Timestamp,Username,Comment,Upvotes
2020-10-13T14:56:01+00:00,bond_bhai,Only 13 off the last three overs. SRH putting on a squeeze of sorts here.,0
2020-10-13T14:56:05+00:00,,Pretty boring match so far aside from the powerplay.,1
2020-10-13T14:56:11+00:00,awesomeredditor777,What is this shit batting,1
2020-10-13T14:56:12+00:00,,"Dread it, run from it, CSK's RR < 7 still arrives.",1
2020-10-13T14:56:13+00:00,,I am disgusted by CSK’s batting,0
2020-10-13T14:56:13+00:00,jasonj2232,"Remember when Watson and Rayudu smashed Rashid and all other SRH players in 2018.

Yeah, I remember, those were the days :_(",5
2020-10-13T14:56:18+00:00,_gadgetFreak,"Someone please dissolve csk, its annoying to watch.",3
2020-10-13T14:56:24+00:00,ADevDX,Wow,1
2020-10-13T14:56:26+00:00,joeispunk,Pandey is fire on the field.,2
2020-10-13T14:56:27+00:00,,Fuck,1
2020-10-13T14:56:32+00:00,oxfordcircus007,!!!,-2
2020-10-13T14:56:32+00:00,ShuddhGheeRoti,Yay!,-2
2020-10-13T14:56:32+00:00,vino8855,120 should be defendable right boys? Boys.....?,15
2020-10-13T14:56:35+00:00,TheFirstLane,Good on Pandey ji. He is not sure.,2
2020-10-13T14:56:40+00:00,,[deleted],3
2020-10-13T14:56:41+00:00,Plastic-Season,CMV: Manish Pandey looks like a dollar store  Vicky Kaushal,-1
2020-10-13T14:56:43+00:00,mexicomasala,Umpire playing for CSK by saying the soft signal for Watto is not out lol,2
2020-10-13T14:56:44+00:00,,Maybe they should have sent Jaddu or Bravo in,2
2020-10-13T14:56:45+00:00,sanjeet94,Pandey ji,3
2020-10-13T14:56:46+00:00,broken_cranium,Good guy Pandey.,9
2020-10-13T14:56:54+00:00,kmadnow,Pandey dont leave us hanging tf,4
2020-10-13T14:56:54+00:00,udayEm,Grounded,4
2020-10-13T14:56:55+00:00,,"Hmm, Rayudu came out with a lot of intent and is still striking less than 100.  Excellent bowling!",4
2020-10-13T14:57:02+00:00,abhinav18,When did Indian fielders become the good guys,4
2020-10-13T14:57:03+00:00,ADevDX,Oho missed,4
2020-10-13T14:57:05+00:00,JAH1205,Johnnys booming “caaaaatch” honestly makes me hard,7
2020-10-13T14:57:07+00:00,Lionheart008,Full points for fair play,5
2020-10-13T14:57:07+00:00,gungly,These Dream 11 fans look like specimens in a virtual Zoo.,8
2020-10-13T14:57:11+00:00,sahit24,I thought these guys were scoring well and they are going at less than run a ball? How?,2
2020-10-13T14:57:13+00:00,sushant300,whether he's out or not out it doesn't matter,0
2020-10-13T14:57:15+00:00,,Fair play points go brrrr,1
2020-10-13T14:57:16+00:00,drsb13,He did it on purpose to keep the partnership going,2
2020-10-13T14:57:17+00:00,,Pandey amazing as always,5
2020-10-13T14:57:18+00:00,DeadlyPantsOfSea,Specialist fielder failing to catch,2
2020-10-13T14:57:22+00:00,Assraj,Ffs someone get going pls,2
2020-10-13T14:57:22+00:00,Idontlikethisstuff,Think pandey knew straight away tbf,2
2020-10-13T14:57:23+00:00,kawanish,"This is a slow wicket. The worst thing you could do is to take 20-25 balls to settle and then get out,  because it is very difficult for a new batsman to get going from ball one.",6
2020-10-13T14:57:25+00:00,,[deleted],-4
2020-10-13T14:57:26+00:00,ganny0007,I understand not going after Rashid but atleast smack nadheem pls.,2
2020-10-13T14:57:36+00:00,,5D thinking from Pandeyji,4
2020-10-13T14:57:38+00:00,blumirage,That's going to send up straight to the top of the all important Fair Play table,3
2020-10-13T14:57:39+00:00,,Pandey really wants the Fair Play points,4
2020-10-13T14:57:39+00:00,mexicomasala,Watson don't save all your runs for the IPL final lol,3
2020-10-13T14:57:40+00:00,SuddenlyFeels,21D reverse ludo by Pandeyji to drop Watto,5
2020-10-13T14:57:42+00:00,,3 lifelines to CSK till now,4
2020-10-13T14:57:44+00:00,belanish11,I'm sure the soft signal is based on the fielder's reaction after catching,5
2020-10-13T14:57:44+00:00,singhsrb,It is no surprise CSK has given up on the tournament already. It was the logical next step after giving up matches.,2
2020-10-13T14:57:45+00:00,jasonj2232,"Should've sent Jadeja or Bravo, at least they hit boundaries. Why can't we have one accumulator - one power hitter partnerships.

Also, Jadeja and Bravo never get the chance to bat and make a difference because our stupid openers consume all the balls.",4
2020-10-13T14:57:47+00:00,Blackbeard567,Every team I've supported has lost the match when I watch on TV. I'm supporting csk today but I might consider turning off the tv,5
2020-10-13T14:57:47+00:00,chut_has_no_religion,Now that's some intent Daddy,2
2020-10-13T14:57:48+00:00,sanjeet94,Pandey ji gaining fair play points,4
2020-10-13T14:57:51+00:00,joeispunk,Rayudu with INTENT™,4
2020-10-13T14:57:53+00:00,_gadgetFreak,Fucking finally,3
2020-10-13T14:57:53+00:00,DonnieDarko2307,Nice guys finish last. So csk will end 8th position.,2
2020-10-13T14:57:57+00:00,,How much does the bowling team's celebration affect the soft signal?,7
2020-10-13T14:57:57+00:00,lvl35beast,Did they use drs,-1
2020-10-13T14:58:05+00:00,VikramArrowerse,This is Called INTENT,2
2020-10-13T14:58:05+00:00,,Nadeem so unlucky today,3
2020-10-13T14:58:08+00:00,,Pandey earned fairplay points for SRH but fans are not impressed 😔,3
2020-10-13T14:58:12+00:00,afex1808,"Dont worry guys, we have sam curran to hit.
Oh wait",20
2020-10-13T14:58:15+00:00,shashi154263,Get Watson out. He could play all the overs and score 150.,4
2020-10-13T14:58:16+00:00,,Rayudu plays that shot a lot,3
2020-10-13T14:58:21+00:00,kissmyass159753,"Like I said , [here] (https://www.reddit.com/r/Cricket/comments/j8jetr/match_thread_25th_match_chennai_super_kings_v/g8c02ie/?context=3) this isn't the worst position for CSK but they need 
 power hitter to salvage this position and I don't think they have any.",2
2020-10-13T14:58:24+00:00,jinesh007,I have this good knack of picking captains who fail considerably,2
2020-10-13T14:58:24+00:00,anti-shinigami,Rayudu hit a six. 3 dots will follow now,2
2020-10-13T14:58:24+00:00,TheWyzim,"To every one asking why are these players defensive against Rashid, taking risks against him in the last 4-5 overs while chasing difficult target is one thing, out of form players who are struggling against Nadeem trying to imitate Tewatia against Rashid in 10th over is whole another deal",4
2020-10-13T14:58:28+00:00,hurricane_news,Is it just me or does the umpire with a stubble look like Ringo Starr?,0
2020-10-13T14:58:36+00:00,muthucsk07,"CSK's batting can be related with reverse plot of the movie ""SPEED"" 
If you try to go fast you'll blow",2
2020-10-13T14:58:37+00:00,Iamyoursoul123,Now tuk tuk thala should come to bat,2
2020-10-13T14:58:38+00:00,mexicomasala,"See, that's the thing which irritates CSK fans. The batsmen can hit beauts. Just that they aren't doing it",8
2020-10-13T14:58:39+00:00,Motta_pai_1,Csk saving up nrr for next edition of tounrney you plebs.,6
2020-10-13T14:58:39+00:00,nouseridavailable,"If we look at bottom 4 teams:

RR is giving regular chances to Parag and Tyagi

SRH is giving regular chances to Priyam Garg and Abhishek Sharma

KXIP is giving regular chances to Bishnoi and now Arshdeep also

CSK is making Sai Kishore, Jagadeesan and Gaikwad warm benches for old, unfit players. Gaikwad got 2 chances out of order and thats it. He is such a good opener that Gill has to bat down the order sometimes for India A just to accomodate him.",8
2020-10-13T14:58:46+00:00,samlfc92,Playing spin off the front foot. What is this?,1
2020-10-13T14:58:47+00:00,VikramArrowerse,This is intent,5
2020-10-13T14:58:48+00:00,chut_has_no_religion,Daddy Watto with his BIG DICK. What a SIX,2
2020-10-13T14:58:48+00:00,mexicomasala,Hell yeah. Back to back.,2
2020-10-13T14:58:49+00:00,,Woow,3
2020-10-13T14:58:50+00:00,awesomeredditor777,26 runs in last 5 overs with no wickets lost. Disgraceful,3
2020-10-13T14:58:51+00:00,,[removed],1
2020-10-13T14:58:52+00:00,hurricane_news,"Wait, was that why the guy who caught the ball didn't celebrate at all? So as to not look sus?",5
2020-10-13T14:58:52+00:00,,"If he celebrates that properly, the soft signal is out and then it may not have been overturned",1
2020-10-13T14:58:54+00:00,abhinav18,"Shahbaz shouldve thrown it wide, Rayudu used his feet about 5 times against him now.",2
2020-10-13T14:58:55+00:00,Hariii_,Watson playing 20+ balls is no good sign for opposition,6
2020-10-13T14:58:56+00:00,jasonj2232,"Shane 'Big Match Player' Watson

Arre BC if we don't get to the playoffs we won't have any big matches to play. Wtf is this shit.",5
2020-10-13T14:58:57+00:00,joeispunk,Watson to play a blinder today and shut us all up?,6
2020-10-13T14:58:58+00:00,TheFirstLane,Watson show is about to begin !,1
2020-10-13T14:58:59+00:00,rodney0102,Lesssgoooooo,2
2020-10-13T14:59:01+00:00,xpentakill,I wish Watson got out there TT_TT,3
2020-10-13T14:59:02+00:00,,Watching a Dynasty at its end is hard,10
2020-10-13T14:59:02+00:00,udayEm,Bad ball,5
2020-10-13T14:59:07+00:00,awesomeredditor777,Looks like I jinxed it hehe,1
2020-10-13T14:59:14+00:00,kinjago,he forgot and took the catch and then asked for DRS,2
2020-10-13T14:59:16+00:00,,[deleted],5
2020-10-13T14:59:16+00:00,ADevDX,Tewatia Cameo,2
2020-10-13T14:59:17+00:00,wingzero00,"Nadeem did pretty well, had some chances missed. A missed catch from Bairstow and a drop from Manish.",2
2020-10-13T14:59:17+00:00,smokeshishaplayfifa,*Wait why it looks like it happened before. I can see flashbacks*,7
2020-10-13T14:59:24+00:00,Idontlikethisstuff,"Last 2 balls: 12 runs

Last 2.5 overs before that: 14 runs",8
2020-10-13T14:59:30+00:00,momschickencurry,finally some fucking action,2
2020-10-13T14:59:30+00:00,zsazlatan,"Honestly all csk matches are so boring to watch.
Might as well sleep very early than this.",4
2020-10-13T14:59:31+00:00,KaamDeveloper,Watson put his entire width into that one,7
2020-10-13T14:59:41+00:00,,Watson not like rashid. Watson angry. Watson tonk.,24
2020-10-13T14:59:42+00:00,fellowmuppetier,"Nobody:                                                                                     .


Commentators: Intent",6
2020-10-13T14:59:50+00:00,santoryuroronoazoro,They'll get to 300 by the end of the 50 I think,8
2020-10-13T14:59:53+00:00,mbnvbcvxczljkhjghfgd,this would be such a good partnership if these guys could run between the wickets faster than at a snails pace,6
2020-10-13T14:59:55+00:00,hurricane_news,Genuine Q. What causes Watson to instantly start hitting harder after 30 or so balls?,8
2020-10-13T14:59:59+00:00,vdix007,"Why does Bangar never get any off days? Why does he start screaming whenever he has to call the action? Why does he try so hard?

So many questions.",6
2020-10-13T15:00:13+00:00,Karna1394,"Fleming strategy - If all CSK batsmen play like Thala, no one can blame Thala.",18
2020-10-13T15:00:15+00:00,siva113,Watson on one knee 😍...The ball disappears,2
2020-10-13T15:00:20+00:00,blumirage,*Watson PTSD intensifies*,3
2020-10-13T15:00:26+00:00,,Both striking better than kholi 🤗,-6
2020-10-13T15:00:29+00:00,anaksr1414,Yeah do it. Just like always bring all out of form guys and teams back in form.,4
2020-10-13T15:00:29+00:00,,"48 balls, 70-80 runs will take it to 160 approx. And I think that's defendable if you break the opening partnership early.",4
2020-10-13T15:00:32+00:00,Idontlikethisstuff,"If Pandey celebrated, I'm not sure that would've been overturned bc the soft signal would've been out",2
2020-10-13T15:00:34+00:00,Plastic-Season,Snooze fest so far (─.─||）,3
2020-10-13T15:00:37+00:00,thedeatheater1410,We haven't had a proper low scoring thriller this season. This can be one,2
2020-10-13T15:00:37+00:00,joeispunk,Does Watson not run doubles at all? Is it an injury thing or what?,1
2020-10-13T15:00:40+00:00,mexicomasala,Jadeja better do a Tewatia,2
2020-10-13T15:00:50+00:00,gr8astardd,"People getting angry at Watson for playing like this, but this is how Manish Pandey plays every game",22
2020-10-13T15:00:57+00:00,,[deleted],9
2020-10-13T15:01:13+00:00,wingzero00,We're fucked today. 2 overs left off Khaleel near the death.,8
2020-10-13T15:01:25+00:00,_gadgetFreak,First ball six and then just 2 runs.,3
2020-10-13T15:01:27+00:00,DonnieDarko2307,Finally suryakumar yadav getting some light. Has been a wall for MI in the previous 2 seasons.,7
2020-10-13T15:01:30+00:00,,[deleted],4
2020-10-13T15:01:33+00:00,TyroshiSellsword,SRH should win this without losing any wickets.,1
2020-10-13T15:01:33+00:00,Prathameshgtav,6 of the first ball 2 runs of the next 5 INTENT ™️,7
2020-10-13T15:01:38+00:00,singhsrb,Reminder that it is pretty impossible to lose batting first if you play decently unless you are DC against MI.,8
2020-10-13T15:01:40+00:00,somename_ind,this soft signal thing is stupid. Just let the third ump decide. Same with umpires call in lbw,5
2020-10-13T15:01:42+00:00,Lazy_Left_Eye,What a weird innings this is. It feels like CSK are going too fast and then I see the RR @ 7 RPO.,3
2020-10-13T15:01:46+00:00,cskindian,In b4 Thala's 19(21),5
2020-10-13T15:01:47+00:00,mch43,CSK are playing very well. They can easily get 180 from this stage.,2
2020-10-13T15:01:51+00:00,HillsHaveEyesToo,Watson will play the biggest innings of his career. How's that for a jinx?,2
2020-10-13T15:01:55+00:00,,"CSK really pushed the ""experience beats youth"" thing this year. These oldies cannot take the heat in UAE.",4
2020-10-13T15:01:55+00:00,mbnvbcvxczljkhjghfgd,this game is two fanbases who have no faith in their team saying they’re fucked even tho there’s a clear winner here,6
2020-10-13T15:01:56+00:00,ankit1455,Banger is horrible. Hot the fuck he managed to get into dugout. Even Mukund and Badri are better than him.,4
2020-10-13T15:02:02+00:00,,BoAts ad is pretty cool .,2
2020-10-13T15:02:09+00:00,,Will delete my account if CSK get over 170,3
2020-10-13T15:02:09+00:00,djjd1996,Whats your thoughts on the Curran experiment?,3
2020-10-13T15:02:10+00:00,,SRH and CSK playing their 2nd match at the same venue. Should've changed it for variety.,1
2020-10-13T15:02:10+00:00,j_fedr,Man one bad season and y'all are shitting on CSK like they're India Z or something smh,4
2020-10-13T15:02:12+00:00,anaksr1414,If they score 200 then I guess dropping Abhishek might cost us.,-1
2020-10-13T15:02:14+00:00,Plastic-Season,Sad seeing Tahir be the Glove Boy :(,15
2020-10-13T15:02:22+00:00,mattytmet,"CSK mate, just cause you've hit one boundary doesn't mean you can then take singles and dots for the next 3 overs",9
2020-10-13T15:02:30+00:00,anirudh1595,"Rahul and Pandya's BOAT ads look dope.
Dhawan's is okay. 

Iyer's is outright comical. Not sure if he's suited for television tbh lol",2
2020-10-13T15:02:31+00:00,Lionheart008,Scared Sandeep still has an over left. Please bowl him out ffs,3
2020-10-13T15:02:31+00:00,,"feel srh is going to lose again to csk, that one victory was bittersweet af, got the w but lost bhuvi",3
2020-10-13T15:02:32+00:00,thebrokeassbiker,Why do they assume the jobs's done after hitting a 6. Rotate the strike ffs.,3
2020-10-13T15:02:37+00:00,joeispunk,Purple cap holder doing what junior players do. Wtf CSK?,8
2020-10-13T15:02:40+00:00,,Sad to see last year's purple cap holder carrying the drinks,2
2020-10-13T15:02:40+00:00,GiraffeDependant,"Come on, send in Lord Kalol you cowards",2
2020-10-13T15:02:41+00:00,thelastattemptsname,Six of the first ball and just 2 in the next 5.,5
2020-10-13T15:02:47+00:00,kmadnow,CSK has Tahir? Why isn't he playing?,1
2020-10-13T15:02:48+00:00,Ayushmann_Corona,Thala please come and add your contribution in this snoozefest,5
2020-10-13T15:02:50+00:00,Siondroms,Tahir is the waterboy :(,5
2020-10-13T15:02:50+00:00,hurricane_news,"This might sound silly, but why don't other csk players exercise as much as Watson and become buff? Lot of people are thin  and if many have 6 packs, they could become stronk",3
2020-10-13T15:02:54+00:00,TyroshiSellsword,Tahir running across the ground without taking any wickets.,4
2020-10-13T15:02:55+00:00,DonnieDarko2307,At least we get to see tahir run. As an MI fan i am happy with that.,4
2020-10-13T15:02:55+00:00,,"Tahir, no, stay on the field :(",5
2020-10-13T15:02:56+00:00,,"F for Tahir, last year purple cap relegated to drinks :(",37
2020-10-13T15:02:57+00:00,,Aww that's so sweet of Tahir to run in with the gloves 🤗 Man with a heart of gold!,9
2020-10-13T15:03:01+00:00,momschickencurry,feel bad to see tahir in a bib,7
2020-10-13T15:03:03+00:00,A_Life_form,Is it wierd that I low-key feel bad for MS Dhoni?,11
2020-10-13T15:03:07+00:00,flabbyboggart,12th man Imran Tahir's running vs His post-wicket celebration running,11
2020-10-13T15:03:23+00:00,Plastic-Season,"Sanjay: ""Rayadu wanted to go arial"" ಠ_ಠ",1
2020-10-13T15:03:34+00:00,slimnahady,Wish Tahir gets some games,3
2020-10-13T15:03:36+00:00,Haunted4life,"7 overs remain

Rashid, Sandeep : 1 over each


Khaleel : 2 overs 


Nattu : 3 over",3
2020-10-13T15:03:52+00:00,MonkeyDsarva,watto is a chonky boy.,3
2020-10-13T15:03:52+00:00,vdix007,"Peak Rayudu dancing down the track, having an ugly swipe at the ball with zero control and top edging it",4
2020-10-13T15:03:56+00:00,,"Is Rayudu,Siraj the only  Andhra/Telangana players in IPL?",5
2020-10-13T15:03:56+00:00,Freakysafal,"54 of 11 in boundaries

38 of 67 in remaining balls

Good test match batting

It is criminal even in odi nowadays",8
2020-10-13T15:04:00+00:00,hurricane_news,Lol why did they make tahir run all the way to give tissues? Dude is like 41 right?,4
2020-10-13T15:04:02+00:00,lifeofpaiii,It's sad seeing Imran Tahir not playing after his season last year,8
2020-10-13T15:04:07+00:00,broken_cranium,SRH needs lady luck now more than ever.,2
2020-10-13T15:04:24+00:00,mexicomasala,The Altroz and Fair Play Table are in a competition for the least fks given,10
2020-10-13T15:04:27+00:00,joeispunk,Yeah take on the guy who can bowl Yorkers at will. High iq move this,7
2020-10-13T15:04:34+00:00,kissmyass159753,Man I hope Tahir is making  $$$ cause this is just sad.,15
2020-10-13T15:04:36+00:00,,The way srh have cut off Rayudu's scoring options reminds me of peak Australian field settings vs Sachin and co.,7
2020-10-13T15:04:36+00:00,TheFirstLane,What tha heck RR did to deserve that position on Fair play ?,1
2020-10-13T15:04:41+00:00,siva113,Csk used to 45-50 / 2 at the end of 10 overs on good pitches...they are showing intent..may not be enough..,1
2020-10-13T15:04:45+00:00,ganny0007,Only Played 13 overs also played 35 dot balls. Just CSK things.,7
2020-10-13T15:04:46+00:00,thelastattemptsname,35 dot balls so far. Dont see much difference today even though there seems to be more intent,2
2020-10-13T15:04:47+00:00,udayEm,Point blank Nattu,2
2020-10-13T15:05:00+00:00,madglover,Feels hard for csk to justify curran and bravo ahead of tahir on this track,6
2020-10-13T15:05:15+00:00,nextdoorrando,I hope csk gives one of santner or tahir to MI,-1
2020-10-13T15:05:18+00:00,VikramArrowerse,Now this is intent,1
2020-10-13T15:05:19+00:00,buddhatalks,Which day of the test are we at bois?,-2
2020-10-13T15:05:20+00:00,,"Anything over 130, SRH can't chase",2
2020-10-13T15:05:20+00:00,Was_Unavailable,Nattu where are your leg breaking yorkers man!!,1
2020-10-13T15:05:21+00:00,,"Calling it, 184.",1
2020-10-13T15:05:21+00:00,Plastic-Season,"rayadu going so deep inside, I love it",9
2020-10-13T15:05:25+00:00,sahasamane_cheppali,Scenes if they're planning to bowl Khaleel during death,4
2020-10-13T15:05:36+00:00,SuddenlyFeels,At this point being beaten by us is like having a 100 year old man break both your legs by throwing his dentures at your knees and then him sloowly walking over to you and bludgeoning to death with his walking stick.,13
2020-10-13T15:05:38+00:00,Lazy_Left_Eye,I feel CSK has done OK till now. But do they have the fire-power to score 65-70 off the last 7?,6
2020-10-13T15:05:38+00:00,MonkeyDsarva,csk shoulda played Tahir instead of bravo.,6
2020-10-13T15:05:38+00:00,,Srh getting other teams back into form. So selfless.,7
2020-10-13T15:05:41+00:00,jasonj2232,Rayudu making up for not playing the CWC 2019 by playing a solid ODI innings.,5
2020-10-13T15:05:43+00:00,Noligation,YORKERS!!!,0
2020-10-13T15:05:48+00:00,,"nice rayudu garu smacking srh, hurts the eyes. lovely player tho",2
2020-10-13T15:05:50+00:00,lonelyisIand,did he just say fuck off lol,7
2020-10-13T15:05:53+00:00,Jy_sunny,"No one cares about your fucking FairPlay awards, commentators. Teams care about winning. If he’s not sure if it carried or not, he’s not cheating, just check it with third umpire",7
2020-10-13T15:05:53+00:00,,Hahaha what was that scream of intent?,7
2020-10-13T15:05:57+00:00,ken_219,Duh why look for yorkers so early? Natrajan is good but he should work on variations.,2
2020-10-13T15:06:03+00:00,ADevDX,When watson will trigger.....,1
2020-10-13T15:06:12+00:00,mch43,What's the pace of Natarjan?,4
2020-10-13T15:06:14+00:00,jasonj2232,Watson Australia Test Match team when?,4
2020-10-13T15:06:16+00:00,deep639,There is a distinct quality gap between the teams. Mumbai have the best team and you can see it from the batting vs other teams' batting. Delhi's bowling is great but their batting is still prone to mistakes. And RCB are still reliant on kohli and abd getting runs. Mumbai are favourites followed by delhi and rcb. I don't think anyone outside these three teams is winning the competition this year.,9
2020-10-13T15:06:21+00:00,siva113,Fakir play award  is the biggest bullshit award....no one knows exactly what is taken into account...decimal points are involved...no one gives a fuck execpt the sponsors,14
2020-10-13T15:06:25+00:00,TyroshiSellsword,a loud FUCK OFF from  Ambati,13
2020-10-13T15:06:30+00:00,funnyBatman,You can't say fuck off and expect the ball to just fuck off to the boundary Rayudu.,12
2020-10-13T15:06:33+00:00,,Watto not running 2s :(,2
2020-10-13T15:06:35+00:00,Hariii_,time to go for a pee,2
2020-10-13T15:06:48+00:00,irrelevantadvisor,....too late for 180?,0
2020-10-13T15:06:56+00:00,,wow 12 run over,0
2020-10-13T15:07:02+00:00,mch43,10 runs but not bad they tried to hit every ball.,3
2020-10-13T15:07:07+00:00,kawanish,Should target 170+ from here.,4
2020-10-13T15:07:11+00:00,,Calling it now CSK will not make the playoffs,5
2020-10-13T15:07:16+00:00,Freakysafal,"Csk playing the whole over without any dot

When did that happen last time?",3
2020-10-13T15:07:17+00:00,,Adichu thoilangata boomers,5
2020-10-13T15:07:18+00:00,sahit24,They should easily get around 170 from here.,3
2020-10-13T15:07:21+00:00,WeaponX23X,Score prediction? Mine is 166,4
2020-10-13T15:07:22+00:00,LividProgrammer,What's the use of boundaries if there are gonna be a couple of dot balls following that,8
2020-10-13T15:07:25+00:00,klopparabia,Absolute shite level commentary that by Sunny G lite,9
2020-10-13T15:07:36+00:00,kissmyass159753,That's points taken off the fair play award there Rayudu,4
2020-10-13T15:07:42+00:00,Savings-Rice,I can understand their strategy. If one of them gets out it probably brings dhoni in and he will further slow down the innings,6
2020-10-13T15:07:46+00:00,Ayushmann_Corona,Ceat Tyres time.,2
2020-10-13T15:07:46+00:00,vvb_12,Out of context but which team have lowest rr in overs (7-15) ?,2
2020-10-13T15:07:48+00:00,Blackbeard567,I frankly don't see anything above 150 guys I don't see how some people are predicting 180,2
2020-10-13T15:07:49+00:00,,Mo Siraj for Test team,2
2020-10-13T15:07:51+00:00,klopparabia,Sometimes commentators should just shut the fuck up,3
2020-10-13T15:07:53+00:00,,:O,1
2020-10-13T15:07:55+00:00,uravggstudent,How long was that Watto six?,2
2020-10-13T15:07:58+00:00,hornyunicorn757,MI and CSK should trade Lynn for Tahir/Santner,6
2020-10-13T15:07:58+00:00,,What's the point of umpire then. It's umpire job to decide it's out or not.,1
2020-10-13T15:08:08+00:00,Immediate_Situation,12 an over will take CSK to 176 which is the minimum they should target,2
2020-10-13T15:08:14+00:00,Was_Unavailable,180 incoming for CSK!,0
2020-10-13T15:08:15+00:00,vicky669,"Csk scores 180 I guess ,if they keep going on this way.",2
2020-10-13T15:08:15+00:00,phantom_97,I can't be the only one who thinks Natarajan's neckbeard looks absolutely horrendous,8
2020-10-13T15:08:16+00:00,kissmyass159753,Rayudu has been a Rayudud  to be honest but I hope he can redeem himself.,2
2020-10-13T15:08:28+00:00,st6374,"Instead of saluting Manish Pandey for doing the right thing. They're actually implying that he was trying to be dishonest there, and should've done more. Sometimes the commentators can fuck right off with their bs.",7
2020-10-13T15:08:31+00:00,,What is it with Watson and SRH? We can't take his wicket for fuck's sake,6
2020-10-13T15:08:31+00:00,ictfan10,"CSK demotes Watson, promote Curran indicating that they need fiery openers..

Watson scores 34(34) at No.3

*Watson, ""dread from it, run from it, intent still the same""*",11
2020-10-13T15:08:36+00:00,kpranar,Not too bad till here. 160+ should be defendable. Lessgo.,2
2020-10-13T15:08:38+00:00,anaksr1414,Khaleel will come back and take one or two wickets securing his place. Dhokebaaz.,4
2020-10-13T15:08:43+00:00,klopparabia,I am getting the feeling MSD would blast a few today.,6
2020-10-13T15:08:46+00:00,udayEm,Wait! Isn't Jagadeesan in the team?,2
2020-10-13T15:08:59+00:00,pritambarhate,These guys need to try for 2 sixes every over now. there are 6 overs to go and 8 wickets remaining! CSK have decent batters till number 9!,3
2020-10-13T15:09:09+00:00,dannyarr,Khaleak has 2 more overs,2
2020-10-13T15:09:10+00:00,red_plus_itt,"Me : minding my own job and jacking off to por

Rishabh Pant: ye main Kar leta, tum dream11 bano",8
2020-10-13T15:09:22+00:00,Bazzingatime,Watto go bezerk or go home,2
2020-10-13T15:09:28+00:00,,[deleted],-6
2020-10-13T15:09:29+00:00,A_Life_form,Is it likely that if CSK found their 'momentum' they can go blazing wins all over their opponents from now on?,2
