Timestamp,Username,Comment,Upvotes
2020-10-13T17:11:06+00:00,,**3D** time,5
2020-10-13T17:11:06+00:00,anaksr1414,Incoming 3D,4
2020-10-13T17:11:07+00:00,breakinb,Garg killed off the match,4
2020-10-13T17:11:07+00:00,rohitk4019,"The way CSK'S season has been , I expected Jaddu to parry that over and make it a six!",4
2020-10-13T17:11:09+00:00,mrfreeze2000,Garg was struggling,1
2020-10-13T17:11:12+00:00,rahulrossi,Now what? Shankar Anna?,8
2020-10-13T17:11:12+00:00,vvb_12,Don't worry guys lord Shankar is yet to come!,3
2020-10-13T17:11:13+00:00,,It's good that mark nicholas has a soothing voice cause some of the shit he says is disappointing,5
2020-10-13T17:11:18+00:00,DeadlyPantsOfSea,Garg wasted 3 overs,1
2020-10-13T17:11:19+00:00,sahit24,Good shot but too flat,2
2020-10-13T17:11:20+00:00,breakinb,Samad >>>> Garg,1
2020-10-13T17:11:22+00:00,Jy_sunny,Root Kohli Williamson Smith all have same body type and similar height,5
2020-10-13T17:11:22+00:00,lonelyisIand,watching this as a neutral I’m just interested in knowing how many times the dugout guys get their predictions right,2
2020-10-13T17:11:22+00:00,G_h_c, Gaikwad fielding for rayudu?,1
2020-10-13T17:11:24+00:00,,What's point of playing like that. Waste balls and gets out .  It was better if he would have try to hit six every ball.,1
2020-10-13T17:11:24+00:00,User9333,SRH need a Fabian Allen who is the next Russell/Pollard in the making.,3
2020-10-13T17:11:24+00:00,aryanx1234,"That shot was looking real good, untill I realised this isn't sharjah",5
2020-10-13T17:11:26+00:00,redditisfun1209,Dugout predicted Garg's wicket.,3
2020-10-13T17:11:26+00:00,RLKay,Straight to the man. And we're one batsman short. Time for 3D to do some magic.,6
2020-10-13T17:11:27+00:00,kmadnow,"Kanos after Garg holes out in the deep ""Chalo chalo chalo""",6
2020-10-13T17:11:27+00:00,blumirage,"Right, I have officially given up all hope. I'm off to play Mafia instead",8
2020-10-13T17:11:30+00:00,drunkamoeba,that was a weird shot. play straight,2
2020-10-13T17:11:32+00:00,Indy_101,Congrats garg u just wasted balls,3
2020-10-13T17:11:34+00:00,kpranar,BITS AND PIECES^(TM),7
2020-10-13T17:11:35+00:00,,"Even getting out he looks good, but he has to bat top 4, 5 too low with pandey and kano ahead of him 
He opens or bats 3 for his stateside I think",3
2020-10-13T17:11:36+00:00,Zer0wned1,Has Chawla done anything?,2
2020-10-13T17:11:37+00:00,Shubh_K30,Lo n Behold 3D Player is here!,7
2020-10-13T17:11:37+00:00,smokeshishaplayfifa,Bc played 3 overs and scored 16. While our khaleel will give it in 2 over. What a noob,2
2020-10-13T17:11:38+00:00,masterblaster422,we have to rely on 3D lord shankar to help Kane now...,2
2020-10-13T17:11:41+00:00,Haunted4life,"Csk Fans : damn play Tahir also we are going to lose. 


Srh fans : we need middle order players, also we are going to lose. 


Everyone else : Kane Kane Kane uwu uwu uwu",11
2020-10-13T17:11:42+00:00,asap_ramz,Impossible to chase this season,6
2020-10-13T17:11:42+00:00,philosifyme,Things are getting sticky,7
2020-10-13T17:11:45+00:00,athadb,That was middled should not have been a wicket.,5
2020-10-13T17:11:45+00:00,DeadlyPantsOfSea,3D Shankar in,11
2020-10-13T17:11:47+00:00,Bazzingatime,"Dugout has got  the script , I'm telling you",13
2020-10-13T17:11:48+00:00,XxBlackDuckPlierxX,"**3D**

**3D**

**3D**",11
2020-10-13T17:11:51+00:00,vouwrfract,That was an excellent section of commentary. I liked it.,4
2020-10-13T17:11:57+00:00,BurntOutIdiot,"God, that vi squeaking sound is so irritating",6
2020-10-13T17:11:57+00:00,,Jadeja made it look like eating a cake....it wasnt lol,6
2020-10-13T17:11:59+00:00,gr8astardd,very Pandey like innings from Garg,8
2020-10-13T17:12:02+00:00,Defo_not_a_bot,3D,4
2020-10-13T17:12:03+00:00,rmU6Rz0ztS,Jaddu man of the match. Didn't even have his customary drop on boundary today.,5
2020-10-13T17:12:04+00:00,,It gets extremely difficult to bat in the second innings in all the grounds with the ball gripping and stopping. I think the only team which did decently well in the second innings was MI. Toss is so crucial man.,5
2020-10-13T17:12:04+00:00,rohitk4019,So no one wants Santner in the XI instead of Tahir/Hazlewood?,3
2020-10-13T17:12:11+00:00,kpranar,Just Kane now. Plizz.,2
2020-10-13T17:12:12+00:00,viratkohli18,"Garg should get his photo updated lol, his current pic looks like he should be learning coding at Whitehat Jr.",22
2020-10-13T17:12:22+00:00,cmvora,Shankar walks out - Ambati Rayudu triggered,9
2020-10-13T17:12:32+00:00,OnlysliMs,Shankar dada MBBS .. .. .. ..,6
2020-10-13T17:12:32+00:00,ohhereim,Only LORD could save SRH from here,5
2020-10-13T17:12:33+00:00,harsh1387,3D time..,3
2020-10-13T17:12:38+00:00,,Damn commentators are taking a piss off Shankar,5
2020-10-13T17:12:39+00:00,gungly,Thala dropped Jagadeesan because he made Rayudu run too much.,10
2020-10-13T17:12:42+00:00,PyRed,3D time!,8
2020-10-13T17:12:43+00:00,cantfindusernameomg,"Only thing stopping us now is a Kanos masterclass, and I won't complain if that happens just like Kohli last time.

3D is here though, should be spicy.",4
2020-10-13T17:12:47+00:00,Harshith12344,Time for 3D boi?,2
2020-10-13T17:12:48+00:00,DonnieDarko2307,So happy for karn. You can see he is trying to give his 100 percent. Piyush gets preferred in the previous matches who also is a terrible fielder.,4
2020-10-13T17:12:53+00:00,,"Should be easy for India and NZ’s no. 4 batsmen, shouldn’t it?",9
2020-10-13T17:12:54+00:00,kpranar,"Fuck, I forgot Shankar exists.",5
2020-10-13T17:13:00+00:00,,"Vijay had played a breezy knock vs SRH once. Boundaries, 4s, 6s. He is capable.",4
2020-10-13T17:13:02+00:00,RLKay,Don't blame Garg here. I this he played well given are playing with 1 batsman less. Blame the braindead management for going with 1 batsman less with batting being our weakness.,4
2020-10-13T17:13:05+00:00,Strike_Reaper,Williamson would screw us if he doesn't get out,1
2020-10-13T17:13:09+00:00,PM_ME_YOUR_CALL_LOGS,Why does kaddu reverse cup everything?,1
2020-10-13T17:13:11+00:00,amerind386,"two nice guys batting.. from csk perspective, hope they dont finish last",2
2020-10-13T17:13:11+00:00,ab370a1d,"Inb4 Rayudu comes snatching the ball from whoever would bowl next over if 3D is on strike, bowl 5 wide Yorkers for which he has no answers and then another yorker to the stump and shows a middle finger to him. A man can only dream",7
2020-10-13T17:13:12+00:00,XxBlackDuckPlierxX,Rayadu will have +5 fielding power now boys,7
2020-10-13T17:13:14+00:00,CricketMatchBot,"**14.4** Sharma to Garg, OUT, **picks out deep midwicket!** A clean lofted sweep from Garg, hit powerfully enough that he might have got a four a couple of metres to Jadeja's right. But he's got this from off stump and straight into the hands **99-4**

PK Garg c Jadeja b Sharma 16 (18b 1x4 0x6) SR: 88.88",0
2020-10-13T17:13:15+00:00,Naan6,I honestly never seen 3D perform,4
2020-10-13T17:13:19+00:00,Teentitansgo123,Out goes Garg!!! Now Williamson needs to get out soon too.,0
2020-10-13T17:13:20+00:00,AnantShrestthPajaMaN,"3D in, bowl Rayudu coward Thala",6
2020-10-13T17:13:22+00:00,Indy_101,67 in 5 is pretty doable but wish srh had some pinch hitters,3
2020-10-13T17:13:25+00:00,SexxyBlack,3D player in the crease,5
2020-10-13T17:13:27+00:00,Haunted4life,"Since Shankar didn't get to bowl to Rayudu, can we get Rayudu to bowl to Shankar :p",7
2020-10-13T17:13:35+00:00,smokeshishaplayfifa,"Good call shankar,there is no two.",7
2020-10-13T17:13:36+00:00,anirudh1595,"Shankar has spoken in so many interviews about how CSK is the one team he wants to excel against. 

This is your chance, lad.",7
2020-10-13T17:13:41+00:00,,Shiiit that was some good fielding by qran,0
2020-10-13T17:13:41+00:00,,Can this be the one game that Vijay Shankar shows up for us?,6
2020-10-13T17:13:53+00:00,UltraUnited,67 from 30 is gettable. Need 3D fireworks though,4
2020-10-13T17:13:57+00:00,,"Moment Kane decide to accelerate  , someone gets out.",3
2020-10-13T17:13:59+00:00,ohhokayyy,Small sample size but Priyam Garg doesn't look like a good player in pressure situations tbh. Got out for single digit scores in the 2 KO matches in U-19 WC too.,1
2020-10-13T17:14:05+00:00,ganny0007,Karn a better Piyush?,1
2020-10-13T17:14:10+00:00,vvb_12,They should have promoted Rashid he can score runs real quick and could have released pressure from Kane,2
2020-10-13T17:14:12+00:00,HrishikeshSonar,SRH are horrible chasers.,2
2020-10-13T17:14:12+00:00,,Karn Sharma the car salesman who sold a fully loaded gold altroz to a broke Swanny and laughed all the way to the bank.,4
2020-10-13T17:14:13+00:00,ken_219,Let Rayudu bowl Shankar for the memes plzzz,3
2020-10-13T17:14:19+00:00,aryanx1234,"We didn't get Buttler bowling to ashwin


Give us Rayudu bowling to 3d atleast :(",5
2020-10-13T17:14:25+00:00,DilliKaLadka,This upgrad donkey ad will make sense if people lick the right body part,8
2020-10-13T17:14:28+00:00,,NGL Rohit’s acting is so good in the Dream11 ad. “Opener hoon na 😏😏😏”,12
2020-10-13T17:14:45+00:00,gungly,Has 3D Shankar played an innings of substance ever since he got branded with the 3D tag? He's been as successful as 3D TVs were.,5
2020-10-13T17:14:50+00:00,sameer_the_great,For SRH this kind of Target now seems impossible to chase. They lack pinch hitters.,3
2020-10-13T17:14:53+00:00,,"Did you mean Karn or Curran

Commentator: ""Yes""",6
2020-10-13T17:14:56+00:00,vicky669,We need one big over,3
2020-10-13T17:14:56+00:00,angryWitness,"generic 3D comment

gib upvote",11
2020-10-13T17:15:06+00:00,thedeatheater1410,Specialist death bowler,3
2020-10-13T17:15:06+00:00,bond_bhai,"KKR/RCB guys - who are you rooting for? 

CSK - bocs SRH will get closer to top 4 

SRH bcos this game should not be ""resurgance"" of CSK?

SRH - bocs, F CSK.",1
2020-10-13T17:15:11+00:00,siva113,67 from 30 .....25 twos + 3 sixes,6
2020-10-13T17:15:11+00:00,Dikshit101092,If pitches start to turn and grip csk will be a force in second half. Dhoni will play as many spinner as he can and squeeze the opposition .,5
2020-10-13T17:15:12+00:00,,Nooo why Piyush,2
2020-10-13T17:15:18+00:00,throwaway_ind_div,At least 3 sixes needed from V J Shankar,4
2020-10-13T17:15:21+00:00,,66 off 5 should give you hope. Don't look at wickets in hand.,6
2020-10-13T17:15:25+00:00,CapitalStructure,There was a time when the commentators would  read out the top tweets during the match wonder why they stopped that,8
2020-10-13T17:15:27+00:00,abhispot,Wait it's 15 overs and Piyush Chawla hasn't bowled one yet? Why is he playing? Wonder if he'll get an over in the last 5.,4
2020-10-13T17:15:33+00:00,neelhere,Jay Shah picking his nose in Live TV! wtf,5
2020-10-13T17:15:37+00:00,ramraj1996,"Chawla the death bowler

Edit: specialist death bowler",5
2020-10-13T17:15:41+00:00,Key-th,Why does Piyush Chawla look like a fat Rowan Atkinson,7
2020-10-13T17:15:43+00:00,Fad_du_pussy,SRH's top order bats like it believes a lot in their lower order,7
2020-10-13T17:15:46+00:00,neondit,The match depends on this over,1
2020-10-13T17:15:46+00:00,,[deleted],2
2020-10-13T17:15:52+00:00,3ngin3,Meanwhil jay seatching his nose for some snoot,1
2020-10-13T17:15:52+00:00,,"Rashid can tonk a few.... 
It's the hope that kills you .",7
2020-10-13T17:15:59+00:00,,Smack this dude ffs,3
2020-10-13T17:16:04+00:00,Giant_Slay3r,Why the fuck is my11 brand ambassador is being shown in dream11 ipl.,6
2020-10-13T17:16:05+00:00,chut_has_no_religion,CSK on other side of the chase.,3
2020-10-13T17:16:11+00:00,mrfreeze2000,Brah how are we okay with the blatant nepotism of Jay Shah,5
2020-10-13T17:16:11+00:00,Bluebillion,Dhoni would have been roasted for an innings like this. Reddit will suck Kane off for the same thing,3
2020-10-13T17:16:14+00:00,shawman123,Chennai have too many bowlers and not enough batsmen. Sadly the young indian talent is missing and they dont have any one to play.,4
2020-10-13T17:16:15+00:00,,"I might jinx this, but never in my life have I watched a good Vijay shankar innings",7
2020-10-13T17:16:22+00:00,gungly,Dada always puts his mask on just as the camera pans to him,3
2020-10-13T17:16:23+00:00,kabirthegreat,beautiful bowling from Karn,1
2020-10-13T17:16:26+00:00,killmeimnotkidding,Kedar Jadhav >>>>>>> Vijay Shankar,1
2020-10-13T17:16:27+00:00,awesomeredditor777,Chawla and Karn Sharma are CSKs death bowlers along with Lord Thakur wtf,8
2020-10-13T17:16:28+00:00,PortableButton,"Fine, I'll do it myself - Kanos 2020",2
2020-10-13T17:16:29+00:00,rohitk4019,"Piyush : what is my purpose?

Thala : You miss the ball inside the ring and hope the batsman tries to make a mistake of your misfield!",8
2020-10-13T17:16:30+00:00,uravggstudent,Chawla is the imposter pretending to do tasks.,2
2020-10-13T17:16:31+00:00,,Concession bear time - always rated Shankar and felt bad when he was dropped from India side 😔,2
2020-10-13T17:16:35+00:00,shiwanshu_,Chawla looking jolly af,1
2020-10-13T17:16:38+00:00,Shubh_K30,CSK shouldn't dismiss 3D. Let lord Shardul and DJ bowl him wide yorkers and the nightmare of Nidhas begins!,3
2020-10-13T17:16:39+00:00,cantfindusernameomg,"Thakur has 3, Bravo has 3, Curran has 1, Karn has 1, Chawla has 3

Who tf are we going to bowl for last 4?",7
2020-10-13T17:16:40+00:00,,[Already predicated this shit](https://www.reddit.com/r/Cricket/comments/jac33w/match_thread_29th_match_sunrisers_hyderabad_v/g8ph4lr?utm_medium=android_app&utm_source=share&context=3),9
2020-10-13T17:16:44+00:00,anaksr1414,Boundaries man Boundaries,10
2020-10-13T17:16:47+00:00,Haunted4life,"After 14 

Csk 116/2

Srh 101/4",7
2020-10-13T17:16:56+00:00,killmeimnotkidding,Samad would've been 100 times better than vijay Shankar,1
2020-10-13T17:16:56+00:00,inspiredredditer,This innings will make or break Shankar's T20 career.,7
2020-10-13T17:16:59+00:00,thedeatheater1410,I used the tuk tuk to annoy the tuk tuk,19
2020-10-13T17:17:04+00:00,coolestbeans2000,lol dada putting his mask on everytime the camera pans to him,10
2020-10-13T17:17:05+00:00,tibbity,Not gonna lie I'd love to see Chawla being slapped all over but we just can't do it.,17
2020-10-13T17:17:09+00:00,Bluebillion,Nice to hear MS being so vocal today,11
2020-10-13T17:17:15+00:00,Indy_101,If u cant hit chawla then...,9
2020-10-13T17:17:15+00:00,sameer_the_great,I think Kane is trying to run 2s. Well that's gonna drain your stamina.,9
2020-10-13T17:17:28+00:00,nextdoorrando,I am here for kanos .,9
2020-10-13T17:17:30+00:00,shiwanshu_,Kab khoon khulega re tera kano,7
2020-10-13T17:17:31+00:00,jatinvj-sumba-d-else,"Dhoni using chawla like "" well we included him in team might as well use him""",30
2020-10-13T17:17:36+00:00,exisiova,It's getting too difficult to slog,9
2020-10-13T17:17:39+00:00,,[deleted],10
2020-10-13T17:17:41+00:00,smokeshishaplayfifa,"They were 117- 3 , we thought they played slowly m. We have such a useless middle order. Laxman what exactly did you all these years man?",11
2020-10-13T17:17:42+00:00,TyroshiSellsword,Khaleel Ahmad Chutiya.,5
2020-10-13T17:17:43+00:00,,Come on kaneee,8
2020-10-13T17:17:58+00:00,,Rashid Khan played a blinder cameo vs kkr in eliminator 2018.,12
2020-10-13T17:18:01+00:00,ohhereim,SRH taking it deeper than CSK,17
2020-10-13T17:18:02+00:00,Rubberducky1239,Chawla doing shashtang pranaam to kanos,10
2020-10-13T17:18:03+00:00,killmeimnotkidding,Fuck Vijay Shankar,9
2020-10-13T17:18:10+00:00,Stowski,"Nah, someone definitely needs to go lol",8
2020-10-13T17:18:13+00:00,WeaponX23X,"Can't leave too much for last 3, need to attack this over",6
2020-10-13T17:18:13+00:00,rahulrossi,Lol he is not even trying to hit.,10
2020-10-13T17:18:14+00:00,Fad_du_pussy,"SRH has YJB, Warner and Kanos. Why doesn't Shankar just learn something from them /s",11
2020-10-13T17:18:21+00:00,kmadnow,Yeah...it's too late. We really miss a Ben Cutting/Yuvraj/Bipul Sharma kind of number 7,9
2020-10-13T17:18:31+00:00,,Smooth looks younger than Iyer,2
2020-10-13T17:18:35+00:00,thedeatheater1410,Are they going to finish with 0 sixes in the innings,11
2020-10-13T17:18:41+00:00,anaksr1414,What a time for break man,4
2020-10-13T17:18:42+00:00,3ngin3,"I guess that's it then, srh gonna lose",6
2020-10-13T17:18:42+00:00,marveltarts98,Fuck these double strategic time outs. Completely takes you out of the game.,8
2020-10-13T17:18:43+00:00,R-o_y,How tf did 3D even play world cup???,12
2020-10-13T17:18:46+00:00,kpranar,I'll take 8 runs in an over at this stage.,6
2020-10-13T17:18:47+00:00,Was_Unavailable,SRH doesn't deserve Kane! The moment he moves on to other team the flair's gonna change.,6
2020-10-13T17:18:49+00:00,,Thala effect dismantled Priyam Garg,4
2020-10-13T17:18:50+00:00,mbnvbcvxczljkhjghfgd,damn if srh could find a consistent power hitter at the back end they could easily be the best team in the league,8
2020-10-13T17:18:50+00:00,,Kane - When did I become finisher.,7
2020-10-13T17:18:51+00:00,PyRed,"Is hitting/slogging in T20, one of the D’s in 3D? If not, SRH are in deeper shit than anticipated.",9
2020-10-13T17:18:52+00:00,,[deleted],12
2020-10-13T17:18:59+00:00,_gadgetFreak,"Vijay Shankar belong to Csk, he is fully qualified.",5
2020-10-13T17:19:02+00:00,rmU6Rz0ztS,Tewatia is already an IPL legend because of 2 games after going totally unnoticed in last 3 years.,7
2020-10-13T17:19:05+00:00,MonkeyDsarva,I'll give curran the last over instead of bravo.,6
2020-10-13T17:19:07+00:00,vdix007,"Everytime Chawla dives, his lower body says yes, but his upper body says no",10
2020-10-13T17:19:07+00:00,limegreennalgene,3D shankar playing 17D chess now,8
2020-10-13T17:19:18+00:00,G_h_c,Gosh why does this game feel like it’s been going on forever,4
2020-10-13T17:19:19+00:00,shiwanshu_,behenchod sab tuk tuk,4
2020-10-13T17:19:20+00:00,HBKM55,Where is the I N T E N T ?,7
2020-10-13T17:19:21+00:00,,"Can't believe I've been to busy to watch this :(

Sam Curran opening as a pinch hitter then getting David Warner out is too good to miss out on",8
2020-10-13T17:19:24+00:00,,[deleted],4
2020-10-13T17:19:28+00:00,rohitk4019,I remember Kanos changing a game with 3 sixes in an over against Karn and re igniting a chase,4
2020-10-13T17:19:28+00:00,,"Delhi needs to watch out, Tewatia is coming for you tomorrow 👀",5
2020-10-13T17:19:30+00:00,poochi,"If Kanos gets out, throw the ball to Rayudu.

I want to see 3D vs Rayudu 🔥🔥",4
2020-10-13T17:19:32+00:00,Bazzingatime,"So 3D is better than Raydu



At tuktuk",8
2020-10-13T17:19:34+00:00,,Rashid not in yet? Tactical error,2
2020-10-13T17:19:35+00:00,Haunted4life,"Dinesh : I'll use Narine after 12 overs against CSK


Dhoni : I'll see your Narine and raise you Piyush after 15 overs.",7
2020-10-13T17:19:35+00:00,swingtothedrive,SRH just showing off to CSK we too can shit the bed when chasing,4
2020-10-13T17:19:38+00:00,ramraj1996,Chawla>>>>>>>>>>>>>>>dube,4
2020-10-13T17:19:38+00:00,AnantShrestthPajaMaN,"C'mon Shankar, you have done it before you can do it again. Just see the ball, hit the ball.",3
2020-10-13T17:19:39+00:00,siva113,"How many of you think Csk will retain the same side if they win knowing....Bravo isn't much and Piyush was wasted today...... Hazlewood, Tahir on the bench..... Jagadeesan can atleast run 2s",7
2020-10-13T17:19:42+00:00,shaun-tait-fanboy,chawla actually looks disgusting with all the extra blubber,3
2020-10-13T17:19:44+00:00,exisiova,They're not able to hit 10 runs an over for a while. Idk how they intend to hit 15 an over,6
2020-10-13T17:19:50+00:00,,How are we so bad at sixes 0 of em so far,8
2020-10-13T17:19:51+00:00,borklaser17,Faf and Chawla (yet) didn't contribute much and still chennai is in winning position. Nice,3
2020-10-13T17:19:53+00:00,V_Seyway,Just saying RR was in similar position day before yesterday during chase.,7
2020-10-13T17:19:59+00:00,,Lmao Lara is still batting for samson. Or maybe I'm rating him wrong! 🤔,3
2020-10-13T17:20:01+00:00,Crickesh,Shankar oka innings Ayina adura babu team lo vunnanduku🙄🙄,5
2020-10-13T17:20:05+00:00,Fad_du_pussy,Nice game of 'the boundary is lava' by SRH,6
2020-10-13T17:20:08+00:00,iphone-se-,Cowards! stop shitting on VJ Shankar. He just come to the crease.,5
2020-10-13T17:20:09+00:00,UltraUnited,Woh Paytm kyc wala  chomu hokar bhi ladki ka number le leta hai. Seekho laundon,7
2020-10-13T17:20:13+00:00,RLKay,"The boundaries are too big and SRH has absolutely no power as one of the commentators pointed out. Warner has lost his edge, Bairstow is hit and miss, Kane don't have muscle, Garg is Kane Lite, 3D is.. Well 3D!",9
2020-10-13T17:20:15+00:00,anirudh1595,"So Garg played 17 balls with zero intent, and got out on the first ball he showed intent, but some people here blaming Vijay Shankar for trying to take 3-4 balls to settle. 

Sucks he's not a *youngster* I guess",10
2020-10-13T17:20:16+00:00,BurntOutIdiot,"Win toss, bat first, win match",11
2020-10-13T17:20:21+00:00,kissmyass159753,59 off 4 overs is tight he says. Love T20 cricket hahaha,9
2020-10-13T17:20:26+00:00,kpranar,Somehow get Kane's wicket and I'll unclench.,5
2020-10-13T17:20:26+00:00,swingtothedrive,There is more chance of Williamson running six runs than hitting sixes at this stage,11
2020-10-13T17:20:36+00:00,Balavadan,Kane definitely looks zoned in. SRH has a real chance of winning it. CSK have been usually terrible at the death too,4
2020-10-13T17:20:41+00:00,CapitalStructure,This Chawla strategy analogous to how Narine was used in the past few matches is a really clever way of preventing batsman from changing gear at the right time preventing the finish,3
2020-10-13T17:20:46+00:00,gungly,Chawla is like a government employee. Collecting a paycheque for doing a minimal job,10
2020-10-13T17:20:59+00:00,,"r/cricket when Dhoni bats slowly in a chase: Loser! He’s just padding stats! He’s lost it. Go home MS! Your time is done!

r/cricket when Williamson bats slowly in a chase: What a masterful chase. Knows exactly when to accelerate. Do you need a slow blowjob along with that slow innings, Kane?",15
2020-10-13T17:21:07+00:00,angryWitness,"at this rate, we will win by the 25th over",6
2020-10-13T17:21:12+00:00,sherlock31,Sehwag looks like Wolverine with that hair,2
2020-10-13T17:21:17+00:00,Bluebillion,I’m calling wicket alert,4
2020-10-13T17:21:20+00:00,,SRH should have rejected Vijay Shankar in that swap deal,3
2020-10-13T17:21:29+00:00,PesAddict8,Fuck it. Samad would have done a better job here.,3
2020-10-13T17:21:31+00:00,cantfindusernameomg,"Except KXIP and the opening game vs MI, all chases in this IPL have been super fucking hard.

Not sure if everyone took a course at tuk tuk academy over COVID or the UAE is Chepauk-lite.",4
2020-10-13T17:21:36+00:00,redditisfun1209,Karan gulping a whole banana for that extra spin!!,7
2020-10-13T17:21:48+00:00,Caretaker7,Oof,5
2020-10-13T17:21:49+00:00,udayEm,3D for ya.,5
2020-10-13T17:21:53+00:00,,3d player unleashed,5
2020-10-13T17:21:55+00:00,Arkadeep101,3D six! Mothafuckas! He is here.,8
2020-10-13T17:21:56+00:00,,3D,3
2020-10-13T17:21:57+00:00,WeaponX23X,take that r/cricket,8
2020-10-13T17:21:58+00:00,gr8astardd,Is that the first 6 this innings?,7
2020-10-13T17:21:59+00:00,wingzero00,We need a Tewatia in the team,11
2020-10-13T17:22:03+00:00,,Shankar annaaaa,8
2020-10-13T17:22:03+00:00,smokeshishaplayfifa,"Take that r/cricket , 3D six for you",10
2020-10-13T17:22:04+00:00,neondit,1st six came in the death,6
2020-10-13T17:22:07+00:00,kpranar,"Plizz Bravo, don't be shit.",6
2020-10-13T17:22:09+00:00,ganny0007,Bravo pls hold the hate,5
2020-10-13T17:22:14+00:00,Fad_du_pussy,Vijay Shankar's neighbor uncle seeing this match and saying 'isse accha to B Tech hi Kar leta',3
2020-10-13T17:22:16+00:00,,3D boi has become a 4D boi,4
2020-10-13T17:22:17+00:00,see_mom_no_username,Bravo wtf,1
2020-10-13T17:22:18+00:00,afex1808,You better not find your 3d skills today shankar.,5
2020-10-13T17:22:18+00:00,catinho99,Fuck off 3D trollers ... chat shit get banged,3
2020-10-13T17:22:19+00:00,nikkhelsai1,Shankar annnnnaaa,3
2020-10-13T17:22:20+00:00,Lionheart008,The camerman should have zoomed into rayudu now,5
2020-10-13T17:22:21+00:00,,Fuck. I've jinxed it,1
2020-10-13T17:22:21+00:00,kmadnow,Dont give me hope,2
2020-10-13T17:22:21+00:00,DilliKaLadka,Fuck your 3D bullshit. I am 6D now - Vijay,4
2020-10-13T17:22:22+00:00,WoakesStokesFoakes,3d 6 bitches,3
2020-10-13T17:22:22+00:00,,Bravo is so done,5
2020-10-13T17:22:22+00:00,VoyagerPaleBlueDot,3D always hammers bravo,4
2020-10-13T17:22:24+00:00,PM_ME_YOUR_CALL_LOGS,Slow pie in the slot,4
2020-10-13T17:22:28+00:00,,Get your 3-D glasses the show is starting,13
2020-10-13T17:22:29+00:00,AnantShrestthPajaMaN,Fuck yeah! Get it 3D!,9
2020-10-13T17:22:34+00:00,ze_shotstopper,Why do CSK have so many bowlers,6
2020-10-13T17:22:36+00:00,DeadlyPantsOfSea,champion bravo,3
2020-10-13T17:22:37+00:00,siddharthzaveri,Can the cameraman focus on Rayudu,4
2020-10-13T17:22:38+00:00,OnlysliMs,"Don’t jinx it guys, just **1** six",3
2020-10-13T17:22:39+00:00,PesAddict8,Waiting for VJ na's 3D special,2
2020-10-13T17:22:41+00:00,PyRed,The real 3D chess move is from Thala leaving out Shankar from CSK so that he can help them out in such games,3
2020-10-13T17:22:42+00:00,awesomeredditor777,Bravo is finished. Bowling slower balls only work if you also have pace to surprise the batsman,3
2020-10-13T17:22:43+00:00,siva113,18 run over from Bravo will break the chase,1
2020-10-13T17:22:44+00:00,rohitk4019,Rayudu - Friendship ended with DJ!,3
2020-10-13T17:22:45+00:00,nextdoorrando,Vijay shankar has to show some power hitting Today.,2
2020-10-13T17:22:46+00:00,aryanx1234,3d competing with the other 3d,2
2020-10-13T17:22:46+00:00,,Sexy shot tambi!,5
2020-10-13T17:22:50+00:00,anaksr1414,3D beast mode on,3
