Timestamp,Username,Comment,Upvotes
2020-10-13T12:11:41+00:00,poochi,"I am not sure if I have given up. But it seems like we used up all the good stuff out of the team in the last 2 years. The loss of Raina and Bhajji is just too much to handle for the team.

So the next 7 matches, I will try to enjoy it like I did in 2018. Like we had 2 years of nothing. Any win is a bonus from now. Hope they play for pride with the pride.",17
2020-10-13T12:15:28+00:00,cskindian,Can we please just bat first today for a change ?,56
2020-10-13T12:16:00+00:00,tinkusai,Must win match today,8
2020-10-13T12:17:32+00:00,thepokemonchef,"I think we should actually try to chase in this game. Yes, CSK haven’t set a total in 7 games and I hope they get a chance now. Neither SRH nor CSK has good death bowlers, and our lack of death bowling was exposed in the previous game.  
 
If SRH bats first, then we’re simply one Faf/Watson/Rayudu special away from losing. I think our batsmen can take on Bravo and Shardul bowling at the death. But I don’t think our bowlers can defend 30 off the last 2 if Faf and Jadeja are batting.",3
2020-10-13T12:18:29+00:00,,[deleted],55
2020-10-13T12:19:12+00:00,Lazy_Left_Eye,This has the potential to be a bore fest. Hoping that I’m wrong,21
2020-10-13T12:20:29+00:00,poochi,"Our bowlers are improving though. That's been one positive. Only we we managed to stem the bleeding in last few overs. 

I almost want to give them a pass because even the exhausted Kohli was just too good in the end.",31
2020-10-13T12:21:39+00:00,jadon_sancho,The most boring match of the Year,15
2020-10-13T12:32:51+00:00,subendu7,"Alright guys! based on the first half of the league stage, pick your 11. Max 2 from one franchise, max 4 overseas.

Rahul, Mayank, Sky, Iyer, AB, Curran, Tewatia, Rashid, Rabada,  Bumrah, Chahal",14
2020-10-13T12:35:47+00:00,,Kane Williamson can play at better strike rate than every other player playing today.,4
2020-10-13T12:38:38+00:00,thepokemonchef,Williamson needs to bat with more overs to spare. Having the one of the best batsmen coming out to bat with just 3 overs left is like having a Ferrari to only go to the grocery store. Williamson at 3. Pandey at 4.,9
2020-10-13T12:40:04+00:00,kpranar,"I honestly don't know what we can do to improve. Tahir in for Bravo? Now that the tracks are slowing down, we just hope that we can strangle the opposition and try to chase the score. As MS said we need to reverse everything that CSK stood for - taking it deep and then going berserk. Go hard in the beginning and hope you don't lose too many wickets. Clearly, if we lose too many, we are screwed anyway. If we lose today, might as well groom the bench for the next IPL from now on. Gaikwad, Santner, Sai Kishore for Watto, Jaddu and Karn. Let Santner open with Faf. If it works, we could have a good opening pair in Santner and Watto next season with Faf three and Ambati four. Or Raina will come back...",8
2020-10-13T12:41:08+00:00,ichbinCamelCase,"I don't think I care anymore, I am just going to enjoy watching Dhonis few of last outings on field, win or lose.",9
2020-10-13T12:42:17+00:00,2684335126835353,The is probably gonna be the most boring game of the season,7
2020-10-13T12:42:35+00:00,,The only way to fix SRH is to ensure Vijay Shankar starts to deliver. Both with the bowl and bat.,6
2020-10-13T12:43:21+00:00,RationalIndian98,"K P, Sunny and Neroli Meadows",3
2020-10-13T12:43:35+00:00,,I’ll just be glad if we don’t sustain another injury.,17
2020-10-13T12:43:48+00:00,Noligation, Am here just to see Thala maintain his 50+ average this season.,3
2020-10-13T12:43:58+00:00,flabbyboggart,"If you look at how well the spinners are performing in this IPL (Chahal, Washington, Rashid, Axar) someone of Tahir's caliber can really help CSK. They are understandably preferring Bravo because of his batting but I think they should to play Tahir in some matches.",15
2020-10-13T12:44:53+00:00,Lazy_Left_Eye,Y'all see any mid season trades happening? I don't see any for MI specifically. I think KXIP would try for a quality pacer like Steyn or Ferguson.,1
2020-10-13T12:49:56+00:00,Unpopular_opinion000,Ffs hope dhoni gets the toss luck correct,1
2020-10-13T12:50:59+00:00,djjd1996,"I thinking the age finally caught up with csk. Since most of them are retired, they haven't played much high caliber cricket recently. Probably explains why the only ones who are performing are Curran and Faf",5
2020-10-13T12:51:32+00:00,sahasamane_cheppali,[meanwhile me getting ready to watch pregame show on star](https://ibb.co/QjVb2pW),2
2020-10-13T12:52:24+00:00,banjowashisnameo,"Ah yes, the battle of the titans



Chalk on the Blackboard vs the relentless droning of Cicadas



Being stuck in the traffic vs buffering screen because of slow wi-fi



Truly a treat for fans",7
2020-10-13T12:53:35+00:00,sangilimuthu,I'm ready to get hurt.,8
2020-10-13T12:55:12+00:00,sahasamane_cheppali,Unrelated but did Dhoni had a hair transplant? His hair looks weird now,8
2020-10-13T13:00:15+00:00,Final-Solid,Is it too much to wish for CSK to bat in such a manner that doesn’t make me want to pull my hair out?,7
2020-10-13T13:00:37+00:00,RationalIndian98,Intent✌🏽,7
2020-10-13T13:05:59+00:00,Rubberducky1239,"10 years ago they were 10 years younger and majority were in their prime, comparing this to 2010 is absolutely baseless",9
2020-10-13T13:07:14+00:00,,[deleted],-3
2020-10-13T13:08:03+00:00,AbhishekSinghal98,"Commentators talking about CSK doing a 2010 repeat, as they were at the same points in 2010 as they are now in 2020. MI were also first then, KXIP were also last then. I don't think, it is possible, not just because of the quality of CSK, but simply because of the playoff system, much harder to win the league with 3rd or 4th place. I really hope it doesn't happen again, still remember 38 year old SRT playing out of his skin and not being able to win:/",-1
2020-10-13T13:08:53+00:00,flabbyboggart,"Do you think Dhoni will play next IPL? Also, who will captain CSK after Dhoni?",2
2020-10-13T13:09:07+00:00,,[deleted],3
2020-10-13T13:09:36+00:00,,It's freaking pouring here in Hyderabad,8
2020-10-13T13:10:40+00:00,,"Its funny how Kane Williamson wasn't seen to be fit for t20s and nowadays he smashing one handed sixes and finishing games.

Other teams would love to have him with his new found range.",56
2020-10-13T13:13:35+00:00,,Lmao what a Dhoni circlejerk video that was,3
2020-10-13T13:14:55+00:00,RationalIndian98,"Guys, Fox Cricket, for which Neroli Meadows works at, is an Australian company right? I almost confused Fox News from USA.😅",1
2020-10-13T13:16:10+00:00,,[deleted],10
2020-10-13T13:17:56+00:00,RationalIndian98,Murali quiz,1
2020-10-13T13:18:37+00:00,,Dhoni's choice of playing XI and his batting would ve interesting to watch after what he said in post match presentation in the last game.,4
2020-10-13T13:19:10+00:00,sahasamane_cheppali,When dafuq did Khaleel bowled Yorkers,6
2020-10-13T13:19:43+00:00,centzon400,Fingers crossed for Chennai if for no other reason than to keep the table interesting.,10
2020-10-13T13:20:09+00:00,Blackbeard567,"I'm here to see the reverse jinxing by fans

Srh will win comfortably",0
2020-10-13T13:20:10+00:00,,As a fan of Steven Smith. I am supporting Csk.,27
2020-10-13T13:23:42+00:00,uravggstudent,It isn't Byjus Cricket Live without showing Dhoni bowl every single time before the toss.,14
2020-10-13T13:25:27+00:00,HrishikeshSonar,"Is this the first match where 2 teams which have already played earlier in the season, playing their second match?",2
2020-10-13T13:26:17+00:00,ketchumchan25,When does the transfer window open? I heard they were waiting for all teams to complete 7 games.,7
2020-10-13T13:26:50+00:00,,"Given their history, I'm surprised that RCB hasn't bought Khaleel yet.",5
2020-10-13T13:28:28+00:00,flabbyboggart,"I think the big gap (even before Covid) from Cricket has ultimately affected Dhoni. He looks exhausted on the field. 

Would be interesting to see if he plays next IPL. Right now it's not about his form but more about his fitness and being in touch with Cricket throughout the year. 

Other retired international players play in the various T20 leagues around the world so they are always practicing and playing. Dhoni is already retired and his inability to play in any other T20 league because of BCCI restrictions would again keep him from any action for quite some time. The only respite he can get that the next IPL is just few months away (Mar 2021) so won't be much of a big gap. 

Hope he finds his groove in the second half of this season. It's just kills me to see him this way.",3
2020-10-13T13:28:54+00:00,adyfbi,Hope our lord and savior Manish Pandey make a hundred with a glorious strike rate of 120,6
2020-10-13T13:29:54+00:00,Bazzingatime,Who was the table topper in this week's dugout ?,3
2020-10-13T13:30:53+00:00,SuperStar1007,At last god damn,9
2020-10-13T13:31:16+00:00,jasonbourne92,Yaay for a a test match day again where only one team may play t20 style!,-6
2020-10-13T13:31:17+00:00,,My playoff goal is also coming to an end for SRH now. Unfortunately we just aren’t the same with an experienced pace bowler like Bhuvi or even Marsh.,3
2020-10-13T13:31:29+00:00,uravggstudent,CSK batting first finally,3
2020-10-13T13:31:35+00:00,Rubberducky1239,Dhoni is a fucking madlad can't hate this dude😂,15
2020-10-13T13:32:21+00:00,balajih67,Csk batting first. Hopefully some good fortune. They can still make it into the playoffs.,6
2020-10-13T13:32:48+00:00,,RIP our chasing skills,1
2020-10-13T13:32:56+00:00,soham_katkar13,"Mark Nicholas to Dhoni : ""How have you considered fixing""

Obviously he was referring to the holes in the team in the previous sentence",2
2020-10-13T13:32:59+00:00,flabbyboggart,"Why is Hotstar not showing toss or pre-match show? 

It's still showing highlights of an old game.",0
2020-10-13T13:33:20+00:00,,Inb4 CSK win today and the media starts jerking off about Dhoni 4d chess to make everyone feel safe against CSK and then unleash in the second half,2
2020-10-13T13:33:20+00:00,,Warner still saying we have a good bowling lineup....,5
2020-10-13T13:33:26+00:00,AnantShrestthPajaMaN,"CSK losing is beneficial for CSK, they'll soon realize that their team is caught with their pants down, is massively fucked and need to have a massive overhaul.",0
2020-10-13T13:33:28+00:00,Prathameshgtav,Lmao they dropped Jagadeesan,1
2020-10-13T13:33:29+00:00,Freakysafal,"Tamil vs telugu today

Southern derby",0
2020-10-13T13:33:33+00:00,balajih67,So csk going in one batsman short?,4
2020-10-13T13:33:34+00:00,Krnishant246,CSK won't be chasing this time. Will this result in change of fortune for them? Let's see.,2
2020-10-13T13:33:40+00:00,irrelevantadvisor,"Yea good choice this, dropping Jagdeesan.

Not like we have a shitty batting or anything",14
2020-10-13T13:34:18+00:00,balajih67,"Csk batting looks wafer thin, tonight. 2 wickets early for srh and it could be tough for csk to come back. Need a strong top order performance tonight",2
2020-10-13T13:34:21+00:00,Lazy_Left_Eye,Jagdeesan didn't do that bad honestly in the last match.,1
2020-10-13T13:34:24+00:00,,"Does anyone remember when Robin Jackman kept saying that whichever team wins overs 11-15, they’re likely to win the game?",1
2020-10-13T13:34:26+00:00,adventurer_here,6d chess by dhoni.. drop batsmen from squad and then lose by 70 odd runs and say one less batsmen cost us the game..,2
2020-10-13T13:34:26+00:00,TheLastAir-bender,"At last it's time, time to start the intent orgy.",1
2020-10-13T13:34:40+00:00,Kiruken,One batsman short when the batting isnt clicking? Bold strategy cotton.,5
2020-10-13T13:35:20+00:00,,"So basically we are playing 6 batsmen? Well, truly RIP our chances now.",8
2020-10-13T13:35:25+00:00,ajye,So they dropped their only good batsman,1
2020-10-13T13:35:30+00:00,Savings-Rice,What's with CSK not giving enough chances to youngsters? First Gaikwad and now Jagadeeshan,3
2020-10-13T13:35:33+00:00,,Jagadeeshan played with intent and betrayed Dhoni last time. Hence the axe /s,10
2020-10-13T13:35:48+00:00,awesomeredditor777,Hopefully Curran gets promoted tonight,7
2020-10-13T13:35:51+00:00,PM_ME_YOUR_CALL_LOGS,"They were doing tuk tuk wit that long ass batting lineup, can't imagine what they'll do with a batsman short today",3
2020-10-13T13:35:54+00:00,kawanish,"Even if we collapse, atleast the other team will chase it down comfortably. Won't have to deal with a shitty chase, clinging onto hope and then suffer inevitable heartbreak.",12
2020-10-13T13:36:11+00:00,AapChronologySamjhye,Csk finally gonna bat first. I'm sure this will change things around. They'll lose by wickets instead of runs now.,0
2020-10-13T13:36:16+00:00,St_ElmosFire,"Harsh call this, for Jagadeesan, he played a promising innings the other night. 

Perhaps too youthful though, maybe that's a problem.",6
2020-10-13T13:36:23+00:00,,Surely Tahir has to play ahead of Watson or Bravo,4
2020-10-13T13:36:32+00:00,sahasamane_cheppali,"SRH have left out their only pinch hitter, RIP this match. I'm outta here Bois",4
2020-10-13T13:36:51+00:00,Gani_19,"So, 7 bowlers huh?? A batsman short?? I can't understand why?",1
2020-10-13T13:37:04+00:00,HrishikeshSonar,Nice to see Warner acknowledging Kanos as an equal authority figure.,8
2020-10-13T13:37:22+00:00,,I just want to roll into a ball.,6
2020-10-13T13:37:24+00:00,,How good is shahbazz?,3
2020-10-13T13:37:26+00:00,SuperStar1007,"Our batting is the problem and we go on to replace our best batsman from last game for Chawla.

We r truly the meme team.",70
2020-10-13T13:37:47+00:00,Freakysafal,"Srh really looks strong now with nadeem coming in

God plz forgive me but i wud have dropped lord shankar

Abishek sharma has given few good performances",4
2020-10-13T13:38:05+00:00,Proboninja,SRH are one batsman short too.....maybe we can finally see Rashid the FINISHER!!,6
2020-10-13T13:38:27+00:00,kabirthegreat,glad they're batting first,2
2020-10-13T13:38:43+00:00,,Not surprising that csk brought extra spinner.I reckon Every team will have to accommodate 2 spinners in their lineup considering how slow the pitches are going to be. Expect low scores from now on,1
2020-10-13T13:38:43+00:00,HrishikeshSonar,Hoping CSK to score at least 160+. I think 175-180 will be above par.,1
2020-10-13T13:38:49+00:00,PM_ME_YOUR_CALL_LOGS,Do they think it'll be slow/turn today? What's with the extra spinner on both sides?,1
2020-10-13T13:39:12+00:00,TheReturnofTheJesse,With one batsman out Pandey may play more conservatively. 55(52) incoming.,8
2020-10-13T13:39:14+00:00,hornyunicorn757,Bravo definitely has Dhoni's nudes,9
2020-10-13T13:39:47+00:00,,Both teams have gone for a spinner. Interesting.,5
2020-10-13T13:40:50+00:00,G186hkK867,I really hate when CSK don't play youngester like Sai Kishore they should have gone with him In place of chawala,6
2020-10-13T13:41:03+00:00,2EyedRaven,"I wish youngsters like Ruturaj or Jagadeesan were in some other team. At least they'll get chances. 

We are fucking second last in the table and still not ready to try something new.",41
2020-10-13T13:41:08+00:00,Was_Unavailable,"Guys whatever you do, do not start CSK's redemption arc where those fuckers will suddenly get back to winning and will go on to win the trophy. Serious chills whenever we play CSK",11
2020-10-13T13:41:12+00:00,anirudh1595,"Absolutely no issues with SRH dropping Abhishek. Shrewd move. Rashid has hardly batted this season and he's more than decent to be a No.7. Fifth bowler has been their problem, so it's pretty cool to have Shahbaz Nadeem fix it. Shankar and Kane can chip in if needed.",11
2020-10-13T13:41:41+00:00,thenintendobustr,"Csk have competent bats down to 7 and Chawla's not useless with the bat, lineup seems fine to me, need the extra spinner.",6
2020-10-13T13:41:53+00:00,randomadultteen,CSK batting 1st with only 4 specialist batsmen.,3
2020-10-13T13:41:57+00:00,,"CSK homies, do you feel Bravo to be a batsmen?",5
2020-10-13T13:42:25+00:00,RationalIndian98,Dhoni vs Rashid key battle,1
2020-10-13T13:42:47+00:00,anaksr1414,"SRH: WTF why would they drop Abhishek who was our only genuine hitter after openers. Nadeem should have replaced Sandeep Sharma(why he is even persisted with)

CSK: Also WTF Poor Jagadeesan, made him wait for 3 long years and finally when he gets his chance hits a decent score only to be dropped in next match that too for Piyush Chawla.

Give me a break man. These two teams competed for best team for worst team changes today.",10
2020-10-13T13:43:48+00:00,TheReturnofTheJesse,"I feel a bit sorry for Nabi at the moment. He is in excellent form with bat and ball, but because of the weakness of SRH’s batting he just can’t get a game.

If a fifth international player was allowed he would come in immediately for Nadeem and strengthen SRH’s middle-order considerably.",7
2020-10-13T13:43:49+00:00,aryanx1234,"Two teams with peak collapse tendency, one with a slow one and one like real quick",9
2020-10-13T13:43:59+00:00,,I am ready to get hurt again,10
2020-10-13T13:44:04+00:00,madglover,Surely Kane has to move to 3 he isn't facing enough balls at the moment,11
2020-10-13T13:44:46+00:00,DonnieDarko2307,Aren't chawla and karn exactly the same type of bowler. I swear their bowling action is same too. And chawla's fielding makes me cry,6
2020-10-13T13:44:55+00:00,The_The_Dude,"Q: What is more boring than a CSK match?

A: Match in which CSK bats first.",12
2020-10-13T13:44:58+00:00,,*chuckles nervously*,2
2020-10-13T13:45:09+00:00,,"Man, with CSK’s spin lineup, I don’t know how our guys are going to go after spinners.",4
2020-10-13T13:45:10+00:00,Sworup58,Why are they promoting Dhoni Vs Rashid as a battle lmao...,15
2020-10-13T13:45:12+00:00,Bazzingatime,"Thala needs to refrain himself from those test cricket shots against spinners ,try to nudge it for singles",6
2020-10-13T13:45:26+00:00,sahasamane_cheppali,"Interesting, CSK opted for 3 spinners",7
2020-10-13T13:45:53+00:00,,Kane mama and Manish need to take on the spinners.,4
2020-10-13T13:45:54+00:00,Blackbeard567,Spin bowling is going to be crucial moving forwards. Absolutely loved the spin choke yesterday,3
2020-10-13T13:46:25+00:00,sangilimuthu,"Warner and Dhoni, amazingly experienced cricketers and captains in Cricket: *drops a player*


/r/Cricket experts: *""Yo that's so wrong, this is how I'll do it.""*",14
2020-10-13T13:46:36+00:00,Assraj,"All I want is CSK to be eliminated

I've been  waiting 13 years for this shit",8
2020-10-13T13:46:40+00:00,Naan6,I feel like csk are gonna come at this game with vengeance,2
2020-10-13T13:47:05+00:00,peter_griffins,this csk lineup is the epitome of batdeep,4
2020-10-13T13:47:13+00:00,ChancesChoices,"Faf, Rayuddu or Curran? Whom to select for the fantasy league?",1
2020-10-13T13:47:16+00:00,,CSK sucks in encouraging young talent.,6
2020-10-13T13:47:25+00:00,bunnyoverkill,Bit offtopic but which Reddit app do you guys think is best for following match threads? The official app is arse and the mobile site gets less appealing by the day.,2
2020-10-13T13:47:29+00:00,,It’s raining a lot in Hyderabad. Don’t feel good for the Sunrisers.,5
2020-10-13T13:47:49+00:00,,CSK won 4/8 tosses. No excuses now hahaha,-2
2020-10-13T13:47:50+00:00,,Thank god ipl is happening in uae.It has been raining since morning in Hyderabad,2
2020-10-13T13:48:06+00:00,,"Manish, you can score upto 49 runs but no 50 pls!",6
2020-10-13T13:48:34+00:00,Savings-Rice,Sam Curran or Watson for Fantasy league ?,1
2020-10-13T13:48:41+00:00,,It genuinely hurts guys.,1
2020-10-13T13:48:42+00:00,peter_griffins,obligatory reminder that piyush chawla is younger than priyam garg,7
2020-10-13T13:48:44+00:00,Naan6,Abhishek didn’t really do anything wrong to be dropped by I don’t mind the extra spinner,1
2020-10-13T13:49:02+00:00,skilled_nihilist,CSK winning it comfortably,0
2020-10-13T13:49:14+00:00,Naan6,Both these teams are not the best at chasing so csk batting first sucks for srh,3
2020-10-13T13:49:17+00:00,ravindra_jadeja,"It's frustrating to support SRH.. Neither you are the best - you can brag about... Nor you are the worst - you can rant freely...

Every time you give up hope, they get improbable win and every time you think they are on the roll, they lose an easier encounter...",12
2020-10-13T13:49:18+00:00,Arunnnnnnn,This is exactly why no young batsmen have been able to breakout from CSK ranks in a decade. They never give such guys even a handful of matches. Hope Jagadeeshan gets to play for a better franchise.,3
2020-10-13T13:49:33+00:00,gungly,"Looks like Dhoni found Jagadesan's true birth certificate.

Thala: But but I know I saw the hair dyes and a set of dentures in your bag. Tell me you aren't 24.

Jagadeesan: Sorry Thala, those were gifts for teammates.

Thala: Get out of my sight. You make me sick.",24
2020-10-13T13:49:46+00:00,,I feel this is going to be a low scoring match given how the pitches are slowing down and csk batsman mostly love pace on the bowl and choke against spin. Srh with 2 spinners won't help the cause either. I am already ready to hear *tuk tuk* comments.,2
2020-10-13T13:49:51+00:00,HrishikeshSonar,CSK has batsman till no. 9 still looks so hollow,5
2020-10-13T13:49:54+00:00,flabbyboggart,"CSK batting first for the first time since the 1st qualifier against MI in May 2019 - ten matches ago.

It is the joint-longest such sequence in IPL. KKR chased in nine consecutive matches in 2014.

\- Cricbuzz",16
2020-10-13T13:50:09+00:00,thedeatheater1410,How to protect NRR while defending? Asking for an enemy,3
2020-10-13T13:50:14+00:00,jadon_sancho,How to motivate myself to watch this? Help,3
2020-10-13T13:50:18+00:00,Noopspow,"I stumbled into Watson's Youtube channel and saw some comments that really was sad to see. Hope CSK don't disappoint today, for those people's sake.",6
2020-10-13T13:50:39+00:00,,Finally we have 5 specialist bowlers. Rashid is good for a No.7 batsman in T20 as someone said in previous SRH thread.,4
2020-10-13T13:50:54+00:00,beastranger_12,Dropping a middle order batsman when the middle order is not solid ffs.,16
2020-10-13T13:51:01+00:00,,[deleted],3
2020-10-13T13:51:02+00:00,sahasamane_cheppali,Obligatory *I never thought Piyush is as old as Koach*,6
2020-10-13T13:51:17+00:00,,"Sorry CSK fans, your getting no love from this SRH fan, you guys have caused me enough heartbreaks",4
2020-10-13T13:51:58+00:00,A_M-a-n,Whining is unbearable here and match hasn't started yet.,3
2020-10-13T13:52:06+00:00,,No Swann yesssss,1
2020-10-13T13:52:10+00:00,Assraj,Border gavaskar trophy test 2,11
2020-10-13T13:52:13+00:00,ravindra_jadeja,"Obligatory, they use Piyush chawla as weighing scale to measure 1 quintal wheat...",7
2020-10-13T13:52:25+00:00,XxBlackDuckPlierxX,Why drop Jagdessen? He played only 1,5
2020-10-13T13:52:50+00:00,blumirage,So CSK dropped the only batsman that performed decently I'm the last match. WHY,9
2020-10-13T13:52:55+00:00,HrishikeshSonar,Didn't realize that R Gayakwad was the second highest scorer in SMA trophy 2019. He should have been groomed by CSK. It is not certain that he'll click but it is better to groom younger players imo,4
2020-10-13T13:53:16+00:00,thepokemonchef,MI is getting incredible value out of Krunal. His bowling stats are miles ahead of Jadeja’s in this IPL and are basically the same as a specialist spinner.,5
2020-10-13T13:53:31+00:00,justavertexinagraph,Dropping jagdeeshan who played reasonably well last match seems odd,14
2020-10-13T13:53:32+00:00,Freakysafal,"I feel warner is the key today for srh

If he survives the pp

Then warner against 2 leggies n 1 left arm spinner with ball coming in for him is gonna be juicy

If he gets out then there r no left handers in that batting line up",5
2020-10-13T13:54:51+00:00,Hariii_,there was one only guy who was showing intent and CSK removed him and brought in Lord Chawla.,3
2020-10-13T13:54:52+00:00,sausagebaconham,Fuck BATDEEP. Me and my homies follow BOWLDEEP,7
2020-10-13T13:54:57+00:00,XxBlackDuckPlierxX,"**Sees CSK match**

*Scrolls by controversial hehe*",12
2020-10-13T13:55:16+00:00,,"If they're dropping batsmen for spinners, they should've dropped Watto and brought Tahir in",3
2020-10-13T13:55:18+00:00,swang123456799083,As a Chennai fan I have zero expectations,1
2020-10-13T13:55:25+00:00,exisiova,Lesgooooooo. Day 1 Session 1 of today's epic match.,8
2020-10-13T13:55:32+00:00,,Tbh is any SRH fan surprised we are no 5? We have always been in the middle of the table all the time during the tournament,8
2020-10-13T13:55:43+00:00,TaylorSwiftIsGod_01,"When Captain Dhoni swings his mighty bat,

All those who chose to oppose taking the game deep must yield.

If he’s led to the crease and a chase is a due, 

Then the tuk tuk of Thala test academy will come through. 

When Captain Dhoni swings his mighty bat.",0
2020-10-13T13:55:49+00:00,flabbyboggart,Sunil Tonk-The-Ball Gavaskar,4
2020-10-13T13:56:07+00:00,HappyWarsFan,Why isn't CSK playing Tahir??,6
2020-10-13T13:56:13+00:00,anaksr1414,"Honestly who all are part of the team to deciding playing 11 for a match in SRH.

I somehow feel Laxman somehow has a soft corner for players like Manish and Garg and might be backing them during those discussions ( if he has a say). Unfortunately players like Abhishek might be losing out due to that.",4
2020-10-13T13:56:43+00:00,ganny0007,Jagadeesan deserved a second game men. SMH,12
2020-10-13T13:57:05+00:00,batsywimping,let this event be the change of fortune for csk. those in favour say amen,0
2020-10-13T13:57:07+00:00,sanyogG,"CSK will bat first for the first time in IPL 2020

Damn",17
2020-10-13T13:57:15+00:00,sangilimuthu,I see everyone here is rooting for CSK to lose. That's.. a lot of hate.,15
