Timestamp,Username,Comment,Upvotes
2020-10-13T15:54:22+00:00,djjd1996,"I think the Curran experiment should continue. I think more then anything, he keeps the run rate going while the openers are playing themselves in",21
2020-10-13T15:54:27+00:00,St_ElmosFire,Wasn't prepared for a universe where CSK is the underdog in most match ups.,20
2020-10-13T15:54:33+00:00,ramraj1996,MI fears that if CSK back to form they can't defend their title.,5
2020-10-13T15:54:41+00:00,,Warner's stache is hideous! (helping a redditor out),3
2020-10-13T15:54:57+00:00,,All 👍 I need 😊 is a Kanos 😍 masterclass 😩 to shut up ✌🏻these 💁🏻 Thala fanbois😘😘😎😎,-27
2020-10-13T15:55:04+00:00,BurntOutIdiot,Bairstow's wicket gonna be key here IMO,6
2020-10-13T15:55:17+00:00,SexxyBlack,"Boundary hitting in this innings was on point. If running between wickets was better during Watson-Rayudu partnership, they could have got 175 and that would be hard to chase on this pitch.

Even with 167, CSK are favorites unless one of SRH’s overseas big 3 score big.",14
2020-10-13T15:55:38+00:00,PM_ME_YOUR_CALL_LOGS,They'll chase it down in 18 overs with 6 wickets to spare I reckon,7
2020-10-13T15:56:26+00:00,,No way SRH are chasing this with future CSK captain Shardul Thakur in the form of his life.,24
2020-10-13T15:56:27+00:00,Freakysafal,"Surprisingly Csk finished really well today

Even dhoni with 21 of 13 did his job

If only rayudu n watto had been more agressive

Still a decent target

Get 1 in pp n csk in the game",11
2020-10-13T15:56:45+00:00,jasonj2232,SRH fans bitchinf about their middle order but it is that middle order that won them their last game against CSK.,13
2020-10-13T15:56:51+00:00,Idontlikethisstuff,"Predictions on when YJB will get bowled through the gate by Chahar?

My money's on 4 balls in",5
2020-10-13T15:57:04+00:00,,"I wake up at night thinking about some rando on r/cricket suggesting Kanos to be the future CSK captain.   
So controversial, yet so true.",19
2020-10-13T15:57:11+00:00,,Warner + Bairstow opening is so OP. Its almost like one of them is guaranteed to go on to do some damage,9
2020-10-13T15:57:26+00:00,,[deleted],16
2020-10-13T15:57:56+00:00,Blackbeard567,Let's accept that dhoni and jadeja played well today. Only problem was the dots and tuk tuk going on between Watson and rayudu but overall a much improved performance and good decision having so many bowlers,13
2020-10-13T15:57:59+00:00,User9333,Pandey for 11 crores is overpriced. He's not a match winner in t20. Even Manoj Tiwary can play the same role who was available for base price.,15
2020-10-13T15:58:30+00:00,CapitalStructure,Do you think IPL finals should be a 3 match series,-6
2020-10-13T15:58:54+00:00,PlsDontBraidMyBeard,Calling it now. Bairstow is Chahar's bunny.,9
2020-10-13T15:58:55+00:00,,"The opening partnership is key. Rattle both of them in the powerplay, and CSK shouldn't have too hard time. The bowlers want to restrict those two as much as possible because when they get going, they're gone.",4
2020-10-13T15:59:04+00:00,aryanx1234,5 d chess move by warner to take strike against yjb's kryptonite,3
2020-10-13T15:59:09+00:00,poochi,Went chasing after that ball.,3
2020-10-13T15:59:43+00:00,fakecricketplayer,Need to continue with the experiment of using Dhoni as a pinch hitter!,9
2020-10-13T15:59:46+00:00,HillsHaveEyesToo,Scenes if they chase it with 10 wickets in hand,3
2020-10-13T15:59:48+00:00,kpranar,Dammit.,1
2020-10-13T15:59:56+00:00,Mr_Bean12,"WTF did I just read...I'll remember to not sort by new..

https://www.reddit.com/r/CricketShitpost/comments/jafvcz/cringe_shitpost_im_going_to_hell_for_this/",4
2020-10-13T16:00:08+00:00,SuddenlyFeels,Ball is stopping for the batsmen. Good for our spinners.,3
2020-10-13T16:00:38+00:00,exisiova,Inb4 Bairstow b Chahar 0(4),8
2020-10-13T16:00:39+00:00,siva113,SRH fans are a bit too pessimistic today???,15
2020-10-13T16:01:13+00:00,Giant_Slay3r,Yjb: Thanks for nothing warner,4
2020-10-13T16:01:16+00:00,kpranar,Plizz Chahar.,7
2020-10-13T16:01:41+00:00,,"I think this is the game Warner really goes all out, we are due",2
2020-10-13T16:01:44+00:00,catinho99,Cmon guru randhawa!,8
2020-10-13T16:02:38+00:00,jasonj2232,Rayudu would've thrown that ball at the wickets but he got scared by Warner's sex offender mustache.,8
2020-10-13T16:02:41+00:00,exisiova,"If Bairstow destroys leggies and is weak against inswingers, why not send him lower down when the ball ain't swinging/leggies come in ?

Same argument would stand for Finch as well.",8
2020-10-13T16:03:12+00:00,,I am supporting Csk because it wil help RR but I am pretty sure I will change side moment Kanos come to bat.,3
2020-10-13T16:03:15+00:00,,Is this thread ded?,2
2020-10-13T16:03:19+00:00,gr8astardd,Did he just use his sweat to shine the ball,3
2020-10-13T16:03:25+00:00,,CSK should buy Kane if they want to really look towards the future. SRH fans will bully me but ya'll ain't got no respect for Cricket Jesus. Why tf would you even utter nonsense like replacing him with Nabi?,14
2020-10-13T16:03:27+00:00,behkul_maan,"Poor from chahar, no wickets in the first over",-7
2020-10-13T16:03:37+00:00,,Uber boats now available in hyderabad. Dm for booking.,1
2020-10-13T16:03:41+00:00,,"Lmao SRH fans know we have to keep the reverse jixs going till the last ball, we know what happens when you stop jinxing ehm RR....",3
2020-10-13T16:03:53+00:00,mattytmet,YJB not getting clean bowled in the first over klaxon,8
2020-10-13T16:03:56+00:00,st6374,YJB taking the Finchy approach of charging down the pitch I see. Not saying other batsman haven't done it countless time to counter the swing though.,2
2020-10-13T16:03:59+00:00,Naan6,I swear to god srh has the most pessimistic fan base. Liek pessimism is fine but it’s only been a over...chill,10
2020-10-13T16:04:07+00:00,limegreennalgene,Alright fellas how’s it going,1
2020-10-13T16:04:53+00:00,Freakysafal,"Being an English fan Why do i like Sam Curran much more than YJB?? 

YJB obviously the bigger player",4
2020-10-13T16:04:54+00:00,jasonj2232,"CSK batting lineup looks so much better without Jadhav in it.

They just have too many players who do the same role -  Jadhav and Rayudu play the same way, Curran and Bravo fulfil the same roles, Faf and Watson fulfil the same roles.",11
2020-10-13T16:05:03+00:00,BurntOutIdiot,I'll celebrate if Curran castles warner,7
2020-10-13T16:05:14+00:00,TheFirstLane,"Cmon ump, have some mercy.",1
2020-10-13T16:05:36+00:00,XxBlackDuckPlierxX,This thread is dead?,3
2020-10-13T16:05:37+00:00,GaussianFunction,"Almost forgot the mini matchup today, Ambati ""The floor is running 2's"" Rayudu vs Vijay ""3D"" Shankar.",17
2020-10-13T16:05:41+00:00,broken_cranium,Sam Curran is so underrated.,11
2020-10-13T16:05:41+00:00,kpranar,Too high?,1
2020-10-13T16:06:07+00:00,Rubberducky1239,Question to CSK fans is Sam one of those guys who will be retained? Is it an obvious or is an iffy?,3
2020-10-13T16:06:20+00:00,,[deleted],-3
2020-10-13T16:06:33+00:00,hurricane_news,"""The orange cap stays on during sex""",11
2020-10-13T16:06:37+00:00,oxfordcircus007,kxip with top two run scorers.. lmao,2
2020-10-13T16:06:39+00:00,aryanx1234,Inb4 Warner's 42(34) and pandey's 47(43),-2
2020-10-13T16:06:39+00:00,International_Boat82,"The special thing about warner in the last 5 seasons was that i didnt have the constant fear of him getting out every ball
He still scores runs but not like earlier",7
2020-10-13T16:06:55+00:00,,"SRH to win if warner striker at around 145 
CSK will win if the leggies go for under 8 economy combined",1
2020-10-13T16:07:04+00:00,sahit24,Johnny Johnny Johnny.,5
2020-10-13T16:07:06+00:00,,Warner trying to scare Chawla,2
2020-10-13T16:07:09+00:00,smokeshishaplayfifa,Rayudu saved a review,1
2020-10-13T16:07:13+00:00,leaderof13,"Team players that have most losses are at the forefront for orange cap , how ironic it is",2
2020-10-13T16:07:17+00:00,moondakamina,It’s a shame orange cap is led by 2 KXIP batsmen and they’re at the bottom.,4
2020-10-13T16:07:19+00:00,nopelok,"I think I saw one of my neighbours on the Dream 11 cam. 

Time for a social boycott.",4
2020-10-13T16:07:24+00:00,Mr_Bean12,"Sam: Should we refer?
Dhoni: F**k off",2
2020-10-13T16:07:25+00:00,,"Sam Curran definitely practices his mean run up face in the mirror, to offset the fact he’s a little boy bowling 78mph.",12
2020-10-13T16:07:36+00:00,HrishikeshSonar,"In the orange cap race, 2 batsmen are from the #8 team, 2 batsmen from #5 team and 1 batsman from #7 team.",4
2020-10-13T16:07:42+00:00,,"Big boy biz 
YJB let's goo",2
2020-10-13T16:07:44+00:00,smokeshishaplayfifa,*Ohh that's sweet sweet sound*,4
2020-10-13T16:07:44+00:00,kpranar,Hahahaha Rayadu xD,4
2020-10-13T16:07:48+00:00,Idontlikethisstuff,Honestly I only realised Rayudu has a neck tattoo today and it's very unsettling yet makes perfect sense??,3
2020-10-13T16:07:49+00:00,sahit24,Shot!,4
2020-10-13T16:07:58+00:00,SuddenlyFeels,I see fate has decided to put KL through the same IPL grinder as Koach had with RCB. He already looks dead inside.,3
2020-10-13T16:08:06+00:00,XxBlackDuckPlierxX,**Downvoter is here**,1
2020-10-13T16:08:09+00:00,kpranar,Oh no.,3
2020-10-13T16:08:12+00:00,wingzero00,"Guys reverse jinxing is only successful when we have a good bowling attack, like in 2018 and 2016. Without Bhuvi our jinxing powers will fade away.",5
2020-10-13T16:08:15+00:00,Truthgamer2,Cracking,3
2020-10-13T16:08:18+00:00,mexicomasala,"Given someone like YJB is doing so well, puzzles me as to how guys like Root and Mushfiqur, who are also world class, aren't playing in the IPL",2
2020-10-13T16:08:19+00:00,Freakysafal,"Csk ideal playing xi according to me

Curran

Watto

Faf

Rayudu

Jadeja

Dhoni

(play anyone u want) 

Chahar

Thakur.

Karn/Chawla

Tahir",3
2020-10-13T16:08:21+00:00,sandviper16,"How many players have opened the batting and Bowling, sam curran treating the IPL as if its his under 15 team",5
2020-10-13T16:08:25+00:00,hurricane_news,65 million years. Zap,1
2020-10-13T16:08:35+00:00,onion_uthappa,Piyush Chawla rolled to the ball,2
2020-10-13T16:08:36+00:00,,*eargasm*,2
2020-10-13T16:08:38+00:00,thesmallprint13,SCurran literally has to do everything for CSK.,4
2020-10-13T16:08:40+00:00,PM_ME_YOUR_CALL_LOGS,Wtf Chawla how are you a professional cricketer?,5
2020-10-13T16:08:50+00:00,hurricane_news,65 million years. Zap,2
2020-10-13T16:08:55+00:00,mattytmet,Jonny how could you massacre baby Scurran like that,3
2020-10-13T16:08:56+00:00,oxfordcircus007,nice throw from chawla,2
2020-10-13T16:08:57+00:00,DonnieDarko2307,Chawla is big fat sus,4
2020-10-13T16:09:12+00:00,kpranar,What the fuck was the Piyush?,5
2020-10-13T16:09:24+00:00,hurricane_news,"Uh oh, I hope he doesn't do a Kolhi",1
2020-10-13T16:09:26+00:00,Euphoric_Dey,GL was a better side than CSK 2020,1
2020-10-13T16:09:29+00:00,,Obligatory comment that Piyush Chawla is younger than Kohli,9
2020-10-13T16:09:42+00:00,properzing,"I strongly dislike Warner milling around every innings at the start, relying on Jonny to get the innings going.",0
2020-10-13T16:09:42+00:00,,"Bairstow's like a boxer, every stroke seems to have so much power.",1
2020-10-13T16:09:49+00:00,loki_made_the_mask,Bill Burr plays such good shots,2
2020-10-13T16:09:53+00:00,gaurcs,Lara oozes so much class,1
2020-10-13T16:10:02+00:00,HrishikeshSonar,Whose middle order is more fragile? SRH or KXIP,2
2020-10-13T16:10:05+00:00,,"Damn, Piyush Chawla looks a like a lesbian mom lmao",4
2020-10-13T16:10:05+00:00,hurricane_news,Who's that clean shaven guy that just walked past in csk?,2
2020-10-13T16:10:06+00:00,smokeshishaplayfifa,"Yeh Jonny, beautiful shot.looks in good touch",4
2020-10-13T16:10:12+00:00,oojamaflip123,"Wait, even Englands bowlers are openers now? I thought Stokes opening was mental but apparently everyone is a secret opening bat",3
2020-10-13T16:10:13+00:00,ramraj1996,Treat to watch Chawla bowling,1
2020-10-13T16:10:13+00:00,Bazzingatime,KL even on that orange cap list has those dead eyes,5
2020-10-13T16:10:18+00:00,,[deleted],1
2020-10-13T16:10:23+00:00,kpranar,"Welp, time to clench the backside.",1
2020-10-13T16:10:25+00:00,BurntOutIdiot,"As I said before, Bairstow's wicket is key",6
2020-10-13T16:10:36+00:00,smokeshishaplayfifa,"*Boundary tehn single, good cricket from Jonny- sunny ji*",7
2020-10-13T16:10:53+00:00,,Sweat is fine binga,0
2020-10-13T16:10:56+00:00,hurricane_news,I don't like where this is going....,5
2020-10-13T16:11:03+00:00,Niyazali_Haneef,My man Kanos is underappreciated in the polls.,3
2020-10-13T16:11:08+00:00,Freakysafal,"2 dancers opening for srh

One dances on the pitch other on tik tok",3
2020-10-13T16:11:11+00:00,TheFirstLane,Williamson 7% 😂,1
2020-10-13T16:11:13+00:00,,"One benefit of not having crowds in the stadium and consequently not having some Vuvuzela blowing shitheads ruining it for everyone else is that you get to hear the sound of the ball hitting the sweet spot.

That Bairstow boundary just now sounded so crisp.",1
2020-10-13T16:11:14+00:00,chut_has_no_religion,Piyush Halwa,0
2020-10-13T16:11:16+00:00,,Is it just me or do you guys also think Bairstow has the greatest bat speed in Cricket ever?,5
2020-10-13T16:11:17+00:00,smokeshishaplayfifa,Goti muh mai tha feeling,2
2020-10-13T16:11:24+00:00,Idontlikethisstuff,It's funny that I'd call someone bowling 78mph slow when watching cricket but I'd shit myself having to face it,7
2020-10-13T16:11:30+00:00,mexicomasala,Chahar bowling too short,3
2020-10-13T16:11:32+00:00,DonnieDarko2307,Chahar literally big brain moment with the sweat,3
2020-10-13T16:11:33+00:00,R-o_y,Chawla lolz,4
2020-10-13T16:11:34+00:00,WeaponX23X,Easy 3 when most of ur fielders are over 35,2
2020-10-13T16:11:36+00:00,oxfordcircus007,wtf? warner out of touch,0
2020-10-13T16:11:40+00:00,sahit24,Wtf! They were jogging the third.,3
2020-10-13T16:11:43+00:00,jasonj2232,If this was Watson and Rayudu that would've been a single,5
2020-10-13T16:11:44+00:00,klopparabia,Quite franckly this is a boring match,-7
2020-10-13T16:11:46+00:00,pratik1698,When star sports commentators SEX ....what will they say in bed ... AHHHHHH AHHHHHH or Dhoni DHONI DHONI...seems like they got orgasm saying dhoni lol,-5
2020-10-13T16:11:49+00:00,sahibosaurus,Jesus Christ this outfield is slow,3
2020-10-13T16:11:49+00:00,,"Eesh warner has not been timing it since the restart right, how did he get on in the England series anyone knows?",3
2020-10-13T16:11:50+00:00,Bazzingatime,"They ran 3 , Watto and Raydu wouldn't even run 1.5 in that time",11
2020-10-13T16:11:50+00:00,ExtraCarrotNoses,More than twice as many people think Warner more important than Bairstow?? Harsh imo,3
2020-10-13T16:12:10+00:00,exisiova,We've got a serial downvoter among us,5
2020-10-13T16:12:41+00:00,BurntOutIdiot,Why was that a wide?,1
2020-10-13T16:12:54+00:00,Parth_Bansal,Okay so Piyush Chawla has played just 25 ODIs for India. Don't know why but I felt that he would have played way more(atleast 100).....,-1
2020-10-13T16:12:58+00:00,hurricane_news,"A 3! Now that's something you don't see often That being said, have 5's occurred in this ipl?",1
2020-10-13T16:13:02+00:00,WoakesStokesFoakes,The downvoter is back bitches,-1
2020-10-13T16:13:03+00:00,XxBlackDuckPlierxX,How was that a wide and Dhoni's one ball?,2
2020-10-13T16:13:06+00:00,properzing,Warner taking a risk in the power play like it's 2017.,3
2020-10-13T16:13:29+00:00,Plastic-Season,"Whoever downvoter my comment, her mother is Gae (☉｡☉)!→ 
EDIT: rip me",-10
2020-10-13T16:13:29+00:00,Endgame2648,Wait. Did the Star sports Commentators said something about SEX?,-8
2020-10-13T16:13:32+00:00,,[deleted],-1
2020-10-13T16:13:38+00:00,Mr_Bean12,The only way to tire the downvoter is to not comment about it.,7
2020-10-13T16:13:39+00:00,oxfordcircus007,"dhoni's face wants to retire, but dhoni doesn't agree",-1
2020-10-13T16:13:41+00:00,LividProgrammer,So many downvotes lol. Is it a bot or a loser with no life.,10
2020-10-13T16:13:50+00:00,aditya_7726,CSK only need Pandey to play more than 15 balls and there winning chances increase.,4
2020-10-13T16:13:56+00:00,yolo_howla,I am now balancing the downvoted with upvotes,3
2020-10-13T16:13:58+00:00,smokeshishaplayfifa,"Good running,take singles in chahar's bowling",3
2020-10-13T16:14:01+00:00,lonelyisIand,cameraman seems to love rashid khan... don’t blame him,2
2020-10-13T16:14:22+00:00,,CSK should buy Rashid if the fans are too concerned about the average age.,3
2020-10-13T16:14:24+00:00,XxBlackDuckPlierxX,"**There is a downvoter here** 

To the downvoter

**Fuck Off**",9
2020-10-13T16:14:46+00:00,,3 overs in 15 mins.,-1
2020-10-13T16:14:47+00:00,Mr_Bean12,"Is thre stats on avg age of teams? We all know CSK is up, but would love to see how far?",-2
2020-10-13T16:14:50+00:00,mexicomasala,CSK's spinners hold key here,0
2020-10-13T16:14:57+00:00,WeaponX23X,Any mid season transfer news?,1
2020-10-13T16:15:18+00:00,,[deleted],-19
2020-10-13T16:15:20+00:00,,[deleted],-6
2020-10-13T16:15:23+00:00,9I54492AB6F9I,Downvote me senpai 🥰,-10
2020-10-13T16:15:29+00:00,Freakysafal,"If only Csk had Ashwin now

Wud have easily got that dangerous English wk opener",3
2020-10-13T16:15:39+00:00,saysikerightnowowo,Holy shit RCB bowlers having 7/10 dugout votes for best Indian bowler. What a surprise.,0
2020-10-13T16:15:42+00:00,lonelyisIand,"nice, I voted for jasprit bumrah too",1
2020-10-13T16:16:03+00:00,klopparabia,CSK matches are boring as fuck,-6
2020-10-13T16:16:04+00:00,rabid_monster,The thing is CSK is better than their current performance usually,1
2020-10-13T16:16:04+00:00,stylepandi,Hazlewood needs to play over bravo.,0
2020-10-13T16:16:06+00:00,poochi,🚨🚨🚨🚨Stop feeding the trolls and upvote every comment🚨🚨🚨🚨,4
2020-10-13T16:16:07+00:00,,"SRH has an all overseas core, Warner, Bairstow, Rashid, Williamson.",3
2020-10-13T16:16:11+00:00,,Chahal for test team bitches. Dude’s got incredible control. Wish he could slog a few though.,0
2020-10-13T16:16:43+00:00,,"The downvoter only gets power if we acknowledge it, a bloody wanker who likes KP's commentary",1
2020-10-13T16:16:46+00:00,WPHero,dont downvote me i'm thala supporter,4
2020-10-13T16:16:54+00:00,,Does anyone know if Raina will go into the auction pool next year?,0
2020-10-13T16:17:06+00:00,,"SRH bros , any players we should get on the mid season trade?",-2
2020-10-13T16:17:16+00:00,sahasamane_cheppali,"Wtf, there's no power supply at my place and I've been following score on Cricinfo. I see Vimal ad there in Telugu",3
2020-10-13T16:17:29+00:00,lonelyisIand,SEXY SAM CURRAN,4
2020-10-13T16:17:33+00:00,,Stop showing Rashid and start showing Sam Curran on camera 😍,10
2020-10-13T16:17:38+00:00,Defo_not_a_bot,YEAHHHHH,-1
2020-10-13T16:17:38+00:00,poochi,Sam Karan Arjun returns!!,0
2020-10-13T16:17:39+00:00,,I think CSK specifically exists to piss my existence off. Everything about them was irritating and then they went and bought National Enemy Sam Curran.,-4
2020-10-13T16:17:41+00:00,BurntOutIdiot,Yessssss,1
2020-10-13T16:17:42+00:00,chut_has_no_religion,Mere Curran arjun will cum. What a WICKET,5
2020-10-13T16:17:45+00:00,Zer0wned1,SAMUEL CURRAN,0
2020-10-13T16:17:46+00:00,Sarthak61199,Yaaass,-1
2020-10-13T16:17:46+00:00,Naan6,Good game guys,3
2020-10-13T16:17:48+00:00,Idontlikethisstuff,"At what point do we say David Warner's been underwhelming this season?

Really lacked fluency",1
2020-10-13T16:17:53+00:00,,[deleted],-5
2020-10-13T16:17:53+00:00,66problems99,ENGLISH BOWLERS AND WARNER,12
2020-10-13T16:17:55+00:00,,AHHHH,-1
2020-10-13T16:17:56+00:00,wonderwoman0621,This is it. The beginning of the end,1
2020-10-13T16:17:58+00:00,Truthgamer2,Game over see y’all next time,-3
2020-10-13T16:18:04+00:00,kpranar,SCURRAN!!!,1
2020-10-13T16:18:04+00:00,kapilfan,Kadai Kutty Singham ...,3
2020-10-13T16:18:06+00:00,,welp,-1
2020-10-13T16:18:09+00:00,sahibosaurus,"Get Kanos in, this is his type of match",5
2020-10-13T16:18:09+00:00,oxfordcircus007,F,1
2020-10-13T16:18:10+00:00,,welp,0
2020-10-13T16:18:12+00:00,blumirage,"Pack it up guys, we're done here. Congrats to CSK for the win",2
2020-10-13T16:18:15+00:00,kmadnow,That's the game,3
2020-10-13T16:18:30+00:00,Bluebillion,Sam Curran. My favorite white cricketer,3
2020-10-13T16:18:31+00:00,mattytmet,Scurran you little rascal,3
2020-10-13T16:18:32+00:00,Shakuni_,"Warner Gone, good to see SRH struggle as well. Not Fair that one team relying on openers bat well and other one suck balls",2
2020-10-13T16:18:35+00:00,zaphod42244,Makes things happen,1
2020-10-13T16:18:35+00:00,Bazzingatime,"If this match ends early ,imma start a show , Mirzapur or Patal Loke ?What do you recommend?",1
2020-10-13T16:18:38+00:00,,Unlucky dismissal,-2
2020-10-13T16:18:38+00:00,Sworup58,How do you get hurried by a Curran Delivery???,-1
2020-10-13T16:18:39+00:00,klopparabia,One of the reasons I like to see CSK getting spanked is because of how easily their fans get triggered. Look at my comment history,-6
2020-10-13T16:18:40+00:00,,"Gg Bois, it was fun while it lasted",-2
2020-10-13T16:18:41+00:00,ExtraCarrotNoses,The GOAT all-rounder strikes again,0
2020-10-13T16:18:43+00:00,NeenaMargarita,It bounced on Warner's pad right? Is it still out?,-3
2020-10-13T16:18:47+00:00,TheWyzim,Warner still can’t play English bowlers even though these are not English wickets smh,0
2020-10-13T16:18:50+00:00,Truthgamer2,Send Kane above Pandey,-2
2020-10-13T16:18:56+00:00,CricketMatchBot,"**3.3** Curran to Warner, OUT, **inside edge onto pad and Curran takes it!** Full and into middle stump. Looks to swipe it behind point and gets it straight onto his front pad which was out in the leg side. Pings back up for Curran who has a short sprint to his left and an easy catch **23-1**

DA Warner c &amp; b Curran 9 (13b 0x4 0x6) SR: 69.23",-2
2020-10-13T16:18:56+00:00,,Warner garu getting dismissed once again in unlucky ways,1
2020-10-13T16:18:57+00:00,,[deleted],-1
2020-10-13T16:18:57+00:00,Eric_Hitchmough87,"Warner's batting, bring on an Englishman to bowl.",4
2020-10-13T16:19:00+00:00,saysikerightnowowo,"Serial downvoter in a csk match thread. Whatta surprise, amirite?",6
2020-10-13T16:19:04+00:00,hurricane_news,"###########################
65 million years. Zap",0
2020-10-13T16:19:05+00:00,maverick_3001,Warner hasn't been impressive so far this IPL. Even his 50 came at a low SR than what is expected from him,-1
2020-10-13T16:19:07+00:00,Naan6,Manish Pandey and Williamson have to perform only way out,0
2020-10-13T16:19:09+00:00,vicky669,We finishing 7th this time:(,-2
2020-10-13T16:19:19+00:00,Freakysafal,Serial downvoters r die hard jadhav fans,6
2020-10-13T16:19:19+00:00,,[deleted],-1
2020-10-13T16:19:20+00:00,thedeatheater1410,Kanos please,-1
2020-10-13T16:19:26+00:00,Mr_Bean12,Didnt realize Rohan Gavaskar is a commentator in this IPL. Has Sunny and Rohan commented together?,1
2020-10-13T16:19:27+00:00,v28priya,Sam Curran you cutie 😍,4
2020-10-13T16:19:32+00:00,Truthgamer2,Le Tuk Tuk Pandey has arrived,0
2020-10-13T16:19:40+00:00,yolo_howla,"Fuck, David garu",-2
2020-10-13T16:19:49+00:00,awfulJ,Sam Curran confirmed as Stuart Broad's son.,1
2020-10-13T16:19:49+00:00,dannyarr,Manish to hit every ball to fielders now,-2
2020-10-13T16:20:02+00:00,onion_uthappa,"And we havent even introduced our weapon of mass destruction, Shardul Thakur, yet.",1
2020-10-13T16:20:02+00:00,loki_made_the_mask,This Shyam Karan fellow should be considered for the Indian team,4
2020-10-13T16:20:04+00:00,ictfan10,"Remember the times when we had Thoko meter when Sidhu was in IPL?

yeah we need an intent meter for everytime someone speaks for it this year!",2
2020-10-13T16:20:05+00:00,BurntOutIdiot,"I've suggested this before already but I think we (India) should just keep Sam Curran. He's already in Dubai, how hard can it be? We'll just keep him and tell England to fuck off. They have all rounders coming out of their ears and don't even play him consistently. Let's just make him ours.",11
2020-10-13T16:20:09+00:00,Haunted4life,Curran sure loves the 4th over. Scored 22 off khaleel and takes Warner's wicket lol,4
2020-10-13T16:20:12+00:00,uravggstudent,"*wicket falls*

SRH FANS: gg game over

Seriously? C'mon.",8
2020-10-13T16:20:13+00:00,sam_ridhi,Rooting for srh to win,2
2020-10-13T16:20:24+00:00,limegreennalgene,yo can the downvoter chil,5
2020-10-13T16:20:24+00:00,Bazzingatime,"You guys shit on Pandey last time ,if he comes to form I'm starting an apology sub",7
2020-10-13T16:20:28+00:00,gr8astardd,Pandey hitting a 2nd ball boundary? What timeline is this?,8
2020-10-13T16:20:33+00:00,,"Theres ONE young lad in csk and that poor guy has to open the inning, hit some runs and come back again to take some wickets too cause all these oldies ain’t doing shit",9
2020-10-13T16:20:34+00:00,catinho99,Good everyone’s Dream11 captain gone,2
2020-10-13T16:20:34+00:00,,Warner's SR this season: 122,6
2020-10-13T16:20:35+00:00,Naan6,"Ppl saying send Williamson over Pandey clearly don’t understand the stats of Pandey batting at 4.

It’s also not the best idea to have all your foreign batsman up at the top. No one to stabilize the middle order",10
2020-10-13T16:20:44+00:00,Soi_Meaw,What a fine stallion Bairsteed is.,4
2020-10-13T16:20:49+00:00,,Damn these shameless serial downvoters are back,6
2020-10-13T16:20:55+00:00,rmU6Rz0ztS,"KKR and SRH on downward curve, RR on the up. Who'll finish fourth guys?",2
2020-10-13T16:20:56+00:00,ravindra_jadeja,"They sent Manish Pandey again!!!

I am done with this match..

Enjoy the victory CSK fans....",4
2020-10-13T16:20:56+00:00,anaksr1414,Yeah Manish. Ffs prove me wrong today.,5
2020-10-13T16:21:06+00:00,Lionheart008,If only rayudu ran that fast between the wickets as he ran after the ball,1
