Timestamp,Comment,Upvotes
2024-04-10T17:42:20+00:00,"For a bowler with limited variations( maybe just one - wide loopy legbreak), chahal does fool many batsmen till now.",7
2024-04-10T17:42:26+00:00,Shit. This RR team is too OP and I love them!!,7
2024-04-10T17:42:27+00:00,"SRH has to be one of the worst players against spin

Edit: Meant, SRK, this shit autocorrected me",1
2024-04-10T17:42:28+00:00,I don't even remember who sk Trivedi was,3
2024-04-10T17:42:32+00:00,"Gill and Kohli shouldn't be the anchors with Sudharsan and Patidar in their side

Just become careless and take up the role that Rohit has taken, than trying the KL Rahul role",6
2024-04-10T17:42:34+00:00,Who tf is Trivedi ?,2
2024-04-10T17:42:36+00:00,GT had an insane batting lineup last couple of seasons. Now its just a bunch of local players and Gill? 😅,7
2024-04-10T17:42:38+00:00,SK Trivedi god that brings back so many memories,1
2024-04-10T17:42:40+00:00,Umpire's call,2
2024-04-10T17:42:46+00:00,fraud tewatia running ekka dukka(ones and twos) like koach,3
2024-04-10T17:42:47+00:00,Samson using DRS for more timeouts genius move,7
2024-04-10T17:42:47+00:00,You fucking idiots,4
2024-04-10T17:42:47+00:00,Clown review,3
2024-04-10T17:42:50+00:00,Samson what's with the shitty reviews tonight babe,5
2024-04-10T17:42:50+00:00,"Purple Chahal will dominate IPL, play in WC, fox every single team, until he sees Maxwell, who has failed in the IPL, in the final hit him for 60 off 2 overs",10
2024-04-10T17:42:50+00:00,That looked like it was sliding down the leg,3
2024-04-10T17:42:51+00:00,Two of the stupidest reviews taken by RR Today,2
2024-04-10T17:42:53+00:00,"Easy win for RR, hope they don't screw this up",2
2024-04-10T17:42:53+00:00,"How tf did Rcb fumble chahal, it's so ridiculous even for Rcb standards",12
2024-04-10T17:42:53+00:00,WTF SANJU,3
2024-04-10T17:42:53+00:00,"As a Pbks fan I've worried what if Srk turns into a prime Polly at GT, I don't have any worries now, Shashank is such an upgrade 😌",3
2024-04-10T17:42:57+00:00,...I don't think so Sanju,1
2024-04-10T17:42:58+00:00,Chahal is literally topping the charts back to back and people here calling him one trick pony,2
2024-04-10T17:42:59+00:00,"Missing Miller - the killer. 
Hope he recovers soon.",2
2024-04-10T17:43:01+00:00,Horrible review ![img](emote|t5_2qhe0|30516)![img](emote|t5_2qhe0|21498),3
2024-04-10T17:43:04+00:00,Should have send rashid dude have displayed many times that he can bat,1
2024-04-10T17:43:07+00:00,"That dismissal of Gill was very similar to the dismissal of Shahid Afridi by Sachin 

In that dismiss Thala told Sachin to bowl a similar line to what Maharaj said to Chahal",4
2024-04-10T17:43:07+00:00,wtf are they doing,1
2024-04-10T17:43:09+00:00,Tewatia is Rinku with restrictions on playing on the off side and still not as impressive as him,5
2024-04-10T17:43:10+00:00,Is this finally the year Yuzi gets to play a WC?,2
2024-04-10T17:43:12+00:00,Need to find out who does Rashid's hair and beard,5
2024-04-10T17:43:13+00:00,Sanju is just wasting time guys.,1
2024-04-10T17:43:18+00:00,This is why wicketkeeper captains need to have a spine... You can't get carried away with enthusiasm.,10
2024-04-10T17:43:22+00:00,"Chahal takes almost 2 wickets for RR every match damn. Biggest L of RCB is letting chahal go, the only spinner to do well in their road of a stadium too",7
2024-04-10T17:43:24+00:00,Samson doing everything good except for reviews,10
2024-04-10T17:43:24+00:00,I a pbks fan knows sharukh cant hit anywhere except the V. He cant play short ball nor over covers not the cut shot. He is so overrated. Lets see if GT magic works on him or not,12
2024-04-10T17:43:30+00:00,Why are they not sending Rashid Khan at 7??,2
2024-04-10T17:43:35+00:00,Tewatia and SRK combinedly should play samson's kind of inning here.,3
2024-04-10T17:43:36+00:00,Ffs why tf you need Ultraedge,4
2024-04-10T17:43:38+00:00,Umpire call?,2
2024-04-10T17:43:41+00:00,Rubbish review.,7
2024-04-10T17:43:42+00:00,What’s with the foot fetish of these umpires,2
2024-04-10T17:43:42+00:00,Blind umpire strikes,2
2024-04-10T17:43:43+00:00,"how did rr never won trophy after 2008?

rcb i can understand - shit batting and all",18
2024-04-10T17:43:45+00:00,The impact will be outside leg.,6
2024-04-10T17:43:49+00:00,Even CSK at Fortress Chepauk won't be able to stop this team,17
2024-04-10T17:44:05+00:00,"impact outside, :-(",1
2024-04-10T17:44:12+00:00,"GT fucked up by sending Wade at 3 and Sai at 1

Wade should've opened, he would've atleast given them a 10 rpo start or would've gone without wasting any balls in the pp

A duck in PP is way better than going at 115 SR in the pp",23
2024-04-10T17:44:13+00:00,That Chahal flipper is thing of beauty.,3
2024-04-10T17:44:18+00:00,"Slow over rate ❌
Slow DRS rate ✅",11
2024-04-10T17:44:19+00:00,Inshallah review this is,2
2024-04-10T17:44:22+00:00,This heartbeat audio is kinda cringe tbh,6
2024-04-10T17:44:25+00:00,Butler is racist btw,-4
2024-04-10T17:44:26+00:00,What a horrible batting stance and technique to play spin how did they even reach at this level,5
2024-04-10T17:44:28+00:00,Time's ticking ahh beat,1
2024-04-10T17:44:29+00:00,Garbage review.,5
2024-04-10T17:44:34+00:00,"Even being a csk fan I am rooting for this RR team. Shows more than big names, you need to have the right combination of players who are driven",5
2024-04-10T17:44:35+00:00,Gill playing with this GT batting lineup is good for Indian cricket. GT won’t be winning shit for a while though.,6
2024-04-10T17:44:36+00:00,"that wasn't a good review, samson sir",3
2024-04-10T17:44:38+00:00,Damn Matthew Wade taking the drink from the fridge. Prolly the first time I saw someone taking it,9
2024-04-10T17:44:43+00:00,Are they editing the delivery?,5
2024-04-10T17:44:43+00:00,RR was 139 after 16th over,6
2024-04-10T17:44:44+00:00,Review wasted,5
2024-04-10T17:44:45+00:00,Rajasthan at Jaipur >>> Your fav team that rigs pitches on their home ground ...,9
2024-04-10T17:44:46+00:00,"smell gray trees society work memory squalid longing coordinated chunky

 *This post was mass deleted and anonymized with [Redact](https://redact.dev)*",10
2024-04-10T17:44:46+00:00,Sanju really needs to listen to his bowlers a little less,10
2024-04-10T17:44:51+00:00,"For all his strengths, DRS isn’t one for Sanju.",13
2024-04-10T17:44:52+00:00,Samson as a keeper should not be taking that review under any circumstances,9
2024-04-10T17:44:52+00:00,So srk has learned nothing in 4 years I see. Typical,7
2024-04-10T17:45:07+00:00,Req run rate went up even after scoring 14 runs 😭,3
2024-04-10T17:45:12+00:00,My gut feeling is Avesh getting tonked.,2
2024-04-10T17:45:13+00:00,repeat of world cup 2023 only to lose to the yellow team,2
2024-04-10T17:45:15+00:00,scenes if they need a review in the last 5 and they've blown them all for the memes,7
2024-04-10T17:45:16+00:00,"Scenes when someone is out plumb but given not out, and they have no reviews left.",3
2024-04-10T17:45:18+00:00,Chahal should have simply declined the review.,4
2024-04-10T17:45:22+00:00,No way in hell Chahal didn't know it was going down leg,5
2024-04-10T17:45:24+00:00,If I ever let go of someone it'd be for playing this song,1
2024-04-10T17:45:24+00:00,Come on GT![img](emote|t5_2qhe0|28120),1
2024-04-10T17:45:24+00:00,Irrespective of the result I hope RR learns how to use reviews from this game. Both their reviews were senseless today,1
2024-04-10T17:45:26+00:00,Rahul and SRK batting together 😏,3
2024-04-10T17:45:30+00:00,Shahrukh about to teach GT why he was released.,3
2024-04-10T17:45:30+00:00,Not missing meme esque bangla bros review,1
2024-04-10T17:45:32+00:00,Rahul and SRK batting together 😏,1
2024-04-10T17:45:36+00:00,"Whenever there is delay in ball tracking, i imagine someone is sitting and editing video in MS Paint like Bobby Deol did in the movie Soldiers",2
2024-04-10T17:45:38+00:00,"RR have a good looking Squad: Jos, Boult, Hetmeyer, Parag, Avesh, Samson, Maharaj",1
2024-04-10T17:45:43+00:00,Why is he bowling Ash now?,1
2024-04-10T17:45:44+00:00,"In Marathi, Wade means madness.",2
2024-04-10T17:45:49+00:00,This is the over they have to go all out,2
2024-04-10T17:45:50+00:00,"Namma Bengaluru tommorow
Can't wait for the statpadding",2
2024-04-10T17:45:55+00:00,The highest wicket taker for India in T20is and IPL has never played a t20 wc. Absolute WILD,4
2024-04-10T17:45:57+00:00,Long time no see Shahrukh,1
2024-04-10T17:45:58+00:00,They have played an over combined but they still have to slog every single delivery.,1
2024-04-10T17:46:00+00:00,Hope avesh won't do a cotrell,4
2024-04-10T17:46:01+00:00,Ashwin again.... ! Man Samson has some guts,4
2024-04-10T17:46:07+00:00,"Yesterday 67 were required of 24, the winning team won by 2 runs. Let's see what happens today.",2
2024-04-10T17:46:09+00:00,That LBW was hitting the stumps - but only after it deflected off the front pad. lol.,2
2024-04-10T17:46:11+00:00,"MI and RR are just XOR of each other, dominating half of the tournament turn by turn",4
2024-04-10T17:46:16+00:00,"Heck of a ball watching batsman coming out by Chahal, heck of a stumping by Samson",1
2024-04-10T17:46:16+00:00,With Jaiswal so out of form. RR can pull a KKR and send Chahal to open,3
2024-04-10T17:46:18+00:00,Cameraman's zoomed in on that girl 3 times now,3
2024-04-10T17:46:19+00:00,Why ash when you have avesh boult and kuldeep,1
2024-04-10T17:46:24+00:00,Pinnaadi ready,2
2024-04-10T17:46:24+00:00,Why are these two taking singles? Lmao,3
2024-04-10T17:46:24+00:00,"Chahal might be a liability in the field and batting. But he’ll more than likely to make it up with his bowling. He should atleast be in squad, if not the playing 11 for t20wc",1
2024-04-10T17:46:26+00:00,We are nothing without Miller and Gill,4
2024-04-10T17:46:27+00:00,Lmao RR definitely trust Chahal as a fielder. Either gets subbed or swapped out overtime he's done bowling his quota,3
2024-04-10T17:46:36+00:00,Two boult one Ashwin one sen. Or are they gonna bowl avesh?,1
2024-04-10T17:46:41+00:00,Aswin -Sanju speaking in Tamil and my man SRK listening to all of it lol,7
2024-04-10T17:46:43+00:00,Chahal is a goddamn chess player,1
2024-04-10T17:46:44+00:00,NGL.. Extremely fun first session of a Test!,1
2024-04-10T17:46:47+00:00,shotttt,1
2024-04-10T17:46:48+00:00,"Tewatia is from Dhoni school chasing 

""Taking it deep""",6
2024-04-10T17:46:50+00:00,Atleast Gill won a trophy before this happened to GT,5
2024-04-10T17:46:51+00:00,Shot,1
2024-04-10T17:46:51+00:00,Raw power![img](emote|t5_2qhe0|29262)![img](emote|t5_2qhe0|8783),3
2024-04-10T17:46:52+00:00,Hey hey hey did you guys see. Teawatia played backfoot punch towards cover 😯😯,1
2024-04-10T17:46:53+00:00,Need more hits like this,3
2024-04-10T17:46:56+00:00,"he has 1 sen 2 boult and 1 avesh to finish ,,  why give to Ash now?",2
2024-04-10T17:46:57+00:00,Boult avesh boult,2
2024-04-10T17:47:00+00:00,wow SRK.,3
2024-04-10T17:47:03+00:00,What kind of cricket GT is playing?? Kill me now,3
2024-04-10T17:47:04+00:00,GT is right in this with that six. 51 off 21 is done pretty often in IPL these days.,3
2024-04-10T17:47:04+00:00,"I mean this was expected. Ashwin is getting smashed tonight, don't know why he got the last one to complete his spell",5
2024-04-10T17:47:05+00:00,Smart by Samson to put in a spinner to 2 guys who can't play spin,3
2024-04-10T17:47:06+00:00,Same ask as yesterday’s game,2
2024-04-10T17:47:08+00:00,Are they really streaming 'fiddy shades of grey' on jio.? What are they actually showing....end credits in slow motion for 2 hours?,3
2024-04-10T17:47:08+00:00,"Sanju saying ""pinnadi iruda dei"" in perfect tamil..
T : stay back bro",10
2024-04-10T17:47:10+00:00,PBKS fans in shambles,7
2024-04-10T17:47:11+00:00,When you thought you are bowling to Vijay but he turned out to be Don.,7
2024-04-10T17:47:16+00:00,Ash Anna please win this game 🙏🏻,3
2024-04-10T17:47:18+00:00,It would be really fuckedup if we lose this now....,12
2024-04-10T17:47:22+00:00,No respect for older Tamil colleague,13
2024-04-10T17:47:30+00:00,Now I know what RCB fans feeling since 2008,5
2024-04-10T17:47:31+00:00,Pbks 👁️👁️ 😮🫨,5
2024-04-10T17:47:37+00:00,"Are fans really defending even this inning from Gill? Maybe they are still stuck with the 'catch up later' mindset, not realising it fucks over the team more times than it helps.",-7
2024-04-10T17:47:37+00:00,Vaanga Anna!!,3
2024-04-10T17:47:39+00:00,Wtf is anna doing,5
2024-04-10T17:47:40+00:00,Yeah more like this SRK,3
2024-04-10T17:47:43+00:00,Ash bowling absolute dross.,3
2024-04-10T17:47:43+00:00,This Shahrukh fella looks huge,2
2024-04-10T17:47:43+00:00,Take this deep Bois,1
2024-04-10T17:47:44+00:00,Ash anna pls bowl offbreaks sometimes.,1
2024-04-10T17:47:44+00:00,Ash Anna's carrom balls are getting tonked today,2
2024-04-10T17:47:46+00:00,This is the one matchup that SRK can take on in a spinner. Maybe I'd have bowled Maharaj,3
2024-04-10T17:47:49+00:00,Don't talk in Tamil while SRK is playing,1
2024-04-10T17:47:49+00:00,Ash anna bowling trash,2
2024-04-10T17:47:49+00:00,"GT can still win it. Given Tewatia, SRK and Rashid Khan",4
2024-04-10T17:47:50+00:00,Bolt sucks at the death overs no? Would you go with him?,4
2024-04-10T17:47:52+00:00,Chaiya Chaiya \*intensifies*,4
2024-04-10T17:47:52+00:00,Ugh another last over match coming,4
2024-04-10T17:47:56+00:00,Ash anna under pressure ![img](emote|t5_2qhe0|8781)![img](emote|t5_2qhe0|28120),3
2024-04-10T17:47:58+00:00,Anna getting pumped,1
2024-04-10T17:48:00+00:00,Is SRK finally gonna perform after all these years.,3
2024-04-10T17:48:03+00:00,If buttler leaves towards the end then what are our remaining option for openers,6
2024-04-10T17:48:04+00:00,"its still pretty doable for gt

3 overs and 50 runs is very doable with two hitters on crease",2
2024-04-10T17:48:10+00:00,Anna just don't give runs annna....,3
2024-04-10T17:48:12+00:00,Shah Rukh with that r/cricket cam in his eyes,2
2024-04-10T17:48:16+00:00,SRK kinda looks like Hardik Pandya under his helmet,2
2024-04-10T17:48:16+00:00,Avesh need to bring out all the tricks in his arsenal once again.,3
2024-04-10T17:48:20+00:00,Ash just never bowls his stock ball anymore huh,3
2024-04-10T17:48:21+00:00,Ash Anna looking really ordinary today.,3
2024-04-10T17:48:21+00:00,Dam elder abuse this is (idk SRKs age),0
2024-04-10T17:48:22+00:00,"PBKS merchant and ex PBKS player bashing RR

Nothing new

Can't wait for Saturday El Clasico (PBKS vs RR)",13
2024-04-10T17:48:26+00:00,How big is Shahrukh,6
2024-04-10T17:48:27+00:00,Only problem is them having no batting left.,2
2024-04-10T17:48:29+00:00,Dude is clipping Anna today 😱,3
2024-04-10T17:48:29+00:00,Ash has been bowling rubbish lately.,9
2024-04-10T17:48:36+00:00,47(20)? doable,1
2024-04-10T17:48:37+00:00,"Has anyone noticed that spot on Omarzai's Beard 

It just stands out the more i see him",6
2024-04-10T17:48:37+00:00,Need a six here,0
2024-04-10T17:48:42+00:00,TN player vs TN player,5
2024-04-10T17:48:44+00:00,SMS goes absolutely silent when the opposition team scores. Haha love it.,5
2024-04-10T17:48:44+00:00,Anna is focusing more in his commentary career this IPL,11
2024-04-10T17:48:44+00:00,"Damn, there was hype around SRK during 2020-21. What happened to him?",7
2024-04-10T17:48:45+00:00,RR still can win if don't bowl Avesh,1
2024-04-10T17:48:45+00:00,"From roasting someone live to playing for GT, that ""Gian hai app"" guy really came a long way. Also didn't know his name was Shahrukh",5
2024-04-10T17:48:48+00:00,I’m always in for SRK comebacks,8
2024-04-10T17:48:48+00:00,It's time to bring your trump card Anna. Mankad him and  finish this game asap,26
2024-04-10T17:48:54+00:00,Come on SRK if you win us this match I will watch Pathaan again. Ohh wait…,21
2024-04-10T17:49:00+00:00,GT  gonna chase it,1
2024-04-10T17:49:00+00:00,Tewatia flexing his off side game,13
2024-04-10T17:49:02+00:00,Don't give me hopes I somehow just accepted defeat,9
2024-04-10T17:49:02+00:00,This game is going in a similar fashion to the first two games for RR.,8
2024-04-10T17:49:03+00:00,Fucked.,5
2024-04-10T17:49:09+00:00,"Ashwin first 2 overs 10 runs

Next 2 overs 30 runs",8
2024-04-10T17:49:10+00:00,GT got this,1
2024-04-10T17:49:12+00:00,This match seems super fishy,3
2024-04-10T17:49:15+00:00,Fuck me... Anna.. Wtf you on,2
2024-04-10T17:49:16+00:00,Rashid can tonk a few too.. This ain't over by any stretch,7
2024-04-10T17:49:16+00:00,Scientist Anna/s,2
2024-04-10T17:49:17+00:00,Tewatia has shots on the OFF SIDE???,7
2024-04-10T17:49:18+00:00,ICE MAN COMETH,2
2024-04-10T17:49:18+00:00,"Yeah GT still in match, shouldn't have made a spinner bowl here when player will only intend to hit",5
2024-04-10T17:49:19+00:00,this mf kohli made me believe any team can chase 40 runs in 3 overs 😭,7
2024-04-10T17:49:19+00:00,"Oh my goddd

jay shah script again ?!?",2
2024-04-10T17:49:19+00:00,Ash Anna making sure no one asks him to play in 20-20 wc :D,9
2024-04-10T17:49:20+00:00,People here convinced me Tewatia was a leg side bully.,8
2024-04-10T17:49:21+00:00,3 over 40 is very much doable,3
2024-04-10T17:49:22+00:00,We are fucked,0
2024-04-10T17:49:23+00:00,Ash needs to stick to what he does best. giving advice to people,4
2024-04-10T17:49:26+00:00,Bowl Kuldeep or it'll be to late for RR,3
2024-04-10T17:49:26+00:00,GT fans... you guys've got this,3
2024-04-10T17:49:28+00:00,Anna thinks IPL is his personal laboratory.,12
2024-04-10T17:49:29+00:00,Ooof could be dangerous here. Aah in death wasn't a great idea when he have overs of Avesh and Boult left,4
2024-04-10T17:49:29+00:00,We gonna bottle this aren't we,2
2024-04-10T17:49:32+00:00,SRK should have come when Manohar came,3
2024-04-10T17:49:35+00:00,"If shami was a batsman with full head of hair and slightly darker complexion, he'd look like tewatia",3
2024-04-10T17:49:36+00:00,"tweatia 5 sixes is the most iconic ipl moment imo. 

rinku still was performing extremely before that games was generally well known. 

tewatia was so suprised especially since everyone was shitting on him",6
2024-04-10T17:49:39+00:00,Why Avesh 😭,1
2024-04-10T17:49:40+00:00,"So long as Tewatia is still in, GT can do it.",3
2024-04-10T17:49:41+00:00,"I'll repeat umpteenth time.

Sanju should've trusted Maharaj",2
2024-04-10T17:49:41+00:00,I feel RR got 20 runs less,2
2024-04-10T17:49:42+00:00,Nvm Samson fucked up bowling an offie,1
2024-04-10T17:49:42+00:00,Rr has to lose this one they've won enough the script has to be followed,1
2024-04-10T17:49:43+00:00,gt will win ig,3
2024-04-10T17:49:45+00:00,RR will bottle this calling it,0
2024-04-10T17:49:46+00:00,First time I see Tewatia playing offside,3
2024-04-10T17:49:47+00:00,"Tewatia hits on the offside. Apocalypse is coming, run for the hills.",2
2024-04-10T17:49:48+00:00,Jay Shah > Christopher Nolan,4
2024-04-10T17:49:50+00:00,"Tewatia scoring a boundary on offside?

WOW",8
2024-04-10T17:49:50+00:00,"We don't have a death bowler. 
Ball's wet. 
We're fucked. 
What I'll hate more is getting tonked by SRK. 
And Tewatia hates us.",3
2024-04-10T17:49:51+00:00,GT’s game to lose now![img](emote|t5_2qhe0|8783),2
2024-04-10T17:49:55+00:00,Fuck you RR. Don't you dare me disappoint me tonight,3
2024-04-10T17:49:55+00:00,"If RR loses this, it’ll start their losing streak",6
2024-04-10T17:49:56+00:00,"SRK looks like the ""Gian hai aap guy"" but with short hair",6
2024-04-10T17:49:58+00:00,Ashwin’s last over got hammered so bad,3
2024-04-10T17:50:00+00:00,Seeing tewatia hitting on the off side for the first time cuz haven't followed him much previously,6
2024-04-10T17:50:01+00:00,Why is there no global commentary today on jiocinema?,2
2024-04-10T17:50:04+00:00,The only problem is that RR just needs to take one wicket and Rashid Khan is the only somewhat good batter left,9
2024-04-10T17:50:06+00:00,Sanju please cook,2
2024-04-10T17:50:07+00:00,Avesh what the fuck?,3
2024-04-10T17:50:07+00:00,"> SRK should have come when Manohar came

How the turntables",2
2024-04-10T17:50:11+00:00,Ashwin best death bowler for a reason 🔥,1
2024-04-10T17:50:13+00:00,"The commentators hype up one-sided MI, CSK or RCB games yet show no excitement for this cracker. The same thing happened during the RR v DC game where DC almost pulled off a blinder and we're actually on top at one point during the chase.",10
2024-04-10T17:50:14+00:00,Samson and Ashwin speaking Tamil… in front of Shahrukh? Dumbos,16
2024-04-10T17:50:16+00:00,"Very poor call from Sanju to bowl Ash at this stage,,, now they have give a whif for GT",11
2024-04-10T17:50:24+00:00,GTs match to lose from here. With Rashid Khan left. They shd comfortably win this.,7
2024-04-10T17:50:33+00:00,"Koach :- plays ipl with utmost sincerity.


Ashwin:- cosplays as Einstein and experiments during ipl.",13
2024-04-10T17:50:33+00:00,Lord Avesh is about to be an impact player for GT,8
2024-04-10T17:50:35+00:00,Dj is firey,7
2024-04-10T17:50:36+00:00,Tewatia of 2022 would take this home.,6
2024-04-10T17:50:42+00:00,"Tewatia gonna do something crazy here , can sense it..",2
2024-04-10T17:50:44+00:00,Next over decides everything... We need a wicket or else SRK and Lord Tewatia are going to do it,3
2024-04-10T17:50:53+00:00,Avesh McGrath please help us,7
2024-04-10T17:50:55+00:00,This is the Khan vs Khan battle I’m actually interested in,8
2024-04-10T17:50:59+00:00,I want Avesh to be tonked for 26 runs,1
2024-04-10T17:51:00+00:00,Tewatia gonna bash him,1
2024-04-10T17:51:00+00:00,"Boult will bowl only 3.
Trust your lead bowler more.",4
2024-04-10T17:51:01+00:00,"3 overs and 42 runs with two hitters

yeah gt winning",1
2024-04-10T17:51:02+00:00,Bowl fast before the fielding restriction.,3
2024-04-10T17:51:05+00:00,"Ash anna sprayed a lot down leg today. 
Too many carrom ball experiments",7
2024-04-10T17:51:09+00:00,Can't believe Boult will end up an over short.,2
2024-04-10T17:51:11+00:00,"Cmon Twetia, show us that finisher magic",2
2024-04-10T17:51:14+00:00,Avesh will take a wicket....,2
2024-04-10T17:51:14+00:00,Don't know which Avesh will show up today.,9
2024-04-10T17:51:15+00:00,14 an over sounds like Child's play these days lol,10
2024-04-10T17:51:15+00:00,Let him cook,3
2024-04-10T17:51:18+00:00,How slow is Samson going here,6
2024-04-10T17:51:25+00:00,RCB-MI tomorrow is being hyped as much as India-Pak was lol,9
2024-04-10T17:51:28+00:00,Avesh is a Khan but looks like he goes to a Bhandara every week,2
2024-04-10T17:51:28+00:00,They are missing sandeep in the middle,4
2024-04-10T17:51:31+00:00,"Avesh, Sen would need to bowl very well, to take this game home.

Missing Burger, Sandeep Sharma dearly, I see :)",2
2024-04-10T17:51:33+00:00,"Stack the leg side

That mfer Tewatia is going to trigger, lineup any length and smack it on his leg side

Just bowl wide Yorkers or slow bouncers",2
2024-04-10T17:51:39+00:00,"Boult can be really really shit in the death

And avesh has been good at the end so not a bad choice really",8
2024-04-10T17:51:43+00:00,I honestly don't see how RR doesn't win this IPL. Leagues above everyone else.,1
2024-04-10T17:51:45+00:00,Ashwin changed the game for both the teams,5
2024-04-10T17:51:47+00:00,Bruh they should've used boult for 4 overs,10
2024-04-10T17:51:51+00:00,Come on ICT Avesh. Wake up your inner demon (the one that gets smashed),1
2024-04-10T17:51:57+00:00,game is really going to come down to fielding isn't it.,4
2024-04-10T17:52:04+00:00,Is it me or ashwin losses his length like fall under pressure very fast when someone attacks him,7
2024-04-10T17:52:07+00:00,Avesh Khan Best finisher for last season,1
2024-04-10T17:52:10+00:00,"“DJ is fire”

“The stadium music is so irritating”

Never change r/Cricket.",15
2024-04-10T17:52:13+00:00,Where is Sandeep Sharma?![img](emote|t5_2qhe0|29261),3
2024-04-10T17:52:13+00:00,Good bowling...,2
2024-04-10T17:52:27+00:00,SRK gonna hit this ball,3
2024-04-10T17:52:32+00:00,We're bottom even in the fair play award table😭,22
2024-04-10T17:52:39+00:00,Out,3
2024-04-10T17:52:39+00:00,Bless my eyes! Did I see tewatia playing on the off side for two consecutive deliveries!?,12
2024-04-10T17:52:40+00:00,Seems like tewatia read the comments on reddit and decided to show his off side hitting abilities,14
2024-04-10T17:52:49+00:00,Who gives a fuck about the fair play awards?,12
2024-04-10T17:52:50+00:00,We sold that boy for a reason,15
2024-04-10T17:52:50+00:00,Oh that's so DEAD,8
2024-04-10T17:52:51+00:00,Avesh Mcgrath 🤲🤲🤲,6
2024-04-10T17:52:53+00:00,"Woah,    

they talking about Women’s college basketball???? In IPL????? Hhaaaaa",10
2024-04-10T17:52:55+00:00,Haha wtf,1
2024-04-10T17:52:58+00:00,Avesh is Bumrah 2.0,3
2024-04-10T17:52:58+00:00,Avesh has done really well this season..,3
2024-04-10T17:52:59+00:00,avesh you mf,3
2024-04-10T17:53:03+00:00,Rashid gonna pull this off,1
2024-04-10T17:53:03+00:00,That is out surely,3
2024-04-10T17:53:04+00:00,Lmaoo I wouldn't call that beautiful bowling,3
2024-04-10T17:53:04+00:00,What a ball. Lower full toss and all,3
2024-04-10T17:53:05+00:00,Did umpire just give an lbw without reviewing it first 😳,3
2024-04-10T17:53:08+00:00,Sunny G with his racist Jamaican accent is the ultimate troll,6
2024-04-10T17:53:08+00:00,Where is the guy? who was saying don't bowl Avesh,6
2024-04-10T17:53:09+00:00,🙄,1
2024-04-10T17:53:09+00:00,My prediction is correct...🤩,1
2024-04-10T17:53:09+00:00,Fraudukh Khan,4
2024-04-10T17:53:11+00:00,Saying arsenal with that accent just sounds like a**ehole,0
2024-04-10T17:53:12+00:00,Never thought I'd hear the commentators talking about NCAA women's basketball during the IPL,4
2024-04-10T17:53:12+00:00,Don’t do the accent pls Sunny G,6
2024-04-10T17:53:12+00:00,That's plum bud. That's bullseye,4
2024-04-10T17:53:16+00:00,Missing full toss 😂😂,7
2024-04-10T17:53:16+00:00,timber!!!,3
2024-04-10T17:53:17+00:00,Who gonna defeat RR ? CSK ?,5
2024-04-10T17:53:18+00:00,Dude got out to one of the trashiest balls of all time. Even Chahal would've flicked that.,12
