Timestamp,Comment,Upvotes
2024-04-10T16:42:28+00:00,guys hardik has been striking at 110-120 sr in his past few games. his t20 selection is up for debate,2
2024-04-10T16:42:28+00:00,"I'm gonna say it but Sachin and Ab de villers are better all format players than kohli in the only 2 formats that matter in my eyes , t20i's are played too infrequently and are too insignificant for me to give them too much weight",-1
2024-04-10T16:42:28+00:00,Sai heard y'all 🤣,4
2024-04-10T16:42:37+00:00,Finally my man sudarshan takes like 25 balls every match to get set,3
2024-04-10T16:42:42+00:00,class,2
2024-04-10T16:42:42+00:00,sai has 2 shots back foot cover drive and pull shot.,3
2024-04-10T16:42:43+00:00,"As soon as i have a go at Sudarshan, he starts hitting em, making me look like a tool.😂",9
2024-04-10T16:42:44+00:00,Sudarshan: And I took it (SR rate comments) personally,3
2024-04-10T16:42:46+00:00,"Oooooh misfield. 

Good shots, Chahal under pressure. If they can bash one of Chahal and Maharaj, they're good",3
2024-04-10T16:42:46+00:00,As soon as bro attacked the stumps,1
2024-04-10T16:42:49+00:00,"They're gonna chase it in 30 overs, easy victory for GT",8
2024-04-10T16:42:50+00:00,Sai playing protective shots,1
2024-04-10T16:42:50+00:00,Cahal getting cunted... This I don't want to 👀,3
2024-04-10T16:42:52+00:00,"With no Miller available, these two REALLY needed to go harder at the start. This saving the wicket and looking for the bad balls strategy won't really help in such a chase, but oh well.",6
2024-04-10T16:42:53+00:00,Great Platform. GT winning this in 18th. Strike rate merchants are bodied,1
2024-04-10T16:42:54+00:00,"GT cruising to a comfortable victory on a batting paradise, people spoke too soon about RR’s invincibility",0
2024-04-10T16:42:56+00:00,Even folks at Jio heard the main commentary and said nah we can't have our viewers watching this and cussing us all day for comms AND shitty tech.,3
2024-04-10T16:42:59+00:00,Saving wickets today so they can fire in do or die matches before playoffs,8
2024-04-10T16:43:07+00:00,Gujarat is shitting this year,5
2024-04-10T16:43:09+00:00,Nooooooooooo,7
2024-04-10T16:43:12+00:00,tactical drop,7
2024-04-10T16:43:14+00:00,Oh Yuvi...,3
2024-04-10T16:43:23+00:00,"Last night and tonight, the catching has been abysmal",1
2024-04-10T16:43:23+00:00,"The fielding has been shit this IPL, across the board",1
2024-04-10T16:43:24+00:00,Chutiya catch drop,1
2024-04-10T16:43:24+00:00,Tactical drop,3
2024-04-10T16:43:24+00:00,Ball is lava today,7
2024-04-10T16:43:26+00:00,Tactical drop,7
2024-04-10T16:43:28+00:00,Wtf chahal,6
2024-04-10T16:43:32+00:00,Chahlol,5
2024-04-10T16:43:33+00:00,That was a fairly straightforward return catch tbh,3
2024-04-10T16:43:34+00:00,Tactical drop![img](emote|t5_2qhe0|8781)![img](emote|t5_2qhe0|8781),5
2024-04-10T16:43:35+00:00,Pakistan ahh fielding,3
2024-04-10T16:43:41+00:00,Oof Yuzi. Didn't expect him to catch it tbh,1
2024-04-10T16:43:42+00:00,Commentators don’t act surprised. We know you’re in on the script,4
2024-04-10T16:43:42+00:00,"Chahal and dropping catches, such an iconic duo",6
2024-04-10T16:43:43+00:00,"No one wants to catch a ball tonight.

Except for GOAT Vijay Shankar.",8
2024-04-10T16:43:45+00:00,Yuzi dropped the match for gt,3
2024-04-10T16:43:45+00:00,Yuzi putting down Sai Kishore ![img](emote|t5_2qhe0|8767),3
2024-04-10T16:43:47+00:00,Fielding has been poor this match from both sides,5
2024-04-10T16:43:47+00:00,Ash is looking to sneak into the t20 squad yet again. He’s been decent in the limited opportunities he’s had in white ball cricket.,11
2024-04-10T16:43:48+00:00,Was a sitter,3
2024-04-10T16:43:48+00:00,Yuzi moment,2
2024-04-10T16:43:50+00:00,First time seeing chahal's delivery turn so much,2
2024-04-10T16:43:50+00:00,Chahal is literally not a mainstay in the Indian team cuz of his fielding lmao,2
2024-04-10T16:43:50+00:00,Investigate everyone involved in today's match (2),11
2024-04-10T16:43:51+00:00,GT🤝RR when it comes to fielding this match.,8
2024-04-10T16:43:52+00:00,Tactical drop,10
2024-04-10T16:43:54+00:00,I need someone to just step out against chahal and hit him for six,3
2024-04-10T16:43:57+00:00,Wtf with our fielding lately,6
2024-04-10T16:44:00+00:00,C'mon that was a bit difficult.,3
2024-04-10T16:44:01+00:00,Scenes from WC 24 if Chahal is selected.,8
2024-04-10T16:44:03+00:00,What's wrong with you people. GT is doing good,15
2024-04-10T16:44:03+00:00,Is that why we need jadeja in squad ? /s,5
2024-04-10T16:44:04+00:00,It's incredible how many Aussies have been involved in the TNPL.,6
2024-04-10T16:44:05+00:00,"one of the worst fielders going around, i am sure he’s dropped 8/9 of 10 return catches that has come his way.",9
2024-04-10T16:44:12+00:00,"That's one of the easier catch I've seen off one's own bowling. Given how he's poor in the field in general, it's not surprising that he dropped it.",9
2024-04-10T16:44:15+00:00,"So many drops, so many midfields today,   

Jay Shah, thank you for the lovely script!!",10
2024-04-10T16:44:16+00:00,Sai Dhoni,6
2024-04-10T16:44:22+00:00,Tactical drop by chahal. Rr wants sudarshan to stay 😆,8
2024-04-10T16:44:23+00:00,Is it gonna rain there,5
2024-04-10T16:44:24+00:00,Please name all other ipl stadiums to Narendra Modi stadium then gill will play good...,9
2024-04-10T16:44:30+00:00,This is gully cricket level fielding. By both sides.,7
2024-04-10T16:44:31+00:00,What a great ODI batting going on..,6
2024-04-10T16:44:34+00:00,Bro was airbending the ball lmao,6
2024-04-10T16:44:36+00:00,Sai is a strong lad with good technique. RR might regret this drop.,10
2024-04-10T16:44:37+00:00,Extremely costly over with dropping a catch. Not good,8
2024-04-10T16:44:37+00:00,"In the end, no matter how low the strike rate. If we can't pick wickets, we'll lose this",15
2024-04-10T16:44:45+00:00,No one catching the ball except our Lord and Saviour Vijay “3D” Shankar,9
2024-04-10T16:44:46+00:00,Bishnoi>Chahal proved,4
2024-04-10T16:44:55+00:00,Bishnoi>Chahal proved,4
2024-04-10T16:44:56+00:00,Yeah idk man. It's kinda good we moved past Chahal in T20I's dude's straight up a terrible fielder. Just not international standard.,8
2024-04-10T16:45:07+00:00,GT openers more lethargic than me on a Monday morning.,3
2024-04-10T16:45:16+00:00,gill you could have done this at the final,-1
2024-04-10T16:45:17+00:00,Sai sudarshan is not a t20 player.,1
2024-04-10T16:45:18+00:00,"This is the CEAT tyre strategic timeout^TM.   


Put some RESPECT on the name BRUH",3
2024-04-10T16:45:21+00:00,Waise khane me jo taste daale usko kya bolna hai?,1
2024-04-10T16:45:23+00:00,Bro that was definitely a tactical drop. In slow mo replay it clearly shows. He thought about it then said eh let it go,4
2024-04-10T16:45:24+00:00,"The rr is 11.5, sai with 125 sr.",1
2024-04-10T16:45:26+00:00,Bring lord parag,2
2024-04-10T16:45:27+00:00,gill playing a proper odi innings in t20 just like the og number 7,0
2024-04-10T16:45:29+00:00,So 3d in T20 wc cuz We need a specialist catcher ?,7
2024-04-10T16:45:29+00:00,RR was 74-2 after 10 overs I remember so far we are doing good wade and Manohar can strike pretty well hoping Shankar doesn't anchor again,6
2024-04-10T16:45:37+00:00,"J Shah stole script from Taiwan baseball game during earthquake, hence no fielding",4
2024-04-10T16:45:40+00:00,Lord parag will get wickets too,1
2024-04-10T16:45:42+00:00,Something seems wrong with Shubman Gill. So many bad reviews lately. I think he is losing his paitence,-3
2024-04-10T16:45:52+00:00,In the end if your SR is low no matter how many wickets you have you can never reach it,6
2024-04-10T16:46:00+00:00,"Yuzi, you just dropped the cup mate.",0
2024-04-10T16:46:04+00:00,This sudershan guy came from out of syllabus I thought he's just a filler name mb guys,2
2024-04-10T16:46:12+00:00,If you have pinch hitter like wade who tonks in powerplay why didn't you send him....,4
2024-04-10T16:46:14+00:00,I think all format batters are mostly anchors in t20,11
2024-04-10T16:46:38+00:00,"This mf DJ plays the most npc bollywood tracks, we got really good Rajasthani songs mf or at least play some diff Bollywood music",5
2024-04-10T16:46:45+00:00,"This is the Strategic Time out, because they are Tyred     


Now you CEAT,

Now you don’t 

BRUH",7
2024-04-10T16:46:48+00:00,Wade should open with Gill if he is playing. Sai isn't the kind of player who can light up powerplays which Wade can. Sai can bat 3.,7
2024-04-10T16:46:53+00:00,"FUCK YOU JIOCINEMA. TURN THE VOLUME DOWN IN THAT ""BLOCKBUSTER THURSDAY"" AD. MY EARS ARE BLEEDING",10
2024-04-10T16:46:57+00:00,That single screen ad is so fucking loud for no fucking reason.,4
2024-04-10T16:46:57+00:00,In 13 innings in IPL Wade has SR of 104🥲🥲🥲,6
2024-04-10T16:47:01+00:00,"Chahal dropping a GT opener, I'm getting flashbacks",3
2024-04-10T16:47:06+00:00,Why are these one sided ads for Mi cuz it's jio Ambani??,7
2024-04-10T16:47:18+00:00,Rn  yuzi the bolwer is good not great but his fielding and batting ability is where his Indian team selection is lacking...,3
2024-04-10T16:47:29+00:00,Lol RCB getting ragdolled tomorrow???,6
2024-04-10T16:47:31+00:00,Why sandeep sharma isnt playing,2
2024-04-10T16:47:35+00:00,Even parag and Samson started slowly but then accelerated... I think GT is playing fine if they can accelerate,7
2024-04-10T16:47:40+00:00,"Guys you gotta realize,  Jay Shah ain't like Bollywood writers. 

He doesn't overdo the current thing. IPL had too many ""jerk off to this stuff"" catches , so he introduces these drops like fillers, so that good ones remain entertaining",5
2024-04-10T16:47:41+00:00,[deleted],10
2024-04-10T16:47:42+00:00,Gill will get his 75 while GT will lose by 25 🤦🏼‍♂️,3
2024-04-10T16:47:43+00:00,"As long as RRR stays below 10, it is “easy”",6
2024-04-10T16:47:53+00:00,Let Nehra cook,2
2024-04-10T16:48:11+00:00,"Lowest catch efficiency, openers not performing well (except that RCB game), still topping the table",6
2024-04-10T16:48:14+00:00,stop shitting on Yuzi you dickheads,3
2024-04-10T16:48:15+00:00,Only if chahal was disciplined he would have become one of the best bowler with great wife,4
2024-04-10T16:48:20+00:00,"Unlike Bazball, RR is changing cricket by proving that catches don't win matches.",8
2024-04-10T16:48:31+00:00,the way they are making hype for tomorrow's match is so annoying..,2
2024-04-10T16:48:32+00:00,As a csk fan i hope both teams lose tomorrow,7
2024-04-10T16:48:36+00:00,Cmon sen,4
2024-04-10T16:48:38+00:00,Show us the speed guns now guys,5
2024-04-10T16:48:39+00:00,Lol IPL only fans think Jaiswal is a blind slogger but he's a far better test batsman who recently got two double hundreds on a trot last month and has highest FC only average in the country,3
2024-04-10T16:48:40+00:00,lmao was last year’s final the only match sai played with a decent strike rate,3
2024-04-10T16:48:55+00:00,Thank you Yuzi,1
2024-04-10T16:49:02+00:00,"So lemme get something right,   

GT have Sai Kishore, Sai Sudarshan, so the only one missing is Sai Baba?",9
2024-04-10T16:49:12+00:00,I'm sure that its not just caught and bowled but Zaheer didn't wanna do Chahal dirty,1
2024-04-10T16:49:18+00:00,we will be there for Mumbai's downfall tomorrow,9
2024-04-10T16:49:35+00:00,Bad decision for kuldeep sen to bowl as rain is 100% so try to stop run or take wickets not give bowling to loose bowlers,1
2024-04-10T16:49:42+00:00,Yuzi boi doesn't take catches off his bowling. There's peasants in the field for him to do that,2
2024-04-10T16:49:44+00:00,134 off 72 was what was needed yesterday too. They had fewer wickets however.,3
2024-04-10T16:49:46+00:00,"I can't help but think playing Shahrukh instead of 3D and opening with Wade would be much better for GT

Wade can strike from ball one and give a good start for finishing you have Shahrukh, Manohar, Tewatia and  Rashid",4
2024-04-10T16:49:48+00:00,Plumb it should be.. If no bat,4
2024-04-10T16:49:51+00:00,I always liked Yuzi. He is too good for Dhanasree,1
2024-04-10T16:49:56+00:00,That is absolutely stone dead unless he hit it...but do you want to get him out?,3
2024-04-10T16:50:03+00:00,RR batting looks like powerhouse butler hit century in last match ... Samson parag in top form and jaiswal has yet to fire .. plus they got jurel and hitmeyer damn that's some line up,2
2024-04-10T16:50:08+00:00,Bro thought this was Kuldeep Yadav,3
2024-04-10T16:50:12+00:00,Thats plumb in front,2
2024-04-10T16:50:22+00:00,My man bowling 147 on the trot,3
2024-04-10T16:50:22+00:00,Tactical review drop opportunity missed,5
2024-04-10T16:50:23+00:00,Harsha mf says angelone moment as soon as the cameraman showed those girls,8
2024-04-10T16:50:27+00:00,GONE,1
2024-04-10T16:50:28+00:00,Here comes today's hero : 3rd umpire ![gif](emote|free_emotes_pack|dizzy_face),2
2024-04-10T16:50:31+00:00,Gill should play under Cummins or poach Cummins to gt next season to silence the crowd.,4
2024-04-10T16:50:32+00:00,"Very nice, (almost) yorker at 147.3!

Encouraging even if this review doesn't go their way

Lmao that's plumb",7
2024-04-10T16:50:33+00:00,Wtf bowling 147kph bruh,7
2024-04-10T16:50:35+00:00,We are so used to calling him Fizz it took me to a second to realise who TF is Mustafizur Rahman,10
2024-04-10T16:50:35+00:00,"Tomorrow’s match is EXTREMELY important for both the teams. Keeping aside the rivalry, loser of tomorrow’s match gets kicked out of this tournament.",6
2024-04-10T16:50:41+00:00,Dharmu is blind or what ?,4
2024-04-10T16:50:45+00:00,end of the misery,3
2024-04-10T16:50:45+00:00,Clown umpire. How did you not give that. Shits plumb ffs,13
2024-04-10T16:50:48+00:00,Wtf kind of way is that to get out.,6
2024-04-10T16:50:48+00:00,"Interesting, should be out",1
2024-04-10T16:50:49+00:00,i saw dharma cena smoking weed in the timeout,10
2024-04-10T16:50:50+00:00,advantage gt,8
2024-04-10T16:50:53+00:00,good to see kuldeep sen again. he showed decent potential last year,1
2024-04-10T16:50:55+00:00, pace got him.,1
2024-04-10T16:51:00+00:00,When you practice on the field,2
2024-04-10T16:51:01+00:00,It's a phair dilevry,-2
2024-04-10T16:51:01+00:00,"Why are people surprised?

Kuldeep has always bowled 145+",5
2024-04-10T16:51:02+00:00,Much needed wicket for GT.,1
2024-04-10T16:51:03+00:00,Good move by Samson. Switching to pace when wind is in favor.,7
2024-04-10T16:51:04+00:00,Plumber than the plumber that stole my wife,28
2024-04-10T16:51:06+00:00,Idk why umpire said no,6
2024-04-10T16:51:08+00:00,"""ek tha jo wicket ke piche se"" intensifies.",8
2024-04-10T16:51:14+00:00,Like I said. Sai isn't a Dasher.. He can play steadily so 3 or 4 is better position for him than an opener.,7
2024-04-10T16:51:14+00:00,"RR have Ashwin, Chahal, Kuldeep and Maharaj


Spin stocks 📈📈📈",9
2024-04-10T16:51:18+00:00,It's about to fucking rain,5
2024-04-10T16:51:19+00:00,The D in Dharamsena stands for 'Don't Deserve to be an Umpire',7
2024-04-10T16:51:20+00:00,Why do batsmen leave when the review is not yet over ? 🤦🏼‍♂️,9
2024-04-10T16:51:27+00:00,Imagine how terrible the umpire must be that player is leaving even without seeing the 3rd umpire decision,12
2024-04-10T16:51:30+00:00,Sai sudharshan is not a opener and shouldn't be opening. He better no 3 player.,5
2024-04-10T16:51:31+00:00,"Damn, this is when you need Murali Karthik. He would've said, 'once more Kuldeep Yadav proving himself with his stump to stump line and getting a LBW' 

Missing him.",11
2024-04-10T16:51:31+00:00,Good to see Kuldeep Sen up in the mid to high 140s right away.,10
2024-04-10T16:51:33+00:00,Umps had no idea where it hit,7
2024-04-10T16:51:36+00:00,Getting out with a sr of 120 after playing 30 balls that too mostly in powerplay is such a shit show,14
2024-04-10T16:51:43+00:00,Even I know that is out and I suck at LBw,7
2024-04-10T16:51:44+00:00,Ez wicket,2
2024-04-10T16:51:45+00:00,Sai Dhawan™,6
2024-04-10T16:51:47+00:00,Shahrukh Khan VS actor Vijay,5
2024-04-10T16:51:49+00:00,Virat Sudarshan gone already?,15
2024-04-10T16:51:50+00:00,"when i switch tabs when I am watching JioCinema, it automatically pauses. Is this some setting in my browser or are those MFs at JioCinema made it happen?",3
2024-04-10T16:51:51+00:00,So much to learn for Sudarshan in terms of pacing an innings,6
2024-04-10T16:51:54+00:00,Is gt waiting for the rain keep wickets and go for dls..,3
2024-04-10T16:51:58+00:00,Why does IPL have such shit umpires?,3
2024-04-10T16:51:59+00:00,Dharmasena wow.,3
2024-04-10T16:51:59+00:00,GT's chances increases by 5%.,13
2024-04-10T16:52:00+00:00,Dumbersena 🤡,7
2024-04-10T16:52:01+00:00,"If that was any more out, it would’ve been waiting outside the stadium",3
2024-04-10T16:52:01+00:00,Sanju keeps taking good reviews,13
2024-04-10T16:52:05+00:00,Adharmasena,4
2024-04-10T16:52:06+00:00,Match losing innings from Sudharsan.,11
2024-04-10T16:52:13+00:00,Why was that not given out in the first place lol,5
2024-04-10T16:52:16+00:00,Dharma Sena sounds like some vigilante religious outfit name,14
2024-04-10T16:52:22+00:00,Tamil Nadu boy getting another Tamil Nadu boy out,4
2024-04-10T16:52:22+00:00,"Sai got the memo from the support staff alright.

""Son, get out of there ASAP.""",7
2024-04-10T16:52:22+00:00,Cameraman about to follow Sudarshan into his house,13
2024-04-10T16:52:23+00:00,Advantage GT?,3
2024-04-10T16:52:23+00:00,Umpire joining the fielders on the shithousery,7
2024-04-10T16:52:24+00:00,All that improvement washed away in this innings.,3
2024-04-10T16:52:26+00:00,Bamboozled by 147kmph,5
2024-04-10T16:52:28+00:00,Rarely do you see batter waking before the decision in a lbw review,8
2024-04-10T16:52:37+00:00,"Simple DRS rules..you see Dharamsena, you review. Dude is the most underconfident cricket umpire I have seen. His face after giving any decision is like he would himself review it if given a chance.",6
2024-04-10T16:52:37+00:00,Lenskart new offer. Buy a new pair of glasses for free. Just apply the discount code #blindumpire,7
2024-04-10T16:52:40+00:00,Kuldeep always bowls well in tandem with Chahal,3
2024-04-10T16:52:40+00:00,Just checked gt has Shah Rukh in the squad tf play him,5
2024-04-10T16:52:41+00:00,Finally the misery is over,3
2024-04-10T16:52:41+00:00,"That's the most sloppy attempt at a lap shot I've seen.


Dude has got technique,  even though his SR ain't that good.


 This is a nothing innings again from Sai",5
2024-04-10T16:52:44+00:00,Good for GT,3
2024-04-10T16:52:48+00:00,"If you are using Wade at 3 , might as well opened with him and used the PP",6
2024-04-10T16:52:52+00:00,Dharma first check your eyes then check Shubhman’s.,4
2024-04-10T16:52:53+00:00,Straighter than my wife's bf,5
2024-04-10T16:52:54+00:00,I am still calming my heart from that electrifying Sai Sudharsan innings,5
2024-04-10T16:52:56+00:00,K SEN MY BELOVED,2
2024-04-10T16:52:56+00:00,![img](emote|t5_2qhe0|8767),2
2024-04-10T16:53:00+00:00,"Sai Sudharsan removes his mask to show that he was,


Kane Williamson ALL ALONG :-0",11
2024-04-10T16:53:04+00:00,"Wade should have batted at end.
3d can't slog",1
2024-04-10T16:53:04+00:00,Umpire did the right thing for RR by giving not out but Sanju couldnt figure it out,5
2024-04-10T16:53:05+00:00,What a legendary ipl career wade has ..wow,6
2024-04-10T16:53:08+00:00,Wade think this is Pakistan,4
2024-04-10T16:53:09+00:00,"While I think Sudarshan is definitely not a T20 bat, not even close: I really want him to be in the plans for ODIs for the future. I hope he won't be hard done by selectors in ODIs just because he's shite in T20s.",9
2024-04-10T16:53:12+00:00,I think gt is playing acc to situation..they are trying not to give wickets so that low runs at the time at rain...now that a wicket is gone they gonna slog now,1
2024-04-10T16:53:20+00:00,"""arey sir aap bhi shuru hogye"" sanju was so cute saying this..",2
2024-04-10T16:53:22+00:00,"That's why Indian anchors often fail, they eat up deliveries but fail to deliver when it's their turn to smash.",8
2024-04-10T16:53:23+00:00,Comes another IPL fraudd,5
2024-04-10T16:53:27+00:00,Where VJ Shankar 🐵,2
2024-04-10T16:53:28+00:00,Alternate version sanjus career took off and he became white ball ict captain,3
2024-04-10T16:53:29+00:00,Still GT’s game to lose,3
2024-04-10T16:53:32+00:00,Sheesh that is fire,4
2024-04-10T16:53:33+00:00,Wade 20 ball 50.,1
2024-04-10T16:53:37+00:00,Sunny creamed,3
2024-04-10T16:53:41+00:00,"TV umpire to director we have a review for lbw. I have checked the front foot it's a fair delivery, can we start off with front on spin vision please?",2
2024-04-10T16:53:42+00:00,Sunny G just came💦💦💦💦,4
2024-04-10T16:53:43+00:00,Sen bowling at 144km/hr first ball.. not bad.. second ball lbw..,6
2024-04-10T16:53:49+00:00,Dharmasena channelling Steve Bucknor.,3
2024-04-10T16:53:52+00:00,Oh bc,1
2024-04-10T16:53:53+00:00,Pace mf ![img](emote|t5_2qhe0|28120)![img](emote|t5_2qhe0|28120),4
2024-04-10T16:53:55+00:00,Kumar Dharmasena? More like Kumar DRSRequiredena,3
2024-04-10T16:53:55+00:00,Damn Kuldeep with that bite upfront. He's playing test,2
2024-04-10T16:53:57+00:00,Now we see if we have a real chance at the wc seeing how shit tim david is.wade needs to step up.,2
2024-04-10T16:54:00+00:00,What happened to saha?,5
2024-04-10T16:54:00+00:00,Umpire having a shocker. Plumb LBW and not even close to an edge.,4
2024-04-10T16:54:03+00:00,Sunny jizzing to that delivery 😎,4
2024-04-10T16:54:04+00:00,Sunny G had orgasm,5
2024-04-10T16:54:04+00:00,Bros bowling guns💀💀💀,3
2024-04-10T16:54:05+00:00,"where is Nehra, why cameras are not showing him or is he actually not present?",4
2024-04-10T16:54:08+00:00,This is what Gavaskar's wife hears it during sex,7
2024-04-10T16:54:08+00:00,Senile G should just leave the over-enthusiasm to Danny Morrison.,5
2024-04-10T16:54:11+00:00,Welcome to the Gabba mate,3
2024-04-10T16:54:11+00:00,Sunny G cums every time a Indian bowler bounces out a non Asian batsman,7
2024-04-10T16:54:12+00:00,short balls and wade never ending story.,2
2024-04-10T16:54:12+00:00,Can anyone tell me who's the guy in chahar and Sanju ad? I know I've seen him somewhere but can't remember.,3
2024-04-10T16:54:14+00:00,back to my point why would you not open with wade if you know gill takes time,7
2024-04-10T16:54:17+00:00,"I'm amazed the way people whine about players ' SR every match. Like, a couple of players will play slow every match guys, has always happened will always happen, can you stop acting so surprised lol. How else will teams lose? Just get all out for 100 every match lol?",3
2024-04-10T16:54:22+00:00,Gavaskar having an orgasm,8
2024-04-10T16:54:26+00:00,Without hardik the balance this team is in gutters. And missing shami is just gave it more fuel.,6
2024-04-10T16:54:27+00:00,You rarely see Australia or the successful T20 teams approach a 195 chase in this way. Shit I would say it’s exclusive to Indians,9
2024-04-10T16:54:37+00:00,GT's batting lineup is weaker than RR's way back in 2008 (which they miracousely won),2
2024-04-10T16:54:37+00:00,Found what makes Sunny happier than taking a single after a boundary,5
2024-04-10T16:54:43+00:00,Parag cutie,4
2024-04-10T16:54:43+00:00,Wade just imagine Shaheen’s face and tonk,5
2024-04-10T16:54:45+00:00,Wade is still playing? For some reason I thought he retired ages ago,7
2024-04-10T16:54:54+00:00,did commentator call him dumbasena lol,6
2024-04-10T16:54:57+00:00,Where can I see DLS score?,3
2024-04-10T16:55:01+00:00,Parag and Kuldeep wholesome,5
2024-04-10T16:55:02+00:00,IPL needs to start getting more international commentators. Indian commentators suck with the exception of Ravi shashtri,12
2024-04-10T16:55:03+00:00,Lol Riyan,7
2024-04-10T16:55:05+00:00,Man this team so wholesome,11
2024-04-10T16:55:05+00:00,Hahaha that was actually funny shit by riyan,8
2024-04-10T16:55:12+00:00,Lmao Paraggg😭😭😭😂😂😂😂😂,1
2024-04-10T16:55:13+00:00,Wade would have sent in the powerplay instead of sudharshan...,3
2024-04-10T16:55:22+00:00,Would like to remind everyone that the iPhone 15 ad is being shown globally. Perhaps billions of eardrums have been irreparably damaged.,5
2024-04-10T16:55:22+00:00,2 owners of pakistan cricket team on the pitch,3
2024-04-10T16:55:24+00:00,"Ah, the new-age Madrasi, Kuldeep Sen",5
2024-04-10T16:55:29+00:00,They will do tuk tuk all they way to 180,2
2024-04-10T16:55:31+00:00,Riyan Parag booking his ticket to the Caribbean and USA for this summer as we speak,2
2024-04-10T16:55:32+00:00,GT has the weakest batting line up among all IPL teams yet they somehow shithouse a victory. They will be found out this season,15
2024-04-10T16:55:33+00:00,If i had one stone for each fraudulent Aussie cunt in ipl i will have “i lost the count” stones,6
2024-04-10T16:55:34+00:00,Kuldeep Shane,2
2024-04-10T16:55:38+00:00,Gill should play most of the balls here,3
2024-04-10T16:55:38+00:00,Even mighty kumar dharmasena is induced by Indian shit umpiring lol,13
2024-04-10T16:55:39+00:00,Kuldeep Sen looks like Haryanvi version of Mukesh ~~Kumar~~ McGrath,13
2024-04-10T16:55:41+00:00,Playing pp as odi and middle overs as test. So we ll atleast see T20 in death over.s,8
2024-04-10T16:55:58+00:00,How are we not shitting the bed against Gujarat? I am starting to think that we have a chance of winning the tourney now,4
2024-04-10T16:56:06+00:00,Need a Riyan emoji ASAP !,1
2024-04-10T16:56:10+00:00,"Okay, but how did RR build such a formidable squad?",3
2024-04-10T16:56:13+00:00,Why is GT playing Test cricket?,2
2024-04-10T16:56:13+00:00,Is there no Insiders' feed today? The option doesn't show up on Must watch jiocinema web?,2
2024-04-10T16:56:13+00:00,Decent pace and control from Sen so far. Need him to come good so that we have another proper pacer in our shed.,4
2024-04-10T16:56:16+00:00,Aussies will fraud in the IPL only to win ICC trophies as usual,2
