Timestamp,Comment,Upvotes
2024-04-10T15:34:44+00:00,There goes the fair play points,1
2024-04-10T15:34:45+00:00,Third umpire browsing Reddit while working?,3
2024-04-10T15:34:45+00:00,red card gill lol,3
2024-04-10T15:34:45+00:00,Side affects of delayed payment. RR should be careful in the future,1
2024-04-10T15:34:46+00:00,"GT losing those fairplay points, and the game",1
2024-04-10T15:34:46+00:00,Gill is arguing with the wrong ump.. He should argue with 3rd ump,9
2024-04-10T15:34:46+00:00,Tf was that attempt LMAO,3
2024-04-10T15:34:47+00:00,Ashwin Anna can't be wronged as an umpire 🤌🏼,4
2024-04-10T15:34:47+00:00,Will be comical if RR win by 1 run due to that controversial wide,4
2024-04-10T15:34:48+00:00,what new script is this? are we entering DRS territory as well. /s,4
2024-04-10T15:34:49+00:00,3rd Umpire got blind yesterday during solar eclipse,7
2024-04-10T15:34:49+00:00,Angry man Shubman,4
2024-04-10T15:34:49+00:00,🍿🍿🍿,4
2024-04-10T15:34:49+00:00,Gill ain't fucking around,8
2024-04-10T15:34:50+00:00,PAY TEA EMM FAIR PLAY AWARD?,3
2024-04-10T15:34:51+00:00,Gilly channeling his inner Kohli,5
2024-04-10T15:34:51+00:00,This is where fixing allegations come from,4
2024-04-10T15:34:51+00:00,it would be funny if GT get penalised for slow over-rate,5
2024-04-10T15:34:51+00:00,What the actual fuck is happening?,4
2024-04-10T15:34:52+00:00,"What the utter fuck? 


This is a fucking joke right?",8
2024-04-10T15:34:52+00:00,Remind me again how much money this league is making.,8
2024-04-10T15:34:52+00:00,So many reviews and DRS and rules ruining the game smh,3
2024-04-10T15:34:52+00:00,Never seen Shubman angry,30
2024-04-10T15:34:53+00:00,-50K,6
2024-04-10T15:34:53+00:00,3rd umpire is using reddit..,24
2024-04-10T15:34:54+00:00,Hahahahaha wtf was that Tewatia,8
2024-04-10T15:34:55+00:00,wtf lmao who was that?,3
2024-04-10T15:34:55+00:00,"Proper village, this.",10
2024-04-10T15:34:56+00:00,Wtf is going on??,1
2024-04-10T15:34:57+00:00,📉 goes the fair play points,8
2024-04-10T15:34:58+00:00,Tewaitya lol....,6
2024-04-10T15:34:58+00:00,What happened there lmao?,1
2024-04-10T15:34:59+00:00,Check complete,2
2024-04-10T15:34:59+00:00,Bro they are not even trying to act anymore,9
2024-04-10T15:34:59+00:00,Part of the script was missing. Umpire got confused,5
2024-04-10T15:35:01+00:00,WHAT IS HAPPENING LMAOOOOO,6
2024-04-10T15:35:02+00:00,we got mahendra singh gill before gta 6,8
2024-04-10T15:35:02+00:00,wtf is happening with GT? The fuck is this?,0
2024-04-10T15:35:02+00:00,Tewatia helpin samson pure rr player,3
2024-04-10T15:35:03+00:00,338th reminder that having reviews for wides is a bad idea,8
2024-04-10T15:35:04+00:00,3rd Umpire to Gill : And fk you in particular,4
2024-04-10T15:35:04+00:00,LMAO clown show RN.,4
2024-04-10T15:35:04+00:00,GT have forgotten fielding tonight.,4
2024-04-10T15:35:05+00:00,"Gill is furious and rightly so, stupid umpire",21
2024-04-10T15:35:06+00:00,Gill will commit a crime today,14
2024-04-10T15:35:06+00:00,"Tooo early but i really wanna see SRH vs RR finals, one of us will break single trophy curse. ",3
2024-04-10T15:35:06+00:00,Broooooooo howwww,1
2024-04-10T15:35:06+00:00,Lmao wtf,1
2024-04-10T15:35:07+00:00,red card gill lol,7
2024-04-10T15:35:07+00:00,Not even owned by Ambani so we could make some jokes,7
2024-04-10T15:35:07+00:00,Easy catch bruh,1
2024-04-10T15:35:07+00:00,tf was that,3
2024-04-10T15:35:09+00:00,Man gt sucks so bad in the field,2
2024-04-10T15:35:09+00:00,Damn that could be really bad for gt,1
2024-04-10T15:35:09+00:00,Lmao,1
2024-04-10T15:35:09+00:00,Did Tewatia just die?,7
2024-04-10T15:35:09+00:00,There goes the fair play points which doesn't mean jack shit tbh 😂,7
2024-04-10T15:35:10+00:00,Umpire’s decision change happened just as he received a mysterious transfer into his bank account 😉,2
2024-04-10T15:35:10+00:00,"Gillman is mad lol.

Also, what the fuck was that?",3
2024-04-10T15:35:10+00:00,"Damn, GT fielding has regressed a lot this season",3
2024-04-10T15:35:10+00:00,Third umpire while making this decision. ![img](emote|t5_2qhe0|8776),6
2024-04-10T15:35:11+00:00,Lolwaaa…,2
2024-04-10T15:35:11+00:00,RR is actually 152-12,10
2024-04-10T15:35:11+00:00,Bruh what is this match,1
2024-04-10T15:35:12+00:00,What the actual fuck are these idiots doing in the field today?????,3
2024-04-10T15:35:12+00:00,Is the match fixed? That catch drop looked suspicious,4
2024-04-10T15:35:12+00:00,"I can do fast maths.

Then tell whats 1234889×3577823

8367890

Ohh that's not even close

But it was fast!!!

Similar umpiring here!",8
2024-04-10T15:35:13+00:00,Poor GT there goes fairplay points,6
2024-04-10T15:35:14+00:00,Bro smokes 2 desi pegs everyday in umpire box and then give decisions.,7
2024-04-10T15:35:16+00:00,Match is fixed!!,1
2024-04-10T15:35:16+00:00,Pouring oil on fire,1
2024-04-10T15:35:16+00:00,"Thank you Agent Tewatia



Seriously tho what happened",9
2024-04-10T15:35:16+00:00,GT HAS been comically bad.. Not just sloppy in field.,8
2024-04-10T15:35:16+00:00,WHAT THE FUCK WAS THAT,7
2024-04-10T15:35:18+00:00,Not even subtle,6
2024-04-10T15:35:19+00:00,Wtf was that lmfao. It's like a bloopers clip,2
2024-04-10T15:35:19+00:00,"dread it, run from it, the umpire's call arrives all the same.",5
2024-04-10T15:35:19+00:00,The hell was that,6
2024-04-10T15:35:19+00:00,Agent Tewatia not taking his former Captain's catch,7
2024-04-10T15:35:20+00:00,This is similar to me writing an answer during an exam and then cutting that answer to write an answer that is completely opposite of it.,8
2024-04-10T15:35:20+00:00,Who was that goofy ahh mf ,9
2024-04-10T15:35:20+00:00,"There should only be wide review using white guidelines, if batsmen has moved then stick with onfield umpires decision",4
2024-04-10T15:35:21+00:00,ROFL clown fielding effort 🤣,6
2024-04-10T15:35:21+00:00,Pakistan team playing in IPL since yesterday looks like,2
2024-04-10T15:35:22+00:00,Does pakistan players have invaded our country from gujrat.,5
2024-04-10T15:35:22+00:00,Sack GT fielding coach,9
2024-04-10T15:35:22+00:00,Not sure if GT or Pakistan based on the fielding,10
2024-04-10T15:35:22+00:00,What’s with the fielding tonight,7
2024-04-10T15:35:23+00:00,This whole game feels sus,4
2024-04-10T15:35:24+00:00,Time for Samson to get out,0
2024-04-10T15:35:24+00:00,Shubman Gill 162.3 kmph ball incoming if he comes to bowl now,4
2024-04-10T15:35:24+00:00,Hahaha haha,3
2024-04-10T15:35:25+00:00,Wtf is happening lmfao.,1
2024-04-10T15:35:25+00:00,That was the right call to make end of the day. But also what happened there??? You can’t make a decision and backtrack on it,2
2024-04-10T15:35:25+00:00,Nehra about to gang up on third umpire after this innings get over.,4
2024-04-10T15:35:25+00:00,I like this from gill,7
2024-04-10T15:35:26+00:00,"Fixed match *yawn* 🥱


(/s)",1
2024-04-10T15:35:26+00:00,man these captains arguing do they think the decision's gonna go in their favour if they won that argument??,0
2024-04-10T15:35:27+00:00,I think someone wakes up the third umpire from his sleep every time a DRS call is made.,3
2024-04-10T15:35:28+00:00,KKR have a competitor for fairplay awardb,8
2024-04-10T15:35:28+00:00,"It’s honestly high time umpires were made fully redundant and got removed. They’re not needed anymore, we have the tech to fill in their role and then some. This entire soft call crap and what not is just really stupid. If you can have a replay that later shows not out, what’s the point of an umpire altogether? What does the out even mean? Umpires harm the game in this day and age.",3
2024-04-10T15:35:28+00:00,Something is seriously wrong with this shit match.,7
2024-04-10T15:35:28+00:00,"SHUT THE FUCK UP APPLE!!!

STOP THIS FUCKING AD",6
2024-04-10T15:35:29+00:00,I'm lovin it,3
2024-04-10T15:35:29+00:00,Bro. GT meme team wtf.. Can't catch anything lmao,11
2024-04-10T15:35:29+00:00,Reason for dropping all the catches and the misfields must be the alternating color of their shoes,1
2024-04-10T15:35:29+00:00,Tewatiaaa what have you doneeee,3
2024-04-10T15:35:30+00:00,ice man melted,5
2024-04-10T15:35:30+00:00,If this match is t fixed I don’t know what else is,3
2024-04-10T15:35:30+00:00,Just sleep it off to a whole new level,3
2024-04-10T15:35:30+00:00,Shubhman Gill villain arc begins,22
2024-04-10T15:35:31+00:00,Foreign umpires>>>indian umpires,5
2024-04-10T15:35:32+00:00,Whats going on?,2
2024-04-10T15:35:33+00:00,"Nehra is gonna be so furious, he's gonna keep yapping for 15+ minutes",4
2024-04-10T15:35:33+00:00,If GT lose today it’s because of their fielding,3
2024-04-10T15:35:34+00:00,ATLEAST MAKE THE FIXING BELIEVABLE FFS GUYS😭,9
2024-04-10T15:35:34+00:00,"""Upar waala jbhi deta, deta chappar faad ke""

T: god is in their side",1
2024-04-10T15:35:34+00:00,what is happening?,1
2024-04-10T15:35:35+00:00,Shubhman and nehraji gonna spank everyone who misfielded today,7
2024-04-10T15:35:35+00:00,"dude I miss the insiders feed, why is it not available today D:",6
2024-04-10T15:35:35+00:00,Why is fielding this much poor,7
2024-04-10T15:35:37+00:00,Both the players from teams should use rock paper scissors to decide if the ball is wide or not,3
2024-04-10T15:35:38+00:00,Gill angry💀,4
2024-04-10T15:35:38+00:00,Peak cinema,2
2024-04-10T15:35:38+00:00,-5 points in the fairplay award,3
2024-04-10T15:35:39+00:00,"Wtf wtf wtf is happening with GT, surely this is scripted",2
2024-04-10T15:35:39+00:00,"It's embarassing to admit that this clownery is genuine, I would feel much better admitting that this shit is fixed.",5
2024-04-10T15:35:40+00:00,Proper village cricket.,1
2024-04-10T15:35:40+00:00,![img](emote|t5_2qhe0|21496)![img](emote|t5_2qhe0|8776)![img](emote|t5_2qhe0|8774) pick your hero for that last ball,2
2024-04-10T15:35:40+00:00,all gt fielders signalling their towels today ![img](emote|t5_2qhe0|8767),2
2024-04-10T15:35:40+00:00,This is absolute clownery and I love it. LOL,1
2024-04-10T15:35:40+00:00,Gill has every right to talk about this atrocious decision making,10
2024-04-10T15:35:41+00:00,Finally gt playing like they were on paper in 2022,2
2024-04-10T15:35:41+00:00,bro i never say this but fixed lmaoooo,8
2024-04-10T15:35:42+00:00,GT is in shambles this season,4
2024-04-10T15:35:43+00:00,Wtf was that 😂🤣🤣😂,3
2024-04-10T15:35:43+00:00,GT gonna get fair play points docked cuz of Third umpire being high,3
2024-04-10T15:35:45+00:00,"
Don't bother keeping the ball down, they are not catching anything today",1
2024-04-10T15:35:46+00:00,"This shows how clueless 3rd umpires are about the wide DRS.

Also if he clearly mentioned its umpire's call, then GT shouldn't lose their review right?",3
2024-04-10T15:35:46+00:00,Rr getting banned again for 2 years,4
2024-04-10T15:35:46+00:00,Some incredible garbage fielding last 2 days.,1
2024-04-10T15:35:46+00:00,Someone must have cast a spell on GT players.,1
2024-04-10T15:35:46+00:00,Lol wut,2
2024-04-10T15:35:46+00:00,LMFAO this is meme fielding,5
2024-04-10T15:35:47+00:00,If GT can't capitalise on an opportunity created after that wrong wide call then that's on them lol. They're turning into a clown show.,1
2024-04-10T15:35:48+00:00,"I think this one on lighting

Common in rr ground",1
2024-04-10T15:35:48+00:00,I love this shithousry,1
2024-04-10T15:35:49+00:00,Is Takeshi castle being streamed right now?,1
2024-04-10T15:35:49+00:00,we had this exact situation yesterday and 3rd umpire gave that wide as well,1
2024-04-10T15:35:49+00:00,"Shubhman Gill
Umpire gives clown decision
Dushman Gill",3
2024-04-10T15:35:49+00:00,Yeah GT don't wanna win this,2
2024-04-10T15:35:49+00:00,"WTF happened there.! Butter fingers.!

Edit: more like butter feet’s..!",1
2024-04-10T15:35:50+00:00,"Basically, ""whatever you said is right because we are both umpires and we have to stick together"". 

Umpires union.",5
2024-04-10T15:35:50+00:00,Third umpires forgot script for a second lmao. Atleast he went with it later,1
2024-04-10T15:35:51+00:00,What kinda drop catch is that ?,1
2024-04-10T15:35:51+00:00,Do any of them know how to field lol? If this carries over ( most of these players won't but still ) to WC then we finished fr,2
2024-04-10T15:35:51+00:00,You can probably cook things on Shubman Gill now.,7
2024-04-10T15:35:51+00:00,LOL at GT's fielding.,3
2024-04-10T15:35:51+00:00,"Again, your account has been credited with Rs. xxxxxx, lol",6
2024-04-10T15:35:51+00:00,"Clown level fielding, lol",2
2024-04-10T15:35:52+00:00,GT can’t even catch Covid it looks like,7
2024-04-10T15:35:53+00:00,RR essentially has been given a free hit for all the death overs,3
2024-04-10T15:35:53+00:00,"Jay Shah, quit your antics, this looks suspicious now.",14
2024-04-10T15:35:54+00:00,WTF is happening with fielding since yesterday.,2
2024-04-10T15:35:54+00:00,What the hell was that,3
2024-04-10T15:35:56+00:00,Is this the worst fielding in any IPL match in past few years,3
2024-04-10T15:35:56+00:00,"This is why ""TV umpayyarr to directorr"" is better than all these smart reviews smh",9
2024-04-10T15:35:56+00:00,funniest over in ipl history,5
2024-04-10T15:35:58+00:00,What is this clownery fielding man,3
2024-04-10T15:35:58+00:00,Third umpire is literally me!!,6
2024-04-10T15:35:58+00:00,IPL umpires 🤝 EPL Referee's,5
2024-04-10T15:35:59+00:00,The final decision was correct imo but you can't be switching like this,3
2024-04-10T15:35:59+00:00,"Is this match rigged or something, how the fuck are they letting go of these many catches?",11
2024-04-10T15:36:00+00:00,"Check cleared, match rigged, hotel? TRIVAGO",26
2024-04-10T15:36:04+00:00,Parag's Renaissance ,5
2024-04-10T15:36:07+00:00,On field Umpire: what did I do wrong bro,4
2024-04-10T15:36:07+00:00,"Someone needs to speak up against these useless cunts posing as umpires, the same ball yesterday was given as a fair delivery...what shitshow",10
2024-04-10T15:36:08+00:00,GT doesn't even want to win,3
2024-04-10T15:36:08+00:00,Rr at least got 12-16 runs from bad fielding on today.,4
2024-04-10T15:36:10+00:00,RR gonna get banned for 2 years again 🗿,9
2024-04-10T15:36:12+00:00,RR will be alone this time. No csk to accompany them,3
2024-04-10T15:36:15+00:00,Even Pakistan isn't this bad at fielding.,6
2024-04-10T15:36:15+00:00,RR and match fixing? Seems like an old combo,2
2024-04-10T15:36:15+00:00,"Ok well, he tripped but still.",2
2024-04-10T15:36:16+00:00,"wtfff is that fielding ,our fielding just sucks",3
2024-04-10T15:36:16+00:00,Gill about to do what Ronaldo did to the referee,6
2024-04-10T15:36:17+00:00,From chocolate boy always smiling to fiery raging gill what captaincy does to you man,5
2024-04-10T15:36:18+00:00,This has to be fixed right. Wide call revoked and catch dropped with 4?,0
2024-04-10T15:36:19+00:00,Iceman melted there ...,2
2024-04-10T15:36:19+00:00,"Tewatia not even hiding it lmao 


Man simply decided to lay down there",6
2024-04-10T15:36:20+00:00,"someone bust out the rule book. is the wide line made with the leg stump guard in mind? if the batter stands on off stump, does the wide line move to the left by two stumps?",6
2024-04-10T15:36:20+00:00,high quality cricket all round,2
2024-04-10T15:36:22+00:00,Clown fielding,1
2024-04-10T15:36:22+00:00,"Cred upi is the one who gave the customer a ""discount"". I would still ask the shopkeeper for additional discount. Also registering a new UPI app account is a big hassle. Garbage ad.",1
2024-04-10T15:36:22+00:00,I want whatever the GT fielders are on today,3
2024-04-10T15:36:22+00:00,"Khopdi fod re iska.(Paresh rawal meme voice) /s 
T: Teach him a lesson",1
2024-04-10T15:36:23+00:00,I walk away for 10 minutes and Gill is fighting with the ump lol,11
2024-04-10T15:36:23+00:00,It is like someone told the third umpire to change the call,6
2024-04-10T15:36:23+00:00,This is worse than RR's fielding vs RCB,1
2024-04-10T15:36:24+00:00,Least obvious fixing attempt since Md Asif and Sreesanth,9
2024-04-10T15:36:24+00:00,"Billion Dollar league

Umpiring ain't worth 25 Paisa",6
2024-04-10T15:36:24+00:00,What the hell - definitely fixed,0
2024-04-10T15:36:25+00:00,Wtf is happening this game,3
2024-04-10T15:36:25+00:00,Sanju better than that rash driver,3
2024-04-10T15:36:27+00:00,They're supposed to be Gujarat Titans not Gujarat Giants.,6
2024-04-10T15:36:28+00:00,How many reviews for wides are there per side?,2
2024-04-10T15:36:29+00:00,Whoever the 3rd umpire is needs to contest upcoming elections .. how the fuck u turn back on a statement u made a minute ago ?,2
2024-04-10T15:36:33+00:00,They are not beating the fixing allegations,2
2024-04-10T15:36:33+00:00,Proper gully cricket?,2
2024-04-10T15:36:34+00:00,Tv umpires has been really bad for these extras decisions. Really embarrassing stuff from richest cricket board.,4
2024-04-10T15:36:34+00:00,I have seen this in movies :),2
2024-04-10T15:36:34+00:00,We do better fielding in gully cricket than this shit.,6
2024-04-10T15:36:35+00:00,Tewatia secretly still a royal,7
2024-04-10T15:36:35+00:00,"OH SHIT SHOW! 

Dunno why Sunny G said it's a waste of time, it's one run for the team mate.",3
2024-04-10T15:36:37+00:00,"First of all, why is Lord Tewatia  wearing two different coloured shoes",2
2024-04-10T15:36:38+00:00,I am convinced ipl is scripted.,3
2024-04-10T15:36:38+00:00,"Make those casual bastards run 10 km tomorrow morning. 

We have a week off anyways.",7
2024-04-10T15:36:39+00:00,Some of the worst fielding i've ever seen. No professional cricket team should field like this,7
2024-04-10T15:36:39+00:00,World's best league....,2
2024-04-10T15:36:40+00:00,Fuck...that tewatia fall made me so happy,2
2024-04-10T15:36:41+00:00,Where is Richard KettledCookedJapalenoChips when you need him yaaaaaar,2
2024-04-10T15:36:41+00:00,"Idk what is happening today. Someone has done black magic. 

Not a single thing has gone our way.",4
2024-04-10T15:36:41+00:00,Tbh I’d take Kanos just for his fielding skills.,9
2024-04-10T15:36:42+00:00,Jay Shah caught in act!!,1
2024-04-10T15:36:42+00:00,LOL!!!,1
2024-04-10T15:36:42+00:00,GT is trying hard to make sure Parag and Samson gets selected for wc,3
2024-04-10T15:36:44+00:00,Clown 3rd umpire and meme level fielding from Tewatia.,7
2024-04-10T15:36:44+00:00,"Let’s fucking review everything like football, might as well start giving red cards",6
2024-04-10T15:36:46+00:00,P in IPL stands for Pakistan.  Just look at the absolutely atrocious state of fielding this year!,2
2024-04-10T15:36:47+00:00,GT no homo .. As they do not touch anyone’s ball on the field .,5
2024-04-10T15:36:48+00:00,There's gotta be a better way of determining these wides than some guy just eyeballing it off a TV,6
2024-04-10T15:36:50+00:00,Someone has 11 vodoo dolls in butter,4
2024-04-10T15:36:51+00:00,Tv Umpiring was crap there. Only thing worse than that has been the fielding,3
2024-04-10T15:36:53+00:00,It was almost impossible to not catch that,1
2024-04-10T15:36:53+00:00,"feels bad for mohit, two fours to misfields a bad wide call and a catch dropped all in one over",7
2024-04-10T15:36:53+00:00,My favourite players in this IPL are Parag and Shaw,2
2024-04-10T15:36:53+00:00,Parag should be in Indian team,3
2024-04-10T15:36:54+00:00,Who want Sanju Samson in the Indian team?,10
2024-04-10T15:36:55+00:00,Absolute dogshit fielding,2
2024-04-10T15:36:58+00:00,thought he was cool wearing different coloured shoes and ended up tripping himself,1
2024-04-10T15:36:59+00:00,GT went from formidable in first 2 seasons to a meme team,5
2024-04-10T15:37:01+00:00,Well Sanju clearly hasn't looked his best today,1
2024-04-10T15:37:03+00:00,When the fixers quota of boundaries for the over has not been met yet.,4
2024-04-10T15:37:03+00:00,Lol Tewatia was that fixed or what? he reached the ball and just took a tumble before the ball even reached him ![img](emote|t5_2qhe0|21496),9
2024-04-10T15:37:04+00:00,"Still don't understand why Third umpire reversed his decision, like wtf?",10
2024-04-10T15:37:04+00:00,Samson going from zero luck to all kinds of luck. I love it for that man!,17
2024-04-10T15:37:05+00:00,Is reviewing wide a new rule now?,6
2024-04-10T15:37:09+00:00,"3rd umpire was basically saying it was the on-field umpire's call, he initially called it a non-wide because that's what he thought the call on the field was but then changed it to a wide when he realized the on-field call was a wide.

Not sure why it is so hard to understand. I agree with the decision as it was marginal either way and you go with the umpire's call on those.",13
2024-04-10T15:37:16+00:00,Worst fielding in IPL I have seen along with last match.,3
2024-04-10T15:37:16+00:00,Lol that was pure luck 🍀 for sanju. Never seen someone tripped by his own feet on field,4
2024-04-10T15:37:18+00:00,Is this match fixed? 🙊,2
2024-04-10T15:37:19+00:00,"Honestly I'd rather take Samson to T20WC but considering ICT selectors hate boner against him, it's highly unlikely",4
2024-04-10T15:37:24+00:00,Sanju in place of Kohli?,0
2024-04-10T15:37:25+00:00,Raj Kundra spotted around parking lot,3
2024-04-10T15:37:25+00:00,Our fielders scored more runs than Riyan and Samson combined,4
2024-04-10T15:37:25+00:00,Spencer Johnson is so handsome,5
2024-04-10T15:37:28+00:00,Lord Parag enlighten us,1
2024-04-10T15:37:28+00:00,Rr so far really has been sanjuparag carry,3
2024-04-10T15:37:31+00:00,So that's basically another drop by Tewatia right?,3
2024-04-10T15:37:31+00:00,If tewatia slipped like that then I am worried about RR fielding next innings. Thought it hadn't rained much,3
2024-04-10T15:37:33+00:00,What great bowling from Spencer,2
2024-04-10T15:37:34+00:00,LOL they graphics guy thought it's a wicket,1
2024-04-10T15:37:39+00:00,"Shit fielding from Gt,

Lost the match with punjab because of shit fielding as well",4
2024-04-10T15:37:40+00:00,"How did he go from ""the wide moves that much"" to ""yep it is a wide"" lol",8
2024-04-10T15:37:40+00:00,Both the set batters should have been in the dugout,2
2024-04-10T15:37:48+00:00,"Downvote me all you want but, its really satisfactory when a cunning bowler tries to act oversmart by sneaking in a wide ball cause he clearly know the batsman has to go for the hit, but then a third umpire decides to screw him up as a punishment for using an *unfair* tactic.",-3
2024-04-10T15:37:48+00:00,Virat kohli type innings from parag,4
2024-04-10T15:37:50+00:00,"Mohit got figured out ig, its second game now he is taken to cleaners",1
2024-04-10T15:37:50+00:00,Thats completely the umpire's fault.Why don't u know the onfield decision before checking everything,3
2024-04-10T15:37:51+00:00,"So our top 4 most likely would be jaiswal, brohit, koach, sky so sanju at 5?? How has he fared at that position?",0
2024-04-10T15:37:51+00:00,"There is an issue with the line's moving, it becomes subjective again. Need a hawkeye to figure out where the foot is and how much the line moves by.",3
2024-04-10T15:37:54+00:00,Tewatia chose Samson as his vice captain in dream11,9
2024-04-10T15:37:56+00:00,"Fish out of water, Gill's men getting a slaughter",6
2024-04-10T15:37:56+00:00,Someone stopped the time and tied Tewatia's shoe laces together and untied them once he fell.,4
2024-04-10T15:37:58+00:00,Gill should be more angry with his fielders than umpires tonight.,9
2024-04-10T15:37:59+00:00,"The fact that pisses me off about that umpiring is what he said and the call he made was contradictory, he said the batter moved enough for it to be a fair delivery, stay with your decision of out. That's a fucking rookie ass no brain usage mistake. Im also baked af that might add to the emotions",11
2024-04-10T15:38:00+00:00,Tewatia is looking like Miandad with a mullet,2
2024-04-10T15:38:05+00:00,"They’re not doing too badly, but it’s still criminal tactics for Hetmyer to face so few balls for RR",2
2024-04-10T15:38:08+00:00,C'mon Parag. Score some more goals,1
2024-04-10T15:38:11+00:00,"man I want to be 3rd umpire, just smoke ganja and say whatever shit you want to say",6
2024-04-10T15:38:13+00:00,Is Parag's strike rate fine because he's scored 68 and not 113?,6
2024-04-10T15:38:17+00:00,Now imagine GT losing by 1 run 😳,2
2024-04-10T15:38:18+00:00,There needs to be a 4th umpire and teams get one 3rd umpire review,3
2024-04-10T15:38:20+00:00,that catch drop was so funny. parag and samson are robbing a higher avg today,1
2024-04-10T15:38:20+00:00,Idea: a camera placed right above the pitch so we have an aerial perspective of the ball and distance determined.,2
2024-04-10T15:38:21+00:00,Sanju hasn't looked his best still scored at good strike rate that's a sign of great player,1
2024-04-10T15:38:22+00:00,Lord parag please don't fall into the vicious trap of being an anchor.,0
2024-04-10T15:38:23+00:00,What on earth is the third umpire trying to say??,1
2024-04-10T15:38:23+00:00,Damn that boundary,2
2024-04-10T15:38:27+00:00,Hit some boundaries ![gif](emote|free_emotes_pack|disapproval),4
2024-04-10T15:38:33+00:00,That too above 140,1
2024-04-10T15:38:34+00:00,Harsha salty about the old grading system. Didn’t the dude get like 95% throughout lol,4
2024-04-10T15:38:36+00:00,I can see gill getting out quickly or scoring a big match winning knock.,3
2024-04-10T15:38:37+00:00,Sanju showing how it's done,2
2024-04-10T15:38:37+00:00,"Have to slog now Bois, we have Jurel and Hetmyer to come and need 190",4
2024-04-10T15:38:37+00:00,GT making sure SunTzu gets on that plane to US 🗣️,2
2024-04-10T15:38:39+00:00,Samson denying us a magnificent Parag Century,5
2024-04-10T15:38:42+00:00,I think we praised Nehra a bit too much.,5
2024-04-10T15:38:44+00:00,Sanju cheeky Samson,2
2024-04-10T15:38:44+00:00,Need sixes guys,2
2024-04-10T15:38:46+00:00,Butlerson,5
2024-04-10T15:38:48+00:00,What a shot Sanju,3
2024-04-10T15:38:51+00:00,Is this a Virat kinda pitch? i.e. slow?,4
2024-04-10T15:38:51+00:00,That's how you ramp it YBJ,3
2024-04-10T15:38:54+00:00,Guys tewatia is giving a tribute to his ex  captain okay it was a show of gratitude that's why he dropped the catch don't worry,2
