Timestamp,Comment,Upvotes
2024-04-10T18:26:14+00:00,"Post Match Thread

https://www.reddit.com/r/Cricket/s/iyHnuLsFqz",1
2024-04-10T12:42:57+00:00,"For those of you that have missed it, Ravi Shastri's either on a bender or has had his twitter hacked.

[I am hottie, I am naughty, I am sixtyyyy 🥵](https://twitter.com/RaviShastriOfc/status/1777932030602572200?t=zkoqKQoekvj819V3vgRO9Q&s=19)

[Does this photo qualify as a thirst trap? 🤨](https://twitter.com/RaviShastriOfc/status/1777974797202526601?t=biHwdKkrsrDjkjDMIM0x8A&s=19)",5
2024-04-10T12:47:53+00:00,Battle of Indian future openers,2
2024-04-10T12:48:32+00:00,stoppable force vs moveable object,-11
2024-04-10T13:03:45+00:00,"I swear on my life, whenever I watch the match the wicket falls, the day I skip it's a 200 runs score 

I haven't seen a single klassen-rinku inning all this IPL except last match where both failed 

Never seen a rohit-kohli inning, I like RR whenever I watch them jaiswal fails, last inning I closed the match after jaiswal scoring duck, and inform buttler made century ( I got back and riyan got out the first ball I watched) 

But today I will not watch this match when RR bats, and I can bet my life, yassu will perform today 

Bookmark this",7
2024-04-10T13:07:43+00:00,Rr finna make it 5-0 ig,1
2024-04-10T13:10:32+00:00,Test for gill captaincy...,3
2024-04-10T13:12:53+00:00,"Hoping for a win, please don't ruin my birthday RR (⁠;⁠ŏ⁠﹏⁠ŏ⁠)",6
2024-04-10T13:13:06+00:00,Props to the BCCI for arranging for these two boring ass teams to play midweek on Wednesday.,-13
2024-04-10T13:17:56+00:00,What is more worth it this match or  3 Body Problem on Netflix.....?,3
2024-04-10T13:18:12+00:00,"Another Low-Scoring affair, battle of the bowlers! If GT comes to bat first, I highly doubt if they can get to 150 🤦🏼‍♂️",4
2024-04-10T13:19:05+00:00,[deleted],1
2024-04-10T13:23:43+00:00,Anyone getting a 504 Gateway Timeout for the English stream on the Willow app? The Hindi stream works fine but not sure I can stand another few minutes of Sidhu and Harbhajan...,5
2024-04-10T13:29:18+00:00,"let me present to you the name for RR vs GT match: The Dhandha Derby 

Dhandha = business. People from both the states are known for their business acumen.",2
2024-04-10T13:29:39+00:00,">the square has been covered. The rain is very light at the moment.

Dear weather, please send some of that rain to Hyd as well!! 🤔",3
2024-04-10T13:30:33+00:00,If you don't want Jio cinema you can watch [Insiders](https://www.bigcric.site/ipl/0.html?channel=Insiders&100424) here and [adsfree](https://www.bigcric.site/ipl/0.html?channel=adsfree-eng-ipl&100424) too no more irritating apple ad. Click cancel on popup,11
2024-04-10T13:31:24+00:00,"I support gt , but I wish rain falls so that gt can get atleast one point, bcuz I don't think gt got any chance to win against rr, terrible batting performance to set any good score",2
2024-04-10T13:32:43+00:00,who’s the female presenter alongside finch?,2
2024-04-10T13:33:12+00:00,The rain will help with the seam movement. Will love it if RR wins the toss,1
2024-04-10T13:34:05+00:00,Anyone from Jaipur here? Does the weather look good enough to have a game today in any way possible?,4
2024-04-10T13:34:32+00:00,"Hoping for a GT win, the underdogs should also win sometimes. You hear that Jay Shah?",3
2024-04-10T13:35:16+00:00,Someone posted a picture of lightning in the backdrop of the Jaipur stadium. Hoping we get as good shots as well today. ,7
2024-04-10T13:35:59+00:00,whats bkt that seems to be sponsoring every team?,2
2024-04-10T13:38:15+00:00,[deleted],5
2024-04-10T13:38:15+00:00,What's the reason for delaying the toss when it's raining? Wouldn't they be able to start quicker if they got done with it while it's raining,5
2024-04-10T13:38:43+00:00,"The only thing I don't like about rain is when matches get delayed but other than that, rainy and cloudy weather is absolute peace and the fact that people place summer above winter and rain is beyond me",2
2024-04-10T13:38:48+00:00,"I'm really not so familiar with the possible different combinations for GT if they want to switch things up.

Is there a reasonable set of player changes that could result in Karthik Tyagi getting some games?",3
2024-04-10T13:39:50+00:00,How bad is the rain?,1
2024-04-10T13:40:27+00:00,Pitch under the covers for this long and with that level of heat means it’s going to swing and move around like a bitch. Low scoring,3
2024-04-10T13:40:28+00:00,I would bet my left nut on GT winning today,3
2024-04-10T13:41:12+00:00,Low scoring match upcoming,3
2024-04-10T13:42:20+00:00,Bruh rain in dry state?,9
2024-04-10T13:42:55+00:00,Hurry up. If this rain goes on any longer than I’m in serious danger of having to do actually do the job I’m paid to do. Heaven forbid,3
2024-04-10T13:43:05+00:00,LSG and GT are only 2 years old but their management is way better than some of the oldest teams in the IPL.,3
2024-04-10T13:43:25+00:00,"Rajasthanis seeing rain for the first time in their lives

![img](emote|t5_2qhe0|8780)![img](emote|t5_2qhe0|8780)![img](emote|t5_2qhe0|8780)",15
2024-04-10T13:43:32+00:00,Toss when??,1
2024-04-10T13:44:13+00:00,send the rain to Karnataka please,3
2024-04-10T13:45:05+00:00,Will this be a rain effected game like any chance of rain in future?,2
2024-04-10T13:45:17+00:00,rain in april. good one,6
2024-04-10T13:45:18+00:00,Rajasthanis when rain :,5
2024-04-10T13:46:28+00:00,"Get on with it, clear blue skies where I'm at",3
2024-04-10T13:46:32+00:00,last time it rained and boult played the score was 5-3,36
2024-04-10T13:46:36+00:00,"What happens if it washes out, do both teams earn a point each",2
2024-04-10T13:47:37+00:00,Rajasthan pls send some rain to Bengaluru ◉⁠‿⁠◉,4
2024-04-10T13:48:08+00:00,Rain....so maybe Toss would be crucial?,4
2024-04-10T13:48:52+00:00,according to [this radar there isn't much rain](https://www.accuweather.com/en/in/jaipur/205617/weather-radar/205617),1
2024-04-10T13:50:05+00:00,Chahal is a one trick pony. All his wickets were just throwing the ball wide. No wonder he is so trash in internationals. ,-14
2024-04-10T13:50:33+00:00,[removed],0
2024-04-10T13:51:30+00:00,We have no game for a week after this. We will play DC at 17th,6
2024-04-10T13:53:36+00:00,Toss is gonna be massive today,2
2024-04-10T13:53:47+00:00,Boult first over wicket me thinks,2
2024-04-10T13:53:51+00:00,Rain delay in Jaipur? In April? Yeh chal kya raha hia weather ka (what is going on with the weather),6
2024-04-10T13:54:50+00:00,"Rain❌


Airborne Dew✅",3
2024-04-10T13:55:55+00:00,Those 31% who think rr will lose are highly optimistic people,0
2024-04-10T13:56:23+00:00,Lord umesh will turn into prime steyn if gt bowls first,3
2024-04-10T13:56:27+00:00,"bells familiar violet air squash cause stocking innocent berserk normal

 *This post was mass deleted and anonymized with [Redact](https://redact.dev)*",4
2024-04-10T13:56:33+00:00,Wade lessgo,4
2024-04-10T13:56:51+00:00,GT chose to bowl first.,5
2024-04-10T13:56:56+00:00,We batting first... I'm afraid...,1
2024-04-10T13:57:01+00:00,Rain now? Lmao what,0
2024-04-10T13:57:08+00:00,Wade + Manohar!!! GT going to give a good fight to RR here,12
2024-04-10T13:57:58+00:00,"Eat your heart out, Bengaluru.",2
2024-04-10T13:58:25+00:00,‘Batting is easy’ oh he is terrific isn’t he,11
2024-04-10T13:58:37+00:00,"As shubhman is in the opposite side , Yashashvi gonna let loose and destroy Gts bowling😂",4
2024-04-10T13:58:42+00:00,Sun Tzu Samson 🗣️,7
2024-04-10T13:58:43+00:00,"finally wade and manohar in,that 3d fraud is dropped

edit: he is still here",7
2024-04-10T13:59:00+00:00,Ohh Sanju!!,5
2024-04-10T13:59:03+00:00,Never change Sanju lol,20
2024-04-10T13:59:18+00:00,My man Samson forgot about who's playing 😭,52
2024-04-10T13:59:38+00:00,Keralite(Sanju) giving full credit of their success so far to a Sri Lankan(Sanga) just because they’re neighbours smh /s,1
2024-04-10T13:59:40+00:00,Sanju 🤝 Rohit,3
2024-04-10T13:59:54+00:00,Manohar solved his issues with Nehra it seems,1
2024-04-10T13:59:55+00:00,Chad Sanju doesn't give shit about toss decorum,6
2024-04-10T14:00:10+00:00,No miller...,1
2024-04-10T14:00:40+00:00,Vijay Shankar has mms of gt management team!!!,3
2024-04-10T14:00:42+00:00,So sharukh could come in today ig,1
2024-04-10T14:00:49+00:00,need a big opening partnership today,1
2024-04-10T14:00:50+00:00,How the hell is Shankar playing again?,3
2024-04-10T14:00:57+00:00,"Not angry with batting first, we're not a great chasing team and hopefully the grass will be wet. Get some early boundaries (easier said than done with Jaiswal's form) and we can put up a decent total. The only thing that concerns me about this GT team is that it's GT, and we can never beat GT.",5
2024-04-10T14:01:09+00:00,My boi manohar playing today excited,1
2024-04-10T14:01:12+00:00,I really want Maharaj to play today,6
2024-04-10T14:01:13+00:00,"I wish every time there was to be rain at a Cricket match, it rained at my place instead. win/win.",5
2024-04-10T14:01:22+00:00,At least our name makes sense. Wtf is this titans shit,3
2024-04-10T14:01:22+00:00,Damn no burger,3
2024-04-10T14:01:22+00:00,Whoa... No burger.. Even in substitute list,6
2024-04-10T14:01:45+00:00,Why the match didn’t start yet.,3
2024-04-10T14:01:51+00:00,I hope PRince has a great day today.,1
2024-04-10T14:02:00+00:00,HOLY FUCKING SHIT IT'S A KULDEEP SEN SIGHTING🛐🛐🛐,8
2024-04-10T14:02:06+00:00,"Jio Cinema where's my Insiders feed at??
and wtf is english worldwide",6
2024-04-10T14:02:07+00:00,"They are still playing the 3D guy, just WHY what's the sauce we're Missing to see in him for the past like 5-6 years maybe more.",2
2024-04-10T14:02:12+00:00,Why is Vijay Shankar STILL PLAYING,6
2024-04-10T14:02:17+00:00,"Getting to see jaiswal bat asap is a win win for me in any situation.
Hopefully he cashes in tonight",2
2024-04-10T14:02:24+00:00,"Drops Kane, keeps Shankar! What's GT cooking?",3
2024-04-10T14:02:25+00:00,Maharaj time tonight,4
2024-04-10T14:02:30+00:00,Gill vs Jaiswal,2
2024-04-10T14:02:58+00:00,[deleted],3
2024-04-10T14:03:13+00:00,so a slight delay because of rain I assume,1
2024-04-10T14:03:14+00:00,so burger is out for rr but kishore is not in for gt,2
2024-04-10T14:03:33+00:00,Why is this game delayed?? They want to make the batsmen play while half asleep 😴 💤? A,0
2024-04-10T14:03:47+00:00,Hope Jaiswal performs tonight,3
2024-04-10T14:03:50+00:00,"Wtf was that RCB kingfisher ad, made zero sense guess the management got hold of the marketing department too.",7
2024-04-10T14:03:58+00:00,"Cricbuzz, its Sen not Saini who's playing",2
2024-04-10T14:04:09+00:00,"Rr doesn't understand, ""don't fix what's not broken"". Why maharaj when burger was good",4
2024-04-10T14:04:21+00:00,"Burger is under investigation by the health department, sorry to inform you all ",3
2024-04-10T14:04:52+00:00,"TF how many ads, i thought the game starts at 730",2
2024-04-10T14:05:00+00:00,We might see SRK as an impact player today for GT,3
2024-04-10T14:05:13+00:00,Come on josh buttler get the fifth win for your team,2
2024-04-10T14:05:31+00:00,RR going with 3 overseas?,2
2024-04-10T14:05:47+00:00,Burger???????????????,2
2024-04-10T14:05:59+00:00,"I swear to god if I see that salivating old man saying ""jitade mujhe chamchamati car"" I'm gonna shoot somebody",6
2024-04-10T14:06:16+00:00,"Chahal in the 11 when you are batting first is low IQ stuff. Also, not utilizing your foreigners quota.",3
2024-04-10T14:06:17+00:00,"When GT was made. Everyone thought they will finish last but they won and played final 2nd time. Hence, no one is a cricket expert. Its just opinions",10
2024-04-10T14:06:43+00:00,No Insiders today??,1
2024-04-10T14:06:55+00:00,kinda guilty that i watched splitsvilla once upon a time.. ![img](emote|t5_2qhe0|21267),2
2024-04-10T14:07:00+00:00,"Burger is injured so he wouldn't be played today.

The match is said to start at 7.40 pm IST",2
2024-04-10T14:07:01+00:00,"Forgot we still have Saini on the books. Hopefully the rest of the pace battery can stay fit, I never want to see him and his beamers again ",3
2024-04-10T14:07:38+00:00,"Isn’t Rajasthan so hot, they barely ever see a rain ☔️? Rain drops must’ve evaporated half way up in the air.",2
2024-04-10T14:08:02+00:00,Boss Juttler with another century,1
2024-04-10T14:08:05+00:00,One more day of Ash Anna telling Parag how to play.,3
2024-04-10T14:08:28+00:00,Insider stream where,2
2024-04-10T14:08:37+00:00,I quite liked the pink RR jersey. Hope they wear that again sometime.,3
2024-04-10T14:08:40+00:00,Is Danny Morrison on the commentary team this season?  Don't think I've heard his dulcet tones yet...,3
2024-04-10T14:09:19+00:00,Shahrukh Lhan only plays in the V. He can hit only on long on and off. Barely over covers and barely plays a short ball. Did not do anything for punjab. Lets see how he does for GT,2
2024-04-10T14:09:26+00:00,gill bowlng?,3
2024-04-10T14:09:32+00:00,if someone has an update about insiders comm please let me know,2
2024-04-10T14:09:34+00:00,Where the fuck is insider feed 😡😡🤬,3
2024-04-10T14:09:37+00:00,If only we could have some of the rain gods to shower their blessings in Bangalore,3
2024-04-10T14:09:37+00:00,captain gill vs the pink panthers,3
2024-04-10T14:09:59+00:00,Not another game with this clueless blabbermouth Harsha Bhogle! Harsha is insufferable! What happened to Manjrekar? ![img](emote|t5_2qhe0|8779),-6
2024-04-10T14:10:03+00:00,Why tf isn't insiders feed available!?,3
2024-04-10T14:10:05+00:00,Jaiswal is going bonkers else 7(10),4
2024-04-10T14:10:24+00:00,"Wade is playing, GT were missing that feisty cunt",2
2024-04-10T14:10:27+00:00,"Jaiswal don't walk on pitch today, I wanna see some jasball.",4
2024-04-10T14:10:32+00:00,Rain in Jaipur!? Wtf,5
2024-04-10T14:10:35+00:00,"If Jaiswal doesn't yeet 1st 2 balls for sixes , i ll change my name",5
2024-04-10T14:10:46+00:00,Come on Jaiswal. You're not being picked with your current garbage form,5
2024-04-10T14:10:47+00:00,What a year 2024 jaipur having rain banglore doesn't have enough water,3
2024-04-10T14:10:49+00:00,Without miller GT doesn't look the same team,9
2024-04-10T14:11:04+00:00,With no Hardik and Shami and Rashid out of form this GT team doesn’t look like reaching playoffs this season.,7
2024-04-10T14:11:14+00:00,ybj finally got new pads!!!!,11
2024-04-10T14:11:53+00:00,Jaiswal should give himself some time to get in rather than just cunting ball one today. Needs to find his flow before he starts smashing,6
2024-04-10T14:12:00+00:00,Jaiswal finally got new pads,5
2024-04-10T14:12:00+00:00,I see its RR s the home team . I can see all 32 RR supporters in the stands,3
2024-04-10T14:12:07+00:00,Can't find the insiders wtf,4
2024-04-10T14:12:18+00:00,Why still 3D is playing???,4
2024-04-10T14:12:27+00:00,Umesh Bhoolav,3
2024-04-10T14:12:31+00:00,Jaiswal looks in for a big one today,3
2024-04-10T14:12:32+00:00,I think the English feed is Insiders. Can hear Scotty and Zaheer,5
2024-04-10T14:12:35+00:00,we need duckett to help out jaiswal again. get out of the counties bruv,17
2024-04-10T14:12:41+00:00,Idk about y’all but I like aakash chopras commentary,4
2024-04-10T14:12:42+00:00,Celebrating every ball that Jaiswal doesn't get out!,10
2024-04-10T14:12:43+00:00,[deleted],11
2024-04-10T14:12:54+00:00,Umesh bowling good lines. Jaiswal unable to move,7
2024-04-10T14:12:58+00:00,These are the type of ground we will get to see in USA t20 wc,16
2024-04-10T14:13:14+00:00,Do we already have our top 4? Kkr srh csk rr? Imo it's looking rough for other teams. Let's see,7
2024-04-10T14:13:21+00:00,Looks like old pads didn't work for Jaiswal so he went for new pads this game,9
2024-04-10T14:13:51+00:00,"God hope jaiswal will score 50+ today, wc is cumming",6
2024-04-10T14:14:11+00:00,So now the insiders won’t have fun between the matches as they are now doing serious commentary,6
2024-04-10T14:14:23+00:00,RR has 70% chances of winning today.,2
2024-04-10T14:14:38+00:00,Joshua Little was bowling well last season. Nehra completely dumped him this season for new bbl toy!,3
2024-04-10T14:14:41+00:00,Time for Jaisball to arrive in IPL 2024,1
2024-04-10T14:14:43+00:00,I hope Jaiswal becomes a great of the game. Likewise for Gill.,2
2024-04-10T14:14:44+00:00,Brother got lucky lol,2
2024-04-10T14:14:44+00:00,Is it a spin friendly pitch?,1
2024-04-10T14:14:45+00:00,Lol the Zinta-pant ad is funny,1
2024-04-10T14:14:55+00:00,So my boy has decided to play proper cricketing shots this time,2
2024-04-10T14:15:01+00:00,Shankar in the starting line up rip,2
2024-04-10T14:15:09+00:00,I feel it’s going to tewatia’s day out,3
2024-04-10T14:15:11+00:00,Well atleast Matthew wade is gonna be a surety in our World Cup squad,3
2024-04-10T14:15:24+00:00,Spencer 1st ball short incoming?,2
2024-04-10T14:15:27+00:00,GT looked unbeatable their first two seasons. Now looks painfully average.,4
2024-04-10T14:15:33+00:00,Is jaiswal out of form or is same like other getting down on ipl after india debut ....,2
2024-04-10T14:15:34+00:00,Ahh daddy Jos 🥵🥵🥵,4
2024-04-10T14:15:34+00:00,">These are the type of ground we will get to see in USA t20 wc

wi have the most diverse pitches in the world, you can’t predict it imo. the recent wi vs eng series had scores ranging from 220+ to 160 ish",7
2024-04-10T14:15:44+00:00,Let's see how good is spencer,3
2024-04-10T14:15:45+00:00,Today is Jaiswal vs Gill who’s going to NY 😭,5
2024-04-10T14:15:49+00:00,Jazball?,2
2024-04-10T14:15:52+00:00,"Why is burger not playing today?

He isn't even in the impact player subs",3
2024-04-10T14:16:17+00:00,"Oh god, when will the insiders be back? I can't listen to boomer Sunny G rambling and waffling about",3
2024-04-10T14:16:21+00:00,wridhhi injured or tactical change?,1
2024-04-10T14:16:24+00:00,Why doesnt IPL market GT vs RR as Western Derby,3
2024-04-10T14:16:26+00:00,Why is Buttler batting ?,0
2024-04-10T14:16:33+00:00,Do you think Rashid gets angry looking at what abomination Afghani momos are,5
2024-04-10T14:16:36+00:00,"What is Rashid's age?

- 16

- 22

- 28

- 30+",4
2024-04-10T14:16:38+00:00,Btw anyone else noticed how Sai's batting has been getting better each match.,4
2024-04-10T14:16:50+00:00,I’ll bet 5$ that Rajasthan Royals won’t get past 155 😂😭,4
2024-04-10T14:16:52+00:00,Isn't jos also a racist?,-3
2024-04-10T14:17:02+00:00,Too many dots from Jaiswal today 😔,2
2024-04-10T14:17:08+00:00,There’s no demons in this pitch it seems. Bounce seems consistent. Pace okay. Not a road but dosent look cooked/excessive moisture from being under the covers,4
2024-04-10T14:17:30+00:00,Buttler vs Gill for cabin partner of the match award,3
2024-04-10T14:17:38+00:00,We need a Little Josh inthe this GT team...,4
2024-04-10T14:17:38+00:00,Is it just me or does Rajasthan's all pink jersey actually look better than their usual kit?,70
2024-04-10T14:17:48+00:00,"200 boundaries in the IPL for Yashasvi Jaiswal.   
  
Only Sunil Narine, Andre Russell and Virender Sehwag have a better balls/boundary ratio in the IPL than Jaiswal, who has hit a boundary every 4.1 balls.",10
2024-04-10T14:17:52+00:00,Jaiswal vs gill today for t20i opening slot,16
2024-04-10T14:18:21+00:00,Gt will play with 5 bowlers only then until Tewatia bowls some,6
2024-04-10T14:18:28+00:00,Jaiswal has misplaced his mojo,14
2024-04-10T14:18:42+00:00,Are those Kohli Kohli chants going around??,0
2024-04-10T14:18:50+00:00,The opening partnership will decide 90% of the match.,2
2024-04-10T14:18:52+00:00,Chill jaiswal bro... Take your time,11
2024-04-10T14:19:14+00:00,"We really need Jaiswal in form for the WC.

Hoping for a century here...",3
2024-04-10T14:19:19+00:00,Wtf is that kingfisher ad,4
2024-04-10T14:19:24+00:00,Fraudwal pls go away bring my boi jazball back,0
2024-04-10T14:19:34+00:00,Pretty in Pink 😃,1
2024-04-10T14:19:44+00:00,Sangakkara is smart but I once saw his bat slipping and hit wicket. Funny shit.,5
2024-04-10T14:19:51+00:00,Wtf is rivalry week? These are just regular match ups,4
2024-04-10T14:19:53+00:00,[deleted],1
2024-04-10T14:19:55+00:00,Is it just me or does anyone else find it satisfactory when the screens circling the boundary lines get damaged a little,3
2024-04-10T14:20:08+00:00,"If someone is tactically removed from the 11 by declaring them injured when they are actually not, its a good thing imo cuz it doesn’t affect their confidence and its better than just declaring that they are out of the game.",6
2024-04-10T14:20:18+00:00,What was the point of that kingfisher ad? Like what product are you trying to sell me? ,5
2024-04-10T14:20:30+00:00,"marble touch snatch public point offer reach upbeat tap languid

 *This post was mass deleted and anonymized with [Redact](https://redact.dev)*",6
2024-04-10T14:20:42+00:00,This attack is toothless without Shami breaking open the top order. With him the bowling balance was complete.,4
2024-04-10T14:20:58+00:00,A KLesque innings from Jaiswal. Hopefully it's just an attempt to get to form and doesn't go his way of SR is overrated batting.,1
2024-04-10T14:21:03+00:00,Spencer Johnson gives off American high school bully vibes,6
2024-04-10T14:21:03+00:00,Hope Wade does well today and continues it to the t20wc in June. Tim David is not the best finishing option for Aus,5
2024-04-10T14:21:07+00:00,Man he is so nervous,7
2024-04-10T14:21:14+00:00,"The model playing Zomato delivery boy been paid fraction of what the stars made, though he shot the same ad 20 time..",4
2024-04-10T14:21:16+00:00,Oh Zak is in the insiders? When did he leave the mi coaching staff?,4
2024-04-10T14:21:23+00:00,Yashasvi pls come back in form pls,4
2024-04-10T14:21:30+00:00,"Jaiswal buddy, you need to find form or else they might make Rohit and Virat open in the WC",3
2024-04-10T14:21:33+00:00,"if you are on 4(3) and you get out on the next ball bowled, is your final score 4(3) or 4(4)",0
2024-04-10T14:21:48+00:00,"in this ipl, all opening performances are inflated from the avg t20i knock due to the impact rule adding more freedom up top so when an opener is struggling, it adds a lot of doubt on how they’ll perform in the wc",1
2024-04-10T14:21:49+00:00,"Anyone can hit umesh yadav , jaiswal waiting for Rashid khan",2
2024-04-10T14:21:50+00:00,why are they playing like rcb in the powerplay,2
2024-04-10T14:21:56+00:00,Is Jaiswal a test specialist?,2
2024-04-10T14:21:56+00:00,Why sunny G getting special commentary show. And why insiders is cancelled,2
2024-04-10T14:21:57+00:00,Imho out of form players should use the nets to practice getting back in form rather than the powerplay,4
2024-04-10T14:21:58+00:00,Why are all our first choice players for t20wc struggling this ipl season,8
2024-04-10T14:21:59+00:00,"Kane Williamson? i think his time in the IPL is over; with him being an O/S and not adapting to the all out guns blazing T20 requires, no space for him in the IPL",2
2024-04-10T14:22:14+00:00,"Jaiswal vs gill anchoring challenge: you win, you get to go to NY!",3
2024-04-10T14:22:20+00:00,"Jais boi playing with a sr under 100 , washed /s",2
2024-04-10T14:22:21+00:00,Jaiswal is struggling big time this IPL,2
2024-04-10T14:22:27+00:00,"Yashasvi "" kl "" jaiswal",1
2024-04-10T14:22:36+00:00,Vijay Shankar finds a spot once again!! Hope 6th time's the charm,1
2024-04-10T14:22:37+00:00,"Jaiswal holding back hints he will go big tonight,",3
2024-04-10T14:22:37+00:00,This ain't our jaiswal.  He's some imposter,4
2024-04-10T14:22:39+00:00,Nice to see YBJ taking his time,4
2024-04-10T14:22:39+00:00,jio cinema is pausing the match while opening the other tab what sht app is this man,4
2024-04-10T14:22:44+00:00,Jaisball is back on the menu boyos,6
2024-04-10T14:22:56+00:00,"How do you decide Display Name? For some its surname, for some its first name. Do you submit it to BCCI somewhere",2
2024-04-10T14:23:04+00:00,Jaiswal looking very scratchy,2
2024-04-10T14:23:05+00:00,"genuine question can 2 bowlers split an over? like say Umesh bowsl the first 3 balls then Johnson bowls the next 3, can they do that until they both get to 4 overs each?",2
2024-04-10T14:23:08+00:00,Not Jaiswal becoming another anchor 😫,2
2024-04-10T14:23:14+00:00,"Last time Jaiswal played this way, he got 2 biggies,2 double 100s against England. Jaiswal gonna get a 100 tonight! ![gif](emote|free_emotes_pack|flip_out)![gif](emote|free_emotes_pack|flip_out)",2
2024-04-10T14:23:15+00:00,Jassu is nervous af,3
2024-04-10T14:23:15+00:00,"Sucks to see Jaiswal struggling, I hope he finds form soon.",3
2024-04-10T14:23:15+00:00,"Rotate the strike you ball hog, you literally have Buttler on the other end",1
2024-04-10T14:23:17+00:00,Umesh just keeps on rediscovering himself as t20 bowler,4
2024-04-10T14:23:24+00:00,Rr and Gt have the potential of great rivalry as they have 2 players who can become superstars for Indian cricket in the next decade and already played final once.,5
2024-04-10T14:23:24+00:00,"YBJ channeling his inner Koach

&#x200B;

&#x200B;

&#x200B;

&#x200B;

&#x200B;

/s",4
2024-04-10T14:23:25+00:00,Yes Jaiswal is struggling. But you’d be stupid to forget what the man is capable of. Just needs to get himself in,6
2024-04-10T14:23:27+00:00,Finally Jaiswal gets one past the fielders,3
2024-04-10T14:23:34+00:00,Jaiswal was so different last season,2
2024-04-10T14:23:35+00:00,My mate Jaiswal played too much test cricket.,8
2024-04-10T14:23:37+00:00,This shows how momentum is a big thing in sports,2
2024-04-10T14:23:38+00:00,"So Thursday its MI RCB and Sunday its MI CSK. Single Header of Both (Untill they face in QF's). Considering the news & Mega Auction in December. Are we witnessing Last Dhoni vs Rohit, Rohit vs Virat?. Most chances are Dhoni wont Play 2025 & Rohit movies somewhere else. IPL is truly changing the guards people watching from 2008 its an end of an era.",6
2024-04-10T14:23:47+00:00,3 dots and a 4 everytime ain't gonna cut it...rotate the bloody strike,1
