Timestamp,Comment,Upvotes
2024-04-21T16:59:30+00:00,Another last over finish for PK?,1
2024-04-21T16:59:57+00:00,"When will ICT produce players like Livingstone ?

Can tonk, can bowl leg spin, can bowl off spin. 


We need 3D players like him and not Lord Shankar",5
2024-04-21T17:00:13+00:00,They’re still behind RRR get moving GT,2
2024-04-21T17:00:21+00:00,Sai can be a good odi player.,3
2024-04-21T17:00:26+00:00,it will be just sad if we cant score 55 runs in 40 balls,2
2024-04-21T17:00:26+00:00,This match is not for people with attention span of an Instagram reel...,11
2024-04-21T17:00:27+00:00,"If this was a 200+ game, we would have gotten 5k+ comments till now",6
2024-04-21T17:00:35+00:00,"Whoever answered that poll was born after 2020.

Miller is a Punjab legend",11
2024-04-21T17:00:40+00:00,Guys please now increase your nrr,3
2024-04-21T17:00:45+00:00,How many does Harshal have left? He'll be a handful on this pitch,3
2024-04-21T17:00:55+00:00,Nice controlled test match inning from Sai,8
2024-04-21T17:00:55+00:00,Wallahi Sai Sudarshan is so bad lmfao. 25 runs off 30 balls. At least play with a 120 sr as an anchor,8
2024-04-21T17:00:58+00:00,Sai plays like he's rescuing the team from a 15-5 collapse. In what world is 26(31) acceptable in a T20???,11
2024-04-21T17:01:14+00:00,"Slogfests on batting-friendly pitches - ❌

Snoozefests even on batting-friendly pitches - ❌

Mid-score Thrillers on Tough fightful pitches - ✅",7
2024-04-21T17:01:14+00:00,Gujarat desperately need the tactical wicket of sudarshan at this point,4
2024-04-21T17:01:17+00:00,GT should have gone harder in the PP rather than fucking about struggling to make runs now. The teams that play with an antiquated approach are the ones that struggle,1
2024-04-21T17:01:18+00:00,Please don't give me hope punjab.,0
2024-04-21T17:01:27+00:00,Nice slow-burner this game. They need Sudarshan to see it through to the end.,5
2024-04-21T17:01:30+00:00,"Okay livi is gone, please start hitting a bit more GT",3
2024-04-21T17:01:38+00:00,Sudarshan is stinking up the chase but GT has two clutch players to come in Tewatia and Rashid.,7
2024-04-21T17:01:58+00:00,Punjab defending this total will be the biggest breath of fresh air in a long time,4
2024-04-21T17:02:05+00:00,Punjab common don't give hope to your fans,1
2024-04-21T17:02:06+00:00,Gt is literally OG Srh,6
2024-04-21T17:02:22+00:00,Sudarshan plays way too slow dude,1
2024-04-21T17:02:26+00:00,Dead thread on sunday evening!! Blame the scheduling,3
2024-04-21T17:02:27+00:00,Same usual last over Punjab loss,3
2024-04-21T17:02:40+00:00,"At this point, Sai's not even the anchor, he's the iceberg the ship had crashed into.",6
2024-04-21T17:02:59+00:00,I am convinced that gt is srh of 2018 but just lack a good qualify pacer other than mohit and a good batter other than gill,8
2024-04-21T17:02:59+00:00,"You can’t even call this anchoring, the anchor is fucking pulling the ship down",2
2024-04-21T17:03:12+00:00,"This was GT's chance to recover NRR, made a mess of the chase through negative batting",7
2024-04-21T17:03:22+00:00,"Need a hattrick when Omarzai’s on strike to eliminate him, Tewatia and Rashid all in one fell swoop",6
2024-04-21T17:03:51+00:00,"IPL after inventing PBKS & RCB

**Profit**",6
2024-04-21T17:03:56+00:00,Not gonna lie Sam curran is giving much better captaincy vibes than Dhawan. Hope he stays captain even if Dhawan comes back,3
2024-04-21T17:03:59+00:00,Why Curran have white hair in that Pic? He looks like Witcher,1
2024-04-21T17:04:02+00:00,The world is not ready for 2 back to back bangers today.,3
2024-04-21T17:04:14+00:00,My dumbass was in the afternoon match thread confused as hell🤡,10
2024-04-21T17:04:25+00:00,Sai brother come on show some intent pls 🙏,1
2024-04-21T17:04:36+00:00,Jio really planning to announce a paid tier mid-IPL?,3
2024-04-21T17:04:39+00:00,Kohli's tantrums single handedly pulling RCB's fair olay score,2
2024-04-21T17:04:45+00:00,Sai Sudarshan is gonna have a 5 wicket haul at this rate,2
2024-04-21T17:04:46+00:00,"Extra Marks for good Handwriting? 

How can some teams are averaging above 10 in fairplay awards ?",3
2024-04-21T17:04:53+00:00,"These are kinda games where boundaries have an actually value, that six from omar was an actual six.",4
2024-04-21T17:05:05+00:00,Hear me out. Fair play top 4 gets playoffs,5
2024-04-21T17:05:12+00:00,“RCB bottom at both tables”😭😭,3
2024-04-21T17:05:20+00:00,"RCB bottom of the points table and fair play table.

Ee Sala 10th spot namde",1
2024-04-21T17:05:26+00:00,Noty noty rcb,2
2024-04-21T17:05:28+00:00,I was gonna say 50 off 30 is doable but I have just watched RCB vs KKR today,2
2024-04-21T17:05:33+00:00,Sudarshan in place of Iyer/ patidar for wtc,2
2024-04-21T17:05:37+00:00,"Having anchors at the top in T20s doesn't make sense. GT, for example, have plenty of hitters in the middle order, but can they therefore produce roads to try and win run-fests? No, because then, the anchors at the top would probably cruise along nicely for the Titans to end up at 180-odd, which will then be easily chased down.

Anchors in a batting order therefore, should be few, and heavily relied upon only when the team is already in trouble, or when chasing low scores on tough pitches. This might seem 'cheap', but to win in modern T20 cricket, this is probably the best way.",1
2024-04-21T17:05:39+00:00,"All. I wish for is a thrilling pant shitting low score chase

We had a thrilling pant shitting high run chase this afternoon, this low scoring would be perfect",1
2024-04-21T17:05:40+00:00,"Any game. It’s always RCB that loses

“Bottom of both tables” fair play and points one",3
2024-04-21T17:05:46+00:00,"Credit where due, PBKS plays a lot of incredibly close games. Highly entertaining for neutral fans, and probably nerve wracking for their fans.",8
2024-04-21T17:05:52+00:00,"Who needs fair play, focus should be on winning title",3
2024-04-21T17:05:53+00:00,"> I am convinced that gt is srh of 2018 but just lack a good qualify pacer other than mohit and a good batter other than gill

Gt literally has the best T20 player in the world i.e. Rashid Khan, a finisher like Tewatia, and guys like Umarzai & Miller.",1
2024-04-21T17:06:05+00:00,GT planning to bottle this?,1
2024-04-21T17:06:11+00:00,"Tewatia will somehow win this again, after all its Punjab",1
2024-04-21T17:06:36+00:00,Stooooop the presses he hit a boundary,2
2024-04-21T17:06:39+00:00,Can't bowl there ffs,1
2024-04-21T17:06:44+00:00,Dry state vs anti-dry state,5
2024-04-21T17:06:47+00:00,Finally!!!,1
2024-04-21T17:06:51+00:00,Wrong wicket,5
2024-04-21T17:06:51+00:00,Tactical wicket by GT,5
2024-04-21T17:06:56+00:00,Man he got the wrong guy ffs,7
2024-04-21T17:06:58+00:00,GT really doing an RCB here....,6
2024-04-21T17:06:59+00:00,Atleast it wasnt as bad as Padikkal's 40(52).,6
2024-04-21T17:06:59+00:00,Advantage gt,11
2024-04-21T17:07:00+00:00,Nooo he was playing for us,16
2024-04-21T17:07:01+00:00,31(34) 💀,13
2024-04-21T17:07:10+00:00,Advantage: GT,3
2024-04-21T17:07:13+00:00,Tactical wicket for gt,3
2024-04-21T17:07:18+00:00,Good fight form Punjab. Unfortunately they're playing with just two batters and a low IQ management.,4
2024-04-21T17:07:23+00:00,I'm pretty sure PBKS is gonna fight their very best and continue their streak of taking games till the very last over........ only to finally lose there,9
2024-04-21T17:07:25+00:00,Tactical chop on,3
2024-04-21T17:07:26+00:00,Game about to be over now. Pbks second most hated player coming,4
2024-04-21T17:07:32+00:00,thank you punjab,3
2024-04-21T17:07:32+00:00,Proper T20 Terrorism from Sai Sudharshan.,9
2024-04-21T17:07:37+00:00,Fuking match losing innings. Ate up more than 1/4th of the runs for 30 runs. Absolutely pathetic.,2
2024-04-21T17:07:38+00:00,Good-bye anchorshan,2
2024-04-21T17:07:41+00:00,They be impact playing for opps,3
2024-04-21T17:07:42+00:00,Pbks getting ready for that 20th over loss,5
2024-04-21T17:07:45+00:00,"Sai sudharshan is besties with Bhatia, MY 2 STATES.",3
2024-04-21T17:07:56+00:00,"Shahrukh, Tewatia the iceman, Rashid still to come. Easy win this for GT. PBKS might as well pack their bags and leave",1
2024-04-21T17:07:57+00:00,TukTuk Academy salutes Sudarshan's efforts.,3
2024-04-21T17:07:58+00:00,Ayoo check my comment history i predicted this sh*t. I knew gt will try to bottle this,3
2024-04-21T17:08:03+00:00,Nice ODI innings Sai unfortunately ODI WC has 3 years left,7
2024-04-21T17:08:07+00:00,Advantage PBKS.,2
2024-04-21T17:08:12+00:00,Punjab should retain shyam karan consistent performer,2
2024-04-21T17:08:14+00:00,Ptsd for punjab,4
2024-04-21T17:08:15+00:00,"**14.4** **chopped on!** Sammy Cuz-Cuz strikes back! Length ball, scrambled seam and Sai plays a flat-footed jab that detonates his own stumps

Sai Sudharsan b Curran 31 (34b 3x4 0x6) SR: 91.17",1
2024-04-21T17:08:18+00:00,Punjab deserves this win.,3
2024-04-21T17:08:19+00:00,Nooo Tewatia 😭😭😭,2
2024-04-21T17:08:19+00:00,All these take it deep merchants are failing miserably this year still they won't change their game plan,4
2024-04-21T17:08:23+00:00,"Does GT have the most number of tuk tuk players ??? 

Sai, Shankar, Williamson, Gill",3
2024-04-21T17:08:28+00:00,No tewetia,1
2024-04-21T17:08:39+00:00,One of the worst knocks I've ever seen,3
2024-04-21T17:08:45+00:00,Rip Punjab it's tewatia,7
2024-04-21T17:08:47+00:00,Jay Shah can't write a straight forward match for  Punjab,3
2024-04-21T17:08:50+00:00,"Tewatia will again fuck Punjab up man, oh the memories.",7
2024-04-21T17:08:59+00:00,Bossman enters,3
2024-04-21T17:09:01+00:00,"Sam Curran seems to squeeze out every bit of his skills for Punjab and also seems very emotionally invested in the team

Punjab management needs to keep this guy with them for a long time",8
2024-04-21T17:09:02+00:00,GT needs to seriously sort out the batting order. Its literally nothing without Gill and Miller.,2
2024-04-21T17:09:03+00:00,Tewatia gonna finish this off in 8 balls and shout a massive fuck you to everything and leave.,5
2024-04-21T17:09:03+00:00,"T20 cricket on flat wickets these days is like, if you sped up the courts in tennis so much that only serving mattered. Fuck Nadal's defense, Djokovic's backhand, Federer volleys etc. We only want to see aces bro. T20 batting is only testing one facet of batting. Hitting. Fuck defensive technique, strike rotation, game management, risk assessment, running between the wickets etc. A guy like Kohli is just an ordinary IPL player now because he's only being tested in one facet of the game: hitting. He's trained all his life to be a top all round player, as do most guys like Gill, Rahul etc, players who people call anchors. Soon they won't be able to compete with guys like Fraser McGurk who have optimised their technique for only one thing all their lives. That's why pitches like these are refreshing.",2
2024-04-21T17:09:06+00:00,Bowl shit get banged ft. Sam Curran,4
2024-04-21T17:09:11+00:00,Certified PBKS hater is here,4
2024-04-21T17:09:11+00:00,Why Tewatia why do you hate us bruhhh,3
2024-04-21T17:09:14+00:00,Tewatia against punjab🦁🦁🦁,1
2024-04-21T17:09:16+00:00,"Tewatia and Punjab😋😋

/s",1
2024-04-21T17:09:17+00:00,What was that filth bowling ffs,2
2024-04-21T17:09:24+00:00,"These white turbans are different than usual. 

They look really good btw",1
2024-04-21T17:09:26+00:00,Not Tewatia again please,1
2024-04-21T17:09:27+00:00,Man I remembered Sheldon Cortrell. He used to do that salute celebration and then Tewatia slapped him 5 sixes and then he disappeared from IPL.,6
2024-04-21T17:09:28+00:00,Annual fuck you PBKS innings coming from tewatia,3
2024-04-21T17:09:30+00:00,Danger man TEWATIA !,1
2024-04-21T17:09:32+00:00,Can't afford to bowl such lose deliveries,3
2024-04-21T17:09:33+00:00,"Curran's bowling is dross, free boundaries",2
2024-04-21T17:09:35+00:00,"Could pubkiss pull off a pubkiss here? I mean, in an IPL filled with record breaking batting, defending a low total would be super entertaining 😂",2
2024-04-21T17:09:36+00:00,"Titans

Hmmm 

Scrabble",2
2024-04-21T17:09:43+00:00,Nah get tewatia out I wanna see RASHID.,0
2024-04-21T17:09:46+00:00,Shyam Karan and Karn Sharma both having a good day today,1
2024-04-21T17:09:56+00:00,"Why would you get sudarshan out!?

Just why!?

Is this match fixed!?",2
2024-04-21T17:10:02+00:00,"Bring on Harshal, if he works out today will definitely get wickets",1
2024-04-21T17:10:03+00:00,Gt gona bash harshal now,1
2024-04-21T17:10:04+00:00,Punjab can get payback from Tewatia as well.,1
2024-04-21T17:10:06+00:00,"To All of the 6 Punjab fans... People always ignore you, so I ask you today

How's life man? Everything okay? You know we can always talk. I just consoled a rcb fan who went in traumatic shock. 

We can  always have a conversation",5
2024-04-21T17:10:10+00:00,Ohhhh this gon be good,1
2024-04-21T17:10:14+00:00,10 runs and wicket of Sai. Bad over for PBKS,4
2024-04-21T17:10:17+00:00,Pbks putting extra effort just to see that sardarji keep his promise of eating 50 gulab jamuns,1
2024-04-21T17:10:27+00:00,"Idk abt the squad but does GT seriously not have any batsman on bench? Other teams have JFM, Jacks, Kushagra on bench. Who does GT have? Sai shouldn't play next game.",3
2024-04-21T17:10:27+00:00,"Black pacer in Punjab ✅️

Tewatia in the middle ✅️

Tense chase ✅️

Get ready bois",5
2024-04-21T17:10:36+00:00,Yay Harshal is here. I can sleep early today.,0
2024-04-21T17:10:37+00:00,Again another overseas left armer against tewatia,1
2024-04-21T17:10:39+00:00,If Punjab can get Tewatia they have a proper chance of winning this here,3
2024-04-21T17:10:40+00:00,Patel redemption Arc,1
2024-04-21T17:10:43+00:00,Purple Patel,1
2024-04-21T17:10:55+00:00,Prem Jyotish lmao,0
2024-04-21T17:10:58+00:00,I want Omarzai to win it for GT!  If he gets out soon I want Punjab to win.,4
2024-04-21T17:10:58+00:00,Kane ![img](emote|t5_2qhe0|8781),8
2024-04-21T17:11:11+00:00,"Sudarshan playing for Punjab 

Bhatia playing for gt 

Perfectly balanced",10
2024-04-21T17:11:15+00:00,GT bought a 2 Cr waterboy Kanos,11
2024-04-21T17:11:35+00:00,The ball vs Sai didn’t bounce at all,3
2024-04-21T17:11:42+00:00,Coventry vs Man U Is Same as KKR vs RCB Today ![img](emote|t5_2qhe0|8783),1
2024-04-21T17:11:44+00:00,no way,1
2024-04-21T17:11:52+00:00,GT has been sh*t this season. Always finds a way to lose,7
2024-04-21T17:11:53+00:00,"**15.2** **nicked behind, Harshal strikes!**

Azmatullah Omarzai c †JM Sharma b Patel 13 (10b 0x4 1x6) SR: 130",1
2024-04-21T17:11:54+00:00,Should've let Brar bowl.,2
2024-04-21T17:11:55+00:00,Jay Shah on a roll today,4
2024-04-21T17:11:56+00:00,Are we coming back into this match 😂,4
2024-04-21T17:11:57+00:00,Agent SRK activated,5
2024-04-21T17:12:05+00:00,Daddy Rashid come save us,3
2024-04-21T17:12:05+00:00,[deleted],4
2024-04-21T17:12:13+00:00,"Sharukh khan legacy game by finishing pbks?


@jayshah this is a perfect script",3
2024-04-21T17:12:14+00:00,We crawling our way back.,2
2024-04-21T17:12:18+00:00,Just need 28 dot balls or 5 wickets c'mon punjabb less goo,1
2024-04-21T17:12:21+00:00,GT stop pulling an punjab,2
2024-04-21T17:12:22+00:00,These low-scorers are made for players like Williamson but he didn't get in.,2
2024-04-21T17:12:23+00:00,SRK winning the game will be almost as bad as tewatia winning it,2
2024-04-21T17:12:24+00:00,Pubkiss feels kinda different with Sam as a captain. Definitely better than Dhawan,6
2024-04-21T17:12:26+00:00,WTF am I watching & how bad are these 2 teams at batting!? 🤦🏼‍♂️,3
2024-04-21T17:12:26+00:00,"Now the match is turning Spicy ...get ready boys . ..🌶️🌶️🌶️🌶️🌶️🌶️🌶️🌶️🌶️🌶️🌶️🌶️🌶️🌶️🌶️🌶️🌶️🌶️🌶️🌶️🌶️🌶️🌶️🌶️🌶️🌶️🌶️🌶️🌶️🌶️🌶️🌶️🌶️🌶️🌶️🌶️🌶️🌶️🌶️🌶️🌶️🌶️🌶️🌶️🌶️🌶️🌶️.


.",2
2024-04-21T17:12:26+00:00,Is it just me or does this year’s GT lack the fire they had last two seasons? It’s like they don’t even fight,6
2024-04-21T17:12:27+00:00,"We have the worst batting line up in the tournament. 

I'm surprised we won 3 out of 7.",7
2024-04-21T17:12:32+00:00,Don’t give me hope,3
2024-04-21T17:12:35+00:00,"It's actually insane how much of the IPL fanbase is composed of RCB fans, especially in this sub. This thread is particularly quiet in no small part, I'm sure, due to the ever-present RCB contingent, reeling from their side's loss earlier today, sitting this game out.",1
2024-04-21T17:12:39+00:00,"One appreciate worthy thing about pubkiss is their core is punjabi- Prabhsimran, Arshdeep, 2 Harpreets.

Now finish 6th as usual and everything is fine",3
2024-04-21T17:12:41+00:00,They rely on Gillman way too much. I hope they really see it that way and not like Gills captaincy is shit replace him,8
2024-04-21T17:12:44+00:00,All this to only loose in the last over for PBKS,5
2024-04-21T17:12:46+00:00,oh my zai,6
2024-04-21T17:12:47+00:00,Our blood,3
2024-04-21T17:12:48+00:00,I really want Punjab to win this man,5
2024-04-21T17:12:53+00:00,Pretty promised these guys aloo paranthas again didn’t she 😆,3
2024-04-21T17:12:54+00:00,Woah that didn’t look out to me live! Would’ve never known except for the appeal,2
2024-04-21T17:12:58+00:00,Stoppable force vs moveable object,6
2024-04-21T17:13:01+00:00,Defending 140 in this season is like defending <120 in previous seasons. Score inflation is real.,8
2024-04-21T17:13:04+00:00,"How is 25 year old curran so much better captain than da1

Like the experience gotta count for something right",8
2024-04-21T17:13:05+00:00,How a team like GT who were so Hard to beat turned into a mere joke in one year,10
2024-04-21T17:13:30+00:00,GT middler order without Hardik is in shambles.,3
2024-04-21T17:13:35+00:00,I would’ve just sent Rashid khan instead to take care of business,0
2024-04-21T17:13:36+00:00,Can PBKS pull a reverse-PBKS?,2
2024-04-21T17:13:37+00:00,"So Tewatia, Shahrukh and then Rashid Khan, it's game over already.",2
2024-04-21T17:13:43+00:00,Shahrukh Khan came in with so much hype. Never really took off and the lit the stage.,8
2024-04-21T17:13:58+00:00,Purple Patella,3
2024-04-21T17:14:02+00:00,GT being hit hard by Shami and Miller missing.,1
2024-04-21T17:14:04+00:00,Looks like Kane will be sharing the fate of Root and Smith in next year Mega auction unless CSK buys him. Shame that his IPL career has fizzled out without a bang.,5
2024-04-21T17:14:11+00:00,if GT Bottles it today they will be same as MANU 3-0 to 3-3,8
2024-04-21T17:14:23+00:00,Gt won a similar match against mi,7
2024-04-21T17:14:23+00:00,"2 fuddu teams playing.

Lets see which fuddu team wins",7
2024-04-21T17:14:38+00:00,Sudarshan is single handedly responsible if GT lose,10
2024-04-21T17:14:42+00:00,"NGL, Sam Curran has been exceptional with his captaincy. Too bad the batting has been shit",10
2024-04-21T17:14:43+00:00,[deleted],4
2024-04-21T17:14:46+00:00,"There you go, Shahrukh batting with his favorite  character Rahul, as Preity watches on",8
2024-04-21T17:14:59+00:00,pubkiss and gt to reverse their roles of choking from winning positions and winning from losing positions,3
2024-04-21T17:15:04+00:00,"ghar k pass shadi h log DJ pe kab se ""lamba hai ri medam lamba"" wala gaana kab se chala rhe hai 🥲",6
2024-04-21T17:15:05+00:00,This is a perfect match for who wants to lose more..,3
2024-04-21T17:15:11+00:00,Hrshu about to give a boundry and ruin his entire over,2
2024-04-21T17:15:18+00:00,"Is this the day of choking, RCB and KKR simultaneously, now GT and now Man United.",5
2024-04-21T17:15:21+00:00,"Oh wait I thought it was Rashid here, what happened",0
2024-04-21T17:15:26+00:00,Gt is definitely doing the funny thing,4
2024-04-21T17:15:28+00:00,RCB and DC both looked like they would win after 10 overs of 2nd innings and then they messed up.,6
2024-04-21T17:15:43+00:00,That livi celebration brought joy to my soul.....,3
2024-04-21T17:15:43+00:00,[deleted],-1
2024-04-21T17:15:48+00:00,[deleted],8
2024-04-21T17:15:52+00:00,We deserve a reverse tewatia match. He has given us enough trauma,4
2024-04-21T17:15:55+00:00,How is Preity Zinta still so banging,11
2024-04-21T17:16:01+00:00,Typical last over loss for Pbks loading,4
2024-04-21T17:16:02+00:00,"PBKS = Punjab ""Banger"" Kings",4
2024-04-21T17:16:06+00:00,Brar now wtf?,3
2024-04-21T17:16:09+00:00,how did punjoob come close,4
2024-04-21T17:16:22+00:00,Pbks try not to make any match interesting challenge (impossible),13
2024-04-21T17:16:31+00:00,Crucial over,3
2024-04-21T17:16:31+00:00,"With the captaincy skills Curran has shown, this could be future Indian Captain vs future England Captain showdown",10
2024-04-21T17:16:42+00:00,Zinta looks so radiant even in this age!!!,7
2024-04-21T17:16:53+00:00,Game perfectly poised for Tewatia to fuck us now then piss on our corpse,18
2024-04-21T17:17:01+00:00,We all know the result. Last over loss for pbks. People aren’t falling for this again,7
2024-04-21T17:17:15+00:00,Why is Brar bowling in 16th over,3
2024-04-21T17:17:17+00:00,PBKS will drag this to the last over and somehow lose,3
2024-04-21T17:17:23+00:00,Pbks always somehow drag the match till end and give their fans hope only to lose,3
2024-04-21T17:17:24+00:00,"Kane might as well retire from the IPL. Unsold for sure next season.

His downfall started in 2021. He messed up several low scoring chases, which is his bread and butter. Utterly useless on flat tracks too because even on his best day his strike rate is like 140. Then in 2022, he has the worst season of any batsman of all time in the IPL. Basically Yuvi's 11 (21) everyday and put huge stress on Abhishek.

That elbow injury ended his career. Sad but unfortunate. Good riddance.",5
2024-04-21T17:17:26+00:00,Jay Shah giving low scoring thrillers now that we've seen many high scoring ones,3
2024-04-21T17:17:30+00:00,The fuckpiyushchawla guy might have to rename himself to fuckrahultewatia soon,7
2024-04-21T17:17:37+00:00,"This is a slow cooked Dum Biriyani, aft game was Instant fried rice.",4
2024-04-21T17:17:37+00:00,"It’s Tewatia v Punjab, again",4
2024-04-21T17:17:41+00:00,"Law of Averages doesnt work on PBKS, so they will again get fucked by Tewatia",3
2024-04-21T17:17:41+00:00,Jay shah isn’t stupid there is a reason why punjab had so many weekend matches.,7
2024-04-21T17:17:42+00:00,Brainfade,2
2024-04-21T17:17:43+00:00,Imagine if Punjab had played chahar instead of Harpreet Singh.,2
2024-04-21T17:17:43+00:00,"GT, what have you done :(",0
2024-04-21T17:17:44+00:00,That's out I am sure of it..,2
2024-04-21T17:17:49+00:00,Damn this uncle umpire really looks grumpy.,4
2024-04-21T17:17:51+00:00,That looks out,2
2024-04-21T17:17:52+00:00,Pitching outside leg surely,4
2024-04-21T17:17:53+00:00,2 wickets in this over and done,3
2024-04-21T17:17:53+00:00,Prediction: Rashid khan smacks Arshdeep to win it and acts smug.,7
2024-04-21T17:17:59+00:00,Punjab giving back to back 5 thrillers what else do we need,6
2024-04-21T17:17:59+00:00,Ball tracking should be like a right handed batter.,3
2024-04-21T17:18:01+00:00,That’s a punt on Brar,5
2024-04-21T17:18:11+00:00,What? Why? There was no need,4
2024-04-21T17:18:16+00:00,pitching i think,3
2024-04-21T17:18:18+00:00,He switched so leg side rule should be nullified,5
2024-04-21T17:18:24+00:00,"cbw

Cock before wicket",8
2024-04-21T17:18:27+00:00,Dick before wicket please,2
2024-04-21T17:18:28+00:00,Tewatia reminds me of Chabuddy,1
2024-04-21T17:18:37+00:00,Outside leg,1
2024-04-21T17:18:41+00:00,Goddamn straight in the dick ???,2
2024-04-21T17:18:41+00:00,"GT and mi played tug of war with Hardik before this year's IPL 
So he was broken into two parts 

Gt got har (loss)
Mi got dick",15
2024-04-21T17:18:42+00:00,GT trying their utmost best to lose,2
2024-04-21T17:18:44+00:00,Cameraman ![img](emote|t5_2qhe0|28120),2
2024-04-21T17:18:45+00:00,Umpires call looks like,1
2024-04-21T17:18:46+00:00,I think it’s pitching outside leg,1
2024-04-21T17:18:50+00:00,"If whether a ball is wide or not changes based on the batter's movement at the crease as the ball is being delivered, then should the ""pitching outside leg"" criteria for LBW decisions also change based on whether the batter is attempting a switch hit?",4
2024-04-21T17:18:52+00:00,"Okay I’m done for the night, this is too much to take",2
2024-04-21T17:18:54+00:00,Embarrassing,1
2024-04-21T17:18:56+00:00,Cameraman doing a great job in this match if you know you know,7
2024-04-21T17:18:59+00:00,Batsmen and (what is going on in my mind) thinking of playing reverse sweep to the balls in stumps line this IPL,5
2024-04-21T17:19:00+00:00,Right in the dick,5
2024-04-21T17:19:04+00:00,"Abhinav Mukund correctly called Tewatia going for a reverse scope in the commentary, amazing",9
2024-04-21T17:19:17+00:00,Punjab team has no chemistry players hardly talking to each other,10
2024-04-21T17:19:24+00:00,Why do these guys have such hard-on for reverse sweeps,6
2024-04-21T17:19:24+00:00,Hurry up bitches,3
2024-04-21T17:19:38+00:00,"Can’t believe Preity married that ugly ass guy. 

And I’ve seen him speak, he doesn’t even sound all that interesting or anything. Pretty blah tbh. 

What did he see in him? 

Sorry if I sound bitter lol",7
2024-04-21T17:19:42+00:00,Good decision!,1
2024-04-21T17:19:43+00:00,[removed],15
2024-04-21T17:19:45+00:00,Why isn't GT just smashing for 6 sixes? Are they stupid?,10
2024-04-21T17:20:01+00:00,"Genuine question --

For no-balls, they measure the batter's height. For ~~CBW~~ LBW, do they measure 

the knee height? Everyone has different knee heights, am I right?",-4
2024-04-21T17:20:04+00:00,"Feel like they should check ball tracking until the ultraedge shows up, will save some time",2
2024-04-21T17:20:05+00:00,"If batsman switches, pitching outside leg should not be not out",8
