Timestamp,Comment,Upvotes
2024-04-21T13:30:22+00:00,Feels like the afternoon and evening slots this time 'round,2
2024-04-21T13:35:03+00:00,At least we are chasing,3
2024-04-21T13:36:17+00:00,good lineup today,3
2024-04-21T13:36:58+00:00,Hope russouw opens this time,3
2024-04-21T13:39:01+00:00,[deleted],9
2024-04-21T13:39:40+00:00,If we can manage to win this match then we may still be in race for top 4 only if RCB manages to beat KKR,2
2024-04-21T13:40:27+00:00,PBKS or GT gang,1
2024-04-21T13:45:32+00:00,Gt vs pbks matches have been won only by the chasing team,2
2024-04-21T13:47:35+00:00,"Before the match GT looked like they've 60% chances of winning. By making them bowl first, PBKS has only helped GT. I'd say GT now has 65% chances of winning.",3
2024-04-21T13:49:12+00:00,Shikhar still out as tactical niggle injury I see,2
2024-04-21T13:49:31+00:00,"Ahhh yes....

The most awaited rivalry of new age ipl",2
2024-04-21T13:49:33+00:00,I guess Sam’s chosen to bat first just for a change. Just hope it’s not another 4 wicket powerplay yet again.,5
2024-04-21T13:50:56+00:00,Lol RCB is bottling the game in Punjab kings fashion. Wonder how Punjab will choke today,2
2024-04-21T13:54:53+00:00,Yesss 3 spinners that's what I wanted from first game,3
2024-04-21T13:57:38+00:00,"I'm curious to see how we donate 2 points today 🥰

Out of the 5 loses, 4 came in the last over 

Depression hitting hard 🥰",4
2024-04-21T14:03:04+00:00,why omarzai wasn't playing in last games?,2
2024-04-21T14:03:45+00:00,1st over wasted,2
2024-04-21T14:03:50+00:00,Wtf are we doing?💀,2
2024-04-21T14:04:33+00:00,good over,4
2024-04-21T14:05:03+00:00,"Punjab batting starts after 4 wickets, Punjab first batters are tailenders and after 4 wickets real batting starts",2
2024-04-21T14:05:06+00:00,Sam blud thinks hes Narine,5
2024-04-21T14:05:24+00:00,Prabh's first boundary this month 😭😭😭😭,2
2024-04-21T14:05:31+00:00,"Prabh should take a couple of deliveries to settle down, he takes too much pressure to be the hitter",3
2024-04-21T14:05:58+00:00,Prabhu gona throw wickets in next 5 balls,3
2024-04-21T14:06:38+00:00,"Holy fuck

Karn Sharma just finished Starc's IPL career",5
2024-04-21T14:07:07+00:00,"I'm at the party right now... Will miss first innings.
HalaGTynadamas",1
2024-04-21T14:09:14+00:00,If RCB match goes to superover reckon we see mi vs kxip 2020 part 2 today folks??,3
2024-04-21T14:09:38+00:00,That match is wild. Possible super over,3
2024-04-21T14:10:24+00:00,Prabh's first 6 this month,6
2024-04-21T14:10:49+00:00,"Rcb🤝punjab

Choking at the last ball, after coming very close",5
2024-04-21T14:11:05+00:00,Alright can now watch this match,5
2024-04-21T14:11:13+00:00,Fun fact: Ashutosh opens for his domestic team and is also a decent pacer,9
2024-04-21T14:11:25+00:00,Prabhsimran redemption arc?,5
2024-04-21T14:11:36+00:00,"Damn, DANNY IS BACK!!!",3
2024-04-21T14:11:44+00:00,"We are hitting boundaries in PP?

IMPOSSIBLE 😭",3
2024-04-21T14:12:05+00:00,is every game a 10 RPO match now,2
2024-04-21T14:12:06+00:00,This Sandeep is the kind of warrier that is used as cannon fodder and dies inconsequently at the very beginning.,20
2024-04-21T14:12:23+00:00,Here after KKR won against RCB by a single run. That was fucking nuts,5
2024-04-21T14:12:44+00:00,"Just imagined the most gut wrenching loss which can happen, and now I am good to watch the match 👍🏻",6
2024-04-21T14:13:03+00:00,"Had difficulty finding this thread , why so low ?",2
2024-04-21T14:13:25+00:00,We need a high score preferably 200+ because I don’t trust our team to defend anything low,11
2024-04-21T14:13:32+00:00,I love how the match thread is dead here because of the RCB Vs KKR last ball finish,1
2024-04-21T14:13:38+00:00,Gill has the GOAT hairline.,3
2024-04-21T14:13:59+00:00,GT deserves this for picking Warrier,2
2024-04-21T14:13:59+00:00,"why's everyone comforting my man after one 4

oh nvm",2
2024-04-21T14:14:02+00:00,Gill bouta leave this side,-1
2024-04-21T14:14:18+00:00,"Oh shit, Prabhsimran finally woke up

I'm glad that we are backing the players",4
2024-04-21T14:14:23+00:00,Prabhsimran finally woke up after his month long slumber,5
2024-04-21T14:14:25+00:00,Everyone following the SRH template now I guess.,2
2024-04-21T14:14:26+00:00,Who the fuck was even watching this bruv,5
2024-04-21T14:14:37+00:00,You naughty naughty tease prabh,3
2024-04-21T14:14:38+00:00,Absolute Cinema after Cinema,3
2024-04-21T14:14:41+00:00,Finally Prabh clicking today or too early to say?,7
2024-04-21T14:14:45+00:00,Shot!,3
2024-04-21T14:14:47+00:00,"I credit Ashutosh, he shamed our own top order by consecutively scoring such good runs. About time they got their act together",9
2024-04-21T14:15:02+00:00,Mare 60 comments 💀,6
2024-04-21T14:15:09+00:00,Ffs another high scoring game,2
2024-04-21T14:15:22+00:00,blud keeps stepping out against fast bowler going to get stumped,4
2024-04-21T14:15:32+00:00,Please give a thriller like the first game,3
2024-04-21T14:15:44+00:00,Warrier runs like Dale Steyn but bowls like Ashok Dinda.,12
2024-04-21T14:16:03+00:00,20L views 15 mins into the game on jio cinema shows everyone's been watching that KKR vs RCB game,18
2024-04-21T14:16:32+00:00,Ohho putr da debut,3
2024-04-21T14:16:34+00:00,Every Punjab fan was calling for Prabh’s head. I’d rather back a youngster like him than Bairstow… local boy with aggressive approach,3
2024-04-21T14:16:45+00:00,"Almost nobody chose to bat first this season, bold move Sam",10
2024-04-21T14:16:48+00:00,Am I tripping or wasn’t domino’s *always* free delivery?,4
2024-04-21T14:16:53+00:00,"“ MRF ZLX , You can bet on it my friend “",2
2024-04-21T14:17:02+00:00,PBKS agent Mohit Sharma,2
2024-04-21T14:17:06+00:00,Where is Bairstow?,2
2024-04-21T14:17:19+00:00,"Thats got to be the cutest pic of teh IPL, that kid with the 'my debut match' card",2
2024-04-21T14:17:22+00:00,Lmao why didn't Saha attempt it atleast,3
2024-04-21T14:17:23+00:00,alright CSKbros what's CSK's desirable outcome from this match?,2
2024-04-21T14:17:28+00:00,Ok folks time to come to this thread,3
2024-04-21T14:17:32+00:00,"Holy Trinity Has Lost 2/2 On this weekend  
Hope PBKS makes its 2/3",4
2024-04-21T14:18:00+00:00,I hope Jay Shah has another strong script for this match.,2
2024-04-21T14:18:01+00:00,"230 on the cards ladies and gents, rip bowlers on these flat tracks",3
2024-04-21T14:18:09+00:00,Keeper could’ve attempted that.,6
2024-04-21T14:18:09+00:00,"Punjab batting first , so they're not choking while chasing",6
2024-04-21T14:18:14+00:00,"PBKS agent Saha 

PBKS agent Mohit",2
2024-04-21T14:18:15+00:00,Saha wtf man. Why was U looking like there’s 3 slips there,5
2024-04-21T14:18:29+00:00,Everyone still trying to digest the first match....no one. On this thread..,11
2024-04-21T14:18:51+00:00,"I want to know who sits there and goes ""Hmm, I need to play some stereotypical ass music when Punjab hits a boundary""",6
2024-04-21T14:19:20+00:00,"Must say 


Crowds in Mohali are great this year 


Despite bad performance by Punjab


Maybe due to Shashank and ashutosh 


Maybe due to new ground 


As Mohali always had half filled grounds for ipl",8
2024-04-21T14:19:39+00:00,"Punjab, please don't give us a thriller.. just win easily and keep our (RR's) kryptonite as far as possible from top 4!",3
2024-04-21T14:19:40+00:00,People complaining about high RR this match clearly haven't been watching. No ball 6 + edges is the reason why so many runs... Pitch looks like a good contest,6
2024-04-21T14:19:48+00:00,Always wondered why do GT players look a bit different. Then I had a close look towards their jersey collar,4
2024-04-21T14:19:57+00:00,"Most Boundaries in an IPL game   
  
81 - SRH v RCB, 2024  
69 - SRH v MI, 2024  
69 - CSK v RR, 2010  
67 - KKR v RCB, 2024  
67 - PBKS v KKR, 2018",4
2024-04-21T14:19:57+00:00,Come on PBKS![img](emote|t5_2qhe0|28120),4
2024-04-21T14:20:06+00:00,"Yesterday I met my friends, who don't watch IPL that much, and explained them why they should watch PBKS's matches.   
PBKS have now gained some fans. Keep us entertaining PBKS.",4
2024-04-21T14:20:10+00:00,I see all 6 Punjab fans are here,34
2024-04-21T14:20:14+00:00,Just waiting for Shashank and Ashutosh at this point 😂,5
2024-04-21T14:20:23+00:00,Sandeep Mage,1
2024-04-21T14:20:25+00:00,Slippin sam what you doin hit the ball or get out,1
2024-04-21T14:20:31+00:00,We're taking over this thread now,7
2024-04-21T14:20:41+00:00,There is a 2nd match today??,6
2024-04-21T14:20:43+00:00,PBKS is double better than RCB,3
2024-04-21T14:20:51+00:00,So Dha1 dropped himself....,2
2024-04-21T14:21:12+00:00,Probably been asked before but why are Punjab Kings shortened to PBKS and not just PK?,5
2024-04-21T14:21:26+00:00,"C'mon Punjab, win tonight to keep us at 7th position.",5
2024-04-21T14:21:31+00:00,[deleted],2
2024-04-21T14:21:35+00:00,Are all the 10 Punjab fans arrived on this thread,9
2024-04-21T14:21:48+00:00,"Dhawan seems like a nice guy and all. But, I'm glad I don't have to see him opening for Punjab amymore.",6
2024-04-21T14:21:56+00:00,How are we not 4 down,9
2024-04-21T14:22:32+00:00,Katich you donkey maxi himself asked to be dropped. Do some basic research at least,4
2024-04-21T14:22:36+00:00,Relatively better over from Mohit,1
2024-04-21T14:22:40+00:00,Why did they keep pbks vs gt on sunday night!,5
2024-04-21T14:22:40+00:00,I just don't have the power to watch another game now...,0
2024-04-21T14:22:56+00:00,"I have to say 


Whenever kohli celebrates too aggressively 


His team loses


I could see him over happy after few first sixes 


And then bam RCB lost",3
2024-04-21T14:22:59+00:00,Is Dhawan injured or dropped,3
2024-04-21T14:23:15+00:00,"4 overs in

How have we not yet lost the top 4?🗿",5
2024-04-21T14:23:16+00:00,What are these cameraman just trying to get girls ?,3
2024-04-21T14:23:32+00:00,"Clarke talking out of his ass, Maxwell played 6 matches and scored a whopping 32 runs. If it was someone else doing this they would probably be benched for a couple of seasons",5
2024-04-21T14:23:39+00:00,"kids don't do sports, take up baking or something and die happily at 60",6
2024-04-21T14:23:45+00:00,"Don't slow down ffs

We have enough batdeep",2
2024-04-21T14:24:02+00:00,I feel like we should bring shashank up the order and keep ashutosh as a finisher,2
2024-04-21T14:24:02+00:00,Why is there a low crowd?,2
2024-04-21T14:24:09+00:00,Is this ground big? It looks amazing like aus. Or maybe it's just the camera angle coz the kkr rcb game ground looked bad in terms of lighting etc,1
2024-04-21T14:24:21+00:00,We literally bat until 11. No need for tuk tuk,1
2024-04-21T14:24:55+00:00,Can we get some reassurance from the PBKS fans that this match is gonna be a banger too?,1
2024-04-21T14:25:00+00:00,"Sam don't just stand there, do something",3
2024-04-21T14:25:12+00:00,There were more than 10x comments at this stage yesterday 💀,2
2024-04-21T14:25:12+00:00,4 overs in and we haven’t had our entire top order collapse 🙏,7
2024-04-21T14:25:13+00:00,Y'all seen the RCB vs KKR thriller lol,3
2024-04-21T14:25:14+00:00,I'm really good at IB Cricket on MetaQuest VR can I be a professional ?,2
2024-04-21T14:25:17+00:00,I don't know about whether GT has declined that much or KXIP is finally batting properly.,4
2024-04-21T14:25:40+00:00,"People being pissy about high rr, we only got it cause of the eleven in one ball.

It's a good bowling pitch and we are a shit batting team",11
2024-04-21T14:25:53+00:00,This reminds me of Rashid's last SRH days when he used to bowl 2 overs in PP.,4
2024-04-21T14:25:53+00:00,so I may have said something about every match being 10 RPO now but this tuktuk in powerplay is not good‼️,6
2024-04-21T14:26:10+00:00,Nice comeback by GT,0
2024-04-21T14:26:47+00:00,What's the reason for less people on this thread?,2
2024-04-21T14:26:49+00:00,Jay Shah can't have rest he's got to cooking again after KKR vs RCB,3
2024-04-21T14:26:50+00:00,This is our second highest opening partnership,4
2024-04-21T14:26:55+00:00,I kind of forgor that Sam Curran has joined the list of CSK boys leading PBKS,9
2024-04-21T14:27:04+00:00,Players like starc are getting paid 20+ crores because some suits believe his performance will boost their team enough to sell us viewers more products. How weird is that,1
2024-04-21T14:27:07+00:00,oh that's MONSTEROUS,2
2024-04-21T14:27:16+00:00,Sanju Simran,2
2024-04-21T14:27:27+00:00,punjab suddenly realized they are shit team hence the slowdown,11
2024-04-21T14:27:29+00:00,Whatta shot![img](emote|t5_2qhe0|29262)![img](emote|t5_2qhe0|8783),2
2024-04-21T14:27:33+00:00,Really want to see Livi go crazy at least once this IPL,3
2024-04-21T14:27:35+00:00,Beautiful,1
2024-04-21T14:27:46+00:00,Curran is such a useless player.,1
2024-04-21T14:28:00+00:00,"get edged‼️

(pbks lost a wicket in pp it's so over)",2
2024-04-21T14:28:05+00:00,LETS FUCKING GOOO ON YA BIKE SIMRAN,0
2024-04-21T14:28:21+00:00,Atleast he hit 35,3
2024-04-21T14:28:23+00:00,Nooooooo,1
2024-04-21T14:28:28+00:00,Alright Rilee don’t get out in 2 balls again,5
2024-04-21T14:28:35+00:00,"After the last few powerplaysv, this seems tuktuk cricket",1
2024-04-21T14:28:50+00:00,1st wicket for Sam Curran,2
2024-04-21T14:28:52+00:00,Huge W for Punjab if they don't lose 3 in next 2 overs,1
2024-04-21T14:28:56+00:00,Slow pitches and 2023 Mohit returns,3
2024-04-21T14:28:57+00:00,It was good till it lasted,5
2024-04-21T14:29:01+00:00,What’s the point of Curran opening when he can’t hit the ball with everyone inside,3
2024-04-21T14:29:02+00:00,Prabhsimran is my D11 captain![img](emote|t5_2qhe0|29262),3
2024-04-21T14:29:06+00:00,🫸🫷🙏🙏🙏🙏🙏🙏🙏🙏🙏🙏🙏🙏🙏🙏🙏🙏🙏🙏🙏🙏🙏🙏🙏🙏🙏🙏🙏🙏🙏🙏🙏🙏🙏🙏🙏🙏🙏🙏🙏🙏🙏🙏🙏🙏🙏🙏🙏🙏🙏🙏🙏🙏🙏🙏🙏🙏🙏🙏🙏🙏🙏🙏🙏🙏🙏🙏🙏🙏🙏🙏🙏🙏🙏🙏🙏🙏🙏🙏🙏🙏🙏🙏,1
2024-04-21T14:29:15+00:00,"I mean it was alright, hopefully russow does well today",3
2024-04-21T14:29:23+00:00,Average Prabh innings. Looks like a million bucks for a 35(21),4
2024-04-21T14:29:34+00:00,"To be honest, Prabh is a real hack. Don't know how he got decent numbers in Ranji.",2
2024-04-21T14:29:40+00:00,"**5.3** **another promising Prabhsimran innings cut short in the IPL!** Fullish ball just outside off. Singh comes down the track to try and loft it over cover but gets an edge to the keeper instead

Prabhsimran Singh c †Saha b Sharma 35 (21b 3x4 3x6) SR: 166.66",2
2024-04-21T14:29:43+00:00,"I just don't understand advertisements for cement during IPL. Who is buying cement based on whether Ranbir Singh or Ranbeer Kapoor is promoting it?! Useless fellows!

I work with builders, and all they care about is the rate. Also buying cement in bulk is a hassle, you can't just walk into a shop and buy large quantities of cement just like that. 

Also, literally every single cement brand in their advt will claim themselves to be the No. 1 cement of India. Is there no authority who cross checks these advts?

Ugh, why am i so mad at cement?!",21
2024-04-21T14:29:49+00:00,"Jatt gang ni banaunde , Ganga run karde",1
2024-04-21T14:29:53+00:00,Medical intern Russouw is here,3
2024-04-21T14:29:59+00:00,"Fun fact: Rilee didn't score one single double digit score in PSL

He's not in form",7
2024-04-21T14:30:01+00:00,"Lot of potentially explosive batting to come for Punjab, hope we see some fireworks. Livingstone is long overdue a barnstormer.",9
2024-04-21T14:30:26+00:00,Shot![img](emote|t5_2qhe0|8781),1
2024-04-21T14:30:37+00:00,can I become a punjab fan im looking to make my life better: previously an rcb fan,5
2024-04-21T14:30:52+00:00,Is it gonna be 1(3) Rossouw or 100(40) rossouw?,2
2024-04-21T14:30:53+00:00,rilee please do at least make 30,2
2024-04-21T14:31:02+00:00,Has Mohit been good or bad this ipl. Feels like he alternates every match.,3
2024-04-21T14:31:16+00:00,Nehra encouraging for length ball,3
2024-04-21T14:31:26+00:00,Mohits hair transplant is falling out already,6
2024-04-21T14:31:34+00:00,Wide wide wide![img](emote|t5_2qhe0|28120),3
2024-04-21T14:31:38+00:00,"That's wide, no?",6
2024-04-21T14:31:39+00:00,Noor will take both these guys next over,5
2024-04-21T14:31:42+00:00,Someone in thread really said that this is tuktuk .....it's 50 in 5 over lad...how are you going to watch t20 world cup with this attention span of Pikachu spoilt with those runfests,36
2024-04-21T14:31:48+00:00,W DJ playing shubh songs,6
2024-04-21T14:31:59+00:00,Umm wide?,3
2024-04-21T14:32:30+00:00,Punjabi Kings vs Gujarati Titans,2
2024-04-21T14:32:37+00:00,Hope rilee actually hasn't forgotten how to old a bat,9
2024-04-21T14:33:55+00:00,Man I want to see this match but I have exams tomorrow.......... I think I'll come to check scores 😞,5
2024-04-21T14:34:53+00:00,curran making sure we don’t miss da1,5
2024-04-21T14:35:14+00:00,We absolutely suck against spin,3
2024-04-21T14:35:19+00:00,How long is DA1 out for?,1
2024-04-21T14:35:22+00:00,"Proper vibes team

https://x.com/livination23/status/1781920307558646003?s=46",3
2024-04-21T14:35:27+00:00,Only 1 wicket in PP? Which parallel dimension is this,7
2024-04-21T14:35:40+00:00,"New to context, but can Rilee play spin?",1
2024-04-21T14:35:41+00:00,3 spinners? Is it turning already?,3
2024-04-21T14:35:41+00:00,"This is the CEAT TYRE strategic timeout^TM        

Put some respect on that name BRUH",3
2024-04-21T14:35:58+00:00,Sam Curran replacing Dhawan perfectly :),2
2024-04-21T14:36:16+00:00,"IMO, should have persisted with Bairstow.",1
2024-04-21T14:36:23+00:00,India win wc if bumrah captain,-3
2024-04-21T14:36:40+00:00,"Ashutosh is an opener for his domestic side

Plus he is a pacer 

He has a 11 ball 50",10
2024-04-21T14:36:46+00:00,"nutty different ossified groovy insurance jellyfish snobbish unique marvelous cobweb

 *This post was mass deleted and anonymized with [Redact](https://redact.dev)*",2
2024-04-21T14:37:49+00:00,"9 by Rilee is his highest score from February

He didn't cross 9 in PSL 😭😭😭",5
2024-04-21T14:37:52+00:00,If anyone is watching in tamil commentary who is the mallu guy in comms?,6
2024-04-21T14:37:56+00:00,Noor looks like afghani Logan sargaent,2
2024-04-21T14:38:03+00:00,"office memory quickest attraction secretive racial coordinated grey gullible impossible

 *This post was mass deleted and anonymized with [Redact](https://redact.dev)*",1
2024-04-21T14:38:21+00:00,Anyone having streaming issue in USA,1
2024-04-21T14:38:34+00:00,India win wc if bumrah captain,-1
2024-04-21T14:38:35+00:00,12 overs of spin here ![img](emote|t5_2qhe0|21498),7
2024-04-21T14:38:36+00:00,[deleted],-7
2024-04-21T14:38:42+00:00,Rossouw sweeps too often isn't gonna work well against these Afghan duo.,1
2024-04-21T14:38:45+00:00,Bruh blind umpire?,2
2024-04-21T14:38:47+00:00,Fuck that's plumb I think,3
2024-04-21T14:38:51+00:00,out if not an edge,3
2024-04-21T14:39:28+00:00,Why is this match thread so dead😭,4
2024-04-21T14:39:35+00:00,Return of rock and roll,1
2024-04-21T14:39:37+00:00,"Drop Rosso, bring back Bairstow.",4
2024-04-21T14:39:44+00:00,"Can Jay Shah back to back bangers tonight ?

Don't doubt the power of Jay Shah",3
2024-04-21T14:39:47+00:00,They literally take 5-7 minutes to show the review on screen,3
2024-04-21T14:39:56+00:00,"far-flung grandiose hospital makeshift sip flag badge bear hurry wipe

 *This post was mass deleted and anonymized with [Redact](https://redact.dev)*",2
2024-04-21T14:39:58+00:00,rilee is ssuch a feast or famine hitter lmao,5
2024-04-21T14:40:01+00:00,Should send Shashank,2
2024-04-21T14:40:03+00:00,[deleted],1
2024-04-21T14:40:04+00:00,Here comes the choke,3
2024-04-21T14:40:08+00:00,"So, Rilee hasn't scored a double digit score since February now 😭😭😭",6
2024-04-21T14:40:21+00:00,Rilee is done. Doubt he gets a 3rd game. Open with Taide,3
2024-04-21T14:40:22+00:00,Mfers removed the sound when the wickets are hitting. I was about to be so angry,8
2024-04-21T14:40:22+00:00,"**6.6** **big lbw call next ball!** Full ball outside off and turning in. Rossouw gets down to sweep but it hits his pad. They scurry across for a leg bye as the umpire says not out. **Gujarat Titans review** and the ball-tracking shows that is plumb lbw. Turning in enough to crash into leg stump. Rossouw tried to rely on the sweep against the turning ball but Noor outfoxed him there

Rilee Rossouw lbw b Noor Ahmad 9 (7b 2x4 0x6) SR: 128.57",3
2024-04-21T14:40:29+00:00,Aakash Chopra W,1
2024-04-21T14:40:30+00:00,Honestly he looked decent today for a guy out of form. I'd give him another game,2
2024-04-21T14:40:33+00:00,"2nd wicket for Sam Curran, leading from front",2
2024-04-21T14:40:41+00:00,"I just have one question, Where is Matt Short and why he isn't playing?


Edit: oops looks like he was a replacement for Bairstow, c'mon man he was better.",3
2024-04-21T14:40:52+00:00,"Should've stuck to Bairstow

Rilee didn't score 100 runs combined in PSL this year and he played all the games",9
2024-04-21T14:41:25+00:00,Why is Jitesh out so early ? He was so good as a finisher...,3
2024-04-21T14:41:26+00:00,Riley please join the cheerleaders on stage next match,6
2024-04-21T14:41:29+00:00,Why do they keep promoting Jitesh up the order man. He’s going to slog now,6
2024-04-21T14:41:38+00:00,They dont trust shashank,5
2024-04-21T14:41:40+00:00,Bairstow is better.,3
2024-04-21T14:42:18+00:00,"It’ll be a shame to not have Ashutosh/ Shashank not get more deliveries to bat

PBKS strategy seems very stubborn",3
2024-04-21T14:42:23+00:00,who is that one gt lady they keep on showing us,7
2024-04-21T14:42:28+00:00,Can we just get shivam singh already,3
2024-04-21T14:43:02+00:00,what a throw from saha lol,2
2024-04-21T14:43:45+00:00,[deleted],3
2024-04-21T14:43:45+00:00,Should have sent Shashank instead of Jitesh.,1
2024-04-21T14:43:47+00:00,"Worst batting lineup in IPL vs shubham gill, we shall see who sucks worse",10
2024-04-21T14:44:07+00:00,"Dread it , run from it, Shashank- ashutosh always come out to bat early",13
2024-04-21T14:44:36+00:00,It is beneficial for GT that Curran stays. Shouldn’t have taken the review. Let my man play for you. /s,3
2024-04-21T14:44:42+00:00,Thats a good review..,2
2024-04-21T14:44:44+00:00,gill booty,11
2024-04-21T14:44:49+00:00,woahhhhhh,6
2024-04-21T14:44:52+00:00,Same old shit 🥰,7
2024-04-21T14:44:57+00:00,"**7.5** full ball around leg stump. Googly. Curran tries to knock it leg side but he's beaten, and the ball hits him on the knee roll. **Appeal for LBW - but not given, however, Gill reviews again.**

Sam Curran lbw b Rashid Khan 20 (19b 2x4 0x6) SR: 105.26",2
2024-04-21T14:45:05+00:00,Spin choke,5
2024-04-21T14:45:07+00:00,How was that hitting?,2
2024-04-21T14:45:10+00:00,Ohh no sam got out 🌚🌚,6
2024-04-21T14:45:10+00:00,Ah there's the collapse,6
2024-04-21T14:45:11+00:00,Just tonk and go home. Let real batters come,2
2024-04-21T14:45:17+00:00,Naah that was umpire's call,-1
2024-04-21T14:45:18+00:00,VK spirit is in curan now,3
2024-04-21T14:45:18+00:00,Advantage Punjab,5
2024-04-21T14:45:26+00:00,WHAT A SURPRISE LMAO. I THOUGHT MEME REVIEWWWWWW,1
2024-04-21T14:45:27+00:00,Sexy umpiring,4
2024-04-21T14:45:31+00:00,let's go,2
2024-04-21T14:45:32+00:00,[deleted],1
2024-04-21T14:45:33+00:00,Parthiv Patel jealous of DK😁,2
2024-04-21T14:45:36+00:00,"Pbks fans look at the positives, you can watch Shashank and Ashutosh bat for more balls",4
2024-04-21T14:45:43+00:00,Nothing new,1
2024-04-21T14:45:43+00:00,Why would we bat first though? Have we lost the plot?,4
2024-04-21T14:45:44+00:00,PBKS owners deserve this after buying this batting lineup in auction even with large purse.,5
2024-04-21T14:45:49+00:00,Sashank and Ashutosh are next. Bad move GT 🤣,4
2024-04-21T14:45:51+00:00,great review. haha looked pitching out leg to me but amazing.,5
2024-04-21T14:45:52+00:00,"""Lame Livingston has walked out to the middle.""
-Jarrod Kimber",6
2024-04-21T14:46:01+00:00,Guys dont worry. Batting starts at 6 for PBKS,4
2024-04-21T14:46:04+00:00,"GT missed a trick 

You need to *allow* the PBKS top order to bat as long as possible 

It’s the lower order which actually has some skill",10
2024-04-21T14:46:06+00:00,Lol pbks don't even have money to buy umpires how are they so pro punjab,5
2024-04-21T14:46:09+00:00,Umpiring in this IPL has been beyond shit.,7
2024-04-21T14:46:15+00:00,"Cmon guys, batting starts now!!🔥🔥",2
2024-04-21T14:46:16+00:00,rigged,4
2024-04-21T14:46:21+00:00,Rcb Lite. 🥰,4
2024-04-21T14:46:31+00:00,One can understand the disappointment on umpire’s call but when the tech shows it’s red on all 3 criteria it’s obvious it’s not luck that was against you. You were rather lucky to be not given out in the 1st place,7
2024-04-21T14:46:32+00:00,Need a Livingstone special to make a match of it..,1
2024-04-21T14:46:34+00:00,"Why is the team built around Sam Curran? I for one cannot recollect a memorable Curran performance. 

Only advantage of Curran is he consistently gives you good points on dream 11.",4
2024-04-21T14:46:35+00:00,"Need an apology form for gill, I thought it was a clown review at first glance.",10
2024-04-21T14:46:39+00:00,Umpires bought by PBKS today?,2
2024-04-21T14:46:43+00:00,"I mean what did punjab even spend money on, there is no player in their lineup that should cost more than 10 Cr. Tom Curran as captain is truly scraping bottom of the barrel",0
2024-04-21T14:46:53+00:00,"Man, these foreigners are so poor against quality spin",2
2024-04-21T14:46:54+00:00,Classic Punjab top order as usual,1
2024-04-21T14:46:56+00:00,Why tf is livi in,1
2024-04-21T14:46:56+00:00,[deleted],1
2024-04-21T14:46:59+00:00,Doesn’t Livingstone.. Rashid and CurRun plays for the same team in one of the franchise league?,3
2024-04-21T14:47:06+00:00,How is no one criticizing sam he literally made  20(19),10
