Timestamp,Comment,Upvotes
2024-04-21T16:13:58+00:00,Gill class 4s,3
2024-04-21T16:14:12+00:00,How many of you have watched Kaala Paani on Netflix... what's your views on it and expectations for season 2 ?,0
2024-04-21T16:14:25+00:00,Gill is so talented,3
2024-04-21T16:15:02+00:00,Get Gill win match for punjab,2
2024-04-21T16:15:04+00:00,"Bill becomes Billy in the west 

Do people call him Gilly in India?",2
2024-04-21T16:15:38+00:00,This is probably the last season for Saha and Umesh.,7
2024-04-21T16:15:40+00:00,Saha is kinda old. He will never make the national team.,1
2024-04-21T16:15:47+00:00,Gill cannot even increase his strike rate knowing the paper thin batting line up that's gonna collapse after his wicket,16
2024-04-21T16:15:49+00:00,21= 3×(7) =thala for reason,0
2024-04-21T16:15:50+00:00,Saha try to play offside challenge (impossible),10
2024-04-21T16:15:56+00:00,Any know what that one guy has been screaming for 10 minutes ?,9
2024-04-21T16:16:47+00:00,[removed],5
2024-04-21T16:16:53+00:00,It's Sai time 😴,7
2024-04-21T16:17:01+00:00,"**3.4** **short and pulled... straight to midwicket!** Arshdeep gets the breakthrough that Kings needed. Came off the toe of the bat and that's a simple catch for Ashutosh

Wriddhiman Saha c AR Sharma b Arshdeep Singh 13 (11b 1x4 0x6) SR: 118.18",5
2024-04-21T16:17:28+00:00,Saha is a rare speciialist wk in t20 .,2
2024-04-21T16:17:48+00:00,GT better off backing some young potential than Saha who just isn't doing it this season.,6
2024-04-21T16:18:04+00:00,"<7 rpo in in pp at sunday night

Wtf",5
2024-04-21T16:18:33+00:00,Seeing individual player fanbases get triggered has started to give me some sort of sadist pleasure,-1
2024-04-21T16:18:54+00:00,Sai sehwag......😮😮😮😮😮😮😮,4
2024-04-21T16:19:15+00:00,"It’s funny the commentators were earlier talking about there are so many Tamilians on the GT team, but when I asked what ethnicity produces the most T20 players in India, y’all are losing your mind.",11
2024-04-21T16:19:22+00:00,Why are there so many Punjabis supporting GT?,4
2024-04-21T16:19:33+00:00,What are other wk options for GT? KS Bharat?,4
2024-04-21T16:20:04+00:00,Can you beat that 89 from last match GT?,9
2024-04-21T16:20:33+00:00,Why do I get this feeling GT is about to mess up this chase?,11
2024-04-21T16:21:12+00:00,What a shot Gillman,4
2024-04-21T16:21:12+00:00,Nice to see PBKS backing local Panjabi player's.,5
2024-04-21T16:21:18+00:00,Saha's luck with his whack blindly and inshallah ran out this year it seems.,15
2024-04-21T16:21:58+00:00,Fuck umpires,5
2024-04-21T16:22:27+00:00,Mf are u blind? Just wasting time man,7
2024-04-21T16:23:11+00:00,Way too easy of a chase RRR is 7,3
2024-04-21T16:23:39+00:00,Send Rashid opening from next match. Toink and inshallah,3
2024-04-21T16:23:41+00:00,Yeah Gills home ground btw,3
2024-04-21T16:24:04+00:00,Stopped the flow of game for absolutely no fucking reason.. Incinerate the umpires at this point...,3
2024-04-21T16:24:13+00:00,"Someone sober up Shastri, this isn't Gill's home ground considering this stadium was built like months ago only.",10
2024-04-21T16:24:20+00:00,Tewatia should open from next game. Rahul Narine. Or Sunil Tewatia,3
2024-04-21T16:24:42+00:00,Easy game for Sai low risk just keep rotating strike with ocassional hits,5
2024-04-21T16:25:08+00:00,Are there a total of  8 people in the chat...,4
2024-04-21T16:25:11+00:00,  PKS v GT on a Sunday night. Yawn,4
2024-04-21T16:25:18+00:00,Rashid as an opener sounds enticing,3
2024-04-21T16:25:28+00:00,Finish in 15 overs increase nrr,3
2024-04-21T16:25:36+00:00,Something is not right about sai eyes today,4
2024-04-21T16:25:43+00:00,"Isn't gt vs PBKS supposed to produce nail biting thrillers!?

What happened here!?",9
2024-04-21T16:26:22+00:00,GT trying hard to take it to last over.,5
2024-04-21T16:26:30+00:00,"Whenever I watch teams playing this slowly instead of trying to make these runs quickly to help their abysmal NRR, I start rooting against them. Hopefully PBKS makes them pay. If this was SRH they'd be aiming to win this game in 10-12 overs instead of 17-18 overs that these guys seem to be targeting.",-3
2024-04-21T16:26:31+00:00,i feel like gill is another player who performs better without the pressure of captaincy,6
2024-04-21T16:27:14+00:00,"Mega auction next year .... knowing DC's big brain, they will retain Lodu, Nokia and Pant.",9
2024-04-21T16:27:16+00:00,Braindead match,7
2024-04-21T16:27:19+00:00,"We rely too much on our bowlers
Shit batting",8
2024-04-21T16:27:32+00:00,This sidhu's got some  good metaphors though ngl,5
2024-04-21T16:27:54+00:00,Lodu for DC is OG,4
2024-04-21T16:28:00+00:00,Retaining information out for the mega auction?,2
2024-04-21T16:28:12+00:00,atleast our DC keeps us entertaining with boundaries if not with wickets,3
2024-04-21T16:28:16+00:00,"""Every day you do something stupider than you did the day before.

And I think 'there's no possible way he can top that'.

But what do you do? You find a way, damn it, to top it.""

- ~~Stanley Hudson~~ Me to PBKS every matchday",13
2024-04-21T16:28:29+00:00,Both teams trying their best to stop fans from leaving the stadiums to get over this boring match.,-3
2024-04-21T16:28:39+00:00,All very straightforward for Gujarat. Boring one sided match.,6
2024-04-21T16:28:50+00:00,"Today I learned, Brohit’s original nickname was *Shana* 

… which roughly translates as smartass, cunning.",13
2024-04-21T16:28:53+00:00,LOOOOOVELYYYYY SHOT. What a beauty,7
2024-04-21T16:29:00+00:00,I just read that Shahrukh Khan was the leading wicket taker in TNPL last year.,11
2024-04-21T16:29:44+00:00,Crazy how PBKS fans are always happy despite all these years of shit performances. They never Boo others nor their own players.,19
2024-04-21T16:30:12+00:00,That pose tho,5
2024-04-21T16:30:13+00:00,Crowd may be bored....should play Instagram Reels on the big screen.... what do you guys think about my suggestion.../s,8
2024-04-21T16:30:27+00:00,Don’t kill me (you virtue signallers) but the ratio of pretty girls is unusually high in the crowd for this game.,17
2024-04-21T16:30:38+00:00,Man Shubman Gill is an exquisite timer of the ball.,9
2024-04-21T16:31:27+00:00,Waiting for SRH to annihilate this GT boring line up,-10
2024-04-21T16:31:42+00:00,Brar can be a good contender for the ICT spot if he works more on his batting.He's a good economical bowler.,12
2024-04-21T16:32:23+00:00,hoping Shubman would come home next year and captain Punjab,4
2024-04-21T16:32:26+00:00,"I feel like GT needs to up their NRR this game, specially once the chase becomes very getable.",7
2024-04-21T16:32:39+00:00,"If i was Prabhsimran Singh batting now Chasing 140.
He would have slogged every ball till he miss hit and got caught out",8
2024-04-21T16:33:08+00:00,Star sports will now play Dhoni's 28*(9) balls repeat somehow,6
2024-04-21T16:33:47+00:00,ill say win in the 15th over gt. i dont have the energy to wait and lose in the last over,6
2024-04-21T16:34:03+00:00,Expect PBKS to make it a last over finish,8
2024-04-21T16:34:40+00:00,Friendly reminder: Gg fav player is Rashford,3
2024-04-21T16:35:14+00:00,"Gillman would look sexy in long hair, ala 2005 Dhoni or Kyle Mayers",3
2024-04-21T16:35:26+00:00,""" Hit me Daddy"" was written on that ball",1
2024-04-21T16:35:28+00:00,"Why bowl both leg and off spin is beyond my comprehension.
Putting feet in 2 boats",1
2024-04-21T16:35:28+00:00,"Not everyone from Punjab os Shubman Gill.
Note - no prabhsimran was harmed",5
2024-04-21T16:35:36+00:00,Bumraah is so good.,1
2024-04-21T16:35:38+00:00,![img](emote|t5_2qhe0|8776),2
2024-04-21T16:35:47+00:00,[deleted],6
2024-04-21T16:35:48+00:00,"JIO SUCKS. As an iMac user, it's the worst. You never get fullscreen. On my 27inch iMac, the full screen has a black border -- basically it's a 16 inch frame inside my screen. Pathetic. The crop marks are visible too, the engineers were fully aware of what's happening.",1
2024-04-21T16:36:00+00:00,GT batting is gill and inshallah if they want to make it to semis they need gill to fire in 80% of the games he is kinda backbone of their fragile batting line up,17
2024-04-21T16:36:05+00:00,"GT should go for the kill and improve their NRR. This is probably their best chance (not sure when they play RCB).

Edit:
-1.3 is their NRR before this match. So I don’t think they can improve their NRR too much.",10
2024-04-21T16:36:06+00:00,Uthappa is asking real questions to Hesson,5
2024-04-21T16:36:38+00:00,"Gill be like - [*Aankh dikhata hai madarjaat*](https://c.tenor.com/N99FBbIURBMAAAAd/tenor.gif)

T - Dont show me snake eyes",9
2024-04-21T16:36:40+00:00,Stupid sexy Shubman,8
2024-04-21T16:36:42+00:00,Gill should seriously come out of that dangal girl hairstyle,10
2024-04-21T16:36:52+00:00,Gill without a helmet is a vibe 😎,11
2024-04-21T16:36:58+00:00,This game was tailor made for Raza,3
2024-04-21T16:36:59+00:00,Mf is appealing that,4
2024-04-21T16:37:00+00:00,Sudarshan and gill dont see like a t20 batting pair,3
2024-04-21T16:37:12+00:00,"I get taking off the helmet, but why cap lol",-1
2024-04-21T16:38:04+00:00,[deleted],2
2024-04-21T16:38:06+00:00,No use of drama here in a snoozefest. Use the drama plots wisely Jay shah.,4
2024-04-21T16:38:31+00:00,"This is it Bois. Take PADIKKAL and Sai to T20 wc.

Live by the vibes. Die by the vibes.",11
2024-04-21T16:38:46+00:00,Whom should Punjab Target in the Auction to lead them next season?,2
2024-04-21T16:38:46+00:00,RCB and PBKS desperately need a mega auction. Will be interesting to see how they go about it next season,4
2024-04-21T16:38:57+00:00,Punjab management is second worst after RCB.,6
2024-04-21T16:39:03+00:00,"Prince of Ahmedabad for a reason (except for November 19th, 2023)",0
2024-04-21T16:39:11+00:00,GT bowled 3 spinners and Rahul Chahar isn't playing for PBKS,8
2024-04-21T16:39:30+00:00,Have to bowl livi bcoz they didn't picked much spinners,2
2024-04-21T16:39:43+00:00,Did you know Gill holds the record for the highest T20I score by a batsman for the Indian team,10
2024-04-21T16:40:02+00:00,Gt would be winner of ODI ipl,8
2024-04-21T16:40:21+00:00,I want them so send out Rashid next,3
2024-04-21T16:40:26+00:00,Sai come on bro,2
2024-04-21T16:40:34+00:00,What I'm doing in my life that I'm watching Gill and sudarshan bat together on a slow pitch on a Sunday night,1
2024-04-21T16:41:01+00:00,I remember pbks used to use the fucking ‘CHRIS GAYLE’ as one down,5
2024-04-21T16:41:21+00:00,We have one more game on Sunday get ready,6
2024-04-21T16:41:42+00:00,Gill is maturing at a rapid rate. I love it. Dude has risen far above peers from his age group.,11
2024-04-21T16:41:49+00:00,RONS FOUR OF THEM,1
2024-04-21T16:41:51+00:00,No HaarCBrar today,1
2024-04-21T16:41:55+00:00,"Mid season trade idea

Nehal Wadhera 🔁 Rahul Chahar

Both players being wasted by their respective franchises
Will help fix holes in both teams",5
2024-04-21T16:42:15+00:00,There is no pressure to score. Gill can take it home in odi mode from here.,6
2024-04-21T16:42:40+00:00,No fucking way this turns into a close game. No way,3
2024-04-21T16:42:56+00:00,Switch to Pak vs NZ .Potential for them to lose to their C team,2
2024-04-21T16:43:12+00:00,"Gill will win this with a 130 SR. Then in a week people will look at his stats and his SR isn't high enough for modern T20. This is how dumb and stats (SR)obsessed people have become. No batsman who happens to play on slightly tougher pitches (or good bowling attack) will ever be selected with this mindset. You cannot analyse and compare players unless you watch and remember the matches and use your brain, stats is a shortcut that's mostly useless.

Edit: Gill wants me to look stupid lmao",7
2024-04-21T16:43:19+00:00,What do our playoff chances look like if we lose?,3
2024-04-21T16:43:29+00:00,"post season trade idea-

Hardik Pandya 🔁 Sai sudarshan.

Like for like and sudarshan doesn't bowl so less runs leaked",3
2024-04-21T16:43:31+00:00,Livi has the golder arm!!!!!!!!,1
2024-04-21T16:43:32+00:00,I think what RCB is missing the most is the Ross Taylor/ABD type of finisher. I still remember the way ross chased impossible targets in 2009. I expected maxi to fill that spot but he is having a tough season.,1
2024-04-21T16:43:35+00:00,"RRR is barely above 7. With 9 wickets in hand, these Motherfukkas need to start caring about the NRR.

Gill is not a good captain lol",-1
2024-04-21T16:43:41+00:00,That's so immature and stupid,14
2024-04-21T16:43:51+00:00,[deleted],10
2024-04-21T16:43:59+00:00,"fans when 270 matches: so many highways, ruining the game…
fans when low scoring matches: boring, sunday wasted….
🤡🤡🤡🤡",19
2024-04-21T16:44:03+00:00,Sai Sudarshan strikes with the bat in hand!,8
2024-04-21T16:44:06+00:00,Is Livingstone mad at gill?,12
2024-04-21T16:44:11+00:00,"**9.3** **goes down the ground... but hasn't caught it!** Livingstone roars in delight, he's got the big wicket of Gill

Shubman Gill c Rabada b Livingstone 35 (29b 5x4 0x6) SR: 120.68",2
2024-04-21T16:44:15+00:00,Fuck you Livingstone,3
2024-04-21T16:44:18+00:00,Retain Livi at all cost he got that Punjabi energy.,24
2024-04-21T16:44:19+00:00,Damn Livingstone doesn't like gill,14
2024-04-21T16:44:26+00:00,Pressure built by Sudarshan cost them that wicket.,6
2024-04-21T16:44:27+00:00,Kind of an overreaction from Livingstone lol,6
2024-04-21T16:44:36+00:00,"Punjab is winning this

At least that's what they will make you believe until 20th over",7
2024-04-21T16:44:39+00:00,Just was about to post that this match is very boring. Some action finally.,1
2024-04-21T16:44:39+00:00,Sai should’ve started to hit not Gill. GT might choke this,2
2024-04-21T16:44:41+00:00,Livingstone is the original Theekshana.,2
2024-04-21T16:44:42+00:00,Kohliesque innings by Gill,8
2024-04-21T16:44:48+00:00,"After all the tension and eye contacts, you threw your wicket to his mid ball. Lost the war mate, lost it big time.",13
2024-04-21T16:45:04+00:00,Shubman so handsome that the man doesn’t have to hide his face behind a beard like the rest of the Indian cricketers (barring Ash Anna),16
2024-04-21T16:45:06+00:00,Livingstone is 100% coked out lol,9
2024-04-21T16:45:14+00:00,So Tewatia and Rashid khan to finish the game today then...,4
2024-04-21T16:45:14+00:00,Wait NZ is playing PAK now? Huh?,3
2024-04-21T16:45:16+00:00,Sai's brand of cricket will always put pressure on his partners.,12
2024-04-21T16:45:18+00:00,Of course Livingstone is going to celebrate he has not been having the best time with bat at least does something with ball,5
2024-04-21T16:45:26+00:00,Horrendous innings by Gill. This guy is not going to the WC for sure.,0
2024-04-21T16:45:29+00:00,Sai you mf,4
2024-04-21T16:45:29+00:00,Punjab will choke after 15 -16 over.,-2
2024-04-21T16:45:34+00:00,"Are  livingstone , sara and gill in love triangle??",6
2024-04-21T16:45:46+00:00,"Was he avenging Bairstow and anderson lol
So animated livi",10
2024-04-21T16:45:54+00:00,Where is everyone? Why are the comments so low?,0
2024-04-21T16:46:09+00:00,"I just came to know what happened 

Livingstone said Sara bhabhi is not sexy.

Gill......well gill.....",7
2024-04-21T16:46:11+00:00,Gilaplse?,7
2024-04-21T16:46:30+00:00,The downfall of GT has been hard. They are trying to do a PBKS against PBKS 2nd time in the season.,7
2024-04-21T16:46:37+00:00,Why was livi so animated lol,3
2024-04-21T16:46:41+00:00,Siddhu give the credit to Liam. Wtf these commentators can never give any credit to the bowlers,2
2024-04-21T16:46:51+00:00,Lividstone,2
2024-04-21T16:46:54+00:00,Great sidhu saying gill threw his wicket and not Livingstone actually taking his wicket even he learnt how to suck players from Star sports,4
2024-04-21T16:47:25+00:00,"Oh look, left handed vijay shankar is slowly pushing up the RRR",3
2024-04-21T16:47:30+00:00,I loved Livi reaction lmao fk fairplay we want animated players.,7
2024-04-21T16:47:30+00:00,"Gujarat might be the new Rajasthan Royals. Fluked a win with a weak squad, but reality is hitting them now. The batting line-up is absolutely atrocious. Who built the team?",2
2024-04-21T16:47:42+00:00,GT...you're gonna win..right?,2
2024-04-21T16:47:44+00:00,"Shamsher Curran, Liampreet, Rilendra, Kagisojeet",7
2024-04-21T16:47:57+00:00,Stage is set for a vintage Lord T innings,8
2024-04-21T16:48:16+00:00,"Sai Sudarshan is the main bud here.

PBKS have to make sure he stays out there till the end.",7
2024-04-21T16:48:19+00:00,[deleted],5
2024-04-21T16:48:30+00:00,King Khan to rescue...?,0
2024-04-21T16:48:43+00:00,My heart cannot take another thriller,0
2024-04-21T16:48:48+00:00,Sai give us that funny expression,3
2024-04-21T16:49:13+00:00,Such an interesting conversation on insiders,5
2024-04-21T16:49:14+00:00,Trying to watch sudarshan bat in T20 cricket without falling asleep challenge (Impossible),7
2024-04-21T16:49:21+00:00,Robbie grilling Hesson on Chahal’s non retention,2
2024-04-21T16:49:28+00:00,Noor looks so Ukrainian lol,3
2024-04-21T16:50:01+00:00,"GT management really fked up by giving up Hardik to MI.

At least release him rather than approving a shady deal for quick bucks.

Deserves bottom spot NGL. Gotta feel sorry for GT fans they had such a good team.",-1
2024-04-21T16:50:06+00:00,I'm ready for a GT collapse before Tewatia wins it from 4 off 1,1
2024-04-21T16:50:07+00:00,Gt desperately need the tactical wicket of sudarshan....,2
2024-04-21T16:50:09+00:00,Kagiso steyn back in action,1
2024-04-21T16:50:13+00:00,"Being a punjab fan for so long I know how this match will turnout, in the end pathetic batting from Bhatia will be the difference.",4
2024-04-21T16:50:18+00:00,genuinely hope Punjab win from here,6
2024-04-21T16:50:36+00:00,"Why are they all of sudden talking about Sai Kishore now? 

Is this commentator a Tamil?",4
2024-04-21T16:50:46+00:00,PBKS were well aware that they don't want sai out,1
2024-04-21T16:51:14+00:00,GT you have one job don’t bottle this,3
2024-04-21T16:51:21+00:00,"This ground is quite big, right?",2
2024-04-21T16:51:25+00:00,"Get Miller out and the match is Punjab's to lose


Sudharsan will get himself out after 36(30) something like he's been doing the entire season",1
2024-04-21T16:51:38+00:00,Wasn’t there some English dude playing for GT last year who looked exactly like Noor Ahmed. It used to confuse everybody,3
2024-04-21T16:51:41+00:00,"Easy win for Gujarat from here. Punjab only stands a chance if they grab 3-4 wickets which they definitely can’t do as they are shit af. Hence, easy win for Gujarat.",2
2024-04-21T16:52:15+00:00,I know they will only give 20 runs in the next 4 overs and then Harshal will get smacked by Tewatia.,5
2024-04-21T16:52:18+00:00,"Get Miller here, and game on!",1
2024-04-21T16:52:25+00:00,This was 4th dissmial to a leg spinner for Gill btw in last 6 innings or so. That's a big weakness to have.,3
2024-04-21T16:52:27+00:00,"If the game has 'evolved', why are batsmen unable to post 200 in Lucknow, Chennai and Chandigarh? Or has it only evolved on flat pitches?",8
2024-04-21T16:52:35+00:00,Bhatia could have done better looking rn,2
2024-04-21T16:52:44+00:00,That's bad length,1
2024-04-21T16:53:00+00:00,lol people acing like there is no rashid-tewatia at back,1
2024-04-21T16:53:19+00:00,Fuck everything. I just wanna see GT win and Gillman celebrating in front of Livingstone,0
2024-04-21T16:53:21+00:00,"Bruh, bowl a little shorter",1
2024-04-21T16:53:22+00:00,Miller’s first match?,1
2024-04-21T16:53:23+00:00,"GT have had only one 200+ game this season (vs CSK)

That's kinda surprising.",5
2024-04-21T16:53:28+00:00,Yeah,1
2024-04-21T16:53:31+00:00,"England got Jacks and Salt firing, Aus got Head and Fraser, WI gonna be WI. India's done well to get a fuck ton of anchors.",13
2024-04-21T16:53:49+00:00,Bruh's pumped..... He was red red,8
2024-04-21T16:53:49+00:00,Hell yeah,1
2024-04-21T16:53:53+00:00,Liamchandran livingtharan,7
2024-04-21T16:53:55+00:00,Let's go,0
2024-04-21T16:53:58+00:00,Bruh this stupid sidhu saying the no ball rule needs to be changed just because koach got out,4
2024-04-21T16:54:01+00:00,Liam Livid-stone,3
2024-04-21T16:54:05+00:00,Liam livingdharan,7
2024-04-21T16:54:17+00:00,Punjab win this please,3
2024-04-21T16:54:19+00:00,Damnnn Liviiii!!! I love the aggression lol,7
2024-04-21T16:54:25+00:00,"Livingstone keep the drama alive, do you saying there is a chance",6
2024-04-21T16:54:25+00:00,Oh GT... Going to bottle this today ain't you mate?,8
2024-04-21T16:54:29+00:00,"If only PBKS scored another 30 runs. 

Then again, if only I had more money, if only people were smarter, if only wars could be stopped...",7
2024-04-21T16:54:30+00:00,Livingstone calm down lmao,1
2024-04-21T16:54:32+00:00,"Sai Sudarshan strikes again with the bat!

This man is GOAT",9
2024-04-21T16:54:43+00:00,He is too passionate today for the team....,3
2024-04-21T16:54:43+00:00,This year's pbks are fighters their position may not justify,6
2024-04-21T16:54:46+00:00,Why the F did we not go spin heavy in previous 3 matches,0
2024-04-21T16:54:48+00:00,Man I'm loving these kind of cricket than high scoring games tbh,5
2024-04-21T16:54:50+00:00,why don't we play kane,2
2024-04-21T16:54:54+00:00,Man Livi hit the Chitta today I am quite sure lmao,2
2024-04-21T16:55:00+00:00,I miss when miller was good at cricket,3
2024-04-21T16:55:09+00:00,"No matter what loving this aggression from livo in this kinda slow static match, not boring per say but we are not used to so",5
2024-04-21T16:55:10+00:00,Punjab in their inflationary phase.,3
2024-04-21T16:55:15+00:00,"How are PBKS this comically bad? The entire first innings was fucked up because the only two real batsmen had an off day. The “impact” sub once again totally flopped. Not leggie despite there being perfect conditions. 
 
How can so much go wrong in a game?",5
2024-04-21T16:55:18+00:00,"Rootlitharan

Travichandran

Glennarine 

Liambhajan",6
2024-04-21T16:55:22+00:00,Can we scrap the shit fairplay award and bring in EntertainerX award ? Punjab will top this season their matches have been banger.,10
2024-04-21T16:55:22+00:00,"WHAT IS IT GONNA TAKE for a match like this to become more common? It's so much more interesting than mindless slogging at 20 RPO, goddamn you TikTok generation",13
2024-04-21T16:55:23+00:00,"**11.5** **timbeeeeeeerrrrrrrrrr!** No Miller Time for GT tonight. Livingstone has put him on ice. Another vein-popping celebration from Livingstone and Kings might just start to believe they can do this. The ball was tossed up and skidding under Miller's big swing across the line to rattle middle and leg stumps

David Miller b Livingstone 4 (6b 0x4 0x6) SR: 66.66",3
2024-04-21T16:55:30+00:00,I missed these kinds of games,3
2024-04-21T16:55:33+00:00,Our bowling line up deserves better. We lost every match because of our top order.if we won those matches we would've been considered as best bowling line up along with rr.pbks is the only team who hasn't conceded 200 in this season,7
2024-04-21T16:55:41+00:00,Punjab gives you CPR only to bash your head back into coma.,7
2024-04-21T16:55:42+00:00,unpopular opinion: these types of matches>>>250 slogfests,11
2024-04-21T16:55:50+00:00,Sidhu needs to go he's still yapping about the no ball and giving illogical comments to defend koach,3
2024-04-21T16:55:53+00:00,"Is it game on?
Punjab pls lose in 19 th rather than take it to 20",3
2024-04-21T16:55:56+00:00,Livingstone is getting a bowl. Wish our Indian batters also bowled a bit from time to time.,5
2024-04-21T16:55:56+00:00,"What do these commentators get by sucking off Kohli, Dhoni and Rohit?",4
2024-04-21T16:55:56+00:00,"People were questioning livi passion for this team...

One of the only guys who care",7
2024-04-21T16:56:07+00:00,Prediction- Last over 10 runs to win for GT and rashid wins in for them.,2
2024-04-21T16:56:09+00:00,Sudarshan tuk tuking is putting pressure on everyone,6
2024-04-21T16:56:16+00:00,Both these wickets are due to Sai btw. He's putting pressure on them due to his run a ball chase.,7
2024-04-21T16:56:22+00:00,2 more wickets and this match will be 50-50,1
2024-04-21T16:56:28+00:00,Good chance for Omarzai to showcase his batting.,4
2024-04-21T16:56:36+00:00,Looks like we are headed for another nail-biter that ends with a punjab loss in the final over,8
2024-04-21T16:56:38+00:00,Miller's form has been really bad this season,1
2024-04-21T16:56:44+00:00,Sai sudarshan maybe only played one aggressive inning in IPL that was in previous year's final lol,8
2024-04-21T16:56:47+00:00,"Does anyone remember ""kanna keep calm award""",6
2024-04-21T16:56:52+00:00,Livi is so passionate. He wants to win it for Punjab,6
2024-04-21T16:57:07+00:00,I am once again asking why tf does miller have so much cred as a t20 player ,5
2024-04-21T16:57:08+00:00,Do they know about our NRR situation or they think they will win 7 out 7 matches,2
2024-04-21T16:57:11+00:00,PBKS coming back to form to reclaim their 6th spot.,3
2024-04-21T16:57:13+00:00,We haven't yet had a bowling side comeback defending a low total have we? Hoping against hope for a collapse here.,4
2024-04-21T16:57:26+00:00,"FYI, there's Tewatia in GT's line-up, lol",3
2024-04-21T16:57:27+00:00,People wanted low scoring thrillers right? Now enjoy...,5
2024-04-21T16:57:31+00:00,No,2
2024-04-21T16:57:37+00:00,KANOS > “Killer” Miller,-4
2024-04-21T16:57:38+00:00,Is this Punjab batting line-up top 5 worst batting line-up in IPL history? I am sure it's at least top 10.,5
2024-04-21T16:57:38+00:00,Damn yo,3
2024-04-21T16:57:44+00:00,Why is almost every Indian batsmen in T20 an anchor nowadays? We need more players like Abhishek in the ICT,19
2024-04-21T16:57:59+00:00,Kane mama next game in place of Miller please,1
2024-04-21T16:58:35+00:00,All that just for tewatia to hit 12(2),10
2024-04-21T16:58:52+00:00,"Jay Shah script for PBKS 

Take the game in last over only to lose it",6
2024-04-21T16:59:09+00:00,"Man, that impact player knock from Bhatia looking more and more impactful now.",2
