Timestamp,Comment,Upvotes
2024-04-21T15:10:14+00:00,"It's criminal to have a clutch player in PBKS. He should be released in the auction next year, they must.",2
2024-04-21T15:10:16+00:00,"Too many talks of flat pitches, and Don Shah produces this rank turner, haters can shut up now",1
2024-04-21T15:10:19+00:00,Entire team can’t play spin. Our pacers will get tonked all over the park,3
2024-04-21T15:10:21+00:00,"Why the fuck they don't go directly to ultra edge. The ball is near the bat, let's take a look at the ultra edge.",9
2024-04-21T15:10:39+00:00,"Sai kishore, m Siddharth, Rachin Ravindra.

They are a same guy!",3
2024-04-21T15:10:55+00:00,"Punjab really has some good looking supporters. 

Hell, their chief is herself damn pretty.",2
2024-04-21T15:10:58+00:00,ayo spiderman is from punjab,2
2024-04-21T15:10:59+00:00,I hope pk dont retain ashutosh and shashank. This way all three of us can wash our hands from this wreck.,2
2024-04-21T15:11:00+00:00,What a fantastic Spin choke..,3
2024-04-21T15:11:08+00:00,Just tuned in. Wait I thought I already saw one RCB match today. I'm confused.,3
2024-04-21T15:11:13+00:00,Why does this feel like over correction decision by third umpire like they did in last match with wides,1
2024-04-21T15:11:30+00:00,"Look I am gonna be honest , I have given up on qualifying this season . I am just enjoying shashank and Ashutosh",3
2024-04-21T15:11:31+00:00,Well its gg now,3
2024-04-21T15:11:32+00:00,Even god wants to see their batting,4
2024-04-21T15:11:34+00:00,Sai Kishore has been doing well in domestic since ages.. I am so glad he is finally getting chances to show his talent.,12
2024-04-21T15:11:35+00:00,jitesh is fell off as well. thats why never judge player on his one season wonders. Next season teams has plans for you,4
2024-04-21T15:11:42+00:00,GG,1
2024-04-21T15:11:44+00:00,YES SAI KISHORE,8
2024-04-21T15:11:49+00:00,It's over,3
2024-04-21T15:11:50+00:00,"PBKS should fire their auction team, whoever that is. Since 2008 they've been frauding the owners.",7
2024-04-21T15:11:52+00:00,Lmao,3
2024-04-21T15:11:53+00:00,Joever,5
2024-04-21T15:11:56+00:00,Why step out? Let the ball come to you!?,3
2024-04-21T15:12:02+00:00,Was that Venom or Spider-Man?,3
2024-04-21T15:12:06+00:00,Now take out Shashank!,6
2024-04-21T15:12:06+00:00,lets go sai ya fuckin beauty,6
2024-04-21T15:12:07+00:00,"Tuned in and wicket falls, as usual.",3
2024-04-21T15:12:09+00:00,What is he smoking that lazy batting man,2
2024-04-21T15:12:11+00:00,Fuck it …. Retain Sai kishore as well. Mega auction next year will fuck us up,6
2024-04-21T15:12:13+00:00,"Disband this team, give a team to MP or North east or something.",4
2024-04-21T15:12:16+00:00,PBKS fans can take the consolation atleast 89 is crossed..,4
2024-04-21T15:12:16+00:00,Pbks is just north Indian branch of rcb,37
2024-04-21T15:12:19+00:00,There's absolutely no reason why we chose to bat first. Absolutely sabotage this entire team can fuck off they don't care about the fans,3
2024-04-21T15:12:20+00:00,finally law of avg catching up.,3
2024-04-21T15:12:22+00:00,Masterclass on variations in pace. He's the best SLA in the country for t20 cricket,2
2024-04-21T15:12:22+00:00,A catch taken by a GT player is a rare occasion.,6
2024-04-21T15:12:22+00:00,Get shivam as impact,2
2024-04-21T15:12:24+00:00,They aren't going anywhere during this match. Their main batsman is out.,5
2024-04-21T15:12:25+00:00,Should've waited for Pace to come back,3
2024-04-21T15:12:26+00:00,Best SLA in the country,3
2024-04-21T15:12:26+00:00,And these mfs don’t have any spinners,3
2024-04-21T15:12:30+00:00,"So many amazing batsmen. 

So fucked up batting order.",3
2024-04-21T15:12:30+00:00,PBKS 🤝RCB - Needlessly throwing away wickets,6
2024-04-21T15:12:32+00:00,Mfers there were 7 overs left and it was the last ball,3
2024-04-21T15:12:34+00:00,so there weakness is spin,2
2024-04-21T15:12:37+00:00,Sai Kishore and Santner should team up next year,2
2024-04-21T15:12:41+00:00,"Well this is new, I thought they will choke towards the end of match",4
2024-04-21T15:12:44+00:00,real batting gone,9
2024-04-21T15:12:47+00:00,PBKS to RCB. Hold my beer :),8
2024-04-21T15:12:49+00:00,"**13.5** **No redemption song tonight!**

Ashutosh Sharma c Sharma b Sai Kishore 3 (8b 0x4 0x6) SR: 37.5",4
2024-04-21T15:12:54+00:00,Please kick this team outta ipl man omg they’re so dead,3
2024-04-21T15:13:16+00:00,Ah shit man. I feel sad now,1
2024-04-21T15:13:16+00:00,Ashutosh strike rate under 100? Impossible,3
2024-04-21T15:13:17+00:00,Someone said PBKS is the north equivalent of RCB and I can’t agree more lol,4
2024-04-21T15:13:18+00:00,Why prepare a spinning wicket to a team that has pletora of spin and our main spinner is brar! Wtf is happening,5
2024-04-21T15:13:23+00:00,Paaji gaddari /s,2
2024-04-21T15:13:28+00:00,SRH inspired Punjab “we will bat first” 92-6 😂,8
2024-04-21T15:13:36+00:00,"let me ask again, why did they drop Sai Kishore after initial 2 good performances",8
2024-04-21T15:13:45+00:00,Our next match is against GT but at Arun Jaitley which is basically our own deathbed.,5
2024-04-21T15:13:57+00:00,"Good news is, today they will lose hopelessly. Otherwise you have to watch the whole match for the inevitable disappointment",1
2024-04-21T15:13:57+00:00,So many paajis supporting GT,7
2024-04-21T15:14:12+00:00,Looks like this season Pbks might not even make their favorite 6th position,11
2024-04-21T15:14:13+00:00,what is this team dude,2
2024-04-21T15:14:25+00:00,[deleted],-2
2024-04-21T15:14:30+00:00,"Good news is, today they will lose hopelessly. Otherwise you have to watch the whole match for the inevitable disappointment",3
2024-04-21T15:14:32+00:00,I thinks it’s the fans’ fault for having expectations when the team is opening with Sam fucking Curran,3
2024-04-21T15:14:33+00:00,"These guys need Bairreddy back, this team's batting looks so much worse",1
2024-04-21T15:14:35+00:00,Is the Pitch spinner friendly or we just bowled excellently?,6
2024-04-21T15:14:41+00:00,Dumbasses using the impact player in first innings again. This team is such a laughing stock,1
2024-04-21T15:14:50+00:00,Same ol same ol,1
2024-04-21T15:15:12+00:00,"Punjab fans

I respect you for Continuosly supporting this franchise🫂![gif](emote|free_emotes_pack|give_upvote)

How are you able to do this???",1
2024-04-21T15:15:28+00:00,What a spin choke..,3
2024-04-21T15:15:29+00:00,I wanted to say even PBKS can't make this one a close game and then I remembered GT's batting,5
2024-04-21T15:15:30+00:00,I'm happy we lost this. The top order can't just keep getting away with playing like absolute crap,6
2024-04-21T15:15:31+00:00,Pbks showing solidarity for their fallen brother rcb,5
2024-04-21T15:15:36+00:00,Punjabi DJs always play bangers,2
2024-04-21T15:15:50+00:00,Why has Sai been on the bench for so long smh,5
2024-04-21T15:15:56+00:00,"Idk what is the obsession with Bhatia 

They could have used chahar here for spin",6
2024-04-21T15:16:13+00:00,Atleast make 150..,1
2024-04-21T15:16:24+00:00,folks from mullanpur. what is your city famous for? is it tourist place ?,2
2024-04-21T15:16:24+00:00,"Every season, after Punjab is out of race, I change my flair back to India from PBKS, lol. 

It's like a tradition as this point. Soon, I'll change for current season.",3
2024-04-21T15:16:33+00:00,"My friend's family is worried because he mostly keeps to himself and doesn't show interest in daily activities. Upon searching his browser history , his family found out that he's searching up on Nihilism related content and only watches RCB, PBKS matches in IPL, his laptop wallpaper is Travis Head batting on 19/11

Should we be worried?",7
2024-04-21T15:16:35+00:00,"These are the wickets we might get in the world cup in west indies..

Not sure about the wickets in the US though. 

But west indies is where the finals and knockouts happen",2
2024-04-21T15:16:40+00:00,"The Earth may turn flat but RCB, PBKS & DC will remain at the bottom of the IPL table.",0
2024-04-21T15:16:42+00:00,Refund every single fan who came to the game. Embarrassing,2
2024-04-21T15:16:48+00:00,Idk why last match we didn't play spinners here like GT instead of the same old Pandu and pacer frends,6
2024-04-21T15:16:50+00:00,"Bairstow has been in India for so long. Had a tough test series and had to go through a lot of media criticism. He was probably a bit down. 

He needed PK management to give him some time to get back in form and stand by him . And the management drops him after a few games when the alternative is fucking Roussow",10
2024-04-21T15:16:56+00:00,DJ playing some bangers today,4
2024-04-21T15:17:06+00:00,"Jay shah, low scoring thriller in the cards?",6
2024-04-21T15:17:08+00:00,Most dead thread this IPL?,0
2024-04-21T15:17:18+00:00,Punjab bros you're still gonna win our batting is Gill and inshallah,5
2024-04-21T15:17:29+00:00,Punjab not missing Dhawan the captain but need someone like Dhawan the batsman up top,6
2024-04-21T15:17:34+00:00,[deleted],2
2024-04-21T15:17:42+00:00, i will have not complaint if shashank will play tuktuk till the end. they just need him thats all,1
2024-04-21T15:18:17+00:00,At least score 160 for GT to bat on,0
2024-04-21T15:18:17+00:00,Didn't know a day night test match was organized last minute in mullanpur,3
2024-04-21T15:18:23+00:00,"What's this nonsense that if a team plays badly it's a slow pitch. 

It's a skill issue lol",8
2024-04-21T15:18:39+00:00,WHY ARE YOU STEPPING OUT!!!! WTFFF,4
2024-04-21T15:18:41+00:00,We were 56-1 after pp.in the next 8 overs we only managed to make 41 runs .also lost 5 wkts,3
2024-04-21T15:18:53+00:00,LMAO RIP POONJAB,12
2024-04-21T15:18:53+00:00,I went out for 5 mins and they are 6 down!! WTF happend,5
2024-04-21T15:18:54+00:00,Lmao,3
2024-04-21T15:18:59+00:00,"Rashid Khan thinks he’s so cool.

He’s not.",-8
2024-04-21T15:19:08+00:00,No redemption tonight.,2
2024-04-21T15:19:08+00:00,Well done Sai Kishore.. Lovely change of pace.,12
2024-04-21T15:19:09+00:00,sai-ki is the indian domestic cricket shining,6
2024-04-21T15:19:11+00:00,Brothers of destruction gone. It's joever for Punjab,8
2024-04-21T15:19:17+00:00,finally. the batting is over,3
2024-04-21T15:19:20+00:00,So we play all three spinners all the time I suppose lol,8
2024-04-21T15:19:21+00:00,Sai broke code of both Sashank and Ashutosh mf was benched for 5 matches,18
2024-04-21T15:19:26+00:00,Spinners game totally...,1
2024-04-21T15:19:27+00:00,[deleted],-8
2024-04-21T15:19:34+00:00,Today's the match GT can use to up their points and run rate both.,10
2024-04-21T15:19:34+00:00,"Delhi capitals, pbks and RCB should go through the qualifiers to get to play in IPL like in world cups, they are just shit and taking the opportunity of new teams due to the fetish of bcci for 10 teams",3
2024-04-21T15:19:38+00:00,Dhawan unknown injury?,1
2024-04-21T15:19:39+00:00,Ok so punjab batting is over I guess,2
2024-04-21T15:19:42+00:00,I sense another thriller,1
2024-04-21T15:19:44+00:00,I do have to ask what the fuck Punjab team management and curators thought they were doing by creating a pitch that turns so much when the only spinner we have is Liam fucking Livingstone,3
2024-04-21T15:19:45+00:00,"Liquidate the team. 

I'm leaving Iol see you guys Friday not watching this shit anymore",1
2024-04-21T15:19:53+00:00,sai the grim reaper,2
2024-04-21T15:19:53+00:00,real batting came   real batting gone,11
2024-04-21T15:19:58+00:00,Punjab 🤝 banglore,5
2024-04-21T15:20:01+00:00,Harpreet and Harpreet lol.,6
2024-04-21T15:20:07+00:00,"**15.2** **his third wicket!** Sai has been varying his pace, forcing mis-hits and mistakes, and this time Shashank hits it right back to the bowler. Sai bowls a length ball, flat, and Shashank comes down the track to meet it. But he cannot get the bat swing through the ball, instead bunting a catch straight back to Sai

Shashank Singh c & b Sai Kishore 8 (12b 0x4 0x6) SR: 66.66",3
2024-04-21T15:20:09+00:00,"Man Shreyas Iyer can't help but hit on married people, can he? 

First Dhanashree and now Bumrah in that dream 11 ad",4
2024-04-21T15:20:09+00:00,So without Shashank and ashutosh Punjab will not able to cross atleast 120...,24
2024-04-21T15:20:11+00:00,"Sai ""Vettori"" Kishore destroying Punjab Kings today",15
2024-04-21T15:20:18+00:00,"Spin masterclass from Sai, the guy is slowing the ball so much with revs at the same time.",3
2024-04-21T15:20:20+00:00,Does Pbks has another spinner with Brar?,2
2024-04-21T15:20:23+00:00,i want to stop watching this match but considering pbks ability to make match intresting is stopping me.,9
2024-04-21T15:20:26+00:00,Punjab batting in 2017 vs 2024 lol,4
2024-04-21T15:20:35+00:00,"At this point, send in the batting coach",3
2024-04-21T15:20:39+00:00,"Finally GT has figured out their best XI ig. Sai su coming in as impact sub in place of mohit. Saha is still a weak link in batting. But, it can be managed ig.",6
2024-04-21T15:20:41+00:00,Why are we making some mid spinner look like prime Murali!?,1
2024-04-21T15:20:48+00:00,Sick of the same bullshit every year.,4
2024-04-21T15:20:50+00:00,No 260-270 this game lol,6
2024-04-21T15:20:50+00:00,Gt taking the nrr back they gaveup to dc,10
2024-04-21T15:20:52+00:00,Sai Kishore not playing for most of the season was criminal.,20
2024-04-21T15:21:18+00:00,That frizzy hair must be distracting..,3
2024-04-21T15:21:26+00:00,Punjab is a team that needs to be relegated from the IPL,3
2024-04-21T15:21:35+00:00,Tewatia loves Sai Kishore hair..,3
2024-04-21T15:21:37+00:00,Kushiro isn’t even that good a bowler lol,-3
2024-04-21T15:21:42+00:00,Punjab have been pathetic. Gujarat have won at a canter.,4
2024-04-21T15:21:51+00:00,Are GT playing at Chepauk this year. It'll be spicy to watch Rashid Noor Sai K vs Jaddu Moen Theekshana,2
2024-04-21T15:22:04+00:00,Good that we have 2 matches today and RCB / KKR was a banger this match is so meh ... What happened to Punjab their batting always looks so dumb,1
2024-04-21T15:22:16+00:00,Brar showing Pbks batters how to play spin,1
2024-04-21T15:22:19+00:00,"As shit as our batting has been this season, our bowling is truly elite. We are missing Shami tho. 

I think Punjab can be restricted to below 140.",9
2024-04-21T15:22:24+00:00,These batsmen are horrible at playing spin,2
2024-04-21T15:22:24+00:00,"Yesterday dc choked
Today rcb and pbks choked

 No trophy supremacy 🔥",3
2024-04-21T15:22:35+00:00,Need this to be a close game (don't want gt overtaking mi on nrr),0
2024-04-21T15:22:53+00:00,Is that fucking sharukhan bowling!,7
2024-04-21T15:22:57+00:00,IPL should have 2 divisions. With promotion and relegation. PK and RCB needs relegation,4
2024-04-21T15:22:58+00:00,Punjab team should compete with under 16 team.they will still lose,2
2024-04-21T15:23:18+00:00,In tnpl sai kishore scored fastest 50 right@2023?,6
2024-04-21T15:23:27+00:00,Srk against pbks damn thats a good redemption arc,5
2024-04-21T15:23:31+00:00,THE KING SRK,7
2024-04-21T15:23:36+00:00,Shashank Singh to win the match with his bowling skills today,1
2024-04-21T15:23:43+00:00,Watch GT choke this one lmao,-1
2024-04-21T15:23:44+00:00,This is peak comedy lol,5
2024-04-21T15:23:51+00:00,That’s missing. Even impact might be an issue,3
2024-04-21T15:23:56+00:00,TNPL Purple cap legend Shahrukh Khan is taking wickets against PBKS lmao,1
2024-04-21T15:23:57+00:00,And sharukh top wkt taker in tnpl? ,3
2024-04-21T15:23:59+00:00,WTF SRK.,5
2024-04-21T15:24:01+00:00,[deleted],2
2024-04-21T15:24:04+00:00,"expansion lip dazzling cover connect pot cake ask groovy coordinated

 *This post was mass deleted and anonymized with [Redact](https://redact.dev)*",1
2024-04-21T15:24:05+00:00,Is it harder to be a PBKS Fan than an RCB fan? Feel PKBS is just another RCB without the Hype & PR! Talking out of frustration! 😑,3
2024-04-21T15:24:06+00:00,All out before 120🙏,7
2024-04-21T15:24:08+00:00,Shahrukh showing PBKS management that he can actually bowl lol,10
2024-04-21T15:24:09+00:00,I'm watching this just expecting every ball to be a wicket.,0
2024-04-21T15:24:14+00:00,Bring in Tewatia next lol.,11
2024-04-21T15:24:20+00:00,Gt shitposting,7
2024-04-21T15:24:32+00:00,Most of the impact players this season have given impact for the oppositions lol,7
2024-04-21T15:24:41+00:00,"GT has 4 from Tamilnadu

Sandeep Warrier (plays for tamilnadu)

Sai Kishore

Sudarshan/Shankar

Shahrukh

3 from Afghanistan

Rashid

Noor

Omarzai",10
2024-04-21T15:24:56+00:00,Fuck this team man,3
2024-04-21T15:24:57+00:00,This umpire didn't get the smart review update?,3
2024-04-21T15:25:02+00:00,Nice that we paid for adobe after effects cc,1
2024-04-21T15:25:02+00:00,jokes on u umpire,4
2024-04-21T15:25:09+00:00,"'kabhi Mai, kabhi Vo, kabhi Mai, kabhi vo..' meme was created for RCB and PBKS to symbolise worst franchise competition

Tr: sometimes us, sometimes them",3
2024-04-21T15:25:10+00:00,Umpire wanted to go home early,7
2024-04-21T15:25:22+00:00,Wait i thought srk was medium pacer,3
2024-04-21T15:25:25+00:00,"Shah Rukh Khan is bowling off-breaks.  

Wasn't he a medium pace bowler?",2
2024-04-21T15:25:27+00:00,howler umpiring here,4
2024-04-21T15:25:33+00:00,"I’m gonna say it…
This match has the highest gathering of pretty ladies in this season of IPL.",21
2024-04-21T15:25:50+00:00,come gill bowl yourself next,6
2024-04-21T15:26:01+00:00,Did they make the boundaries bigger or are we just struggling to clear them?,1
2024-04-21T15:26:08+00:00,Who kept this match on a freaking Sunday,2
2024-04-21T15:26:09+00:00,Umpiring has been terrible this match,1
2024-04-21T15:26:21+00:00,Umpiring on another level this ipl,1
2024-04-21T15:26:30+00:00,Gill about to come next over lol,8
2024-04-21T15:26:37+00:00,brar discovered himself as the main hero of story,2
2024-04-21T15:26:38+00:00,"How many spinners have we got?
GT: yes",6
2024-04-21T15:26:39+00:00,how many decisions overturned today lol,2
2024-04-21T15:26:50+00:00,140 + and we can have a close match.,2
2024-04-21T15:27:15+00:00,"Give the bowl to Tewatia, given his record against Punjab he will take a hat-trick",7
2024-04-21T15:27:29+00:00,He's stepping out just bait him with a wide,2
2024-04-21T15:27:30+00:00,"Holy trinity of sucking in the IPL- PBKS, RCB , DC. /s",5
2024-04-21T15:27:33+00:00,that run out was literally same as dhoni,2
2024-04-21T15:27:35+00:00,"Aunty ji don’t worry 
You don’t have to eat gulab jamun for the rest of the season ",9
2024-04-21T15:27:39+00:00,[deleted],16
2024-04-21T15:27:49+00:00,[removed],1
2024-04-21T15:27:59+00:00,Brar is a better batsman then bhatiya,2
2024-04-21T15:28:06+00:00,PBKS doing their best to not make those poor fans Diabetic.,11
2024-04-21T15:28:08+00:00,Lady wants diabetes asap,3
2024-04-21T15:28:25+00:00,Please get to 145,2
2024-04-21T15:28:29+00:00,"Can't remember who (cricket expert) said, 'Sai Kishore is the best left spinner in India right now and should play every match'",3
2024-04-21T15:28:34+00:00,GT has developed a really good fanbase in just 2 years,5
2024-04-21T15:28:41+00:00,50 gulab jamun is diabetes speedrun,8
2024-04-21T15:28:51+00:00,"Yes Mr.bhatia,please ensure the bat is exactly aligning with your sight every time and meticulously proceed to do nothing.",2
2024-04-21T15:28:53+00:00,You should eat 50 gulaab jamuns IF Punjab wins IPL lol,3
2024-04-21T15:28:56+00:00,So happy to see Shankar come out with the drinks,8
2024-04-21T15:29:07+00:00,Jay shah was exhausted after writing the script for KKR vs RCB so he’s letting the umpires cook for this match ,2
2024-04-21T15:29:07+00:00,Chance for gt to get their nrr Better,3
2024-04-21T15:29:09+00:00,This is make it or break it inning for Bhatia,1
2024-04-21T15:29:09+00:00,50 gulab jamun khake pet badh Jana hai kake. T: don't eat too many sweets lmao,2
2024-04-21T15:29:22+00:00,Prem Jyotish lmao,2
2024-04-21T15:29:38+00:00,"Actually just a bad match for a Sunday night lol

Should've been a CSK/MI game",2
2024-04-21T15:29:49+00:00,So after a great exciting match in the noon they course corrected and are giving us this match,3
2024-04-21T15:30:02+00:00,What happened to the depressed pbks fan??? Haven't seen him around in years,9
2024-04-21T15:30:12+00:00,From 50-0 in 5 overs to...this. PBKS is an art,3
2024-04-21T15:30:14+00:00,I can eat 50 gulab jamun,5
2024-04-21T15:30:43+00:00,Sardarji knows pbks not winning shit so he put his stomach and anus on the line.,-1
2024-04-21T15:30:49+00:00,Trust Jay Shah's script Wait for the next innings,2
2024-04-21T15:30:54+00:00,Why can’t they use the Harpreets’ last names? So confusing,2
2024-04-21T15:30:55+00:00,Never thought Prabh would be our top scorer this match!,3
2024-04-21T15:31:02+00:00,"""We'll have bat, thanks"" isn't the best idea, when you have best chasers in Shashank & Ashutosh. I know, hindsight is 20/20.",6
2024-04-21T15:31:03+00:00,I’m still getting over the earlier game man,3
2024-04-21T15:31:09+00:00,"I don't know when but someone here commented that Sai Kishore looks like a crack addict and now that's stuck in my head 

And I laughed in front of my family when he came to bowl because i remembered that comment and they all gave me weird stares",16
2024-04-21T15:31:22+00:00,"r/cricket - hate these high scoring matches. This is not cricket. 

Also r/cricket - this low scoring match is ruining my Sunday",11
2024-04-21T15:31:47+00:00,"Holy Trinity 3/3 
DC , RCB Lost, PBKS OTW",4
2024-04-21T15:31:47+00:00,are you guys have no trust in jay shah its still GT batting left . harshal bumrah is there too,5
2024-04-21T15:31:53+00:00,"Great that GT realised mid season that with batting as weak as it is any way, playing Noor isn't optional. He has to bowl in the middle.",5
2024-04-21T15:32:03+00:00,"Question: Who do we need to win here for Delhi’s benefit?

Answer: It does not matter, Pant has already given up.",5
2024-04-21T15:32:04+00:00,We might end up making Harpreet brar an all rounder,14
2024-04-21T15:32:10+00:00,"Brar can bat decently well, nice.",3
2024-04-21T15:32:15+00:00,"cameraman what kinda fetishes do u have man? don't bring someone that close to my screen, rather record fair/unfair catches properly.",2
2024-04-21T15:32:18+00:00,"I gotta give PBKS credit for making the team filled with the most punjabi names possible 
Respect ",5
2024-04-21T15:32:19+00:00,Surprise mfs our best batsman is on the crease,9
2024-04-21T15:32:23+00:00,brar for WC,2
2024-04-21T15:32:32+00:00,Speaking of 50 gulab jamuns my friend once ate 50 jalebis on a bet. Mfer ate 50 jalebis in one sitting and won the bet.,8
2024-04-21T15:32:50+00:00,BRAR 76(26) incoming,10
2024-04-21T15:32:51+00:00,"So, Bhatia is the tailender and Brar is the pinch hitter right?",10
2024-04-21T15:33:12+00:00,Brar for world cup,2
2024-04-21T15:33:15+00:00,"Genuinely asking, is it within rules as to what Nehra and Gautam do?",3
2024-04-21T15:33:19+00:00,Boring double header today,2
2024-04-21T15:33:27+00:00,Punjab Kings dont want their fans to be diabetic. How kind of them.,6
2024-04-21T15:33:51+00:00,bhatia who is this guy,2
2024-04-21T15:33:51+00:00,[deleted],5
2024-04-21T15:33:53+00:00,Bhatiya ki jangah kaverappa ko sub in kar leta .brar is a better batsman anyway. We would have a better chance of winning that way,2
2024-04-21T15:34:00+00:00,"Are our bowlers back to form, pbks is shitting the bed or is the pitch a low scorer, only jay shah knows the answer",5
2024-04-21T15:34:04+00:00,"""You are out of your damn little pea-sized mind. Every day you do something stupider than the day before.... You are a professional idiot.""

- ~~Stanley Hudson~~ Me to PBKS every matchday",3
2024-04-21T15:34:05+00:00,MFs subbed in a tailender and called it a day,11
2024-04-21T15:34:22+00:00,Can’t believe Mohit doesn’t get picked for national T20 team. He’s been consistently great in ipl,1
2024-04-21T15:34:24+00:00,Why did Punjab get Harpreet as the impact sub when Harpreet is more than capable with the bat?,7
2024-04-21T15:34:41+00:00,This year we might get a GT calculator instead of RCB. /s.,7
2024-04-21T15:34:50+00:00,"Who is this bhatia playing impactful innings for Gujarat, atleast give strike to Brar he is trying for boundaries...",2
2024-04-21T15:35:04+00:00,"So PBKS should plan to play Livi, Brar and Chahar but watch them bowl all 4 overs of all pacers",2
2024-04-21T15:35:12+00:00,Rabada > Bhatia,6
2024-04-21T15:35:36+00:00,"Shambolic performance this tournament from the PBKS top order. 
Can't expect your lower order to bail you out every time.",4
2024-04-21T15:35:59+00:00,50 gulab jamuns even that hard. But 50 besan ke laddoo? Now that ain’t possible.,3
2024-04-21T15:36:00+00:00,If they can sneak a 145 or so here - they're definitely in this match,2
2024-04-21T15:36:13+00:00,Do PBKS not have a better batsman than this Bhatia guy,4
2024-04-21T15:36:34+00:00,"Get to 145, and there's a non-zero chance",5
2024-04-21T15:36:41+00:00,Sai Kishore looks Kramer-ish,2
2024-04-21T15:36:52+00:00,Punjab has led GT into thinking Kishore is a good bowler lmfaooo,-3
2024-04-21T15:36:55+00:00,19(8) he is actually playing good,2
2024-04-21T15:37:04+00:00,David Spiller,3
2024-04-21T15:37:06+00:00,"Could have subbed in chahar too, he's decent with the bat",2
2024-04-21T15:37:27+00:00,Bhatia 0 boundaries in 15 balls IMPACT PLAYER!!! For GT,4
2024-04-21T15:37:39+00:00,Denied the 4th wicket to ~~Rachin~~ Sai Kishore,3
2024-04-21T15:37:40+00:00,bro never saw miller dropping catch like this.,3
2024-04-21T15:37:46+00:00,Why is Brar looking more composed than any other PBKS batsman today?,5
2024-04-21T15:37:50+00:00,"That's what our batsmen had to do , instead of stepping out every ball",2
2024-04-21T15:37:50+00:00,Can’t wait for some team to wipe off that stupid smile off Kishore’s smug face,-1
2024-04-21T15:38:00+00:00,"Not the best numbers for Jitesh!   
  
Lowest average for a batter in IPL 2024 (100+ balls)  
  
Jitesh Sharma - 16.0  
Sam Curran - 19.0  
Prabhsimran Singh - 19.3",5
2024-04-21T15:38:03+00:00,Kishore deserved that 4th,3
2024-04-21T15:38:06+00:00,Brar in his Goldy Brar era,3
