Timestamp,Comment,Upvotes
2024-04-04 10:59:22 PM IST,"If I recall correctly, we weren't able to defend 27 off the last 2 overs a few matches ago, so this should be possible.",4
2024-04-04 10:59:23 PM IST,Jay Shah interesting script so far how about a superover ,5
2024-04-04 10:59:29 PM IST,Can pbks do a csk in this chase?,3
2024-04-04 10:59:32 PM IST,I need to study finish it off quickly.,4
2024-04-04 10:59:33 PM IST,Lol over,1
2024-04-04 10:59:36 PM IST,Ashutosh gonna smack or get out against Mohit,1
2024-04-04 10:59:37 PM IST,"The way Ashish is passing messages on field, is daylight cheating. How the fuck is this even allowed? Let your players bloody play!",1
2024-04-04 10:59:42 PM IST,"Don't worry guys, we are going to a super over.

I have seen the script.",2
2024-04-04 10:59:43 PM IST,"If GT loses this one then it's completely their fault. They had a stacked batting line-up and then they sent Shankar to shithouse and waste 10 balls. They had Nalkande in the team and didn't give him a single over. If you're not gonna bowl a bowler then might have played another batter and go hard in the middle overs. And don't get me started on the fielding. Nehra ji has made blunders this game, some grave mistakes that too which could cost them this match. This match should have been a free win, because you're playing PBKS at your home ffs.",1
2024-04-04 10:59:43 PM IST,Looks like it's either going to be a super over or a 1-2 run loss,3
2024-04-04 10:59:47 PM IST,Pls Mohit I love you ,2
2024-04-04 10:59:48 PM IST,"from one of the most boring matches to a banger, shashank you might not raise your bat but tha's what you have done",1
2024-04-04 10:59:48 PM IST,Right Shashank would've made 70 by now,5
2024-04-04 10:59:49 PM IST,My 11 circle don't even have an English ad 🤦. Official sponsor my ass,3
2024-04-04 10:59:51 PM IST,Mohit Sharma is the death bowler Arshdeep aspired to be,5
2024-04-04 10:59:55 PM IST,"My ideal XI

1. Gill

2. Jaiswal 

3. Kohli

4. SKY 

5. Pant (wk) 

6. Hardik 

7. Rinku (c) 

8. Jadeja

9. Kuldeep / Arshdeep

10. Bumrah

11. Mayank ⚡️",0
2024-04-04 10:59:56 PM IST,Mohit is such a god damn cheat code,7
2024-04-04 11:00:00 PM IST,Mohit for the wt20 squad,3
2024-04-04 11:00:00 PM IST, Who bowls the last over?,2
2024-04-04 11:00:01 PM IST,No way RCB is on 2nd at fairplay award.,6
2024-04-04 11:00:04 PM IST,Go pbks go,3
2024-04-04 11:00:10 PM IST,Well this over decides the match ,6
2024-04-04 11:00:10 PM IST,Damn,4
2024-04-04 11:00:12 PM IST,Punjab redeeming all their good karma points today,16
2024-04-04 11:00:14 PM IST,Damn 🔥,10
2024-04-04 11:00:17 PM IST,Ashutosh Man that was a shot !!!!,6
2024-04-04 11:00:18 PM IST,yesss let’s go it’s getting interesting,6
2024-04-04 11:00:18 PM IST,Less gooooo boiiiii,5
2024-04-04 11:00:18 PM IST,Ayyy rcb in the top 2😎😎,5
2024-04-04 11:00:19 PM IST,Mohit bowling is so hard to watch 🤦🏼‍♂️,3
2024-04-04 11:00:21 PM IST,Specialist cunter is cunting hard 💀,2
2024-04-04 11:00:23 PM IST,Damnn,1
2024-04-04 11:00:23 PM IST,Ohh my gooooodddddd,2
2024-04-04 11:00:23 PM IST,Rare Mohit L,1
2024-04-04 11:00:24 PM IST,Good one,1
2024-04-04 11:00:25 PM IST,3 sixes away from winning.,1
2024-04-04 11:00:25 PM IST,Bouncers going for runs one way or other and pretty sure Umesh gonna bowl majority of them bouncers . Just place a fielder directly behind ffs.,3
2024-04-04 11:00:28 PM IST,PBKS scouting team works????,4
2024-04-04 11:00:28 PM IST,Love it when slower ball is smashed,4
2024-04-04 11:00:29 PM IST,Perfect Impact,3
2024-04-04 11:00:30 PM IST,Why wasn't Ashutosh already playing for Punjab?,2
2024-04-04 11:00:31 PM IST,Holy shit,2
2024-04-04 11:00:31 PM IST,what the fuck dude only 3 more sixes?? 😭😭😭,1
2024-04-04 11:00:32 PM IST,Fuck ....great script Jay bhai,3
2024-04-04 11:00:36 PM IST,Mohit has been neutralized first time this season....,3
2024-04-04 11:00:37 PM IST,First time seeing Ashutosh and he's been great. Needs to finish it though.,2
2024-04-04 11:00:38 PM IST,Average of 30 and Sr of 200. Where have they been hiding him,4
2024-04-04 11:00:40 PM IST,See it's that easy.,1
2024-04-04 11:00:40 PM IST,Aashutosh rana,5
2024-04-04 11:00:40 PM IST,"I have gotten enough heart attacks , I am never trusting PBKS not to do a kxip",3
2024-04-04 11:00:41 PM IST,Let’s go young man,3
2024-04-04 11:00:45 PM IST,Why is kkr at the last of fair play yada yada bullshit table...??,1
2024-04-04 11:00:45 PM IST,Abd would have caught that,1
2024-04-04 11:00:46 PM IST,Wow Punjab!,2
2024-04-04 11:00:48 PM IST,This dude’s good wtf,3
2024-04-04 11:00:48 PM IST,"Punjab in the jaws of victory.

Punjab is fucked!",2
2024-04-04 11:00:49 PM IST,"Praise the middle order, damn.",1
2024-04-04 11:00:49 PM IST,Someone should start an instagram page of uninteresting cricket moments. Vijay shankar would probably occupy a good 99% of those posts,4
2024-04-04 11:00:49 PM IST,Made my day,1
2024-04-04 11:00:51 PM IST,Slower one or bouncer. This guy can't do anything else,4
2024-04-04 11:00:52 PM IST,Yes. Tonk that running spinner.,2
2024-04-04 11:00:53 PM IST,pick Mohit Sharma for the World Cup. He’s doing decent job. And can maybe even offer some control in slower windies wickets,1
2024-04-04 11:00:54 PM IST,That hit with some power 🔥,1
2024-04-04 11:00:57 PM IST,"KKR at the bottom of fairplay rankings. RCB near the top. Guess who is winning the battle of 'Delhi se hoon, bc'",1
2024-04-04 11:00:57 PM IST,"Having Narine open the batting is absolutely unfair of us.

Why would a bowler tonk everyone out of the park ?

Against the spirit of the game",-1
2024-04-04 11:00:58 PM IST,![img](emote|t5_2qhe0|29262),1
2024-04-04 11:00:58 PM IST,"GT has too many anchors, they need Miller back Omarzai has to go",3
2024-04-04 11:00:58 PM IST,Lmao get fucked GT,7
2024-04-04 11:00:58 PM IST,Why does Darshan Nalkande even play lol,5
2024-04-04 11:00:58 PM IST,smashed a 101 kph holy cow,6
2024-04-04 11:01:00 PM IST,69Mts is long on six 🤣 ,3
2024-04-04 11:01:00 PM IST,I think PBKS have reversed their batting order,2
2024-04-04 11:01:01 PM IST,He's got some real power Ashutosh. Saw it off the first ball he faced,4
2024-04-04 11:01:01 PM IST,Oh no…,1
2024-04-04 11:01:01 PM IST,Long time since I saw a nice slow ball hit for a 6.,5
2024-04-04 11:01:02 PM IST,Ashutosh playing a great cameo!,3
2024-04-04 11:01:03 PM IST,Impact players really can change the game,3
2024-04-04 11:01:04 PM IST,Only competant guy in pbks mangement is the guy keeping an eye on domestic comp. They find good players from it.,7
2024-04-04 11:01:06 PM IST,"Man it's so annoying to see nehra running like a madman, let the captain do something too and prove a point, coaches shouldn't do a captains job.",8
2024-04-04 11:01:07 PM IST,Ahh man Umesh next over is gonna cost us ..,3
2024-04-04 11:01:08 PM IST,The correct PBKS outcome would be to bring this slam to a run a ball and then lose,14
2024-04-04 11:01:08 PM IST,"Length ball going into the stands!

If that's what Nehra wants then it isn't working",8
2024-04-04 11:01:10 PM IST,losing to punjab at home is embarrassing.,4
2024-04-04 11:01:12 PM IST,Best Buy of 2024 auction,4
2024-04-04 11:01:12 PM IST,Stat: Highest successful chase in IPL 2024: 183 by KKR vs RCB in Bengaluru,11
2024-04-04 11:01:17 PM IST,"na na na naaaa, na na na naaaaa, hey hey     
GOODBYE    

GT >:-)",5
2024-04-04 11:01:18 PM IST,Pubjab can’t bottle this now,3
2024-04-04 11:01:19 PM IST,"I don't get PK

Absolutely crumbled last match after 100 opening

Now looks looks like they will chase 200 after 6 down",9
2024-04-04 11:01:19 PM IST,Go guys fuck GT and their fuckin winning ego!,4
2024-04-04 11:01:21 PM IST,"Impact player making impact 


- Sunny G.",8
2024-04-04 11:01:23 PM IST,IMPACT PLAYER,8
2024-04-04 11:01:25 PM IST,The scriptwriter might be cooking. Alexa play Villagers by Sumit Goswami.,4
2024-04-04 11:01:29 PM IST,Bruh sending 100kmphs that far quite impressive,3
2024-04-04 11:01:32 PM IST,Ashutosh finally learned to smack/trash Mohit Bowling slow 😂😭,2
2024-04-04 11:01:33 PM IST,Mohit sharma bowls the same delivery every ball,1
2024-04-04 11:01:34 PM IST,Mohit Sharma's name even being discussed for the WT20 tells you everything you need to know about India's fast bowling stocks in limited overs cricket,0
2024-04-04 11:01:34 PM IST,Goodness me the batting talent is insane in this country,2
2024-04-04 11:01:34 PM IST,Is that gill's sister that's praying?,5
2024-04-04 11:01:35 PM IST,Sai is everywhere,1
2024-04-04 11:01:36 PM IST,"I keep saying, we are a good team, we just need a mfering experienced captain man",6
2024-04-04 11:01:36 PM IST,Is Ashutosh Maxwell of India?,3
2024-04-04 11:01:37 PM IST,"Ashutosh ""lapodi"" Sharma",1
2024-04-04 11:01:38 PM IST,Dude does not know what a straight bat is,2
2024-04-04 11:01:38 PM IST,Cmon boys hold your nerves,3
2024-04-04 11:01:39 PM IST,Ashutosh has ice in his viens for a guy who's so new to IPL facing a pressure situation,8
2024-04-04 11:01:41 PM IST,don't know why i feel like superover is long due in IPL,7
2024-04-04 11:01:43 PM IST,Yo wtf is happening,5
2024-04-04 11:01:44 PM IST,Who'll be in the super over for pb?,2
2024-04-04 11:01:45 PM IST,I hope Jay Shah is in super over mood today,9
2024-04-04 11:01:48 PM IST,One six they are even,3
2024-04-04 11:01:48 PM IST,I want a super over! 🌝 as a neutral it will be funnnn,4
2024-04-04 11:01:49 PM IST,"All part of the script, it's perfect time for gill to bowl the last over and take this year's first hat-trick :)",3
2024-04-04 11:01:51 PM IST,Now wait for punjab to bottle,9
2024-04-04 11:01:51 PM IST,"Mohit Sharma getting humiliated


I will be there",11
2024-04-04 11:01:54 PM IST,Bruh it's Umesh in the last over,4
2024-04-04 11:01:57 PM IST,"RCB , MI & DC now : See? Some other team’s lost at home too!",2
2024-04-04 11:01:57 PM IST,Punjab plays really well when they are in hunt for 6th,6
2024-04-04 11:01:58 PM IST,Missed a full toss,3
2024-04-04 11:02:01 PM IST,Bruh everywhere I go I see Sai flying down the boundary 💀,7
2024-04-04 11:02:01 PM IST,Advantage PBKS with Umesh bowling the last over,3
2024-04-04 11:02:01 PM IST,Whom should i support from our perspective?,2
2024-04-04 11:02:01 PM IST,We used to pray for days like this 🙏,5
2024-04-04 11:02:02 PM IST,Damn why so much gt hate,7
2024-04-04 11:02:09 PM IST,mohit bro run for the ball,2
2024-04-04 11:02:10 PM IST,wow PBKS has big hitters who are from India this is looking good for them,10
2024-04-04 11:02:14 PM IST,Punjab matches are not good for health,5
2024-04-04 11:02:15 PM IST,All 4 GT fans in shambles,10
2024-04-04 11:02:15 PM IST,Crazy from Punjab. GT 🤐,2
2024-04-04 11:02:18 PM IST,We know the Punjabi script. 8 to win of the last over....ans they'll lose.,12
2024-04-04 11:02:19 PM IST,"i am new to cricket, someone tell me why doesn't everyone just bowl at 96 kph? are they stupid?",12
2024-04-04 11:02:20 PM IST,"Sadda Punjab bitches.

T: Punjab theme",15
2024-04-04 11:02:20 PM IST,What a bottlejob,3
2024-04-04 11:02:21 PM IST,what an innings,3
2024-04-04 11:02:25 PM IST,Dhawan batting made chase easy y,7
2024-04-04 11:02:30 PM IST,Where's nehraji tonight ?,6
2024-04-04 11:02:34 PM IST,"Script writer when it's an match between the competent teams: 😴😴

Script writers when Punjab are involved: ✍️🔥🔥",14
2024-04-04 11:02:34 PM IST,"If PBKS wins, Ahmedabad will drink. 

Drink hard.",12
2024-04-04 11:02:37 PM IST,Two sixes this match should be done and dusted,3
2024-04-04 11:02:37 PM IST,What a yummy match,8
2024-04-04 11:02:41 PM IST,Do people still want to complain about 4 overseas being too few in the XI?,9
2024-04-04 11:02:42 PM IST,lol Punjab out of nowhere getting so so so close. Classic.,11
2024-04-04 11:02:50 PM IST,"These guys need to finish up games faster man

They are taking up my fap time with such close matches",7
2024-04-04 11:02:51 PM IST,Punjab has never had any good finishers. Jitesh?? Not there. This is nice to see against a good team like gt,6
2024-04-04 11:02:53 PM IST,Umesh won't defend shkt..GG Punjab,9
2024-04-04 11:02:55 PM IST,its PBKS match to lose now unless GT plot Armor kicks in,25
2024-04-04 11:02:57 PM IST,"> Random ashutosh shows up outta nowhere 
> out bats the whole lineup 
>refuses to elaborate 
> ... To be continued",12
2024-04-04 11:03:01 PM IST,As a pbks fan I’m scared,4
2024-04-04 11:03:08 PM IST,Umesh isn't trustable for the last. Will Gill gamble and give it to Nalkande who he forgot existed until now???,2
2024-04-04 11:03:09 PM IST,Fair play points are awarded out of 10 /11 / 12 ??,2
2024-04-04 11:03:10 PM IST,Need a boundary,4
2024-04-04 11:03:15 PM IST,Why so many fulltosses?,2
2024-04-04 11:03:16 PM IST,"Isn't this they guy PBKS bought by mistake?
Might be the best decision they took",4
2024-04-04 11:03:17 PM IST,Don’t get out please,3
2024-04-04 11:03:19 PM IST,"Jst play sensibly, match is yours",3
2024-04-04 11:03:19 PM IST,Youngsters are all in for this year,5
2024-04-04 11:03:19 PM IST,Punjab will bottle this,3
2024-04-04 11:03:20 PM IST,Stop praying in that ground. It clearly doesn’t work!!,5
2024-04-04 11:03:21 PM IST,Now watch a wicket fall only for Purple to come in and let us down with his batting,4
2024-04-04 11:03:24 PM IST,ashutosh impressive first showing ngl,6
2024-04-04 11:03:28 PM IST,I love seeing artificial death bowlers get smashed. Not a better joy in cricket,1
2024-04-04 11:03:28 PM IST,How come gt fielded so well yet so bad in same match,5
2024-04-04 11:03:28 PM IST,Is this the super over script?,5
2024-04-04 11:03:29 PM IST,Rest 3d spectator nxt Match bring saikishore ,2
2024-04-04 11:03:30 PM IST,Blind mofo that was 6th stump and appealing for lbw,3
2024-04-04 11:03:30 PM IST,This commentary putting me to SLEEEP man,2
2024-04-04 11:03:32 PM IST,"Dread it

Run from it

PBKS giving a MOTY contender always arrives",10
2024-04-04 11:03:33 PM IST,Jay Shah today ✍️🔥🔥🔥,3
2024-04-04 11:03:35 PM IST,6 now this game is over 🔥,1
2024-04-04 11:03:37 PM IST,I thought today was a random match and just played it in the background while i finish my packing for my early morning flight. Damn you punjab i am glued to the tv. Loving the youngsters.,5
2024-04-04 11:03:39 PM IST,Impact is impacting,3
2024-04-04 11:03:42 PM IST,A team that somehow finds a way to win vs a team that somehow finds a way to lose,3
2024-04-04 11:03:42 PM IST,Six rahhh,7
2024-04-04 11:03:42 PM IST,Bruh unknown NPC lower order batter hitting best death bowler of ipl wtf,6
2024-04-04 11:03:44 PM IST,Mohit can defend 12.,1
2024-04-04 11:03:44 PM IST,Super over?,3
2024-04-04 11:03:45 PM IST,"Had a really rough week , ik it's just a stick and ball sport but I'm so happy",8
2024-04-04 11:03:46 PM IST,Chad shashank,5
2024-04-04 11:03:46 PM IST,We ain't winning this with Umesh bowling the last over fam,6
2024-04-04 11:03:46 PM IST,I don't back Umesh for the final over.,5
2024-04-04 11:03:50 PM IST,Lmao,1
2024-04-04 11:03:50 PM IST,Less gooooo!!!!!,2
2024-04-04 11:03:51 PM IST,Thats the game,2
2024-04-04 11:03:51 PM IST,YESSSSSSSSSSSSSSSS COME ON PUNJAB,5
2024-04-04 11:03:52 PM IST,it’s going to the last over boysss let’s fucking goo,7
2024-04-04 11:03:53 PM IST,GT didn't learn anything from last year. Don't tell Mohit Sharma what to do!,13
2024-04-04 11:03:53 PM IST,Super Over,3
2024-04-04 11:03:55 PM IST,IF I DONT COMMENT AFTER LAST OVER CONSIDER ME DEAD OF HEART ATTACK,16
2024-04-04 11:03:56 PM IST,I honestly don’t care about the result. Punjab young guns fighting till the end is inspiring.,11
2024-04-04 11:03:56 PM IST,Holy F,2
2024-04-04 11:03:56 PM IST,Finally someone cunting Mohit like the gully bowler he is,4
2024-04-04 11:03:57 PM IST,Rips off GT's mask. It's Punjab inside!,12
2024-04-04 11:03:57 PM IST,Bruhhh,3
2024-04-04 11:03:58 PM IST,Game. Set. Match.,5
2024-04-04 11:03:58 PM IST,Umesh knows he fucked upm,9
2024-04-04 11:03:58 PM IST,Joever,6
2024-04-04 11:03:58 PM IST,Damnnnn,4
2024-04-04 11:03:59 PM IST,Okay who amongst these 2 will get the super striker of the match? Tough competition between these 2 with each ball passing ![img](emote|t5_2qhe0|30516),9
2024-04-04 11:03:59 PM IST,That one lil fan seems traumatised 😂😂😂,21
2024-04-04 11:04:04 PM IST,I don't back Umesh for the final over.,5
2024-04-04 11:04:04 PM IST,Bruhh Mohit Sharma taken to cleaners,8
2024-04-04 11:04:04 PM IST,His smile disarms the bowlers beforehand,6
2024-04-04 11:04:06 PM IST,Up yours GT!,0
2024-04-04 11:04:06 PM IST,Its over.,3
2024-04-04 11:04:08 PM IST,GG well played Punjab,3
2024-04-04 11:04:08 PM IST,these match threads have become so toxic. It's always about hating one team instead of appreciating the performance of the other team,13
2024-04-04 11:04:08 PM IST,Punjab dugout is so dead lmao,3
2024-04-04 11:04:09 PM IST,GT WHAT ARE YOU DOING,1
2024-04-04 11:04:10 PM IST,fkn shot!!,5
2024-04-04 11:04:10 PM IST,Shashank you beauty,7
2024-04-04 11:04:10 PM IST,Ahahaha,1
2024-04-04 11:04:11 PM IST,lesss gooo,2
2024-04-04 11:04:12 PM IST,Alexa play tutak tutak tootiya,5
2024-04-04 11:04:13 PM IST,Never seen mohit getting cunted so bad since his return.,6
2024-04-04 11:04:13 PM IST,God I LOVE this team,6
2024-04-04 11:04:14 PM IST,Cunted,2
2024-04-04 11:04:14 PM IST,WTF PUNJAB KINGS ARE CLUTCH?!,8
2024-04-04 11:04:14 PM IST,"Fuck bro..
What a game. Well chased PunJab",5
2024-04-04 11:04:15 PM IST,Punjab ~chokings~ plis not today,4
2024-04-04 11:04:15 PM IST,Shashank Redemption,17
2024-04-04 11:04:15 PM IST,"Enough of that nehra holding a coconut picafter every game, c'mon Punjab give them a proper belting",13
2024-04-04 11:04:15 PM IST,It's done and dusted now,1
2024-04-04 11:04:16 PM IST,Wow,2
2024-04-04 11:04:18 PM IST,Lmao this running spinner finally got figured out.,7
2024-04-04 11:04:19 PM IST,Can we bottle this,1
2024-04-04 11:04:19 PM IST,Goallllll,2
2024-04-04 11:04:19 PM IST,"Umesh , you have one job",2
2024-04-04 11:04:19 PM IST,Lesgoooo,3
2024-04-04 11:04:20 PM IST,Ice in his veins 🧊🥶,10
2024-04-04 11:04:22 PM IST,can't believe we have bottled this,4
2024-04-04 11:04:22 PM IST,"7 balls left, now 7 left to chase now.",4
2024-04-04 11:04:22 PM IST,If pbks bottles this they should dissolve their franchise.,7
2024-04-04 11:04:23 PM IST,Where they people asking for Mohit Sharma in the wc,8
2024-04-04 11:04:24 PM IST,"7 in last over with Umesh, easy win for PBKS",5
2024-04-04 11:04:25 PM IST,Gujarat loosens,3
2024-04-04 11:04:27 PM IST,"Was that ai art?
Wtf",1
2024-04-04 11:04:28 PM IST,Seeing all these new guys doing so well. My question is with dc scouts and mangement. Wtf were they doing,2
2024-04-04 11:04:29 PM IST,Glad I decided to stick around after the terrible powerplay,5
2024-04-04 11:04:29 PM IST,O balle balle,2
2024-04-04 11:04:29 PM IST,Punjab needs this win,3
2024-04-04 11:04:30 PM IST,"Mohit Sharma decoded, he's gonna challenge Purple Patel again.",2
2024-04-04 11:04:30 PM IST,"Whenever someone comes to advise Mohit,he bowls more bad balls.. history is proof",3
2024-04-04 11:04:31 PM IST,"How did we lose to PBKS. Fucking hell. Fuck this.

Who is this Shashank cunt.",1
2024-04-04 11:04:31 PM IST,"Yeah, you probably shouldn't bowl slower ones to these batters",1
2024-04-04 11:04:32 PM IST,SHASSHHHANKKK 🤫,2
2024-04-04 11:04:32 PM IST,"Umesh defending ,
☠️",3
2024-04-04 11:04:32 PM IST,Gill bro 🫡 your captaincy. Loving your calmness,3
2024-04-04 11:04:32 PM IST,Insane bottlejob,2
2024-04-04 11:04:32 PM IST,Shashank 'Clutch' Singh,3
2024-04-04 11:04:32 PM IST,Ideal time for PBKS to choke it like they usually do,1
2024-04-04 11:04:33 PM IST,PBKS breaking out of the RCB curse,3
2024-04-04 11:04:33 PM IST,"Punjab could be 1 for 3, they could be 5 for 6, they could be 19 for 20. 

Never forget how they can fuck it up",9
2024-04-04 11:04:34 PM IST,Yup Mohit Sharma ain't it for the world cup ,0
2024-04-04 11:04:34 PM IST,This is Shashank Singh's redemption 🔥,6
2024-04-04 11:04:34 PM IST,This IPL has already given us so much new Indian Talent. Love it,8
2024-04-04 11:04:35 PM IST,Mohit learning from Harshal bhai,5
2024-04-04 11:04:35 PM IST,Why am I so happy for Punjab lol,6
2024-04-04 11:04:35 PM IST,SHASHANK SINGH,3
2024-04-04 11:04:36 PM IST,It will be a super over.,1
2024-04-04 11:04:36 PM IST,I hate it and i love this team at the same time,6
2024-04-04 11:04:36 PM IST,Now watch them choke.,3
2024-04-04 11:04:37 PM IST,"Heart says Punjab, brain says GT, dick says superover",7
2024-04-04 11:04:37 PM IST,Idk why it feels so satisfying to see slower balls get absolutely smacked,3
2024-04-04 11:04:37 PM IST,Umesh can't defend this at his best.,3
2024-04-04 11:04:38 PM IST,2014 Punjab is back guys,3
2024-04-04 11:04:38 PM IST,lets go punjab boisss,2
2024-04-04 11:04:39 PM IST,That's a spectacular bottle job by GT,2
2024-04-04 11:04:39 PM IST,"This is the moment commentators can cash in and show some energy and shout but too many boomers here, some orientals too",4
2024-04-04 11:04:40 PM IST,Yeah this Mohit  guy surely deserves t20 world cup spot,5
2024-04-04 11:04:40 PM IST,Perfect chance for pbks to choke,2
2024-04-04 11:04:41 PM IST,Some mf called punjab matches booring,4
2024-04-04 11:04:41 PM IST,I won’t be able to sleep if we loose from here.,4
2024-04-04 11:04:42 PM IST,choking time.,1
2024-04-04 11:04:42 PM IST,Ashuthosh and Shashank. Putting the Indian in the Indian Premier League. GGs!!!,7
2024-04-04 11:04:44 PM IST,Yoooooooo,1
2024-04-04 11:04:44 PM IST,Shashank and Ashutosh doing the silencing job. Cumdawg will be proud.,4
2024-04-04 11:04:44 PM IST,"Script writer has betrayed jay shah, he would do anything to make preity happy",5
2024-04-04 11:04:46 PM IST,"Umesh finishing this in the first ball itself. 


(1 wide included)",4
2024-04-04 11:04:46 PM IST,This was not expected of you Punjab ! The holy Trinity were meant to be together.,12
2024-04-04 11:04:49 PM IST,super over you heard it here first,1
2024-04-04 11:04:49 PM IST,Man fuck this shit. Absolute ass from GT,0
2024-04-04 11:04:49 PM IST,GT could really use Hardik Pandya right now,2
2024-04-04 11:04:52 PM IST,One time I saw PBKS bottle a run a ball 15 with 7 wickets to spare. Anything can happen,3
2024-04-04 11:04:52 PM IST,Good to see a low tier team winning ipl gets boring when the same teams win over and over,5
2024-04-04 11:04:53 PM IST,This is Gill’s test now,2
2024-04-04 11:04:53 PM IST,That kid with the Gujarat Jersey rightly represents the emotions of GT fans,1
2024-04-04 11:04:54 PM IST,Watching this match since last 15 mins....where is Punjab and what have you done with the team? Who are these imposters?,5
2024-04-04 11:04:54 PM IST,Only pbks can bottle this now,4
2024-04-04 11:04:54 PM IST,Still no trust in this team 😭😭 this is what they have done to us,6
2024-04-04 11:04:54 PM IST,"want to say gg but its punjab, we nvr know lol",2
2024-04-04 11:04:55 PM IST,Nehra is Annoying,0
2024-04-04 11:04:55 PM IST,GT learning how to choke from the og chokers,5
2024-04-04 11:04:56 PM IST,Hope that 1 short run won't spoil Punjabs win!,3
2024-04-04 11:04:56 PM IST,Alexa play Jatt don’t care,3
2024-04-04 11:04:58 PM IST,There’s something satisfying about seeing someone’s literal prayers dashed. Especially when those prayers are being performed for something as dumb as a cricket match,3
2024-04-04 11:04:58 PM IST,"Mohit got what he deserved, law of averages , you always can't get away with slow pies",0
2024-04-04 11:04:59 PM IST,Now we'll see Punjab make this interesting,0
2024-04-04 11:04:59 PM IST,Umesh can win it for PBKS in just 2 balls,0
2024-04-04 11:04:59 PM IST,Shanshank is showing to Punjab management I deserve to play in IPL,6
2024-04-04 11:05:00 PM IST,Man I always hope Punjab wins purely for Dhawan. I miss prime Shikar ,7
2024-04-04 11:05:01 PM IST,Imagine Umesh defending this. Perfect redemption arc,7
2024-04-04 11:05:02 PM IST,Nalkande,2
2024-04-04 11:05:02 PM IST,HAHAHAHAHAHAHA,2
2024-04-04 11:05:03 PM IST,GujTits in shambles,4
2024-04-04 11:05:04 PM IST,Great batting !!,1
2024-04-04 11:05:05 PM IST,"Gill's captaincy has been outstanding today, but individuals let him down",5
2024-04-04 11:05:06 PM IST,Mohit allergic to bowling outside off?,3
2024-04-04 11:05:06 PM IST,"To think that Punjab didn’t even want to buy this dude at the auction. FYI for those who don’t know, Punjab bid on Shashank Singh, thinking he’s a different Shashank Singh and wrongfully bought him at the IPL Auction",6
2024-04-04 11:05:06 PM IST,"All the punjab fans should thank Dhawan for getting out early, it wouldn't have been possible without that.",4
2024-04-04 11:05:07 PM IST,Love seeing Mohit get hit.,1
2024-04-04 11:05:08 PM IST,Singh swinging like tennis racket with both hands,3
2024-04-04 11:05:11 PM IST,The real punjab fans know that now we're on the backfoot,1
2024-04-04 11:05:11 PM IST,How did GT bottle this?,5
2024-04-04 11:05:12 PM IST,umesh gonna cook,1
2024-04-04 11:05:12 PM IST,"> Some mf called punjab matches booring

My bad buddy, i'll watch all punjab matches now",5
2024-04-04 11:05:15 PM IST,"Umesh in Test Cricket and Domestic -🗿  
in IPL, T20i and ODI - 🤡",1
2024-04-04 11:05:15 PM IST,At least play Sai Kishore for Nalkande from now on,3
2024-04-04 11:05:16 PM IST,"Honestly we can still lose this, it's punjab after all but what an effort by these two lads",2
2024-04-04 11:05:17 PM IST,Ayo will Punjab outpunjab it,4
2024-04-04 11:05:18 PM IST,Shashank (accidental buy) and Ashutosh finishing a close game for Punjab chasing a 200 target 6 wickets down? Even the most delusional Punjab fan wouldn't have dreamed of this.,11
2024-04-04 11:05:20 PM IST,Aint no way they defend this now,2
2024-04-04 11:05:21 PM IST,Well...so Shashank will be retained by PBKS next year....😂,6
2024-04-04 11:05:25 PM IST,"CSK fans and along with them me, well I'll apologize right now for saying this isn't interesting, Idk about others. I'm sorry",2
2024-04-04 11:05:27 PM IST,Looks like GT needs paandu more than he needs GT,1
