Timestamp,Comment,Upvotes
2024-04-04 08:54:36 PM IST,Get going,4
2024-04-04 08:54:37 PM IST,I would love to see gill play till last ball,5
2024-04-04 08:54:38 PM IST,If only Gill got more strike throughout the innings...,4
2024-04-04 08:54:38 PM IST,What the actual fuk is that tennis shot lmao.,8
2024-04-04 08:54:40 PM IST,I came gill bhau,3
2024-04-04 08:54:43 PM IST,I missed the match fuck,2
2024-04-04 08:54:48 PM IST,"Tennis, eh?",4
2024-04-04 08:54:48 PM IST,Ahmedabad bully gill,-1
2024-04-04 08:54:50 PM IST,KG bowling pace on in the slot wtf,3
2024-04-04 08:54:51 PM IST,Wimbledon application shot,7
2024-04-04 08:54:53 PM IST,Rabada 🤝 Nokia,4
2024-04-04 08:54:53 PM IST,Backhand for 4,5
2024-04-04 08:54:54 PM IST,Gill singlehandedly carrying GT atm.,9
2024-04-04 08:54:58 PM IST,Gill is one of the most aesthetically pleasing batsman,6
2024-04-04 08:54:59 PM IST,double handed forehand,3
2024-04-04 08:54:59 PM IST,Gill is free to go all out now that Shankar the Anchor has arrived,5
2024-04-04 08:55:00 PM IST,Gill will do anything to keep 3D off strike..,8
2024-04-04 08:55:01 PM IST,Shubman Federer.,3
2024-04-04 08:55:02 PM IST,MF flat batted almost out of the park,4
2024-04-04 08:55:06 PM IST,"Lmfao absolute filth, ridiculing Rabada as though it’s Vijay Shankar bowling",3
2024-04-04 08:55:07 PM IST,I'm Cumming.,3
2024-04-04 08:55:11 PM IST,This is not good. This is Ra-**bad**-a,3
2024-04-04 08:55:12 PM IST,Unreal acceleration from Gill again,6
2024-04-04 08:55:12 PM IST,Gill: So this how Kohli bro feels.,9
2024-04-04 08:55:15 PM IST,Kg is such a bad death bowler ffs,3
2024-04-04 08:55:16 PM IST,"Ahh yes, Gill is the other player after Rohit that a bowler should be wary of when trying the short ball. Reminds me of the time Gill hit that shot to Kyle Jamieson in tests who was churning out leg side bouncers.",6
2024-04-04 08:55:16 PM IST,I can’t understand these bowling decisions,5
2024-04-04 08:55:20 PM IST,"Man, what's up with Sanskari cheerleaders from GT & RR",4
2024-04-04 08:55:20 PM IST,They finally used the world cup fireworks ,5
2024-04-04 08:55:22 PM IST,What confidence does to a mf,7
2024-04-04 08:55:22 PM IST,That was like a WTA double handed forehand,3
2024-04-04 08:55:23 PM IST,What a shot Gill. Audacious,4
2024-04-04 08:55:24 PM IST,3D player giving advice to Gill,2
2024-04-04 08:55:24 PM IST,Gill is one of the best players of short ball today…no I don’t remember wc final,10
2024-04-04 08:55:26 PM IST,Less go Prince. Need a 100.,3
2024-04-04 08:55:27 PM IST,Gill play like this every game. Let these guys go explosive and you anchor. Gill has impresssiveee acceleration,6
2024-04-04 08:55:27 PM IST,"Akash chopra with cringiest line 

“ Gill da mamla”",6
2024-04-04 08:55:28 PM IST,My man Shubman running the count to the century in his head,4
2024-04-04 08:55:28 PM IST,Why is the 3D player still getting selected into the teams in IPL?,5
2024-04-04 08:55:28 PM IST,"Bro Rabada

Stop bowling in the slot",5
2024-04-04 08:55:30 PM IST,Bruh these guys are booing shankar lmao,7
2024-04-04 08:55:32 PM IST,Gill is having rabada like rabdi,5
2024-04-04 08:55:32 PM IST,Yeah Gill.. just play like this in IPL… not in important matches for India.. downvotes upcoming,-1
2024-04-04 08:55:33 PM IST,Because of Rohit Gill has to sit out of the T20 WC,14
2024-04-04 08:55:35 PM IST,Shubman is MY favorite Gilly,11
2024-04-04 08:55:41 PM IST,Gill channelling his inner Djokovic,8
2024-04-04 08:55:43 PM IST,"People have been giving Riyan Parag shit for years, but in the same time, what has Vijay Shankar done that is even remotely relevant and justifiable for his place in any team?",3
2024-04-04 08:55:44 PM IST,If Shubman Gill can pull off a performance for India like this in a WC final or an important Test away hundred and win us a game it will give him the God like status,12
2024-04-04 08:55:46 PM IST,"ONCE AGAIN ITS IN THE AIR.....not-really-timed-as well.



Deep Dasgupta.",7
2024-04-04 08:55:47 PM IST,Gill ahmedabad average 🗿,7
2024-04-04 08:55:48 PM IST,"Gill is that type of player who performs 1 in 4 matches but when he performs, he looks so good.",9
2024-04-04 08:55:51 PM IST,advantage gt,4
2024-04-04 08:55:53 PM IST,Blessing in disguise,5
2024-04-04 08:55:53 PM IST,Three dots by V Shankar to close out the over..,3
2024-04-04 08:55:54 PM IST,Gill the first Centurion of IPL 2024 ?,5
2024-04-04 08:55:54 PM IST,That’s how you accelerate koach,10
2024-04-04 08:55:58 PM IST,Vijay ~~Shankar~~ Stinker,6
2024-04-04 08:56:01 PM IST,That was a slap to those who were talking shit about his approach while he was batting with a sr of 168,4
2024-04-04 08:56:03 PM IST,Wrong wicket,2
2024-04-04 08:56:03 PM IST,Blessing in disguise for GT,5
2024-04-04 08:56:03 PM IST,"LOL
3D is so cooked man",4
2024-04-04 08:56:03 PM IST,Finally Shankar with some impact on the game.,3
2024-04-04 08:56:06 PM IST,Wrong wicket,3
2024-04-04 08:56:06 PM IST,Nooo.. shouldn’t have caught that,4
2024-04-04 08:56:08 PM IST,Fuck yess. Finally we'll see Tewatia,5
2024-04-04 08:56:09 PM IST,"**17.4** No, Vijay tries to go for the boundary but flat bats it to long-off.

Vijay Shankar c Harpreet Brar b Rabada 8 (10b 0x4 0x6) SR: 80",1
2024-04-04 08:56:09 PM IST,let's go gt advantage,6
2024-04-04 08:56:11 PM IST,PBKS took the wrong wicket.,3
2024-04-04 08:56:12 PM IST,Wrong wicket buddy,0
2024-04-04 08:56:12 PM IST,lmfao shumban batting filthy good and Vijay Shankar is just filthy,6
2024-04-04 08:56:12 PM IST,Well done Brar,2
2024-04-04 08:56:13 PM IST,Gill is anal funking Rabada,4
2024-04-04 08:56:14 PM IST,YES!! Thank you Brar (you idiot),4
2024-04-04 08:56:15 PM IST,Shouldn't have caught that,3
2024-04-04 08:56:15 PM IST,Lol pbks,1
2024-04-04 08:56:17 PM IST,Man Tewatiya is kinda wasted in GT,3
2024-04-04 08:56:17 PM IST,wrong wicket,3
2024-04-04 08:56:17 PM IST,Lord Tewatia time.,2
2024-04-04 08:56:17 PM IST,Nice,1
2024-04-04 08:56:19 PM IST,3D player still stuck at the 2018 nidahas trophy final,3
2024-04-04 08:56:20 PM IST,That's a massive blow... for Punjab.,4
2024-04-04 08:56:20 PM IST,I can play better than Vijay Shankar,2
2024-04-04 08:56:21 PM IST,Tactical drop😓,1
2024-04-04 08:56:21 PM IST,Why that girl being sad for Shankar getting out ?,5
2024-04-04 08:56:21 PM IST,oh no *boss music starts*,4
2024-04-04 08:56:22 PM IST,"Tewatia vs black PBKS bowler?

I'm scared yo",7
2024-04-04 08:56:23 PM IST,There are a lot of famous clown shows in the world. But the greatest clown show of all is unquestionably >!PBKS death bowling!<.,1
2024-04-04 08:56:23 PM IST,Advantage GT,2
2024-04-04 08:56:23 PM IST,pk so stupid to take wicket of shankar,1
2024-04-04 08:56:23 PM IST,"3d cricketer accomplishes his mission of doing absolutely fuckall, but in 3d
 ",2
2024-04-04 08:56:24 PM IST,Lol! 3D Shankar. I think even his parents will disown him soon.,4
2024-04-04 08:56:24 PM IST,Bro Vijay Shankar is so awful man how does he get so many chances,5
2024-04-04 08:56:25 PM IST,Why did you catch bro,7
2024-04-04 08:56:25 PM IST,3D guy with yet another useless knock.,5
2024-04-04 08:56:27 PM IST,Its a loss for us tewatia is far more superior than vijay,3
2024-04-04 08:56:27 PM IST,Vijay Shankar is the consistent shit batsman,4
2024-04-04 08:56:28 PM IST,Even commentators are shitting on Shankar,9
2024-04-04 08:56:29 PM IST,We deserve this in t20 wc but we will get brohit insted,6
2024-04-04 08:56:30 PM IST,"3D tries to be aggressive once and he is out.

Advantage GT.",5
2024-04-04 08:56:30 PM IST,Punjab made a mistake getting shankar out !! It wilp cost them a lot,6
2024-04-04 08:56:31 PM IST,Also I think it's time GT moved away from Saha. He's been exceptional for them in the past but it looks like he's slipping back to his old ways.,2
2024-04-04 08:56:32 PM IST,is Tewatia playing,1
2024-04-04 08:56:34 PM IST,Even the commentator said the quiet part about 3D out loud 🤣,3
2024-04-04 08:56:35 PM IST,"""What's a tactical drop?""",4
2024-04-04 08:56:36 PM IST,"mf gone finally,now send in lord tewatia",5
2024-04-04 08:56:36 PM IST,Is punch ev any good,3
2024-04-04 08:56:38 PM IST,Shank-ar is the correct name,3
2024-04-04 08:56:38 PM IST,Cricketer ❌ tuk tuk academy content creator ✅,2
2024-04-04 08:56:39 PM IST,0d fielding by PBKS. Should have dropped it 🤦,5
2024-04-04 08:56:40 PM IST,Vijay Shankar is a “CRIMINAL“.,1
2024-04-04 08:56:40 PM IST,Ah shit disadvantage to PBKS. Rabada be like. Shouldn’t have caught that,1
2024-04-04 08:56:42 PM IST,Year and again I wonder how tf Vijay Shankar gets a slot in any team.,2
2024-04-04 08:56:43 PM IST,"abhinav manohar in for vijay next game, unless 3d man wants to bowl a couple overs. we need sloggers",2
2024-04-04 08:56:44 PM IST,Punjab is cursed even good bowlers become ordinary. Just get Rabada to CSK or MI and watch him demolish teams,2
2024-04-04 08:56:46 PM IST,Lol did he apologise for taking the catch?,1
2024-04-04 08:56:46 PM IST,Mf could have hit to get single at least,1
2024-04-04 08:56:47 PM IST,Why couldnt this mf play like this on Nov 19,3
2024-04-04 08:56:47 PM IST,"not a bad thing from GT perspective, should have kept shanker on strike",1
2024-04-04 08:56:47 PM IST,Can't believe this guy actually played a world cup for India.,5
2024-04-04 08:56:50 PM IST,"lmao Vijay ""3D"" Shankar everybody",2
2024-04-04 08:56:50 PM IST,Why don't they drop 3d for srk,1
2024-04-04 08:56:51 PM IST,"Brar should have left that catch, advantage Gujarat Titans now 😂",5
2024-04-04 08:56:51 PM IST,Lord Shankar intentionally played Tuk Tuk inning to keep match interesting,2
2024-04-04 08:56:52 PM IST,"""Took the catch? Shouldn't have Brar paji."" --- Punjab Kings fans",6
2024-04-04 08:56:53 PM IST,This guy is straight up Ass,3
2024-04-04 08:56:53 PM IST,"When Vijay Shankar plays at sub-100 strike, you guys line up to suck him off. But when my man Kohli scores an 86 off 59, you guys call him you f**ing donkey...I am going to make a meme on this on r/cricketshitpost

-- RCB fan",6
2024-04-04 08:56:58 PM IST,Shankar probably still thinks he's playing 2019 ODI WC,2
2024-04-04 08:57:00 PM IST,Gill in Ahmedabad is something else 🔥,3
2024-04-04 08:57:01 PM IST,Tewatia vs Punjab,2
2024-04-04 08:57:04 PM IST,Shankar? I hardly even know her,2
2024-04-04 08:57:05 PM IST,VShit Shankar,1
2024-04-04 08:57:05 PM IST,Next match Manohar or Shahrukh. No Shankar pls nehraji.,2
2024-04-04 08:57:06 PM IST,Shankar has no game.. It was evident before and it's evident today..,2
2024-04-04 08:57:06 PM IST,Chill lady 3d got out gill is there lol,2
2024-04-04 08:57:06 PM IST,"Why don't we see teams intentionally drop or ignore a catching opportunity depending on who is occupying the crease. Seems like a tactic worth employing, no?",6
2024-04-04 08:57:07 PM IST,Bruh even the commentators are saying advantage GT lmao,8
2024-04-04 08:57:10 PM IST,na man gill deserve the ton.,2
2024-04-04 08:57:11 PM IST,Tennis shot from gill,2
2024-04-04 08:57:15 PM IST,Worst player in the history of all players across all sports in all countries just got out,5
2024-04-04 08:57:16 PM IST,Vijay Shankar is an affliction every IPL team should suffer once,3
2024-04-04 08:57:19 PM IST,I think this is last innings of Vijay he will surely be replaced by SRK or Manohar,4
2024-04-04 08:57:21 PM IST,Well done Shankar. Now time for some tewatia fun.,4
2024-04-04 08:57:21 PM IST,God knows how this dude managed to play so many IPL games.,2
2024-04-04 08:57:24 PM IST,"If the commentators start saying that losing your wicket is better than keep batting, you know it's bad",2
2024-04-04 08:57:25 PM IST,Vijay Shankar has a bat swing like a kid,2
2024-04-04 08:57:29 PM IST,1st century of this IPL incoming?,3
2024-04-04 08:57:30 PM IST,Tuk Tuk Academy is impressed by Lord Shankar's contribution,3
2024-04-04 08:57:31 PM IST,"Vijay my man, this aint it chief",1
2024-04-04 08:57:31 PM IST,Whose nudes does Vijay Shankar have that he is getting his place in playing 11 every game,1
2024-04-04 08:57:31 PM IST,"Punjab basher is here. 





LORD TEWATIYA",4
2024-04-04 08:57:32 PM IST,"3D shankar got out cos he wants Tewatia to finish the job and find some form for rest of the season. 
What a team guy",2
2024-04-04 08:57:35 PM IST,Time to put 9 fielders on Leg side,5
2024-04-04 08:57:37 PM IST,PTSD of PBKS fans arrived. Tewatia.,4
2024-04-04 08:57:38 PM IST,"Question has there ever been a tactical drop in cricket?

Yes the crowd would never know but was there ever an obvious drop or a player admitting after the match?",5
2024-04-04 08:57:40 PM IST,3D wasted so many balls,3
2024-04-04 08:57:48 PM IST,Tewatia vs Punjab is beast.,3
2024-04-04 08:57:49 PM IST,3d player gone finally,2
2024-04-04 08:57:49 PM IST,Pls dont bowl ever bowl short ffs,3
2024-04-04 08:57:53 PM IST,"I know the comms are forced to say this but there is something so jarring about talking about how Gill is batting and then link it to a car ad.

If they have a soul I hope they don't genuinely enjoy going from talking about one of the great young talents in full flow playing the sport they love and then having to swivel to talk about some fucking car they'd never even have heard of if it weren't for their contract obligations.",4
2024-04-04 08:57:54 PM IST,The fact that Vijay 3D Shankar played in a WC will forever be a stain on Indian cricket when far far more deserving players were left out b4 and after.,6
2024-04-04 08:57:57 PM IST,I want Rayadu's opinion on Shankar... not on RCB to0 order...,6
2024-04-04 08:57:57 PM IST,gill should put gt jersey inside the india jersey in t20 wc. also wear a vr gear to view ahmedabad.,7
2024-04-04 08:57:59 PM IST,"Remember when they sent Vijay Shankar over DK who was in sublime form to win them the Nidahas trophy. 


Either he is prime Bradman during the nets or he has nudes of the entire cricketing fraternity. ",23
2024-04-04 08:58:03 PM IST,Gill with GT gives me CR7 with Portugal(2010-14) vibes.,7
2024-04-04 08:58:04 PM IST,Nice of PBKS to have fielders in their dugout,5
2024-04-04 08:58:13 PM IST,Tewatia vs Punjab the rivalry that always Tewatia wins,1
2024-04-04 08:58:15 PM IST,He ran weirdly?,1
2024-04-04 08:58:18 PM IST,Shankar+Saha+Williamson = 45(47).  That's nearly 8 overs at 5.75 RPO. Truly matchlosing.,10
2024-04-04 08:58:23 PM IST,Wait till Punjab buys Vijay Shankar for 6 crores next year and make him do exactly what he's been always doing; nothing.,6
2024-04-04 08:58:25 PM IST,Shankar is such a dud,3
2024-04-04 08:58:27 PM IST,Punjab kings match are soo boring regardless of opponents ...,5
2024-04-04 08:58:29 PM IST,"Shubman ko strike do 👏👏👏👏 Shubman ko strike do 👏👏👏👏Shubman ko strike do 👏👏👏👏

T- Give the strike to Shubman",2
2024-04-04 08:58:30 PM IST,"Hard to tell which camp will be happier by the dismissal, GT or PK? lol",5
2024-04-04 08:58:30 PM IST,"Imagine seniors due to fake ego are going to play another T20 wc to fail again instead of gill and rinku 


Gill might not make even 15


Rinku might have to sit on bench 


Whole multiple wc failures hog the centrestage 


No guarantee gill and other youngsters might help us win wc but it is better than losing with superstars ",10
2024-04-04 08:58:32 PM IST,"Commentators taking a piss out of shankar, wtf",6
2024-04-04 08:58:33 PM IST,That girl was looking pretty.,9
2024-04-04 08:58:36 PM IST,Tewatia is that rare two hit wonder.,8
2024-04-04 08:58:38 PM IST,Tewatia should have been sent before Shankar.,8
2024-04-04 08:58:39 PM IST,I guess 3D wants to move to MI,8
2024-04-04 08:58:52 PM IST,Now watch Lord  Tewatia become Gayle against Punjab,4
2024-04-04 08:58:53 PM IST,Okay century is doable now go for it gill,6
2024-04-04 08:59:03 PM IST,GT captain sounds like cheating captain,2
2024-04-04 08:59:08 PM IST,"Gill, Rinku, Jaiswal are locked in T20 WC, I guess.",0
2024-04-04 08:59:11 PM IST,"Vijay Shankar is such a non-sense player, fucking awful.",0
2024-04-04 08:59:12 PM IST,"True love between two people should be like gill nd Ahmedabad ground but not like koach and chinnaswamy stadium.

- Welcome to my Ted talk",7
2024-04-04 08:59:14 PM IST,Need Gill's 100 for that Take a bow celebration.,1
2024-04-04 08:59:15 PM IST,That PBKS baddie can ruin my life,3
2024-04-04 08:59:15 PM IST,Tewatia in his sleep >>> Vijay Shankar at his peak,6
2024-04-04 08:59:16 PM IST,Send Vijay Shankar to WPL so that even girls can have some opportunities to statpad on his batting and bowling,9
2024-04-04 08:59:21 PM IST,Gujju girls are really Sundar ![img](emote|t5_2qhe0|28120),2
2024-04-04 08:59:33 PM IST,2 punjab haters battling together Harshal to bowl what could go wrong?,3
2024-04-04 08:59:33 PM IST,Tewatia violence on black PBKS bowler successfully avoided,4
2024-04-04 08:59:37 PM IST,I am still firm on what I said earlier: https://www.reddit.com/r/Cricket/comments/1boedrr/post_match_thread_chennai_super_kings_vs_gujarat/kwoc2zo/,1
2024-04-04 08:59:40 PM IST,Guy never said anything about being a 3D player but look at the comments.... straight up hateful. ,3
2024-04-04 08:59:45 PM IST,Just woke up. Is the match worth watching?,3
2024-04-04 08:59:48 PM IST,Thank goodness Shankar only used up 10 balls and nothing more. Dude's a walking liability.,5
2024-04-04 08:59:49 PM IST,Lord Shankar 8(10) 😭🤲,6
2024-04-04 08:59:50 PM IST,Gill should open in the WC,3
2024-04-04 08:59:55 PM IST,Man Punjab have been really unlucky with the skiers falling safe today.,4
2024-04-04 08:59:55 PM IST,Time to play Manohar or SRK instead of Shankar.,5
2024-04-04 09:00:11 PM IST,PTSD,3
2024-04-04 09:00:12 PM IST,18 overs and Gill getting 40 odd balls is such a crime bro,11
2024-04-04 09:00:15 PM IST,Ohh my my here it comes..Lord Tewatia,2
2024-04-04 09:00:17 PM IST,Why does the management trust harshel so much,2
2024-04-04 09:00:17 PM IST,"Bro was bowling yorker the over before, but again full toss patel has taken over",1
2024-04-04 09:00:18 PM IST,PTSD for Punjab fans,5
2024-04-04 09:00:27 PM IST,"For such a big guy, Shankar has no power. Needs to move on from rasam and rice",3
2024-04-04 09:00:29 PM IST,20+ over incomin,1
2024-04-04 09:00:29 PM IST,Full toss patel is back guys,3
2024-04-04 09:00:35 PM IST,Gill has accelerated his innings post 10 overs,2
2024-04-04 09:00:35 PM IST,Another 100 loading for ~~Ahmedabad~~ Prince.,0
2024-04-04 09:00:36 PM IST,Pandu could have achieved many things,2
2024-04-04 09:00:37 PM IST,Bruhhhhh,1
2024-04-04 09:00:40 PM IST,ICEMAN,5
2024-04-04 09:00:42 PM IST,That's how you do it 3D,4
2024-04-04 09:00:43 PM IST,Yep here we go,4
2024-04-04 09:00:47 PM IST,Six!!!,1
2024-04-04 09:00:47 PM IST,"Lmao, shiting at its finest",2
2024-04-04 09:00:49 PM IST,"Tewatia: I see Punjab, I hit",5
2024-04-04 09:00:50 PM IST,Tewatia is the lord,3
2024-04-04 09:00:51 PM IST,Lol why tf are they showing this,4
2024-04-04 09:00:53 PM IST,Trademark Tewatia hit,3
2024-04-04 09:00:55 PM IST,Harshal in the death is my favourite dessert,5
2024-04-04 09:00:56 PM IST,Full-toss Patel.,3
2024-04-04 09:00:56 PM IST,Left hand batsman vs harshal 💀,3
2024-04-04 09:00:57 PM IST,"Man Pandu, you really had something on your hand leading this squad of underdog overachievers.",2
2024-04-04 09:00:58 PM IST,Tewatia doesn't know that runs can be scored in the offside as well.,2
2024-04-04 09:00:59 PM IST,Tewatia the Rainmaker.,3
2024-04-04 09:00:59 PM IST,"Broooooooo

Why Tewatia? Anybody but him bro

I really can't, my PTSD",3
2024-04-04 09:01:00 PM IST,thats the harshal i know,5
2024-04-04 09:01:01 PM IST,Left hander PTSD to purple,3
2024-04-04 09:01:01 PM IST,Did Deep just say Sharjah was the venue for a IPL 2022 game which was all hosted in Mumbai 🤦‍♂️,4
2024-04-04 09:01:02 PM IST,Match is already over pbks,4
2024-04-04 09:01:02 PM IST,lord punjab basher tewatia activated,8
2024-04-04 09:01:02 PM IST,Harshal is more like HarSHIT,6
2024-04-04 09:01:03 PM IST,Bye . Sheldon cottrell is back,3
2024-04-04 09:01:05 PM IST,TEWATIA TIME BITCHES,3
2024-04-04 09:01:06 PM IST,"Bruh they literally have Sharukh Khan. Shankar isn't used for his bowling anyways, time to bring him in or Manohar. Much needed muscle in the middle.",5
2024-04-04 09:01:07 PM IST,Vijay was playing for us,3
2024-04-04 09:01:09 PM IST,Why bowl harshal why not bowl curran.,5
2024-04-04 09:01:13 PM IST,"Shubman ki century khaya paap lagega Tewatiye

T- Don't block shubmans century",4
2024-04-04 09:01:14 PM IST,"Nehraji obsession with Vijay Shankar is hilarious 


He does not even bowl ",6
2024-04-04 09:01:15 PM IST,Told you already full toss Patel is back,3
2024-04-04 09:01:15 PM IST,C'mon Gill. Get out. We need Tewatia and Rashid masterclass.,3
2024-04-04 09:01:15 PM IST,"That's what a full toss deserves, last match he escaped after a over full of full tosses",7
2024-04-04 09:01:16 PM IST,How tf did he time it like that😭😭😭. Whatt??,7
2024-04-04 09:01:17 PM IST,Purple Patel 🔥,1
2024-04-04 09:01:18 PM IST,Odean is back.,3
2024-04-04 09:01:19 PM IST,"I am not even a supporter of PBKS but any mention of that 13(3) Tewatia game makes my blood boil. Odean Smith, you will pay for your crimes",8
2024-04-04 09:01:21 PM IST,Purple Patel is bored of Purple caps. So he is wearing purple pants.,3
2024-04-04 09:01:25 PM IST,Tewatia tonking pkbs bowlers. Better love story than twilight.,1
2024-04-04 09:01:26 PM IST,Tewatia for wc,1
2024-04-04 09:01:27 PM IST,"Can't blame Rahul. 

Harshal is technically West Indian",5
2024-04-04 09:01:27 PM IST,"How does Harshal have IPL teams convinced he is a death bowler, just like Chris Jordan 💀",6
2024-04-04 09:01:29 PM IST,Harshal is just Odean smith 2.0,9
2024-04-04 09:01:30 PM IST,This Tewatia guy should Punjab buy to win IPL,3
2024-04-04 09:01:31 PM IST,Beautiful shot. Pantesque,6
2024-04-04 09:01:31 PM IST,Tewatia has some serious issues with PBKS,9
2024-04-04 09:01:32 PM IST,"Tewatia, like Rinku, is the type of player who can win matches for India. Can't believe he's never gotten a chance, wonder if there was something behind the scenes after he got called up those few times",4
2024-04-04 09:01:36 PM IST,"It's a match made in heaven.

TEWATIA only has one shot, Purple only has one ball.",13
2024-04-04 09:01:40 PM IST,Tewatia hates Pbks.. Absolutely,6
2024-04-04 09:01:41 PM IST,Wtf is that ball,3
2024-04-04 09:01:42 PM IST,Dude it's a wide it nearly pitched on the grass,1
2024-04-04 09:01:48 PM IST,Fuckers review that,2
2024-04-04 09:01:49 PM IST,"Tewatia knows voodoo I guess, most of the times I see bowlers bowl a full toss to him.",3
2024-04-04 09:01:50 PM IST,Wide he move in too much,1
2024-04-04 09:01:52 PM IST,Purple patel at his best at death lmao,1
2024-04-04 09:01:55 PM IST,purple patel is back,1
2024-04-04 09:01:58 PM IST,GT has the worst fucking cheer leading squad in all history.,3
2024-04-04 09:01:58 PM IST,"Risk with yorkers is that if you get em wrong, you fly.",2
2024-04-04 09:02:05 PM IST,"From purple cap to Ashok dinda 

Unreal growth",1
2024-04-04 09:02:05 PM IST,scared ha ha,1
2024-04-04 09:02:05 PM IST,Isn't that a no ball?!!,6
2024-04-04 09:02:06 PM IST,Tewatia's love story with Punjab continues lol.,4
2024-04-04 09:02:07 PM IST,"Dhawan : bc se bowling bhi nhi hoti


T: cry cry",6
2024-04-04 09:02:08 PM IST,It’s a no ball,4
2024-04-04 09:02:09 PM IST,shitposting begins,1
2024-04-04 09:02:10 PM IST,Fuck off this shouldn't be a wide,5
2024-04-04 09:02:12 PM IST,Stupid team,1
2024-04-04 09:02:15 PM IST,That's definitely not a wide but I think that was a no ball?,6
2024-04-04 09:02:16 PM IST,Lord Harshal coming up with a 20 run over soon.,3
2024-04-04 09:02:20 PM IST,Stupid stupid team,2
2024-04-04 09:02:21 PM IST,Pretty sure that's a no ball,4
2024-04-04 09:02:23 PM IST,Tewatia is what legwan aspires to be,4
2024-04-04 09:02:26 PM IST,That was not wide,2
2024-04-04 09:02:31 PM IST,"maybe unpopular opinion but you still need guys like King Kohli, Steve Smith, Kane Williamson to anchor in T20. Today Gill is godly but if he were to fall surely there will be an imminent collapse so you need a calming figure like those players to make sure that you can anchor the ship",8
2024-04-04 09:02:35 PM IST,NO BAAALLLLLLLL. BRUH WHATTT??,1
2024-04-04 09:02:43 PM IST,That shouldn't be wide..,5
2024-04-04 09:02:47 PM IST,That looked like a no ball and this looks like a boundary,3
2024-04-04 09:02:49 PM IST,Only one fielder on leg side boundary?,2
2024-04-04 09:02:54 PM IST,Gill thinking of his century 😹,5
2024-04-04 09:02:54 PM IST,Just get it done i dont give a shit anymore,5
2024-04-04 09:03:04 PM IST,Tewatia thinks Harshal is from the West Indies.,5
2024-04-04 09:03:08 PM IST,Tewatiya never ever come to punjab 🤬 cuz of you did i will have to hide under my bed,6
2024-04-04 09:03:10 PM IST,"Bhai, 4D player Vijay Shankar ka role kya hai GT main? GT usually plays with 9 players on average, which encourages others on the team to go above and beyond and win it for them",5
2024-04-04 09:03:10 PM IST,How is that not a wide? Man had his foot on the blue line lol,4
2024-04-04 09:03:13 PM IST,"Punjab literally has the best bowling lineup on paper, how the hell are the struggling so much.",7
2024-04-04 09:03:14 PM IST,190 plz.dont let them reach 200,5
2024-04-04 09:03:21 PM IST,Gill has been a god in this ground for the last year except on Nov 19.,9
2024-04-04 09:03:25 PM IST,"Bro, just put the leg side fielders on the boundary, that's where he hits, he can't bat on the on side",3
2024-04-04 09:03:26 PM IST,Seems like no century for gill,4
2024-04-04 09:03:26 PM IST,"Punjab has a player specially against RCB (Brar), similarly GT has a player specially against Punjab (Tewatia)",3
2024-04-04 09:03:27 PM IST,Why Hindi commentary lacks so much in quality ,3
2024-04-04 09:03:27 PM IST,I swear Tewatia must be hyping himself uo before every match against this team,3
2024-04-04 09:03:28 PM IST,"Just joined in, Is this match happening in Ahmedabad?",2
