Timestamp,Comment,Upvotes
2024-04-04 09:58:28 PM IST,This Punjab batting line up is an achievement in itself. In bravery. /s,3
2024-04-04 09:58:30 PM IST,Even if they dont lose a wkt sam will make sure that we loose.will prolly make 25 of 23 balls.,1
2024-04-04 09:58:37 PM IST,afghanistan just casually creates one of the brightest talents in spin and leaves,12
2024-04-04 09:58:37 PM IST,These Viru + SunnyG ads are the worst of them lot,20
2024-04-04 09:59:19 PM IST,"The ground is quite big
Pbks should take early opportunities in scoring boundaries
Depth over might make things difficult",2
2024-04-04 09:59:28 PM IST,"Leggie bowls a good leg break. 

/r/cricket : is this the best ball of the season ? 

Calm down fuckers.",1
2024-04-04 09:59:35 PM IST,What a f all team PBKS is. Along with DC.,0
2024-04-04 09:59:36 PM IST,GT RR KKR looking ominous this season,2
2024-04-04 09:59:39 PM IST,Noor Ahmed looks like young Rick Astley.,3
2024-04-04 09:59:42 PM IST,This man can tonk...,2
2024-04-04 10:00:03 PM IST,Nita Ambani must be the idol of those women who want to marry a rich guy and be settled for life.,5
2024-04-04 10:00:19 PM IST,Why don't they send Raza instead of Sam Curran? Raza is good against spin,3
2024-04-04 10:00:19 PM IST,"Senile G really said ""he's not really a big turner of the ball"" to Rashid Khan.",1
2024-04-04 10:00:20 PM IST,Only way PBKS is winning this if Prabh can take down their spinners.,4
2024-04-04 10:00:30 PM IST,Honestly if they wanna send sam in the middle over. I'll rather send dhawan 1 down ffs.sam is just good for 160.,3
2024-04-04 10:00:31 PM IST,PbKs looks really weak on paper if this team is what they have to offer. Some good bowlers but I don't see where the runs come from.,1
2024-04-04 10:00:35 PM IST,"Sanjay Manjrekar , Sunil Gavaskar , Aakash Chopra are all big L commentators",6
2024-04-04 10:00:38 PM IST,India is not even in the top 5 in the best bowling strike rate💀,4
2024-04-04 10:00:52 PM IST,If i had 100 cr i would rather gamble everything and lose than to give to priety zinta to make a team,4
2024-04-04 10:01:02 PM IST,"Mini Afghanistan - GT

Mini England - PBKS

Mini NZ - CSK

Mini Australia - DC",10
2024-04-04 10:01:19 PM IST,"Prabhsimran Singh is the absolute nightmare of the armchair analyst. He defies conventional cricket logic. He makes confidence based decisions. He plays the game in a manner that the traditionalists on cricket forums detest. Listen, there's a segment of the cricket community out there that believes the game should be solely analyzed through statistics and analytics. ""Pushing up my glasses. Oh, he can't play elegant shots.  
Oh, he doesn't fit into the team because he's only a slog-sweeper (9 ."" YOU'RE GONNA GET BOWLED OUT! YOU'RE GONNA LOSE THE MATCH! IT'S A BAT AND BALL GAME! IT'S A TEST OF SKILL! IF YOU WANT THAT, IF YOU WANT THAT PLAY FANTASY CRICKET! IF YOU WANT THAT, WATCH BASEBALL! WATCH GOLF! WATCH A DIFFERENT SPORT! THIS IS CRICKET YOU MOTHERFUCKER!  
YOU GET BOWLED, YOU'RE OUT! YOU GET CAUGHT, YOU'RE OUT! YOU GET STUMPED, YOU LOSE THE WICKET, YOU LOSE THE MATCH! IT'S A CRICKET GAME!",8
2024-04-04 10:01:29 PM IST,Finch representing the association of Batriarchy in the comm box today,2
2024-04-04 10:01:45 PM IST,I don’t Sam tbh. Far too expensive and his batting is quite limited. Mostly bats at 120/130 SR which you could probably get from a domestic player,2
2024-04-04 10:01:53 PM IST,"Ngl, PBKS would've made a killer ODI team. Time to start 1 @ Jayshah",2
2024-04-04 10:01:57 PM IST,Tbh 8.24 economy last year is very high for Rashid,2
2024-04-04 10:02:00 PM IST,I could only imagine if klr or mayank had this squad under them how well we would have done,4
2024-04-04 10:02:16 PM IST,"Damn kanos, nice save",5
2024-04-04 10:02:22 PM IST,I love Kane.,2
2024-04-04 10:02:32 PM IST,I just saw Aakash Chopra's ad why is his head so wobbly,1
2024-04-04 10:02:33 PM IST,Kanos improved his SR,1
2024-04-04 10:02:36 PM IST,How tall is kane?,3
2024-04-04 10:02:40 PM IST,Kanos fast AF,7
2024-04-04 10:02:43 PM IST,"Cant wait for next game already. 
Just dismantle PBKS and DC man",9
2024-04-04 10:02:55 PM IST,[deleted],2
2024-04-04 10:03:20 PM IST,KOHINOOR 💙💙💙💙💙💙,4
2024-04-04 10:03:22 PM IST,Kohinoor my guyy,5
2024-04-04 10:03:28 PM IST,"Rashid's action reminds of Koach bowling, kind of like taking your shirt off.",3
2024-04-04 10:03:30 PM IST,"**When Noor bowl mirror showed Rashid**   
**When Rashid bowl mirror showed Noor**",5
2024-04-04 10:03:30 PM IST,Noor Ahmed is being rewarded for nothing,1
2024-04-04 10:03:30 PM IST,Noor HAS to be retained,8
2024-04-04 10:03:33 PM IST,No.2 for Kohinoor ,7
2024-04-04 10:03:36 PM IST,"Ja Prabhsimran, ja (T: go, Prabhsimran, go)",2
2024-04-04 10:03:40 PM IST,Noor is generational,3
2024-04-04 10:03:41 PM IST,I can't wait until IPL will have relegation.,3
2024-04-04 10:03:43 PM IST,Bruh Noor is completely outperforming Rashid in the last 2 matches.,8
2024-04-04 10:03:47 PM IST,Kane's glorious beard created magical sparks during that dive,8
2024-04-04 10:03:48 PM IST,PBKS mandatory collapse incoming.,7
2024-04-04 10:03:49 PM IST,"**7.2** **Flummoxed!**

Prabhsimran Singh c Sharma b Noor Ahmad 35 (24b 5x4 1x6) SR: 145.83",1
2024-04-04 10:03:56 PM IST,what a find noor is,3
2024-04-04 10:03:57 PM IST,BRUH WE CANNOT NOT RETAIN HIM. HES TOO GOOD. PLS GT RETAIN OUR KOHINOOR,9
2024-04-04 10:03:58 PM IST,Last time Punjab had a good team?,3
2024-04-04 10:04:02 PM IST,Le spin choke,4
2024-04-04 10:04:07 PM IST,This NOOR guy...🤌🏻🤌🏻,3
2024-04-04 10:04:07 PM IST,Someone please tell prabh he can calm down at times,2
2024-04-04 10:04:08 PM IST,Why does PBKS even play? Just declare loss during auction itself,4
2024-04-04 10:04:12 PM IST,On paper Punjab Kings is the most perfect team in IPL. No idea how they lose lot of these close games. ![gif](emote|free_emotes_pack|neutral_face),4
2024-04-04 10:04:16 PM IST,"This team template if dhawan gets out early 10 overs 100 runs all out

If dhawan plays till the end 175 in 20 overs


🤡🤡🤡",18
2024-04-04 10:04:16 PM IST,Now I feel how Indian boomers felt when Sachin got out.,8
2024-04-04 10:04:21 PM IST,"Prabhsimran just can't resist the urge to go after everything. That's why, other than that one fluke hundred, he never scores more than 30-odd",4
2024-04-04 10:04:26 PM IST,Need a good Jitesh innings,7
2024-04-04 10:04:41 PM IST,I just knew noor would run through us,9
2024-04-04 10:04:55 PM IST,Clown trinity all losing games in 3 consecutive days,7
2024-04-04 10:04:58 PM IST,"Livingston mug would've come out now,got out the second ball after hitting a six ,smiled and walked off by now without giving a flying fuck. I'll take a mid potential player who gives everything for the team than guys like Livingston who much less care about ipl let alone their franchise team.

Edit: Saying this in regards to the potential he possesses and what he produces most of games. Can hardly remember a handful of good innings throughout his time at Pbks and certainly not lived up to potential to say the least.",6
2024-04-04 10:05:14 PM IST,"GT is carbon copy of SRH 2016....Anchor-esque batting, 7.5-8.0 econ-esque bowling",17
2024-04-04 10:05:16 PM IST,Noor kea nazar lag gyea 🧿,4
2024-04-04 10:05:18 PM IST,Tomorrow is El Runnasico,8
2024-04-04 10:05:18 PM IST,"Jay Saha please write a banger for tomorrow

These scripts are not upto your mark, waiting for 200+ run chase

And add a century in your script please

-Your fan",11
2024-04-04 10:05:46 PM IST,GT gonna retain both noor and rashid?,7
2024-04-04 10:05:47 PM IST,I always trust on you rasa,5
2024-04-04 10:05:54 PM IST,I vow to NEVER buy a ceat tire or any affiliated product because of how much these timeouts piss me off,20
2024-04-04 10:06:00 PM IST,Stupidest rivalry week,1
2024-04-04 10:06:04 PM IST,It will be nightmare for star players in next auction. Pbks gonna come up with full purse and going to buy some good players mixed with usual shit ones and end up in the bottom half.,9
2024-04-04 10:06:05 PM IST,Pubkiss batting line-up 🤥,6
2024-04-04 10:06:23 PM IST,"Last time Punjab had a good team 
It was Gilly Shaun Marsh and David Hussey",3
2024-04-04 10:06:31 PM IST,How PBKS won over DC is beyond me.,3
2024-04-04 10:06:36 PM IST,"GT boys, y'all retaining Rashid or Noor if y'all can retain only one for whatever reasons. First remember, it is The Rashid Khan, he can bat too and this might just be a temporary slump in form. Also remember what happened with DC when they retained Nortje over Rashid.",5
2024-04-04 10:06:37 PM IST,"3 consecutive games away from home

What the fuck is the shite schedule?",4
2024-04-04 10:06:40 PM IST,good thing there's mega auction next year too many weak teams this time,2
2024-04-04 10:07:03 PM IST,PBKS should just retain Curran and go all out in the mega auction,3
2024-04-04 10:07:04 PM IST,Cmon Jay shah add some twist in the boring match.,2
2024-04-04 10:07:10 PM IST,200 sr,1
2024-04-04 10:07:30 PM IST,2 part time batsman anchoring innings while needing 200 ☺️✌️,5
2024-04-04 10:07:36 PM IST,All this competition and RCB losing their home games.,2
2024-04-04 10:07:37 PM IST,Fuck Sam Curran continental dickwad,0
2024-04-04 10:07:39 PM IST,Finally Raza,1
2024-04-04 10:07:41 PM IST,woh is punjabs impact player,2
2024-04-04 10:07:58 PM IST,"There should be a new rule. 6 players total can be retain. And only a maximum of 2 overseas can be retained. 

This way it allows teams to keep their core players and build a legacy around them. 

If a team chooses not to retain ANY player, this will be allowed. (Looking at RCB)",4
2024-04-04 10:08:10 PM IST,Prabhsimran will end up just like Nitish Rana. Intent but highly inconsistent,6
2024-04-04 10:08:17 PM IST,"GT has the best bowling line up, Rashid Khan and left handed Rashid Khan with 8 overs, and Mohit Sharma with 4 overs in death. Oppositions wait for Rahul Chahar to come to loot him. Very difficult to chase this target here with the kind of batting line up we have. We need Gayle, or Livi type players with brute power here.",2
2024-04-04 10:08:21 PM IST,"DC, RCB and PBKS always give the same performance every year. But RCB somehow manage to be entertaining in their matches.",5
2024-04-04 10:08:31 PM IST,Sam 4(6).,3
2024-04-04 10:08:44 PM IST,Only if PBKS could use Jay Shah as an impact player,4
2024-04-04 10:08:48 PM IST,Not a very convincing start from Peanut Butter and Kelly Sandwich,2
2024-04-04 10:08:50 PM IST,"PBKS has been extra bad this season. Atleast in earlier seasons, they used to come close ro winning or win 4-5 straight matches, then lose the same number. 

Under Dhawan, PBKS has gotten even worse that it's a joke now.",6
2024-04-04 10:08:53 PM IST,"Pbks should change their name to
Pbms  Punjab mids",2
2024-04-04 10:09:00 PM IST,"There should be a new rule. 0 players total can be retained each year.  

Yes I want MAXIMUM chaos yaar",6
2024-04-04 10:09:05 PM IST,GT playing with two Rashid Khans,4
2024-04-04 10:09:10 PM IST,There's no way this stadium is profitable right ?,3
2024-04-04 10:09:19 PM IST,Required Run Rate is 11 send harshal patel,6
2024-04-04 10:09:23 PM IST,Only 4 more overs of torture left,2
2024-04-04 10:09:42 PM IST,Sam why tf did they send sam for.even after having batting till 8 .they send sam in.,3
2024-04-04 10:09:54 PM IST,Bairstow is finished tbh.He is literally clueless since ashes 2023.,2
2024-04-04 10:10:00 PM IST,Raza and Sam Curran should build a partnership here or they collapse,3
2024-04-04 10:10:03 PM IST,"Alright lemme add another rule.

For every player you retain, you have to give up 2 others. 3 if overseas",2
2024-04-04 10:10:04 PM IST,Which team is sam playing for again,1
2024-04-04 10:10:07 PM IST,3d fielding,1
2024-04-04 10:10:09 PM IST,Two guys with Zimbabwe connection batting together,3
2024-04-04 10:10:16 PM IST,3D player,2
2024-04-04 10:10:16 PM IST,[deleted],6
2024-04-04 10:10:23 PM IST,"PBKS downfall started the day when they decided to drop Silver colour season by season, and when Miller left.",8
2024-04-04 10:10:29 PM IST,Petition for all the IPL players to have clean shaves,4
2024-04-04 10:10:48 PM IST,"Even in PBKS first match against Delhi I could tell their batting isn't stable enough to compensate for their mid bowling attack , 

Looks difficult for them if they lose again today",3
2024-04-04 10:10:54 PM IST,Finish this match already,4
2024-04-04 10:11:01 PM IST,Pbks dependent on two Zimbabwe guys.,2
2024-04-04 10:11:02 PM IST,Uthappa is the Murali Kartik of Insiders,2
2024-04-04 10:11:05 PM IST,fucking moron murali,2
2024-04-04 10:11:07 PM IST,[deleted],1
2024-04-04 10:11:10 PM IST,"Gill kinna sonna aa

T:Gill is handsome",6
2024-04-04 10:11:31 PM IST,FUCK YESSS,4
2024-04-04 10:11:35 PM IST,Bro Curran… pace toh khel le bhai,3
2024-04-04 10:11:35 PM IST,Murli idiot chasing is easier if bowlers help keep the target low,4
2024-04-04 10:11:36 PM IST,60 run victory for GT loading.,4
2024-04-04 10:11:39 PM IST,"**8.4** **Catching practice!**

Sam Curran c Williamson b Azmatullah Omarzai 5 (8b 0x4 0x6) SR: 62.5",1
2024-04-04 10:11:40 PM IST,Bairstow Curran Raza… Horrible overseas trio,3
2024-04-04 10:11:44 PM IST,Punjab tailend starts,1
2024-04-04 10:11:47 PM IST,Kanos my man,2
2024-04-04 10:11:52 PM IST,Thanks sam .we were only playing with 10 players,2
2024-04-04 10:11:54 PM IST,What happened to Bhanuka?,1
2024-04-04 10:11:57 PM IST,Mandatory gift for Omarzai,3
2024-04-04 10:11:58 PM IST,Afghan Titans on fire. 🔥,3
2024-04-04 10:12:00 PM IST,Go and prepare for exams boi.,2
2024-04-04 10:12:04 PM IST,Nehraji goad,1
2024-04-04 10:12:07 PM IST,A nice free flowing shot straight into the hands of a fielder.,1
2024-04-04 10:12:07 PM IST,Kane Williamson’s catching technique is impeccable,2
2024-04-04 10:12:07 PM IST,oh man if kane increases his sr this team is gonna be dangerous,6
2024-04-04 10:12:08 PM IST,collapse coming,2
2024-04-04 10:12:08 PM IST,My kingdom for a competitive ipl game,1
2024-04-04 10:12:12 PM IST,Get Kane in for fielding only lmao,3
2024-04-04 10:12:12 PM IST,Lmao,1
2024-04-04 10:12:13 PM IST,Ahmedabad is our fortress,10
2024-04-04 10:12:16 PM IST,[deleted],4
2024-04-04 10:12:17 PM IST,good night guys i am just gonna cry myself to sleep,3
2024-04-04 10:12:19 PM IST,Pbks in freefall,2
2024-04-04 10:12:19 PM IST,"The way CSK is called Christchurch Super Kings

GT should be called Gandhara Titans",6
2024-04-04 10:12:20 PM IST,Dc vs pbks vs RCB for wooden spoon,3
2024-04-04 10:12:23 PM IST,"Kane’s a pure asset that keeps giving returns one or the other way. Bro can bat, he’s a gun fielder and a great tactician and leader. Truly one of a kind.",12
2024-04-04 10:12:24 PM IST,Looks like Sam Curran forgot how to bat,1
2024-04-04 10:12:28 PM IST,With all the money in IPL auction idk where PBKS use it,1
2024-04-04 10:12:34 PM IST,Dhawan and Curran sinking my fantasy team.,1
2024-04-04 10:12:35 PM IST,So holy trinity will be at the bottom with a surprise visit from MI.,6
2024-04-04 10:12:36 PM IST,Kane you beauty 🤌,3
2024-04-04 10:12:39 PM IST,"Zimbabwe Cricket Best XI:  
  
Eddie Byrom  
Brad Evans  
Gary Ballance  
Nick Welch  
Colin de Grandhomme  
Cartwright  
Jayden Schaendorf  
Sam Curran  
Malcolm Lake  
Ben Curran  
Tom Curran  

Impact Sub: Sikander Raza, Blessing, REGIS CHAKABVA",3
2024-04-04 10:12:48 PM IST,Must win with big margin to get back the NRR from CSK loss,1
2024-04-04 10:12:49 PM IST,Kill me kill me fuck this team fuck Bayliss fuck bangar,3
2024-04-04 10:12:50 PM IST,"PBKS doing a fellow Punjabi, Gill, a solid.",1
2024-04-04 10:12:53 PM IST,That one is bad luck tbh,1
2024-04-04 10:12:53 PM IST,Sorry but Raza over Livingston doesn't make much sense,1
2024-04-04 10:12:55 PM IST,Can anyone tell how to play that ball without getting out? Genuinely curious,1
2024-04-04 10:12:57 PM IST,Sanjay Banger changing from RCB to PBKS is like escaping from Batman then getting caught by Punisher.,3
2024-04-04 10:12:58 PM IST,"Looks like again a home victory is incoming, too many of them...",2
2024-04-04 10:12:59 PM IST,Honestly i am just excited to see ashutosh bat lol.wanna see how he bats.,2
2024-04-04 10:13:01 PM IST,"Jitesh, Rabada, sam, Livi, Raza moves from here and have a better career in other teams where there is no management pressure. 

I really started feeling bad for these talents now.",0
2024-04-04 10:13:02 PM IST,Another nothing Curran knock. Cant afford for him to be a passenger.,2
2024-04-04 10:13:03 PM IST,"Absolute useless players kxip has every season. Delhi, Panjab should have been replaced with Gujrat and Lucknow before they had got 2 new teams",2
2024-04-04 10:13:04 PM IST,Dhawan is literally the new kl of pbks if they get out Punjab collapses,7
2024-04-04 10:13:06 PM IST,My 7th sense telling jitesh winning the match for match,1
2024-04-04 10:13:06 PM IST,pbks ain't a real team man,4
2024-04-04 10:13:10 PM IST,"Yank here, why was PBKS named after the Chinese premier Xi Jinping before 2020? Are they an enemy of the state? Did they start Covid?",8
2024-04-04 10:13:22 PM IST,I can sympathize with Dhawan anchoring  for Punjab considering the rest of the batting is shit,8
2024-04-04 10:13:26 PM IST,Graveyard of franchises,5
2024-04-04 10:13:28 PM IST,Shashank Singh 103*(45) coming,3
2024-04-04 10:13:31 PM IST,Now we are slowly entering into that phase of IPL where we even can't remember which teams played the day before yesterday.,3
2024-04-04 10:13:33 PM IST,Punjab's batting just ain't it bruh,2
2024-04-04 10:13:34 PM IST,[deleted],5
2024-04-04 10:13:35 PM IST,"PBKS 🤝🏻 MI 🤝🏻 RCB 🤝🏻 DC: hum saath saath hain

T: we're always gonna be together.",7
2024-04-04 10:13:41 PM IST,Punjab's middle order is made of tissue paper,6
2024-04-04 10:13:45 PM IST,This really feels like a Kabul Titans team.,7
2024-04-04 10:13:50 PM IST,DA ONE  gonna be with his brother Brohit at the bottom of the table after this match.,3
2024-04-04 10:13:53 PM IST,There's nehra who is constantly speaking and doing things to make team win and there's Dhawan I think he do not even give a fuck about winning or losing wtf is wrong no intent whatsoever,4
2024-04-04 10:13:56 PM IST,"If you were to club all the leagues around the world together, PBKS would still be in the bottom 4 of table.",3
2024-04-04 10:13:58 PM IST,"On Saturday it’ll be ~~Royal~~ lowest total derby, 58 vs 49",3
2024-04-04 10:14:04 PM IST,"This Shashank guy was with us a few seasons ago, and hit something like 3 sixes in 20th over.",1
2024-04-04 10:14:07 PM IST,Is it the tears in my eyes that makes Shashank's stance looks like 2014 maxi,4
2024-04-04 10:14:11 PM IST,[deleted],1
2024-04-04 10:14:13 PM IST,This stadium is huge but not beautiful in any sense,5
2024-04-04 10:14:20 PM IST,Dhawan has been captaining so long and Gill still has way better field placements than him,7
2024-04-04 10:14:26 PM IST,shit>>>rcb>>>>DC>>>>pbks,0
2024-04-04 10:14:26 PM IST,Where are all the people who were saying its advantage for pbks after da 1 wicket. Lol no they play like clowns lmao .,4
2024-04-04 10:14:44 PM IST,Yeah the field placement by someone so inexperienced has been better than Dhawan who has so much experience,5
2024-04-04 10:14:44 PM IST,"Rishab Pant was right when he said 
Ye Punjab kab jeeta?",2
2024-04-04 10:14:45 PM IST,Has Preeti came for today's match. That's enough for the SIX PBKS fans.,3
2024-04-04 10:14:50 PM IST,PBKS to finish third from last again 🦀,0
2024-04-04 10:14:54 PM IST,Does raza have only 1 shot,3
2024-04-04 10:15:01 PM IST,This will go down as the most boring match in IPL history unless Shashank gets a 100(29),3
2024-04-04 10:15:04 PM IST,There is absolutely no doubt which team Afghanistan is supporting this IPL !,8
2024-04-04 10:15:28 PM IST,Step out and cunt this mofo,2
2024-04-04 10:15:29 PM IST,"Rishabh/Dream 11 TVC called their fate before the season: ""Punjab kab jeeta?""",2
2024-04-04 10:15:30 PM IST,At least our bowling is not boring,1
2024-04-04 10:15:33 PM IST,What's on his helmet? Dragon fly?,4
2024-04-04 10:15:38 PM IST,Shashank attracting dragonflies to his head,3
2024-04-04 10:15:43 PM IST,Rcb DC have been bad ipl teams. Pbks are just straight up shit,4
2024-04-04 10:15:49 PM IST,pbks is beyond redemption,6
2024-04-04 10:15:54 PM IST,Murali kartik with yet another useless analysis that nobody needs.,5
2024-04-04 10:16:05 PM IST,The bottom 3 gonna look like a 2019 WC Top 3 reunion..,1
2024-04-04 10:16:21 PM IST,"Raza batting practice session:sweep ,sweep(but like scope but still sweep),fine sweep",1
2024-04-04 10:16:23 PM IST,Lol with Dhawan they could've got till 170. But you don't want him so you deserve this.,6
2024-04-04 10:16:26 PM IST,They've gotta start launching now or it will be too late,3
2024-04-04 10:16:31 PM IST,How bad is Bhatia? Season's already over in my books why not try him?,2
2024-04-04 10:16:34 PM IST,In theory GT should have best players of legspin since you’re facing Rashid and Noor daily in nets,2
2024-04-04 10:16:37 PM IST,"Not only teams like dc, pbks are playing bad also their managements are shitty too.

All teams have the same amount of money, how come you guys are unable to make a good enough team that at least can compete.",1
2024-04-04 10:16:39 PM IST,Whoa.... They are already four down..,1
2024-04-04 10:16:39 PM IST,We lost to this Punjab team smh,1
2024-04-04 10:16:45 PM IST,This team without Dhawan's anchoring can't reach 140,7
2024-04-04 10:16:46 PM IST,Review waste,2
2024-04-04 10:16:49 PM IST,Even if you merged Punjab and RCB I don't think you could get an IPL winning team,6
2024-04-04 10:16:51 PM IST,Imagine having to watch these two teams after coming back home tired from a hectic day at work.,3
2024-04-04 10:17:08 PM IST,Nehra for ICT,4
2024-04-04 10:17:08 PM IST,Raza knows only one shot: sweep,3
2024-04-04 10:17:08 PM IST,"Every time PBKS do something stupid, the stadium DJ should play 'Udta Punjab' (T: Punjab flying *high*)",1
2024-04-04 10:17:15 PM IST,Why you need ultra edge for that,1
2024-04-04 10:17:16 PM IST,umpires call or missing off. maybe even impact outside off,1
2024-04-04 10:17:19 PM IST,"Did anyone see a helicopter on Shashank's helmet, lol, he is gonna fly from here",2
2024-04-04 10:17:20 PM IST,That Mohit catch reminds me of the Arshdeep drop vs Pak,0
2024-04-04 10:17:21 PM IST,Rcb pbks dc already out of contention imo,3
2024-04-04 10:17:22 PM IST,"Gill. Mate. You need to work on your ""T"".",1
2024-04-04 10:17:23 PM IST,"Menon almost thought of giving it out and realizing it's not Kohli , so he didn't",0
2024-04-04 10:17:25 PM IST,People more worried abt the dragonfly then punzabkinz,1
2024-04-04 10:17:28 PM IST,Why is there a fan on his helmet? /s,1
2024-04-04 10:17:33 PM IST,"Shashank only seems to get picked up by the worst IPL teams, gets sent out in terrible situations and occasionally plays one or two interesting knocks. Nobody actually knows how good he is",1
2024-04-04 10:17:58 PM IST,Can someone please explain to me why the fuck we don’t have a single batsman in substitutes to use as an impact player?,2
2024-04-04 10:17:59 PM IST,It was frustrating to watch DC yesterday and today it's as frustrating to watch PBKS. Gotta feel for the fans.,3
2024-04-04 10:18:08 PM IST,noor you shouldn’t be allowed to look like that when you are already so talented. not fair.,5
2024-04-04 10:18:10 PM IST,Considering the number of Afghani players GT has their anthem needs to be Afghan Jalebi.,4
2024-04-04 10:18:15 PM IST,RCB should learn from GT; a good bowling line up can get you much further in the tournament! Even if the batting is on weaker side!,3
2024-04-04 10:18:16 PM IST,Sanjay Bangar in coaching staff doesn’t sound right,3
2024-04-04 10:18:25 PM IST,PBKS is literally a lays packet. Looks full and promising and then you open the packet and there's not even 1/4th of a potato in there.,2
2024-04-04 10:18:25 PM IST,"English commentary: talking about the match, bowling actions etc

Hindi commentary: cringe meme callbacks and forcefully rhyming every single line while shouting like a horse",5
2024-04-04 10:18:28 PM IST,Even with its delicate wings the dragonfly can probably bat better than half of PBKS' batting lineup,3
2024-04-04 10:18:35 PM IST," Does it really matter who wins? I mean, in the grand scheme of things, it's as significant as deciding which flavor of ice cream to have in a melting universe. Let's face it, folks. Whether PBKS or GT emerges victorious, it's all just a blip in the cosmic timeline. One day, the sun will swallow us whole, rendering our wins and losses as inconsequential as yesterday's gossip. So, by all means, cheer for your team, revel in the drama, but let's not pretend it's anything more than a distraction from the impending heat death of the universe. After all, in the end, we're all just stardust waiting to scatter.",5
2024-04-04 10:18:38 PM IST,We need a camera view of the camera man videoing the tv umpires just to be extra sure.,4
2024-04-04 10:18:38 PM IST,Lmfao gill,3
2024-04-04 10:18:39 PM IST,Damn so close,4
2024-04-04 10:18:43 PM IST,Fair play Gill. Didnt expect it to miss the off stump by that much,2
2024-04-04 10:18:44 PM IST,Blud thought he's him 😭🙏,0
2024-04-04 10:18:48 PM IST,My reaction was also the same....,3
2024-04-04 10:18:53 PM IST,LMAO gill,2
2024-04-04 10:18:59 PM IST,"Ig we all know that Rashid isn’t 25 

How old do u think he is? My guess is 30ish something",7
2024-04-04 10:19:00 PM IST,"The ball was always turning away, poor review there.  Noor knew which delivery he had bowled.",2
2024-04-04 10:19:09 PM IST,"The decision to take that review, cost them that review.

- Murali Karthik",56
2024-04-04 10:19:15 PM IST,PBKS/KXIP has been the answer to the question- Which is the most consistently mediocre team in the IPL,4
2024-04-04 10:19:19 PM IST,Lmao that reaction😭😭😂😂😂😂😂😂😂😂,2
2024-04-04 10:19:22 PM IST,Punjab may not even make it to their coveted 6th place.,3
