Timestamp,Comment,Upvotes
2024-04-04 06:34:01 PM IST,Today Gill scores a match winning knock?,2
2024-04-04 06:41:24 PM IST,Today i feel Punjabi,1
2024-04-04 06:44:23 PM IST,How do we feel today!!!!!,1
2024-04-04 06:45:17 PM IST,So no one has scored a century yet this season?,3
2024-04-04 06:45:43 PM IST,Odean Smith gone missing after Tewatia's 2 sixes,29
2024-04-04 06:53:33 PM IST,Silence in this thread very indicative of the level of anticipation (or lack thereof) for this match,6
2024-04-04 06:57:04 PM IST,Welcome to annual Tewatia match saving knock match,69
2024-04-04 06:59:32 PM IST,It's going to be a boring match script again guys. Honestly we need a bit of the drama cup in this ipl.,5
2024-04-04 07:01:58 PM IST,So we can't see Tewatia clutching it now,2
2024-04-04 07:02:25 PM IST,"Take my upvote and rise up,Finally a no match day in ipl,punjabi titans hope they win",1
2024-04-04 07:02:59 PM IST,Sikandar to conquer Ahmedabad today.,3
2024-04-04 07:03:16 PM IST,Kane mama in,10
2024-04-04 07:03:21 PM IST,KANEEEEE finally,16
2024-04-04 07:03:26 PM IST,Kane playing today!,4
2024-04-04 07:03:34 PM IST,Williamson in ⛽,5
2024-04-04 07:03:36 PM IST,"Oh no

Kanos is playing 

Everybody gets to form against us

Miller missing out means Tewatia bats a bit early, we are fucked",5
2024-04-04 07:03:52 PM IST,Damn. Kane mama’s back after 2 years,36
2024-04-04 07:04:33 PM IST,Kanos mama for the win,4
2024-04-04 07:04:34 PM IST,Parthiv Patel somehow seems to be a sweet guy to hang out with.,3
2024-04-04 07:04:36 PM IST,I don't even mind if Jay Shah reuses an old PBKS script where they lose needing 5 off 7 or something. Just need this one to go deep,6
2024-04-04 07:05:16 PM IST,I wish Pakistan players were allowed to play in the IPL. It feels a bit lacking in star names nowadays,2
2024-04-04 07:05:40 PM IST,"The only thing I want from Da1

Please don't bring Chahar against a set batsman after the 14th over

Brar should bowl 3 minimum overs

Harshal should bowl 3 overs between the end of PP and the beginning of death, Curran and Arsh in death",3
2024-04-04 07:06:15 PM IST,"GT is @ 5 at 4 points

PBKS is @ 7 at 2 points

Imagine if PBKS wins today, it's like destiny always reserves a place at no 6 for Punjab",3
2024-04-04 07:06:27 PM IST,"Virgin normal Indian players: go for 11 an over and get dropped

Chad Hairshal Patel: goes for 11 an over and stays in the team",6
2024-04-04 07:06:53 PM IST,This rivalry week meme is a bit extra lol,3
2024-04-04 07:07:34 PM IST,"Lord tewatia vs Punjab again since Miller is missing, good luck Punjab bros",6
2024-04-04 07:08:10 PM IST,"Not a fun fact

This is Kanos second match at Narendra Modi Stadium. Last time he played he didn't got to bat or bowl and got his ACL broken",11
2024-04-04 07:08:29 PM IST,"Just read the script ,congrats gill for reaching 3 figures",4
2024-04-04 07:08:31 PM IST,"Man Punjab and GT basically have no chemistry or rivalry, what can we even joke about in this thread, it's that game where everyone goes, eh",5
2024-04-04 07:08:49 PM IST,"sad livi is injured, estatic raza finally gets a chance",7
2024-04-04 07:09:11 PM IST,Dhawan forgot that Chahar is dropped.,6
2024-04-04 07:09:12 PM IST,"Punjab is bowling first, why don’t they have Chahar in instead of Prabhsimran? They messed up?",7
2024-04-04 07:09:56 PM IST,What has chef J Shah cooked for us tonight ?,4
2024-04-04 07:10:14 PM IST,No Miller so brar has to be used to his full potential,7
2024-04-04 07:11:21 PM IST,"Why not have Mohit in the first XI, just in case GT need an extra batter! Since they have to bring in Mohit in the second innings, even if they have a batting collapse, they just got to go with it.",3
2024-04-04 07:11:44 PM IST,"A fun fact 

Out of the 22 players named in playing XI of both teams only two has won Orange Cap in IPL, Shubhman Gill and Kane Williamson both in GT",6
2024-04-04 07:12:03 PM IST,"I won't even be pissed if GT wins

I just don't want any part of the win coming from Tewatia man

That shit just triggers my PTSD and depression, it'll end up ruining my mood for the entire weekend",5
2024-04-04 07:12:09 PM IST,"Without Miller, that GT batting lineup looks like a bunch of anchors put together. But it's probably fine since they're only playing Punjab",4
2024-04-04 07:12:57 PM IST,"People are doubting GT without Miller

Bro, they are facing PBKS with Tewatia in the lineup",9
2024-04-04 07:12:57 PM IST,don't understand the point of playing Vijay Shankar when he doesn't even bowl in any match,0
2024-04-04 07:13:25 PM IST,Just saw Punjab's impact subs. Looks like their team if they were batting first. 4 bowlers in the impact sub list. ,3
2024-04-04 07:13:55 PM IST,"Still no Karthik Tyagi even in the impact subs list, what an absolute shame",7
2024-04-04 07:14:06 PM IST,[removed],1
2024-04-04 07:14:11 PM IST,Hopefully soon PBKS plays Kavrappe in place of Harshal,6
2024-04-04 07:14:48 PM IST,"they should remove the punjab side from the ipl. auraless team, nobody will miss them",3
2024-04-04 07:15:07 PM IST,"Why won't Punjab just play Nathan Ellis, Last season was such a good season for him",3
2024-04-04 07:15:34 PM IST,"That can't be Rabada.

That's definitely a robot impersonating him.",2
2024-04-04 07:15:49 PM IST,No miller :(. Hope he gets well soon. Happy for Williamson though,2
2024-04-04 07:15:57 PM IST,"Confused seeing the impact subs for PBKS. 4/5 are bowlers.

Have they shown the wrong team.",4
2024-04-04 07:16:11 PM IST,"Another stat

Kane Williamson becomes the 4th player from New Zealand to feature in IPL 2024 after Rachin, Dazz, Boult",2
2024-04-04 07:16:28 PM IST,Why is the PBKS training kit absolute fire but the actual kits are mid?,7
2024-04-04 07:16:56 PM IST,Ashutosh Sharma gonna debut today?,1
2024-04-04 07:17:20 PM IST,they got kane in,4
2024-04-04 07:17:43 PM IST,I want us to use Williamson opening or one down. He isn’t a David miller to be coming in at 5 or 6 and start smashing sixes ball one.,12
2024-04-04 07:18:05 PM IST,KANE,3
2024-04-04 07:18:50 PM IST,Remove Punjab and bring a Haryana team and watch the fan base,1
2024-04-04 07:19:07 PM IST,"Don't understand why they brought in Williamson for Miller. Wade would've been a more logical replacement- GT have far too many anchors now.

Alternatively they could've brought in Williamson for Miller and maybe dropped Sudarsan for Shahrukh Khan or Abhinav Manohar.

GT have a good set up though and are quite smart so theyll probably go okay but fuck me that batting lineup is putrid on paper.",5
2024-04-04 07:19:40 PM IST,"If Kane is playing, then Manohar should have come in place of Sai Sudarsan.....And why the fuck is 3D still in squad....",5
2024-04-04 07:20:02 PM IST,Is this the least exciting match so far this IPL,0
2024-04-04 07:21:21 PM IST,"Damn, that top five of Gujrat Titans would work well for an ODI eleven. Or even a four day match. But for a T20, their top order really seems to lack firepower. Just anchors and average T20 players all the way. I hope they prove me wrong and blast 200+.",2
2024-04-04 07:21:34 PM IST,"hello everyone,    

ready for match 17 of the IPL??????",3
2024-04-04 07:21:45 PM IST,Miller out?,2
2024-04-04 07:21:47 PM IST,"Tewatia: Cottrell

Tewatia: Odean

Tewatia: Rabada???

Better not be the case tonight",3
2024-04-04 07:22:12 PM IST,GT is now proper test squad.. all Tuk tuk merchants,1
2024-04-04 07:22:19 PM IST,Chahar finally out as impact sub,2
2024-04-04 07:22:35 PM IST,Feeling super proud Indian army ,2
2024-04-04 07:22:36 PM IST,Kane Williamson is playing,2
2024-04-04 07:23:17 PM IST,Kanos is playing,2
2024-04-04 07:23:30 PM IST,I'm back mfers. looks like I can't call a certain cricketer a word that rhymes with cat,7
2024-04-04 07:23:42 PM IST,"Livingston and miller out, what a snooze fest",3
2024-04-04 07:24:02 PM IST,Nathan Ellis was by far Punjab's best overseas bowler last season. Why is he not playing over Rabada?,5
2024-04-04 07:24:02 PM IST,It's pretty telling where Punjab stand as a franchise when their marquee player is Shikhar Dhawan. I wonder how international players feel when their name stops at Punjab Kings at the auction.,5
2024-04-04 07:24:22 PM IST,"I think PBKS have got the team right today. Don't push Jitesh up. He's better as a finisher at 6 or 7. Curran at 4, Raza at 5 and Jitesh at 6. Looks like Ashutosh will come as impact sub. Late order hitter, good move.

If they can see beyond the price tag and bring in Vidwath, they are well covered. Vidwath, Arsh & KG in PP. Curran, Arsh & KG at the death.",5
2024-04-04 07:25:11 PM IST,"Raza better than washed Livi, let's go.",3
2024-04-04 07:25:12 PM IST,The team with best record VS the team with worst record in IPL..,3
2024-04-04 07:25:19 PM IST,"Shubman: 7 letters   
Shankar: 7 letters   
Omarzai: 7 letters   
Tewatia:  7 letters   
Darshan: 7 letters   
Shikhar: 7 letters    
Harshal: 7 letters  
  

7 Players with 7 Letters   

DONT MAKE ME SAY IT",8
2024-04-04 07:26:09 PM IST,Kane?? Kane Williamson is playing? OMG. What timeline is this? Finally!!,12
2024-04-04 07:26:48 PM IST,Will be interesting to see how Sai and Williamson can fit in the middle order. Both of them are tuk tuks of the highest order,0
2024-04-04 07:27:24 PM IST,Kane mama playing lesss gooooo,2
2024-04-04 07:27:36 PM IST,Let’s go Punjab,3
2024-04-04 07:28:19 PM IST,Mohit when Lesshit walks in:,3
2024-04-04 07:28:24 PM IST,To any possible Punjab fans out there: why do you continue supporting a team that hasn't reached playoffs for (iirc) 8 years? Isn't it mentally exhausting?,2
2024-04-04 07:28:28 PM IST,Happy to see Williamson playing. He's an underrated player in T20s. Also will Nathan Ellis be in the Australia squad for the World Cup? His slower balls and variations will be useful in the Caribbean.,2
2024-04-04 07:28:35 PM IST,Dhawan? PBKS dont even believe in their own captin,1
2024-04-04 07:28:36 PM IST,So who's gonna be impact sub for Punjab? Thyagarajan or Ashutosh Sharma? Who's the better batter and what's their domestic records like??,3
2024-04-04 07:28:47 PM IST,Anyone else annoyed that spectators are stepping on the seats?,2
2024-04-04 07:29:14 PM IST,"At auction pbks was looking so strong. Thier squad still does but thier on ground performance has been piss poor . Hope they can turn this around in the coming games. 


I see them finish 11th at the table out of 10.",2
2024-04-04 07:29:21 PM IST,"Ugh. Can GT be any more boring. Picking Williamson, really?",-9
2024-04-04 07:29:49 PM IST,"Why has this place and a lot in the country turned on Vijay Shankar ?While the likes of dodgy Sachin with his Ferrari fiasco are treated like Gods ,I can understand twitter being a shithole but the 180 on Shankar over the lost few years inspite of him being one of the few in Indian cricket with a 3D glasses is baffling to say the least",2
2024-04-04 07:29:51 PM IST,I hope Sai keeps his position at 3.,3
2024-04-04 07:30:09 PM IST,"Any reason it looks so empty there? Besides it being a 120,000 cap stadium.",2
2024-04-04 07:30:28 PM IST,Shikhar it isn't RCB hehe,1
2024-04-04 07:30:44 PM IST,Glad to see Williamson in the playing XI.,1
2024-04-04 07:31:22 PM IST,"I kind of want Williamson to lead RCB the next season, i would tune in just to watch his sexual tension with Koach",2
2024-04-04 07:31:34 PM IST,Raza and Williamson. Woohoo!!!,1
2024-04-04 07:31:36 PM IST,Brar has been good this season..Nice tactics by Pbks for now.,2
2024-04-04 07:31:36 PM IST,"Ok PBKS have done their homework, no pace for Saha.",5
2024-04-04 07:31:50 PM IST,Good over till now honestly,3
2024-04-04 07:31:55 PM IST,"GT looks like they got flaws on paper, but somehow find ways to win on the field. The 3 matches this season, the middle order doesn't look great, but yet getting the results.",7
2024-04-04 07:32:12 PM IST,This stadium always looks so empty man I swear,3
2024-04-04 07:32:17 PM IST,Dhawan captaincy good?,4
2024-04-04 07:32:43 PM IST,Oh yesss,2
2024-04-04 07:32:48 PM IST,Bro just want to see RCB get thrashed,3
2024-04-04 07:32:51 PM IST,PRINCE,2
2024-04-04 07:33:01 PM IST,Superb shot,2
2024-04-04 07:33:05 PM IST,BOOM,2
2024-04-04 07:33:12 PM IST,what a shot,3
2024-04-04 07:33:13 PM IST,Can't we play 3 spinners? Sai kishore can do better than Nalkande he was given only 2 overs last match,2
2024-04-04 07:33:22 PM IST,Harpreet Brar when Pianoreet Brar walks in:,6
2024-04-04 07:33:24 PM IST,shubman and showing intent??????,1
2024-04-04 07:33:35 PM IST,"Wow firecrackers for a six
Thank god this is a big ground and not Vizag or Hyderabad lol",3
2024-04-04 07:33:35 PM IST,For every six by Gillman i cum once,8
2024-04-04 07:33:40 PM IST,Bruh GT cheerleader are top notch,0
2024-04-04 07:33:49 PM IST,Wow wtf arshdeep bowling good,3
2024-04-04 07:33:49 PM IST,That looked high.. Should be reviewed,5
2024-04-04 07:33:51 PM IST,"I knew Gill would go behind Brar to put pressure, just if Brar could've bowled quick wide.",1
2024-04-04 07:34:15 PM IST,That's out no doubt,1
2024-04-04 07:34:17 PM IST,Kanos time,1
2024-04-04 07:34:21 PM IST,Ahmedabad seats painted orange and blue ,1
2024-04-04 07:34:28 PM IST,Looks high,1
2024-04-04 07:34:39 PM IST,Thank you agent saha,2
2024-04-04 07:34:39 PM IST,"Some people's favorite team is CSK, other people's is KKR

But my favorite team is DRS",1
2024-04-04 07:34:42 PM IST,Height may be an issue here.,1
2024-04-04 07:34:46 PM IST,_No need for UltraEdge_,1
2024-04-04 07:34:47 PM IST,I think gt are going 3 spinners today knowing how bad we are vs spin. Anything above 160 we are fucked,2
2024-04-04 07:34:48 PM IST,Imagine wasting a review on a tailender.,2
2024-04-04 07:34:50 PM IST,Just 180 comments? PBKS is straight up viewership poison.,3
2024-04-04 07:34:53 PM IST,Saha is a Noha today,2
2024-04-04 07:34:55 PM IST,Saha is also a Pbks legend,4
2024-04-04 07:35:04 PM IST,High? Looked like it hit his thigh pad,1
2024-04-04 07:35:07 PM IST,Adding 2 more teams has made IPL unnecessarily Long & boring. Atleast they should have kept more double headers,3
2024-04-04 07:35:12 PM IST,Good to see kane playing. Is Miller injured or GT dropped him,2
2024-04-04 07:35:14 PM IST,^Kanos ^please ^dont ^disappoint,2
2024-04-04 07:35:16 PM IST,What a bad call,2
2024-04-04 07:35:24 PM IST,"Exactly, too high",2
2024-04-04 07:35:33 PM IST,FUUUCK,1
2024-04-04 07:35:39 PM IST,good review,1
2024-04-04 07:35:40 PM IST,Ground was probably upset that kanos isn't coming out,3
2024-04-04 07:35:40 PM IST,How do we know they are not modifying the ball tracking to favour a team,2
2024-04-04 07:35:48 PM IST,Why has the umpiring been so bad lately?,3
2024-04-04 07:35:49 PM IST,Yup.. Like I said it looked high first instance itself. Umpire didn't even think about it. As usual shit umpiring is permanent this season.,2
2024-04-04 07:35:49 PM IST,How’s that review fast man,2
2024-04-04 07:35:49 PM IST,Bro y almost all umpires are chonky,2
2024-04-04 07:35:51 PM IST,Lmao well tried tho,1
2024-04-04 07:35:53 PM IST,Sanjay Bangar bouncing between two meme teams,1
2024-04-04 07:35:54 PM IST,Lmao blud gave his everything😭,5
2024-04-04 07:35:57 PM IST,Good challenge that’s over the stumps,1
2024-04-04 07:36:01 PM IST,Lmao,1
2024-04-04 07:36:03 PM IST,Lol,1
2024-04-04 07:36:03 PM IST,That was kinda comedic Jitesh,3
2024-04-04 07:36:03 PM IST,Lmao,2
2024-04-04 07:36:04 PM IST,"If you're gonna replace Miller with Kane, at least replace Sai with Abhinav Manohar.

Where's the firepower in this batting lineup? You shouldn't be batting two anchors at 3 & 4.",3
2024-04-04 07:36:05 PM IST,Comical,1
2024-04-04 07:36:06 PM IST,"That's so funny. Lol

Jitesh you are out of the squad now. Pant better. 
One can't hear, one can't run",2
2024-04-04 07:36:08 PM IST,2025 rohit to join srh homecoming started in dc ending in srh,3
2024-04-04 07:36:10 PM IST,Gill it’s time you hit 70+ runs man. Don’t be stupid and get out,3
2024-04-04 07:36:16 PM IST,Lmao what you doing sharma ji,1
2024-04-04 07:36:16 PM IST,Jitesh thought he is Flash.. He wasn't.,2
2024-04-04 07:36:17 PM IST,"LBW? calls like that make me think we dont think umpires anymore, go full AI",2
2024-04-04 07:36:17 PM IST,Lol I always stumble like that,2
2024-04-04 07:36:18 PM IST,Falling into my future like…,2
2024-04-04 07:36:19 PM IST,Hope Jitesh is okay but that fall was hilarious,5
2024-04-04 07:36:23 PM IST,He got the gloves outz but his balance got the ball out,2
2024-04-04 07:36:25 PM IST,WTF was that from Jitesh 🤣,3
2024-04-04 07:36:27 PM IST,Wicket Keeper 🤡ing himself moment 🤦🏼‍♂️,2
2024-04-04 07:36:32 PM IST,"You should have taken your pads off too, Jitesh. You'd run faster",2
2024-04-04 07:36:33 PM IST,Benny Hill music right there,2
2024-04-04 07:36:35 PM IST,Lol that was straight out of a cartoon,1
2024-04-04 07:36:35 PM IST,"Good toss to win for PK. If Gill is taken out, the middle order might not get above par scores. Best way to tackle GT is to ask them to bat first or make them chase big totals. Anything less than 175 is GT's territory, they just take their time to settle and score it.",1
2024-04-04 07:36:37 PM IST,"Wat a Ball,all batsman need to do is nick",1
2024-04-04 07:36:40 PM IST,"PBKS is my 3rd favourite team due to Dhawan and Bairstow but sorry guys, it's kane mama today.",2
2024-04-04 07:36:41 PM IST,Lmao that's going straight into the funny IPL moments playlist.,3
2024-04-04 07:36:48 PM IST,I hope we get aggressive Gill tonight,2
2024-04-04 07:36:52 PM IST,I am pretty sure we just witnessed a new meme being born.,1
2024-04-04 07:36:54 PM IST,Neckbeardeep Singh,3
2024-04-04 07:36:56 PM IST,jitesh 😭😭,2
2024-04-04 07:36:59 PM IST,Which sports is genuinely famous in Punjab?Like do they dont care about pbks or just not into cricket or ar not that vocal in social media,2
2024-04-04 07:36:59 PM IST,Trent Boult moment,2
2024-04-04 07:37:01 PM IST,Still hard to run with keepers pads assholes. Leave him a lone,4
2024-04-04 07:37:02 PM IST,Fell like a little boy. Good effort though,1
2024-04-04 07:37:10 PM IST,Swing,3
2024-04-04 07:37:11 PM IST,How I react when I see my dog after leaving her for 30 minutes,3
2024-04-04 07:37:44 PM IST,can someone post a replay of that lmao,1
2024-04-04 07:37:45 PM IST,Mf bowl on off,2
2024-04-04 07:37:45 PM IST,It's fixed guys,1
2024-04-04 07:37:51 PM IST,Purple when,1
2024-04-04 07:37:57 PM IST,I miss the good old days when Arshdeep used to bowl consistent overs. Feels like the India cap ruined him and many other bowlers too,2
2024-04-04 07:37:59 PM IST,"Chahar gets released next season for sure. If Brar can bowl good this season, he will probably become our main spinner",3
2024-04-04 07:38:08 PM IST,I'm late on this but why isn't Miller a part of squad,1
2024-04-04 07:38:16 PM IST,Arshdeep always gives stupid boundaries to batsmen.,2
2024-04-04 07:38:22 PM IST,Why does Subhman Gill always look like he is wearing some concealer makeup? 😂,6
2024-04-04 07:38:24 PM IST,GT all the way today. I give GT 85% chances of winning today.,5
2024-04-04 07:38:26 PM IST,Go Saha! The best wicketkeeper of your generation.,3
2024-04-04 07:38:30 PM IST,Hope purple makes up  chahars unavailability,1
2024-04-04 07:38:34 PM IST,[deleted],2
2024-04-04 07:38:48 PM IST,Powerplay is such injustice for bowlers,2
2024-04-04 07:39:00 PM IST,Feelin piroud Indian army,5
2024-04-04 07:39:12 PM IST,Nice saveee,2
2024-04-04 07:39:12 PM IST,Why saha is still playing??,-1
2024-04-04 07:39:14 PM IST,Oh my God Deep Dasgupta's just the worst commentator in existence his voice sounds like nails on a chalkboard,3
2024-04-04 07:39:18 PM IST,"Dhawan, Bairstow, Saha, Khan, Kane    

Lots of prominent ex-SRH players featuring here today",3
2024-04-04 07:39:19 PM IST,Anyone in Oz? Is your kayo feed glitching out?,4
2024-04-04 07:39:24 PM IST,Nxt time I need ball camera.,1
2024-04-04 07:40:03 PM IST,Fuck Kayo,3
2024-04-04 07:40:11 PM IST,Is this a red soil pitch they're using today at Ahmedabad? Already after two overs it doesn't seem as lifeless or dull as their dogshit black soil pitches.,5
2024-04-04 07:40:17 PM IST,How can you watch this game in Fiji? Not for me but for cricket fans that live in Fiji,-1
2024-04-04 07:40:47 PM IST,[deleted],3
2024-04-04 07:41:12 PM IST,"Rabada, it’s time to shine, for once 🤦🏼‍♂️",3
2024-04-04 07:41:19 PM IST,Who was rock hard on the pitch report🤨,3
2024-04-04 07:41:23 PM IST,"Even wpl threads had more active people in it.


Pbks is washed",7
2024-04-04 07:41:40 PM IST,"KG has such a beautiful action, like poetry in motion",3
2024-04-04 07:41:47 PM IST,"Ahmedabad(NaMo) stadium would need to do a lot to regain any fandom for me man. Worst day of the decade, and that was a decade with Covid.",2
2024-04-04 07:41:52 PM IST,What % of the Modi stadium is filled?,2
2024-04-04 07:41:54 PM IST,Mehh bowling from rabada,2
2024-04-04 07:41:59 PM IST,"List of Indian wicketkeepers I trust:  
1. Thala (for a reason)  
2. Sanju Samson (for various reason)  
3. Pant (could be higher if he manages to come back strong!)  
4. Saha (constant Wridhi)  
5. Everyone else",4
2024-04-04 07:42:08 PM IST,"Man, we don't have a gameplan for anybody

Just bowl randomly and pray for a wicket",4
2024-04-04 07:42:14 PM IST,The Big Red Monster Kane is playing.,2
2024-04-04 07:42:19 PM IST,"PBKS bowling looks so good on paper lol

Arshdeep - new ball swing + death overs yorker

Harshal - cutter specialist + batdeep

Rabada - seam + hard lengths + tall/quick + exp

Brar - good domestic SLA

Curran - jack of all trades + AR value

Raza - offspin + AR value",3
2024-04-04 07:42:20 PM IST,[deleted],-6
2024-04-04 07:42:31 PM IST,"Sam curran giving tips to kagiso rabada,fast bowler helping fast bowler ",3
2024-04-04 07:42:35 PM IST,Evil Gill be like:,2
2024-04-04 07:42:36 PM IST,Why can’t they bowl straight,2
2024-04-04 07:42:43 PM IST,"How are you guys feeling about Clarke in commentary? 

So far, I'm liking it. But I'm not sure if it's because it means that every minute he's on, it's a minute that I don't have to listen to Anjum, Sunju or Karthik.",4
2024-04-04 07:42:48 PM IST,"Bro comms for a stroke player are so sexually charged, I swear

""Supple wrists, soft hands""

""That's creamed""",7
2024-04-04 07:42:51 PM IST,"Arshdeep and Siraj do not inspire any confidence. Mohit, Mayank Yadav, Khaleel and Avesh are looking way better currently ",8
2024-04-04 07:43:10 PM IST,"""What was noticeable was the bounce""

So definitely red soil",5
2024-04-04 07:43:40 PM IST,[deleted],0
2024-04-04 07:43:59 PM IST,2 more,2
2024-04-04 07:44:04 PM IST,Advantage GT,1
2024-04-04 07:44:05 PM IST,Ypu can't do that to me Gabbar...,3
2024-04-04 07:44:11 PM IST,Rabada ! Who else,1
2024-04-04 07:44:11 PM IST,"> Gt, pk and rr must be most boring teams  


so why you watching then sir??????",4
2024-04-04 07:44:11 PM IST,"Saha gifting wkt ,he is completely off today",2
2024-04-04 07:44:15 PM IST,typical saha match,1
2024-04-04 07:44:15 PM IST,Ahemdabad probably excited cause kanos is coming in,6
2024-04-04 07:44:30 PM IST,Fuck yaar,2
2024-04-04 07:44:31 PM IST,We looking solid today. Bowling is top notch,3
2024-04-04 07:44:33 PM IST,"**2.6** **143ks. Skied, Dhawan takes it at mid-off**

Wriddhiman Saha c Dhawan b Rabada 11 (13b 2x4 0x6) SR: 84.61",4
2024-04-04 07:44:34 PM IST,let’s gooo kane,2
2024-04-04 07:44:35 PM IST,Shikkyyyy boyyyyyyy,3
2024-04-04 07:44:40 PM IST,Saha finished his 12 ball quota.,3
2024-04-04 07:44:43 PM IST,Saha out of touch,2
2024-04-04 07:44:45 PM IST,"Get early wickets, force them to get an IP because Mohit is in the sub list",3
2024-04-04 07:44:58 PM IST,Finally Rabada bowling like the 2nd best bowler in the world 👏🏻,2
2024-04-04 07:45:02 PM IST,GT's version of the tailender strategy that KKR uses isn't going so well. It probably helps that Narine isn't a proper tailender.,8
2024-04-04 07:45:11 PM IST,Interesting to see Gill and Williamson play together,2
2024-04-04 07:45:11 PM IST,"VIjay Shankar is alright, nothing spectacular but a decent IPL-level player who can make solid contributions with the bat or ball as needed. Shika Daone is washed",2
2024-04-04 07:45:12 PM IST,Dhawan never drops catches,8
2024-04-04 07:45:20 PM IST,"Where the hell is preity guys, i am not here to watch gill or rabada. bring preity you dumb cameraman.",5
2024-04-04 07:45:28 PM IST,I've never seen Saha play more than 15 balls,8
2024-04-04 07:45:33 PM IST,I think GT needs to move on from Saha. He was good for them last season on a fast and pacy pitch but Ahmedabad isn't the same anymore so he's a liability for GT as things stand.,5
2024-04-04 07:45:35 PM IST,"Saha out, advantage GT!",2
2024-04-04 07:45:43 PM IST,"Called it, they should make tewatia open like narine",7
2024-04-04 07:45:48 PM IST,Is Williamson getting to bat for the first time for GT ?,5
2024-04-04 07:45:49 PM IST,Smileson vs smileone,7
2024-04-04 07:45:54 PM IST,"Every match MI lose, dream 11 cooks up another cocky hardik ad",4
2024-04-04 07:45:59 PM IST,"Saha is washed up ,",0
2024-04-04 07:46:03 PM IST,"Two most boring teams of IPL, one is a choker other is not(usually) that’s it",2
2024-04-04 07:46:29 PM IST,"Honestly, how long will they continue with Saha? Look I like the guy, but he isn't a T20 opener. Yeah, he might give you the odd cameo but surely they can do better.",1
2024-04-04 07:46:32 PM IST,Gilliamson,7
2024-04-04 07:46:38 PM IST,"Kane and Gill batting together, absolute chefs kiss of aesthetics 🤌",6
2024-04-04 07:46:39 PM IST,"Tall. Strong. Handsome. Kind. Patka.

Arshdeep is the ideal male to repopulate the Earth after a zombie apocalypse.",5
2024-04-04 07:46:42 PM IST,Saha cpmpleted his qupta of 1p balls,2
2024-04-04 07:46:48 PM IST,Where is Preity Zinta hero cam? She is the only hero PBKS has.,5
2024-04-04 07:46:48 PM IST,Gill while batting makes not even a bit of unecessary movement.,5
2024-04-04 07:46:49 PM IST,cum on kanos,3
2024-04-04 07:46:58 PM IST,I hate GT but I love Kane. Idk whom to support now?,4
2024-04-04 07:46:59 PM IST,Another day another filler match,5
