Timestamp,Comment,Upvotes
2024-04-09 09:38:16 PM IST,really excited to see where srh goes in the coming years. They've made pretty good improvements this year. Cumdawg is pretty exciting to see anyway,6
2024-04-09 09:38:16 PM IST,[deleted],12
2024-04-09 09:38:18 PM IST,Bye,1
2024-04-09 09:38:20 PM IST,"Bairstow out, advantage PBKS!",7
2024-04-09 09:38:23 PM IST,Dunno if we should be celebrating. Guy was always a walking wicket. He should be eating more balls rather than get actual batsmen in.,5
2024-04-09 09:38:24 PM IST,thank god i had 5 pacers in my d11 team. only if rabada got more wickets :/,3
2024-04-09 09:38:24 PM IST,[deleted],3
2024-04-09 09:38:25 PM IST,How has YJB been for Punjab? Or is this his first season with them?,1
2024-04-09 09:38:27 PM IST,Sherdil Prabhsimran is here![img](emote|t5_2qhe0|28120)![img](emote|t5_2qhe0|8781),8
2024-04-09 09:38:27 PM IST,"Lol, everyone made fun of SRH for buying test specialist Cummins for 2.5 million dollars but it turns out he turned out to be a better deal than Starc.",39
2024-04-09 09:38:32 PM IST,"_clears throat_ 

I'm not gay but I want to live in a log cabin in the woods with Cummins. We won't ever have sex, but there will be a simmering erotic undercurrent as I stand in the kitchen window watching him tighten his ass as he chops wood, shirtless, sweat pouring off his body. I'll run upstairs and masturbate, the entire time forcing myself to think of women while my thoughts drift back to Cummins. I won't be able to climax and I'll eventually go back downstairs, angry. Sometimes we will look across the table and catch each other's eyes, and in that second, anything is possible, but we both deny ourselves and go back to what we were doing. One day one of us will die, and the other will bury him outside the log cabin. Then they'll go inside, pen a brief missive to their departed friend, and commit suicide, never able to deal with life without their one true platonic love.",19
2024-04-09 09:38:35 PM IST,Bairstow at best makes 30s on really flat pitches,3
2024-04-09 09:38:37 PM IST,Showing Vijay Shankar as a trailer for RR vs GT is terrible marketing.,7
2024-04-09 09:38:40 PM IST,perfect pitch for patty.btw he tries to bowl these other indian pitches gets belted.,4
2024-04-09 09:38:42 PM IST,Lol and just 20min ago people in this thread were saying Cummins sucked at T20 cos he didn't make runs,7
2024-04-09 09:38:43 PM IST,Well this is what you get for not having an Aussie batsman in your side. Cumdog makes you pay,2
2024-04-09 09:38:45 PM IST,Guys calm down there are still 18 and big overs to go,6
2024-04-09 09:38:46 PM IST,"I like PBKS's homegrown talent I just don't trust them enough to win it.

I'd be pretty happy if I'm wrong tho",3
2024-04-09 09:38:49 PM IST,"Punjab fucked up as usual, should’ve been closer to a 160 target.",2
2024-04-09 09:38:52 PM IST,"Journalist: Whats ur plan for Bairstow, how do u plan to get him?

Aussies : Through the gates x 4

That interview keeps on giving",15
2024-04-09 09:38:54 PM IST,Cumdog,3
2024-04-09 09:38:56 PM IST,Guys why is Jio broadcasting football? Are they stupid?,3
2024-04-09 09:38:57 PM IST,"Damn, they don't even need to try some crazy bowling tricks. Just Line and Length is deadly on this pitch.",4
2024-04-09 09:38:59 PM IST,An Australian knocking over an English - lovely to see,8
2024-04-09 09:39:01 PM IST,[removed],3
2024-04-09 09:39:01 PM IST,Baristow on a duck. There are few sights more powtic than this.,15
2024-04-09 09:39:01 PM IST,There isn’t an alternative to Bairstow. Roussow is equally bad,12
2024-04-09 09:39:04 PM IST,Lol... Bairstow getting that Ashes flashback/ preview.,15
2024-04-09 09:39:11 PM IST,"Test match line and length in a T20,  sneaky Cummins, Bairstow takes the moral victory",5
2024-04-09 09:39:13 PM IST,I feel Bairstow will do well tonight,10
2024-04-09 09:39:14 PM IST,Difference between Cummins in KKR and Cummins in SRH is insane,29
2024-04-09 09:39:15 PM IST,RR has such a small fanbase. hope they have good season,9
2024-04-09 09:39:15 PM IST,[deleted],14
2024-04-09 09:39:17 PM IST,Cummins might be hot but Prabhsimran got dem Cakes 🍑,15
2024-04-09 09:39:25 PM IST,2 slips. Great captaincy,11
2024-04-09 09:39:30 PM IST,Pat Bateman,10
2024-04-09 09:39:32 PM IST,I love solar panel pat!!,6
2024-04-09 09:39:33 PM IST,Now we're without the batting prowess of Arshdeep :(,9
2024-04-09 09:39:36 PM IST,i am gey for cumdawg,12
2024-04-09 09:39:37 PM IST,Waiting for Nitish Anna’s Bowling,17
2024-04-09 09:39:41 PM IST,Insider commentators saying perhapsimran,8
2024-04-09 09:39:41 PM IST,"I'm not gay but I want to live in a log cabin in the woods with Cummins. We won't ever have sex, but there will be a simmering erotic undercurrent as I stand in the kitchen window watching him tighten his ass as he chops wood, shirtless, sweat pouring off his body. I'll run upstairs and masturbate, the entire time forcing myself to think of women while my thoughts drift back to Cummins. I won't be able to climax and I'll eventually go back downstairs, angry. Sometimes we will look across the table and catch each other's eyes, and in that second, anything is possible, but we both deny ourselves and go back to what we were doing. One day one of us will die, and the other will bury him outside the log cabin. Then they'll go inside, pen a brief missive to their departed friend, and commit suicide, never able to deal with life without their one true platonic love.",17
2024-04-09 09:39:48 PM IST,bowling paradise 😍,7
2024-04-09 09:39:48 PM IST,"Is arshdeep really the worst batter Punjab has, I've seen him smack some biggies",2
2024-04-09 09:39:50 PM IST,aus owning eng here too,11
2024-04-09 09:39:50 PM IST,2 overs of powerplay wasted completely. You are inflating the target yourselves mate,10
2024-04-09 09:39:51 PM IST,Cummo's got the dawg in him!!!,9
2024-04-09 09:39:52 PM IST,Bairstow ashes flashback watching Cummins,9
2024-04-09 09:39:53 PM IST,What exactly did Cody even do to deserve all the Hero celebration he got yesterday at WM? Its been one day and people are already bored of his reign. Glad I only watch the big 4 PPVs of WWE.,-1
2024-04-09 09:39:55 PM IST,2 beautiful overs,5
2024-04-09 09:39:59 PM IST,CumDawg is so intimidating,10
2024-04-09 09:40:00 PM IST,RRR keeps going up every over. Dhawan wasted a full over,10
2024-04-09 09:40:01 PM IST,Doing the 'impact sub' signal while holding a cap is a bold move. Umpire looks like he's doing Naagin dance. Someone get Bangladesh Cricket on the line!,9
2024-04-09 09:40:04 PM IST,Cumdog vs cake singh,8
2024-04-09 09:40:06 PM IST,[removed],1
2024-04-09 09:40:08 PM IST,Dayumm that’s football score,12
2024-04-09 09:40:14 PM IST,Pat Comments,0
2024-04-09 09:40:15 PM IST,Exactly how Cumdawg got bowled. He gets Bairstow bowled,5
2024-04-09 09:40:18 PM IST,CumDAWG on daily routine,3
2024-04-09 09:40:24 PM IST,Another day another Shashank carryjob,2
2024-04-09 09:40:25 PM IST,We're playing football today?,2
2024-04-09 09:40:29 PM IST,Punjab and absolutely wasting the powerplay,1
2024-04-09 09:40:29 PM IST,dhawan going back in this over,1
2024-04-09 09:40:29 PM IST,"Dear Jio commentators, his name is not Cummings 😭",10
2024-04-09 09:40:34 PM IST,PC I love you 😘,1
2024-04-09 09:40:35 PM IST,Is Bairstow genuinely finished? He has had like one great inning in the last year across formats,2
2024-04-09 09:40:36 PM IST,"Well, it's functionally like we scored 200 now, but even better!",6
2024-04-09 09:40:39 PM IST,Don't wanna jump the gun but this game is kinda looking joever after just 2 overs,7
2024-04-09 09:40:39 PM IST,Shot,2
2024-04-09 09:40:39 PM IST,"1-1-0-0

1-0-1-1

  
talking in binary",6
2024-04-09 09:40:39 PM IST,Now its a 200 target,3
2024-04-09 09:40:40 PM IST,"Peak Srh coming back with extra bonus in form of batting,what a time to be alive ",8
2024-04-09 09:40:42 PM IST,Practical target is 210 now. After astrocious 2/1 in 2 overs.,4
2024-04-09 09:40:43 PM IST,Was that the first bowled wicket for srh today this season,2
2024-04-09 09:40:43 PM IST,I need a win from SRH today because Manchester City are going to play terrorist ball at Bernabeu and I'd not be able to sleep if at least one team I support doesn't win.,9
2024-04-09 09:40:45 PM IST,"This is just top bowling. PBKS are getting nothing, Bairstow took a risk and his stumps were knocked back. ",7
2024-04-09 09:40:48 PM IST,All this for unadjusted to go for 15 in the middle overs with his 90kmph balls (reverse jinxing),6
2024-04-09 09:40:50 PM IST,Need 2 more wickets in pp please,7
2024-04-09 09:40:54 PM IST,Lmfao this is the worst possible start we can have. Why does Dhawan put so much pressure on the score board man. 1 in 7 balls is unforgivable,8
2024-04-09 09:40:54 PM IST,DaOne,6
2024-04-09 09:41:03 PM IST,Yeah that's a classic Dhawan shot.,4
2024-04-09 09:41:10 PM IST,Come on need 2 more in the pp to be safe,5
2024-04-09 09:41:11 PM IST,Few years back SRH has such good bowling that they can defend 160 now Shahbaz is their top spinner. Lol from Rashid to Shahbaz what a down grade,10
2024-04-09 09:41:15 PM IST,Go Gabbar! Break those shackles and make some runs,1
2024-04-09 09:41:17 PM IST,I don't think PBKS can replicate what SRH did on this. Need to be fearless + skillful,5
2024-04-09 09:41:18 PM IST,"This Shikhar doesn't have any intent, Punjab can do nothing with him.",2
2024-04-09 09:41:20 PM IST,Didn't think 183 was enough but it might be 100 more than needed with PBKS shit batting line up,3
2024-04-09 09:41:21 PM IST,Good shot,2
2024-04-09 09:41:21 PM IST,Dhawan after scoring a wicket for srh now scoring some runs for pbks,1
2024-04-09 09:41:23 PM IST,Captain cumdawg + stats srh whole team,2
2024-04-09 09:41:24 PM IST,"unrelated but i once drew marvel parallels to SRH. david warner being captain america, he meets the falcon (dhawan)  and the winter soldier(bairstow) at different points of time- 

 and after the captain goes back in time (Warner going back to DC) the falcon and the winter soldier team up, continuing their mission (PBKS)",3
2024-04-09 09:41:26 PM IST,"they forced that little kid to the IPL , she must be a die hard Test cricket fan",1
2024-04-09 09:41:33 PM IST,Need 2018 srh bowling,13
2024-04-09 09:41:44 PM IST,Dhawan needs to plays aggressively.  Better to score 30 at a SR of 170 and get out rather than a 50 at a SR of 120-130,2
2024-04-09 09:41:46 PM IST,Nice give dhawan some four and keep him in crease till the end,1
2024-04-09 09:41:48 PM IST,Maybe should have let Bairstow bat in this form ?,1
2024-04-09 09:41:51 PM IST,i need to ask cumdawg's waifu whether she has a sister 😎,4
2024-04-09 09:42:05 PM IST,Bhuvi 141 damn,6
2024-04-09 09:42:06 PM IST,Punjab needs get Prabh in place of Harshal and Ellis in place of YJB.,4
2024-04-09 09:42:06 PM IST,Buvi bowling 141s is crazy,9
2024-04-09 09:42:07 PM IST,That fan was on some crazy shit,5
2024-04-09 09:42:13 PM IST,"Watto gassing shikhar up reminds me of that bicycle meme ""he trynna gass it up""",1
2024-04-09 09:42:16 PM IST,"I think many foreign players (especially those new to it) underperform in the IPL because it is hard for them to take the tournament seriously seeing all the hero worship and fanaticism that goes with it. The crowd, I think, play a major role in shaping the players' perception of how the game is received, and can't blame them if they think its one big circus fest. There simply isn't enough motivation for them to be at the top of their game when they are overwhelmed by a deluge of masses clamoring for heroes while there are only a few who appreciate the game itself.",4
2024-04-09 09:42:17 PM IST,"What does Bairstow needs to get dropped?

He could literally use racial slurs and would still be picked in the squad",8
2024-04-09 09:42:20 PM IST,BHUVI BOWLED OVER 140 THIS IS NOT A DRILL,6
2024-04-09 09:42:21 PM IST,"2 bad matches, 2 good matches, 2 bad matches, 2 amazing matches, 2 bad matches, 2 good matches, 2 bad matches, 2 amazing matches

Bairstow in nutshell.",8
2024-04-09 09:42:21 PM IST,"I've seen Dhawan hit that shot a million times, but it's just as gorgeous every single time",4
2024-04-09 09:42:23 PM IST,bhuvi gets the right hander?,6
2024-04-09 09:42:24 PM IST,Bhuvi bowling 141 dafaq,9
2024-04-09 09:42:30 PM IST,Why did they stop showing IPL stats?,2
2024-04-09 09:42:30 PM IST,I find it slightly funny when some people criticize Hardik when he seems to only bowl when conditions are good. Cummins does the same and gets praised. (I know there is the obvious quality difference b/w Cummins and Hardik bowling),4
2024-04-09 09:42:39 PM IST,Ohhh almost,5
2024-04-09 09:42:39 PM IST,After Da1 only Curran looks threatening enough in this batting line-up.,6
2024-04-09 09:42:42 PM IST,where can i check ball Speed?,6
2024-04-09 09:42:46 PM IST,"
Someone How Unlucky you’re 
Me : Travis Head Klaasen played for RCB Nitish Kumar Reddy attended RCB camp but they didn’t even Bid for himc
Im RCB , RCB is me",4
2024-04-09 09:42:46 PM IST,Inswinger bhuvii,3
2024-04-09 09:42:47 PM IST,"It's nice to see Bhuvi bowling consistently above
133-135 kmph speeds. For few seasons he was literally bowling early 120's with a max speed of rare 130 kmph balls.",5
2024-04-09 09:42:59 PM IST,Bhuvi bowling around 140?? Wtf is happening??,3
2024-04-09 09:43:02 PM IST,0(4) now,3
2024-04-09 09:43:02 PM IST,Bhuvi should come up for the T20 WC,6
2024-04-09 09:43:02 PM IST,Bhuvi constantly reaching 140s is something I didn't expect to see in 2024,10
2024-04-09 09:43:04 PM IST,just a reminder even if we win we will be 5th 🥶,11
2024-04-09 09:43:06 PM IST,not today gabbar,3
2024-04-09 09:43:13 PM IST,Wouldn’t be surprised if SRH bowling chokes,6
2024-04-09 09:43:14 PM IST,Is this bhuvi 3.0? Wouldn’t mind him on the flight to Caribbean,13
2024-04-09 09:43:20 PM IST,"Dots, tons of em",3
2024-04-09 09:43:22 PM IST,Prabh boi gonna soon,3
2024-04-09 09:43:22 PM IST,Prabhu 🧎,2
2024-04-09 09:43:24 PM IST, Bhuvi has one of the most aesthetically pleasing bowling actions.,8
2024-04-09 09:43:35 PM IST,Prabhsimran is awesome ![img](emote|t5_2qhe0|8781),3
2024-04-09 09:43:36 PM IST,Btw asking for nth times who is the power hitter for punjab at the top of the order??,3
2024-04-09 09:43:38 PM IST,Bairstow is finished,3
2024-04-09 09:43:38 PM IST,Silencer really have a special aura around him,8
2024-04-09 09:43:39 PM IST,We need to fucking run between the wickets,3
2024-04-09 09:43:40 PM IST,"Give us a flat pitch,we will outbat yu.Give us a swing fast paced pitch we will bundle you.Give us a spinning track,well you have got us.BYE BYE.",9
2024-04-09 09:43:44 PM IST,PBKS eagerly wanting to join the lower half friends of RCB and DC,8
2024-04-09 09:43:56 PM IST,No,2
2024-04-09 09:43:57 PM IST,Prabhsimran already doing more than Tripathi as impact sub LOL,7
2024-04-09 09:43:57 PM IST,"prabhsimran, come on man",5
2024-04-09 09:43:58 PM IST,DaOne or Prabhsimran are gonna go big,6
2024-04-09 09:44:06 PM IST,Nooooooooooooo![img](emote|t5_2qhe0|29262),6
2024-04-09 09:44:08 PM IST,Yoo boobie. Let's go,6
2024-04-09 09:44:10 PM IST,NKR YOU LEGEND,5
2024-04-09 09:44:11 PM IST,Bhuvi should bowl one of bis yorkers,1
2024-04-09 09:44:12 PM IST,Lesgoooo,5
2024-04-09 09:44:16 PM IST,Umpire has had enough of pbks shitting the bed.,3
2024-04-09 09:44:16 PM IST,"Having no strategy, , Struggling to hit in PP at your home ground is just embarrassing",12
2024-04-09 09:44:16 PM IST,"PBKS: Shikhar

Cummins: Shook Her",16
2024-04-09 09:44:17 PM IST,Travis Head being proud,16
2024-04-09 09:44:18 PM IST,Yeahhhhh,5
2024-04-09 09:44:22 PM IST, nitish rhodes ✅,10
2024-04-09 09:44:23 PM IST,Unadkat with a last ball 6. This IPL has seen it all,14
2024-04-09 09:44:24 PM IST,Let's go,6
2024-04-09 09:44:26 PM IST,Good catch,7
2024-04-09 09:44:27 PM IST,Travis Head- That's my boi,8
2024-04-09 09:44:29 PM IST,head-esque catch. simran was looking out of touch anyway,10
2024-04-09 09:44:30 PM IST,Impacts not impacting tonight,7
2024-04-09 09:44:31 PM IST,BHUVIIIIIIIIIIIIIIII 😭,11
2024-04-09 09:44:32 PM IST,Lessgooooooo my mannnnnn,5
2024-04-09 09:44:33 PM IST,LETS GOOO BHUVI AND NKRRR,8
2024-04-09 09:44:34 PM IST,My man Curran always gets pushed in pressure situations,6
2024-04-09 09:44:34 PM IST,LFG GET IN BHUVI,5
2024-04-09 09:44:34 PM IST,NKR!!!,4
2024-04-09 09:44:35 PM IST,Travis Head ahh catch,11
2024-04-09 09:44:35 PM IST,Damn Bhuvi. What great bowling,9
2024-04-09 09:44:38 PM IST,I have seen this shit before i guess,6
2024-04-09 09:44:39 PM IST,Excellent catch but I am glad it's not THAT guy who took it. Would've hurt,7
2024-04-09 09:44:41 PM IST,"https://www.reddit.com/r/Cricket/s/37y1JcBkXc
Too soon",2
2024-04-09 09:44:41 PM IST,"Prabh is a good find - if he learns to convert starts into big scores, he has potential to turn into IPL legend",1
2024-04-09 09:44:42 PM IST,NKR is having some day,12
2024-04-09 09:44:42 PM IST,"**2.6** **this goes straight up, and Bhuvneshwar has his man!** Length in the fifth stump channel. Seems destined to angle in but straightens just a shade after pitching. Prabhsimran walks down the track and looks to whip it away over mid wicket. Skews it off the leading edge, and Nitish, running back from cover point, gobbles it up. SRH have two in the powerplay!

Prabhsimran Singh c Nitish Kumar Reddy b Kumar 4 (6b 1x4 0x6) SR: 66.66",6
2024-04-09 09:44:43 PM IST,Ngl this is looking like 2018 srh,9
2024-04-09 09:44:44 PM IST,">Btw asking for nth times who is the power hitter for punjab at the top of the order??


Didn't they have a trophy if they had such things",3
2024-04-09 09:44:45 PM IST,this is a good wicket! prabh can prove to be dangerous at times,3
2024-04-09 09:44:46 PM IST,"Yaaaaaaaaas, let's fucking gooooo",4
2024-04-09 09:44:48 PM IST,<333333333,7
2024-04-09 09:44:49 PM IST,Belowavgsimran singh got out,6
2024-04-09 09:44:49 PM IST,What is everyone doing,5
2024-04-09 09:44:49 PM IST,Yey.. 2nd Wicket for our Bhuvi this season...,9
2024-04-09 09:44:50 PM IST,Ffs we are terrible,3
2024-04-09 09:44:50 PM IST,Nitish never drops it,9
2024-04-09 09:44:52 PM IST,Ily bhuviiiiiiiiiiii😭😭😭😭,7
2024-04-09 09:44:52 PM IST,19/11 PTSD catch,9
2024-04-09 09:44:52 PM IST,What a crappy shot,6
2024-04-09 09:44:52 PM IST,Yeah these guys are not crossing 100,3
2024-04-09 09:44:52 PM IST,That catch parallels Head's wicket today.,11
2024-04-09 09:44:53 PM IST,NKR paid tribute to Travis Head but with safer landing,15
2024-04-09 09:44:54 PM IST,Why sre we always so shit at home,3
2024-04-09 09:44:56 PM IST,We're so done 💀,3
2024-04-09 09:44:56 PM IST,Game on!,3
2024-04-09 09:44:59 PM IST,"for a team that is so analytical in their bowling, punjab has a lot of shit shot selection",4
2024-04-09 09:45:02 PM IST,This guy looks at hitting every damn ball...no matter the situation..,3
2024-04-09 09:45:03 PM IST,two class bowlers. Class line and length. format doesn't matter,5
2024-04-09 09:45:06 PM IST,That's one more reason to live boobie(s),3
2024-04-09 09:45:06 PM IST,Faf to Prabhsimran: Tried fooling them twice lad too. Doesnt work.,2
2024-04-09 09:45:09 PM IST,"Dhawan eating up balls is legit forcing others to take risk

I'm tired of this outdated approach from Dhawan, we do so well when he gets out early",4
2024-04-09 09:45:10 PM IST,Hoping to see nkr bowl today,8
2024-04-09 09:45:11 PM IST,You can't run away from NKR tonight,3
2024-04-09 09:45:12 PM IST,First wicket for Bubbaneshwar Koomar,0
2024-04-09 09:45:16 PM IST,Pathetic,1
2024-04-09 09:45:17 PM IST,And we are so fucking back right now.,1
2024-04-09 09:45:20 PM IST,The ball isn't even swinging as much as it did in the first innings. Just brainless batting against good length bowling.,5
2024-04-09 09:45:20 PM IST,"That's good, throw the match early so I can study",6
2024-04-09 09:45:25 PM IST,Might as well take Bhuvi to the WC if the alternative is Siraj!,-1
2024-04-09 09:45:26 PM IST,"Dread from it, run from it. That moment still arrives.",5
2024-04-09 09:45:29 PM IST,Wonder if both TravIs Head and CUmmins chuckled after seeing that catch,8
2024-04-09 09:45:31 PM IST,Prabhsimran is way too sloggy to be any consistent. Needs to be a bit more clever.,5
2024-04-09 09:45:32 PM IST,"Garbage approach by PBKS for PP, prabh keeps attacking nonsensically and Shikhar keeps playing dots mindlessly.",3
2024-04-09 09:45:35 PM IST,"With Punjab it’s always, bowl good, bat shit, bowl shit, bat good. Never a combo",6
2024-04-09 09:45:38 PM IST,Don't lose hope kxip enjoyers with each wicket we are all one step closer to shashank heaven singh,9
2024-04-09 09:45:42 PM IST,Whats the song played after the wicket?,2
2024-04-09 09:45:44 PM IST,Purposeful catch setup by Cummins to remind crowd and silence them again,12
2024-04-09 09:45:45 PM IST,This catch had nothing to do with Head and yet so much to do with Head. Poetic af match this,3
2024-04-09 09:45:48 PM IST,SRH had an obvious plan and we fell right into it. Brain dead team,6
2024-04-09 09:45:52 PM IST,"If Nitish Kumar Reddy has million number of fans i am one of them . if Nitish Kumar Reddy has ten fans i am one of them. if Nitish Kumar Reddy have only one fan and that is me . if Nitish Kumar Reddy has no fans, that means i am no more on the earth . if world against the Nitish Kumar Reddy, i am against the world. i love #NitishKumarReddy till my last breath.. .. Die Hard fan of Nitish Kumar Reddy . Hit Like If you Think Nitish Kumar Reddy Best player & Smart In the world",8
2024-04-09 09:45:52 PM IST,i sneak in punjab's hotel and have some piece of prabhsimran watermelon,3
2024-04-09 09:45:55 PM IST,"So, in a nutshell, Punjab learnt nothing from SRH's powerplay batting failing tonight. Unlike SRH, they don't have their batting stacked all the way down. 2 more wickets and they're done",7
2024-04-09 09:45:56 PM IST,SRH can be happy they are getting early wickets. But all they are doing is inching closer to the carnage that will be unleashed by Shashank and Ashutosh.,10
2024-04-09 09:45:58 PM IST,Bowl Bhuvi out. No point saving his overs for the death,9
2024-04-09 09:45:59 PM IST,Sam Curran at no.4 never ceases to amaze me,3
2024-04-09 09:46:00 PM IST,So it is a bowling wicket?,1
2024-04-09 09:46:06 PM IST,"Even if I wasn't a SRH fan, I love to see Bhuvi get PP wickets. Such a wonderful humble and hardworking guy, who makes the ball do some beautiful things.",16
2024-04-09 09:46:09 PM IST,Punjabs best batsmen on crease now,3
2024-04-09 09:46:15 PM IST,"WTF, are we already in the tail?",8
2024-04-09 09:46:15 PM IST,We really need to capitalise on NRR this game. We threw away that opportunity last game and we need it as positions 3/4/5 are really tight in the table rn!,6
2024-04-09 09:46:17 PM IST,Both impact players shat the bed today,5
2024-04-09 09:46:22 PM IST,Bro was walking for that shot wtf.,5
2024-04-09 09:46:26 PM IST,pbks need to be smart here. just chill in the pp and start hitting once the ball stops moving,3
2024-04-09 09:46:26 PM IST,"Just realized one weird thing. With the rule change making byes and leg byes not get counted against the bowler (which I agree with btw), a maiden over for the team and a maiden over for a bowler is no longer the same thing. For example the first over was a maiden for Bhuvi but not for the team. It used to be one and the same before.",8
2024-04-09 09:46:32 PM IST,"Hardik becomes MI captain, Gambhir hugs kohli, gambhir hugs Dhoni, Dhoni makes meme song video, Bhuvi hits 140, Siraj hits more sixes than Maxwell, Maxwell takes more wickets than Siraj. 

What’s happening in 2024",14
2024-04-09 09:46:33 PM IST,Good on Dhawan still contributing to Srh after so many years,6
2024-04-09 09:46:35 PM IST,"Yes, its too much but now I demand DA1 's wkt",8
2024-04-09 09:46:36 PM IST,cummins bowling now? bro who's gonna bowl the MO? nattu?,2
2024-04-09 09:46:39 PM IST,Captain to Captain. Round 1. ,6
2024-04-09 09:46:45 PM IST,Every player in SRH has orange cap,12
2024-04-09 09:46:47 PM IST,Nostradamus missed few of the classes i gave thats why he missed sometimes meanwhile i [https://www.reddit.com/r/Cricket/comments/1bzriqs/comment/kyscj13/?utm\_source=share&utm\_medium=web3x&utm\_name=web3xcss&utm\_term=1&utm\_content=share\_button](https://www.reddit.com/r/Cricket/comments/1bzriqs/comment/kyscj13/?utm_source=share&utm_medium=web3x&utm_name=web3xcss&utm_term=1&utm_content=share_button) never do.,2
2024-04-09 09:46:47 PM IST,"Fuck this team , remove that punjab from ur bitchass franchise's name",6
2024-04-09 09:46:50 PM IST,Bhuvi has some following which is soo good to see as they are literally non toxic and love him,38
2024-04-09 09:46:51 PM IST,We are getting benchoded here,11
2024-04-09 09:46:57 PM IST,If an SRH player gets an orange cap how would you tell when he’s wearing it,18
2024-04-09 09:47:01 PM IST,Can’t get complacent.,6
2024-04-09 09:47:01 PM IST,"Hope Nitish bowls, he does some decent bowling in domestic.",7
2024-04-09 09:47:06 PM IST,Cummins wants Dhawan's wicket,9
2024-04-09 09:47:19 PM IST,"Ive lot of respect for cricketers like Bhuvi, no PR, no shenanigans.

Life hits hard but always try everything in his prowess",15
2024-04-09 09:47:19 PM IST,Bairstow should just keep himself away from the game now.He is just embarrassing himself.No way England select him for t20 wc squad.,9
2024-04-09 09:47:27 PM IST,When's the next RCB Match? Looking forward to having a good laugh,6
2024-04-09 09:47:29 PM IST,It’s kinda sad to see batters step out to Bhuvi but it is what it is. I don’t think I can ever get mad at Bhuvi,3
2024-04-09 09:47:30 PM IST,Silencer is the only captain with performance,7
2024-04-09 09:47:32 PM IST,Need to be increasing this RR every over. Put pressure on the batters.,3
2024-04-09 09:47:32 PM IST,"Commentary telling Shikhar to be extra careful now, when him being extra careful in the 1st two overs is what got us here.",2
2024-04-09 09:47:36 PM IST,He might whop us today but not able to digest the Sammy is coming in at No. 4 for Punjab..,1
