Timestamp,Comment,Upvotes
2024-04-09 06:29:36 PM IST,Who should I put my money on? 💰,2
2024-04-09 06:32:01 PM IST,srh looks so wholesome this year.. the whole vibe has changed. cumdawg is a fantastic captain. that comes with a plan,8
2024-04-09 06:38:50 PM IST,Robin Uthappa drip goes HARD. Those sneakers are choice 🤌,5
2024-04-09 06:49:20 PM IST,Supporting PBKS just for the vibes. They never have a boring match,3
2024-04-09 06:51:03 PM IST,"Let's go

Time to make Mullanpur our fortress",2
2024-04-09 06:51:58 PM IST,"how we feeling about the toss folks, I hope we atleast win this one",2
2024-04-09 06:55:33 PM IST,"Since Pbks never win two games in a row, I’m mentally ready for a loss. Congrats Srh guys",8
2024-04-09 06:56:07 PM IST,The last time these two teams played was exactly an year ago.,3
2024-04-09 06:56:35 PM IST,"1 year ago at this time, we still had not witnessed Rinku's 5 sixes in a row.",6
2024-04-09 06:56:41 PM IST,I am very worried about Nattu. The wickets have dried up and he keeps conceding runs. He has a very predictable stock delivery which is a full (not yorker) delivery at 134 km/h. Batsmen have figured him out and have carted him around.,5
2024-04-09 06:59:55 PM IST,Supporting pbks for u/fuckpiyushchawla,17
2024-04-09 07:00:11 PM IST,I want da 1 to do good but want srh to win,9
2024-04-09 07:00:16 PM IST,"Oh my god, why would you make a flat pitch when you're playing SRH?

We are done bro",7
2024-04-09 07:02:15 PM IST,"Dhawan is the worst captain, not faf

The only reason why Dhawan isn't being targeted is because he's a really good guy and is being saved by individual brilliance of domestic players",11
2024-04-09 07:02:45 PM IST,Does Dhawan have a language barrier? He rarely praises his players and literally just said they were lucky to win the previous game.,9
2024-04-09 07:03:22 PM IST,Come on go nuts. 277 is a below par score.,3
2024-04-09 07:03:28 PM IST,PBKS laying XI,1
2024-04-09 07:03:44 PM IST,"Most teams win here batting first (domestic tournaments). 
Pbks won last match by the edge of their teeth, and it was against Dc despite chasing quite a below par total. 

Pretty sure it was a wrong decision to bowl first",1
2024-04-09 07:03:49 PM IST,"I hope we can atleast put up a fight

Why? Spin has been our achilles heel but SRH lack quality spinners",1
2024-04-09 07:03:54 PM IST,"Minions, Today we find out which is better: LASSI or BIRYANI",3
2024-04-09 07:04:11 PM IST,Our practice jersey >>>>>> any jersey in IPL,4
2024-04-09 07:04:15 PM IST,SRH batting is worth to watch this season with their intent,6
2024-04-09 07:04:24 PM IST,Murali Karthik played cricket 2000-2007 retired playing for 7 years u know the drill,5
2024-04-09 07:04:38 PM IST,Flat pitch. PBKS winning toss & opting to bowl first?,3
2024-04-09 07:04:40 PM IST,"Dhawan liteally said PBKS were ""LUCKY"" to win the last match against GT. Wow. That's a low blow to the young blokes in the team who worked there asses off in the last game.",10
2024-04-09 07:04:46 PM IST,Cummins saying Bhuvi is something I never knew I wanted to listen to. Tbh anything this guy does is lovely,8
2024-04-09 07:04:59 PM IST,hyped for punjab da puttar abhishek 🦁,3
2024-04-09 07:05:12 PM IST,"Man Tripathi went from being one of the most dangerous Indian batsmen in the IPL to not even getting a place in the XI

How is such a big deviation possible?",3
2024-04-09 07:05:30 PM IST,Yeah we are fkd. No way we are beating this Punjab team while they are chasing with our shitting bowling. Congrats punjabros yoi got this in the bag,4
2024-04-09 07:05:31 PM IST,Mullanpur sounds like a city in Pakistan,1
2024-04-09 07:05:35 PM IST,Punjab should buy Rohit Sharma in the mega auction,1
2024-04-09 07:05:42 PM IST,"why the fuck did we chose to bowl on a flaat pitch against a team who made 270+, are we stupid?",2
2024-04-09 07:05:42 PM IST,"There ain't no way someone's played cricket for over a decade, and commentated on it for even longer, and still refer to Punjab as Poon-jab. It took me two KXIP matches to get the pronunciation right.",13
2024-04-09 07:07:11 PM IST,Dhawan saying they were lucky to win is the shittiest statement a captain can make. Just shattering the confidence of those who worked hard for it.,6
2024-04-09 07:07:16 PM IST,Head and Abhishek opening pair has to be the deadliest opening combination in a while,7
2024-04-09 07:07:53 PM IST,"Why aren’t the new stadiums having bigger boundaries? can understand the older ones, But the top brass should take some cognisance about the bowlers.",5
2024-04-09 07:08:20 PM IST,"Guys I’m from Western Australia I’ve never supported an IPL team before but I’m leaning towards Punjab. Most of taxi/uber drivers have been Punjabi and they have always been super friendly. I also like supporting underdog teams.

Would they be a good team to go for? I’m also from Perth so a team with a lot of WA or Aussie association would be nice too.",5
2024-04-09 07:08:22 PM IST,srh should drive at 277kmph on this mullanpur road,7
2024-04-09 07:08:27 PM IST,"harshal was actually called ""running offspunner"" KEKW",3
2024-04-09 07:08:41 PM IST,"Abhishek being an all rounder is such an asset, how good of a bowler is he?",3
2024-04-09 07:09:07 PM IST,Shikha DaOne is one of the most likeable and chill players out there but he's a terrible Captain. Do Punjab not have any other options (other than Curran)?,3
2024-04-09 07:09:50 PM IST,Is the pitch road or tortoise?,4
2024-04-09 07:11:18 PM IST,mullanpur stadium has no roof wtf 😬,2
2024-04-09 07:11:19 PM IST,"Allrounder skills wise, I think Washington >> Shahbaz",-3
2024-04-09 07:11:58 PM IST,Good game,1
2024-04-09 07:12:45 PM IST,"PBKS: Man, these SRH batsmen are smashing everything, wonder what should we do to win?

Also PBKS: Lets prepare a highway road

We are absolutely fucked",10
2024-04-09 07:13:01 PM IST,We got Brian Lara speaking Hindi before GTA V,3
2024-04-09 07:14:00 PM IST,dhawan should play atleast 75 balls 🤞,5
2024-04-09 07:14:12 PM IST,Is there no Insiders feed on JioCinema?,0
2024-04-09 07:14:39 PM IST,"Man what a shift, I remember being early on SRH match threads till last year, and all the comments were like ""damn, a nobody cares derby"", ""irrelevant"", ""who's watching this shit"" and so on. Thanks cumdawg, you beauty",42
2024-04-09 07:14:44 PM IST,We're yet to win two on trot,2
2024-04-09 07:15:05 PM IST,Sunrisers Hyderabad today gonna play in first copy of Hyderabad Stadium,2
2024-04-09 07:15:15 PM IST,"Da1, YJB and Shashank

All SRH agents",6
2024-04-09 07:15:29 PM IST,"By the way today, Ugadi, is the Telugu New Year so yeah good luck SRH",10
2024-04-09 07:16:12 PM IST,pbks fans dont panic by seeing our lineup as dhawan said u guys need luck as ur impact player,1
2024-04-09 07:16:30 PM IST,"Okay. I need to recover from yesterday's loss. Please,  PBKS, give a performance true to your name so I don't feel for being a KKR fan. 

Thanks.",1
2024-04-09 07:16:59 PM IST,"why don't they try umran malik? atleast for once,",1
2024-04-09 07:17:24 PM IST,"Yet another Punjabi boy is gonna smack us around in the park today and to make matters worse, we’re at home this time. I’m sick of it",1
2024-04-09 07:17:28 PM IST,Never in my wildest dreams I'd imagined that someday Unadkat will be playing every match ahead of Umran. (for us),6
2024-04-09 07:17:32 PM IST,"Fun Fact: Rinku Singh, T Natarajan, Varun Chakravarthy played for KXIP before",2
2024-04-09 07:17:46 PM IST,[deleted],1
2024-04-09 07:17:48 PM IST,A good captain with his bowling changes and field positions atleast makes difference of upto 15 runs,3
2024-04-09 07:17:51 PM IST,"I love his analogies but seriously, Sidhu paji gets paid 25-35 lakhs for his commentary man...",2
2024-04-09 07:19:05 PM IST,"SRH are an Indian batsman short, I think Tripathi should come back in. Also, I feel Unadkat will be exposed he goes  at 11 runs an over since his 2017 season. In all likelihood, he will be thrashed this match. Still I feel, SRH should win this match.",2
2024-04-09 07:19:21 PM IST,80% chance of SRH winning.,2
2024-04-09 07:19:38 PM IST,abhishek play well if u score less dont say punjab da puttar like that old guy in dream 11 ad 🫠,1
2024-04-09 07:20:40 PM IST,"Surely on a supposedly rock hard pitch with even grass covering, you give Umran a go even as an impact sub seeing as you're batting first?

Such a mess that two of India's three bowlers capable of bowling 150kph cannot get on the park and the third is now out for the next 2-3 games at least.",1
2024-04-09 07:20:42 PM IST,"SRH have easy schedule the next 4 matches, they have to win atleast 3 matches to put themselves in a decent spot.",3
2024-04-09 07:21:13 PM IST,Why did punjab decide to bowl first? The pitch is literally a road,1
2024-04-09 07:21:37 PM IST,today is such a good day for arsenal plus srh fans hope my both team wins inshallah,1
2024-04-09 07:21:38 PM IST,Will the real Orange Army please stand up,3
2024-04-09 07:21:42 PM IST,Simon Doull (on cricbuzz) has freakishly long legs what the fuck,1
2024-04-09 07:21:44 PM IST,I would've given us a chance if we had a proper captain,1
2024-04-09 07:21:46 PM IST,[deleted],1
2024-04-09 07:21:54 PM IST,Punjab Oo Punjab Oo Punjab Oo punjab...,1
2024-04-09 07:22:00 PM IST,Why not start with another batter in our XI instead of Nattu? We can always sub him in right?,1
2024-04-09 07:22:11 PM IST,"My 11 for today would have been

1.	⁠Johny ✈️
2.	⁠Shikhar
3.	⁠Prabhsimran
4.	⁠Shashank
5.	⁠Jitesh
6.	⁠Liam ✈️
7.	⁠Harpreet Brar
8.	⁠Harshal
9.	⁠Kagiso ✈️
10.	⁠Arshdeep
11.	⁠Rahul Chahar

Bench - Sam, Sikander, Ashutosh, Nathan, Riley, Woakes, Vidhwath

This team can sub an explosive batsman, a spinner batsman or a gun pacer, whatever is needed according to the situation. And has 3 pacers and 3 spinners (including Liam) already. I honestly do not know why Punjab doesn’t play 3 foreigners and have all of the others on the bench for emergency.",3
2024-04-09 07:22:58 PM IST,Kavya vs preity today,1
2024-04-09 07:24:20 PM IST,Looks like we are staying at 6th again 😭,1
2024-04-09 07:24:35 PM IST,even if we win today our position will be 5th 😔,4
2024-04-09 07:24:42 PM IST,Pbks to chase down 7th 200,1
2024-04-09 07:24:46 PM IST,where is the heroin cam 🫶,5
2024-04-09 07:24:48 PM IST,We coming for the title,1
2024-04-09 07:25:21 PM IST,after Shawshank next auction PBKS will select Miss Daisy,1
2024-04-09 07:26:03 PM IST,100% black soil isn't going to be much of a batter friendly pitch.,1
2024-04-09 07:26:17 PM IST,"Inb4, so you don’t have to make the same old drawn out “jokes” over and over again. 


1) Boring match (Will this thread even reach 3000 posts?)


2) RCB-lite (Implying RCB has a stronger version)



3) DaOne is a shit captain, abysmal field placement. (Arm chair creaks)


4) Only watching for Priety/Kavya (Simp or slander)



5) They didn’t even want to buy him lol. (They did)



6) Uncapped player needs an Indian team call up for the World Cup (They won’t).",12
2024-04-09 07:26:29 PM IST,"Abhishek Sharma won't hurt his actual home team, would he? Why would he?",2
2024-04-09 07:26:31 PM IST,Punjab Kings should really change their name to Punjab Cricketers. Their name is a lie. The way they play is nothing like how kings would play. Actually wait. Does it mean kings who do not play cricket professionally? Then it's accurate. I'm sorry Priety Zinta for doubting you.,0
2024-04-09 07:26:32 PM IST,whyd they show NKR as opener instead of Abhi? huh? surprise in store?,3
2024-04-09 07:26:35 PM IST,SRH are probably the most exciting team to watch this season,8
2024-04-09 07:27:03 PM IST,"PBKS going absolute batdeep tonight,  the likes of Brar and Harshal at 9 and 10",1
2024-04-09 07:27:38 PM IST,R c b. R c b,-18
2024-04-09 07:28:13 PM IST,3 ex srh players in pbks lineup. Rip srh,2
2024-04-09 07:28:18 PM IST,what are srh fans thought on shabhaz vs Washington. Shabhaz played a good game with the bat at the start of the season and since then he has been average (correct me if I'm wrong). I feel washi has a higher ceiling,2
2024-04-09 07:28:30 PM IST,Srh will cook punjab,1
2024-04-09 07:28:31 PM IST,SRH and KKR are the most exciting teams this season,8
2024-04-09 07:28:35 PM IST,"Back from a 3 day ban, starved to shitpost. Hopefully it'll be a good match for the memes",3
2024-04-09 07:28:41 PM IST,"DA1's captaincy is so freaking predictable he always bowls first whenever he wins the toss. He's also over reliant on match-ups.

Always under bowls Brar despite him being very economical. Keeps over bowling his main bowlers even when they get smacked and doesn't rotate his bowlers well. Under Sam Curran last year, they won consecutive matches and the moment da1 returned they shat the bed. He's literally the biggest culprit behind PBKS inconsistency.",1
2024-04-09 07:29:16 PM IST,Anything happens punjab cannot take 3 wickets in PP.,1
2024-04-09 07:29:23 PM IST, bois get ready to entertained,1
2024-04-09 07:29:24 PM IST,Going in with no expectations.but hope we win,3
2024-04-09 07:29:32 PM IST,Dream 11 Red vs Dream 11 Orange,3
2024-04-09 07:29:43 PM IST,Arshdeep has to find his form asap for India’s chances in the world cup,5
2024-04-09 07:29:47 PM IST,Stadium is EMPTY,5
2024-04-09 07:29:56 PM IST,SRH are due a batting collapse. Today looks like the day.,6
2024-04-09 07:30:10 PM IST,biryani vs butter chicken lesss gooo,8
2024-04-09 07:30:18 PM IST,SRH has always been the most compatible with SA and Australian players. Point to be noted in the next auction.,3
2024-04-09 07:30:26 PM IST,"All this hyping up, early wicket incoming",5
2024-04-09 07:30:38 PM IST,277 about to be broken,-1
2024-04-09 07:30:43 PM IST,I HEARD A SOUND,8
2024-04-09 07:30:44 PM IST,Clean shaved Jitesh Sharma,3
2024-04-09 07:30:48 PM IST,Full ass edge no?,5
2024-04-09 07:30:49 PM IST,Damn,5
2024-04-09 07:30:51 PM IST,I heard something,7
2024-04-09 07:30:55 PM IST,Da1 already looking clueless 😭😭😭😭,7
2024-04-09 07:31:05 PM IST,He has edged that. I don't know about whether that edge is from the bat or the pad.,1
2024-04-09 07:31:06 PM IST,Nobody came to the stadium.,6
2024-04-09 07:31:06 PM IST,empty stadium 🥲,6
2024-04-09 07:31:07 PM IST,"Le RCB Fans last two brain cells inside peek:

Cell 1: Let's Watch this nice SRH VS PBKS game

Cell 2: Yeah, and also Chant RCB RCB in the match thread 

Cell 1: Why should we do that

Cell 2: Why not, we are the best

Cell 1: You smart son of a bitch, I am in.",9
2024-04-09 07:31:08 PM IST,Jitesh just say yes,4
2024-04-09 07:31:13 PM IST,I heard smn there💀,7
2024-04-09 07:31:14 PM IST,Absolute jaffa from KG!,1
2024-04-09 07:31:15 PM IST,Yooooo there was a sound brother,6
2024-04-09 07:31:15 PM IST,T Natrajan is the 13 Left arm pacer player who will play his 50th IPL Match,1
2024-04-09 07:31:17 PM IST,Jitesh looking like a 15 yo,6
2024-04-09 07:31:17 PM IST,"Srh Bowling is weak ,harshal patel 10wkt haul incoming.",5
2024-04-09 07:31:20 PM IST,I swear Jitesh Sharma is not the same person from last season's,7
2024-04-09 07:31:22 PM IST, i heard sth,6
2024-04-09 07:31:28 PM IST,Fuck me awesome ball that one,3
2024-04-09 07:31:31 PM IST,Rabada is exactly the sort of bowler to cock block this SRH batting,7
2024-04-09 07:31:40 PM IST,watching rabada toss grenades as i curse taklu for retaining nortje instead,5
2024-04-09 07:31:43 PM IST,I'm sure i heard something,6
2024-04-09 07:32:03 PM IST,I literally heard a clear clicking noise on the first ball. What was that,1
2024-04-09 07:32:08 PM IST,Yep luck aint never helping us,1
2024-04-09 07:32:10 PM IST,"Pant is being considered for the WC

Hope at least this lights a fire under Jitesh",2
2024-04-09 07:32:17 PM IST,Head bro play little safe 😭😭,5
2024-04-09 07:32:19 PM IST,What a ball woah,2
2024-04-09 07:32:19 PM IST,Bhai paheli hi over mein Murali Karthik.... Torture,2
2024-04-09 07:32:20 PM IST,I can’t find this damn arun ice cream on blinkit in the north ffs,4
2024-04-09 07:32:29 PM IST,I am sure that’s how he survived on 19th of nov,6
2024-04-09 07:32:32 PM IST,i didnt hear the nick on first ball but i heard this four,10
2024-04-09 07:32:37 PM IST,Travis please be careful I can't be living on the edge like this,10
2024-04-09 07:32:42 PM IST,"They say Travis Head

I hear Trauma",8
2024-04-09 07:32:44 PM IST,Punjab Kings moment,8
2024-04-09 07:32:52 PM IST,This mf still carrying his final luck,10
2024-04-09 07:32:56 PM IST,Rabada cooking,2
2024-04-09 07:32:57 PM IST,Lmaoo,4
2024-04-09 07:32:59 PM IST,Is Head the most 'edgy' player? I swear I see him getting boundaries off edges more than any other batter in recent times,6
2024-04-09 07:33:00 PM IST,"Oh fuck off

Clear edge

We are fucked",5
2024-04-09 07:33:01 PM IST,"Abhishek sharma scared to face rabada,head survived with luck",3
2024-04-09 07:33:04 PM IST,Hehehehehehe,3
2024-04-09 07:33:07 PM IST,Punjab kings moment,6
2024-04-09 07:33:08 PM IST,LMAO,2
2024-04-09 07:33:08 PM IST,Damn what's the point of appealing DaOne if you ain't going to review,9
2024-04-09 07:33:08 PM IST,Ffs rabada should have gone for it,2
2024-04-09 07:33:10 PM IST,Dhawan u stupid dumb fuck,8
2024-04-09 07:33:13 PM IST,Head is proper intent merchant.,6
2024-04-09 07:33:15 PM IST,Hell no,1
2024-04-09 07:33:16 PM IST,Let’s go. We have shit record against SRH but we will win today 💪,4
2024-04-09 07:33:20 PM IST,Srh fan but still loving these beauties from rabada,5
2024-04-09 07:33:21 PM IST,"I knew i heard sth, u dumb idiots couldn't hear it in the ground",5
2024-04-09 07:33:24 PM IST,Head is having the time of his life. Man can do no wrong.,5
2024-04-09 07:33:24 PM IST,"Its photo battle now

Kavya Vs Preity 

Win Win Situation",5
2024-04-09 07:33:26 PM IST,Lol they didn't review. Wtf?,6
2024-04-09 07:33:28 PM IST,WTF,3
2024-04-09 07:33:28 PM IST,thanks dhawan 🕺,3
2024-04-09 07:33:29 PM IST,Head got saved...,5
2024-04-09 07:33:30 PM IST,Head now got 4 chances in 4 matches,5
2024-04-09 07:33:30 PM IST,🤡 's 11 punjab,5
2024-04-09 07:33:30 PM IST,Why the stadium is empty?,7
2024-04-09 07:33:31 PM IST,"Head's facial expression said there was something wrong 
He was hesitant",14
2024-04-09 07:33:32 PM IST,Bro that ball went flyingggg,6
2024-04-09 07:33:33 PM IST,if the bowler is not convinced they don't deserve the wicket,9
2024-04-09 07:33:35 PM IST,Head and his luck name better combination...,10
2024-04-09 07:33:36 PM IST,Peaki punjab moment,6
2024-04-09 07:33:38 PM IST,This opening choke of the night has already happened.,7
2024-04-09 07:33:41 PM IST,dhawawn i swear to fucking god,7
2024-04-09 07:33:42 PM IST,Lol 😂😂,4
2024-04-09 07:33:42 PM IST,I feel like I can be a better captain than this dude and faf combined,12
2024-04-09 07:33:44 PM IST,Pbks Lost the match already,5
2024-04-09 07:33:45 PM IST,Imagine saving DRS for an obvious wide later.,15
2024-04-09 07:33:45 PM IST,SO THE NOISE WAS REAL. Peak PBKS Moment.,9
2024-04-09 07:33:50 PM IST,Obligatory Travis Head lucky survival,6
2024-04-09 07:33:52 PM IST,my man carry too much luck with him,4
2024-04-09 07:33:54 PM IST,That was such a faint edge. Difficult to hear for the keeper.,4
2024-04-09 07:33:54 PM IST,would that first ball have been a wicket?,5
2024-04-09 07:33:59 PM IST,test line and length,1
2024-04-09 07:33:59 PM IST,"PBKS is already bottling it. 

They started with the very first delivery of the match. 

Wtf",2
2024-04-09 07:34:01 PM IST,Head is extremely uncomfortable today. Looks he is going to get out cheaply,2
2024-04-09 07:34:03 PM IST,Head scratching decision not to review,1
2024-04-09 07:34:03 PM IST,[deleted],5
2024-04-09 07:34:03 PM IST,What's with all these obvious missed edges both from the umpire and the teams when deciding to review?,1
2024-04-09 07:34:04 PM IST,Just pbks things,1
2024-04-09 07:34:08 PM IST,"The first time this year that the first over hasn't gone for double digits

Moral victory",3
2024-04-09 07:34:13 PM IST,Jitesh is looking cute today,1
2024-04-09 07:34:14 PM IST,"Honestly that's as easy as reviews come by, trust PBKS to have a clown moment",1
2024-04-09 07:34:15 PM IST,Do I need to subscribe on jio cinema to get the insiders? I can't listen to Murli anymore,1
2024-04-09 07:34:16 PM IST,We've seen this script so many times. Travis Head is getting a hundred today,2
2024-04-09 07:34:19 PM IST,"There’s no waaayyyy. Bruhhhh, no way they didn’t review that",3
2024-04-09 07:34:20 PM IST,"Rabada can’t hear shit , just get ur ears checked 


He made others doubt themselves",3
2024-04-09 07:34:21 PM IST,Travis being clueless at the start- we all know what happens next.,5
2024-04-09 07:34:23 PM IST,Please don’t show replays 😭😭😭,3
2024-04-09 07:34:23 PM IST,Why yall criticizing da 1 when rabada refused to review,4
2024-04-09 07:34:26 PM IST,The stadium doesn't even sound that loud. Missed opportunity there for PBKS.,1
2024-04-09 07:34:26 PM IST,"This has become a ritual now, every match head somehow lucks out initially then goes all berserk with that extra life.",4
2024-04-09 07:34:32 PM IST,Twice in an over LOL,1
2024-04-09 07:34:32 PM IST,Ayo Rabbada,2
2024-04-09 07:34:34 PM IST,"Yes, mankading is against the spirit of cricket but batsman can stay shamelessly on the pitch after edging the ball expecting nobody notices or reviews. I just don’t understand the bullshit around cricketing spirit and all.",2
2024-04-09 07:34:35 PM IST,Anyway punjab never qualifies for playoffs so why worry ?,0
2024-04-09 07:34:35 PM IST,That first ball was out,4
2024-04-09 07:34:37 PM IST,Seeing Dhawan's captaincy I'm starting to feel that faf isn't that bad,4
2024-04-09 07:34:39 PM IST,SRH & KKR batting has surprised me this season,4
2024-04-09 07:34:39 PM IST,Hella over,2
2024-04-09 07:34:41 PM IST,Rabada getting insane swing,3
2024-04-09 07:34:47 PM IST,How the fuck do you not review that,7
2024-04-09 07:34:50 PM IST,rishab in dc vs kkr and dhawan here 😭,3
2024-04-09 07:34:53 PM IST,This is what we call Dancing for bowlers tunes in our gully cricket terms.,3
2024-04-09 07:34:58 PM IST,This ipl drs decisions have been abject to say the least,1
2024-04-09 07:34:59 PM IST,Rabada must move to LSG & join the Depressed Faces Club™.,5
2024-04-09 07:34:59 PM IST,"Lmao head played 4 matches so far, and dude threw his wicket 3 times straight in the first over itself. 2 dropped catches, one bad call",9
2024-04-09 07:35:01 PM IST,Im predicting a 20 run over,0
2024-04-09 07:35:06 PM IST,I'm convinced Travis Head is a cat with 9 lives,42
2024-04-09 07:35:11 PM IST,"Arsh va Abhishek, who knows whom better?",1
2024-04-09 07:35:12 PM IST,"Istg head got more chances than anyone ever who played the game. Dropped by Tim, Dropped by Moeen, survived shitty umpiring this match",7
2024-04-09 07:35:19 PM IST,"This looks like it's an SRH home game, all the chairs are bright orange ",3
2024-04-09 07:35:22 PM IST,Jay Shah told the cricketers not to get a first ball wicket for the second match in a row lest it look scripted. Hope this helps 👍,3
2024-04-09 07:35:23 PM IST,why are they called pbks is'nt it just pk?,6
2024-04-09 07:35:25 PM IST,This season atleast Punjab is keeping the team consistent,6
2024-04-09 07:35:29 PM IST,Idk Who is worse captain between Pant  and dhawan,5
2024-04-09 07:35:31 PM IST,Punjab batter vs bowler lessgo,4
2024-04-09 07:35:35 PM IST,Why does Head always seem so clueless at every start?!,8
2024-04-09 07:35:39 PM IST,Imagine Bhuvi on this pitch,2
2024-04-09 07:35:39 PM IST,"what's wrong with the people in this city, they don't want to see Head, Abishek and Klaasen bat",6
2024-04-09 07:35:44 PM IST,We are the meme team!,3
2024-04-09 07:35:45 PM IST,The swing though,4
2024-04-09 07:35:46 PM IST,Bro looks guilty lmao,5
2024-04-09 07:35:48 PM IST,Happy Ugadi people ,3
2024-04-09 07:35:51 PM IST,Oscar level acting from Travis head,16
2024-04-09 07:35:53 PM IST,"In an era where teams are reviewing wides, these guys didn’t review a genuine wicket 🤦‍♂️",9
2024-04-09 07:36:02 PM IST,Shaky Start,2
2024-04-09 07:36:04 PM IST,Punjab doing Punjab things in first over,3
2024-04-09 07:36:04 PM IST,Head's face 😂😂,6
2024-04-09 07:36:06 PM IST,How unprofitable is the Mohali franchise? I can still book the stadium tickets for this match,10
2024-04-09 07:36:06 PM IST,"Lmao, Bairstow was legit begging for a review

Da1 my man goes under the radar for being the worst captain in IPL history just because he is a nice guy",69
2024-04-09 07:36:20 PM IST,head nick the ball and do whatever u want no one will review,8
2024-04-09 07:36:30 PM IST,This pitch isn't looking a road,5
2024-04-09 07:36:31 PM IST,Any reason why Umran not playing in Mullanpur?,4
2024-04-09 07:36:31 PM IST,"Look at the replay, Head looked back and then straight at the umpire with a dead eye look. He knew he edged it.",11
2024-04-09 07:36:35 PM IST,head really has absorbed marnus' luck,22
2024-04-09 07:36:36 PM IST,"pot flowery paltry husky toothbrush humorous cover selective encourage alive

 *This post was mass deleted and anonymized with [Redact](https://redact.dev)*",7
2024-04-09 07:36:40 PM IST,Does anyone know why the stadium is *so* empty?,11
2024-04-09 07:36:44 PM IST,"Jitesh has to be more confident there, going up and then saying you aren't sure after Rabada looks at him is poor wicket-keeping. Helping your team make the right DRS decisions is a massive part of keeping now.",22
2024-04-09 07:36:48 PM IST,Good agility from shikhi,11
2024-04-09 07:36:56 PM IST,"Oscar level performance lmao, he sold rabada on some bs 💀",61
2024-04-09 07:37:11 PM IST,"Head seems more comfortable in an ODI format than in T20s, he’s rushing way too much and it looks ugly. It’s been coming off so can’t complain",6
2024-04-09 07:37:11 PM IST,What happened to my Head 🤦🏼‍♂️😭,11
2024-04-09 07:37:17 PM IST,"Aus Players- ICC Intent merchants

Indian Players- Instagram Content merchants",11
2024-04-09 07:37:22 PM IST,Yeah we are fkd. Ball is swinging like a banana,11
