Timestamp,Comment,Upvotes
2024-04-09 08:36:13 PM IST,a indian uncapped playing good for srh i am so happy after seeing disasterclass from mayank shankar pandey etc,5
2024-04-09 08:36:16 PM IST,"Change the line

Idiot's didn't want Fizz bowling to Russell yesterday

Russell was clueless trying to guess where the next ball was coming


All we do is bowl in the body line which is the easiest to line up a bowler",1
2024-04-09 08:36:21 PM IST,Should be sensible and not lose wickets looking to go big. I'll take 10 runs a over with a couple of 15-20 run overs.,1
2024-04-09 08:36:22 PM IST,I CAN'T TAKE IT ANYMORE GUYS!! FUCK THIS APPLE AD IT MAKES ME SOOO MAD HOLY SHIT,2
2024-04-09 08:36:25 PM IST,Aw fuck,3
2024-04-09 08:36:27 PM IST,It's gone case now,2
2024-04-09 08:36:29 PM IST,not klaasen😭,1
2024-04-09 08:36:29 PM IST,Purple patel is back,3
2024-04-09 08:36:30 PM IST,Noooo,3
2024-04-09 08:36:31 PM IST,Of course harshal has to become prime McGrath against us,3
2024-04-09 08:36:32 PM IST,Purple Patel got him 😭,5
2024-04-09 08:36:34 PM IST,Patel coming in clutch,5
2024-04-09 08:36:35 PM IST,Noooo,2
2024-04-09 08:36:35 PM IST,HOLY SHITTT,6
2024-04-09 08:36:36 PM IST,"""Talk nah, r/Cricket."" Purple probably.",15
2024-04-09 08:36:38 PM IST,harshal badal gaya hai 😐,2
2024-04-09 08:36:38 PM IST,Game changing,3
2024-04-09 08:36:38 PM IST,Imagine losing to punjab,15
2024-04-09 08:36:40 PM IST,Damn jinxed it.,4
2024-04-09 08:36:41 PM IST,wtf klassen,6
2024-04-09 08:36:42 PM IST,Comparing Klassen with ABD is like comparing Mushfiqur Rahim with Sangakkara,8
2024-04-09 08:36:42 PM IST,Love Curran’s energy,10
2024-04-09 08:36:43 PM IST,What the fuck did i just see,9
2024-04-09 08:36:45 PM IST,Fuck purple ,6
2024-04-09 08:36:46 PM IST,r/cricket in shambles,11
2024-04-09 08:36:47 PM IST,"**13.1** **Harshal gets the big fish, and this is a huge moment in the game!**

Heinrich Klaasen c Curran b Patel 9 (9b 1x4 0x6) SR: 100",3
2024-04-09 08:36:50 PM IST,Harshel taking the wkt of klassen wtf,7
2024-04-09 08:36:51 PM IST,Man Curran is charged up this match. I wonder why,8
2024-04-09 08:36:51 PM IST,GONE!!!!!!!!,1
2024-04-09 08:36:51 PM IST,Aw come on!! Where 100?,1
2024-04-09 08:36:52 PM IST,Welp there goes the match,1
2024-04-09 08:36:53 PM IST,This is not our purple patel,6
2024-04-09 08:36:54 PM IST,Random question but is Ambani Rayudu still playing in the IPl,2
2024-04-09 08:36:59 PM IST,"Sky failed on Sunday, Kingku failed yesterday and now Klassen fails",6
2024-04-09 08:36:59 PM IST,Curran acting like 2014 Kohli,7
2024-04-09 08:36:59 PM IST,klaasen what u done 😭😭,5
2024-04-09 08:36:59 PM IST,Harshal of all people??? Lmao,3
2024-04-09 08:37:00 PM IST,Purple Patel bacc?,2
2024-04-09 08:37:00 PM IST,![img](emote|t5_2qhe0|8780),2
2024-04-09 08:37:03 PM IST,we are fucked,3
2024-04-09 08:37:03 PM IST,Purple Patel is purpling,1
2024-04-09 08:37:04 PM IST,"See, Harshal is pure magic in the middle overs

One of the best

Just don't use him in death, he's awful",3
2024-04-09 08:37:04 PM IST,mcgrath patel,2
2024-04-09 08:37:05 PM IST,Imagine giving wickets to purple Patel,1
2024-04-09 08:37:05 PM IST,I don't recognize this team right now,3
2024-04-09 08:37:06 PM IST,where is the harshal patel apology letter,2
2024-04-09 08:37:06 PM IST,"Deshpande got Rinku and Russell

Harshal got Klassen

Wtf is happening",10
2024-04-09 08:37:07 PM IST,"The Big Fish?

Fish and Chips for you 🐟🍟",3
2024-04-09 08:37:11 PM IST,Klassen is so washed.,4
2024-04-09 08:37:11 PM IST,Srh goose is truly cooked here,2
2024-04-09 08:37:12 PM IST,it's so over,1
2024-04-09 08:37:13 PM IST,Midas touch powerup for PBKS today,3
2024-04-09 08:37:14 PM IST,It's gone for srh.,3
2024-04-09 08:37:15 PM IST,Please man just keep bowling him in the middle overs,3
2024-04-09 08:37:18 PM IST,Yessss 🥳🥳,1
2024-04-09 08:37:18 PM IST,![img](emote|t5_2qhe0|8774),5
2024-04-09 08:37:19 PM IST,"Holy SHIT. 
Cool Klassen loses his mind for a nano second and gives his wicket to Purple Patel. 
This is fuckin UNBELIEVABLE",3
2024-04-09 08:37:21 PM IST,Dang. Nitish Klassen is here atleast,2
2024-04-09 08:37:22 PM IST,Punjab is the most volatile team ever lmao,4
2024-04-09 08:37:22 PM IST,Purple Patel is not playing for the opponent. I repeat that Purple Patel isn't playing for the team that is batting.,3
2024-04-09 08:37:23 PM IST,RCB let go of Purple Patel….. whyyyyyyyyy,0
2024-04-09 08:37:23 PM IST,Does anyone know abt the incident when Pretty Zinta abused Sanjay Bhangar ??,1
2024-04-09 08:37:24 PM IST,Why is every SRH batter playing it’s practice match,2
2024-04-09 08:37:25 PM IST,Nathan Ellis is just happy to be there with drinks and towels.,3
2024-04-09 08:37:26 PM IST,Srh gone.....,2
2024-04-09 08:37:26 PM IST,Purple supremacy,2
2024-04-09 08:37:27 PM IST,Patel wth,2
2024-04-09 08:37:29 PM IST,Get your purple apology forms ready,2
2024-04-09 08:37:30 PM IST,All hopes on nitish now lol,2
2024-04-09 08:37:31 PM IST,Well we're not shilling anymore... Cummins 22 ball 50 maybe?,2
2024-04-09 08:37:33 PM IST,Purple Patel has taken 2 wickets at an economy of 3. WC 2024 seat confirm?,5
2024-04-09 08:37:34 PM IST,130 back on cards,2
2024-04-09 08:37:34 PM IST,Priety appreciation,2
2024-04-09 08:37:35 PM IST,yeah that's the first time ever klaasen gets out on single digit.,2
2024-04-09 08:37:37 PM IST,Purple Patel the Messiah is here.,1
2024-04-09 08:37:38 PM IST,Where are those guys who were saying Klaasen would bash Harshal?,4
2024-04-09 08:37:39 PM IST,"Apart from Nitish, every SRH batter sucked today. Need to get the man to ensure low total.",3
2024-04-09 08:37:39 PM IST,Nitish is our man today guys. He’ll get that sweet 80 today,2
2024-04-09 08:37:39 PM IST,bro off-spinner bro,1
2024-04-09 08:37:39 PM IST,Hate it when these fast spinners get wickets instead of folks like Rabada whose edges fly away to boundaries,0
2024-04-09 08:37:40 PM IST,I'm more happy about Sam being hyped af,4
2024-04-09 08:37:40 PM IST,Sam is Coked up today,3
2024-04-09 08:37:42 PM IST,[removed],1
2024-04-09 08:37:43 PM IST,next auction purple 10cr✅,6
2024-04-09 08:37:44 PM IST,I knew Harshal was the man when he bowled 6 full tosses in a row in the death 2 matches ago,4
2024-04-09 08:37:46 PM IST,"bruh imagine if they reviewed head, first ball wicket + collapse would've been golden for PBKS today",5
2024-04-09 08:37:46 PM IST,Purple patel strikes,3
2024-04-09 08:37:46 PM IST,Wtf purple.. what is this..,3
2024-04-09 08:37:47 PM IST,That's what you get when he bowls in the middle overs and not the death overs.,5
2024-04-09 08:37:47 PM IST,Ok PBKS winning this plus boosting mad NRR,5
2024-04-09 08:37:47 PM IST,Lord Harshal wtf,3
2024-04-09 08:37:50 PM IST,"https://www.reddit.com/r/Cricket/s/WhIYsydyVr

So replica of yesterday's match",1
2024-04-09 08:37:51 PM IST,Nitish should just farm strike no talent from samad needed,2
2024-04-09 08:37:55 PM IST,Fraud player is here,3
2024-04-09 08:37:55 PM IST,Wtf happened to purple?,3
2024-04-09 08:37:56 PM IST,what the fuck patel,2
2024-04-09 08:37:57 PM IST,Samad finally got an opportunity to give back to the team,3
2024-04-09 08:37:57 PM IST,Punjab loves making names out of random uncapped Indian players against them.,4
2024-04-09 08:37:58 PM IST,"Ah come on Klaasen. You were meant to destroy them. 

Cumdawg: fine I’ll do it myself",3
2024-04-09 08:37:58 PM IST,Bro Samad for once in your life play a game changing innings like 19 ball 53 or something like that.,7
2024-04-09 08:37:58 PM IST,"Our trump card is gone, turned to ashes",2
2024-04-09 08:37:59 PM IST,Klassan giving wicket to Harshal to make selectors get him for T20 wc to ruin India's chances. Genius!,4
2024-04-09 08:38:00 PM IST,Average player after leaving RCB,4
2024-04-09 08:38:02 PM IST,"Purple Patel 🤝 Deshpande

Apology forms go brrrrrrrrrr",5
2024-04-09 08:38:03 PM IST,Nitish and Samad gonna repay SRH 🙌,8
2024-04-09 08:38:05 PM IST,PURPLE PATEL!!!,4
2024-04-09 08:38:08 PM IST,Klaasen is Gone-Son,3
2024-04-09 08:38:10 PM IST,If we somehow win this game through samad and Nitish batting and solid bowling performance that'll be a massive confidence boost because all our foreign batsmen failed,7
2024-04-09 08:38:10 PM IST,Get Arshdeep back in the attack,1
2024-04-09 08:38:11 PM IST,Purple Patel with economy of 2. What a day to be alive.,4
2024-04-09 08:38:12 PM IST,"Nah, should've brought him in when spin was about to come on. Sent in Tripathi and wasted the impact sub as well as a good Klassen score. This game is Punjab's",2
2024-04-09 08:38:13 PM IST,"What the hell happened to Rahul Tripathi?? 

He was once my one of the fav players. He had all the strokes and would play freely. But now, he is a liability for the team.",1
2024-04-09 08:38:13 PM IST,Wait I didn't want the ginger man to get out?,1
2024-04-09 08:38:20 PM IST,Purple patel officially out of orange cup,2
2024-04-09 08:38:21 PM IST,Where did this Harshal come from 🤡😱😱😭,3
2024-04-09 08:38:23 PM IST,"rinku, russell and klassesn can't play in middle overs, they can only tonkk, that's what i understood",6
2024-04-09 08:38:29 PM IST,Samad,1
2024-04-09 08:38:30 PM IST,"Ah right, we have samad and sahbaz ..",3
2024-04-09 08:38:30 PM IST,Just needed a bit more power Klassenbhai,1
2024-04-09 08:38:34 PM IST,Cumdawg is going to gun for a 26 runs over,2
2024-04-09 08:38:36 PM IST,First time Klassen got out for single digit for SRH.,7
2024-04-09 08:38:43 PM IST,Fuck this im done it's gonna be another one of s dhawan 78(60) winning masterclass,8
2024-04-09 08:38:46 PM IST,just need to score 10 an over. No hurry,5
2024-04-09 08:38:47 PM IST,"For once in your career, please don’t shit the bed Samad",5
2024-04-09 08:38:47 PM IST,Yall not ready to sign Abdul Samad apology form,1
2024-04-09 08:38:53 PM IST,Waiting for Cummins' 50,2
2024-04-09 08:38:56 PM IST,im sure its not related but i get a migraine whenever samad comes out to bat,5
2024-04-09 08:38:57 PM IST,This is what would have happened to RCB if there was no Virat,8
2024-04-09 08:39:00 PM IST,"Ass Ahh Haitch


- Micheal Clarke trying to say SRH",8
2024-04-09 08:39:01 PM IST,Imagine trusting Tripathi over a club legend and veteran like Samad. PBKS need to respect their legends a bit.more,3
2024-04-09 08:39:02 PM IST,Sam Curran is turning into one of my fav players on team. Don’t know what type of crack he’s on today but love his passion,14
2024-04-09 08:39:02 PM IST,Harshal woke up and chose performance.,6
2024-04-09 08:39:05 PM IST,"Don't worry, it'll pass. Our patel will come back",4
2024-04-09 08:39:08 PM IST,good game awareness from Nitish,3
2024-04-09 08:39:10 PM IST,Intent merchants getting exposed on non-flat tracks,18
2024-04-09 08:39:23 PM IST,SRH Legend Abdul Samad is here!,5
2024-04-09 08:39:27 PM IST,Why Sammy acting as if he just won the World Cup?,4
2024-04-09 08:39:29 PM IST,SRH pranking rest of the the franchises letting Purple Patel get away with these figures,10
2024-04-09 08:39:31 PM IST,Samad time to shine,5
2024-04-09 08:39:38 PM IST,Klaasen was Duckett in disguise 🥷🏿,2
2024-04-09 08:39:40 PM IST,Smash them samad,6
2024-04-09 08:39:43 PM IST,I never blamed my parents for not supporting me to become a cricketer till I saw Preity Zinta hugging players in IPL,8
2024-04-09 08:39:44 PM IST,Who was the last Telugu player to score 40+ for SRH!?,8
2024-04-09 08:39:47 PM IST,RCB to get Harshal Patel again in mega auction🤡,5
2024-04-09 08:39:48 PM IST,Keep your apology form ready guys,4
2024-04-09 08:39:51 PM IST,"Intent merchants crying from two days.

Same will happen in T20 worldcup",16
2024-04-09 08:39:57 PM IST,🎶orange army 🎶,3
2024-04-09 08:40:01 PM IST,dawg who skinchanged into harshal,2
2024-04-09 08:40:03 PM IST,"Kkr missed a trick could have gone for cumdog instead of Starc 

Then made him captain so playing shreyas would have been optional 

Now we are stuck",7
2024-04-09 08:40:05 PM IST,Under cumdawg we never stop attacking.. love this approach. Doesn’t matter if we lose,20
2024-04-09 08:40:09 PM IST,today srh is goes for atmanirbhar,31
2024-04-09 08:40:12 PM IST,What a shot,12
2024-04-09 08:40:13 PM IST,Samad redemption arc is going crazy,11
2024-04-09 08:40:19 PM IST,"Oh nvm they still have Cummins to bat, becomes a Bradman at clutch",11
2024-04-09 08:40:25 PM IST,Holy shit samad redemption arc,6
2024-04-09 08:40:26 PM IST,Real Harshal is back on the menu bois,7
2024-04-09 08:40:29 PM IST,Here is our harahel,3
2024-04-09 08:40:31 PM IST,There he goes! My goat Harshal is back at it again!,5
2024-04-09 08:40:35 PM IST,"Classic Punjab 

Dominate early on 

Get shat on by Abdul Samad",11
2024-04-09 08:40:36 PM IST,samad damn,4
2024-04-09 08:40:37 PM IST,"Never in my life will I not enjoy Travis Head getting out, until the day he retires",2
2024-04-09 08:40:39 PM IST,One good thing about this innings they are not playing safe even with wickets falling,6
2024-04-09 08:40:39 PM IST,Samad,3
2024-04-09 08:40:40 PM IST,"If SRH can score 200 here, I’m fairly confident that PBKS will have to score more than 200 to win",11
2024-04-09 08:40:43 PM IST,after watching yesterday's match. this Punjab crowd is dead af . Sam Currun was shouting like a 🤡 to the most boring crowd.,3
2024-04-09 08:40:50 PM IST,"Parag, samad!?",3
2024-04-09 08:40:51 PM IST,I thought the rapture was over but no.,1
2024-04-09 08:40:57 PM IST,what is cummins' secret? how does he look so good?,4
2024-04-09 08:41:00 PM IST,60 more off 6 overs,7
2024-04-09 08:41:09 PM IST,"“Whipped away, whipped away with such style and grace” - shot reminded me of Koach vs Australia in 2016 T20 WC.",3
2024-04-09 08:41:11 PM IST,samad not being brainless? bro this new year is some real shit,10
2024-04-09 08:41:12 PM IST,aaaahh same old purple patel. crumbling under pressure,4
2024-04-09 08:41:13 PM IST,He is doing well,3
2024-04-09 08:41:14 PM IST,They should have used Washington instead of Tripathi as Impact player. Iam sure he couldn't do much worse than Tripathiji and he would have also contributed with ball.,7
2024-04-09 08:41:14 PM IST,We still got Shahbaaz and Cummins to bat,9
2024-04-09 08:41:22 PM IST,To send Rahul Tripathi ahead of Samad and Klaasen looks like a bad decision. They could’ve gotten Markande in second innings if they hadn’t done that,7
2024-04-09 08:41:23 PM IST,"We have seen Parag beat the meme player accusations, now is Samads turn hopefully",1
2024-04-09 08:41:29 PM IST,pbks isn't prepared for patty's 50(14),5
2024-04-09 08:41:29 PM IST,People are so fucking quick to hate Indian players. He just got Klaasen out and had gone for 6 off 2 overs. Maybe take some steam off?,7
2024-04-09 08:41:30 PM IST,we are 5 wickets down there's shahbaz and cummins still [left.so](http://left.so) yes. our batting definitely end after klassen.,1
2024-04-09 08:41:32 PM IST,"If SRH win this. They’re deffos the strongest batting lineup out there, KKR couldn’t survive the collapse let’s see SRH",8
2024-04-09 08:41:36 PM IST,"Oh lol, SHarjahl Patel is back",3
2024-04-09 08:41:38 PM IST,still good! 2-17 in 3 overs 👏🏽,3
2024-04-09 08:41:39 PM IST,"Having cumdawg and Shahbaz, hoping for 200",5
2024-04-09 08:41:43 PM IST,"Indian core stepping up after the international batsmen collapsed for srh, am I dreaming is this real life",7
2024-04-09 08:41:46 PM IST,"Please bowl out Harshal

Please don't use him in the death",5
2024-04-09 08:41:58 PM IST,They are still 111 in 14 overs though. Id they had a good finish they could easily reach 170-180,2
2024-04-09 08:42:01 PM IST,"Indian core stepping up after the international batsmen collapsed for srh, am I dreaming is this real life",3
2024-04-09 08:42:02 PM IST,I reallyy thought we lost purple for a min there,5
2024-04-09 08:42:03 PM IST,Run rate is still good. Key is NKR now. If he stays till the end PBKS might regretti spaghetti,5
2024-04-09 08:42:07 PM IST,make in india is working for srh modiji proud😌,3
2024-04-09 08:42:07 PM IST,"The youngsters are firing on all cylinders for SRH    


Good job guys they are coming along well for the India team in a couple years",2
2024-04-09 08:42:13 PM IST,Will we get to 150 even,1
2024-04-09 08:42:13 PM IST,"NK Reddy should be dropped, how dare he play with such a low SR in a modern T20 game.

There's no place for anchors in a T20 game😡.

Throw your wicket and go away if you can't accelerate 😡",3
2024-04-09 08:42:13 PM IST,180 is definitely on the cards for seh,1
2024-04-09 08:42:14 PM IST,Cummings says only two words in the team meetings - Intent and Attack.,2
2024-04-09 08:42:20 PM IST,"I think the reason Cummins doesn't promote himself up is that he doesn't want to attract undue controversy, as foreign IPL captains often do. Either that or he doesn't rate his own batting at all.",2
2024-04-09 08:42:31 PM IST,"This shall too pass 

Not to worry about Harshal’s form guys, our patel will be back next game.",4
2024-04-09 08:42:31 PM IST,smash this fraud..please guys..,-1
2024-04-09 08:42:32 PM IST,"Riyan’s ability to play the middle overs makes him so much better than rinku singh and this sub will downvote me for this take. (based on how rinku, russell and klaasen got out in their last game)",7
2024-04-09 08:42:36 PM IST,Chatur Ramalingam (Silencer) yet to bat....,3
2024-04-09 08:42:36 PM IST,Brar wouldn’t perform if its not rcb,2
2024-04-09 08:42:45 PM IST,Should reach 175 no?,1
2024-04-09 08:42:45 PM IST,Nitish you deserve a 50. Don't throw away your wicket.,8
2024-04-09 08:42:50 PM IST,Nitish looks really solid ,3
2024-04-09 08:42:52 PM IST,SRH be a bowling team and defend the small total,5
2024-04-09 08:42:56 PM IST,there is a case to be made that Punjab Kings are the true GOATs of IPL. They meme no matter what. That is what the IPL's for.,1
2024-04-09 08:42:56 PM IST,He is playing the  reverse sweep so well,8
2024-04-09 08:42:59 PM IST,Styled him 🥶,6
2024-04-09 08:43:01 PM IST,Srh vs pbks rivalry of mid table scrappers is truly unmatched in ipl,2
2024-04-09 08:43:03 PM IST,Damn that fan was losing his shit 💀,3
2024-04-09 08:43:05 PM IST,Audacious!,5
2024-04-09 08:43:07 PM IST,Brave from Nitish,5
2024-04-09 08:43:07 PM IST,Bruh 💀,3
2024-04-09 08:43:05 PM IST,Nitish 5 wickets are down 😭😭,7
2024-04-09 08:43:08 PM IST,"Alright ill tell you guys the secret

Today's batting was pre planned by srh batsman as a test for our bowling.

If the srh bowlers don't perform today, all batsman get to beat the shit out of the bowlers",3
2024-04-09 08:43:11 PM IST,always these random indian players stepping up,8
2024-04-09 08:43:12 PM IST,Indian Maxwell,9
2024-04-09 08:43:12 PM IST,Markam bitch learn something,10
2024-04-09 08:43:16 PM IST,Lessss gooo,3
2024-04-09 08:43:19 PM IST,These reverse sweep is gonna give me ptsd,7
2024-04-09 08:43:19 PM IST,WHAT A SHOT,4
2024-04-09 08:43:21 PM IST,nkr you beauty !!!,8
2024-04-09 08:43:22 PM IST,maxwell reddy,8
2024-04-09 08:43:23 PM IST,Holy man he did a good reverse sweep?,13
2024-04-09 08:43:26 PM IST,It's really nice to see telugu guys in srh,10
2024-04-09 08:43:27 PM IST,MILKKK.,5
2024-04-09 08:43:27 PM IST,Holly,7
2024-04-09 08:43:33 PM IST,"Holy fuck what a shot, you got yourself a new fan sire",16
2024-04-09 08:43:37 PM IST,Right. NKR is going to get retained/ bought back for next season,5
2024-04-09 08:43:40 PM IST,"Cummins edging fans by coming in at the last moment...

Is Cummins a thalasson or the new thala???",8
2024-04-09 08:43:40 PM IST,I know this is going to jinx him but nitish has activated BEAST MODE,4
2024-04-09 08:43:41 PM IST,wut!? that was a full toss???,6
2024-04-09 08:43:44 PM IST,"Nitish so good, I took my car to the mechanic to replace the clutch with Nitish",3
2024-04-09 08:43:44 PM IST,So Klassen cannot perform on bowling pitches?,4
2024-04-09 08:43:45 PM IST, PBKS losing the plot like they did against RCB.,2
2024-04-09 08:43:47 PM IST,Fuck me in the ass and call me a little bitch if it ain’t Punjab throwing again,5
2024-04-09 08:43:47 PM IST,"Nitish tonks Brar in previous over

Dhawan: *again!*",5
2024-04-09 08:43:48 PM IST,NKR u beauty,2
2024-04-09 08:43:48 PM IST,learn RCB,2
2024-04-09 08:43:49 PM IST,Reddy doing it easy.,4
2024-04-09 08:43:49 PM IST,Why is this star sports hindi commentator forcefully speaking hindi ...,1
2024-04-09 08:43:49 PM IST,so good to see young Indian talent rescuing the team,2
2024-04-09 08:43:50 PM IST,Gg nitish,1
2024-04-09 08:43:51 PM IST,What ra Sudeep,5
2024-04-09 08:43:51 PM IST,make in andhra product nkr 💪,5
2024-04-09 08:43:52 PM IST,Such a good innings this from Nitish,3
2024-04-09 08:43:52 PM IST,Reddy you just got a new fan,7
2024-04-09 08:43:54 PM IST,Damn what a shot,5
2024-04-09 08:43:55 PM IST,This is my goat....,4
2024-04-09 08:43:56 PM IST,Great innings,4
2024-04-09 08:43:57 PM IST,Bro is owning Brar,4
2024-04-09 08:43:58 PM IST,RCB look another team found an interesting local talent u witless capitalist mfs,4
2024-04-09 08:43:59 PM IST,The maturity has been the best aspect of his knock tonight,4
2024-04-09 08:43:59 PM IST,I thinkk Brar and purple change roles today.,3
2024-04-09 08:44:00 PM IST,Srh is actually ahead in this game,6
2024-04-09 08:44:00 PM IST,He's just 20 damn,6
2024-04-09 08:44:01 PM IST,I am fairly certain that visiting team is fed something to make them drowsy.. nitish is fasting..,3
2024-04-09 08:44:02 PM IST,"A full ball, and then a full toss. A half tracker incoming",5
2024-04-09 08:44:04 PM IST,Nitish anna is in some form![img](emote|t5_2qhe0|8783),6
2024-04-09 08:44:04 PM IST,"This ain't bowling pitch.

Yesterday's pitch was tough for batters",2
2024-04-09 08:44:05 PM IST,Thank you Reddy for saving our aaasshh,3
2024-04-09 08:44:06 PM IST,Finally found a dude who can smack Brar 😱,5
2024-04-09 08:44:07 PM IST,"Rinku’s ability to play the middle overs makes him so much better than Riyan Parag and this sub will downvote me for this take. (based on how Riyan, russell and klaasen got out in their last game)",7
2024-04-09 08:44:10 PM IST,"NKR has the right mindset for this type of a game. 

Since you all are suggesting the likes of Khaleel and Dube for WT20, I’ll throw my hat in with Nitish !",8
2024-04-09 08:44:12 PM IST,Rare Shashank L?,2
2024-04-09 08:44:13 PM IST,Maa Telugu bidda Nitish🔥,10
2024-04-09 08:44:13 PM IST,Telugodi debba,7
2024-04-09 08:44:14 PM IST,"Lord taketh, lord giveth",7
2024-04-09 08:44:16 PM IST,Bruh,4
2024-04-09 08:44:16 PM IST,SRH agent,12
2024-04-09 08:44:17 PM IST,"We expected this inning from Iyer yesterday but man is so washed in T20
;(",3
2024-04-09 08:44:17 PM IST,Shashank unredemption,9
2024-04-09 08:44:19 PM IST,the other shashank would have caught it,12
2024-04-09 08:44:21 PM IST, Oh man💀,2
2024-04-09 08:44:21 PM IST,"This Nitish dude will be 100% retained. He is special coz he can bat, bowls medium pace and a good fielder.",7
2024-04-09 08:44:22 PM IST,Shashank Singh tribute to his former team. What a gentleman,10
2024-04-09 08:44:23 PM IST,Shashank still got that srh in him,6
2024-04-09 08:44:25 PM IST,Undercover srh agent,6
2024-04-09 08:44:25 PM IST,SRH agent Shashank Singh,7
2024-04-09 08:44:25 PM IST,Shashank Singh,4
2024-04-09 08:44:27 PM IST,There actually needs to be a Shashank redemption in the 2nd innings now,7
2024-04-09 08:44:29 PM IST,Get in NKR,3
2024-04-09 08:44:30 PM IST,shashank now counting how many runs he gotta make extra,4
2024-04-09 08:44:31 PM IST,reddy anna showing too much coc,5
2024-04-09 08:44:32 PM IST,"Shabaz, Markram, Raghuvanshi got out to reverse sweep this week. Finally Nitish got it right 😎",2
2024-04-09 08:44:33 PM IST,Shashank Redemption.....,3
2024-04-09 08:44:34 PM IST,Thank you Shashank,5
2024-04-09 08:44:35 PM IST,srh agent shawshank 👌,5
2024-04-09 08:44:35 PM IST,"Cummins to Tripathi: You have a really aggressive role next game onwards...

...you will aggressively carry drinks and gear",6
2024-04-09 08:44:39 PM IST,dropped the match...,1
2024-04-09 08:44:41 PM IST,This body language by an Indian uncapped player also shows good environment setup by Cummins and vettori,5
2024-04-09 08:44:41 PM IST,Telugu commentary is the real shiiii..,9
2024-04-09 08:44:42 PM IST,Impressive knock. Seems more like a veteran batter than a youngster.,13
2024-04-09 08:44:42 PM IST,Punjab punjabing,3
2024-04-09 08:44:45 PM IST,Shawshank Redemption when you play it backwards,3
2024-04-09 08:44:46 PM IST,Fake Shashank,2
2024-04-09 08:44:46 PM IST,Woow just woooow,2
2024-04-09 08:44:46 PM IST,Based on previous threads this innings b NKR is shit with only a >170 sr,2
2024-04-09 08:44:47 PM IST,Bro wtf 💀💀💀💀,2
2024-04-09 08:44:47 PM IST,"Fortune favors the bold and you've been plenty brave today Nitish.

Mighty fine inning",4
2024-04-09 08:44:48 PM IST,If nitish can bowl well too.....,2
2024-04-09 08:44:48 PM IST,SRH blood Shashank Singh 😎,7
2024-04-09 08:44:48 PM IST,PBKS IS BACK!,9
2024-04-09 08:44:51 PM IST,NKR the mann. Let's fucking goooo,6
2024-04-09 08:44:51 PM IST,dropped the ipl cup,4
2024-04-09 08:44:51 PM IST,Scriptwriters have added one dropped catch of every imp player this season,4
2024-04-09 08:44:51 PM IST,Reddyyyy🔥🔥🔥🔥,4
2024-04-09 08:44:54 PM IST,PBKS agent Markram 🫂 SRH agent Shashank,5
2024-04-09 08:44:55 PM IST,Holy fuck,6
2024-04-09 08:44:56 PM IST,Yeah fuckk that ball,3
2024-04-09 08:44:58 PM IST,Brar is getting brutalised here,1
2024-04-09 08:44:58 PM IST,"Bowling pies: I sleep     
Hitting pies: I sleep    
Eating pies: REAL SHIT",2
2024-04-09 08:44:59 PM IST,The real shashank singh would have caught it,2
2024-04-09 08:44:59 PM IST,Is this the Reddy Anna from Malleshwam area?,4
2024-04-09 08:44:59 PM IST,Please nkr calm to nerves for an over,1
2024-04-09 08:45:00 PM IST,Dubey in SRH how??,4
2024-04-09 08:45:00 PM IST,They are almost on 9 rr,2
2024-04-09 08:45:00 PM IST,Too bad for SRH that mega auction is in the next when finally they have a few good  Indian batters,3
2024-04-09 08:45:00 PM IST,Brar getting fucked.,5
2024-04-09 08:45:00 PM IST,This is the brar i knew,7
