Timestamp,Comment,Upvotes
2024-04-09 10:46:09 PM IST,Why Nitish again bruh 😭,3
2024-04-09 10:46:16 PM IST,Make or break over this,1
2024-04-09 10:46:17 PM IST,This could be game deciding.,1
2024-04-09 10:46:20 PM IST,they need at least 3 boundaries per over.. they should better start hitting every ball or this game is over,1
2024-04-09 10:46:21 PM IST,Fuck the apple ad it’s so annoying,1
2024-04-09 10:46:26 PM IST,Will Jitesh deliver today ? Crucial for booking his slot in ICT as the WK-Lower Order Slogger.,1
2024-04-09 10:46:27 PM IST,Big over,1
2024-04-09 10:46:36 PM IST,Man hope we see more bowler captains. Bumrah would have been cool to see in MI.,3
2024-04-09 10:46:38 PM IST,This is gonna end bad for SRH,1
2024-04-09 10:46:38 PM IST,"Honestly the first game makes a huge difference. Past 2 seasons we were absolutely thrashed by RR to the point of humiliation. Makes the entire season's morale go down.

We lost the first game this year as well but it was super close.",4
2024-04-09 10:46:41 PM IST,Come on yaar,3
2024-04-09 10:46:44 PM IST,THEY WILL GO AFTER THE POOR NKR NOW,8
2024-04-09 10:46:45 PM IST,Dhawan lost us this game with pathetic batting and putting the pressure on our other batters which led to 2 wickets and them him getting out to the most braid dead shit,6
2024-04-09 10:46:51 PM IST,Come on Jitesh. Give something for Selectors to select you for the wc,2
2024-04-09 10:46:55 PM IST,would you forgive nitish if he gives the match away now,3
2024-04-09 10:46:56 PM IST,Natt-out,3
2024-04-09 10:46:58 PM IST,Punjabi kavya😮,7
2024-04-09 10:46:58 PM IST,Why,4
2024-04-09 10:46:59 PM IST,Nattu has always been such unreliable fielder.,4
2024-04-09 10:47:00 PM IST,Wtf he deserved a wicket,7
2024-04-09 10:47:04 PM IST,noooooooo,3
2024-04-09 10:47:05 PM IST,Punjabi kavya maran,7
2024-04-09 10:47:05 PM IST,Wait fake kavya,8
2024-04-09 10:47:06 PM IST,Ohhh Nattu oh oh nattu boy...,7
2024-04-09 10:47:08 PM IST,NKR is robbed of a wicket there.,6
2024-04-09 10:47:08 PM IST,KLAASEN WAS LITERALLY 3 METRES AWAY,3
2024-04-09 10:47:10 PM IST,"puzzled hobbies juggle friendly sharp tap cough towering paint flag

 *This post was mass deleted and anonymized with [Redact](https://redact.dev)*",3
2024-04-09 10:47:11 PM IST,When is Natarjan going to be binned?,1
2024-04-09 10:47:13 PM IST,Trademark Jitesh shot throwing his wkt away but Natarajan oh my what a drop,4
2024-04-09 10:47:13 PM IST,What have you done nattu,2
2024-04-09 10:47:14 PM IST,Nattu wtf man,3
2024-04-09 10:47:16 PM IST,"What the fuck Nattu, stop denying NKR his wicket bois",8
2024-04-09 10:47:16 PM IST,nattu u foken idiot,9
2024-04-09 10:47:17 PM IST,Village cricket,9
2024-04-09 10:47:23 PM IST,Man fielding has been horrible from srh,11
2024-04-09 10:47:24 PM IST,Nattu has never been even a good fielder. Average at best.,7
2024-04-09 10:47:25 PM IST,That is pathetic catching,2
2024-04-09 10:47:26 PM IST,easy peasy😭,3
2024-04-09 10:47:28 PM IST,Robbed Nitish of a dream match,7
2024-04-09 10:47:30 PM IST,Very good word play from Isa “the sun has to set”,2
2024-04-09 10:47:30 PM IST,Natarajan what a 🤡! Drop him from the squad from the next game,5
2024-04-09 10:47:30 PM IST,Peak captaincy. Clownery fielding. Poor Nitish man😭,11
2024-04-09 10:47:31 PM IST,nut rajan,3
2024-04-09 10:47:36 PM IST,WHO IS SNEEZING,2
2024-04-09 10:47:39 PM IST,All the wicketkeepers are shit no one deserves to be selected for the wc,1
2024-04-09 10:47:40 PM IST,"Wow kavya Maran lookalike supporting pbks 

Good tactics Preity to bewider srh fans but your batsmen are shit",8
2024-04-09 10:47:45 PM IST,"i am convinced the gods of luck absolutely LOATHE nitish, last year too faf was dropped iirc",10
2024-04-09 10:47:48 PM IST,If NKR gets 1 wkt even at ER of 12 he’s POTM,6
2024-04-09 10:47:56 PM IST,Fark me. Why you drop those.,2
2024-04-09 10:47:56 PM IST,Interesting to see Cummins back Reddy,2
2024-04-09 10:47:56 PM IST,SRH so stacked that team cant even fit macro and farooqi into the 12. (Includes impact player),5
2024-04-09 10:47:59 PM IST,"Petition to make Punjab's match threads punjab and their opponent's fans only

Because these fuckheads who support teams from outside their region and hero worship should god damn stay away and can't stop saying same shit

Also applies to Delhi's match thread",5
2024-04-09 10:48:03 PM IST,"What fucking horseshit fielding has this game been? Again, even if we somehow win, our NRR will not take a big boost thanks to all this shit.",2
2024-04-09 10:48:05 PM IST,nut rajan over ran,6
2024-04-09 10:48:10 PM IST,Trevor Bayliss has the most perfect set of Yellow Teeth that I have ever seen,2
2024-04-09 10:48:12 PM IST,This is what happens when you drop a catch dawg,5
2024-04-09 10:48:12 PM IST,I’d be a very angry man if I supported a team that fielded poorly. Dropped catches like that are just unacceptable,8
2024-04-09 10:48:14 PM IST,Game over for SRH.,4
2024-04-09 10:48:15 PM IST,you can never be cool if you can't catch,5
2024-04-09 10:48:15 PM IST,Fuck,7
2024-04-09 10:48:17 PM IST,"I don't think SRH has to worry, chill guys.",3
2024-04-09 10:48:22 PM IST,Catch drop and his rhythm is disturbed. Why did you have to do this team,5
2024-04-09 10:48:23 PM IST,I was super confused on why Kavya was cheering,3
2024-04-09 10:48:27 PM IST,Shot. Jitesh needs to convert this,1
2024-04-09 10:48:31 PM IST,if we lose today its all because of nattu battu,5
2024-04-09 10:48:32 PM IST, Who tf sneezing in com box and jinxing this shit,5
2024-04-09 10:48:34 PM IST,What happened to SRH's fielding today?,8
2024-04-09 10:48:37 PM IST, NKR is undoing all the good work he did with the bat.,1
2024-04-09 10:48:38 PM IST,No,1
2024-04-09 10:48:39 PM IST,Jitesh or Jurel  ?,1
2024-04-09 10:48:40 PM IST,"NKR has contributed well with the bat, but this is not it.",5
2024-04-09 10:48:41 PM IST,Relax guys Punjab doesn't want to leave their 6th spot,4
2024-04-09 10:48:44 PM IST,Goneee,2
2024-04-09 10:48:44 PM IST,As a ICt online selector. I am quite impressed by jitesh,1
2024-04-09 10:48:44 PM IST,COME ON NITISH DON'T GIVE UP,9
2024-04-09 10:48:45 PM IST,Finally got a wicket,8
2024-04-09 10:48:47 PM IST,"Jitesh, jurel, porel, ishan are not ready for world cups. Its either pant or rahul",10
2024-04-09 10:48:49 PM IST,Nattu can breathe now 😭😂,12
2024-04-09 10:48:50 PM IST,ABHISHEKKKK,11
2024-04-09 10:48:51 PM IST,Nice,5
2024-04-09 10:48:52 PM IST,"Ipl needs relegation system…

There is no incentive for teams like delhi and punjab to improve… continue to be shit for decades… and keep hiking team valuation yoy… because of whole ipl..


Because these owners were at right place in right time… they can forever run these teams on auto crash mode",22
2024-04-09 10:48:53 PM IST,Man of the match sealed for NKR.,10
2024-04-09 10:48:55 PM IST,What a shitty way to go,6
2024-04-09 10:48:56 PM IST,I love you Abhishek,8
2024-04-09 10:49:00 PM IST,Deserved it NKR,6
2024-04-09 10:49:00 PM IST,LETS GOOOO NKRRR SO PROUD MY BOY 🔥🔥🔥,10
2024-04-09 10:49:01 PM IST,Can yoghurts win?,3
2024-04-09 10:49:02 PM IST,Papaparaaaaaaaaaaaaaaaaaaaaaaaaaaaaaaaaaa,6
2024-04-09 10:49:03 PM IST,Oh ya nitish deserves the Man of the match today,5
2024-04-09 10:49:04 PM IST," Jitesh pls, get out now and I will be your biggest PR for the WC",6
2024-04-09 10:49:04 PM IST,don’t think there’s a lot of scope of jitesh being in the wc squad now. i wanted him to make it but seems unlikely.,9
2024-04-09 10:49:04 PM IST,"Okay Sharma ki ka beta holds on 
Let’s go Nitish Anna",6
2024-04-09 10:49:04 PM IST,1 six player,5
2024-04-09 10:49:04 PM IST,Finally 🙏,3
2024-04-09 10:49:07 PM IST,Punjab real batting starts now,7
2024-04-09 10:49:07 PM IST,Thank god at least someone can catch. Great catch Abhi,7
2024-04-09 10:49:08 PM IST,finally,3
2024-04-09 10:49:09 PM IST,Game done ?,5
2024-04-09 10:49:10 PM IST,Punjab's batting line up is lowkey stacked af,4
2024-04-09 10:49:12 PM IST,;-; x2,1
2024-04-09 10:49:12 PM IST,I am tired,2
2024-04-09 10:49:13 PM IST,good six need at least one more six....,2
2024-04-09 10:49:15 PM IST,"I would've lost it if that was a drop..

Please don't be a No Ball...",3
2024-04-09 10:49:15 PM IST,"It dropped catch and next ball we get how often did does that happen.


Normally after the catch drop it is a boundary.",5
2024-04-09 10:49:15 PM IST,Horrible ball horrible shot![img](emote|t5_2qhe0|8779),6
2024-04-09 10:49:15 PM IST,"What if, what if, NKR as the fast bowling all rounder for wct20??",4
2024-04-09 10:49:16 PM IST,"Shashank, Ashutosh to do it again?",2
2024-04-09 10:49:20 PM IST,Thank fucking shit. Sharma actually has brains.,5
2024-04-09 10:49:20 PM IST,"ashutosh in, scary hours",5
2024-04-09 10:49:20 PM IST,LFG THANKS JITESH,7
2024-04-09 10:49:21 PM IST,my man desreved that wicket in first  ball mate,7
2024-04-09 10:49:21 PM IST,Jitesh isn't helping himself with the WT20 selection,4
2024-04-09 10:49:23 PM IST,Power pair here,9
2024-04-09 10:49:25 PM IST,I mean that was a high catch and bowlers are generally not very good fielders except a few,5
2024-04-09 10:49:27 PM IST,Pretty much out of contention for wk position in World Cup,5
2024-04-09 10:49:28 PM IST,Jitesh knows nothing except throwing the sink at everything right??,4
2024-04-09 10:49:31 PM IST,"good to see cummins' trust on Nitish.



bowlers together strong",13
2024-04-09 10:49:34 PM IST,Jitesh is most mid keeper batsman,6
2024-04-09 10:49:34 PM IST,Jitesh keeps getting out to horrible balls,5
2024-04-09 10:49:37 PM IST,"Once again it’s in shashank and Ashutosh to rescue us.
Please 😭",6
2024-04-09 10:49:38 PM IST,yoooo lessgo nkr abhi,8
2024-04-09 10:49:40 PM IST,well played Anuv Jain,2
2024-04-09 10:49:41 PM IST,Want bcci to make nitish a good bowler mabye will be the next hardik,7
2024-04-09 10:49:45 PM IST,my boyyyyyy has a wickett 🥹,7
2024-04-09 10:49:46 PM IST,Iam sure with these kind of scores Jitesh is no where near that T20 WC selection.,3
2024-04-09 10:49:46 PM IST,"Jitesh has been given great opportunities to prove himself, like so many for WC20. But he’s been mid sadly",6
2024-04-09 10:49:46 PM IST,69 needed,3
2024-04-09 10:49:46 PM IST,"Fuk yeah tactical drop that from Nattu,just to give hopes",8
2024-04-09 10:49:49 PM IST,"**15.3** **Jitesh holes out, and Nitish rises to the occasion again!** Slower bumper on leg stump that is actually begging to be hit. Jitesh tries to smash it into next week and swings too early. Gets it right off the toe-end and rather than flying over fine leg, it spoons up towards deep square leg. Abhishek comes running in off the fence, slides forward and completes the catch! PBKS keep slipping!

Jitesh Sharma c Abhishek Sharma b Nitish Kumar Reddy 19 (11b 1x4 1x6) SR: 172.72",1
2024-04-09 10:49:49 PM IST,that should do it,1
2024-04-09 10:49:50 PM IST,Jitesh ain’t gonna come to the WC with these shit performances,3
2024-04-09 10:49:52 PM IST,Jittya only has himself to blame if KL gets into WC XI now,5
2024-04-09 10:49:53 PM IST,Jitesh shouldn’t be anywhere near the national team,3
2024-04-09 10:49:56 PM IST,"Man jitesh is having a bad season, I feel bad for him so much potential",8
2024-04-09 10:49:58 PM IST,"Dude this was a shit ball jitesh 

Played all over it.

I am afraid bit by bit you are going far away from ICT 
So many of them waiting",10
2024-04-09 10:49:58 PM IST,Cummins has taught everyone that slower into the pitch ball that he used on that dreaded day,11
2024-04-09 10:49:59 PM IST,"nkr de villers✅

nkr rhodes ✅

nkr flintoff✅",13
2024-04-09 10:50:06 PM IST,Please recreate the last match's chase ashutosh and Shashank 😭,3
2024-04-09 10:50:09 PM IST,"Yup, there's the Hardik 2015 performance. Excellent batting. 130s bowling, but expensive, yet gets the key wicket.

We have a long term prospect.",7
2024-04-09 10:50:09 PM IST,Yeah don't think Jitesh is making that WC squad,3
2024-04-09 10:50:09 PM IST,We have hardik pandya from vizag here,8
2024-04-09 10:50:09 PM IST,Now the top G order is in the crease,2
2024-04-09 10:50:09 PM IST,"Ashutosh has hit a 11 ball 50. Anyways, PBKs lost this one",7
2024-04-09 10:50:11 PM IST,i see a few punjabis already silenced lol,1
2024-04-09 10:50:11 PM IST,"PBKS put the ""mid"" in middle-order",5
2024-04-09 10:50:11 PM IST,"hey guys jitesh sharma back, i think i played a world class innings striking at 250, i am going to be selected for the wc right?",2
2024-04-09 10:50:12 PM IST,Jitesh is mid,3
2024-04-09 10:50:13 PM IST,"Idk why everyone say Jitesh should be chosen over Pant. No way man, Jitesh isn’t that special. I don’t mind Jurel or Samson but not Jitesh",3
2024-04-09 10:50:17 PM IST,Railway and redemption guys on the go,6
2024-04-09 10:50:18 PM IST,Surely Jitesh isn't going to be anywhere near the World T20 squad. He played as specialist keeper in the last T20I series India played,5
2024-04-09 10:50:21 PM IST,ashutosh no 😭😭😭,2
2024-04-09 10:50:24 PM IST,PBKS need to sub in Starc and let him bowl for SRH if they want to chase this,5
2024-04-09 10:50:28 PM IST,Punjab’s star players are going to come out now,4
2024-04-09 10:50:30 PM IST,NKR remember the name,7
2024-04-09 10:50:31 PM IST,"Jitesh Sharma is just a load of thrash, hope he’s nowhere near the national squad",2
2024-04-09 10:50:33 PM IST,Yeah Jitesh ain't going to the WC. Our selectors tend to rate consistency a lot.,3
2024-04-09 10:50:38 PM IST,wtf man.. it a ball to hit for six..  I have told it and I repeat it agin. Jitesh should not be in ICT,2
2024-04-09 10:50:38 PM IST,The punjab vs delhi final in ipl 33 is my  WrestleMania main event,4
2024-04-09 10:50:40 PM IST,"What emotions for bowler dropped catch , then six , then catch",9
2024-04-09 10:50:40 PM IST,Jitesh has missed the WC ticket.,6
2024-04-09 10:50:45 PM IST,Ah shit here we go again SHASHANK SHARMA,2
2024-04-09 10:50:47 PM IST,"With each match, Samson cements his place as the wicketkeeper for the T20WC.",14
2024-04-09 10:50:49 PM IST,"Pant is definitely the front runner now, right? Kl not batting middle order hurt him. Jitesh eh.",6
2024-04-09 10:50:49 PM IST,197 strike rate what 😳,5
2024-04-09 10:51:05 PM IST,Mr 200 strike rate has to strike at 250 today to win,6
2024-04-09 10:51:13 PM IST,Shashank looking pretty good,3
2024-04-09 10:51:15 PM IST,Disappointing season for Jitesh so far.,2
2024-04-09 10:51:16 PM IST,and at that point she thought about the ICL,3
2024-04-09 10:51:23 PM IST,So many Karnataka players yet RcB is yet to produce or even scout a player like RCB,6
2024-04-09 10:51:23 PM IST,Ashutosh Sharma holds the record for the fastest fifty by an Indian in T20s (11 balls),8
2024-04-09 10:51:27 PM IST,shawshank no redemption 😔,3
2024-04-09 10:51:30 PM IST,Jitesh should be batting slightly up the order. At 6 in place of Raza imo.,1
2024-04-09 10:51:31 PM IST,Dhawan inings was such a waste an opener wasting so many balls,5
2024-04-09 10:51:33 PM IST,Punjabi batting lineup is stacked what the hell.,12
2024-04-09 10:51:38 PM IST,"Patrick Bateman Cummins, I bow to you",11
2024-04-09 10:51:42 PM IST,I would never understand who tf chose raza over rilee when he wasn't going to bowl,7
2024-04-09 10:51:43 PM IST,Let's home this pair atleast give SRH a scare! Otherwise it's a boring game,5
2024-04-09 10:51:44 PM IST,"This guy should’ve come earlier. Double-handedly destroyed GT, these 2 lads. But again not Gills fault, total 5 catches dropped that game. Other than that Gills captaincy was great",8
2024-04-09 10:51:46 PM IST,Ashutoshi sounds Japanese,3
2024-04-09 10:51:49 PM IST,Bruh punjab had this one in the bag how'd they get here,6
2024-04-09 10:51:51 PM IST,Why do people here and in cricinfo think punjab had any chance from the 10th over - as if going at 13p/o with 4 down is a walk in the park (unless rcb or delhi is bowling),4
2024-04-09 10:51:54 PM IST,Go railway guy,2
2024-04-09 10:51:54 PM IST,They aren't chasing this,3
2024-04-09 10:51:59 PM IST,Great over by nkr 👏👏,6
2024-04-09 10:52:01 PM IST,The 2 bouncer rule has helped medium pacers a lot. They pretty difficult to hit with their variations on short balls,6
2024-04-09 10:52:02 PM IST,Surprised that it wasn't wide....,2
2024-04-09 10:52:05 PM IST,67 in last 4 overs out of which 2 are bowled by cummins and bhuvi. Looks tough.,2
2024-04-09 10:52:07 PM IST,Well played nitish bhai,3
2024-04-09 10:52:11 PM IST,if we win today i'll remove my shirt like ganguly and dance 😌,2
2024-04-09 10:52:12 PM IST,Stage was set for Jitesh![img](emote|t5_2qhe0|21498),5
2024-04-09 10:52:12 PM IST,"They should get rid of Yjb and bring in Brohit . Brohit and Da1 opening , run it back",6
2024-04-09 10:52:13 PM IST,so proud of our NKR 🔥 let’s wrap up this match boys,4
2024-04-09 10:52:16 PM IST,"Field placement so good, its easier to clear the boundary than to find the gap.",8
2024-04-09 10:52:19 PM IST,Damn how good has Cummins been for Sunrisers,9
2024-04-09 10:52:22 PM IST,Jitesh needed a 40(20) today to cement his place. Seems like either Samson or Pant gonna make it !,7
2024-04-09 10:52:25 PM IST,If this is a shashank and ashutosh royale I am here for it,2
2024-04-09 10:52:32 PM IST,Choked the opposition on their own home ground after not doing very well in batting. Sounds like peak srh,4
2024-04-09 10:52:32 PM IST,that 60 odd on these conditions were worth more than a 100,3
2024-04-09 10:52:37 PM IST,"Reddy is turning out as a good all rounder option, worth grooming as Pandya backup in my opinion",8
2024-04-09 10:52:43 PM IST,Bhuvi death bowling 😬,1
2024-04-09 10:52:46 PM IST,"Dhawan been a net negative for this team. 

Hows he 40 years old and still can't play off stump line",5
2024-04-09 10:52:47 PM IST,Shashank scares me man,3
2024-04-09 10:52:50 PM IST,"so who will SRH retain for next year? Cummins, Klassen, Abhishek, and who will it be for the last retention?",4
2024-04-09 10:52:52 PM IST,Only 20 something runs in powerplay and losing three wickets cost us along with piss poor fielding.,3
2024-04-09 10:52:54 PM IST,[deleted],1
2024-04-09 10:52:55 PM IST,Promising future for this young all rounder.,2
2024-04-09 10:52:56 PM IST,Pat Cummins has really good luck,2
2024-04-09 10:52:58 PM IST,Boobie 😁,2
2024-04-09 10:52:58 PM IST,We were gonna lose this match anyway. But punjab being punjab 1 baar hope badate hain phir agli bowl pe hag dete hain,3
2024-04-09 10:52:59 PM IST,"Good tactics by PBKS, using nightwatchmen to counter the swing. Real batting starts now.",2
2024-04-09 10:53:03 PM IST,"This should be in the bag..

If Bhuvi finishes strongly..

Just hope he doesn't go for 20 or more....",3
2024-04-09 10:53:04 PM IST,"why is it so hard for me to be confident, even at this stage",5
2024-04-09 10:53:04 PM IST,"Bhubi please get cunted to make the match interesting 
Okay he started lol",3
2024-04-09 10:53:15 PM IST,"If Shashank and Ashutosh win us the match again, then mgt should give 1% each to them because they own the team now.",4
2024-04-09 10:53:16 PM IST,bhuvis 4th over nightmare starts?,8
2024-04-09 10:53:17 PM IST,"Jaydev but he left his software job for a law firm

Jaylawyer 

^(this was so horrible, i’ll see myself out)",9
2024-04-09 10:53:17 PM IST,Oh no no no no,3
2024-04-09 10:53:19 PM IST,"If pant stops those gimmick shots, he will be fine with the bat",5
2024-04-09 10:53:19 PM IST,Cummins would've been even more likeable if India had just won that one match,1
2024-04-09 10:53:20 PM IST,L fielding,6
2024-04-09 10:53:23 PM IST,Bc whatta shot![img](emote|t5_2qhe0|8783),7
2024-04-09 10:53:27 PM IST,Sashank singh dhoni,3
2024-04-09 10:53:28 PM IST,Today both the teams batting line up deeper than Bengali  fuddi!!,4
2024-04-09 10:53:30 PM IST,No bhuvi don't,2
2024-04-09 10:53:31 PM IST,The scream was because Jitesh knew the WC ticket was slipping,5
2024-04-09 10:53:32 PM IST,Bruh im afraid now,2
2024-04-09 10:53:32 PM IST,lol ok bye,1
2024-04-09 10:53:32 PM IST,Mandatory Shashank outside edge done. Now let him cook,7
2024-04-09 10:53:32 PM IST,Yeah it's over. GG well played PBKS,3
2024-04-09 10:53:33 PM IST,"did i just see boobie mouth ""bkc"" kekw",7
2024-04-09 10:53:33 PM IST,3rd man is pretty much a must at this stage no?,5
2024-04-09 10:53:34 PM IST,Hey I have seen this one it's a classic,18
2024-04-09 10:53:42 PM IST,Crazy how Shashank is PBKS' best batter,9
2024-04-09 10:53:43 PM IST,"Murali Kartik of India and Murali Kartik of Australia and Murali Kartik of West Indies in the comm box. 
Vomit.",11
2024-04-09 10:53:49 PM IST,Another Shashank 50 would redeem this afternoon for me,7
2024-04-09 10:53:49 PM IST,"Ipl is overrated anyway smat is real , state's own talent real club cricket 💯💯",12
2024-04-09 10:53:53 PM IST,shashank singh heard preity zinta will give him kisses if he wins this for punjab,14
2024-04-09 10:53:56 PM IST,Oh boy.. Bhuvi please please ..,8
2024-04-09 10:54:03 PM IST,Can this duo do it again?,6
2024-04-09 10:54:03 PM IST,That was not even a bad ball,3
2024-04-09 10:54:04 PM IST,Shashank bats like a right handed rinku,11
2024-04-09 10:54:15 PM IST,ok.. luck is with them.. come do it again or at least make it interesting,0
2024-04-09 10:54:16 PM IST,They are only gonna play one way now. Just gotta put your best foot forward and wait for a mistake,2
2024-04-09 10:54:23 PM IST,"It's now between Samson, Pant and Jurel?",8
2024-04-09 10:54:42 PM IST,I don't know who will be selected as WK in WC . But BCCI first cancel the ticket of Jitesh.,6
2024-04-09 10:54:44 PM IST,The same duo again? Wow,5
2024-04-09 10:54:49 PM IST,"Star Sports hypes up this random matchup as ""RIVALRY"" 

and guess what?! There are hardly any ads played in-between overs.   
Even if played, they are just Star Sports' own production adverts (upcoming games, 4K telecast ads only) 

lol",3
2024-04-09 10:54:49 PM IST,punjab batting line up is like maharaja burger looks stacked but u cant hold it 😔,3
2024-04-09 10:54:49 PM IST,No bhuvi. Please no,7
2024-04-09 10:54:56 PM IST,yeah .. boy.. shashank has started shashanking.. keep it up..,7
2024-04-09 10:54:59 PM IST,"Ashutosh will not hit, he will try to ruin it.",1
2024-04-09 10:55:00 PM IST,"Ashu pls help my man shahshank

We are rooting for you",1
2024-04-09 10:55:01 PM IST,Shashank you deserve a better team,10
2024-04-09 10:55:05 PM IST,"Commentators will hype, but they won't win. Today, we defy the most sixes at end over stat",3
2024-04-09 10:55:09 PM IST,Bhuvi no,3
2024-04-09 10:55:13 PM IST,Bhuvi :(,2
2024-04-09 10:55:15 PM IST,What is this field setting?,1
2024-04-09 10:55:15 PM IST,"Bro bhuvi used to be a death over god, wtf happened?",3
2024-04-09 10:55:17 PM IST,I came,1
2024-04-09 10:55:18 PM IST,If these two do it again...,3
2024-04-09 10:55:18 PM IST,I HAVE SEEN GOD HE BATS AT 6 FOR PUNJAB,11
2024-04-09 10:55:19 PM IST,Shashank is no joke,3
2024-04-09 10:55:22 PM IST,bhuv bhuvi get him,2
2024-04-09 10:55:24 PM IST,keep the guy off strike!,1
2024-04-09 10:55:25 PM IST,Shashank bro 🚀🚀,1
2024-04-09 10:55:27 PM IST,What a choke by SRH,2
2024-04-09 10:55:29 PM IST,Come on Bhuvi .. that was Amateurish considering your experience,1
2024-04-09 10:55:31 PM IST,How did Shashank turn out as MSD all of a sudden,3
2024-04-09 10:55:33 PM IST,Bhuvi bowling trash,1
2024-04-09 10:55:33 PM IST,what is it with bhuvi and 4th overs dude,1
2024-04-09 10:55:35 PM IST,stoppable force vs movable object,4
2024-04-09 10:55:37 PM IST,What happend to bhuvi man?! He used to be gun death bowler.,1
2024-04-09 10:55:37 PM IST,noooooo bhuvi tff???? i didn't trust nattu bro why are you bowling shit too,8
2024-04-09 10:55:41 PM IST,Isn’t Shashank an allrounder? Haven’t seen him bowl for Punjab,3
2024-04-09 10:55:42 PM IST,If these guys do that again then this would be an unusual team that is overdependent on a couple of rookies.,2
2024-04-09 10:55:42 PM IST,need a six at least in this over,2
2024-04-09 10:55:43 PM IST,At this point just let Ashutosh and Shashank play after the 10th over.,7
2024-04-09 10:55:44 PM IST,"We are the Sunrisers,    
   

Of Hyderabad!!    



We are SRH,  


We are here to win,


We will bat your bowlers out of the stadium,     


We will make sure to light up the skies with our batting,



Don’t tempt us,


Cause 

We.   


Will.   


Win!!!!",1
2024-04-09 10:55:49 PM IST,One six and I'll cum,6
2024-04-09 10:55:50 PM IST,"Bhot fear lagra hai

T- Im scared",2
2024-04-09 10:55:55 PM IST,[deleted],6
2024-04-09 10:55:58 PM IST,Wait so he moved this time and it's not a wide? How does this work,2
2024-04-09 10:55:59 PM IST,bhuvi shatting the bed 🥲,3
2024-04-09 10:56:00 PM IST,Why they don’t understand Dont bowl bhuvi in death,3
2024-04-09 10:56:02 PM IST,What even bhuvi bowls at the death man,2
2024-04-09 10:56:06 PM IST,bhuvi is killing this man,2
2024-04-09 10:56:11 PM IST,Oh come on. That's not your standard my guy,7
2024-04-09 10:56:17 PM IST,Bhuvi and death over redemption for opposition,3
2024-04-09 10:56:21 PM IST,That is not a wide,2
2024-04-09 10:56:22 PM IST,"> If these guys do that again then this would be an unusual team that is overdependent on a couple of rookies

PBKS for a reason",10
2024-04-09 10:56:25 PM IST,Why didn't PBKS just open with these two? Are they stupid?,4
2024-04-09 10:56:29 PM IST,No Yorker at all.... Except for this ball,4
2024-04-09 10:56:35 PM IST,Why bowling so off if there's no one there?? Bhuvi struggles to bowl to the field istg,1
2024-04-09 10:56:36 PM IST,Bairstow performed brilliantly in SRH when the middle order was non existent. Now he has a wonderful middle and lower order and he is unable to perform.,6
2024-04-09 10:56:36 PM IST,The fact that Unadkat has to bowl one scares the shit Outta me,4
2024-04-09 10:56:37 PM IST,Easy wide,1
2024-04-09 10:56:40 PM IST,L umpire,2
2024-04-09 10:56:41 PM IST,They are gonna chase this down easy,2
2024-04-09 10:56:41 PM IST,"strong steer gray person mindless encouraging many ghost cagey square

 *This post was mass deleted and anonymized with [Redact](https://redact.dev)*",6
