Timestamp,Comment,Upvotes
2024-04-17 09:31:15 PM IST,Never back down never what? : JFM Probably,6
2024-04-17 09:31:15 PM IST,Tf is that background music,4
2024-04-17 09:31:15 PM IST,Amazing shot..,3
2024-04-17 09:31:18 PM IST,Jfm ain't playing no games,7
2024-04-17 09:31:18 PM IST,Ayo stop bro GT is already dead,10
2024-04-17 09:31:18 PM IST,Oh my Gurk,5
2024-04-17 09:31:20 PM IST,Ober covers in ahemdabad 💀,7
2024-04-17 09:31:25 PM IST,BBL showdown,3
2024-04-17 09:31:25 PM IST,"Along with Hero cam we need a hot cam focused on Zinta, Kavya and Nehra.",9
2024-04-17 09:31:30 PM IST,McGurk needs an s to poop. There is no other explanation,3
2024-04-17 09:31:32 PM IST,Fatality !,3
2024-04-17 09:31:33 PM IST,"How hard is it to think that our strike bowlers(rashid, Noor) should bowl first for such a low target....",7
2024-04-17 09:31:39 PM IST,This little fucker is gonna replace warner in wc squad,5
2024-04-17 09:31:41 PM IST,"And what I don’t like is if the business is true, that you left your moms in the hood, somebody go smoke that yute. You don’t leave your moms nowhere. You have money and you left your moms there? Yo, you’re sick to my stomach, fam. But if it’s not true, shorty's just talkin' shit.    

- Jake Fraser-McGurk probably",6
2024-04-17 09:31:43 PM IST,McGURK is McQUICK,3
2024-04-17 09:31:44 PM IST,"bro i just tuned in thinking it must be a boring match , but wtf happened bruhh , jay shah got me again shit",3
2024-04-17 09:31:46 PM IST,DC have crossed the sixes hit by GT in their entire innings in the start of the second over💀,6
2024-04-17 09:31:46 PM IST,Dada ☺️☺️,5
2024-04-17 09:31:47 PM IST,Hehe dada happy,7
2024-04-17 09:31:47 PM IST,Hmm i can see this guy annihilating us in 2027 wc finals,12
2024-04-17 09:31:48 PM IST,JFM nightmare BGM - Jakey Jakey it's time to play dot balls.,5
2024-04-17 09:31:53 PM IST,Australian cricketers are built differently.,8
2024-04-17 09:31:57 PM IST,These Aussie openers love batting at Ahmedabad fml,8
2024-04-17 09:31:57 PM IST,Dada's smile is making me happy.,7
2024-04-17 09:31:57 PM IST,23% runs scored in 6.67% balls,13
2024-04-17 09:32:02 PM IST,EspnCricinfo puts DC at 98.83% for the win. Not even 99% 😄,6
2024-04-17 09:32:07 PM IST,Ganguly’s reactions are just the best LOL,5
2024-04-17 09:32:08 PM IST,Yeah they're gonna finish this before the PP ends,2
2024-04-17 09:32:09 PM IST,1/4th total chased in 7 balls.,15
2024-04-17 09:32:13 PM IST,delhi is suddenly looking so strong,4
2024-04-17 09:32:18 PM IST,GT should bring in spinners early otherwise match will be over 8 overs,2
2024-04-17 09:32:24 PM IST,First 2-digit score in IPL 2024.,8
2024-04-17 09:32:24 PM IST,I'm a neutral and even I'm feeling embarrassed for GT watching all this.,8
2024-04-17 09:32:27 PM IST,So McGurk next test opener for Aussies? Just needs to have a chat with Sehwag.,11
2024-04-17 09:32:31 PM IST,Bro will score a 50 in a chase of 90 runs,7
2024-04-17 09:32:31 PM IST,Dada enjoying...😂,4
2024-04-17 09:32:35 PM IST,Bro only has one mode and probably drives in 5th gear only,3
2024-04-17 09:32:35 PM IST,[deleted],2
2024-04-17 09:32:37 PM IST,JFM- 6 or out nothing in between,1
2024-04-17 09:32:44 PM IST,I wanna see Jake play in the World Cup. I know it’s too early to say but imagine Jake and Head opening,1
2024-04-17 09:32:44 PM IST,Wtf is wrong with delhi,1
2024-04-17 09:32:47 PM IST,JFM looks like the bald niece from Dune 2 when it all turned black and white,2
2024-04-17 09:32:49 PM IST,Clears the front leg and hack,1
2024-04-17 09:32:52 PM IST,"Jake plays for the perennial wooden spooners, the Renegades in the BBL",1
2024-04-17 09:32:52 PM IST,"If you look up *Kitchen sink* in google, the second pic will be of Jake. First being Narine.",4
2024-04-17 09:32:56 PM IST,"Maaro bc

T: do or die",2
2024-04-17 09:32:57 PM IST,Is he opening for the first time this season? Good decision if so.,2
2024-04-17 09:33:00 PM IST,Ambanis and goenka are gonna start a corpo war over this perfomance,6
2024-04-17 09:33:03 PM IST,we really suffered w injuries otherwise we’re a really solid fucking team ,4
2024-04-17 09:33:10 PM IST,JFM outscored 10 of GT's batters in 5 balls. Edit: He's the 2nd highest scorer in the match after Rashid Khan.,4
2024-04-17 09:33:10 PM IST,Where's the football coach Nehra at? ,2
2024-04-17 09:33:11 PM IST,I hope JFM can adjust his attitude and apply his talent in red ball. He obviously has great coordination but he keeps getting out early and cheap trying to smash it in our domestic FC system lol,2
2024-04-17 09:33:12 PM IST,Boring without wickets,1
2024-04-17 09:33:12 PM IST,Bros too cracked. Tbh with Marsh not performing that great. He can be tried by Aussies,5
2024-04-17 09:33:13 PM IST,"WT20 Final 2026, Ahmedabad stadium

India 140/8 (20 overs)

Australia 141/3 (16.3 overs) Jake Fraser-McGurk 77*(48)",17
2024-04-17 09:33:16 PM IST,How is that not a wide?,10
2024-04-17 09:33:21 PM IST,Jake narine,1
2024-04-17 09:33:22 PM IST,wide?,0
2024-04-17 09:33:31 PM IST,We remembered that we weren’t the daredevils anymore. Tears in my eyes,12
2024-04-17 09:33:37 PM IST,He loves violence,3
2024-04-17 09:33:38 PM IST,question made by someone w a foot fetish ,14
2024-04-17 09:33:39 PM IST,Bruh not wide??,2
2024-04-17 09:33:46 PM IST,TF fuck was that question???,10
2024-04-17 09:33:56 PM IST,That is practically a tongue twister.,6
2024-04-17 09:34:05 PM IST,Can somebody tell me what happened to gt in pp?,4
2024-04-17 09:34:10 PM IST,"Bruh, that fucking stance. His bat is facing Timbuktu.",6
2024-04-17 09:34:13 PM IST,Was Warner dropped or injured?,2
2024-04-17 09:34:14 PM IST,Boundary or inshallah,12
2024-04-17 09:34:23 PM IST,does he not know he is chasing 90,6
2024-04-17 09:34:25 PM IST,Lol i thought PK said Dhawan missed oit due to niggle. Here they are already prepared with Sam Curran's headshot for the MI clash!!,4
2024-04-17 09:34:27 PM IST,"Born to play baseball, forced to play cricket",11
2024-04-17 09:34:28 PM IST,Gone McGurk. Caught,7
2024-04-17 09:34:31 PM IST,"It's that time of night where I sit in bed pondering the existential questions of life, such as ""If Warrier lost a war, would he just be Rier?""",8
2024-04-17 09:34:40 PM IST,"it’s alright, i love jfm so much i hope he keeps doing this ",10
2024-04-17 09:34:42 PM IST,Chat suggest some good movie please. This match is going to get over before my Swiggy order arrives.,6
2024-04-17 09:34:44 PM IST,"**1.6**

Jake Fraser-McGurk c Manohar b Johnson 20 (10b 2x4 2x6) SR: 200",1
2024-04-17 09:34:45 PM IST,Ah Fuck.,6
2024-04-17 09:34:50 PM IST,Done his part really well,10
2024-04-17 09:34:55 PM IST,Did his job.,6
2024-04-17 09:34:56 PM IST,had a feeling that was coming,4
2024-04-17 09:35:09 PM IST,they should all play like this just for the run rate boost though,6
2024-04-17 09:35:09 PM IST,Did his job tk give a fast start..,3
2024-04-17 09:35:11 PM IST,Why is blud in such a hurry? 💀,3
2024-04-17 09:35:13 PM IST,Stubbs should come in now,1
2024-04-17 09:35:14 PM IST,Fell right into the trap,1
2024-04-17 09:35:14 PM IST,The most JFM innings possible,7
2024-04-17 09:35:15 PM IST,DC's win prediction falls to 98.5%,2
2024-04-17 09:35:18 PM IST,Damage is done,2
2024-04-17 09:35:20 PM IST,"
So it begins",2
2024-04-17 09:35:20 PM IST,Just 9 more wicket/s,5
2024-04-17 09:35:24 PM IST,"That's fine
Blud must continue like he is playing
I am not complaining",6
2024-04-17 09:35:27 PM IST,"Dont mind this mindset. In fact I welcome it. Did the damage, didnt waste balls, and game is done.",9
2024-04-17 09:35:28 PM IST,Did his job. It's upto DC batters to finish this in next 8 overs,6
2024-04-17 09:35:31 PM IST,JFM's done his job. Scored 1/4 of the total in 2 overs.,7
2024-04-17 09:35:31 PM IST,Just saw the score....wtf happened to GT ?,2
2024-04-17 09:35:32 PM IST,"Young lad needs to learn how to cool down, he was playing as if the target was 200",2
2024-04-17 09:35:33 PM IST,More than 25% chased in 2 overs,5
2024-04-17 09:35:35 PM IST,Played his part. We all know he is a hit or miss type of player,3
2024-04-17 09:35:37 PM IST,"DC batting with 5 openers - Sachin, Sehwag, Lara, Fraser and McGurk.",6
2024-04-17 09:35:37 PM IST,Shaw gotta continue this 🙏🏻🙏🏻🙏🏻,2
2024-04-17 09:35:39 PM IST,"Has Shaw given up on his national team aspirations? Prithvi gol hai.


T: the earth is round. ",2
2024-04-17 09:35:39 PM IST,Pant commin,1
2024-04-17 09:35:43 PM IST,Please not tuktuk Porel,3
2024-04-17 09:35:44 PM IST,Bruh why all of this moving around the crease shit. Just stand and hit the ball,2
2024-04-17 09:35:44 PM IST,"i’m ok w even being 90/9 if we get them in 7 overs, we need an NRR boost ",5
2024-04-17 09:35:44 PM IST,No worries we need PP hitters still played better than whatever Marsh was doing this season.,7
2024-04-17 09:35:45 PM IST,Porel![img](emote|t5_2qhe0|21498),3
2024-04-17 09:35:58 PM IST,Aww hell naw not porel 💀,5
2024-04-17 09:35:59 PM IST,NOT POREL NOOO DC WHY NOOOOOO,6
2024-04-17 09:36:08 PM IST,Please bring Rashid now....not that fucking warrior.,2
2024-04-17 09:36:11 PM IST,"You have pant stubbs axar hope 
Chasing 90
Sends porel 
Guess they wanna make it interesting",8
2024-04-17 09:36:11 PM IST,To the rcb fan who was calling JFM a bbl fraud there you go he has now made more runs than Green in 3 games less,9
2024-04-17 09:36:11 PM IST,took an evening nap and gill’s boys have just capitulated. what happened,7
2024-04-17 09:36:12 PM IST,Porel the impact player for DC,7
2024-04-17 09:36:22 PM IST,What happened why GT didn't play complete 20 overs ? Rain ? One batter was remaining,2
2024-04-17 09:36:22 PM IST,Abhishek porel and Bad Dhoni look like siblings,5
2024-04-17 09:36:31 PM IST,Why we are sending porel at 3? Ffs Ganguly,5
2024-04-17 09:36:31 PM IST,What an innings 20(10) killed the match is pp itself,7
2024-04-17 09:36:33 PM IST,Every batsman need to hit a six.,4
2024-04-17 09:36:33 PM IST,That's gone. Not,2
2024-04-17 09:36:34 PM IST,Porel 30(45) to see us through,11
2024-04-17 09:36:36 PM IST,"bells political worry direction cooing treatment flowery deserve chop possessive

 *This post was mass deleted and anonymized with [Redact](https://redact.dev)*",3
2024-04-17 09:36:44 PM IST,"nah why porel, he was a flop last innings too",1
2024-04-17 09:36:49 PM IST,"We finally get an aggressive opener (that too left handed) , and now people are wanting to drop him because of not performing in ipl. People just want him to statpad and score runs and then complain why we don't have openers like JFM.",11
2024-04-17 09:36:54 PM IST,Wtf pant you should be out there,3
2024-04-17 09:37:00 PM IST,"Umpire loves watching Shaw bat, he's just like me fr",6
2024-04-17 09:37:13 PM IST,Umpires call at best..,4
2024-04-17 09:37:15 PM IST,not umpire call again ffs,4
2024-04-17 09:37:20 PM IST,"This is not the pitch where you go in a shell, just hit or get out",4
2024-04-17 09:37:21 PM IST,Script kicking in guys...,9
2024-04-17 09:37:25 PM IST,Typical delhi batting collapses coming in?,3
2024-04-17 09:37:27 PM IST,200+ scores:- Missing me now r/cricket?,6
2024-04-17 09:37:41 PM IST,Missing by miles,3
2024-04-17 09:37:46 PM IST,Not out.,3
2024-04-17 09:37:47 PM IST,Gill is like Fuck it i am taking the review,11
2024-04-17 09:37:48 PM IST,Umpire hates our guts lol,4
2024-04-17 09:37:58 PM IST,Was the overs reduced from 20 overs to 6 overs each side?,5
2024-04-17 09:38:02 PM IST,"homeless history like trees provide steer fly rhythm marvelous grey

 *This post was mass deleted and anonymized with [Redact](https://redact.dev)*",5
2024-04-17 09:38:02 PM IST,DC boys y’all can’t lose from here. please,4
2024-04-17 09:38:04 PM IST,I can see Gill being super aggressive once he hits kohliesque image,4
2024-04-17 09:38:15 PM IST,Shot,1
2024-04-17 09:38:19 PM IST,Chat what is the likelihood DC forces a close finish for absolutely no fucking reason,4
2024-04-17 09:38:20 PM IST,finish it in 7 overs fr,3
2024-04-17 09:38:23 PM IST,I need a pant 30(8),5
2024-04-17 09:38:24 PM IST,Whatta shot![img](emote|t5_2qhe0|28120),1
2024-04-17 09:38:27 PM IST,"That was clear missing 


Gill is so desperate and now wasted a review",2
2024-04-17 09:38:29 PM IST,So we can bully shaw with swing,1
2024-04-17 09:38:31 PM IST,All DC is aiming for a Positive NRR,6
2024-04-17 09:38:31 PM IST,Looked more out than the one that was umpire's call,1
2024-04-17 09:38:31 PM IST,Typical Sehwag,1
2024-04-17 09:38:33 PM IST,Why did prithvi Shaw downfall?,2
2024-04-17 09:38:33 PM IST,Shaw is wearing the helmet or the helmet is preventing the Shaw's head from falling,4
2024-04-17 09:38:36 PM IST,Sandeep Steyn,1
2024-04-17 09:38:37 PM IST,"The previous one was umpires call.(Looked very far)

This one was missing.(Looked closer)

Such is life my Bois.",5
2024-04-17 09:38:38 PM IST,Bring Rashid and Noor on ffs,3
2024-04-17 09:38:43 PM IST,"I absolutely hate the impact player rule  
  
I love the power surge rule in BBL  
  
Call for it before the 16th over and you get one over after the powerplay where there are just 2 fielders outside the circle  
  
That's way better than the IP rule",10
2024-04-17 09:39:03 PM IST,"Experts would have said to go with 200+ score 

But i had other ideas 

-jay shah",4
2024-04-17 09:39:07 PM IST,We are literally stuck at the extremes of T20 cricket. Literally nothing in-between,9
2024-04-17 09:39:08 PM IST,Rashid & Noor where?,3
2024-04-17 09:39:10 PM IST,"65(107) at Ahmedabad.



Just 1 run. We were this close to perfection.",1
2024-04-17 09:39:11 PM IST,why is this guy still bowling?,1
2024-04-17 09:39:11 PM IST,DC this is not what I meant by you beating GT to keep mid table open. DC incoming with massive NRR boost,7
2024-04-17 09:39:14 PM IST,DC have the review luck on their side today,3
2024-04-17 09:39:16 PM IST,At least GT have a cool looking jersey.,3
2024-04-17 09:39:21 PM IST,I wasn’t watching the match and saw the scorecard at the end of the first innings and for a moment I thought it was DC that got bowled out for 89,2
2024-04-17 09:39:33 PM IST,Where is afg spin duo ?,3
2024-04-17 09:39:34 PM IST,"recognise deliver continue jellyfish books offend station north fall straight

 *This post was mass deleted and anonymized with [Redact](https://redact.dev)*",4
2024-04-17 09:39:35 PM IST,Sachin's straight drive,3
2024-04-17 09:39:44 PM IST,DC can fuck GT's chances here. The 3rd and 4h spot race will be tight.,10
2024-04-17 09:39:52 PM IST,GT realising what PBKS and RCB feel most of the time,5
2024-04-17 09:39:58 PM IST,Good guy Gill trying to help his u19 teammate,9
2024-04-17 09:40:02 PM IST,What a ripper!!!!,3
2024-04-17 09:40:07 PM IST,"I like DC winning, but, I like the fact that I can now shamelessly shit on RCB. Thanks Ponting🙏🏼",6
2024-04-17 09:40:10 PM IST,Script.....,6
2024-04-17 09:40:15 PM IST,[deleted],2
2024-04-17 09:40:18 PM IST,That was a nasty one. Great ball.,3
2024-04-17 09:40:20 PM IST,Gone. Prithvi,1
2024-04-17 09:40:21 PM IST,"**2.4** **terrific short ball!** And Warrier gets reward for that.

Prithvi Shaw c Johnson b Sandeep Warrier 7 (6b 1x4 0x6) SR: 116.66",1
2024-04-17 09:40:21 PM IST,SRH would have finished this in powerplay lol,6
2024-04-17 09:40:22 PM IST,Sad Shaw,4
2024-04-17 09:40:23 PM IST,"It's going to be a humongous task to fill the shoes of someone like Hardik Pandya. He carried the team on his shoulders for the entirety of his GT career, but still gets called a stat-padder and selfish",-6
2024-04-17 09:40:24 PM IST,"Donkey. 
Effing donkey.",4
2024-04-17 09:40:24 PM IST,Do I still have hope? God are you real? Give me sign,8
2024-04-17 09:40:26 PM IST,Sah guy working hard,3
2024-04-17 09:40:27 PM IST,Stubbs or Pant now. No more hope please,6
2024-04-17 09:40:28 PM IST,DC DCing,5
2024-04-17 09:40:29 PM IST,That was a fucking great bouncer,3
2024-04-17 09:40:29 PM IST,/Sandeep take 8 more,2
2024-04-17 09:40:32 PM IST,Is the world ready to see DC win IPL trophy?,4
2024-04-17 09:40:32 PM IST,Bro playing bouncers like KS Bharat,1
2024-04-17 09:40:34 PM IST,Finally someone remembered Shaw struggles against bouncers,2
2024-04-17 09:40:34 PM IST,Dayum!!!!,1
2024-04-17 09:40:35 PM IST,Gill gotta decide on how to take review and give clear instruction to bowlers and keeper on what info to give to him to make a decision. In this case both keeper and bowler where not convinced but he still went with it,1
2024-04-17 09:40:35 PM IST,Shaw was surprised...,2
2024-04-17 09:40:35 PM IST,It's happening guys DC is collapsing,1
2024-04-17 09:40:35 PM IST,Why was Porel sent out? I was hoping for Pant to finish it quickly,1
2024-04-17 09:40:41 PM IST,Jay shah be wilding,2
2024-04-17 09:40:43 PM IST,this is what happens when two mid teams clash. they’re trying to out do each other,2
2024-04-17 09:40:47 PM IST,What a ball !,4
2024-04-17 09:40:47 PM IST,"Alright so who’s India playing as WK for WC? 

* Pant 

* Kishan

* Sanju 

* KL

* DK

* Saha

* Thala 

* Jitesh

* Jurel",2
2024-04-17 09:40:52 PM IST,"Told ya, this isn't a defensive pitch. Rashid is going to becoming the second coming of warne here.",4
2024-04-17 09:40:53 PM IST,Really good ball that.,2
2024-04-17 09:40:54 PM IST,oh so u can get both openers out of chasing team at Ahmedabad? strange.,4
2024-04-17 09:40:56 PM IST,Sandeep Warrier's first wicket in GT colours,4
2024-04-17 09:41:00 PM IST,Looks like things have gone Tits up for the Gujjus,1
2024-04-17 09:41:01 PM IST,Yeah Shaw no way he's coming back into the Indian team anytime soon.,6
2024-04-17 09:41:02 PM IST,"If GT wins this, I will change my flair to GT",7
2024-04-17 09:41:02 PM IST,DC should not take this chase as condition to qualify,4
2024-04-17 09:41:05 PM IST,Wow that was a very good short ball,3
2024-04-17 09:41:07 PM IST,I have never seen batting technique as bad as Shaw to think this guy was touted at the next Sachin,4
2024-04-17 09:41:08 PM IST,"Man I want DC to stuff GT. 
I'm too scared of them qualifying.",5
2024-04-17 09:41:14 PM IST,Perfect bouncer![img](emote|t5_2qhe0|28120),2
2024-04-17 09:41:15 PM IST,Idk how this guy faced Akhtar in past 🤔,6
2024-04-17 09:41:26 PM IST,Idk why no team went for Josh Inglis. Always plays with intend and is a clutch player. Ipl teams keep going for the same guys always,2
2024-04-17 09:41:27 PM IST,"Pant needs to take this deep, no fing around with those sweeps",0
2024-04-17 09:41:28 PM IST,Just 9/9 wins left after this match.,6
2024-04-17 09:41:29 PM IST,"This is the right approach from DC, go bang bang to improve NRR because wickets don’t matter (unless you’re all out before the target 😬)",9
2024-04-17 09:41:35 PM IST,Where the fuck is Pant,2
2024-04-17 09:41:36 PM IST,"liquid degree station scale worm bewildered offend bag somber automatic

 *This post was mass deleted and anonymized with [Redact](https://redact.dev)*",6
2024-04-17 09:41:40 PM IST,59 off 105 and you guys have hope??,3
2024-04-17 09:41:43 PM IST,"This guy used to play for us 


(Kerala Team).",2
2024-04-17 09:41:43 PM IST,He is never making it to international stage. Never.,4
2024-04-17 09:41:44 PM IST,"i like DCs approach, focus on NRR and finish this within powerplay",5
2024-04-17 09:41:44 PM IST,"Never change, DC.",3
2024-04-17 09:41:44 PM IST,Really hope Pant sees DC through to a win,2
2024-04-17 09:41:45 PM IST,"DC's win prediction falls again to 98.1%

GT believes!!

Go bowlers, fuck'em!!!",6
2024-04-17 09:41:57 PM IST,Why isn't davey playing?,2
2024-04-17 09:42:04 PM IST,Those who hyped Shaw as the next Sachin should be ashamed of themselves,4
2024-04-17 09:42:08 PM IST,Where is Pant?,1
2024-04-17 09:42:13 PM IST,Now best man to be here for a test,2
2024-04-17 09:42:15 PM IST,Hope might remind me of his innings from 2019 WC,3
2024-04-17 09:42:16 PM IST,WTF DC you trying to choke even this one??,3
2024-04-17 09:42:16 PM IST,fucking hell pant send yourself or stubs out. hope’s 120 sr ain’t helping you,3
2024-04-17 09:42:21 PM IST,Every day it looks like Shaw has probably played his last game for India. Hopefully he turns it around and improves his fitness.,3
2024-04-17 09:42:24 PM IST,What are these brain-dead decisions to send Porel and Hope ahead of Pant and Stubbs,1
2024-04-17 09:42:29 PM IST,Man who the hell brought Perth pitches to Indiia ☠️,6
2024-04-17 09:42:30 PM IST,Almost Shami 2019 to Shai Hope,2
2024-04-17 09:42:31 PM IST,"Shai is the perfect batsman to knock around the ball and get the runs in.

Even 50 more runs and they'd be within a shout here.

These are just too less",4
2024-04-17 09:42:31 PM IST,Atleast 120-130 would have been a tough match...,5
2024-04-17 09:42:36 PM IST,GT have half of the Tamin Nadu Ranji team now lol,6
2024-04-17 09:42:37 PM IST,"Hilarious if they bottle this , the bottom tablets are so much fucking worse than top 4 it's not even funny",4
2024-04-17 09:42:37 PM IST,DC's only Hope is in,2
2024-04-17 09:42:38 PM IST,Pant is holding himself back for swing to die down. Good move.,4
2024-04-17 09:42:39 PM IST,"that's why I love low scoring thrillers. Can u sense the spring in the step of Gujarat Titans boys atm. They believe they can do it. Anything can happen. They were the underdogs after scoring only 89. But that body language says different. For a change bowlers dominate and the value of each run increases that much.

Every dot ball too has the crowd involved... I love low scoring thrillers.",11
2024-04-17 09:42:39 PM IST,Damn missed both the edge and the stumps.,2
2024-04-17 09:42:40 PM IST,"Just play 20 overs and win the match.

We are winning every match from here anyway.",4
2024-04-17 09:42:55 PM IST,Sandeep Warrier when Sanshallow Coward walks in:,8
2024-04-17 09:42:58 PM IST,DC deliberately trying to choke this one,12
2024-04-17 09:42:59 PM IST,Hope? Are we planning to chase this in 15 overs?,6
2024-04-17 09:43:03 PM IST,"Hope this ends up a close match, but DC still wins it.",5
2024-04-17 09:43:19 PM IST,"Shubman channeling his inner Virat. Wait for 2-3 years, when the Gill-Siraj gen are the seniors, you’ll see the aggression",7
2024-04-17 09:43:29 PM IST,Having both Porel and Hope on is fucking crazy considering how low the target is,10
2024-04-17 09:43:31 PM IST,DC is trying to do what gt did last year in the 130 chase,11
2024-04-17 09:43:48 PM IST,I don’t think shaw will ever going to make it to ind playing 11 again,7
2024-04-17 09:44:11 PM IST,Virgin Abhishek Sharma and Travis Head striking at over 200 this season vs. Chad Khaleel with 14 IPL strike rate,10
2024-04-17 09:44:17 PM IST,I request DC to not unleash this form against SRH our Batting might collapse like a Dominos,8
2024-04-17 09:44:29 PM IST,Need a Porel special - 30 off 30 ,1
2024-04-17 09:44:30 PM IST,"Oh, how the mighty have fallen. It's kind of sad seeing Gujarat Titans like this. I mean, I get that some people get schadenfreude seeing such a successful team fail. But while I would also enjoy seeing other teams like RR or DC grab the trophy, it's only good for the IPL and cricket to have a big team like GT really strong and competitive. On this form it looks like they won't even make it to the semis.",9
2024-04-17 09:44:36 PM IST,"Hope and porel, it's gonna be a TUK-TUK fest now.",6
2024-04-17 09:44:42 PM IST,"If we lose this, Jindal might straight land up at Motera in his private chopper and dish out belt treatment to the whole team right then and there",13
2024-04-17 09:44:46 PM IST,2 wickets in an over and this match will become truly interesting.,3
2024-04-17 09:44:48 PM IST,Rashid Khan where,3
2024-04-17 09:45:06 PM IST,DC took half the overs to make the same runs as GT did in the powerplay. Moral victory.,4
2024-04-17 09:45:22 PM IST,"Anyone who's watched Hope in the last year knows that he's dramatically improved his power game, this ""are we chasing it in 15 overs sending him in?"" stuff is nonsense. He's the perfect player for this situation, can strike at a good rate and also anchor to make sure there are no hiccups.",5
2024-04-17 09:45:24 PM IST,"So DC win this one, next one is Warners annual fuck SRH game.",21
2024-04-17 09:45:43 PM IST,"Infuriating to see a talent like Shaw doing nil work for his cricket. His fitness, his short ball technique just gives it away. That dismissal will be teleported to each and every fast bowler about his weakness.",10
2024-04-17 09:45:48 PM IST,If DC bottle this😭 Literally just play test cricket and you’ll get there,7
2024-04-17 09:45:50 PM IST,Ruthless bowling this love to see it😍,4
2024-04-17 09:45:52 PM IST,Porel is made of glass,6
2024-04-17 09:45:55 PM IST,Delhi's biggest rival is its management,10
2024-04-17 09:46:02 PM IST,"Abhi""Shook"" Porel",3
2024-04-17 09:46:05 PM IST,"That little kid just shouted ""nikal"" 💀",2
2024-04-17 09:46:07 PM IST,I am going to Kotla to watch JFM play![img](emote|t5_2qhe0|28120),3
2024-04-17 09:46:13 PM IST,Nice to see some Kryptonian representation in the IPL in Por-El.,1
2024-04-17 09:46:15 PM IST,How we thought pitch would behave on nov 19th 2023 night,4
2024-04-17 09:46:15 PM IST,We need a poop colored cap for the team that most often shits the bed.,2
2024-04-17 09:46:16 PM IST,"Ugh, these two will bore us to death.",4
2024-04-17 09:46:22 PM IST,1 good innings by porel and DC thinks he is perfect at 3,5
2024-04-17 09:46:23 PM IST,Spencer hit him right in the Johnson,5
2024-04-17 09:46:23 PM IST,Yeah bro it didn’t hit the nice area at all,2
2024-04-17 09:46:27 PM IST,"Jiocinema Tamil feed started playing Bazz & Smith CSK partnership, Nehra taking wickets for CSK out of the blue for no reason.",2
2024-04-17 09:46:28 PM IST,Hope is probably the best player to have in this situation for DC,2
2024-04-17 09:46:38 PM IST,After seeing JOhnson's catch I said 'wow what a catch' and then a Herbalife representative immediately materialized in my living room and then proceeded to beat the shit out of me because I didn't call it a 'Herbalife Active Catch of the Match' stay safe guys,5
2024-04-17 09:46:38 PM IST,WTF are these 2 doing? Win this game in the powerplay & spike your run rate by 2 points.,6
