Timestamp,Comment,Upvotes
2024-04-17 08:56:11 PM IST,Jay Shah saw r/cricket complaining about pitches and big scores and hence today's script,4
2024-04-17 08:56:14 PM IST,"77-7

TFAR",6
2024-04-17 08:56:28 PM IST,Mohit learnt how to play in the middle overs by watching Koach and Brohit.,4
2024-04-17 08:56:35 PM IST,"> 77-7   

It just writes for itself... Jay baby strikes AGAIN",2
2024-04-17 08:56:35 PM IST,SRH KKR RR will qualify by this month end,3
2024-04-17 08:56:37 PM IST,Thank God Khaleel is finishing on time and not his usual give the amount of runs he gives in 3 overs.....,4
2024-04-17 08:56:42 PM IST,"[https://www.reddit.com/r/Cricket/comments/1c693y8/comment/kzzyvlk/?utm\_source=share&utm\_medium=web3x&utm\_name=web3xcss&utm\_term=1&utm\_content=share\_button](https://www.reddit.com/r/Cricket/comments/1c693y8/comment/kzzyvlk/?utm_source=share&utm_medium=web3x&utm_name=web3xcss&utm_term=1&utm_content=share_button)

Was close just 1 run",4
2024-04-17 08:56:47 PM IST,What will Nehraji do now? Stand on the boundary ropes and give tips to Khaleel? Come on guys y'all will see Nehraji when GT's bowling,7
2024-04-17 08:56:50 PM IST,Prime ishant sharma?,3
2024-04-17 08:56:51 PM IST,This fucking stupid idiotic ground seeing ‘balls since last boundary ’ want to throw hands,2
2024-04-17 08:56:52 PM IST,Good guy mohit not letting that Khaleel spell go wicket less,6
2024-04-17 08:57:02 PM IST,"Khaleel deserved a wicket for his excellent bowling today.. 

Sumit is a gun fielder..",6
2024-04-17 08:57:03 PM IST,Quick little cameo from Mohit there,2
2024-04-17 08:57:07 PM IST,The duality of this Delhi Capitals team… jheez feel bad for you fans,2
2024-04-17 08:57:08 PM IST,Night watchman is out,3
2024-04-17 08:57:10 PM IST,Rashid (ABD) Khan is still in the crease. Do not lose hope.,6
2024-04-17 08:57:10 PM IST,Misery comes to an end,3
2024-04-17 08:57:11 PM IST,"Wtf is Khaleel celebrating?

Antiques like this will never make him a proper threat bowler",-3
2024-04-17 08:57:13 PM IST,Have a feeling DC could still fuck this up.,3
2024-04-17 08:57:18 PM IST,Saha with a wide grin as Mohit boiii surpasses his 2(10) with a 2(14) ....,5
2024-04-17 08:57:19 PM IST,BC why does Gill keep making that selfie pout face? ,-1
2024-04-17 08:57:20 PM IST,Khaleel like “fuckkkkkkk yeeeaaasssss got a wicket on my last ball yesssss 😭”,5
2024-04-17 08:57:23 PM IST,These fuckers are doing  arithmetic progression with their runs/wickets,2
2024-04-17 08:57:24 PM IST,Great news chat. We will get to sleep early tonight.,2
2024-04-17 08:57:24 PM IST,GT lineup finally playing the way they were expected to play after 2022 Auctions,7
2024-04-17 08:57:27 PM IST,Ayyy,1
2024-04-17 08:57:27 PM IST,Sumit finally contributing something 💀,5
2024-04-17 08:57:28 PM IST,At least get 120 by rotating you chumps,2
2024-04-17 08:57:33 PM IST,"""His name is Khaleel, he's like a happy meal"" iykyk",6
2024-04-17 08:57:36 PM IST,Mohit Sharma saved himself from single digit SR,1
2024-04-17 08:57:39 PM IST,I trust DC bowling enough that GT will still score 140 something,3
2024-04-17 08:57:40 PM IST,"automatic childlike merciful important grandfather melodic practice forgetful butter hobbies

 *This post was mass deleted and anonymized with [Redact](https://redact.dev)*",3
2024-04-17 08:57:44 PM IST,Just declare already I wanna see JFM,2
2024-04-17 08:57:45 PM IST,Shabnam gill pouting 😘🤣,2
2024-04-17 08:57:48 PM IST,By series succession gt will get 88/8 99/9 and 1010/10,2
2024-04-17 08:57:52 PM IST,The Afghan boys,1
2024-04-17 08:57:53 PM IST,Khaleel is what Mitchell starc supposed to be🗿,9
2024-04-17 08:57:55 PM IST,"Off topic, i know DK has announced that this will be his last IPL but did he officially announce his international retirement. I am not sure about that.",3
2024-04-17 08:57:57 PM IST,"Gujarat Titans, once shining bright,
Fallen off the cliff, their season in plight.
Gill's elegant stroke, a moment's delight,
Fell short, his wicket gone, team's light.

Saha's slow innings, painful to see,
Miller's magic lost, fans in misery.
Tewatia's finish, unfulfilled promise,
Collapse, dream lost, season gone stale.

Rashid, a warrior, hero of the game,
Fights with bat and ball, spirit aflame.
Beacon of hope, in dark of night,
Titans' dreams alive, glimmer of light.

Though fallen, they rise, with Rashid's roar,
Team striving to soar, once again score.
Victory's sweet embrace, still in sight,
Rashid's spirit, fire that burns bright.",1
2024-04-17 08:57:59 PM IST,"Finally we can have 2 Afghan Jalebis. 

GT: LOOK AT ME. I SHALL BE NOW AFGHANISTAN NATIONAL TEAM.",5
2024-04-17 08:58:05 PM IST,In chinnaswamy it has gone for a six and commentators must be saying what a six that too at extra covers lol ..... That's why we need big grounds,5
2024-04-17 08:58:09 PM IST,"We seen 66-6 and 77-7

Time for 88-8",3
2024-04-17 08:58:12 PM IST,"**14.6** **taken at deep backward point!** Sumit was placed at deep point, but went to his left to take it low. Khaleel, from around the wicket to Mohit, went for the bouncer around sixth stump. Mohit rode the bounce by leaping in the crease, and went ramping at it. But the ball flew off the top edge, and went dipping on to Sumit

Mohit Sharma c Sumit Kumar b Ahmed 4 (14b 0x4 0x6) SR: 28.57",1
2024-04-17 08:58:12 PM IST,"Go on, give Sumit a bowl. Do it you cowards",8
2024-04-17 08:58:27 PM IST,Khaleel absorbed some of Shami's power from his nipples,4
2024-04-17 08:58:30 PM IST,"This is why you need players like Ashwin in your team, who can prevent the collapse.",7
2024-04-17 08:58:38 PM IST,Does anyone else think Khaleel has fitness issues.....always looks like he is about to faint as long as he finishes his spell.....,2
2024-04-17 08:58:39 PM IST,Why r they happy?? Mohit was wasting balls.. we need him back on pitch,3
2024-04-17 08:58:44 PM IST,This is exactly what I wanted. Got tired of watching 220+ scores every match.,6
2024-04-17 08:58:47 PM IST,GT's gonna get an nrr spanking of epic proportions,2
2024-04-17 08:58:54 PM IST,"This is unfair, let khaleel bat :)",4
2024-04-17 08:59:01 PM IST,this is what I needed after yesterday's and day before yesterday's run fest,3
2024-04-17 08:59:03 PM IST,Afghani Spinner Bois batting together,1
2024-04-17 08:59:05 PM IST,"Me: Mohit went for 2 runs in 14 balls

Friend: Must've had a good day with the ball right?

Me: 🗿",7
2024-04-17 08:59:05 PM IST,How’s warners hand doing,1
2024-04-17 08:59:13 PM IST,Feels like GT is gonna be like RR... win the trophy in 1st season and then.... 💀,2
2024-04-17 08:59:16 PM IST,This is a nail-biter. I have seen this script in the middle period of many franchise leagues.,3
2024-04-17 08:59:18 PM IST,Fraser-McGurk is the lucky charm then,6
2024-04-17 08:59:29 PM IST,This match singlehandedly regressed the IPL back to the mean after the last couple,5
2024-04-17 08:59:33 PM IST,The duality of IPL.,3
2024-04-17 08:59:35 PM IST,Did Pant call Noor patlu,6
2024-04-17 08:59:37 PM IST,DC chasing the target in PP would boost up their NRR,7
2024-04-17 08:59:40 PM IST,"Looking at the DC bowling attack, I was like they are just praying that GT batters would get out before the death. Looks like that strategy is working for now!",3
2024-04-17 08:59:51 PM IST,[deleted],2
2024-04-17 08:59:52 PM IST,"Not a full week i was saying how watching rcb makes me feel better abt my shit life. I knew it could happen to me too

Should have known the forces inevitable would come for the more rightous. God is testing me now. Ill let them know ... when shit hits the fan, im still a fan. 

🙏🫡🧎‍➡️",3
2024-04-17 08:59:54 PM IST,[deleted],-2
2024-04-17 08:59:56 PM IST,bruhh pls just try to take a single,1
2024-04-17 09:00:00 PM IST,Thes should have a test setup for the new batsman,1
2024-04-17 09:00:12 PM IST,"As a neutral, I am hoping for a thriller with DC top 4 shitting on this chase spectacularly and Kuldeep winning the game for DC",4
2024-04-17 09:00:13 PM IST,Did DC drop Nokia?,2
2024-04-17 09:00:18 PM IST,Jay Shah is nothing if not receptive to audience feedback,3
2024-04-17 09:00:24 PM IST,Afg vs GT,6
2024-04-17 09:00:26 PM IST,100 is the number of chicks Shaw bangs every month,5
2024-04-17 09:00:30 PM IST,"keep noor on strike man, more aggro fields please",3
2024-04-17 09:00:40 PM IST,Only way gt can win is if their spinners turn into warne or murali,3
2024-04-17 09:00:42 PM IST,"If Noor and Steve Smith were batting together, Noor would promptly get run out. ",2
2024-04-17 09:00:46 PM IST,Rashid will start hitting now,2
2024-04-17 09:00:53 PM IST,Wtf is Shaw doing there![img](emote|t5_2qhe0|29262)![img](emote|t5_2qhe0|8774),1
2024-04-17 09:00:55 PM IST,DC should make sure folks opening for them can play spin well,3
2024-04-17 09:00:58 PM IST,If noor was india he would have got lot of endorsements just coz of his looks,6
2024-04-17 09:01:00 PM IST,"Axar has bowled economical in most matches.. 

No fuss.. Just comes and does his job quietly.",4
2024-04-17 09:01:02 PM IST,Only 2 overs went above 10 runs 💀,1
2024-04-17 09:01:07 PM IST,"Next years mega auction all teams will be looking to change their teams drastically.

Meanwhile RCB proceeds to keep buying star batters and shit bowlers.",6
2024-04-17 09:01:08 PM IST,I think Delhi missed out on a golden opportunity to flex a win without using the impact player,1
2024-04-17 09:01:08 PM IST,Jay shah clapping back at the batriarchy allegations,3
2024-04-17 09:01:11 PM IST,Mohit Sharma today 2.2-0-14-0,1
2024-04-17 09:01:12 PM IST,"Why did GT management agreed to let go of their captain and that too without any exchange ?

I mean I have never seen such a short sighted approach.

They should have let Hardik go straight to the mega auction as a fk u to him and MI.",3
2024-04-17 09:01:14 PM IST,"Pant lost DC 2-3 games by bowling Nokia in the final overs. When he got hit for 20 runs in first match ,no lets do that for another 3 games.",1
2024-04-17 09:01:15 PM IST,"'Bete ek zamana tha jab hum bhi choker hua karte they, raato raat Clutch ban gye hum'- DC probably

Tr: turned their game around",2
2024-04-17 09:01:27 PM IST,come on kulya don’t go wicketless,2
2024-04-17 09:01:28 PM IST,Yeah. Nokia not needed thank you very much.,3
2024-04-17 09:01:30 PM IST,Surely Delhi won't bottle it right,9
2024-04-17 09:01:30 PM IST,Tf happened there,3
2024-04-17 09:01:32 PM IST,Fuck you pant,-5
2024-04-17 09:01:35 PM IST,Rashid Khan cant win with these KATZ,4
2024-04-17 09:01:44 PM IST,What tf are umpires smoking,7
2024-04-17 09:01:47 PM IST,"Its either 200+ for both teams or sub-100 totals now, Jay Shah does not like to have a normal game",8
2024-04-17 09:01:47 PM IST,no way,2
2024-04-17 09:01:57 PM IST,Why not bring ishant or Mukesh to finish the tail,2
2024-04-17 09:02:03 PM IST,dafaq was that laugh spidey bro,2
2024-04-17 09:02:09 PM IST,Pant is giving heart attacks to GT fans by appealing,8
2024-04-17 09:02:17 PM IST,Not our,3
2024-04-17 09:02:22 PM IST,Goofy ah laugh,3
2024-04-17 09:02:23 PM IST,Rashid angry. Rashid hit 6,15
2024-04-17 09:02:27 PM IST,One touch one hand out,5
2024-04-17 09:02:32 PM IST,"To Ipl script writers,287,277,272,262, all these scores can be only balanced out by 25,35,40,50 all-out scores.Ipl history needs to be more balanced.",7
2024-04-17 09:02:34 PM IST,Holy well,3
2024-04-17 09:02:39 PM IST,LETS FUCKING GO RASHID,3
2024-04-17 09:02:40 PM IST,First Six of the Match,2
2024-04-17 09:02:41 PM IST,Let's go afgan show,4
2024-04-17 09:02:43 PM IST,if rashid takes them to 120 i think with their bowling and dc’s batting they can defend it,4
2024-04-17 09:02:44 PM IST,Meme review,2
2024-04-17 09:02:44 PM IST,In the slot.. Come On kuldeep,7
2024-04-17 09:02:48 PM IST,FIRST SIX OF THE MATCH,4
2024-04-17 09:02:51 PM IST,IPL script writers are best. They actually listen to feedbacks. People were getting bored of high scores so today they brought this for us.,7
2024-04-17 09:02:52 PM IST,End this in 5 overs to make a statement.,2
2024-04-17 09:02:52 PM IST,'Bhaisaab bohot zor se maar rahe the' LMAOO,4
2024-04-17 09:02:58 PM IST,First six of the match,1
2024-04-17 09:02:58 PM IST,MF Cheerleaders dancing on first six after 16 overs,2
2024-04-17 09:02:59 PM IST,I can clearly see the ball bounce after hitting the bat 💀💀,2
2024-04-17 09:02:59 PM IST,Hardik Pandya's curse is so strong that it's affecting both the team he left and the team he rejoined.,3
2024-04-17 09:03:00 PM IST,Rashid needs to open.,3
2024-04-17 09:03:02 PM IST,First six of the match,1
2024-04-17 09:03:04 PM IST,Pant is annoying behind the stumps,-3
2024-04-17 09:03:04 PM IST,88-8 loading,2
2024-04-17 09:03:08 PM IST,AFGHAM JALEBI,3
2024-04-17 09:03:10 PM IST,Gill can't stop smiling,2
2024-04-17 09:03:15 PM IST,Just get him out already,1
2024-04-17 09:03:17 PM IST,rashid has to be the most no fucks given batsman in the ipl,7
2024-04-17 09:03:17 PM IST,Wait what happened here..,2
2024-04-17 09:03:19 PM IST,89-9 ?,2
2024-04-17 09:03:19 PM IST,Today every GT player is getting off the crease just after hitting the ball without looking where the ball is,1
2024-04-17 09:03:21 PM IST,"Peeps, here's your 88-8",8
2024-04-17 09:03:25 PM IST,"Ump would probably review that six if Pant appealed, just play the game and quit reviewing all the obvious dumb shit",3
2024-04-17 09:03:28 PM IST,"Goal should be 120-130 now. We need Rashid to hard carry. Maybe we can pull off a miracle then.

The pitch is good for spinners, our spinners are the best in the business.",10
2024-04-17 09:03:29 PM IST,Jay woke up and chose ~~violence~~  peace after seeing all those balls being wrecked the last couple of days,-1
2024-04-17 09:03:31 PM IST,Rashid thinks he is maxwell,2
2024-04-17 09:03:35 PM IST,88-8 bois,9
2024-04-17 09:03:36 PM IST,Rashid Bhai not tonight please,1
2024-04-17 09:03:55 PM IST,"Let’s be real, Rashid is a proper finisher with the bat. Better than Narine in the lower order",2
2024-04-17 09:03:55 PM IST,fuck man Atleast try to hit,0
2024-04-17 09:03:56 PM IST,Thala hit 20(4) so 100(20)?,7
2024-04-17 09:03:57 PM IST,Next checkpoint 99-9,2
2024-04-17 09:04:02 PM IST,"Rashid making 8% of the runs in one ball, that's why hes the GOAT",10
2024-04-17 09:04:09 PM IST,Rashid must be angry on pant that's why he hit six,1
2024-04-17 09:04:10 PM IST,"What the fuck, I forgot this match was even on but what the fuck happened, how are gt at this score against delhi’s bowling",0
2024-04-17 09:04:10 PM IST,No nehra cam today ?,1
2024-04-17 09:04:11 PM IST,Bowling holy shit,1
2024-04-17 09:04:11 PM IST,finally GT cheerleaders got to show some move,1
2024-04-17 09:04:16 PM IST,"Good

Now gimme a 99-9",10
2024-04-17 09:04:27 PM IST,A beauty of a ball.,1
2024-04-17 09:04:29 PM IST,When do we see a slip in 17th over of game..,2
2024-04-17 09:04:34 PM IST,They may actually reach 110-120,2
2024-04-17 09:04:36 PM IST,"Stadium must be at least 50,000 full yet looks pretty empty. Just goes to show how massive the Narendra Modi stadium is.",2
2024-04-17 09:04:36 PM IST,88-8 achieved,2
2024-04-17 09:04:43 PM IST,Tbh if Rashid work on his temperament he can open like Narine and hit a century.... Rashid had great hand eye coordination and striking abilities.,8
2024-04-17 09:04:47 PM IST,"28/2 -> 28/3  
47/5 -> 48/6  
66/6 -> 66/7  
77/7 -> 78/8  
88/8 -> 88/9 ?",7
2024-04-17 09:04:47 PM IST,88-8 baby,5
2024-04-17 09:04:49 PM IST,"99-9
1010-10",12
2024-04-17 09:04:54 PM IST,"We saw 66-6,77-7 now 88-8. Now please make it 99-9",6
2024-04-17 09:04:54 PM IST,It's been 17 overs 😱,2
2024-04-17 09:05:00 PM IST,Noor > rest of the batters,3
2024-04-17 09:05:03 PM IST,I do love low scoring thriller! each dot ball adds more tension and each run adds another layer of stress,7
2024-04-17 09:05:04 PM IST,88-8 👍🏻 now onto 99-9,3
2024-04-17 09:05:05 PM IST,"https://www.espncricinfo.com/series/indian-premier-league-2023-1345038/gujarat-titans-vs-delhi-capitals-44th-match-1359518/full-scorecard

Last time these two played here was a 130 vs 125 game which DC won by 5 runs.

Tewatia got 20 from 7 that game which looks mental compared to the other scores",7
2024-04-17 09:05:16 PM IST,Man this 25 year old youngster can really bat,4
2024-04-17 09:05:21 PM IST,My uncle's girlfriend who works in nintendo told me Iyer has a problem hooking up with girls,3
2024-04-17 09:05:21 PM IST,Pant's stump mic commentary >>> official box commentary.,8
2024-04-17 09:05:25 PM IST,will be lucky to get it to 100 now,3
2024-04-17 09:05:25 PM IST,88-9 lmao,4
2024-04-17 09:05:26 PM IST,This match should end by 10:10,9
2024-04-17 09:05:27 PM IST,88-9,5
2024-04-17 09:05:37 PM IST,Mukesh McGrath strikes...,4
2024-04-17 09:05:40 PM IST,"I believe in the script now

88-9",6
2024-04-17 09:05:40 PM IST,"
Ah shit",2
2024-04-17 09:05:45 PM IST,99 all out?,2
2024-04-17 09:05:46 PM IST,How positive is my guy Rishabh today,4
2024-04-17 09:05:48 PM IST,Gone,2
2024-04-17 09:05:49 PM IST,Damn u all predicted it,4
2024-04-17 09:05:53 PM IST,Under 100 now surely,7
2024-04-17 09:05:55 PM IST,Watch Delhi bottle this btw,4
2024-04-17 09:06:01 PM IST,Mukesh McGrath for a reason,-2
2024-04-17 09:06:02 PM IST,"Hahahahahah


99/9 IS REAL",6
2024-04-17 09:06:05 PM IST,Thank you Mukesh bhai![img](emote|t5_2qhe0|28120),4
2024-04-17 09:06:07 PM IST,It's joever,1
2024-04-17 09:06:13 PM IST,"strong languid zephyr rinse placid nutty cow sloppy square panicky

 *This post was mass deleted and anonymized with [Redact](https://redact.dev)*",3
2024-04-17 09:06:13 PM IST,"Sorry GT fans. I jinxed it

https://www.reddit.com/r/Cricket/s/RZepgWQ5bc",2
2024-04-17 09:06:14 PM IST,Take that rashid,3
2024-04-17 09:06:16 PM IST,"On Sunday Rohit was GoAT, on Monday Head was GoAT and yesterday it was Butler. So who'll be GoAT today?",3
2024-04-17 09:06:17 PM IST,"Ah fuck, there goes the match. ",3
2024-04-17 09:06:22 PM IST,"Guys, will we see 99-9?",2
2024-04-17 09:06:25 PM IST,What happened to DC legend Aman Khan?,2
2024-04-17 09:06:27 PM IST,I can’t believe Khaleel was allowed to bowl out when DC have this guy,0
2024-04-17 09:06:28 PM IST,What are the odds GT pass Buttler's score of 107 yesterday? Looking even more unlikely with Rashid Khan's wicket now.,3
2024-04-17 09:06:29 PM IST,What happened? I missed the cricinfo commentary? How did GT collapsed?,2
2024-04-17 09:06:33 PM IST,Delhi will be 23/5 in the powerplay,-2
2024-04-17 09:06:34 PM IST,"Rashid is such a clutch player, those 31 runs are huge",5
2024-04-17 09:06:34 PM IST,All I'm saying is that if there's a team that can bottle this....it's DC,6
2024-04-17 09:06:34 PM IST,Still GT played better than RCB,2
2024-04-17 09:06:36 PM IST,Well done rashid 👏,2
2024-04-17 09:06:36 PM IST,JFM is the true impact player in this DC squad,3
2024-04-17 09:06:37 PM IST,"Mukesh takes a wicket and immediately Pan masala add, waooo",9
2024-04-17 09:06:38 PM IST,"**17.1** **tickled to Pant!** Rashid went upper-cutting at this short ball in the channel outside off, but played at it away from his body and while still in the crease. The ball took a faint top edge, as Pant took the catch with a reverse cup. GT's last hope is gone

Rashid Khan c †Pant b Mukesh Kumar 31 (24b 2x4 1x6) SR: 129.16",1
2024-04-17 09:06:44 PM IST,Imagine DC does WPL S1 DC vs GG here and chase this in PP.,5
2024-04-17 09:06:45 PM IST,Bro even with this shambolic batting they got to 88. How the heck did 49 all out even happen lmfao.,14
2024-04-17 09:06:45 PM IST,Feeling bad for GT fans who spent on those tickets to stadium,3
2024-04-17 09:06:51 PM IST,Gujarat crowd is the worst,5
2024-04-17 09:06:53 PM IST,"GT doing bad without Hardik,   

Hardik doing bad without GT,   

will we see a reunion next year? I hope so!!",7
2024-04-17 09:06:55 PM IST,if the pitch isnt a flat road we tend to produce such performances not only GT. They need to bring back the avg 160 pitches quickly  or we'll get caught out in the WC,11
2024-04-17 09:07:03 PM IST,Put me out of my misery,6
2024-04-17 09:07:04 PM IST,Jay Shah will give us the Daredevils chase tonight,1
2024-04-17 09:07:13 PM IST,"Ok that's it. Sub 100 total. This is too little to defend. 

Fair play to DC.",4
2024-04-17 09:07:14 PM IST,Maxi making fun of Akaay,2
2024-04-17 09:07:16 PM IST,88 is the score SRH score alone in PP,7
2024-04-17 09:07:22 PM IST,"49 all out seems like such a fever dream... with 11 batters (and the likes of Gayle, ABD, Kohli nonetheless), how on earth can a team only get 49?? i think its gonna be one of those records that wont be broken for some time... it truly is enigmatic, like even if you tuk tuk, you should be able to get 60-80 runs lol",10
2024-04-17 09:07:27 PM IST,"28/2 -> 28/3  
47/5 -> 48/6  
66/6 -> 66/7  
77/7 -> 78/8  
88/8 -> 88/9

Pattern",7
2024-04-17 09:07:29 PM IST,"One team that can bottle this chase is us.

The second team is DC",5
2024-04-17 09:07:31 PM IST,i have a shit feeling we're losing this,2
2024-04-17 09:07:36 PM IST,"DC fans calm down, Pant is one of the best players on tough tracks, Shai too, it'll be smooth sailing",8
2024-04-17 09:07:37 PM IST,Ahmedabad has had a series of silencing games over the past year,6
2024-04-17 09:07:39 PM IST,maybe it was hardik making the difference.... MAYBE,14
2024-04-17 09:07:43 PM IST,"11-1 ✅ 

22-2 ❌ 

33-3 ❌ 

44-4 ✅ 

55-5 ❌ 

66-6 ✅ 

77-7 ✅ 

88-8 ✅ 

99-9 ❓",12
2024-04-17 09:07:50 PM IST,Prithvi you dufus.. Learn to field ffs,3
2024-04-17 09:07:51 PM IST,Shaw starts on -5,10
2024-04-17 09:07:54 PM IST,C'mon homelander let's go,2
2024-04-17 09:07:55 PM IST,Now JFM needs to go berserk in the PP,5
2024-04-17 09:07:56 PM IST,Mi next year buys Gill  and makes him captain and trades Ishan to Rcb.,8
2024-04-17 09:07:56 PM IST,MukGrath,1
2024-04-17 09:07:56 PM IST,Now when bowlers at the top and dismantled the batting people will say it's a boring match which is true it's a boring match .... Means fans never happy,4
2024-04-17 09:07:58 PM IST,Nehra ji coconut water got over I think,6
2024-04-17 09:08:03 PM IST,"**17.3**

Noor Ahmad b Mukesh Kumar 1 (7b 0x4 0x6) SR: 14.28",2
2024-04-17 09:08:04 PM IST,Rashid khan highest scorer 💀,6
2024-04-17 09:08:04 PM IST,"They should stop games in Motera 
150k capacity 
Hardly 15-30k come",4
2024-04-17 09:08:15 PM IST,mukgrath,6
2024-04-17 09:08:20 PM IST,All out under 100,5
2024-04-17 09:08:22 PM IST,Is this the first time a team has got all out this season?,9
2024-04-17 09:08:24 PM IST,99-9 denied.,5
2024-04-17 09:08:24 PM IST,DC can get their NRR back on track,10
2024-04-17 09:08:30 PM IST,Mukesh McGrath knows how to clean a tail..,7
2024-04-17 09:08:31 PM IST,Lol DC without any foreign pacer bowling out GT for 89.. unbelievable,5
2024-04-17 09:08:32 PM IST,"Fuck mukesh

I wanted to see 99-9",3
2024-04-17 09:08:32 PM IST,Put some respect on his name🤫,3
2024-04-17 09:08:33 PM IST,Not 99. It's 89 all out.,3
2024-04-17 09:08:33 PM IST,Naurr 89,6
2024-04-17 09:08:33 PM IST,"The obligatory ""This guy can bat"" comment from Dominic Cork on Spencer Johnson there",3
2024-04-17 09:08:35 PM IST,99-9 missed,5
2024-04-17 09:08:38 PM IST,Mukeshbra >>>Mcgrath,3
2024-04-17 09:08:41 PM IST,"That's it. 89 it is. Time to improve their NRR DC mfs, don't fuck this up now....",4
2024-04-17 09:08:42 PM IST,Is it okay to feel confident for Capitals now?,4
2024-04-17 09:08:43 PM IST,Script aagaii,3
2024-04-17 09:08:45 PM IST,Mukesh McGrath,2
2024-04-17 09:08:45 PM IST,89 all out,1
2024-04-17 09:08:46 PM IST,DC great,2
2024-04-17 09:08:46 PM IST,![img](emote|t5_2qhe0|8774),2
2024-04-17 09:08:47 PM IST,Nope! No 99-9,6
2024-04-17 09:08:48 PM IST,This whole innings was a joke,8
2024-04-17 09:08:51 PM IST,Never knew a team like dc can put me to that level of misery,19
2024-04-17 09:08:58 PM IST,Stranded at 1(1)\*  💔,3
2024-04-17 09:09:00 PM IST,Jay shah saw the batriarchy memes so he changed the script,5
2024-04-17 09:09:01 PM IST,Spencer got off strike on purpose,1
2024-04-17 09:09:02 PM IST,Chasing in 9 overs btw,3
2024-04-17 09:09:02 PM IST,"Mukesh McGrath denied me that juicy 99-9

He should be nowhere near ye T20 WC side",5
2024-04-17 09:09:05 PM IST,Both 250 pitches and sub 150 pitches are absolute dogshit,1
2024-04-17 09:09:11 PM IST,"WE WILL BOWL FIRST

Fuck yeah we will.",3
2024-04-17 09:09:11 PM IST,They should try to chase this in powerplay,8
2024-04-17 09:09:11 PM IST,Gopalganj Gutka Glenn Mukgrath,4
2024-04-17 09:09:14 PM IST,"If Nokia was bowling today, GT wins",4
2024-04-17 09:09:20 PM IST,"Definitely losing 49 rs on D11

But fuck yeah less gooooooo DC 🐅",2
2024-04-17 09:09:22 PM IST,Mukesh McGrath strikes again,3
2024-04-17 09:09:25 PM IST,Can't ask for more from the bowling really. Imagine coming from 30 an over Nortje to this.,2
2024-04-17 09:09:27 PM IST,If we can chase this in 9 overs then our NRR shall go from -0.975 to -0.05,2
2024-04-17 09:09:28 PM IST,"GT have fallen off. Massive nrr damage probably, qualification looks difficult.",6
2024-04-17 09:09:29 PM IST,Lord Mukesh about to shithouse his way to WC.,3
2024-04-17 09:09:30 PM IST,hope asking pant to open he gonna finish game in PP,2
2024-04-17 09:09:37 PM IST,"The only ground where a DJ with a mic is valid. GT fans, scream and support your team morons",6
2024-04-17 09:09:37 PM IST,DC to chase in 8 overs,2
2024-04-17 09:09:38 PM IST,How good is Mukesh? Any chance of him in T20 wc?since our pacers aren't looking good,1
2024-04-17 09:09:39 PM IST,A 10 wkt win would be special,4
2024-04-17 09:09:41 PM IST,Early bedtime today. Will be finished under 10 overs.,8
2024-04-17 09:09:41 PM IST,Hope everything is fine with Dada. He looks like he’s been crying the whole time ,6
2024-04-17 09:09:44 PM IST,Shaw should end the game in PP for a massive NRR boost,8
2024-04-17 09:09:47 PM IST,Why Ganguly looking sad,2
2024-04-17 09:09:47 PM IST,I don't know why I'm smiling,5
2024-04-17 09:09:48 PM IST,89 all out. Who'd be a batsman in the Tata IPL.,4
2024-04-17 09:09:48 PM IST,Bruh 1day I didn’t watched the match and mukesh gutka kumar wrecked havoc,6
