Timestamp,Comment,Upvotes
2024-04-17 08:19:49 PM IST,What happened to Gillmedabad. Is it a different ground. ?,2
2024-04-17 08:19:50 PM IST,"Yea  wtf, where’s axar",3
2024-04-17 08:19:57 PM IST,Is 6 wickets in 1 run credible (ignore flair),8
2024-04-17 08:19:59 PM IST,"In kuldip’s over, commentators were not even talking lol. 

Whole over was rishab pant commentating",11
2024-04-17 08:19:59 PM IST,Tempo for the innings lol,6
2024-04-17 08:20:01 PM IST,Pant doing the most.,6
2024-04-17 08:20:09 PM IST,GT honestly has the most pathetic batting lineup in the IPL.,4
2024-04-17 08:20:10 PM IST,Nice angle,5
2024-04-17 08:20:14 PM IST,OUT,5
2024-04-17 08:20:20 PM IST,Bruh I swear if DC loses the match here ,5
2024-04-17 08:20:22 PM IST,JFM hair looks wild. Edit: My bad I meant stubbs,3
2024-04-17 08:20:24 PM IST,Dam  Saha looks like a COACH!,2
2024-04-17 08:20:29 PM IST,Out![img](emote|t5_2qhe0|29262),3
2024-04-17 08:20:30 PM IST,Looks out?,3
2024-04-17 08:20:30 PM IST,why do they do ultraedge for Stumping?,2
2024-04-17 08:20:34 PM IST,Lmaoo per 5,4
2024-04-17 08:20:36 PM IST,Ooooooo,3
2024-04-17 08:20:36 PM IST,I'm sorry Stubbs. I wasnt familiar with your game. Fuck yeah.,44
2024-04-17 08:20:37 PM IST,"we’re coming for the cup this time boys, y’all don’t know our game, FUCK OFF ",14
2024-04-17 08:20:38 PM IST,Does stubbs even bowl?,8
2024-04-17 08:20:38 PM IST,Stubbs we Love You..,16
2024-04-17 08:20:38 PM IST,This is fucking Pant he is a genius,24
2024-04-17 08:20:39 PM IST,Yep,5
2024-04-17 08:20:43 PM IST,Panty boi,8
2024-04-17 08:20:47 PM IST,Pant has adopted MS's keeping technique,8
2024-04-17 08:20:48 PM IST,what can this guy not do,8
2024-04-17 08:20:49 PM IST,Gone this time. Spidy you beauty,13
2024-04-17 08:20:51 PM IST,HOLY SHIT,6
2024-04-17 08:20:56 PM IST,"**8.3** Pant is delighted for a potential stumping... but this will go to the third umpire too. Manohar was trying to push at this length ball dipping just outside off, but was beaten on the outside edge. His back foot seems just outside the crease, and the third umpire concludes that no part of it is on the crease. So Pant stumps Manohar, as Stubbs strikes

Abhinav Manohar st †Pant b Stubbs 8 (14b 1x4 0x6) SR: 57.14",3
2024-04-17 08:20:57 PM IST,"47/5   
Rishab has Spidey Senses today for sure",9
2024-04-17 08:20:57 PM IST,GT is well coached but they’re severely deficient on talent.,10
2024-04-17 08:20:58 PM IST,Hahahahahahahahhahahahahahah STUBBSY,7
2024-04-17 08:21:00 PM IST,I love Ahmedabad crowd lol. They're there just for shits n giggles,20
2024-04-17 08:21:00 PM IST,Stubbs taking a wicket. It's all happening- the resurgence of DC!!,11
2024-04-17 08:21:01 PM IST,Wtf how Stubbs getting wicket,9
2024-04-17 08:21:01 PM IST,Pant is thala regen?,11
2024-04-17 08:21:02 PM IST,Got out to Stubbs lmao,3
2024-04-17 08:21:05 PM IST,Pant is on a roll today,5
2024-04-17 08:21:10 PM IST,This smart camera or whatever is really good. One of the rare IPL innovations that actually smashes,5
2024-04-17 08:21:11 PM IST,Stubbs has done enough to get retained. But but our management,6
2024-04-17 08:21:12 PM IST,New entrant for tuk tuk academy,1
2024-04-17 08:21:13 PM IST,Pant taking off everyone's Panties ☠️,7
2024-04-17 08:21:15 PM IST,Stubbs does the job.,1
2024-04-17 08:21:15 PM IST,I take my comment back bowl him more Pant lessgoo,6
2024-04-17 08:21:16 PM IST,"obviously RCB getting cheers inside GT home stadium 



*oh wait*",2
2024-04-17 08:21:17 PM IST,This is not out,-2
2024-04-17 08:21:18 PM IST,GT has a whole bunch of anchors that can only anchor on a flattie,3
2024-04-17 08:21:21 PM IST,"Yeah if anybody wants to practice their serial killing, dm me i’ll send you the address",3
2024-04-17 08:21:25 PM IST,Their best batter is yet to come,6
2024-04-17 08:21:27 PM IST,"5 wickets for two runs 

please make it possible",4
2024-04-17 08:21:27 PM IST,Pant and Samson sound exactly the same behind the stumps after a stumping or a catch.,3
2024-04-17 08:21:29 PM IST,Ahmedabad is a nightmare for the home team!,4
2024-04-17 08:21:29 PM IST,5 left,1
2024-04-17 08:21:29 PM IST,Double hatrick and we beat rcb,2
2024-04-17 08:21:30 PM IST,how tf is Pant's keeping better than pre-injury fucking hell,11
2024-04-17 08:21:30 PM IST,2 runs to escape it,7
2024-04-17 08:21:32 PM IST,Holy shit man,1
2024-04-17 08:21:32 PM IST,Whatever sanju can do Pant will do it better,4
2024-04-17 08:21:36 PM IST,Need 3 runs from 12 overs,5
2024-04-17 08:21:38 PM IST,Sad that delhi's jersey is not yellow and we won't see commentators analyzing this stumping after every ball.,8
2024-04-17 08:21:39 PM IST,DELHI READY FOR TAKE OFF PANTY GONNA TAKE US TO THE MOON,5
2024-04-17 08:21:41 PM IST,Fuck sake.,1
2024-04-17 08:21:44 PM IST,"DC should try to convince RCB to let them take Virat Kohli,   

BRING HIM HOME!!",6
2024-04-17 08:21:44 PM IST,"If Vin Diesel had an Indian son, Abhinav Manohar would be him",1
2024-04-17 08:21:48 PM IST,"If Stubbs is not retained by this DC management, I will finally stop supporting them after 17 years.",5
2024-04-17 08:21:49 PM IST,looks like teams donn't know how to bat on pitches that aren't flat. :/,5
2024-04-17 08:21:52 PM IST,Not out his section of foot is behind the line innit,1
2024-04-17 08:21:52 PM IST,"Stubbs put a stinger, pant is so good behind the stump today. Panties status wet",2
2024-04-17 08:21:53 PM IST,"Expectations from Stubbs with the ball: 🤡🤡

Actually Stubbs with the ball: 🗿🗿",9
2024-04-17 08:21:54 PM IST,Pantboi is all set for the WC20 babyy!,4
2024-04-17 08:21:54 PM IST,you'd think experienced commentators would stop suggesting DC has reviewed something when it's a stumping appeal umpire review,6
2024-04-17 08:22:03 PM IST,What in the actual fuck?! 5 wickets down before the 50 run mark.,2
2024-04-17 08:22:04 PM IST,You don't leave the crease when Spidy Pant is behind the stumps.,2
2024-04-17 08:22:08 PM IST,This is where Kane Williamson would have been of use,6
2024-04-17 08:22:09 PM IST,GT are fucked if Gill doesn't fire,7
2024-04-17 08:22:14 PM IST,Pant is Thala on steroids bitchess,9
2024-04-17 08:22:16 PM IST,GT finally playing like the team they are on paper 😭,24
2024-04-17 08:22:18 PM IST,"This is the CEAT Tyre Strategic Timeout^TM    

Put some respect on that name, BRUH",2
2024-04-17 08:22:18 PM IST,Panty making his case with his spidy keeping. Best keeper right now?,5
2024-04-17 08:22:21 PM IST,"Pant is going to world cup thats 100%

Lets see how much wait till we see him as test captain.",7
2024-04-17 08:22:23 PM IST,"People were shitting on pant for his captaincy but won't praise him today for his great captaincy lol great job panty boi,I think he has alot to improve but he will get there.",17
2024-04-17 08:22:29 PM IST,Rishabh has been on fire today,10
2024-04-17 08:22:30 PM IST,Stubbs for WC!,3
2024-04-17 08:22:32 PM IST,The foot was on the crease. It is not out.,-6
2024-04-17 08:22:41 PM IST,Pants keeping and Enthusiasm is in a different planet level tonight.. Absolutely LIT 🔥,4
2024-04-17 08:22:41 PM IST,GT’s Narine in da house![img](emote|t5_2qhe0|28120),4
2024-04-17 08:22:45 PM IST,"Pant learning from Dhoni,   

Thala for a REASON",1
2024-04-17 08:22:46 PM IST,"Our batting lineup  
1:Gill  
2.  
3.  
4.  
5.  
6.  
7. Rashid",3
2024-04-17 08:22:47 PM IST,Man loving this match. Such a palate cleanser from the recent matches.,3
2024-04-17 08:22:47 PM IST,Ofcourse Rayudu mentions Dhoni within a minute of that stumping lol,2
2024-04-17 08:22:54 PM IST,Openers of GT are finally here,4
2024-04-17 08:22:55 PM IST,"boys, do wickets count in the NRR calculation? if we get them all out in 10 overs is that better or letting them drag along till 20 and get a very low score? ",2
2024-04-17 08:22:59 PM IST,I think Pants banter got to their head,3
2024-04-17 08:23:05 PM IST,This batting line-up reminds me of the NZ batting line-up of the 80s,3
2024-04-17 08:23:10 PM IST,Can we use all batters as bowlers it'd be fun,3
2024-04-17 08:23:11 PM IST,Stubbs is what Markram aspires to be. ![img](emote|t5_2qhe0|21267),1
2024-04-17 08:23:12 PM IST,Needed that NRR boost sorry GT,5
2024-04-17 08:23:16 PM IST,"Tristan can do everything! Keeps and bangs in SA20, bowls occasionally!",1
2024-04-17 08:23:17 PM IST,"Pant, Axar, Kuldeep and Stubbs will be my four retentions for DC.",1
2024-04-17 08:23:19 PM IST,gill messes up one day and this is what the lineup does,8
2024-04-17 08:23:20 PM IST,"If Thala did that stumping, they would have shown that replay 10 more times - Jalbhajan",13
2024-04-17 08:23:24 PM IST,Great we are developing a SA allrounder on the Indian pitches and not developing our own allrounders,1
2024-04-17 08:23:24 PM IST,Pant you beauty. Not even nariyal Pani can save them now.,4
2024-04-17 08:23:26 PM IST,GT. Is now just gill and Rashid .... Rest are just meh,6
2024-04-17 08:23:28 PM IST,The cricinfo forecast projects GT to only score 104 ☠️,9
2024-04-17 08:23:36 PM IST,GT could've used Shakar's 30(40) here.,10
2024-04-17 08:23:42 PM IST,I actually think this field is a minefield like CSK vs RCB opener where CSK chased 70 runs in 19 overs. There's no way Stubbs a batting allrounder can turn the ball that much with his skill,4
2024-04-17 08:23:43 PM IST,Best Indian keeper rn?,3
2024-04-17 08:23:45 PM IST,Stubbs is a keeper no?,1
2024-04-17 08:23:47 PM IST,![img](emote|t5_2qhe0|8780),2
2024-04-17 08:23:49 PM IST,"1 transfer ruined 3 teams - MI, GT, RCB",9
2024-04-17 08:23:50 PM IST,"Yes GT. 
Get fucking stuffed. 
(Don't read flair)",2
2024-04-17 08:23:52 PM IST,All this for DC getting all out in second innings,1
2024-04-17 08:23:56 PM IST,pant wants nehra ji to come out and bat,3
2024-04-17 08:23:57 PM IST,Pant to Jay Shah: “Sign the contract big boy”,1
2024-04-17 08:23:59 PM IST,"Every single day I wonder how a lineup of Prime Kohli, Gayle, Abd failed to score more than 49",7
2024-04-17 08:23:59 PM IST,This season these 2 are the only players who are performing consistently for GT,2
2024-04-17 08:24:00 PM IST,"Gill's attitude of ""don't think like that when GT is playing huh"" **spins and leaves** in Shambles",14
2024-04-17 08:24:03 PM IST,"Shubman, Sai and God's grace. That's what GT's batting has been like this year",6
2024-04-17 08:24:11 PM IST,Meanwhile Ponting thinking of all the times he could have bowled his best bowler with 1 SR in Adam Gilchrist.,1
2024-04-17 08:24:13 PM IST,SRK in as impact sub?,4
2024-04-17 08:24:28 PM IST,"Mumbai terrible with pandya

Gujarat terrible without pandya


This phenomenon is called Schrodinger's pandya",80
2024-04-17 08:24:34 PM IST,"Alright guys who are DC bringing in to replace the injured Marsh? 

- Steve Smith

- Josh Inglis

- James Vince

- Ben Duckett

- Rassie vd Dussen

- Finn Allen

- Mark Chapman

- Michael Bracewell

- Dasun Shanaka",3
2024-04-17 08:24:36 PM IST,2 finishers in 9th over,2
2024-04-17 08:24:41 PM IST,One or two more wickets and even Pant can try bowling & see how it goes,2
2024-04-17 08:24:41 PM IST,Panty almost touched the gates of heaven and said let me go I'm gonna be better. AND HE MEANT IT.,11
2024-04-17 08:24:44 PM IST,"Crazy how IPL has a space for everyone. There's a guy who debuted around 2 decades , there's another who signifies an entire generation for Indian cricket and again there's who's the future of the same art in Indian cricket. All three of them rocking the stage simultaneously.",5
2024-04-17 08:24:51 PM IST,Ughhh...get rid of impact sub🙏,3
2024-04-17 08:24:57 PM IST,Why is Pamt advising Stubbs in Hindi,6
2024-04-17 08:24:59 PM IST,💀,1
2024-04-17 08:24:59 PM IST,Why is Pant saying Hindi to Stubbs lmao,8
2024-04-17 08:25:01 PM IST,Lmao he’s gone,3
2024-04-17 08:25:06 PM IST,Wtf is happening,1
2024-04-17 08:25:07 PM IST,Pant talking to Stubbs in Hindi?,4
2024-04-17 08:25:07 PM IST,Maybe DC should've let Manohar stay and try to get Tewatia out,1
2024-04-17 08:25:08 PM IST,Srk and Tewatia have to play it like Ranji for 10 overs now,2
2024-04-17 08:25:09 PM IST,Lmao... This is peak comedy,3
2024-04-17 08:25:10 PM IST,"pant speaking to stubbs in hindi? LMFAOO

ALSO WE JUST GOT ANOTHER HAHAHAHAHA ",11
2024-04-17 08:25:12 PM IST,Speaking to Stubbs in hindi....,8
2024-04-17 08:25:13 PM IST,Delhi vs Hyderabad will be a cracking game,4
2024-04-17 08:25:13 PM IST,What are these guys doing lmao,9
2024-04-17 08:25:13 PM IST,"Next season:

Retain - Gill, Rashid & Shami
RTM - Noor & Miller
Target - Aggressive opening partner for Gill, Aggressive middle order wicket keeper and quality economical pacers to complement Shami",2
2024-04-17 08:25:17 PM IST,Lmao why is pant taking to Stubbs in Hindi 😭,32
2024-04-17 08:25:18 PM IST,nice impact sub LOOL,5
2024-04-17 08:25:18 PM IST,What the fuck ? He is saying long sentences to Stubbs in Hindi,8
2024-04-17 08:25:21 PM IST,[deleted],8
2024-04-17 08:25:24 PM IST,can they slow down i have no plans tonight what am i supposed to watch if this gets over in 30 mins,2
2024-04-17 08:25:25 PM IST,What the actual fuck is going on? Hahahahha,2
2024-04-17 08:25:26 PM IST,"Never write us off

-SomeOne.",2
2024-04-17 08:25:26 PM IST,Pant is the real thala,8
2024-04-17 08:25:27 PM IST,Rishabh not even letting commentators speak lmao,5
2024-04-17 08:25:28 PM IST,Why is Pant giving Stubbs instructions in Hindi?,5
2024-04-17 08:25:28 PM IST,"This is why we let him go

He's awful against spin",3
2024-04-17 08:25:28 PM IST,Wtf panty boyyy onnn fireeeeee gwaaaadddd,5
2024-04-17 08:25:29 PM IST,Stubbs can bowl,2
2024-04-17 08:25:29 PM IST,Pant MOTM for keeping alone. Do it cowards,6
2024-04-17 08:25:31 PM IST,haha,3
2024-04-17 08:25:31 PM IST,Oh my Pant,2
2024-04-17 08:25:31 PM IST,Stubbs knows Hindi??,10
2024-04-17 08:25:32 PM IST,"relieved wise aromatic quack resolute soft full simplistic rude snow

 *This post was mass deleted and anonymized with [Redact](https://redact.dev)*",3
2024-04-17 08:25:37 PM IST,Pant talking to Stubbs in hindi 😭,5
2024-04-17 08:25:37 PM IST,another RCB record in danger 😮‍💨,5
2024-04-17 08:25:38 PM IST,This is a comedic slaughter. I love it!,5
2024-04-17 08:25:40 PM IST,why is pant talking in hindi to stubbs? xD or was it get under the batter's skin,8
2024-04-17 08:25:40 PM IST,1 run for 5 wickets c'mon DC do it,5
2024-04-17 08:25:42 PM IST,Pant to Stubbs in Hindi,4
2024-04-17 08:25:43 PM IST,Did Pant just talk to Stubbs in Hindi lol,6
2024-04-17 08:25:44 PM IST,What an Impact,3
2024-04-17 08:25:44 PM IST,Bruh if this is out too... 😂,2
2024-04-17 08:25:46 PM IST,What the fuck,2
2024-04-17 08:25:49 PM IST,is pant talking to stubbs in hindi lol,5
2024-04-17 08:25:49 PM IST,Rcb’s mouth watering,3
2024-04-17 08:25:50 PM IST,"Lmao was Srk not sitting in the dug out? 
Did he not see how the previous guy got out.",3
2024-04-17 08:25:57 PM IST,"GT know they’re allowed to stay in their crease, right?",4
2024-04-17 08:25:58 PM IST,Pant conversing with stubbs in hindi and it worked😭,5
2024-04-17 08:26:00 PM IST,Will we see 11 wickets for the first time in cricket's history????!,3
2024-04-17 08:26:01 PM IST,"lol, speaking to stubbs in hindi",9
2024-04-17 08:26:06 PM IST,Tripathi level impact that,2
2024-04-17 08:26:07 PM IST,Tired of these wicket fests. There should be proper competition between bat and ball.,3
2024-04-17 08:26:07 PM IST,"He aint speaking to stubbs. He is getting into the batsman's head, Come on guys use some sense!",3
2024-04-17 08:26:08 PM IST,I never thought wicketkeeping could be this electrifying. Pant is such a joy to watch since he plays with so much joy. So great to have him back.,1
2024-04-17 08:26:08 PM IST,"Yeah, Pant is a good front-runner for the WC.",2
2024-04-17 08:26:10 PM IST,Trischandran Stubbsin,3
2024-04-17 08:26:11 PM IST,We don't deserve play off spot.,4
2024-04-17 08:26:11 PM IST,lol he left the ball,2
2024-04-17 08:26:14 PM IST,Shahrukh khan gained more muscles and lost more cricketing brain cells..,5
2024-04-17 08:26:14 PM IST,Why oh why would you send Shahrukh Khan over Vijay Shankar as an Impact Sub when your team is 5 down for fuck all?,3
2024-04-17 08:26:16 PM IST,Bhai Pant converted Stubbs into Delhi ka launda,6
2024-04-17 08:26:16 PM IST,Why is ultra edge being checked?,4
2024-04-17 08:26:17 PM IST,pant is in their heads,10
2024-04-17 08:26:18 PM IST,He didn’t even catch the ball why they checking ultra edge 💀,3
2024-04-17 08:26:18 PM IST,But he doesn't catch it you fucking moron so why check ultra edge,8
2024-04-17 08:26:29 PM IST,Gone,2
2024-04-17 08:26:32 PM IST,Nehra effect not working?,3
2024-04-17 08:26:32 PM IST,oh my god did pant fuck this,7
2024-04-17 08:26:34 PM IST,pant welcome in WC squad,3
2024-04-17 08:26:35 PM IST,"Pant, the man with Midas touch",2
2024-04-17 08:26:36 PM IST,Lmao GT this is absolute clownshow.,2
2024-04-17 08:26:39 PM IST,Good to see Gill getting exposed as a captain. Next one should be Iyer.,1
2024-04-17 08:26:39 PM IST,Lmao thats out,4
2024-04-17 08:26:41 PM IST,dafuk 🤦‍♂️,2
2024-04-17 08:26:41 PM IST,"Gt 2022-23 : obliterating haters
Gt 2024 : obliterating fans",2
2024-04-17 08:26:42 PM IST,Bruh close call,5
2024-04-17 08:26:44 PM IST,"I will say this -

Pant deliberately deflected ball on the stumps. And you can't change my mind about this 😋",7
2024-04-17 08:26:44 PM IST,"Speaking Hindi to Stubbs before enacting a stumping is peak Pant. Omg, is the legend back 😭",9
2024-04-17 08:26:48 PM IST,If they can get past 130. Rashid and Noor might be able to make a match out of it…….And Shahrukh has gone for a duck.,3
2024-04-17 08:26:48 PM IST,"they could have had omarzai instead of spencer today, he can bat decently",3
2024-04-17 08:26:49 PM IST,Clearly ball hit the stump,6
2024-04-17 08:26:49 PM IST,finally a good camera angle in IPL.,6
2024-04-17 08:26:50 PM IST,That's out,4
2024-04-17 08:26:54 PM IST,That's a very tough call,3
2024-04-17 08:26:58 PM IST,Stubbs is Glenn Philips at home,3
2024-04-17 08:26:59 PM IST,This freakin idiot will make it more complicated than it is,2
2024-04-17 08:27:01 PM IST,looks out,0
2024-04-17 08:27:02 PM IST,Did he take the bails off with his gloves?,2
2024-04-17 08:27:04 PM IST,The ball did land but he broke with his gloves lmao,9
2024-04-17 08:27:08 PM IST,the ball clearly hit the stump fucking come on mate ,2
2024-04-17 08:27:08 PM IST,That's some zoom,1
2024-04-17 08:27:08 PM IST,"4 wickets for 2 runs 🙏

make it happen please",2
2024-04-17 08:27:08 PM IST,Bc atleast cross 49,2
2024-04-17 08:27:09 PM IST,Why 3rd umpire is checking for ultra edge. I thought they won’t check or is it only for team reviews?,2
2024-04-17 08:27:09 PM IST,All the mid table teams supporting DC,6
2024-04-17 08:27:11 PM IST,Why is pant talking to stubbs in hindi,3
2024-04-17 08:27:11 PM IST,tf Punter fed Pant today,5
2024-04-17 08:27:13 PM IST,i reckon that's out,2
2024-04-17 08:27:13 PM IST,Huh. Looks glove to me,2
2024-04-17 08:27:15 PM IST,What in the fuck,2
2024-04-17 08:27:17 PM IST,Why’s gt so dead this year,2
2024-04-17 08:27:17 PM IST,Low scoring thriller coming,1
2024-04-17 08:27:17 PM IST,Out,1
2024-04-17 08:27:18 PM IST,"Ah yes, the ""zero impact"" sub",6
2024-04-17 08:27:20 PM IST,That's not out,3
2024-04-17 08:27:21 PM IST,Ashutosh Sharma in 3 matches has already surprassed whatever Shahrukh did for Punjab in 3 years,9
2024-04-17 08:27:21 PM IST,Is he dumb?,1
2024-04-17 08:27:21 PM IST,Out,2
2024-04-17 08:27:22 PM IST,Both ball and glove hit the stump - interesting to see what the call would be here,4
2024-04-17 08:27:23 PM IST,Does not matter give out,1
2024-04-17 08:27:25 PM IST,That’s not out man,1
2024-04-17 08:27:25 PM IST,"Ishant Sharma for WC2024

Along with DK, MSD

Make ICT 2013 again",7
2024-04-17 08:27:25 PM IST,I'd give it out,1
2024-04-17 08:27:27 PM IST,This is boring asf. T20 cricket is for entertainment bring on 200+ pitches.,-11
2024-04-17 08:27:27 PM IST,"Absolute scenes, Rishabh pant being as goofy behind the stumps as he has ever been.",6
2024-04-17 08:27:27 PM IST,Bro did Pant talk to stubbs in hindi LMFAO,10
2024-04-17 08:27:28 PM IST,If it were Thala everyone would have nutted.,2
2024-04-17 08:27:29 PM IST,Gone,1
2024-04-17 08:27:29 PM IST,That's close,2
2024-04-17 08:27:32 PM IST,pant you beauty,2
2024-04-17 08:27:32 PM IST,So that’s a run out then.,2
2024-04-17 08:27:35 PM IST,"Ball hit the stumps but bails fell because of the gloves, cricket experts what's the correct decision 🤔",1
2024-04-17 08:27:35 PM IST,"Virat Kohli's tearing it up in Bengaluru with RCB but the tides are slowly turning against him. Delhi Capitals and their fans are calling him back to his roots. DC fans are lighting up social media, buzzing for their hometown superstar to make a grand return. They’re rallying hard, making noise to swap the red for blue. Let's bring him home!",5
2024-04-17 08:27:36 PM IST,Making the 3rd umpire work for his pay today,9
2024-04-17 08:27:36 PM IST,This angle there is gap between glove and stump,5
2024-04-17 08:27:37 PM IST,Booo,2
2024-04-17 08:27:37 PM IST,Given out though,1
2024-04-17 08:27:38 PM IST,"Pant to Stubbs : ""Ghabraana nahi hai, ball pakad ke daalta reh bas"" 💀

T : Don't worry and just keep bowling tight.",7
2024-04-17 08:27:40 PM IST,"Everybody: lets break the highest score in IPL

GT: Gotta be different from the pack 🗿",10
2024-04-17 08:27:41 PM IST,"Idiot umpire prolly wont give it out due to delay the lighting has

EDIT: Sorry umpire bro, wasnt aware of your game",4
2024-04-17 08:27:41 PM IST,tough tough call,5
2024-04-17 08:27:42 PM IST,Scriptwriters heard everyone complaining about high score games.,4
2024-04-17 08:27:43 PM IST,Bro trying to rob Pant.,3
2024-04-17 08:27:43 PM IST,Rock and roll please,5
2024-04-17 08:27:44 PM IST,"Nehra released A local gem like Urvil Patel and kept this guy who got out to part time bowler/ keeper batter and he was bought for a very high price in the mega auction iirc

He earns more than Sudarshan, Noor, Mohit, Omarzai combined",5
2024-04-17 08:27:44 PM IST,"Cute to see Rishabh Pant speak to Stubbs in Hindi - “Pakad ke daalta raha ise” 

Also, how has DC suddenly transitioned into the menacing Pakistani team of the 90s who were either a massive hit or a flop.",35
2024-04-17 08:27:46 PM IST,[deleted],-1
2024-04-17 08:27:47 PM IST,So that’s a run out,6
2024-04-17 08:27:47 PM IST,"Stubbs seriously came out of syllabus for GT. They had no clue what he will bowl and it shows. Lol, good onya Stubbs. And fair play to Panty for this inspired captaincy...credit where credit is due. Also GT subbed him ahahahahahah.",19
2024-04-17 08:27:50 PM IST,One of the few times I'm happy that the umpire took their time!,10
2024-04-17 08:27:52 PM IST,Stubbs can't do anything wrong for this team atm.,12
2024-04-17 08:27:53 PM IST,[deleted],22
2024-04-17 08:27:56 PM IST,Pant lucky there,2
2024-04-17 08:27:57 PM IST,Right call from 3rd umpire. Should be out as the ball hit the stumps. Bails maybe broken by the glove but it’s inconclusive,4
2024-04-17 08:27:58 PM IST,Wait how is that out?,2
2024-04-17 08:28:01 PM IST,Don't envy the third ump rn that's a genuine toss up,5
2024-04-17 08:28:02 PM IST,Sometimes these replays look like porn -- its like watching a BJ lol,0
2024-04-17 08:28:03 PM IST,GT batting like how everyone expected them to right after the 2022 auction,25
2024-04-17 08:28:03 PM IST,Ahmedabad crowd cheering the wicket.. Wtf is going on..,8
2024-04-17 08:28:03 PM IST,Lmfao. So the ball was making SEPARATE contact with the stump while pant used his gloves,7
2024-04-17 08:28:03 PM IST,"Damn man, GT is so fucked",6
2024-04-17 08:28:05 PM IST,Very impactful,7
2024-04-17 08:28:05 PM IST,How tf did he see the gap from there.,10
2024-04-17 08:28:07 PM IST,That’s an interesting call,8
2024-04-17 08:28:11 PM IST,That’s tough,1
2024-04-17 08:28:12 PM IST,Definitely out,3
2024-04-17 08:28:13 PM IST,Lmao. We are fucked. Good night fellas.,9
2024-04-17 08:28:13 PM IST,Gill will start crying anytime now,5
2024-04-17 08:28:13 PM IST,This over lasted as much as the rest of the innings so far,6
2024-04-17 08:28:15 PM IST,Guys it’s even worse than 50-5,5
2024-04-17 08:28:16 PM IST,Benifit of doubt ?,3
2024-04-17 08:28:17 PM IST,That was a sus angle tf.,2
2024-04-17 08:28:17 PM IST,Impact player with no impact at all. Like zero,7
2024-04-17 08:28:17 PM IST,At least we got Wide yeahh,8
2024-04-17 08:28:18 PM IST,Bruh who would want to be a third umpire in such a situation,4
2024-04-17 08:28:19 PM IST,Why is my blud speaking in hindi with stubbs,3
2024-04-17 08:28:20 PM IST,Never thought Stubbs will be on the hatrick,4
2024-04-17 08:28:21 PM IST,"RCB Boys..

49 is still on.",4
2024-04-17 08:28:22 PM IST,Poor dicision,1
2024-04-17 08:28:23 PM IST,49 STILL AT RISK,9
2024-04-17 08:28:23 PM IST,"Why are you judging the glove touching the stumps based off the one angle you can't actually see whether the glove touches it? 

Pure incompetence by 3rd ump, whether right or wrong.",4
2024-04-17 08:28:25 PM IST,Finally 3rd umpire has some work to do....,1
2024-04-17 08:28:26 PM IST,"what is unfortunate about that? he shat the bed? FUCKING GET OVER IT, BIASED COMMENTATORS NEVER APPRECIATE DC, fuck off the lot of you ",0
2024-04-17 08:28:26 PM IST,"r/cricket: we are so tired of high scoring games!!!!!   

Jay Shah: say less!",16
2024-04-17 08:28:26 PM IST,People were asking a low scoring thriller and IPL is here to deliver it,18
2024-04-17 08:28:27 PM IST,Lmfao DC eating GT alive.,7
2024-04-17 08:28:29 PM IST,[deleted],1
2024-04-17 08:28:30 PM IST,"So Stubbs can bat, bowl, and keep?",7
2024-04-17 08:28:31 PM IST,And a duck! Pant is on fire rn! What have Punter and Dada fed him today man?,4
2024-04-17 08:28:31 PM IST,Wtf is up with Stubbs,3
2024-04-17 08:28:31 PM IST,"don't agree with that decision

the ball hit first but didn't dislodge anything. Pant's gloves 100% were the cause",6
2024-04-17 08:28:31 PM IST,Am I the only one who thought that wasn't out?,8
2024-04-17 08:28:33 PM IST,I thought we were friends DC ![img](emote|t5_2qhe0|8774),3
