Timestamp,Comment,Upvotes
2024-04-17 06:29:43 PM IST,Finally a yearly break ends,5
2024-04-17 06:37:10 PM IST,This thread is as alive as Pant after his accident!,1
2024-04-17 06:44:23 PM IST,Came in. Saw no one is here. Left.,3
2024-04-17 06:45:30 PM IST,DC will win coz of mc gurk 😍,2
2024-04-17 06:48:09 PM IST,![img](emote|t5_2qhe0|8776),2
2024-04-17 06:53:16 PM IST,Good night Guys,4
2024-04-17 06:56:40 PM IST,I am Sarfaraz Khan for tonight's match ![img](emote|t5_2qhe0|8776),3
2024-04-17 06:57:06 PM IST,Let's begin,1
2024-04-17 06:58:49 PM IST,"Where can I find team records in ipl example - most sixes by teams most sixes conceded, most runs scored",3
2024-04-17 07:02:01 PM IST,Shastri still coaching pant on why to bowl first,3
2024-04-17 07:02:22 PM IST,the ground is not even 50% full,4
2024-04-17 07:02:40 PM IST,So today will be Gabba clash....,4
2024-04-17 07:02:49 PM IST,"""Warner samgawjgaaw because of Injury""",3
2024-04-17 07:02:56 PM IST,stadium is as empty as space,2
2024-04-17 07:04:02 PM IST,"Stadium looks so empty. What’s with the stadiums up north? Ahmedabad, Punjab,Delhi & UP stadiums 🏟️ are always empty? Lack of any star players? 🤔",-2
2024-04-17 07:04:26 PM IST,Finally Umesh sits out,3
2024-04-17 07:04:48 PM IST,Miller let’s go baby,7
2024-04-17 07:04:49 PM IST,Can someone explain why Sumit Kumar keeps playing? He neither bowls nor bats.,4
2024-04-17 07:04:56 PM IST,"Dread it, run from it, THE GOAT Sumit is inevitable",3
2024-04-17 07:05:02 PM IST,"Warner not playing ... fuck

Saha and Miller in ... fuck

Won toss, chase .... maybe fuck",8
2024-04-17 07:05:12 PM IST,Nehra would rather throw his cocount away than debut Kartik Tyagi ,8
2024-04-17 07:05:31 PM IST,Chutiya Sumit is back,4
2024-04-17 07:06:20 PM IST,Sumit Kumar keeps getting games and Yash dhull keeps carrying drinks.. Bravo management,8
2024-04-17 07:06:50 PM IST,"Sumit doesn't bring anything new to the table he isn't a good enough batter nor a good enough bowler


I would rather play Yash Dhull or Kumar Kushagra ",9
2024-04-17 07:07:13 PM IST,"Cannot believe Sandeep Warrier is getting a game ahead of Karthik Tyagi, fucking hell.

Also the black soil pitches make for some awful cricket at this ground.",4
2024-04-17 07:07:22 PM IST,Istg if these cunts somehow take it to the last over this time i may as well have a fucking heart attack,9
2024-04-17 07:07:23 PM IST,We are back to make stupid team selection ... i think winning the last game fried Ponting's brain,14
2024-04-17 07:08:00 PM IST,Is DC playing with just 3 overseas players? Surely Jye Richardson is better than Ishant,5
2024-04-17 07:09:07 PM IST,"Pant is like we need to improve death bowling. So, maybe bring an overseas quick in place of Ishant? But they are like Nah we’ll play Sumit Kumar and pray all GT batters get out before death or the forget how to bat at the death.",18
2024-04-17 07:09:12 PM IST,What is that batting line-up DC😭,4
2024-04-17 07:09:20 PM IST,Shahrukh given the debut cap but not on the team sheet,7
2024-04-17 07:09:39 PM IST,Lmao I don’t know whom to support because I like both the teams ,3
2024-04-17 07:09:40 PM IST,"7.5 Cr Kushagra on bench. 

Nobody can spend like DC and RCB on benchwarmers lll",10
2024-04-17 07:10:41 PM IST,Bruh I really hope Sumit does something today. Something that justifies his repeated selections ,5
2024-04-17 07:11:32 PM IST,"We should play 3 spinners Rashid, Noor and Sai Kishore can do much more then we have Mohit too",5
2024-04-17 07:13:04 PM IST,Why is Warner dropped,1
2024-04-17 07:15:14 PM IST,"Both teams make no sense to me. GT has Tewatia and Rashid at 6 and 7, a very risky strategy when batting first. DC is playing only 3 overseas, no overseas batsman in their impact sub so will have to bring in an Indian batsman. ",7
2024-04-17 07:15:47 PM IST,"3 overseas players makes sense as that's all we have left as far as batting goes..the Indian bowling unit has been decent, all of them better than Richardson. Nortje has been given a break to sort himself out and Lizard is a sub. They would have used Lizard if we were bowling second but now it's going to be Porel.",2
2024-04-17 07:16:17 PM IST,Finally 3D Shankar dropped. Finally. Praise the lords our Nehra ji has listened to us!,9
2024-04-17 07:17:18 PM IST,"Gotta control GT for under 170. Anything more and with a thinner batting lineup, it will be hard for us to chase.",3
2024-04-17 07:17:25 PM IST,Lmao Gill is immune vs left arm pacers,1
2024-04-17 07:17:36 PM IST,"Our middle order looks good now. Power hitters like Abhinav, Miller, Tewatia and Rashid.",17
2024-04-17 07:18:18 PM IST,Why don't they play Lizaad,6
2024-04-17 07:18:26 PM IST,I know he’s injured but only our team can replace David Warner with Sumit Kumar 🤡,61
2024-04-17 07:20:10 PM IST,"Wait, Is Lalit dropped?",2
2024-04-17 07:22:22 PM IST,"For all the criticism, DC's top 5 looks gun. Shaw, JFM, Hope, Pant, Stubbs is really solid",6
2024-04-17 07:23:04 PM IST,How good is warrier as a bowler?,2
2024-04-17 07:23:28 PM IST,"DC results so far

L L W L L W

2 Ls coming up?",3
2024-04-17 07:23:30 PM IST,is the stadium full,1
2024-04-17 07:23:39 PM IST,Why are we playing with only 3 foreign players.. Why isn't Nokia or jhye playing.. What stupid choice is this.,1
2024-04-17 07:24:01 PM IST,DC only 3 oversears ?,4
2024-04-17 07:25:10 PM IST,🤥⛽🫣,2
2024-04-17 07:25:11 PM IST,"Yash Dhull would have been the perfect Warner replacement today… instead we get Sumit! 

Shaw 

JFM

Dhull

Hope 

Pant (c/wk) 

Tristan 

Axar",5
2024-04-17 07:25:30 PM IST,Modi vs Kejriwal,82
2024-04-17 07:25:38 PM IST,No foreign batter in impact sub list too.. Means if Warner or any other foreign batter is injured for few games then  there is literally no batter replacement. Top class management once again.,8
2024-04-17 07:25:45 PM IST,"If Saha hack against DC one more time, I am going to lose my shit.",2
2024-04-17 07:25:55 PM IST,"Rajasthan absolutely dominating 

I have a very bad feeling that they're peaking too early 

Hop I'm wrong tho, Need to see someone new win this shit",5
2024-04-17 07:26:45 PM IST,"If Gujarat wins, Ahmedabad would be the capital of India. Gujarat Capital incoming",20
2024-04-17 07:28:07 PM IST,"As a RR fan I support both the teams here lol. 
Hope to see another thriller.",3
2024-04-17 07:30:24 PM IST,Prithvi should be in sub list and not field ... but Ponting works in mysterious ways,8
2024-04-17 07:30:55 PM IST,Another Blue Jersey  Vs Blue Jersey match. Seriously annoying.,2
2024-04-17 07:31:19 PM IST,Worst opening ball in IPL history,2
2024-04-17 07:31:33 PM IST,"Graeme Swann : Pitch looks like an absolute belter 

Par score 1st innings (on this batting pitch) : 185 😆🤣",3
2024-04-17 07:32:54 PM IST,Why sumit is playing?,6
2024-04-17 07:33:06 PM IST,Umpires and GT Jerseys are same color how is that not confusing.,4
2024-04-17 07:33:21 PM IST,abhinav looks like a default bald character we get to choose in every game,7
2024-04-17 07:33:25 PM IST,Bro talking shit to Gill? 👊🏻,3
2024-04-17 07:34:01 PM IST,Doesn't look much swing is gonna happen..,1
2024-04-17 07:34:10 PM IST,"Saha is proper odi batsmen, he do have nehra’s nudes",0
2024-04-17 07:34:19 PM IST,Starc vs Gill,2
2024-04-17 07:34:20 PM IST,I know Nortje is out of form but he is wayyy better than Sumit kumar,1
2024-04-17 07:34:36 PM IST,"So DC chose to filed because of dew, I assume. And this thread is dead.",3
2024-04-17 07:34:37 PM IST,"Despite being blue, I don’t really think the jerseys look the same. MI vs LSG would be more of an eyesore ",2
2024-04-17 07:34:58 PM IST,Great goal,2
2024-04-17 07:34:59 PM IST,WOW. GILLY BOI. MY PRINCE. MY SKIP.,8
2024-04-17 07:35:04 PM IST,[deleted],2
2024-04-17 07:35:05 PM IST,Could have played kushagara in place of Sumit today.. Paying 7 CR to carry drinks with no game time is high level idiocy I completely expect from DC management.,7
2024-04-17 07:35:57 PM IST,Gill back to his softboydefense,0
2024-04-17 07:36:05 PM IST,"Very difficult for DC to win, unless Warner fires. 80% chances of GT winning this one.",1
2024-04-17 07:36:33 PM IST,Cancel culture has no effect on Sumit bitchess,5
2024-04-17 07:36:56 PM IST,"In last few months I have learnt how to host a website for free and how to scrap data from web so I am thinking of making a website for stats which us redditor likes. Ex:- 1) Boundary Count 2) Orange Cap among bowlers 3) Contribution/Cost of player (grouped by country) 4) Batsman with slowest SR 5) Sixer king among bowlers 


What do you guys say? Any suggestions?",3
2024-04-17 07:36:59 PM IST,"Who would steal your girlfriend?

Pant is a good looking lad, but not the type to steal your gf. He is a real bro 

Now Gill, that mf looks like he'll steal your gf. He will hit at your gf the moment he sees her alone. 

Sai on the other hand is probably her best friend. The kind who really wants her, comes very close but gets freindzoned. Dude stil thinks ""well it feels like we're more than friends"" 

Now I wouldn't worry about Rashid, he is proper bhaiya material. 

Spencer probably doesn't even know what women is.",24
2024-04-17 07:37:29 PM IST,Warner injured. It means Mcgurk and Shaw will open,2
2024-04-17 07:37:52 PM IST,Is Delhi the best team with least runs conceded in the powerplay ? (Minus that 272 game vs KKR),1
2024-04-17 07:37:57 PM IST,"Every team should have careless openers, Teams should back them.",1
2024-04-17 07:38:04 PM IST,Bc why Sumit Kumar?![img](emote|t5_2qhe0|8774),6
2024-04-17 07:38:08 PM IST,Only here for McGurk and Spencer,4
2024-04-17 07:38:24 PM IST,I just hate dead threads,4
2024-04-17 07:38:49 PM IST,"Bruhhh! I heard a Nick, that was OUT!! Like WTF 😳 No appeal !?",3
2024-04-17 07:38:55 PM IST,We have  our  own sumit pandya,3
2024-04-17 07:39:03 PM IST,Khaleel is poor man starc..... When you can't buy starc buy khaleel for 1/10 of price ...,9
2024-04-17 07:39:19 PM IST,Mini heart attack,5
2024-04-17 07:39:28 PM IST,Good to see that T20 fraud Kane Williamson isn't playing,-1
2024-04-17 07:39:30 PM IST,Good shot,2
2024-04-17 07:39:32 PM IST,"Delhi always got to have the “he’s there I guess” player

Before it was Lalit, now it’s Sumit",9
2024-04-17 07:39:41 PM IST,"It’s funny in a way, Wriddhiman Saha has never been a top top player   

Never in his entire life but he’s still more successful than 90 percent of players will ever be. Top level sport is brutal and I understand why many choose to pursue more traditional ways of earning money instead of this",12
2024-04-17 07:39:41 PM IST,![img](emote|t5_2qhe0|8766)![img](emote|t5_2qhe0|8766)![img](emote|t5_2qhe0|8766),9
2024-04-17 07:39:42 PM IST,"Yeah, Gone",5
2024-04-17 07:39:50 PM IST,I love how Ishant just accepted the the natural form of his teeth I mean how much does it cost to put veneers for someone who played for ICT,6
2024-04-17 07:39:54 PM IST,Fuck,6
2024-04-17 07:39:57 PM IST,that’s like half of their batting lineup,15
2024-04-17 07:40:00 PM IST,Some good bowling,7
2024-04-17 07:40:03 PM IST,Sharma jiiiii![img](emote|t5_2qhe0|8766)![img](emote|t5_2qhe0|8766),8
2024-04-17 07:40:10 PM IST,50% batting lineup gone,35
2024-04-17 07:40:13 PM IST,"Brilliant bowling and field placement.. 

Made Gill confident he can play all shots through off side and he perishes cos of it.",16
2024-04-17 07:40:15 PM IST,wtf Shubhi?,5
2024-04-17 07:40:15 PM IST,Let's go Ishant,5
2024-04-17 07:40:17 PM IST,"**1.5** **chipped to cover!** Shaw there takes it just below his face.

Shubman Gill c Shaw b Sharma 8 (6b 2x4 0x6) SR: 133.33",2
2024-04-17 07:40:17 PM IST,Chutiya shot to get out,5
2024-04-17 07:40:17 PM IST,That dismissal was softer than a dick on whiskey,8
2024-04-17 07:40:25 PM IST,Noooooooo,2
2024-04-17 07:40:26 PM IST,guys what happened to Ahmedabad gill,8
2024-04-17 07:40:30 PM IST,1st Gabba wicket down....,9
2024-04-17 07:40:31 PM IST,GTs 60 percent batting down,23
2024-04-17 07:40:36 PM IST,Another boring s saudarshan inning loading.,2
2024-04-17 07:40:37 PM IST,Kane is even worse than Smith in T20s,3
2024-04-17 07:40:38 PM IST,Bro fuck man,4
2024-04-17 07:40:46 PM IST,My dream 11 teams are dead with shubman,5
2024-04-17 07:40:47 PM IST,There walks our batting,5
2024-04-17 07:40:51 PM IST,Jasiwal and Gill in a competition to see who can shit harder,2
2024-04-17 07:40:56 PM IST,"Uncle ishant sharma got the "" prince "" of Ahmedabad in Ahmedabad lol hahahahha",11
2024-04-17 07:40:59 PM IST,come out of shower. look at tv. gill is gone. just wonderful,2
2024-04-17 07:41:02 PM IST,I refuse to believe Gill and Shaw are the same age group wtf,8
2024-04-17 07:41:03 PM IST,my only reason for ever wanting to watch this match walks out,1
2024-04-17 07:41:07 PM IST,Gill out via Commentators curse,7
2024-04-17 07:41:13 PM IST,Do remember Ishant was bought by us for base price when no on else was bidding on him. Has done well for someone who is there for 15 years and so..,4
2024-04-17 07:41:15 PM IST,"There goes my D11 CAPTAIN, Fuck.",6
2024-04-17 07:41:20 PM IST,"DC does look interesting with Stubbs and JFM, also Hopefully Hope hops on the opportunities given",6
2024-04-17 07:41:20 PM IST,Shaw redemption arc!,3
2024-04-17 07:41:23 PM IST,hardik is not lying Tbh about practicing sangeet instead of bowling,6
2024-04-17 07:41:32 PM IST,"Imagine getting caught out by Prithvi Shaw, pack it in dude your career's over",6
2024-04-17 07:41:42 PM IST,60% of Gujarat batting already in dugout,5
2024-04-17 07:41:42 PM IST,Now watch how Sudarshan and Saha do tuk-tuk like it's day 1 of a fucking test match,8
2024-04-17 07:41:44 PM IST,Sai 33(26) incoming,6
2024-04-17 07:41:44 PM IST,Odi begins from sudharshan from now...,6
2024-04-17 07:41:54 PM IST,"Take a shot ever time oo antava gets played in this tournament

Pre schedule an ambulance before you start",3
2024-04-17 07:41:55 PM IST,All ready for the thrilling and orgasmic knock of 28(34) by knaos mama 😍😍,4
2024-04-17 07:42:09 PM IST,Kind of form gill and jaiswal in I have no faith in them rather Virat and Rohit open the innings and then we can fit Rinku in line up as finisher....,3
2024-04-17 07:42:13 PM IST,Sai 30s sudarshan,1
2024-04-17 07:42:14 PM IST,Gill was way too impatient,4
2024-04-17 07:42:16 PM IST,Out,1
2024-04-17 07:42:18 PM IST,Does anyone have a strm they can DM please,1
2024-04-17 07:42:21 PM IST,What was that voice crack ![img](emote|t5_2qhe0|8766),1
2024-04-17 07:42:37 PM IST,Even Ahmedabad pitch is unable to compliment Gill.,1
2024-04-17 07:42:39 PM IST,Am I right to say Sundarshan has been striking slowly this season?,2
2024-04-17 07:42:48 PM IST,Completely forgot about Pant and reviews. My heart skipped a beat as soon as I realized that we have DRS. ,2
2024-04-17 07:42:56 PM IST,"I mean it's an awful shot by Gill but I can already see 40 overs of cutters and spinners. Could be grim viewing. 

Hope I'm very wrong.",1
2024-04-17 07:42:57 PM IST,Shaw didn't drop it,2
2024-04-17 07:43:05 PM IST,Shabnam unlucky,-1
2024-04-17 07:43:07 PM IST,Did they just drop Warner,1
2024-04-17 07:43:25 PM IST,"DC bowling acting like AC, +ve in one match -ve in next match",4
2024-04-17 07:43:44 PM IST,Gill has been a disappointment this season for,-2
2024-04-17 07:43:49 PM IST,Axar should bowl more in PPs![img](emote|t5_2qhe0|29261),1
2024-04-17 07:43:57 PM IST,"Ishant Sharma OMG!! 🔥🔥. Ishant still has it in him, never count him out! Ever",1
2024-04-17 07:43:59 PM IST,Wtff ishant is in the spectators as well,5
2024-04-17 07:44:16 PM IST,GT chasing would be a good win for them tonight🥲. Low scoring game,1
2024-04-17 07:44:24 PM IST,Nice 👄Gill bhai![img](emote|t5_2qhe0|28120),2
2024-04-17 07:44:47 PM IST,Another day another slow dry and two paced ahmedabad wicket 🤧🤧,-1
2024-04-17 07:44:48 PM IST,genuinely tired of hearing about ponting whining on the sidelines.,1
2024-04-17 07:44:56 PM IST,Way too much intent,1
2024-04-17 07:44:56 PM IST,Idk why DC think they are strong enough to have no overseas bowlers.,4
2024-04-17 07:45:03 PM IST,That ball should have been dispatched,2
2024-04-17 07:45:04 PM IST,Who's pant getting mad @.,1
2024-04-17 07:45:09 PM IST,"What do you say lads, come back at 77-1 in 10 or watch the match.",2
2024-04-17 07:45:15 PM IST,Impact sub who?,1
2024-04-17 07:45:32 PM IST,Gill should go easy on that Concealer Makeup lol 😂,2
2024-04-17 07:45:35 PM IST,I have to stop watching this shit,1
2024-04-17 07:45:37 PM IST,Gill is not gilling this year,2
2024-04-17 07:45:37 PM IST,Saha is completely washed...,3
2024-04-17 07:45:40 PM IST,Lol did warner injure himself doing the CRED UPI ad or some shit ?Or did he fall from a golf cart too ?,3
2024-04-17 07:45:44 PM IST,Gill looking at that fan poll like 😡,5
2024-04-17 07:45:45 PM IST,Gill aged like milk,0
2024-04-17 07:45:53 PM IST,Khaleel Akram Ahmed![img](emote|t5_2qhe0|28120),1
2024-04-17 07:45:55 PM IST,Sudarshan’s batting will cure my insomnia. I believe.,2
2024-04-17 07:46:03 PM IST,Bit weird question but with that close look of gill face makes me wonder is Gill has done something to his face? Like some surgery or what? Looks like to me.,1
2024-04-17 07:46:05 PM IST,Don’t think ‘Young Pretender’ was the right usage of words there.,4
2024-04-17 07:46:08 PM IST,"GT is already playing wit 5 full-time bowlers, so impact sub has gotta be a batsman.",2
2024-04-17 07:46:08 PM IST,Lord parag playing better than all the Indian batters except koach.,4
2024-04-17 07:46:13 PM IST,GT has gone from the most entertaining team to the most boring team in 2 seasons,7
2024-04-17 07:46:31 PM IST,Mc Shaw![img](emote|t5_2qhe0|8774),1
2024-04-17 07:46:33 PM IST,Angkrish at 18 already plays faster than young Kkr Gill and i think he can easily be the youngest to 3000,2
2024-04-17 07:46:34 PM IST,No way Gill opens in the World Cup,1
2024-04-17 07:46:34 PM IST,Ponting going to be furious at that,5
2024-04-17 07:46:37 PM IST,They let this one go as per the script,3
2024-04-17 07:46:40 PM IST,GT is lucky that’s its DC against them. Cause I can’t see them scoring more than 200 today.,1
2024-04-17 07:46:40 PM IST,Excellent backing up by Sai baba devotee,5
2024-04-17 07:46:45 PM IST,🥱🥱,2
2024-04-17 07:47:03 PM IST,Shaw couldn't even dive,2
2024-04-17 07:47:05 PM IST,YES SAI SU,2
2024-04-17 07:47:11 PM IST,Only 300ish comments?,1
2024-04-17 07:47:12 PM IST,that was so clean,1
2024-04-17 07:47:14 PM IST,Khaleel action is very similar to starc just he is 30kg and 5 inch shorter than him,4
2024-04-17 07:47:16 PM IST,Jaiswal and Gill making sure VK and Ro they will open for India in WC.,8
2024-04-17 07:47:19 PM IST,THAT IS ATROCIOUSLY GOOD,4
2024-04-17 07:47:24 PM IST,Pitch looks good for batting so far..,1
2024-04-17 07:47:27 PM IST,What was that Sai ![img](emote|t5_2qhe0|21496),1
2024-04-17 07:47:28 PM IST,How bad does your team have to be for Shaw to be fielding at extra cover in the PP? He is probably one of the slowest movers this IPL,3
2024-04-17 07:47:29 PM IST,What a good looking shot,1
2024-04-17 07:47:35 PM IST,ahahahahah,1
2024-04-17 07:47:45 PM IST,"I may be simply sitting on my couch, but I still think I chased that ball faster than Prithvi did",2
2024-04-17 07:47:47 PM IST,Mukesh McGrath,1
2024-04-17 07:47:55 PM IST,Is Warner Injured ? Or dropped ? Or will show up as Impact sub ?,1
2024-04-17 07:48:00 PM IST,Sai needs to be in consideration for the Indian test team. Not quite a T20 player.,1
2024-04-17 07:48:02 PM IST,you know Match so boring when the rate of comments per ball slows down.,-1
2024-04-17 07:48:05 PM IST,Idk why people hate sai. He’s a future star.,7
2024-04-17 07:48:08 PM IST,Shaw simply let that go because he's a stout devotee of Sai Baba,3
2024-04-17 07:48:13 PM IST,Let’s hope this is a normal scoring game,3
2024-04-17 07:48:18 PM IST,"The Indian team is kinda fucked for the WC. No guaranteed pacer after Bumrah, no clarity in the keepers, no clarity on the opener(s)

It’s a real shitshow",1
2024-04-17 07:48:19 PM IST,"I don't get the ""Dil Khol Ke Bol"" Kingfisher ads",2
2024-04-17 07:48:33 PM IST,These kingfisher ads are so cringe,2
2024-04-17 07:48:39 PM IST,It doesn't justify dropping a player of calibre like Warner but Shaw is doing well and frasser looks like he can tonk in pp. Strange times we live in,1
2024-04-17 07:48:48 PM IST,"Dude, Saha should just retired out now....",3
2024-04-17 07:48:49 PM IST,I tune into the match and my fantasy captain is already back in the hut. Fml,4
2024-04-17 07:48:50 PM IST,Jhye Richardson not even in the subs. Idk what DC is thinking tbh,3
2024-04-17 07:49:18 PM IST,Saha needs to go,2
2024-04-17 07:49:27 PM IST,I love Swann’s commentary ![img](emote|t5_2qhe0|28120),3
2024-04-17 07:49:32 PM IST,Will Shaw ever be picked for ICT again,5
2024-04-17 07:49:39 PM IST,Saha has looked washed as a batter for 3-4 years now.,5
2024-04-17 07:49:53 PM IST,Is Saha trying to make a Test comeback?,5
2024-04-17 07:49:55 PM IST,Saha thinks he is playing Ranji Test match vs Delhi?  lol 😂,4
2024-04-17 07:50:20 PM IST,Mukesh with the panwadi glare 💀⚰️,4
2024-04-17 07:50:25 PM IST,Kuldeep runs better than Prithvi,7
2024-04-17 07:50:34 PM IST,"Why was Ishant dropped again?
didnt get the selector's argument that time",2
2024-04-17 07:50:36 PM IST,Saha has completely forgotten this is a T20 game..,3
2024-04-17 07:50:48 PM IST,Alarm 🚨,3
2024-04-17 07:50:53 PM IST,Finally gonna get a match with less than 200 scores,6
2024-04-17 07:51:02 PM IST,How to add flair of your team.,2
2024-04-17 07:51:05 PM IST,No muki bhai![img](emote|t5_2qhe0|29262),3
2024-04-17 07:51:20 PM IST,"Warner is a true Hyderabad icon, but I think the franchise ditched him at the right time (even though that whole situation was handled poorly) . Warner peaked playing for SRH",3
2024-04-17 07:51:20 PM IST,Mukesh wasn't happy that they scored only 2 runs off his 3 balls. How dare they bring his economy down!,3
2024-04-17 07:51:22 PM IST,Idk why everyone has a face like middle-aged overworked company worker in DC.,2
2024-04-17 07:51:22 PM IST,These starts will eat GT. One of these days they'll set a target of 170 and the opposition will chase it in 14 overs or whatever.,5
2024-04-17 07:51:25 PM IST,Only we can fuck up free hit,2
2024-04-17 07:51:27 PM IST,pols aa gayi pols,3
2024-04-17 07:51:28 PM IST,"Don't GT have any opening batsman other than Saha, Sai or Wade? Gill desperately needs a power hitter at the other end opening with him !

May be they can try Abhinav Manohar opening? Can't be worse than Saha.",6
2024-04-17 07:51:30 PM IST,Free hit ! more like rent is due,4
2024-04-17 07:51:33 PM IST,"""Haar din Naya , haar din bada ""

Translation - everyday new , every day big 

This sounds like female pornstar punchline",5
2024-04-17 07:51:36 PM IST,"2 off 9, tf is this.",5
2024-04-17 07:51:41 PM IST,I'll be surprised if Mukesh doesnt bowl a no ball in the entire match!,4
2024-04-17 07:51:44 PM IST,"why do bowlers suddenly remember how to bowl on free hits though

well this happened just to spite me",8
2024-04-17 07:51:52 PM IST,Is Shaw being treated by the BCCI the way Kambli was treated ?,1
2024-04-17 07:51:56 PM IST,"Nah man, that's a wrong wicket",5
2024-04-17 07:51:57 PM IST,"Saha isn't batting that bad

*looks at scorecard and sees 2(9) *

Oh....",8
2024-04-17 07:51:59 PM IST,Only sudharshan can play single on a freehit...,4
2024-04-17 07:51:59 PM IST,"Lol Saha, that's match losing.",6
2024-04-17 07:52:02 PM IST,deathrattle,3
2024-04-17 07:52:04 PM IST,wtf was that shot on a free hit,6
2024-04-17 07:52:06 PM IST,Advantage gt ig,6
2024-04-17 07:52:08 PM IST,2(10),8
2024-04-17 07:52:11 PM IST,Finally Mukesh shutting down all his haters 🔥🔥,4
2024-04-17 07:52:12 PM IST,"NOOOOOO..

We needed Saha to Bat for us atleast till PP Ends..",2
2024-04-17 07:52:12 PM IST,advantage gt,3
2024-04-17 07:52:12 PM IST,Mukesh McGrath is back mfs,6
2024-04-17 07:52:12 PM IST,Saha played 10 balls for this?,3
2024-04-17 07:52:12 PM IST,Bye byeeee,3
2024-04-17 07:52:18 PM IST," As long as the Impact Player rule exists, there is no way you can justify making Prithvi Shaw field",6
2024-04-17 07:52:23 PM IST,O Delhi reeeeeeeee ![img](emote|t5_2qhe0|28120)![img](emote|t5_2qhe0|28120),5
2024-04-17 07:52:24 PM IST,"**3.5** **chopped on!** Saha went swinging across the line again, and this time fell. Mukesh bowled on a short of a length just outside off, and this time there is extra bounce for him.

Wriddhiman Saha b Mukesh Kumar 2 (10b 0x4 0x6) SR: 20",1
2024-04-17 07:52:24 PM IST,Wrong wicket,3
2024-04-17 07:52:28 PM IST,Tactical wicket for GT,2
2024-04-17 07:52:34 PM IST,They needed Kane here more than Miller,1
2024-04-17 07:52:37 PM IST,"Can't wait to smile smugly at the haters who mocked DC's fast bowling attack.

Let'sgooo starc-gillespie-mcgrath",3
2024-04-17 07:52:39 PM IST,Can SRK keep? If so… SRK in for SAHA and we have our best XI.,2
2024-04-17 07:52:41 PM IST,Advantage GT,7
2024-04-17 07:52:44 PM IST,I see the 400+ games have officially cooked some of yall.. be safe out there,3
2024-04-17 07:52:50 PM IST,Saha telling Miller not to Bat like him.. 😋,4
2024-04-17 07:52:52 PM IST,Bruh wrong wicket,7
2024-04-17 07:52:54 PM IST,Feels bad watching Saha. Atleast until last season he was good for 20(12) type of innings in the powerplay and then getting out. Now it's looking really rough.,6
2024-04-17 07:52:56 PM IST,"“Not wasting time”

2(10) is absolutely wasting time in modern T20s",5
2024-04-17 07:52:57 PM IST,"Aww shouldn't have got him out, he was playing for us",5
2024-04-17 07:53:01 PM IST,This looks like a 19th nov type of pitch,4
2024-04-17 07:53:02 PM IST,"Delhi has the best theme hands down, KKR is a close second",4
2024-04-17 07:53:02 PM IST,DC is good,5
2024-04-17 07:53:03 PM IST,"Khaleel Starc

Mukesh McGrath

Ishant Gillespie

Greatest fast bowling attack the IPL has ever seen.",20
2024-04-17 07:53:06 PM IST,Advantage to Gujarat. Saha played a test match apparently,6
