Timestamp,Comment,Upvotes
2024-04-30 09:18:11 PM IST,Dawood is the moniker that suits Tim David,6
2024-04-30 09:18:11 PM IST,Man nothing makes my blood boil more than watching mistimed shots which is 80% of Tim David's repertoire,8
2024-04-30 09:18:13 PM IST,KL smiling always makes me happy,2
2024-04-30 09:18:16 PM IST,I seriously judge the 40% who voted for Tim David.,9
2024-04-30 09:18:17 PM IST,Meme shot,3
2024-04-30 09:18:17 PM IST,"Back then, reaching 140-150 after being 27-4 was considered as a godlike recovery. These days it's more like prolonging your own misery",15
2024-04-30 09:18:22 PM IST,"Ngl Chawla looks like the bad guys in Indian crime TV shows, who doesn't say anything, get slapped hard and proceeds to snitch on everyone.",7
2024-04-30 09:18:24 PM IST,"Already watched Rohit, Surya and Pandya performance team. I feel very confident for the WC.",4
2024-04-30 09:18:24 PM IST,Tim David this is the last over btw,2
2024-04-30 09:18:27 PM IST,"No. Mayank and SKY are not brothers. Although, they do look similar.",8
2024-04-30 09:18:28 PM IST,"Bumrah should just rest himself and be fresh for WC

No point in playing this IPL anymore",13
2024-04-30 09:18:35 PM IST,Did Australia announce their squad yet?,3
2024-04-30 09:18:37 PM IST,What the fuck is the outfield made of?,8
2024-04-30 09:18:37 PM IST,Ball just died in the outfield,8
2024-04-30 09:18:40 PM IST,Why is Deep obsessed with knowing how Stoinis looks with his shirt off 🤦‍♂️,10
2024-04-30 09:18:40 PM IST,"Outfield is slow af, huh",5
2024-04-30 09:18:47 PM IST,"Objectively, MI has one of the best batting line ups in the tournament. But they're so poor. It's shocking and embarrassing. You can have one or two players underperform but except for Tilak, no other MI batter has been consistent. This is enough proof how important is the atmosphere in the dressing room",7
2024-04-30 09:18:49 PM IST,"LSG is really strong, something I didn't imagine with pooran being out of form",6
2024-04-30 09:18:51 PM IST,Tim David is a finisher?,2
2024-04-30 09:18:55 PM IST,I support lsg because they play bhojpuri songs in the home stadium.. lol,7
2024-04-30 09:18:55 PM IST,"One of the worst fan poll questions right there. Marcus Stoinis has always been The Hulk, christened by Shane Warne himself, RIP.",11
2024-04-30 09:18:56 PM IST,Kartik devastated Russell isn’t an option.,1
2024-04-30 09:19:06 PM IST,Deep Dasgupta is a weirdo.,2
2024-04-30 09:19:13 PM IST,Mayank walks off with injury just 20-30 minutes before SKY takes the field. Hmm. Sus.,38
2024-04-30 09:19:16 PM IST,Ain't no way the finisher is actually finishing,4
2024-04-30 09:19:23 PM IST,Is it possible that Ambani paid for that poll?,4
2024-04-30 09:19:25 PM IST,That commentator is more obsessed with Big Papi than Zampa,2
2024-04-30 09:19:27 PM IST,"So Lucknow didn't even use Krunal and had Mayank bowled his full quota, one of either Mohsin and Naveen would not have finished their quota. Unreal balance in this lko side and still they played with 6 bowlers in the initial games.",10
2024-04-30 09:19:33 PM IST,"I remember during his younger days, Cummins constantly had injury issues(i think specifically back related). He worked really hard on his fitness and overcame those injuries and we have seens how he has achieved almost everything.

Mayank Yadav is still young and he has a long way to go. I just hope he is as motivated as Cummins and has correct people around him to advise and guide.",13
2024-04-30 09:19:34 PM IST,I would choose Kyle Mayers as my spirit monster,2
2024-04-30 09:19:34 PM IST,Mayank and Surya look like long lost twins yaar,4
2024-04-30 09:19:42 PM IST,Those five fans GT earned by winning ipl two years ago are moving to LSG fanbase i heard,5
2024-04-30 09:19:44 PM IST,"I just want to see all those experts who called MI ""The strongest batting unit"" and said  ""Mi is definitely going to playoffs""",2
2024-04-30 09:19:47 PM IST,All these years of IPL and good talent every year to pick a shit ass WC squad,2
2024-04-30 09:19:53 PM IST,Tim Dawood mistimes 90% of the shots he plays,8
2024-04-30 09:19:54 PM IST,"After shithousing so much they still reached 100+

However GT is positioned above MI

Who came off better in the Pandya fiasco?",8
2024-04-30 09:19:56 PM IST,Tim Kohli,4
2024-04-30 09:19:59 PM IST,"Well tried Mohsin, was a tough one",2
2024-04-30 09:20:00 PM IST,Real ones know that Stoinis is The Hulk after witnessing Warne orgasm on comms whenever Stoinis was shown on screen.,7
2024-04-30 09:20:00 PM IST,Mayank needs more protein or reduce his pace and rely on swing and seam to make his career,-1
2024-04-30 09:20:02 PM IST,Bumrah should smack stumps today ,3
2024-04-30 09:20:02 PM IST,Head would’ve………..,9
2024-04-30 09:20:05 PM IST,I could tell that he is gonna drop it.,3
2024-04-30 09:20:05 PM IST,Mayank went off the field🌚🌚. Putting MI kit on again,17
2024-04-30 09:20:11 PM IST,Krunal running like i need my brother's team not look bad,4
2024-04-30 09:20:15 PM IST,"People who start bowling at an early age are prone to more injuries (Pat, Hardik, Bumrah)

Stop calling them glass bodies you armchair experts who can even run for 5 min straight",8
2024-04-30 09:20:19 PM IST,Costly over,1
2024-04-30 09:20:19 PM IST,Great batting by david,6
2024-04-30 09:20:21 PM IST,Opened just now. Wtf happened with MI?,2
2024-04-30 09:20:22 PM IST,What was that catch attempt lmfao Mohsin? Not saying you should’ve taken it but looked like my neighbour uncle trying to take a catch.,1
2024-04-30 09:20:24 PM IST,That's as good an innings from tim that I have seen...pitch is sticking hope it doesn't become an absolute road when we ball,14
2024-04-30 09:20:29 PM IST,They should impact sub Malinga and bowl Bumrah and Malinga 8 overs upfront for MI to have a chance to win this.,7
2024-04-30 09:20:32 PM IST,Is it the pitch or good bowling or bad batting?,4
2024-04-30 09:20:32 PM IST,KL David,3
2024-04-30 09:20:36 PM IST,Last year MI matches were so good. This year's most boring team,18
2024-04-30 09:20:37 PM IST,"Oh johnty, even gambhir couldn't help them win a title",6
2024-04-30 09:20:37 PM IST,Feel for him man,6
2024-04-30 09:20:56 PM IST,"140s and Rohit winning this.


Pandya,  give up the captaincy now.",19
2024-04-30 09:21:01 PM IST,Good over this,6
2024-04-30 09:21:07 PM IST,Never doubted my man Tim Dawood,6
2024-04-30 09:21:08 PM IST,Honestly really good batting in this dead pitch,2
2024-04-30 09:21:10 PM IST,How is the pitch today? Is it really slow for batting?,1
2024-04-30 09:21:14 PM IST,"Polly/Rohit/Malinga(BUMRAH later) made MI, ""MI"".

Even now it's not bad franchise. But that was just a golden era and I think this season confirmed that there's another angle one needs to look at MI now. They're Panjab/RCB/DC level bad.",15
2024-04-30 09:21:18 PM IST,"Just when the WC selection is due, Tim David comes back to form",7
2024-04-30 09:21:20 PM IST,Lmao all fielders on leg side,6
2024-04-30 09:21:22 PM IST,It gonna be a good run chase if MI bowl sensibly,13
2024-04-30 09:21:29 PM IST,Finchy's IPL commentary compared to his BBL commentary is very weak.,6
2024-04-30 09:21:30 PM IST,When mohsin is under pressure he is a different person,3
2024-04-30 09:21:34 PM IST,Shit finish by LSG,8
2024-04-30 09:21:36 PM IST,David showing the rest of MI how it’s done,4
2024-04-30 09:21:43 PM IST,Outfield is made out of sponge,6
2024-04-30 09:21:43 PM IST,Lazy af fielding,2
2024-04-30 09:21:44 PM IST,Where were you bro ??,2
2024-04-30 09:21:51 PM IST,Mohsin looks gassed out,5
2024-04-30 09:21:57 PM IST,Outfield seems seriously slow,8
2024-04-30 09:21:58 PM IST,Bowling the last over in t20 is such a thankless job,8
2024-04-30 09:22:00 PM IST,Can't wait to see pandya taking first over in this chase,11
2024-04-30 09:22:01 PM IST,Pooran is such a dumbass lol,3
2024-04-30 09:22:02 PM IST,"I didn't watch the initial phase, did Mayank bowl to Surya?",1
2024-04-30 09:22:03 PM IST,"MI fans always on Tim David's case when he's striking at over 160 with a 30 average this season, ranked 14, maybe higher after this innings.

Maybe your top order should stop failing dummies?",16
2024-04-30 09:22:03 PM IST,"David has been so good this season, beautifully picked that gap",9
2024-04-30 09:22:05 PM IST,40 runs under par,4
2024-04-30 09:22:06 PM IST,The problem with David is that yeah he's gonna hit a few sixes and bat at 200 SR but so what? Every team has someone down the order who can do that. What's missing is winning the match for the team. Yes at that position it's difficult to consistently win the matches for the team but man we got somebody who could do that. Pollard really spoiled us.,5
2024-04-30 09:22:07 PM IST,"Mayank went out to put on surya makeup, before 2nd innings. Sky pulling a Rab ne bana di Jodi",13
2024-04-30 09:22:07 PM IST,wtf was that man,3
2024-04-30 09:22:08 PM IST,"So is this a dead pitch or was it just bad batting from MI, I don't understand or was it just bad bowling in the last over",7
2024-04-30 09:22:11 PM IST,best over of placement ever lmao,8
2024-04-30 09:22:11 PM IST,To be chased in under 16 overs,3
2024-04-30 09:22:12 PM IST,Bro did they just forget to water the outfield since the last match or what?,14
2024-04-30 09:22:12 PM IST,Shit outfield,6
2024-04-30 09:22:20 PM IST,Something tells me this chase isn’t gonna be as easy as it seems.,7
2024-04-30 09:22:20 PM IST,"Ok.. so the conspiracy theories have been true.. Mayank is the split personality of Surya.... 

Lol reminds me of the movie Aparichit...",10
2024-04-30 09:22:23 PM IST, this was genuinely a great innings from Tim David wow,12
2024-04-30 09:22:26 PM IST,"The fuck is that outfield. If it was a test match, the ball would start reversing by the end of 20th over.",11
2024-04-30 09:22:33 PM IST,20 run short,5
2024-04-30 09:22:35 PM IST,LSG should chase this in 16-17 overs and KL should swing his dick in front of Rohit and Pandu,7
2024-04-30 09:22:35 PM IST,"Insane running, hope coetzee isn't gassed",7
2024-04-30 09:22:38 PM IST,Mumbai missed their MVP today Nitin Menon,8
2024-04-30 09:22:39 PM IST,"144. We are just short of 50 runs.  
This will turn into a flat pitch and LSG batsmen will smack MI bowlers.",10
2024-04-30 09:22:41 PM IST,"MI can still win this , they have coetzee, Bumrah and piyush.",2
2024-04-30 09:22:45 PM IST,Tim Dawood for a reason,6
2024-04-30 09:22:45 PM IST,[removed],1
2024-04-30 09:22:47 PM IST,"It's gonna be a good PP for mi, then Pandya is gonna bowl a 16-20 run over and finish it for MI.",7
2024-04-30 09:22:55 PM IST,Ohh paltan can we defend this.,1
2024-04-30 09:22:57 PM IST,Very good finish from Tim bhau today considering how slow this pitch is,6
2024-04-30 09:23:01 PM IST,Tim David played the 1 good innings of the season. now back to scoring single digits unless someone bowls fulltosses,5
2024-04-30 09:23:02 PM IST,"Not only 2 points , MI is handing a NRR boost for LSG",10
2024-04-30 09:23:02 PM IST,"Still bad.

KL 60(40) will chase this down easily.",9
2024-04-30 09:23:05 PM IST,"Jay Shah - We want High Scoring Matches

Lucknow curators - Fuck off!",12
2024-04-30 09:23:14 PM IST,"Can Israel and Hamas please direct their airstrikes towards the fuckers blasting the God damn horns non stop, most annoying shit at any cricket game",6
2024-04-30 09:23:15 PM IST,144 is good total here just some quick wickets and we are in for a treat.,6
2024-04-30 09:23:15 PM IST,"Morgan led England crashed out of 2021 t20 wc semi -> Morgan retires -> Eng won 2022 t20 wc 








Rohit led India crashed out of 2022 t20 wc semi -> Error 404",7
2024-04-30 09:23:16 PM IST,If Bumrah and Coetzee strike first then LSG is fucked.,3
2024-04-30 09:23:18 PM IST,"I'm not kidding when I say it's very much a match winning score.

If it is a true Ekana pitch - this match will go to the final over.",6
2024-04-30 09:23:21 PM IST,All over to bumrah now,4
2024-04-30 09:23:24 PM IST,"Tim Dawood Apology form 1 for 35 Rs, If >10 brought, sold at discount price of 18 per form.",8
2024-04-30 09:23:31 PM IST,"Mayank wasn't mismanaged, he was only selected when declared fit. He'd been bowling in the nets. Can't do much if match intensity causes an injury. He's probably not strong enough to bowl the pace he does. But he's only young, he'll gain strength in the future.",12
2024-04-30 09:23:34 PM IST,this will be chased in 15 overs,4
2024-04-30 09:23:34 PM IST,116-3 off 14 after that shambolic start. The so-called seniors have really shit the bed today for MI,8
2024-04-30 09:23:37 PM IST,Chad nehal,6
2024-04-30 09:23:38 PM IST,A strong PP for LSG and it could help the NRR if they can win this match in ~15 overs.,5
2024-04-30 09:23:42 PM IST,"Fair play Tim David, that was the type of innings Pollard would pull off from time to time to rescue us on difficult surfaces. Given his struggles against spin and slower deliveries, this was a great effort.",14
2024-04-30 09:23:43 PM IST,Irfan Pathan rightly pointed out selectors’ biasness in kicking Rinku and Bishnoi out of the 15,12
2024-04-30 09:23:50 PM IST,Rahul Dravid when Rahul Aryan walks in.,9
2024-04-30 09:23:51 PM IST,Are they playing in Lucknow or on Arrakis??,8
2024-04-30 09:23:55 PM IST,"Please don't bowl today, Hardik",7
2024-04-30 09:24:06 PM IST,Cmon Wadhera. 144 is not a good score.,4
2024-04-30 09:24:06 PM IST,Can we all agree that MI's got the best cheerleaders?,6
2024-04-30 09:24:11 PM IST,"""we would have got more if I was standing in the middle"" 🤡🤡",-2
2024-04-30 09:24:11 PM IST,"What teams in the IPL would benefit most from Babar, Shadab, Afridi, and Rizwan?",2
2024-04-30 09:24:15 PM IST,We're so going to get cooked in the world cup.,7
2024-04-30 09:24:17 PM IST,Bumrahdman hat trick today trust,4
2024-04-30 09:24:18 PM IST,warra finisher tim david,6
2024-04-30 09:24:21 PM IST,Every one is getting main man syndrome after close contact with Pandya.,4
2024-04-30 09:24:25 PM IST,The only way to stabilise the match is to let Bumrah bowl 2 in the powerplay,5
2024-04-30 09:24:25 PM IST,Wadhera is like that school kid talking to his headmaster,15
2024-04-30 09:24:37 PM IST,"That's exactly how you should be running on the last ball, David didn't give a damn about a red inker and went for a suicidal third. Plenty of teams don't go for that extra run, like what do you have to lose?",15
2024-04-30 09:24:41 PM IST,"Whenever Mumbai aren't winning the trophy, they're busy fighting for the wooden spoon.",5
2024-04-30 09:24:42 PM IST,And these commentators want us to take the kid to the US. He's been bowling very well but come on- his body broke again.,10
2024-04-30 09:24:47 PM IST,LSG to chase 104 in 18 overs + 2 overs of Hardik,8
2024-04-30 09:24:52 PM IST,Pandya please give the first over to Bumrah 🙏,9
2024-04-30 09:24:53 PM IST,LSG should concentrate on NRR,2
2024-04-30 09:25:03 PM IST,Guys Manjrekar didn't include Virat coz he didn't want him to get humiliated in wc by this clown of a team,3
2024-04-30 09:25:04 PM IST,Props to wadhera! Hyping up 144 like it is 204 !,6
2024-04-30 09:25:15 PM IST,"I haven’t seen Mayank and SKY together in photos, coincidence? Maybe but you can’t be too sure these days",5
2024-04-30 09:25:16 PM IST,"Mayank may end up being the most injury-prone genuine fast bowler in the history of cricket. I made a comment a few weeks ago shuddering at the thought of him doing a Cummins and turning into an excellent but boring bowler, but he has such a good action that I think he can pull it off and carve out a successful career for India in that capacity.",2
2024-04-30 09:25:21 PM IST,LSG you have pretty good support so stop trying to attract Mohun Bagan fans,4
2024-04-30 09:25:23 PM IST,"Calling Murali sir is a crime , ban him for 1 match",15
2024-04-30 09:25:27 PM IST,"Tbh, Mayank's only 21, he looks older but when you bowl over 150, your prime window is very small, from 26-32 really, no matter how much muscle work he does, the muscle he needs is just gonna come naturally with age",2
2024-04-30 09:25:31 PM IST,Fuckin don't tell them how to bat nehal,9
2024-04-30 09:25:41 PM IST,I have a feeling this is going to be a tight match,3
2024-04-30 09:25:42 PM IST,"MI fans are trolling tim for being "" pollad replacement"", but he did good today",9
2024-04-30 09:25:44 PM IST,These LSG fuckers rushed Mayank didn't they. BCCI already showing how great they are at taking care of the young quicks.,2
2024-04-30 09:25:45 PM IST,What a dumb question to ask an opposition batter,8
2024-04-30 09:25:45 PM IST,What is Wadhera talking about?,5
2024-04-30 09:25:46 PM IST,Low key Tim David ~200 SR cameo,6
2024-04-30 09:25:51 PM IST,[deleted],0
2024-04-30 09:25:59 PM IST,Ok.. guys .. wait today kl will come at six and then rescue lsg from 30-4 and win them the game by scoring a century.... And say fuck off to the selectors... Lol..,11
2024-04-30 09:26:03 PM IST,Wadhera trying his best to manipulate the LSG batters that it's a difficult target to chase,13
2024-04-30 09:26:06 PM IST,"Nehal seems too stressed, just like me when I have to address a crowd. I feel you bruh",17
2024-04-30 09:26:20 PM IST,Lmao Wadhera is giving suggestions to LSG on how to bat.,7
2024-04-30 09:26:21 PM IST,"In an IPL season dominated by 250+ scores, batting supremacy and bowlers having to bear the brunt, MI is making it a point to put up lower totals, motivate the bowlers and maintain a balance in the game 😇",16
2024-04-30 09:26:26 PM IST,Thanks Wadhera for giving tips to the LSG batters,10
2024-04-30 09:26:28 PM IST,"Dude if you stop singles, doubles and boundaries. Only way LSG wins is by taking triples. That’s pretty tough! Good planning wadhera!",7
2024-04-30 09:26:38 PM IST,"Surface is tricky, outfield slow af

Could be tricky for LSG",3
2024-04-30 09:26:41 PM IST,Who's gonna open for LSG?,1
2024-04-30 09:26:48 PM IST,Pands if you are a real son of a gun then go take the first over and give a good start.. To the other team.,11
2024-04-30 09:26:51 PM IST,"Naveen was their best bowler, not Mohsin.

Edit - Stoinis a close second",3
2024-04-30 09:27:09 PM IST,What happened to Mayank?,1
2024-04-30 09:27:13 PM IST,[deleted],4
2024-04-30 09:27:19 PM IST,All Hardik bashing only for him to end up with 91(34) and 3-13(4) twice against KKR,4
2024-04-30 09:27:22 PM IST,I wish we could overcome politics and stupid wars and have Pakistani players in the IPL and vice versa. We are all humans. Skin and bones at the end of the day yet a line on the map tells us what to do and not to do. I feel bad cause they are all just cricketers at the end of the day that wanna be in company of one another ;-(,6
2024-04-30 09:27:25 PM IST,"Very matured from Tim David. Didn't blindly slog, played the pitch, and got a 200 SR

His best innings imo, sheerly for the adjustments he made. If this turns out like the MI vs SRH 136-96 Alzarri debut game, we can say Tim David played Pollard's role",17
2024-04-30 09:27:29 PM IST,"Honestly I liked what Lara suggested. If you wanna groom Mayank, we need to invest in him. Assign good physios and nutritionists so he gets proper rest between games.
We can afford to do it, I mean Bumrah has been injury free for a year now with no signs of stopping.",7
2024-04-30 09:27:33 PM IST,"I was once walking down the street with my friends in Ahemdabad. Suddenly Suryakumar Yadav appeared out of nowhere and started chasing us, shouting ""supla! supla!"" I faced him and shouted ""Knockout Match!"" and he immediately disappeared. Be aware guys!",13
2024-04-30 09:27:41 PM IST,"Hope, Pandya gets out of this shithole of form he is in before WC.",2
2024-04-30 09:27:42 PM IST,"Good thing with Mayank is that he seems to stop bowling and go off the field if something feels even slightly wrong. So I'm sure nothing major has happened, and there's no significant pain, but it's just a case of that muscle being unable to take the load he's putting it under.",6
2024-04-30 09:27:45 PM IST,Best pitch this IPL by a mile,3
2024-04-30 09:27:48 PM IST,"Wadhera is so relatable, so likeable.",5
2024-04-30 09:27:50 PM IST,"Uncapped retention for MI:  Wadheera 

For CSK: Tushar 

For Punjab: Ashutosh 

For KKR: Raghuvanshi 

For LSG: Mohsin (Mayank will get debuted)

GT: ? DC: ? RCB: ? RR: ? SRH: NGK",6
2024-04-30 09:27:57 PM IST,That outfield is actually tragic. Ball perfectly splits the gap between the fielders and stops almost immediately after the first bounce.,7
2024-04-30 09:28:18 PM IST,which teams have potential to have similar MI vs CSK rivalry in future,1
2024-04-30 09:28:19 PM IST,"Now that selection bunny is off the back, no one is ready for KL orange cap at SR of 117. Take that Virat, take that Jay Shah! Take that { insert name }",-1
2024-04-30 09:28:23 PM IST,So any guesses on who will bowl the first over?,3
2024-04-30 09:28:29 PM IST,Petition for Mayank to have a personalised Health & Coaching staff from Aussies who handled with express pace bowlers before and please don't mix him in the ordinary players it's rare for us getting players like these and we shouldn't lose them,9
2024-04-30 09:28:33 PM IST,We are aiming for the Top 2 today,3
2024-04-30 09:28:47 PM IST,Looked to get better to bat as the ball got older. Key will be seeing off the new ball in the PP. Try get 45/46,2
2024-04-30 09:28:47 PM IST,Why is Akash Ambani always sitting on that stupid fucking sofa like it's a throne bro looks like Baron Harkonnen,12
2024-04-30 09:28:47 PM IST,"I’ll probably get downvoted for this, but this match seems like a glimpse into a India game in WC this June. Tough pitch, top order shitting the bed, middle order over burdened which eventually gets burdened, and whole match is handed over to bowlers with the expectation for them to win the match.",16
2024-04-30 09:28:57 PM IST,KL will score a 15 ball 50 today.,6
2024-04-30 09:29:02 PM IST,Wadhera is making an elevator pitch for his batting. Lol.,5
2024-04-30 09:29:09 PM IST,"KL  pulling off a JFM or Will Jacks performace will be peak comedy lol, I really want to see KL smashing today",7
2024-04-30 09:29:21 PM IST,I sense a Mumbai comeback cooking. (I am delusional),8
2024-04-30 09:29:24 PM IST,"It's not going to be a tough score to chase because we don't have good bowlers. We have 2 decent spinners of which one guy doesn't get a chance to bowl half the time, and fast bowlers who don't know how to bowl a slower ball. If LSG don't chase this with 4+ overs to spare, they should be ashamed of themselves ![img](emote|t5_2qhe0|8779)",8
2024-04-30 09:29:37 PM IST,"Mayank should probably be kept in a bubble wrap and taken proper care of for the rest of the season.

Meanwhile, let's see how Arshin bats, he was hyped up as the next Hardik.",13
2024-04-30 09:29:48 PM IST,"A slow pitch on this ground with it's slow outfield and larger boundaries is what we need more of this IPL. Even 140-160 scores are par in that case. For the bowlers, you will have some assistance but you will have to bowl strictly to your field. For the batsmen, you have to settle down for at least 8-10 balls before going for risky shots.",3
2024-04-30 09:29:57 PM IST,If LSG chase this in 16.2 overs then MI goes below RCB,6
2024-04-30 09:30:09 PM IST,Jio cinema host is doing everything he can to defend Rohit's shit innings,5
2024-04-30 09:30:13 PM IST,[deleted],17
2024-04-30 09:30:15 PM IST,"That's incredible MI made a fighting total after what was a disastrous start! Credit to Tim David, and Nehal Wadhera. Hoping Pandya doesn't say ""Wadhera scored only at a strike rate of 113, and that cost us the match"" lol",12
2024-04-30 09:30:19 PM IST,Is mi not going to play csk again?,3
2024-04-30 09:30:36 PM IST,"If it is at all possible, Mayank should get some personalised coaching from Javagal Srinath. His action is so similar to young tearaway Srinath's, who seems to have fared somewhat okay on the injuries front for a bowler of his pace.",3
2024-04-30 09:30:38 PM IST,Jassi. Please. Request.,2
2024-04-30 09:30:47 PM IST,[deleted],0
2024-04-30 09:30:52 PM IST,Nabi and piyush have to take wickets,2
2024-04-30 09:31:05 PM IST,"Ashton Turner's got 3 runs in 4 innings he's batted in IPL, with a highest of 3 and an average of 1, that means he got out on 0 on 2 out of these 4 innings and finished unbeaten on 0* in one other innings.",7
2024-04-30 09:31:10 PM IST,Bumrahs running pose always gets me 😂,5
2024-04-30 09:32:03 PM IST,Great chance for de Kock to knock MI down,2
2024-04-30 09:32:06 PM IST,I love these low scoring affairs. Idc what anyone says. Rather these tough chases than boom boom 250+,7
2024-04-30 09:32:10 PM IST,Unfortunately for KL this is not the pitch to take out his frustration today. Needs to anchor the innings and win it for his team.,6
2024-04-30 09:32:17 PM IST,"MI's usage of Nabi has been baffling to say the least if they always wanted to use him as a no 8

Then they should have gone for other options in the Auction like Maharaj, Motie, Hosein, Adil Rashid",6
2024-04-30 09:32:36 PM IST,MI do it for the point table chaos pls,3
2024-04-30 09:32:46 PM IST,ankara bumrah,5
2024-04-30 09:32:49 PM IST,"Some clowns are taking strike rate way to seriously 

Batsman gets out on 4 runs 2 balls but but he played at 200 strike rate vrooo",7
2024-04-30 09:32:54 PM IST,Petition to call this match the Koffee with Karan Derby,10
2024-04-30 09:33:22 PM IST,"MI is going to win this, aren’t they? Them and do-die scenarios",2
2024-04-30 09:33:34 PM IST,"Me laughing 🤣it is MI batting line up but then realizing it is  also 3/6 of Indian batting line up ,☠️😭",6
2024-04-30 09:33:37 PM IST,[removed],1
2024-04-30 09:33:38 PM IST,"KL Rahul gets/has got a lowest percentage of flat pitches to bat on in every format, of any player I can remember, especially in this era.",-1
2024-04-30 09:33:46 PM IST,"Wadhera - we have to stop the singles, doubles and boundaries 

LSG - so you let us score only threes then?",3
