Timestamp,Comment,Upvotes
2024-04-30 10:29:15 PM IST,Pands and Hoods.. Rift confi.......no... Exists.,1
2024-04-30 10:29:43 PM IST,That bouncer was personal,1
2024-04-30 10:29:48 PM IST,Pands and Hoods.. Rift confi.......no... Exists.,1
2024-04-30 10:29:49 PM IST,Fuckboi needs a new fade,2
2024-04-30 10:30:03 PM IST,Test bowler hardik,2
2024-04-30 10:30:08 PM IST,Don't show Tunday on TV ffs. I'll start craving 🤤🤤,4
2024-04-30 10:30:09 PM IST,Hooda is over existed,1
2024-04-30 10:30:13 PM IST,"Fuck the match, go Kebabs",6
2024-04-30 10:30:20 PM IST,Shit man. Now i need to order those kebabs,4
2024-04-30 10:30:21 PM IST,Ah Murali Karthik is a vegan,1
2024-04-30 10:30:22 PM IST,Why isnt this clown giving nabi the ball?,2
2024-04-30 10:30:25 PM IST,What is that??? Momos????,2
2024-04-30 10:30:25 PM IST,That Fanpoll question is from r/cricketshitpost,5
2024-04-30 10:30:28 PM IST,Shit man. Now i need to order those kebabs,10
2024-04-30 10:30:29 PM IST,Why you showing kebabs? 😭,12
2024-04-30 10:30:39 PM IST,That Fanpoll question is from r/cricketshitpost,8
2024-04-30 10:30:43 PM IST,Yup food in that part of India is to die for. Literally lol.,7
2024-04-30 10:30:50 PM IST,Is it only me or Reddits high again,19
2024-04-30 10:30:54 PM IST,Bishnoi has to do all the crab walk to get more revs meanwhile Chad Chawla does it with just his chonky body,5
2024-04-30 10:31:18 PM IST,"At least make them bat till 17-18, so we don't end up below RCB 😭",3
2024-04-30 10:31:19 PM IST,India wont lose wc because of f pandya but because of Vadapav and his dickriders,-3
2024-04-30 10:31:22 PM IST,It's great that Uttar Pradesh- ummido ka Pradesh and it's food is getting recognition through LSG,7
2024-04-30 10:31:24 PM IST,Guess LSG are going to be the second team after csk to reach 3 out of 3 playoffs,5
2024-04-30 10:31:27 PM IST,"Murali - *Food does nothing to me*

We know bruh, we know. The lack of protein and carbs shrunk your brain.",15
2024-04-30 10:31:31 PM IST,Why this lsg stadium matches are sort of boring..no vibe..anyone feels the same?,3
2024-04-30 10:31:35 PM IST,Man last shot suggests the pitch has eased up,3
2024-04-30 10:31:35 PM IST,It's great that Uttar Pradesh- ummido ka Pradesh and it's food is getting recognition through LSG,5
2024-04-30 10:31:43 PM IST,Ban this poll guy instead of bowlers for celebration,6
2024-04-30 10:31:43 PM IST,Ranveer n Alia should just F off,3
2024-04-30 10:31:56 PM IST,Food does nothing to Murali. He sustains himself on the groans of his listeners.,9
2024-04-30 10:31:58 PM IST,i want to visit india and taste all the yummy foods there yaar,8
2024-04-30 10:32:06 PM IST,"Rather than giving questions so that CSK fans can show true dickriding even in non-csk games, I like those fan polls doing something funny or just shit posting so that we can all laugh",6
2024-04-30 10:32:10 PM IST,Happy that atleast we have a better game tonight in Munich,6
2024-04-30 10:32:15 PM IST,"if reddits crashing for you too, its because kendrick dropped his diss track",12
2024-04-30 10:32:25 PM IST,In 2024 if rightys are batting offies get invisible,6
2024-04-30 10:32:30 PM IST,"Lucknow food is a banger. This might piss off some of my Hyderabadi brethren, but IMO Lucknowi Biryani > Hyderabadi Briyani.",14
2024-04-30 10:32:32 PM IST,"All the hooda haters are Krunal cucksuckers! Krunal hasn’t done shit for MI or ICT in last couple of years. At least hooda is unique in terms of his abilities. What does Krunal bring? India doesn’t loose ICC tournaments because of BCCI, but because of these big name dick riders!",9
2024-04-30 10:32:34 PM IST,Vada Pav mentioned!!,9
2024-04-30 10:32:34 PM IST,Lmao LSG fans shitposting in the stadium with that banner. Lol,20
2024-04-30 10:32:34 PM IST,Thank IPL. Now I’m hungry and in pain,15
2024-04-30 10:32:36 PM IST,lol . Finally Vada pav made it !,16
2024-04-30 10:32:38 PM IST,The leaker of all leakers is here,10
2024-04-30 10:32:44 PM IST,they're trolling Brohit with those banners 😭😭,20
2024-04-30 10:32:44 PM IST,Under bowling Nabi on such a pitch is criminal. As criminal as not bowling Krunal,14
2024-04-30 10:32:50 PM IST,"Boucher should be sacked 
That clown couldn't even manage the MICT team despite having the best players across teams",10
2024-04-30 10:33:17 PM IST,Coetzee is the Harshal Patel of MI,3
2024-04-30 10:33:23 PM IST,Fucking IPL idiots made me order kebabs on Zomato and waste 200 rupees.,20
2024-04-30 10:33:29 PM IST,Toss plays such major part in IPL games. Match would have been completely different if LSG was batting first. Rahul looked relieved when he won the toss,2
2024-04-30 10:33:37 PM IST,Boucher is instilling his dna in mi 💀,4
2024-04-30 10:33:39 PM IST,Wow that banner is so disrespectful and on top of that it seems LSG management want e-lafda for engagement,5
2024-04-30 10:33:40 PM IST,Do Lucknowi folk ever get tired of the same fucking stereotypes being applied to them?,6
2024-04-30 10:33:46 PM IST,"As much as i love kebabs 


I also love bishnoi he is just a nice lad with magnificent hair",9
2024-04-30 10:33:46 PM IST,Fuck man this haryanvi commentary is so good,2
2024-04-30 10:33:51 PM IST,This poll was the most interesting thing that happened in this match. Tells you a lot,5
2024-04-30 10:33:56 PM IST,Match is so Uninteresting they decided to show Cuisine of Lucknow,8
2024-04-30 10:33:58 PM IST,We really shitpostjng on main comms,5
2024-04-30 10:34:00 PM IST,That was the closest poll I've ever seen from IPL and it involved Kebabs.,17
2024-04-30 10:34:03 PM IST,Why Mumbai released Markandey,3
2024-04-30 10:34:09 PM IST,I'd take a bite of that chawla gyat,11
2024-04-30 10:34:19 PM IST,who needs waterboarding and being put in stress position to torture people when you have these idiots in commentary and the ipl personnel coming up with some of the most ridiculous questions,5
2024-04-30 10:34:23 PM IST,No no no the important stuff is of course the vada pav,2
2024-04-30 10:34:25 PM IST,"Graeme swann has to go back to insiders man..

He's so good there..",1
2024-04-30 10:34:33 PM IST,"Why do we even play nabi if he is not gonna bowl

Especially on this pitch",11
2024-04-30 10:34:34 PM IST,Comms box is smoking some good stuff,5
2024-04-30 10:34:38 PM IST,Deepak Hoodas are large insects and convenient for research and classroom study of zoology. They are edible by humans. They have been eaten throughout history and are considered a delicacy in many countries.,3
2024-04-30 10:34:38 PM IST,We may never qualify for the playoffs but there is never the need to talk about the random shit in our matches,1
2024-04-30 10:34:39 PM IST,When is Nabi gonna bowl?,2
2024-04-30 10:34:43 PM IST,Oh fuck now I’m craving some vada pav,1
2024-04-30 10:34:43 PM IST,Mayank Yadav can't bowl 4 overs and y'all think he'll play BGT,13
2024-04-30 10:34:43 PM IST,stoinis slowing down for his half century😡 /s,5
2024-04-30 10:34:44 PM IST,This is LSG best batting line up. They have Indian top order batting open. They should let let Mankad/devdut swing freely in power play,3
2024-04-30 10:34:46 PM IST,"all the other team fans who were saying till that ""but hardik is ICT player dont boo him"" are gonna be bashing him",4
2024-04-30 10:35:05 PM IST,The only way LSG can lose is by taking this match deep,7
2024-04-30 10:35:10 PM IST,Bro in haryanvi commentary said Kebab lost because today is Mangalwar lol,12
2024-04-30 10:35:21 PM IST,Coetzee peppering the short stuff despite it being completely obvious that the one definite trash delivery on this pitch is the short pitched ball,2
2024-04-30 10:35:26 PM IST,"Just give the ball to brohit, he will take a hat-trick here",11
2024-04-30 10:35:40 PM IST,Feels too late to ask lol but what's everyone's issue with cricketers doing paan ads? It just says coated elaichi on the ads right? is there more going on that a health concern? I know absolutely nothing about paan btw,3
2024-04-30 10:35:42 PM IST,Reddit was down and I thought like that day it would have been.,5
2024-04-30 10:35:43 PM IST,"Thanos never can become humble, this leading from the front quality even though it's not necessary is what makes him a bad leader, sometimes you let other shine",2
2024-04-30 10:35:46 PM IST,"62 in 30 balls for MI to get the wooden spoon, this is nail biting stuff",2
2024-04-30 10:35:52 PM IST,"Tears in my eyes.
Watching Stoin perform on a slow pitch gives me hope for the T20 wc where we are mostly shite",7
2024-04-30 10:36:02 PM IST,At this point both teams are playing for formality,7
2024-04-30 10:36:14 PM IST,hardik as an all rounder this season has been so funny. when he bats well he shits while bowling and when he bowls well he shits while batting.,3
2024-04-30 10:36:16 PM IST,The real fight begins now....who will pick the wooden spoon? DC or RCB or MI?,3
2024-04-30 10:36:17 PM IST,"Foreign commentators : Analysis and strategies 

Hindi commentators: Puns",3
2024-04-30 10:36:18 PM IST,"None of the MI loss should hurt the fans anymore. Coz every time MI lose, the opponents push CSK further below (our opponents are just LSG KKR and SRH now)",2
2024-04-30 10:36:18 PM IST,Can MI win from here ?,1
2024-04-30 10:36:19 PM IST,"So Nabi has bowled 11 overs across 7 matches so far and has usually batted at 8 except that one match against RR.

What a waste of experience and talent. He should've been coming up the order instead of Pandya and bowled more than him too.",3
2024-04-30 10:36:21 PM IST,If once again you're allowed to retain only 4 next yrs auction who will MI retain realistically?,1
2024-04-30 10:36:21 PM IST,Would losing this match take the ambani indians out of playoffs contention?,2
2024-04-30 10:36:24 PM IST,But they told me coetzee was better buy than cummins after the auction,7
2024-04-30 10:36:26 PM IST,Off topic but fir general good.. Reddit web on mob is better than their trash android app. ,4
2024-04-30 10:36:27 PM IST,Coetzee is unbelievably bad,3
2024-04-30 10:36:27 PM IST,Pandu forgetting that Nabi is in team,4
2024-04-30 10:36:33 PM IST,"Coetzee, what you doing bro?",2
2024-04-30 10:36:34 PM IST,Hooda seeing 11 Irishmen in mi,3
2024-04-30 10:36:40 PM IST,"RCB listened to their fans and started playing Will Jacks consistently, look where it got them. When is Mumbai going to do similar with bowling Nabi? Or giving him something to do at all?",2
2024-04-30 10:36:46 PM IST,Hooda trying his best to get in squad before 25 May,1
2024-04-30 10:36:50 PM IST,"I don't understand what the fuck is Hardik saving Bumrah for every game when they have 2 runs on the board?  
Bowl him out and try to build pressure up front at least. Whats the point when he bowls when they need 10 runs from 40 balls?",4
2024-04-30 10:36:50 PM IST,Please do not retain Coetzee. Never play him again. He’s legitimately the most brainless guy to hold the ball. Just raw pace with no brains will make you a Varun Aaron not a Bumrah.,9
2024-04-30 10:36:51 PM IST,Has there ever been a good T20 bowler that wears a headband?,8
2024-04-30 10:36:53 PM IST,Frustrating from coetzee,4
2024-04-30 10:37:01 PM IST,Don't bowl coetzee here you mf,3
2024-04-30 10:37:05 PM IST,"What a flop is Coetzee! Stoinis bowled better than you, you fraud.",8
2024-04-30 10:37:08 PM IST,Coetzee more overrated than Drake.,7
2024-04-30 10:37:12 PM IST,"This pitch kinra reminds me of mi vs kkr 2021 at Chepauk where mi defended 150 runs when required was like 30 of 31 



Boult popped off in the death


Also russel got a 5wicket haul 

I miss boult have i said that enough in these match threads",6
2024-04-30 10:37:19 PM IST,Ok. What happened to Hardick headband??,3
2024-04-30 10:37:21 PM IST,"You will see Padikkal opening in a couple of matches, be ready. This Kulkarni experiment is not going to work.",4
2024-04-30 10:37:21 PM IST,Coetzee gonna for auction next year and end up being a 4-1-27-2 kind of bowler for that franchise,12
2024-04-30 10:37:28 PM IST,Mi getting thrashed on vadapav's birthday while he failed royally is only the start of the justice lol,10
2024-04-30 10:37:32 PM IST,if no one is working out just try out NABI !!!!!!!!!!!!!!!!,6
2024-04-30 10:37:35 PM IST,hooda for the wc,3
2024-04-30 10:37:48 PM IST,Tata neu box guys don't get a seat to sit?,3
2024-04-30 10:37:52 PM IST,To all the Non-Indian IPL watchers why did you start watching IPL and did this Year IPL really spread to Overseas?,6
2024-04-30 10:37:56 PM IST,Once again I am proposing a GoFundMe page for paying Murali Karthick not to commentate.,5
2024-04-30 10:38:01 PM IST,"Wait so if MI loses this, they’re out?",3
2024-04-30 10:38:03 PM IST,Why not have a mid wicket if most of the balls were gonna be short?,3
2024-04-30 10:38:05 PM IST,The only good things is key player brohit Koach bumrah will leave early for USA,14
2024-04-30 10:38:09 PM IST,"Rather than giving questions so that Shashank Singh fans can show true dickriding even in non-Shashank Singh games, I like those fan polls doing something funny or just shit posting so that we can all laugh",6
2024-04-30 10:38:19 PM IST,This guy literally bowling bumrah after every 5 overs 😭 Even gully cricket captains are better than him,10
2024-04-30 10:38:29 PM IST,Is this Laxmi's frozen samosa good??,1
2024-04-30 10:38:38 PM IST,"I miss LSG's teal jersey, atleast it was unique among the plethora of IPL's blue jerseys",8
2024-04-30 10:38:46 PM IST,"Murali Kartik: ""Food does nothing to me because I mix up the names of foods too. I never know what I'm eating""",6
2024-04-30 10:38:47 PM IST,"I know Stoinis is shaping up to be undisputed Potm, but the way KL navigated the new ball which DESTROYED mumbais top order deserves a shout if anything other than runs/SR/economy/wickets mattered",6
2024-04-30 10:38:49 PM IST,Come.on let the insiders prediction come true...need a wicket,7
2024-04-30 10:38:54 PM IST,"Bumrah doesn't deserve this horseshit.

Come home Jasprit, come to KKR.",0
2024-04-30 10:39:06 PM IST,"LSG retentions will be tough: Rahul, Pooran, Bishnoi, Stoinis? But got to get Mayank somehow.",15
2024-04-30 10:39:12 PM IST,Am I the only one whose surprised to see LSG being equal to SRH in points (as well nrr) when SRH had the aura of a Goliath team whilst LSG felt as if they were just fodder.,10
2024-04-30 10:39:16 PM IST,Please bumrah get one wicket atleast make this match have a lil spice,5
2024-04-30 10:39:24 PM IST,WANKHEDE IS NOT A FORTRESS,10
2024-04-30 10:39:26 PM IST,Get out hooda this aint test cricket,-5
2024-04-30 10:39:27 PM IST,Atleast BUMRAH will get some rest before World Cup.,8
2024-04-30 10:39:40 PM IST,This season is worse than 2022,4
2024-04-30 10:39:53 PM IST,"Alright stoinis, let’s finish this off, chop chop",3
2024-04-30 10:39:56 PM IST,Stoiny always keeping it casuel 😃,3
2024-04-30 10:40:00 PM IST,I can’t tell if people here are trolling or they unironically prefer watching games like these over 180+ games,6
2024-04-30 10:40:13 PM IST,Imagine being dropped from T20 squad and still go on to play 28(22). This mf is not playing for country for sure. Starpadder. Good riddance,-11
2024-04-30 10:40:13 PM IST,What dick riding commentary is this ? Eden gardens a fortress for kkr this year?,5
2024-04-30 10:40:18 PM IST,Commentator is suggesting MI to play for NRR lmao,5
2024-04-30 10:40:22 PM IST,Bumrah the 🐐,1
2024-04-30 10:40:27 PM IST,Man no wicket again...this game is gone of it wasn't already,3
2024-04-30 10:40:28 PM IST,Boom what? Why u appealing for that? That bowl was angled towards West Indies,7
2024-04-30 10:40:29 PM IST,Make RR under 6,1
2024-04-30 10:40:29 PM IST,Can pandya or Coetzee come and ball I need to start studying,7
2024-04-30 10:40:35 PM IST,Have MI forgotten that creating pressure leads to wickets and not just bowling your main bowler randomly every 5 overs,7
2024-04-30 10:40:41 PM IST,"How did we get a season worse than 2022 atleast we were trying and fighting that season even if we lost 8 in a row

This season the fighting spirit feels to be seen rarely",8
2024-04-30 10:40:45 PM IST,"There is no point in hoping here

They have 8 wickets

Even bishnoi can score fours.",2
2024-04-30 10:40:45 PM IST,There is literally no way MI is going to playoffs with 14 points. These commentators are pure coping here and trying to make it exciting.,5
2024-04-30 10:40:46 PM IST,Don't care if I get down voted but MI has been the most boring team this IPL,18
2024-04-30 10:40:54 PM IST,If only we had Boult rn,3
2024-04-30 10:41:06 PM IST,Bumrah's problem is that he's too good. No one bothers to take him on.,12
2024-04-30 10:41:11 PM IST,"That iphone most likely would have been thrown out the auto and then taken by someone else

Unrealistic ad",3
2024-04-30 10:41:11 PM IST,imagine the scenes of MI actually releases hardik next season,15
2024-04-30 10:41:19 PM IST,"Where’s Nabi, Pandu you dumbfuxk?",3
2024-04-30 10:41:21 PM IST,Teams should be allowed to retain 2 young Indian players players along with the 4 main retentions,6
2024-04-30 10:41:29 PM IST,Ok now fast forward to bumrah in 16th over,7
2024-04-30 10:41:36 PM IST,WHERE IS NABI,3
2024-04-30 10:41:38 PM IST,Chawla came with cup of tea .. gleefully accepted,3
2024-04-30 10:41:42 PM IST,Krunal specialist fielder tonight 😂,1
2024-04-30 10:41:47 PM IST,Nabi is in the team only to take good catches,9
2024-04-30 10:41:47 PM IST,"I understand that the wicket is little difficult to bat on, but at some point in the tournament LSG got to start thinking about nrr too. Or else we will be looking at another eliminator at max.",8
2024-04-30 10:41:58 PM IST,"Hardik has absolutely no idea how to maintain pressure ffs.

There was no need of that Coetze over. Let Bumrah build it up more and bowl someone with pace off. Outfield so slow MI batters ran 3 couple of times.",8
2024-04-30 10:42:01 PM IST,"Purely from a form point of view Rahul has been looking so good since Asia Cup 2023. Always looks in control, you can question his decision making, but he looks in fine shape, just hoping for a big BGT for him.",2
2024-04-30 10:42:03 PM IST,"After commentating on that 250 pitch I don't think Murali Kartik was ready for this challenge. You can see with the foreign commentators that they are attuned to this kind of match. Murali is just used to going ""oh, oh, oh"" and when he has to talk about food, he is unable to find the clever remarks like Aussies do in the middle overs on the big ground, he is too reliant on his large mouth.",12
2024-04-30 10:42:14 PM IST,"I'll stop sucking off Stoin soon, but man it really does feel good to see him perform after that disastrous wc form of his. He's always been good in T20s but it's great to see such a nice bloke perform again",5
2024-04-30 10:42:15 PM IST,"Post auction this mi team looked balanced on paper 



Noone would have expected them to fail this badly",8
2024-04-30 10:42:22 PM IST,"MI just hasn't turned up this season and the management, owners have done nothing productive to solve that. 

Can't blame them I guess. Reliance is the kind of company that cares more about the money they're making over other things.",3
2024-04-30 10:42:33 PM IST,Why is Nabi in the XI?,3
2024-04-30 10:42:37 PM IST,"Interviewer: ""So, Hardik. Why did you lose the match?""

Hardik: ""Tilak Varma getting runout cost the match. He should have had more crease awareness""

Tilak Varma rushes out from the dressing room and breaks his bat on Hardik's head.",10
2024-04-30 10:42:40 PM IST,"Last 3/4 matches at Mumbai.


Pandya must be dreading to play at home, considering they might end last in the table 😂",3
2024-04-30 10:42:48 PM IST,Where is Arjun Tendulkar,3
2024-04-30 10:42:48 PM IST,"No matter how bad MI are playing, as a KKR fan I always feel anxious facing them 😒",1
2024-04-30 10:42:51 PM IST,STIONIS for Player of the match,6
2024-04-30 10:43:06 PM IST,LSG playing on this pitch against kkr would be fun to watch,1
2024-04-30 10:43:10 PM IST,Stoin Papi is the last bloke you'd expect to play well on pitches like Ekana and Chepauk,5
2024-04-30 10:43:12 PM IST,Pandya making Nabi specialist fielder despite Nabi being economical 😂,6
2024-04-30 10:43:14 PM IST,"Moral of the story, don’t hand off the management of your franchise to the spoilt rich kids. 
 
Akash Ambani is doing exactly what Kavya did",10
2024-04-30 10:43:18 PM IST,Kl task was to watch out pp overs and he did that perfectly for us.,2
2024-04-30 10:43:23 PM IST,"As an MI fan, I want them to finish last this year. Would be a good reality check for the management",8
2024-04-30 10:43:26 PM IST,Hooda summoning his inner pbks,2
2024-04-30 10:43:31 PM IST,peoplewho say captaincy dont matter team work does just see this MI season after having best t20 batter world best bowler and so many good players they are loosing,6
2024-04-30 10:43:32 PM IST,"Stoinis is the true Robin Hood. 

Bashes the successful teams, while flops against the weaker ones.",5
2024-04-30 10:43:33 PM IST,Tough decision for CA to leave out Big Papa Stoin,7
2024-04-30 10:43:36 PM IST,MI seems to have staved off the wooden spoon. What a shame!,2
2024-04-30 10:43:46 PM IST,"Haha after auctions everyone was praising Mi for being the most balanced team out there, yeah guys they are most balanced in losing convincingly and consistently",1
2024-04-30 10:43:53 PM IST,"who came with the cringe nickname of Stoin Papi, lmao ew gross",-3
2024-04-30 10:44:02 PM IST,Chawla ji shouldn't be ur main spinner,8
2024-04-30 10:44:21 PM IST,Rcb has more chance to qualify than MI such a shit performance,1
2024-04-30 10:44:24 PM IST,"Hooda gone, advantage LSG",6
2024-04-30 10:44:24 PM IST,Bring in krunal we need to see a 1v1,3
2024-04-30 10:44:28 PM IST,Are we allowed to intentionally get leg bye runs (by kicking the ball) or did Chain Kulli ki Main Kulli lie to me??,7
2024-04-30 10:44:29 PM IST,Even a single Aussie is enough to dismantle India's any T20 WC bowler (except right arm quick),6
2024-04-30 10:44:33 PM IST,Goddam hardik ![img](emote|t5_2qhe0|8783),2
2024-04-30 10:44:35 PM IST,So basically no nabi unless if he is gonna let nabi bowl in death,0
2024-04-30 10:44:35 PM IST,How is pandu of all people getting wickets😭,1
2024-04-30 10:44:35 PM IST,Hardik will bowl well on WI pitches,5
2024-04-30 10:44:37 PM IST,Oh pinch me Pandya got a wicket,2
2024-04-30 10:44:38 PM IST,Hooda bhai Aram se thoda,1
2024-04-30 10:44:38 PM IST,Fuckboiiiii,6
2024-04-30 10:44:39 PM IST,Fuckboi fucks,2
2024-04-30 10:44:41 PM IST,"good news for us, at least his bowling is good in this match",7
2024-04-30 10:44:42 PM IST,"Lord, just Stoinis’ wicket and well watch the madness unfold",2
2024-04-30 10:44:42 PM IST,Hardik desperately needs this kind of a bowling performance. good for him.,10
2024-04-30 10:44:44 PM IST,Gifting wickets to Pandu .... LSG da fcuk,4
2024-04-30 10:44:50 PM IST,Lmao it's pooran,2
2024-04-30 10:44:51 PM IST,What a player Pandu is 😚,2
2024-04-30 10:44:56 PM IST,HARDIK PANDYA IS BACK BITCHES,3
2024-04-30 10:44:59 PM IST,36 Biradari cuts ties with Deepak Hooda after this inning 😔,3
2024-04-30 10:45:00 PM IST,It's like they see him as a small kid and misque to gift wickets,2
2024-04-30 10:45:02 PM IST,"Take out Pooran or Stoinis in this over itself, and we’ve a chance",5
2024-04-30 10:45:03 PM IST,No Ireland no party for hooda,2
2024-04-30 10:45:06 PM IST,Pandya proving his worth with the ball. Good times ahead for team India,8
2024-04-30 10:45:06 PM IST,"**13.1** **Hardik has another!** Hardik keeps badgering that hard length outside off, and Hooda's patience has run out. He has a wild slog at it and does not have any shape to play that stroke. Goes straight up off the outer half of the bat and Bumrah makes no mistake at mid off!

Deepak Hooda c Bumrah b Pandya 18 (18b 2x4 0x6) SR: 100",1
2024-04-30 10:45:10 PM IST,Wicket but when TF will u bowl nabi now?,1
2024-04-30 10:45:14 PM IST,Surprise of all surprises. HP's bowling form coming back?,4
2024-04-30 10:45:15 PM IST,Hooda why you gotta give pandya confidence? Could have got out to b umrah,3
2024-04-30 10:45:15 PM IST,This thread in shambles,3
2024-04-30 10:45:17 PM IST,Why would you gift your wicket when its nearly a run a ball,1
2024-04-30 10:45:18 PM IST,Shit! Feels like we might choke. I have seen Lucknow choking such chases before as well. 🥲,2
2024-04-30 10:45:22 PM IST,Pandu double hat trick incoming,2
2024-04-30 10:45:25 PM IST,Only winning that match by himself with his bowling would be redeeming Hardik.,2
2024-04-30 10:45:27 PM IST,"If Ro and Jaiswal are opening, I don't think Sanju would make the 11 given VK would come at 3 and Sky at 4. For me, he would be good at 5 as well but the management would back Pant. 

Sanju can play at 3 only if Ro and VK open is what I feel.

Opinions?",3
2024-04-30 10:45:27 PM IST,"last time hardik played in ekana, he defended 134",4
2024-04-30 10:45:28 PM IST,Hell yeah Pooran smash the shit out of Hardik,-1
2024-04-30 10:45:28 PM IST,Why did they drop De Cock ?,1
2024-04-30 10:45:31 PM IST,Hardik double hat trick. Mark my words.,-1
2024-04-30 10:45:34 PM IST,Not Pandu coming back to form before a KKR game is on the horizon 😭,2
2024-04-30 10:45:35 PM IST,Well at least Pandya's taking wickets,2
2024-04-30 10:45:39 PM IST,Who would've thought that pandya bowling in middle overs would be the best idea,1
2024-04-30 10:45:39 PM IST,Come on fuckboiii,0
2024-04-30 10:45:45 PM IST,"Oh fuck, I hope LSG is not doing the clownery they do in every season - lose an almost winnable game out of nowhere. ☠️

They lost to GT last year when they required 30 of 36 balls with 7 wickets in hand. 🤡",4
2024-04-30 10:45:45 PM IST,"This is the kind of sticky wicket we might find in WI and given how Pandya has bowled on it so far… 
  
Maybe we will end this year singing Pandya’s name after all",1
2024-04-30 10:45:46 PM IST,Is Turner an IPL level batsman. Haven't seen much of him,0
2024-04-30 10:45:47 PM IST,"Pandya>Bumrah?




*/s*",3
2024-04-30 10:45:49 PM IST,Hardick deserves a spot in the WC team until he does something I don't like,2
