Timestamp,Comment,Upvotes
2024-04-30 08:09:22 PM IST,"Surya OUT
Mayank IN",2
2024-04-30 08:09:25 PM IST,Where pace?,1
2024-04-30 08:09:26 PM IST,"Hardik Pandya with the bat in IPL 2024 so far  
  
Innings - 10  
Runs - 197  
Average - 21.8  
Strike Rate - 150.3  
50s/100s - 0/0  
Ducks - 1  
  
The captain hasn't lived up to the standards MI would have desired!

Mind you he is VC for ICT in WC24. 

No Economical Bowling, No Explosive Batting. Hari Om Selectors",11
2024-04-30 08:09:26 PM IST,Not again another Blue team with 29-4 after PowerPlay,1
2024-04-30 08:09:27 PM IST,Bumrah will be proud,2
2024-04-30 08:09:30 PM IST,How is that an Lb on 6.1? No shot offered right?,4
2024-04-30 08:09:30 PM IST,"Me when there is no speedometer after Mayan Yadav's ball

⚰️",5
2024-04-30 08:09:31 PM IST,"Pandya seems to have kind of ruined his career at the moment. He just can’t do a single thing right. 
Don’t know if he will bounce back",4
2024-04-30 08:09:33 PM IST,Mayank washed,2
2024-04-30 08:09:33 PM IST,I still predict LSG as the champions this season and I’m not even a fan.,2
2024-04-30 08:09:34 PM IST,Wow 10k slow,2
2024-04-30 08:09:36 PM IST,Was breaking the 49 record included with the Cam Green deal? I really hope so.,3
2024-04-30 08:09:36 PM IST,"Rohit Sharma has second most single digits in IPL  
  
Most single digits in IPL history  
  
81 - Dinesh Karthik  
79 - Rohit Sharma  
66 - Sunil Narine  
65 - Ravindra Jadeja",4
2024-04-30 08:09:37 PM IST,Lol Mumbai Indians suck,1
2024-04-30 08:09:41 PM IST,That’s not a no ball come on,3
2024-04-30 08:09:41 PM IST,One of the lowest pp scores in this ipl?,1
2024-04-30 08:09:42 PM IST,Should have happened during Sky/Rohit's dismissal at least ![gif](emote|free_emotes_pack|sob),1
2024-04-30 08:09:44 PM IST,That was not a no ball. Fucking MI and umpires,2
2024-04-30 08:09:46 PM IST,anyone noticed how the advertisements have been getting worse lately? If the game is stalled for literally more than 5 seconds they're cutting to an ad break...,5
2024-04-30 08:09:47 PM IST,Marginal no ball tho,1
2024-04-30 08:09:48 PM IST,Uh oh,1
2024-04-30 08:09:50 PM IST,Don't worry.. Next in Tim David will hit a 123*(31) and the match will be on again. Die hard optimist.,2
2024-04-30 08:09:51 PM IST,How is this no ball,2
2024-04-30 08:09:51 PM IST,C'mon Mayank let them have the 49 record,1
2024-04-30 08:09:52 PM IST,Come on that's not a NB,3
2024-04-30 08:09:52 PM IST,RCB: (Chuckles) 49 is in danger,2
2024-04-30 08:09:54 PM IST,"Sanju watching the match from hotel:  Despite selection, I will play only the tail end of the WC where games dont matter much. Time to do some arm curling to strengthen my arms for carrying kits.",3
2024-04-30 08:09:55 PM IST,"drop pandu for rinku 


drop rohit for gaikwad",5
2024-04-30 08:09:56 PM IST,That didn't look like a no ball,4
2024-04-30 08:09:56 PM IST,"Still believe that either Sanju or KL should lead the T20 squad after Rohit

Without his PR, Hardik doesn't even make the main 15",8
2024-04-30 08:09:57 PM IST,Mayank should get the same tattoos as SKY. Just for the memes.,4
2024-04-30 08:09:57 PM IST,Helicopter time,1
2024-04-30 08:09:58 PM IST,Lowest PP score this ipl?,2
2024-04-30 08:10:03 PM IST,[deleted],3
2024-04-30 08:10:03 PM IST,"Anyone can perform as good as they can, team will always have Rohit, Kohli, Pandya, Pant and Jadeja. Kohli might get an excuse for being consistent in previous wt20s but what is the excuse for others?",13
2024-04-30 08:10:05 PM IST,KL be showing middle fingers to the selectors,5
2024-04-30 08:10:07 PM IST,wtf is that noise? Feels like a Railway station,4
2024-04-30 08:10:12 PM IST,Ambani's cheque came in,4
2024-04-30 08:10:14 PM IST,160 kmph where?,3
2024-04-30 08:10:14 PM IST,WHAT THE FUCK DID YOU DO TO MY MAYANK???????,6
2024-04-30 08:10:17 PM IST,oh yes. excited to watch Mayank live for the first time,5
2024-04-30 08:10:19 PM IST,Was that really wide?,8
2024-04-30 08:10:21 PM IST,Not surprised every 50-50 decision going mi way,6
2024-04-30 08:10:23 PM IST,"Damn the top order already started practicing for WT20 by these score, too used to it by now. ",8
2024-04-30 08:10:26 PM IST,What a performance for Maharashtra day 🥰,6
2024-04-30 08:10:32 PM IST,"For some reason Irfan is way too critical of Hardik.
I am not against it but don't see nearly as much criticism from him for other guys.",5
2024-04-30 08:10:33 PM IST,I guess it's his first slower ball of the season.,7
2024-04-30 08:10:34 PM IST,How pathetic are we!,4
2024-04-30 08:10:35 PM IST,Sometimes I wonder why the fuck am I paying for jio cinema. It comptes with discovery+ for the most shit OTT,3
2024-04-30 08:10:37 PM IST,Smh SKY shitting the bed in both bowling and batting today🤦🏽‍♂️🤦🏽‍♂️,9
2024-04-30 08:10:37 PM IST,Why is Nehal so aggressive?,6
2024-04-30 08:10:42 PM IST,Mumbai’s impact sub: The umpire,7
2024-04-30 08:10:48 PM IST,Dumbass review,3
2024-04-30 08:10:50 PM IST,"Mayank got a slow ball in his arsenal 💀

Let's go",6
2024-04-30 08:10:51 PM IST,It's not just about the speed gun with Mayank Yadav. This dude routinely rushes people with mid-140s deliveries which are rather common these days. He certainly has that X-factor of some extra zip in his short deliveries.,3
2024-04-30 08:10:52 PM IST,A fast bowler who can actually bowl a slower delivery too? That's great news if he holds up,2
2024-04-30 08:10:52 PM IST,We still haven't seen SKY and Mayank Yadav together....,3
2024-04-30 08:10:55 PM IST,That seems fair delivery,3
2024-04-30 08:10:57 PM IST,he think he's Kohli,2
2024-04-30 08:10:58 PM IST,arshin Kulkarni will open with KL Rahul today 👍🏼,2
2024-04-30 08:10:58 PM IST,This wannabe Viv Richards hasn't performed since quite some time. In the IPL and the international stage. Hope we don't run into a middle order crisis at the WC.,3
2024-04-30 08:10:59 PM IST,no 160 in first three balls? he’s washed,6
2024-04-30 08:11:00 PM IST,around the game 9/10 for the season fatigue sets in and batting lineups collapse,2
2024-04-30 08:11:02 PM IST,Nehal is furious,2
2024-04-30 08:11:04 PM IST,This match is reminder why a team full of hitters (IPL success stories) might utterly fail in T20 WC.,3
2024-04-30 08:11:06 PM IST,There seems to be no chemistry between Kishan and Nehal,3
2024-04-30 08:11:08 PM IST,"People be crying as if the options on bench are any better than those selected 

Drop Rohit for whom? KL? Or Gill? Who failed in the WC Final and is having a horrible form himself. Or Abhishek? Who has zero international exposure and has done nothing outside flat tracks 

Drop Hardik for whom? Venky Iyer? Vijay Shankar?

Drop SKY for whom? Rinku? Again, who himself is struggling

Whichever way you want to look at it, we have picked the best 15 players from the country. If they just aren't good enough, there's nothing that the selectors can do",-6
2024-04-30 08:11:09 PM IST,Nehal trying to match Pandya's clownery level,2
2024-04-30 08:11:11 PM IST,Seems like MI was caught celebrating the team selection,1
2024-04-30 08:11:12 PM IST,They are batting like SL in 2023 WC💀💀,3
2024-04-30 08:11:15 PM IST,Dude that was not a wide STOP FUCKING WASTING TIME and focus on your batting.,3
2024-04-30 08:11:17 PM IST,Is today going to be the day??,3
2024-04-30 08:11:23 PM IST,49 where?,3
2024-04-30 08:11:24 PM IST,Sorri darling,2
2024-04-30 08:11:25 PM IST,"i kind of wonder how they selected Hardik and on what basis other than VC, VC is just an assistant to the regional manager position of Dwight schrute",4
2024-04-30 08:11:28 PM IST,Meme.,1
2024-04-30 08:11:29 PM IST,That's a fair ball,4
2024-04-30 08:11:31 PM IST,dot ball free hit,3
2024-04-30 08:11:32 PM IST,Mayank Yadav's speed is not being shown?? why?? the one thing most interesting about him,4
2024-04-30 08:11:35 PM IST,what speed is Mayank bowling today?,1
2024-04-30 08:11:36 PM IST,Hate me if you want but the best all-rounder is sky,6
2024-04-30 08:11:36 PM IST,No goals in the whole match so far,1
2024-04-30 08:11:38 PM IST,Short king reviewing wide,3
2024-04-30 08:11:38 PM IST,"Yes Hardik way to justify that selection buddy
You go girl ",7
2024-04-30 08:11:43 PM IST,Guys… just signed in and.. We are not winning the WC again,6
2024-04-30 08:11:43 PM IST,Tim couldn't help this time.,0
2024-04-30 08:11:45 PM IST,Bro can't seem to play short balls,4
2024-04-30 08:11:46 PM IST,I still think MI has a great squad on paper. This whole Hardik fiasco has fucked the team. Absolute shambles. 2-3 games he himself has lost the game and then shithousery in the post match about probably your best batter and zero man management skills.,7
2024-04-30 08:11:47 PM IST,Dude took the dumbest review ever. MI filled with braindead idiots this season,8
2024-04-30 08:11:48 PM IST,Bowler sky is slow today,4
2024-04-30 08:11:48 PM IST,Wasted a review in the 7th over for this shit lmao?,6
2024-04-30 08:11:51 PM IST,Is it worth reviewing a wide in the 7th over when you need it later for LBWs,3
2024-04-30 08:11:51 PM IST,"""Whole r/Cricket against 11 guys today."" KL probably.",8
2024-04-30 08:11:57 PM IST,"The third umpire is my spirit animal during internals.

“Sorry, review for wide not given. Sorry no, wide not given sorry”",2
2024-04-30 08:11:58 PM IST,Impact player opted by mi : The Umpires,3
2024-04-30 08:11:58 PM IST,Aah yes finally 150+,1
2024-04-30 08:12:00 PM IST,"Australia & England Loves Cricket  
India Loves Cricketers 

Kind of Selections Commitee is forced to select players due to fandom. 2007 was one where seniors rested and India won with youngsters. Money No Brains BCCI

Sums up the difference between Trophies & Droughty Ones",3
2024-04-30 08:12:00 PM IST,rohit would shit the bed like he did in last t20 wc and make that cry baby face to get the sympathy and will bottle wtc+ct next year.,2
2024-04-30 08:12:00 PM IST,152,6
2024-04-30 08:12:02 PM IST,">**23.2 Leg byes**

>**23.2.1** If a ball delivered by the bowler first strikes the person of the striker, runs shall be scored only if the umpire is satisfied that the striker has

>either     attempted to play the ball with the bat

>or          tried to avoid being hit by the ball.

The umpires might have felt he tried to avoid being hit but was too slow.",2
2024-04-30 08:12:03 PM IST,"Dear Ishan


Take more risks, it's okay if you get out. Don't take a single after a boundary. Don't rotate strike against spinners. Accelerate, if you have wickets in hand.

Dont play for your 100. You clearly always do, and it costs the team.

It's not all your fault, you have been the best player for MI this season. But don't take the responsibiltiy of MI on your shoulders. Because if you do, it just doesn't work. Especially in T20s, one guy can't win you games. You need to trust that the middle and lower order will do well. 3 quick fire 30s > 1 medium paced 100.

I don't think MI will start winning games, if you take more risk and potentially get out. There are other big issues with the team and management. But atleast people will stop blaming you. Let the rest of the batters get a chance to do their job, if they fail, it's on them.

/s",4
2024-04-30 08:12:05 PM IST,152.8 there we go .,10
2024-04-30 08:12:08 PM IST,152.8 kph!!!,5
2024-04-30 08:12:09 PM IST,Why do they effing waste reviews on wides in initial overs.. The inning is not even mid way through.. They could have used it for more fatal decisions. Duh.,5
2024-04-30 08:12:10 PM IST,[deleted],17
2024-04-30 08:12:14 PM IST,152,3
2024-04-30 08:12:15 PM IST,After not getting selected for WC ishan kishan showing his class for next BGT series. Amazing batting,2
2024-04-30 08:12:15 PM IST,Mofos will never look stupider than when wasting reviews on wide not given,6
2024-04-30 08:12:16 PM IST,I know it's probably stupid but I hate when people stop the ball before it hits the boundary cushion,10
2024-04-30 08:12:20 PM IST,152.8,4
2024-04-30 08:12:20 PM IST,Why would you waste a review this early in the innings on a wide?,3
2024-04-30 08:12:20 PM IST,152.8 damn nice,9
2024-04-30 08:12:23 PM IST,Want to see Mayank and SKY in the same frame,5
2024-04-30 08:12:24 PM IST,152.8 kmph! I believe he will be on that BGT bus!,6
2024-04-30 08:12:24 PM IST,"Yeh thi tumhari foolproof planning

T: this was your...",3
2024-04-30 08:12:25 PM IST,Haarcb fans think 49 gonna be broken,4
2024-04-30 08:12:26 PM IST,Siraj over sandeep? Dafuq they were thinking?,5
2024-04-30 08:12:27 PM IST,"Ishan Kishan❌

Ishan Awasthi✅",9
2024-04-30 08:12:27 PM IST,Cgi is getting crazy,7
2024-04-30 08:12:32 PM IST,This reviewing system is harsh imo. Balls like these should be called wide they're impossible to connect with,1
2024-04-30 08:12:34 PM IST,MI need to get to 150 which may be enough to back their bowlers given the pitch,6
2024-04-30 08:12:36 PM IST,?,2
2024-04-30 08:12:36 PM IST,I don’t see batter SKY in the same frame as the bowler SKY,6
2024-04-30 08:12:37 PM IST,Surya got out because he has to bowl now,4
2024-04-30 08:12:38 PM IST,Bro how many bouncers? 3 already,10
2024-04-30 08:12:41 PM IST,That passed phassttt,0
2024-04-30 08:12:45 PM IST,"My mom asked if I finished washing the clothes

I said ""Rohit and Hardik""

She knew they were washed",35
2024-04-30 08:12:46 PM IST,Bros face😦,2
2024-04-30 08:12:49 PM IST,Umpires taking decisions that don’t help MI? Is this an alternate timeline?,3
2024-04-30 08:12:49 PM IST,Damn these domestic dudes (and a lot of internationals) are completely beaten for pace on his bouncer.,3
2024-04-30 08:12:50 PM IST,"I hate MI and I can't be happier. But if you think how 3 batsmen from MI are in T20WC squad, you know we are truly fucked. And we deserve it too. India won't win T20 till they drop these geysers.",17
2024-04-30 08:12:55 PM IST,Hey aren't the ball boys not allowed to touch the ball before it reaches the boundary???,5
2024-04-30 08:12:56 PM IST,Some guy really asking drop Rohit for whom (like he is that good) in WT20😭 Like dawg what has he done except performing in first WT20 and then minnow bashing.,16
2024-04-30 08:13:00 PM IST,3rd bouncer,1
2024-04-30 08:13:06 PM IST,Wadhera imploring the umpires for extras every ball,6
2024-04-30 08:13:06 PM IST,"he's legit, would be amazing to watch him bowl these lengths at Perth",7
2024-04-30 08:13:11 PM IST,What was Agarkar thinking.. Pandya in the team and as VC?!?! Is he seeing how out of form Pandya is?,10
2024-04-30 08:13:11 PM IST,"Whatever you do Mayank, keep bowling fast. Don't listen to these old fucks who reduce every pace to line and length and ruin his strengths.",15
2024-04-30 08:13:11 PM IST,Still only gave 7 runs,7
2024-04-30 08:13:15 PM IST,We should create a portal to track recent performances of our squad,1
2024-04-30 08:13:15 PM IST,Selectors obviously forgot that Sky can't be substituted in WC...no impact players in that level.,8
2024-04-30 08:13:17 PM IST,RCB fans.. what if Hardik came to RCB instead of Green? I think RCB would have benefited from a unique captain.,2
2024-04-30 08:13:21 PM IST,Is the pace a bit low because of the slow pitch?,5
2024-04-30 08:13:21 PM IST,3 bouncers allowed in one over?,11
2024-04-30 08:13:23 PM IST,Sky should have taken on Mayank but that would disrupt the timeline so...,2
2024-04-30 08:13:24 PM IST,Now you know why Agarkar didn't consider ipl performance for wc selection lol,7
2024-04-30 08:13:32 PM IST,Does it look like Kishan is hiding on no strikers end? Played 12 of 42 bowls,2
2024-04-30 08:13:33 PM IST,Mayank’s slow ball js 135,2
2024-04-30 08:13:34 PM IST,Did Mayank Yadav just bowl 3 bouncers in the over and get away with it?,10
2024-04-30 08:13:35 PM IST,3 bouncers in an over. No one will cry cheating now.,3
2024-04-30 08:13:39 PM IST,Mayank should be atleast part of BGT even as reserves,3
2024-04-30 08:13:41 PM IST,ms dhoni never bottled rigged home world cup,6
2024-04-30 08:13:43 PM IST,Atleast show the last ball speed and then cut to ads you FUCKING CUMSTAINS,12
2024-04-30 08:13:46 PM IST,"Fuck WC, I just want Bumrah and Mayank destroy Eng/Aus in their own pitches.",7
2024-04-30 08:13:49 PM IST,wadhera shit scared of the pace i see,8
2024-04-30 08:13:52 PM IST,"Absolute shambles. MI is in deep shit. Thank God there are Mega auctions next year. Expect Ambani to go for Salt, Buttler, Head, Klassen 😂",2
2024-04-30 08:13:52 PM IST,Didn't Naveen take 2 wickets??,3
2024-04-30 08:13:55 PM IST,MI on track for a triple figure score.,4
2024-04-30 08:13:59 PM IST,How Rohit is still an automatic pick for Ind in T20s is beyond me.. Guy hasn't done anything in the last 3 or 4 T20wcs and hasn't done anything in the ipl either the last 5 or so years. For how long can you keep picking someone based on their stardom and experience??,7
2024-04-30 08:14:04 PM IST,Batting so bad even the umpires can't find a way to help,8
2024-04-30 08:14:05 PM IST,What do you want from a Speedster? Wicket taking delivery but going for runs or opposite,1
2024-04-30 08:14:07 PM IST,Kishan trying to test team here,3
2024-04-30 08:14:09 PM IST,"siraj over sandeep 

rohit over gaikwad 

chahal over bishnoi

arshdeep over natarajan

richest board :)",8
2024-04-30 08:14:11 PM IST,[deleted],12
2024-04-30 08:14:16 PM IST,Classic MI making a 160 pitch look like a 120 pitch and watch it get chased in 15 overs.,5
2024-04-30 08:14:20 PM IST,"Look at these comments lol

Is r/cricket always this reactionary ?",3
2024-04-30 08:14:25 PM IST,13 more needed,2
2024-04-30 08:14:28 PM IST,"everyone was smacking RCB's 263, So Mumbai have decided to snatch 49.",5
2024-04-30 08:14:32 PM IST,He’s bowling in the 140s.,3
2024-04-30 08:14:33 PM IST,"High, because they play MI once again after this.",6
2024-04-30 08:14:39 PM IST,Sky has to get out because he had to come bowl,4
2024-04-30 08:14:40 PM IST,"How can the chances be ""Probably not""",3
2024-04-30 08:14:44 PM IST,I was hoping CSK or SRH to be their with lowest total in PP,1
2024-04-30 08:14:47 PM IST,Why is Romario Shepherd not playing? Didn't he make like 30 runs in an over?,4
2024-04-30 08:14:48 PM IST,I really hope Mayank yadav doesn't turn out to be another umran. He seems to have way more control over his lengths which is awesome to see,6
2024-04-30 08:14:52 PM IST,"Having mayank,still picking Siraj and arshdeep . Selectors should take risk for 1 spot in every wc selection",3
2024-04-30 08:14:56 PM IST,Still remember people and I were criticising why didn't rcb directly traded for pandya insted of green💀,3
2024-04-30 08:14:59 PM IST,Today's batting is slower than Tamil movie romance scenes,1
2024-04-30 08:15:00 PM IST,Shami’s damn injury seems to have ruined India’s WC prospects and GT’s IPL prospects,3
2024-04-30 08:15:01 PM IST,"Honestly speaking, guys like Ruturaj deserved a place ahead of Brohit in the Indian team.",1
2024-04-30 08:15:05 PM IST,Looks like pitch curators got offended,2
2024-04-30 08:15:05 PM IST,"Mumbai Indians… more like India in Knockouts

Sad but appropriate",5
2024-04-30 08:15:13 PM IST,gotta appreciate kishan's steadfast determination towards maintaining the 50 SR,2
2024-04-30 08:15:14 PM IST,Can't believe we're this bad. Unreal downfall,3
2024-04-30 08:15:16 PM IST,"SKY :




In form ❌




Has bailed us out of difficult situations in previous t20 wcs ❌






People questioning his selection in t20 wc ❌












Pandya :






In form ❌




Has bailed us out of difficult situations in previous t20 wcs ✔️






People questioning his selection in t20 wc ✔️",1
2024-04-30 08:15:18 PM IST,"Rohit Sharma dropped Rahul from squad, Rahul invaded Mumbai with Missiles and Bombers.",3
2024-04-30 08:15:19 PM IST,kl to rcb next year please god,0
2024-04-30 08:15:21 PM IST,How the fuck is Rohit in the list of MVP ? What are they smoking dude,5
2024-04-30 08:15:23 PM IST,"I don't see how they could fit both Axar and Jaddu in the 11 together,  why have them both in the squad ?",3
2024-04-30 08:15:28 PM IST,fun fact we don’t even have a finisher for the t20 wc this time,3
2024-04-30 08:15:28 PM IST,"Stoinis bowling 125-135kph

Broadcasters: ""Let's show the speed gun every ball. Important stuff right there.""

Mayank bowling 140-155kph

Broadcasters: ""Speed readings– no time for that nonsense! Segue to the replay, pronto!""",11
2024-04-30 08:15:31 PM IST,Glad to see Turner in the lineup.,1
2024-04-30 08:15:33 PM IST,"What a beautiful game. The Captain, Vice Captain and the no 1 batter in the WC squad are back in the hut and the batter watching this happen from the non striker's end is not even in contention for a position.",8
2024-04-30 08:15:33 PM IST,I think its a high chance of a low probably not,3
2024-04-30 08:15:37 PM IST,One thing I admire about LSG is that unlike the original teams they win consistently against MI and CSK.,7
2024-04-30 08:15:38 PM IST,"This seems like a slow pitch only because MI is batting first, when LSG bat this will be a road",11
2024-04-30 08:15:39 PM IST,Pitch is extremely slow. Like old Lucknow pitch. LSG could totally mess up the chase.,0
2024-04-30 08:15:42 PM IST,"For everyone rooting for Gaekwad - he hasn’t been impressive in his international outings.   

BCCI said they wouldn’t pick players based on IPL and they’re staying true to that.",16
2024-04-30 08:15:58 PM IST,Now I wonder how Mumbai Indians qualified the playoffs last year with that team. It is probably time to remove Hardik at Captain and bring back Rohit Sharma,10
2024-04-30 08:16:02 PM IST,"Having 4 players from a single team, where both the team and the respective players haven't been in a consistent form is a big concern for our WC

But whatever sails the boat for our selectors",5
2024-04-30 08:16:06 PM IST,"So what are your top 4 predictions?

Mine- RR KKR CSK LSG",5
2024-04-30 08:16:10 PM IST,Inb4 mayank or sky is substituted before the second innings cause they are the same guy,3
2024-04-30 08:16:14 PM IST,Will they hit 100+?,2
2024-04-30 08:16:16 PM IST,Looks like MI and RCB competing for the last spot on the table,0
2024-04-30 08:16:19 PM IST,"Rohit shouldn’t even be part of 15, let alone be captain of t20 team.",4
2024-04-30 08:16:20 PM IST,"Team with 4 players in the world cup squad, versus team with 0 players.


Revenge Derby💀",12
2024-04-30 08:16:22 PM IST,I’m glad Lucknow gave a solid recovery break to Mayank instead of rushing him back in. Still lots of time to qualify.,5
2024-04-30 08:16:23 PM IST,"Life was hell.. when KL and RO used to hit 30 runs in POWERPLAY

Fuck 2021 WC",6
2024-04-30 08:16:23 PM IST,Kishan doing well to see off the new ball. Should look to switch gears a bit in the 2nd session,10
2024-04-30 08:16:23 PM IST,"To all new fans: If some new player is destroying other teams. Give the other teams a few matches to analyze him and find his weakness and create plans to counter. For selection to national teams: Give another season.

Cricket is a strategic game as much as it's tactical. It's not gilli-danda.",6
2024-04-30 08:16:28 PM IST,A team full of youngsters will do better than the squad we have,4
2024-04-30 08:16:33 PM IST,They're carefully trying to go over 49. They'll smack after that,10
2024-04-30 08:16:33 PM IST,"True, bowlers win you tournaments!",7
2024-04-30 08:16:36 PM IST,The team with most Indian team representation vs a team with no representation,10
2024-04-30 08:16:48 PM IST,"People are saying Rinku Singh isn’t in the squad because he didn’t get enough game time at KKR this year. Fine. If IPL2024 is the criteria for selection, then what are Hardik, Jaiswal, Jadeja, Arshdeep, and Siraj doing in the squad?",13
2024-04-30 08:16:51 PM IST,I have a feeling now MI will bring out their best against us next game since they've fucked up for long enough,5
2024-04-30 08:16:52 PM IST,gill in reserves is mad ... you're wasting his prime,0
2024-04-30 08:16:52 PM IST,"SKY playing on both sides, bats like a freak, bowls like a freak.",3
2024-04-30 08:16:53 PM IST,"Naveen's bowling angles are the closest to Bumrah than anyone else, or am I tripping? his bowling arm arcs quite similar to Bumrah",6
2024-04-30 08:16:58 PM IST,Tough luck RCB,7
2024-04-30 08:17:05 PM IST,No way did you guys just saw how pandya walked down the crease ? I don't know if they showed but insiders showed it.,11
2024-04-30 08:17:07 PM IST,"You know 


If mayank stays fit and bowls fast 


He can still sneak into world cup squad 


If siraj keeps getting hit",7
2024-04-30 08:17:11 PM IST,looks like kishan has finally started playing ranji,14
2024-04-30 08:17:19 PM IST,"r/cricket used to be sarcastic reactionary shitposts for the lols, but kids coming in are taking it seriously.",22
2024-04-30 08:17:21 PM IST,Sky watching Nehal Wadhera whack a four off his own bowling ???,12
2024-04-30 08:17:25 PM IST,Should we sub in Naman if another wicket falls,7
2024-04-30 08:17:36 PM IST,No player from Lucknow and 4 or 5 from Mumbai Indians🤡Unreal downfalll,9
2024-04-30 08:17:39 PM IST,“I duck” ~ wadhera,7
2024-04-30 08:17:46 PM IST,"Can Naman play a rearguard innings at 7?
Don't send brevis ,he will not be useful here.",3
2024-04-30 08:17:56 PM IST,"will Rohit, SKy and Hardik retire from International cricket for the 2029 WT20",5
2024-04-30 08:17:59 PM IST,2024 is not going the way I thought it. And neither it is going for Hardik Pandya. I have an elite company of in the gang of having a fucked up year.,1
2024-04-30 08:18:01 PM IST,What happened here? I tuned in half an hour late and the match is virtually over. The trouble with T20 games.,1
2024-04-30 08:18:02 PM IST,"LSG fighting for top 4, MI fighting for bottom 1",10
2024-04-30 08:18:04 PM IST,Murali Karthik is the commentary equivalent of cold congealed cake maggi,5
2024-04-30 08:18:05 PM IST,"Wow, guess bowling a team out for below 49 must be extremely difficult.",9
2024-04-30 08:18:19 PM IST,Brohit is getting out against left handed fast bowlers just in time for another big tournament.,5
2024-04-30 08:18:23 PM IST,"Every day, 49 all out is becoming a target that is going to go down as an untouchable record",3
