Timestamp,Comment,Upvotes
2024-04-30 06:21:10 PM IST,Yadav vs Yadav on the way,3
2024-04-30 06:24:05 PM IST,Rahul to take out his vengeance on MI.,8
2024-04-30 06:31:09 PM IST,Expecting a century from KL in less than 55 balls,7
2024-04-30 06:35:06 PM IST,Poor KL his coffee buddy Pandu gets picked for WC as vc despite bad performance and KL doesn't even get a place in reserves.,12
2024-04-30 06:36:23 PM IST,"Yaay, time to lose.",2
2024-04-30 06:46:25 PM IST,"Historically accurate take:


MI first half of season when they need to build momentum: 😅😝😅😓😭😭😭😣😴😪


MI second half of season when they need to win 4/5 and increase NRR by +4: 😎💪🏾😎💪🏾🔥🥱🥱🥱🫡🫡😁👍🏾",4
2024-04-30 06:48:02 PM IST,LSG tonight evengthough them winning doesnt help DC. KL's ICT T20 career died but Pandu lived to tell another failure story ... can't support that.,4
2024-04-30 06:48:15 PM IST,KL will unleash his fury for not selecting him for WC 😈,5
2024-04-30 06:49:40 PM IST,Hardik will win another toss and decide to lose either way,4
2024-04-30 06:49:41 PM IST,kl vs mumbai today,13
2024-04-30 06:51:14 PM IST,Will mr maggi give us a treat ?,3
2024-04-30 06:52:43 PM IST,"Idk man, as a PBKS supporter, I want both these teams to lose today.",7
2024-04-30 06:53:06 PM IST,"Never felt so sure in any edition. MI looks on course for 10th position. Hurts, but logic points in that direction.",8
2024-04-30 06:58:40 PM IST,If mayank ain't Playing today I'm gonna riot,6
2024-04-30 06:58:55 PM IST,"KL will end MI today. It's been a shit season, hope it ends soon.",31
2024-04-30 06:59:04 PM IST,Justice for kl rahul. Why is sympathy merchant given priority over him????? Hope he belts mumbai today.,7
2024-04-30 06:59:47 PM IST,KL gonna hit at SR of 300 today.,22
2024-04-30 07:00:40 PM IST,Thank you rohit sharma and virat kohli for your service to Indian cricket. Hopefully kohli plays in ct 2025. No hope for t20 wc,8
2024-04-30 07:01:16 PM IST,KWK bros,4
2024-04-30 07:01:43 PM IST,KL looks dejected,18
2024-04-30 07:02:20 PM IST,KL looks sad tbh,5
2024-04-30 07:02:22 PM IST,KL sad,6
2024-04-30 07:02:25 PM IST,jts very suspicious how mayank yadav is only coming back against mumbai. double role today?,15
2024-04-30 07:02:30 PM IST,Kulkarni is in ...good luck to him.,3
2024-04-30 07:02:36 PM IST,Dude I understand KL looks depressed but looking at him I sinking my heart I don't know why,35
2024-04-30 07:02:38 PM IST,THE PAIN IN HIS EYES,6
2024-04-30 07:02:43 PM IST,Arshin coming in place of QDK is an interesting call,6
2024-04-30 07:02:46 PM IST,I know r/cricket hates KL but today I am feeling bad for him dude looks sad as hell today.,51
2024-04-30 07:02:58 PM IST,"KL misses out WC selection. 

KL wins toss and opts to bowl and possibly bury MI in the mud.",6
2024-04-30 07:03:02 PM IST,"Klpd looks more depressed than usual


He has no idea about team


He really thought he was in with a chance ",2
2024-04-30 07:03:08 PM IST,Dont know why but I feel like KL will pull off an insane knock like SKY did against RCB in 2020 when SKY wasn't selected.,18
2024-04-30 07:03:16 PM IST,rahul wins every toss lmao unreal,5
2024-04-30 07:03:24 PM IST,Vuvuzelas,2
2024-04-30 07:03:35 PM IST,Hardik is like that kid who doesn't study shit and still gets an A,3
2024-04-30 07:03:39 PM IST,Eyes don't like chico.(KL),4
2024-04-30 07:03:46 PM IST,Now that KL Rahul has been omitted from the WC squad expect him to play like a 21 year old Don Bradman,6
2024-04-30 07:03:50 PM IST,yuvuzels to counter booing??,3
2024-04-30 07:03:55 PM IST,KL totally going for the orange cap now,5
2024-04-30 07:04:02 PM IST,I thought I was imagining it but reading the comments I think it's fair to say that KL looks completely out of it. Happy about the decision to drop him but still feel kinda sad for him.,1
2024-04-30 07:04:08 PM IST,KL need to bring fury and wrath on Rohit and Pandu's plotting and planning.,6
2024-04-30 07:04:10 PM IST,A very rare day where every other team will root for MI,1
2024-04-30 07:04:12 PM IST,bro why am I feeling bad for kl his face looks so sad,6
2024-04-30 07:04:14 PM IST,"Hardik pandya looks delighted 


He looks most happy in last few games that too in genuine way


He is relieved that Rohit did not drop him for wc haha ",4
2024-04-30 07:04:22 PM IST,Almost forgot that it's Karan Arjun derby,3
2024-04-30 07:04:33 PM IST,"Without KL, I don't know who will be the scapegoat this time when we lose",12
2024-04-30 07:04:51 PM IST,he's happy because his captain accidentally selected him for wc,6
2024-04-30 07:04:53 PM IST,Aww I feel bad for KL,8
2024-04-30 07:04:58 PM IST,I think Turner is very underrated but surprised they drop stonis for him?,1
2024-04-30 07:05:05 PM IST,Its Mi game so we have to ask : was Hardik Booed??,3
2024-04-30 07:05:18 PM IST,kl is a really nice guy though as much as i didn’t want him in the squad i feel really bad now,2
2024-04-30 07:05:22 PM IST,"r/Cricket displaying dual emotions today: 

- No KL in the WC squad!

- KL looks sad today. Poor thing.",45
2024-04-30 07:05:25 PM IST,"Just because KL is sad doesn't mean he deserved the spot, I was one of them who wanted KL in contention too, but Sanju and Pant should be given a chance as they are the future, plus KL was adamant about being an opener, should've played this season as a middle order batter",3
2024-04-30 07:05:29 PM IST,Pandu's smugness will have no bounds now. Well it will help when we come home before semis.,7
2024-04-30 07:05:42 PM IST,"Everybody wants MI to win today except LSG fans.
Everyone will be bashing Pandya in the post match thread with MI fans today lol.",24
2024-04-30 07:05:51 PM IST,"Pandya not getting booed, I'm happy for him",2
2024-04-30 07:05:56 PM IST,KL is a great wk. But I guess there were too many options..but still. Kinda feel bad for him,13
2024-04-30 07:06:04 PM IST,Bad toss to lose ugh,3
2024-04-30 07:06:23 PM IST,jadeja and rohit will be the reason why we lose,9
2024-04-30 07:06:26 PM IST,"Yeah it's official, it's the Pandya derby now",3
2024-04-30 07:07:10 PM IST,"Let this game not distract U from the fact that CSA dropped the most legendary batsman of this era for the T20WC

The Myth, The Legend

Justice for Temba Bavuma",13
2024-04-30 07:07:14 PM IST,Nah KL not being in the wc squad is the absolute right decision. The squad is perfect imo except for the Rinku exclusion,-1
2024-04-30 07:07:27 PM IST,Rohit's last few knocks in IPL on birthday have been single digits.,13
2024-04-30 07:07:36 PM IST,"Arshin Kulkarni will play against Mumbai. At this point LSG is pre-MI quota team.
Mohsin, Arshad, Yudhvir, Prerak and now Arshin. ",7
2024-04-30 07:07:36 PM IST,"kl would have had a better chance to be selected if played in the middle order, wasn’t he supposed to do that earlier?",7
2024-04-30 07:08:31 PM IST,"Everyone is complaining about the WC squads, and no one is happy for Turner.",8
2024-04-30 07:08:36 PM IST,Time for us to show the other team fans just how shit we can be,8
2024-04-30 07:08:40 PM IST,"Omitted from WC squad, Angry KL would do anything to beat MI. As MI fan I fear a defeat by a huge margin.",6
2024-04-30 07:09:04 PM IST,MAYANK YADAV IS BACK BABYYYYYYYYYYYY,6
2024-04-30 07:09:18 PM IST,"Pandya is happy genuinely after days of overacting 


He was really scared he was going to get dropped for world cup


Klpd looks extra depressed 


And Ian bishop was trying to scratch at his pain 


But he avoided that question ",15
2024-04-30 07:09:54 PM IST,Rohit pulls Mayank for 6 x 3 times in a row. ,3
2024-04-30 07:10:39 PM IST,Is it just me or is almost every team fielding first this ipl after winnings the toss ?,2
2024-04-30 07:10:57 PM IST,Mayank and Suryakumar on the same ground at the same time. World ends today,8
2024-04-30 07:11:18 PM IST,"KL is a known MI merchant

Add this selection thing, he'll cook something tonight",11
2024-04-30 07:11:53 PM IST,"""Pandya will have to bowl consistently in the IPL to be in the WC squad.""

Pandya bowls consistently shit in IPL.

BCCI: ""Well, good enough! ^⁠_⁠^""",68
2024-04-30 07:11:54 PM IST,"rohit run predictions 

👇",3
2024-04-30 07:12:12 PM IST,"Damn , MI have created a nice placeholder costume , can't differentiate between him and the real SKY/Mayank",8
2024-04-30 07:12:46 PM IST,Dube is going to shit the bed in WI slow pitches. IPL flat pitches are clouding everyone's judgement,-7
2024-04-30 07:12:53 PM IST,"On other hand 


It seems good 


Despite crores in ipl


Indian cricketers still care about playing for india ",4
2024-04-30 07:12:53 PM IST,"KL gonna take his anger on MI, bro is always ready to destroy MI.",6
2024-04-30 07:12:55 PM IST,why naveen replaced Henry wtf,2
2024-04-30 07:12:56 PM IST,Is this first instance where Captian and Vice-captain for WC playing from same IPL team....,5
2024-04-30 07:13:11 PM IST,Can't wait for the memes when Yadav to run through MI and makes a mockery of WC selections.,5
2024-04-30 07:13:24 PM IST,KL is  going to score 80 of 35 balls as revenge,8
2024-04-30 07:13:39 PM IST,imo mayers should be given a chance. Foreign pacers are not really needed,4
2024-04-30 07:13:41 PM IST,Watch KL smack 30-40 ball 90 runs guy will be furious after not getting selected for WC....,7
2024-04-30 07:13:44 PM IST,[deleted],3
2024-04-30 07:14:10 PM IST,"Slow wicket today, I think tonight we're gonna see a lowish score like 230",7
2024-04-30 07:14:54 PM IST,Can MI make a comeback at this point realistically speaking?,2
2024-04-30 07:15:03 PM IST,it's really surprising how mumbai players always get the clean chit when world cup selections are around,4
2024-04-30 07:15:05 PM IST,lets say Mayank yadav bowls well in the upcoming matches without pulling a jofra archer what are the chances of him making a wild card entry in India T20 wc team,2
2024-04-30 07:15:09 PM IST,imagine all teams bashing Pandya after MI loses today,8
2024-04-30 07:15:47 PM IST,"MI having 2 matches with LSG KKR 

1 with SRH 

we decide the fate",12
2024-04-30 07:16:06 PM IST,"Yes I'm sad for KL not making in the team. But now he should claim the Orange Cap back and take his team to Finals.


Not like he has anything to lose anymore ",9
2024-04-30 07:16:32 PM IST,Is this the first T20 wc for Chahal?,2
2024-04-30 07:16:39 PM IST,Mayank vs Bumrah. Let’s GOOOOO!!!,4
2024-04-30 07:16:54 PM IST,Did yall see Pooran and Krunal trolling Kishan in net practice video?,4
2024-04-30 07:16:55 PM IST,"Man I am already scared about Rohit, today it's his b'day so I hope he plays good but knowing him I feel scared.",4
2024-04-30 07:17:45 PM IST,Fans booing Hardik was wrong. But way those 3 on star sports were babying Hardik was just embarassing. He's a grown man ffs. He's there to do a job.,2
2024-04-30 07:18:03 PM IST,Turner is the guy who scored 3 ducks in a row with RR ?,2
2024-04-30 07:18:07 PM IST,KL end MI's chances so that the captain and VC can focus on WC.,36
2024-04-30 07:18:30 PM IST,Feel bad for MI tonight. KL gona cook them on a Jet burner stove.,7
2024-04-30 07:18:53 PM IST,What happened to Henry??? He bowled pretty well.,3
2024-04-30 07:18:54 PM IST,Runs against mi don’t count,4
2024-04-30 07:18:58 PM IST,KL always turns up against MI and CSK won't be surprised if he cunts the Outta tournament...,15
2024-04-30 07:19:36 PM IST,Let’s hope Mayank bowls 150s. Last game he played he was reaching 140s barely. Whereas games before easily 155s,7
2024-04-30 07:19:48 PM IST,First meaningful IPL game since the last time Mayank Yadav played,5
2024-04-30 07:19:52 PM IST,I'm so dissapointed that one Mi Fanboi haven't put out any Rohit Sharma bday stay mofo remembers everything about MI....,5
2024-04-30 07:20:12 PM IST,Backing LSG cause I don't wanna see thala in the playoffs,33
2024-04-30 07:20:14 PM IST,Who would be lucknows impact player when they are batting?,2
2024-04-30 07:21:49 PM IST,KLR will probably smash MI today to complete his revenge arc against rohit for not selecting him in the wc squad 👍,12
2024-04-30 07:22:15 PM IST,"KL vs MI since 2018

- average of 134.00
- has hit three of his four IPL centuries against MI",18
2024-04-30 07:22:50 PM IST,"from ""justice for sanju samson"" to ""justice for kl rahul"" we have all grown up",17
2024-04-30 07:23:45 PM IST,"I just want 1 team out of  MI,DC,GT,KXIP in the playoffs. 

All of them needs to win all of their matches.

 MI has enough power to pull this off.",5
2024-04-30 07:23:47 PM IST,KL revenge arc vs rohit bday vibes who will win??,8
2024-04-30 07:23:52 PM IST,They could've replaced Pant w Rahul imo.,12
2024-04-30 07:24:59 PM IST,Why has QDK been dropped?,5
2024-04-30 07:25:02 PM IST,Lucknow fans cheering pandya cuz they know he will play for their team,11
2024-04-30 07:25:27 PM IST,"Ngl, KL is in better batting form than Rohit, Jaddu, but you can't drop skipper & all-rounder for just a batter. There was no way for him to fit in team.",11
2024-04-30 07:26:21 PM IST,"Ashton ""5 ducks"" Turner is here",5
2024-04-30 07:26:43 PM IST,LSG not playing Kyle Mayers? The hell?,3
2024-04-30 07:26:43 PM IST,I have a feeling KL is going to go into 🐐 mode to piss of the selectors,7
2024-04-30 07:28:12 PM IST,I'm expecting a 4(5) from Brohit,26
2024-04-30 07:28:14 PM IST,Are we continuing with Thusara,2
2024-04-30 07:28:34 PM IST,"Is it ""bring your kids to work"" day???. What's that height difference between the umpires??? Lmao.",2
2024-04-30 07:28:43 PM IST,ngl kl in a crown looks handsome,4
2024-04-30 07:28:51 PM IST,"KL to Mayank: Either aim at Rohit's head or his balls, nothing else, a beamer would be even better",9
2024-04-30 07:28:59 PM IST,KL’s revenge today,4
2024-04-30 07:29:08 PM IST,"Every time I see that LSG banner, I'm confused as to why Varun Chakravarty's on it.",2
2024-04-30 07:29:11 PM IST,Happy birthday Ro please don’t blindly mistime today thanks,3
2024-04-30 07:29:18 PM IST,Marcus Stoinis with the new ball??,3
2024-04-30 07:29:19 PM IST,MI masterclass today please 🙏,0
2024-04-30 07:29:40 PM IST,"rohit sharma run predictor on birthday

👇",3
2024-04-30 07:29:55 PM IST,Kl and Bishnoi vengeance arc,8
2024-04-30 07:30:16 PM IST,opening w/ the new ball? Bro's doing side quests,5
2024-04-30 07:30:19 PM IST,Par score plz?,2
2024-04-30 07:30:27 PM IST,hope stoinis can swing the ball and not bowl only short bowl,1
2024-04-30 07:30:48 PM IST,Slow pitch keeping Kyle Myers at bay,1
2024-04-30 07:30:50 PM IST,"I am ok with KL not being in T20s but I also think that he was a soft target. Selectors didn't show the same balls of steel while deciding players like Rohit, Pandu, Pant, Jaddu, etc etc who haven't won us many T20 games in recent ICC T20 tournament. So one good selection decision can't hide 5 bad ones.",12
2024-04-30 07:31:15 PM IST,"HOLY FUCKING SHIT

Ashton Turner, the RR LEGEND, is playing today


He scored 3 runs in 4 matches at an average of 1 and strike rate of 30 for us",5
2024-04-30 07:31:26 PM IST,Ishan kishan's international career might as well be dunzo,3
2024-04-30 07:31:29 PM IST,hard to support LSG with the horns,2
2024-04-30 07:31:33 PM IST,Review,4
2024-04-30 07:31:45 PM IST,Aint no way,2
2024-04-30 07:31:52 PM IST,"Hot take: KL in place of dube in the wc squad. KL is quality, Dube is just a basher, will find it difficult in slow pitches",6
2024-04-30 07:31:53 PM IST,stay 20 overs brohit,5
2024-04-30 07:31:54 PM IST,Somehow it looks like stoinis is wearing a toupee,6
2024-04-30 07:31:59 PM IST,As an SRH fan I should be supporting MI today right?,5
2024-04-30 07:32:22 PM IST,Miles away lol,3
2024-04-30 07:32:25 PM IST,"I can't hear shit, while the horns are blaring",6
2024-04-30 07:32:31 PM IST,"Stinker of a review, God knows what made him go for that",4
2024-04-30 07:32:31 PM IST,One of the reviews of all time,3
2024-04-30 07:32:34 PM IST,I feel bad seeing KL in today's match :(,14
2024-04-30 07:32:39 PM IST,What in Rizwan was that,3
2024-04-30 07:32:40 PM IST,KL looking chubbier.,0
2024-04-30 07:32:41 PM IST,clear gap lol,3
2024-04-30 07:32:44 PM IST,"Kl saved from abuse for not winning wc . Bowling attack is so bad, even ireland can chase if bumrah is having a bad day",9
2024-04-30 07:32:48 PM IST,Ambani back at it,2
2024-04-30 07:33:01 PM IST,Stoinis is a bowling allrounder who can score a 120* if needed for us these days,4
2024-04-30 07:33:05 PM IST,Mi buying umpires and ultra edge as always,1
2024-04-30 07:33:05 PM IST,stoinis got thaaat cake,5
2024-04-30 07:33:15 PM IST,"3rd umpire: ball passing close to the bat.
Ball nearly 6 inches away from the bat.

Do these guys bring their glasses to the match or just come to sit in AC?",0
2024-04-30 07:33:24 PM IST,"GUYS GUYS! Just realised that Lucknow pitch is as much of a similar pitch to Usa/Windies pitch we’ll get. Good test for Rohit, Pandya, Sky and Bumrah today.",8
2024-04-30 07:33:27 PM IST,How is the crowd enjoying these horns?,4
2024-04-30 07:33:36 PM IST,Why arshin as IP and not hooda or ayush? Arshin is an allrounder,1
2024-04-30 07:33:37 PM IST,Um Ishan what are you doing,3
2024-04-30 07:33:38 PM IST,BROHIT pls don't gift me duck on birthday I am vegetarian,34
2024-04-30 07:33:48 PM IST,What is this tuk tuk batting? /s,3
2024-04-30 07:33:48 PM IST,"I'll take a high of 150-151kph and an extended injury-free run from Mayank. He's already got a few ''wow"" pace readings in for the record books. Now it's all about cutting corners where it doesn't make any practical difference.",5
2024-04-30 07:33:54 PM IST,Thushara is here unless there is collapse. It’s good since he needs time to settle in. He will be good further he plays.,3
2024-04-30 07:33:54 PM IST,MI unlike other teams have developed a mindset to waste the pp and make the game fair for bowlers. Why are they not leading the fairplay award list?,7
2024-04-30 07:34:12 PM IST,Growing up we all lost that fearless KL in us and now have become a void like the current KL,17
2024-04-30 07:34:29 PM IST,So no Ishan and KL in the WC. Wonder if that will make them play fearlessly today,10
2024-04-30 07:34:38 PM IST,If KL scores good today what a tight slap would it be to the selectors.,11
2024-04-30 07:34:41 PM IST,Hell yeah. Mayank is fit and  back.,2
2024-04-30 07:34:45 PM IST,Calling indian WC bowling (exp bumrah) clowns is a massive disrespect to the clowns🤡,40
2024-04-30 07:34:46 PM IST,It was a wide,5
2024-04-30 07:34:57 PM IST,"Bruh they are not hitting Stoinis, Yadav is gonna clean them ul",8
2024-04-30 07:35:04 PM IST,brohit taking time to settle is better than blindly smacking from first ball,10
2024-04-30 07:35:06 PM IST,"Guys, I think I may have a mancrush on Stoinis. I get you Zampa.",9
2024-04-30 07:35:17 PM IST,Yeah brohit take it. Today’s ur bday. Use them reviews as your gift,7
2024-04-30 07:35:29 PM IST,Turner's debut. Excited,7
2024-04-30 07:35:32 PM IST,"WOOOO HE's OFF A DUCK

to the lad who said he was vegetarian, congrats, no more duck for you",6
2024-04-30 07:35:41 PM IST,"I’m just here for the SKY vs Mayank Yadav face off, might look like something out of the twilight zone",5
2024-04-30 07:35:42 PM IST,"Rohit's last three IPL scores on his bday 

1(5), 2(5), 3(5)

4(5) loading today",132
2024-04-30 07:35:47 PM IST,Rohit dedicating the first over to KL ... captain for a reason,5
2024-04-30 07:35:47 PM IST,Brohit bday bash upvote party,1
2024-04-30 07:35:52 PM IST,"Must be demotivating for KL. I understand he's a professional n all, but I'm sure it hurts.",3
2024-04-30 07:35:52 PM IST,"Looking at the bowling line up of LSG, I'm not confident MI will do good against even one of those bowlers. And we are already struggling against the part timer Stoinis ![img](emote|t5_2qhe0|8774)![gif](emote|free_emotes_pack|facepalm)",1
2024-04-30 07:35:54 PM IST,lol rohit can't even smack stoinis it's joever,2
2024-04-30 07:35:56 PM IST,Marcus McGrath,4
2024-04-30 07:36:01 PM IST,India’s bowlers apart from Bumrah and Siraj look as injury prone as Archer,1
2024-04-30 07:36:01 PM IST,Rooting for KL more today just to stick it to the wc selectors*,2
2024-04-30 07:36:02 PM IST,Will never be able to comprehend why mfs pay so much money to be there in person and then spend the entirety of the 3 hour game blowing into vuvuzelas (or whistles in the case of CSK),2
2024-04-30 07:36:02 PM IST,I know Stoinis is a medium fast bowler. But why is his over also very slow?,1
2024-04-30 07:36:06 PM IST,These dudes dont even attack Stoinis in the PP man,4
2024-04-30 07:36:16 PM IST,Sex over from big papi,2
2024-04-30 07:36:20 PM IST,Come on Brohit a birthday special like old times please,5
2024-04-30 07:36:22 PM IST,See Stoinis looks cool with a chewing gum unlike a certain captain who forces himself to look cool,7
2024-04-30 07:36:25 PM IST,Siraj preparing for his fiver (against USA),9
2024-04-30 07:36:34 PM IST,Oh. Gotta watch this. Mayank Yadav is playing.,11
2024-04-30 07:36:36 PM IST,Expect more of the same from this guy in the t20 World Cup,5
2024-04-30 07:36:44 PM IST,On one hand though I'm happy that ishan kishan didn't get In.,6
2024-04-30 07:36:56 PM IST,Have Mayank and Sky been seen together yet? Won’t believe one is not other till we do :P,3
2024-04-30 07:36:57 PM IST,Brohit duck for birthday special,-4
2024-04-30 07:37:13 PM IST,Jaiswal needs to let go of that moustache,5
2024-04-30 07:37:14 PM IST,Yashu my boy that stache isn't it😂,4
2024-04-30 07:37:17 PM IST,No way 4(5) is on,12
2024-04-30 07:37:18 PM IST,Damn,2
2024-04-30 07:37:27 PM IST,"Brohit at 37 will still stick around till next year. Koach is elite and fit as fuck for a 35 year old. A decade ago, this was the age you’d be termed as finished and expect to hand in your retirement",1
2024-04-30 07:37:27 PM IST,"Which is the spiciest cornitos flavor?

Is it jalapeño, peri peri or Tikka masala?",2
2024-04-30 07:37:33 PM IST,AB Rohit devilliers,2
2024-04-30 07:37:34 PM IST,He has been trying such shots,1
2024-04-30 07:37:36 PM IST,No Rinku in T20WC 😞,2
2024-04-30 07:37:36 PM IST,Steady start by India’s opener,3
2024-04-30 07:37:38 PM IST,Rohit getting out now to continue the trend,3
2024-04-30 07:37:38 PM IST,WC opener boi,3
2024-04-30 07:37:39 PM IST,"4(4), is he getting out next ball?",66
2024-04-30 07:37:40 PM IST,O capitan my capitan,3
2024-04-30 07:37:41 PM IST,Happy birthday brohitttt,6
2024-04-30 07:37:41 PM IST,Brohit playing these type of shots will one day give me heartattack,2
2024-04-30 07:37:41 PM IST,Nothing more scary than Indian bowling lineup for the WC. Scary for us.,13
2024-04-30 07:37:47 PM IST, Atleast not a duck,3
2024-04-30 07:37:51 PM IST,KL will be in the wc. Someones going to get injured and KL will be called to replace. KL wins india the final with a century,5
2024-04-30 07:37:55 PM IST,MF Rohit will get out playing this type of shot in wc knockouts,9
2024-04-30 07:37:57 PM IST,Happy birthday.,3
2024-04-30 07:37:57 PM IST,atleast its not a duck....,5
2024-04-30 07:38:00 PM IST,Wtf. Crazy shot,2
2024-04-30 07:38:03 PM IST,People really predicted this .,2
2024-04-30 07:38:03 PM IST,Will be rooting our for our rivals today. Score big Brohit.,3
2024-04-30 07:38:04 PM IST,Not a good bday is it mate?,3
2024-04-30 07:38:05 PM IST,lololol,5
2024-04-30 07:38:06 PM IST,The sky is blue,4
2024-04-30 07:38:07 PM IST,Someone predicted 4(5),8
2024-04-30 07:38:08 PM IST,4(5) a birthday special,2
2024-04-30 07:38:10 PM IST,Lol ... captain T20 ladies and gentleman,3
2024-04-30 07:38:11 PM IST,my indian captain ladies and gentlemen,5
2024-04-30 07:38:11 PM IST,No party today,2
2024-04-30 07:38:13 PM IST,37 has been the decisive age for many athletes recently.,2
2024-04-30 07:38:14 PM IST,DUDE NO FUCKING WAY HAHAH,2
2024-04-30 07:38:15 PM IST,Captain fantastic,2
2024-04-30 07:38:16 PM IST,Lol knew this was going to happen![gif](emote|free_emotes_pack|facepalm)![gif](emote|free_emotes_pack|facepalm),3
2024-04-30 07:38:16 PM IST,lmao so 4(5),4
2024-04-30 07:38:16 PM IST,Some dude actually predicted 4(5) wtf,8
2024-04-30 07:38:16 PM IST,FFS,3
2024-04-30 07:38:17 PM IST,"**1.3** **four and out!**

Rohit Sharma c Stoinis b Mohsin Khan 4 (5b 1x4 0x6) SR: 80",2
2024-04-30 07:38:18 PM IST,"Ohh captain, my captain. 😭",4
2024-04-30 07:38:18 PM IST,WC Opener Captain Lads 🤡,8
2024-04-30 07:38:20 PM IST,whoever said 4(5) got it right,12
2024-04-30 07:38:22 PM IST,Don’t celebrate too much it’s only allowed for certain people,3
2024-04-30 07:38:22 PM IST,"Sorry, no birthday gift for you Rohit",2
2024-04-30 07:38:23 PM IST,Happy motha fuckin bday captain,7
2024-04-30 07:38:23 PM IST,"Trailer of T20 WC.

We are doomed.",10
2024-04-30 07:38:24 PM IST,birthday party cancelled,8
2024-04-30 07:38:24 PM IST,SUPLAAAAAA,6
2024-04-30 07:38:25 PM IST,Klol in today's match: I am vengeance,11
2024-04-30 07:38:27 PM IST,BC MI can't catch a break.,5
2024-04-30 07:38:30 PM IST,What will do in WC if this the case 🥲,1
2024-04-30 07:38:30 PM IST,Shoonya Kumar yadav coming,6
2024-04-30 07:38:31 PM IST,signs were there looked uncomfortable,8
2024-04-30 07:38:31 PM IST,"Rohit, trying his luck . And he gets out on his bday.",3
2024-04-30 07:38:32 PM IST,Team selection is a draining process. Did well to get 4 here. Now go and take a good rest!,7
2024-04-30 07:38:33 PM IST,captaincy quota is real guys,11
2024-04-30 07:38:33 PM IST,I'm expecting a 5(5) next year,6
2024-04-30 07:38:33 PM IST,hes cursed on birthdays lmao,5
2024-04-30 07:38:35 PM IST,It was 4(5) last time too right? Unfortunate for Rohit on his birthday.,9
2024-04-30 07:38:36 PM IST,BRO😭😭😭😭😭,6
2024-04-30 07:38:37 PM IST,lmao he scored 4 runs,8
2024-04-30 07:38:37 PM IST,Wtf it came true,7
2024-04-30 07:38:39 PM IST,Khada hu aaj bhi wahin. T: still standing there,4
2024-04-30 07:38:44 PM IST,cooked captain,6
2024-04-30 07:38:44 PM IST,Lol bring left arm pacers get free wicket,7
2024-04-30 07:38:45 PM IST,O captain my captain ![gif](emote|free_emotes_pack|facepalm),3
2024-04-30 07:38:45 PM IST,Rohit slowly losing his touch before the WC,9
