Timestamp,Comment,Upvotes
2024-05-11 10:03:14 PM IST,"humko ranaji maaf karna galti mare se ho gayi

T : Ranaji forgive for I had doubted you",9
2024-05-11 10:03:18 PM IST,This is our allrounder. Imagine what international batters will do to him.,8
2024-05-11 10:03:21 PM IST,"Venky sucks against spin and shreyas sucks against high pace. They complete each other. 

Like ying Yang. Or should we say iYering and iYerang",10
2024-05-11 10:03:22 PM IST,I feel the reason Rana is played over Raghuvanshi is to give Rana some game time before the eventual departure of the Salt,11
2024-05-11 10:03:23 PM IST,Hardik's getting hit like a rented drum,8
2024-05-11 10:03:25 PM IST,Pandya back in form,8
2024-05-11 10:03:29 PM IST,"Bazball XI ( This IPL)

(Just attacking batsman and defensive bowlers) 

JFM

Head

Abhishek

Sky

Klaasen(wk)
 
Andre Russell

Dinesh Karthik 

Sunil Narine
 
Cummins
 
Axar Patel 

Bumrah 


Impact sub: Sandeep Sharma",5
2024-05-11 10:03:31 PM IST,is u/bgt_bgt a bot? could you please answer this for us,2
2024-05-11 10:03:32 PM IST,"No idea why Hardik introduces spin so late. Venky got poor record against spin, he must bring in chawla now. In the last game too, he brought chawla in the 11th over, and then Chawla took some quick wickets..",11
2024-05-11 10:03:40 PM IST,"Man Hardik bowled a good first over,but back to earth my hopes.",6
2024-05-11 10:03:44 PM IST,"I’m missing Hittu on field so much man. Maybe I’m too habitual of seeing him as our captain, constantly instructing people and on cam 50% of the match.",5
2024-05-11 10:03:45 PM IST,This Iyer is scoring most runs in the edges.,4
2024-05-11 10:03:50 PM IST,"Message from GG in the timeout was clear. We have 3 more batters, so go for it.
If required GG can sub in another batter at the end",17
2024-05-11 10:04:01 PM IST,Deep Das Gupta is always in the commentary box whenever KKR plays🤷,3
2024-05-11 10:04:05 PM IST,"This is the difference between shreyas and rana 
Rana takes 12-15 balls to get set 
Iyer takes 30 to start hitting, which is too many in T20s

Especially this IPL you can't do that on a good batting pitch",11
2024-05-11 10:04:07 PM IST,Sorry Venky bro. You are late. Shivam Dube already took your spot in t20WC.,6
2024-05-11 10:04:08 PM IST,Now the problem is that they have to bowl third bumrah over.,5
2024-05-11 10:04:18 PM IST,despite being shit in this cycle MI will still have a headache when deciding on retention,12
2024-05-11 10:04:26 PM IST,"Yes, hit some sixes this is a short match.",6
2024-05-11 10:04:34 PM IST,"If a wicket falls, Russell should come.",5
2024-05-11 10:04:40 PM IST,Man I missed Rana’s sixes,3
2024-05-11 10:04:40 PM IST,"""Nobody seems to be interested""",3
2024-05-11 10:04:41 PM IST,Boring ass game and commentary.,1
2024-05-11 10:04:53 PM IST,Captain should step up and bowl 4 overs,9
2024-05-11 10:04:55 PM IST,"After fucking over MI I like to think Iyer goes on Monday to his day job - a boutique consultancy firm where he's known as ""hardworking nerd""",9
2024-05-11 10:05:01 PM IST,ChawlaJi has delivered,3
2024-05-11 10:05:02 PM IST,Hardik ain't wearing that stupid looking bandana anynore,5
2024-05-11 10:05:03 PM IST,who is hardik shouting at after giving 16 runs himself lol,12
2024-05-11 10:05:03 PM IST,Chawla my goat,7
2024-05-11 10:05:16 PM IST,Chicha op,3
2024-05-11 10:05:16 PM IST,PIYUSH FUCKING CHAWLA KARDE BAWLA.,4
2024-05-11 10:05:17 PM IST,Damn Chawlaji really is something,5
2024-05-11 10:05:17 PM IST,Fuck,3
2024-05-11 10:05:18 PM IST,Chawla 🐐,5
2024-05-11 10:05:20 PM IST,Lord chawla and first ball wickets ![img](emote|t5_2qhe0|8783)![img](emote|t5_2qhe0|8783)![img](emote|t5_2qhe0|21496),5
2024-05-11 10:05:24 PM IST,No celebration by KKR legend chawla,7
2024-05-11 10:05:24 PM IST,Chawla fucking got him he got him I tell you!!!,2
2024-05-11 10:05:25 PM IST,"Good to see Ranaji back in action, hope he can take over from here.",2
2024-05-11 10:05:28 PM IST,"Yeah that's ok, get in Raman or Russell",6
2024-05-11 10:05:30 PM IST,Chawla chacha here to serve some extra ghee with the rajma and say Ben Stokes as you pay the bill,5
2024-05-11 10:05:33 PM IST,Piyush mama is back !,2
2024-05-11 10:05:33 PM IST,It had to be chawla obviously,2
2024-05-11 10:05:34 PM IST,"I hate it man this Chawla getting wickets in this kind of deliveries 
What a life haha",-1
2024-05-11 10:05:34 PM IST,(Young) Uncle power overcomes the MI basher,3
2024-05-11 10:05:35 PM IST,Did we just get mogged by chawla ji?,2
2024-05-11 10:05:35 PM IST,"**8.1**

Venkatesh Iyer c Yadav b Chawla 42 (21b 6x4 2x6) SR: 200",2
2024-05-11 10:05:36 PM IST,Chawla ji striking. Venky did his job very well though. They've too many batsmen to come to play tentatively,2
2024-05-11 10:05:37 PM IST,uncle ji strikes on first ball,2
2024-05-11 10:05:38 PM IST,Yessssss,1
2024-05-11 10:05:38 PM IST,Why's Brohit the imoact player? Surely a 5 times winning captain can help with the ideas though.,5
2024-05-11 10:05:40 PM IST,Go away bruh iyer (not U Venky the other one). Rana can captain and the team looks so strong. Let GG cook. Iyer dumbo is dragging this team down,5
2024-05-11 10:05:40 PM IST,Avg Chawla ji W,7
2024-05-11 10:05:40 PM IST,"cursed sub, everytime i open it, kkr wicket falls, goodbye",7
2024-05-11 10:05:44 PM IST,Damn our ex players... 😭😭,10
2024-05-11 10:05:45 PM IST,Piyush uncle > prime bumrah,5
2024-05-11 10:05:47 PM IST,"Just Chawla Chacha things

T: Chacha = uncle",5
2024-05-11 10:05:48 PM IST,Superman Chawla ji at it again. Unpopular opinion but having him back next year won’t be the worst thing on Earth,6
2024-05-11 10:05:48 PM IST,Good innings from Venky. It's up to Rinku and Russell now.,5
2024-05-11 10:05:49 PM IST,We losing today. Typical KKR performance against MI,3
2024-05-11 10:05:54 PM IST,Still a pretty good knock in the context of the game.,6
2024-05-11 10:05:57 PM IST,Chawla took Dhoni's spark comment seriously. Been a different man since,7
2024-05-11 10:06:01 PM IST,None of his shots looked convincing enough. Was a whisker away from being caught few times. However went on to score 42 off 21. Lol,4
2024-05-11 10:06:08 PM IST,Do Indian management trust Hardik to fulfill the role of 3rd seamer in t20 WC ?,1
2024-05-11 10:06:09 PM IST,Coaches should be allowed to sub in    once per season,5
2024-05-11 10:06:12 PM IST,Dude really lost all his power,2
2024-05-11 10:06:13 PM IST,"Some guy here was saying bring in spin, venky struggles against them. Brilliant my guy ![img](emote|t5_2qhe0|8783)",6
2024-05-11 10:06:15 PM IST,"dre russ sent against chawla ? 

I smell another wicket in this over",1
2024-05-11 10:06:16 PM IST,Russell isn't exactly strong against spin. Don't know why Ramandeep isn't sent ahead of him in collapses.,2
2024-05-11 10:06:17 PM IST,"Called it

https://www.reddit.com/r/Cricket/s/nUTslKPLzn",1
2024-05-11 10:06:17 PM IST,"Piyush Chawla told Hardik that he wanted to bowl the next over, and he did it!",3
2024-05-11 10:06:20 PM IST,Ngl I was expecting this.,1
2024-05-11 10:06:23 PM IST,Man would rather give an appraisal than a leave. Top notch poker player.,4
2024-05-11 10:06:23 PM IST,I worry about the Indian team selection for the wt20. We mught have chosen a more traditional set of skills that might get caught off guard. Fingers crossed I guess….,5
2024-05-11 10:06:27 PM IST,Ok time to summon u/fuckpiyushchawla,6
2024-05-11 10:06:36 PM IST,Venky threw away his wicket needlessly,5
2024-05-11 10:06:37 PM IST,WC year Chawla ji owning everyone Head Klassen Venky,3
2024-05-11 10:06:37 PM IST,Russel-mania begins,1
2024-05-11 10:06:38 PM IST,AGAIN THE SAME MISTAKE. WHY ARE YOU SENDING RUSSELL SO EARLY? SEND RINKU YOU IDIOTS,2
2024-05-11 10:06:39 PM IST,"Russell time ! He's not had a big total this season, law of averages has to catch up some day...",2
2024-05-11 10:06:40 PM IST,"Chawla chacha ke kulche 🤤

T: Uncle Rice's baked all purpose flour leavened flatbreads",-1
2024-05-11 10:06:40 PM IST,Russel against Chawla no way man just give Rana the strike,2
2024-05-11 10:06:41 PM IST,Bro i dont have hopes from Russell,2
2024-05-11 10:06:43 PM IST,should have sent rinku. Rinku being in form for playoffs is more imp than this match,1
2024-05-11 10:06:45 PM IST,Chawla doing everything to grab a heavy cheque next auction,4
2024-05-11 10:06:50 PM IST,Ashok Asvalkar sir forgot to tell SKY that he's supposed to perform in important matches as well,2
2024-05-11 10:06:52 PM IST,Having 8 batters is just crazy .,4
2024-05-11 10:06:52 PM IST,What was that song bruh,2
2024-05-11 10:06:54 PM IST,"Why gg and chandu are hell bent on promoting Russell over Rinku.
Russell can go from first ball, Rinku needs some time 
Also Russell is shit against leg spin anyway",3
2024-05-11 10:06:55 PM IST,![img](emote|t5_2qhe0|30516)![img](emote|t5_2qhe0|30516)![img](emote|t5_2qhe0|30516)![img](emote|t5_2qhe0|30516)![img](emote|t5_2qhe0|30516),3
2024-05-11 10:06:58 PM IST,[deleted],0
2024-05-11 10:06:59 PM IST,New pads for russ?,3
2024-05-11 10:06:59 PM IST,Uncle chawla 😭,2
2024-05-11 10:06:59 PM IST,I don't know why but I love the sight of Venkatesh Iyer playing spin without a helmet..,5
2024-05-11 10:06:59 PM IST,Not sure about sending Russell in just as Chawla is starting his spell.,-2
2024-05-11 10:07:02 PM IST,Fuck you piyush - andre,3
2024-05-11 10:07:02 PM IST,"Last match PC took key wicket of Head and Klassen but Hardik got credit for taking wicket of Shahbaz, Nitish Kumar..",9
2024-05-11 10:07:07 PM IST,Iyer again making mistake not sending rinku ![img](emote|t5_2qhe0|21944)![img](emote|t5_2qhe0|21944),-2
2024-05-11 10:07:13 PM IST,Here we go,2
2024-05-11 10:07:13 PM IST,"Chacha Chawla strikes again

so nonchalant about it",3
2024-05-11 10:07:19 PM IST,[deleted],2
2024-05-11 10:07:20 PM IST,"Dre Russ is not as reliable against spin, Rinku should have been sent instead",2
2024-05-11 10:07:23 PM IST,Muscled the shit out of that,3
2024-05-11 10:07:23 PM IST,The absolute worst commentary combo wtf.  ,4
2024-05-11 10:07:25 PM IST,"This is a good contest, Russell against spin.",4
2024-05-11 10:07:25 PM IST,Who’s the captain today? Seemingly everyone seems to be gravitating towards sky,6
2024-05-11 10:07:28 PM IST,I take my words back. Russlemania,4
2024-05-11 10:07:34 PM IST,Eat your words Murali 😂,3
2024-05-11 10:07:37 PM IST,I’d love to watch Dre Russ play Test cricket,7
2024-05-11 10:07:39 PM IST,russel is gonna get out in these 3 balls,5
2024-05-11 10:07:42 PM IST,One basher goes another monster arrives,2
2024-05-11 10:07:43 PM IST,">Be Piyush Chawla

>See Pacers getting belted

>Barges into field

>Gets the belter out

>Complimentary Ben Stokes as a celebration 

Really a 🐐",12
2024-05-11 10:07:56 PM IST,Should ask the cameraman to find me a bride lol,10
2024-05-11 10:08:17 PM IST,Murali and Deep together 🤢 🤮,9
2024-05-11 10:08:21 PM IST,These two have played each other enough in the nets. They know each other well.,2
2024-05-11 10:08:30 PM IST,162 of those 204 runs of Andre have come of boundaries,4
2024-05-11 10:08:32 PM IST,Russell mf bashed us for 50 and didn't score another,9
2024-05-11 10:08:32 PM IST,Nobody wants to write a Q in front of them!,11
2024-05-11 10:08:33 PM IST,Bumrah next over,6
2024-05-11 10:08:37 PM IST,Ooooooh spin experts in the comm. box,5
2024-05-11 10:08:47 PM IST,"Senior players celebrating after wicket - No action

When Harshit Rana does it- Real shit

No opening ceremony for world cup match between Eng and NZ

Organized a whole ass pre match concert in India Pak game out of the blue

Sometimes it feels convincing that the universe restores balance by making India lose every ICC tourney so that scums at BCCI can't take credit",35
2024-05-11 10:08:48 PM IST,"Chawla's attitude after taking a wicket reminds of that one uncle in every family wedding who moves his hands around as though he's controlling everything, but in reality it's all happening on its own,. although for some reason he thinks he's in charge.",75
2024-05-11 10:08:56 PM IST,Ooof random finesse from Dre,15
2024-05-11 10:08:59 PM IST,What a drive,10
2024-05-11 10:09:01 PM IST,hope they send Rinku next🥺,6
2024-05-11 10:09:16 PM IST,Ayo where'd that drive come from,6
2024-05-11 10:09:18 PM IST,The big man can play delicate orthodox shots too! Well played,11
2024-05-11 10:09:19 PM IST,Chawla shows a lot of attittude for someone that gets tonked regularly,6
2024-05-11 10:09:21 PM IST,I will never forget Piyush Chawla for how much he has carried our spin attack in last two seasons,6
2024-05-11 10:09:26 PM IST,Koach-esque cover drive.,7
2024-05-11 10:09:30 PM IST,Kohliesque cover drive from Russell is not what I expected,10
2024-05-11 10:09:31 PM IST,how is piyush chawla passing yo yo test ?? genuine question… Does he really have that fatty muscular strongman build ?,1
2024-05-11 10:09:32 PM IST,"Rusell and cover drive, you don't see that often",5
2024-05-11 10:09:33 PM IST,42 balls and 5 batsmen,3
2024-05-11 10:09:40 PM IST,"Bowl bumrah, this guy could be the difference between 160 and 180...",3
2024-05-11 10:09:42 PM IST,Take that ben stokes chawla,3
2024-05-11 10:09:43 PM IST,That macho sporto ad is so creepy.,3
2024-05-11 10:09:48 PM IST,Drive from russell? I've seen everything lol,14
2024-05-11 10:09:49 PM IST,Whose bright idea was to put Deep Das and Murali Karthik together in the com box…,10
2024-05-11 10:09:49 PM IST,Biggies playing technical cricket feels soo weird.,8
2024-05-11 10:09:53 PM IST,Finesse by Dr Dre,5
2024-05-11 10:09:55 PM IST,"Ahhh the classic ""KKR being bunny of MI"" match",1
2024-05-11 10:09:56 PM IST,Bring in bumrah you brainless cunts,4
2024-05-11 10:09:59 PM IST,"Venky was struggling after the injury, so I guess the stroke made sense",10
2024-05-11 10:10:10 PM IST,Bruh this DJ,3
2024-05-11 10:10:19 PM IST,"No one can question piyush fuckin chawla man, He hit the six to mitch johnson which kohli also tried on the similar ball and got out.",9
2024-05-11 10:10:31 PM IST,How many times has Piyush Daddy taken a wicket in the first over in his MI career???? SURELY HAS TO BE A LOT.,5
2024-05-11 10:10:31 PM IST,u/fuckpiyushchawla  Where are you bro?,7
2024-05-11 10:10:36 PM IST,"If we get to 170-180.
It will be a steal",3
2024-05-11 10:10:38 PM IST,"Bumrah is bowling the 15th for sure

The question is whether we bring him at the 11th, or the 13th?

This Thushara over will decide it",5
2024-05-11 10:10:41 PM IST,"damn , beautiful cover drive from Dre Russ of all people!",11
2024-05-11 10:10:43 PM IST,"Yesterday's comms panel was so good

Today's is equally shit",11
2024-05-11 10:10:44 PM IST,HP has such a lesser number of options that he can go to when Russell is playing. Bumrah can be the only right option now.,4
2024-05-11 10:10:45 PM IST,Thushara's will be a yuuuge over,3
2024-05-11 10:10:52 PM IST,Dafuq my ali baba malinga doing,18
2024-05-11 10:11:03 PM IST,Still going at near 10rpo. 180 would be a competitive total.,12
2024-05-11 10:11:07 PM IST,Andre vs medium pacer lol,4
2024-05-11 10:11:31 PM IST,"Good move to get Thushara in. Awkward action, somebody none of these two have played against.
And, you get to save Boom for the death.

Kamboj or Pandya would have been a gamble",1
2024-05-11 10:11:55 PM IST,"KKR isn't doing Rinku any favours by giving him such low batting time

Even Sanju sticking to top order has pretty much confirmed that Pant will start while Sanju, if he gets a chance, will be a pure batter",3
2024-05-11 10:12:05 PM IST,Russell wearing DK’s pads,6
2024-05-11 10:12:06 PM IST,Just realized MI is playing with just 5 bowlers including Hardik.,6
2024-05-11 10:12:06 PM IST,sri lanka is now full of malinga lites no wonder they are minnows now,2
2024-05-11 10:12:13 PM IST,Is it not distracting for the bowler for the nonstriker to be swinging his bat around,4
2024-05-11 10:12:27 PM IST,I just imagine if someone comes in line when Russell muscles the shit out of that ball,3
2024-05-11 10:12:27 PM IST,[removed],-2
2024-05-11 10:12:28 PM IST,Bro spamming wide yorkers,7
2024-05-11 10:12:30 PM IST,Rohit Sharma chants in kolkata,5
2024-05-11 10:12:39 PM IST, how did Mumbai miss out on pathirana with Mahela in the management for 6 years,7
2024-05-11 10:12:43 PM IST,"Looks like hardik will give 18th and 20th over to bumrah, oh wait",8
2024-05-11 10:12:50 PM IST,"If LSG wouldn't have gotten belted the way they got in the last two games, scheduling wise they still have the best chance to qualify for eliminators.",4
2024-05-11 10:12:56 PM IST,What's with Dre and DK with the same unusual pads?,3
2024-05-11 10:12:57 PM IST,Ranaji dafuq you doin ova there,2
2024-05-11 10:12:59 PM IST,Just randomly remembered that Malinga got Russell on a duck the last time he faced KKR,3
2024-05-11 10:13:06 PM IST,I want to see Bumrah vs Rinku/Russel matchup but both the teams are brainless to make this happen,3
2024-05-11 10:13:08 PM IST,Why pandya so angry at teammates,2
2024-05-11 10:13:09 PM IST,"How come mi gets all the babies. First baby ab and then this guy, and none of them grow up🤦",3
2024-05-11 10:13:16 PM IST,"What a good score for 16 overs on this pitch, peeps?",4
2024-05-11 10:13:18 PM IST,My goat Narine is out? Good thing he can bowl as well ,6
2024-05-11 10:13:20 PM IST,Cmon Ranaji you're too good to try these cheeky shots!,6
2024-05-11 10:13:22 PM IST,"Mi's scouting team few years back was better. After tilak ,they are yet to give a good player",3
2024-05-11 10:13:27 PM IST,Tf rana is doing,4
2024-05-11 10:13:29 PM IST,The only thing I want today is for Rohit to regain his form. At Eden. Against KKR. It’ll be poetic as fuck.,12
2024-05-11 10:13:33 PM IST,Why was nitish rana benched this whole time? Been out of the loop lately,4
2024-05-11 10:13:54 PM IST,Need a 20-25 run over now,6
2024-05-11 10:13:57 PM IST,"2 lite malingas, who'll be muralitharan",10
2024-05-11 10:14:00 PM IST,What’s the time for slow over rate?,8
2024-05-11 10:14:18 PM IST,3 overs of Hardik+Chawla from here will be very tough for MI now,7
2024-05-11 10:14:19 PM IST,[removed],-9
2024-05-11 10:14:24 PM IST,Sasta Malinga,1
2024-05-11 10:14:25 PM IST,Nah Dre Russ is in the zone tonight,5
2024-05-11 10:14:32 PM IST,Shot,3
2024-05-11 10:14:33 PM IST,Rinku-esque,2
2024-05-11 10:14:33 PM IST,Get Bumrah against Russell ffs,3
2024-05-11 10:14:38 PM IST,Try bowling a pinpoint Yorker to Rana. He moves so back in his crease he might get hit wicket,4
2024-05-11 10:14:49 PM IST,I miss Angkrish.,4
2024-05-11 10:14:49 PM IST,"Has Russell borrowed those pads from dk, he is playing like dk too lol

Hitting sixes",6
2024-05-11 10:14:54 PM IST,Dre’s pads look like a bad attempt at gift wrapping,18
2024-05-11 10:15:08 PM IST,DK pads are dkaing,6
2024-05-11 10:15:14 PM IST,Bumrah needs to come on next over else Russell is going to cause a LOT of damage,2
2024-05-11 10:15:16 PM IST,"2019 and 2020 IPL have to be the craziest league table finishes ever

In 2019, 4th team was at 12 points, and last team at 11

In 2020, 4th team was at 14 points, and last team at 12!

Funnily enough, KKR faced the brunt of 5th place both the times due to NRR",6
2024-05-11 10:15:18 PM IST,Not enough people talk about Iyer mostly being shit in IPL..KL gets more shit and his peaks are a lot higher,3
2024-05-11 10:15:18 PM IST,Tactical miss,3
2024-05-11 10:15:18 PM IST,"Fuck it man, at the end of the day it's sad and annoying to see a top team get dismembered and play clueless cricket, or decline, or whatever else. Whether it's seeing West Indies decline, or Pakistan once having people like Saeed Anwar open to what's happening now, Zimbabwe shrinking, to even seeing MI today.",1
2024-05-11 10:15:20 PM IST,You think Bumrah’s 6rpo at the death is nuts? This is [nuts](https://encrypted-tbn0.gstatic.com/images?q=tbn:ANd9GcQtP55VQmkxQNg-qTWZa174MjGYuJybD9GTQ1Cc2ipyteWIYeh3HGc-q9w9&s=10),36
2024-05-11 10:15:34 PM IST,"Reaching even 160 here won’t be easy, given two Bumrah overs are remaining.",1
2024-05-11 10:15:38 PM IST,Does anyone remember the legendary Sri Lankan fast bowler called Thilan Megina Mirando Thushara? Those were the glory days of Sri Lankan cricket with legends like Malinda Pushpakumara and Thilana Kandamby.,5
2024-05-11 10:15:50 PM IST,How good of a captain is Nitish?,1
2024-05-11 10:15:50 PM IST,"Why is venky, nitish,  varun, suyash not getting ict opportunities?",3
2024-05-11 10:15:57 PM IST,"Knights, please engage in the process of reverse jinx to support our team. Regards",4
2024-05-11 10:15:57 PM IST,"Russel wearing weirdly fitting pads to disorient MI bowlers

 /s",5
2024-05-11 10:16:14 PM IST,"ALWAYS STAND BEHIND THE WICKETS, Thushara",8
2024-05-11 10:16:29 PM IST,Ranaji against spin is gonna be interesting,4
2024-05-11 10:16:36 PM IST,Dekock ?,2
2024-05-11 10:16:55 PM IST,"Not related to this game but Mohammad Shami and Sanju Samson are my favorite national players, give their best don't expect anything in return, man beautiful people too.",7
2024-05-11 10:16:55 PM IST,Why doesn't MI / Hardik rest Bumrah if they are out already,0
2024-05-11 10:16:56 PM IST,Russell looking bat intently at the run out chance instead of completing his own run. Cares too much about his mate,2
2024-05-11 10:16:59 PM IST,Mf keeping bumrah for starc's batting?,11
2024-05-11 10:17:04 PM IST,"Fastest gun in the West, our Goughie!",3
2024-05-11 10:17:15 PM IST,"Sunil Narine is simultaneously KKR's most important batsman and bowler simultaneously, has any athelete in any sport been this dominant in all facets of a game? Very few would come close to this, I think. We are legit witnessing some Messi 2012 level or Bradman level shit and even raw stats probably do not  do justice to what he's doing. He's scoring a lot of runs at a strike rate that's extremely quick even in this era and bowling at an unprecedented economy in a ground where 262 has been chased in 18 overs.",8
2024-05-11 10:17:23 PM IST,Atleast roll it through 🥺,-1
2024-05-11 10:17:29 PM IST,"Just tuned in, why isn't Brohit starting? Back problem again?",2
2024-05-11 10:17:39 PM IST,"Day by day, Nitish Rana is turning into Abhishek Nayar",4
2024-05-11 10:17:44 PM IST,Shouldn't the umpire check the video till the point of the wickets getting hit ?,1
2024-05-11 10:17:46 PM IST,Bumrah bowling 13 and 15 I think.,3
2024-05-11 10:17:56 PM IST,Nitish Rana is just a left handed Iyer. WE DON'T NEED TWO OF those.,5
2024-05-11 10:17:56 PM IST,If we hit 80 runs from here it's gonna be a steal,4
2024-05-11 10:18:09 PM IST,Just saying that thala would never,7
2024-05-11 10:18:12 PM IST,It’s nice to finally see the commentators not talk about Dhoni for a change.,3
2024-05-11 10:18:15 PM IST,Spirit of Maxwell entered narine today,2
2024-05-11 10:18:16 PM IST,140 decent score??,1
2024-05-11 10:18:17 PM IST,"I will downvoted for this. 🥲. But if not for Narine masterclass, KKR would have been lying from 6-10th this year.",2
2024-05-11 10:18:21 PM IST,Can bumrah bowl 4 overs?,2
2024-05-11 10:18:27 PM IST,[deleted],1
2024-05-11 10:18:29 PM IST,"The last time MI played at Eden, this man Russell absolutely hunted us down

But hey, Hardik played the innings of his life too - 91(34)",6
2024-05-11 10:18:30 PM IST,What happened to Russell lol,4
2024-05-11 10:18:32 PM IST,Chawla is impressed with orthodox Russell,4
2024-05-11 10:18:33 PM IST,Even Piyush uncle was impressed,2
2024-05-11 10:18:41 PM IST,What's up with piyush chawla and his funny little faces today😭🤣,4
2024-05-11 10:18:41 PM IST,"If I were Hardik I would bring in Bumrah right about now , but then I'm not Hardik",4
2024-05-11 10:18:44 PM IST,160 is bare min here. 200 is what will make KKR feel lil comfy ,1
2024-05-11 10:18:54 PM IST,Man Cricinfo changed the font size. I absolutely hate it.,2
2024-05-11 10:18:57 PM IST,"Come on Boom 
2 more wickets and get that purple cap again",3
2024-05-11 10:19:05 PM IST,Boom vs Russell will be interesting,3
2024-05-11 10:19:11 PM IST,"Fuck me, even with their openers gone they are still going at 10 rpo",4
2024-05-11 10:19:11 PM IST,"23 after playing nearly 3 overs when you have Rinku and Raman to come. 
Come on Rana ji. Swing.",5
2024-05-11 10:19:17 PM IST,Jay Shah started cloud seeding?,3
2024-05-11 10:19:17 PM IST,Nitish needs to buckle up,3
2024-05-11 10:19:24 PM IST,"Already worried about the 3rd Chawla over

Out 6th bowlers are Naman and Tilak today",4
2024-05-11 10:19:40 PM IST,"Rana is supposed to be a spin hitter. 

Apparently he's also from Iyer's school of spin hutting.",4
2024-05-11 10:19:44 PM IST,Waiting for Bumrah to come and bowl and make Russell lay down on the pitch twerking,4
2024-05-11 10:19:53 PM IST,How weird are Russell's pads 🤔,-1
2024-05-11 10:19:53 PM IST,"The field placement and angles are a bit off imo, every ball is going very far away from the boundary fielders despite the position being manned",1
2024-05-11 10:20:00 PM IST,"Why's Nitish playing like it's a T20 match

Rinku and Ramandeep are yet to bat, KKR can hit as much as they can",8
2024-05-11 10:20:02 PM IST,"why not bumrah man, every time russell comes in bumrah is on fking pandya why r u so edgy",3
2024-05-11 10:20:03 PM IST,GOD THIS MATCH IS GONNA END AT LIKE 1 AM😭,2
2024-05-11 10:20:08 PM IST,"Russell giving respect to good balls and showing I can also build an innings, I’m not just a basher",7
2024-05-11 10:20:10 PM IST,Rana is putting russel in unnecessary pressure,6
2024-05-11 10:20:36 PM IST,Go bang bang now,3
2024-05-11 10:20:36 PM IST,"Russell has improved his game awareness and even his technique it seems , been a marked improvement from his past seasons where he was a bit too much of a loose cannon at times",3
2024-05-11 10:20:38 PM IST,Damn tilak my goat,5
2024-05-11 10:20:39 PM IST,KKR just not able to accelerate,3
2024-05-11 10:20:40 PM IST,"KKR doesn't need to win this gamez, they have shit ton of NRR can give match time to bench players incase of injury",1
2024-05-11 10:20:42 PM IST,Great fielding by Tilak,5
2024-05-11 10:20:42 PM IST,Bowl bumrah you cowards,2
2024-05-11 10:20:43 PM IST,Jonty Varma,7
