Timestamp,Comment,Upvotes
2024-05-12 12:04:03 AM IST,[deleted],0
2024-05-12 12:04:04 AM IST,Cmon boys let's win this <3,3
2024-05-12 12:04:06 AM IST,"SKY last 3 years:-

at Wankhede 584 runs, 58 avg, 195 sr

Everywhere else 669 runs, 33 avg, 150 sr",4
2024-05-12 12:04:07 AM IST,You are telling me Rohit played with 79 strike rate in a 158 In 16 over chase ?,3
2024-05-12 12:04:11 AM IST,Hardiks gotta atleast attempt to chase so he can get some of his form back,2
2024-05-12 12:04:15 AM IST,chakra with the fourth,2
2024-05-12 12:04:18 AM IST, atleast we're playing 3 minnows in the first 4 games in the World Cup to find some sort of form,1
2024-05-12 12:04:21 AM IST,Pitch is definitely gripping and turning still doesn't justify 19(24) and 11(14),3
2024-05-12 12:04:22 AM IST,"Pandya, the season is over, fire with the bat now at least?",2
2024-05-12 12:04:23 AM IST,Sky almost same strike rate as Rohit. Now those people who were rooting for him are gonna say let's replace him with Rinku in WC.,4
2024-05-12 12:04:28 AM IST,“Indian team needs an open heart surgery”- Ralph Ragnick,2
2024-05-12 12:04:28 AM IST,"Ventakesh, Nitish,Rinku, Kishan and now Tilak 

The pitch seems to be favourable for left handers",3
2024-05-12 12:04:30 AM IST,the match just disappeared on Sky...,2
2024-05-12 12:04:31 AM IST,"If all the players are ok to be retained and every team can retain 4 players, who should MI retain?",2
2024-05-12 12:04:34 AM IST,"Teacher: Rockets works on the principle of Newton’s third law.

KKR fans: How dare you talk about actions? Do you know ICc cleared Narine and CSk was banned and Pathirana and Bumrah have illegal actions and…",0
2024-05-12 12:04:35 AM IST,Sending Varun for a 4th over Narine is good captaincy.,3
2024-05-12 12:04:41 AM IST,Hardik its your time to redeemZ,1
2024-05-12 12:04:41 AM IST,From 90-something off 60-something to 70 off 30 is quite the choke ,3
2024-05-12 12:04:42 AM IST,"Maggi must have become soggy, took too much time",2
2024-05-12 12:04:47 AM IST,Man we seriously should protest! Someone can't keep getting away with shitting the bed so continuously but still making the national team! What's the point of IPL if deserving guys don't get spots atleast in the T20I squad??,5
2024-05-12 12:04:48 AM IST,Think about Brohit going back to SRH which is the successor of his original team Deccan Chargers and takes a hattrick against MI again.,3
2024-05-12 12:04:49 AM IST,It will be interesting to see how Irfan Pathan will criticize Hardik today for Rohit's pathetic knock. My guess? Hmmm... Hardik's captaincy affected him n forced him to play like this,6
2024-05-12 12:04:50 AM IST,why the fuck are they not even trying to slog? are they trying to lose willingly?,7
2024-05-12 12:04:53 AM IST,Even if hardick does not win this if he only manages to take it close will wash half of his sins .,6
2024-05-12 12:04:53 AM IST,Actual slow pitch,2
2024-05-12 12:04:55 AM IST,"If Piyush does well in a game, then the other spinners will do even better.

There's a reason he's not an elite IPL player despite so many years.",3
2024-05-12 12:04:57 AM IST,MI is trying to increase the required rate and Timothee is getting ready to be called a fraud,1
2024-05-12 12:04:58 AM IST,no varun for WC shouts here?,1
2024-05-12 12:05:01 AM IST,Pandya has lost his 6 hitting ability.,2
2024-05-12 12:05:02 AM IST,"Unpopular opinion but Rohit isn't one of the top 10 ODI players of this generation. Would rate Kohli, de Villiers, Smith, Root, Williamson, Taylor, de Kock, Warner, Dhawan, Morgan, Shakib, Babar over him.",-7
2024-05-12 12:05:02 AM IST,Narine not the one bowling 4 wow,1
2024-05-12 12:05:04 AM IST,An empire toppled by its enemies can rise again. But one which crumbles from within? That's dead.,12
2024-05-12 12:05:08 AM IST,"Ro and sky wasted 38  total balls that was below run a ball


thats 6.2 overs.... In a 16 over game",9
2024-05-12 12:05:09 AM IST,Should be the last innings Rohit ever plays for MI,11
2024-05-12 12:05:14 AM IST,Good decision to bring Mistri for his 4th,2
2024-05-12 12:05:21 AM IST,It feels like every match I hear the same thing. 'If Hardik wins it from here...' and it never happens.,2
2024-05-12 12:05:25 AM IST,Hardik quit GT because MS told him hardships are necessary for growth,5
2024-05-12 12:05:28 AM IST,Pandus chance to redeem himself as a batsman,1
2024-05-12 12:05:29 AM IST,Sunny g post match : SKY need to rethink his position in t20 if he can be consistent and perform then only he should be in squad and according to me if he cant keep up strike rate he should not play.,2
2024-05-12 12:05:30 AM IST,"I would be very surprised if India even made it to the finals of the World Cup. This batting line up does not move me. I think it’s between us and Australia in the final, might be shocked by one of Pakistan or South Africa",4
2024-05-12 12:05:33 AM IST,I just feel SKY and Rohit do this on purpose to sink Pandya,4
2024-05-12 12:05:35 AM IST,Varun Chakaravarthy > Yuzvendra Chahal,4
2024-05-12 12:05:37 AM IST,Should be the last innings rohit plays in IPL or T20I even I hope,3
2024-05-12 12:05:41 AM IST,This is the over,3
2024-05-12 12:05:41 AM IST,"It's so funny seeing armchair experts instantly claiming KKR ""struggling"" when getting hit in powerplay lmao so satisfying seeing their comments early on",5
2024-05-12 12:05:52 AM IST,Surely MI don't think they've got 20 overs to chase this 💀,2
2024-05-12 12:05:54 AM IST,"bc surya gone, match 80% gone",1
2024-05-12 12:05:56 AM IST,"Such a limp dick batting from the Indian core this year.

I worry this time thisnis going to be worser for us. Yashasvi/Kohli and inshallah.",9
2024-05-12 12:05:56 AM IST,Bumrah is biggest asset to Indian cricket than Rohit and Virat at this point of time,11
2024-05-12 12:06:03 AM IST,Tilak would be wonderful at ODIs,1
2024-05-12 12:06:08 AM IST,Hardik. The captain. Bro you are the clutch player apparently. Atleast win one match for this season. 01 match in one season atleast.,3
2024-05-12 12:06:09 AM IST,These are real world use cases. SKY got out in a crunch situation. Hardik gotta deliver. We will be in similar situations in the WC.,2
2024-05-12 12:06:11 AM IST,No intent whatsoever.,5
2024-05-12 12:06:15 AM IST,Pandu lol,3
2024-05-12 12:06:18 AM IST,Do these guys realise the Required rate is 16+,7
2024-05-12 12:06:20 AM IST,Hardik looks finished he isn't the same hardik,9
2024-05-12 12:06:22 AM IST,varun is looking like warne to MI,3
2024-05-12 12:06:24 AM IST,That Nitish Rana innings looking like a masterpiece now,11
2024-05-12 12:06:24 AM IST,"Hardik and Tilak ""no match awareness"" Varma partnership ",9
2024-05-12 12:06:27 AM IST,Pandu what are you doing?,5
2024-05-12 12:06:30 AM IST,Pandya 11(9) incoming.,6
2024-05-12 12:06:30 AM IST,okay does anyone know if KKR winning significantly negatively impacts DC's chances to be in the top 4?,8
2024-05-12 12:06:34 AM IST,Lol hardik.. you are done,14
2024-05-12 12:06:37 AM IST,Screw you Pandya. Why do we even have hopes?,8
2024-05-12 12:06:37 AM IST,Well Hardik it's not happening for you,11
2024-05-12 12:06:38 AM IST,Captain vc and star player all below 100sr,10
2024-05-12 12:06:38 AM IST,My idolo pandu is truly finished 😭😭😭,10
2024-05-12 12:06:39 AM IST,Clowns,3
2024-05-12 12:06:39 AM IST,Pandu can't get a redemption arc to save his life.,14
2024-05-12 12:06:40 AM IST,Fantastic spell from Mystery... He's completely flipped this match,4
2024-05-12 12:06:40 AM IST,I thought SKY was 14(11) lol it's opposite. Both suck but man <100SR is just sorry,6
2024-05-12 12:06:41 AM IST,Hardd dik?,7
2024-05-12 12:06:42 AM IST,hardik 'useless' pandya,11
2024-05-12 12:06:43 AM IST,"**11.4** **Chakravarthy gets MI's past and current captain**

Hardik Pandya c Arora b Varun 2 (4b 0x4 0x6) SR: 50",4
2024-05-12 12:06:47 AM IST,Welp this world cup is fucked,7
2024-05-12 12:06:47 AM IST,The clutch ain't clutchin,3
2024-05-12 12:06:48 AM IST,"Lol

We are shit",7
2024-05-12 12:06:49 AM IST,Bruh,2
2024-05-12 12:06:50 AM IST,This team’s fucking ass dude,6
2024-05-12 12:06:52 AM IST,Chaman,3
2024-05-12 12:06:52 AM IST,hardiclutch gone,2
2024-05-12 12:06:53 AM IST,Moye moye,3
2024-05-12 12:06:53 AM IST,">It feels like every match I hear the same thing. 'If Hardik wins it from here...' and it never happens.

Hmmmm",8
2024-05-12 12:06:53 AM IST,"This is one hell of a chokejob post Ishan


And trust me I have seen 2016 final",6
2024-05-12 12:06:54 AM IST,"Nah man, we folding like pack of cards",2
2024-05-12 12:06:55 AM IST,Hardik Pandya dosent help himself man,4
2024-05-12 12:06:55 AM IST,"Clutch Pandya >>>>>>> PRohit

*- Sujeeth from Bangalore maybe*",5
2024-05-12 12:06:55 AM IST,Selfless Rohit -> Selfless SKY -> Selfless Hardik,8
2024-05-12 12:06:56 AM IST,"Best player on the team, Hardik pandya, great job",8
2024-05-12 12:06:56 AM IST,What KKR needs is a good Legspinner. Unfortunately Suyash has disappointed this season,6
2024-05-12 12:06:58 AM IST,I like Varun's silent swagger after taking the wicket.,14
2024-05-12 12:07:01 AM IST,PAHAHAHAHAHA,5
2024-05-12 12:07:02 AM IST,Pandu has been the real impact player for mi. Came to mi and impacted them immediately and immensely lol,8
2024-05-12 12:07:03 AM IST,Rohit Wow. Sky Wow wow. Hardik wow wow wow..,4
2024-05-12 12:07:03 AM IST,MI have 1 win away from home this season.....,3
2024-05-12 12:07:03 AM IST,"As far as I can recollect, Russel got SKY in the last game too",5
2024-05-12 12:07:04 AM IST,Pandya ![img](emote|t5_2qhe0|21496),5
2024-05-12 12:07:07 AM IST,Lmfao,1
2024-05-12 12:07:07 AM IST,Lol.. I officially apologize for keeping any expectations from hardick lol..,3
2024-05-12 12:07:08 AM IST,"This guy is our finisher

I would rather have tewatia or rinku",2
2024-05-12 12:07:08 AM IST,Nita Kaki gotta take back the MI management from her son,9
2024-05-12 12:07:09 AM IST,MI choked hard. GG,6
2024-05-12 12:07:09 AM IST,I am so worried for world cup😭,2
2024-05-12 12:07:10 AM IST,"Never liked Varun as a bowler earlier. But these last few matches, he's actually showing his worth",3
2024-05-12 12:07:11 AM IST,"I never understood how these so-called experts club Kohli and Rohit together. In T20Is if Kohli is 9/10, then Rohit is 5/10. India lost 2016, 21, and 22 T20 wc because of Rohit. Somehow, only Rahul got all the blame for last 2 wcs.

No team selection committee in sane mind would have picked Rohit based on his past performancs, and ours made him captain.",2
2024-05-12 12:07:11 AM IST,"I don't understand the bashing MI is receiving on this sub.

Clearly all these armchair experts have no idea how tough it is to be consistently *shit* an entire season.",5
2024-05-12 12:07:12 AM IST,This is our ICT?!? Jesus Christ? We'd get bitchslapped by fucking Mongolia at this stage.,1
2024-05-12 12:07:13 AM IST,Redemption arc my foot,1
2024-05-12 12:07:14 AM IST,"MI fans- Hardik pls redeem yourself today

Hardik- 2(4)",3
2024-05-12 12:07:15 AM IST,This is a massive fuck you to the Mumbai management,2
2024-05-12 12:07:15 AM IST,Hardik bhai even suhana is laughing at us 😔,3
2024-05-12 12:07:15 AM IST,"LOL ... anyone who thinks this useless luggage will win us anything in WC with his batting, please see a shrink.",1
2024-05-12 12:07:15 AM IST,Man NONE of the ict members are giving me confidence rn it's literally just gonna be Kohli bumrah and inshallah,4
2024-05-12 12:07:15 AM IST,Great decision giving him the 4th lessgoooo,6
2024-05-12 12:07:15 AM IST,And now Hardik will become the scapegoat for this MI loss,9
2024-05-12 12:07:16 AM IST,"Pandya at this point is a massive failure as a player. Can’t believe we have both him and Rohit in India’s playing 11 in a couple of weeks.

We’re so fucked.",4
2024-05-12 12:07:16 AM IST,Nothing's going right for us this season.. fuck this..,3
2024-05-12 12:07:18 AM IST,"Ah yes, our WT20 is going to be great on pitches that take some turn.",1
2024-05-12 12:07:18 AM IST,"Hahahaha we r goimg yo win this world cup 

>!Im delusional!<",5
2024-05-12 12:07:18 AM IST,Decided not to watch the World Cup!,5
2024-05-12 12:07:19 AM IST,"Aa tenu moj karawan, dancing with the tune in my head 

Come on Bois",2
2024-05-12 12:07:19 AM IST,Hardik you absolute donkey,5
2024-05-12 12:07:21 AM IST,tim bdsk do something to make sure u r retained,3
2024-05-12 12:07:22 AM IST,Gandya for a reason,1
2024-05-12 12:07:22 AM IST,I like how Rohit and Pandya are complementing each other well. This is how team players should be.,4
2024-05-12 12:07:24 AM IST,Mi has the same score what hardik had last time he came to eden,1
2024-05-12 12:07:24 AM IST,"At this point, Hardik getting out helps MI more than the opposition.",2
2024-05-12 12:07:25 AM IST,Both pandhya and rohit are shit…no point in talking who is better,2
2024-05-12 12:07:25 AM IST,[removed],1
2024-05-12 12:07:26 AM IST,varun for t20wc xDDDD,1
2024-05-12 12:07:26 AM IST,Arre Herdick gundya 😭,2
2024-05-12 12:07:27 AM IST,MI filled with so many selfless players its funny.,4
2024-05-12 12:07:28 AM IST,Want all the clutch redditors to go bonkers for him as well.,2
2024-05-12 12:07:31 AM IST,"100 kph
Damn ",1
2024-05-12 12:07:31 AM IST,"Last match HP took wickets of Shahbaz, Nitish Reddy and Marco Jansen. Suddenly people thought HP was goat, but real hero was PC with wicket of Klassen and Head.",3
2024-05-12 12:07:32 AM IST,And to think that Kohli gets all that hate and scrutiny for his Strike Rate,3
2024-05-12 12:07:32 AM IST,nah losing 2 back to back matches to KKR is the lowest of lows for MI,4
2024-05-12 12:07:33 AM IST,"Man they are jogging, not even putting the pressure on the fielder with running. They have mentally checked out",2
2024-05-12 12:07:33 AM IST,50 strike rate is acceptable if you didn't waste more than 5 balls,3
2024-05-12 12:07:34 AM IST,Was Hardik part of the anti-captain conspiracy too that y'all are talking about,1
2024-05-12 12:07:34 AM IST,PBKS trauma helped us real good,6
2024-05-12 12:07:34 AM IST,"I am convinced, wicket is actually tough, Rohit strategically played slow in the start so as to provide strike to Ishan who was striking better, after that it just got tougher , doesn't justify but still not as bad as some people make it seem like",3
2024-05-12 12:07:35 AM IST,Rohit and Hardik: Hum do bhai dono tabhayi,5
2024-05-12 12:07:35 AM IST,pandya and rohit always neutralise their haters real bond #onefamily,8
2024-05-12 12:07:37 AM IST,"I honestly feel sad for Hardik, if the rift between Brohit and Pandya continues. It will eventually affect ICT. Both of them are core member.",1
2024-05-12 12:07:37 AM IST,"Pandu gone 


This is ours baby",5
2024-05-12 12:07:39 AM IST,Whole team decided to screw with ambanis today,2
2024-05-12 12:07:41 AM IST,This whole thing came about due to a failure to rotate strike against spin by Ishan and then whatever Rohit was trying to do.,1
2024-05-12 12:07:41 AM IST,"One day Hardik could actually get away from the slander, he threw it away",2
2024-05-12 12:07:42 AM IST,We are so fucking washed that it's not even funny,2
2024-05-12 12:07:42 AM IST,"Agent Pandya out, disadvantage KKR",3
2024-05-12 12:07:43 AM IST,No way MI is going to retain him. Not even sure if any team will pay more than 5 cr for him in auction.,3
2024-05-12 12:07:43 AM IST,"The only world this MI team is rocking, is their own",4
2024-05-12 12:07:44 AM IST,Literally threw the wicket,3
2024-05-12 12:07:46 AM IST,Can't wait for the fans war between Rohit and Hardik in twitter to prove who is playing worse,3
2024-05-12 12:07:46 AM IST,Delete this team,3
2024-05-12 12:07:47 AM IST,Hardik conspiring with Rohit and Sky to bring down the current captain. Selfless.,5
2024-05-12 12:07:47 AM IST,Feel bad for Varun for getting scapegoated for that WC and it leading to his departure permanently from ICT,4
2024-05-12 12:07:47 AM IST,"If SKY doesn't have a great T20 WC, he too should be done away with. He would anyway be 36 before the next t20 world cup.",3
2024-05-12 12:07:47 AM IST,"In retrospect, MI losing this bad is good for us.

They would want ultimate vengeance against LSG and that is a must-lose match for them so that RCB  goes through.",3
2024-05-12 12:07:47 AM IST,"Every mi season isn't considered shit unless there's one factor indicating it's shittyness


Losing both games to kkr

Losing once is already painful enough but if an mi team loses both of their games to kkr that mi team is at the bottom of the barrel in terms of an MI team


Might as well be a fake team bought out from rc 2023",6
2024-05-12 12:07:53 AM IST,"Every match when Pandya enters, everyone : incoming redemption arc.
Pandya : Hold my sangeet ad",6
2024-05-12 12:07:54 AM IST,these pokerbaazi ads are so shit,6
2024-05-12 12:07:55 AM IST,Moye Moye,2
2024-05-12 12:07:56 AM IST,And these are the players heading to the world cup😂😂😂,3
2024-05-12 12:07:56 AM IST,WC year Chakaravarthy is a different beast,2
2024-05-12 12:07:57 AM IST,"Imagining rohit ,vk tears after WC loss. Boss it will be painful. Hope rohit wins wc somehow like finch in 2021 and vk, samson carries this batting lineup.",3
2024-05-12 12:07:57 AM IST,"Rohit - 19(24) 
Sky - 11(14) 
Pandya - 2(4) 

Indian scorecard in the WC match they need to win to qualify for Semis 

(They will still qualify because a certain player will give 82(51))",4
2024-05-12 12:07:57 AM IST,"wtf is mumbai doing? Jesus. It's like they just threw the game away from a winning position. They were very comfortable at 10 an over, and then they just decided to chill? And now it's too much",2
2024-05-12 12:07:58 AM IST,Irfan tweet already drafted,4
2024-05-12 12:07:59 AM IST,"Whenever Hardik hits the ball these days, it's like he puts his entire energy behind that shot and it still barely crosses the 30yard circle",3
2024-05-12 12:08:00 AM IST,David is explosive. Him and Tilak can win it from here.,1
2024-05-12 12:08:01 AM IST,No.1 all rounder pick for Indian Cricket Team ladies and gentlemen ![img](emote|t5_2qhe0|8767),1
2024-05-12 12:08:01 AM IST,Shoulda stuck with GT innit. Enjoy the wooden spoon you deserve it.,2
2024-05-12 12:08:01 AM IST,Hate boner for sky on this sub . only plays on wankhede for a guy who has 3 centuries in sena countries,2
2024-05-12 12:08:01 AM IST,MI just don't have a second spinner. Chawla does what he can. Danny did say spinner would cook here.,2
2024-05-12 12:08:03 AM IST,Advantage MI,1
2024-05-12 12:08:03 AM IST,"> At what point do we talk about Hardik being so much better as an overall performer than Rohit this season? Captaincy still has questions tbf

Meanwhile Hardik: *Le moot diya tere comment pe*

T - *Just peed on your comment*",3
2024-05-12 12:08:03 AM IST,Varun honestly deserves another shot at the Indian team after the WC. He has been amazing in the last 2 years.,2
2024-05-12 12:08:03 AM IST,Hardik pandya downfall must be studied. How does someone fuck up this bad?,6
2024-05-12 12:08:03 AM IST,[deleted],2
2024-05-12 12:08:04 AM IST,"Well he could do only one thing, but it sucks",2
2024-05-12 12:08:04 AM IST,What is this god tier bowling Chakravarthy?,3
2024-05-12 12:08:06 AM IST,now I feel Rinku batted really well,3
2024-05-12 12:08:09 AM IST,It's Dawooding time,3
2024-05-12 12:08:09 AM IST,Pandya will want to forget this season very fast.,2
2024-05-12 12:08:09 AM IST,Ig even hardik don't want to be retained in this team 😂,3
2024-05-12 12:08:09 AM IST,"I used to pray for time like this, Us bulling MI, is this the heaven",3
2024-05-12 12:08:09 AM IST,"Lack of game awareness by Tilak and him not scoring against spin, cost us the game. - Hardik in his post match summary of the game.",6
2024-05-12 12:08:10 AM IST,is the pitch grippin more in the 2nd innings?,2
2024-05-12 12:08:11 AM IST,He's a clutch in an automatic gearbox,4
2024-05-12 12:08:12 AM IST,"Can we take our name out of this T20 WC, what's the point of playing with these embarassments",5
2024-05-12 12:08:14 AM IST,"Chakravarthy dismissing both the current and the future captain of India in T20Is to make a point 

/s",2
2024-05-12 12:08:15 AM IST,"Either Rohit is a awful batter who doesn't even deserve to be in the squad of t20 wc let alone captain it or he has willfully sabatoged the chase..

There is no other explanation for this kind of innings",6
2024-05-12 12:08:17 AM IST,If tilak wins this for mi here just make him the captain atp,5
2024-05-12 12:08:17 AM IST,"India is so cooked for t20wc, Brohit is out of touch , Pandu is in career worst form and even sky has been struggling a bit recently",3
2024-05-12 12:08:17 AM IST,Not losing 4 points against MI is the secret sauce for KKR's qualification,8
2024-05-12 12:08:17 AM IST,Goated spell from Mr. Mystery,2
2024-05-12 12:08:18 AM IST,"19(24)
11(14)
2(4) 

Our WC batting line up ladies and gentlemen. Best of luck to Kohli and Jaiswal.",9
2024-05-12 12:08:19 AM IST,"Pandya >>>> hitman


Bro wasted just 4 balls.",9
2024-05-12 12:08:21 AM IST,"I hope they back mentally strong players in the future atleast. Like Rinku, Jaiswal, Gill, Sai sudharsan. These Surya Kumars and Ishan Kishans seem like the ones from past generation who crumble under slightest semblance of pressure",5
2024-05-12 12:08:23 AM IST,Great over by VC here,3
2024-05-12 12:08:26 AM IST,Commentator just said critical wicket as if Pandu has set this season on fire with his batting 🤣🤣,6
2024-05-12 12:08:27 AM IST,David bats like hes never seen a spinner before lmao. Such a limited batsman,3
2024-05-12 12:08:27 AM IST,"Man, I'm tired of both - Rohit AND Pandu. Would've been better off without them.",4
2024-05-12 12:08:29 AM IST,I don’t fear losing the WC. That’s probably a given. But this team will probably get fucked by Pakistan as well. That’s the real worry. Every one is riding some horse without bothering to accept how out of form most of them are! Horrible!,5
2024-05-12 12:08:29 AM IST,"Rohit🤝SKY🤝Pandya 

Three chutiyas playing ring a ring a roses in dressing room",3
2024-05-12 12:08:30 AM IST,"PR be like:  

Aah yes, found the scapegoat again..!",1
2024-05-12 12:08:32 AM IST,aimless hitting hardik. that shot wasn't going anywhere even if he middled it.,1
2024-05-12 12:08:32 AM IST,Lets see if Alibaba polly gonna win this for MI,2
2024-05-12 12:08:32 AM IST,India will go to the WC with out of form players like Pandya and Rohit when they have such a tremendous talent pool is embarrassing,9
2024-05-12 12:08:34 AM IST,"Some MI fans want their team to lose

The team obliges 

[Those fans](https://images-wixmp-ed30a86b8c4ca887773594c2.wixmp.com/f/2939ef5c-83b6-4b75-a102-7b04730230eb/dcsc5tg-a29ab604-a22a-40b4-b61c-a9752485c4c3.png?token=eyJ0eXAiOiJKV1QiLCJhbGciOiJIUzI1NiJ9.eyJzdWIiOiJ1cm46YXBwOjdlMGQxODg5ODIyNjQzNzNhNWYwZDQxNWVhMGQyNmUwIiwiaXNzIjoidXJuOmFwcDo3ZTBkMTg4OTgyMjY0MzczYTVmMGQ0MTVlYTBkMjZlMCIsIm9iaiI6W1t7InBhdGgiOiJcL2ZcLzI5MzllZjVjLTgzYjYtNGI3NS1hMTAyLTdiMDQ3MzAyMzBlYlwvZGNzYzV0Zy1hMjlhYjYwNC1hMjJhLTQwYjQtYjYxYy1hOTc1MjQ4NWM0YzMucG5nIn1dXSwiYXVkIjpbInVybjpzZXJ2aWNlOmZpbGUuZG93bmxvYWQiXX0.DT4sNFa0rB86_dHT3fpwB63dCAM7j7EnWMegwUllIpM)",5
2024-05-12 12:08:36 AM IST,ICT players with a scary 32(42) with 3 wickets.,2
2024-05-12 12:08:38 AM IST,"Bruh SKY is gonna bottle this wc, he ain't the no1 batter everyone has made him to be.A bit challenging wicket and he goes packing.",7
2024-05-12 12:08:39 AM IST,Has the Pandya trade tanked our WC prospects lol,6
2024-05-12 12:08:39 AM IST,KKR is writing a new chapter here of making MI their bunny now,3
2024-05-12 12:08:40 AM IST,"Haha, we're leaving 50% of our best fifteen at home and carrying specialist captain and vc along with some run machines also known as fast bowlers.",10
2024-05-12 12:08:41 AM IST,"If my kid ever asks me what difference can captaincy cause, i will make him/her watch 2024 Mumbai Indians",12
2024-05-12 12:08:44 AM IST,Unreal spell from Varun,6
2024-05-12 12:08:47 AM IST,"I’ve been enjoying today’s commentary because I didn’t have to hear SanjuManju, Harsha, or Sunil.   

I’d rather listen to ordinary commentators than those 3",3
2024-05-12 12:08:47 AM IST,"Me watching hardik get out in ipl: 😈
Me realizing he's in the wc squad: 🤡",7
2024-05-12 12:08:49 AM IST,I don't know why pandya doesn't use spinners,3
2024-05-12 12:08:51 AM IST,[deleted],2
2024-05-12 12:08:52 AM IST,What a wonderful spell,3
2024-05-12 12:08:53 AM IST,Thank God we didn't win one of the earlier matches this season....coz we shitting the bed right now would have felt way worse,2
2024-05-12 12:08:55 AM IST,Nitish Rana over anyone? Subscribe?,1
2024-05-12 12:08:56 AM IST,We've been shit against spin consistently,3
2024-05-12 12:08:56 AM IST,Has Starc bowled yet?,1
2024-05-12 12:08:58 AM IST,Come on Timothee I have to pay my gym fee,2
2024-05-12 12:08:59 AM IST,VC has been so underrated each season yet gets so much shit due to the one match where no one turned up,3
2024-05-12 12:09:00 AM IST,GT will be wearing their lavender jersey against KKR on 13 may to spread awareness against MI,3
2024-05-12 12:09:01 AM IST,Hardik stays useless,2
2024-05-12 12:09:02 AM IST,how tf we lost against this mi team,4
2024-05-12 12:09:03 AM IST,Remove runs leaking chahal from wc and put this Varun chakaravarthy in,2
2024-05-12 12:09:04 AM IST,This David fraud. Hit one ball on the offside this season and ended up giving a dolly at one of the shortest boundaries in India,3
2024-05-12 12:09:07 AM IST,This wicket is tough to bat(not defending Rohit gotta specify on this sub lol),0
2024-05-12 12:09:08 AM IST,So KKR is qualifying,1
2024-05-12 12:09:10 AM IST,David bats worse than kuldeep against spin wtf ,2
2024-05-12 12:09:10 AM IST,r/Cricket about to accuse Chakravarty of chucking now,6
2024-05-12 12:09:12 AM IST,Pandya is no better than a no.9 at this point,2
2024-05-12 12:09:13 AM IST,Our WC chances are doomed,1
2024-05-12 12:09:16 AM IST,I would go for Russ - Starc - Russ - Starc/Rana for the remaining 4 overs.,2
2024-05-12 12:09:17 AM IST,Varun has been so so so good. And iyer’s captaincy has been top tier,2
