Timestamp,Comment,Upvotes
2024-05-12 12:46:38 AM IST,"Post Match Thread

https://www.reddit.com/r/Cricket/s/jdkNTI3aqJ",1
2024-05-11 06:48:36 PM IST,"I must be one of the unluckiest mfs. I have bought cricket tickets three times in my entire life. First, RCB vs RR in Bengaluru in 2019. Washed out. Second, India vs NZ, WC23 Warm-up in Trivandrum. Washed out. Third is today, KKR vs MI. Raining cats and pissing dogs. On top of all that, I'm an RCB fan. Why does God hate me?",77
2024-05-11 06:49:03 PM IST,"DC choosing Axar as temporary captain like CSK chose Jadeja, let's see how it goes for them",3
2024-05-11 06:50:35 PM IST,today i feel wada pav,-7
2024-05-11 06:51:49 PM IST,"Raining on and off in Kolkata throughout the day. Even if the game goes ahead, I think it will end up being shortened.",6
2024-05-11 06:54:29 PM IST,"Thushara better bring his A game today. First ipl match was 3/42, 2nd was failure. It happens to the best every now and then but his fielding can't be rubbish & dropping sitters.

Hope he has a good outing to complement Bumrah from both ends.",3
2024-05-11 06:59:18 PM IST,Do you anticipate any play today?,2
2024-05-11 06:59:42 PM IST,Will it benefit kkr if game washes away...,1
2024-05-11 07:00:25 PM IST,Is it raining?,1
2024-05-11 07:00:41 PM IST,Bring back Saturday double headers. My dad and I wake up every Saturday morning with nothing to do,33
2024-05-11 07:00:43 PM IST,Who invited RAIN Perera??,3
2024-05-11 07:01:24 PM IST,So rain is gonna save us from last position,3
2024-05-11 07:01:34 PM IST,Bro aint no way its already raining,2
2024-05-11 07:02:11 PM IST,Nahhh Ambani will do anything to prevent his team from an embarrassment.,5
2024-05-11 07:03:51 PM IST,Both teams doesn't care really if the match is washed out,4
2024-05-11 07:05:03 PM IST,"In the battle between Vada Pav and Mishti Doi, rain is winning??????",3
2024-05-11 07:08:03 PM IST,Bro can’t they just do the toss indoors?,9
2024-05-11 07:09:12 PM IST,bro I just came back from the gym deadbug finished me bruh,3
2024-05-11 07:10:56 PM IST,"Yay rain. 

Everyone needs a break day in the IPL I guess.",3
2024-05-11 07:11:03 PM IST,I thought I’d enjoy my coffee yogurt while enjoying the match,4
2024-05-11 07:11:13 PM IST,No this is too bad. Just cuz you are the richest man in India doesn't mean you can flex your money on cloud seeding techniques to save your team from embarrassment Ambani bro.,24
2024-05-11 07:12:06 PM IST,Weather forecaste followers - likelihood of getting any play?,6
2024-05-11 07:13:48 PM IST,We might get a game here.The rain forecast shows no rain after 8 pm.,7
2024-05-11 07:14:04 PM IST,"shaggy oil squeal ruthless psychotic ossified fine dog gullible impolite

 *This post was mass deleted and anonymized with [Redact](https://redact.dev)*",16
2024-05-11 07:14:07 PM IST,Was already pissed at no double header Saturdays and then weather pulls this shit off r/Fuckrain,11
2024-05-11 07:14:57 PM IST,Who won the toss?,-1
2024-05-11 07:16:37 PM IST,"rain rain go awaay 

rain rain go awaaay 

rain rain go awaaaay",13
2024-05-11 07:16:47 PM IST,KKR won't mind a washout at all. 17 points guarantees qualification and they get a mini break before flying cross-country to Ahmedabad for a match in less than 48 hours.,7
2024-05-11 07:18:31 PM IST,Why can't they have a toss in the rain just use an umbrella lol,25
2024-05-11 07:19:54 PM IST,This prediction is INSANEE,5
2024-05-11 07:19:57 PM IST,"It feels weird to me that with the impact sub and flat pitches that Gayle's 30 ball century and 175 is still untouched and no one's even come close really . Even with all the the JFM, Head, SKY and Klaasen's of the world. I do think JFM can get a 30 ball hundred vs RCB at the chinnaswamy tommorow tho.",26
2024-05-11 07:21:00 PM IST,"After the news of Jimmy's retirement, I just want some smash and smash cricket to forget about all my pain.

Wait, what do you mean it's raining?",9
2024-05-11 07:22:13 PM IST,Rinku hanging out with all the wrong people,17
2024-05-11 07:23:18 PM IST,Embrace yourself for 49277287262261 Rain Perera jokes,4
2024-05-11 07:24:19 PM IST,Rohit in KKR's camp lmao,9
2024-05-11 07:24:37 PM IST,rohit sharma just sighed after hearing anderson is gonna retire,4
2024-05-11 07:24:44 PM IST,I have to make a fantasy league team ..dear Kolkata boys any chance of a game at all ?,2
2024-05-11 07:25:10 PM IST,is match getting washed?,1
2024-05-11 07:25:45 PM IST,"So lets say CSK vs RCB is the last match, and winner gets to 4th position. Wouldn't it be absolutely hilarious if rain chimes in and knocks out both of them?",38
2024-05-11 07:25:58 PM IST,Why is apple weather app showing no rain😭😭,4
2024-05-11 07:26:49 PM IST,I'm sure Jimmy's premature retirement has rattled him. Probably doesn't have finances sorted out yet. Come to ipl for a season lol,7
2024-05-11 07:27:11 PM IST,"We may see matches now getting washed out / get shortened


Monsoon is coming ( it was really necessary , so dont really care about IPL )",9
2024-05-11 07:27:42 PM IST,Mazha ninnu bois,7
2024-05-11 07:27:49 PM IST,"So I predict that Narine will again take wicket of Rohit, what do you guys think?",8
2024-05-11 07:27:50 PM IST,Why are these morons showing dhoni playing football today,34
2024-05-11 07:27:58 PM IST,Rinku hits 3 sixes in a row. Stays at his crease and stares at rohit while chewing gum,8
2024-05-11 07:28:01 PM IST,Rain Gods are crying after hearing news of Jimmy's retirement,17
2024-05-11 07:29:09 PM IST,"For those in kolkata, how bad is the rain?",9
2024-05-11 07:29:11 PM IST,"We get it, MS Dhoni is cool. Now let’s discuss this upcoming game",48
2024-05-11 07:29:36 PM IST,"Rain or win, it's the same for KKR.",11
2024-05-11 07:30:27 PM IST,"gutted by anderson's retirement, never expected the kohli-anderson battle to end so prematurely",7
2024-05-11 07:31:43 PM IST,Bro they should just ask the teams to play random games like bottle flip or something like that to keep the audience entertained,9
2024-05-11 07:32:18 PM IST,Dhoni licking done ..time for Kohli now 😂,8
2024-05-11 07:32:22 PM IST,Last 2 matches of Rohit with mi this had to happen,3
2024-05-11 07:33:17 PM IST,Vishnu Vinod a chance?,1
2024-05-11 07:33:19 PM IST,Turned on after the football to see Phil Salt bat and it’s *raining*? Rude and inconsiderate.,6
2024-05-11 07:33:37 PM IST,"“Surya dada welcome to our in the net’s session”

😋😩",2
2024-05-11 07:33:59 PM IST,"I'm worried if both captains shake hands now, they'll start playing ms dhoni the untold story",43
2024-05-11 07:34:17 PM IST,Man I want Brohit to finish good this season as it can be his  last  season for MI.😔,3
2024-05-11 07:34:36 PM IST,"Incase of a washout, what happens to the points? 1-1 each and KKR qualify?",7
2024-05-11 07:34:48 PM IST,"Kolkata boys , how’s the weather? Is it gonna stop",3
2024-05-11 07:36:24 PM IST,I demand one point to be minused from both the teams incase of washout /s,0
2024-05-11 07:36:25 PM IST,"considering this as washout , will it affect any other teams cause MI is eliminated and kkr are almost qualified . can someone explain?",3
2024-05-11 07:36:53 PM IST,"Kya Bolti public bole toh takleef. 

T : I love this sub.",3
2024-05-11 07:37:29 PM IST,[deleted],6
2024-05-11 07:37:49 PM IST,Washout on Saturday is atrocious,10
2024-05-11 07:38:23 PM IST,This game is the first dead rubber I think. Even if KKR lose it wouldn't make much of a difference.,-2
2024-05-11 07:38:36 PM IST,Rain stopped.,6
2024-05-11 07:38:42 PM IST,Even Nature doesn't want such dead rubber game.,1
2024-05-11 07:39:22 PM IST,"The game doesn't matter to rcb, so god decided to pee on it",12
2024-05-11 07:39:47 PM IST,Is it possible for DC AND RCB to qualify? Even if RCB defeat DC they can still end up with 14 points by defeating LSG.,5
2024-05-11 07:39:52 PM IST,Lol what is Rohit doing in KKR dugout? Please don't tell me he is actually coming to our team next year 🥲😭,17
2024-05-11 07:39:57 PM IST,Just play book cricket in case rain doesn’t stop,6
2024-05-11 07:40:55 PM IST,rain has stopped,5
2024-05-11 07:41:44 PM IST,"Did I hear him say ""allegedly"" land on the moon?",2
2024-05-11 07:42:02 PM IST,My cousin just told me that rain has stopped. The drainage system of Eden gardens is the best in the country iirc. Expecting the play to start shortly,9
2024-05-11 07:42:28 PM IST,"Rain has stopped and the groundstaff are using mops to push the water on the covers to one side so that they can remove without spilling on the outfield

it takes time",20
2024-05-11 07:42:40 PM IST,[deleted],10
2024-05-11 07:42:43 PM IST,why rohit sharma is behaving like ronaldo in man utd,4
2024-05-11 07:43:01 PM IST,eden has good drainage system,8
2024-05-11 07:43:04 PM IST,Just give each side one point each. We can go back to Mumbai and KKR can go to Gujarat.,11
2024-05-11 07:43:41 PM IST,Can't they cut the toss time by doing toss now?,7
2024-05-11 07:43:57 PM IST,If our best drainage system is a bunch of guys mopping the ground then it's not best lol it's embarrassing,3
2024-05-11 07:44:17 PM IST,Rain Perera adds another POTM to his collection...,11
2024-05-11 07:44:32 PM IST,Any team winning the toss will chose to bowl.,7
2024-05-11 07:44:37 PM IST,Are we likely to see a full 20 overs match now the rain has stopped?,6
2024-05-11 07:44:58 PM IST,Kkr don't need Rohit Sharma.Just stop all these Rohit Sharma is coming to kkr next year bs.,14
2024-05-11 07:45:22 PM IST,Rohit in KKR dugout bro 🥲🥲,61
2024-05-11 07:45:25 PM IST,I think its rude that rain has been snubbed in this seasons IPL script and reduced to cameo appearances.,10
2024-05-11 07:45:54 PM IST,Where did the name “Rain Perera” come from? Someone drop the lore please.,5
2024-05-11 07:46:02 PM IST,currently [https://imgur.com/a/scKFcdt](https://imgur.com/a/scKFcdt),5
2024-05-11 07:46:43 PM IST,"So when it'll rain in a Big Bash game, will we call it a BBL Drizzle?",7
2024-05-11 07:46:44 PM IST,How about Rohit retiring from IPL and white ball cricket to focus on tests for a few(2-3) more years?,4
2024-05-11 07:46:51 PM IST,Wtf how can it rain here? 3 matches ban to Rana,34
2024-05-11 07:47:06 PM IST,"From Cricbuzz:

> Joseph Xavier M: Actually there is so many people against Impact sub rule. But I actually like it as it gives more oppurtunity for more Indian players. But need bowler friendly wickets to neutralize the rule. But that will be a distant dream.",4
2024-05-11 07:47:14 PM IST,"Final take, we don't need brohit",11
2024-05-11 07:47:53 PM IST,I think the match will be reduced to 15 overs,6
2024-05-11 07:49:37 PM IST,Irrelevant match,-5
2024-05-11 07:49:42 PM IST,[deleted],9
2024-05-11 07:49:47 PM IST,Why cant they use mopping vehicles instead of manual labor.comentator trolled by saying we went to moon long ago but still using guys with mops instead of machines,14
2024-05-11 07:50:13 PM IST,Apparently the rain has been caused by the very in-disciplinary actions of a young pacer- harshit rana. Therefore a two match ban for him.,30
2024-05-11 07:51:33 PM IST,What's up with these Rohit in KKR dugout comments? Anybody got a pic or a video?,7
2024-05-11 07:51:49 PM IST,Bcci just need sponser money but won't try to improve quality of the game and horrible umpiring,13
2024-05-11 07:52:22 PM IST,"Can't they just do the toss shortly, watch em set a toss time and match half an hour later",10
2024-05-11 07:52:43 PM IST,[deleted],9
2024-05-11 07:53:26 PM IST,"Covers are being taken off

-cricbuzz",6
2024-05-11 07:53:27 PM IST,Rohit doing some inception in the KKR camp?,6
2024-05-11 07:53:46 PM IST,People interacting in dugouts is a common sight under rain and such. Doesn't mean shit for auctions. Even Sky was chatting with Venky and others doesn't mean he's coming to KKR,7
2024-05-11 07:54:11 PM IST,"Harshit Rana celebrate like that and it resulted in a heavy rain at the Eden.

2 match ban for him.",6
2024-05-11 07:54:11 PM IST,Someone let me know when the game starts…,5
2024-05-11 07:54:17 PM IST,"Something's cooking over on Cricbuzz (and I posted the first comment here, and so am feeling compelled to post the follow-ups as well)

> Rishabh: I find it absurd to be honest. Just because of impact sub rule players like Yashasvi Jaiswal & Abhishek Sharma never have to roll over their arm. We need top order batters who can bowl decent part time spin.That art was slowly disappearing post Raina-Yuvraj, but thanks to impact sub it's extinct now.

> Jagadish Naik: The impact substitution rule may benefit certain players while not necessarily benefiting others, particularly all-rounders. While it offers opportunities to more players, it can also demotivate all-rounders, who are often the true match-winners.",12
2024-05-11 07:54:35 PM IST,covers are coming off,3
2024-05-11 07:55:29 PM IST,Who do we want to support SRH bros? Would MI winning help us in securing top 2. (Yes I am delusional),1
2024-05-11 07:55:43 PM IST,"A little joke about Sri Lanka's disastrous run of form in away test tours in 2016 to England, 2017 to India and 2018 to New Zealand, in each of which we would have been whitewashed if it weren't for the rain intervening and saving test matches. Perera is a extremely common surname amongst Sri Lankan cricketers and Sri Lankan cricketers also tend to have 3, 4, 5, sometimes 6 initials preceding their surname. So RAIN Perera became our star batsman on these away tours with his dour defensiveness preventing opposition bowlers from taking 20 wickets and earning us draws 😄


See also SMOG de Silva (whose epic triple hundred in Delhi in 2017 prevented India from winning the 3 test series 2-0). Disclaimer- not my comment but the original user deleted their username.",6
2024-05-11 07:55:44 PM IST,Wasn't bumrah's wife our anchor?,10
2024-05-11 07:55:57 PM IST,Update- umpires inspecting the pitch,5
2024-05-11 07:56:00 PM IST,"Why can't toss be done indoors with proper broadcasting?

They'll do the toss now, then the match will start 30 mins later.",11
2024-05-11 07:56:10 PM IST,"Delayed by rain? Smh, should've held it in notoriously sunny England where it's currently glorious blue skies",12
2024-05-11 07:56:37 PM IST,[deleted],12
2024-05-11 07:57:38 PM IST,"If KKR could poach SKY and Bumrah, I'll switch my allegiance from MI",6
2024-05-11 07:58:59 PM IST,Rayudu looks constipated,3
2024-05-11 07:59:17 PM IST,Tbh the only team that can benefit from Rohit captaincy is PBKS.,3
2024-05-11 07:59:28 PM IST,[deleted],-2
2024-05-11 07:59:30 PM IST,Well paid Ambani,2
2024-05-11 07:59:39 PM IST,"Why can't bowlers be on the hero cam? 

Bumrah/Narine have contributed way more than Rohit/Iyer",19
2024-05-11 07:59:47 PM IST,[deleted],-5
2024-05-11 07:59:51 PM IST,What's with the terrible CGI. They don't even look like their feet is grounded. One of the richest league in the world and can't get basic shit done,10
2024-05-11 08:00:11 PM IST,wallahi I hope rcb wins tomorrow and csk loses. may 19 should be a washout. if rcb goes out we're taking csk with us,10
2024-05-11 08:00:25 PM IST,No overs lost yet but i lost her😓,21
2024-05-11 08:01:10 PM IST,"Not posting any more comments from (apparently lay users, I've been helpfully informed) Cricbuzz on the impact sub debate. Please follow the match on cricbuzz.com for further updates. Thank you.",-2
2024-05-11 08:01:25 PM IST,I'd rather watch the rain livestreamed from the ground than whatever they are presenting,35
2024-05-11 08:01:39 PM IST,Only rain can save KKR from MI's seasonal bashing,19
2024-05-11 08:01:42 PM IST,"""I got 5 100s but we lost the world cup""
Damn Brohit",26
2024-05-11 08:02:12 PM IST,"If the batsman Sunil Narine faced the bowler Sunil Narine, who'd win?

(Assuming both are playing for KKR under GG's helm)",21
2024-05-11 08:03:59 PM IST,Why can't the fricking toss be done indoors? Do they need the coin to interact with the wind to call it fair?,13
2024-05-11 08:04:26 PM IST,Will KKR qualify officially with 1 more point if this match gets abandoned?,2
2024-05-11 08:04:27 PM IST,"Ambani to buy RCB, CSK, and KKR next year - one for each of his kids. And PBKS for his li'l brother just out of spite.",21
2024-05-11 08:04:39 PM IST,Why kishu looking depressed af,2
2024-05-11 08:05:02 PM IST,This boom interview with his wife is too cute both seems such happy humble and nice people.,6
2024-05-11 08:05:07 PM IST,i hope rohit score more that 4(5) so atleast i get some confidence for wt20,3
2024-05-11 08:05:34 PM IST,"MI can't even say they're playing for pride, they lost it when the season started",54
2024-05-11 08:05:34 PM IST,[deleted],-2
2024-05-11 08:05:57 PM IST,"KKR has won all 3 previous MIvsKKR games, yet some KKR fans act like MI bashes some shit outta them everytime. I'm telling you, it isn't the same MI which it was 4 years back.",10
2024-05-11 08:06:11 PM IST,The Hindi commentary can give you hemorrhoids,3
2024-05-11 08:06:18 PM IST,Apparently Copilot says that Ambati Rayudu is the highest run scorer for CSK in IPL 2024,10
2024-05-11 08:07:41 PM IST,Any update on rain?,1
2024-05-11 08:08:20 PM IST,Why aren't they doing the toss who are they waiting for,7
2024-05-11 08:08:59 PM IST,[deleted],7
2024-05-11 08:09:18 PM IST,It's been 30mins since the rain has stopped. What are we waiting for?,5
2024-05-11 08:10:01 PM IST,Sujan Mukherjee can go f himself probably,3
2024-05-11 08:10:23 PM IST,I'm here for Ananya,8
2024-05-11 08:10:25 PM IST,Everyone is smoking pot in dressing room before the match I guess,8
2024-05-11 08:10:40 PM IST,Mumbai is wayy more humid than kolkata. Coming from someone who's spent a good chunk of his life at both,4
2024-05-11 08:11:12 PM IST,Pant was suspended over overate? Is this repeat offence or something? Like it's usually just fined with match fee right?,5
2024-05-11 08:11:31 PM IST,More rain will surely fall,1
2024-05-11 08:11:34 PM IST,10.68 Rpo teams fans afraid of 9.58 Rpo team 📉,8
2024-05-11 08:12:01 PM IST,When was the last time a MI game got washed out?,1
2024-05-11 08:12:02 PM IST,"If somebody’s at the ground, could you kindly tell me what are umpires still waiting for before toss? Are their still wet patches on the ground?",2
2024-05-11 08:12:50 PM IST,"MI pulling out a football, what does it mean?",3
2024-05-11 08:12:55 PM IST,"If Mumbai fields first, can they just forfeit their reviews to save time? We all know Pandya is going to use them for wides anyway.",3
2024-05-11 08:13:24 PM IST,Plz explain this rain perera joke😭😭,-5
2024-05-11 08:13:29 PM IST,"Fans, would you believe who's that person we kkr fans hate the most? Not any player who thrashed us, not uthappa, he is our chief curator, mf's face is soo punchable",9
2024-05-11 08:13:45 PM IST,Pant has himself to blame for overrate he walks up to the bowler like every single ball and then starts thinking himself while talking to the bowlers.i watched this so many times especially in the death,51
2024-05-11 08:15:16 PM IST,In no shape or form can I see Narine being a calypso king…chutney king or more apt.,6
2024-05-11 08:15:19 PM IST,[deleted],1
2024-05-11 08:15:51 PM IST,Give all the awards for this match to the groundmens/women,9
2024-05-11 08:16:05 PM IST,"8:45 inspection time, so no chance of match actually starting before 9:30",3
2024-05-11 08:16:54 PM IST,"I'll never get these rain rules man

What's the point of holding inspection an hour after rain ended given all covers are already off",15
2024-05-11 08:17:12 PM IST,Rohit has scored just 69 from his last 6 innings. Bro is gonna get out for a duck today just for the memes,11
2024-05-11 08:17:16 PM IST,Why not have toss before inspection how does inspection affect toss man,10
2024-05-11 08:18:17 PM IST,INSPECTION TIME™ ![img](emote|t5_2qhe0|8781),5
2024-05-11 08:18:38 PM IST,Toss for the win fuck it. Whoever wins the toss wins the game,9
2024-05-11 08:18:47 PM IST,Is it raining again?,8
2024-05-11 08:19:33 PM IST,Why the hell do they need so long? Are they sucking the water from the ground?,19
2024-05-11 08:19:38 PM IST,"Wtf the rain has stooped right, just get on with the toss",29
2024-05-11 08:20:47 PM IST,"Second last game of Rohit for MI probably

It would be nice for MI to finally drop this absolute burden of a guy (batting-wise)",14
2024-05-11 08:20:51 PM IST,"Apparently the inspection is at 08:45

So we'll be having a shorter game",15
2024-05-11 08:21:02 PM IST,BCCI and Indian grounds are so primitive in terms of setup and technology for maintenance. They were using household mops for clearing out the frikkin Eden Gardens! Embarrassing.,18
2024-05-11 08:21:11 PM IST,Why is the inspection so late?,9
2024-05-11 08:21:27 PM IST,Kolkatians - can we expect that it won't rain again?,6
2024-05-11 08:21:30 PM IST,"I remember ipl2023 final, we've been together in same thread for three days",28
2024-05-11 08:22:32 PM IST,Mfs waiting for it to rain again,5
2024-05-11 08:22:50 PM IST,Humans systems are so good at habit formation. A single washed out day feels like a week without cricket.,8
2024-05-11 08:23:00 PM IST,Wait what? Why am I seeing thala here?,12
2024-05-11 08:23:33 PM IST,Top moment of this IPL - Thala hitting 3 sixes (hes the first indian to hit 3 sixes on his first 3 balls (that doesn't even make sense)).,11
2024-05-11 08:23:48 PM IST,AWW CUTIEES,6
2024-05-11 08:24:11 PM IST,If outfield is wet why don't they just position all players within 30 yard circle smh,6
2024-05-11 08:24:15 PM IST,bro wtf I wait 7 days and Jay Shah you give me thiss,12
2024-05-11 08:24:58 PM IST,"I can really understand KKR fans frustration. Imagine being in excellent form, having to wait 6 days for a match and then this.",19
2024-05-11 08:25:01 PM IST,Will we be getting a 10 overs game at least?,6
2024-05-11 08:25:10 PM IST,BCCI having all the money to make us feel poor,4
2024-05-11 08:25:15 PM IST,If it's 10-15 overs game KKR wins this easy they have sloggers from 1-8,13
2024-05-11 08:26:13 PM IST,bhai bring this rain for the csk match also,6
2024-05-11 08:26:34 PM IST,"These ""ANALysts"" have been discussing Thala's scoop shot against Mohsin for almost 5min now.",29
2024-05-11 08:26:35 PM IST,TIL this sub has a glossary,10
2024-05-11 08:26:53 PM IST,Ayo Bumrah is a Gamer ? Truly the 🐐,15
2024-05-11 08:26:56 PM IST,Let's just bowl 4 overs of Bumrah and 4 of Narine and declare this a game,63
2024-05-11 08:27:41 PM IST,Jio match centre guy was asked  best IPL moment .His answer : Ms Dhoni .And then I couldn't hear what he said with all the gagging noise he was making .Clowns doing so called analysis,12
2024-05-11 08:27:59 PM IST,There are high chances that the Rain will be back after 10. These idiots are wasting so much time on Toss and all that can be done indoors. Just play the game ffs,9
2024-05-11 08:28:01 PM IST,Why don't they toss indoor i don't understand this stupid rule,4
2024-05-11 08:28:09 PM IST,Just do fucking toss already.,5
2024-05-11 08:28:29 PM IST,Bumrah started his YouTube channel so that he could also shade Narine's action like ash did,4
2024-05-11 08:28:32 PM IST,"Does anyone else remember when they brought in a HELICOPTER to dry the outfield in Ranchi?

Edit: Ranchi too [https://www.espncricinfo.com/story/fifth-odi-called-off-due-to-rain-wet-outfield-682607](https://www.espncricinfo.com/story/fifth-odi-called-off-due-to-rain-wet-outfield-682607)",3
2024-05-11 08:29:06 PM IST,It’s either a washout or we get a shortened match. No way it starts before 9:30p. 8:45pm is inspection,6
2024-05-11 08:29:26 PM IST,"Saba karim is so annoying, it's only today that i got to know his name, he's doesn't have that commentary voice.",3
2024-05-11 08:30:42 PM IST,"Make the 11th player bat and bowl from each team. 1 over each. Winner takes the 2 points. 

It will be exciting and unpredictable.",9
2024-05-11 08:31:14 PM IST,"Unrelated to the match, but how many runs can we expect in 4 overs of Bumrah with Manish Pandey and DK on the crease

Their strike rates against Boom- ~180, ~190 respectively",9
2024-05-11 08:31:30 PM IST,The powerplay went well. Didn't expect GG to open with Manish Pandey and hit 120. Unexpected. I hope we can capitalise on the start with Morgan and Shakib,14
2024-05-11 08:32:21 PM IST,In the end time remaining will only be sufficient for a bowl out like IND vs Pak match lol,3
2024-05-11 08:32:22 PM IST,On my way to see France vs Belgium match,2
2024-05-11 08:32:46 PM IST,"Captains generally look at the pitch before deciding at the toss, which is why toss is not done indoors.",10
2024-05-11 08:32:50 PM IST,We getting a t10 with this one boys🔥,16
2024-05-11 08:32:55 PM IST,It will be a complete game,-2
2024-05-11 08:33:54 PM IST,Didn’t the rain stop like 10 years ago? Why are these people wasting time?,21
2024-05-11 08:35:02 PM IST,I hope it's 10 over match,5
2024-05-11 08:35:07 PM IST,"If Bangladesh had a star sports, they would title Shakib as Lisan Al Gaib",7
2024-05-11 08:35:09 PM IST,"I'll tell you guys about an incident, me and my friends used to play cricket everyday after school in a nearby ground or near my house, one of the fondest memories I have of my childhood is playing cricket in the rain. I remember this one time, we started playing at 4 pm and it was brutally hot outside, and around 5:30 it rained, we continued our play and then the rain stopped and when I went home my mom was so angry 😭yeah, lmao.",17
2024-05-11 08:36:13 PM IST,Salt and Narine in the dressing room when they realise if they lose overs they can’t tuktuk like usual and have to try and hit every ball for 12,17
2024-05-11 08:36:17 PM IST,"Man I was excited for this game, planned my day around it☹️",5
2024-05-11 08:36:41 PM IST,8:45 is not even toss time it's fucking ground inspection time,6
2024-05-11 08:36:53 PM IST,We could have had 2 box cricket games within this time.,11
2024-05-11 08:36:54 PM IST,[deleted],9
2024-05-11 08:37:02 PM IST,This is preview of my life what it's going to happen after ipl is over.,11
2024-05-11 08:37:46 PM IST,They had to show that one run defeat of RCB of all things today in the delay,4
