Timestamp,Comment,Upvotes
2024-05-11 11:27:33 PM IST,Shot,3
2024-05-11 11:27:37 PM IST,MI winning it in 12 overs.,5
2024-05-11 11:27:37 PM IST,Kishan batting at 200+ am I dreaming ,8
2024-05-11 11:27:40 PM IST,So many dots for these two,5
2024-05-11 11:27:42 PM IST,"Narine is now fielding at point where the best of the fielders like Jadeja and Maxwell are placed. 

Thank you God for this life, I've seen it all now.",11
2024-05-11 11:27:44 PM IST,Should have taken that review man,6
2024-05-11 11:27:45 PM IST,"I mean dude has next to no options on offside,, he'll hit onside only.",5
2024-05-11 11:27:46 PM IST,That wide gave us 7 free runs,3
2024-05-11 11:27:47 PM IST,😘,3
2024-05-11 11:27:48 PM IST,Qualifying for the playoffs is lava apparently,3
2024-05-11 11:27:50 PM IST,now if there's a fielder you hit it for a six. why God why,1
2024-05-11 11:27:50 PM IST,That was a fabulous six,1
2024-05-11 11:27:52 PM IST,"Vaibhav's two extras in total cost KKR 12 runs!!! If the score was now 34 instead of 46, things wouldn't feel so bleak.",3
2024-05-11 11:27:52 PM IST,"Maybe Kishan is lil Abhishek in disguise, time for Rohit to become lil like Head",1
2024-05-11 11:27:58 PM IST,so it turns out that Ishan and gill go in and out of form together,6
2024-05-11 11:28:01 PM IST,"Things I wanna see:-


1) Koach- ABD or Koach- Thala partnership for one last time.



2) Dhawan- Brohit opening the innings.



3) Koach- Warner running between the wickets.



4) Bhuvi and Boult opening the bowling on a green surface.",13
2024-05-11 11:28:02 PM IST,Swanny should come back to the insiders next year,6
2024-05-11 11:28:11 PM IST,This is what happens when two bcci haters face each other,4
2024-05-11 11:28:11 PM IST,I love how they blur the screen as the woman arrives in the Gillette ad,4
2024-05-11 11:28:15 PM IST,"Batter is strong legside.

KKR bowler: Tine to bowl straight.",3
2024-05-11 11:28:18 PM IST,Strike is over rated: Rahul Sharma,4
2024-05-11 11:28:23 PM IST,Defending in 16 overs is basically an auto loss,1
2024-05-11 11:28:23 PM IST,MI bowled really well today,1
2024-05-11 11:28:25 PM IST,[deleted],6
2024-05-11 11:28:27 PM IST,Bring on Narine damn it,1
2024-05-11 11:28:30 PM IST,NGL MI always turns up like Prime Aus in WCs vs KKR,7
2024-05-11 11:28:34 PM IST,Shreyas deserves a praise tbh,8
2024-05-11 11:28:41 PM IST,Chucking begins now,-1
2024-05-11 11:28:42 PM IST,When Kishan plays as an opener everyone says he best suited to no. 4 and when he plays as a no. 4 everyone says he's best suited as an opener.,13
2024-05-11 11:28:44 PM IST,Why is kkr hiding starc?,6
2024-05-11 11:28:46 PM IST,Bro why does Rinku look so good in the outfield? Is it the hair?,9
2024-05-11 11:28:50 PM IST,"Everyone knows ishan is strong on the leg side, mf will still bowl to him on the pads",5
2024-05-11 11:28:54 PM IST,Cannot tolerate kingfisher ads,2
2024-05-11 11:28:55 PM IST,"Well timed sweep, ball raced across the turf",2
2024-05-11 11:28:55 PM IST,Random chucking allegations coming in 3..2..1,6
2024-05-11 11:28:57 PM IST,Rinku almost misfielded,5
2024-05-11 11:29:00 PM IST,"MI is 13 runs ahead of the DLS par score ( 33/0 ).  For the next two overs, here are the DLS par scores 

Overs left | 0w | 1w | 2w | 3w
--- | :---: | :---: | :---: | :---: 
11 ov  | 42/0  | 45/1  | 47/2  | 51/3 
10 ov | 51/0 | 53/1 | 56/2 | 59/3 |",10
2024-05-11 11:29:06 PM IST,"They should add a rule along the lines of ""Every overturned decision after a review adds an extra review to the reviewing team"". That could safeguard against one sided bias in umpiring.",7
2024-05-11 11:29:16 PM IST," 
I want some fan to go and pinch Rohit’s milkers like dude yesterday bowing to Thala",6
2024-05-11 11:29:17 PM IST,What are the cheerleaders salaries like??,6
2024-05-11 11:29:20 PM IST,"Rohit man,what happened,u were more destructive in odi wc23",18
2024-05-11 11:29:22 PM IST,"Sunil in

Rohit out?",9
2024-05-11 11:29:23 PM IST,"Ishan Kishan 🤝 M Rizwan  


  leg side bullies ",16
2024-05-11 11:29:24 PM IST,"So Narine was not satisfied with being the best bowler and best batsman of his team. 

Now he's decided to become the best fielder of his team and has placed himself at point.",32
2024-05-11 11:29:34 PM IST,"Narine comes to bowl

Everyone: ""hmm. Chucker""",3
2024-05-11 11:29:36 PM IST,"Not the chucker...

Also Brohit finally got the start, just stay off strike.",2
2024-05-11 11:29:39 PM IST,Isn't it worse if you only win when nothing is at stake,1
2024-05-11 11:29:42 PM IST,"Which team is going to be lucky to have Ishan when he finally figures his game out like Pooran finally has now.

That's the question. Until then he'll always give the impression of being a liability at 15ish crores.",1
2024-05-11 11:29:52 PM IST,"either make hiding ball illegal or everyone else should start doing that, why narine have all the fun",1
2024-05-11 11:29:52 PM IST,Ishu Kishu full flow is so much fun to watch ♥️,1
2024-05-11 11:29:52 PM IST,Who's this Arab Horse that Sidhu is keep mentioning?,1
2024-05-11 11:29:55 PM IST,You know rohit is screwed when he can't hit in eden either,3
2024-05-11 11:29:58 PM IST,Imao brohit not even facing narine,2
2024-05-11 11:29:59 PM IST,"Brohit, this t20 wc is your chance for the redemption and this ipl is to practice for that wc. TF is this ODI gameplay 😭, hit the ball like you did in the 23wc",3
2024-05-11 11:30:00 PM IST,Nah this format is finished both batsman looking like shit still RR is 10+,1
2024-05-11 11:30:01 PM IST,What was Starc doing in that position?,2
2024-05-11 11:30:03 PM IST,Ramandeep is everywhere..,3
2024-05-11 11:30:05 PM IST,Ishan really lack skill to pierce fielders,3
2024-05-11 11:30:06 PM IST,Russell needs to bowl after this one. The other seamers can’t seem to control the ball,6
2024-05-11 11:30:10 PM IST,Raman is a gem,2
2024-05-11 11:30:14 PM IST,Being top of the table with this bowling is a testament of Shreyas Iyer captaincy.,6
2024-05-11 11:30:21 PM IST,"What has happened this monsoon season, why do I feel so restless?...never happened before, my heartbeats have quickened.When the cuckoo sings in the gardens, oh my dear.",1
2024-05-11 11:30:21 PM IST,What my man brohit is doing these 15(14) 🤡🤡,2
2024-05-11 11:30:24 PM IST,At this point even Kishan's bat doesn't know where the ball is going to end up after it makes contact,8
2024-05-11 11:30:26 PM IST,Ishan can’t bat for shit on the off. Goddamn!,4
2024-05-11 11:30:27 PM IST,"Rohit is an Impact Sub? Damn, that ought to feel disrespectful. But fair I guess, he hasn't been performing well at all.",13
2024-05-11 11:30:30 PM IST,Is there something Narine can't do ??,6
2024-05-11 11:30:37 PM IST,Woah,5
2024-05-11 11:30:39 PM IST,Yeah Narine has come one over late,3
2024-05-11 11:30:48 PM IST,switch hit,1
2024-05-11 11:30:51 PM IST,"That's how you play chucker , unfair advantage vs unfair advantage",4
2024-05-11 11:30:53 PM IST,Can’t hit on the offside? Make offside as your leg side. That’s one way,16
2024-05-11 11:31:00 PM IST,He switches and makes his off his leg. Lmao this guy really cannot for shit on the offside lol,0
2024-05-11 11:31:01 PM IST,"Even when he hits offside , he needs to switch hit",17
2024-05-11 11:31:01 PM IST,What a shot,6
2024-05-11 11:31:01 PM IST,Kishan seeing Rohit not able to hit.. Decided to become a Right hander himself to show Rohit how to hit..,26
2024-05-11 11:31:03 PM IST,ishaniviliers,5
2024-05-11 11:31:05 PM IST,Glenn kishan,6
2024-05-11 11:31:05 PM IST,RGS school of switch hits,3
2024-05-11 11:31:07 PM IST,Kishan got tired of Rohit and said fuck it now I am a righty,1
2024-05-11 11:31:07 PM IST,Yeah ishan smash this chucker,1
2024-05-11 11:31:09 PM IST,I am sorry Bengali Bros. We need to wait to wait for RR tomorrow. 🥲,10
2024-05-11 11:31:11 PM IST,"if batsman can play switch hits, bowler can also chuck alright?",6
2024-05-11 11:31:11 PM IST,Bruh shottt,2
2024-05-11 11:31:12 PM IST,Kohli improving his sr day by day and Rohit's sr taking a massive dive man,5
2024-05-11 11:31:13 PM IST,I swear DANNY M ALWAYS COMES UP WITH THE MOST GARBAGE ABBREVIATIONS,5
2024-05-11 11:31:17 PM IST,That's a pull. Aakash is stupid enough to call it a sweep,3
2024-05-11 11:31:17 PM IST,Sunil who?,0
2024-05-11 11:31:18 PM IST,Ishan is Kishaning,3
2024-05-11 11:31:18 PM IST,Kishan playing that annual blinder which gets him the retention,17
2024-05-11 11:31:19 PM IST,Fuck it....ishan is the best player in the world. He is that goat. THE GOAT!,3
2024-05-11 11:31:19 PM IST,Seems like SRH can finish at 1/2,3
2024-05-11 11:31:19 PM IST,Still it was right handed batsman's leg side,4
2024-05-11 11:31:21 PM IST,Not Narine's day ig,2
2024-05-11 11:31:25 PM IST,I have seen more of Suhana Khan's face than Ishan Kishan in this match wutttt,10
2024-05-11 11:31:25 PM IST,KKR successfully spamming IsnKisn back into form,6
2024-05-11 11:31:29 PM IST,That is the danger of bringing in Narine in PP .You wasted his one over.,2
2024-05-11 11:31:30 PM IST,Shotaa bouy,2
2024-05-11 11:31:30 PM IST,Please don't mess up the NRR advantage.,3
2024-05-11 11:31:31 PM IST,"thanks Narine, now I've lost my ₹49",2
2024-05-11 11:31:32 PM IST,Now watch Narine chuck from his next over..,4
2024-05-11 11:31:33 PM IST,this game is dunzo,5
2024-05-11 11:31:35 PM IST,Seeing marine getting smashed is as satisfying as him hitting sixes. Just so pleasing for some reason ,8
2024-05-11 11:31:35 PM IST,"Narine is now KKR's - 

- best batsman
- best bowler
- best fielder",5
2024-05-11 11:31:36 PM IST,"If they dont get a wicket or 2 soon, its game over for KKR",3
2024-05-11 11:31:38 PM IST,"What hope do the rest of us have if Rinku is having a bad patch...

Mandatory F BCCI",6
2024-05-11 11:31:38 PM IST,Bang this chucker thank you,14
2024-05-11 11:31:39 PM IST,Brohit playing like Koach however even Koach playing great in last few innings,5
2024-05-11 11:31:40 PM IST,Narine getting tonked is always satisfying,9
2024-05-11 11:31:42 PM IST,I think the match is out of hands now (kkr),4
2024-05-11 11:31:48 PM IST,Pick it up Rohit damn,2
2024-05-11 11:31:49 PM IST,Lower teams basically screwing the top 4 then there’s RCB scheming and BSing its way to top 4 😂 🤣 😂,9
2024-05-11 11:31:49 PM IST,Looks like chucking is gonna be back on the menu after that over,9
2024-05-11 11:31:50 PM IST,Arora lost the game right there. Gonna be a wild night for the kid.,5
2024-05-11 11:31:50 PM IST,"THATS WHY HE'S THE GOAT

 THE GOOOOAT",6
2024-05-11 11:31:50 PM IST,Kishan securing bag for next year,2
2024-05-11 11:31:52 PM IST,Ishan playing brilliantly just before mega auction 🤌,5
2024-05-11 11:31:55 PM IST,Happy Cummins noises,1
2024-05-11 11:31:58 PM IST,Give another over to Starc,1
2024-05-11 11:31:59 PM IST,we are cooked,2
2024-05-11 11:32:00 PM IST,"I still remember IND vs NZ in dharmashala where matt henery beat Rohit fair and square,and Rohit came down to pitch and hit him straight six.
Why doesn't he doesn't that in t20i",3
2024-05-11 11:32:01 PM IST,[deleted],2
2024-05-11 11:32:06 PM IST,Ishan petiersen,1
2024-05-11 11:32:06 PM IST,"Ishan Kishan whole season : I Sleep 

Ishan Kishan when retention is on the line : Real Shit",6
2024-05-11 11:32:07 PM IST,"We're gonna bring back Brohit and Pandu to form , just watch",4
2024-05-11 11:32:12 PM IST,"Satisfying to see chucker getting belted .

Spirit of circket dies 1000 deaths when Narine does good in bowling .",2
2024-05-11 11:32:14 PM IST,Mystery or mistri,2
2024-05-11 11:32:17 PM IST,The usual “teams at bottom that have no chance of making it into the playoffs fucking everybody else’s chance” script,8
2024-05-11 11:32:21 PM IST,I’m ok with Rohit not throwing his wicket away atleast even if he is struggling,0
2024-05-11 11:32:21 PM IST,Rohit going to be out for 17(19),5
2024-05-11 11:32:22 PM IST,Even in switch hits he hits at cow corner  /s,3
2024-05-11 11:32:22 PM IST,"If you get Narine out early in batting, he will also get too pressurized for bowling.

Really just try to get him out early with a proper plan and the game is yours.",2
2024-05-11 11:32:22 PM IST,Watching the pie chucker getting cunted is so satisfying,2
2024-05-11 11:32:22 PM IST,Is there something Narine can't do except smiling unnecessarily?,3
2024-05-11 11:32:25 PM IST,"Reddit has been a pain in the ass today ffs. Gets stuck, double comments, can't comment many a times.",2
2024-05-11 11:32:26 PM IST,Kl stepped down as LSG captain?,2
2024-05-11 11:32:30 PM IST,Hmmm yeah let's win the GT one lol. This game's gone. RR is.. well... RR,5
2024-05-11 11:32:33 PM IST,"Sunil: I can only bowl well as long as I can hide my elbows, this half sleeve doesn't work for me please",4
2024-05-11 11:32:34 PM IST,Varun to take a wicket this over of Rohit mostly,3
2024-05-11 11:32:34 PM IST,"MI is 17 runs ahead of the DLS par score ( 42/0 ).  For the next two overs, here are the DLS par scores 

Overs left | 0w | 1w | 2w | 3w
--- | :---: | :---: | :---: | :---: 
10 ov | 51/0 | 53/1 | 56/2 | 59/3
9 ov | 61/0 | 62/1 | 64/2 | 67/3",7
2024-05-11 11:32:35 PM IST,Rohit's SR 😍,2
2024-05-11 11:32:41 PM IST,Brohit playing one day cricket.,7
2024-05-11 11:32:42 PM IST,Rohit turning in to an Anchor. In time for worldcup /s,12
2024-05-11 11:32:47 PM IST,"'Ghoda Banuga' wtf is this advertisement. 

T: I will become a horse.",5
2024-05-11 11:32:57 PM IST,"Is this the Fuck you innings from Kishan to r/cricket lol..
 Yesterday it was gill now kishan..lol",6
2024-05-11 11:32:57 PM IST,Brohit is literally preparing for WC as we speak,7
2024-05-11 11:32:58 PM IST,rohit 50(49),6
2024-05-11 11:32:59 PM IST,Smash this chucker,1
2024-05-11 11:33:04 PM IST, Varun eyeball Chakravarthy,1
2024-05-11 11:33:05 PM IST,"Man these guys are just shithousing their way to runs, I can't believe they got to 60 runs already.",5
2024-05-11 11:33:14 PM IST,Just gotta make these two stay another 5 overs and KKR will win,2
2024-05-11 11:33:24 PM IST,"Someone said ""Lots of swing. Kishan 0(1) incoming"". Lol.",5
2024-05-11 11:33:25 PM IST,"redditors: Kishan can’t play the off side shit player

Kishan: I’ll make my off side the leg side",9
2024-05-11 11:33:26 PM IST,I hope Rohit is sandbagging rn and turns up with the usual Mojo in the WC.,7
2024-05-11 11:33:26 PM IST,The only fact I am calm today is because we are more or less in the playoffs. Otherwise I would have been hurling mouthfuls by now 🥰🥰,5
2024-05-11 11:33:29 PM IST,Rohit playing that terrorist innings,10
2024-05-11 11:33:32 PM IST,[deleted],3
2024-05-11 11:33:32 PM IST,Today is Narine's off day,5
2024-05-11 11:33:33 PM IST,16(15) after a getting gifted 10 runs is pretty insane for an Indian Captain...but rather this sub will focus on a 42 year old man,16
2024-05-11 11:33:41 PM IST,"Brohit being 16(15) in a 16 over game and he opens for India in wc , better for us I guess",13
2024-05-11 11:33:45 PM IST,"Rohit is highly Overrated in t20 cricket 
Change my mind",14
2024-05-11 11:33:48 PM IST,Ishan Kishan belongs to the rahane/KL league of players who start doing well right before people start talking about dropping them,15
2024-05-11 11:33:49 PM IST,hItMan is our opener boys,7
2024-05-11 11:33:54 PM IST,"Ishan before the last mega auction circle:-

1) 50(25) vs RR

2) 84(32) vs SRH",8
2024-05-11 11:34:03 PM IST,Rohit recreating the 2022 semi final master class just in time for the world cup,10
2024-05-11 11:34:06 PM IST,"Rohit on 49

Adding his last 6 inng score",13
2024-05-11 11:34:06 PM IST,[deleted],2
2024-05-11 11:34:11 PM IST,hit six ffs rohit,3
2024-05-11 11:34:16 PM IST,Mithali Raj's commentary > Cancer,8
2024-05-11 11:34:18 PM IST,Even the Tata Neu box are tired AF sitting in their AC boxes with free food,3
2024-05-11 11:34:21 PM IST,2013 Rohit is back,-1
2024-05-11 11:34:25 PM IST,"Rohit must be criticised by big names heavily for his own good. 

Look what happened with koach.",23
2024-05-11 11:34:25 PM IST,Why doesn’t Chakaravarthy play more for India? He seems to be a fantastic economic bowler in T20’s. ,2
2024-05-11 11:34:29 PM IST,Rohit forgot to hold a bat wow,8
2024-05-11 11:34:41 PM IST,"Absolute stinker from rohit
It's a shame that he prolly is the weak link in our wc squad",5
2024-05-11 11:34:42 PM IST,so guys.. if MI wins this match.. will RCB have a better chance of making it to the playoffs?,2
2024-05-11 11:34:44 PM IST,Cmon Brohit we got 10 wickets left for 10 fuckin overs,6
2024-05-11 11:34:45 PM IST,Not so selfless today huh,10
2024-05-11 11:34:51 PM IST,Height maybe,5
2024-05-11 11:34:52 PM IST,Good ball by mystery-boi,6
2024-05-11 11:34:56 PM IST,Just slog man. It's painful now.,4
2024-05-11 11:34:59 PM IST,I’m watching this shit on mute,1
2024-05-11 11:34:59 PM IST,I swear all these mystery spinners just secretly chuck…,1
2024-05-11 11:35:00 PM IST,"Just [spotted this on ](https://www.reddit.com/r/CricketShitpost/s/r5WNfgnKfZ) cricketshitpost

Still some clowns will justify Harshit's ban lol",2
2024-05-11 11:35:02 PM IST,recreating the iconic 27(28),6
2024-05-11 11:35:02 PM IST,Here we go...,3
2024-05-11 11:35:02 PM IST,We ain’t winning no wc bruh what is this,5
2024-05-11 11:35:02 PM IST,“they’re cruising it” rohit on 16(17),7
2024-05-11 11:35:02 PM IST,Rohit in his prime form,7
2024-05-11 11:35:05 PM IST,Rohit preparing for the next WTC,3
2024-05-11 11:35:06 PM IST,Peak shithousry going on in insiders lmao,5
2024-05-11 11:35:06 PM IST,"Players can't hit Narine - chucker

Player hits Narine - chucker. 

Absolute dumbfucks here .",1
2024-05-11 11:35:07 PM IST,Ump's call.,2
2024-05-11 11:35:08 PM IST,Mandatory wasted review from Iyer?,3
2024-05-11 11:35:08 PM IST,Umpire in Mumbai lobby?,2
2024-05-11 11:35:09 PM IST,Rohit 16 for 16 balls 💀,5
2024-05-11 11:35:09 PM IST,"There was an edge, I think

P.S.: I clearly need to see an ENT asap",5
2024-05-11 11:35:12 PM IST,Why is blud bowling short balls??,3
2024-05-11 11:35:12 PM IST,Peak shithousry going on in insiders lmao,7
2024-05-11 11:35:12 PM IST,"Rohit Sharma is so shit in t20s, wtf is he gonna do at the WC",10
2024-05-11 11:35:13 PM IST,Shouldn’t have taken the review,8
2024-05-11 11:35:18 PM IST,"Why review this? If he's out, it will get SKY!",3
2024-05-11 11:35:20 PM IST,KKR will put up a Shreyas Appreciation Post for taking this review now.,6
2024-05-11 11:35:22 PM IST,"IPL mid match and post match interviews are too predictable

When batsman plays at a low SR: Pitch is too slow!

Reality: Your SR's the only thing thats slow

When bowler gets git in a run chase:  There was dew

Reality: The bowler has been expensive throughout the season and would have shat the bed even if he would have bowled first.",3
2024-05-11 11:35:23 PM IST,"So 16(17) it will be , Rohit reliving 2022",7
2024-05-11 11:35:23 PM IST,"How will these pace lovers gonna do in slow WI pitches, Rohit, Kohli, Jadeja.",2
2024-05-11 11:35:25 PM IST,The fall of Rohit in T20 is a case study in itself..,10
2024-05-11 11:35:26 PM IST,Stop showing these celebrity kids nobody fucking cares,9
2024-05-11 11:35:27 PM IST,That's clean out.,5
2024-05-11 11:35:28 PM IST,Thank u iyer,5
2024-05-11 11:35:28 PM IST,Lol why would KKR want Rohit to go,11
2024-05-11 11:35:30 PM IST,"Mi looks good, i hope they win this year",15
2024-05-11 11:35:38 PM IST,Let Rohit stay bruh. Tuk tuk is good for us,10
2024-05-11 11:35:39 PM IST,martin scorsese should learn from Jay Shah on how to write a script,1
2024-05-11 11:35:40 PM IST,There's a clear gap.,1
2024-05-11 11:35:42 PM IST,Playing at a SR of 100 when you have players like Sky who are in terrific form ready to bat after you is honestly criminal,9
2024-05-11 11:35:43 PM IST,should retire from t20 cricket,1
2024-05-11 11:35:43 PM IST,wonder what sunny ji will say now,4
2024-05-11 11:35:46 PM IST,High,1
2024-05-11 11:35:48 PM IST,The scenes if he goes out for such a score again...,4
2024-05-11 11:35:49 PM IST,plumb,0
2024-05-11 11:35:51 PM IST,"Ravindra Ghodeja 0-51 (6 overs) vs Pak and NZ in 2021 WT20 - Oh Dear, Oh Gorgeous

Varun C 0-56 (8 overs) vs Pak and NZ in 2021 WT20 - You fucking donkey",8
2024-05-11 11:35:51 PM IST,I said it again and again Kohli and Jaisawal is India's best opening partnership.,12
2024-05-11 11:35:52 PM IST,Is the umpire Nitin Menon? That’s clean out,-2
2024-05-11 11:35:55 PM IST,"What exactly did even years ever do to Rohit? This can't be the same guy that we saw in Oct. , Nov. Last year.",7
2024-05-11 11:35:58 PM IST,Money talks and umpires listen.,1
2024-05-11 11:36:00 PM IST,Bro that's PLUMB innit,1
2024-05-11 11:36:00 PM IST,Tbh for KKR having Sharma bat was the better option lol,5
2024-05-11 11:36:10 PM IST,Knew that was not out,5
2024-05-11 11:36:13 PM IST,Suhana 🤝 me : about to cry,4
2024-05-11 11:36:14 PM IST,  Advantage KKR,5
2024-05-11 11:36:16 PM IST,rohit this is a t20 in case u forgot,3
2024-05-11 11:36:18 PM IST,Oh wow,3
2024-05-11 11:36:20 PM IST,Advantage KKR,3
2024-05-11 11:36:20 PM IST,Advantage KKR.,4
2024-05-11 11:36:23 PM IST,Advantage KKR,3
2024-05-11 11:36:23 PM IST,Advantage KKR,4
2024-05-11 11:36:24 PM IST,"Rohit needs to up his strike rate, Ishan Kishan alone cannot do it.",5
2024-05-11 11:36:27 PM IST,Varun C has improved a lot since that disastrous 2021 WC.,6
2024-05-11 11:36:30 PM IST,how's that missing the stumps lol,4
2024-05-11 11:36:30 PM IST,"Man, the amount of hate Kohli receives is unreal, and the amount of free pass Rohit gets is unbelievable. Dude gets no criticism whatsoever. Kohli plays one slow innings and all hell break lose, while Rohit keeps playing garbage without being criticized.",25
2024-05-11 11:36:31 PM IST,"Michael Gough is bald, that's news to me",3
2024-05-11 11:36:34 PM IST,Tf kinda bounce is that??,6
2024-05-11 11:36:35 PM IST,Conspiracy theory : Rohit is instructed to play shit by management so that fans will start to hate h and love pandu,-1
2024-05-11 11:36:36 PM IST,"Why he even open , just come after 2-3 wicket if u want to anchor the innings",7
2024-05-11 11:36:36 PM IST,Not out advantage Kkr,2
2024-05-11 11:36:36 PM IST,Charkravarthy made a fool out of Iyer lol. This captain is a joke.,6
2024-05-11 11:36:37 PM IST,Kkr should be happy with not out,5
2024-05-11 11:36:41 PM IST,Kishan and Varun were both in 2021 squad and both out of 2024 squad.. yet they’re looking more deserving currently than the captain,6
2024-05-11 11:36:42 PM IST,That was close,1
2024-05-11 11:36:42 PM IST,"Rohit pls don't waste this chance.
Pls hit some",4
2024-05-11 11:36:43 PM IST,Advantage KKR,2
2024-05-11 11:36:45 PM IST,Rohit 17(18)*,1
2024-05-11 11:36:46 PM IST,tf is that bounce,1
2024-05-11 11:36:46 PM IST,"Rohit this is a powerplay 

You can hit in the air , there are only 2 fielders",2
2024-05-11 11:36:46 PM IST,Tactical blunder by Iyer taking that review.. Escaped by luck.,13
2024-05-11 11:36:49 PM IST,Disadvantage mi,9
2024-05-11 11:36:50 PM IST,Umpire: signature look of superiority,5
2024-05-11 11:36:50 PM IST,pLuMb,1
2024-05-11 11:36:51 PM IST,That wide review was a big mistake,4
2024-05-11 11:36:52 PM IST,Nitin menon you beauty,5
2024-05-11 11:36:53 PM IST,"Slog Rohit. If you get out slogging, it's better. What's this defence defence",11
2024-05-11 11:36:54 PM IST,Advantage kkr,7
2024-05-11 11:36:55 PM IST,All KKR fans heaved a sigh of relief 😮‍💨 ,5
2024-05-11 11:36:58 PM IST,Saeed Ajmal having ptsd,2
2024-05-11 11:36:58 PM IST,Let him bat another session,3
2024-05-11 11:37:01 PM IST,One more Narine over coming up?,2
2024-05-11 11:37:04 PM IST,Narine-Chakravarthy spell should be called as Chuckervarthy tbh. /s,11
2024-05-11 11:37:05 PM IST,Only if Sara Tendulkar was here then it would've been more interesting match of who gets the most screen time between Suhana and Sara.,12
2024-05-11 11:37:07 PM IST,Drs worked in favor of KKR,7
2024-05-11 11:37:07 PM IST,tuk tuk sharma,7
2024-05-11 11:37:10 PM IST,17(18) reminds of 27(28),9
2024-05-11 11:37:11 PM IST,"Please just like how i dont want KL in the t20 team, same for rohit, sorry fellow MI fans, but i dont want him anywhere near in the t20 team",11
2024-05-11 11:37:13 PM IST,At least bowl a pacer so that he can touch the ball lol,6
2024-05-11 11:37:15 PM IST,"Kuldeep in last two matches has scored more runs in fewer balls faced than brohit in his last 5 matches


40(28) Vs 35(33) 💀💀",15
2024-05-11 11:37:18 PM IST,Ok there is no way that could have missed the stumps. We should see ball tracking from the side too. This is suspicious as hell,-1
2024-05-11 11:37:18 PM IST,Come guys don't criticise brohit.. he is saving his runs in ipl to score in the world cup..,2
2024-05-11 11:37:20 PM IST,"Ball bhi poch raha hai muh bhi what use

T- wiping face n ball with the same towel",1
2024-05-11 11:37:21 PM IST,Fuck strategic timeouts,5
2024-05-11 11:37:21 PM IST,Irfan pathan should shift his criticism to Rohit then blabbering constantly about Hardik Pandya,11
2024-05-11 11:37:21 PM IST,I shit on umpires all the time but that was amazing decision 👏🏻,10
2024-05-11 11:37:23 PM IST,Starc masterclass when?,3
2024-05-11 11:37:23 PM IST,What selfless powerplay batting from Mumbai ka Raja,9
2024-05-11 11:37:26 PM IST,Brohit you made a 200 on this ground please 💀,4
2024-05-11 11:37:27 PM IST,Bro~~hit~~fuss,2
2024-05-11 11:37:27 PM IST,There are 6 batters to come and only 10 overs remaining. What is Rohit doing,2
2024-05-11 11:37:28 PM IST,This why r/cricket members do not have an umpire gig,7
2024-05-11 11:37:31 PM IST,"A guy here predicted 17(19) for Rohit Sharma.

He is on 17(18)* currently, with timeout taken.",13
2024-05-11 11:37:32 PM IST,"Superb over by mystery... They need another quiet over or two, KKR",3
2024-05-11 11:37:32 PM IST,Rohit showing glimpses of his masterclass vs PAK on June 9,6
2024-05-11 11:37:34 PM IST,Harshit looks like an Indian Reece Topley (or RT looks like a bri'ish Harshit I guess). It's the hair.,2
2024-05-11 11:37:37 PM IST,"I think more than the big 3 gatekeeping, the downfall of cricket will be the ads.",2
2024-05-11 11:37:37 PM IST,Oh selfless captain my captain...,4
