Comment,Upvotes
"Even if we don't make the playoffs, it's at least gratifying to see our boys in yellow still cause a bit of problems for the RCB gang.",4
"Slow wicket + massive straight boundaries + Faf patrolling them is just one helluva combo. 

Faf covers ground so quickly and his anticipation is world class.",14
"Kinda have a feeling that CSK may win this one. With this pitch, hitting boundaries is super difficult which CSK hasn't anyway been good at. But rotating the strike and hitting a 150 at the end of 20 overs is totally doable if they maintain the SR by taking those quick ones and twos.",4
This pitch is real slow. Yesterday everyone struggled and today also. 150 should be a competitive score,9
50 off 44 is not ideal honestly. Once you've played 30 balls you must bat the remaining balls at around 180-200 SR.,-1
What's the point of batting depth till 8 when u dont trust them.,-4
If you apply skinnyvirat cheatcode on virat kohli you get gurkeeratman,2
"Faf du Plessis, love you professional, but hate you personally!",-3
Lmao did that ball spin after the pitch!,2
Faf on the boundary is like a frog catching flies. Does not miss.,8
"The ball is not at all coming on to the bat. Pitches are deteriorating as the tournament progresses.


I get that there should be a contest between the ball and the bat, but we are just going to see some 130-140 scores.",8
"When chahar and Curran look like good death bowlers, yk the pitch is really shit.",4
"Don't hit in areas reachable by Faf, rookie mistake /s",11
Curran won't finish his quota of overs. Sigh...  #JustDhoniThings,6
All twos and no hits make Koach a dull boy,5
"Everyone saying the pitch is slow and 150 enough, trollers ready with alternating caps text when CSK starts firing.",1
Ali is rubbish,-1
"All of CSK Fans : Let's have Meme Siraj and Not Lord Siraj today, please please please !!!!",4
They have not really bowled all that well in the final overs.  But haven't paid the price for it.,5
Sad to see Steyn play just 1 match,1
Is the final being played on this pitch? Please tell me no,4
These are the UAE pitches we hate and despise.,6
Since batsmen get hot during the  game esp here why not create helmets lined with those liquids in cooling packs on the inside? Ipl teams have the money right?,3
"If Morris is struggling , pitch is slow",6
wow Chahar with wickets now!,1
Pitch looks difficult to bat on.,4
Scurran and Faf should just form their own team cause they deserve so much better,3
I hate slower balls now,6
Csk fucked us,4
"This pitch should suit Csk and their game plan to a T .

An interesting chase beckons",8
Does Du Plessis have the most number of catches at the boundary?,2
BEAUTIFUL YORKER,3
Stick with singles and doubles please,2
Death bowling Chahar > Powerplay Chahar,2
My sexual orientation is crunchy wicket noises.,5
"If RCB lose today, I want RCB in the eliminator. They have a bad record against meme teams. KKR has definitely became a meme team this IPL. But first we need to qualify.",1
"If AB can't hit a six in an innings of 36 balls, you bet this pitch is slow!",31
Dude has passed couple of catches to others. Still has highest catches.,28
CSK gonna bottle this,5
Why is CSK save for a few misfields suddenly performing this match out of all matches?,13
Chahar is one handsome bastard,3
"CSK gonna cruise past this,aren't they?",7
Udana would be good for this pitch,3
"Imagine being yorked by Chahar

Good ball though",5
Morris shocked not to see Shami bowling.,2
"Wait, I thought we were going to shit ourselves in the last 4 overs... What is this magic?",3
At least Chahar isn't broken yet. Nice to see him smile and bowling with a plan,3
"This isn't even fun to watch. Maybe an entertaining day 2 pitch, but not a T20 pitch.",3
WHAT A DELIVERY,2
Dhenier went easy on RCB's ass. Should've unleashed the full power of my main man Monu.,10
"**19.3** Chahar to Morris, OUT, yorker. The pitch doesn't matter here. This is just the quick yorker after that big slower one last ball. Disturbs the furniture **139-6**

CH Morris  b Chahar 2 (5b 0x4 0x6) SR: 40.00",4
"lowest score defended by RCB ?

Against CSK?",1
[deleted],0
CSK can win this game,4
Chad chahar smile,1
Ramp shot from Washington incoming,2
I just want to see VKs face when Dhoni fucks Morris,-4
Wtf has happened to Chris Morris' batting,-4
"Unless some youngsters turns up , the usual suspects in csk would again defend their way to make a meal of this chase ...Last over finish or shitshow on cards ?",2
"Until Kohli was out you guys wanted boundaries, now you ppl want singles and twos. We'd give anything to have someone like Kohli in our squad",10
Looks like we can't get 150,6
"RCB the real BatDeep

They have an opener at 8",14
A score of 140-145 looks good on this slow pitch minding yesterday's night game,8
"Yes CSK be spoilsports, This is the Way.",11
Why tf did the camera man cut away.,2
"Fuck, slow outfield too man",8
They are doing a good job of tiring faf,8
Sundar took one ball to outscore both Moeen and Morris,8
"Ball won't even reach the keeper, can't wait to see how this clown team are going to bat 2nd innings",8
Too early for wE hAvE a bAt tHaNks?,3
Not a bad shot for your first ball,2
Nah. Should have sent gurkeerat man instead of virat if they only wanted to rotate strike. If anyone can hit at death its abd.,-3
"Just remember last match here when kxip struggled their way to 125 and srh shit the bed chasing it

Maybe we should watch csk's batting before judging",10
So many batsmen. Sundar at 8 is amgood batting depth tbf,8
Sundar is like fuck this pitch fuck them all,23
It’s a shame that the game is already beyond CSK. Pretty sure they’re incapable of chasing anything more than 6 an over.,13
"Oh I have missed Chahar's death bowling.

Remember him bowling a ripper in last year's final against Pandya and Pollard just conceding 5 runs!",8
So these uncles don't turn up the entire season and now they wanna win games.,9
"Wtf, is there multiple Faf's outisde the 30 yard circle?",15
Liking these low score matches.,2
Another match in which team left far too much for the death overs depite having wickets in hand.,-3
This tournament will be boring. I understand 200 pitches are boring. But at least 160 should be on to make people want to watch IPL,2
Rcb in self-sabotage mode,0
"Yas make Fafdu run, drain his energy so he gives his wicket easily.",1
"What lodu batting this is. I mean, 145 is still defensible I guess but fuck.",-2
The W in CSK stands for Winning,9
"Slow pitch, slow outfield. Old CSK. Yeah this is gonna be tough",8
Match so boring faf decided to take  a nap,15
"Very slow outfield, Kohli's way of taking 2s is the only way to win",15
Both pooran and abd batted 30+ balls in the pitch without hitting a six.,50
"If Koach couldn't get going, nobody else can.",20
"145+ is RCBs game, chill out lads",7
Chahar wicket farming,2
Terrible batting or really good bowling. Could not get ball out of boundary line.,6
"ABDV, Moeen, Kohli & Morris all tried to score a boundary and got out, only Sundar succeeded. Sundar > all the above batsmen, hence proved.",30
"We live in a timeline where Simon Doull brought up Brian Lara before Mark Nicholas

Wtf",9
argh fuck,3
Wishing a Moeen show  with the ball,8
Gurkeert specialist fielder,2
See you on wednesday.,6
That's a good score imo.,7
Above par score.,8
CSK bowling looked good after 11 fucking matches,8
Probably 10-15 runs short. Just hope siraj doesn't fuck up and we should be fine given the pitch and CSKs batting,13
I'd still say it's an above par score considering the pitch and CSK batting,3
Now that was death bowling,-1
These are the Chepaukesque conditions conducive to CSK's style of play,1
"The fact that ab struggled really shows how difficult it is

Morris and Moeen couldn't even connect",14
"Barring MI , looks like anybody can lose to anybody on their day ?? Isn't it ??",8
 CSK should win this if they bat sensibly. Poor batting from RCB.,-6
"If we get faf and jaddu out, that's the game imo, cause those are good rotaters of the strike",5
Csk 60 all out. Siraj 5fer.,9
Thank God we restricted RCB for 145. Now we will only lose by 25 runs.,26
"If Faf is able to stick out the powerplay, they have a good chance of chasing this down.",5
Watch our NRR tank after this,5
"First 10 overs - 72 runs 

Last 10 overs - 73 runs.

Perfectly balanced.",15
Weird first innings score where both teams are disappointed at the end,9
Powerplay crucial on this pitch. Lack of timing is less of a penalty with less fielders outside circle.,2
I have been happy with our bowling effort this season. If only batting and fielding were as good.,5
"Siraj will frick csk.......

i dont hope so but still my 7th sense is telling that...",4
It's a really good score tbh. 70-30 RCB already.,6
Time to choke the CSK,1
Any other team chasing and I'd say it's their game to lose,1
"Entire RCB team with low strike rate

Chad Sundar with 250 strike rate",10
Ez pz for CSK. They're gonna finish in 18,4
I hope top two fights goes on to the last match of DC with RCB.,3
This pitch isn’t  that different from the Chepauk pitches. CSK should chase this down if they play sensibly rather than their usual tuk-tuk+take it deep.,6
daddy sundar with a sr greater than that of vk and ab combined,9
Csk has a good chance today.,4
I just want to see Gaikwad execute a shot today. I hope it’s not too much to ask of him. Fingers crossed,6
"No one:

Cred guy in the heaviest possible voice: Let's just do a simplednfjdkdidnjfkdndjf bxhdhdmcka",11
"Chennai performing well on chennai type pitch 
   
Change of venues really fucked up their plans",10
"ABD couldn't go ballistic, means no one can go ballistic",15
RCB should open with Sundar and play Udana instead of Finch.,7
"Fleming : So why didn't you bowl him out ?

Dhoni : The world isn't ready for his powers yet!",11
I think this is only a par score. Yesterday KXIP only won because SRH were pathetic.,15
Washington “Brian Lara” Sundar,12
We might lose this but atleast we bowled with great over rate.,6
"Decent score, could have been a lot higher but CSK's death bowling saved them a little bit",6
Dhoni's hair on his head is now fully grey.,8
CSK's death bowling saved 5-10 runs for sure,12
For how long will we keep playing Finch? Fail after fail,7
"Sorry for being harsh, Monu is awful. Wish him luck in the future.",4
"If boundaries are hard to come, CSK will need to run lots of ones and twos. Can they do that?",7
Mere Bhai Siraj Ka swag Dekho,19
"I am expecting a CSK win here, just to get koach's ass on fire for his run a ball innings.",2
Just drop finch already. Abd will be able to bat much more freely if he doesn't have to keep,7
So Finch 15(11) wasn't that bad,24
Some body convince faf that we are playing aus.,9
CSK will bat like there's nothing wrong with the pitch and chase the target in 17.2 overs. Dhoni masterclass 32*(28) today.,9
Finally slower pitch and udana not in the squad,6
Fuck of you to all saying terrible batting performance from us. A batting with Rahul Gayle pooran maxwell could only hit 126.,37
"Washi, Chahal, and Moeen are gonna have a field day on this pitch",6
Final CSK score: 131-5 in 20 overs. ThalaGod 34*(36).,8
Feel like Indian commentators are much more Conservative in thier approach when it comes to critizing players or just asking tough questions.. In English commentary Mark Taylor asked Sangakara whether a player like Kholi with all his fame and popularity in india can subconsciously affect an umpires decision and sanga just straight out agreed.. Even during the CSK post match presentation a lot of hard questions were asked to Dhoni regarding his team selection and comments.. KP talking about intent of Rayudu was also great stuff.. Just feel like there's needs to be a better brand of commentary from Indian commentators,20
Monu Kumar actually bowled decently. Would be sad to just look at 10 rpo in his debut game to diss him.,10
RCB should have scored 160 after the first 10 overs they had. They are short and if CSK can bat well for once they will chase easily.,6
"Faf was being a good lad in that first catch. Like how older bros make a catch easy and hand it to the young kid. Gaikwad would have loved that confidence.

PS, I still drop those kind of Parrys!",5
I’m so confused about this score and first innings. Is it good is it bad lmao,7
Two continuous matchs on the same pitch is sure fire for it to be a low scoring game.,3
"Faf is already tired, he will lose his wicket soon",1
"Worried about our fast bowlers on this wicket. 

Morris and Saini like to hit a hard length and Siraj is an excellent red ball bowler who can look for early seam movement.

This is more an Udana kinda wicket. Bowl cutters every ball. 

12 overs of spin should choke CSK but death bowling could be tricky if if you're not adept at bowling cutters and exploiting the pitch. 

If CSK need something like 60 off from 8 overs with wickets in hand, they'll win this.",16
"Genuine Q. For a short person like Monu, are shots normally considered as regular balls for other batsmen considered as full toss/bouncer for him  giving him extra ball?",4
"You literally saw a team defend 124 and abd, kohli,pooran struggling in this pitch and acting like this is par score.",15
Fleming to Santner- Jor Jor se bolke sabko scheme bata de,10
Whoever wins the powerplay will probably win this game.,16
RCB didn't even put enough runs on board so that Gaikwad and Jagadeesan can hit a century each. Smh at you Koach.,20
Santner's face cut is so fucking good. Handsome lad.,12
"Wtf, why are all the kiwi players so well spoken? Cant see anything wrong with NZ players honestly",31
Rcb game to lose,-2
I think someone like Dhoni who relies more on strength than pace of the ball can hit the ball very well on this pitch. Even guys like Gayle and Pollard will do good too.,6
Just want to see Gaikwad and Jagadeeshan score some runs.,6
Thala issued a challenge to RCB batsmen to try to win his jersey today.,8
Csk will target moeen.,1
Tahir would've had much lower economy if everyone didn't misfield whenever he bowled,6
145 is a perfect score for Dhoni's batting nautanki.,12
[deleted],3
Santner said R/L at the front. So who’s it gonna be if its not Curran? Jadeja???,3
Go hard in the PP before we resort to the tried n tested tuk tuk in mid overs.,4
Inb4 Siraj Hat-trick,5
"Would've been carefree if it was 160, but 145's not bad. Could get close",13
How did AB struggle on this pitch? I've never seen him struggle even on slow pitches,14
Santner such a cutie.,6
You think CSK will try out Asif next match? What other youngster do you think they can give a game?,7
"Place your bets, who's getting Dhoni's jersey today? My bet is on either DDP or Siraj",31
Finchy with second highest SR... stupid sexy finch,25
"They need to get about 60 in the first 6, when the ball is new and hard. But they don't really have batsmen do it.",0
"Looks a par score on this wicket with rcb bowling and csk batting , shd sent Curran or santher to open . This pitch will make ipl boring though",2
"Random question since there is a break,how safe it is to hangout (pubs,etc) in the current situation?",2
AB didn't struggle. He wanted to keep wickets till the end but got out on a bad shot.,9
Are Jagdeesan and the other guy playing again?,5
"CSK gonna win this one, isn't it?",8
"My man virat, how much stamina do you have",4
"Dhoni and Fleming would love to see Rutu and Jaggi fire today. Either way, alot of people will find ways to rub it in on thier faces despite whatever happens",10
There was almost 0 swing in the beginning. Looks like Siraj will be 3-0-31-0 today.,6
I remember Asif doing well in the one or two games he had played for CSK. He should get a game next,2
CSK will have to score atleast 60 runs in the PP before the pitch slows down even further to have any semblance of chance in this match.,1
If RCB wins the match Virat Kohli’s innings is a “carefully constructed innings that made all the difference”. If CSK wins it becomes “a rather slow and uncalled for drudgery”.,23
If CSK somehow pull this off it's gonna make SRH look really bad,11
"Just tuned in 

How did this Monu guy bowled?",4
Can rcb trade pp to rr?,0
Send Monu to open. Every ball will be an over head wide or waist high full toss. Free runs.,10
Will csk open with Sam and faf? Go for an attacking start?,4
"Damn, I missed watching the nearly mythical creature that is Monu Kumar bowl.",2
"Youngsters, pls show some spark today. Proving Thala wrong would be a bonus",5
Ah time for Dhoni ass licking im Byju's cricket live.,6
"I am optimistic we can defend this.

It is really rare that both Kohli and AB hold back for so long after getting set, if the aim was for 180 one of them would have attacked from the 13th over or so like they usually do when we bat 1st. They must have thought 160 or so is a winning score and planned for that, only for both to get out with exploding.

And both Moeen and Morris could not time even 1 ball properly when new to the crease, so this does seem like a tricky pitch. And against CSK's batting, even if we are few runs below par we should be able to defend.",18
I don’t know why people are saying RCB are 10-15 runs short. If AB de villiers of all players is striking at 100 after 35 balls then it’s a sign that it’s a tough wicket to bat. Won’t be easy to chase this down,13
Pls don't have over expectations from Siraj.,6
[deleted],6
This is CSK's match to lose and lose they will.,7
Pitches getting far slower. *Sandeep Lamichhane on bench* Everyone to Punter- Execute Order 66,9
Is this going to be enough?,4
Anyone have an accurate height of Monu? Google says 5’10 but c’mon...,4
"Ah, Dhoni vs Chahal battle except it isn’t going to be much of battle.",7
Fhow many runs will gaikwad make today?,1
Thala will be the difference between defeat and win today,-2
Unpopular opinion but I'd like to see Faf as captain once Dhoni retires.,7
Genuine Q. How do all the stump cams work? They don't look like they have wires or anything right? And how are they not broken ever?,5
"RCB still doesn't have a Pollard, Andre Russell type player in the middle order. Dube was supposed to be that, but he is just been underwhelming. Puts pressure on Kohli + ABd to anchor innings for an over or two more.",13
"If de Villiers couldn’t got above 108 SR, what will others do?",6
I'm scared of this Siraj guy,6
"Please CSK, win this one for us. Thanks, love MI.",5
Is faf pronounced as fap?,-4
Rashford for PM with SCurran as his Dommy C equivalent,9
I just learned that 2021 mega auction might be postponed. Rip CSK.,10
CSK need an excellent powerplay if they are to win this. They need 80 in the first 10 overs.,5
Look at that MI NRR man. Wtaf,5
How does a pitch get slower towards the end of the innings? Please explain thanks,5
Who's Kolhi looking at?,3
"I don't think 145 is par, even tho it's csk and the pitch is slow. One good innings and it's game over for rcb",6
[removed],5
highest run ever scored in powerplay coming Bois/Uncles/granduncles,10
"If (when) a wicket falls in the powerplay, I'd be tempted to send Lord Thakur to throw his bat around and get 20(10) before scoring gets harder.

Edit: Nvm, I didn't pay any attention to team selection today.",7
Sam curran deserves a better team.,4
Please open with sundar,3
Kohli asking Anushka “Baby Thana Thaya?”,2
Ffs cricbuzz still talking about possiblity of csk qualifying to playoff,10
What happens if rcb looses including today?,0
"""This could be the season where CSK miss out playoffs""

- Yes, there's a slight chance of that. Lol",7
Faf will play a tired shot,5
"Santner : We gotta take it deep 


**WE KNOW**",2
"If kxip retained Sam, they would have been unstoppable.",6
This is exactly the type of game csk will win lmao,6
I'm i the only one or do the fielders take screamers frequently against Kohli,6
Faf is gonna be the key for CSK today. He is very good on slower pitches like this one.,9
Csk's match to win.,6
Get it Monu! Best wishes from fellow statemate.,7
Got late and missed all the Monu memes 😪,5
Green caps looks nice tho,1
Lol looking at the comments and both teams are scared shtless of Siraj,15
T20 should be high scoring games and tests should be low scoring games. That's best way to enjoy cricket,-5
That absymmal stats of Ruthuraj,-1
Scenes when Sundar wins altroz super striker award,6
This guy has had a tough start to his ipl career. Fuckk,6
"Hope Ruturaj does well today

Still think Faf should take strike as the senior batsman",2
"Dhoni should have a shot as an opener, that might solve a few problems",3
Rcb vs csk? Na it's luigi vs wario,5
siraj to leak 15 runs or take a wicket maiden first over,9
Sundar to open?,4
I'd say this score is around par. The only reason we defended 120 odd was SRH's choke tbh,7
Faf looks like Joaquin Phoenix,10
Hopefully CSK go out there and bat like a team with nothing to lose... Mainly because they are a team with nothing left to lose.,3
4 matches 5 runs - Ruttu. Bruh.,10
"Did AB just scream ""Aiyoo""?",10
"5 runs from 4 matches. Bro, WTF is you doing here?",10
"Siraj be like : I'm not trapped in here with you, you're trapped in here with ME",9
If these bottom four start winning now it would be pretty hilarious.,12
"Gaikwad dada khel aaj

Great success",2
Why are so many players wearing some sort of a sleeve on one arm?,1
Which Ranji is Gaikwad from,8
Test match on bois,8
This is the southern derby,3
I still think batsmen are giving Sunder way more respect.,9
WASHY WASHY WASHY,7
Conspiracy theory : Finch gets out before Padikkal because he doesn't want to run twos the chonky motherfucker,69
"RCB 🤝CSK
Being fearful of Siraj",66
"How good is Washi??

Absolutely no warm up balls.",11
"Kohli plays tuk tuk

Manages to get to 40(35) with running

tries to get a move on

Fielder takes a screamer

Why does this happen always",17
Finally he scores one run,11
GAIKWAD OFF THE MARK,13
Confirmed : Kartik Tyagi is the missing son of dada tyagi,1
"20 runs from power play , 40 runs in the first 10 overs incoming.",13
"By sticking his tongue out, Rutu is asserting his dominance over RCB bowlers already",30
Fun fact - RCB has never done a double on CSK.,20
Gaikwad increased his number of IPL runs by 20% just now,25
CSK 104/6 after 20 overs,15
I just tuned in. How did csk bowl?,4
Washy bowling exactly like what is needed on this pitch. Excellent,15
Off topic- Those kids in OPPO F17 pro ad are so damn cute!,17
OP Gaikwad scoring 20% of his runs in the first over,13
Horrible start. They have start to dig a hole already.,3
"Kohli always stands near Abd, But then, who wouldn't ?",12
Holy duck gaikwad is fast compared to Rayudu and the others,9
Not a bad throw,5
Holy shit wtf was that effort from gurkeerat.,0
Morris needs to take pace off,4
"I support RCB but CSK should go hard and try to finish under 15 overs. They don't need points, they need confidence going out of the tournament. And more importantly, Dhoni's career should not end with this shit show.",8
Gaekwad's heart must be pounding for everyone in the middle to hear.,9
if RCB win I want Kohli to rip his shirt out and scream Jai Shri Ram while burning an effigy of Raavan in true desi style,8
We need to cramp them for singles and make them work very hard for their runs,2
"Ah yes, Gaikwad Smile! This will get better!",9
"Morris: Takes pace off

Ball: 133 kph",17
"Fuck it, bowl 12 overs of spin upfront.

Need 48/2 after 12 overs",9
No. No boundaries allowed for CSK 😠,14
These lot are some how going to make it 14 RRR before halfway through,5
Bangar describing a direct hit as an inaccurate throw. Scenes,14
Lol I took Monu Singh in my fantasy team just cause... Idk why lol for the same reasons CSK took him I guess,18
Wtf was that bowling,3
India have stopped producing great batsmen against spin.  New breed are  from average to poor.,12
Faf ❤️,3
SHOT,2
That was sweet,2
Pls get du Plessis out,5
Finally a bad day for Morris?,10
Morris... need.... more.... PACE.,9
Of course they find their form after they cant qualify.,29
"Oh man what the hell, now the sixes come on easily",12
Imagine having Morris as your international player,5
SHIT ON,8
These flick shots for 6 just look outrageous. Blimey.,8
CSK winning this,4
We're gonna lose this aren't we,8
CSK shitting on the top teams chances from the Bottom  of the table is peak 2020,12
Think they’ll just bowl spin for a few overs now,5
RUT-A-TUT!!,2
Don't give me hope,3
SPARKKK,9
Ok so we're going to lose,12
Lmao gaikwad just scored more than his total runs this season before this match with that shot,22
Fuck fuck fuck fuck fuck fuck,12
So this is what RCB lack upfront - the ability to give quick starts. Wonder if phillipe could help it. Haven't seen him enough.,5
"2 sixes already, CSK need to make the most of the powerplay",6
Csk gonna with 10 wickets,4
"
SPARK",7
"Of course. Of fucking course.


They find their fucking form after it is all over.",18
Damn that was silky smooth from Rutu,10
7 rpo. Rubs eyes,10
Only if RCB get FAF out.. We're in for a thrilling final day final innings test match on our hands,10
"“That’s why they’ve picked him” 

Lolol except they didn’t coz he lacked spark",9
💥✨❇️✨💥,3
ChRis MoRris BeSt aLL RoUnDeR,6
"Thanks, I hate this",5
That six showed a lot of spark,10
Watto was like : There's the spark!!,12
How are the sixes coming on so easily now?,16
[deleted],2
"Not the worst target RCB have set, esp against Dadaji Nanaji Aur Ek Do Pote XI, but I just always assume they'll lose to them.

No different this time. Guess I'm a true RCB fan.",7
😢,6
Gaikwad showing off his spark,5
