Timestamp,Username,Comment,Upvotes
2020-10-27T12:06:27+00:00,Iamyoursoul123,Welp. I am 1st to comment again,22
2020-10-27T12:07:29+00:00,theredguardx,A little early aren't we,72
2020-10-27T12:23:20+00:00,aryanx1234,"Dc plz do a kxip 2018

Thanks",6
2020-10-27T12:39:31+00:00,Lazy_Left_Eye,"So basically the Rift^^^TM conspiracy is doing rounds once again, due to Rohit's non-selection. Apparently Rohit has removed ""Indian Cricketer"" from his bio, so yeah that's flamed a bit of the accusations as well.",7
2020-10-27T12:39:53+00:00,udayEm,Happy Birthday to our Skip!,7
2020-10-27T12:42:51+00:00,pussydestroyer100,"Guys I have a theory about that Ajio ad that plays during the game.

That girl is mentally disturbed and just spends her days looking at a screen and imagining things everytime that Covid news plays on her screen.

Ad number 1: she lives alone and has no friends. So she buys branded stuff on Ajio and wears it and posts her photos on social media and gets happiness or solace by looking at imaginary likes and emojis floating on her imaginary social media account.

Ad number 2: she looks at her screen and it triggers another round of disturbance in her head as she ends up buying a gift for the only person who seems like a friend to her, the liftman. 

Ad number 3: she is looking at the news again when it triggers memories of her mom who has passed a long time ago. So she buys another new dress on Ajio and pretends like her mom is still around and they're dancing together. 

The end.",16
2020-10-27T12:46:21+00:00,Slippin_Jimmy1216,[I just want this](https://www.reddit.com/r/Cricket/comments/jidcgw/match_thread_46th_match_kolkata_knight_riders_v/ga5x23d?utm_medium=android_app&utm_source=share&context=3),2
2020-10-27T12:49:33+00:00,diethylbenzamide,Oh it's matchday,2
2020-10-27T12:50:10+00:00,Assraj,Capitals_to_Daredevils.exe loading....,6
2020-10-27T12:52:01+00:00,diethylbenzamide,We are qualifying today,5
2020-10-27T12:52:39+00:00,Uncomfortablekid,Hope Warner doesn't try to compensate his below par performance in this IPL in the upcoming series against India... Warner with a purpose looks very dangerous... 2019 IPL was brutal enough... We need to make him more softer and should keep encouraging him to make more tik tok videos... Come on SRH fans  show some more love towards Warner so that he forgets all his aggression...,3
2020-10-27T12:54:03+00:00,Iamyoursoul123,Off topic but can you tell me is there any profession in commerce field  which requires negligible writing work?,-2
2020-10-27T12:54:32+00:00,saumya5,Go Delhi!!!!!!,4
2020-10-27T12:56:42+00:00,Iamyoursoul123,Delhi sultanate vs hyderabadi sultanate,10
2020-10-27T12:57:13+00:00,Rubberducky1239,"Get Shaw in, Hetti at 4, Pant at 5. We shouldnt be facing the batting meltdowns then. Rest everything is fine, and we should have a decent chance",3
2020-10-27T12:58:39+00:00,aryanx1234,"Srh has to do a kxip and beat all 3 toppers to even have a chance of qualifying

Best of luck srh, I'm with u atleast with u in the dc and rcb game",5
2020-10-27T12:59:18+00:00,Lazy_Left_Eye,"CSK, SRH and MI are the active teams yet to finish at the bottom of the table/win the wooden spoon .

Edit : Apparently, RR as well. For all their misfortune after their 1st season they've never finished below 7th.",5
2020-10-27T13:01:48+00:00,BoreHoRahaHaiYaar,Someone should probably whisper to Pant & Axar how they failed to make it to the national team just so they can get all riled up and perform today,7
2020-10-27T13:03:21+00:00,aryanx1234,"Either my boi pant will smash srh bowlers with anger

Or fail due to underconfidence",3
2020-10-27T13:03:47+00:00,fieztel,"If SRH can do a KXIP and beat top 3, they have a decent chance of making it to the playoffs with their NRR",2
2020-10-27T13:05:40+00:00,Iamyoursoul123,"Ok DC,you have my blessings. I hope you win. I am sorry, I won't be available to watch your victory ;(",9
2020-10-27T13:07:52+00:00,HillsHaveEyesToo,So who's supporting which team and on what basis?,3
2020-10-27T13:11:50+00:00,aryanx1234,"With either rahane or shaw, dc opening pair is a walking wicket",0
2020-10-27T13:13:40+00:00,,[deleted],10
2020-10-27T13:16:35+00:00,,snails humorous governor deranged hard-to-find encouraging jobless aromatic hospital steep ` this message was mass deleted/edited with redact.dev `,6
2020-10-27T13:18:10+00:00,anirudh1595,"Irrespective of what happens, I just want to see Warner take his rage out with the bat today. The way he looked after the defeat versus Punjab, I have never seen Warner THAT PISSED. Jesus he was genuinely fuming. 

Also the way he batted in the powerplay, coupled with what he said in the interview, gives me hope that the ultra aggressive Warner has always been alive, he has just most of the times ended up curtailing and controlling his instincts too much - for both Australia and SRH (of late). 

I just want a classic 2011/12 ish Warner innings lol I have missed Davey smash the fuck out of the ball so much, ngl. The two sixes he hit in the powerplay versus Punjab made me really happy.",9
2020-10-27T13:18:56+00:00,Rubberducky1239,"Rahane is Shaws Inconsistency with the Intent of Jadhav, if they pick him again we are losing this even before a ball is bowled",4
2020-10-27T13:22:07+00:00,aryanx1234,"Is it only me who is obsessed with my avatar?

One of the best reddit features ngl",2
2020-10-27T13:22:38+00:00,,"I want RCB to top the table and Warner to finally get rid of that post presentation face

lets go SRH!",4
2020-10-27T13:22:56+00:00,thepokemonchef,I have a feeling Pant is going to absolutely maul Holder today.,5
2020-10-27T13:23:20+00:00,Unpopular_opinion000,Supporting DC to avoid wooden spoon,6
2020-10-27T13:23:47+00:00,aryanx1234,69th,2
2020-10-27T13:24:10+00:00,wingzero00,Just want Pant and Warner both at their aggressive best.,5
2020-10-27T13:27:27+00:00,onomybonesareflaccid,Were overdue for a 200+ game. Hope it's a good one on both sides.,1
2020-10-27T13:27:28+00:00,enterprisevalue,The OG DC vs Poser DC,5
2020-10-27T13:30:51+00:00,caesarisape,I both feel bad for SRH that their remaining games are with the top 3 and excited about the fact that they have the potential to fuck up their plans.,2
2020-10-27T13:31:01+00:00,Rubberducky1239,Chasing again. Bold move would be a fucking understatement,1
2020-10-27T13:31:04+00:00,fieztel,DC opt to bowl,1
2020-10-27T13:32:29+00:00,Siondroms,Uhmm.. why are we chasing again...,1
2020-10-27T13:33:06+00:00,Slippin_Jimmy1216,**K A N O S** is here.,4
2020-10-27T13:33:12+00:00,,Good changes,2
2020-10-27T13:33:21+00:00,GlitchPro27,I'm scared. DC aren't good at actually winning games that they're favorites to win.,5
2020-10-27T13:33:48+00:00,thepokemonchef,I was hoping Bairstow would play this game because Delhi lack a leggie.,5
2020-10-27T13:34:06+00:00,,At least this time we can die relying on our speciality : defending totals,1
2020-10-27T13:34:12+00:00,DilliKaLadka,"No offense to SRH but this is our best chance to get 2 pts and secure playoffs. But we are chasing, so we just made it difficult for us.",6
2020-10-27T13:34:18+00:00,Assraj,Yes lets drop our best batsman in our most important game,0
2020-10-27T13:34:24+00:00,uravggstudent,"Bairstow dropped, did not see this coming",3
2020-10-27T13:34:24+00:00,fieztel,Gosh. Get top 3 of SRH and game over.,1
2020-10-27T13:34:38+00:00,aryanx1234,Has dc ever won chasing apart from winning against the wooden spooners?,-6
2020-10-27T13:34:48+00:00,anirudh1595,Might Bairstow have played his last game for SRH?,-1
2020-10-27T13:34:55+00:00,,"Finally they dropped Bairstow!

I was begging here to drop Bairstow",2
2020-10-27T13:34:55+00:00,,"SRH have already lost the real game by dropping YJB

Distinct lack of units™ in the side now",4
2020-10-27T13:35:10+00:00,,"Kane HAD tp comeback now. Against us. Smh. Pack the bags bois, we ain't winning shit today",3
2020-10-27T13:35:23+00:00,alanysmt1978,Love Johnny but defo the right decision... he’s been one of the best one day openers since 2017 but sure as hell not in this form,6
2020-10-27T13:35:23+00:00,anaksr1414,Good changes but would have still opted for Abhishek instead of Nadeem to add firepower in lower order and he is a decent bowler.,6
2020-10-27T13:35:35+00:00,,Yassss the changes I've fucking wished for. Finally SRH has grown a brain,3
2020-10-27T13:36:05+00:00,Siondroms,"It's clench your buttcheeks time, hate it when Delhi has to chase",0
2020-10-27T13:36:29+00:00,carl_elias,"KW picked in playing 11..

r/cricket: ᕕ(  ◕‿◕)ᕗ",41
2020-10-27T13:36:52+00:00,,"Even if Kanos fails these 3 matches( rare) , I'd still retain him over Bairstow",10
2020-10-27T13:37:02+00:00,thepokemonchef,When did Bairstow become so weak to spin? He carted spinners all around the park in the World Cup and he smashed RCB’s spinners when he made a century last year.,10
2020-10-27T13:37:16+00:00,,Srh has always made changes that are good.  It's a shame they can't fucking win anything those losers. Happy bday Warner btw.,7
2020-10-27T13:37:18+00:00,adventurer_here,why is this chick asking silly cricket questions on hotstar?,6
2020-10-27T13:37:56+00:00,,It's time for us get ready for boarding the train.. **KANE TRAIN**,3
2020-10-27T13:38:02+00:00,DilliKaLadka,All eyes on Pant. He need to show the selectors why he is the real X factor,3
2020-10-27T13:38:10+00:00,thepokemonchef,Would it be bad sportsmanship to repeatedly drop Rahane so that Pant doesn’t get to bat?,1
2020-10-27T13:38:26+00:00,,"Been saying ever since we lost 3 consecutive games that Bairstow’s time has come to be dropped. Yet we desperately persisted with him.

Have you guys seen how much he was struggling out there against spin ? Especially in the game against KXIP. It was painful to watch him.",2
2020-10-27T13:38:30+00:00,bond_bhai,Why no Khaleel? I thought he was a wicket taking bowler? No? or is he injured or something?,2
2020-10-27T13:38:53+00:00,alanysmt1978,"With bairstow it isn’t a spin thing, it’s simply a form thing... for England in the summer he looked so much weaker than 2019 against all attacks",4
2020-10-27T13:38:59+00:00,Lazy_Left_Eye,Kane for Bairstow is a bold decision. He shouldn't open imo. Samad should open and Kane at No 3 pls.,6
2020-10-27T13:39:17+00:00,,Saha big match player comeback,3
2020-10-27T13:39:28+00:00,,Let's go no Bairstow!,3
2020-10-27T13:39:56+00:00,aryanx1234,Warner opening with Saha or kanos? What do u guys think?,3
2020-10-27T13:40:03+00:00,Rubberducky1239,"Extremely Hot Take- Open with Pant cos he clearly is doing a role which Rahane is capable of doing, with PP he has all the freedom and could be best case of optimising the batting unit",5
2020-10-27T13:40:05+00:00,gr8astardd,"idk why SRH keep persisting with Samad over Abishek, he really hasn’t had one good innings yet",2
2020-10-27T13:40:18+00:00,zambur-e-bahar,Why the heck do they pick Deshpandey? Won't Harshal Patel or Mohit Sharma be better options?,1
2020-10-27T13:40:20+00:00,thepokemonchef,Just hope Saha makes 20(15) and gets out. He’s beyond useless after the powerplay.,4
2020-10-27T13:40:39+00:00,,[deleted],3
2020-10-27T13:40:58+00:00,legbreak_18,What's wrong with Abhishek Sharma ? Curious why he's not been picked ahead of Samad or Nadeem,2
2020-10-27T13:41:07+00:00,flabbyboggart,"**DC in IPL 2020**

Win while batting first: 6

Lose while batting first: 2

Win while chasing: 1

Lose while chasing: 2

**SRH in IPL 2020**

Win while batting first: 3

Lose while batting first: 2

Win while chasing: 1

Lose while chasing: 5",5
2020-10-27T13:41:18+00:00,anaksr1414,I hope if they are opening with Saha then communication must have been just go and either smash the ball or get out. Even he would like to forget his last innings.,3
2020-10-27T13:41:37+00:00,Plastic-Season,Mohit Sharma>Tushar Deshpande,1
2020-10-27T13:41:37+00:00,,Saha > every other young Indian keeper,4
2020-10-27T13:41:38+00:00,,Pant should be allowed to open so that he can play fearlessly. His mindless slogs will fetch plenty of runs in the PP too because the probability of him getting caught in the outfield is pretty low.,1
2020-10-27T13:42:01+00:00,Plastic-Season,damn Shankar got hitched,2
2020-10-27T13:42:07+00:00,Rubberducky1239,IPL interview hai ya Koffee with Karan,1
2020-10-27T13:42:17+00:00,Lazy_Left_Eye,Remember when Saha scored 100 of 20 balls in some 40m ground and made news? Good times.,10
2020-10-27T13:42:42+00:00,Iamyoursoul123,Saha and opening?lol,2
2020-10-27T13:42:56+00:00,,[deleted],0
2020-10-27T13:42:56+00:00,TheRichestCuck,"Saha HAS to open 

So that there middle order gets solid with Kanos,Pandey,Shankar,Samad,Holder",4
2020-10-27T13:43:40+00:00,harshmangat,Welp! No Bairstow makes it so easy to not care about SRH today!,6
2020-10-27T13:43:40+00:00,,"Thank God Warner didn't win the toss, otherwise he would've chosen to bowl first again.",4
2020-10-27T13:43:41+00:00,kmadnow,If Delhi beats us today they should be ashamed to order biryani from Swiggy next time. That's all I'm saying.,15
2020-10-27T13:43:43+00:00,Arkadeep101,Axar Patel is such a happy happy lad. Answers to all questions whether smart or stupid with a smiling face.,5
2020-10-27T13:43:45+00:00,NachoDipper,Expect a statement game from Pant. 50+ at 180SR,6
2020-10-27T13:45:23+00:00,flabbyboggart,I'm ready for Warner's birthday special innings.,3
2020-10-27T13:45:55+00:00,sxd827,It seems all the experts are puzzled by Bairstow's exclusion but every SRH fan wanted this change. Now let Kane open and Saha can bat at 5 if we lose 3 early wickets inside 8 overs or else he can come at 8.,7
2020-10-27T13:47:15+00:00,tortuga104,I thought DC would always prefer Prithivi Shaw over Ajinkya Rahane!,2
2020-10-27T13:47:59+00:00,,"I strongly believe we could have won last game if it was Kane in there instead of Bairstow. Saha also playing would have helped us as he could tackle the spinners. 

This late move cost of us at least a game.",3
2020-10-27T13:48:21+00:00,,[deleted],-1
2020-10-27T13:48:23+00:00,,[deleted],1
2020-10-27T13:49:19+00:00,aryanx1234,"I'm calling it, kanos will be srh's gayle

Srh will win all games now",1
2020-10-27T13:49:41+00:00,Plastic-Season,"The officer blue ads selling ""music CDs"" are cringe af.",3
2020-10-27T13:49:45+00:00,flabbyboggart,"Some of the noteworthy results for SRH in this season:

Won by 15 runs vs DC

Won by 69 runs vs KXIP

Lost in super over vs KKR

Won by 8 wickets vs RR

Lost by 12 runs while chasing 126 vs KXIP",4
2020-10-27T13:50:52+00:00,gr8astardd,"Slightly off topic, but who do you guys think is the better bowler - Rabada or Archer?

Archer for me personally",0
2020-10-27T13:51:46+00:00,,[deleted],21
2020-10-27T13:51:55+00:00,Naan6,"Batting order should be:

Saha (wk)
Warner (c) 
Pandey
Williamson
Shankar
Holder
Samad
Rashid
Nadeem
Sandeep
Natu

Pls not mess with it",5
2020-10-27T13:52:17+00:00,shyggar,No Swanny in the dugout today. Me sad. T_T,1
2020-10-27T13:52:22+00:00,Slippin_Jimmy1216,"Dear Saha, Hit it or leave.",2
2020-10-27T13:52:26+00:00,Rubberducky1239,"Iyer has to remove his cap, that cap has been acting as his mortal enemy. Remove it and remove all problems /s",0
2020-10-27T13:52:35+00:00,Naan6,Embarrassed to say that I still have hope for srh for some reason,7
2020-10-27T13:53:09+00:00,,I don't think no other team fans worry about changes and batting lineup as much as our fans do,3
2020-10-27T13:53:14+00:00,Truthgamer2,No Swanny tonight bruh wtf,3
2020-10-27T13:53:22+00:00,,[deleted],3
2020-10-27T13:53:34+00:00,Slippin_Jimmy1216,"Beware, There's already a downvoter here.",-1
2020-10-27T13:53:36+00:00,tortuga104,"Considering his performance in last 4 matches, why is Ajinkya Rahane still in the team? and no one is talking about Prithvi Shaw. Am I missing something?",4
2020-10-27T13:54:40+00:00,MrWolfsbane,"saha is a powerplay specialist like Robin, hopefully he gets a quickfire 30",3
2020-10-27T13:54:43+00:00,Naan6,I swear if Saha goes run a ball...that’s not his role,1
2020-10-27T13:55:06+00:00,PikaPant,"Another SRH game, another evening of bench-warming for Fabien Allen 😔",5
2020-10-27T13:55:09+00:00,,[deleted],2
2020-10-27T13:55:11+00:00,Truthgamer2,Birthday innings from Warner?,6
2020-10-27T13:55:22+00:00,chratoc,Was bairstow dropped or injured?,2
2020-10-27T13:55:34+00:00,sxd827,"Considering the next 10 fixtures, I believe there is a good chance one of RCB/DC will fail to make it to the playoffs.",3
2020-10-27T13:55:54+00:00,kpranar,Kane to carry SRH's batting today.,2
2020-10-27T13:56:05+00:00,Niyazali_Haneef,"I think Warner will be in *fine, I'll do it myself* mode today.",8
2020-10-27T13:56:30+00:00,buddhatalks,Swanny absent from the dugout tonight. I feel like bawling like a little kid right now. 😭,12
2020-10-27T13:56:30+00:00,User9333,Fuck SRH for dropping one of the most destructive white ball players right now. Similar to how they got rid of Ben Cutting. Kane Williamson is not destructive enough for t20. Can't chase 190+,-8
2020-10-27T13:56:39+00:00,,"I think Bayliss deserves a second chance and doesn’t need to be judged for this bad season. 

It’s his first time and he has to tackle personalities like VVS, who acts like he is “Donald Trump.”

I don’t blame him personally for hesitating to drop Bairstow.",5
2020-10-27T13:56:41+00:00,,"Hetti at 4, Stoinis at 5 and Pant at 6. Stop messing up orders man",4
2020-10-27T13:57:46+00:00,gr8astardd,"Everyone used to call out KXIP for not being able to close out game, but the fact that SRH are 7th with a positive NRR tells you a lot",50
2020-10-27T13:58:05+00:00,blumirage,Sanjay Bangar in the dugout is the the only one who still has hope for us,5
2020-10-27T13:58:12+00:00,flabbyboggart,"0, 35, 34, 26, 32, 5, 69\*, 57, 101\*, 106\*, 6

Shikhar Dhawan has been like a good old wine this season. Getting better and better every day.",5
2020-10-27T13:58:17+00:00,Bakasur279,Tushar has suffered severe confidence loss after Gayle messed him up though.,2
2020-10-27T13:58:24+00:00,lifeofpaiii,Wait they dropped Bairstow??,2
2020-10-27T13:59:01+00:00,Lionheart008,Bairstow got dropped for an indifferent season(although he had one big innings in there). Wonder what Maxi does to justify his place in the side? That too year after year,3
2020-10-27T13:59:39+00:00,Silly-Point,"YJB putting on a smiley face in the dugout, inside he's going through ways of getting his revenge.",7
2020-10-27T13:59:40+00:00,anaksr1414,KKIP supporters. We supported you guys till you reached 4th position. Now it's your turn.,6
2020-10-27T13:59:45+00:00,PlsDontBraidMyBeard,Can Saha keep up with birthday boy Warner's running between the wickets? We're about to find out!,3
2020-10-27T14:00:11+00:00,2684335126835353,Why the fuck are they playing this relic instead of Shaw,4
2020-10-27T14:00:12+00:00,Lazy_Left_Eye,"4 of the last 5 Orange Caps have been won by Warner/Kane. The one time an SRH batsman didn't win was when Kohli went 973 and even that year Warner was 2nd with 800+ runs. 

Goes to show how much SRH has relied on Warner/Kane duo.",107
2020-10-27T14:00:24+00:00,DilliKaLadka,I think we will let Saha run us over. Just like we did with Narine the other day,3
2020-10-27T14:00:48+00:00,singhsrb,Some competence by the DC management by giving Rahane a proper chance.,-3
2020-10-27T14:01:06+00:00,blisteringbar,"I've said this before and I'll say it again.



Only small pp fellows gild match bot",0
2020-10-27T14:01:39+00:00,Silly-Point,Nortje around the wicket straight away to Warner. The Broad Plan.,2
2020-10-27T14:01:48+00:00,TheAR69,Saha vs Pant for the wicket-keeping position in the Test team. Fight!,3
2020-10-27T14:01:49+00:00,WhoIsYou1,"Holy shit, Kane is back",5
2020-10-27T14:01:52+00:00,,Some incompetence by the DC management by still playing Rahane.,2
2020-10-27T14:02:25+00:00,dannyarr,Saha will make case for test side today,6
2020-10-27T14:02:44+00:00,,Let's go Delhi,2
2020-10-27T14:02:44+00:00,shwnnnik,"Guys chill, there's no way DC are losing today. No, no way ;)",4
2020-10-27T14:02:49+00:00,MISSIONCAP,Who should win? Asking as a MI fan.,1
2020-10-27T14:02:51+00:00,Lionheart008,Was the throw slow or he ran fast. That looked out when they showed the first frame lmao,3
2020-10-27T14:02:54+00:00,ankush024,"if Saha gets run out whose loss is it srh or dc?

&#x200B;

I would say dc's",-4
2020-10-27T14:03:05+00:00,christeebs,Every time Anrich doesn't hit 155 I'm irrationally disappointed,81
2020-10-27T14:03:15+00:00,2684335126835353,"Not sure if this is a unpopular opinion or not but I hope they don't expand the teams. Why the fuck would I tune in to watch the likes of Saha, Rahane, 3D, Robin, or Deshpande",-1
2020-10-27T14:03:26+00:00,Smurfiness,"Dugout is sometimes unironically funny. 


silence Gone *awkward silence*",3
2020-10-27T14:03:49+00:00,Lionheart008,Saba hit a boundary? Fucking diabolical,-4
2020-10-27T14:03:58+00:00,,If SRH wins today then the whole points table will become more interesting.,4
2020-10-27T14:04:02+00:00,TheAR69,Ball staying low even when bowled at 150 clicks.,3
2020-10-27T14:04:18+00:00,dannyarr,"So my hyderabadi bros , ready for another heartbreak?",4
2020-10-27T14:04:23+00:00,sxd827,Poor Pant lost his spot in T20s and ODIs. Now Saha is here to steal his test spot too.,47
2020-10-27T14:04:36+00:00,,Fuck that last ball took off the pitch,3
2020-10-27T14:04:39+00:00,aditya_bheemreddy,Warner 100 incoming.,1
2020-10-27T14:04:42+00:00,gungly,22 ball 100 incoming from Saha,3
2020-10-27T14:05:05+00:00,,"Mark Nicholas: ""Didn't try to hit it too Hard

Memories of Cricket 07 <3",2
2020-10-27T14:05:10+00:00,HillsHaveEyesToo,You guys talk about Saha like he never played a big innings before,12
2020-10-27T14:05:54+00:00,TheAR69,Good fielding by Usha Pandey,2
2020-10-27T14:06:01+00:00,Plastic-Season,tushar will save 1 run now to concede 20 extra later,10
2020-10-27T14:06:13+00:00,bond_bhai,Rabada shares the new ball for the first time this season.,3
2020-10-27T14:06:19+00:00,udayEm,Only if Pollard was the fielder.,5
2020-10-27T14:06:25+00:00,rahulrossi,Saha scored a 55 ball 115 in 2014 IPL final he is not a bad player. On his day he can go big.,147
2020-10-27T14:06:52+00:00,Plastic-Season,saha is warming up before india test tour,9
2020-10-27T14:07:03+00:00,jeeverz,Oh wow. Thought they would give the batter the benefit of the doubt. Great save.,6
2020-10-27T14:07:07+00:00,throwaway_ind_div,Wrintent Saha,5
2020-10-27T14:07:13+00:00,TheWyzim,"If SRH wins this it could be an interesting fight among KKR, Punjab & SRH for the 4th spot",12
2020-10-27T14:07:40+00:00,Iamyoursoul123,Congrats SRH,2
2020-10-27T14:07:41+00:00,udayEm,Yes Saha justify your PP role,6
2020-10-27T14:07:43+00:00,Niyazali_Haneef,I'm sorry but this is intent ^™®©,11
2020-10-27T14:07:47+00:00,aryanx1234,">If DC win today does it mean that they become the first team to qualify?"" -- No. 16 points won't secure a playoff spot for the time being as up to five teams can potentially get to 16 points as of now.

-cricbuzz",6
2020-10-27T14:07:49+00:00,Naan6,Saha haters in shambles,85
2020-10-27T14:07:52+00:00,Lionheart008,Saha on 🔥. _Apology thread loading_,11
2020-10-27T14:07:53+00:00,,If you look it up. Saha actually has one of the highest strike rates in the ipl.,14
2020-10-27T14:08:01+00:00,WhoIsYou1,"Saha, fuck them up",8
2020-10-27T14:08:13+00:00,shubomb1,Lmao DC always seems to be fielding with 6-7 fielders only.,10
2020-10-27T14:08:17+00:00,,Rabada destroyed,5
2020-10-27T14:08:21+00:00,ArtInvasion,lmao out of all batsmen if saha fks delhi up today it would be hilarious,19
2020-10-27T14:08:31+00:00,aryanx1234,"Friendship ended with bairstow

Saha is my best friend",30
2020-10-27T14:08:36+00:00,MISSIONCAP,SRH it is then :),5
2020-10-27T14:08:41+00:00,,Saha hitting rabada for boundaries is my favorite thing now,6
2020-10-27T14:08:49+00:00,Lionheart008,Saha 🤝 Uthappa,1
2020-10-27T14:08:54+00:00,jeeverz,"I gotta say, Warner and Saha are quick between the wickets.",1
2020-10-27T14:09:02+00:00,,Can’t wait for pant to go apeshit after now getting omitted from the loi team.,5
2020-10-27T14:09:06+00:00,rahulrossi,I'd love it if Saha does a Parthiv/Narine and goes after every ball and gets out for a quick 30-40.,3
2020-10-27T14:09:09+00:00,anirudh1595,"Playing Rahane is not the failure of DC's management 

They failed by having Rahane and Lalit Yadav as the ONLY TWO backup Indian batsmen in the entire squad. How can a management be so daft?",0
2020-10-27T14:09:14+00:00,Naan6,"Unpopular opinion: saha should be the keeper in the test team, not pant",5
2020-10-27T14:09:19+00:00,throwaway_ind_div,"Rihanna in DC is good for SRH, they should help him to 30 ball 30 and not take his wicket",8
2020-10-27T14:09:32+00:00,,[deleted],25
2020-10-27T14:09:48+00:00,Niyazali_Haneef,I want to see Kohli and Warner in the same team for that sweet running between the wickets.,72
2020-10-27T14:09:48+00:00,uravggstudent,"If they're taking Rabada on, can't imagine what they'd do to Deshpande",18
2020-10-27T14:09:55+00:00,neelhere,Riddhi da hitting two of the best pacers and scoring twice as fast as Warner. Love this approach!,10
2020-10-27T14:09:55+00:00,dannyarr,Bro how did we beat dc the last time with such an okay team,8
2020-10-27T14:10:03+00:00,,Hope Warner doesn't put pressure on Saha with Thala-esque innings,8
2020-10-27T14:10:07+00:00,zambur-e-bahar,"GET SPINNERS IN, SAVE NORTJE AND RABADA FOR LATER",8
2020-10-27T14:10:25+00:00,aryanx1234,Saha is the kid u call to your bday party and then everyone talks to him instead of u,56
2020-10-27T14:10:33+00:00,crazyb14,Saha showing he should have been picked in odi and t20 squad too,9
2020-10-27T14:10:33+00:00,JustStrolling_,Saha is playing how every team who makes a replacement expect the player to play. It doesn't always work out like this though.,9
