Comment,Upvotes
Watch Morgan get called overrated after these cunts send him in against Bumrah with the RR 15.50.,4
7 off Polly's over is all I need to know about the intent.,4
Did anyone get a dm to downvote?,1
They are not even trying smh,1
Is it really shit bowling if it gets wickets?,-2
Commentators are sleeping on Eion Morgon,5
Looks like polard will be bowling 4 with the spinners chipping in a couple each. Who would've thought,-4
Why are they going easy on Pollard,-2
I’m starting to zone out... someone bring out Morgs. I need to hear him yelling NOOO,2
At least in yesterday's match we got to witness Dhoni's fuckery and troll innings.,3
There are so many players. There has to be someone with reddit account browsing r/cricket. Right?,7
Should have bowled Pollard last game,3
"Decent over by Pollard, Rohit probably looking to slip in a few overs before Russ shows up",0
"Pollard might probably bowl his full quota today, he has been really effective.",3
Russel and Morgan in this situation would be ideal tbh,-1
Whatever happened to Lendl Simmons? He played soo well for Mumbai. If he was an Aussie he would’ve gotten a million dollar deal. His record in the ipl is amazing. Remember soo many of his knocks,-1
"Deano comparing Dre Russ to ferrari, hope he is not like this year's SF1000 shitbox",3
"125 in 10

Still not that hard if dreruss n morg have normal days in the office",0
Zzzzzzzzzz,-6
Morgan has to bat at 4,-4
Bottled,-4
After watching these 2 nitwits bat Russell will be over anxious when he gets in and he'll go out on a duck.,-5
Morgan Russell still to come and these guys are clowning around with rr over 12,-5
Hopefully we can get their RRR to over 15 by the 15th,-4
Yeah Boi Rahul!,-8
Upvote if you have big pp,-4
yikes,-7
There are 3 overs of Bumrah left & they just nudged Pollard smh,-6
At least Russel can come in now,-2
Our van dijk is the best van dijk,-3
Respect to Karthik for not doing a Dhenier .,4
I'm happy for the wicket but I'm terrified at the prospect of Russell coming in,-4
Good Gtfo Karthik.,-8
Thats as plumb as it gets,-5
I N T E N T ™,1
KKR need 125 off 60 now. Seems difficult,-2
"Gone swinging, DK. Fair.",-3
The downvoters have very big penises and are loved by friends and families,10
This is worse than how CSK played yesterday,-4
They are playing too defensive for their own good,-2
"**10.1** Chahar to Karthik, OUT,  **71-3**

KD Karthik lbw b Chahar 30 (23b 5x4 0x6) SR: 130.43",2
Beautiful Google,-2
chahar finally coming to the partaaaay.,2
Good thing honestly,-1
Gonzo. YESSSS great comeback by Chahar.,-1
"That is so out

Don't even think it's possible to be more out",-1
"Send Morgan one half would be mad, send Russell the other half would be mad",5
Plumbest of plumbs,3
Morgan or Russ?,-3
Tactical by KKR cap. Russell will smash now.,1
Send in Dre Russ now. If you want a shot at the game.,2
Russell needs to show up now. He's the only hope for KKR,4
Even Pollard doesn't give a shit about his bowling,3
[deleted],4
"Based on performances so far in the IPL, who do you guys think deserves more opportunities in the international team?",4
the downvotes in this thread,11
Karthik wicket is bound to be a blessing in disguise for KKR considering Andre Russel and Eoin Morgan still to come,2
Too early for Russ?,-1
Good luck Morgs!,6
30 of 23 balls. That is what you expect from DK. Nothing more than that.,-2
>>Eden Morgan,-2
I heard Kiran Morgan,0
Ian Morgan,0
captain morgan owned by morgs?,-1
Is pollard pregnant?,-3
KKR Fan : Hello darkness my old friend.,1
"u/livid_ad_2892 is the downvoter I believe, new account and he's flexing in all his comments that he's the one downvoting, report him y'all.",11
"how many fucking serial downvoters are here, or just one lowlife with multiple alts",9
Eoin NOT Ian!!!,5
Quick gun Morgan or Morgone?,4
Did the stadium announcer call him Ian Morgan or was that just my shit hearing?,6
Dre Russ vs spin? Dont think thats a good idea,0
"Everyone is downvoted , serial downvoters on loose",10
Who the fk is downvoting every comment.,12
I understand dre russ in a beast but morgan is no joke.,3
Pollard had 8 wickets in 6 matches with economy of 7.55 this year in cpl.,9
Kohli would’ve reviewed that,13
Fuck I though it was out,5
Morgan is struggling,2
Fucking useless this team,2
Typical KKR Leave too much for Russ,7
Ahh nrr 12 too low for DreRuss to come /s,11
They should have brought Nikhil Naik in instead 😂😂😂,3
Morgan is struggling,5
What a bowling man !!!,1
Wouldn't mind seeing Morgan and Dre Russ having a go together.,1
Whole of r/cricket will shag downvoter's mum,16
[deleted],6
Good guy Morgan boosting the confidence of young Indian bowlers,15
Why does he look so clueless,4
Clive Rose,6
Morgan gonna do a sam Curran,-2
Morgan has not been very successful in IPL. Mainly because of his limitations against spin in the middle overs.,9
Just putting it out there for people perplexed by Dhoni not playing up the order. CSK had an extended quarantine time frame compared to others.,8
"Smart bowling, DK went after him early in his previous overs, went for the quicker ball early this time.",1
This is the same guy who cunted Rashid all over the park,6
Morgan should come in at 4 and Russ at 5,5
lmao there was a guy earlier who said russell was gonna bat at 6 and he was downvoted,11
Morgan can take Rashid to cleaners but can't pick Chahar. story of his IPL career so far.,8
Why are kkr pilulling a csk?,2
"Yo , the hindi commentary is fucking cancer .",10
Looks like we have an army of sad downvoting clowns.,12
"I like chahars run up, It looks kinda mean.",6
Eowyn Morgan,2
This thread is ruined. Perfectly fine comments getting neg 10.,19
One downvote = No of times your gf/wife cheats on you,7
Chahar on point with those Googlies,5
"Now the Run Rate is 13.78, they should've sent out Russell tbh",7
Morgan - That's illegal. You can't turn the ball.,12
Deepika Padukone in Jio ad kekw,5
Stop complaining about the downvotes. Keep Calm and upvote. They usually give up soon.,14
None of the commentator can pronounce punjab properly still and these idiots saying ion room nonsense get over it,5
Yeah this game is done. Russel probs going to get out first ball trying to hit it for six. KKR deserve all the shit they get. Haven't learned a thing,5
Chintu and his app can fuck off,4
"I'm obviously no expert, but how come no one in the KKR thinktank ever thought 'how about we send Russell in when the RRR is not 300 for once?",7
KKR getting clowned by Virgil Van Dijk Lite,1
What's with so many comments being downvoted for nothing ?,-1
Go on downvote me lmao. As if fake Internet points mean anything. Bunch of crybabies.,-3
Russell should have arrived,0
They allowed Pollard to sneak in 2 overs for 15 runs. Now only 1 more over from Krunal to maybe worry about.,4
Hotstar spelled hijack wrong for the Neerja ad,3
Wheres Brathwaite btw,7
Textbook way to chase 196.,0
Pandya lol,7
"Did you know Downvoters don't last long in bed, it's because thier hands are too fast.",6
Lmao Pandya,4
Lol,-1
Can I have some downvotes,-10
"Do you also downvote something if it's already downvoted, if yes then you need help",5
"well, well..... Polly with this 3rd.",-1
Why so angry Pandya,3
One too many Pollard over.,0
[deleted],6
The anil kapoor ad annoyed me way too much. Switched to dugout just cuz of that.,0
Lmao hardik pandya is fucking furious for nothing,8
GOOAAALLL for Hardik. What a slider!!!,5
"Morgan not picking him, Chahar's confidence has been boosted by the wicket.",0
Hardik is maaaaad XD,1
I think this over is the match changing over.,3
"Dont dive on those pitches, not worth at all",7
Pandya is a wanker. What the fuck is he flaming for?,10
Time to start serial upvoting boys,8
How do people get into virtual guest box!?,4
Use me as a downvote button for KLR,-7
Rohit doesn’t want bumrah to get Injured. So then why even select him,-2
Hardik doing a sliding tackle to the ball.,0
Dude that guest box is so creepy,5
What is Chakrapani doing,2
"Morg struggling against Rahul chahar

Bring in Rashid Khan",6
"Morgan SR in T20s since May 2019
Balls 1-10: 150.71
Balls 11-20: 179.43
Balls 21-30: 216.85
Balls 30+: 246.15

I believe",7
That was so wide,0
Looking at the fan reactions is more entertaining than this game,8
"Damn, that pale woman was staring right into *abyss*",5
Pollard bowling better than Cummins,1
Somebody wrote script for downvoting?,10
Think Rohit is holding Bumrah in reserve for Russell.,7
Russell would have murdered this trundler.,4
Morgs looks more under pressure in IPL than he does playing for England,11
"Wtf is wrong with Hardik, angry but why ?",11
14 RRPO. Shit's getting real,8
Morgan out!,2
This game was over by the 5th over,8
[deleted],-5
"3 overs from Bumrah , 2 each from the other pacers to come",11
What a catch,10
WOOOOOAH WHAT A CATCH,9
Gg Mumbai idk how they manage to win all the time.,1
In walks dre russ,1
Hardik what a fucking catch boii!,9
"Kolkata is this season's RCB.

Quite awefull team this year.",9
HARDIK MY BOII,9
Time for Russel the muscle.,0
Alright bois hold on tight,6
Holy shit Pandya. I was worried you'd touch the ropes.,10
Russell time. Aka ass clench time,4
Pandya karke aiya,9
catch by fuckboi,10
"Pandya , the real man!!!!",9
Russell's coming,3
What a catch man. Missed this kind of classy fielding in the lockdown.,16
Dugout didn’t even realise it was caught for like five seconds lmao,15
What a superb catch by hardik,12
PP partnering up.,5
Now r/cricket will be at peace. Dre russ in,7
Russell has every right to be angry. They send him in this kind of situation every time and expect to win.,11
"HARDIK PANDYA, MAN WTF",10
Since 2015 lmao bruhh,7
Russell : Aw shit here we go again.....,6
A walk in the park.,10
"Upvoting everyone, fuck you downvoter",7
Russell coming up boi,6
That was so casual I thought it missed him completely.,17
amazeballs form hardik!,8
andd.. this is why he's fuccboi,12
Morg and Russ.,4
Don't worry KKR fans Russell's on his way,5
Pollard has a wicket now. Mumbai really is Kolkata's bogey team,6
KKR should celebrate that wicket of Rana more than MI.,6
Polly is crushing.... 190+ score doesn't hurt either.,2
fuck yes finally its DreRuss time,5
"Pollard -  My captain in Fantasy League for today!!!  

A",11
"Morgan, Finch and Guptill always suck in IPL.Amla was a better batsman than these hitters.",5
Morgan playing like a gully cricketer.,5
Are you kidding ??? 😮😮😮😮 Incredible fielder Hardhit . First wicket since 2015 for Polly. It must be that Yusuf Pathan wicket in the last over he bowled.,7
Russell to be dismissed first ball,-6
"**11.4** Pollard to Rana, OUT, lovely catch by H Pandya. Pollard's slowness means Rana has to create all the power on this lofted cover drive. Pandya is off the fence and he has to run back to hold on and he has to keep the fence in mind too. He does all that, and makes it look easy. Pollard's first IPL wicket since 2015 **77-4**

N Rana c HH Pandya b Pollard 24 (18b 2x4 1x6) SR: 133.33",10
Lmfao Russell once again coming in with the RR 15. You can't make this shit up.,9
Tbf if anyone could do this- it’s Russel and morgan,7
Fuck Whitehat Jr.  ad,12
KKR top order just fuckin sucks. Some days Narine comes off other days you realize how dumb it looks when he is facing Bumrah and Bolt with the new ball,7
Rahul Dravid is so awkward in that ad,5
"Everytime this hindi commentator says muscle russel , I lose few braincells .",13
The expectations KKR has on Russel are like the expectations my dad has on me.,25
2 sixes,5
what's the song? heard it but forgot the name,2
I feel like KKR bat slow on purpose because they know Russell will pick up the slack at the back end.,6
Morgan Dhoni,8
What happened to my world champion?!😒,4
Bring in Rabada.. oh wait wrong team,18
[deleted],22
Ye sub me kon apni marwa raha hai so many fuckin downvotes,12
Who downvotes CricketMatchBot man.,23
Hardik shudnt have caught that as per the match situation,10
Why’s Morgan whiffing every ball?,9
"Even if Russell wins them this game, KKR think tank won’t learn their lesson.",14
Russell have >8 overs. Lets see if he still got *it*,10
Pollard has given us a few valuable overs today. We'll take that with both hands,5
Prepare for a first ball solid defense.,8
Pollard has his first IPL wicket since 2015.,17
Downvoter shills for Whitehat Jr to feed himself,20
"Me: Worried that he would touch the boundary ropes.

Pandya: Didn't even flinch.",16
Pollard 1 for 22 in 3 overs is goldust.,24
"It is somehow very hard to hit Pollard, he just bowls slow and good lengths.",14
"Seems like KKR is going to go down tonight, that means the last 4 games would be lost by the teams winning the toss and chosing to bowl. Nasser Hussain would feel right at home in IPL.",30
Russel should pull in a dhoni kkr will lose their shit. It will be peak entertainment.,19
Where is this whitehat ad,12
Pollard's first IPL wicket in over 5 years,13
How funny would it be if Morgan ran dre Russ out for a diamond duck,12
Finally mrf zlx gave us an ad in chiku's OG voice.,11
"Great catch, made it look easy.",12
There is only one combination that can win it for kkr it's the one right here if these can't do it it's game over,17
KKR do something bro,13
Am I hallucinating or did they change the MRF voiceover with Koach ?,23
We need to hit some sixes.,12
Bumrah in..,9
A solid negative NRR to KKR.,8
Bumrah. Finally!,9
This should be a good contest.,4
Bumrah will get tonked all over now,1
Wicket alert,4
"Bumrah vs Russel
Oh mama",4
"Here we go, Russell walking out",3
If kkr can pull this off they r pretty much undefendable,3
Bumrah vs Russell is the ultimate battle,9
Russel should purposefully get out for a Golden duck and troll KKR,16
Downvoter's wife will suck my cock! Plz upvote guys,29
Bumrah vs russel interesting...,8
It might just be me but I think KKR are falling behind,7
Fierce from Bumrah. Here we go,8
Blockbuster,2
"Fuck, that must have hurt",5
Did they just call Dre russ a right handed Narine,4
If Russell gets going then 117 from 46 isn't a big deal. IF,3
Thanks to IPL I've seen one of the best yorkers. Aka Rabada vs Russell in that super over,3
Ooooooohhh. I liked fired up Bumrah.,4
No boom dont poke him please,6
Bumrah on fire there,6
"Deep ""There's no two ways about it"" Dasgupta",2
"Required RR at the start 9.8  
KKR masterplan: Waste powerplay, score at 6.5, throw wickets and then expect a guy to smash   14 per over for 8 overs.",8
Bumrah ne kiya gumrah,2
"Mumbai can afford to retain 3 overs of Bumrah & 7 overs of quality pace overs overall after 12 overs. 

Imagine if Hardik also comes to party... Crazy!!",3
Bumrah will get some big dick sixes.,3
Here we go!!!,3
Haath toot jayega bc Bumrah!,3
Bumrah take it easy with aggression buddy. Don't wanna anger Mr. T,6
"Yea, smash his brains out, Bumrah!!!",3
"If you downvote, you use WhiteHat Jr",8
Feels so awkward watching Bumrah do this cause he's literally so nice lmao (just like Kane Williamson),15
"Kohli rubbing off on Bumrah, lmao.",5
"KKR spin attack is struggling... clearly they planned for Eden gardens where the pitch off late is pace friendly.

Narine is half the bowler he was before changing action, kuldeep gets worried about getting hit than taking wickets.

Any other options ?",5
damn can't believe they played Pollard like Cottrell or something..,5
8 off 11 nobody talking about in 14+ RR run chase,8
Love the aggression from bumrah🔥🔥,9
Bumrah has big balls,14
Last year there was a koach cartoon. Is it still on?,5
What a pathetic run chase,5
F for KKR,6
Russell needs to do some hard hitting in order to keep KKR in contention,2
Only Russell can save KKR with his power hitting,2
Did boult just do a fake throw?,4
This bumrah kid is pretty good,15
I had almost forgotten how weird bumrah's action looks. How does he generate the pace he does with that t-rex looking runup,8
I've been spamming A-J to upvote everyone to balance the downvotes no worries mates,5
Russell vs Tiwary fight would be so fucking amazing,9
Hmm 8*(11). That sounds a bit familiar.,8
Quality chase this.,6
Russell playing test cricket here with SR 33.,6
"Call it day

Enough of this shitfest",7
Oof,7
Bails Didn't fall!,4
Lucky asf,5
Where has the energy come on the ground suddenly. I can feel it here.,5
Dre Russ with a rough patch in CPL.. I don't see him doing it for KKR today..,4
Morgan is one lucky bastard,11
Fucking luck of Irish!!,9
KKR slowly slipping into the zone where you get more worried about run rate than win.,10
"I know its almost impossible 

But why is rusell still giving me goosebumps",8
"Deputy lead investor of a big new fintech cheering like that, this is so fucking sad.",4
Morgandra singh Dhoni,17
"Morgan was bullying Pakistan, what's up here :-\",11
Guys why don't you add a +3 in your head per comment to compensate for the downvotes?,3
"As the famous poet baburao said 

Khopdi todd sale ka.",5
Morgan really riding his luck,6
"How lucky is Morgan, escaped by the barest of margins",9
Is the game too slow today? I mean it's been 3 and a half hours and more than 7 overs still to be bowled.,5
8 of 12 in a 14+RRR chase.. if it was Dhoni people would have lost their minds!,15
Wtf was that by Morgan!?,1
lol what’s going on,2
Harsha needs to calm the fuck down. Too much enthu for nothing,0
That's so fucking hilarious from Harsha,6
That was really really close,3
Lucky Morgan,2
Morgan shitting his pants here,4
Morgan almost got out,3
"More than 5 overs total left for Boult, Bumrah and Patinson, no chance from here for KKR. Russell or not.",6
Morgan and russell have no idea against bumrah,6
"DAMN, WHAT LUCK MORGAN",10
No Russel doesn’t know how to hang around. We have seen that shit against Australia in 2019 WC.,3
"How has Bumrah's speed been ?

&#x200B;

Does he look like the old Bumrah",1
Is a leg cutter still called a leg cutter if it just drifts in the direction it was boweld?,2
wow,4
Poor Morgan,5
Nayar looks more upset than DK and McCullum there,1
Morgan is struggling,9
do something with that luck bro,6
MS Morgan am i rite?!?!?!,1
[deleted],1
Extraordinary over this from Bumrah. He's got 2 more coming.,4
I think we have seen the return of the old Bumrah in this match. The old confidence is back,9
Bumrah should be in the national team already,3
"Morgan got lucky, really lucky.",3
Bumrah back to his best,3
8(13) dhoni died for this yesterday lol,9
Morgan Singh Dhoni,6
4 from the over. GOLD,1
Eh 100 of 5 is too easy hehe,2
"Oh Damn.
Oh Damn. 
Oh Damn.

Great over already.",2
Russell ain't got shit on Bumrah,3
What an over was that.,4
Bumrah bowling to scare everyone off.,9
"So much for the ""send Morgan at top"" theory.",14
This middle order was too overhyped,19
Bumrah 0-3 after 2 overs 😍😍,19
Kkr or Mi.. Who is in the drivng seat?  MI for me,2
Bumz back to the original Bumrah! Le bumro bumro shaam rang Bhumroo!,8
Bumrah getting back in his element.,6
Bumrah cruising at a 1.5 ER defending 195,7
We are seeing a very different Morgan today! No connection with the ball all along :/,2
Kkr almost their..... to 100,3
Harsha should come to the dugout! I hate the ads,5
Those Zing bails are definitely a little heavier than regular wooden ones. Seen so many of these types of situation in the last few years with them.,8
Where are all the Dhoni haters from yesterday? Why arent you guys saying jackshit about this innings from Morgan??,3
Downvoter is tired b,4
[deleted],5
One wc winning cap doing what another did,3
Morgan trying to emulate Dhoni,-1
Morgan in Ipl is so shit,5
WhY iSn'T MoRgAn HiTtInG sIxEs?,9
KKR might have just decided to play for NRR. Sort of like what CSK did in their last game.,10
Has the pitch gotten harder to bat on?,2
People hyped Kkr way too much aint it,7
I want to see a good chase but also don't want my bowlers to get hit fml,2
Bumrah broke Morgan's rib! Astonished to see an Indian fast bowler do that!,3
Slow gun Morgan,3
"you may not like it, but this is how you chase 196",3
At this stage MI were 33 runs ahead KKR,2
Mi might as well load up on bumrah and Boult now. This is the only potential dangerous partnership,3
In hindsight. faf and Dhoni did well to save the NRR yesterday. KKR heading for a heavy loss with 2 more Bumrah overs left.,16
"Yo, remember when you hit 16 6s in a game?",7
"That ball at the ribs was scary, Bumrah so good",8
Surely it's all over for KKR??,8
Pattinson in.. Chance for Kkr to fire?,3
This is just agonizing to watch,8
Patinson gonna get tonked this over,3
Man I hope they rethink about the captaincy now. And also to stop with the Narine opening experiment.,5
"Morgan should've been sent in the powerplay at 3, wouldn't have let the run rate get to this level",0
Russell play a Dhoni innings,3
Morgan taking it deep,3
"To state the obvious, this is some quality bowling. Even with the risks taken runs just aren't coming.",3
"Lol people comparing morgan to dhoni seriously. Dhoni came in after 15 overs in a role where you have to get going. Morgan isn't doing great he'll get his share of slack calm down. 

It's just that dhoni pulled this nonsense way too many times and morgan hadn't",3
Is this pitch actually just hard to bat on? Did it change after Mumbai's first 10/12 overs,3
Boult and Bumrah top 2 ODI ranked bowlers in the same team is unfair. On the other hand KKR decided to buy the top ranked test bowler.,30
That shot doesn't look good,2
"Can't watch the game right now, just here to read the comments. Damn I missed this energy!

You guys are awesome. ❤️",7
How many Englishmen here,2
Yesterday chase was better,2
[removed],4
Russel needs to add coke back into his diet.,5
"dre russ would be a dud this season, already calling it",5
"Boult, Bumrah, Pattinson with overs and asking rate of 15...an impossible task if I've ever heard one",5
russel with those shoes is just inviting those toe crushing yorkers,1
Dhoni had a excuse that he hasn't played for 14 months. What's the Morgan excuse?,3
RRR reaching 18 lmao,1
Yeah. Morgan never had a good ipl.,3
This is too deep. Too fucking deep lads.,1
I think only gautam gambhir can make KKR win,0
Ambani nanobots at play here?,0
"Cmon hit atleast 1 six

Give one ray of hope plz",2
Any aussies here who want to replace Cummins with Pattinson in their t20 team?,0
Harsha speaking about inflation. Next match ban confirmed.,9
Which one sucked more - CSK the other night or this KKR shitshow?,3
Not gonna lie I love the KKR bling,5
Morgan his missed like 5 balls already,1
Morgan is only good in England !,0
Feeling bad for Morgan,2
KKR have lost this match atleast 10 overs ago.,7
MS Morgan,3
Yess!! finally,2
Was In the slot,2
"The thing is, Morgan is trying, flaying his bat. Dhoni didn't even try before the last over.",6
Russell be like I am done wiping your shit. Won't bat if you leave 12+ RRR for me to deal with.,4
Morgan hitting it for a six..,2
[deleted],2
"Gill, Morgan and Dre Russ have to bat in the top 5. KKR need to choose their other 2 between Karthik, Rana and Narine.",1
Oh Captain My Captain rise up and hear the bells,1
Bengaluru vs Karnataka tomorrow,6
Yesterday’s match being replayed today,2
Tomorrow’s match: RCB vs RCB lite,22
Runs just aren't coming for KKR at the moment,4
"r/cricket is more frustrated seeing Morgan getting beaten than himself and the KKR management, ngl",12
I don't understand why you all prefer Bhogle over any other commentator. He's downright atrocious.,-10
Need a lot more of those from the england captain,5
The RCB vs KXIP bit was more interesting than KKR's batting till now,14
Really makes you appreciate Rohit's Batting today with both these struggling out here now.,19
Go Wide yorker to Irish Morg.,1
"Oh boy here we go, finally a six",1
Hope they can connect a few more hits otherwise this game is gonna fizzle out real quick,2
"I dont see kkr winning but i want it to be a close match alteast, too much yawning atm",11
Unnecessary six.....they shud play safe....,8
Yes the Morgan we know,7
Forget the win now. NRR will be costly,19
Morgan is hitting too many wide balls here,8
They ain't scoring 100 of 6,11
Both Pattinson and Boult have taken much load off from bumrah.,16
KKR are loosing since 1st over,11
In before morgan gets bowled,10
"Nikhil Naik be like,

""Bruh I get only one game a season. You guys seriously gonna send me out with required run rate at 20 rpo!""",18
"Tomorrow is going to be so troll 😂

It'll be a match to see alright",14
"Just hold on KKR, few more overs and we're off to Day 2",45
Morgan will play different if he would be the skipper,9
Bouncer on Russell..,8
"pattinson is mcCleanaghan, mcCleanaghan is pattinson.",7
"If anyone plays Eoin Morgan in a movie, it should be Mark Wahlberg.",14
"Andre ""only beast on indian pitches"" Russell",9
Need 100 from 6 overs. Lol,3
Even as a Mumbai fan I wouldn’t mind seeing some fireworks from KKR right now. It’s getting quite boring.,10
Why none complaining abt rusell knock tho,4
Bumrah is the capacitor as an user on here described him a few years back. Doesn't take the wickets but the economy and tight bowling supercharge the entire bowling attack.,13
Let's not jump on Morgs. Even Dre Russ hasn't got going.,5
"Every finisher is suffering from MS Dhoni syndrome this IPL.

WTF is going on!",13
I'd just bowl Bumrah out here and finish the game if I were MI.,4
IM LOSING MONEY! HIT THE BALLS FOR FOUR AND SIX FFS,3
I N T E N T™,1
