Comment,Upvotes
Nattu boi so far so good,2
El capitano.,5
Who is this Natarajan? Seems to have a great head on shoulders. Would love to seem him bowl more. SRH don't lose him please.,5
"What happened to kanos???
?",4
Warner anna 👏👏👏,8
Ah yes #Intent has interned the chat.,3
"Great effort cap, khaleel bowl Yorkers to hetmyer",1
Imagine if you are TN Nattu and getting dapped up from Warner and Bairstow,-1
Any other pair would have taken 3,7
Wtf!? Pant seems to be trolling,4
[deleted],5
Well bowled and well batted too.,2
[deleted],3
Hetmyer needs to go. It's now or never. Big Stoin is still sitting in the dressing room,2
Simran needs to live his a life a little now I reckon,8
Khaleel with an Yorker,4
Man Rishab has gotten fat. Koach aint gonna like this.,4
"When even a lockdown can't make Khaleel put on weight and gain some muscles, I don't know what can.",5
"Even Khaleel nailing his Yorkers. This is the old SRH who would defend even 120-130 scores

Edit: I stand corrected. Lord Khaleel ftw",6
Not watching the game. Why are DC batting so slow?,4
This guy is shit ofc,3
Lol At Bish sticking to referring to himself in third person,0
Cmon yaar khaleel...,1
Kane is a gun fielder and he might be giving some very good suggestions to bowlers while Davey is saving some runs at long on/off. He should be on the field,2
Je baat,-1
"That's why bowlers don't bowl yorkers every ball

If you miss, you get hit for 6",13
Sux,2
Only khaleel can bring hetmyer back to form. Fuck me. We aren't gonna win this either,3
Kaleel auditioning for Dinda academy,2
"It’s hard not to respect David Warner the cricketer, especially when it comes to the IPL.",7
great the second fat ass is getting in on it too...,2
Death overs should be renamed Tewatia overs for this edition,9
Why is Rishab Pant running like Inzamam and declining singles. He needs to be in better shape considering he is just 22,6
Damn son,1
Oh yes Shimron,1
Snoozefest,0
SRH bowlers nailing the Yorkers. Reason? Muralitharan is their Bowling coach ❤️,2
Khaleel never disappoints,7
Hetwatia,6
That's a brilliant shot,2
Man this guy has another over! 🤦🏻‍♂️,5
Simran.,5
Harsha is on another gear when commenting on SRH,3
Khaleel sucks. You stupid bitch,-1
Khaleel doing what he does best.,3
Lord khaleel,3
Discount Zaheer lol,4
Left arm bowler to left hand batsmen this IPL hasn't been a rosy journey...,1
Imagine getting an IPL contact because you bowl with your left hand,3
"Once again, unchasable is getting chased.",3
TONKED,3
Kaif taking notes : khaleel ki le li bc,6
What a shot!! Everyone keeps shitting on him but boy he has immense talent,2
These Carribean left handers have ungodly power and hella flair... Gotta give respect,5
Khaleel sucks 😀,7
We are fucked,4
bhuvi and rashid will save srh.,2
Khaleel you clown,7
Classic case of r/cricket jinxing someone,8
My boys are feasting,2
"Fuck off khaleel, BC. Throwing like a kid. WTF are doing. Wasting all the hardwork by other bowlers to waste",9
"I am shocked, I tell you! Shocked! Did not expect this from Khaleel. /s",4
yea DC gonna chase this with 2 overs to spare.,2
khalil you ........,1
Atleast Sid Kaul took wickets but Khaleel doesn't seem to take wickets as well,6
He quote clearly has a good Yorker but chooses to bowl a short ball. Fucking retarded,1
Why is Kane sitting,3
That's better,2
"SRH campaign is done. 


See you next year when they buy Fast bowlers 😞😞😞😞😞😞😞",4
"Khaleel is shit? Ah, 2020 is returning to normal.",3
"Rashid and Khaleel with two more overs to bowl against two lefties, oh no",4
Why is Kane sitting out?,3
Wtf is kaif writing everything is available on many cricket sites.,2
C'mon DC,1
"And here we go. Khaleel and shit bowling, what a pair.",4
"Common boys, last team defeating top team would be fun !!",2
Khaleel suss,3
"I said many times that RCB need to drop Umesh to increase their chances of winning matches, SRH need to drop Khaleel",1
"Just to clarify why nehra said yorker overrated

He said that in current scenario i.e 14th over and he is right yorker is good in death overs not in 14th over. He said you can control runs but cant take wickets.",4
"Made no fap challenge if srh win, seems like it's going to be off",3
"death, taxes and Khaleel being shit",4
Hell yeah another night of madness with these two bad boys catching fire,2
"Considering how the last couple of games went, I think DC  has this in the bag. 61 off 39 doable.",2
"Finally, time for hetmyre to improve his IPL stats. It doesn't suit him.",3
coach wtf lol?,2
I'm not going to switch off the TV after 15th over today,4
RCB bowler to RCB batsman. I'm just gonna sit back and enjoy lol,1
"you have to get one more out of khaleel it seems 

&#x200B;

&#x200B;

harsha why you do dis",3
This MF got only two variations,2
"Ya K Khaleel, you are just shit.",1
Idk why but I always get sadistic pleasure when Khaleeel gets smacked. Maybe because I dont consider him good enough to be in the national team and he always somehow finds place in it thanks to him being a leftie even though he is shit bowler.,3
Do they have a pun for every player in the league?,3
Pant LMAO,3
"I was just casually mentioning to my friend that Khaleel has improved . Looks to have developed control and consistency . Might be a good pick in our fantasy teams .

Within minutes - two sixes back to back .

The Love Hate continues .",13
Hetymer looks like that fat rich kid who comes in an SUV to play gully cricket,32
The bowler and the batsmen are younger than me. Feeling old,8
Hetmyer's ass>Kardashian's ass,22
Pant full entertainment,3
Trevor for me looks like a too laidback coach.,4
With one more Khaleel over to go DC are in with a chance,6
Thank you Khal Drogo. Phew,5
khaleel and his chutiya bowling,1
Poor running this,2
Khaleel back to his original form,3
Lord Khaleel at it again,3
Khaleel pulled of a Tewatia!!! He was slow at first but now he is a legend ! Well done khaleel,5
Lol Khaleel,1
SRH Bowlers: *There's an imposter among us*,7
I'm glad the SRH knuckle ball era is over,1
Why the f are all players attempting a Dhoni lately,5
"My money on Delhi from here, looks fairly straightforward with 3 big hitters around",3
"Four good yorkers, 2 bad balls. I still think that's the best most bowlers can do.",6
No running between the wickets lmao,2
"59 of 30 should be easy, right?",3
50 off 5 should be easy. Our game to lose from here.,6
Shocking running between the wickets from these two chubsters,5
"Ja shimron ja, jeele apni zindagi",3
"Harsha Bhogle “QQKHALEEEL, from the epiglottis”",6
60 of 30 looks nothing now,2
"Has he done that shitty ""call the selectors"" celebration yet?",2
This pepsi ad is one of the cringiest ad evers,2
should give Bhuvi the next over,1
Wtf i thought pant was the one denying singles. Its actually been hetmyer all along,3
Saving Rashid for defending 4 off the last over. Big brain from Warner,5
khaleel is too beta man. gotta strike some fear in the batsman as a fastbowler.,5
I don't want to believe that IPL is fixed but how the fuck is this happening game after game?,4
Sanjay used bemused correctly - made me tear up.,2
"One of them needs to go if srh wants to win this ..  


and khaleel sure as fuck ain't gonna get you that wicket",1
Bruh to left handers and Kane is not bowling on a slow deck,2
Caught up to pant in half the balls.,6
All Hope's on bhuvi,1
I might just download Cred for the amazing adverts,2
Now khaleel will pull off a tewatia by taking a hattrick in his next over,3
"Shimron Hetmyer be like ""I wanna run doubles but the clap of my ass cheeks keeps alerting the opposition""",7
"This is DC match's to loose now, which is good news for SRH because DC will loose a match from winning position.",5
And stoinis isn’t even here yet,3
Wickets it is. Nothing else can win this for SRH.,9
As a DC supporter I'm not gonna watch the match as I may potentially jinx it,6
FUCKING HELL BHUVIIIIIIII,6
Bhuvi :),3
Stupid stupid shot..,1
[removed],7
Hetmyer is the master of throwing wickets away :),3
Phew!,3
"Yes bitch, finally. Bhuvi love you",9
FFS,2
Hetmyer out😂😂😂😂😂,3
Bad shot. Very bad,3
I love Harsha Bhogle when he does SRH matches. Love,8
Warner to Khaleel : band karo band karo khule hagna band karo,6
Bhuvi delivers,3
Pandey ji specialist fielder,4
Stoinis plssssss,1
Yay!,2
Koach this is how you use your bowlers take notes,5
"Thought he'd made a meal of that catch tbh

Massive wicket, well bowled Bhuvi",3
Nice slow ball from Bhuvi.,1
Bhuvi pls don’t be afraid of Pant.,3
What the fuck? Where is Rashid?,1
The DJ started with Stayin Alive and has now reached hookah bar.,8
Cometh the hour cometh Stoinis,3
oh bhuvi my bhuvi,2
Probably saving rashid for stoinis,5
Ponting preparing his dressing room speech,8
"Cool af, Pandey Bro.",7
A West Indian for a West Indian,2
"Manish , goti muh meh agaya.",8
"Okay Delhi Fanbois.
How many times will we have to remind youu..Ur team is not dependable at all",3
Stoinis bout to clap some SRH cheeks,5
"Bhuvi and Rashid. 5.1 overs, 17 runs, 4 wickets.",16
shimmy shimmy,4
What could be the average age of people on this sub?,5
Stoinis we’re gonna need some of that bicep power please,3
Manish Pandey doing what he does best.. fielding.,7
Rohit and Shreyas traitors for playing Fifa instead of Cricket 07,4
Nice fielding boys,2
SPECIALIST FIELDER,6
"C'mon Bish, answer the question, why is the yorker such a hard ball to bowl?",1
"During SRH's golden years Bhuvi was ably supported by Kaul and Sandeep. They don't have anyone now, not even Kaul and Sandeep.",2
Fuck this time out!,2
Stoin we need you again,1
Uhhhh is Warner actually holding Rashid back for the last over or something,2
dat ass though ( ͡° ͜ʖ ͡°),8
Fuck off with the time outs cunts,5
"**15.1** Kumar to Hetmyer, OUT,  **104-4**

SO Hetmyer c Pandey b Kumar 21 (12b 0x4 2x6) SR: 175.00",7
Stoinis fck this shit up my man. Kill em all.,3
Pandey almost dropped the match there. But fuck me Stoinis is out now,6
Atleast gave some momentum to the chase. Keeps his place for one more match,5
oh jesus don’t remind me about tomorrow,3
Shimron kardeshian hetmeyer,11
I think the outside off to hitmyer was the plan. Khaleel just couldn't execute it. Gave too much timing.,6
Pandey is seriously our best fielder his drop rate is also really low,10
Rcb strikes back,3
"Bhuvi must have gotten a boner when he looked at this pitch, he’s relishing bowling here, making mockery of the top-order batsmen",8
"tbh that was good from hetmeyer. dc needed someone to speed things up and relieve pressure form pant, and he did that.",5
As an RCB fan I can finally relax and watch in peace,11
Oh no we are up against Lord Tewatia tomorrow,12
Hulk time,3
RR playing outside Sharjah for the first time tomorrow,6
"That being said, looks like Boobie is gonna overdo the slower balls and get hammered again.",3
What are they saving Rashid for?,2
"Harsha with the Sass on Bishop. When it's SRH, Harsha rides too close to the sun doesn't he?",3
Finally a wicket,2
Hetmyer is talented but no brains,4
Lmao I had given up all hope on srh and now they're going to beat one of the best teams,10
What a terrible shot,1
stoinman gonna chase this in 2 overs from here.,5
"No one. 
Literally no one.....


Hetmyer cùnts first ball of Bhuvi 
🤦🏽‍♂️",8
"Bumrah, Bhuvi, Saini in t20s, replace Bhuvi with Shami for odis.",6
Don't hype up stoinis he's 100% giving his wicket to Rashid,7
This is our last batting pair. They gotta strike a 40 runs partnership at least.,4
This wicket was a result of setting up that shot. This ball was just a bit slower than the previous one in khaleel over.,6
SRH and RCB fans are distant cousins lol,14
Strategic timeout is real shit. One is atleast fine but two in a single inning. SMH,10
Once the 2nd Fattie gets outt..Game set and Match for SRH ?!,1
"I was concerned and now it's been confirmed, this team can't chase anything more than 180. I don't think we should be considered top favourites at all.",1
"It feels everything is right with the world when the lead bowlers do their job of taking wickets, immediately into their over",11
Stoiks,1
"Question - can wank also be used a synonym for shit? Like ""They have a wank privacy policy"".",4
Imagine if BBL was IPL and Kohli was banned for Sandpaper. Would he got back his Royal Challengers Adelaide captaincy back?,13
What the fuck are these Josh ads?,1
DC would be wishing they'd retained Tewatia now.,6
"Pointing needs to have a serious word with hetmyer. He’s arguably the most talented young player in the world, needs to work on his mental game",9
"No pace from Bhuvi, the ball from Khaleel on a similar line that was hit for six was quicker, and shorter.",3
SRH winning would be good for the IPL,14
"Thanks to these last few matches, no target looks safe now.",7
Why is Kane not fielding? Injured?,4
Shimron do be havin a thiccc ass,5
Bhuvi and Rashid are what made SRH bowling so formidable. Nice to see them both getting back into form.,9
I believe Pant will win this,1
Hindi isn't my native language but does anyone refer to their guard as Guard Bhayya?,6
"Come on Stoinis, drawn SRH in the sea of your jizz",4
"Damn seriously what is going on with the fitness in DC... Shaw , pant , hetmeyer",3
Shit who got out?,1
Another example why strategic time out is unnecessary,4
"for that gloster add... i hate to say this but ...that kid is dumb as fuck ...  


all dumb guesses for abbreviations..which are themselves cringe as fuck",3
Tewatia : ᕙ༼◕ل͜◕༽ᕗ,2
"At least the Josh app ad is honest, showing us how unfunny their ad is, no chance I will download the app for more such unfunny videos",2
You have hot girl in a pink dress and you watch the match? You deserve the hand bro.,3
"So, body shaming is a norm here now?",2
Lol Warner saving one over of Rashid for Stoinis.,5
Chain Kulii Ki Main Kulii is the greatest sports movie ever made don't @ me,5
"Knockout teams will be:

RR
DC
RCB
KXIP",8
Do the Tewatiaa Pant boyy,3
Fuckin what Pant's only 22?,4
That's some PTSD!,4
why pant playing like jadhav lol?,5
Damn Pant made Bhuvi his bitch in 2018,5
"If only Abhishek caught that , SMH. We would have a chance in this match. These two will go berserk",6
Oof,1
"Here we go, we r fucked",3
now get that weird little aussie who might ruin this for us..,3
Winning of SRH would provide balance to points table,7
Pant and Gill are same age? Tells you the talent of Pant and expectations from him,4
Oye bhenchod,3
Stoinis the Moinis!,1
Big dick stoinis,1
told ya,1
Lets go Stoin,1
Overdoing the slower balls as predicted. When will he learn!,1
Get Stoins wicket boobie,3
Chad,2
Sexy stoin,1
You sexy stoin,2
Stoinis should bat at 3. In this form we are simply wasting him. Iyer should bat at 5.,2
I am scared of Stoinis. This batting lineup is very stacked,7
im telling youuuu. stoinis is gonna be the costliest buy next season.,1
Inb4 Mar kas pun on Hindi commentary,3
Will pant pull off a dhoni or a tewatia?,4
They're talking about his biceps lol,3
Gg boys it was fun while it lasted :),8
"Honestly this is pretty chasable as much as I want SRH to win ,they need a wicket in the next 2 overs.",3
Lol stoinis is jacked,2
"50 off 25 seems very get-able, what has this IPL done",5
"As someone who isn't too involved with Australian cricket, what's the deal with stoinis and zampa? Are they actually rumored to be hooking up or is it just a meme?",5
Why was Stoinis never so good for us,8
SRH got 1 over of Rashid to take Stoinis out. Else it's gonna be difficult for SRH,6
"When Stoinis plays for Australia, he almost never hits a four in the first ten balls.",13
Stoinis the mannis is going to absolutely twat us,6
DC's got some good ass players.,10
[removed],5
Stoinis looks bit like hero Abbas(Premadesam).,4
So Khaleel will be the given the last over it looks like.,3
Pant playing tuk tuk,2
powaa pant,1
Pant stop doing fancy stuff lmao,1
The way Bhuvi bowls determines how well the sunrisers are bowling - Harsha Bhogle,9
Sexy shot that Panty,1
53 off 26 is chase-able by SRH considering they have Pant and Stoinis. SRH need to get one of these quickly.,3
What is kaif writing ?,2
We're still fucked mates,3
"Where is this confidence when Stoin plays for Australia down the order? I don't get it, he'd have dead batted that 1st ball down to his feet if he was playing for Aus",5
How does every ball not fly into the stands when Big Biceps Stoin hits it?,1
Is SRH giving me hope?,4
I get the need for innovation and it works but sometimes you just need to cunt it down the ground like that,2
York the fucker out Boobie,3
DC has it in bag folks.,1
Need a wicket,1
49 in 4 ... tall mountain but not an Everest,3
Should give Rashid the next over imo,0
How hard was that hit!,1
Rashid and Khaleel overs will decide the match,3
Harsha praising the batsman and also expressing our feelings. What a player.,6
"Pant and stoins is picking and hitting Bhuvi, they will masscare my boi Khaleel. Pray for him.",3
Is SRH this year's RCB?,7
Isn’t Stoinis supposed to Aussie MSD?  Just few days back we were all shitting on him on Eng Aus match thread about his slow starts. And now he is scoring boundaries from ball 1.,3
Bhuvi of 2017 was such a gun death bowler ❤️😭,2
Pant gonna attack Rash as usual and succeed as usual.,2
Man Pant has a LOT of power.,2
"Ek hi dil hai, Kitni baar jeetoge Bhuvi bhai <3💕",1
I really like how this stadium looks,4
u/RLKay really pains me to say this. But feels like Bhuvi is a shadow of his past. The lack of yorkers from him is deeply upsetting.,3
Who’s gonna bowl now? Should be Rashid,1
Pant is definitely a better player (in all formats) than Samson and Ishan Kishan,3
Welp one Khaleel over left. Thats the game.,3
Pant scored 44 of 11 against Bhuvi when he was barely 20.,7
Afghani Chad Rashid has got this or Aussie Chad stoinis got the stonks,1
oh no it’s rashid I’m scared,1
Should bowl rashid now while stoinis is new to crease,0
"Idk who will win

This is the IPL. Anything is possible.",2
One 20 run over and 29 off 18 which is quite doable.,3
"Hetmyer hasn't fired until now. A few signs are there in this game that he is getting his touch back. This DC line up will become more dangerous once he gets into his groove.

Pant, Hetmyer and Stoinis taking care of the 2nd half of the innings.",0
The dropped catch might cost the game.,2
"DC top order ate way too many balls, just like the last match. It will be really hard for them to defend or score on a pitch like yesterday they also have lowest run rate in the powerplay 4.5 or something.",1
49 of 4 looks too easy after MI scored 79 last night,3
Not Rashid pls be scares me,0
Would a Brohit sized Stoinis be as attractive as muscular Stoinis?,0
This is what we in the business like to call a BIG OVER™,4
Rashid and Pant are playing against each other since U19 times!!,9
"Rashid enters. 

*Boss music playing*",3
This is the make or break over for SRH,3
This is the over that sets the match,1
I don't know how much is safe with Khaleel. Like anything is possible with his over.,3
"Leftie Be Leggie

Ohh I love it",2
"This will be the make or break over I reckon. If he keeps it tight giving away just 5-6 runs, then it will SRH's to lose. If DC takes him apart, gg",2
Here's hoping another cracker like yesterday!,2
Lets see if Stoinis makes those biceps to use,1
Don't give strike to pant. Rashid jeed to take stoins,0
"We need at least one boundary in this over, or the pressure would be too much",3
DC fans what do you think of Carey over Hetmyer?,2
NO. DONT EXPOSE STOIN TO RASHID PANTSS,3
Pant trying to play a young Dhoni innings here.,3
"DC are gonna play Rashid off, unless Rishab thinks the impossible.",3
Can Pant keep calm and respect Rashid here? This is the time you need to keep your wits about you.,4
I want SRH to win because they have Kanos. But Stoinis' biceps are testing my resolve,3
Warner holding Rashid back was a good idea,5
Just realized YJB always looks like he's wearing the orange cap,2
What time does the Super Over starts?,4
Rashid against stonis this will be fun.,2
DC's gotta be careful now and not do anything stupid,3
No wickets here is a win for DC even if over goes for 6,5
Man they hit 54 in the last 27 balls:(,2
Pant can't run two at all,4
"DC ain't winning this game.

Edit: you heard that first here boys.",1
starting to feel sorry for warner. 2020 has been a wild ride.,3
Rashid baby yes,3
Fuck yeah,4
"Yeeeessssss bitch , what a catch. It stuck",5
Jai Balayya,9
Fuck offf,3
nice.,2
Rashid Khan and Bhuvi carrying this bowling attack.,7
wow the way I yelled “fuck” out loud just now,5
Rashid you beauty...,3
"Pant, what the fuck was that. Rashid's last over. Dumbass cricket. Idiot.",6
King khan,4
Pant and brain dead batting choices. Name a better duo,6
HOLYFUCK RASHID KHAN YOU ARE THE KING OF HYDERABAD,12
lol,1
Pant should really work on his composure. Can't rely on him at all,6
Dumbass,4
FUCK YES RASHID,3
Leg spinner to left handed batsman - good idea!,7
Hagg dia bhai ne,3
Lol Pant has swept like 90% of the balls he faced against Rashid,3
lmao meme Pant,1
"Because of the last 2 matches, this equation looked like an easy win for the batting team at first glance. Then realized it's over 12 an over.",6
Lol Panty making every Delhi fans pants wet rn😂😂,1
Rashid's back fuckers!!,3
Lmao I love punters face.,1
fuck yes ..thank you being pant ..rishabh pant,2
Rashid my boiii.,1
Could have just played this over but no,1
"2018 vibes. Williamson carrying the batting, Rashid & Bhuvi carrying the bowling",14
Pant doesn't have 2 brain cells .,5
"I'm crying, thats a beautiful spell from Rashid 😭",4
"no no no, i don't want hope.",4
Wow someone actually took an outfield catch,4
Good match,2
Pant is so fuckin predictable!,1
Great to see Riyan Parag get some action,2
All he had to do was play off this over. SRH's game to win now.,3
I can’t watch thisss,1
Rashid is back bay,2
Can't really blame Pant. Couldn't exactly play him out at this stage,3
Young Rashid Khan from Afghanistan!!,5
Pant is playing a Dhoni type innings of taking the game deep,2
The best 30 year old 20 year old in the world,10
Would be thrilled if there will be another super over today,1
This is still DC's game to lose 😶,3
Slogging against Bhuvi & Rashid is always going to be risky,2
Pant out. Is there a twist in the tale again? Were the past couple of days just aberrations.,3
"Scratch that

Now Samson or Ishan > Pant",4
Don't get excited. Don't get excited.,4
You just can't keep falling over and score big runs everytime.,2
Ponting looked at the camera like it’s The Office.,12
Punter's expression 🤣,7
Should've played out Rashid when will pant learn sigh,6
Just Kidding Cement,0
Unnecessary my Panty,2
The squeal I let out at that,6
"Bairstow glad he plays in the same team as Rashid so that he can still use his trademark 'yes Rash, nice Rash'",9
Rashid is back!,4
"Game still not over tho. Stoinis' 170 odd vs NZ makes me think he could cut this close

Edit: 146*",5
That was good field placement than good ball tbf,3
Gg wp. Gn folks.,1
Ponting to Shreyas : what’s it gonna be tonight mate ? You want the knuckle duster or the fkin baseball bat?,6
Priyam Garg has a punchable face.,0
someone said earlier that Pant is struggling like Kedar Jadhav lmao i can see whyy,0
"Great bowling :(

Discount jadeja next up",3
That look on Ponting's face is so satisfying. Better than winning the match.,4
i think ive seen pant get out to that shot like 15 times in the last 1 year.,5
"What did the commentator just say? ""Riyan Parag took a ...""",8
I was just typing how this was still DC's match and Rash got him.,2
Punter looks ready to give pant am earful after match,6
"Rashid is worth every single penny of that 9 crore. Not just about the bowling. He looks like a fighter who will fight tooth and nail till the last ball.

And, good with the bat as well. Would have loved to have him in KKR.",7
"Ohh boyy, Smith vs Cummins tomorrow. Should be fun.",4
Send in Mishraji. He's the only one who can pull a Tewatia.,3
No other team anthem even comes close to the SRH..maybe the old Hyderabad anthem,3
When will these batsmen learn not to attack the opposing team’s best bowlers,3
Pant is a Ponzi scheme,5
Porno level acting by the MI boys in that Samsung ad,13
"Well this just got a lot more interesting, totally still doable for DC but SRH should win",2
Fuck yeah!!!!,1
This is why I hate Pant. I'm sure the fielder there was waiting for the catch. How many times has Pant been caught there?,6
"Pant sweeps like he's an Aussie .



He should settle their then 😂😞😞😞😭😭😭",-1
Pant is so talented but he's always jittery while batting. He needs to learn calmness... I'm happy though,8
"Good to see SRH's bowling coming together - Bhuvi, Rashid, Natarajan, Abhishek

Nol, not you K Khaheel",7
Pants has no game sense..why go after Rashid and lose wicket,7
"Pant: Rasode main kaun tha..

Rashid: Main thaaaaaa BC",5
"**16.4** Rashid Khan to Pant, OUT, oh Pant tries the impossible shot. Rashid has slowed this down and bowled full on middle and leg. He wants to go behind square with the sweep, but he doesn't have pace to work with. Ends up sweeping this to deep square leg **117-5**

RR Pant c Garg b Rashid Khan 32 (27b 2x4 2x6) SR: 118.51",5
All over for DC now,2
Rashid got Pant out at his real age.,10
We played into the hands of Rashid Khan and SRH. Should've seen what KKR did against Rashid. So Brainless man no idea what the think tank was strategising. This is fucking awful.,13
