Timestamp,Username,Comment,Upvotes
2020-10-27T16:45:12+00:00,peter_griffins,ah we're back to daredevils mode i see,4
2020-10-27T16:45:13+00:00,LightningStrikes321,Iyer is a liability on the team. He very rarely is able to score freely whether the team needs it or not,2
2020-10-27T16:45:14+00:00,,Fuccboi Axar gonna pull a Tewatia here,2
2020-10-27T16:45:15+00:00,roha5090,"Vijay Shankar should have been called for Aus tour, as Hardik doesn't bowl much. Could have used a pace all rounder.",2
2020-10-27T16:45:15+00:00,aryanx1234,Stoinis should have bowled 4 overs,1
2020-10-27T16:45:16+00:00,,[removed],4
2020-10-27T16:45:17+00:00,the_pacifier8,"Pant, really needs to work on his fitness, Gayle is running faster than him between the wickets and he is 41 years old.",8
2020-10-27T16:45:22+00:00,,Lol we're not that good as the points table suggests. That's why I was mad after that Chennai game. We just got lucky. Iyers captaincy and batting both are dreadful.,4
2020-10-27T16:45:22+00:00,PortableButton,">142 from 51

Damn! This is gonn be a good chase",2
2020-10-27T16:45:24+00:00,,I'm now watching this match just for the nostalgia,9
2020-10-27T16:45:24+00:00,stylepandi,Delhi doing the reverse kings 11 in the second half. But only difference being that kings 11 were atleast entertaining when they lost.,7
2020-10-27T16:45:28+00:00,shiftysoph,DC whole vibe got wrecked in 1st innings,1
2020-10-27T16:45:29+00:00,anaksr1414,We are a weird and most unpredictable team.,5
2020-10-27T16:45:32+00:00,Rubberducky1239,"Shaw played a huge fucking role in those 2 victories, he gave that momentum which pushed us till there. He is a genuine Aggressive player he is going to be inconsistent",3
2020-10-27T16:45:33+00:00,nopelok,Chad 3D Shankar >>>> Virgin Rayudu,6
2020-10-27T16:45:33+00:00,,bachpan yaad aane laga hai wapas... DD ke dinn..,5
2020-10-27T16:45:33+00:00,TheRichestCuck,DC is getting its NRR fucked,3
2020-10-27T16:45:34+00:00,throwaway_ind_div,Iyer is a confusing talent,6
2020-10-27T16:45:37+00:00,Robert_s_08,Is Axar the Saviour out yet?,2
2020-10-27T16:45:44+00:00,MrWolfsbane,Delhi have sadly (it’s not that sad) lost all steam,5
2020-10-27T16:45:47+00:00,,Iyer is a T20 batsman. Iyer is a T20 batsman. Iyer is a T20 batsman,6
2020-10-27T16:45:51+00:00,mch43,Never had doubts about our our bowling. Was just worried one of the bowlers might go for runs which has happened this season but we have 6th bowler.,3
2020-10-27T16:46:02+00:00,sameer_the_great,Wow Delhi. If this is how you are gonna play from now on then you better stay here than qualify for playoffs.,5
2020-10-27T16:46:03+00:00,darn_it_,This is what u get for senseless Batting order.,4
2020-10-27T16:46:05+00:00,warrenslaya,This is over.,0
2020-10-27T16:46:05+00:00,NachoDipper,bro Iyer fucking sucks... enough said,0
2020-10-27T16:46:06+00:00,rabid_monster,Awwww🙄🙄,2
2020-10-27T16:46:06+00:00,,[deleted],4
2020-10-27T16:46:07+00:00,singhsrb,Iyer played the most worthless innings I have seen in this match. At least I understood the point with the rest.,1
2020-10-27T16:46:09+00:00,Prathameshgtav,I thought this was DC's year..,2
2020-10-27T16:46:11+00:00,moderatedcaucasian,Pant needs to play a Thala-esque innings now. 60*(59) or whatever I won't mind it at all,4
2020-10-27T16:46:12+00:00,Simple-Neck,Now this is all about protecting the NRR,2
2020-10-27T16:46:16+00:00,Naan6,DC are like the popular kids that peaked in high school,9
2020-10-27T16:46:20+00:00,lampard241,That's what the good whiskey is for!,3
2020-10-27T16:46:21+00:00,MISSIONCAP,"RRR 17.0, tf you doin DC",1
2020-10-27T16:46:21+00:00,,"For the love of god, DC please get 146.",1
2020-10-27T16:46:22+00:00,,No Indian player can read Rashid Khan bar Dhawan,7
2020-10-27T16:46:30+00:00,ritwika96,Why would Iyer not back himself to dig out DC out of the hole and demote himself ? Inexplicable,3
2020-10-27T16:46:30+00:00,Adventurous-Region-7,Playing aggressive here is subject to net run rate risk.,3
2020-10-27T16:46:31+00:00,,"DC went from 
-	we will top the table to 
-	we will get top 2 easy to 
-	we will barely qualify",11
2020-10-27T16:46:32+00:00,,Dare I say SRH are like Pakistan? We're consistently unpredictable for some reason at batting and better at bowling,5
2020-10-27T16:46:33+00:00,newtonwaswrong,"India will probably line up with a middle order of Iyer, Samson and Pandey in t20s. Truly tragic.",6
2020-10-27T16:46:33+00:00,_gadgetFreak,Iyer cannot survive when attack is coming from 3 dimensions.,9
2020-10-27T16:46:37+00:00,aryanx1234,Injury premier league,4
2020-10-27T16:46:39+00:00,bunnyoverkill,Axar plz save NRR,1
2020-10-27T16:46:39+00:00,Lifeisboringxxx,Suryakumar died for this!,11
2020-10-27T16:46:47+00:00,Siondroms,"Bruh Delhi's bowling was pretty shit, no slower balls till the fucking 16th over.  Ashwin obsessed with Legspin for some reason smfh",2
2020-10-27T16:46:47+00:00,Character-Top-2963,Shankar also injured wtf ?????,3
2020-10-27T16:46:47+00:00,Winny_Nehemiah22,SRH and injuries 😭,4
2020-10-27T16:46:48+00:00,1337k1d,SOMEBODY THINK ABOUT THE CHILDREN!!!,2
2020-10-27T16:46:51+00:00,Jy_sunny,Shankar AGAIN injured?! Is this man made of glass,2
2020-10-27T16:46:51+00:00,,Another injury what the flying fuck,2
2020-10-27T16:46:51+00:00,Niyazali_Haneef,Bairstow,5
2020-10-27T16:46:51+00:00,MrWolfsbane,Uh oh,2
2020-10-27T16:46:51+00:00,,Shoutout to bair-reddy,4
2020-10-27T16:46:52+00:00,,Shankar and injuries. - A love story,5
2020-10-27T16:46:54+00:00,Naan6,Srh and injuries man,5
2020-10-27T16:46:57+00:00,dannyarr,Poor Bairstow,5
2020-10-27T16:46:57+00:00,princenag25,"3D or Russel, who has a fragile body?",4
2020-10-27T16:46:58+00:00,TheFirstLane,What the fuck? Another hamstring injury,6
2020-10-27T16:46:58+00:00,,[deleted],9
2020-10-27T16:47:01+00:00,punekar_2018,"if axar patel and chahal were to arm wrestle, who would win? i say audience",2
2020-10-27T16:47:01+00:00,staticspacelord,"Oh fuckk, not 3D",5
2020-10-27T16:47:02+00:00,shiftysoph,Love DC but this is just embarrassing. Going from dominating table topping team to this ffs cmon,2
2020-10-27T16:47:02+00:00,theroaringdragon,Pant show them why you were selected in test squad,3
2020-10-27T16:47:03+00:00,Idontlikethisstuff,"Yikes

Vijay Shankar injury",5
2020-10-27T16:47:04+00:00,Eating_Cox,Ooh la la. Well good night bois. Gonna have a cry now.,3
2020-10-27T16:47:05+00:00,,3D's hamstring in trouble. Too many injuries,7
2020-10-27T16:47:05+00:00,vikram2760,Not again Vijay,7
2020-10-27T16:47:06+00:00,RATULVAI,"Ok So, If kkr and kxip Both win 2 of their remaining, So both of them in 16 points.

And DC and rcb loses So they will be Like 13 matches 14 points, So the last match On RCB vs DC will be a knockout match (・∀・)",8
2020-10-27T16:47:07+00:00,mattytmet,Wtf you can't just casually cut to a kid upset that his team are losing being consoled by his mother,3
2020-10-27T16:47:08+00:00,Viratian_Ambush,Hope tomorrow's match will be very interesting to watch. Don't know what the fuck is this match. Isn't it the right time to accelerate the runs?,6
2020-10-27T16:47:08+00:00,rabid_monster,"Srh fans, why so many injuries??",8
2020-10-27T16:47:10+00:00,blumirage,Oh no 3D might have an injury,6
2020-10-27T16:47:10+00:00,redviper96,This man is a walking glass,10
2020-10-27T16:47:10+00:00,neelhere,3D is really delicate. Be it his legs or fingers!,6
2020-10-27T16:47:10+00:00,shawman123,DC batting failed again in a pitch SRH scored 220. Stoinis looked great early on and now looks terrible. Iyer has also blown hot and cold. Pant has barely fired this season and Hetmeyer has not fired this year. Next season they need to add couple of good overseas batsmen. Only Dhawan has played well and he unfortunately failed today.,6
2020-10-27T16:47:17+00:00,,Oh FFS now show us 10 ads play one ball and another 10 ads. Fucking fuckers,6
2020-10-27T16:47:18+00:00,broken_cranium,Oh man! SRH is one cursed team this season.,9
2020-10-27T16:47:20+00:00,anirudh1595,"There is no justification for picking Iyer and Pandey over Suryakumar Yadav. No justification. Not in T20 cricket. 

Today just proved it.",11
2020-10-27T16:47:22+00:00,HBKM55,SRH injurymania strikes again,8
2020-10-27T16:47:23+00:00,MrWolfsbane,"This is literally what happened to Bhuvi

Stop giving me PTSD",17
2020-10-27T16:47:24+00:00,joeispunk,People were praising Iyer for his batting and captaincy. Was even touted for the India captaincy once VK hung up his boots and now people shit on him.,14
2020-10-27T16:47:29+00:00,mnking8,Axar has to see jaddu in every srh bowler now,5
2020-10-27T16:47:30+00:00,mch43,Sun Risers Hamstrings,15
2020-10-27T16:47:30+00:00,DilliKaLadka,We can't chase anything above 125. Who gave Iyer the idea to chase. FFS,2
2020-10-27T16:47:34+00:00,flabcannon,SRH can't catch a break with all these injuries.,3
2020-10-27T16:47:36+00:00,4qua_Dementia,"Lord Axar tinkered with space-time, messing up his hamstring",2
2020-10-27T16:47:36+00:00,vikram2760,why is Vijay Shankar so injury prone?,4
2020-10-27T16:47:39+00:00,,Shankar glass,3
2020-10-27T16:47:41+00:00,uravggstudent,"This is how SRH always have a positive NRR every year. One mandatory match where Warner goes berserk and gets 220 for SRH. And, Rashid comes in and chokes the opposition. They're the real NRR bullies.",6
2020-10-27T16:47:41+00:00,TheAR69,RIP 3D,3
2020-10-27T16:47:42+00:00,fieztel,OMG. What's with SRH and injuries :(,3
2020-10-27T16:47:43+00:00,anaksr1414,WTF are these injuries to SRH man,6
2020-10-27T16:47:45+00:00,Prathameshgtav,Behnchod 3d how many times you get injured,7
2020-10-27T16:47:46+00:00,singhsrb,We are terrible at chasing and should always bat first.,2
2020-10-27T16:47:46+00:00,,Bairstow looked like a mom of 2 there ngl,6
2020-10-27T16:47:47+00:00,,"Shankar going for 5.5 RPO is criminal, wtf DC he’s not even a full time bowler",3
2020-10-27T16:47:50+00:00,gr8astardd,"Mitchell Marsh, Bhuvi, Williamson, Saha, Shankar.

Who’s next, Rashid???",9
2020-10-27T16:47:50+00:00,theroaringdragon,"Oh no, not 3 D too",5
2020-10-27T16:47:51+00:00,mattytmet,Fucking hell SRH have been absolutely cursed by injuries,14
2020-10-27T16:47:52+00:00,Assraj,Use all your powers and pls win tomorrow RCB,5
2020-10-27T16:47:54+00:00,,Why is indian team obsessed with accumulators?,2
2020-10-27T16:47:56+00:00,Robert_s_08, 30 balls ethical 100 incoming,3
2020-10-27T16:47:58+00:00,loki_made_the_mask,CSK fans watching that young boy get the consolation they never got,3
2020-10-27T16:48:00+00:00,Adventurous-Region-7,Shankar got injured again. Hard luck SRH. You lost another all rounder.,4
2020-10-27T16:48:05+00:00,,[deleted],0
2020-10-27T16:48:05+00:00,theotherwhiteafrican,Imagine having to manage a rrr of 17+ halfway through your innings. Eish Delhi...,5
2020-10-27T16:48:09+00:00,bond_bhai,MC BC DC!!,4
2020-10-27T16:48:10+00:00,,No issues we can try to bowl SRH out for 90 and try to chase it down on day 5,3
2020-10-27T16:48:11+00:00,udayEm,"SRH : Yes the team looks perfect and set.
Injuries : Yes.",12
2020-10-27T16:48:11+00:00,cockpit500,But the end of the ipl we should be able to make an injured XI,7
2020-10-27T16:48:11+00:00,Slippin_Jimmy1216,Why are we so unlucky man? Fuck those injuries.,6
2020-10-27T16:48:12+00:00,,Hamstring Hurters Hyderabad,13
2020-10-27T16:48:14+00:00,lifeofpaiii,SRH and injuries this season....very unfortunate,7
2020-10-27T16:48:14+00:00,,Khaleel will always find a way to comeback to the line up lmao,11
2020-10-27T16:48:16+00:00,LightningStrikes321,“The physio and his minions rush into the field”. Lmao cricbuzz wtf,28
2020-10-27T16:48:18+00:00,,If injury substitutes can keep why can't they bowl? Both are equally important,2
2020-10-27T16:48:18+00:00,kalp342,How good are Shankar's red ball stats?,3
2020-10-27T16:48:20+00:00,takitaka007,Somone definitely did vodoo magic against us this year☹️,11
2020-10-27T16:48:22+00:00,Nithinyns,Damn the top 3 hasn't changed since so long.,5
2020-10-27T16:48:23+00:00,joeispunk,"Warner is no coward, he brought himself on",9
2020-10-27T16:48:23+00:00,theabhi16,Saha playing T20 and Pant is playing test. What timeline is this?,10
2020-10-27T16:48:23+00:00,Dikshit101092,Vijay shankar is too fragile,5
2020-10-27T16:48:26+00:00,KrteyuPillai,WARNEY BOWLING,4
2020-10-27T16:48:28+00:00,GlitchPro27,"Okay, so, what if Shaw is actually our lucky charm?",10
2020-10-27T16:48:30+00:00,Jy_sunny,Warner bowl the last ball!!!,6
2020-10-27T16:48:30+00:00,,You know its painful to watch when you need a rrr of 17 in the 12 over,9
2020-10-27T16:48:30+00:00,mch43,Lol David bowling now,5
2020-10-27T16:48:30+00:00,wtfmido,"Man fuck hamstring injuries. Once you tear it, they keep coming back to haunt you. Had a 13cm tear in my right hammy in 2016 and was never able to fully recover",17
2020-10-27T16:48:32+00:00,,Right arm trash,5
2020-10-27T16:48:33+00:00,mnking8,"Warner practicing against rcb

Edit: was expecting legbreak...lol",13
2020-10-27T16:48:33+00:00,mattytmet,"Get Bairstow on to finish the over

I reckon he can bowl some proper dibbly-dobblies",10
2020-10-27T16:48:35+00:00,TheAR69,Warner KEKW,10
2020-10-27T16:48:36+00:00,theturtlefrommidgard,Not another injury pls,3
2020-10-27T16:48:39+00:00,,Hat-trick incoming,4
2020-10-27T16:48:43+00:00,OpinionNoOneAskedFor,Warner taking the piss right now.,7
2020-10-27T16:48:45+00:00,gr8astardd,LMAO he really nearly took a wicket,12
2020-10-27T16:48:46+00:00,,"Iyer the best captain india needs

....we will have a bowl theeeenqs!!  ( when all wins of DC are by defending)",4
2020-10-27T16:48:46+00:00,DoomMachine-77,Warner is giving us the middle finger,17
2020-10-27T16:48:47+00:00,Naan6,Warneyyy,6
2020-10-27T16:48:52+00:00,dank_schon,Pant plays like I do on cricket 19 as a left handed batsman. Get inside the line and play everything to fine leg,6
2020-10-27T16:48:53+00:00,mattytmet,"Warner gonna finish the over?

Please yes",9
2020-10-27T16:48:54+00:00,Zer0wned1,Swear Warner used to bowl medium pace,3
2020-10-27T16:48:55+00:00,blumirage,"Fuck, we lost Mitchell, Bhuvi, Kane for a few matches and 3D through injuries alone. It's like we're fucking cursed.

Edit: And Saha also had a groin pull this match",21
2020-10-27T16:48:55+00:00,Niyazali_Haneef,David Warnie,21
2020-10-27T16:48:56+00:00,,Damn havent seen Warner bowl in quite a long time,6
2020-10-27T16:48:56+00:00,roha5090,r/Cricket you just had your biggest wish of Warner bowling come true.,29
2020-10-27T16:49:00+00:00,wonderwoman0621,Now I’ve seen it all,13
2020-10-27T16:49:01+00:00,,[removed],3
2020-10-27T16:49:03+00:00,shiftysoph,WARNER BOWLING man is really wildin on his birthday,18
2020-10-27T16:49:03+00:00,DevilKillerX,"Yesterday I had a dream that India didn't make it in the Top 4 and semis in T20 WC 2020 and missed out the berth and the spot by 2 points and India's highest run scorer was Kohli followed with Rohit and we still lost and couldn't make it to semis and also we lost to Pakistan badly and beat NZ in our first match and lost against England in a do or die match where we needed to win 4 out of 4 matches and we won the previous 3 but lost to England in the 4th match and got knocked out.It was a bad and shitty dream,hope this doesn't come true.Lol.

Guess who made it to the top 4:-

England

Australia

South Africa

Sri Lanka",4
2020-10-27T16:49:04+00:00,broken_cranium,It's cool to see big players like Jonny doing 12'th man job really well.,8
2020-10-27T16:49:05+00:00,TheRichestCuck,Warner showing 3D how it’s done,5
2020-10-27T16:49:08+00:00,,Shane Warner with his offspin,11
2020-10-27T16:49:08+00:00,,Warner is just taking the piss isn't he? 😂😂😂,22
2020-10-27T16:49:09+00:00,abhinav18,LMAO warner bowling,8
2020-10-27T16:49:17+00:00,wingzero00,Warne(r),8
2020-10-27T16:49:21+00:00,Assraj,David Warner just ripped off Lyon's action lmao,6
2020-10-27T16:49:22+00:00,exisiova,Warner almost got a wicket wtf,12
2020-10-27T16:49:24+00:00,puccabui,Now we have 9 bowlers in lineup now..,10
2020-10-27T16:49:26+00:00,dannyarr,Warner gives his absolute 100 percent for this team,8
2020-10-27T16:49:29+00:00,darn_it_,Did Warner just bowl,4
2020-10-27T16:49:29+00:00,,Delhi Daredevils back on track. Also How the fuck is Rahane such a terrible player of spin?,3
2020-10-27T16:49:29+00:00,fellowmuppetier,"Iyer as a captain has been a big, big flop when it has mattered.  Don't understand the point of giving it to him in the first place.",-1
2020-10-27T16:49:32+00:00,tinselly_bastard_7,What the fuck is with SRH and injuries?,2
2020-10-27T16:49:33+00:00,kmadnow,Warner's economy is better than Rabada's,7
2020-10-27T16:49:33+00:00,,The only reason Shankar should be shitted is on how fragile his body is.,3
2020-10-27T16:49:34+00:00,,I hope Saha and Shankar are both fit:,3
2020-10-27T16:49:35+00:00,neelhere,"DC's next two matches are against RCB and MI. They should be scared, very scared!",3
2020-10-27T16:49:35+00:00,TheMissingName,Absolutely dangerous levels of bants on display.,3
2020-10-27T16:49:36+00:00,DilliKaLadka,Selectors would be zoom calling each other to pat each other's back.,2
2020-10-27T16:49:37+00:00,uravggstudent,"Shane WarneR, is that you?",5
2020-10-27T16:49:37+00:00,anaklusmos_wielder,"warner : "" fine ill do it myself """,8
2020-10-27T16:49:39+00:00,76_67,Warner doing it all today lmao.,1
2020-10-27T16:49:42+00:00,moderatedcaucasian,Is there someone named Warnest out there?,4
2020-10-27T16:49:42+00:00,rabid_monster,Warner bowling good actually damn👌🏾👏🏽👏🏽,1
2020-10-27T16:49:44+00:00,,Should have caught. One more over plz,1
2020-10-27T16:49:45+00:00,Truthgamer2,Rashid to finish,2
2020-10-27T16:49:47+00:00,I_Feed_Pigz_Pork,David Warne,7
2020-10-27T16:49:48+00:00,,Chill guys Axar is on the crease. He has chased 17 rpo before this season.,1
2020-10-27T16:49:49+00:00,ritwika96,Now give 3Ds overs to Kanos,5
2020-10-27T16:49:51+00:00,akhilvarmad13,3 bowlers injured now ffs,5
2020-10-27T16:49:53+00:00,kawanish,SRH has sold it's player's souls to the devil for a victory,3
2020-10-27T16:49:53+00:00,supermember866866,Warner Most passionate and craziest out there,9
2020-10-27T16:49:54+00:00,warrenslaya,SRH have half a squad and are still in contention. Its a miracle.,8
2020-10-27T16:49:55+00:00,Jayasurya7a,Looks like RCB vs DC is going to be a knockout the way both the teams are playing currently,6
2020-10-27T16:49:55+00:00,punekar_2018,"v raju, axar patel and y chahal go to a gym. hayden bunches them together and does a bench press with the bundle.",3
2020-10-27T16:49:58+00:00,,Wow. Since when did CSK start playing in blue?,1
2020-10-27T16:49:58+00:00,NachoDipper,"all joking aside the parity in the IPL is wonderful. Does any other sports league in the world compete? Top to bottom, IPL is very deep.",7
2020-10-27T16:50:02+00:00,peter_griffins,ive now seen warner bowl legspin medium pace and off spin,4
2020-10-27T16:50:02+00:00,kapilfan,Warner - “I can’t do anything wrong today. Let me bowl and test my luck”,8
2020-10-27T16:50:04+00:00,Ritwicked,This has been such an unfortunate season for SRH.,5
2020-10-27T16:50:05+00:00,,"Was looking at the remaining fixtures just to see if a miracle is on the cards but lmao it's so insanely unlikely that SRH qualify from here.  
 
Both KKR and KXIP play RR and CSK in their remaining games. RR can win both their matches with it being a concern for SRH, KKR and KXIP can only win one at most, CSK can do whatever it wants, and SRH must win both their remaining games which just happen to be against the table toppers.",6
2020-10-27T16:50:05+00:00,,Thanks Delhi. Very cool. So 2 shots at the finals for us inshallah,9
2020-10-27T16:50:06+00:00,AnyoneButSanjuManju,I'm glad that kid wasn't a CSK fan.,7
2020-10-27T16:50:07+00:00,TheAR69,Pant playing a forward defence. Wow.,3
2020-10-27T16:50:16+00:00,darn_it_,FYI First time Warner bowling in T20.,4
2020-10-27T16:50:17+00:00,exisiova,Solid forward defence from Pant.,1
2020-10-27T16:50:19+00:00,ozzymandias26,Pant making sure he gets a good practice before the Australia tour,2
2020-10-27T16:50:19+00:00,wonderwoman0621,"Yer a wizard Rashy.

Imma wut?",3
2020-10-27T16:50:21+00:00,vikram2760,"Rishabh ""Thala"" Pant",1
2020-10-27T16:50:25+00:00,wingzero00,RR above 15 and Pant pulls out a forward defence.,-1
2020-10-27T16:50:25+00:00,roha5090,"You either get dropped for a weak form or live long enough to see yourself an all rounder - said Warner, prolly.",1
2020-10-27T16:50:26+00:00,shiftysoph,"Rashid still in the single digits run OP, man gets upset when he goes for single 😂",3
2020-10-27T16:50:27+00:00,vvb_12,With the amount of T 20 matches Rashid Khan plays every year across globe and his age I feel he will get 1500 wickets in T20 at the end of his career !!! (May be more lol),10
2020-10-27T16:50:29+00:00,TheAR69,Reminds me of a left handed Dhoni.,1
2020-10-27T16:50:30+00:00,Siondroms,"Pant should play some 70(50) and protect the NRR as much as possible, would be nice to get him back in touch",2
2020-10-27T16:50:31+00:00,A_M-a-n,"Keep Pant away from Dhoni, please!!",3
2020-10-27T16:50:36+00:00,Uncomfortablekid,Man if pant ends up playing a blinder today what a tight slap it would be for the people who have been critizing him... Still remember hearing on stump mic while he was batting with hardik pandya in wc19 bhaiya daar lag raha hain.... He's fucking 23 and already gave him the Dhoni taq... Let him breathe for fuck sake,17
2020-10-27T16:50:40+00:00,,Saha looks like ross geller.,1
2020-10-27T16:50:43+00:00,Adarsh_lee98,Arey yaar someone open a DC depression thread coz it's about to kick in.,7
2020-10-27T16:50:45+00:00,flexice,Pant started practising for Australia test already.,5
2020-10-27T16:50:46+00:00,Wazflame,What happened to Warner's leg spin with the 'Shane Warne' run up?,3
2020-10-27T16:50:47+00:00,,It would be funny if Delhi or rcb don't end up making it,7
2020-10-27T16:50:51+00:00,,"SRH and injuries, name a better pair. What the hell.",10
2020-10-27T16:50:53+00:00,,[deleted],13
2020-10-27T16:50:55+00:00,warrenslaya,David Warner mystery spinner,11
2020-10-27T16:50:59+00:00,djjd1996,"Thala pant, playing for the nrr",4
2020-10-27T16:51:00+00:00,MISSIONCAP,Rashid going for the kill,4
2020-10-27T16:51:03+00:00,Niyazali_Haneef,Inshallah boys defended well.,8
2020-10-27T16:51:09+00:00,,I remember KP mocking Kohli for having chicken legs and Kohli saying that he hasn't tore his hammies even once and how he can run as fast as anyone else. Respect to Kohli for taking care of his body like a temple.,18
2020-10-27T16:51:10+00:00,,How many srh players are now injured??,4
2020-10-27T16:51:11+00:00,fuckthisshit0102,Rashid is surely gonna get 🐐 status in IPL spinners if he continues this.,36
2020-10-27T16:51:20+00:00,NachoDipper,"Delhi is of course losing to MI and RCB, what a limp dick ending to a promising start... feels bad man",9
2020-10-27T16:51:21+00:00,redviper96,Absolute masterclass from Rashid,5
2020-10-27T16:51:21+00:00,Rubberducky1239,Rashid overs aside also they are not showing intent only i mean they would not have chased 140 also this way,3
2020-10-27T16:51:24+00:00,jGrapik,Some users here jinxed DC,3
2020-10-27T16:51:25+00:00,Jy_sunny,Rashi not going to let Siraj hold onto his record :(,6
2020-10-27T16:51:27+00:00,JohnSeen1996,Haters gonna hate but Pant has convinced me his selection in Test Team ❤️,17
2020-10-27T16:51:29+00:00,duckpupper,Net RR goes brrrrrrrrr,7
2020-10-27T16:51:33+00:00,awesomeredditor777,Pant is on 20(22) chasing 220,8
2020-10-27T16:51:34+00:00,chano4,Delhi are shit,2
2020-10-27T16:51:34+00:00,MonkeyDsarva,Rashid is such a legend,5
2020-10-27T16:51:35+00:00,caesarisape,Will they bowl Williamson? What do you guys reckon?,13
2020-10-27T16:51:38+00:00,,"In a chase of 220, Rashid bowls his quota for 7/3. Mind blown",12
2020-10-27T16:51:48+00:00,harsh1387,Stupid play all through.. last 2 balls of Rashid left and you wanna slog now.. fuckn morons.,9
2020-10-27T16:51:50+00:00,,Nice catch,1
2020-10-27T16:51:50+00:00,Truthgamer2,Rashid is a BEAST,7
2020-10-27T16:51:51+00:00,,[removed],4
2020-10-27T16:51:52+00:00,,Lol at axar trying to hit Rashid,8
2020-10-27T16:51:57+00:00,,This is just painful to watch. Ouch,3
2020-10-27T16:51:57+00:00,supreeth106,I am guessing DC are not going to release the post match team meeting with Ponting.,8
2020-10-27T16:51:59+00:00,Naan6,Can someone test rashid to see if he is human,11
2020-10-27T16:52:03+00:00,captain_kiru,Delhi not even going for their nrr,3
2020-10-27T16:52:03+00:00,GTX1080SLI,Lol,2
2020-10-27T16:52:05+00:00,KelvinRkrab,Decalre kardo yar better he,8
2020-10-27T16:52:06+00:00,1234hrishipai,is that the 3rd soft dismissal?,1
2020-10-27T16:52:08+00:00,,SRH NRR GOES BRRRRRRR,3
2020-10-27T16:52:09+00:00,rabid_monster,"Delhi, are you even gonna make 150 at this rate?
r/cricket: Damn boi!",3
2020-10-27T16:52:09+00:00,mrfreeze2000,Lmao I have a feeling DC might just crash out,6
2020-10-27T16:52:09+00:00,kawanish,Rashid ain't no Jadeja,7
2020-10-27T16:52:13+00:00,neelhere,Rashid's figures are incredible even for a test match.,9
2020-10-27T16:52:15+00:00,TheKingslayer19,"Charge down, move side to side, do a switch hit, at least try something ffs. You cannot play 4 overs for 7 runs chasing 219 ffs",7
2020-10-27T16:52:21+00:00,,Rashid man,4
2020-10-27T16:52:22+00:00,Truthgamer2,"Man, SRH really struck gold in 2017 with Rashid",24
2020-10-27T16:52:23+00:00,gryffindorito,Warner’s intent on 🔥 🔥 🔥,10
2020-10-27T16:52:24+00:00,awesomeredditor777,Waiting for Ponting speech,3
2020-10-27T16:52:26+00:00,nouseridavailable,Everyone else is getting out and Pant is getting criticised here. WOW,2
2020-10-27T16:52:29+00:00,PlsDontBraidMyBeard,Squat Catch,2
