Timestamp,Username,Comment,Upvotes
2020-10-27T15:34:05+00:00,,No wicket for RABADA.,1
2020-10-27T15:34:05+00:00,bowlbat,Warner with the pornstache.,2
2020-10-27T15:34:05+00:00,IamPsyduck,"A good comeback from DC. 

From 230-250 to only 220.",2
2020-10-27T15:34:08+00:00,bond_bhai,Come on man... i thought 230. Not even 220...,3
2020-10-27T15:34:11+00:00,Coffeebeans2d,Has Pants put on more weight?,0
2020-10-27T15:34:12+00:00,adxx12in,RIP Rabada's streak,0
2020-10-27T15:34:13+00:00,chut_has_no_religion,they should have easily reached 240,0
2020-10-27T15:34:14+00:00,NachoDipper,and the streak is broken!!,2
2020-10-27T15:34:15+00:00,joeispunk,DC dodged a bullet. They looked like conceding 240 at one stage,1
2020-10-27T15:34:17+00:00,ddhenier,My man Rabada with Siraj stats today :O,3
2020-10-27T15:34:19+00:00,aditya_7726,"Wicketless Rabada with going for 54 runs..

WOW",1
2020-10-27T15:34:19+00:00,ritwika96,We score 219 and people still complain that we should’ve scored 240. Shut the fuck up.,7
2020-10-27T15:34:19+00:00,66problems99,not even 220 smh,1
2020-10-27T15:34:19+00:00,singhsrb,We pulled it back a bit at the end lol! They are 20 runs short lol.,0
2020-10-27T15:34:20+00:00,peter_griffins,Wicketless rabada :(,5
2020-10-27T15:34:22+00:00,TheFirstLane,"Rabada streak is broken. SRH, the Brock Lesnar of IPL",2
2020-10-27T15:34:24+00:00,Truthgamer2,Horrible death batting given their position 14 overs in,4
2020-10-27T15:34:25+00:00,canadaisnubz,No wicket for Rabada.,2
2020-10-27T15:34:27+00:00,,"Kane 11*(10)

Should have done better. Expected 10 more runs",6
2020-10-27T15:34:27+00:00,hemantp,Iyer's body language is pretty poor for a captain,4
2020-10-27T15:34:28+00:00,staticspacelord,Rabada streak RIP,5
2020-10-27T15:34:28+00:00,TheRichestCuck,Drop Rabada next game ffs  /s,3
2020-10-27T15:34:29+00:00,anirudh1595,"Disappointing finish but still 50 above par. Atrocious bowling in middle overs and unreal batting from Warner and Saha. 

Also, Rashid factor.",0
2020-10-27T15:34:30+00:00,User9333,[I was correct](https://www.reddit.com/r/Cricket/comments/jizuot/match_thread_47th_match_sunrisers_hyderabad_v/ga9viid?utm_medium=android_app&utm_source=share&context=3),3
2020-10-27T15:34:30+00:00,,Strike rate of 140 is good by Pandey’s standards,0
2020-10-27T15:34:30+00:00,Siondroms,"Bruh, 220 to chase, will take an exhibition of batting to get across, SRH already know Slow balls will kill the chase, they should win it comfortably",2
2020-10-27T15:34:32+00:00,hidden_kid,"RCB fans, having Déjà vu seeing DC bowling.",3
2020-10-27T15:34:33+00:00,OftenShady,So the Rabada streak ends....,7
2020-10-27T15:34:34+00:00,KrteyuPillai,Pandey looks properly disappointed in himself.,2
2020-10-27T15:34:34+00:00,M_Batman,No........ Rabada goes wicketless. Look how they massacred my boy.,7
2020-10-27T15:34:34+00:00,tdlan,Open with Stoin you cowards,3
2020-10-27T15:34:35+00:00,,Pandey SR watch: 142,1
2020-10-27T15:34:35+00:00,amitbhatt25,Fuck it send Stoinis to open Rahane gonna fuck up the chase,2
2020-10-27T15:34:35+00:00,pinguteshwar,Ok I was scared 240-250. 218 is still doable but DC needs to put it's foot down.,2
2020-10-27T15:34:36+00:00,,Finally we ended Rabada’s streak!,5
2020-10-27T15:34:36+00:00,,Should have sent Williamson at 3,5
2020-10-27T15:34:37+00:00,berbathlicism,Are we allowed to say on this particular subreddit that Williamson cost them 10-15 runs minimum or is that a bannable offence.,31
2020-10-27T15:34:38+00:00,Naan6,Still think they did good even though it slowed down. Srh Bowlers game to loose I reckon,7
2020-10-27T15:34:38+00:00,deep639,two batsmen went at 194 strike rate facing more than 40 balls. The other guy faced 30 balls and his strike rate is 140.,0
2020-10-27T15:34:41+00:00,bhadva,"No 243+ score

*Moral Victory*",6
2020-10-27T15:34:42+00:00,sxd827,44 off last 5 overs. Good finish for SRH standards.,5
2020-10-27T15:34:43+00:00,mnking8,23 runs last 3 overs is a steal for dc,8
2020-10-27T15:34:44+00:00,theroaringdragon,Rabada scored a 50 today,1
2020-10-27T15:34:45+00:00,A_Deku_Stick,Should have gotten 240+ with the starts Warner and Saha gave.,6
2020-10-27T15:34:46+00:00,ajye,23 off the last three when you are only two down?,7
2020-10-27T15:34:46+00:00,,I feel like bowlers' bad days get more criticised than batsmen's.,2
2020-10-27T15:34:47+00:00,fuckthisshit0102,"23 of the last 3 is underwhelming for any team, but kinda expected and happy for SRH Fans.",8
2020-10-27T15:34:50+00:00,JohnSeen1996,Imagine saying Suryakumar is better than Pandey lmao he just outdid Williamson now 😭😂😭😂😭😂,-9
2020-10-27T15:34:53+00:00,rahulrossi,"All these comments about we should have could have scored 230/240, we don't have big finishers like other teams. So this i in line with what is expected.",7
2020-10-27T15:34:53+00:00,,I hope we can learn from the first innings and find ways to improve our bowling.,1
2020-10-27T15:34:53+00:00,Bhosadchod69,moral victory for Delhi,-1
2020-10-27T15:34:54+00:00,pr0crast1nater,Pandey at 5 will be useless for Indian T20 unless it's a rescue from collapse.,4
2020-10-27T15:34:55+00:00,Lionheart008,26-1,0
2020-10-27T15:34:56+00:00,cyberchamp_210,"SRH batted amazingly but 44 in the last 5 is pathetic with the start they got.

Still it’s a competitive total",3
2020-10-27T15:34:56+00:00,Zephyrv,Wow Rabada's first wicketless game,4
2020-10-27T15:34:58+00:00,0onoodlesw,Great from Kane Williamson there 👍. Really justifies one of the IPLs top run scorers in the last two years being dropped doesn’t it.,-3
2020-10-27T15:34:59+00:00,porn-senpai,"If DC end up collapsing this game, it will be a big dent in the NRR for them.",3
2020-10-27T15:35:02+00:00,breakinb,"44(31) and 10(11) is terrible after that start from SRH. 

Pandey really shouldn't be a finisher for India in the T20s lol",4
2020-10-27T15:35:03+00:00,Idontlikethisstuff,"Shit last over tbh

Fairly underwhelming finish but Delhi will need Dhawan or Pant to go big today",1
2020-10-27T15:35:04+00:00,_adviti_,Pant's revenge innings incoming,3
2020-10-27T15:35:05+00:00,lifeofpaiii,220 is a great score people.....,3
2020-10-27T15:35:07+00:00,DilliKaLadka,Lol Kane batted worse than Pandey and yet everyone is going after Manish.,11
2020-10-27T15:35:09+00:00,gr8astardd,"This has to be some of the worst death batting I’ve seen tbh. You have 8 wickets in hand, Saha and Warner have left out the perfect platform to make 230, all you need to do is hit some good aerial shots and try clear the rope, or be a bit more attacking. If you get out, that’s fine, 5 overs left with the likes of Rashid, Shankar, Samad and Holder to come. 

This is really underwhelming given the start, they didn’t even make 220. Maybe the pitch slowed down, then fair enough. Otherwise, poor stuff considering how much pies there were too",4
2020-10-27T15:35:10+00:00,AtomR,Rabada is not a bot. Confirmed.,4
2020-10-27T15:35:10+00:00,SexxyBlack,DC will chase this with 2 overs left after Rahane scores 102 (30).,10
2020-10-27T15:35:11+00:00,,">KG Rabada goes wicket-less for the first time in 26 games.

Man, DC are so done for this season.",3
2020-10-27T15:35:12+00:00,ze_shotstopper,Williamson wasted balls,7
2020-10-27T15:35:14+00:00,afex1808,Rabada to be dropped,1
2020-10-27T15:35:16+00:00,,Rabada Academy,1
2020-10-27T15:35:21+00:00,udayEm,Weights transferred to Bowlers,3
2020-10-27T15:35:24+00:00,blumirage,They scored 219 and are still being criticized by the gurus at r/cricket,17
2020-10-27T15:35:25+00:00,,Should've been over 220 but ok,2
2020-10-27T15:35:27+00:00,TyroshiSellsword,"Are you kidding 2 wickets in the power play and it's a goneski, they also have Rashid.",2
2020-10-27T15:35:31+00:00,,220 is a pretty good total. Sure we should have had 10-20 more but we take what we can get and it’s a sign the pitch is evolving to the bowling sides favour.,3
2020-10-27T15:35:34+00:00,,If India plays Pandey at 5 for T20s there is no way India has a chance of winning the T20 WC,1
2020-10-27T15:35:36+00:00,sid_kaps,"Guys, if SRH does win, what happens to the points table then ?",3
2020-10-27T15:35:38+00:00,warrenslaya,If Rabada is the best bowler in this generation then it shows how the standards have dropped. Previous generation's best bowlers never had an off day. You never saw Malcolm Marshall get hammered.,-12
2020-10-27T15:35:46+00:00,,Love to see overconfident DC fans being salty and sad.,8
2020-10-27T15:35:46+00:00,santoryuroronoazoro,Lmao I'm seeing people criticise Pandey more than williamson,2
2020-10-27T15:35:48+00:00,RLKay,"We're not 20 short, ffs. If we can't defend 220, we don't deserve to stay in this tournament anyway.",9
2020-10-27T15:35:48+00:00,singhsrb,We need 200 from 16 overs and 20 from the Rashid 4 overs without losing any wicket.,6
2020-10-27T15:35:52+00:00,Krs1218,Pitch slowed up or realised you have to for slower balls?,3
2020-10-27T15:35:54+00:00,fellowmuppetier,Of course Rabada goes wicketless for the first time in 26 games when I make him my fantasy captain.,21
2020-10-27T15:35:55+00:00,namastehello,Today DC will pay the price of Saha having once in a lifetime kind of inning.,4
2020-10-27T15:35:56+00:00,,"**Kagiso Rabada**

2 May 2017 - DC v SRH (Delhi) - 4-0-59-0

Since then has taken at least one wicket in his next 25 games: 98-1-763-51 (ave 14.96, S/r 11.61, Eco 7.73)

Tonight, 27 Oct 2020 - DC v SRH (Dubai) - 4-0-54-0

[Source](https://mobile.twitter.com/mohanstatsman/status/1321112864204247041)",5
2020-10-27T15:35:57+00:00,hobabaObama,Can't believe I am going to say this but Williamson was the worst batsmen today... With Saha and Manish Pandey having played full innings...,10
2020-10-27T15:35:58+00:00,A_M-a-n,"Excellent last over.

And that marks the end of Rabada's wicket taking streak.",4
2020-10-27T15:35:58+00:00,Idontlikethisstuff,"Pandey's innings wasn't great but I swear people just need an excuse to abuse him

Far better innings than Williamson but who gets all the flack?",9
2020-10-27T15:35:58+00:00,MISSIONCAP,Chad SRH batsmen were too much for virgin Rabada,6
2020-10-27T15:36:00+00:00,TheRichestCuck,23 of the last three is a STEAL,9
2020-10-27T15:36:00+00:00,GlitchPro27,Can we borrow RR to chase this please?,4
2020-10-27T15:36:02+00:00,Robert_s_08,OG Shami can now catch up to Rabada,7
2020-10-27T15:36:02+00:00,User9333,You know your team is in trouble when Marcus Stoinis of all people is your most economical bowler,8
2020-10-27T15:36:06+00:00,porn-senpai,Reactionary Kohli would drop Rabada next game and pick Isuru Udana instead.,5
2020-10-27T15:36:07+00:00,maffzlel,"Stoinis and Dhawan to open, Pant at 3, gotta be the way to go.",8
2020-10-27T15:36:08+00:00,,OpenThePant. PantToOpen,4
2020-10-27T15:36:08+00:00,mattytmet,Now to see if everyone is right that this is a flatty where 210 is par or if maybe SRH actually just batted well,5
2020-10-27T15:36:09+00:00,,Pant should open,3
2020-10-27T15:36:13+00:00,sukumarkarne,Rabada not getting a wicket sums up DC's bowling performance today!,5
2020-10-27T15:36:15+00:00,weedhead2,"I think with any sort of acceleration, they would've got 240. Like 2-3 overs of 15+ in overs 16-20 (they only got 1 15 run over).",4
2020-10-27T15:36:16+00:00,thesmallprint13,Get DaOne early and SRH will have two...points.,3
2020-10-27T15:36:18+00:00,Rubberducky1239,Our batters if want to come to form this could be about right fucking time. Dont send Rahane to open pls,4
2020-10-27T15:36:24+00:00,,Man that Pandey Saha partnership was HARD,4
2020-10-27T15:36:26+00:00,Silly-Point,"As crazy as it sounds, 219 feels like a win for DC.",10
2020-10-27T15:36:27+00:00,theabhi16,I need Pant to score 100 :(,8
2020-10-27T15:36:31+00:00,,"This thread sounds like an indian dad when his son gets 95/100 , beats him up for not getting 100/100",27
2020-10-27T15:36:38+00:00,DilliKaLadka,Please don't be under any illusion. We aren't chasing this. The best case scenario would be to not fuck up NRR too much,6
2020-10-27T15:36:40+00:00,Memexp-over9000,Let's gooooooooooo! Let's shake up the table baby!!,6
2020-10-27T15:36:41+00:00,takitaka007,"Given our batting record this season ,we would take anything above 160.",16
2020-10-27T15:36:45+00:00,mnking8,I hope ajju plays a blinder of a test innings. /s,6
2020-10-27T15:36:46+00:00,canadaisnubz,I hope everyone realizes this score is not at sharjah. It's at Dubai.,8
2020-10-27T15:36:47+00:00,MISSIONCAP,Pant should open lmao 🤣,9
2020-10-27T15:36:47+00:00,poly-cosmos,Don't have any hope for SRH but another injury? Damn,3
2020-10-27T15:36:56+00:00,,"Rashid/Holder should have come in place of Kanos. As much as I like Kanos, today wasn't the right situation to send him at no. 4",11
2020-10-27T15:36:59+00:00,metrelongschlong,Have you heard of the tragedy of Delhi Capitals?,8
2020-10-27T15:37:05+00:00,gungly,Budhiman Saha. Khelo dimag se,7
2020-10-27T15:37:06+00:00,,"With Rahane in the team and Pant out of form, ain't no way we chasing this shit. Lmao",4
2020-10-27T15:37:09+00:00,NachoDipper,We couldn't even chase 170 lmao. SRH are 50 over that,2
2020-10-27T15:37:09+00:00,canadaisnubz,How often do you see Rabada as the most expensive?,3
2020-10-27T15:37:13+00:00,huthutmike39,"At the start, SRH would have easily taken 220, but halfway through they looked set for more",7
2020-10-27T15:37:15+00:00,Robert_s_08,Deshpande bowling 18th over sums up DCs bowling today,4
2020-10-27T15:37:25+00:00,mch43,"All the idiots posting ""Williamson fans hating Pandey"" etc, see when those comments are posted. Most of those comments were when Pandey was 19(19) or something.",4
2020-10-27T15:37:28+00:00,darkvader19,"All you Pandey haters, we saw how hard Koach and ABD found it to accelerate on this pitch... 44 of 31 is not bad by any means

This sub is so fucking radical and wants every player to be a Pollard",6
2020-10-27T15:37:29+00:00,WeaponX23X,Heytmyer need to bat @3 instead of Iyer,6
2020-10-27T15:37:29+00:00,funnyBatman,"I mean, can we give some credit to DC's bowling in the last 5...",5
2020-10-27T15:37:29+00:00,singhsrb,So the equation is 2 boundaries an over of anyone not called Rashid.,3
2020-10-27T15:37:32+00:00,R2RBoy,"220 is a mountain to climb when you have 4 overs of Rashid to handle.  
Sunrisers will have to shit the bed completely. Like absolutely cause an avalanche of shit to cascade throughout every room in the house to lose this.  
  
Also, word for Saha. Really underrated throughout his career. In any era without Dhoni, he'd have a lot more India appearances",20
2020-10-27T15:37:33+00:00,kapilfan,"The way Saha played today, he is on something :) definitely not MSD though",4
2020-10-27T15:37:33+00:00,nikkhelsai1,Kanos 💔💔,3
2020-10-27T15:37:34+00:00,Anurag6502,Idk why but I'm hopeful about our chances to chase this down.,6
2020-10-27T15:37:34+00:00,AtomR,Even a 65(35) type inning would suffice for Pant today.,4
2020-10-27T15:37:45+00:00,ssharma123,Imagine if DC lose all their remaining matches and get knocked out,3
2020-10-27T15:37:48+00:00,,"Williamson did not play 31 balls neither 18 balls to get settle. And he was also giving strike to Pandey in beginning. Lol. 

Manish pandey apologist trying to frame Williamson here . Ignoring what happened in match",-8
2020-10-27T15:37:48+00:00,nopelok,Ok. Which one y'all jinxed DC's bowling?,3
2020-10-27T15:37:52+00:00,catinho99,Don’t worry Iyer the dew will help,1
2020-10-27T15:37:56+00:00,,Where are the Pandey haters now?!?!?!,1
2020-10-27T15:37:59+00:00,anaksr1414,Sometimes I feel even Pandey is confused about whether he needs to play defensively or aggressive. I mean guy can smash the ball but on most occasions goes into a shell and builds pressure on him and others. I guess aggressive Pandey should be the way forward for him.,3
2020-10-27T15:38:00+00:00,KrteyuPillai,Dc aren't good chasers imo. I feel like the pressure of 220 is going to crack them. Especially if Dhawan doesn't fire,2
2020-10-27T15:38:02+00:00,rmU6Rz0ztS,Rabada and Nortje were always going to finish well. It was that good Stoinis over that kept the game alive.,7
2020-10-27T15:38:05+00:00,JustStrolling_,"In retrospect now, Samad or Holder should've come in for Williamson",9
2020-10-27T15:38:07+00:00,wtfmido,Good guy kane helping dc by scoring at <100,7
2020-10-27T15:38:07+00:00,touseeff,I think varying pace is the way here and Delhi just figured it out late. That's a big reason for the slow rate in last five,10
2020-10-27T15:38:17+00:00,SilentCaveat,Iyer in post match interview: Rabada leaked runs today,16
2020-10-27T15:38:26+00:00,,[deleted],2
2020-10-27T15:38:27+00:00,anti-shinigami,True INTENT,0
2020-10-27T15:38:27+00:00,thesmallprint13,Six points separating all 8 teams. That's quite close right? Or has there been a closer table?,11
2020-10-27T15:38:28+00:00,singhsrb,I want them to not take it deep like the KKR match and keep smashing regularly. There is no room for taking 30 balls to make fuck all like Iyer and Pant did that game.,2
2020-10-27T15:38:31+00:00,jai302,People here commenting as if 219 is a disappointment. Sure they slowed down but it's still the highest score on this ground by 13 runs IIRC. Good going SRH.,8
2020-10-27T15:38:32+00:00,sozzler,"Is Bairstow injured? 
Looks like Saha played a blinder.",8
2020-10-27T15:38:36+00:00,anirudh1595,"Curious to see how Iyer plays today. Far too often in the past he's gotten away with slow knocks citing the ""anchor"" excuse. I'm not expecting him to score a 100, I just want him to play with intent. Barring Sharjah vs KKR, he's showed no intent in any game. 

Today there is no bs about anchoring, especially with Rahane being one of the top three batsmen.",4
2020-10-27T15:38:38+00:00,iMangeshSN,"/r/cricket is actually surprised that Manish Pandey can't change his gears. And he's going Australia as our death over specialist in LoI. 

God save India.",2
2020-10-27T15:38:38+00:00,Rubberducky1239,"I see Mumbai fans finding some solace in us getting a beating when they have just gotten belted by Stokes and Samson. Understandable, have a great day.",3
2020-10-27T15:38:44+00:00,,"That was a pretty decent closing from SRH ngl.

0-10 : 113/1 with 6 overs of powerplay

11-20: 107/1 with no powerplay",10
2020-10-27T15:38:45+00:00,,"Our bois did good 

Proud of them scoring 219 at the biggest ground of the tournament",13
2020-10-27T15:38:50+00:00,banjowashisnameo,Open with Pant you cowards,2
2020-10-27T15:38:58+00:00,,sometimes this sub has such a big hate boner for indian players for idk whatever reasons... some are trolling Pandey after playing with a SR of 142 whereas i haven’t properly seen even few trolling Williamson,13
2020-10-27T15:38:59+00:00,poly-cosmos,Pant redemption arc today?,3
2020-10-27T15:39:18+00:00,MasonParker420,Pant gonna carry Delhi alone today to shit on the Indian selectors,2
2020-10-27T15:39:18+00:00,Lazy_Left_Eye,"So top 3 teams have clearly visible weak points now 

MI : Have problems with defending scores

DC : No plan B when bowlers are under the pump

RCB : No real boundary scorers in the middle overs",10
2020-10-27T15:39:20+00:00,MISSIONCAP,219 is a good score ffs,4
2020-10-27T15:39:21+00:00,ztaker,25 matches in a row for atleast one wicket ..streaks ends today for rabada? is this a record?,5
2020-10-27T15:39:33+00:00,sohompramanick,DC's bowling has suddenly become poor; at such a crucial stage of the tournament. They are giving away lot of runs in the past 3-4 matches.,5
2020-10-27T15:39:34+00:00,,Warner hunting Rabada for 22 was my highlight. Smashed 5 boundaries in 1 over.,12
2020-10-27T15:39:40+00:00,warrenslaya, Does anyone have any idea why Abdul Samad is getting so many chances? Its nice to pay so much faith in an 18 year old but he hasn't performed even once.,4
2020-10-27T15:39:46+00:00,,The sweet sounds off Saha's bat is why I love cricket!,5
2020-10-27T15:39:51+00:00,philosifyme,Where was this batting display against Kings XI? I think they batted to make up for the innings they missed in the last match,5
2020-10-27T15:39:53+00:00,Ive_abandonedMyChild,No way is Delhi chasing that total with pant being absolute shite,3
2020-10-27T15:39:58+00:00,anaksr1414,Kondlanna will be so happy with this effort today,1
2020-10-27T15:40:04+00:00,sunnywayne,"Is it the same pitch used for RCB Vs CSK match??
Or different one?",6
2020-10-27T15:40:19+00:00,sagguonreddit,"Saahasi Saha

T: brave Saha",1
2020-10-27T15:40:20+00:00,cinemasosa,"Can somebody please do the math, by how many runs should DC lose for rcb to end up in 2nd place today?",6
2020-10-27T15:40:22+00:00,DilliKaLadka,Gotta score 80 in PP without any wicket to reduce the Quantum of Loss^^TM,1
2020-10-27T15:40:29+00:00,i_like_chicken_69,Ootl whats with Marlon Samuel's controversy?,1
2020-10-27T15:40:37+00:00,Smurfiness,C'mon Pant. Plis.,3
2020-10-27T15:40:38+00:00,burgthebeast,Pant has to open today no questions asked. Cannot have rahane making 8 off 10,10
2020-10-27T15:40:41+00:00,,Srh has 7 bowling options today,4
2020-10-27T15:40:42+00:00,MISSIONCAP,"DC, like MI peaked too early in the tournament  imo",13
2020-10-27T15:40:48+00:00,DeadlyPantsOfSea,Pandey is India’s no. 5 / no. 6! Doesn’t make any sense. He will play tuk tuk at the end in the WC ?,5
2020-10-27T15:40:49+00:00,bowlbat,219 + GST is like 275. Calm down guys.,29
2020-10-27T15:40:56+00:00,,"DC looses this one and then next two games against MI and RCB..... Dc are in real trouble... started the tournament with a bang and are now finding themselves in trouble.

This is why IPL is unpredictable",11
2020-10-27T15:40:58+00:00,hidden_kid,"SRH bowling is kind of CSK, there bowler will easily be able to take pace of the bowl considering most of them bowl around 130's. No way DC can win this game, they didn't learned from RCB's mistake on this pitch. Their batting line up isn't capable of chasing 170+ score that's a first thing second thing chasing on this pitch. Huge huge mistake by taking bowling first.",-2
2020-10-27T15:41:05+00:00,,Don't see how Delhi chase this down with 4 overs of an in form rashid,5
2020-10-27T15:41:23+00:00,,I want Delhi to lose by a run but Pant score 180. Got to keep the competition spicy but simultaneously shit on the selectors,14
2020-10-27T15:41:31+00:00,Hariii_,I missed SRHs batting. Should've watched the game instead of playing fifa ffs,14
2020-10-27T15:41:49+00:00,The_Truthhurts87,"I don't see Capitals getting more than 180 on this pitch.

That was some unreal batting from Saha and Warner .",6
2020-10-27T15:42:02+00:00,Idontlikethisstuff,The purple and orange cap graphics as part of the scorecards are so ugly jfc,17
2020-10-27T15:42:09+00:00,turtlemons,Who is making Saha's apology thread now? r/cricket,2
2020-10-27T15:42:24+00:00,see_mom_no_username,#\#SAHAforCSK,-3
2020-10-27T15:42:27+00:00,Lionheart008,Want to see Dhawan on song today.,2
2020-10-27T15:42:34+00:00,singhsrb,They need to give Hetmyer a chance to influence the match by sending him early if Pant is being shit since his come back.,4
2020-10-27T15:42:37+00:00,ShuddhGheeRoti,"I think SRH should persist with Kane.

He playing with, rubbing shoulders with and learning from Saha can only improve him.",23
2020-10-27T15:42:39+00:00,Giant_Slay3r,Delhi have saved the worst for the last.,6
2020-10-27T15:42:43+00:00,aryanx1234,"The field placement wasn't gr8 tbf, ashwin at third man will leak u 10-12 runs in 2s and 4s",3
2020-10-27T15:43:10+00:00,warrenslaya,Jonny Bairstow IPL career ended?,2
2020-10-27T15:43:24+00:00,,Bruh we gave away 5wickets to Varun. Can't even imagine what we'll do against Rashid now. Rahane opening already giving me PTSD,0
2020-10-27T15:43:29+00:00,gungly,"People defending Pandey, yes he ended up with better numbers than Kane today. He was 11 off 10 at one point too though.

Criticism for Pandey didn't surface overnight. He has under-performed for the last 3 years for SRH. His career strike rate in IPL  is 120 which is not good enough for a specialist batsman.",3
2020-10-27T15:43:35+00:00,,"Dhawan scoring well cos he knows SRH's attack or

SRH bowling to get Dhawan cheaply cos they know his areas?",7
2020-10-27T15:43:38+00:00,mattytmet,"One things for sure, DC can't afford to play out Rashid like everyone else has. Should be fun to watch if they do go after him",6
2020-10-27T15:43:38+00:00,DW_78,"Rabada got taken for 0-54, that's gotta sting.",5
2020-10-27T15:43:40+00:00,SanFishkin,"If DC lose tonight, they'll be doing a reverse KXIP.",5
2020-10-27T15:43:41+00:00,,Kane should play at 3 or  don't play him,8
2020-10-27T15:43:41+00:00,motasticosaurus,So why isnt YJB playing?,1
2020-10-27T15:44:15+00:00,nouseridavailable,"Open with Pant, you cowards",5
2020-10-27T15:44:19+00:00,,Srh would have had legitimate playoff chances if bhuvi and Mitch marsh did not get injured,9
2020-10-27T15:44:28+00:00,weedhead2,"This situation is tailor-made for Pant. Not just because of how he bats, but because it's a chance to have a permanent meme - the one day they let Saha out, he tried to make his case for T20, but Pant came in and made it better. Given the timing right after team selection for the Aus tour, if Pant wins this game, that will never die down.",2
2020-10-27T15:44:30+00:00,the_pacifier8,I don't what Abdul Samad has done for him to be included in the playing 11 every single game.,3
2020-10-27T15:44:33+00:00,wingzero00,"Pant is gonna be key, he's looked the most comfortable against Rashid among the DC batsmen over the years. I want him to score big but still want DC to lose.",1
2020-10-27T15:44:33+00:00,,"This is a very tough target, but I have faith in the boys.",7
2020-10-27T15:44:38+00:00,uravggstudent,[Called this a few days back. Rift^TM](https://www.reddit.com/r/Cricket/comments/j94ccr/match_thread_27th_match_mumbai_indians_v_delhi/g8ht1nj?utm_medium=android_app&utm_source=share&context=3),-3
