Timestamp,Username,Comment,Upvotes
2020-11-08T15:58:13+00:00,Slippin_Jimmy1216,"What went wrong for SRH this match:


Usually, they pick a couple of wickets in the powerplay and then apply the spin choke.


But when the chances were dropped, DC had a good start and went all out against every bower except Rashid who they played out.",5
2020-11-08T15:58:16+00:00,fieztel,Please SRH atleast get to 170 and win our hearts,8
2020-11-08T15:58:20+00:00,,Rahene is a specialist fielder for today,7
2020-11-08T15:58:20+00:00,luckywrath234,Srh is gonna shit the bed like rr did against kkr 100% sure,6
2020-11-08T15:58:22+00:00,pranavbrijwani,"Only two 190+ totals have been chased this season where we saw Lord Tewatia and Lord Stokes at it, will we see another Lord tonight?",7
2020-11-08T15:58:23+00:00,ghostshelltaken,Dhawan is like those Anime heros who attacked at the end to destroy villan,5
2020-11-08T15:58:39+00:00,Goodfelli,Delhi has the best bowling attack. Atb srh,5
2020-11-08T15:58:40+00:00,oxfordcircus007,I will be shitting my pants if DC opens with Ashwin against warner,5
2020-11-08T15:58:48+00:00,kramer944,Warner special coming up?,3
2020-11-08T15:58:50+00:00,crazyb14,They should've declared at 160,7
2020-11-08T15:58:59+00:00,,Ashwin vs Warner lessgooooo,3
2020-11-08T15:59:09+00:00,2684335126835353,Rabada is only allowed 1 wicket,2
2020-11-08T15:59:17+00:00,Lionheart008,"Remember that Stoinis hitting it big couldn't even bring DC close to MI target in Q1. No matter how good Warner is, no way he is doing this alone.",8
2020-11-08T15:59:26+00:00,WoakesStokesFoakes,Pant vs Hetmyer on potential and where you see them 10 years from now,4
2020-11-08T15:59:29+00:00,,[removed],9
2020-11-08T15:59:33+00:00,International_Boat82,"I forgot dc has ashwin , isnt his stats great against warner 
 
*Fuck*",7
2020-11-08T15:59:40+00:00,fieztel,Goswami don't be a Go Swami today please 🙏,3
2020-11-08T15:59:47+00:00,Naankhataii,Vimgel wadaaa player ..,3
2020-11-08T15:59:55+00:00,LewDog1991,I'm telling you right now they are not chasing this. Game's over,7
2020-11-08T15:59:58+00:00,,"DC fans, irrespective of whether you win or lose today, I think Ponting and Kaif really need to set Pant straight. The dude was horrific and his running made me think he was in his late thirties. How is this guy supposed to be in his mid-twenties? 

I’ll admit I’m not one to talk because I became fat too during the lockdown but I ain’t getting paid millions for my fitness.",9
2020-11-08T15:59:58+00:00,Fabulous-Rice,How many of you will log off after Warner gets out early?,7
2020-11-08T16:00:00+00:00,,Both of Delhi’s opening bowlers are South African. This is a knockout game. Absolutely no pressure then,8
2020-11-08T16:00:08+00:00,singhsrb,Now hopefully Iyer doesn’t do round robin bowlers during captaincy. Ashwin needs to bowl 3 in the power play like everyone and their mother knows.,4
2020-11-08T16:00:21+00:00,udayEm,Why the hell are they taking a pic now!?,2
2020-11-08T16:00:25+00:00,,[Hope this Warner shows up](https://m.cricbuzz.com/live-cricket-scorecard/16447/gl-vs-srh-qualifier-2-indian-premier-league-2016),2
2020-11-08T16:00:29+00:00,siddharthzaveri,What is the point of this mid innings photo shoot ?,3
2020-11-08T16:00:29+00:00,Saviour2401,New MOTM today for Srh??,3
2020-11-08T16:00:32+00:00,,"I dont care who wins, just dont let MI win another cup",10
2020-11-08T16:00:32+00:00,shsha11,Why the players carrying pillows while leaving their hotel ?,5
2020-11-08T16:00:33+00:00,,"Photoshoot of Delhi.


Oh No, I am in danger.",8
2020-11-08T16:00:36+00:00,suyashkhubchandani,Decent comeback from SRH imo. Could be a half decent chase if they avoid some brainfades,7
2020-11-08T16:00:39+00:00,crazyb14,Goswami can't stand a chance with Rabada's and Nortje's pace.,3
2020-11-08T16:00:42+00:00,vvb_12,R Ashwin and Y Chahal together in t20 for India? Will it be a good combination?,2
2020-11-08T16:00:50+00:00,Yorkerhundredmiles,That's weird.,1
2020-11-08T16:00:52+00:00,rishibhavsar,just me or hyderabad players looked really lethargic in field? terrible fielding display. guess just one day of rest isn't enough specially when every game that you're playing is a knockout one.,4
2020-11-08T16:00:55+00:00,sahit24,Shikhar got 50 from 26 and then 28 from 24.,1
2020-11-08T16:01:06+00:00,sahibosaurus,Wtf are they taking a picture in the middle of the game for?,2
2020-11-08T16:01:07+00:00,,Has Shaw gone bald already?,1
2020-11-08T16:01:09+00:00,International_Boat82,Highest chase by srh has been 155 this season 😂🤣😭😭😭,11
2020-11-08T16:01:13+00:00,naughty_ningen,"Yes Iyer is better than sky.....



Better at choking his team with dots....",4
2020-11-08T16:01:18+00:00,aj_viz,"Lot of ignorant fans saying they are 20 runs short.

For them who never even played even a competitive street game it is all like a math equation where in x overs if you already got so much by 'Y' number of over they should have got this much. They don't understand this is sport and there will be ebbs and flows in the game and there is also an opposition playing in the game.

DC did a damn good job and disrupted SRH's game in the first half.",5
2020-11-08T16:01:27+00:00,V710,DC should open the bowling with KG Rabada and Anrich Nortje,2
2020-11-08T16:01:31+00:00,blumirage,"So what do we think, 150-7?",6
2020-11-08T16:01:39+00:00,T-MosWestside,Why did we let go of Hetmyer ffs.,3
2020-11-08T16:01:46+00:00,belanish11,I actually hope that the batsman hits a six everytime Ashwin suddenly stops and then bowls,5
2020-11-08T16:01:47+00:00,Vicodin_Abuser,"Goswami is going to be the key here. 

With a 35(20) he can set the match up for SRH, or with a 2(8) he can break the match down for SRH.",3
2020-11-08T16:01:47+00:00,touseeff,"With the Delhi opening bowlers, goswami is a walking wicket",3
2020-11-08T16:01:51+00:00,Rubberducky1239,"Showing MPL as making lives better has to be such a shitty thing, wish our censor board was more krodith over this than kisses",4
2020-11-08T16:01:52+00:00,,"Missing my man Saha. I know India duties are more important, but damn would have been worth an arm and a leg rn",2
2020-11-08T16:01:53+00:00,LewDog1991,Cheer up Trevor,1
2020-11-08T16:01:53+00:00,R2RBoy,Delhi could've gotten 200 but Kohli's pet poodle sucked away the momentum and then the last few overs were decent,1
2020-11-08T16:01:54+00:00,TheKingslayer19,"RCB took their team photo because they knew they were scheduled to lose. Today DC taking team photo and not SRH, clear indication of what's to come. It's all fixed SMH my head /s",7
2020-11-08T16:02:02+00:00,zambur-e-bahar,Incoming Warner 100(45),-1
2020-11-08T16:02:11+00:00,fieztel,"The two coaches with no expressions :

1. Justin Langer

2. Trevor Bayliss",6
2020-11-08T16:02:14+00:00,gungly,DC taking a class photo in case they don't make it to the finals.,2
2020-11-08T16:02:16+00:00,jinesh007,Who was that cutie in orange?,1
2020-11-08T16:02:16+00:00,,"Just when commentators said Malinga can bowl 6 yorkers and while Nattu can’t cuz he has a limit, my man Nattu shatters their opinions.",4
2020-11-08T16:02:22+00:00,,Seems like a good for Mankad.,2
2020-11-08T16:02:34+00:00,Terra_Rizing,"✋ DC vs SRH

👉 Rashid Khan vs Ravichandran Khan.",0
2020-11-08T16:02:38+00:00,GlitchPro27,I'm extremely terrified of Warner tonight. I've seen him take it away from Delhi over the seasons way too often.,4
2020-11-08T16:02:40+00:00,fookin_legund,"Ashwin doesn't stop, it's your stream glitching",5
2020-11-08T16:02:50+00:00,lifeofpaiii,Hopefully Saha will recover before the Aus tour...he is a great wicketkeeper,8
2020-11-08T16:02:56+00:00,fieztel,OMG it's Garg wtf,14
2020-11-08T16:02:59+00:00,,FUCK YEAH GARG OPENING,11
2020-11-08T16:03:00+00:00,Silly-Point,Bit odd taking team pictures in the middle of the game. Could be as fatal as celebrating a milestone mid job.,4
2020-11-08T16:03:04+00:00,T-MosWestside,"Come on Delhi, beat those Hyderabadis.",0
2020-11-08T16:03:16+00:00,GlitchPro27,Are the DC boys attempting a reverse jinx with that picture?? xD,1
2020-11-08T16:03:17+00:00,learn_devops,Srh need to play well atleast for that chic,5
2020-11-08T16:03:28+00:00,,"I am calling it 


Warner goes beserk today",7
2020-11-08T16:03:47+00:00,Vicodin_Abuser,Boy oh boy we have Garg opening! Come on India U-19 captain!,5
2020-11-08T16:03:50+00:00,justavertexinagraph,Is this the make the injured guy open and hit out strategy they tried with Williamson?,2
2020-11-08T16:03:56+00:00,Rubberducky1239,Wait surprise openers game lol,3
2020-11-08T16:03:58+00:00,pranavbrijwani,Garg probably to counter Ashwin as well.,2
2020-11-08T16:04:02+00:00,Proboninja,Garg maybe injured... he'll just swing in the PP and get out...like Kane vs KKR,2
2020-11-08T16:04:03+00:00,LewDog1991,WARNER NICKS OFF FIRST BALL,2
2020-11-08T16:04:05+00:00,naughty_ningen,Fuck Yes Delhi Capitals the champions of refridgerator rights and equality of defenestration rights,1
2020-11-08T16:04:07+00:00,WeaponX23X,Why Garg is opening?,1
2020-11-08T16:04:11+00:00,Slippin_Jimmy1216,"Bro, who tf is reading this thread? Stoin and Garg opened this match.",1
2020-11-08T16:04:12+00:00,Silly-Point,Happy with this order change,2
2020-11-08T16:04:19+00:00,ankush024,Hold your momos delhi Here comes our stoinis,1
2020-11-08T16:04:20+00:00,fieztel,Atleast Garg's finally allowed to play wildly without being exposed to pressure situations all the time,3
2020-11-08T16:04:20+00:00,,Just tuned into the match. Is Saha playing?,3
2020-11-08T16:04:20+00:00,SnoopDogg_Official,Garg opening. Nice,1
2020-11-08T16:04:24+00:00,munkeyy,"Goswami is a walking wicket, they cant take chances with Kane, so trying with Garg... neverthe less all experiments dont succeed!!!",2
2020-11-08T16:04:26+00:00,RogerThatRafaThis,"Warner and Garg: Baniye ka dimag, Miyanbhai ki daring.",3
2020-11-08T16:04:26+00:00,Ioosubuschange,"Blue vs red ft IPL.

Can red catchup?",2
2020-11-08T16:04:28+00:00,smokeshishaplayfifa,"Garg is waste anywhere, might as well open with him as well",0
2020-11-08T16:04:30+00:00,curioD,Garg,1
2020-11-08T16:04:30+00:00,peter_griffins,Great opportunity for Garg,1
2020-11-08T16:04:32+00:00,User9333,Goswami IPL career strike rate is in the same league as Cheteshwar Pujara LoL,2
2020-11-08T16:04:34+00:00,Yorkerhundredmiles,I like this kid but it's too much pressure I believe.,3
2020-11-08T16:04:34+00:00,TheKingslayer19,Big opportunity for Garg,2
2020-11-08T16:04:35+00:00,Fabulous-Rice,Thank god it's not Goswami.,5
2020-11-08T16:04:35+00:00,Proveit98,Are we really letting Garg face Nortje and Rabada? Poor kid.,1
2020-11-08T16:04:43+00:00,,Good step to open with Priyam. Give the kid licence to hit out and express himself.,3
2020-11-08T16:04:43+00:00,DilliKaLadka,Ashwin first over.... this is all Ponting and his evil schemes.,4
2020-11-08T16:04:43+00:00,,"I absolutely hate that no matter who wins this match, Gavaskar isnt going to shut his stupid mouth after Mumbai win the final",7
2020-11-08T16:04:47+00:00,2684335126835353,Didn't realise Garg was kinda tall since he has a really big fucking head,4
2020-11-08T16:04:50+00:00,awslurker,congratulations Mumbai on winning the IPL,4
2020-11-08T16:04:50+00:00,Lionheart008,They are trying that Williamson trick with Garg maybe. Make as many as you can in the pp,5
2020-11-08T16:04:55+00:00,,"Rule 1: If you're injured, you ain't getting a rest you gotta freaking open",11
2020-11-08T16:04:59+00:00,,Warner needs to channel back his Ashes'19 energy.,0
2020-11-08T16:05:00+00:00,Ritwicked,Ashwin is opening the bowling wow,3
2020-11-08T16:05:02+00:00,oxfordcircus007,srh really fucked up their action for their batting. i mean a guy with 115 sr and 1 50 is opening for them in a semi final,2
2020-11-08T16:05:03+00:00,Naan6, Garg might be a decent choice tbh,3
2020-11-08T16:05:04+00:00,siddharthzaveri,Ethical start to the innings,3
2020-11-08T16:05:05+00:00,LightningStrikes321,Lmao Garg opening. Gone inside 3 overs,1
2020-11-08T16:05:08+00:00,fieztel,Almost gone fuck,2
2020-11-08T16:05:10+00:00,massconstellation,um why is priyam garg opening,1
2020-11-08T16:05:15+00:00,anotherlonelyman,I like Ashwin. But I hope that he doesn't take Warner's wicket.,2
2020-11-08T16:05:19+00:00,WeaponX23X,Gravity defied big ass reaching to that catch lol,2
2020-11-08T16:05:20+00:00,aryanx1234,Dc missed a possible 0/3,2
2020-11-08T16:05:22+00:00,,Hetty's jersey number 😳,2
2020-11-08T16:05:25+00:00,touseeff,Don't mind the garg punt. Personally feel like there's a class player in there,3
2020-11-08T16:05:27+00:00,ameetkumar2021,Its a good move Right hand left hand combo..,2
2020-11-08T16:05:30+00:00,LightningStrikes321,Why is a 117 sr batsman opening?,3
2020-11-08T16:05:32+00:00,Lionheart008,Yeah. Hopefully the shit fielding consumes DC now like it did SRH,2
2020-11-08T16:05:36+00:00,zambur-e-bahar,_for a minute there i lost myself_,3
2020-11-08T16:05:36+00:00,jeeverz,"Oh man, Garg looks like he is 13 lol",5
2020-11-08T16:05:37+00:00,,Reminds me of the match when KKR opened with Yusuf Pathan and CSK with Ashwin,1
2020-11-08T16:05:42+00:00,naughty_ningen,Ashwin got Warner in first over in 2014 scg test,2
2020-11-08T16:05:44+00:00,smokeshishaplayfifa,"Told ya, Garg won't stay long. Only few overs maximum",-1
2020-11-08T16:05:50+00:00,,Bruh why is Saha not playing?,-1
2020-11-08T16:05:52+00:00,swain18,"What is Pant's favorite song?

*Make some noise for the DC boys*",9
2020-11-08T16:05:54+00:00,Freakysafal,"I was rooting for Goswami

New MOTM  for SRH. Wtf garg",6
2020-11-08T16:05:56+00:00,edudhtamris,Ashwin's beard is weird,3
2020-11-08T16:05:58+00:00,Naan6,They might be doing what they did with Williamson after his injury,7
2020-11-08T16:06:03+00:00,fieztel,Did I just see Ashwin chanting some mantras there?,3
2020-11-08T16:06:06+00:00,oxfordcircus007,prediction : warner lbw this over,2
2020-11-08T16:06:06+00:00,masterblaster422,if he's injured he may as well hit out and get out in the powerplay,5
2020-11-08T16:06:06+00:00,MISSIONCAP,Need that Mankad from Ash,8
2020-11-08T16:06:18+00:00,,Bitch yes,1
2020-11-08T16:06:19+00:00,noysey,Yes gargy boy good start,6
2020-11-08T16:06:21+00:00,smokeshishaplayfifa,Woooooooooow,2
2020-11-08T16:06:22+00:00,SexxyBlack,Chasing 190 and 117 SR guy is opening,-9
2020-11-08T16:06:22+00:00,Rubberducky1239,Ohno,5
2020-11-08T16:06:26+00:00,t51r,Good start,6
2020-11-08T16:06:28+00:00,naughty_ningen,Nooooo,3
2020-11-08T16:06:35+00:00,fieztel,Oh yeaaaaaah. Come on 🔥,6
2020-11-08T16:06:36+00:00,aryanx1234,Holy fuck garg,7
2020-11-08T16:06:37+00:00,float,Take a single.,0
2020-11-08T16:06:38+00:00,Naan6,Shot,3
2020-11-08T16:06:38+00:00,peter_griffins,Beautiful,2
2020-11-08T16:06:38+00:00,Yorkerhundredmiles,Hot damn,3
2020-11-08T16:06:38+00:00,Ioosubuschange,Manish pandey to do 2014 final heroics,6
2020-11-08T16:06:39+00:00,smokeshishaplayfifa,Ashwin who? /s,8
2020-11-08T16:06:43+00:00,deep639,These dudes sent a 19 year old to open in a 190 chase to get to the IPL final.,12
2020-11-08T16:06:49+00:00,crimemaster_gogo20,Smashed!,1
2020-11-08T16:06:51+00:00,nikkhelsai1,"Wait what ,garg?",1
2020-11-08T16:06:57+00:00,SnoopDogg_Official,An 18 year old just smacked Ashwin for 6. Retire now Ash /s,1
2020-11-08T16:06:57+00:00,,Pag didn’t come to fuck around,3
2020-11-08T16:07:05+00:00,dexter_in_pajamas,"DC: Plays a pinch hitter as an opener

SRH: Hmmmmmmmm",13
2020-11-08T16:07:07+00:00,,[deleted],5
2020-11-08T16:07:07+00:00,awslurker,mankad incoming,3
2020-11-08T16:07:08+00:00,TedhaHaiParMeraHai,Feels like SRH are gonna chase this easily.,1
2020-11-08T16:07:12+00:00,Rubberducky1239,Pant touching that ass real smooth,5
2020-11-08T16:07:13+00:00,zambur-e-bahar,We might lose,1
2020-11-08T16:07:14+00:00,International_Boat82,Subhanallah,2
2020-11-08T16:07:15+00:00,smokeshishaplayfifa,"Pant bc, don't jump on the batsman.",7
2020-11-08T16:07:15+00:00,Lionheart008,Already better than Goswami,4
2020-11-08T16:07:16+00:00,fieztel,Pant's commentary when?,3
2020-11-08T16:07:27+00:00,masterblaster422,you had I N T E N T and now you also have C O M M I T,4
2020-11-08T16:07:28+00:00,naughty_ningen,SRH run rate 18 we are fucked,3
2020-11-08T16:07:31+00:00,TheReal-Tonald-Drump,Ez ez ez,2
2020-11-08T16:07:32+00:00,Hariii_,This is going to be a really interesting chase,1
2020-11-08T16:07:33+00:00,2684335126835353,Pant improved his keeping but kinda forgot how to bat,3
2020-11-08T16:07:34+00:00,udayEm,Pant mofo trying to get on Garg,3
2020-11-08T16:07:35+00:00,Treemann,"DC gonna win:

Reference: we have a player called AshWIN, not AshLOSE.",16
2020-11-08T16:07:45+00:00,awslurker,"Saha legit made of glass, gets injured way to frequently",4
2020-11-08T16:07:46+00:00,anaksr1414,Remember Injured Kane going bang bang in one match. We have Priyam now trying to replicate that.,2
2020-11-08T16:07:51+00:00,siddharthzaveri,Notice how solidly Warner stays in the crease at the non strikers end ? That’s how it should be,8
2020-11-08T16:07:54+00:00,oxfordcircus007,dc fans already turned to pessimism.,4
2020-11-08T16:07:57+00:00,DoomMachine-77,Oh fuck.,1
2020-11-08T16:08:02+00:00,naughty_ningen,Wide bc,1
2020-11-08T16:08:02+00:00,TheWyzim,"Why hasn’t Saha opened today, he was in red hot form",-2
2020-11-08T16:08:04+00:00,fookin_legund,Remember that Delhi have a newbie spinner in the attack. 190 is not impossible at all.,10
2020-11-08T16:08:09+00:00,,"That's the one place you don't bowl to garg, he always does that move lmao",5
2020-11-08T16:08:09+00:00,smokeshishaplayfifa,"Two sides, aswin wants to stumping. Bowling deliberately",3
2020-11-08T16:08:10+00:00,talhaaaa14,Was an 18 year old garg made to face the first ball,9
2020-11-08T16:08:11+00:00,Hariii_,I'd love to see vintage Warner again. Century please David!,5
2020-11-08T16:08:20+00:00,MISSIONCAP,I have a bad feeling about this,4
2020-11-08T16:08:24+00:00,Goodfelli,David warner has a very likable personality,6
2020-11-08T16:08:25+00:00,WeaponX23X,Great start by SRH,3
2020-11-08T16:08:26+00:00,T-MosWestside,"So, for which team is Finch gonna go and win the Orange Cap next year?",5
2020-11-08T16:08:36+00:00,vdix007,Damn Pant keeping on point,3
2020-11-08T16:08:39+00:00,Lionheart008,DC fans spamming those reverse jinx comments lol,3
2020-11-08T16:08:40+00:00,,Unethical over,6
2020-11-08T16:08:42+00:00,uravggstudent,SRH confused DC last time by opening with Saha. Today they're doing the same thing with Garg.,10
2020-11-08T16:08:42+00:00,Krs1218,"Sunrisers have backed Garg in every match when he’s only had one good performance, time to repay that faith",8
2020-11-08T16:08:46+00:00,oxfordcircus007,"chill out, dc fans. we still have 180 more runs to get",3
2020-11-08T16:08:47+00:00,,"Just need to get Warner, it's game over .",3
2020-11-08T16:08:49+00:00,massconstellation,this is messy as shit,2
2020-11-08T16:08:53+00:00,nextdoorrando,"Ponting: Let's open with stoinis he even opens in BBL.

Trevor Bayliss: I have a better idea. DC will never know what hit them.",7
2020-11-08T16:08:55+00:00,Aakash1203,I just dont want MI to win,4
2020-11-08T16:08:57+00:00,madglover,Good over by Ashwin standards,-2
2020-11-08T16:08:57+00:00,,"Keep calm Priyam my boy, you'll get more chances to hit out.",3
2020-11-08T16:09:02+00:00,smokeshishaplayfifa,Sunny ji with his usual uncle jokes. Smh. Back to Telugu commentary,3
2020-11-08T16:09:07+00:00,,Will having 3 spinners backfire?,1
2020-11-08T16:09:13+00:00,SnoopDogg_Official,"I hate how they change the zones on the pitch map to push a particular narrative. If they wanna call it good balling, they mark it as 'Full Length' and if they wanna call it bad ball, they call it 'The Slot'",1
2020-11-08T16:09:17+00:00,Fabulous-Rice,Loving the banter between Pommy and Sunny 😂,1
2020-11-08T16:09:19+00:00,naughty_ningen,Delhi Bois start praying that rabada doesn't have a 1 for 52 day,1
2020-11-08T16:09:22+00:00,YazCarlz,"How tall is Priyam Garg?! 

Looks so tall up close but avg from far....",2
2020-11-08T16:09:22+00:00,DoomMachine-77,In one over they yanked my soaring smile down. I’m scared.,2
2020-11-08T16:09:22+00:00,warrenslaya,Priyam Garg was probably a small kid watching Ashwin in 2011/2012 as a young spinner doing well in IPL. Now he's hitting him for sixes.,3
2020-11-08T16:09:34+00:00,WeaponX23X,Rabada gonna get Warner in this over,71
2020-11-08T16:09:38+00:00,Freakysafal,"A tough chase for SRH

Just a good start in powerplay not gonna be enough like in previous matches",3
2020-11-08T16:09:47+00:00,RationalIndian98,I think this is in the bag for DC. It is in their game to lose now.,1
2020-11-08T16:09:51+00:00,Hariii_,*GameOver*,3
2020-11-08T16:09:53+00:00,deep639,Oof. Rabada.,3
2020-11-08T16:09:53+00:00,fieztel,Game over. Great game bois,4
2020-11-08T16:09:55+00:00,drassaultrifle,LEZGOOOO,3
2020-11-08T16:09:56+00:00,oxfordcircus007,battle to watch : rabada vs warner,4
2020-11-08T16:09:57+00:00,t51r,HOLY FUCK RIP SRH FUCKKK,4
2020-11-08T16:09:57+00:00,,Get yorked bitch!!!!!!,6
2020-11-08T16:09:57+00:00,awslurker,"goswami is useless, pandey is hit or miss, holder has had a bad day today, williamson is a 130 chase specialist

so get Warner, win the game

edit: game over",11
2020-11-08T16:09:59+00:00,,RABAAADDAAAAAA,3
2020-11-08T16:09:59+00:00,T-MosWestside,Hammayya,2
2020-11-08T16:10:00+00:00,abdv172784,holy fuck,2
2020-11-08T16:10:00+00:00,naughty_ningen,Ma hi chod dia rabada benchoooooo,9
2020-11-08T16:10:01+00:00,smokeshishaplayfifa,What a ball. That's the match. Bye bye boys,3
2020-11-08T16:10:01+00:00,Rubberducky1239,RABADA CANT TAKE WICKETS IN POWERPLAY. TALK NAH AB,8
2020-11-08T16:10:03+00:00,siva113,Happy diwali guys..it's over,1
2020-11-08T16:10:05+00:00,2684335126835353,Okay no more wickets pls,3
2020-11-08T16:10:07+00:00,,Keep calm and trust Rabada,3
2020-11-08T16:10:07+00:00,Lionheart008,Match over,3
2020-11-08T16:10:07+00:00,pranavbrijwani,RABADAAAAAA!!!,2
2020-11-08T16:10:08+00:00,shiwanshu_,I'm cooming,1
2020-11-08T16:10:08+00:00,DilliKaLadka,Fuck yeahhhhhhhhhh. Warner blacked tonight,1
2020-11-08T16:10:08+00:00,jamb1993,Wow what a ball from rabada 1st up,1
2020-11-08T16:10:10+00:00,RationalIndian98,Rabada:“Fuck yes”!😂,6
2020-11-08T16:10:10+00:00,Poopy_Butt_Seed,Another Xbox for Archer.,5
2020-11-08T16:10:11+00:00,Naan6,Game over,2
2020-11-08T16:10:13+00:00,abdv172784,Rabada you beauty,5
2020-11-08T16:10:13+00:00,DREAMhaLAND,"Rabada, you god",2
2020-11-08T16:10:13+00:00,aryanx1234,See u in the finals dc,2
2020-11-08T16:10:13+00:00,swain18,Rabada takes DC to final on the first ball he bowls,6
2020-11-08T16:10:14+00:00,masterblaster422,gg,6
2020-11-08T16:10:15+00:00,,gg guys,6
2020-11-08T16:10:15+00:00,massconstellation,OH NOOOOOOOOOO,2
2020-11-08T16:10:15+00:00,slimnahady,Killer blow,2
2020-11-08T16:10:16+00:00,Proveit98,It was a good tournament..,5
2020-11-08T16:10:17+00:00,TedhaHaiParMeraHai,Fucking hell,2
2020-11-08T16:10:17+00:00,SnooMacaroons9408,Was this a replay of Bumrah's bowl to Dhawan?,8
2020-11-08T16:10:17+00:00,Ritikkatiyar09,thats the game,2
2020-11-08T16:10:17+00:00,oxfordcircus007,hahahaha,2
2020-11-08T16:10:18+00:00,Siondroms,KAGISOOOOOOOOOOOOOOOO,6
2020-11-08T16:10:18+00:00,,"Well, goodbye SRH, give us kane next year please",4
2020-11-08T16:10:20+00:00,sharkaim4,WOOOOOHOOOOOO FUCK YES RABADA BABYYYYYYY,5
2020-11-08T16:10:20+00:00,vvb_12,Just few bad games and people really started doubting Rabada,10
2020-11-08T16:10:21+00:00,ConcentrateBig3530,Just need to get kanos now and we got this match,8
2020-11-08T16:10:22+00:00,Anoob13,Game done,5
2020-11-08T16:10:22+00:00,enz3,Rabada seems genuinely pumped about that wicket. A great boost for him.,9
2020-11-08T16:10:22+00:00,fieztel,That kinda day for us,4
2020-11-08T16:10:22+00:00,,"Finals DC vs MI


Congratulations to MI for their 5th title",7
2020-11-08T16:10:23+00:00,cyberchamp_210,Bye Warner,3
2020-11-08T16:10:23+00:00,,YEAAAAAAHHHHHHH,4
2020-11-08T16:10:23+00:00,shantanu_m28,Oooff. DC is thrilled,4
2020-11-08T16:10:24+00:00,TheKingslayer19,That's the game lads,7
2020-11-08T16:10:25+00:00,theroaringdragon,That's the match probably,6
2020-11-08T16:10:25+00:00,zambur-e-bahar,DID WE JUST,6
2020-11-08T16:10:27+00:00,aj_viz,"That gentleman is Game set and match. 

It was already over when they posted 189. But now it's a certainty.",9
2020-11-08T16:10:29+00:00,,Oof KG!!,1
2020-11-08T16:10:29+00:00,Idontlikethisstuff,Rip SRH,1
2020-11-08T16:10:30+00:00,LewDog1991,You love to see it,4
2020-11-08T16:10:31+00:00,staticspacelord,"RIP, see ya next season bois",2
2020-11-08T16:10:32+00:00,crimemaster_gogo20,"Game is done, Warner needed to fire today",2
2020-11-08T16:10:32+00:00,LazyAssClown,R A B A D A A A A A A,4
2020-11-08T16:10:34+00:00,Lionheart008,Good luck in the finals DC. Time for a new winner,7
2020-11-08T16:10:35+00:00,Freakysafal,"After Last match hammering, KG is back in style",4
2020-11-08T16:10:35+00:00,jeeverz,"Damn, that was a spectacular delivery",3
2020-11-08T16:10:36+00:00,kishore2521,It was fun while it lasted,4
2020-11-08T16:10:36+00:00,AnyoneButSanjuManju,Its inevitable that Sunny G in this mood will unleash his deadly Caribbean accent.,6
2020-11-08T16:10:37+00:00,oxfordcircus007,gg,4
2020-11-08T16:10:38+00:00,ankush024,Congrats mumbai,5
2020-11-08T16:10:40+00:00,Jy_sunny,Nattu and Rabada got the most beautiful wickets this week,6
2020-11-08T16:10:40+00:00,warrenslaya,Pommie Mbwanga is a wholesome dude.,5
2020-11-08T16:10:41+00:00,Zer0wned1,On your bike Dave,8
2020-11-08T16:10:43+00:00,Heisenberg_Ind,Pack your bags now SRH,1
2020-11-08T16:10:45+00:00,munkeyy,GG guys.... Trend is to bowl yorkers for first ball in powerplay!!!,5
2020-11-08T16:10:46+00:00,Siondroms,Kagiso's Revenge,4
2020-11-08T16:10:46+00:00,Mpsingh18,Faf : *My boy*,6
