Comment,Upvotes
"If Dugout can do this type of analysis on a single player, imagine the analytics team of the franchises, wonder what gold they would have on every player.",16
"6D chess from ABD to get 42 year old tahir to chase that, now he's too tired to bowl well",19
This season hasn't yet seen a Jadeja masterclass in the field where he just ruins the opposition's batting with an out of the world catch or a direct throw.,11
"Hotstar showing an ad about the CSK documentary, Roar of the lion, in which Dhoni says 'I always say what doesn't kill you makes you stronger' like he came up with it",22
Finch even if he makes fuck all for the rest of the games will not get dropped. So stop whining.,9
"Wtf are those goggles, Sam?",10
Cheeku having kela in timeout nice,7
Monu kumar will be the new shivil kaushik today.,3
chad sam curran,5
Sam with that CURRENT,4
Curran flashes and flashes hard!,4
Dussehra Mela goggles for Sammy boi!,8
Curran looking fly,6
"RCB can really just knock it around tbh. With Moeen to come in later, and with CSK's 'death bowling', can see some fireworks later",5
Curran looks ready for a pool party,7
Who was that Ahaaa guy.. xD,3
"LMAO SAM!

WHAT ARE THOOOSE",6
Curran reminding his boomer teammates about his age with those green shades,11
Sam also wants to save the planet,10
Sam wtf lol,2
Those sunglasses look goofy lol,4
Why is Sam Curran wearing RCBs shades,4
Kohli always finds singles,5
Australians having a bad ipl even though they were match prepared,2
Swanny taking on Curran for those glasses LMFAO.,2
Did Curran get that from Swaminathan by the Chennai beach for 20 rupees,3
Unpopular Opinion- Comparing women on the basis of how good they look is not cool. Lets limit ourselves to cricket eh?,6
"Sam Curran with the Fuckboi goggles 

Probably a cougar gifted it",9
jithu jilladi curran,1
What on earth are those sunnies Scurran,4
Sam Curran showing the young 'spark' with his specs.,2
Sam Curran showing his support for the Go Green initiative with those terrible glasses.,8
Wicket alert,1
Sam with a power rangers jungle fury sunglasses lol,2
Nice throw santner,1
🕶,1
"Cork: ""Sanjay, that was a wonderful analysis of Kohli""

Swann interrupting - ""My kids wear scuba gear""",12
Sam Curran wearing Jaathrey Kanadka (Kannada for cheap sunglasses one buys from a fair),14
Allow AB and VK to settle they'll take the game away from you.,6
Sam Curran on his way to fuck your bitch,13
Man Bangar is good.,1
Tahir will run out of the stadium if he gets these two.,3
Any other idiot from the UK thought this started in 15 mins?,1
watching kohli and ab convert 1s to 2s is a treat,8
Whata throw,0
"Sam Curran ready to shake the district

Jila hilale la Curran-wa!",3
Sanjay bond lmao,0
Santner looks like John Mulaney.,1
Is Satner gonna open today lol,1
"The field is preventing the second run frequently, smart",0
Do yall reckon Siraj will carry his form or will he go back to his old ways,0
Inb4 kohli 43(39) and abd 103*(45),9
Rcb in the middle overs is really slow,7
May I ask why Dube isn't playing? He's a much better hitter than Gurkeerat and can bowl 1-2 overs if needed.,4
Don't take chances with jaddu Bois,7
"Close shave dayum, was Jaddu",5
Kohli has sacrificed a death bowler in Udana (still don’t trust Siraj based on one good match) and yet Finch hasn’t delivered. He doesn’t deserve such a long rope. Udana and Moeen should both play,4
"Don't risk those runs, please.",5
Swann smoked some good shit today.,11
Jaddu missing this is sad,7
Hoping that Tahir will play for CSK in 2021 too.,10
Rcb has the lowest run rate this season between 8 to 15 overs,8
Sam's the imposter,7
"One thing distinctly missing this season is batsmen rarely use their feet to spinners. Even top batsmen. 

Everyone's sitting back and either waiting for the ball to be overpitched and range hitting like Samson or waiting for it to be dropped short which is tricky in the big boundaries at Dubai and Abu Dhabi. 

Even domestic Indian batsmen don't play spin as well as before.",4
160 target should seal the game for RCB,3
Man even now I'm having heart attacks.,8
These two are looking good,5
"De Villiers don't go for a quick single. 

We will be happy to see tuk tuk on the other end rather than you getting run out.",7
When you realize Monu still has 3 overs left,7
"This is going exactly like last match. Kohli taking quick singles and doubles, while the fielders are running in the sun and getting tired.


Kohli is going to accelerate soon.",8
Why did RCB suddenly decide green today?,0
I sense a carnage if these 2 don't get out. :),2
Tahir's hairs looked grayer than usual the other day as if his mehdi guy can't visit him due to social distancing norms,3
Curran with his 80's disco/porn glasses looking cool,8
Some real tactical stuff from MS. Nice to see an unorthodox field.,5
I say bring Monu. They'll do something And we might get a wicket here.,2
When will FInch get dropped? Even Shane Watson was dropped. They have yoing Phillipe to replace him.,3
CSK is lacking *spark* in their fielding.,5
Lenskart ads are hilarious,3
"""Shot. Four. de Villiers!""",5
Mo gonna bat with 2 bats lol,1
Anyone knows the name of the girl in the Airtel X tream ad?,-1
What is RCB’s plan to win the cup? Kohli+ABDV each score 70+ in 2-3 playoff games or they go home?,3
"A boundary an over when available, else take singles or twos till the 14th over or so has pretty much the MO of these two for years now.",6
This is the ideal T20 middle innings right? 4-5 singles and a four!,2
Strike rotation porn,7
"Banton would have been a great backup option for finch instead of philippe..

banton also a wk and explosive openor+ right handed so the left hand(paddikal) right hand(banton) combination stays...

if kkr does not retain banton then rcb is gonna go for him next year.",3
Monu has 3 overs remaining with ABd and Kohli set. Lol have fun chasing 200+,8
This is the first rcb match i am not watching live :-(,6
Absolute scenes when monu gets both of these out,5
Unpopular opinion: RCB should play with 3 overseas and bring PP in. PP to go berserk and if he gets out no problem because it brings in VK early,9
Kohli stop please.,3
Why do you have to change from helmet to cap for spinners and pace.,2
Red Pads with Green outfit is interesting,3
"I heard that Gaikwad was very aggressive, but seeing his last match, he could barely connect the ball. I also heard he contracted corona along with chahar. What's the chance that impacted his performance permanently? Genuine q",7
How much is Dhoni paid?,4
Black Cocks,10
Hurry up and get out Chutiyas so I can watch the glorious beard,3
Sam Curran doing his sunglasses shopping from HeraPheri's Akshay kumar,9
Hope Moeen doesn't do a Scotty,11
Dugout is talking about the New Zealand Black Cocks,9
I'm so tired of commentators jerking off to ABD and VK,1
Is KP no longer commentating? I do not see them around these days,2
"A very good spell.from Santner, we should have got him earlier",3
Proper cringe commentary this.,2
Survived Santner. Phew,2
In last match RCB was 95 in 15 over still made 175 without abd,2
Black cocks,2
Wow the overs are just flying.,2
Monu my boy where are you :(,3
"CSK

Throws: 38263881719387
Throws on wicket: 1",2
Black Cocks is the answer,1
"New Zealand chose ""Black Cocks"" as a nickname for their badminton national teams

Cheeky Swanny",5
Why no green pads?,2
"Fuck!! Kohli can't bat against leg spinners these days.

I blame Zampa.",1
"Finchy is getting it way too complicated with the walking up to the bowler early on. 

If he can get hit in the dick every match he’ll score a 50 every time. Easy  stuff.",2
The scale of the jio csk ad is so bad. All of them look like midgets on the balcony.,2
Jaddu vs Santner to see who finished their overs more quickly,1
"As a saffer, watching AB score runs off Tahir is like watching your parents through a messy divorce. I want them both to succeed always don't make me choose!",6
The overs are passing by in a hurry. Just imagine Jadeja coming on here.,2
Man this pitch has no pace left in it. Anything above 160 should be a competitive score imo,5
"So Jaddu, Santner and Tahir are all in. Left it all to Sam Curran to handle pace AND carry the batting, have you kings??",3
You are now witnessing the famous RCB tuk tuk.,12
Kohli still 0 boundaries,2
"SRH couldn't chase 120 yesterday after scoring 56 in the power play.

Considering we generally score around 25 in the power play 100 is probably the max we could chase .",3
Spin yorker,2
Good that at least we are chasing today instead of batting first to score 130/6,5
Yorker!!,1
Would you rather Monu or Jadeja bowl the 3 overs that CSK needs?,4
Dhoni is much more pleasant and encouraging of his players in this game.  He looked like an angry mean old man in some of the previous outings.,4
I was promised a Tahir running spree... Where is it?,4
[deleted],1
Imagine complaining about *not* getting altroz ads,2
Swann in the dug out is Andy Bernard finally being funny instead of the dittidydoo bs,7
A Team- Singles and Doubles for life                                                 The Other Team- Whats that?,4
Ads on Netflix?,2
Tata Motors share is up 10% since IPL started,7
"Off topic but anyone watched ""The Scam 1992"". One of the best Indian series out there",7
bruhmoment.jpg,3
"Listening to commentary alone, one might think this partnership is striking at 150.",7
Ball is lava,2
What's wrong with Santner? He is a gun fielder usually.,3
Teenage level fielding,1
Double missfields!!,0
So many events in this Ball,3
The fuck was that passage of play,3
That's what these two do to fielders.,3
Santner quietly finished his quota giving less than run a ball. Dude is underrated.,8
RCB are the slowest scoring team in the 7-15 over period.,8
The pitch is slow. Very slow.,4
Yikes such bad fielding,7
six different angles lmao graeme,3
Wtf is this outfield that was hit so hard,5
Dhoni keeping Monu sir for death overs as he doesn't want to see his mate Kohli trembling and sweating.,4
Dhoni contemplating to retire after all these miss fields,0
Lol they’re saying “brilliant” stop... gtfo of here,7
Santner does have a hunchback damn,7
Santner quota over so early woah,6
Hits his thumb,5
I fucking love dugout man,11
I watch Dugout everyday to hear Swanny take the piss out of the third umpire.,20
God just give a four dont want 200 replays to decide it's not a 4,13
This is why CSK is at the bottom,1
"That was 4, dafuq",12
Swann doesn't give a f 😂😂,11
All the dugout comms getting on the Swann bandwagon.,6
Please someone get one of these out,1
Is there a r/yesnoyesnonononoyesno?Yes ?,4
"Anytime Kolhi-AB, Anytime now",2
"Even at the age of 41, Tahir is bowling brilliantly",7
Don't have dugout on my channel. What did the swann guy say?,2
Santner knew that was a four,1
Jadeja incoming over now,0
These two are gonna go crazy after Tahir finishes his spell,3
"Murugan Ashwin bowled brilliantly yesterday, was it the same pitch?",3
Faf used to bowl leggies too right?,1
Swann has made dugout better.  I'm sure he brought some new audience to the broadcast as well,3
RCB's homage to the last great living legend of the game,5
"I am seeing everybody commenting bout DUGOUT COMMENTETARY...

how tf am i supposed to hear that? any specific channel??",7
"Masterful

Ominous

Number 1

Ultra-Cool",3
Everytime Kohli gets out all I have on my mind is “GOTTA GO GOTTA GO GOTTA GO”.,2
I think IPL should have a yoyo test to maintain standards comparable to international cricket. CSK is fielding like it's a charity game.,2
"Swann has been so caustic at times. Bless the man, bloody funny.",3
Another drop,8
Jaddus hairline is....something else,2
No one wants Kohli to get out,4
"Jadeja gonna bowl at the death today.

This is gonna be fun",5
What SRH did wrong last night was not getting this 1's and 2's regularly like Virat and AB.,9
Dunno who it was that predicted like 85-2 after 13 overs but they're looking pretty Nostradamus-esque atm,13
We are seriously out of luck!!,2
How many catches CSK want to drop before it stops being funny?,7
Is 150-160 enough in this pitch?,5
What are these field placements brooo,9
What even is CSk fielding this season?,7
Cmon vk get a move on please,7
"How to beat rcb:

Step 1: expect finch to play like finch

Step 2: keep DDP and kohli till the 16th over

Step 3: send ur strike bowler to abd when he feels rr pressure

There u go, rcb below 160 score",20
Jaddu needs a barber,5
CSK needs an astrologer to get some luck going their way. Maybe go for RPSG Goenka’s astrologer.,11
Did they seriously play Monu to give him one over?,14
Dropped catches don't go well with CSK.,20
AB getting his golf swings out anytime now,21
Don't feel bad RCB there's Monu Kumar at the death,12
Ah. Got reminded of all the drops off Dhawan. So nostalgic!,11
Rooting for Jaggi and Rutu to come good for MS and Fleming. They'd love some positivity even if they lose today!,9
"Kohli and abd really need to start going, they still have Gurkeerat, moeen and Morris left.",6
Bring monu back,3
"Play youngester. Give him one over. 
Peak csk.",1
Dhoni wishing he had picked 3 more spinners today.,6
"One way or the other, CSK should’ve made place for Tahir from the start. Spinners have thrived in the UAE",9
"~~Sonu~~ Monu, Tujha Majhyavar Bharosa Nay Kay",7
Last 18 balls no boundary.,7
Bowl Lyon you cowards,2
"Is it just me, or ABD is louder than other players? Hearing his calls every other ball..",2
I think Dhoni forgot that we don't have a death bowling in place.,6
I think the dugout feed is owned by star sports while official feed is owned by BCCI,4
CSK made team for these slow ass tracks. Imagine 7 games here.,4
Tf. I thiught that brown  hat fielder's full body was outlined with blue,1
"Kohli and ABD be like so CSK fam we have been told by mike to show a special demonstration on how to run doubles and singles, so here we go",2
BRB watching mi vs kxip highlights from last week,4
Every game I watch it and every game I am convinced at running between the wickets Kohli is currently unparalled in world cricket.,5
Kohli/ABD partnership has lost some of the oomph it had in previous seasons.,0
Fucking cunted that.,2
"Sam Curran will obviously bowl a couple at the death.

But for the other two death overs our options today are 

Jadeja 

Chahar

Monu Singh

If AB stays till the death can see them two overs going for atleast 50 min",2
Kohli gonna tuk tuk till the 20th over without getting out,1
What a shot by Ab,2
Shot AB,2
"So it’s going to be Monu at the death 

Yayyyyyy",3
Yes Tahir deserved wayyy more games,1
kohli be like why take 2 single when dot and double do trick,8
Monu can be our Shivil Kaushik today.,6
I am one day late to ask this. Why didn't Shaw play yesterday? Dropped or injured?,0
"Oh, what a timing.. even faf couldn't reach that",5
"24(26)

24(22)

That was a good phase for us.",10
Here we go it’s starting,8
AB is going to pump Monu and Chahar at the death. CSK need to get him in the next 2 overs.,12
Is the ground slippery?,2
Monu shonu looking so chotu,10
 Bruh moment by Monu there,5
Aight my Morroco Pasta Pizza is here wish me luck,15
It will be bad if any of these set batsmen lose their wicket.,1
No boundaries yet for Kohli.,-3
KEEPER  KEEPER KEEPER,3
Partnership which represents the term Passive Aggressive,5
What a shot Koach,3
Fasten your seatbelts boiis! Here we go!,4
"Oh man, Dhoni folding his hands and waiting for the Ball to come back while watching even the young fielders mess up things lol!",8
Inb4 one of these guys get out and people start calling for them to be dropped.,20
First boundary for Kohli,4
Did he hit it between the legs?,5
are these guys expecting csk to bat like how they did last game?,1
Why isn't csk realizing these people will start picking up runs soon and not just singles forever?,7
83 in the last 6 with Moeen and Morris to come is do-able,6
The rampage is gonna start anytime now,12
150 is par here so RCB is batting sensibly.,8
Tahir better not lay his hand trying to stop that ball.,9
Not many players can take 4 on that ball,9
150 is the target I'm guessing,2
No Tahir wicket today! Ffs 2020,19
Tf is BKT,4
I have a feeling Jaddu might go for plenty,2
Monu is a tiny boi.,8
Can anyone explain why tf is kohli called KOACH,5
"Ez win for Rcb, they're gonna get 170+",1
Ab needs to play out this over. Then it's absolute carnage,6
still csk match to lose. They have the momentum just need to apply the choke,1
"VK, AB there is something called onside also",4
"Who is going to get Dhoni's jersey today?
Maybe padikkal",10
"Still feel RCB need an  attacking Batsman down the order in Dube, not Mann

Sundar is there to steady the ship",9
Need atleast 160,4
Chahar and Curran have 2 overs both.,5
Ooof play this over out please.,-1
"World's best batsmen playing at run-a-ball batting first.
Going to horrible watching Jaggi and Rayudu in the Middle overs all over again!",2
He was nowhere near lmao,3
We need one more Monu over please,4
we have moeen and morris left lads,8
"Sunil ""Flights are about to take off"" Gavaskar.",10
149,6
Someone should make a post about why kohli is called koach and pin it in the sub.,14
Lol sunny G,7
I’m cringing for Gavaskar because he’s already repeatedly predicted ‘flights taking off’ every ball but it hasn’t happened yet,7
Kya slow khel rahe hain yaar,0
"14 overs in 1 hour. With a strategic timeouts, that's a very good overrate from CSK. Yes I am trying to find positivity.",23
"What are they waiting for, assault should have begun an over ago..",1
[deleted],6
[deleted],8
"###########################
65 million years. Zap",19
wtf virat,1
You know the wicket is slow when ABD is batting at a strike rate of 100. I'll take anything above 160 at this point really..,13
Monu will get both of them.,1
160 realistically,4
"Sam Currans shades are some of the most horrific I've ever seen, fair play",5
"“Flights are about to take off” this over. 
2 dots, and 4 singles. 
Lol",6
Sunny G cringe,2
90s ODI nostalgia,2
Phew,3
"Why wasn't Tahir given more matches 

DHONI : No spark in youngsters :p",10
"With the pitch getting slower, 160+ would be really difficult to chase.",2
Just wanna see Monu Kumar bowl,1
Plenty of hot singles in the area.,13
"Never watched Sunny G bat, but I have zero respect for him as a commentator",-2
130 would be a difficult target for csk. xD,-1
Lyon to bowl,3
I’m scared for CSK if ABD and VK are struggling to hit big shots,3
Monu looks like that Shel silverstein dude from the Wimpy Kid books lol,3
🐐,1
Jadeja finishes an over by the time I pee and get back smh,2
This monu guy looks like Nathan Lyon,2
MONU LETS GO,6
"Last 5 overs, here we go. 150 at least has to be expected with this setup and wickets remaining.",2
"Monu to get pasted this over, called it first",3
Budget Walter white here guys,3
Carnage starts.,1
Why is Lyon playing from CSK?,3
It's time. Release the KRAKEN....,1
Monu sir 😍😍😍😍😍,1
Unpopular opinion: Moeen Ali shoud played at 4 he has the highest strike rate in middle overs since his debut in 2018.,1
Garry’s back let’s go.,1
Big over alert 🤣,0
What is wrong with these RCB fans? 126 was defended here yesterday... Chill out,4
Fuck yes death bowler Monu,3
"Monu is back, here we go",2
people are predicting 160? no way. 140 at best,-1
"Last csk vs rcb RCB at 15 -95 -> 20-178

This match 15-99 ->20-??",2
Ooh he’s from Jharkhand,2
Mighty over incoming,2
Wow he is like five feet tall,0
"Let's go buddy!!

Whole CSK is with you.",1
From when did Lyon started bowling fast,2
Who tf wants an interview now.,2
Jadeja and Santner have bowled 36 balls and Moeen has faced 0 of them. Can’t help but feel this is an error from RCB and overcompensation for their mistake vs KXIP,2
Katappa back into attack,3
We all woke up today for Monu v ABD,6
Is this yesterday nights pitch?,2
Monu is a nice name,7
[deleted],7
 Moeen Ali and monu kumar are katappas of this match.,7
Lemskart should sponsor a misfield of the season and show the worst misfield as ad till next IPL so as to shame the misfielder. Better incentive than catch of the season to field good.,11
this is now more like Chennai pitch and conditions.,3
The GOAT for all GOATs: Monu Singh,2
In b4 Monu gets Lord status,4
Chad Koach vs Virgin Monu who wins?,1
Gavaskar keeps predicting boundaries but wasn't he here just yesterday for the other game. The wicket is hard to bat on,0
I feel bad for any ragging Monu might’ve faced in his life,14
Virat shivering seeing the real GOAT,9
Bachchan is selling this Dubai thing real hard... think he has a stall there?,4
Definitely don't wanna run into Monu in a dark alley,7
I don't get why Santner has hardly played. Decent bowler and would have improved the lower order batting.,2
"Man I can't watch Monu vs AB and Virat. Please boys, he's a kid!",4
Monu Kumar is a new face so I guess Kohli will reckon giving away his wicket to him.,11
How old is Monu san ?,1
BREAKING: local man with poor knowledge of the pitch has strong opinions about the run rate,10
What's monu kumar's height?,2
This Monu dude looks like Dr Neo Cortez from Crash Bandicoot lmao.,3
Twice ABD shouldve been run out,6
"Such has become the state that Nathan Lyon had to give up his off spinners, name and nationality to be an ipl player",14
Lmao did gaikwad just roll around on the ground?,5
[deleted],10
Is ruturaj a 3-year old or what,1
It isn’t a Monu over without an obscene wide,11
Monu looks like Birju from CID. The guy who always spills out the plan after 1 slap from Daya,8
Bowling coach thinks he is very accurate. And he bowled two wides down the leg side in the first over.,2
Monu Kumar will be perfect in a Roadies sketch by TVF,5
"Just had a look at Monu's shoes...message ""fuck it,bowl fast""",3
Monu is the love child of Nathan Lyon and MSD.,4
Come on monu!,1
This MF Monu said 🗿,2
The only Ubuntu I know is Linux.,5
"Monu Kumar played in 2014 U-19 World Cup with Iyer, Samson, Kuldeep, Sarfaraz, Hooda 

damn",5
Ubuntu?,5
Lyon bowling well. No pace at all,3
"Eric Simons can be a nice commentator, is clear in what he wants to say and is witty far better than most of the current lot",2
Koach looks frustrated!!,2
"Kohli will hit him for 3 consecutive 4s, and then will get lbw to monu",2
No ball,1
CSK literally picked Monu because of his height. Or lack there of. LMAO,3
The pitch is clearly tough to score. Calm down mofos,4
RIP Monu,0
Freee hitttttt,1
No way do CSK's youngsters give old vibes. It's in the DNA.,3
If katappa had beard,1
This is gonna cost him now,1
Free hit to ABD,1
"This pitch looks tough to bat on, kohli is charging down the pitch every ball",3
Oh no Monu!! What you do?,2
Erm constantly commentators talking about Monu's height is kinda getting old rather quick.,8
"Monu out here looking like Indian Nathan Lyon, and the yellow doesn't help either",8
Ball is a hot potato,3
Monu ji will not finish this over today,3
Monu kumar is Bollywood comedy villan.,7
Monuu nooooo,4
[deleted],10
Ok De Villiers better hit this one for 6,1
I think De Villiers plays the highest number of beamers!,3
Yeahhhh kohli LOUDERRRR,2
What would be the ideal score on this pitch? What would be the ideal score for CSK?,2
CSK fielding like Chumps.,3
[deleted],0
Nice Monu,3
This is a great over by monu against two quality batsman,7
Wow. The coach calling it!!,12
Even the youngsters in CSK look 35+,22
"Eric Simmons, the bakra you put upfront when the team is shit. No more Hussey or Fleming.",3
Ohhh monu with sexy yorker,5
Damn this guy is actually good except for extras,13
My god how tf is everyone misfielding?,7
Wow that was some Yorker,15
Maybe monu does have a spark indeed,12
Bhai marna kab chalu karonge?,8
Both abd and vk on 32(31) ffs,10
I want Curran's sunglasses.,8
Not bad from Monu wow,8
Well done,3
Good one Katappa!,12
from being a judge on Roadies to CSK..it has been quite a journey for monu,20
"RCB: We'll wear green plastic jerseys

Curran: I'll wear green plastic shades",39
Look at the symmetry,2
Monu 'Malinga' Kumar,6
We're fucked.,2
[deleted],-2
Monu Kumar looks a lattu,2
The most disappointment with our team is the Fielding.,6
"Csk gonna win this with 10 wickets, aren’t they.",8
Monu Singh arrives: Bumrah be scared be very scared,12
For the first time Koach looks more threatening than ABD,4
"Monu shd change his name to ""Extras"" Monu",2
This pitch is fucked if ABD is struggling for timing.,8
Can already see Saini getting tonked everywhere,10
You think Monu looks like Lyon? Give that guy a longer beard and Curran's sunglasses and you see a Hashim Amla,11
Can't believe this is Kohli AB Partnership. I'm expecting utter carnage in the last 4,10
4,1
Binging with Babish is quite a handy bowler I see,15
"If both AB and Kohli aren't able to score quickly, that MUST mean the pitch is difficult, right?",37
Rcb need 170 pls,7
"Why are they so slow?

We have morris and moeen next cmon",9
Looks like Monu likes to bowl 9 balls per over on the regular,17
lord jadhav blessed RCB,6
"Sry lads, doesn't look like a 249 to me today",19
"Minus bowling a lot on the pads, otherwise he's accurate",10
"It was a very good over, the figures might suggest otherwise but has bowled pretty well",17
Fielding is agricultural,6
Is the pitch thaaat bad or what,8
RCB inspired by yesterday's DC chase? Or Dubai pitch did full 360? From 200 plus scores to 150?,10
AbD with a SR less than 120 😨,7
Need 60-70 in the last 4,6
"If bowling doesn't work out for Monu, my man has a solid career in acting as the minion of the villain in South Indian movies.",9
