Comment,Upvotes
A Dhoni team choking in the group stages. Something I never thought I would say,7
Great job by Russell.💪,4
It feels like Sam Curran plays the same innings every game.,9
Jadhav crossed,2
Ded,1
CSK lost it.,1
DK captaincy was on point today,2
Morgan gets his revenge on Scurran,1
Russell doing with the ball,1
And that’s what happens when you assure the set batsman that he’s gonna have to do it all by himself because you’re worse than useless,3
YES. WE HAVE A DEATH OVERS SPECIALIST. WE DISMISSED THEIR BEST BATTER TOO!,3
Those 3 dots from Jadhav absolutely built pressure for that wicket.,8
Dre Russ..my man,6
Jadeja will still win it easily despite Kedar,2
Morgan is real captain here dk is just setting the field ...just like pant sets the field in DC,5
"Hold ya horses ,Jaddu can hit it",4
Time for someone to curry Curran's wicket,1
Does csk tail start at 4?,2
"The game is done and dusted for csk i think 

Or is it?",2
"Morgan making the field changes and talking with the bowlers, just make him captain already",9
We are done. Thanks Thala and Jadhav.,3
**COLLAPSE SUPER KINGS**,3
K O H L A P S E,2
Was Kedar Jadhav ever good enough?,1
Assist: Jadhav,4
Jadhav Tewatia moment incoming,3
Jadhav plays 3 dots now Curran gets desperate and gets out. What a shit show,3
"Kedar Jadhav is a such top class player

He is already honing his skills for the Test series against Australia in December

Fuck IPL matches, all glory for the National team

I mean, why do you guys not respect the hussle of this legend !?",4
Only KXIP can lose to CSK,4
Some of my friends support KKR. Just cause they have hots for Bengali chicks.,-1
Jadhav fuckin did this,6
Russell the batsman has underperformed but Russell the bowler has been really good.,7
Russell’s transferred his batting power to death bowling power.,4
jadhav should be dropped for those 3 balls alone what a dumbfuck,1
omg are... csk..... choking??,5
I have a strong feeling csk won't make it to playoffs,4
Send Bravo,2
SEND BRAVO NOT JADEJA OMG,4
Fucking obviously this was bound to happen. This lilliput literally left the last three balls of last over.,3
"The way Russell ran in, I felt he was warming up. I didn't think he would legitimately bowl, much less get a wicket.",3
Yeah that's gg... completely bottled by the middle order. We have no business losing 78 off 60 come on,5
It definitely gets harder when the ball gets older,1
Csk needs to clean house and get some youtthhh,1
"Meh, just appear like losing and then win it. Is this the real taking deep part? Or is it Jadhav’a redemption to show middle finger to us?",1
Guess this match was another one of those stoppable force against movable object kinda scenario,3
Birthday boy bravo winning it hopefully,1
"Curran is a 20(10) sort of player. If you’re relying on him to close a game by *himself* , you’re doing something wrong",3
DK playing 9D chess with the bowlers,3
Jadeja can still swing but Jadhav...,2
Why the hell isn't Bravo out there ?,1
Saala everybody bats in this team.,2
and with that all English TVs have their channels changed,5
"**17.1** Russell to Curran, OUT, can he ever? Can he ever? **129-5**

SM Curran c Morgan b Russell 17 (11b 1x4 1x6) SR: 154.54",3
Jadhav will now hit six sixes in an over.,3
Dinesh Kartik playing chess in  uncountably infinite dimensions,8
Currantly things are NOT looking good,6
oh no. Sir jadeja is here.,4
"DK to MS : match mai jeet leta hoon, aap Dream11 me team bana lo.",10
Collapse of epic proportions,3
"Faf, Watson, Curran and maybe Rayudu are the reliable batsmen on this team.",5
"Cummins bowled that economical over in the middle and since then CSK hasn't been in the game. 

Maybe came in for a second when Curran hit Narine for 6/4",8
Thakur would be better than Jadhav,3
"I not even disapointed, I am just sad!!",6
Russell is hard to hit. Has a mean bouncer and good Yorker!,3
Alright. We lost this.😭,4
"This isn't really RCB level bottling yet, but I'll take this for now.",7
Meh game tbh. Typical CSK. Openers get out. Dhoni comes in. Dhoni gets out. Game over.,5
Balajii,5
They were 94-1 after 10 lol,11
b a t d e e p,7
Holy fuck Jadeja Jadhav DJ Karn it's long tail,6
Guys relax lord Thakur is yet to come,11
Keep jadhav on strike please,7
DK best captain in IPL don't @ me,6
I guess DK outplayed us.,3
Just put under so much pressure by Dhoni and Jadhav. Can't blame him,1
I want Jadhav to be slaughtered by people online if he doesn't perform today,1
Jadhav won't even run lmao.,3
Did jaddu said chutiya to jadhav after he said no for the second run,1
Jadeja can hit it around. Worried about him.,2
The only way CSK is winning this is if Jadhav sacrifices his hamstring.,2
Csk can still make it. Don't count them out.,1
Lmfao Jaddu has a SR of 123 being a lower order batsman.,2
why is this fuck not running,5
Loda jadhav bhaag b nahi rha,3
Jadhav not even running ffs,2
CSK going the RCB way and RCB going the CSK way. Strange year indeed.,3
People shitting on DK for not using Narine in the first 10 overs. Where you at?,4
"Send birthday boy Bravo to finish the job already. Bravo didn't bowl to Russel , let him at least get to bat against him.",2
CSK middle order with smol pp energy,3
Despite the outcome I hope people learn to not shit on captains (DK in this context) after a couple of bad matches or calls.,2
"We never saw it coming, did we?",4
Haha jadhav,3
"Hahahaha, jadeja mad at jadhav",3
*CHOKING SUPER KANGZ*,2
"Russell bowls 140+ with a bad knee..
Hats off to the guy.",1
"This is nice captaincy by Morgan

Single handedly turned around the match after that shitty first half

You can see him talking to the bowlers every ball since 10th over",3
So a fielder and specialist hair dresser on the crease now,1
Jadhav fucker is good for nothing,1
DK apology thread when?,2
"Dhoni 10 years back : ""We want young and fresh players in the team""

Dhoni today: 'We want players with a lot of experience""",10
I am feeling happy for Karthik,3
Sam got Eoin out and now Eoin was half responsible for Sam getting out. They are Even Stevens now😀.,1
Someone has to try to hit if other players gonna play 3 dots in a 12 run an over required rate.,1
No way KJ is running a quick 2 with a hamstring that has the structural integrity of a snowflake,8
Used to be a fan of Slowni but then I grew up,1
"Should’ve sent Bravo, he has that BirthdayBoyEnergy^TM today",1
How is he hurrying batsmen with 135 ks on a slow pitch?,1
We bat till 11 but can't chase 168. on their way to 153/5 again. How does this happen again and again,2
DK comes across as a genius for holding Dre and Narine for the death overs.,3
I think Jaddu is the only one to have 100+ wickets and 2000 runs in the ipl,1
if jadhav doesn’t hit a 6 i’m gonna be fuming,1
How the fuck did Kings XI lose by 10 wickets to *this* chaska lineup?,8
All of a sudden DK is like 2011 MS,6
C'mon we'll win this,1
"does bravo play as an out and out bowler now?  
sure he's better than jadhav",3
Dhoni should have been the one to be given a room without a balcony.,6
"These match threads make the game so much more enjoyable, I love it!",7
Brilliant captaincy by Eoin Morgan.,7
What does Dhoni see in Jadhav ffs,11
Incoming proper defence,1
DK took it DEEP™ today,3
Time for some test cricket,2
Four over mid off incoming,2
RR 14.5 tf ?,2
Jadhav worst batsman of IPL?,3
Bhaag DK bose,1
3 fucking dot balls bro my head's hot,1
Great swinging by jadhav.,1
Jadhav please,1
Jadhav tf you counted fielders for a dot?😭,12
Plizz Jadhav.,3
Amazing 0 in 4 balls by jadhav,6
JADHAV YOU CHOOTH,5
CSK = Choking super kings!!!,7
Jadhav def match fixing,2
The self confidence shown by jadhav denying jadeja strike should be declared the 8th wonder of the world,13
*StReEt SmArT pLaYeR*,8
Jadhav 4 dots,9
Rinku Singh can't be worse than Jadhav?,5
Shankaresk miss,1
Don’t shit on r/cricket for lambasting DK’s captaincy everyone thought that was loony biz. look at the process not the outcome only,9
Bowls-a-heavy-ball™,3
Bravo still in the dugout. Is he out of form or injured? Why send Jadhav ahead when he hasn't been doing well.,1
DK OUT HERE WITH HIS 7D MOVES.. THAT BEARD WAS FUCKING HOLDING HIM BACK. DK DOES A TEWATIA BUT IN THE FORM OF CAPTAIN AAAAAAAA,9
"Well Sam, you took 2 wickets, scored runs quickly and gave me Fantasy points. Obi, your work was done here.",4
The last match just put some paper over the cracks. A lot of our batting order is shit.,2
WTF JADHAV MADACHOD,9
That fake audience is seriously ridiculous. Really need to sort it out,3
"I’m happy for Varun Chakravarthy. In his first season expectations were incredibly high and there must have been a lot of pressure on him.

Good to see him do well. On the other hand, it must be difficult for KKR to unable to use Kuldeep. Did lockdown kill his career? Not that he was exceptional in last year’s IPL.",3
Mistake by Dhoni to come out at 4.,0
"KKR lost a matchwinner in Dhoni but they have their other matchwinner, Jadhav in the crease.",9
11 of 12 from Dhoni. I understand taking it deep but man this isnt 2018 anymore.,3
0 in 5 balls,6
60% to 38% chance of winning,1
Jadhav why why why why u exist,2
"0 by 5 balls, guess the player.",2
Why tf he's even playing ffs.,1
Top notch batting by jadhav,1
"Man, this is so sad. The top 3 played so well",3
"Not a maiden over, surely?",1
Painful to watch Jadhav,4
"Jadhav already in retirement mode, totally given up on his career.",7
This dude is worse than Tewatia’s shitty phase.,9
Jadhav just feeling the pitch,5
"Can we give Morgan captaining theory a rest. Was he the captain when CSK was cruising? If that was DK, this is DK too.",8
Holy shit Jadhav is gonna get brutally trolled on twitter today,7
"This is actually embarrassing for an international player

At least Dhoni gets bat on ball",13
5 dots,3
KKR's walking injury bowling to CSK's walking injury. Gotta love it!,3
Inb4 jadhav pullsnoff a tewatia,5
A length ball from Russell is a short ball for Jadhav,5
"In the words of Danny Morrisson, ""the Double Js are at the crease""",5
"I hope none of these two get out now!

Don;t want Shardul Thakur in the crease suddenly in the last 10 days.",5
Jadhav dot ball count: 5,10
JADHAV LMAOO,5
Jadhav get the fuck out and give chance to bravo atleast,5
Jadhav you fucking cunt,3
At this rate Jadhav gonna raise the bat when he score his 1st run,12
Ohh fuck off Jadhav you piece of shit,8
Press F for Kedar’s CSK spot,8
Lol Jadhav looks like he might start crying,8
It's like Dhoni never got out...,9
Lord Jadhav is doing his bit for KKRs win...,5
Jadhav bhenchod,8
Jadhav best batsman,6
OMG. I think I might punch this guy.,3
And Jadhav has completely forgotten how to bat.,2
Jadhav 😂,3
"Ohh man, I am just waiting for Dhoni's post match after they lose this game.


Tip: Switch from Dugout to English. Dugout doesn't show post match interview immediately.",3
"DK, if he pulls this off, is a fucking genius with the bowling chances.",2
"I keep seeing people mention Bravo, he can't really bat anymore. He's not dangerous",2
Morgan it seems has overtaken the reins.,2
Jadhav looking at the umpire like as if bowling short balls is illegal,5
Gets off the mark in one over.,1
Nice Kedar Jadhav taking it deep,2
Most surprising twist of the day is the DK redemption arc. Hasn't put a foot wrong with his captaincy. Just 30 mins ago this whole thread was shitting on him for holding Narine back.,7
jadhav lol omg,2
"Yeah wr have lost it, both of them can't hit.",3
What an over so far from DreRus,3
"I want Jadhav to get a 10 ball duck and make us lose humiliating, so that MSD and Fleming will have no excuses to keep him for the rest of the IPL.",6
0(5) is really some half Tewatia BS come on,2
And takes a single...hahaha,1
Why wouldn’t they send in bravo after curran? It’s like they’re trying to lose.,3
Jadhav with a gritty 0 (5) bois.,6
Seriously hilarious what this match has turned out to be,2
Imagine earning 8 crores for this.,8
How t f is kedars exclusion from the team so obvious to everyone else other than CSK think tank.,3
Nice flick off the hips. A beautiful elegant shot!,2
You see that’s why Dhoni does not come out early. He gets exposed so bad and it hurts the brand.,7
Oya kr rha hai ye,1
"Should have bought some batsmen!! 

Motherfuckers!!",3
"Jadejadhav partnership is going to win this, still doable",1
Karthik to Morgan: ye me kar leta hoon aap jaake fielding karo,5
"Damn Russell is back again as KKR's Top wicket taker this season. 

He has switched from Batting AR to Bowl AR this season so far.",3
CSK burying themselves,5
"Ah yes. Kedar Cricket, inventor of the sport called Cricket",5
At this point Jadeja should refuse the strike to Jadhav,9
Jadhav doing exactly what is expected off him... Nothing,2
"Upgrad: I got promotion from learning not licking.

Jadhav : I got 7.8 cr for licking Dhoni

  


Jadhav> Upgrad",13
Man.. I'm not even a CSK fan. An usually I'm very understanding of the batsmen. But 1 (6) at this situation. C'mon Jadhav. Have to do better than that.,9
Don't worry folks Jadhav will play entire season without getting injured,6
he got a run!! let’s gooooo!!!,4
"If DJ doesnt get to Bat again and CSK loses, i'll be absolutely mad.",8
Scurran died for this shit,10
pathetic,12
Kkr need to be very clinical now. CSK can still win,6
"Jadhav 1\* (6)

KKR fans loving it.",13
Can Jadeja weave some magic?,5
Useless Jadhav,5
Reminder that Kedar Jadhav has an Indian contract. Go apply for that job! You’re not under qualified.,7
Gentle reminder that Jadhav was RCB's best batsman in 2017 lmao,13
Jadhav is such a frustrating player to watch.,8
Maula mere Maula mere Maula mere Maula,6
"Top 10 biggest mysteries science can’t solve

No.1– Jadhav’s role in this CSK lineup",16
Trivia: name the player with 1 run off 7 balls in the 18th over,9
"What kills me is, Kedar will play next csk game.",20
"Is Jadhav’s knock the worst in entire IPL history. 

Cannot think of a worse knock that was this bad comically.",19
Jadhav should raise his bat after the single,20
No way KKRs gonna lose this now,2
Now I want to see Jaddu refusing a single to Jadhav this over,6
"Russell and Pollard are sooo likely to come in clutch omg. Game changing players, and consistently so",4
So 2 remaining overs are Narine and Russell right?,2
I’ve seen this story too many times this season,4
That was some good bowling from russell,1
Well it's the energy that CSK is lacking.,1
"Is it just me or someone else also think behind Karthik's successful bowling rotation, it is perhaps Morgan who is devising these clever plans.",2
[deleted],9
Russell has quietly put in some great death overs this season. Respecc,6
36 off 12 still chaseable. Don't lose hope machas.,1
Russell is underrated as a bowler.,3
"Sam Curran is the real consistent player of the IPL, constant score of 15-18 in each match.",10
Kedar Jadhav wants to pull a tewatia but without the good part.,4
"God fucking hell Russel dada, just throw the ball at my face instead so I don't have to watch Jadhav bat",7
Can’t believe CSK will lose the match. At 10 over stage it was their game...,5
What happened to Kuldeep?,1
Reminds me of Pak v RSA wt20 2009 semifinal,1
"CSK going to lose by 20+ runs today

You heard it here first",5
He's just wasted a full over. Embarrassing,3
Shithousery from DJ playing Chammak Challo,3
"Yeah CSK ain't winning this. This loss is gonna be more infuriating than the last three, argh.",3
CSK Slowly but surely trying to snatch defeat from the mouth of a win,3
So kkr theme song is basically srk movie songs?,1
Jadhav counting fielders like he's gonna hit it in a gap and cleanly misses,5
"Hope Russel can Pull through this ,doesn't have much of a problem there",3
This guy is paid a million dollars for this,3
Gr8 over by Russell nevertheless,2
Fleming's having an existential crisis right now.,9
"Jadhav is a limited player, they'd get better results with Vijay playing at 5. Wouldn't you prefer a 4(6) instead of a 1(6)?",8
DK lowkey showing Dhoni he's still got it captaincy wise,3
Hazelwood rarely comes to play IPL and now he's here and on bench,6
One more Russell over and that's the game Butlya Jadhav can't do shit,2
MS to r/cricket: Mere retirement ki bhot fikr hai tum logo ko,5
What was Jadhav doing with those forward defence against Chakravarthy,2
Ian Bishop is the Sangakkara of bowling. Very insightful comments on bowling actions and tactics.,4
Jadhav got paid,7
Is it that stage where we move over from shitting on DK's captaincy to praising Morgan's captaincy?,5
"Jadhav got to play in India & CSK, because Dhoni always backed him. Change my mind.",6
"Eoin Morgan, ""look at me, I'm the captain now.""",6
Damn Jadhav cant bat for fucks sake,1
Jadhav single-handedly infuriating all of Chennai. Carry on good sir,5
It’s infuriating as a CSK fan to watch this shitshow especially Jadhav,2
CSK collapsing in the same way KKR did,1
BRO JADHAV WTF,1
CSK treating Russell like he's rabada. This is the most glorious botching up of a chase I've seen in a while,7
Jadhav bsdk,1
Send his ass straight from the field all the way back to India,1
Narine 😅🤣🤣,1
Come on jadeja.,1
"""ye andar ki baat hai, Jadhav hamare saath hai"" - KKR fans.",3
The pitch has really slowed down. Good idea to save Narine and Varun's over.,2
6 overs 64 not walk in the park,3
Omg. I am nervous,3
42 runs in 8 overs. They were 90 for 1 after 10 overs.,7
"My favourite part of the threads

Pant, Kohli, dhoni, jadhav while batting

Siraj, unadkat, rabada while bowling",10
Watching paint dry > this match,5
"CSK fans, If y'all lose from here, the below comment on cricbuzz by one of ya'll is the reason. I've never got more jinx vibes from anything else before

***SJ****: ""The sleeping giant has finally woken up! Should be a walk in  the park for CSK from this point on. As for KKR, lots of things are  going wrong for them, starting with their skipper first. They must make  some adjustments quickly to stay in contention for the next round.""*",9
Russell has been Excellent with the ball this season,5
DAE Street Smart?,3
Like I said CSK absorbed more than a little bit of RCB. #thenewRCB,4
I want to appreciate MS for working on his beard game. Nice barber find. Hope he is getting some good selfies,5
Some masterclass from DK saving Naraine and Russel for later part of the match.,3
"Full props to DK on his tactics but I still don’t agree. CSK still needed 68 of 48 when Narine came on. That is gonna lose you the game most of the time. It’s just that CSK are real shite with their batting. Everyone after Rayudu is just a big name not a good player anymore. The one who shall not be named .And even with that if Curran doesn’t get out, you lose the game.",8
Now or never for Jadhav,1
"I don't think Kedar sucks, but the way they use him definitely is. He needs a few balls to get in and Curran can hit right away. Why send in Curran in the 14th over and Kedar in the 17th? Also, he's not good enough on batting alone, but he's handy with the ball. Play another batsmen and let him bowl part time.",1
"Do I play for pride? No.

Do I play for glory? No.

For money? No. 

For family, for country, for the sheer essence of competition...? No.

You see sir, I play so that one day I might be named the Altroz Super Striker of the Match™",5
Imagine having batting till 11 and sending this clown Jadhav in,3
Keep trashing KKR here don't drop your guards here r/Cricket,7
Jadhav to play out the last over before tea,4
I thought KKR bottled this with 74 off last 10 and we have 42 off the last 8 lmao,3
Jadhav chance to redeem himself and do a tewatia.,3
I really want csk to finish last if they lose this match. Stop this experience player grabbing bullshit,6
"Kedar Jadhav is the best batsman in death overs.

For the opposition.",5
Welcome to the shit batting club CSK,2
Eoin Morgan is talking to the bowlers all the time. Looks like he the designated bowling captain of KKR.,8
"KXIP are generally shit, except that match, no CSK batsman except Curran has shown he can go at 150 strike rate from the word go",7
I know Jadhav's neighbor. You can send me whatever message needs to be passed on. I will insert the MCs and BCs myself.,7
If you thought Dhoni was bad....,8
"bugger off Jadhav, You don't deserve to be wearing the jersey of CSK.",6
Kedar is good against spin.,4
Damn Jadeja tryna break his back or something there ?,3
Another classic suicide by CSK.,3
Whoever thought of keeping Narine till the end took a gamble. Gamble paid off.,7
Tripathi's innings 🙏,4
"CSK plays for NRR, Jadhav plays for KKR",36
Oo jadhav,3
Jadhav suddenly has more fans and people supporting him than he has in his entire career,8
"I think CSK should drop Jadhav and give an extended run to youngsters. Even if he somehow miraculously ends up winning this game for CSK, he is a shadow of his past self with the bat, a liability on the field and is not bowling either.",6
I don't believe my eyes.,5
God's miracle,5
SRH may win tomorrow. Kings look hopeless.,0
"Shit Jadhav hit a four, I'm sorry csk fans, his spot is now cemented",13
Raina is the missing link. They are playing like they still have him down the order,8
I am not ready for tomorrow's game...No Bhuvi against arguably the best batting side,8
Why csk fans are acting as if this wouldn't have had happened ?,8
"When kkr does bad: DK iS a ShIT CapTAiN
When kkr does good: MoRgAn iS DoiNG iT.

Y’all are just dumb",14
kedar tewatia???,4
Curran must be seething with anger at these clueless idiots,6
"Prediction : Russel bowls last over. A sudden short rain forces ground to be slippery. Russel keeps slipping, all balls are wides. He bowls 36 wides. Csk takes home victory",13
Jadhav with I N T E N T,7
Jadhav redemption,6
Csk could've won this,3
wow jadhav!,4
Dhoni's expressions throughout the season has been like a failed dad,4
"Morgan's kinda involved but looks like this was the plan all along. Keep the spinners for when the wicket slows to a pulp and they responded by removing the dangers.

If Narine closes this out it a fantastic spell.",5
This short to Rohit and he will hit you on roof,10
4 sixes jadhav,2
Can he pull a twatiya?,4
Mistake by Karthik. Jadhav and Jadeja are strong against spin.,1
Lord Jadhav 🙏🙏🙏,3
Kadhav’a first four in how many years?,6
Yeah that’s Jadhav’s quota for the total boundaries this season,11
Lord Jadhev coming on,2
"Curran can’t always be expected to perform. If he fails, then who will step-up? Like how TF can Jadeja, Dhoni and Bravo can’t be trusted to close the game? You have to be kidding me if Bravo can’t bat.",7
"My lecture starts right at  lunch time (12 PM)

Still who has a more shitty timing - 

my lectures or Jadhav-Jadeja ?",5
Gotta hand it to them - that's one hell of a choke job by Chennai with the bat,5
18 runs an over..  :(,3
"No excuses here, we should have won this game",9
Didn't have to be so close.,1
[deleted],9
Jadhav doing the dhoni,3
Should have been Mavi,3
Time wasting tactic™,2
Hits a four and asks for a new bat lmao,17
Kedar Jadhav is stealing a living,3
We should have sent bravo.,2
Lol Jadhav replacing bat after 1 boundary,6
Bravo taking a nap.,2
Jadhav is just waiting for the perfect time to pull a Tewatia guys,7
Jadhav bringing out his Tewatia bat now.,6
Ofcourse a change in bat,3
"So Watto and Faf gone, match gone for CSK.",4
so jadhav can hit narine for a boundary but Dhoni can't,5
This is Jadhav just trolling us,8
A spinner in the death overs is always a risk. Maybe should've gone with Nagarkoti.,1
[deleted],6
Well well well jadhav changing bats,2
"Strategy of keeping Narine till the 10th over

If it works, r/cricket: Home work done by Bmac and team, good suggestion by onfield captain Morgan. 

It it fails, r/cricket: DK is the worst captain of the IPL, cant wait for the mid-tournament captaincy switch.",9
Kamlesh nagarkoti looks a little bit like Jin kazama from tekken.,2
Every match I've watched the chasing team has lost. Somehow that's about to happen again...,1
My 2 bucks on Jadhav getting out after the bat change,1
Both teams played like shit after their 10 overs.,1
CSK are a team of Dhoni mimickers,6
"People asking will he pull a Tewatia 

Answer : Big NO.",6
That Russel over tho. Removed Curran and perfect lengths to Jadhav at pace,2
CSK: Pta nahi kyu aise situation mein hamesha me hi  kyu aa jaata hu,1
"I hated it when rcb dropped so many good players over the years.
Do not regret jadhav",2
Jadhav dot ball count : 6,2
What things exactly go into the fair play award?,1
Super over would feel like a win rn,3
😞,2
Should Punjab do this? Use Mujib and other wrist spinners in death (except Sharjah)? Can't be worse than our pace bowlers,2
"Yes that's right, its the bat's fault that you bat like its a test match  Jadhav.",3
Kedar Jadhav out there pretending to be a cricketer.,4
"Obviously it was the Bat's fault guys, curse that stupid bat",5
That was a Wide!!,2
Great batting jadhav baby,5
"Lmfao what did he do with that bat, he missed 3 of his 7 deliveries at least. Why does he need a change now?",2
If KKR pull this off. Credits to DK.,6
"Just a reminder, this mug earns 7.8 crore per season for this shitshow.",9
Fielder almost gifted Jadhav the boundary so CSK wouldn't drop him lmao,8
"Ha! Yeah,  the bat is the problem. You useless fella",7
"This was a self inflicted choke by csk, they can't qualify for playoffs like this",14
Yo..what did we do to be 7th on fair play rankings?,2
"KKR on top of fair play award  ,this is a parallel time line people",3
BMac trying to pull off sandpaper gate 2 with that walkie talkie?,3
