Comment,Upvotes
Top much intent they learned something from last match don't leave it too late,2
Kohli with the look from past seasons,6
Looks like last match Siraj was an exception,7
"Good batting, bad bowling, both?",3
Only thing that can save the day is mi losing so no one qualifies yet,11
Siraj back to form,7
Blinding!!,3
Rayudu wiped after running a 2,8
"Siraj 0-29 (2)

That's the Siraj we know",20
Who are they and what have they done with CSK?,12
Gosh Rayudu seems to have added a fifth dimension to his batting,6
Siraj's figures show normalcy has been restored.,2
Was that a flash in the pan performance by Siraj?,1
Rcb hit only two sixes ;-;,2
where the hell was this timing?!?!,2
"Holy shit that was some shot, absolutely smoked.",5
Siraj back to being Siraj...and the world is back to normal.,2
They're using 4K cameras to film. Why no broadcast?,2
"I am too numb to appreciate this partnership. 

> 59 runs in 41 balls.",3
[thala after seeing spark](https://ibb.co/fdWPVxq),0
Rayudu spent his whole life force hitting that shot,1
Intha performance yenga da pochu?,1
Rayudu what happens to a wasted KL Rahul,2
Well time to question Kohli's intent today 😉. Pitch isn't looking that horrible.,12
"CSK, try not to lose.

""BITCH, I'M  PLAYING FOR NRR""",7
Sparks flying everywhere rn,9
"Unkills are spanking these kids hard, now now, will they dent their NRR?",3
That Siraj spell against RR is gonna knock RCB out of IPL,3
Rayudu taking world cup selection revenge on Kohli,3
Time to rescind Siraj's apology thread? Lol,5
Our run rate is fucked again. thanks,7
"VK and ABD are not always at their best and that is completely fine but setting them as a measure if they cant score, no one can is well not valid as they are showing",12
Wtf a 100 m six by rayudu!!,7
"Rayudu man, work on your fitness. No wonder India preferred 3D over you.",8
So Siraj was an imposter last match.,9
"Delhi exposed. 
RCB exposed. 
MI to get exposed next?",6
Those who apologized to Siraj after last game getting ready to apologize for apologizing,7
Dhoni hates Karnatakians,3
Slow pitches....we don't have those in India!!,5
RCB are so shit. KXIP are gonna do em in in the eliminator.,7
Siraj might cost RCB the tournament due to his performance vs KKR,3
">Idhar dhek bhosdike. Ye le tera spark.

- Gaikwad to Dhoni",11
How do they go from the bowling from the match with KKR to this? I was finally putting my hopes up for RCB's bowling.,4
What is RCB's record in green jersey?,4
CSK is bossing the chase,4
"ah yes, the notorious 17-7 from sunrisers, I remember it like it was yesterday",11
"So rcb got hammered by the worst team, still think they can compete against aggressive teams like Delhi and Mumbai in the playoffs?",-1
Pandey's 15(29) was the worst innings of this season,3
"Why does Gavaskar not say anything to praise Rayudu’s six? Only talk about how MUMBAI bounced him out cleverly, or how Gaikwad keeps his head straight while batting",7
"Let's bowl fast on slow pitch.

Parkour.",4
[deleted],2
"Aur zor se daalo bc.


T: Bowl slow ffs",2
CSK csk,2
Of course the only match when Siraj played well had to be against KKR ;-;,9
Koach did his usual rubbish and didn't open up the bowling with siraj and sundar.,4
"what do you tell the God of death ?

not today",2
"Guys I'm new to cricket...


Does the green team always bottle against shitty opposition or is it the first time?",13
Just RR needs to win today. And we will be officially out of 2020. May be 2008,9
Guess who's back? Back again? Lord is back. Tell a friend.,13
[deleted],9
It's just not IPL without a meme performance by RCB against us,7
Well if Raydu gets out & CSK can lose the game. I have full faith in their batting.,4
We will have a bat first.,6
This is the Siraj we know,6
Good batting CSK well done👍🏽👏🏽👏🏽👌🏽,-2
SRH management making Manish Pandey watch this match instead of letting him into the nets session.,2
Gaikwad has shown so much spark that even if we tuk tuk from here should still win comfortably,9
Csk still in it bois,1
Siraj had an off day last game and now he's back to form.,4
"Sunny G Logic - 

Gaikwad gets out cheaply against MI - why play him, at the top,  Murali Vijay should play lol.

Gaikwad showing spark today - he is the batsman, good running, good shot, good everything.",22
You'd think CSK were chasing 180 not 140.,3
Rayudu : Fuck you r/cricket for saying 3D is better than me.,7
Siraj just had an off day in the previous match. Don't worry he is back.,3
"Just an opinion, For a guy who's done good for CSK r/cricket gives Rayudu alot of shit!",16
"Yesterday on WHO WILL WIN TOMMORROW POLL commented that how tf is there votes for csk, csk fans are blind supporters, csk has no chance...

where are you dear right now",10
Goes to show how untouchable MI are really.,10
"Spark was always there.

MSD was just wearing Gucci shades 😎",23
Why is Chahal not bowling now,7
"Conspiracy theory: The green of the Pak jersey is the most natural one, so to avoid that association RCB went neon green.",3
These two compared to RCB have made the field look so open (not even counting the 6's). Its like theres 1s everywhere.,8
Has Siraj taken readmission into Dinda academy ?,0
RTG is back bois,4
In conclusion Virat has no power left in his arms and just relies on running now. Proper ODI player,14
"I think difference between KXIP yesterday and RCB today has been character showed by team, RCB bowling and fielding both are shit today with no intent",5
"What do you do when you have a wooden spoon?

You eat someone else's cake.",28
"Watching Rayudu bat like this against Green RCB reminds me of the 2012 classic where he scored 81 alongside Pollard on a 122 run unbeaten partnership, and MI chased 173 after being 51/5",21
Being a DC fan I like this.,3
This sub literally made a apology thread for Lord Siraj. Form is temporary shit bowling is permanent lads remember.,19
does csk have a chance 😢,7
This tournament isn't going to end well for RCB.,9
We chase 140 like it’s 180 and 180 like it’s 140,35
Only one who can make this game interesting now is Dhoni,5
Told you guys that you are now stuck with Siraj for the rest of the season.,3
That Siraj apology thread was typical r/cricket premature ejaculation.,20
I still don't understand why didn't Koach batted 2nd?,5
Playing so good throughout the tournament only to lose like this to spark 11,13
Kohli saving chahal for last over😁,12
"OK Gaikwad is good. Now someone get out, I wanna see Jagadeesan bat.",9
"R Gaikwad: Take this ""spark"" and put it in your a$$",10
This is literally a Chepauk pitch,21
Siraj with the fucking intent in the field what is this shitshow,4
Gaikwads playing well. I am happy for him but could we wait one match before judging him as the Lord of this realm?,6
Nelson??,1
So the pitch really wasn't that slow and Kolhi and AB pretty much exhausted themselves out by running so many 1's and 2's?,11
"SunnyG's just salty at Ruturaj because his initials are RG.

Reminds me of another disappointment in his eyes.",18
HOLY SHIT! HE FINALLY HIT A 6!,-3
MSD throwing youngsters who didn't even get the chance for the poor performance of the team.  No captain should do it.,6
Mumbai nibbas  I don’t like yall but rooting for your win today. Beat RR bad like you did to us.,4
"Damn, this CSK can't get me to stop smiling. This is lovely to see. Rutu and Rayudu have been brilliant so far.",6
Hope the spark is bigger than Nelson!,4
If Rayudu is batting well against you... well RIP in pepperonis,6
the WLW WLW WLW WLW pattern continues 😔,8
RCB can still win this if they get these two out immediately after the timeout. Weirder things have happened in IPL so this isn’t so far fetched,2
SRH boys when will we find players who play fearless shots!? Why does stupid VVS always brings mediocre players!?,2
Rayudu WANTS that time-out after running a double.,1
"For people saying apology threads backfire

There r meant to be.... It's r/cricket jinx at its peak",5
"can Csk pull a Srh :""v",8
That thread which claimed RCB will make IPL final if they win with green jersey . Is it still available or deleted ?😂😂😂,6
"Pitch : slow. 
RCB spinners : Im gonna do an Afridi",11
"If the IPL were held at home, CSK would have definetly being in the top 4. This match all but answers that. They need to hope and pray next year's IPL is in India.",4
"111/1 in 13.

I'll go out on a leg to claim a long 2:30 Timeout for a certain Shepherd.",2
Siraj should upgrade with himself with batting skills like Lord Shardul. Or else he will quickly become obsolete in this format of the game,3
What is with the 7:26 start time?,3
We need a complete and total shutdown of apology threads on r/cricket until we can figure out what the hell is going on,12
"Get 5-6 men inside the circle and save singles ffs! Having 5 men back in the outfield makes no sense. 

35 to win off 42 with 9 wickets in hand is a walk in the park.",5
"Horrible bowling from Sundar. What's the point of darting in balls towards the pads when you need wickets? Disappointing man, smh.",3
How consistent is Ambati Rayudu for CSK? He's been pretty good everytime I've seen him.,1
"CSK is eliminated , correct?",2
I am waiting for CSK to pull off a SRH.,-1
💥💥💥💥💥,1
"If CSK chases this down in 18 overs, how much would it dent RCB's nrr?",4
"Guys, fire crackers are banned in my city. My question is that has Gaikwad shown enough spark to allow me to use his batting highlights as an alternative on Diwali?",11
What demons were RCB looking in this pitch while batting,9
You know if RCB implode in their next few matches they may not even make the playoffs.,4
"So we lost yesterday, RCB on the cards today. Aap chronology samjhiye",5
Gaikwad increasing his ipl run tally by a cool 900% so far this innings,10
"Siraj getting tonked. Finally, inner peace.",6
CSK didn’t bowl one half volley or one short ball to RCB. No room given whatsoever,5
"I still think RCB is all Kohli and ABD. Get both out for cheap, and the team will fold for 100.",5
Scenes if CSK loses from here.,2
Will somebody make this match interesting?,1
Where tf is chahal,2
Siraj had to go for runs. His economy was coming below 9. Need to get back to 9.5.,3
Kohli and Abd should get an award for making everyone to think that there's something in this pitch,12
"Shit in most games and suddenly puts in their best performance of the season against us to damage our chances of top 2, fuck CSK.",12
Excellent innings Gaikwad! Wish to see you in CSK for years to come.,6
Trump and Bolsonaro loving all this spark. So much spark climate change is accelerating,8
Even in their worst year CSK find a way to humiliate RCB lol,19
Udana could've bowled well here,4
Koach probably thinks CSK will automatically shit the bed like SRH last night. Piss poor bowling and overall set up.,8
"Honestly, as a CSK fan, I'm happy about how we've done this season because of this match.

After last season I knew this season would be bad (didn't think it'd be this bad though) because we only made playoffs last season because of Dhenier and bowling department. I wasn't looking forward to this season. 

Now I'm actually looking forward to the next season, I feel we'll do well.",11
csk should look to chase this in 15 overs,2
"On a serious note though. 

Rayudu _could_ have been our #4 in 50 over cricket. He bats really well as an accumulator. Just needed a longer, maybe much longer rope. But well, time wasn't really a friend because we needed a solid team by 2018 end.",2
Don't know why I suddenly think of David Shepard standing on one leg for 111,5
"So disappointed with kohli’s batting overall this IPl. Apart from his 90(52) , I don’t remember any remarkable batting performance. He struggles to hit boundaries. F this crap man , he’s overrated",1
"Let's face it, RCB were 20 runs short when batting. About 10 profligate when bowling.",2
He went to take a shit guys...give him time,5
i think kohli was tryna fool csk by making it look tough to bat but looks like they didnt get fooled,3
Kohli seriously needs to rethink his strategy in middle overs after this match. He has the lowest strike rate among top run scorers this season.,5
Lmao Rayudu off to drop some logs,6
"Chennai are the most vulnerable in the last few overs ,they need to finish a little early if they were to win",1
Kohli should bowl. This pitch will suit his style of dibbly dobblers,2
Rayudu went to take a shit?,11
Rayudu: ight imma head out,7
Apparently Rayudu's gone for a shit,16
Wtf am I seeing? Is it even the same pitch or RCB's bowlers are bowling shit tier or is it the captaincy.,3
RCB better bowl out their best bowlers now.,1
"Batting first

Playing slow . 

Don't even try to hit 
 
Bowlers bowling fast in slow pitch

Not playing Udana in slow pitch

Giving singles easily

Giving fast bowlers over in middle overs rather than spinners. 

Yeah pre - planned lose",7
"Rayudu gone to poop, and commentators talking about what he could possibly be doing lmao",7
I think what been happening in todays game I what csk expected before the IPL began.. To get teams to score 150 or below on slow Chennai pitch and have a player bat a decent innings and get 8 out of 14 wins and make it to playoffs and try thier luck out there.. Csk might finish well in this end part of the season,2
"I know we hate the timeouts and it often ruins the momentum of teams. But in this heat , I'm sure alot of the players would love a cool break!",2
*tatti Karne gya hai Rayadu*,5
Y'all are shitposting here but there's that one guy working out probabilities for CSKs playoff chances. May the force be with you mate!,5
Mumbai will hope this RCB turns up on Wednesday.,1
I see this 111-1 happening so often.,3
"RCB being the meme team, losing to only the last point team.",2
106m six jeez,2
Kohli is terrible as a captain. His field placements are puzzling sometimes.,1
"Collapse in one match = blast off in second

Doesn't depend on bowling lineup, look at kkr and csk",2
Could see the uncomfortness in his face after hitting that six. Lmao.,3
Rayudu using strategic timeout for shitting literally,8
Rayudu went to do a Renshaw?,1
Well I really thought this pitch wasn't easy to get on with.,2
"Finch isn't in the team meeting, isn't scoring runs, why he is in the team again?

I thought they bought him for his help in captaincy.",3
"Ever bat so good you shit yourself? 

Rayudu has",10
Commentators trying to talk around the fact he went for a shit,8
"Rayudu aur iski jhaange. 

He's unfit asf.",1
RCB supporters: Saala yeh dukh kahe khatam nahi hota hai be?,2
"I made the prediction that RCB would lose against CSK and win the title, but I was not being serious about losing to CSK FFS 😳",3
I hope he wiped his arse after shitting. Must be in a hurry,0
"Two quick wickts and a team like CsK will collapse under weight of  self doubt.



Make this match interesting fuckers",1
And people were asking RCB to declare at 110 runs stage. Lol perfect /r/AgedLikeMilk material,11
"Rayudu's pee break turned into a ""fuck !!! where's the TP""",7
What is he talking???,4
Few pounds lighter,9
Apparently Rayudu went to take a CSK in the toilet,6
"AbD yapping into Rayudu's ears lol.

Wicket coming soon.",8
Sam Curran best all-rounder of the tournament,2
"My man Rayadu taking a dump on the toilet and RCB both in the middle of the match
 Edit:
And gets dumped on first ball haha",6
"Pet Safa, aur yeh Tej Bhaaga",4
never knew players can do that,4
Ugghhh they’re talking about a player’s bowel movement on live tv and cracking jokes about it,3
"Imagine the RCB dressing room when Mike Hesson praises Kohli for making 50(43) while he goes on liking tweets of Eng Analysts saying "" Kohli was Selfish"" "" Cricvizz says Kohli gets negative points"" 😂😭😂😭😂😭",7
"He shits when he wants, he shits when he waannnts

That boy Raydu, he hits old people and thinks he's tough",5
Lmao abd and rayudu talking about toilet,3
"The fitness level is so unprofessional with this guy it's unbelievable. One six he hit dancing down the pitch and he is pulling up his muscle and shit...

Good riddance from ODI team.",5
Gone,3
111/1 strikes again,2
Get fucked. Back to the toilet with you.,0
Rayudu break didn’t help,1
Didnt finish it last time,1
Raydu kar ke nahi aya,3
Rayudu needs to go back to the bathroom,8
Please Dhoni come on this is the right time for you!,3
A sliver of light for RCB,2
Rayudu's six straight to the douchebags who think that knowing the owners entitles them to a VIP ticket during a global pandemic.,6
Collapse coming up,2
Rayudu literally and figuratively shit himself,3
Rayudu took his time just to get out,1
Yup held him too late,1
The stark difference between CSK and RCB fields is so evident. The ground seems more open in the second innings,1
AB and Rayudu smiles confirmed that its a nature call.,3
4D chess by rayudu to finish his shit,6
Match will get interesting now. Anybody’s game now,0
LOLLLLLLLL Chahal didn't bowl after the 8th over. Koach masterstroke.,3
4D move by anti 3D to bring Jaggi in..,6
 Curran pls,5
MI's team looks so much better than others that it almost seems unfair,6
Rayudu shouldn't have dropped his lucky poop.,3
Happy for Rayudu. Nothing worse than coming out with an incomplete shit,10
"Yeah, all i want to see is jagadeesan's batting
Edit: FU thala",2
Ah I already see RCB winning this,2
Please don't collapse like srh,2
Maybe he was batting so well cause he was holding it all in.,2
It’s time for Dhoni’s tuk tuk,2
"Rayudu can now go wash, to be crude :p",3
Virat Kohli had the same strike rate that Gaikwad has. r/cricket just picks a scapegoat and sticks with the scapegoat the entire time.,12
I am gonna lose my shit if Dhoni or some oldie comes now and increase rr. Send in jaddu or sam and effectively end this in 2 overs,10
"He needs to clean up properly that's why he got out, not because he's rubbish",6
Definitely got himself out so he could get back to the toilet,4
Thala 12(30) incoming,3
Will we see an SRH type collapse today too?,1
CSK gonna lose this one as well,1
"If he had waited a bit more, be could've gone now",2
"Oh no!!

We are taking it to 20th over.",7
Oh comeon Dhoni! We wanted Jagadeeshan!,2
"Rayudu should have held onto that pile of shit, was his lucky charm today clearly",3
Guess that poop was the reason behind Rayudu's spark today,1
Chahal's fiance is cute but I think they can both do better,-2
Abhi toh haag ke aaya tha vapis hagg diya,3
Lol tuk tuk Dhoni is in. Watch game go to the final over,0
So it was shit performance by our batsman.,2
Dhoni will bring the game to the last over,2
Please send Sam or Jaddu.,2
Could have gotten out and then gone to the toilet,3
Thala!?,1
"Called it boys!


https://reddit.com/r/Cricket/comments/jhpts4/_/ga1v4g7/?context=1",2
Dhoni you can play as many dot balls as you wish!,6
"The next three balls would be dots 100%

Edit :

Shock and horror",3
Wtf why Dhoni?? Send in Jaggu 🤬,4
It would be peak 2020 CSK to shit the bed and lose this,11
Into the tail.,0
"**13.3** Chahal to Rayudu, OUT, big shriek of a YES from Kohli as Rayudu sweeps all around a full legbreak. He is bowled neck and crop. The off stump gone. Chahal comes back and creates a chance. Who would have thought? **113-2**

AT Rayudu  b Chahal 39 (27b 3x4 2x6) SR: 144.44",4
Dhoni batting with spark.,1
Only way RCB can win this is if Dhoni comes in to bat now,4
Thala is here🔥,2
What if that Shit was csks lucky charm? 😳,4
Lara is boring af,0
"Very good six from Rayudu today, best shot of his this season",1
"Rayudu probably flushed away his spark in the break, and as a result, got out.",5
"Dhoni has come now for winning glory, hasn't it",1
Rayudu got out because he forgot to wipe his arse. Now he will do that in peace.,1
Rayudu: DOMINOS!!,1
I wanted to see Jagadeesan but good to see Dhoni come out and face his weaknesses head on,2
Should have brought in Sam Curran,2
Dhoni out there to see the spark close up.,4
Lunge forward defence incoming,2
Fasten your seat bells. Dhoni has arrived to take this to the last over.,10
Wtf is Dhoni in the middle for?,1
Oops looks like celebrated too early.,1
MS's neck and face have become one.,2
Dhoni against Chahal. Omg not gonna go well,3
thala is our only hope now,11
gaikwad don’t get out at 49 please,3
That wicket was 👨‍🍳👌,2
This is stil fine from Rayudu. Rather get out upping the rate than playing an 80 SR innings,2
Time for Dhoni to come out to slow things down I see,6
Did Rayudu need to take a shit lmao?,4
Don't people ever learn after Raina going for a pee break during the time out,4
Tuk Tuk is back on the menu boys,5
9D move by rcb to bring dhoni,12
Csk don't collapse like srh man it's hard to watch,5
Dhoni wants to see the spark for himself,9
Im out of the loop. What's with the poop jokes?,2
Dhoni wants to help his friend Kohli today,2
MSD came to see the spark for himself.,10
Dhoni coming in when RRR is below 6 and he'll get the tag 'finisher' once again,5
Imagine going to take shit in world cup final in tense situation.,11
"Dhoni really should've brought out some safety goggles

You know, to shield his eyes from the spark",19
if csk choke this we're winning the ipl,1
"50!!! Well played Gaikwad, lovely stuff",5
Thala coming before Jagdeesan?,1
So happy for Gaikwad,7
[removed],7
Can Dhoni bring rcb back in game ?,3
nO sPaRk Gaikwad,1
"If only CSK had an in form batsman who could quickly rack up some runs. Oh well, Dhoni it is.",3
Dhoni coming in at the appropriate time to take credit. Like he always does.,4
Even poop god wants to see RCB win.4D chess by Shit God to eliminate Rayadu.,4
Dominic Cork pronounces 'Ambati Rayudu' _perfectly_!,6
I just can't finish it in 4-5 minutes. I atleast need 15-20 mins to feel I am done. I would feel more uncomfortable if I had to shit and be done in 4-5 mins.,4
Dhoni congratulating spark,6
"50 for Gaikwad

Sparkling knock. 

Maybe too late for this season but is gonna be regular feature for future hopefully",3
Good innings from Rituraj.,2
Well played Rutraj Gaikwad!!!,3
"Hats off to Gaikwad after the previous failure and publicly humiliating comments from his captain, need a big heart to do what he has done here",3
Why Dhoni? Why not Jagadeesan? Perfect time to show Spark,7
Gaikwad going near dhoni to show that spark lol,7
"Well played young man, I eat humble pie.",2
Gets 50 while Thala is on the pitch.,8
"My hate for Dhoni is intensifying.

He doesn't send Curran to finish things.

No sends himself to get some glory, and yet gives a chance for CSK to lose because how terrible his batting is.",6
In your face Thala,2
"Lmao hahaha Brian said "" Is it good sending Dhoni to bat now there will be dot balls"" instantly Dominic Cork going "" Wooooo"" knowing he can't say this in Star broadcast 😂😭😂😭😂😭😭",23
Dhoni was blinded by that spark,5
Should have let jagadeesan to bat and build up his confidence.,4
GOATwad showing how it's done,3
"Well in, lad. Sparkling innings!",1
Kris Shrikant feels vindicated today.,6
4 runs in 5 matches to a 50,9
Dhenier is in so it's RCB's to lose /s,2
Take that 50 for your spark MS. Jai Maharashtra !,3
Finally CSK has found one young Indian spark today,11
Why do white people go Poonjaab?,17
Just can't bottle from here,2
"S P A R K



P



A



R



K",8
Why are they giving away easy singles? Koach is an absolute idiot.,0
Dhoni is blinded by the spark in the middle today.,8
Rayudu got a Dubai belly,2
Looks like Rayudu pooped his intent too /s,3
"Ambati Rayuuuu dududududu gone to complete his dududududu

Edit : don't hate me I just had to dodododo",2
Now for the Gaikwad apology thread. Congrats gaikwad!,6
Dhoni again robbed Jagadheesan of his sparks.,9
Make or break over!,3
"Everybody shitting on Kohli, rightly so, but forgot abd also batted like that

Also both vk and rutu scored 50(42)",6
"Lmao. 

Dhoni only comes when team is in winning position",5
Slowni taking this chase deep,6
Come on Morris do something :'(,7
">CSK will collapse like SRH yesterday 

>Dhoni has come to take all the credit off a easy chase

Atleast have some consistency",17
[removed],10
"My dad says Dhoni should not have made that remark, glad they are proving him wrong.                                                      *Grins remembering him being the biggest MSD fan*",11
Yikes Dhoni don't bottle this,4
"Lol

Dhoni comes in to make the match more interesting",7
"It's a decent game for Dhoni to take deep and win, just for sentiments and shit. 

I don't think he's coming back next year.",1
One thing we know in this IPL is that matches are never over. Some tight overs can make it interesting,3
"No one made low totals look as imposing as Gautam Gambhir in the IPL. Win or lose, he'd make the opposition earn every single run. Super attacking fields, almost test match fields. 

Give him 3 decent spinners, a tired and slowish pitch and an opposition low on confidence and he'd make 145 look like 180.",13
We done Rutraj !!!,5
"Kohli with fast over rate?

**Impossible**",1
Thala showing Intent,3
Will Gaikwad forever be called Spark now ?,8
Dhoni is gonna buy some land and live there now 😂,8
"I can't tell which would be funnier  -

1. Dhoni and rest shitting the bed and losing.

2. CSK winning all their matches and other results go their way and qualifying.

Everyone on r/cricket is going to lose their minds if 2 happens.",13
[deleted],3
Dhoni comes in to confuse anti CSK bookies.,12
FFS MS don't take it deep. Finish it with a couple of overs spare.,3
CSK on suicide watch,5
[removed],8
That was not a nick?,1
