Comment,Upvotes
CMB be like: Go Green BC!,4
[deleted],1
"Come on CSK, win this one game please. Hope y'all learnt something about how to make a comeback from KKR yesterday. If both RCB and MI win today(which currently seems highly likely), we're gonna be quite fucked ngl.",0
I’d stick with the same team as the last for CSK. Except somehow try to play Sai Kishore maybe. Let Rituraj and Jagadeesan have another go.,5
Finch 101(56) today,5
[deleted],10
I hope it’s an OP meme match today so we can all have fun.,7
I hope Jadhav plays today. Missing his brute force defensive shots.,26
"Everybody is busy predicting who will win the match, but the real question who will Dhoni give his jersey today ?",17
"Are they playing on the same pitch that was used y'day in SRH/KXlP game? If yes, then the contest is equal. Tahir will have a blast.",14
The only way CSK is winning this is by playing 3 leggies and hoping that RCB management send ABD at 6.,12
Nothing against RCB but I think CSK is gonna win today. The bottom of the table team always messes it up for teams in the top 4 at the end of the tournament.,18
Lets gooo Unkillsss,4
Rcb should win so that I could see the mental breakdown of msd's chapri fans,8
"This game is giving me the vibes of the famous encounter in South Africa when RCB nearly bottled a chase of around 120 when they were cruising in the tournament

Good old days of Praveen and Dillon Du Preez swinging it in RCBs favor",9
[deleted],13
Hope Ab destroys the Csk bowling line up,26
[deleted],-2
Just gonna support CSK today. No need to thank me.,-9
I'm cautiously optimistic.,14
"Maybe I'm having high expectations, but I want this match to be entertaining... I'm sure RCB will fulfill that thanks to ABD, Koach and Lord Siraj, but then you have CSK... nuff said.",6
"RCB green has historically been entertaining matches, one way or the other",8
Why is star sports so obsessed with CSK. They aren't even showing anything about RCB.,7
Even though I should be supporting CSK but I wont. I don't want  DC to rely on other teams to do their job. So here to a hard faught match and hope for a close contest.,1
"Mandatory RCB vs CSK comment

Fuck IPL trophy, all I need is a win against CSK",11
RCB in green gives me good vibes even we have lost in green too still!,7
Why is star sports so cringe what bullshit apprentice and master,-1
My only hope is that RCB don't choke. I don't mind if CSK happens to  play well and they lose.,2
Shit I just realized UK time. Fuck me.,0
"RCB desperately need to get in the top two, if punjab makes it to the playoffs somehow, their stint ain't gonna end well if they are #3",18
"Star Sports pre-match shows are the epitome of cringe lmao. 

Also, just got to know a few days back that there is animated show on Star Sports about Virat called "" Super V "" where he is shown as a superhero.  Like,  seriously what the fuck, man !?!",10
"I lost a challenge yesterday and changed flair to KXIP from MI, can I still speak shit about KXIP?",-8
Monu Kumar is finally making a debut after 2 years and 11 matches this season,8
"Only good thing about IPL coming to end is we won't have to see cringe Thala Dhoni and CSK tributes videos on Star Sports. "" Will Thala dhoni fire today?"" Enough of this bullshit. Only two more CSK matches and cringe pre show to go after today 🤞",3
When is RJ Balaji returning to Tamil commentary? At least we can laugh while commiserating.,4
"Mahendra Bahubali and Super V in the same game. For the last time this season (yeah almost). 

All you sane cricket fanatics - Stay away from Star Sports preview shows today. May the force be with you, guys. Loads of love.",1
Virat chooses to air-fry CSK first,2
RCB bat,7
Monu Kumar’s spark plug will be tested today after being in the garage for more than 2 years.,12
crap. not another csk chase!,-3
We'll have a bat thanks,6
Finally Moeen!,3
Moeen in for Udana,2
RCB to molest CSK today,-5
No Udana,4
Moeen with a 5fer,5
Last night shouldn't be a factor considering SRH is light on batting. But then so is CSK so shouldn't matter,7
Should've bowled first,1
"gReAt iNiTiAtiVe

guess the other gReAt iNiTiAtiVe match",-3
Mo is in!!,1
lol dugout predicted santner inclusion last night!,5
Santer is in.. It's like they are setting teams based on social media comments.,21
Now this has to be RCB's best XI,0
Moen is a good change,7
"Kohli, please let us win the match if you are an admirer of Thala",4
"I'm not the biggest dhoni stan but seeing him like this defeated sad and almost given up makes me very very sad, I dont like seeing him like this.",65
"Happy with the team. Yeah season is over but atleast we are giving everyone a chance now .

Hopefully Gaikwad and Jagadeesan can play now without any pressure and make contributions.

Also going back to three spinners is nice . Used to be the CSK tradition since IPL started .

Hopefully we revert back to Curran (or Santner ) opening the batting and Faf can come in at 3.",6
Wait Monu is the same guy who Sakshi posted a photo with kissing his head?,22
"As a keralite, would have loved to see KM Asif back but I like Monu Singh too. Been waiting for 3 years and a pretty chilled out guy I've seen from the videos he's in. Think he's related to Dhoni's wife too",9
Mo will be a permanent fixture from here on. Good all-round abilities and a golden arm.,6
The Tahir-Santner partnership should be exciting. No one has gone with two foreign spinners this IPL iirc,8
Tahir and Santner to kill RCB,8
"CSK team( batting line up based on my hope )

Santner

Gaikwad

Faf

Jagadeesan 

Curran

Rayadu

Dhoni

Jadeja 

Chahar

Monu Singh

Tahir",3
So RCB bat till NO 8 and 6 proper bowlers. 12 over of spin. Should be a good one,47
That poetry was really nice :(,0
Moeen Ali finally IN. RCB squad getting further strong,11
"alright guys! First time since pandemic started I have a whole weekend to myself. Moved to hometown just before the March lockdown with my parents. WFH was beginning to take a toll. This is welcome break. I am ready with a blunt to watch this. Hoping CSK plays some exciting cricket, at the same time not keeping my hopes high. Though I am ^high",16
"Fantasy Q- who should i captain from DuPlessis, Curran, Buttler, SKY and Bumrah? Currently on Faf",2
I just love it when there are 10+ overs of spin. Innings gets over quickly.,11
So Finch and Maxi are playing all matches no matter what!,20
"Seriously when will rcb realise finch isn't gonna pull a Watson, quit while your ahead.",3
Is Dube dropped or injured?,0
[removed],-16
CSK might just win today,5
Guys! Finch is just fine. He is not giving any bad starts. Let’s not try to fix something that’s not broken.,8
[deleted],8
So lads which RCB's gonna show up today?? 49/10 or 263/5?,6
I really want the youngsters in CSK to perform well today and show their potential,4
Monu finally getting a game after being MS' chamcha (hanger-on) for so long,-11
"Few things in life are better than the extra hour of sleep you get the day the clocks go back

But watching RCB destroy the last slither of hope for CSK might be one of them",12
I really hope to see Tahir running around like a madman several times in this first innings.,-4
"I have this idea. To make the ending of IPL more entertaining,there should be a match between The team which won the ipl trophy in that season vs Playing XI consisting players of all the remaining teams. What do you think?",7
"I just have a bad feeling about this green jersey

I bet Tahir and Santner will pull some shit",7
CSK should buy Starlight from The Seven next season. She is a youngster with lots of spark.,12
"Thala preparing CSK for 2021 IPL. Since there'll be no mega auction, they'll need to figure out the best combination.",8
"Tahir 4-0-16-4

Santner 4-0-20-2",3
no Udana  we are putting too much trust on Siraj.,8
"Monu is a name that I can root for!

Let's go..",4
"RCB squad looks great, just that Dube needs to come in for Gurkeerat. Dube is an extremely good late game finisher and can bowl if needed as well. Gurkeerat is an anchor test match player, which honestly do we really need at number 5 in a T20 game?",9
Unrelated but I am so glad that srh lost yesterday. We don't fucking deserve to be in the playoffs because we are going to lose the eliminator anyway as we have done thrice now.,3
Can someone explain Why's dube being dropped even after decent performance? Gurkeerat isn't as good as dube also.,9
"I think, Gaikwad and Jagadeesan will continue to play the remaining matches. I hope they use this opportunity.

If not for pride, at least for upping their rates for next auction",9
Is the show Mirzapur worth watching ?,0
Moeen with a 10fer today,8
I think Dube should play instead of Mann.,8
SS Tamil trolling Kedar Jadhav by playing the clips of his batting misses.,15
Very smart of Kohli to drop Isuru Udana today. He knew that a Sri Lankan will definitely get thrashed on Dussehra.,104
"In the previous years, rcb would have been in csks and position and vice versa lmao",8
Kohli is using up all his coin toss luck instead of saving for aus tour ;-;,52
CSK will win easily today. Finch will waste 20 balls,-5
"The other day, just because Gaikwad and jagadeesan got out for a duck, MSD's toxic fans took to Twitter and said Dhoni can never be wrong and when he said he never saw the spark, that's true and you don't doubt thala.

To make such an open statement about young players in itself is a shitty thing to do and people backing and supporting dhoni are ridiculous. A lot of players be young or old could be confidence players. You see someone like shikhar, he's a confidence player. As a captain, you're ideally supposed to at least have some trust in the players you fucking bought in an auction. They could be talented otherwise you wouldn't bid for them in first place. Give them enough chances and if they fail, you can talk whatever shit you want to about them. But making public remarks like that after not even a couple of innings might put so much pressure on the players and might destroy their confidence is ridiculous

Coming to twin ducks, honestly, facing Boult when ball is doing a bit is hard for some of the best batsman. We saw how our stars struggled against swinging Boult in WC semifinal. No this is not comparing kohli to some youngster but boult is that good. If people want to suck on Dhoni's dick, no body is stopping them. But not at the expense of commenting on others while their entire team Shat the bed(including Dhoni) this season",8
Ah man. Udana was really good for RCB. I see no reason to replace him.,7
"Manu = Manchester United

Monu = Monchester United

Am I doing it right fellas?",7
Okay bois time to meme finch into form,21
The team which plays a lot of sweeps and lap shots for 1s and 2s on this slow pitch will win today. That means RCB are winning because Kohli will make a century without hitting a boundary with only 1s and 2s.,1
Finch's USP is his leadership.,5
Monu looks like my 50 yr old uncle,1
Did Sunny just say Jadeja has been disappointing with both Bat and Bowl?,5
"Should have bowl. You can end it first inning , why wait for second inning.",-2
Look at that avg age and send that to csk fans who say that they bring in many youngsters,0
Monu looks like discount Amit Shah,6
"RCB have bit of ""Bat Deep"" thing going today with Sundar at 8, can go hard right throughout the innings",3
Monu is that one creepy uncle we all are uncomfortable with,8
Monu looks like a tiktoker from Dharavi,5
search ipl on google and go to the match. prob is RCB 60- CSK 40 even before the match has started !,2
Off topic but do you think covid will completely vanish from india within 3 or 4 months?,2
"all the talk about csk being old, but rcb has an average age just 1 year less",6
Imma pull for CSK today,1
"Come on CSK, Show some fight!! Make my day a little better!!",2
Come on Finch!,2
"Damn Mo Ali is playing today, wanted to support CSK but ugh",4
Ain't nothin brings MS down 👍,2
CSK should also change their jersey a bit in 2022. Got a bit boring,4
Why did we choose to bat?????,3
"All of us are talking about either MI or dc being a strong, but this year rcb seems to be strongest their bowling is in top-notch form ,  batting may be little inexperienced but if finch finds form, they would be unbeatable .",1
"As a cricketer making his debut, I am more scared of Monu than either of Tahir or Santner",2
Get ready for painful first 10 balls from finchy,8
RCB's green is really good,3
Pitch tailor made for DP's 30(36),5
So we're playing against 11 highlighter pens today,5
"Don't depend on theory that pitch will slow down in the second innings, the same happened in the last RCB match vs KXIP and then there was Gayle storm.",2
"New player makes debut

r/cricket: lets make fun of how he looks bois",31
"Think every IPL been won by team that finished in top 2 since IPL format changed to playoff eliminators and qualifiers except SRH in 2016.

So finishing top 2 is massive for RCB. So would be nice if we could at least ruin that and have some positive from this train wreck of a season.",2
Will we get 150+ today?,1
Those red pads and gloves with the green jersey are such an eyesore.,17
Come on Finchy!! Would love to see you play your natural game today!,4
This green jersey RCB always reminds me of their game against GL. That was carnage,14
"RCB never lose in green jersey

Edit - Just checked they have won only one time in green. LOL",2
I have a feeling this will be a customary 250 score game with century by either abde or kohli. It invariably happens once every season .,1
They should've gone with the golden pads on this jersey.,7
RCB looks too strong on paper today. So it’s fair to assume RCB will lose this game.,12
Congrats RCB 2 free points for ya,3
"CSK fans: CSK have nothing to lose so they can win.

CSK: We have nothing to lose. So team proceeds to lose.",39
Hopefully CSK fielding should be better today with younger spark plugs,2
Aaron FLINCH  in the house...,3
"Love the green jersey wish they used it more, maybe during all day games.",4
Anyone know about Monu Kumar? Which state does he play for?,3
Do you dhoni will retire from ipl after this season?,5
I have a feeling CSK will win today.,2
Chahar bowling to finch. This isn't going to end well,9
Finchy scores more with his butts than his bat,8
Prediction : Santner will bowl the second over and open the batting,5
Will Finch end up in a new team next IPL?,5
"As a mi fan, it's weird supporting csk",6
The green RCB jersey reminds me of some chaos I witnessed a few years back. Hope that happens again,8
There has always been something missing from finch’s game which prevents him from going to that next level of elite batsmen .,8
CSK groomed Chahar as a youngster,11
Couldn't they buy an extra set of 11 pads,8
[deleted],10
Finchy being finchy,3
Finch 70+ today. You heard it here.,9
Lol i thought it was a catch,8
Dev should’ve come for 3rd ffs,6
"Bruhh whatever finch scores
I'll take it as a bonus runs!!!",21
How is a world class player like Finch so afraid of swing?,13
Man finch lives on the edge. Maybe it's just me,14
Praveen Kumar flashbacks,7
Finch to make a century,9
Santner should bowl next over,5
Google was giving 60% win probability for RCB before the start of match. How does this even work?,9
"If Finch actually finds forms, everyone else is truly fucked",50
Finch not wasting balls!,4
Finch's quota is over,7
I hope these boundaries will make him realise he is a pretty good batsman even against swing and doesn't need those ramp walks,27
Forced Finch to smash couldn't defend now coming ahead in pitch,7
Finchy playing with fire & I love it!!,11
Green day Finch day...,11
RCB fans be thankful we gonna bring finch back to form.,17
Are we going to finally get a Finch show today?,6
Great! Power went out.,8
The cred ad is seriously the scum of the earth with that ear rape of a song,-1
Lara should coach Pant,3
Lara masterclass on dugout,2
Who’s monu kumar ? Is he a ranji topper ?,3
Now wait and watch as we DC fans start criticising other teams batting,9
Nathan Lyon lite,8
How tf is this guy an international player with this footwork? Let alone the highest ranked t20i batter and loi captain of aus,28
"MI folks, finch for lynn, deal?",5
RCB is going to be bowled out for 48. you heard it here first. thank me later.,-10
I don't get why do so many f\*\*king batsmen like Bairstow and Finch open when they can't even face a swinging ball?,11
Dugout is really insightful,5
Desi Lyon coming to bowl,75
Maybe Monu was all CSK ever needed to win,8
Weird Run up,6
I thought it was tymal mills for a second,6
Desi Lyon,9
"Double headers are great, I actually get to watch an ipl match live",6
"When IPL ends, I'll miss Dugout more than the IPL.",11
"Monu Kumar doesn't really look like a youngster, tbh!",18
Monu touching 140?,9
Monu Kumar must be an OP gully cricket bowler.,17
Noice Garry,5
Nathan Lyon,14
"Why does Monus bowling look faster than it actually is?

Why does he run like his knee is hurting?

Why does the man look like a spinner?",18
Lara is not a big Padikkal fan,9
Using all of his 15 degrees.,12
Monu looks like bald dhoni,2
Bald characters are the most OP,12
Is he chucking?,6
Megamind dont @ me,11
Dugout is really fantastic,7
[deleted],-7
Something looks off with that run up,5
"DDP leaving the balls, making a good case for test squad. Just need to show us he can negate the new ball and play till lunch",1
He kinda forgot DDP is out of strike this bowl,6
Who or what or why is this Monu? Dude looks like your 7th bowler.,4
Monu looking like a character straight out of Mirzapur,5
I like Monu. He reminds me of dibbly dobbly wibbly wobbly.,7
Forgot finch is right handed,3
Monu is going to snap his ankle one day holy shit,7
That action is ummm.. Interesting,6
Seeing Lyon play in yellow jersey after so long,6
Bc how wide can you be,7
Monu Kumar looking like a Budget Nathan Lyon,11
Monu bhai looking like Lyon and bowling like Flintoff.,7
Man he's chucking,7
Dhoni keeping is still better than some of the youngsters,10
Monu bowling to Padikkal looks like a movie villain bowling to the chocolate boy hero,8
Lol was that an edge,2
Edge?,5
Lex Luthor,6
How tall is Monu Singh? Google search says 177cms but he looks shorter,9
Monu looks like Joginder Sharma without hair.,11
Bruh minion Monu,8
"That arm must be quite near to the 15 degree bend, no?",7
Monu is *sparky*,4
It's weird seeing a fast bowler bowl with full sleeves,5
Want Abde to come in early and hit a 45 ball 130 . Please one time .,4
Finch is the Watson of RCB.,24
No edge,5
"I heard something, the one where finch swinged and missed",0
Sorry is it just me who saw some serious bent elbow action on that replay,4
When did Saitama start playing cricket now,7
that was massive,3
interesting action...,6
Vin Diesel playing cricket,8
Finchy will take liking to monu.,3
Monu moaning like a tennis player.,6
LULZ . CSK bringing out Monu . this is looking like pokemon now.,7
Bruh that's wide even for a left hander,8
"Look at that shine on that ball! First time seeing much lacquer on a white ball.


Oh wait.. that's Monu Kumar.",13
"Monu is Dhoni’s answer to Moeen. 


Matching baldness with baldness",10
Monu is gonna get whacked all over by ABD,10
Natheshwar Lyon,8
How did Finch open for Australia with this technique is out of me,12
finch just hit a six and get out,5
Monu doesn’t look like IPL quality tbh.,12
Reminds me of James Kirtley's action in the load and release. Did Kirtley ever get done for chucking?,3
This is the longest over ever,11
"Can't see match rn. How it's looking and what's csk squad?


Edit : MONU IS PLAYING!",8
Green kits with red pads is quite the look,11
So confused...why is Nathan Lyon bowling pace with Sreesanth's action ?,49
Pretty sure at the start of season nobody in CSK camp would have thought that Monu is going to get a game.. probably not even Monu himself.,11
Even that would have been a wide lol,8
"Unlike Sharapova, those grunts by Monu do hardly any good to his delivery. Ugh.",14
Finch should just stay inside the crease and swing. He's so powerful,5
not what I expected a guy called monu would look like,11
When you adopt your pet name as main name because people prefer it,4
Why does it look like my boy is bowling rockets when he is bowling 130,7
Decent start from Desi Aaron Paul,11
"Brighten up Monu Bhaiya! Against all odds, you bowled well.",4
Scurran is like the token young guy in CSK,9
In what world they refered to Monu as Express pace?,6
What does one have to do in his previous lifetime to be named Monu,16
Love seeing Flinchy shashaying down the pitch....,8
vatta marra bsdk,6
Except those wides that was a decent over by Monu,7
What happened to Jacqueline's face?,6
Teams should introduce home and away jerseys in IPL.,4
TIL Monu was in India’s U19 squad,6
Monu is defo chucking. That's way more than 15° bend in the elbow,3
"I watched Finch's 153 highlights today, so if he scores well, it's because of me",17
Parrot jersey.,5
C'mon Paddi,2
"Bumrah hyperextension - wow hes so cool one in a generation talent



Monu hyperextension - wtf he's a chucker",40
Forgot the clocks went back today so I missed the start lmao,3
Monu GOAT Kumar,10
Vk and AbD gonna fook this Monu. Also how can your parent name you Monu?,11
Absolutely love seeing Brett lee talk about Fast bowling. I can listen to him all day,11
Chand do pahar ko nikla #MonuKumar,2
Good I really like the name Monu. Have to name my future son this.,4
Finally some intent from padikkal,5
Shot!,3
Chahar been poor this season,2
"Samsung: Reward yourself with a Galaxy Note 20

Jack Daniels: *Throws phone away*",8
"Ok, the red pads with this green jersey are hurting my eyes.",11
DDP is one of those rare left handers who do not usually play cover drives.,15
"Dhoni : Yes I need Lyon for this season

CSK management at auction: buys monu",16
[This came up when I searched for Monu Kumar ](https://telugu.telugubullet.com/dhoni-wife-sakshi-singh-kisses-monu-kumar/dhoni-wife-sakshi-singh-kisses-monu-kumar/),29
[deleted],12
Monu Kumar: The one true heir to MSD,12
Monu Singh looks like the guy who says *sir ye toh tatti hai* from Delhi Belly movie,20
"Devdutt ""Particle""",17
The match is between RCB and ThisSeason'sRCB,8
Monu advertising Clear anti-dandruff shampoo on his sleeve. Noice.,41
AFTER 3 WHOLE YEARS MONU IS PLAYING I'VE BEEN WAITING FOR THIS FOR SO LONG!,11
"We will chase 180 and will be 80/2 in 15 th over .

Sorry have seen this movie before already",22
People gave Dhoni so much shit for saying youngsters don't have spark that he brought in Monu Kumar as exhibit A to prove his point,12
Don’t bowl Monu at the death,6
Devdutt Jayasurya,8
"Surely, there is more to his first name than Monu?  His parents cannot be that unbothered.",11
Monu > Bhuvi,4
"Kisi bhi lodu ko utha liya auction mei CSK ne

(CSK picked up any random guy in the auction)",7
"Do you guys think DDP can someday open for India? For me, he's too weak against spin to be considered and slow runner",3
What wrong Hazelwood did to get dropped ??,11
Deepak chahar gets a nice shape on the outswinger,3
"A kid who studied at school with me was named Shiny and her initials were A.S. 

Moral: You can do a whole lot worse than Monu",21
Rinku Singh vs Monu Kumar : The true battle of GOATs,12
Monu Kumar looks like the TVF Roadies guy who takes the interviews.,36
This boy is punching way above his weight. Wonders that confidence can achieve.,3
3 balls and finch doesn’t need to face chahar till 17th,16
"What will Monu Kumar do after IPL :

Shoot an Anurag Kashyap movie.

What he did before IPL : 

Gave audition for Mirzapur 3",22
Beautiful.,2
"Real reason for Monu's inclusion? 

Sakshi Bhabhi has a [thing](https://telugu.telugubullet.com/wp-content/uploads/2019/04/Dhoni-WIfe-sakshi-singh-kisses-monu-kumar.jpg) for him apparently...",6
Downvoter is back?,10
"CSK plays a new scopegoat in each game.
Today it would be Monu",20
"RCB :How slow can you be?
DP:Yes",14
I just want monu to take some wickets for the memes,11
It's more like dhoni is trying to prove his point more than giving chances to youngsters.,17
How many people can watch on Hotstar at a time?,0
Why isn't the post's run counter thing updating?,3
When does rcb wear green? Any particular criteria?,4
When you wanna create a player on Cricket 19 and get bored midway and save him as Monu.,5
I just paid my credit card bil during powerplay on cred but got only 5 rupees back ＼(°o°)／,3
Monu has 4  alphabets so does GOAT,12
CSK fans: Should we retain Raina next season if there is no mega auction?,2
NEW LENSKART AD HAS ME IN SPLITS,8
"What?? No monu, no party!",8
here comes kutti singam,8
I'm so lost why is everyone shitting on monu? His over wasn't terrible was it?,3
Finchy got all sorts of weird stands lol,3
Monu Kumar to bowl at death!! Let's pray.,8
FEEL THE CURRANT SPARK,3
I actually missed monu's over since I can't watch match. How's he doing?,5
If RCB go on to win this IPL everyone else will look back at 2020 as the pandemic year or the market crash year but Kohli will remember it as the year he finally won the IPL and the year his firstborn was conceived (and maybe born?),17
Monu isn't 24. Comes from my hometown.Dude was my senior in Ranchi local cricket scene.,10
Monu bowl pls,1
[removed],5
So how long until the Finch apology thread gets made since this sub loves being reactionary,2
Ms is really listening to his insta comments isn't he?,3
Waiting for this thread to turn around it head after Monu picks up a fifer.,6
This sub shits on everyone questioning young players and now they are shitting on Monu. Relax!,11
[removed],-1
