Comment,Upvotes
"Typical MI.

Blazing start. Threaten to make 220. End up at 160 - 180. Bowlers bring it home.

Tbh I'll gladly take 195.",10
Not even 200. After that start.,2
Did the match start late today? Or they really took 2 hours to bowl 20 overs?,8
Last ball 140.3 km/h,1
Excellent death bowling by KKR.,1
Over 2 hours for a T20 innings? That's insane.,3
Good Job from Mavi. Now bring Gill for opening.,1
Decent comeback by KKR. The batting should firmly believe that they've got this.,3
Pollard should have been sent ahead of Hardik. He usually takes a while to get going.,2
"Mavi bowled much better than the experienced cummins today, tried bowling yorkers instead of the same length",3
"The late surge which never really came for MI ..
HAPPENS when you keep your hitters saved for 21st over.",1
DK really has to contribute with the bat. His captaincy is not enough to justify a spot,5
"Brett Lee when it comes to Cummins: Oh dear, oh dear, gorgeous!

Brett Lee when it comes to other death bowlers: You fucking donkey!",11
They might make morgan the captain midway through the season,7
Game on. I hope Krunal can still bowl,2
[deleted],3
Might as well announce Morgan as captain. Anyways a better decision than Karthik as cap.,8
After the start Mumbai I think you have to be slightly disappointed they didn’t get 200+ but it’s a very defendable score,4
Road of a wicket easy 400 score,7
"Overall score is really above par, but the momentum^(tm) is with kkr",2
Given the bowling attack mumbai has this is still a very difficult chase,10
Krunal is a poor pandya,1
"Ballsy too give bowling to inexperienced mavi, and kudos to him on keeping it tight.",7
"sending tiwari was a bad strategy. if they'd sent in pollard or pandya, they couldve used those overs to get settled and fired in the last few. rohit was already set on the other end.",1
"FUCK IT, WE WILL CHASE 196 AND WIN THIS GAME",2
ultra patriot Shri Shahrukh khan bought cummins knowing that he's a shit t20 bowler just to wear him out with extra workload and increase the chance of an injury so that he'll not be available for the test series vs India.,84
DK going to get a fine after this match,7
So KKR has gone the Shadow captaincy route? Might as well make Morgan the face.,9
Why did this innings take more than 2 hours to complete?,14
Nothing like the comforting alpha presence of Eoin Morgan to guide you through a death over,7
End of a S-T-R-E-C-H-E-D innings finally!! 2hrs 6mins for 20 overs ?,18
Dinesh Karthik back with his slow over rate,2
"Great maturity shown by Mavi upfront and in the end 
Mumbai will be sad that they didn't hit the 200 mark 
But highlight of the innings was Rohit and his hitting and ofcourse Pat Cummins justifying his price tag by maintaining ER Close to that",9
We are 10-15 runs below par I guess. Getting Dre Russ and Morgan will be key,2
David Hussey looks like he has aged 30-40 years since he retired,3
Those 20 extra runs from cummo going to come back and haunt KKR,3
"Cummins better watch his back, KKR would try and send him home with an injury and let insurance take care of his 15 crore salary",9
"15 runs less of what was looking halfway, but still a good score...can't say it's safe with Morgan Russell and Dew",3
"Karthik's the specialist tosser

Morgan's the real captain",11
[removed],15
Shivam mavi the most impressive young fast bowler in this season,5
2 hours 10 minutes to bowl 20 overs . What’s up with the over rate ?,10
"195 is good but it should have been 210. Those 15 runs are the difference between a chaseable and a really difficult to get total. 

Also Pollard should not be not out after facing 7 balls at the end of 20 overs. He should come in earlier.",9
"Love you Polly.

MI Legend.",8
[removed],9
Umesh Yadav should learn from Mavi.,6
"Kkr can chase this with Morgan, Russell and Dk",6
"20 run short because dew, but KKR also have shite record against MI",4
Morgan was acting like captain,11
[Has COVID19 been renamed as Hardik Pandya?](https://pbs.twimg.com/media/EinKafrU0AArQaH.jpg),4
Sweaty beast,5
This game is all on Morgan and Dre Russ,9
Pollard's beard almost looks fake. Too well trimmed and shaped!,17
Thats... Such a wholesome thing to say.  Of all people didn't expect polly to say that.,7
MI were robbed if that 4th Cummings over!!!,8
Only one time MI lost after scoring 190+ in IPL. That was against Delhi Daredevils in 2018.,5
I really want Gill to perform. Should be his breakthrough season where he scores 500+ runs,6
"DK has given up, he just wants to go to csk next year lol. Looks like McCullum has taken over everything.",14
"Yesterday,Even with more sixes they finished 1st innings much earlier.",4
Dre Russ storm loading..,2
When does the second innings begin?,2
It's not Russell that I fear. It's that damn Morgz that sends shivers down my spine.,10
"I closed the stream after innings end , what did Pollard say ?",5
"Rohit getting out dropped the score by 10-15 runs. KKR got lucky with Hardik's wicket,  take nothing away from Russell and Mavi at the death. Should be good to watch this chase, seems gettable.",2
"**Worst ER for KKR in IPL (3+ overs)**

17.00 (51 off 3) L Balaji vs MI Kolkata 2011

16.33 (49 off 3) J Unadkat vs MI Mumbai WS 2016

16.33 (49 off 3) P Cummins vs MI Abu Dhabi 2020 

*Cricbuzz*",6
"Narine isn't 100 percent , should he open against boult, Pattinson ?",3
Man everybody saw it's Morgan who handled it in end.,5
Remember when T20's finished in 3.5hrs? This is going to push 4.5-5,4
"Shivam Mavi, back from a long injury lay off, has to bowl 2 overs at the death under pressure against Rohit, Hardik and later Pollard, and kept all 3 of them relatively quiet. Huge confidence boost for him.",4
Terrible over rate. Dk should be fined,5
"Rohit struggled to run between the wickets,, what could be the reason?",3
Wait are they expecting narine to open in all matches?,2
I’m more scared of Morgan than Russ tbh,9
"The treatment being handed to Pat Cummins is not surprising at all.



He neither bowls yorkers, nor into the pitch.  Just bowls a good length at pace which doesn't always work in white ball cricket.






KL Rahul carted him to all corners in the ODI series earlier this year and even before coming here, the Englishers smacked him for fun.







Only if you don't follow enough cricket that you will be surprised how he is being treated right now.",56
I'm not sold KKR can do this even with their batting lineup. SKY and Rohit were too good. Not sure sloggers can do it. It all depends on Gill and Rana imo.,5
"Not sure who should I support today. SRH and CSK lost back to back, ruining the previous two evenings for me.

Go KKR!",3
Cummins earnings/ball just went up since he didnt bowl his full quota.,6
Imagine if KKR had bought Alex Hales. Must be awkward for Morgan,11
"Don't know if anyone else knows this

But that's former F1 driver, Karun Chandoks brother Sunil Chandok talking to Bret Lee on Star Sports",15
"mavi was so good! bowled better than the pros at the death,great stuff.",17
"I think MI should have sent Pollard instead of Tiwary after the wicket of Suryakumar, given that pollard needs atleast 10-15 balls before he can start hitting the ball out of the ground.",6
Gald KKR has Ferguson to compensate for Cummins. Not seeing him play more than 4 matches.,5
Will Narine open?,5
Waiting for customary tweets from Vaughan and Nasser about the time this innings took and why The 100 will revolutionize everything.,7
"They should have given captain position to Morgan.
It is good both for kkr and Karthik.",9
Morgan is a natural captain.,6
"If any KKR fans are sad there's a dude on 
r/PAN Working out in Deadpool costume .Just saying",5
"I m ready with my heart

Plz win it over Subhman

GILL. jitega sabka dil",1
[deleted],46
"hoping morgan doesn't just flow like his usual self, he's more dangerous than roided man.",3
"Bruh, the tiktok knockoffs are the worst",1
Inb4 Naraine opens and scores 100 in power play,6
So what did Pollard say??,2
"So, I gather every six and four that was hit tonight was due to DK's poor captaincy and every dot ball and wicket was because of Morgan guiding the bowler. Have I got this right?",40
Gill has one supporter in mumbai btw.,10
What's the point of starting at 7:30? They still take so long to finish an innings,8
"Karan Johar: ""Hardik what happened today?""

Hardik: ""Aaj me wicket me maar k aaya""",5
Karthik should do a Gambhir like in that season at DC. Isnt that how Iyer emerged as a captain?,2
"From cricbuzz : 

Highest successful chases by KKR

206 vs RCB Bengaluru 2019

200 vs KXIP Bengaluru 2014 (Final)

191 vs CSK Chennai 2012 (Final)

Two of them in finals.... wow",8
Pat's 140 SR gonna be handy tonight,3
Sunil Narine to Gill - strike hum lenge bas tum run out mat kara dena :d,6
Tiwari is so thicc man,4
Rohit Injured,3
How many viewers on Hotstar today?,1
"Pat and narine should open,that pat guy need to work for 15 crores",7
It'll be scenes if Pat Cummins gets a few sixes tonight. I really hope he makes up for it,3
inb4 Bmac pads up and starts blasting.,10
lmao reddit treating DK and Morgan to Kohli and dhoni respectively for india,4
I hope Pollard can captain well,4
Imagine having Boult and Bumrah in the same lineup. Wow,9
I feel like Boult vs naraine is gonna be good,3
Should atleast mention the average in a batsman's stats. Yeah SR is important but average isn't totally irrelevant in T20s.,3
"is that a Cross earring on Gill's profile photo

is he a Christian or is he wearing it as a fashion statement like the Japanese",2
"KKR started well last yr but imploded in the 2nd half of the season and there was some off field drama too. They still could have made it to playoffs by winning their last match but they lost it..... against MI, of course.",3
Damn Boulto is so sexy I'd lick the sweat off his body!,-3
Did kohli just promote sports betting as a viable method to fund your kids education! Lol should partner with byjus to complete the circle. What kind of mind numb upper management approved that fucking ad,14
Do you guys remember that clip of Pollard in 2017 final in which he pretends to tie his lace and says something to the batsman?,3
[deleted],20
Feel that this pitch can be tougher than the mumbai batsmen made it look.,4
Rohit not in the field? 😭,6
I really want Cummins to perform this IPL so he can prove everyone wrong about him not being a t20 player.,6
Off topic but Csk's shirts are so nip-friendly.,5
Gill looking to play 10 dots and then explode - Watson agrees to the strategy.,7
5 dots. About time r/cricket writes off Gill as shitty.,62
Gill auditioning for that test match spot,11
"Gill is hitting it good , don't fuck up pls",3
Pollards beard looks like a wig,3
Pollard may be carrying more excess weight than Rohit,3
maiden.,3
Gill tryna payback maiden that mavi bowled,5
the only thing which keeps me away from liking KKR is they destroyed my man unmukt chand in 2013. He just perished after that season :(,8
In about three years Hardik will be only playing IPL. No Indian jersey once Kohli losses the captaincy,-11
Great start,3
In b4 Gill 50 ball 1 run,-1
Brilliant over.,3
Goddamn Boulto nice fucking over! Beautiful!,4
So this is a T19 now,12
"Fuck, a maiden.",6
"Yeah, he bowled a maiden but he didn't bowl a wicket maiden like Mavi.",6
Gotta enjoy Boult Bumrah... Till it lasts,7
1 maiden over checks out,3
"Ah, the good old Narine pinch hitter strategy",5
 mans lacking confidence,3
Starc would've been a ripper if he was in this IPL,4
Imagine what Boult would do to gill in helpful conditions ...,6
Best bowler in the world.,3
Overrated gill,-4
"The mom in Extramarks and Whitehat ad are the same , just noticed",3
El Boulto starts off with a maiden,6
Should have opened with Mr bants Banton,1
Shubman stating his credentials for the OZ tour,3
Good guys KKR ensuring RRR is above 10 before they get going,19
What the hell Gill ?? This isn't a test match. Ffs..hit 6 sixes of the 1st over or get out.,13
INTENT™,1
This over definitely won't be a maiden,2
Boult is a steal for MI,10
[deleted],-1
"Mumbai have fallen 15-20 runs short. Their death batting was sub par. 

If KKR can get off to a decent start, send Russell to bat with atleast 8 overs to go, this is their game. Don’t do what MI did and send your biggest hitters to late after a great start. 

Russell at 4 should be their seasons mantra.",9
Bring dreruss at 3,3
Feel like shit just want Banton opening,10
Test cricket is best cricket.,6
Opening with Narine will never work in these long boundaries,8
Gotta love Finch for getting Narine to open,7
Definite 4 saved.,2
Kunfu Pandya is back,2
"I just don't get the ""let's get Narine to make a quickfire 20"" strategy when you have Banton on the bench...",8
Why would KKR even play Gill ? Don't they know that Gills don't work on land ?,1
Hardik showing Character™,6
Saved a certain boundary there,3
Nice.,1
C'mon get them shots going Naraine,5
fantastic stuff from the one you call Fuckboi,10
Remember Pollard doing that at point. Now Hardik,3
This bowling line up looks deadly for even a top class test team.,6
"Off the mark, raise the bat",6
Oh look a run,3
Yay. A run!,3
This is fine,6
Oh look a run,3
MI strategy to keep opening batsmen intact.. Dont let russel in till 16th over,12
"Even if we lose this match, it doesn't count because it's against MI.",5
Pattinson only cost Mumbai 1 crore,6
Watching test cricket after a long time,7
I wish Narine waste some balls at the beginning,1
It's already over for KKR. Better play this to save the NRR now.,6
Three superb shots straight to fielders so far,8
Is it really a run chase unless the required rate is 2 a ball?,9
The crowd noise is just trolling now,6
They are gonna field well too now??OOF,6
"Chasing 195, 9 balls to get the 1st run lmao",10
Pattinson looks like a bully from high school,10
"Fielding looks on another level compared to game 01.

Great stuff.",7
Man these guys are under Bazz,3
oh i see in that Sky in the UK have no problem going TO AN AD BREAK IN THE MIDDLE OF AN OVER,3
here we goo narainne!,3
"Pattinson is like a cowboy cricketer. Bet he eats steaks for breakfast, lunch and dinner.",3
Who tf shouted catch it,9
Shoot he picked that early. Sweet as.,2
NARAYAN NARAYAN,11
BIG Dick Narine,2
Ooh mama,2
Narine just hits it so effortlessly,6
IPL is so conflicting for me. I hate MI as a team and want them to lose every game but Bumrah is my favourite bowler and I also want him to take a hat-trick.,6
This Mumbai kit will look a lot better with White or Yellow instead of this Gold,1
Don't shit on KKR yet. They are setting the stage for Russell show. It's would be so good to see him score 50 runs of the last 2 overs to chase this down,10
I forgot Narine smacked RCB *twice* lol,2
Ffs sky stop changing the channel without warning me,8
u/tdlan I saw that,3
James Pattinson is making 1/16th of what Cummins is making and I bet he does better than Cummins thru the IPL,15
"Back of the length ..under the neck , on the stumps ..

Notes of umesh yadav for Narine.",7
MI has a deadly bowling lineup ngl,7
i can’t decide which team i hate more in this match,16
Gill looking really rusty here,2
"ICC be like this is illegal how can narine open he is bowler.

Now he is banned for opening the batting.",-1
"We just need to do a Csk

N get to 200

Easy peasy",-1
"Abhishek Nayar, isnt he some guide for so many indian players?",4
"They would keep banging back of the length slower ones, the pacers.",2
Who was that standing with DK? Looked familiar.,3
Gills take some breath,3
Gill pulling a Vijay today,6
Damn dugout feed is pretty fucking good. Was getting ear fucked for the last 4 games by the English commentary.,6
Yayyy,1
kid just choked under pressure.,2
How do you carry watching on UK sky go??,1
Karthik at 3,2
Abhishek Nayar is to KKR what Nehraji was to RCB. The guy's everywhere.,3
Lmao.,1
Nice catch Pollard👏🏼👍🏽,1
All this build up ?,1
"Even cricbuzz calls it a pie

Lol boult",2
"Gill is Uthappa's successor, confirmed",1
:(,1
what a dumb shot,1
"Side note 

I know inside edges that almost clip the wickets but then roll to the boundary are part of the game. 

But my god, they genuinely piss me off",3
Boulto just make me your slave you sexy man!,4
Idolizes Virat---->Struggling against Boult,19
This is how El Boulto responds. Take that Gill.,1
Gill rusty af,1
Big hands bois,1
Lol Russel.,3
Mumbai had a zoom session with Sweden's greatest Johnty Rhodes after that CSK match,3
Pollard catches the ball like it's a fruit that he needs to eat for dinner,4
I am so pissed that we gifted Boult to Mumbai. It’s tough being a DC fan. Rabada and him were a lethal combo. We don’t need to use a foreign spot in our top order batting. It’s all Indian.,12
"Anticipated the short ball, pity couldn't execute the pull.",2
Lol Russell takes the catch lmaooooo,2
Gill :(,2
Gill struggles with the short ball,2
Poor from Gill,3
ffs gill,3
"Russell takes the catch 
- legend deano",2
Big hands aka The Anti-George Bailey,3
"Gill. Great Trailer, disappointing movie.",6
Sadly? mate we were waiting for that dismissal,4
Is That DK at 3?,4
"Probably been asked a bit, but how can I watch this in the UK? Women's cricket is on SSC.",5
"Getting out to Boult?

Gill is future Kohli confirmed!!",7
"BIG HANDS
B I G H A N D S",1
Them vadapavs bouncing when Rohit runs. Noice.,8
DK over Rana,1
"**2.4** Boult to Shubman Gill, OUT,  **14-1**

Shubman Gill c Pollard b Boult 7 (11b 1x4 0x6) SR: 63.63",3
What happened to the good old days of Lynn and Narine cunting it?,4
But /r/cricket told me Gill is a specialist opener?,8
Sara will be disappointed,7
8D chess to get out so better batsmen come in,3
Kkr definitely bottom 2,1
"""Andre Russell takes the catch. No, it's Pollard""

AlL bLaCk PeOpLe LoOk AlIkE.",25
too much pressure on gill.,7
Yeah babay 👍👍👍,3
Sara in shambles,4
That's what a captain should do,7
Overrated Gill gone.,-2
"Subhman gill does a Murali Vijay

Bring in faf now",5
Wtf is the guy saying in the cred advertisement,2
"Why DK at 3? 



Ffs


We need you as a finisher for the next wc.",4
"Could be KKR, could be Mumbai Indians. Great commentary Murli. I thought it could be RCB.",18
These chants suck,1
This White hat jr ad is criminally misleading jeez,33
Wow.. DK stepping up to take the responsibility.. Hmm,7
Mi fielding for last match too.,2
Cummins in next,3
Damn fucboi,4
Karthik's 96 or odd was sick last year,3
Yo Dinesh in! Need a captains knock,7
Pandya is not letting a single ball go through.,10
Fielding standards of first match to fielding standards of today ..... Improved indeed,5
Let’s go DK!!,2
"Auspicious man Gill, gone.",3
Should have sent Russell up tbh,-4
Karthik would have been a domestic legend if he wasn't an international pauper,7
 Karthik about to play a captains knock?,5
"DK clearly overestimating himself. 😂
Morgan should have walked in. Only he could have used whatever's left of the powerplay.",-10
"Yeah DK, shut em up",9
"Irrespective of how this goes, I like the idea of DK getting himself out at 3",7
Anti-dhoni,7
Karthik coming at 3 is terrible for KKR. That means Russell won’t come on till 6. The match will be gone by then. Their body language tells me they will send Rana and Morgan ahead of Russell.,-13
"Captain standing up and taking responsibility, Gambhir subscribes.",13
NIDHAAS,9
Fuck me some of you literally need a single bad performance to jump on players don't you,13
Let's go DK Bose.,9
"Good to see DK came out to bat, have taken it upon himself as a captain unlike a certain captain last night",16
"Grrr. My stream has just cut to England vs Windies women's game. HELP!

EDIT: Thanks chaps! Missed a fuckin' wicket though, I see.",8
Bumrah about to rattle the stumps,3
I feel Gill was trying to hit it hard and smash it every ball. When he has good orthodox technique.,4
DK doesnt wanna argue with russell down the order lol,6
Nagin killer is here lads,7
Captain stepping forward with intent to win it for his team. Appreciate it,9
"come on, boom!",3
"As someone who went to the same school as Shubman, I always root for him. He used to say how he's going to make it big and I always laughed it off. Welp, look where he is now.",21
"Tamil Matrimony app advt... all the dudes in list are very pale. Does not checkout!

Edit: haha, downvoted for pointing out - even targeted advts are whitewashing our natural skin color.",-4
"Karthik is not anti-dhoni, dhoni is anti-karthik",12
Does Narine now play like an actual batsman?,3
Amazing bowling line-up MI,5
What exactly has Cummins done to be paid 5X Boult’s salary?,7
Narinder just can't run.,5
[deleted],8
"having considered the matter carefully, golden pads aren't for me.",7
"How did Boult play so shit for Delhi but becomes a Don in Mumbai?

Serious question, what is in Mumbai culture?",18
Fuck me that was the worst throw in the history of throws. Lol.,6
No other captain would send Dinesh Karthik ahead of Morgan and Russell,21
"Boult, bumrah, pattison.. Spoiled for choices in the power play",4
Where else on earth you would find Nehra g sharing his views on building an innings .,6
Bumrah had an off day last match let's see if his rust has been scrapped off or not.,3
I SEE RINKU!,3
"Common narine throw ur wicket

We need 2 captains batting now. 

Showing a certain cap how to bat like a cap",3
Umm guys Naik 's strike rate is 64.,7
"How long would it take KKR to realize that teams have figured out Narine, the opener?",5
2 throws... Both fucking trash... Learn to throw like pros you fuckin idiots!,-6
"Narine really doesn't want to bat with Karthik lmao

Almost run out twice",5
Is narine trying to get out?,6
Narine gives 100000⁰-1 shits,18
Commentators laying it thick on DK,2
This is supposed to be the powerplay.,4
Playing as tho they’re chasing 140,12
Pollard is the kinda of guy that would purposely miss the stumps if he belives narine would eat up more balls,63
THEY ARE LEAVING BALLS??,3
I'm not sure how we've started this well. But I'll take it.,2
[deleted],0
Mumbai won this one. Calling it early,4
Man they’re all at sea vs this attack.,6
KKR surely will get this done inside 35 overs,10
Dk doing a vijay to woo the girl vijay stole from him,8
Ambani so rich - he's bought the whole KKR team just for a fielding session of MI,16
narine trying hard to run himself out,4
Cant you guys see? They are playing off the new ball /s,4
why tf does igp think a dude with cake on his face is gonna sell their shit,1
Inshallah all KKR batsmen will pay tribute to Dhoni today,12
BIT weird that the graphic of ball placement uses the WHITEST skin tone imaginable,2
"Karthik vs Bumrah (IPL)
23 balls
50 runs
No dismissals
SR 217.39

Stolen from cricbuzz",8
Arey umpire catch yaar.,3
Kkr are really gonna leave this for dre russ to finish. 70 off 30 vibes,5
I have a confession guys. I like the jio dhan dhana dhan ad.,11
Where is the Intent,3
"Just making a little more challenging for Russell.

The more the asking rate , more he gets pissed while approaching the crease to take guard.",4
Hey why this odi got reduced to 20 overs?...someone explain plz,2
"After seeing all these youngsters performing in their first games, was Padikkal really that good or SRH bowling shit?",4
"is the crowd chanting ""Take it off, Take it off, Take it off""

K I N K Y",6
Why don't IPL allow Pakistani players in the teams ? That would be grape.,5
"dinesh is a really nice guy but he comes off as a bit of a pushover. plus he's had medium success in the national team. it's gonna be hard to take him seriously when there's a wc winning captain, a more assertive guy like morgan on the team.",8
Please get Narine out so he can stop wasting time.,2
Hire RPS's astrologer or something.,7
DK will go down as a legend whenever he retires.,6
Shot,1
"CSK Fans: Umpire should have caught it, afterall he plays for MI, right?",10
Karthik showing KPs iNteNt,1
Kartick slices the ball like that really well,3
Good over from JP.,1
"Narine making full use of his Lux Cozi ""*Apna luck pehen ke chalo*"" jersey.",7
"I like the idea of DK at 3. KKR have too many accelerating type of batsmen. DK is best placed, with his experience to play through the innings. He's very good and busy in the middle overs and keeps it ticking. And he can clearly finish when required. Is one of the few Indian batsmen who's truly 360.",9
My dad almost had an aneurysm when he saw that BOTH teams had gold in their jerseys,7
"I hope our indian batsmen at least bat like tiwary

Decent 20 of 13, did his job, got out done.",2
"Everyone in kkr either trying to do a Vijay or Dhoni

Aise kaise chalega bc",2
Ouch DK😅,3
"lol I thought narine was gone, later realised there is an umpire under it.",3
"I remember Karthik, playing at 3 for MI in 2013, he scored over 500 runs, really good.",5
It won't be fun to watch if it was too easy for Russell. He wants to get 90-100 runs in the last 5.,0
dk dick shot,2
That’s gotta hurt DK,2
That's plumb in the plums but not plumb LBW unfortunately Patto,2
Right in the slot,2
Dk is class but im conflicted about him coming in at no 3,1
One patty bought for 15 crores and the other bought as a replacement.,8
Narine can't run or doesn't want to ? And can't pull fast bowlers .,5
Binga should do stand up,3
Lol Lee just said that's hitting middle stump,5
Someone from mi has to do a nagin dance to burst out the sapera Karthik,3
Honestly kkr may have the strongest batting lineup in the league,3
What happened to women's IPL? Is it happening?,0
people are so fuckin quick to call someone a legend,3
I hope they bring morgan and russell next,2
