Comment,Upvotes
inb4 Patrick at 6,2
Lmao. He sat on the ball and lost it,8
Lmao,2
Why don’t other teams bid for Karn Sharma? He always seems to play well but rarely gets a game for CSK.,5
Lmao,2
"Karn Sharma.  With that circle beard and average body, he looks like your basic 90's MLB relief pitcher, probably named Dave McGloin or Tim Bradley.",9
"Karn Sharma is brother of Kim Sharma, Yuvi's ex.",3
"Bless you Chahar for showing us that interesting demonstration of break dancing. Now it's your turn Kedar Jadhav, maybe you'll finally be useful at something.",9
Karn Sharma rocking the same hairstyle since the dawn of the IPL,23
That was a Wile E Coyote moment for Chahar,2
Karn has outperformed PC,5
Why is every KKR batsman except Tripathi struggling here,7
why does the batting order look like dk put the numbers 1-11 into a random sorter,4
Tripati for 100. I am Jinxing.,-1
Karn Sharma booking his spot in the next game aswell.,2
"7 overs a go, it's time for Russell. Tripathi should take a risk",8
"Great spell from Karn, but don't forget Chawla too was excellent in his first game",2
5D Chess from KKR to give Karn the best spell of his CSK career.,7
Suddenly remembered what my ex smelt like.,0
Kudos to Karn for bowling well on a good surface.,1
Karn Sharma goat,2
"Which youngster is like rahul dravid,according to you?",1
3-time IPL winner Karn Sharma is a god.,7
Why hasn’t Jaddu bowled yet?,2
"25 runs & 2 wickets from 4 overs from Karn Sharma, brilliant spell given the pitch",5
"I think the fascination with Narine has to end soon for them, they have to realise they have world class proper batters. Who need to actually face balls to make an impact",6
"Karn  👏 

That was a good team change.",10
"**Rahul Tripathi's last five scores as an opener in IPL**

27(15) v KKR

80*(58) v RCB

20(13) v KKR

50(45) v KXIP

58*(39) v CSK (so far)

- Rahul Tripathi scored 3 - 50s in last 4 innings (while playing as opener in IPL)

- [Rahul Tripathi (Avg/SR) as opener: 31/140](http://www.howstat.com/cricket/Statistics/IPL/PlayerPositions.asp?PlayerID=4679)

- Rahul Tripathi in IPL: as opener: 5- 50s Non opener: 0- 50s",11
Karn Sharma for Aus tour? Redemption from 2014 tour Ghosts ❤️🥰,0
"Lol, this game is David + BMac vs Michael + Fleming. Brother + Legendary Kiwi captain competition lmao",6
[deleted],9
Swann now shilling Ceat Strategic Timeout. Found a new sponsor.,1
It'll either be an 8 wicket victory for CSK or a post-2016 Dhoni special chase.,-7
They did not send Tripathi to open because he lasts too long /s.,7
KKR might have send in Narine for Dhoni to not use Jadeja in a 4D chess move. But Dhoni probably had no plans to use him from the start!,6
"DK, Morgan, Russell all asking Baz to bat higher

Baz can't decide between them so he just sends in Narine.",14
csk winning this is entirely dependent on watto,14
Iyer's acting reminded me of KRK,10
Narine's 17 (9) can turn out to be quite crucial by  the end of the game.,15
"Reminder to everyone that WhiteHatJr is a fucking scam

E: please take a look at some of his posts u/pooniahigh",45
"All anti Dk in this sub r Murali Vijay fans

Lol",41
That was a great spell by Karn. CSK have just pulled things back slightly here. Wonder who'll Karthik decide to send next.,6
"Bc coding karne se desh kabse badal jaata hain, fucking whitehat",8
Pls keep Karn in the team next match. I just can't see chawla running in the field it's just atrocious.,6
karn will stay on the team his figures were very good,2
Tripathi with a 100 and Russell with a 14 ball 50. I hope my jinx works.,10
Piyush Chawla serving bananas 😂,10
Chawla serving bananas to Jaddu is.....ok,7
Sam ‘the terminator’ Curran.,0
I miss Lynn at KKR... or playing at all for that matter,4
Who else cringed watching Dhoni Oppo ad,0
Excellent long term strategy by KKR to ensure selection of Karn for next matches.,8
Third Umpire sounds like he is an indian in an american movie,2
"Wait, why did Jaiswal just peg that straight into the ground?",1
"Mark my words, one day we'll see Mavi and Nagarkoti open the batting for KKR",5
He was a gonzo,0
"It seems like everyone can bat in the CSK line up, need 190.",4
"Ffs, get a direct hit already",1
haven't seen one direct hit this season.,1
Come on guys hit the stump,0
"Anyone else just not as impressed on those relay catches? 10 years ago they were a cool anomaly, but now there’s one like every game. Commentators playing it up big time IMO.",-1
"DK banging his wifey

Vijay- Me ye krleta hu aap dream11 pe team banao",2
Sam curran is 'Baby's day out' version of cricket,7
why isn’t kkr playing kuldeep?,5
Imagine if CSK could hit the stumps,10
Lmao Tripathi survived 3 runout chances,4
Sam Curran bowling at Morgan. A nation holds its breath.,8
"Brother dropped a catch, Sam missed a runout.",7
Betting on the based twink to provide the breakthrough,3
How many times has Tripathi survived the run outs,0
ooh sam bowling at the skipper,5
"Tripathi's knock entering the ""starting to hurt the side"" territory. Needs to hit out or get out.",4
KKR are trying to increase their score and CSK don't want that,0
"Idk if this is relevant here,but jaiswal fucking looks handsome with that hair. No homo",1
I swear if Russell doesn't send CSK's army of dibbly dobblers into the next dimension...,-1
Off topic but can anyone tell me how whitehat is scam ?,1
Who hurt DK?,0
Anybody remembers when Kuldeep used to play,1
What is Morgan doing? Russell is yet to bat and he is doing tuk-tuk.,1
"Tripathi really hates being in either crease lol, good batting tho",5
Fleming has the best reaction faces. His reaction to Pune paying so much for Stokes(iirc) during the auctions was such a classic.,3
Tripathis weakness is fucking obvious...running between wickets,2
Too many hitters left to not be hitting.,3
Tripathi running in the middle of the pitch like a champ.,3
Being swept is the ultimate insult to a fast bowler imo. Maybe only batting without a helmet comes close.,4
"it's almost criminal and unfair that MI has boult, pattinson, bumrah , pollard and pandya as bowling options while the only good bolwer we had is injured. Now we're left with 110 kmph pie chuckers",3
Santner?,1
Tripathi looks tired af,2
Tripathi loves the slog sweep. EA Cricket 2005 vibes.,1
Deepak Chahar was searching for the ball for a looooooong time,0
Start hitting DK Russell Cummins Nagarkoti still to come,0
Tripathi needs to get out.,-1
What a shit team by Bangar,8
"113-3
13.3",1
Russell vs Thakur would be too fun to wathc!,6
[deleted],8
Let's not tuktuk let's boom,3
On Banger's team Santer will probably not get a game,8
"""Sun was on my eyes"" moment",4
Imagine being the captain of England and playing only the last few overs as a finisher in the ipl,5
Bangar is terrible in the dugout,6
Bangar chose Virat over Rohit. What an idiot. Kohli has only one good game,4
"Tripathi is trying so hard to give his wicket. *Le lo, are bhai le lo*",5
"I put tripati as a captian then relaxed with Rana, chose karan as CSK bowler then replaced with chahar. RIP my score. Fuck me",3
"Lil Sammy's growing up

Looking a bit aggy today and he's grown some fluff on his face",3
Bangar chose Santner lmao he hasn’t even got a game,11
Curran looking older and more stressed out by the day.,1
Why are commentators cribbing about Narine No. 4 experiment? Its not as if he wasted balls. He scored 17 off 9 and thats what he was supposed to do as a pinch hitter.,6
Bangar lmao,4
Idiot Bangar has picked Santner in his Fantasy XI,13
Banger's team is some vanilla stuff,3
BC Tripathi hit or get out.,2
Tripathi seems to have no sense of when there’s a single & when there’s not,7
Ok Swann we don't do gre words here lol. Facetious 🙄,2
Lol Swann and bangar,1
"Fuck these lights.

No wonder so many drops",2
Tripathi is too lucky today he cant get out,8
Tripathi has Curran in his fantasy team seems like.,3
Tripathi is exhausted af,1
Why is everyone struggling to time the ball??,0
The only way CSK can win this game is by scoring more than KKR in their innings,2
Bangar is so slow,1
Don't apologise Swann. It was stupid of Bangar to select Santner who will probably never be selected this IPL.,5
Projected Score is obsolete why do they keep showing this every game,1
"Abey out hoja,
Get out man.

Trying hard to out",0
Bangar justifying picking santner lmao,4
Bangar hasn't understood a single jone on the Dugout so far lol,3
3D play by CSK not letting Russel come in by letting Tripathi play,1
Understood. Tripathi won't get out today.,4
Tripathi looks tired. Seems like he has lost a bit of his strength,6
It's getting awkward in the dugout with Swann and Sanjay lmao,8
Nobody does it better than CSK when it comes to not getting the struggling batsman out,3
KKR have missed at least 5 extra potential doubles,8
RUSSELL TIME BITCH,6
"https://www.crictracker.com/englands-chris-woakes-and-his-wife-blessed-with-a-baby-girl/

Woakes pulled out of IPL 2020 to be with his pregnant wife 

He should've pulled out of his wife to be with IPL in 2020",2
 Curran in to the English team,5
I feel like Russell is gonna get in form today. He has a history of cunting the ball outside the park again csk.,3
soft and sensual dismissal,2
My boii Scurran❤️❤️,6
MakesThingsHappen,5
Watch DK send Mavi into bat,4
👀,0
"Even tho I support CSK, if DK comes we riot",9
Bruh Morgan out 😶😶😶,2
Fake crowd noise dead?,1
"Specialist pace bowlers like Bumrah, Boult and Pattinson had an awesome day yesterday. Shuddering thinking of what Patty Cummins could do here",1
Wow its like an office episode. Everything that's happening between Swan and Bangar,8
Lol imagine the meltdown if DK had played that sort of an innings,24
Sam Curran won't be playing for England's limited overs sides for a while then,12
Rip Currans LOI England career,7
DK DK DK,7
Lmao Morgan played like Narine,22
There goes Sam's LOI spot in England,12
Nooo Morgan KLPD,2
Oh yess.. Morgan out..😍,-1
"Sam Curran after dropped catches :

**Fine I'll do it myself**",10
"For a good player, Morgan is Terrible against a short ball.",16
Narine > Morgs,3
"Big wicket for CSK, but never knew Sam had that much pace to hustle someone lol",3
hahahaha. the match when they sent Morgan up the order.,14
Vintage IPL Morgan,8
Redemption for DK tonight?,3
Sam curran to nehra :- take that,4
Russell muscle,1
“Thank about that the next time you drop me” Sam to Morgs,6
lmaooo that should shut the fanbois up,9
Slow medium bouncer does the trick.,1
IPL script writers one-upping r/Cricket once again with Morgan's innings.,9
SEND IN DK IT WOULD BE SO FUNNY,8
"Is this good bowling or bad batting?
Have the conditions become bowler friendly?",2
BC Eoin. We were are all rooting for you man,2
BREAKING NEWS: Sam Curran is dropped from the England white ball team.,15
https://www.reddit.com/r/Cricket/comments/j6pm26/comment/g80clnt,2
"""What a worst captaincy by DK sending Morgan at 5 when he doing so good at 7"" /s",5
Hahahahaha you guys hahahaha.,-1
Samuel is the only player that I want to do well in CSK,1
"Curran bowling bouncer to his captain

Wish commentators had that gut",6
"**13.6** Curran to Morgan, OUT, and there is a wicket at the wrong end. It is Tripathi who should be getting out from KKR's point of view. Instead it is Morgan gone off a really good sharp bouncer. It is angled into the body and over his right shoulder and takes the glove on the way through to Dhoni **114-4**

EJG Morgan c &dagger;Dhoni b Curran 7 (10b 1x4 0x6) SR: 70.00",3
Russel out there makes me very very uncomfortable. He could take apart Shardul and Chahar at the end,4
Sam getting his captain out.,4
Suddenly Narine seems a better choice than Morgan eh /s,3
DK playing as a specialist captain,5
This was the perfect innings for Morgs to fire. Disappointing knock tbh.,2
"The one time Morgan is sent over DK and  Russel, he ends up not performing lol",4
Narine > Morgan confirmed.,1
"I know hes just been dismissed and probably wrong time to ask, but has anyone really seen Morgan smile this IPL?",3
Narine at number 4 looks like a genius move in retrospect. The run rate would be looking horrendous without his contribution,2
SRK,1
Only one Curran shall remain in the team now,3
Deepak is bowling shit. Wtf was that leg stump half volley. Umesh Yadav like,2
Who is DK,2
Chahar has been shit today,1
Chahar bowling like a bhenchod,4
Fuck yeah,2
Tripathi needs to get moving,1
"Chahar BC, he is hitting you on the legside you keep bowling there.",3
Why the fuck do you keep bowling on his pads,1
"Can't wait for Cork to get into the Dugout so Bangar never fucking returns, he speaks at x0.5 speed, such a pain to listen to",6
Lets jinx Dre Russ so he doesn't get to double digits,6
You just know Chahar will bowl slow short ones.,2
Wow! Jadeja didnt even bowl today! That's something,5
Who are they announcing this for? There's no one in the fricken stadium,8
Chahar has forgotten how to bowl is it?,6
Suryakumar Tripathi scoring in the V behind wicket,4
Single digit score for Russell today,3
Tripathi is apparently ex RCB. Figures,5
The K in SRK stands for Kocaine,7
Why is Tripathi vibrating while facing lmao?,5
"Man, Madhuri still looks stunning after all these years. Looks like she took a bath in the fountain of youth.",12
It's interesting how batsmen who don't have a great big hitting game try the ramp shot to get boundaries. SKY yesterday and now Tripathi too.,6
Rahul flicks with one knee on the ground as if he's proposing someone,3
3rd time Chahar bowling same shit ball down the leg,2
"Tripathi generally struggles outside powerplay, need to do a Tewatia here and level up lol.",8
"Suryakumar Yadav: ""Rahul Tripathi for Indian team""",5
"Feels like Tripathi & rest of the batsmen are playing on completely different pitches, facing different bowlers",6
Why. Why. Why,3
"Narine good

Morgan bad

r/cricket sad",33
monkaW russell is batting,3
graeme stfu I can’t,4
Selecting a batting order is a lot like the eating of an orange,3
Muscle russel or no tussle russel?,2
Sam Curran is soooo cute 🥺🥺🥺,8
Cmon KKR!,2
Karan four overs done?,2
"This season russell looks not as much destructive as kkr fans would have liked, this is a great stage to come back to form tho",6
Finally KKR using their common sense and not sending DK up the order.,8
Asshole asshole asshole,2
SKY is that you?,1
Russells 69th ipl match,2
This batting lineup is exactly rCricket has been screaming for. Let's see how it turns out.,2
What a shot,1
Stop bowling there omg,4
I'm trying to understand whats the point of gliding bots.,5
What a six 👌,4
What shite bowling,8
POGGERS,5
Chahar what are you doing man??!?!?,5
DADDY TRIPATHY,4
I see csk getting murdered today by russ,2
Fine leg up.. A nice military medium outside the leg stump. Just begging to get hit for a boundary that.,4
Chahar giving Umesh level freebies,7
Atrocious bowling from Chahar. He is single handedly costing CSK the game.,4
Chahar's not having a good day today,3
Fucking beyond leg stump line.. fucking joker,3
Jesus another shit ball,3
Crap bowling,3
Chahar is bowling worse than Thakur. Lmao🤣🤣🤣,6
Wtf Chahar y u bowling in the leg,3
That’s horrible bowling,5
"Rahul ""suryakumar"" tripathi",6
Umesh Chahar.,3
Good year for Rahuls,4
That is a hybrid between an AB and a SKY flick,5
Chahar bowling like garbage,3
chahar ffs,1
"Failed Yorkers, now get in lord Thakur and clean up the mess pls",4
"Same chutiya bowling, never change. Change the fielders or bowl according to field.",1
Post covid Chahar not so good,9
Tripati has a good balance to pull off shots like that,3
Tripathi is playing a fantastic innings here,2
Chahar is really out of touch :(,2
Chahar what the fuck,4
Bc itka gavthi shot 😂😂,6
Kkr need 180 minimum,1
"When Chahar bowls these balls down the leg side, Dhoni has the typical disappointed dad look!",10
What the fuck is Chahar doing?!!,3
Remember when Shane Watson used to bowl??,10
Lord Chahar nearing a quick fifty,2
Seeing Rahul bat pisses me off on how RR underutilized him by making him bat down the order,9
Bangar is silent lol,3
Why are all the bowlers bowling at the leg today? So many unwanted boundaries,4
Chahar is not the same after he got COVID,3
[deleted],0
"*Irfan Pathan to Dhoni after watching Chahar bowl*: ""What he got that I didn't?""",8
Every time an uncapped player thrashes csk.. and chahar bowl on the off for fucks sake,4
Russ gotta play till the end.,3
Is this really Tripathi's first game as an opener? What a talent,3
Russell timing the ball instead of smashing from get go..... I've seen everything,3
Bangar is the impostor of Dugout,4
Umesh vibes,1
Tripathi for India when? 🤔,4
[deleted],1
on what channel do they have dug out,2
Andre Tripathi,6
Give Ambati an over,3
"Despite Morgan's failure today, this batting order is perfect with narine as floater. DK should come as low as possible. Once he himself said he feels most sorted when he is finishing.",4
we live in a world where narine and thakur r better than chahar and morgan,3
Chahar single handedly changing the momentum of the match. In KKR's favour that it is. KKR fan probably disappointed that they won't be getting anymore over from him.,3
"If another wicket falls now, DK should send Cummins just for the memes",3
These commentators never laugh at each other's jokes lol,5
Tripathi for 100?,1
"Time to clone Thakur, atleast with him there is zero expectation.",2
In life Be positive but not in Covid test plz...,0
"**Andre Russell vs CSK between overs 16 and 20**

- 130 Runs

- 59 Balls

- 130 Avg

- 220.3 S/R",3
Hindi comms (except Pathan) are calling Sam Curran stupid who didn't know Morgan struggle against short stuff. Dhoni had to tell him twice what to bowl with right field setting because he didn't understand it first time. Wtf is this commentary. Pathan is only sane one who says Curran understands Morgan's game because they play together and was asking Dhoni to set the field.,9
Karthik calling Karthik - ye mein kar leta hoon. Tab tak aap \#7 mein khelo.,1
Hope Tripathi scores a 100 today. It has been 12 long years since we saw a KKR batsman reach that milestone.,3
Mfw Thakur will bowl at the death,2
KKR has 8 batsmen damn,2
"Lol. Jadeja's t20 stocks dipping day by day.
Wont bowl if Left handers are batting, and if and when he does, more often than not, gets taken to the cleaners.",4
"*Are you sure it's not Tripathi's birthday? He's been gifted so many deliveries*

Lisa Sthalekar being savage lmao",10
Lol DK shaved looks weird,3
Ah DK shaved. In comes 15 ball 50.,6
Thakur vs Russell !!!,1
downvoter is back gg,2
DC shat the bed today. Terrible bowling from him.,2
"Plays 1 good innings, Literally everyone: Get him into the Indian team, also fuck pant",6
What did DK do to his beard? Went the Pollard way,5
Dk destroyed his magnificent beard,7
Feah yeah,2
Collective orgasm.,3
Lmao,2
hahahahaha. rCricket's batting order is not working,6
Thakur to Russel dot ball. peak 2020,7
"Not gonna lie, Narine in middle overs to up the run rate isn't a bad idea if he can score those 18 off 9, 15 off 4 etc cameos.",6
Ffs,3
Is this the real life,2
Hype hype hype hype,4
"Perfect time to sneak in two frm Jadeja. May even get Russ, but they're sending Shardul to be cunted by Russ

And he gets out as I say this, lol",2
Thakur Sahab!,5
All hail the Lord,4
That's the end I guess.,3
Lord Thakur > Chahar,2
"Big wicket, well-done stopped nearly 30,40 runs",2
"So much for the commentators praising dhoni all the time, none of them have him in their fantasy league",7
RISE OF THE LORD THAKUR,4
Thakur >>>>>> Bumrah,2
Russell making the Hindi commentator eat his words mid sentence,3
Thakur God,2
Please can team management send Cummins in at the next fall of wicket for the meme potential,2
AHAHAHAHAHAHAH HUGE MEME I LOVE THIS,2
"Thakur 2-9 in 2.2 overs

If I speak...",5
Lawandre Russel,1
Lord delivers,2
alright get tripartite out and it’s over,2
BLAME DK FOR THIS TOO,7
Wow I'd never speak I'll of Thakur again,8
We jinxed Russell didn't we,5
Shardul you magician,2
O shit.....,2
"Fuck, we ain't crossing 170 now.",5
👆🏽👆🏽👆🏽👆🏽,3
Lord Thakur is having the time of his life,5
DK masterclass incoming,1
DK to play a blinder and shut up r/cricket,3
Russell's out of form... potential 200 came down to 170,4
CSK already won the match,3
Thakur too good for Russell.,5
Russell ain't got shit on LORD THAKUR,3
All remaining is for DK to do a fuck r/cricket today,10
"Mccullum writing ""lag gaye laude BC""",20
time for OG finisher DK to show up,6
Russell gone 🔥🔥🔥🔥😍😍,6
RUSSELLLLLL YOOU SHIT,6
Boring,2
"That's what happens when u overhype Russell and meme thakur, r/cricket works in mysterious ways",13
"So no matter where karthik bats, the team will remain shit. Noted",9
This is peak 2020. Watch while you can enjoy y'all,9
Fucking thakur costing me two Fantasy league matches in a row,8
thakur is bowling out of his mind,1
WHERE ARE THE SHARDUL HATERZZ,5
Is it just me or has Russell gotten thicc since last year?,6
Pollard > Russell,7
Send in Pat,1
Russell is massively overrated imo,0
"No matter the target, very much looking forward to CSK taking it nice and easy in the chase and needing 100 off 42 deliveries as is tradition.",8
Yay,1
in before Dk 46(13),2
Why 😭,0
"Remember, Thakur almost got a hattrick last match.",3
Lord Thakur cleaning up chahars mess,5
"Once again, all those who said they will take Russell over Rabada can eat shit.",6
Shaven DK is r/cursed_images material,6
DK be like this is what happens when I don't come in before Russell and Morgan,6
"KKR : fuck r/cricket , should have never listened to you xD",3
Russel has been shit with the bat in this IPL,7
DK: You couldn't live with your failures...and where did that bring you? Back to me...,12
Great  bowling by ma boy Thakur but Russ is a chutya.,2
If we can get Tripathi now we can restrict it to 180,1
"hehe, we are in trouble",5
"**15.2** Thakur to Russell, OUT, huge wicket. Russell clears the front leg to slog to leg, but Thakur has been superb. Unerring with his length. Short of a length, cross-seam, lands on the seam, bounces, and takes the top edge through to Dhoni **128-5**

AD Russell c &dagger;Dhoni b Thakur 2 (4b 0x4 0x6) SR: 50.00",1
"Bye Bye KKR, so CSK has finally found their groove and winning streak probably.",4
Thakur is so underrated I swear. Thakur>>>>> MoSiraj,4
Wasn't expecting this tbqh!!,7
Dre Russ getting out cheaply to Shardul Thakur just like everyone expected,9
"Team continues to play shit. 
McCullum: SCRIBBLE SCRIBBLE SCRIBBLE",5
It seems like Russel is waiting for a match against rcb to get in form.,7
"Shardul, Siraj >>>> Chahar, Saini",7
Hope clean shave brings some luck to DK's batting.,3
"Calling it now, Russell's 2019 was an outlier and an anomaly for his already crazy pinch hitting abilities, he's not going to perform at the same level this season",3
And just like that. Thakur continues to pick up wickets.,3
Bc,2
"Man, will KKR even get a respectable score now",2
scenes if DK plays a splendid innings,4
DK to score 150 off 30 to shit on everyone here,5
"Man DK had such a perfect beard, why would you shave that beauty",3
KKR wouldn’t have gotten to 130 if Tripathi had been run out earlier,5
Thakur GOAT,2
Thakurrrrrr,3
Shardul op🤣🤣🤣🤣,3
Dk gonna pull a nidahas now,6
"Scenes if dk finishes well

Will ppl qsn him coming at 7??",3
"See this is why DK was coming in at 4 to sacrifice himself. 😂🤣😂
Morgan and Russel plays well only if they come after DK!",3
Rahul Tripathi batting with Rahul Tripathi.,4
"Thakur, Bumrah, Dube, Karn, Mishra my pick for T20I bowling. Don't @ me with your serious analysis.",0
Shaved DK to the rescue?,4
DK's game is suited for the end overs with his ramps and scoops. Redemption arc incoming?,10
Russell has been so shit with the bat.,12
"This Sub:- trolls Thakur

Thakur takes wicket 

This sub :-  ye lund mujhe dede Thakur",12
"RR seems to be wasting a lot of Indian talents with their constant chopping and changing, over reliance on their foreign players. Their main strength before ban was unearthing Indian talents but now their management does not back Indian players except Samson.",8
Now if only DK performs then the r/cricket annihilation by kkr will be complete,9
DK's wifey is such a snacccccc,3
"Karthik be like, what's up r/cricket",5
Baz writing on the paper: *Learn how to play on the back foot wanker!*,8
All that's remaining to fuck r/cricket is for DK to do a Nidahas or Tewatia today.,9
Two DKs at the creae now,7
It turns out Karthik wasn't the imposter in the KKR team after all,13
WTF happened to DK?,3
russell needs rcb's bowling to get back into form,10
"There's gonna be a talk about sending Narine ahead.
And DK's gonna get criticised.",7
Thakur has turned into Bumrah ffs,17
Russell gone. I am happy he got out but I had made him my fantasy captain. 😐,7
Vikrant Massey to play DK in his biopic?,5
Quite the catastrophic collapse from Kolkata's middle order,3
"Russel,DK,Rana have done fuckall this season yet. And this is when you have one of the best upcoming T20 talent on the bench",3
Lucky i captained shardul in my fantasy team.,8
Looks like KKR need Tripathi up top and at the end of the middle order too 🤦‍♂️,6
Btw is Tripathi playing on a different pitch?,3
Russel gone taken by Lordd Thakur.,2
Has the pitch slowed down or is Thakur just a lord?,2
Russell has no brain,5
DK looking Jatin Sapru now,5
"For the past few seasons, karthik has been a good pinch hitter at the end. Failing to bat in the top order. Lets see how he does here",3
