Timestamp,Username,Comment,Upvotes
2020-11-08T14:56:36+00:00,zambur-e-bahar,do not give wicket,1
2020-11-08T14:56:42+00:00,shiwanshu_,Rashid going for one tip one hand,23
2020-11-08T14:56:51+00:00,,Raa-shidd.. Raa-shidd.. Raa-shidd!,6
2020-11-08T14:56:54+00:00,zambur-e-bahar,r khan tryna injure himself,12
2020-11-08T14:57:03+00:00,,Rashid is hyper today,13
2020-11-08T14:57:07+00:00,kapilfan,Oh boy. Rashid needs to calm down.,12
2020-11-08T14:57:15+00:00,PlsDontBraidMyBeard,"Earlier today, on Insta, Dawood posted a picture of his youngest daughter who was understandably missing him and he tagged his family and wrote ""Daddy will be home soon"". 

That little girl's wish >>> an orange army of reverse jinxers wish",19
2020-11-08T14:57:21+00:00,KelvinRkrab,Is Rashid high? Why is he so worked up?,10
2020-11-08T14:57:24+00:00,swain18,SRH caught some of that RCB curse from their last game,5
2020-11-08T14:57:25+00:00,WeaponX23X,Just one more left of Rashid,3
2020-11-08T14:57:27+00:00,DilliKaLadka,Just one real over left for SRH. We can target 200 now,8
2020-11-08T14:57:27+00:00,9yearoldpatriot,gud! just tuk tuk rashid,7
2020-11-08T14:57:29+00:00,,"Can't wait for people to scream after the Finals 

 SrH DesErVED tO bE iN thE FINaLs",14
2020-11-08T14:57:34+00:00,,[deleted],-19
2020-11-08T14:57:38+00:00,fieztel,How costly that Saha's injury would prove,15
2020-11-08T14:57:38+00:00,TheReal-Tonald-Drump,The young blood in Rashid Khan is boiling today,8
2020-11-08T14:57:43+00:00,2684335126835353,Imagine if koach decides to play at 4 again to accommodate kl,5
2020-11-08T14:57:54+00:00,PeRvYSaGe21,Iyer replicating koach by killing the momentum,2
2020-11-08T14:57:57+00:00,BoreHoRahaHaiYaar,"20 runs & a wicket of 3 overs off Rashid, I'll take it considering our record against him this IPL",6
2020-11-08T14:57:59+00:00,punekar_2018,"Iyer is no hurry, 30 more overs to go",7
2020-11-08T14:58:15+00:00,R2RBoy,"Shreyas Iyer is like Virat Kohli if Kohli had never scored 70 centuries and had begun with his ""slow accumulation in T20"" style before achieving anything in life",8
2020-11-08T14:58:21+00:00,zambur-e-bahar,"dhawan evokes the same feeling in me abd evokes in rcb supporters, feels like he be the batting backbone",8
2020-11-08T14:58:25+00:00,,Shreyas used to be DC's (and probably even new India's) best players against spin. What happened :/,7
2020-11-08T14:58:27+00:00,KelvinRkrab,"Pls send Hetmyer next.
PLEASE.",7
2020-11-08T14:58:40+00:00,R2RBoy,"Shreyas Iyer is like Virat Kohli if Kohli had never scored 70 centuries and had begun with his ""slow accumulation in T20"" style before achieving anything in life",8
2020-11-08T14:58:41+00:00,super-mar1003,Iyer killing momentum.. again..,5
2020-11-08T14:58:50+00:00,ru_sunshine,Must say Iyer will ensure DC don't reach 200.,4
2020-11-08T14:58:50+00:00,harsh1387,Should have sent Hetmyer.. wasting the advantage,2
2020-11-08T14:58:51+00:00,and1984,henlo it's your bowling hand,2
2020-11-08T14:58:53+00:00,ganny0007,Every India player are tuk tukin like msd in the middle Over. Just play your natural game Bois.,3
2020-11-08T14:59:07+00:00,iamjamesbonda,I have the same hair and beard as Nattu🥴,1
2020-11-08T14:59:07+00:00,PM_ME_YOUR_CALL_LOGS,Harsh call I think,1
2020-11-08T14:59:08+00:00,kapilfan,Iyer + Rahane is what I want at the crease. Please make that happen.,1
2020-11-08T14:59:11+00:00,naughty_ningen,C'mon Delhi 190+ and we're off to finals,2
2020-11-08T14:59:11+00:00,WeaponX23X,Stoinis took revenge of knocking out Zampa team,4
2020-11-08T14:59:13+00:00,jeeverz,Rashid showing some of that Tahir energy lol.,3
2020-11-08T14:59:20+00:00,porn-senpai,"Not sure how DC is going to handle Rahane's position in the lineup now. They need to send Pant, Hetmyer right after.",6
2020-11-08T14:59:20+00:00,zambur-e-bahar,Iyer here to improve bowlers' economy,4
2020-11-08T14:59:25+00:00,rambo_zaki,Rashid is on speed today.,5
2020-11-08T14:59:25+00:00,,Punter needs to have a chat with Iyer the same way he did with Dhawan when the latter was playing slow,7
2020-11-08T14:59:29+00:00,BlackDuckPlierX,Subcontinent Players played spin with ease. Nowadays they struggle against spin more than SA batsmen,8
2020-11-08T14:59:35+00:00,,Natarajan is Reddit's poster boy with that sexy neck-beard.,3
2020-11-08T14:59:37+00:00,saysikerightnowowo,"""AjInKyA rAhAnE wOuLd hAvE rUiNeD tHe mOmEntUm"" , Iyer be like I'll do it myself.",29
2020-11-08T14:59:37+00:00,Rubberducky1239,"Iyer mere mitr, please keep the momentum up. Dont brake, Rahane also has to come, pls",5
2020-11-08T14:59:38+00:00,bond_bhai,"Don't know what Pant and Hetmeyer are talking, Rabada doesn't seem to be interested at all!!!",8
2020-11-08T14:59:44+00:00,singhsrb,"Win the toss, bat first.

Play Stoinis as opener.

Play your worst bowler as a leggie because they get wickets anyway. 

Wow Delhi woke up or some shit!",11
2020-11-08T14:59:49+00:00,mch43,STOP THE COUNT!,23
2020-11-08T14:59:50+00:00,fookin_legund,Sending Iyer was a mistake!,7
2020-11-08T14:59:51+00:00,,[deleted],8
2020-11-08T14:59:53+00:00,AustereTiger,Name a more iconic duo than Stoinis and getting out to bowlers named Rashid,13
2020-11-08T14:59:58+00:00,chanlfc21,"Rashid is better off not squaring up against Stoinis. 

Ek maar pada Stoinis ka, toh uthega nai.",7
2020-11-08T15:00:00+00:00,stoic_trader,"Rabada in shorts looks like an innocent kid in a school, lol",16
2020-11-08T15:00:05+00:00,Fabulous-Rice,Why is Nattu not yorking? Nothing going right for SRH.,4
2020-11-08T15:00:08+00:00,,This start should ensure 200 with such depth but many of our Indian players make sure to practise for test.,7
2020-11-08T15:00:13+00:00,sanctumelement,What happened to Shreyas Iyer?,6
2020-11-08T15:00:13+00:00,KelvinRkrab,Iyer needs to move on now. Has played himself in enough I feel.,4
2020-11-08T15:00:17+00:00,JustStrolling_,Two massive underpeformers are good friends it seems in Pant and Hetmeyer,3
2020-11-08T15:00:22+00:00,R2RBoy,WTF is Discount Virat Kohli doing?,17
2020-11-08T15:00:24+00:00,swain18,"DC: oolala 200+ on the board today!

Iyer: Hold that thought fellas not under my watch",2
2020-11-08T15:00:29+00:00,fieztel,Need Shikhar D's wicket asap,7
2020-11-08T15:00:32+00:00,,"Iyer, my boi, it's yer time shine plx.",9
2020-11-08T15:00:35+00:00,hooman_byeen,SRH should restrict DC to 180 or else the game is gone,1
2020-11-08T15:00:35+00:00,ConcentrateBig3530,First let Iyer bat a little bit then judge if it was a mistake to send him or not,10
2020-11-08T15:00:37+00:00,batman_of_mars,why is iyer playing test?,4
2020-11-08T15:00:42+00:00,International_Boat82,Shouldn't a left hander have come instead of iyer considering the overs of nadeem and rashid left,10
2020-11-08T15:00:46+00:00,Sicknit,Dc should look to get 225 plus and not settle for 200. Just bat srh out of the game . Srh def capable of chasing 200.,13
2020-11-08T15:00:48+00:00,Slippin_Jimmy1216,So many salty comments in this thread?,8
2020-11-08T15:01:00+00:00,kramer944,Less than 200 is going to be a disappointment but wouldn't surprise me,3
2020-11-08T15:01:03+00:00,KelvinRkrab,Will they give Nadeem his 4 overs?,2
2020-11-08T15:01:03+00:00,St_ElmosFire,"Best IPL seasons for Dhawan:

1) 582 runs, SR: 147.7 (2020)

2) 569 runs, SR: 129.6 (2012)

3) 561 runs, SR: 127.8 (2013)

4) 521 runs, SR: 135.7 (2019)

5) 501 runs, SR: 116.8 (2016)

Career runs: 5525

Career SR: 126.7",18
2020-11-08T15:01:12+00:00,gentlemans-game,An in form free scoring Dhawan is good for india as both rohit n koach take time tk shift gears.,3
2020-11-08T15:01:15+00:00,DoomMachine-77,Iyer loves doing this,2
2020-11-08T15:01:19+00:00,Ritwicked,Get Dhawan out and we have a chance of restricting them to 180-185.,1
2020-11-08T15:01:19+00:00,shiwanshu_,"You know why nattu isn't bowling yorkers? Because dhawan has been constantly stepping out, fucks with the bowlers mojo",5
2020-11-08T15:01:25+00:00,WeaponX23X,"Iyer is doing great, he should anchor Dhawan is already attacking",6
2020-11-08T15:01:25+00:00,porn-senpai,Iyer might just be starting to suck out the momentum out of DC's innings after that electric start by Stoinis and Dhawan.,6
2020-11-08T15:01:28+00:00,shiftysoph,Iyer and the crazy shuffling,0
2020-11-08T15:01:30+00:00,9yearoldpatriot,abbeyy kya hua,1
2020-11-08T15:01:31+00:00,,[deleted],6
2020-11-08T15:01:33+00:00,kapilfan,Yep! The dancing Iyer is here.,4
2020-11-08T15:01:33+00:00,,Really wish we had Shankar rn. Having a 6th bowler allows us to rotate away from the bowler who is going for runs(today it’s Nadeem).,5
2020-11-08T15:01:34+00:00,,Iyer fucking hit or get out. Stop fucking around BC!!!,1
2020-11-08T15:01:44+00:00,ganny0007,Iye might be a good candidate for dancing with the stars,7
2020-11-08T15:01:47+00:00,singhsrb,"Iyer doing chutiyapa in this game as well.

BC hit or get out!",4
2020-11-08T15:01:48+00:00,chut_has_no_religion,"""baat to sayii aeee"" eat more balls amigo😘",5
2020-11-08T15:01:55+00:00,krishnasharma18,Dc batting so shit they need to play rahane to avoid collapse.,0
2020-11-08T15:01:56+00:00,doomxiv,Imo the reason kohli bottled as a batsman this tournament is probably because his wife is pregnant and that is completely understandable as a human being,-3
2020-11-08T15:01:57+00:00,ru_sunshine,Dhawan is feeling the pressure now. Overtrying stuff.,3
2020-11-08T15:02:01+00:00,fieztel,"If we restrict them for less than 200, that's a decent job from here on",6
2020-11-08T15:02:07+00:00,KelvinRkrab,Bhai Iyer kuch kar bhai,6
2020-11-08T15:02:08+00:00,chut_has_no_religion,Dhawan about to loft one in the air,2
2020-11-08T15:02:12+00:00,rambo_zaki,Doing pseudo gambling to get an opportunity to make an absolute jackass of yourself on the telly is some proper village stuff.,2
2020-11-08T15:02:15+00:00,Rubberducky1239,If Rahane comes next I am gonna start crying,3
2020-11-08T15:02:17+00:00,,Miss my economy<6 bois,3
2020-11-08T15:02:18+00:00,BoreHoRahaHaiYaar,"Oh God, please not Rahane next!",2
2020-11-08T15:02:20+00:00,International_Boat82,"This is the thing i have hated the most this season, people playing anchor when they don't need to",5
2020-11-08T15:02:22+00:00,manashole,I just hope rahane doesn’t come on next,2
2020-11-08T15:02:23+00:00,Sicknit,Time to take those pads off Ajinkya,6
2020-11-08T15:02:24+00:00,gentlemans-game,"I wonder what ponting might be thinking while listening to kaif...

I assume he n his team always assumed him to be a walking wicket in their playing days.",3
2020-11-08T15:02:25+00:00,Fabulous-Rice,I dread to think what DC would have scored had Khaleel played.,0
2020-11-08T15:02:28+00:00,PM_ME_YOUR_CALL_LOGS,Shreyas what is you doing baby,7
2020-11-08T15:02:30+00:00,,Bruh wtf Pant looking like a fucking Halwai,10
2020-11-08T15:02:33+00:00,,[deleted],2
2020-11-08T15:02:41+00:00,,So when is dhawan going to try his switch hit?,2
2020-11-08T15:02:47+00:00,,[removed],79
2020-11-08T15:02:51+00:00,KelvinRkrab,Next over two Iyer sixes or a wicket,6
2020-11-08T15:02:59+00:00,sohompramanick,"Dhawan's injury was a huge blowback for India, in the 2019 World Cup.",5
2020-11-08T15:03:00+00:00,aravind2896,Ma boi iyer playin it for the orange army! You go man!,8
2020-11-08T15:03:00+00:00,HBKM55,Hoping for a Thala innings from Iyer today,4
2020-11-08T15:03:05+00:00,rahulrossi,Yesss run rate below 10 for once in this game moral victory,8
2020-11-08T15:03:05+00:00,fieztel,So Goswami is our Stokes today?,4
2020-11-08T15:03:09+00:00,viki3024,Shreyas is sasta VK,4
2020-11-08T15:03:11+00:00,,SRH should set the mark at 200. Look at a score of 200 and think about defending it. It creates positively each time you restrict the opponent to a low scoring over.,2
2020-11-08T15:03:12+00:00,venkatateja12345,"If Warner and Kanos get out early, samad and garg should fire up. There is nothing to lose anyway and I would like to see samad hitting some sixes",2
2020-11-08T15:03:14+00:00,anirudh1595,Pandey > Iyer confirmed,3
2020-11-08T15:03:17+00:00,2684335126835353,Nadeem will get a wicket here,1
2020-11-08T15:03:20+00:00,,How do India plan to win any t20 WC with Iyer and Pandey? These guys suck any sort of momentum out of the game as soon as they come out to bat.,4
2020-11-08T15:03:23+00:00,Siondroms,Send Hetmyer next idiots,1
2020-11-08T15:03:23+00:00,,Bowlers should feel safe in front of Iyer. He won't hit you unless you are a spinner who is bowling full.,6
2020-11-08T15:03:24+00:00,Sicknit,Time to take those pads off Jinks,10
2020-11-08T15:03:34+00:00,sxd827,Don't worry co-fans of  SRH. Everything going according to plan for Warner to win that Orange cap.,4
2020-11-08T15:03:37+00:00,,Good keep going like this and maybe you can do a collapse and fuck off below 160 after such a good start.,2
2020-11-08T15:03:40+00:00,fookin_legund,Kaif is always whispering to Ponting like Wormtongue.,3
2020-11-08T15:03:41+00:00,R2RBoy,"Please keep Shreyas in.  
He's like the human version of an anti-viagra.  
If the total is getting erect, he just deflates it",2
2020-11-08T15:03:45+00:00,naughty_ningen,Bhenchod Iyer smash Rashid back to Kabul,6
2020-11-08T15:03:46+00:00,ItsNotMe98,Shreyas Iyer playing the most typical Shreyas Iyer innings,9
2020-11-08T15:03:50+00:00,,That start will get wasted man,0
2020-11-08T15:03:50+00:00,,Apparently Pahul Gill is back? Is it true 👀👀,3
2020-11-08T15:03:52+00:00,gungly,Iyer is taking his time to get his I in.,3
2020-11-08T15:03:58+00:00,chanlfc21,"What pleasure does Natarajan derive of that disgusting looking beard? 

The lad should tidy up and appear more groomed for his own sake.",10
2020-11-08T15:03:58+00:00,nut_nut_november,Does srh not have a 6th bowler,2
2020-11-08T15:03:59+00:00,DJMhat,DC has come out swinging and surprised all in their quest to get pulverised by MI again.,3
2020-11-08T15:03:59+00:00,HeyguysAliA,"If Pant is next in, his performance could determine the game. If he hits form, dc have probably won this. If he plays like he's played every other game this season, that could cost dc massively",4
2020-11-08T15:04:03+00:00,manashole,Pant < Kishan?,11
2020-11-08T15:04:04+00:00,hippieintheward,"Dhawan got intimidated by warner, bairstow and now seems to have a point to prove. Fucker chose the wrong match smh",4
2020-11-08T15:04:11+00:00,,"Dhawan has only 2 gears apparently, 0 and 100*",8
2020-11-08T15:04:17+00:00,LightningStrikes321,Shreyas liability Iyer at it again,-1
2020-11-08T15:04:20+00:00,,"With more and more stats being presented in the dugout each match, 

I reckon next IPL we're gonna see how much the players' dick curves and how it affects their performance on the off side.",3
2020-11-08T15:04:23+00:00,shiftysoph,The sound of that battttt oof,1
2020-11-08T15:04:26+00:00,uravggstudent,I'm so excited to see our Indian team of accumulators in Australia!!,5
2020-11-08T15:04:30+00:00,roha5090,Surely you need to open with Dhawan in Australia as he doesn't take that much time to settle and can attack straight away.,4
2020-11-08T15:04:34+00:00,Jy_sunny,Dhawan is the only current Indian cricketer who plays sweep shot?,4
2020-11-08T15:04:35+00:00,saysikerightnowowo,Iyer 🤝 kohli. Killing the momentum in the middle overs.,9
2020-11-08T15:04:40+00:00,nut_nut_november,Shreyas playing tuk tuk aaah normalcy,2
2020-11-08T15:04:41+00:00,,"Iyer hasn't even been cunting spinners since the last couple of matches, sad",5
2020-11-08T15:04:43+00:00,Annange-love-aagide,So the only full time team to not make the finals of IPL will make it today,2
2020-11-08T15:04:44+00:00,2684335126835353,The fuck are they doing,2
2020-11-08T15:04:45+00:00,PM_ME_YOUR_CALL_LOGS,Absolutely sucked out the momentum,1
2020-11-08T15:04:45+00:00,aegonbittersteel,Some sage advice for DC: go after everyone not named Rashid,7
2020-11-08T15:04:51+00:00,Rubberducky1239,"Iyer is trying and I am fine with that. Gotta do more than that tho, gotta finish strong",5
2020-11-08T15:04:51+00:00,KelvinRkrab,Iyer bkl. Pant aur Hetmyer are sitting in the dugout. Maar yaar,4
2020-11-08T15:04:54+00:00,,"Bangar & the word ""literally""

Name a more iconic duo.",5
2020-11-08T15:05:05+00:00,naughty_ningen,200 target is now downgraded to 175,-1
2020-11-08T15:05:12+00:00,ganny0007,Delhi losing the rhythm here,0
2020-11-08T15:05:20+00:00,,Give Sandeep an over next. Pls don’t be tempted by Rashid.,2
2020-11-08T15:05:21+00:00,ru_sunshine,16(22) Iyer today?,0
2020-11-08T15:05:23+00:00,aryanx1234,"People shouldn't be harsh on dc

Even mi slowed down after a gr8 start for a few overs, it was after 14 overs they started firing

Plz wait till innings gets over",7
2020-11-08T15:05:24+00:00,singhsrb,Iyer plays against us or some shit. Absolute useless innings so far.,2
2020-11-08T15:05:24+00:00,WeaponX23X,"Chill guys Iyer is capable of hitting 4 sixes in an over, he will make for it",9
2020-11-08T15:05:38+00:00,sanctumelement,"best case for SRH, Dhavan gets out and Rahane comes in and DC trundle to 160 from here",4
2020-11-08T15:05:39+00:00,Proveit98,Please beat MI in the finals too guys..,8
2020-11-08T15:05:41+00:00,bunnyoverkill,How's the pitch lookin lads?,2
2020-11-08T15:05:45+00:00,naughty_ningen,Threading the needle Iyer,6
2020-11-08T15:05:49+00:00,oxfordcircus007,SD will really go after nadeem,6
2020-11-08T15:05:50+00:00,DilliKaLadka,What placement ... perfect,5
2020-11-08T15:05:53+00:00,,[deleted],4
2020-11-08T15:05:54+00:00,fieztel,Fuckin hell DC bat deep. Less than 200 is  gonna be good for us,7
2020-11-08T15:05:56+00:00,SigmA_DarkKnight,"We are done for, we cannot chase 180 or 190. DC beat MI for us in the final.",3
2020-11-08T15:05:57+00:00,,That placement was sexy,4
2020-11-08T15:05:58+00:00,,How was Iyer in 2018/2019 in IPL  ? Better than SKY ?,3
2020-11-08T15:06:00+00:00,saysikerightnowowo,Nice fielding srh. Just loving this.,7
2020-11-08T15:06:00+00:00,nut_nut_november,Well looks like shaw ate all the biryani out of Hyderabad today,6
2020-11-08T15:06:01+00:00,glade_dweller,Top level shit housery here,9
2020-11-08T15:06:06+00:00,kapilfan,"Iyer

Dotball Iyer

Dot ball Single run Iyer

Dot ball Single run Double Run Iyer

Dot ball Single run Double Run 4 runs Iyer

Dot ball Single run Double Run 4 runs 6 run Iyer",14
2020-11-08T15:06:06+00:00,aegonbittersteel,That was funnier than it had any right to be,10
2020-11-08T15:06:08+00:00,Ritwicked,Garg you fool,6
2020-11-08T15:06:08+00:00,,OOOOYYYYY FUCKIN GET OUT YOU BC MC. IYER NEEDS TO GO,4
2020-11-08T15:06:17+00:00,Lionheart008,"More than the bowling, the fielding is beyond shit at this time.",3
2020-11-08T15:06:19+00:00,Simple-Neck,"Iyer if he ever pops on this thread, will be delighted at being compared to Koach and Dhoni.",5
2020-11-08T15:06:20+00:00,thedeatheater1410,Both fielders giving guard of honour for that shot,9
2020-11-08T15:06:21+00:00,gungly,"Ponting be like if anyone asks, it was your decision to send Iyer in.",9
2020-11-08T15:06:24+00:00,R2RBoy,Sloppy fielding. Either could have stopped it. Neither did,8
2020-11-08T15:06:24+00:00,Jy_sunny,How far did Manish run!!,3
2020-11-08T15:06:30+00:00,HeyguysAliA,I've always thought iyer was supposed to be a great LOI prospect and even future captain for India. What's happening?,4
2020-11-08T15:06:30+00:00,PeRvYSaGe21,"Shreyas ""kill the momentum"" Iyer",2
2020-11-08T15:06:34+00:00,Rubberducky1239,"Iyer is far fitter than say Shaw or Pant, why not try doubles?",7
2020-11-08T15:06:41+00:00,,Par score Vs SRH already,13
2020-11-08T15:06:42+00:00,aj_viz,Garg's inexperience in the field prevented Manish to take that dive. He didn't pull out early giving Manish the space. Would have been a collision.,7
2020-11-08T15:06:44+00:00,nouseridavailable,"Guys like Root don't get to be part of England T20i lineup because they all go guns blazing. If anyone tries to go guns blazing in India, he is made to bat like Kohli Jr. because his own style is ""irresponsible"".",12
2020-11-08T15:06:44+00:00,harsh1387,Minimum 80 runs in last 7 overs..,4
2020-11-08T15:06:44+00:00,9yearoldpatriot,fuckin finally,1
2020-11-08T15:06:46+00:00,loki_made_the_mask,Legit thought my stream was glitching when camera panned on Warner running backwards,5
2020-11-08T15:06:47+00:00,ru_sunshine,SRH will come with Sandeep next over. Can Dhawan hit 16 off him?,0
2020-11-08T15:06:49+00:00,chanlfc21,Iyer applying his geometry skills to pierce mid wicket boundary.,4
2020-11-08T15:06:49+00:00,,[removed],-9
2020-11-08T15:06:50+00:00,TheFirstLane,That misfield was an equivalent of that Amit Mishra Lenskart ad.,10
2020-11-08T15:07:02+00:00,2684335126835353,If they send Rahane next I'll kms,2
2020-11-08T15:07:06+00:00,,Thank god neither dived. I’d rather avoid a possible injury than save two runs.,7
2020-11-08T15:07:11+00:00,Silly-Point,That would have required an ambulance if they both kept going.,7
2020-11-08T15:07:19+00:00,Transitionals,Iyer the momentum killer,1
2020-11-08T15:07:21+00:00,R2RBoy,Iyer starts accelerating veryyyy slowly. Maybe that's the kind of style Kohli prefers in the India team and maybe Iyer is no better than my boss (typical corporate ass kisser) but this isnt good for Delhi,0
2020-11-08T15:07:22+00:00,gentlemans-game,"Would srh still open with Goswami or there could be a change ??

Warner - pandey 
Warner - kano 
Warner - garg 
Warner - samad 


Anyone ?",6
2020-11-08T15:07:24+00:00,Naan6,"Ya there is no way we chasing anything above 200, good luck in the finals dc",6
2020-11-08T15:07:28+00:00,NegotiationThin6735,Delhi is batting like - tunk tunk tun tara ra,1
2020-11-08T15:07:35+00:00,swain18,"*SRH looks like losing*

Literally everyone: WTF who's gonna beat MI in final now",13
2020-11-08T15:07:42+00:00,Serialmosquitokiller,"Pehle aap, pehle aap!",5
2020-11-08T15:07:48+00:00,,"SRH slowly build momentum. I believe Holder and Nattu can close the games for us properly. 

Give Sandeep an over.",3
2020-11-08T15:07:51+00:00,GunduGulabjam,GoodBye Risers,3
2020-11-08T15:07:52+00:00,sxd827,Half-full glass perspective there is better it went for 4 than an ugly collision that takes out both Pandey and Garg.,3
2020-11-08T15:07:54+00:00,and1984,"They wouldn't have got the ball.... they might have had a meet-cute, though.",2
2020-11-08T15:07:55+00:00,Transitionals,Surya would have made 24 (15) by now. Iyer is botching this innings with a 16(15),5
2020-11-08T15:07:56+00:00,Rubberducky1239,They dubbed over Pant's voice in that ad. Ouch,3
2020-11-08T15:07:56+00:00,cherry0079,I have never seen koach playing a sweep shot like ever....,1
2020-11-08T15:07:58+00:00,bakaitified,MBA != tarraki upgrad,1
2020-11-08T15:08:01+00:00,fieztel,Warner is smiling but dead inside,4
2020-11-08T15:08:05+00:00,anirudh1595,"What mental gymnastics from Iyer fans today, I wonder. 

Can't use the ""he came in at the fall of an early wicket"" excuse. He literally walked in at 100/0 in 10. 

Situation didn't demand to score 10 off 12 balls. No reason to play anchor. 

Is it gonna be the same ""But but but he scored 60 against New Zealand in February""?",7
2020-11-08T15:08:07+00:00,,Wtf is an antivirus fan?,7
2020-11-08T15:08:09+00:00,suyashkhubchandani,Dhawan is such a big game player,11
2020-11-08T15:08:14+00:00,,Maybe real IPL trophy is the players we injured along the way!,8
2020-11-08T15:08:14+00:00,,[deleted],8
2020-11-08T15:08:17+00:00,GunduGulabjam,🌤⛅️🌥☁️,2
2020-11-08T15:08:24+00:00,,"Even if DC loses all their wickets scoring no more runs, we'll still struggle to reach this total lmao",3
2020-11-08T15:08:26+00:00,LightningStrikes321,Everything setting up perfectly for MI,3
2020-11-08T15:08:27+00:00,kramer944,Perfect platform for a 200+ score and Iyer is fucking it up lol,2
2020-11-08T15:08:30+00:00,OkWar7880,Now just watch Delhi win this match comprehensively and then choke against MI smh,3
2020-11-08T15:08:32+00:00,and1984,Harsha sounding annoyed .... time for **yet another**... CEAT tyre strategic timeout.,3
2020-11-08T15:08:33+00:00,Lionheart008,200 minimum if iyer gets over next over.,1
2020-11-08T15:08:35+00:00,takitaka007,DC you better win against MI next match.,1
2020-11-08T15:08:38+00:00,, anything under 210 after the start they had is underwhelming,5
2020-11-08T15:08:40+00:00,shiftysoph,Biggest conflict: love DC but want someone to thrash and beat MI in final so ..,2
2020-11-08T15:08:41+00:00,Mpsingh18,"There's no question about it I've been saying it since he got selected in Indian team for T20I If you're taking singles and blocking in 18th over with 8 wickets to go no you're not good.

He couldn't even face Bangladesh's bowlers Blocking them like it was Glenn McGrath on the other side.

Yeah you get one or two or good innings in which you manage to get your SR above 128 but that's it. Luck He doesnt have the skills for a good T20 batsman Manish Pandey is a better version of him but no we have Shreyas as our number 4. Glorious sr of 120 And the commentators just love to cream all over him. They talk about that one innings he belted santner all over the park.

Today's poll

Most exciting DC player

Who won?

Shreyas freking iyer with 44% Yeah very exciting singles",7
2020-11-08T15:08:47+00:00,,Govinda has made even 30 sec dance in that ad entertaining,4
2020-11-08T15:08:51+00:00,Proboninja,I believe if SRH restrict them around 175....they could still win,2
2020-11-08T15:08:53+00:00,St_ElmosFire,I wonder if cricketers ever chuckle at the nonsense we collectively spew sometimes here on this sub.,5
2020-11-08T15:08:54+00:00,djjd1996,"Which ever one of DC or SRH wins, I hope they crush MI.",2
2020-11-08T15:08:54+00:00,,DC inflate deflate strategy worked,1
2020-11-08T15:08:56+00:00,hippieintheward,Turning out to be a humbling disaster for us,5
2020-11-08T15:08:59+00:00,,Warner & Williamson need to open for SRH,2
