Comment,Upvotes
Backing KKR,7
FINNALY IT'S OUR MATCH!,6
Just your daily reminder that Mumbai are yet to win a game in the UAE,74
"Here for the shits and giggles cause even year MI are bad as it is but this year is especially bad because of the combined team effort to get fatter together and become Memebai Chonkians.

One family hai, one rahenge aur ek saath bahut sara Vada pav bhi khayenge!!",11
Cant believe KKR looses a lot against MI.,6
[deleted],1
Never imagined I ll see Rcb at the top of points table,6
"Even though saurabh tiwari played well, I would want ishaan kishan to be in the playing 11. Even if it means dropping tiwari. Kishan is too good a player to be left out. He is the future of indian cricket.",4
"Feel like this IPL is going to do Cummins a lot of good. He's going to be under serious pressure to perform up to the level of his price tag especially at the death. No doubt, I back him to rise to the occasion even if it his weak point.",4
"Is it just me or is the KKR batting getting overhyped? I think it’s decent but Russell is their only real champion batsman imo. They do have a decent Indian contingent in Rana, DK and Gill but except Russell they have no other consistent and reliable explosive batsmen unless you want to count Narine. Don’t see how the batting at DC or MI is not superior and maybe even a Punjab frankly. I guess the difference seems to be that many people rate DK and Morgan up there or near about the Warners and DeVilliers of the game, which IMO is not really valid. Morgan is good for sure but more of a Williamson/Smith mould player imo and then DK to me is decent but again a level down from a Rahul or even an Iyer.",1
"Can we focus on strike rotation in the middle overs and putting bad balls away instead of heaving every ball towards cow corner?  We had 40 dot balls in the last match, that's a third of the entire innings. ABD and Kohli the other day putting pressure on the fielders was amazing and puts the batting team in a positive mindset to accelerate.",6
"With 3 gun pacers bowling in pp i dont think kkr shud send Narine to open. Rather they could open with someone like Rahul Tripathi who likes pace in the ball. 

Later Kkr can maybe send Narine as a pinch hitter when the leggie or left arm spinner is bowling. 

If narine opens its just a matter of time before his timber gets disarranged or he gets caught on a short ball.",1
Can DK make a come back to national side ?,-2
KKR loses to Mumbai most of the times and it is an even year for MI where they shit their bed. It is like an unstoppable force meets an immovable object when it comes to which one loses.,1
I'm ready to get hurt again,5
"Want to see that KKR middle order bat, also waiting to see Gill and Nagarkotti play well.",3
[deleted],-2
Nagarkoti sledges like a gangsta btw,4
"Mumbai have never won a game in the UAE, and are known for sucking terribly in the first stages of the tournament, particularly so in even years. 

Kolkata has not had a great run in general I'm recent times and have a history of being crap against Mumbai (6 wins against 19 losses throughout the tournament). 

This is a race to the bottom and I am here for it.",7
Nice of the Burj to do a lightshow of the KKR team yesterday. It will be symbolic after I fling myself off it after our inevitable loss today.,5
"I dont think Kuldeep has gotten over Moeen's spanking. In practice match, one six from Russell and his face went *hello darkness my old friend*.",20
"saw an interview with venky, baz, karthik and eoin. is eoin in the leadership group? or kkr going down the same shadow captain route this year as well?",4
Narine or banton dunno who's gonna be 4th foreigner,1
"I will now begin the new IPL season for KKR by telling everyone that ever since Baz scored 158* in the first ever IPL match, there has never been an individual centurion for the KKR.

Will this finally be the season? Let's see.",24
"What's the 1v1 record between these two, hardly ever see kkr beat MI",1
Don’t let the IPL distract you from the fact that Attack on Titan: The Final Season is airing from December 7th.,7
"Morgs Russ DK

I'd say subscribe tf outta this middle order🔥",8
[removed],2
Supporting KKR tonight! Want a new IPL winner this season preferably RCB. DC and KXIP will also do.,5
"KKR has won 7 out of 7 opening matches of the IPL since 2013.

W W W W W W W",27
Let's go KKR.,4
"I am going to lose my mind, if Rohit gets out to Narine for the 1028292th time:/",4
[deleted],1
"Man if there's one team I hate us playing, it's MI",3
KKR's bowling looks weak,2
I just want Russel to bat from the 10th over,1
Will Rohit ever get pressure as he not performing (batting)in  IPL for 3 years straight now?,2
[deleted],3
Rohit loses another one,1
KKR chasing easy win,1
uggh lost the toss again. fml.,1
WHY IS IT THAT EVERY TEAM I SUPPORT ENDS UP LOSING THE TOSS?,3
Yesssss come on KKR,3
"I don't know if you guys noticed but Rohit is fat, what do you mean ""he's fit enough to play for India""? I can literally see that he's fat.

Upvotes to the left for my unique observation",2
Time for Rohit to stress eat some of that juicy fried Vada pav to bring the cortisol levels back under control.,2
Ffs Bumrah will have to have a great match if MI has to defend against Russell.,5
don't ever remember Rohit winning the toss,7
"It felt like bishop wanted rohit to say ""are maa chudi padi hai""",6
"The record for KKR is 6-19?!

How the fuck do you manage only 6 wins in 12 years",7
feeling like pure shit just want Ishu Kishu back,5
"Hardik made 91(34) against KKR last year, hoping for a repeat.",2
You fat fucks you're playing the same side again??? Fuckin chuttads!!,2
TIL arch rivals win 6 out of 25 games played,15
No nagar? Damn i wanted to see him :(,4
need mrs. ambani back in the stands doing her prayer thing for today.,5
No nagarkoti (╬ಠ益ಠ),6
I hope Shivam Mavi plays well given Nagarkoti isn't playing,3
Why has Morgan never captained in the IPL? Defo best LOI in the world at the moment,7
Cummins paid around 6000 USD per ball.,12
🚨Nikhil Naik is playing🚨,5
CSK - MI are the only Arch-rivals.,7
"Why's KKR so obsessed with Nikhil Naik, didn't inspire any confidence the way he was playing last year and then the fact that they opened with him for a few matches instead of Gill was inexplicable",8
Why is Mavi playing instead of Prasidh or Nagarkoti !?!,5
"KKR top six looks good , bowling looks thin though.

Shubman Gill is opening as well, hope he plays well today",7
[removed],1
"And the wait to see Nagarkoti continues.

One of these days, I am going to send an angry(but respectful) email to KKR management and BCCI.",4
Why is the Cricket match bot an RCB supporter. Lol.,19
"Sandeep Warrier gang, what we saying",3
" **KKR in their season openers since 2013**  
2013: Beat DD by six wkts  
2014: Beat MI by 41 runs  
2015: Beat MI by seven wkts  
2016: Beat DD by nine wkts  
2017: Beat GL by ten wkts  
2018: Beat RCB by four wkts  
2019: Beat SRH by six wkts 

&#x200B;

KKR is anti MI.",4
I don't understand the selection of Nikhil Naik. He was a waste last season.,6
Here for cummo 😍,4
Would've preferred to see Rinku Singh and Nagarkoti over Naik and Warrier.,2
Wanted to see Nagarkoti today. How many more years untill I see him bowl╭( ✖\_✖ )╮,5
"Cricbuzz stats : Damn

KKR in their season openers since 2013

2013: Beat DD by six wkts

2014: Beat MI by 41 runs

2015: Beat MI by seven wkts

2016: Beat DD by nine wkts

2017: Beat GL by ten wkts

2018: Beat RCB by four wkts

2019: Beat SRH by six wkts

- Six of the seven wins coming batting second.",3
Nikhil Naik at 7 wtf,3
"That KKR batting line up is stacked

Bowling looks a little weak though, think a lot depends on Kuldeep's form",5
"My batting line up for KKR

Gill

Rana

Kartik

Morgan

Russell

Narine

Naik",2
Kkr looks weak in papers,0
They have a big bowling problem,1
Hope Sandeep Warrier does well!,4
"Mavi😭
Nikhil Naik 😭😭",4
"Can I ask a question.

Nagarkoti was a beast in the U19 but will he able to show the same performance in senior sides. He's quite short for a fast bowler",3
"Shud have played Nagarkoti in place of Naik

What will a batsman at 7 do

Cummins n Nagarkoti r good enough to bat at 7 n 8

N that wud have boosted their bowling too",4
Fuck it kkr is the weakest ipl team this year,-1
Yo what happened to Chris Lynn??,3
No 8 position is reserved for kkr,2
Ishan Kishan sidelined yet again. MI if u don't need him give him to us.,1
So excited to see Shubman gill in his actual position and not being wasted at 6,3
"I remember that 2019 KKR opener against SRH. We had the game wrapped and then Russell happened. Impossible innings.

KKR won a lot last season on Russell's back. But then we always win on Warner's efforts, so who cares.",2
"KKR look good on paper; hopefully, they convert it. Of course, they have been good in their first matches of different IPLs.",3
"Morgan hasn't played in the IPL since 2017, and he was ordinary then

KKR are lacking in the batting, they need Gill to have an exceptional season",4
They should just ask Russell to pad up after the 12th over any wicket falls send him in doesn’t matter who’s bowling or how many wickets have fallen that man will put fear in the opponents just by his presence,3
Did DK say he Narine will be opening? How are we so sure Naik will be coming at 8?,1
Why star sports suck Dhoni D so much?,5
No Banton no Party,1
Just happy to hear Harsha again,1
Daddy Harsha is back! Needed him during the 2nd innings,4
u/CricketMatchBot has an RCB flair lol !,5
"Can Nikhil naik reliably bowl overs? Seems weird to have him at 7 as a specialist bat and Russell as a 5th bowler doesn't inspire confidence.

Edit: Forgot Narine existed, I'm an idiot.",3
"I want to see a Hardik 100, Pollard 50, Hardik 5-fer, Russell 0. No, nothing to do with my fantasy team, why do you ask?",9
Harsha and Danny😍,4
pls no danny morrison. he's ultra cringe,2
[deleted],1
"All I want to say is this.

Respect Dinesh Karthik!",2
Looking forward to Duminy's stint in the commentary box. Should bring a good perspective having played almost every season and with different franchises.,4
Was KKR's profile photoshoot conducted in a Dark room? Had to take a hard look to recognise the players.,2
Cheering for KKR!,4
"Both teams have a lot of power hitters. Needless to say, excited to see an action packed game",5
UAE or MI ?,4
Is there a reason that KKR have selected Naik ahead of Tripathi? He has traditionally been excellent in the IPL and I’m surprised not to see him in the side.,1
Sounds like packed stadium,2
excited to see eoin morgan!!,5
Gill looks like he belongs to a dance troupe in the profile photo,4
just let this be a well fought game from mumbai!,2
"9am lecture at uni tomorrow which I have loads of work to do for and it’s the last night of pubs open late so I’ll be going out. 

That means doing my work now but nah, I’ll just sit on my arse on Reddit instead",9
I would have thought Morgan would captain? Maybe they stuck with dk cause he is more familiar with the team,3
MI need to play safe in the powerplay. No risks whatsoever,1
KKR would be title contenders if they didn't break the bank on Cummins and instead invested in a good Indian fast bowler.,-2
guys upvoot,2
Stream?,1
"Morgan should be KkR captain, is he not available for a full season",2
"CSK's lost one, MI's lost one... it's only fair if KKR loses one. Restore the balance IPL gods",4
"Honestly think banton should have played over Morgan today. Narine as an opener isn't gonna work against this bowling attack and morgan's ipl record doesn't inspire confidence, would rather have Banton opening with gill. No disrespect to Morgan intended.",3
Welcome back Harsha Bhogle! You've been missed!,4
What's the prediction?,2
Making DK the captain over Morgan is stupid imo,2
"So guys, what is your prediction about thicc boi? How much will thicc boi score today? Let me know",1
Both teams are likeable. Who should i support?,1
How much will Rohit score today,3
Kinda jealous with Mavi. Lad gets to learn from Cummins while getting paid.,3
"MI 135-9 20/20. 
KKR 137-5 16.5/20
Edit :this was typed just before the first ball was bowled, i am not changing thr score",5
"Harsha Bhogle, finally a good commentator after having to suffer through KP and Slater",8
i remember warriar had similar action as stayn but somehow he changed it.,0
Was hoping to see krishna play but warrier seems good too.,3
"Have de Kock scoring 23+ on Paddy Power BTD, he’d better show up",2
Warrier dude has good high arm action ..,1
Good start by Warrier till now.,2
I'm cheering for the 2 guys in pale blue,8
Paytm umpire gear is fugly,4
i like the look of warrier.,2
How is Cummins in the death?,7
"Warrier looks good ao far , hope he can continue this through out the season",2
Rohit just needs to get his head down and get a start. The Russell factor makes me think even 200 will be too small a score for us.,2
Crowd is going wild for Rohit.,8
Good bowling so far,2
inb4 he gets smacked off the extra ball,38
"Was a good over until now,it’ll get worse if the extra ball goes for a boundary",4
Called it!,2
Ah shit,1
vadashot,1
Harsha is back. Now waiting for Danny Morrison,2
God. Pat Cummins is such a sexy sexy sexy man. I want to do things of a sexual nature with him,5
Good six by hitman👍🏽,2
Any idea why Morgan isn't the captain instead of DK?,5
Unacademy Cracking six🤣🤣,7
Was expecting Narine against Rohit. He has probably his worst record against him I think.,1
I just spent 5 balls trying to figure out where the team called the Warriors have suddenly come from. I need to go to bed🤦🏻‍♂️,57
That was piest of pies.,-1
Thicc boi,0
Good shot,0
Good boi Morgan appreciating the bowler,1
"**Most IPL matches played by Overseas player**

ABD - 155

**Pollard - 150**

Watson - 136

Bravo - 134
Warner - 127",5
[deleted],1
[deleted],1
Hope mavi has worked on his head movement at the end of his run up.,3
Mavi hitting 140 kph from the start. Nice!,3
You would like to think the no.1 ranked test bowler will open the bowling,2
If MI and DC ever get into a super over they should have a Rohit Vs Ashwin twerk competition as tie breaker.,10
"**Winners in KKR 's opening matches since 2013**

2013: KKR vs DD - KKR

2014: KKR vs MI - KKR

2015: MI vs KKR - KKR

2016: KKR vs DD - KKR

2017: GL vs KKR - KKR

2018: KKR vs RCB - KKR

2019: KKR vs SRH - KKR

2020: KKR vs MI - ?",4
"With Morgan's addition, KKR looks pretty strong. What else can I say about beautiful Pat Cummins",3
Oooh yesss,3
"Ohh God Cummins is gonna bowl death today, isn't he.",4
\*happiness noises\*,2
Lol,2
What was the bowling speed,3
That was the thiccest bloke ever who took that catch lmao,6
WTF De Kock. Garbage shot,2
I hope today Pandya and Pollard will show the world how average Cummins is in T20s.,5
Cocks out for de Kock,4
Mavi you beauty. Make it your season.,0
"De kock thought that higher the ball, more the runs",3
I'd have liked to see Brisbane Heat legend Tom Banton play tonight. Disappointed face,5
Hmm... Dinesh you bloody genius!!,-1
can i cry?,3
Big blow,2
Kkr can do without cum boy they just need for those tough times when all the bowlers look clueless,3
Oh fuck no. Not this early,3
Really de Kock!!,5
"**Most runs against KKR in the IPL**

Rohit Sharma - 830*

David Warner - 829

Suresh Raina - 818",6
Guys any free stream available?,4
That was in the air for so long,2
"Guys, what is De Kock's average in Ipl?",4
"**1.2** Shivam Mavi to de Kock, OUT,  **8-1**

Q de Kock c Naik b Shivam Mavi 1 (3b 0x4 0x6) SR: 33.33",7
I did not imagine the background noise could get worse.,6
[Fuck off](https://www.reddit.com/r/Cricket/comments/iy8uso/match_thread_5th_match_kolkata_knight_riders_v/g6bguij/?utm_source=share&utm_medium=ios_app&utm_name=iossmf&context=3),6
Memebai fuuuucked hahahaha... Uhuhuhuhuh!,-1
Nikhil Naik MOTM for that catch.,6
The Kock status: FLACCID,20
Send Tiwary,0
according to [cricinfo Nagarkoti hasn't played a match since Feb 2018](https://www.espncricinfo.com/india/content/player/1070188.html),2
UAE curse continues,4
"When was the last time we beat MI??

Seems ages",6
Predict SKY's score today,4
Squeaky bum time,5
Oh my god the background noise gonna kms rn,7
Let's go boys,1
That was the loudest cheer a dot ball could ever get,46
Imagine getting bumpats from Cummins,13
[removed],4
Nitish Rana has completed his transformation into a sketchy stripclub owner.,62
Any more guys doubting Shivam Mavi selection?,5
"Good pace, good line and length. Mavi looking good.",6
Rohit hits a dot. Fake crowd goes wild.,58
Great bowling by Mavi,3
Mumbai hasn't won any games in UAE and Kolkata haven't won many games against Mumbai. Battle of who breaks the bad streak,11
Ong the bowl is FLYING today absolutely fucking loving it,8
What the Kockk,3
Why is the bot supporting RCB?,2
"Ball hit to fielder...

AND THE CROWD GOES WILD!!!",1
Maiden ball,1
His head position is 90 degrees,1
Wicket maiden! Fantastic.,2
Omg what a beautiful over by mavi had me moaning....,3
mavi and warrier are damn good.,2
Good test match lads,-1
Can they stop with the satanic chant,2
The crowd noise is 😂😂,1
mumbai “Tummy” indians lmao,2
Is that the Kohli chant? Wrong game sound man,1
Damn good over from Shivam Mavi.,4
Wicket maiden 😍,5
Mavi just made De Kock and Nohit his bitches in that over damn,6
"Mavi you beauty, that's what we missed last year, powerplay bowlers..",2
Mavi gets a maiden wicket and the fake crowd is shouting Rohit Rohit the whole time,7
Ok Patty now you better do something really special,3
"If the IPL had an award for the least cricketer-looking cricketer, Nikhil Naik would not have any competition",5
"Dilemma: I want the reduced crowd noise on Dugout, but Harsha :(",6
"1st maiden over of ipl 2020 Shivam mavi

Plus a wicket as well",3
EVERY CHILD IN THE WORLD WILL LEARN CODING ONLINE NOW,7
"Rohit gets beaten 

Crowd gone bonkers. Totally Wankhede",9
WICKET MAIDEN in the IPL,19
Flaired up and ready lads.,-1
Remember the days when Denly played for KKR and was always shot of 100. Damn miss those days.,-1
yikes,1
I know for sure... This season we gun be 8th!,4
"Wicket maiden for Mavi

Love seeing young Indian pacers do well",3
Lucky af,2
That four almost made my ❤️ gasp! PHEW!,2
This KKR side is packed with some good seamers,5
Ohohoho these mumbai cunts are lucky today....imagine cum daddy bowling in these conditions,-3
"Please don't lose a wicket now, I really don't want to see Saurabh Tiwary coming in the 3rd over.",2
"We rarely beat MI but also rarely  lose our opening game


Let's see which record carries on today",16
"That delayed cheering is so disconcerting, it's silence and then suddenly the booming cheers put you off",1
Waiting for The cocks Cummings showdown,1
Damn what was that bowl 💙,1
Cut him in half! What a beaut,1
These guys making my heart skip a beat,1
Lucky af V2.0,1
I hate this crowd. I wish it was just ambient noise,6
This bowling is orgasmic,3
"If we get irritated this much by the fake crowd noises, imagine how much the players are keeping their calm",3
Jesus what is this?,3
kkr have pat cummins and they've not needed him so far with the new ball. tells you everything you need to know about kkr's domestic bowling attack.,3
"_Most Fours in IPL Cricket:_

1) S. Dhawan: 524 @ 3.30 4pi

2) S. Raina: 493 @ 2.61 4pi

3) G. Gambhir: 492 @ 3.24 4pi

4) V. Kohli: 480 @ 2.82 4pi

5) D. Warner: 459 @ 3.61 4pi

6) R. Uthappa: 435 @ 2.54 4pi

7) R. Sharma: 433 @ 2.35 4pi

8) A. Rahane: 404 @ 3.06 4pi


_Most Sixes in IPL Cricket:_

1) C. Gayle: 326 @ 2.63 6pi

2) AB de Villiers: 214 @ 1.49 6pi

3) M.S. Dhoni: 212 @ 1.23 6pi

4) R. Sharma: 195 @ 1.05 6pi

5) S. Raina: 194 @ 1.03 6pi

6) V. Kohli: 190 @ 1.12 6pi

7) D. Warner: 181 @ 1.43 6pi

8) S. Watson: 181 @ 1.37 6pi",11
Reckon RCB and KKR have the fastest bowling attacks.,2
"What to do in Lockdown ft. Parents
1) learn CODING
2) Do Stocks",11
"* ball goes to boundary *

Star sports searching for cheerleaders: Maal kidhar hai",2
This is why we shouldn't be going with media hype alone. There must have been some reason that KKR are playing Mavi and Warrier over Nagarkoti.,-1
Wtf DJ is on cocaine today,3
The fake crowd noises sound absolutely demented,5
">I think playing another proper batsman in Nikhil Naik might help them if they have a collapse like SRH did a couple of nights ago!

Fucking leave us alone. We are depressed already.",1
Where's the guy who bet on De Kock to get more than 23 runs on the PP,3
Who did Naik eat during quarantine?,0
I definitely think it was smart for KKR to release Piyush Chawla. Going with the extra pacer makes perfect sense. Kuldeep+Narine are good enough as spinners. Just hope Kuldeep recovers after last year’s poor form.,3
Who is KKR's vice captain? Morgan or Gill?,2
Great bowling.,2
Mavi with the no look technique. Pretty fascinating,3
Oh for fucks sake. Enough with this fake crowd noise.,4
Morrison-Bhogle >>> the other comms this IPL,3
"Suryakumar always looks suss when I see him in the IPL, I don't know how he scores all the runs in FC",-1
"""KKR's strength is it's middle-order, but it has a glaring hole as far as Indian pace bowling options are concerned.""

Mavi: ""Hold my beer"" \*looks up at the sky\*",2
I can stand the fake crowd noice but the fake chants really grind my gears!,4
This MI side is fucking insufferable. We're just complete trash for supposed defending champions.,1
Is anyone else seeing a delay with hotstar??,3
I have no clue about any other batsman other than Morgan and Russell in KKR. How are the others ?,2
Wonder how much water they must need to water the outfield in Dubai heat,6
"C'mon Surya, hit few good ones so Gambhir tweets you're the best youngster",8
They really gotta tone the noises down.,2
"It's JP (Diminy), I heard KP and was wondering since when did he became so soft spoken.",7
"If the young indian bowlers do well, KKR are the favourites. They have a killer batting order.",3
My heart gets broken when the crowd starts screaming but there’s a fielder to grab the ball.,5
"Does anyone know what happened to the Bengali commentary? Watching on Hotstar app in the US and it was there for the first few games, but not available any more...",1
This is just shaping to be a classic.....hardik vs Russell and bumrah vs Cummins.....oofff,5
Can’t we just have an ambient humming like the test matches rather than the pained screams,12
So now we know Dubai has the best DJs followed by Sharjah and the Abu Dhabi DJ needs to be fired,5
What a shot wow,2
"""It is a game of inches""


-- that is what she said",5
Shot yaar !!,2
Can Cornwall remove his Nikhil Naik mask now,8
SKY!!!!,2
Ian Bishop meant to be commentating today as well,3
Narine averages 15. I don't get why teams open him all around the world,1
tbh i miss the vuvuzela background sound,3
"They just press the ""AAAAAAA"" button the moment ball touches the bat. 

Are they using school kids as crowd DJ? At least have nuance or subtlety in crowd noises. Or keep it to a murmur. No one cares",9
“Sweet ass” - Danny Morrison,2
"""He loves that on leg side""


- that is what she said",1
Oh I kinda forgot Rohit loves playing against KKR,2
It's going to be a nightmare bowling to Russell with full dew,-1
can Kolkata beat the Trinbago KR,1
"Wow, risky but good fours!",1
Respect for that guy who controls the crowd noises,2
U can't give so much width with that pace.,1
Expensive,1
That was only hands.... no feet at all.,3
SKY MY BOY,3
This gonna be a four/six or a wicket,2
Sky have been so consistent for both these teams,5
Lol KKR bowling sucks bring in cummo lol,1
Thank you SKY,2
Warrier has been found out.... 1 over into the spell,4
All the hard work Mavi did getting that wicket maiden undone in the space of an over,4
Welcome to IPL Warrier,1
In form SKY is a beast,2
That was lucky. If Morgan was there that was a goner,2
Unlucky Warrier.,1
"Guys, what is this? So few upvotes? Plz upvote the post",-9
I still can't get over ranveer climbing the pyramid.....it should not be allowed to air on television,2
Only Indian commentator I prefer right now is Harsha.,6
Would have been caught if it was anyone other than Narine.,2
Russel wtf was that 😂😂,5
It's ridiculous how literally everyone is ranting about the crowd noises instead of talking about Surya hitting 3 fours in 3 balls...,8
"Quality batsmen like Suryakumar Yadav, Sanju Samson, Ambati Rayudu, Ajinkya Rahane and Dinesh Kartik are so underrated idk why",1
Surya Bhag benchod,6
"SKY had realistic kinda ipl debut in the same ground
in 2014 in Mi vs Kkr",3
"Wait , when did jp Duminy become a commentator?",4
"Sandeep Warrier has so far bowled short and wide and got cut for 6, two on the pads which have gone for four and one full and wide which was trashed by SKY for four. Terrible tbh",3
"CALM YOUR TITS, FAKE CROWDD",6
"Of all the matches, the Abu Dhabi sound guy is the worst. First match and now this.",5
"Small question, where are u all watching the match from?",3
8 off Rohit's ten delivery's have been dots,3
Watching on Sky. Have all previous games had crowd noise like this? Finding it a little unbearable.,1
Banton has the same amount of 50's (plus a hundred) as Narine in 156 less innings,4
SKY and De Kock should open.,2
Looks like 6 Day Quarantine  fried Harsha's brains,2
That MPL sticker looks ugly,2
Wow that fake crowd sure love their whistles,4
Only Harsha should talk,5
Brohit day it seems like,3
