Timestamp,Username,Comment,Upvotes
2020-11-08T17:13:26+00:00,Freakysafal,"Maybe some other guy is famous as captain cool

But the real captain cool for me from last decade are

Kanos Morgan and Bailey",7
2020-11-08T17:13:28+00:00,aryanx1234,"Remember when kanos got angry and gave a stare to garg, for him to go and score a 50?

If kanos gets them close, he should give the batsman on crease the ""stare""",2
2020-11-08T17:13:28+00:00,,77 off 36 in most cases is gettable but sadly we have no support for Kane today,6
2020-11-08T17:13:30+00:00,GlitchPro27,"What is Pant's obsession with the word ""Easy""?",6
2020-11-08T17:13:41+00:00,Simple-Neck,I want to see pacers back just so that we don't have to hear Pant's banshee impressions.,2
2020-11-08T17:13:41+00:00,Shetts1103,Eeeeez hetty Eeeeez,2
2020-11-08T17:13:45+00:00,SnooMacaroons9408,"If I had to choose 2 batsman to bat for my life in international cricket, it would be Steven Smith and Kane Williamson. Always dependable, always calm.",7
2020-11-08T17:13:50+00:00,gentlemans-game,Someone has to come and smoke a few ..,1
2020-11-08T17:13:51+00:00,mytwoice,"India, despite the IPL, is lagging behind in producing world class T20 batsman.",-1
2020-11-08T17:13:59+00:00,MrLaggyShaggy,"Come on William my son, you can do it.",5
2020-11-08T17:14:08+00:00,Shetts1103,Samad needs to tonk a few sixes here,1
2020-11-08T17:14:09+00:00,Lucifer-Morningstar,"'Lovely slower ball'
140kmph
Lmao",7
2020-11-08T17:14:13+00:00,Rubberducky1239,"Slower ball at 140, sees Nortje yea thats right",6
2020-11-08T17:14:14+00:00,WeaponX23X,Where tf is Ashwin? Injured?,2
2020-11-08T17:14:17+00:00,,"If DC manage to lose this, Ponting will be charged with homicide after the game",4
2020-11-08T17:14:18+00:00,,What happened to Rashwin? Didn't see the beginning of the match but doesn't look like he's bowled,1
2020-11-08T17:14:21+00:00,Internet_Crab,Pant should be fined for fokat ka shouting lol,6
2020-11-08T17:14:28+00:00,,Bruh where is Ashwin?,1
2020-11-08T17:14:28+00:00,,76 off 35 is normal. Let's go.,3
2020-11-08T17:14:30+00:00,warrenslaya,If Pant would be Dhobi he would have plucked the edge by diving. Sadly Pant cant dive. He can only pencil roll,1
2020-11-08T17:14:30+00:00,CricketSingle,Shreyas has a lot of Ashwinesqe PTSD,1
2020-11-08T17:14:31+00:00,Shetts1103,Samad needs to cunt nortje,6
2020-11-08T17:14:34+00:00,R2RBoy,"Dom Cork - SLOWER DELIVERY!  
140.9KMPH",3
2020-11-08T17:14:35+00:00,tonight_we_make_soap,"Relax Delhi fans, the RRR shows it's a 2 person chase. Kanos alone cannot win the game... On that note, has goswami ever had a memorable game? He's been playing ipl since the beginning if I recall correctly.",3
2020-11-08T17:14:38+00:00,saysikerightnowowo,Climbed into that shit.,2
2020-11-08T17:14:39+00:00,Sicknit,Need pollard and pandya to win it from here,3
2020-11-08T17:14:39+00:00,Ritwicked,Samad show us what you got,10
2020-11-08T17:14:41+00:00,chut_has_no_religion,Abdul Samad what a shot Daddyd💦,7
2020-11-08T17:14:43+00:00,TheFirstLane,"BRILLIANT:
adjective
 1. having a lot of light; very bright.
 2. very clever, skilful or successful.
 3. Kane Williamson.",8
2020-11-08T17:14:44+00:00,Nyhrox,"Kanos is leaving it too late, need big few overs",7
2020-11-08T17:14:46+00:00,anaksr1414,"Samad also needs to start hitting few now.


Edit: I guess he heard me.",10
2020-11-08T17:14:46+00:00,naughty_ningen,Don't lose it from.here bc,11
2020-11-08T17:14:51+00:00,darn_it_,Cmon guys wer are the yorkers,3
2020-11-08T17:14:53+00:00,1deathstroke1,Kane is really a great batsmen when it comes to chase a huge target.. Guy knows how to run the game and slowly get team closer to win..,4
2020-11-08T17:14:56+00:00,munkeyy,Incoming Nortje Bullet yorker to samad,2
2020-11-08T17:14:56+00:00,DoomMachine-77,I’ll feel destroyed if we lose this from here.,2
2020-11-08T17:14:57+00:00,harsh1387,"Well,, need a new wicket asap.. and bowl some fuckn Yorkers..",1
2020-11-08T17:15:02+00:00,ru_sunshine,Even Samad's hitting. ByE bye DC.,4
2020-11-08T17:15:03+00:00,redviper96,That was absolutely cunted,8
2020-11-08T17:15:07+00:00,PM_ME_YOUR_CALL_LOGS,Every time the camera pans to Shreyas he like so lost,3
2020-11-08T17:15:07+00:00,glade_dweller,Is there still some hope left?,6
2020-11-08T17:15:08+00:00,CricketSingle,Come on my boy! Make Jammu proud.,7
2020-11-08T17:15:10+00:00,joeispunk,This would massively improve Samad's CV if he managed to take his team past the finishing line.,2
2020-11-08T17:15:12+00:00,,Kashmir 🔥🔥,14
2020-11-08T17:15:12+00:00,lonelyisIand,Nortje live up to your HYPE bruh,8
2020-11-08T17:15:14+00:00,philosifyme,Kane Williamson is such a good accumulator of runs. Like wow! I hope he gets to win the world cup eventually. He definitely deserves it.,3
2020-11-08T17:15:19+00:00,,"See Iyer, that's how you hit a bowler who isnt a spinner bowling full length deliveries.",8
2020-11-08T17:15:20+00:00,WeaponX23X,"DC is sweating, I think Ashwin is injured",4
2020-11-08T17:15:21+00:00,Simple-Neck,"Short ball at 150ks

Not an easy shot at all.",8
2020-11-08T17:15:22+00:00,fieztel,Love to see Warner smile,8
2020-11-08T17:15:23+00:00,,Fuckkk,4
2020-11-08T17:15:25+00:00,maverick_3001,Pls win SRH,6
2020-11-08T17:15:27+00:00,dhtikna,Man if kane pulls this off...,8
2020-11-08T17:15:29+00:00,,Wait what the fuck. 720 sixes this season ?!,5
2020-11-08T17:15:30+00:00,jadon_sancho,Samad can take number 6 slot for India,4
2020-11-08T17:15:32+00:00,Lionheart008,I see Yousuf Pathan in this kid,7
2020-11-08T17:15:36+00:00,ressurects13,Come on SAMAD be a STAR today,2
2020-11-08T17:15:38+00:00,Potential_Maize2236,Fuck yes Samad.,6
2020-11-08T17:15:40+00:00,harsh1387,What rubbish bowling..,2
2020-11-08T17:15:40+00:00,chut_has_no_religion,DAMN! This young daddy looks fluent,5
2020-11-08T17:15:41+00:00,porn-senpai,I read a lot of comments about Shreyas Iyer being the next India captain but I don't think he should be. He's Kohli II.,2
2020-11-08T17:15:42+00:00,Hariii_,sexy shots by the youngster,3
2020-11-08T17:15:44+00:00,4qua_Dementia,"If this was MI, it'd be their game to lose lol. BATDEEP",11
2020-11-08T17:15:45+00:00,,[deleted],10
2020-11-08T17:15:47+00:00,vvb_12,Abdul's day out?!,10
2020-11-08T17:15:50+00:00,9yearoldpatriot,need wicket desperately,6
2020-11-08T17:15:50+00:00,MasonParker420,Bruh Nokia gonna break,4
2020-11-08T17:15:51+00:00,DilliKaLadka,Stop bowling slow and bowl fast at the stump balls.,5
2020-11-08T17:15:53+00:00,munkeyy,just take a single and hand over to kane now!!,4
2020-11-08T17:15:53+00:00,krishnasharma18,Sorry dc your curse would be maintained.,3
2020-11-08T17:15:55+00:00,BlackDuckPlierX,Pls No Politics people,5
2020-11-08T17:15:55+00:00,saysikerightnowowo,Don't lose it samad.,6
2020-11-08T17:15:57+00:00,warrenslaya,If I were MI I don't know which team I would face honestly. DC has been beaten 3 times but they have peaked again.,3
2020-11-08T17:15:57+00:00,,Get in. Get the fuck in!! 🔥,4
2020-11-08T17:15:57+00:00,WeaponX23X,"Samad has done enough for Kane to win it easily now, Rip DC",12
2020-11-08T17:15:59+00:00,RLKay,Thia game is giving me PTSD about that RCB game in 2018 where chasing 219 we got really close and Kanos got out resulting us losing. The similarities are scary.,17
2020-11-08T17:16:04+00:00,Aakash1203,I want both teams to win,10
2020-11-08T17:16:05+00:00,Darshp1394,Williamson hits 100 and SRH will win it,10
2020-11-08T17:16:06+00:00,123twiglets,"Hopefully that's samad opening the gates and hitting big from now on, kane can't do it on his own",9
2020-11-08T17:16:08+00:00,sathvikvv,You can never hate this man KANE,10
2020-11-08T17:16:10+00:00,Serialmosquitokiller,Is Ashwin injured or what?,4
2020-11-08T17:16:11+00:00,,Delhi are losing it aren't they?  :(,8
2020-11-08T17:16:12+00:00,Simple-Neck,Lara gets another call right. Absolute madman,4
2020-11-08T17:16:13+00:00,mytwoice,SRH will win this,6
2020-11-08T17:16:21+00:00,Rubberducky1239,Wtf man pls no,3
2020-11-08T17:16:22+00:00,aegonbittersteel,Nortje has been rather poor since that match in which they rested him.,8
2020-11-08T17:16:22+00:00,naughty_ningen,Bc??????,5
2020-11-08T17:16:22+00:00,,Bowl a fucking Yorker,4
2020-11-08T17:16:22+00:00,jadon_sancho,Nortje should ball slow,5
2020-11-08T17:16:25+00:00,__1001001__,Let’s fucking go Samad,8
2020-11-08T17:16:27+00:00,SorcererSupremeee,"If Delhi lose from here, they don't deserve to be in the finals.",18
2020-11-08T17:16:27+00:00,Siondroms,What are they doing,3
2020-11-08T17:16:28+00:00,ru_sunshine,Samad's killing it.,10
2020-11-08T17:16:28+00:00,fieztel,Good Samu Nice Samu,8
2020-11-08T17:16:32+00:00,harsh1387,Dumbfck... BC bowl at the stumps you fuck..,2
2020-11-08T17:16:32+00:00,,Abdul Damien Martyn Samad,7
2020-11-08T17:16:33+00:00,chut_has_no_religion,ARgghhh Dadddy💦,3
2020-11-08T17:16:33+00:00,saysikerightnowowo,Almost killed the kid behind the boundary.,7
2020-11-08T17:16:34+00:00,RemarkableInvestment,Does Warner know they are gonna win? How is so calm and smiling?,8
2020-11-08T17:16:34+00:00,Hariii_,60 of 5 overs is DEFINITELY gettable.,9
2020-11-08T17:16:35+00:00,punekar_2018,Hetmyer's head looks like badger brush. i am always tempted to shave when he is on screen.,6
2020-11-08T17:16:35+00:00,,5 overs 60 wooohoooo,2
2020-11-08T17:16:40+00:00,ganny0007,South Africans at it again,7
2020-11-08T17:16:44+00:00,glade_dweller,Woah! Samad has Nokia's number.,5
2020-11-08T17:16:46+00:00,uravggstudent,Get fucked,2
2020-11-08T17:16:46+00:00,warrenslaya,Abdul Samad arrives!,3
2020-11-08T17:16:46+00:00,TheFirstLane,Samad is on steroids 💪,2
2020-11-08T17:16:47+00:00,,Pant wears sweaters to look fat. He uses Ezee liquid to wash his sweaters. So he advertises them during the match. **Ezee** **Ezee** **Ezee** **Ezee**.,10
2020-11-08T17:16:49+00:00,jadon_sancho,Why TF is Nortje bowling so fast lol,4
2020-11-08T17:16:51+00:00,JustStrolling_,Abdul Russell,9
2020-11-08T17:16:52+00:00,nextdoorrando,Now those are some genuine smiles from Warner not like earlier where he was hiding he's pain,12
2020-11-08T17:16:52+00:00,rohit-engt,"Demotion for Goswami from top to bottom.

. 

.

.

I'm talking about Shreevats.",6
2020-11-08T17:16:56+00:00,jadon_sancho,Nortje is a Choker,2
2020-11-08T17:16:56+00:00,joeispunk,DC's bowling going to choke now? Can't DC go through one game without vying for a meme team spot?,3
2020-11-08T17:16:57+00:00,justavertexinagraph,Have to say I love that we always punch above our weight and never lose hope no matter what,5
2020-11-08T17:17:00+00:00,flyhighy,TIL Kane has higher SR than Kohli in IPL Career,3
2020-11-08T17:17:00+00:00,bond_bhai,"POINTING: Get me more GUM, i need to CHEW CHEW CHEW.",5
2020-11-08T17:17:01+00:00,aryanx1234,"Nokia was never the same after the ""SKY"" celebration",5
2020-11-08T17:17:01+00:00,Shetts1103,Ahhh Samad is tonking nortje!,1
2020-11-08T17:17:03+00:00,,Samad has the potential to be future star,3
2020-11-08T17:17:03+00:00,kapilfan,Well well well. Took a break and came back to see the game very much alive.,2
2020-11-08T17:17:04+00:00,Ritwicked,Did you see that guy trying to dodge the ball,2
2020-11-08T17:17:04+00:00,OkWar7880,"What Srh needs is a good finisher who is not just a hitter but can also rotate the strike. Preferably indian. Someone like Pandya maybe. Then they'll be unbeatable with kanos, an in form Warner, Saha, Pandey, Shankar, Rashid, Bhuvi, Holder, Sandeep, Nadeem, and that Indian finisher.",2
2020-11-08T17:17:04+00:00,,[deleted],3
2020-11-08T17:17:04+00:00,Dikshit101092,"Lara literally has the script , jofra who just random tweets vs on  spot prediction",4
2020-11-08T17:17:05+00:00,singhsrb,Trust the South Africans in a semi final!!,8
2020-11-08T17:17:05+00:00,Rubberducky1239,Why not bowl the yorkers. Why,1
2020-11-08T17:17:06+00:00,bindaasbaba,Samad went off,2
2020-11-08T17:17:07+00:00,4qua_Dementia,Unplanned Samad event initiated,2
2020-11-08T17:17:07+00:00,mgonoob,Mahoosive over,1
2020-11-08T17:17:07+00:00,jadon_sancho,Why so Brainless? Just take off pace,1
2020-11-08T17:17:08+00:00,belanish11,Lmao that man after seeing the ball coming towards him,4
2020-11-08T17:17:09+00:00,theramblingman18,"Oh Samad, you beauty. That takes some pressure off Kane",8
2020-11-08T17:17:12+00:00,OverThinker24,Why you bowl south african bowler now?,1
2020-11-08T17:17:12+00:00,porn-senpai,"Nortje with the 'hit me' bowling... This is getting to exciting territory. If DC lose this, is Ponting going to throw away his hat in anger?",3
2020-11-08T17:17:12+00:00,legbreak_18,Kashmir willow,2
2020-11-08T17:17:12+00:00,vky8766,"Well, it's over for DC.",1
2020-11-08T17:17:12+00:00,saysikerightnowowo,Srh have a middle order? 🤔,4
2020-11-08T17:17:13+00:00,toothpaste4dinnr,hold on damn are dilli losing this?!!,1
2020-11-08T17:17:14+00:00,,[deleted],6
2020-11-08T17:17:15+00:00,crazycricfan,"williamson : hum hum hai,baaki sab paani kam hai.",6
2020-11-08T17:17:15+00:00,zambur-e-bahar,Next over who?,5
2020-11-08T17:17:17+00:00,Siondroms,Delhi losing this,4
2020-11-08T17:17:20+00:00,Bazzingatime,Nortje couldn't bowl a Yorker after the first six ?,9
2020-11-08T17:17:22+00:00,kpranar,"The South African in Nortje is coming to the fore, huh?",6
2020-11-08T17:17:24+00:00,ze_shotstopper,Corona means I already have a high heart rate. This is not good for my health.,11
2020-11-08T17:17:24+00:00,Simple-Neck,"Lara before the over - Samad is going to hit Nortje for a big over.

Cork - guffaws",11
2020-11-08T17:17:25+00:00,PM_ME_YOUR_CALL_LOGS,What happened to Ashwin? Injured?,8
2020-11-08T17:17:25+00:00,,[deleted],12
2020-11-08T17:17:25+00:00,redviper96,Are we witnessing a birth of a hero,8
2020-11-08T17:17:27+00:00,jinesh007,Samad just increased his stonks for the next auction,31
2020-11-08T17:17:28+00:00,TyroshiSellsword,Just bowl like what Natrajan does!,2
2020-11-08T17:17:29+00:00,WeaponX23X,Kane wicket or It's done for DC,3
2020-11-08T17:17:30+00:00,rohitk4019,Irfan Pathan already drafting his tweet praising himself for Abdul Samad.,23
2020-11-08T17:17:30+00:00,jadon_sancho,A South African choking in a Semi Final,20
2020-11-08T17:17:35+00:00,Sicknit,Samad looked great in one of the earlier games too . Hits the ball cleanly .,7
2020-11-08T17:17:39+00:00,GlitchPro27,"This is the point where DC slowed down, so this is honestly anybody's game for the taking right now.",8
2020-11-08T17:17:42+00:00,Mimiristheshit,"Only two overs of Rabada and Nortje left in the final five!
Who's gonna bowl the other three?",4
2020-11-08T17:17:47+00:00,KahaniGharGharKi,Why don't rabada and nortje bowl yorkers,4
2020-11-08T17:17:48+00:00,Freakysafal,"With Kanos set n Samad going big

50-50 now",2
2020-11-08T17:17:53+00:00,Giant_Slay3r,Hope is the best of things.,8
2020-11-08T17:17:58+00:00,,Bhenchod gaand fatt rhi hain,2
2020-11-08T17:17:59+00:00,,Fucking hell what a turnaround!,5
2020-11-08T17:18:00+00:00,singhsrb,Reminder that Iyer 21 off 20 killed us!,7
2020-11-08T17:18:01+00:00,Anurag6502,Just need one wicket. Bowl Rabada or Ashwin.,8
2020-11-08T17:18:05+00:00,darn_it_,When you can bowl such good Yorkers why would you bowl those short ones!!!!,9
2020-11-08T17:18:07+00:00,Alltaxx,"Batsmen hits Nortje for a boundary

Nortje: _You have won a free yorker_",9
2020-11-08T17:18:08+00:00,mangoestomind,SRH don't give me hope and rip my heart  out after time out.,4
2020-11-08T17:18:11+00:00,ConcentrateBig3530,Stoinis can bowl decently well in death but it would be tough against these guys,2
2020-11-08T17:18:14+00:00,fieztel,Kanos has his own script,4
2020-11-08T17:18:15+00:00,,[deleted],3
2020-11-08T17:18:15+00:00,,Gotta get Kane out or it's over for us,6
2020-11-08T17:18:16+00:00,,"I hope hindi commentators stfu. This is the last recognized pair and they literally need 12 runs every over, Samad has to hit it out and try to score ~15 runs every over.",4
2020-11-08T17:18:17+00:00,JustStrolling_,"Samad struggled bit time vs slower balls before, nice to see him improve this game",5
2020-11-08T17:18:18+00:00,ChotiGoldflake,Wicket in next over or SRH to play final,4
2020-11-08T17:18:19+00:00,,Lmfao we're going to lose this,7
2020-11-08T17:18:19+00:00,shubomb1,This match is gone now. Spinners will still have to bowl 2 overs minimum now and no target will be too big then.,1
2020-11-08T17:18:21+00:00,naughty_ningen,Ashwin kahan hain bc????,2
2020-11-08T17:18:22+00:00,2684335126835353,Nokia bamboozling Kane and getting tonked by some unknown kid,6
2020-11-08T17:18:23+00:00,,Big man Samad,4
2020-11-08T17:18:24+00:00,Potential_Maize2236,Another over like that and its SRH's game to lose.,5
2020-11-08T17:18:26+00:00,anaksr1414,Kanos hain toh mumkin hain.,10
2020-11-08T17:18:27+00:00,Slippin_Jimmy1216,Samad is long due. Hoping he takes it home.,6
2020-11-08T17:18:29+00:00,HBKM55,"Williamson angry

Samad and Garg: Shit shit shit shit shit shit. *Hits boundaries",12
2020-11-08T17:18:32+00:00,,Lord Nokia joining Dinda academy anytime soon ?,5
2020-11-08T17:18:32+00:00,thepokemonchef,"Glimpses of talent with Garg and Samad  as always. Irrespective of how this goes, I'm happy that they will only get better next season.",9
2020-11-08T17:18:34+00:00,mnking8,If samad can pull out hardick kind of innings.....,3
2020-11-08T17:18:36+00:00,broken_cranium,I like what Lara is wearing today.,1
2020-11-08T17:18:36+00:00,DoomMachine-77,"Losing out on the 200 might bite us in the ass. As Koach says, we may be 10-15 runs short. 
I’m scared.",3
2020-11-08T17:18:41+00:00,Simple-Neck,"Absolute lack of self awareness from Corky describing 140k as not being fast enough.

Fucker couldn't hit 130k on his best day.",3
2020-11-08T17:18:41+00:00,,I ain't watching the match as I don't wanna Jinx it,1
2020-11-08T17:18:43+00:00,,Rabada has only one left. They need 1-2 overs of spin. DC is fucked 😁,1
2020-11-08T17:18:43+00:00,dillisehoonb14,Oh I’m in danger..,1
2020-11-08T17:18:44+00:00,KelvinRkrab,Game gone I feel. Two more proper batsmen to come. Kane with 60 already. Dew. Rabada nortje with one each only.,0
2020-11-08T17:18:45+00:00,chratoc,Why fear when Kanos is here. SRH 2020 🏆,2
2020-11-08T17:18:46+00:00,harsh1387,Ashwin was our best bowler last match and here he isn't being bowled..,2
2020-11-08T17:18:46+00:00,oxfordcircus007,"chill DC folks, RRR is still 12",3
2020-11-08T17:18:47+00:00,flyhighy,Finally chance for Samad to perform where SRH has backed him consistently this season.,3
2020-11-08T17:18:48+00:00,porn-senpai,This is very gettable for SRH if these two keep going. One over from Rabada and Anrich to come. Can target Stoinis or Dubey or Ashwin.,2
2020-11-08T17:18:49+00:00,bunnyoverkill,"""It's the hope that kills you."" both SRH and DC fans",4
2020-11-08T17:18:49+00:00,R2RBoy,"Dugout Guru is just too easy for Lara.  
Reads the game easy. I'd to pay to watch him and Sachin analyze the game together on a comms panel",8
2020-11-08T17:18:51+00:00,VimalRana,Kanos was going strong and now samad's looking good too. Will be hell of a win if they manage it,2
2020-11-08T17:18:54+00:00,pranavbrijwani,"When you can bowl yorkers like those, why the fuck do you have to experiment",2
2020-11-08T17:18:55+00:00,,[deleted],6
2020-11-08T17:18:56+00:00,1deathstroke1,Don't know why Nortje going for wide length in spite of having skill to bowl such amazing yorkers..,3
2020-11-08T17:19:02+00:00,GlitchPro27,It hurts more when they give you hope first. :/,1
2020-11-08T17:19:03+00:00,saysikerightnowowo,I hope samad smashes mankad,2
2020-11-08T17:19:03+00:00,ishaan8878,Stumps gonna get wrecked soon,2
2020-11-08T17:19:04+00:00,OpinionNoOneAskedFor,That Nattu final over might just come back to bite DC in the ass..,2
2020-11-08T17:19:05+00:00,,Fml,1
2020-11-08T17:19:10+00:00,singhsrb,Finally we remember we have Ashwin lol.,0
2020-11-08T17:19:13+00:00,Lucifer-Morningstar,One team dependant on South Africans while other on Kanos. We know which one chokes in a semifinal and which one on final,5
2020-11-08T17:19:14+00:00,,Rashid can slog. He's got a bit of Afrdi in him,6
2020-11-08T17:19:16+00:00,vinay47,"not gunning for 200+ may come back to bite DC's ass here, we ve seen this happen when gabbar hit that first 100 at like 140 sr and the team scored only 160",1
2020-11-08T17:19:17+00:00,munkeyy,Just take single s and give strike to kanos please,2
2020-11-08T17:19:21+00:00,mrexperimenter,Terrible rotation of bowlers by Iyer. Why has Ashwin only bowled one over?,3
2020-11-08T17:19:23+00:00,Bazzingatime,Ashwin coming in now is peak incompetent captaincy/planning,5
2020-11-08T17:19:25+00:00,dillisehoonb14,"Fuck me, you can’t lose this BC.",7
2020-11-08T17:19:26+00:00,Shubh_K30,I'm getting vibes that Samad is either gonna murder Ashwin this over or Ashwin does a mankad,4
2020-11-08T17:19:26+00:00,,***TAKE WICKETS!***,6
2020-11-08T17:19:28+00:00,justavertexinagraph,Bruh if we somehow clinch this... Can't even imagine,3
2020-11-08T17:19:31+00:00,faxotee,Whoa where was he hiding all match?,2
2020-11-08T17:19:33+00:00,MISSIONCAP,We're here just to see who chokes in the last 5 overs.,2
2020-11-08T17:19:34+00:00,ztaker,Remember when cotrell went for 30 and next played a game later,2
2020-11-08T17:19:35+00:00,mnking8,Ashwin vs srh,0
2020-11-08T17:19:36+00:00,porn-senpai,This has to be a clutch spell by Ashwin. This is the game right here.,2
2020-11-08T17:19:39+00:00,PM_ME_YOUR_CALL_LOGS,Letzoooo ash,0
2020-11-08T17:19:42+00:00,Hariii_,Ashwin at the death. Let's see how this goes,1
2020-11-08T17:19:43+00:00,,[deleted],3
2020-11-08T17:19:43+00:00,drassaultrifle,Mankad please it’s the only way we can win.,2
2020-11-08T17:19:43+00:00,broken_cranium,This is not a good match up. Ash is way too experienced for Samad.,7
2020-11-08T17:19:49+00:00,,Samad being the bipul sharma of 2016 Q2,5
2020-11-08T17:19:49+00:00,Sicknit,Ashwin gonna win this for DC,2
2020-11-08T17:19:50+00:00,,Keeping 3 overs of spin for death overs 😂,5
2020-11-08T17:19:51+00:00,,Ash winning the match for sure in this over. Could be for any team though,2
2020-11-08T17:19:53+00:00,ru_sunshine,Samad is just batting so fucking well,2
2020-11-08T17:19:55+00:00,ganny0007,Last over should have been Ashwin,1
2020-11-08T17:19:55+00:00,Rubberducky1239,"Nice recovery Doull, very cool",5
2020-11-08T17:19:57+00:00,Anurag6502,Too short.,1
2020-11-08T17:19:58+00:00,,59 in 29. Idk but I'm still hopeful,3
2020-11-08T17:20:01+00:00,warrenslaya,This is not impossible tbh.,1
2020-11-08T17:20:02+00:00,shashi154263,"If SRH have to win, one of the Indian guys have to do it. Kane kan't do this.",3
2020-11-08T17:20:04+00:00,saysikerightnowowo,What shit is ashwin bowling?,8
2020-11-08T17:20:10+00:00,_Precept,What the fuck is Ashwin is bowling?,6
2020-11-08T17:20:12+00:00,PlsDontBraidMyBeard,Ppl in UAE just lost the beIN connect stream. I'm so mad,2
2020-11-08T17:20:13+00:00,,Gotta go past Qualifier 2 for once,6
2020-11-08T17:20:18+00:00,naughty_ningen,Ashwin is literally the only guy who i can trust against Kane,2
2020-11-08T17:20:23+00:00,thepokemonchef,"Ashwin always posts about CSK on his YouTube channel, very rarely about his current franchise. Seems like he wants to go back.",6
2020-11-08T17:20:24+00:00,singhsrb,Lot of rubbish in that over from Nortje.,2
2020-11-08T17:20:24+00:00,Hariii_,This man Kane never disappoints 😭💯❤️,4
2020-11-08T17:20:27+00:00,nouseridavailable,Fastest bowler Samad played before IPL was Prasidh Krishna but he is playing Nortje like he has been doing this all his life.,8
2020-11-08T17:20:29+00:00,chut_has_no_religion,Ooff Gote was in mouth,1
2020-11-08T17:20:31+00:00,faxotee,Ashwin gonna fire everything in,2
2020-11-08T17:20:31+00:00,drassaultrifle,This bowling is trash.,3
2020-11-08T17:20:32+00:00,,Crazy that dc gave up boult.,2
2020-11-08T17:20:33+00:00,kapilfan,Nice wrist work Samad. This guy is good,3
2020-11-08T17:20:34+00:00,darn_it_,Bowl to the field man,3
2020-11-08T17:20:35+00:00,,Ashwin was crying lmao,2
2020-11-08T17:20:36+00:00,red_plus_itt,"Players like Samad, Hardick are very hard to find for a team",4
2020-11-08T17:20:36+00:00,shubomb1,Wow! brought Ashwin way too early.,3
2020-11-08T17:20:39+00:00,fieztel,Nice Bois cool Bois,1
2020-11-08T17:20:40+00:00,,I want somebody to find me the way Williamson finds gaps,5
2020-11-08T17:20:40+00:00,Shetts1103,Pant and screaming ash ash is inevitable,4
2020-11-08T17:20:42+00:00,PM_ME_YOUR_CALL_LOGS,Ethical short balls,2
2020-11-08T17:20:42+00:00,AcceleratingRiff,Warner today 🙂,8
2020-11-08T17:20:45+00:00,harsh1387,Wtf.. idiots bowl at the stumps and not so wide..,3
2020-11-08T17:20:45+00:00,roha5090,Ponting death stare intensifies.,2
2020-11-08T17:20:46+00:00,,Samad will finish this himself.,1
2020-11-08T17:20:47+00:00,maverick_3001,SRH pls pls win this,1
2020-11-08T17:20:47+00:00,sxd827,"DC should be worrying now. Our two best batsmen are still to come, Goswami and YRKFA.",5
2020-11-08T17:20:48+00:00,dillisehoonb14,"Delhi fans: finally an easy win 


Delhi: not so soon, Bc",11
2020-11-08T17:20:49+00:00,yuvraj_birdi,SRH are cruising as long as Kanos is there tbh,2
2020-11-08T17:20:50+00:00,ru_sunshine,Welcome SRH to the finals. We will have a legendary match.,7
2020-11-08T17:20:52+00:00,Subzero007,Classic Kano!!,3
2020-11-08T17:20:52+00:00,Naan6,"Good character development from samad already. Last couple times we have seen him, he seems to have gotten carried away after hitting boundaries",9
2020-11-08T17:20:57+00:00,aegonbittersteel,"Well if DC has been consistent in one thing this season, it is braindead captaincy.",4
2020-11-08T17:20:57+00:00,zambur-e-bahar,im feeling fear again,5
2020-11-08T17:20:58+00:00,BlackDuckPlierX,Anyone who thought the match was won by DC (Including me) should apologise,5
2020-11-08T17:20:58+00:00,ChotiGoldflake,What the fuck is Ashwin bowling?? Too short and carrom only,1
