Comment,Upvotes
Bit early that,1
If Kane isn’t playing I’m supporting RR this season.,54
[deleted],7
"So if SRH wins comfortably, CSK will be at the bottom of the table?

Changing my flair to SRH rn",8
Frontbencher vs Backbencher,6
"As much as I would like to believe that we are favourites here, years of being a Delhi fan has taught me to expect the worst.

Plus Warner is too much of a champion player to lose three on the trot.",6
"I have confidence but definitely not entirely convinced with our batting performances so far.

The first game we needed a Stoinis miracle & KXI bottling the game to pull us out of certain defeat.

Second one we dropped the ball whilst batting in the death overs, but excellent bowling won us the game.

Hopefully we see our batters in some explosive form today.

P.S. : Hope Kanos plays and performs really well in a losing SRH effort.",2
"We've had two exhausting days of cricket, I sense a boring game today.",5
"SRH should have retained Pathan and Hooda, they gave a false sense of confidence to the Top order that there are big hitters to come, though they very rarely brought out the big hits for SRH and were as poor as their current middle order, but at least the top order batted in much more relaxed state of mind",6
[deleted],5
"So approx. 35 minutes until we find out that SRH are not playing Kanos, and have opted to lose.",3
"Today seems to be a good day to have a Warner-Bairstow masterclass. I'm conflicted who to root for though. If SRH win, it is better for the tournament buttttt CSK will likely be pushed to the bottom of the table.",9
Probable team changes for today? Are Ash & Ish fit? Is kanos playing?,2
"Not that other SRH middle order players were any better, but Kanos couldn't really get going last year.

His innings: 14, 3, 3, 8\*, 13, 14, 3, 70\*, 28",3
"It's promising to see the Delhi unit coming together over the years. Finally the CSK and MI model bearing fruit. 

Hope they don't show the brain dead planning in the next major reshuffle as they have done in the past.",5
Hopefully Hetmyer gets a good innings today,1
[deleted],1
"I'd drop avesh for Harshal patel, avesh bowls a lot of pies",1
[deleted],3
My favourite team vs my least favourite team.,1
"Unpopular opinion as always but Rashid Khan’s spot needs to be looked at closely. He’s cost the franchise 9 Crores and an overseas spot. For someone costing that much money and keeping out Kane Williamson, he needs to perform head and shoulders above the other spinners in the competition. It’s not enough that he simply bowls at 6.5 RPO. Even average spinners do that. He needs to be able to deliver for the team in the power play and even death, and be a strike bowler, similar to how Ashwin was for CSK back in 2011. 
 
Like Narine, he essentially provides no batting utility as he gets out to any remotely high quality bowling. Several analysts were looking for KKR to drop Narine. Why is Rashid any different?",3
Expecting a great day for SRH pacers today,4
Abdul samad in for srh,3
Yo does Trevor got a thing against kiwis or smth?,1
[deleted],1
"I swear if Kane is benched too much, he might just demand to get transferred to another team as Dhawan did. Then we’ll get a couple of crappy India players in return.",7
"More about [Abdul Samad](https://www.espncricinfo.com/story/_/id/29023354/profile-big-hitting-jk-batsman-ipl-signing-abdul-samad), tonight's debutant for SRH.",3
"I actually don’t see which other team would play Kane regularly if he was with them. Maybe Punjab or Delhi in place or Pooran/Hetmyer? CSK for Watson? But no one is really dying for Williamson in their squad imo. Now that teams are getting set, not even sure who stands to benefit seriously from getting him.

I say this as someone who is a big Kanos fan and believes he’s almost as good or as good a T20 player as someone like Kohli. Just feel like there’s no shortage of class batsmen.",-5
[deleted],0
Ishant is back! Great news for Delhi that.,5
"Kane is in.

Kane is in.

Kane is in.",5
KANE AND ISHANT BACK,3
Kane’s back!,3
Time for Kane Bois finally,3
"KANOS IS IN

AJSHWHWUAKSA

ALL ABOARD THE KANE TRAIN",2
Kane inplace of nabi? Lol,3
Oh god finally Kane is in or U was about to go sleep and wake up around 10 pm ist,1
KANEEEE FUCK YEAHHH,2
Kanos is playing. ❤️,3
Is this the ground with joke boundary length?,3
Finally Kane is playing,8
ALL ABOARD,6
Kanos😍😍😍,5
Warner-Bairstow 300 partnership incoming. You heard it here first.,7
A Davey 100 before bedtime pls,5
God is back. Game on.,5
[deleted],32
"Glad to see Ishant back

Tons of Kane hype as well, inb4 underwhelming performance (yes I know he hasn't played for a while but still funny innit)",3
Would've stopped supporting SRH if they had dropped Kane for this match too,7
Kanos is gonna snap his fingers.,2
"kane and samad back in! yes, yesss, YESSS!",1
Abdul Samad the 19 year old J&K batsman is in the team,5
"Kanos 😍

Why my pp suddenly big",13
"Kane is love, kane is life. Al aboard kane train 🚆",31
Thank goodness Kanos is in. One of the best in the business.,2
The last two days have given my heart quite a workout; will it happen again tonight?,1
"Nabi left out against a side that has 4 left-handers in the top 7.







Who is taking these decisions at SRH?",6
I don't understand why you'd still opt to field after seeing how the past games went,2
"More hyped for Samad. He's been my Dark Horse ever since the auction. In Pant's voice, ""Lezzzz Gowwwww""",4
"Without Vijay Shankar, Abhishek Sharma now has to bowl 4 overs. Kane himself might be forced to roll his shoulders for a couple of overs.",3
YJB munched too many pies during lockdown,4
Feels like today can only be a let down after two of the best T20s I’ve seen in a while back to back. Can never complain about having YJB on my screen though so looking forward to this one!,9
Nice to see Abdul Samad make the team. Possibly only the third player from J&K to play in the IPL. Almost gave J&K the first innings lead against Karnataka in the Ranji QF.,6
Let's go DC... knock SRH out.,-7
Score predictions please!,1
So Abdul Samad is a batting allrounder who bowls legspin. I think he should get a try with the ball also. A lot of leg spinners are very successful when they first bowl because batsmen take time to get used to their action.,6
"excited to see abdul samad bat 
 
watched some of his videos on youtube and he really hits some effortless sixes",4
why aren't more neutrals supporting sunrisers? :( isnt it better for the tournament for sunrisers to win today? keep things interesting?!,5
Wishing for J&K's Abdul samad to do well. Will have some positivity in the region.,6
Sometimes it’s painfully obvious how popular two teams are based on the number of comments in these threads lol,55
Really hope Samad does well today. India really does lack some big hitting middle order batsmen.,7
"Phew Kane is playing 

Kanos be like ""I'm... inevitable.""",7
"Fuck ..why does ishant have to play when we are the opponents..  


rabada and ishan...",7
Kanos playing through the season might make him an MVP! He can dig in and pierce the gaps when the pitches slow down in the next half,6
Bowling is very very weak but screw it since Kane is back. Hope he performs and becomes a permanent fixture in the team.,3
"How scared are these cricketers to set a target?

It is embarrassing to say the least. They have seen most teams lose while trying to chase.",1
"Delhi is too Op,The only time they might fail is the knockouts since they are a bit inexperienced",12
Rabada has been wicketless only in 2/20 IPL games he's played. Last time he was wicketless was 16 games ago. He's taken 2+ wickets in his last 9 games.,2
Barstow looking like a henchman from any action movie,5
Imagine choosing to field even though almost all the teams that chose to field lost,4
"SRH team looks like those RCB teams with Gayle, Kohli and ABD at the top, no middle order and only one competent bowler.",67
A lot is riding on Rashid to finish the game.,5
"Srh bowling looks litl weak now

Abishek sharma shud bowl 4 overs

They cud have played nadeem",3
"rabada, nortje, sharma, mishra and axar. and ash when he's back. stacked bowling.",9
All neutrals are supporting thier usual points table neighbors.,6
This thread is dead man. Hopefully the match isn't,11
It's actually funny how nobody cares about this match,-4
"Should have kept Nabi instead of Rashid:

1) Proper batting finisher

2)Opposition would be willing to take risks against Nabi. Their goal is to typically avoid Rashid as much as possible. With Nabi at least they can be tempted.",2
Time to make some biryani out of these SRH players tonight 😋,-1
Quick question : is it okay to shit on CSK if H'bad boys win?,6
"DC does seem like the most balanced team this season, I think their biggest obstacle might be relative inexperience.",9
"Honestly not getting a proper Indian opener after letting Dhawan go was a big mistake from SRH. I get how good these two are but it totally messes up the balance. Hopefully for SRH, Garg develops well and can add some strength.",6
hopefully the match is not like that saturday sleepfest.,12
[deleted],-10
its chhole vs biryani tonight!,7
"I've been an ardent Hyderabad fan since 2008. Feels shit to support SRH after ages. With Kane coming back, I hope there's a change in momentum.",8
I am team Rabada..,4
MI and CSK would be praying on one leg for SRH. Never thought we will see this day,7
Is tonight the night The Hulk finally rips out of his shirt like it's tissue paper!?,8
"If Ishant will be able to swing the ball for Warner from round the wicket, it will be fun to see.",2
One big advantage of hosting matches in UAE is that you don't have to worry about rain.,6
"Oh no, we won the toss... That's been such a bad omen this season....",2
Rooting for DC but my boi Kane Williamson’s playing today 🥺,4
Go get them boys!,3
Yay Kane Willaimson is playing but oh no SRH only have 5 bowlers.,2
"Kane is back y'all

Nabi was still very good though. Wish we could field 5 foreign players",5
"Who are the 5 bowlers for SRH, I saw only 4",4
Is Harsha commentating today?,3
SRH need to back Yusuf Pathan even if he's inconsistent he is  a big hitter,0
SRH has the shortest and the most competent batting lineup I have ever seen.,6
DC gonna choke today. SRH posting 180+ and DC lineup will falter,8
"Wish I had drinks, would take a shit every time SRH shit the bed.",4
Hope SRH scores 110 and defends it just for the memes,8
How did the points table get reversed?🤔,8
Graeme what you smoking bruh,3
Upvote this thread or Jesus will be angry with you,3
I’ve been supporting Delhi the past few matches because of the Rabada-Nortje partnership but Kane’s tempting me to support the Sunrisers.,2
Hope SRH shows some INTENT.,5
"No matter what is the result, Rabada has been such a gem for Delhi. They better retain him for next mega auction.",4
Genuine question. Why can't Rashid be dropped? He's a wicket taker alrightbut Nabi's the more economical bowler and better batsman and he's *coughs* older and more experienced.,4
"Instead of out batting lineup finishing after 3, it finishes after 4.",6
"Lee: We're in for an absolute cracker.


**SRH puts in a borefest**


Lee: *Surprised Pikachu Face*",6
What time is the Super Over guys?,4
CAN WE WIN A GAME PLEASE?,2
"I see more RCB fans than SRH fans, guys go home our match is over!",6
"you could not live with your own failure. Where did that bring you? back to me

\-Kanos",52
Why is CricketMatchBot supporting RCB?,2
Very happy with Kane's return. Hopefully our middle order get some runs.,5
"Kanos is in today , hope he gets going",6
Oh shit I just realized Ishant is playing in a team coached by Punter,10
Scenes if Kanos scores 700+ again but without playing 2 matches,6
Scenes if SRH is 4/3 in 2 overs.,4
Rahane would make it to any teams starting XI except Delhi smh,-1
Wow this thread really is dead today.,2
Hope kanos comes at 3,1
Scenes if the serial downvoter is back,-1
Really fancy YJB to go very unacademy today,2
"Ah, I’ve finally figured out what I want. Kane to score a big century and Rabada and Nortje winning the game for Delhi like they’ve done thus far. At least that gives me hope that our cricketing future won’t be complete shit with all the shit being thrown around now.",3
SRH please win today and let Watson score in next match pls,1
I see that Anrich Nortje is applying for Australian citizenship under the bogan fast-track process.,1
"Really like DC's tradition of choosing a different player to give the huddle speech every match, it's only symbolic but shows they're willing to listen from everyone and are inclusive",2
"This is embarrassing, we're getting memed by RCB fans. Like, where do they get the nerve?",8
good to bat first and hope that bowling goes well rather than batting collapse in second innings,1
Let's go boys,1
blitzkrieg innings needed from baistow and warner today.,1
Kanos will no longer watch from the shadows,7
Ishant is T H I C C,2
Off topic: I want NZ to win the World Cup in 2023. They honestly deserve and need it more than anybody else,6
"In International T20s, Ishant with the new ball against the likes of Bairstow and Warner would scare the crap out of me as an Indian fan",4
*Unacademy cracking six* is one of most annoying ads.,6
stream hai kya kisi kay paas?,1
when is holder out of quarantine?,1
Why is everyone underestimating Ishant so much,1
"get your memes ready bois, Delhi gonna chase!!!",3
Kanos be like: *I'm Inevitable.*,2
Hetmeyer has to come good tonight. Or else I see him being dropped for a long time,4
Warner garu kadu. BHAIII Bulate,5
Is there a bigger power childhood friendship couple than The Hulk and Dan Ricciardo? I doubt it,5
What the fuck is that fake chant stuff in the first over. Very annoying,3
Hope Srh gets their first win.,8
I am ready for a Delhi choke,5
"Jammu and Kashmir boy Abdul Samad in, hope he does good big fanbase he has there.

I am supporting SRH today, I like shake up of points table, unless RR is playing !!",6
My boys SRH not going to disappoint me again. Leggo!,4
"Never in my life, I've heard people cheering for ishant",7
"Some part of DC's turnaround goes to Rahul Dravid as well. When he was the coach he pursued with under-19 players even though the lacked experience and kept collapsing under pressure.
Even ganguly after him. All that is bearing fruits now",3
I see more Deccan charges fans than Delhi capitals fans.,5
"We won the 3rd match in 2016. We're winning this easy, No worries.",9
After the last two games I expect this match to feature at least one double century and three sets of super overs.,3
What was Ishant on last year? 48% dots in powerplay are quite good.,3
Would love to see these 2 run between the wickets at the MCG with the ropes almost out to the fence. They'd run a 6,8
SRH's one wicket equals two for the other teams.,1
"Evening gents (and ladies)!

Let's go",2
"Kane is back. Harsha is back.

Good day!",6
Good running,2
"They dropped nabi for kane lmao, now they have to get 4 overs out of Abhishek Sharma, Kane Williamson and Abdul Samad against these crazies.",9
Kane looking fresh af,4
"Unbelievable, they took 3 runs",5
Feel like shit just want Bairstow back with Gray Nics,8
KANOS PLAYING TODAY 😍😍😍,9
man where tf did they get this david warner chant from,7
200+ on the cards. Pitch look good,4
We $ Love $ India,8
"If you make a fielding error against these two, it’s a guaranteed extra run.",9
Kanos looking very ominous,1
Totally forgot about the match. God bless my friend who knew I'd be excited to see Kane in and dropped me a message. :'),4
Kane is back,1
I can't tell who's looking worse Shikhar or Graeme,2
I was about to praise Mishraji for saving that boundary at this age but then realized that it was Prithvi Shaw.,4
">Johnny Warner and David Bairstow

This duo's got so much potential, tbh.",7
"Who is the 5th bowler for SRH lmao ?

Surely it should have been Nadeem coming in for Saha",6
Btw these Dream 11 ads are really funny and relevant.,12
"No matter where we live, no matter what country we support, we are all united by our love for Kanos",6
"Hello guys, sorry for off topic, I am classy Indian and KIWI at heart who supports New Zealand team and hope they win the next World Cup that is going to be held in India. Because they dEsErVe it more than anybody else.

Anyone else agree? Upvotes to the left.",5
No Ashwin :(,3
[deleted],7
Why does SRH matches feels boring even though they have warner?,4
Wait Sharma ji is playing? I thought he wasn't fit!,2
SRH batting doesn't look bad at all today. Is Abdul samad good?,1
Lol! What a weird stroke..,4
Finally first boundary,2
Who's the fifth bowler in SRH,2
Why is this thread so polite?,4
The openers can finally play freely knowing the middle order won't collapse now,4
"I sincerely hope Ishant is actually 100% fit and not just playing because DC forced him to.

Australia tour is much more important than this.",22
"As much I want to see kane bat, I want Warner and Bairstow to score 100 each in 17 overs",7
Stupid question. How do you mention your favourite team's name beside ur user id?,5
Where the hell is Ashwin?,1
"Kanos probably the most universally loved man in the world right?

Like what sort of sick fuck wouldn't want to have a drink with him",13
"Intent is there, let's see",1
Warner was really upset about the no. of dot balls we conceded last game. It was about 30-35 according to him.,6
"Hey guys, which commentary should I listen to the dugout or the other English commentary?",1
Hogwarts alumni and cardoons opening for SRH.,5
"I just realized, one of the best #3s isn't even playing ipl. Anyone know why root isn't here?",1
30L live on hotstar. Is that decent/above par/below par?,2
Kanos looks more and more like a malnourished Kratos.,6
BRUG,1
Rabada going ball to ball B),4
Rabada really has the best smile ever,4
"SRH has the best top 4 in this IPL: Warner, Bairstow, Kane, and Pandey. Wonder why they didn't start off like this.",0
Just seeing kanos on screen hypes me up.,1
"Seeing how strong a team DC is, it is only a matter of by how many wickets they win.

of course, would be happ to be proved wrong. It will add excitement to tournament.",0
Knock his bloody head off..,2
Right in his little Jonny,9
Bairstow gonna pull a finchy now,2
low blow,2
"how strong is delhi captials team.  
Bowling boosted with the inclusion I sharma , along with rabada , nortje, amit mishra, axar patel , stonis looks a decent bowling line up.",3
Aaron finch mode: on,5
"Wait, I have seen this before.",3
Irfan Pathan making fun of Mishraji' changing hair. Like he didn't got his hair weaved,6
"Woah, I thought that was above waist",3
Wow we're seeing a lot of balls being destroyed this tournament,6
How is that not a no ball,6
Are they without protection ?,3
Oh god he nailed it,5
Press F to pay respects to Bairstow family's future.,23
Ouchhh,1
"Saha is out. I like his Wicketkeeping, but he is a big batting liability in T20s",3
"Something something kiwi good, Kanos wholesome 100, give me upvotes.",10
"Now we know, bairstow got the strike he needs. He's gonna do what finchy did",3
IPL teams' twitter handles are more cringe than....... well imagine something very cringe and then imagine that they are even more cringe than that,3
So SRH is going to win tonight right since everyone's favorite Kane is in the team now?,6
"That's the wrong jonny, Rabada.",4
Rabada asserting dominance in the first over itself,5
Another one in the box.,2
"Straight in the baby maker.

That hurt.",4
"Finch is stronger down there than Bairstow, he didn't sit after getting hit on kfc stick",3
Right in his babymaker,3
They are playing staying alive at the IPL? Wtf,3
Remember what happened yesterday when Finch was hit. hm...,1
Man this stayin alive song reminds me of the Office,4
lol are they playing staying alive,1
"DC is doomed now, one doesn't mess with YJB's balls",2
What a cricketer Junior would have been,2
Bairstow took a ball to the dick. RIP DC.,3
Hotstar subscription makes a lot of sense tbh. Can toggle between commentaries when I get bored.,5
Alexa play Another One Bites the dust,5
"I am hard just looking at the magnificence of Rabada and Ishant in the same frame talking to each other


**My pace senses are tingling**",2
Right in the jewels,2
Johnnys strike rate will improve likely,1
Stoinis looked stonked,4
"that cred payer of the match shit is so cringe, can they NOT",4
The song may be Stayin Alive but I'm not sure YJB's sperm count is so lucky,5
[deleted],2
Harsha throwing up cricinfo stats,2
Handle balls with care - Warner,3
Rabada instructing Ishant where exactly to target lol.,6
Karan Williamson playing should win some fans over for us today,8
Wait! Why is Ishant bowling so sensibly.,8
DC BC Letzz gooo,1
Was that the first time he’s ever worn a hat?,5
"Watched Breakfast with champions episode featuring Ishant, my respect for him increased a lot",4
"Rabada telling Ishant: ""Their weakness is the dick area""",34
Whats this abdul samad? Bowler all rounder?,2
Rabada has now changed the meaning of bowling in the slot,8
fragile sticker needed on trackpants next match onwards.,10
"Brilliant bowling by ishant, he's not giving these guys the pace to operate with",5
Rabada is targeting bairstow's kids,44
i don't wish even my worst enemy to win CRED payer of the match and do that dong shit in front of no one and then sulking to abyss,17
Why does Bairstow always look like he's off his face on coke,7
Abdul Samad is a pretty kid,3
Cmon warner bairstow lit my day,2
"DC, SRH head to head - 6 9

Niice

More like head to .....; You get the point",11
"Someone should hit koach in his balls, that should get him back to form",3
Did Mishra get a transplant? Or is it hair fixing? Looks good,2
Jonny Bairstow in that SRH kit looks like a banana if bananas were orange.,5
Did... did he just mistake Irfan for Yusuf?,7
"Yes, I always watch cricket with a placard in my hand. At home. So natural",2
Prithvi Shaw looks and acts like 90s bollywood villain,15
Ishant has confused them into playing test cricket,4
Pls play Williamson at 3 not Pandey,1
Samad with a casual SR of not defined,1
"Waiting for the spinners to come on, so Rishabh can recite the **Jonny Jonny Yes Papa eating dot balls no papa** rhyme when JB's on strike",3
henry cavil in action,2
Prithvi Shaw somehow looks like a child and a child predator at the same time.,26
"IPL ads used to be good , now we have Whitehat and Josh smh",2
It's impressive that all those celebrities accepted cred ad,2
"I actually forgot that DC and SRH played each other in eliminator last yr, it really had the inevitability of a MI-CSK final. This season looks much more unpredictable.",2
Sunrise need to get going in this powerplay,4
"Top 10 anime comebacks of all time:

Ishant sharma in the last 3-4 years",21
warner needs to go arial. too many shots going straight to fielders in the inner circle.,4
Abdul Samad has a First Class strike rate of 112,1
Warner and Bairstow playing Find The Fielder™,7
Wtf is this crowd noise man.,5
Warner hitting straight to the fielders,3
The fake crowd cheering 3 seconds after a ball is hit for a single is soooo fucking annoying.,6
These virtual fans shouting on singles is so annoying.,6
nortje 🤝 nokia,29
I miss the Vodafone ZuZu ads,4
I’m surprised they have a recording of the crowd going “OHHH...”,1
If Nortje had thick moustache he'd look like Borat,3
Wtf this batting! Are these guys gonna bore me to sleep before the first *CEAT tyre strategic timeout*,3
Why is SRH not playing at Sharjah at all?,7
Nortje with that moustache looks like the sporty dad in a generic coming-of-age film.,4
"other match threads when refresh after an over: **XXXX comments** ( *495 new*)

this one: **XXX comments** (*8 new*)",2
shoe squeaking sounds in the dugout,6
"Ball: hit straight to a fielder, 0 runs


Fake crowd: AHHHHHHHHHHHHHHHHHH",10
"This DJ is really bad, scream for each time the fielder is running lmao",2
"Crowd noise seems stoned, gets it peak when the fielder's already got the ball",3
Man these two are way too rusty ATM. They can't keep taking singles and tire out themselves. Get your shit together and tank it boys.,3
"After last match, Warner said that one of their problems was that they are starting slow in the first half of their batting. But, I do not see any urgency in his and Bairstow's approach.

Less than run a ball.

What's the point of bringing Kane if the openers do not play more freely without having to worry about the middle order?",1
"God it feels like watching a test match, wtf",11
Bring back tom moody,3
Bairstow's mummy is into black magic I guess. That would hit the stumps 99/100 times,3
"""And the crowd goes wild"" as I run back to the telly thinking its a wicket  


  


Warner tapping to mid-off for a single. Ffs",7
"DC's best bowling lineup would be Rabada, Nortje, Ishant, Mishra ji and Ashwin. Lots of quality, variety and experience. Really waiting for Ashwin to come back from his injury.",4
Bounce the cunts,1
This incredibly delayed screaming for a single is pissing me right off,4
Member when zuzu ads were so good! I member.,2
"If the IPL is so rich, why can't they hire better people to mix the crowd noise into the background?",47
Nortje’s gooood,1
Harsha Bhogle is such a well spoken Telugu guy!,7
Warner- Bairstow opening used to be the most exciting thing for me in IPL. It's been a disappointment this season.,4
Oh god. Sunrisers bring Sunrisers again,3
Good opening for this ODI here.,3
Get your shit together SRH,4
Is it just me or does Nortje look a lot like Sacha Baron Cohen?,2
Delhi bowling <3,3
