Comment,Upvotes
"Rohit striking at 130, unless he shifts gears in next two overs ..not good enough. Saying that because tiwari isn't striking at 160 either.",3
Should've send Pollard up the order.,3
Fake audience sounds are killer man . They go  so loud even for 1's and it SUCKS. don't ruin boundaries by this,5
ffs the rr is barely above 8.5. time to ramp things up.,3
"Running between wickets have been below average by MI, they will suffer in Dubai and Abu Dhabi ground if they don't improve",1
"Sunil Gavaskar's least favourite team is MI, because they convert twos into ones",2
What is Tiwary doing,3
"Hope dk finishes kuldeep's quota, and hope warrier + russell (3+1) is the 5th bowler quota done..",3
Can someone tell me the commentators on hotstar? I've heard that guy but can't seem to remember his name,2
Oh now I understand why Tiwari is in MI. It's Rhyno conservation awareness.,13
Ishan Kishan ಠ╭╮ಠ,2
"Kuldeep's pulled it back nicely, after going for 11 first over, probably should've bowled Nitish Rana for the *makes things happen* quota",3
Dugout has become cringe with these alerts feeling like I am watching some shitty game show,3
Wow the last 3 IPL seasons Rohit has averaged under 30,3
Wheres their top buy,6
Where's Nagarkoti? Thought hes alright,2
"Very anti-rohit inning till now

Starting with a flyer n then going slow

He usually goes other way around",3
"**Most 50+ Scores vs KKR in IPL**

Raina - 8

Rohit - 7

Warner - 6

Dhawan - 6",5
Guys like Tiwari ensure the local mithai shop stays in business,-1
I don't get this batting right now.,1
Don't think IPL teams should promote unfit local players regardless of how good they are. Leaves a bad precedent.,-1
If these two manage to run a 3 I will donate $50 to a charity of you guys suggest.,41
Warrier looks like an indian Donald Glover,1
Both brothers padded up.,2
Baz flipping pens in dugout lol,3
"""Tiwary is also known for his big hitting"" what? did I miss something? commentators say whatever they feel like saying?",3
Emiway Bantai being played in stadium hh,2
What was that ball?,2
Bring back Nagarkoti or Krishna ffs,2
Should have sent Hardik over Tiwary,8
How much wide wil he bowl??,3
"Krunal looks like he is annoyed as hell with Hardik’s blabbering and just wanna smack him but can’t because of mom, so just sitting there with head down.",6
Yo Tiwari so fat when he sat during the auctions he automatically lowered his base price.,13
Shami should host a biggest loser show just saying,0
DON'T BALL SHORT.,2
"Most runs against teams in IPL

* 875 **Rohit Sharma vs KKR**
* 829 D Warner vs KKR
* 825 V Kohli vs Delhi
* 819 D Warner vs KXIP
* 818 S Raina vs KKR
* 818 S Raina vs MI",4
"Popup of ""Fit India Mission"" then cut to Rohit and Saurabh Tiwary playing.",5
Why does our batting appear weak to me? It's the same from last year.,7
Yes warrier. Rohit can't play mid paced half trackers,3
"The dugout edit: IN HOTSTAR is real innovation in the IPL.. makes me feel like Indians CAN actually innovate -- unless they copied it from some other sport of course, but still they get credit for picking up a good idea and doing something for the TV spectators. Really impressive that they  aren't being greedy for ad money too.",-1
Anyone applied for cams or chemcon?,3
Aw come on,1
While batting first atleast Mumbai should send Poland up the order,6
Brohit has turned up early this year or what?,4
"sub par innings from rohit **till now**, needs to step up",-1
"**Most 50+ scores in IPL**

48 - Warner

41 - Kohli

39 - Raina

38 - Rohit

37 - AB De Villiers",5
What's the dot percentage for rohit in this innings ?,3
"Why is he bowling so many wifes?

Edit: wides",3
That ain't a wide.,1
That was not wide fuckers,1
"Tiwary has always been a big lad, I don't get why are people so obsessed. Could he be fitter? Yes, for sure. As long as he gets runs and does the job, who gives a shit?",8
Saurabh tiwary cannot get a wide for a ball bowled to his offside,1
Mi brought in Tuk tuks over their power hitters,2
Tiwary obviously has no plan to play at international level. There is no way he can pass the fitness test and he isn't Brohit to get special treatment.,17
Fit India lol,5
[deleted],10
Getting offered 1:100 odds for a three to be taken in this partnership. Should I take it ?,7
Warrior has bowled well but the tendency to dish out a hit me ball every over has spoilt his figures.,5
[deleted],-1
"Seeing ""CEAT strategic timeout available"" makes me want to disinfect my eyeballs with concentrated acid.",3
Fit India promotions when Tiwari is batting. Sneaky.,3
"Question - Lets say if Rohit decides to get really fit, do you think he will be even better batsman or talent is talent and you won't see any change?",1
"If Rohit = Vada Pav,
Then Tiwari = Big Mac.",2
"> fit India dialogue

> Tiwary and Rohit playing",2
Are they deliberately showing Fit India advertisement because Saurabh Tiwary is batting?,5
Crowd goes wild ...... for a single,3
Bruh who was DK talking to tamil in?,2
"Just get rid of the free hit. It's too harsh a penalty for a minor involuntary transgression by the bowler. Along with that please remove the stratetegic timeout. All it does is obstruct the flow of the game. I know IPL is a highly commercialised prodcuct and they will show ads whenever possible but there are enough interruptions in the game to show ads. 

Instead of 20 overs a side I think they should play 21 overs a side. I don't know why but 21 is a better number.",-11
Is it me or does the game seem awfully slow today?,6
"Pollard should come next, if a wicket goes down soon",3
Fit India ad when Rohit and Saurabh are on crease is peak unintentional bantz.,7
The  dugout *on Hotstar* is real innovation in the IPL.. fixed it,2
Why S Tiwari isnt invited to that fit india talk? This is a travesty.,9
Where is Cummins?,5
Aight Rohit is bored already,5
"-3d chess from MI

Brought in a guy who neither can hit big nor can run fast",5
ICYMI : Rocket League is free on Epic Games,2
"Under the able leadership of Shri Jay shah, I expected nothing less than ads of F INDIA movement.",1
Watching these two bat together makes MI - Motu Indians. ^Sorry,0
[removed],13
Tiwary just did a Smith there. To a Yorker,3
Tiwary running around like he is running since start of innings,2
India needs Cheeka back to the selection panel. He surely wont neglect Suryakumar Yadav,-1
I guess commentators will get fired if they speak about players' fitness on air lol not a single word's been said thus far all tournament.,1
"As soon as Tiwary came, the game became so slow",0
Lmao nehraji caught taking a nap,1
Hotstar lags .. my asshole friends keep telling me the score before,5
Fit India ad displayed while Rohit and Tiwary are batting lmao you can't make this shit up,5
very poor strategizing from MI. who decided that Tiwari must go in at this stage?,1
Why is Hinglish commentary not a thing,8
Sacred games ad,1
Lol Nehra ji,1
"Pandya - hits big

Pollard - looks big, hits big

Tiwary - looks big",9
Good thing these two are running slowly else the desert below will shift a mile.,3
"Here's why Tiwary being unfit is a problem. It shows he's not giving it 100%. Super unfair to those out there working their ass off for a place in these teams. I'm sorry but when you're playing a sport at a high-end level, you've got to maintain fitness, it's literally your job.",12
Wish we could have flairs of two teams. I like both RR and SRH.,2
Instead of 20 overs a side I think they should play ~~21~~ 250 overs a side. Not sure why but it's a better number.,1
Whats the point of establishing a platform to attack and sending Tiwari,7
Wallop,1
Did KKR sell Lynn just to open Gill with Narine?,3
Slogged hard !,1
Out of stadium! Sexy Hitman Brohit!,10
Should have let spinners continue,1
That was a dolly from Kuldeep.,7
Do we really need virtual cheer leaders,11
Rohit trying to get out now but will end up getting a 100,6
Why is Brohit murdering us :(,3
Time for rohit to make up for the slow start..kuldeep in trouble again.,2
"Quicks getting hit. 

Spinners getting hit.


What's up with KKR today?",2
"Rohit is like ""mat bhaag bhai, I understand your pain""",8
"Rohit mistimes a pullshot, fans go loud",4
Rohit is gassed,6
Hit a long six and have a break until the ball is retrieved,11
If Sanju Manju was doing commentary right now he would be gunning for Rohit’s double century already. Miss him so much /s,5
Fulldeep,0
MI had yuvi expectations from Tiwari but they're getting Misbah ul haq in return,1
"Rohit basically playing Cricket 19, pouncing on every pull opportunity",3
Rohit looks like he's about to become a father,-1
Tiwari should be playin aggressively while Rohit bats through the innings. Hardik and pollard are yet to come and they can drastically increase the run rate,6
feels really weird to think that cost of Cummins' single delivery in this IPL equals my annual pay,9
yall see kuldeep coming back to blue jersey?,5
Fatboy power,2
Tiwary doesn't need to hit now. Just give strike to Rohit,4
Rohit 100?,1
Cummins playing as a specialist batsman. Narine and Cummins to open the innigs for KKR,11
What a crowd. They are into singles. Would make a good one for tests,18
Any of you here are sending dancing videos over for dream 11 fans video thingie?,1
I am very interested to see these guys play a day game here,6
Tiwari has come to rotate strike ..wtf.,8
Hit or get out tiwary!!,1
It is sad that Kuldeep's bowling has been exposed.,2
"Stop fat shaming, what if the genders were reversed . /s",2
Tiwari is like lamba khelunga. I'll go deep.,3
200 th six for Brohit,8
69 with a six,3
Brohit 200.,6
"Why the fuck Tiwari is playing accumulator. That's not your role mate, definitely not after the start we got",2
Poor Kuldeep,1
Have they changed the crowd so it's almost silent and then suddenly hell loud when they hit it? Sounds like a goddamn video game,6
Thicc boi Rohit on fire!,1
Kuldeep looks like past.,1
DK is a mediocre captain,2
Rohit on for a hundred here,5
Have some mercy on your teammate Rohit,4
Brohit on 69,4
How does Rohit hit sixes so easily when he's not really that fit and then there's Virat who's got so lean and shredded with the biceps and all..I mean look at the amount of energy they put into the shot too!,24
Looks like Mumbai has brought in the heavy hitters!,10
Does KKR have any other spinners on the bench?,6
Mf Kuldeep talked all sorts of crap in lockdown about gaining confidence and shit... and comes out with this lol,9
Rohit 69😉,2
"64D Chess by MI management by sending in Tiwari. 

Rohit realises he has to do all the hitting now and is taking far more chances. Atmanirbhar Rohit",8
"Who's your top 3 Bad captains till now in this IPL? For me KL Rahul, Iyer and DK",1
"Hahaha just noticed Mumbai are sponsored by dairy milk, seems appropriate with these 2 rotund fellas at the crease",2
"Rohit and warner against KKr

Unmatchable",1
Moral of the game. Play of larger fields so Rohit get tired of running and hit sixes,2
J.P. Duminy has a strange combination of a Saffer and Indian accent.,3
Seems this year will be the end for Kuldeep  chances in Indian t20 team .,1
[deleted],4
Tiwary playing like dhoni,6
Why isn't Morgan captaining KKR?,-1
Ashwin will be happy that his replacement is getting whacked,2
Rohit seems so annoyed every time he has to run,5
Rohit=FatMan=Nuclear Bomb,2
"Tiwary doing a good job here, not taking IP dots, giving strike to rohit",1
Don't fucking take a single Tiwary,4
Brohit wants to smash Kuldeep all the way back to Mumbai,2
When and what was peak kuldeep?,3
Rohit would be walking these singles if he could,3
Looks like Dhoni gave his tips to Tiwary as well,3
Ye passport size cheerleaders ka kya point hai,3
Ok this was a very expensive over for KKR.,1
Saurabh Tiwari could eat yashasvi jaiswal for lunch,2
"Tiwary the true successor of dhoni, he's taking it deep",6
No timing only slogging Tiwari 😂,2
The crowd seems to love inside edged singles more than sixes,8
"Tiwary fucking hit or gtfo. 

The fuck are you doing.",5
Tiwary’s head looks photoshopped on his body!,5
I feel so sorry for kuldeep,1
Lmao Tiwary running between wickets looks exactly like fall guys character running towards finish line.,11
Is Tiwary a giant?,3
KulDEEP INTO THE STANDS MIRITE,3
I wouldve loved to see hardik instead of tiwary,9
Should have bowled Rana at least once,1
"Dk is clueless, maybe some one should remind him that he is captain",12
Narine hattrick coming in.,3
The only reason Kuldeep is in the India XI is bc of the chinaman,7
"Won't the organizers be embarrassed to see someone like a Tiwary play? It's a bad, bad advertisement for the product.",-1
"Tiwari needs to go big now, run a ball doesn't work.",4
He took the single lmao,2
Mi should send Bumrah next. Force Rohit to go into Super -Saiyan mode and not rely on the batsman on the other end.,5
"lala is like, either I'll hit a boundary or I'll die trying because no way in hell I'm running for twos again.",6
Is tiwari auditioning for the test team?,2
"no need to be so angry on tiwari, the guy is trying to take singles and give strike to rohit and the mans doing his job",9
"Just like Dhoni motivating Faf yesterday

Tiwari doing it for Rohit",6
Watching Rohit's belly jiggle and ripple in slow when he hits a six is getting to me too much for me.,30
"Rohit is the ideal male body.  You may not like it, but this is what peak performance looks like.",97
With Dhoni not longer around. I don't see Kuldeep in our limited overs set-up for very long. His confidence is down. Gambhir handled him really well. He needs a good captain.,6
That Engage ad is just trash.,3
In literally every season there is 1 game where Rohit smashes up KKR and gets atleast 50 against them,3
Kuldeep's form really nosedived!!,1
rohit to tiwary: Oh maar le bhai,2
The beauty of big grounds. You need the footwork to hit sixes.,2
Did they remove the dub from the MRF ad ?,1
Commentators sucking up to Ambanis,1
Finally cumdog,-2
Anyone else got the salman khan advertisement of underwear.,2
Tiwary rotated strike what's wrong,1
Tiwari looks like he ate Rohit Sharma accidentally,8
Cummon Cummo,2
How to did that go for a boundary,3
A night of Chungus,4
[removed],10
DK forced to introduce his part timer medium pacer.,5
Imagine getting hit for a four by Tiwary,10
Looks like Cummins took the most expensive player tag the wrong way,96
"Tiwary - 1
r/cricket - 0",18
"**Most sixes in IPL**

Gayle - 326

AB de Villiers - 214

MS Dhoni - 212

**Rohit - 200**

**Most 6s by Indian in IPL**

Dhoni - 212

**Rohit - 200**

Raina - 194

Kohli - 190",5
"DK after this match: consider me as retired from 00:00 hrs

But honestly he's a crazy finisher. Better give captaincy to morgs and focus on batting.",3
"Shaadi.com offer is so weird

I want to find a non creepy person who i can spend the rest of my life with but please 10 taka discount milega?",5
You know someone is bad when Tiwari smacks them for 4,3
Never would have thought I would see Tiwary smashing Cummins what the fuck.,9
"Ngl Cummins is one good looking man

No homo",6
Sourabh is on next level,2
Tiwari smashing cumdog even archer wouldn't have tweeted it,8
What a shot by Tiwary,1
Cummins getting slammed by Tiwari. What a day!,10
15 crores,3
Tymal mills ultra Pro max,5
Tiwary trolling the whole subreddit lmao,2
My god what a shot Tiwari !!!,3
Lol. Saurabh Tiwary smashing an Aussie Millionaire,5
lmao,-1
"Take thatttt. Finally. 

Go on Tiwary!",5
Lmao Toward giving it back,1
Thicc power from Tiwary,2
What a six. Rohit would be proud of that shot.,3
KKR counting their losses already,4
"Talk r/Cricket. Talk or I will sit on your face. 
-Tiwari",12
Tiwari: fuck off r/cricket,9
Tiwariii,2
15cr getting hit by potato,11
Chad chonk Tiwary vs Virgin Cummi,11
15.5 crore,9
"Tiwari: r/cricket yeah, nah",4
Patrick Unadkat,10
Karthik is a bottom 3 captain in IPL for sure,2
tiwary hitting so the people here stop crying after he rotates strike,3
Tiwary was just waiting to target Cummins the absolute maverick,8
This is what tiwary should be doing,5
Why Lynn not playing?,3
r/cricket in shambles,8
Mega Vada Pav popping off,4
Saurabh Tiwary rolling back the years,6
Tiwary heard r/cricket talking shit about him,12
WHAT THE FUCK DID I JUST SEE?? Holy fuck that's soo good,6
Has Tiwari lost 10 kgs since the previous match?,1
Even Tiwary can't believe that,2
KKR should have paid Tiwary all you can eat for an year than 3 million on Cummins,6
I was honestly hoping that RCB dsnt get pat Cummins. So glad,5
"""Mote hain toh kya hua? Gaand toh phaad hi sakte hain.""

–Tiwary, 2020",8
Is Tiwary actually taking on Cummins of all people? Color me surprised,8
Mccullum shoul've just bought Mark Wood for 50 L instead of wasting 15 crores on Cummins,5
"Another day, another ""fuck r/cricket"" statement by Tiwari",9
"Lmao Pat Cummins getting smashed by Saurabh Tiwari, this is a nightmare for him.",2
Saurabh Tiwary is an absolute unit.,4
Let's be honest. Cummins hasn't even been Australia's best LOI bowler and this thrashing isn't exactly surprising.,5
"""saurabh tiwari naujawan ye khiladi"", koi ncb bhejo madarchod commentary box me",5
"**If Pat Cummins play 14 matches**

For each match it costs KKR 11 million to bowl 4 overs. 

Each over costs KKR 2.77 million

Each ball costs KKR 460k",1
Costly bowlers at the auction have also been costly on the field.,2
Look how they massacred my boy... :(,3
Cummins getting the Unadkat treatment,5
Cummins dishing pies and Tiwary is so happy eating them up,3
What's with these Jharkand players taking so long to set and hitting sixes once set,3
Whoa! You don't casually straight drive Cummins for six like that!,3
"Out of all the bowlers, Tiwary chose to cunt the no.1
ranked test bowler.",7
15 crore too many,1
[deleted],3
Tymal Mills part 2,3
"Happy to see saurabh tiwary do well.

He and Tirumalasetti Suman were my favorite ipl only players",5
15 crores was always too expensive for a bowler who hasn't been good in T20s,8
"KKR saved 3 Cummins overs for the death 😂🤣
They've apparently not seen Cummins bowl at the death",8
DK has been running up the pitch more than the batsmen have,3
"JP Duminy was so underutilised in IPL, he had a great record.",2
[deleted],4
If they wanted to waste 15 crores they should have just donated it to PM CARE FUNDS,6
Virgin 17 crores Flat Cummins vs Chad 50 lakhs Thicc Sourabh Tiwary,17
Why not bring Mavi and try breaking the partnership? He was doing great.,4
Are you even allowed to hit a six like that ? Tiwari you mad Rhyno !,2
"Beautiful shot by Tiwary

Morgan's nowhere to be seen, he should be in inner circle and talk to bowlers atleast",2
"Cummins has come off some international cricket, He is prepared to be thrashed in IPL after being thrashed by Australia lol",0
You guys can watch on twitch also,2
"That 6 will definitely hurt r/cricket's feelings. 

Darling smacked with disdain.",11
Cummins to bowl short to Brohit again??,3
"Knew since day 1 pat cummins is NOT a t20 bowler. Being quick and a Aussie these days is a guaranteed ipl gig. Remind me, how many t20 world cups have they one ? Have they even been to a final",7
Imagine being the best bowler in the world and getting carted around by fucking Sourabh Tiwary.,7
They paid 15 cr for cummins to promote tiwary's career,2
Shut up with the dhoni comparison. DHONI <<<<< TIWARI,3
"Cummins is good but not quite Rabada!

Also Cummins vs Rohit is 2 million vs 2 million.",5
"Cumdog seems out of form atm, he was shit in the series vs us too",5
Is it poor communication or bad execution or a mix of both? Or is it just dk doing his thing?,2
This partnership is a big fuck you to Fit India,32
Cummins is magna cum laude graduate of the Dinda academy of IPL fast bowling.,5
Just a single? Wtf lmao.,2
"MI is the best team on paper. KKR are my favorite team eleven on paper. 

I hope KKR would make the simple decision of batting Russell at 4. You give him enough balls instead of wasting him down the order, you can reach reach the moon. Tooooo explosively consistent to be coming out to bat with like 5 overs left.

They have enough batting strength to do well if he happens to get out cheaply with a few  overs left so there is no risk. I feel teams play too ridgedly with their big hitters who they have labeled as pure finishers in their head. Especially when they are in great form like he was last year.",3
What must be going through the heads of the keyboard warriors who were criticizing Tiwary a moment ago?,6
Does anyone know how much Saurabh Tiwary was paid?,8
Why is Cummins bowling three on the trot??? Bad captaincy,3
Theres nothing I enjoy more than watching big units smash the ball out the park,3
That six from Tiwary was a really good shot,3
69 sixes in this ipl,9
KKR are fucked ... good luck chasing 220,2
Why does James Pattinson look like the youtuber gatis Kandis??,3
The delayed crowd noise is so hilarious,7
We've never played MI very good and 100 other things to tell yourself :DK probably now,5
My man can truffle shuffle the ball to the boundary,1
Our food budget will be through the roof tonight having to restock the guts of our 2 big units in the middle.,2
"""**THAT IS SO GOOD**....but just one.""",11
This ball is gonna be boundary or out,4
"Kkr expects to win with DK as captain   
DK is a good finisher, but not a captain material",5
"Tiwary : Yea, Talk r/cricket nah",17
Millionaire vs local vadapav eaters,2
"Others hitting Cummins for six is okay, but normalcy won't be completely restored until bumrah hits him for a six and maintains his strike rate",5
"Kkr need to play lockie Ferguson, dude was amazing in the wc. Unplayable in the final and semis",12
KKR Bowlers be like ERROR 404 Yorker file not found,5
What do coaches write after every delivery?,7
Rohit is like trying random button combos in cricket 2007 right now,22
How much money did they pay for Cummins?,8
Imagine having the world cup winning captain in your team and making fucking Dinesh Kartik your captain.,30
When Mi wins they’ll say Ambani has done it again. Watch,4
How much did kkr pay for CumDog?,2
That 15 crore was the worst deal ever.,8
I just love mumbai batsmen are treating Cummins just like a club bowler he is,8
Lol the crowd noise,2
"Saurabh Tiwary this IPL

Hits the first six

Hits the 69th six",30
KKR has even worse attack than RCB,7
Has any expensive bowler delivered in ipl ever ?,2
Cummins making sure he doesn't get another game.,5
Can we just stop with  Dinda jokes and Fat jokes?,6
Kkr's bowling is weaker then rcb.,3
Are the NZ and Australian players struggling in UAE?,1
Fielder : slips .... Fake Crowd : Aaaaaaaa,2
Commentators talking about Tiwary like they remembered his existence before this week lmao,12
Hit every ball now with the batting that is still to go.,4
Tiwary just did a Smith there. To a Yorker,1
15 crores - 15 runs each over!,3
Cummins has bowled two overs but he looks like he's at the end of his second 8 over spell of the day.,6
Why are they being mean to Dhawan in the ad :(,4
Why is Mavi not bowling?,0
Tiwari is running first fast... Like rohit is gonna run quick double,1
KKR should play Ali Khan. That guy is brilliant in death overs.,2
"KKR,  Just dont get tiwary out now",1
"cummins 2 overs 30 runs

*paise barbaad behenchod.jpg*",3
MI don't like to waste that firepower,2
"Hey guys, new cricket fan here. I've been told that Cummins is the best bowlman in the world? Is my friend winding me up because he looks very, very shit against that fat batting man?",3
15cr going for 15er,5
"15 crore to concede 15 runs every over, simple math for you",12
I think Tiwary is doing more than decent job tonight. His main purpose was to give rohit strike and he's also atleast hitting and not giving away his wicket.,3
I am low key liking these Dream11 ads,3
15 runs per over for 15 crores - The Art of Deal -> STONKS,21
Brohit,2
Cummins is bowling short and doesn't look like he is gonna get wickets,2
Tiwary showing that he is the best player from Jharkhand this season.,6
guys i think pat cummins thought he had to give 15 every over because he got paid 15 cr,9
do yall reckon cummins is tired from the ausveng series and needs some rest?,4
"Cummins: First over - 15 & Second over - 15

Too big a coincidence",2
Someone please make me understand. Why isn't Eoin Morgan the captain?,2
"Is there anything for the bowlers on the pitch? What is this? A road? Not a KKR fan, But you just have to feel for the bowlers. There's nothing much they can do.",4
Both these dudes can’t run between the wickets at all. Tiwary should hit boundaries or get out while trying. 5 overs is just enough for hardik and pollard to make a difference,1
Only people who don't know Suarbah Tiwary are surprised by Saurabh Tiwary,5
Anyone know if the Dugout stream on Hotstar is copied from another sport? Anyone even watch the Dugout stream?,1
Tiwary showing the world you might have a chad body like Cummins but Fat holds more energy,5
[deleted],8
lmao gayle beating out most sixes by 100,12
Cummins has a fundamental issue I think he finds it difficult to bowl fuller,4
"Pat ""15 crore"" Cummins with a economy of 15.",7
Worst part is that DK is not having conversations with bowlers,4
Imagine getting 2lakhs in bank account for every six you give .,2
I've got the song Urvashi stuck in my head for the past two days because of the stupid pharm easy ad,7
Talk r/Cricket talk nah,-9
Pandya party time now,2
Oh man Tiwary looks like snorlax,17
