Timestamp,Username,Comment,Upvotes
2020-10-27T14:52:00+00:00,,what the actual fuck is this field placing? it's like we're fielding with 5 guys in total.,4
2020-10-27T14:52:00+00:00,Simple-Neck,Saha's placement has been Godly.,2
2020-10-27T14:52:01+00:00,flabbyboggart,I am speechless at how fluently Saha is playing all these shots today.,6
2020-10-27T14:52:05+00:00,Here4deepfakes,Why do I cringe everytime Sanjay Bangar speaks,0
2020-10-27T14:52:06+00:00,funnyBatman,Ok Saha has been brilliant,0
2020-10-27T14:52:06+00:00,,Saha already injured?,1
2020-10-27T14:52:06+00:00,sam_ridhi,Is this pitch really good for batting?,5
2020-10-27T14:52:07+00:00,KahaniGharGharKi,Saha's placement is fucking insane,9
2020-10-27T14:52:09+00:00,kurtailed,Saha's timing in this innings >>>>>,8
2020-10-27T14:52:10+00:00,Truthgamer2,This isn’t the SRH I know playing tonight,2
2020-10-27T14:52:12+00:00,RemarkableInvestment,Saha is in golden touch today. He is touching the ball and it is going to boundary,4
2020-10-27T14:52:14+00:00,,"God-Damn, look at those ground shots into the gaps ahhhhhhh",6
2020-10-27T14:52:16+00:00,WhoIsYou1,You know the field set is shit when they have already ran 3 runs 3 times already,4
2020-10-27T14:52:16+00:00,1234hrishipai,So where was this SRH all along?????,6
2020-10-27T14:52:17+00:00,Shubh_K30,"Indian team selectors after Saha's innings:

*Emergency Meeting",11
2020-10-27T14:52:17+00:00,ShitsAndGigglesSake,Wow... Great job keeping the momentum... I was not expecting run rate to keep steady beyond 6 overs,1
2020-10-27T14:52:20+00:00,Siondroms,Bowl to the fuckinh field you idiots,3
2020-10-27T14:52:20+00:00,KunwarBIR,Oooo.... What happened.... Hopefully nothing serious.,1
2020-10-27T14:52:21+00:00,123twiglets,"Running 3s when some wouldn't even go for the 2, love that energy",4
2020-10-27T14:52:22+00:00,,Saha and injuries. Name a better duo,1
2020-10-27T14:52:22+00:00,Naan6,Saha despite being a decade older seems so much more fitter than pant. Kinda embarassing for pant tbh,3
2020-10-27T14:52:22+00:00,joeispunk,Oh please don't be injured. We have no backup WK,2
2020-10-27T14:52:24+00:00,sxd827,Saha is on fire! Finding gaps like prime Tendulkar.,5
2020-10-27T14:52:25+00:00,TheFirstLane,Okay this pitch ain't slowing down. DC has a chance.,3
2020-10-27T14:52:26+00:00,Lionheart008,I see no fielders on the ground at the moment. Just some swimmers testing the dew,8
2020-10-27T14:52:27+00:00,,141 in 12 overs. Am I dreaming??,5
2020-10-27T14:52:31+00:00,,This innings reminds me of his century in 2014 final,4
2020-10-27T14:52:34+00:00,N2nalin,I'll have what Saha is having...,7
2020-10-27T14:52:37+00:00,adyfbi,Ok now this is too much saha,2
2020-10-27T14:52:39+00:00,zambur-e-bahar,Saha can't play no more safety first,4
2020-10-27T14:52:39+00:00,anuraag09,"DC's lack of wristspinner costing them 
 
Sandeep may play the next match",0
2020-10-27T14:52:40+00:00,NachoDipper,so in T20 you should double your score at over 12 yeah? SRH to make 280 this match?,8
2020-10-27T14:52:43+00:00,singhsrb,How has Ponting not eaten one of these folks alive  yet?,2
2020-10-27T14:52:44+00:00,afex1808,SAHA IS 36 YEARS OLD???,18
2020-10-27T14:52:44+00:00,wrongorderagain,Just checking in... what happened here? Are delhi not playing with any bowling?,3
2020-10-27T14:52:45+00:00,udayEm,Saha needs to keep too. Hope he departs quick if he isn't that fit ATM.,4
2020-10-27T14:52:45+00:00,kapilfan,"r/Cricket - 

initiating apology sequence ...

Replace batsman “XYZ” with “Saha”
Rerun program",26
2020-10-27T14:52:49+00:00,rednarutopokemongo,"When Dhoni gave the same pose, everyone was like 'Bahubali' Thala!

Let's see how they react after seeing Saha!",19
2020-10-27T14:52:52+00:00,thepokemonchef,Do well then get injured? Summarizes the season for us.,9
2020-10-27T14:53:01+00:00,DilliKaLadka,Enough runs already on board. And still 8 more overs to go. FML,4
2020-10-27T14:53:04+00:00,SexxyBlack,"DC bowling getting destroyed by Nitish Rana, Sunil Narine and now Saha, I did not see that coming.",4
2020-10-27T14:53:05+00:00,,Someone get started on the Saha apology thred now.,8
2020-10-27T14:53:06+00:00,,Saha:- only scores in big games,8
2020-10-27T14:53:06+00:00,Shubh_K30,"Indian team selectors after Saha's innings:

*Emergency Meeting",26
2020-10-27T14:53:10+00:00,PlsDontBraidMyBeard,That's nazar yo!,0
2020-10-27T14:53:11+00:00,,"Axar destroyed.

Who is left now??",0
2020-10-27T14:53:15+00:00,massconstellation,saha almost single-handedly destroying the econs of the dc bowlers,9
2020-10-27T14:53:15+00:00,theturtlefrommidgard,Noooo Saha please be okay,7
2020-10-27T14:53:19+00:00,tonight_we_make_soap,Wow SRH is past its normal 2nd innings score and there's still about 9 overs left.,9
2020-10-27T14:53:22+00:00,Truthgamer2,And that’s a 15 run over,4
2020-10-27T14:53:22+00:00,Fabulous-Rice,They say you are supposed to double the score at 12 overs. So 280 it is.,20
2020-10-27T14:53:30+00:00,fuckthisshit0102,Imagine Saha now goes into another gear because he can't run.,24
2020-10-27T14:53:37+00:00,,"Looks like Ashwin has taken his KXIP experience to DC - win 4 to 5 matches in the beginning, get cunted to hell after",3
2020-10-27T14:53:40+00:00,WeaponX23X,Bring Lara the lucky charm in dugout asap,2
2020-10-27T14:53:41+00:00,amitbhatt25,IPL 2014 Final heroes batting together,64
2020-10-27T14:53:42+00:00,,DC to do reverse KXIP,12
2020-10-27T14:53:44+00:00,,This is what I expected from Trevor Baylis’s team.,9
2020-10-27T14:53:47+00:00,,[deleted],12
2020-10-27T14:53:49+00:00,,Saha is an excellent player of spin. Bairstow struggled and struggled and struggled. This is why I felt we should have been more open to Saha and Sreevats. Saha has a good strike rate in powerplay and can regulate the middle overs.,10
2020-10-27T14:53:55+00:00,fookin_legund,Gayle broke DC that day,28
2020-10-27T14:53:55+00:00,NachoDipper,If saha can transition from tests to t20 then why can't rahane,23
2020-10-27T14:53:57+00:00,massconstellation,guessing pandey is there for moral support,10
2020-10-27T14:53:58+00:00,Lazy_Left_Eye,The same team choked last match by losing 7 wickets in 14 runs.,23
2020-10-27T14:53:59+00:00,SnoopDogg_Official,Ponting finna pull out that spring bat from 2003,9
2020-10-27T14:54:00+00:00,_gadgetFreak,I mean these 2 now can literally go at every ball considering just 1 wicket is lost amd Williamson is yet to come.,10
2020-10-27T14:54:09+00:00,dracarysmafu,Where are you Saha haters,2
2020-10-27T14:54:11+00:00,,"Question: if you WK goes unfit through half time, can you get a substitute WK like you do with fielders?",2
2020-10-27T14:54:11+00:00,Transitionals,Delhi is missing someone like Harshal Patel who can bowl lot of variations.,2
2020-10-27T14:54:13+00:00,jeeverz,"Oh no, Rabada is about to get rocked",2
2020-10-27T14:54:13+00:00,toothpaste4dinnr,hooolllyy crap saha rolling back the years this is absolutely sparkling batting diwali came early,4
2020-10-27T14:54:16+00:00,N2nalin,Saha be playing like Cricket 07...,28
2020-10-27T14:54:21+00:00,Perfectstranger01,DC. Hey hey hey. Goodbye.,7
2020-10-27T14:54:23+00:00,lifeofpaiii,Pant should be the most worried now,6
2020-10-27T14:54:23+00:00,,In before apology thread for Saha,14
2020-10-27T14:54:24+00:00,lonelyisIand,rabada 37 runs conceded I can’t believe my eyes,10
2020-10-27T14:54:28+00:00,doomxiv,My catch: David and saha were too scared of pandey playing and a 50 s/r ..... /s,6
2020-10-27T14:54:28+00:00,abhi8192,Seriously missing mishraji today. He comes good under pressure while ashwin crumbles.,5
2020-10-27T14:54:37+00:00,GlitchPro27,This is gonna fuck up our NRR so much that if we won't even make it on NRR anymore. Delhi batsmen can't chase this. They panic too quickly.,5
2020-10-27T14:54:44+00:00,Simple-Neck,Rabada going at 20 RR is unreal.,5
2020-10-27T14:54:44+00:00,wrongorderagain,Wooo rabada 2 over 37.  Who cunted him?,7
2020-10-27T14:54:46+00:00,_fml_420,rabada's 50 today?,6
2020-10-27T14:54:51+00:00,Here4deepfakes,Sanjay Bangar is no good than Kapil dev here. Says every generic thing possible,3
2020-10-27T14:54:51+00:00,LightningStrikes321,Hopefully we can beat RCB cuz we sure as hell ain’t going top 2 without that,3
2020-10-27T14:54:52+00:00,zambur-e-bahar,Wickets incoming,0
2020-10-27T14:54:53+00:00,BeautifulEar9857,Looks like Ponting played all his aces in 1st half of the tournament.,5
2020-10-27T14:54:55+00:00,mnking8,Is thampi worst than khaleel ?,3
2020-10-27T14:54:56+00:00,gr8astardd,I have a gut feeling Rashid is gonna get cunted today,2
2020-10-27T14:54:56+00:00,singhsrb,Can we just get 50 all out now so that the more deserving teams can make the playoff and I can skip the last 2 games? Thanks!,3
2020-10-27T14:54:58+00:00,Anurag6502,Wait WTF? Rabada went for 37 in 2?!,16
2020-10-27T14:54:59+00:00,Siondroms,Rabada redemption over?,1
2020-10-27T14:55:00+00:00,DilliKaLadka,Why is SRH even doing this. They aren't going to make it anyways. Baksh do yaaro,-5
2020-10-27T14:55:00+00:00,,"Saha pls don't play too well, CSK already calling your phone",6
2020-10-27T14:55:00+00:00,,Excited to see what kind of batting DC is gonna pull off.,7
2020-10-27T14:55:08+00:00,bunnyoverkill,"You're being listened to whether you want it or not. Is that unsettling, or reassuring?",3
2020-10-27T14:55:10+00:00,abstergofkurslf,Possible 250?,12
2020-10-27T14:55:13+00:00,SilentCaveat,"Honestly, it's therapeutic to see DC bowlers getting smashed around",26
2020-10-27T14:55:22+00:00,sdasu,SRH 114 allout in 19.5 last match. Today 113/1 in 10.0,28
2020-10-27T14:55:25+00:00,Lionheart008,Rabada and Nortje are good in death overs. Should be able to restrict them under 200.,2
2020-10-27T14:55:27+00:00,GiraffeDependant,Can Rabada top Saini's 3 over 48? Lessfindout,7
2020-10-27T14:55:36+00:00,harsh1387,To top it off this is the match where we needed Shaw's explosive opening and we got Rahane :(,7
2020-10-27T14:55:36+00:00,theredguardx,Khaleel creepy af,12
2020-10-27T14:55:36+00:00,Transitionals,Jonny BairSaha,10
2020-10-27T14:55:41+00:00,anuraag09,"Pant really having a bad week 
 
Now saha scoring runs may even cost him his test spot",7
2020-10-27T14:55:43+00:00,wonderwoman0621,"SRH’s fans be like

Cause you're hot then you're cold

You're yes then you're no

You're in then you're out

You're up then you're down

You're wrong when it's right

It's black and it's white

We fight, we break up

We kiss, we make up",11
2020-10-27T14:55:51+00:00,KrteyuPillai,"This is a sunrisers I can root for. They aren't playing boring anymore, I like aggressive srh",19
2020-10-27T14:56:02+00:00,Lazy_Left_Eye,"36 Y.O. Saha running 2's like Kohli. Given, the fielder was Ashwin, but still good fitness from him.",3
2020-10-27T14:56:05+00:00,fieztel,SRH have nothing to lose. Hence the beyond the world intent,2
2020-10-27T14:56:09+00:00,cherry0079,Just checked the scores wtf is happening? I FREAKING LOVE THE SCRIPT WRITERS.,1
2020-10-27T14:56:12+00:00,chut_has_no_religion,ethical mind™ on ball's radar.,0
2020-10-27T14:56:12+00:00,Siondroms,RUN and catch it ethics,0
2020-10-27T14:56:16+00:00,,It's actually a perfect opportunity for Pant to play his natural game without any burden.,0
2020-10-27T14:56:17+00:00,zambur-e-bahar,Jaane waale hain dono,-1
2020-10-27T14:56:17+00:00,Krs1218,"Pandey has to go aggressive too, Kane’s next up and he anchor if need be",5
2020-10-27T14:56:21+00:00,,Haha Injury Premier League go brrrrr,5
2020-10-27T14:56:23+00:00,,Saha for a ton,5
2020-10-27T14:56:28+00:00,loki_made_the_mask,"Projected: 237

Me who is obsessed with The Shining: nice",4
2020-10-27T14:56:30+00:00,,Saha bhai kya kha liye ho,5
2020-10-27T14:56:37+00:00,mammary_man,Woah just tuning in WTF happened? No Johnny? Saha is playing well?! WTF,5
2020-10-27T14:56:45+00:00,,"Wicket tegiro nimmoun!  
  
T: Please sire, pick a wicket soon.",4
2020-10-27T14:56:45+00:00,catinho99,How to hit in the air and not get caught by Saha,2
2020-10-27T14:56:49+00:00,JustStrolling_,Still don't understand the choice to send out Pandey. Wouldn't Pandey be a better finisher than Williamson?,2
2020-10-27T14:56:49+00:00,NachoDipper,Hope Saha gets a century to put the nail in our coffin,5
2020-10-27T14:56:55+00:00,DilliKaLadka,Not a single bouncer or yorker from Rabada so far. His brain stopped working completely,6
2020-10-27T14:56:57+00:00,ritwika96,Binga doesn’t seem like himself which is understandable but sad 😞,1
2020-10-27T14:57:00+00:00,Fabulous-Rice,Saha has to keep wickets. He better retire and take rest now.,2
2020-10-27T14:57:04+00:00,drsb13,Umpire looks badass,1
2020-10-27T14:57:06+00:00,,Pant is 23 and Saha is 36. I bet Pant would have rejected half of the running that Saha did today.,6
2020-10-27T14:57:07+00:00,,[removed],20
2020-10-27T14:57:12+00:00,SnoopDogg_Official,I predicted 152/1 in 13,1
2020-10-27T14:57:14+00:00,saumya5,Where are the fielders????,3
2020-10-27T14:57:15+00:00,TheAR69,Send Rashid in next you cowards.,3
2020-10-27T14:57:15+00:00,gr8astardd,What’s the average on this pitch?,2
2020-10-27T14:57:18+00:00,kishore2521,Even his shoulder hits a four.,3
2020-10-27T14:57:20+00:00,,Which stadium is this one??,7
2020-10-27T14:57:21+00:00,Here4deepfakes,Sanjay Bangar will fit right into r/increasinglyverbose,6
2020-10-27T14:57:26+00:00,srtxtt7,Rabada to  go wicketless today?,4
2020-10-27T14:57:26+00:00,deep639,Please send samad in next.,5
2020-10-27T14:57:26+00:00,bowlbat,Benchod doesn't even require a bat anymore.,8
2020-10-27T14:57:27+00:00,singhsrb,Our spinners don’t turn the ball. We saw how Varun ripped us a new one last match. I expect nothing less from Rashid.,2
2020-10-27T14:57:30+00:00,Lionheart008,God mode activated,3
2020-10-27T14:57:30+00:00,NachoDipper,"what does that mean, why would Saha pick his ""bat up in anger""?",3
2020-10-27T14:57:34+00:00,,Pandey SR watch: 150,3
2020-10-27T14:57:35+00:00,WhoIsYou1,Can Rabada top Rajpoot's 4 over 60 runs tho?,8
2020-10-27T14:57:36+00:00,ddhenier,Just tuned in AND WHAT THE FUCK SAHA,8
2020-10-27T14:57:38+00:00,massconstellation,FOUR LEG BYES WTF,3
2020-10-27T14:57:40+00:00,ItsSuplexCity,"I am predicting a collapse of the delhi innings under 100. They will try to do what warner and saha did, and fail miserably. 

The huge NRR hit will make this tournament more interesting where delhi might struggle even to stay in top 4.",6
2020-10-27T14:57:41+00:00,,First six,3
2020-10-27T14:57:45+00:00,Silly-Point,150 up in the 13th over. Madness.,5
2020-10-27T14:57:45+00:00,Naan6,Saha- Made of steel,5
2020-10-27T14:57:48+00:00,KunwarBIR,Ahhhh.... That SOUND!!!!,3
2020-10-27T14:57:49+00:00,udayEm,Em aadtunnadu ayya Saaha.,3
2020-10-27T14:57:52+00:00,peter_griffins,YJB isnt getting back,3
2020-10-27T14:57:52+00:00,,"Shit Saha turned 36 and is playing well, CSK's young talent  scouting team would bid for him now",16
2020-10-27T14:57:53+00:00,amitbhatt25,Saha smacking Rabada unbelievable,4
2020-10-27T14:57:53+00:00,Assraj,Where the fuck are the fielders lmao,6
2020-10-27T14:57:53+00:00,flabbyboggart,"David Warner has now scored 57 runs against Rabada in IPL. He is 
the only batsman to score 50-plus runs against Rabada in IPL.

\- Via Twitter",8
2020-10-27T14:57:54+00:00,AnantShrestthPajaMaN,"At this rate,  I wouldn't be surprised if Ponting comes out to open and actually wins the match with an unbeaten 140(57) something.",11
2020-10-27T14:57:58+00:00,Truthgamer2,Beautiful shot,1
2020-10-27T14:57:58+00:00,,SRH got offended when people started saying DC has the best bowling side,8
2020-10-27T14:57:59+00:00,dracarysmafu,Saha has decided to give his mind and body for this match,4
2020-10-27T14:58:01+00:00,,[deleted],1
2020-10-27T14:58:02+00:00,Naan6,Rabada who??,5
2020-10-27T14:58:03+00:00,TheFirstLane,That sound off the bat was so sexy.,2
2020-10-27T14:58:03+00:00,harsh1387,Have DC bowlers completely forgotten how to bowl Yorkers and slow balls.. what with this short pitch bowling..,2
2020-10-27T14:58:03+00:00,anuraag09,The sheer disrespect to purple cap holder lmao,5
2020-10-27T14:58:04+00:00,WeaponX23X,Saha has a 20 ball century in domestic game,2
2020-10-27T14:58:05+00:00,calmiswar,"Fuark, never seen this side of Saha before.",1
2020-10-27T14:58:05+00:00,bunnyoverkill,"Inb4 Saha gets a call up for t20is, ultimate dunk on Pant Boi",2
2020-10-27T14:58:06+00:00,Psychological_Dust30,Can't believe ranada has been hit for 47 in three overs. What a shot from Saha though!,2
2020-10-27T14:58:06+00:00,,[deleted],6
2020-10-27T14:58:06+00:00,_gadgetFreak,Where the hell the fielders are standing,2
2020-10-27T14:58:08+00:00,,Cant believe its only been 13 overs.,4
2020-10-27T14:58:09+00:00,,Scenes if Saha scores a 100 in his first match this IPL,5
2020-10-27T14:58:09+00:00,JohnCenaThe46th,Lmao Saha who hurt you,3
2020-10-27T14:58:10+00:00,adyfbi,Saha >>> AB using even his shoulders to hit 4s,5
2020-10-27T14:58:11+00:00,neelhere,Holy guacamole! What a shot,3
2020-10-27T14:58:11+00:00,TheAR69,Why is there no deep mid wicket? Wtf Iyer,2
2020-10-27T14:58:13+00:00,Noopspow,Fuck me... DC were looking invincible 3 games ago...,8
2020-10-27T14:58:14+00:00,rednarutopokemongo,Ajinkya Rahane dreams that he can bat like Saha one day!,11
2020-10-27T14:58:14+00:00,,what a sexxyyyy shot,5
2020-10-27T14:58:15+00:00,udayEm,That's a six ffs,5
2020-10-27T14:58:16+00:00,joeispunk,Iyer usually had the luxury of saving up 2-3 Rabada overs for the death. This counter attack has forced him to use Rabada up top. This is a blueprint for other teams to try and get DC now.,11
2020-10-27T14:58:19+00:00,sahit24,That sound. That damn sound it made.,6
2020-10-27T14:58:21+00:00,Ok-Rip-7206,DC lost the top team momentum,3
2020-10-27T14:58:21+00:00,theturtlefrommidgard,SAHA MY DUDE,6
2020-10-27T14:58:22+00:00,,Can we have second innings in Sharjah?,7
2020-10-27T14:58:22+00:00,bowlbat,Maro Altroz ko. Maro.,6
2020-10-27T14:58:25+00:00,theabhi16,Wtf happened to Saha lol,3
2020-10-27T14:58:25+00:00,sahib88,Iyer idli being destroyed by warner lg oled cardoons,5
2020-10-27T14:58:26+00:00,cherry0079,WTF? SAHA FUCKING RABADA. WOW.,11
2020-10-27T14:58:28+00:00,,Bruh Saha is in Hit or OUT mood. It could get really bad for DC,10
2020-10-27T14:58:29+00:00,darn_it_,Saha be like I score only 100 bitches,10
2020-10-27T14:58:31+00:00,shiftysoph,There are no fielders anywhere or what,2
2020-10-27T14:58:33+00:00,,"Saha be like ""idar aa rabada, tujhe purple cap deta hu""",8
2020-10-27T14:58:34+00:00,Lionheart008,Look how they massacred my boy,3
2020-10-27T14:58:34+00:00,Jy_sunny,Our Test keeper playing a more white ball innings than our LOI keepers,6
2020-10-27T14:58:35+00:00,,I think it's the bit of inexperienced fielding placement that's causing this,4
2020-10-27T14:58:38+00:00,c_dart,Serious big dick batting by Saha.,12
2020-10-27T14:58:38+00:00,Slippin_Jimmy1216,"Rooting for a **Saha Century** 

Hope I didn't jinx it.",11
2020-10-27T14:58:40+00:00,drunkamoeba,Wow. Never imagined Saha pulling Rabada for a 6.,7
2020-10-27T14:58:41+00:00,GiraffeDependant,Why does Saha sitting remind of Rayudu's potty break last game?,3
2020-10-27T14:58:43+00:00,,[deleted],3
2020-10-27T14:58:44+00:00,hidden_kid,How to make a best bowling line up look mediocre 101. Just three match this was one of the best bowling line up.,6
2020-10-27T14:58:45+00:00,Sicknit,Where did this power hitter come from all of a sudden,6
2020-10-27T14:58:46+00:00,h3mang,SAHA smashing Rabada. Woah!,7
2020-10-27T14:58:48+00:00,peter_griffins,"i'm predicting rcb beat mi, mi beat dc, dc beat rcb, all 3 lose to srh",4
2020-10-27T14:58:49+00:00,,[deleted],9
2020-10-27T14:58:52+00:00,LightningStrikes321,This team ain’t winning the cup that’s for sure,5
2020-10-27T14:58:54+00:00,JohnSeen1996,"Saha: "" What the fuck is Pant doing in Test squad let me end his career by thrashing Rabada 😎""",52
2020-10-27T14:58:54+00:00,w48rd8kb,Where are the fielders lmao,8
2020-10-27T14:59:03+00:00,ritwika96,"Honestly we don’t really deserve to be in the playoffs with the way we batted last game but let’s spoil the party for MI, DC and RCB",8
2020-10-27T14:59:05+00:00,Assraj,🚨Saha 100 watch🚨,1
2020-10-27T14:59:07+00:00,hidden_kid,LMAO DC choking even before playoff.,2
2020-10-27T14:59:10+00:00,HahaChaudhry,"If Saha scores a century today, I'll stop jacking off to him.",3
2020-10-27T14:59:12+00:00,NachoDipper,they had to sneak that Altroz ad in there lmao,6
2020-10-27T14:59:13+00:00,Shubh_K30,Just realized the two best performers of 2014 IPL final are batting together,6
2020-10-27T14:59:13+00:00,theabhi16,Scenes if Rabada gone for 60,5
2020-10-27T14:59:15+00:00,sam_ridhi,Dc not qualifying,1
2020-10-27T14:59:16+00:00,ramesh423,Btw what is IPL highest score ? 😎,3
2020-10-27T14:59:17+00:00,waltandhankdie,Are substitute fielders allowed to keep wicket? Asking for a friend,4
2020-10-27T14:59:19+00:00,kapilfan, 250 on cards? This is going to royally fuck DC NRR,3
2020-10-27T14:59:20+00:00,bond_bhai,"DC has MI and RCB matches. If they lose this, then their only hope is to get 2 points from RCB match.",1
2020-10-27T14:59:22+00:00,Simple-Neck,Saha to remove his mask and reveal it's Rohit Sharma post a crash diet all along,3
2020-10-27T14:59:22+00:00,,DC se *saha* ni jaa raha ab,6
2020-10-27T14:59:23+00:00,gungly,Saha schooled Rabada like a KG student.,9
2020-10-27T14:59:24+00:00,dexter_in_pajamas,"So every side has been cunted in this IPL, RR cunted MI, SRH (and KKR) cunted DC",2
2020-10-27T14:59:28+00:00,sahibosaurus,Aight imma head out,6
2020-10-27T14:59:28+00:00,,Saha displaying Big Dick Energy right there.,3
2020-10-27T14:59:28+00:00,phantom_97,Wtf has Saha been fed today,6
2020-10-27T14:59:30+00:00,Siondroms,"Rahane gets out on first ball

Ponting : fuck this team, give me the pads

Iyer : but..

Ponting : Did I stutter?

Ponting scores an unbeaten 120",21
2020-10-27T14:59:36+00:00,,Scenes if delhi doesn't make playoffs lmfaoo,5
2020-10-27T14:59:38+00:00,Zer0wned1,So are SRH not gonna retain Bairstow next season? Sad to see how things have become after last season but I hope he can do well at another team,3
2020-10-27T14:59:38+00:00,Truthgamer2,50 partnership,1
2020-10-27T14:59:39+00:00,,LMFAO 50 PARTNERSHIP WITH MANISH ON 7,7
2020-10-27T14:59:42+00:00,singhsrb,Who is this imposter they are calling Rabada now?,2
2020-10-27T14:59:43+00:00,KahaniGharGharKi,Stoinis 💆‍♂️,2
2020-10-27T14:59:44+00:00,sjajsn, Brain dead bowling from DC,4
2020-10-27T14:59:44+00:00,mattytmet,"YJB been given the chop then?

Saha better be giving plenty of 'yes Rash, nice Rash' behind the stumps to make up for him",12
2020-10-27T14:59:46+00:00,breakinb,Rabada's second half century this season.,3
2020-10-27T14:59:50+00:00,Lionheart008,Common Pandey. Play like you played against RR,8
2020-10-27T14:59:51+00:00,drunkamoeba,Delhi is chasing 240ish i believe.,5
2020-10-27T14:59:53+00:00,,Why is Delhi choking in this stage of the tournament? Are they really gonna let Saha score a century here?,6
2020-10-27T14:59:55+00:00,motasticosaurus,This is rather one sided. Delhi isn't winning this.,9
2020-10-27T14:59:57+00:00,KrteyuPillai,Kag going for 47 in 3 is so shocking to me,7
2020-10-27T14:59:58+00:00,,Imagine getting molested by a fragile old test specialist,2
2020-10-27T14:59:59+00:00,,20 off Stoins at least please,2
2020-10-27T15:00:01+00:00,Smurfiness,Feels like Pandey has been out there for so long but has only faced 5 balls.,9
2020-10-27T15:00:02+00:00,swingtothedrive,DC remaining games are against RCB and Mumbai. Could very well end up missing the top 4 at this rate lmao,8
2020-10-27T15:00:02+00:00,fuckthisshit0102,50 partnership of Saha with himself.,11
2020-10-27T15:00:03+00:00,Siondroms,0 yorkers in powerplay.....,1
2020-10-27T15:00:04+00:00,,[deleted],11
2020-10-27T15:00:06+00:00,Here4deepfakes,Aah Marcus Stoinis. The Marquee bowler,4
2020-10-27T15:00:12+00:00,Shubh_K30,"So this Saha guy is our exclusive Test batter and Manish Pandey is exclusively for LOIs?

That seems about right today",15
2020-10-27T15:00:13+00:00,GlitchPro27,So today's the day Rabada loses his at least one wicket each match streak.,7
2020-10-27T15:00:16+00:00,TheFirstLane,"Cmon Pandey ji, attack",1
2020-10-27T15:00:23+00:00,ddhenier,Delhi Capitals being closet chokers in the business end of the tournament,1
2020-10-27T15:00:23+00:00,joeispunk,Nobody jinx the 100,4
2020-10-27T15:00:24+00:00,,Inb/4 RCB copies SRH and opens with PP only to get 33(28) in return.,5
2020-10-27T15:00:24+00:00,IamPsyduck,Saha showing spark at a very young age.,8
2020-10-27T15:00:28+00:00,WhoIsYou1,This is straight up a massacre,2
2020-10-27T15:00:30+00:00,willyam_sexspeare,Get out please I am here for Kanos,1
2020-10-27T15:00:36+00:00,TyroshiSellsword,200+ and Dhawan is gona shit the bed!,2
2020-10-27T15:00:37+00:00,SuperFrankieLampard8,Big SRH fan. Moving to Hyderabad for new job in December. Pretty excited :D,5
2020-10-27T15:00:39+00:00,dexter_in_pajamas,"wriddhiman ""fuck u selectors"" saha",4
2020-10-27T15:00:39+00:00,ozzymandias26,Anything less than 220 is unacceptable,7
2020-10-27T15:00:40+00:00,harsh1387,Saha deserves a 💯..,6
2020-10-27T15:00:43+00:00,ShitsAndGigglesSake,50 off 20 partnership wtf!!,5
2020-10-27T15:00:45+00:00,leaderof13,"Wow warner and Saha surprised everyone today, good to see Delhi bowlers getting whacked",2
2020-10-27T15:00:48+00:00,mrexperimenter,There's a real possibility that MI/DC/RCB might miss out on a playoff spot now. No team has sealed a spot for playoffs yet.,4
2020-10-27T15:00:49+00:00,,"Are yall thinking what I’m thinking, a Saha century???",11
2020-10-27T15:00:52+00:00,anirudh1595,Rabada purple cap is the new Rahul orange cap,3
2020-10-27T15:00:54+00:00,catinho99,Saha looks like slimmer Abhishek upmanyu,5
