Timestamp,Username,Comment,Upvotes
2020-11-08T12:14:19+00:00,nouseridavailable,Letszooooo,6
2020-11-08T12:15:24+00:00,fieztel,Let's gooooooooooooooo boisss,2
2020-11-08T12:15:25+00:00,tapped_out_addict,Atb fans. Hope one y'all win the title,7
2020-11-08T12:16:10+00:00,soham_katkar13,Very neutral as an MI fan today. But I had predicted an MI vs DC final last year itself when CSK beat DC in the Q2. So let's see,5
2020-11-08T12:16:45+00:00,GlitchPro27,Almost time to find out if the pain gets prolonged til Tuesday or finally ends today.,10
2020-11-08T12:18:56+00:00,fieztel,Saha pleaaaase,8
2020-11-08T12:19:58+00:00,Rubberducky1239,"So finally its here, absolutely terrified. Its either gonna be the ending of Infinity War or Endgame",7
2020-11-08T12:20:52+00:00,sahibosaurus,"I'm just numb today. Having supported this Delhi side since the IPL began, it's just endless disappointment over and over.

I was at the ground when we lost by 146 runs. The humiliation over the second half of this season doesn't faze me. Today's inevitable loss will just be another page in the Delhi tragedy novel.

Just get it over with man. Just get it over with.",8
2020-11-08T12:22:08+00:00,,[deleted],6
2020-11-08T12:22:25+00:00,Proveit98,Let's fight it out over who gets to be crushed by the Mumbai Juggernaut in a couple days time!,3
2020-11-08T12:23:00+00:00,,Delhi fans have entered full reverse jinx mode after that MI defeat and now Im all paranoid cuz that’s the tactic we used to sneak into the playoffs. MI y u gotta beat em so hard ?,14
2020-11-08T12:23:53+00:00,,I’m still wondering how the hell did we make it to the penultimate match of the tournament? My mind still hasn’t sunk this in after that KXIP game.,38
2020-11-08T12:24:02+00:00,fieztel,"DC are like wounded lions now, they gonna crush us real hard.",10
2020-11-08T12:25:11+00:00,MotaBhai_Official,"supporting DC today, just incase we lose atleast DC gets their first trophy",10
2020-11-08T12:26:57+00:00,,"btw go check jonny bairstow insta stories, rain was pelting down",4
2020-11-08T12:27:09+00:00,Potato_McCarthy777,"Honestly, as a dc fan, I am content with what  the boys have done. The DC team is simply not experienced enough to win games in crunch situations as it happened against MI, as far as batting is concerned. Neither are they led by a legendary player (like Shane Warne for RR 2008) . Plus SRH has such nice guys playing for them that I would not mind if they end up winning today against my first choice side. At least then the finals will be interesting to watch!",3
2020-11-08T12:31:01+00:00,vinay47,STH are into reverse jinx mode again.,2
2020-11-08T12:31:06+00:00,OkWar7880,"Okay so on a side note, I read and research vedic astrology as a hobby. A lot of bogus going on in the name of astrology nowadays, but if genuinely studied with pure intentions in a non profitable manner then it can be quite helpful.

So I was seeing Kohli's Sun and Moon charts for this and the next year, and what surprised me is that the end of 2020 and the whole of 2021 is potentially supposed to be the best years of Kohli as a captain. There are extremely high chances of him winning a cup for his team, almost guaranteed you can say, which is rare to see in anything in astrology. However my guess is only one trophy, since I don't think his individual performances will be so great. But his captaincy is gonna be top notch and a lot of luck factor. Good news for Rcb fans/Indian fans. I would prefer the World t20 cup over IPL trophy though. 

Would want him to prove me wrong by performing really well as well 🤞",-5
2020-11-08T12:31:41+00:00,BoreHoRahaHaiYaar,"* Stoinis
* Dhawan
* Rahane
* Iyer
* Pant
* Hetmyer
* Axar
* Harshal/Tushar
* Rabada
* Ashwin
* Nortje

My 11 for DC today arranged according to their batting no

&#x200B;

What y'all think?",7
2020-11-08T12:34:33+00:00,,I swear SRH fans come early to the match threads only to reverse jinx their team.,21
2020-11-08T12:35:35+00:00,gr8astardd,Have a strong feeling Stoinis is gonna open alongside Dhawan today,18
2020-11-08T12:36:27+00:00,LightningStrikes321,No amount of reverse jinxing gonna work today SRH,28
2020-11-08T12:36:50+00:00,sahasamane_cheppali,In B4 everyone jinx the fuck outta us.,6
2020-11-08T12:37:37+00:00,fieztel,Ashwin vs Warner would be a great contest in the powerplay,5
2020-11-08T12:38:52+00:00,OkWar7880,Dhawan century today?,0
2020-11-08T12:40:33+00:00,sahibosaurus,"Dhawan, Stoinis, Iyer, Rahane, Pant, Hetmyer, A Patel, H Patel, Ashwin, Rabada, Nortje

I'd go with this",1
2020-11-08T12:41:45+00:00,,Comments section rn is which side can out-reverse-jinx the other.,8
2020-11-08T12:41:51+00:00,Rubberducky1239,"I genuinely think we can go with the same squad for the next season, addition of Roy and Woakes just to round it off. But this is a solid squad for Kotla matches or even if it happens here also again. Form of Pant, Shaw, Iyer was a let down but otherwise not many faults tbh",4
2020-11-08T12:43:24+00:00,josh123z,Guys instead of dropping Shaw why not drop Rahane and play Shaw in the middle order. He can atleast attack the spinners.,4
2020-11-08T12:44:11+00:00,bunnyoverkill,"You're being listened to whether you want it or not. Is that unsettling, or reassuring?",2
2020-11-08T12:44:16+00:00,Clear-Preparation675,"The only reason I wanna see SRH lose today is because the ""reverse jinx"" strategy it's fan use is so overused and unfunny.

If they win like this, these fans will never stop reverse jinxing. All the following IPLs we'll have to read these unfunny comments.

Nothing against Kanos and Warner though. Really wanna see both of them get a 50 today!!

PS- I know other teams also have fans who use reverse jinxing but they have already lost.",-11
2020-11-08T12:45:57+00:00,thelastsurvivor28,I'm rooting for literally anyone except MI,45
2020-11-08T12:46:17+00:00,sahibosaurus,I have no clue what this lady presenter's accent is supposed to be.,7
2020-11-08T12:48:16+00:00,sahasamane_cheppali,"We were happily enjoying the underdog status, none of the so called ""experts"" even gave us a chance or even thought we will qualify for playoffs. Now all the other fans(doing it with good intentions?) started calling us as the only team who can give tough fight to MI. Amidst all this chaos, it's fans like me with reverse jinxing (we have our sentiments Bois) need to up the ante and step up for our Bois today.",27
2020-11-08T12:48:45+00:00,2684335126835353,Can't wait for Warner to win the toss yet again,9
2020-11-08T12:49:04+00:00,OkWar7880,MI fans seeing everyone rooting for anyone except them: It's lonely at the top,4
2020-11-08T12:50:19+00:00,exxentricity,"Jinx, reverse-jinx, or no jinx, or whatever for that matter, SRH is probably gonna win this based on the side they can field in this match. Topic is over!! 😒",-1
2020-11-08T12:50:29+00:00,Eddie_Rattlehead,"What do you guys think about the chances of Lamichane making the 11 today? I say unlikely but on the cards as spinners came clutch for RCB in the last game on the same ground. Might mean Stoinis  also has to bowl more than is expected of him, unless Harshal also makes his way in.",5
2020-11-08T12:51:57+00:00,BoreHoRahaHaiYaar,[MI fans watching today's match](https://i.imgur.com/YDhtErW.jpg),9
2020-11-08T12:53:20+00:00,Potential_Maize2236,Hope Priyam Garg opens with Warner if Saha is unavailable. Goswami is pretty much specialist wicketkeeper.,8
2020-11-08T12:54:20+00:00,gr8astardd,Silly question: but what happens when an IPL Playoff game gets rained out?,7
2020-11-08T12:55:16+00:00,,"questionnn: can we register someone else (say, garg) as wicket keeper and then sub on goswami when its srhs turn to bowl?",6
2020-11-08T12:55:16+00:00,mytwoice,Two teams I've been rooting for this season.  Whoever wins this should go on and beat MI. SRH probably is that team.,4
2020-11-08T12:58:37+00:00,,"from cricinfo:  I am afraid Nagraj Gollapudi has given me some not-so-great news for SRH fans: ""Saha is understood to have hurt his hamstring in his left leg. With the Australia Test series in December, both Saha and BCCI would want to play safe. It is unlikely he will play any further part in IPL unless Sunrirsers are desperate and push him to.""",7
2020-11-08T12:58:56+00:00,udayEm,Couple years soon before everyone mocks us fans if we call ourselves underdogs! Lol stop it guys. It's like trying to push an agenda!,5
2020-11-08T12:59:06+00:00,OkWar7880,Supporting Srh since if Delhi wins then you might as well give the trophy to Mumbai.,5
2020-11-08T13:00:13+00:00,,"I'd send Pant to open and give him a hit or get out license, then Stoinis/Hetmayar",2
2020-11-08T13:00:28+00:00,KelvinRkrab,Is it gonna be a 10 wicket loss or a 100 run loss?,6
2020-11-08T13:01:23+00:00,GlitchPro27,"Half an hour till toss, I don't even know what toss outcome to hope for any more.",2
2020-11-08T13:01:25+00:00,mytwoice,"Can't see DC not surrendering to Rashid, tbh.  Left-handed Pant should be taking down Rashid, but Pant in current state of mind is no better batsman then a random man on the street.",8
2020-11-08T13:01:57+00:00,harsh1387,"I am pretty optimistic about our chances today.. I got a hunch we gonna play freely, maybe fail spectacularly or smash it unbelievably.. won't be a middle ground today.. it's literally do or die..",7
2020-11-08T13:01:58+00:00,faxotee,Why the fuck is the finals on a Tuesday?,33
2020-11-08T13:02:32+00:00,Slippin_Jimmy1216,Guys? Looks like it's raining in Dubai :(,5
2020-11-08T13:03:03+00:00,International_Boat82,Wont even be slightly surprised if we found out even warner and rashid are injured today and we simply run out of players to play,64
2020-11-08T13:04:36+00:00,faxotee,Why do world class professionals who've been playing the sport since before puberty need to still do drills before the game?,1
2020-11-08T13:05:24+00:00,,Seems like it's raining. DLS is certainly going to bite us more than them.,3
2020-11-08T13:05:38+00:00,cyberchamp_210,Does Delhi even stand a chance against this powerful team?,-11
2020-11-08T13:07:43+00:00,sahasamane_cheppali,What rain? Checked weather and it's fine no?,3
2020-11-08T13:07:58+00:00,LightningStrikes321,Fellow Delhi fans stop reverse jinxing and own it that yes we’re gonna win today,13
2020-11-08T13:08:49+00:00,,Haters (idiots) will say it's raining because of the social reformations in the UAE.,9
2020-11-08T13:10:04+00:00,OkWar7880,Tfw when you realize you're just a fan and none of the analysis and calculations you do in your head and none of the jinxing/reverse jinxing is gonna change the outcome of the game.,58
2020-11-08T13:10:58+00:00,Freakysafal,"Big time for DC to wake up

Tbf delhi has better bowling n better batting on paper",5
2020-11-08T13:11:16+00:00,Potential_Maize2236,If DC batting starts shitting all over itself again I won't  be suprised if Ponting walks out to bat.,79
2020-11-08T13:12:56+00:00,ravindra_jadeja,IIRC Warner has won 7 tosses on trot.. So unlikely we win toss today... Hence highly likely that DC would chase and win the match..,1
2020-11-08T13:13:11+00:00,GlitchPro27,I'd find it funny if rain somehow saved us today because Delhi making it into an IPL final is just about as implausible as rain is in the UAE.,3
2020-11-08T13:13:47+00:00,dblala,Funny seeing srh fans reverse jinxing when they clearly they have a momentum.,1
2020-11-08T13:13:54+00:00,,btw guys stop checking accuweather for uae forecast its extremely innacurate lmao,2
2020-11-08T13:14:02+00:00,ak_one7,"If Saha is still injured, I'd like Rashid Khan to open with warner try to emulate Sunil Narine and take advantage of powerplay. He bats well and can hit few boundaries. Goswami can bat at 6 or 7.",2
2020-11-08T13:14:21+00:00,KelvinRkrab,"Win or lose, I am gonna miss the IPL so much.",1
2020-11-08T13:14:46+00:00,,"Every team I've been supporting since last few matches have lost. So, I'll be supporting SRH today🤞",3
2020-11-08T13:15:21+00:00,faxotee,What does a coach do other than telling players to back themselves?,3
2020-11-08T13:16:50+00:00,Winny_Nehemiah22,In b4 Goswami's 54(21),5
2020-11-08T13:16:53+00:00,TheFirstLane,"Lemme be clear about this, any SRH fan ""reverse jinxing"" gets a down vote from me",-17
2020-11-08T13:17:27+00:00,,"Can't see DC winning the IPL even if they win today.. It is the Koach curse. Koach = Punjabi origin (KXIP), from Delhi (DC) and plays for Bangalore (RCB). Hence all these three teams (RCB, DC and KXIP) will never win a title. Better to lose today as SRH have a better shot at breaking the Mumbai hegemony",34
2020-11-08T13:17:32+00:00,gr8astardd,"Random question: Finals, and if a team needs 2 runs to win, with 1 wicket in hand, and the bowler bowls a wide, but the batsman gets stumped. Does the bowling side win, or is it a super over?",6
2020-11-08T13:18:20+00:00,Vicodin_Abuser,"Team for Delhi :

Dhawan  
Shaw  
Hetmyer  
Iyer  
Pant  
Stoinis  
Axar  
Harshal  
Rabada  
Ashwin  
Nortje

What say?",3
2020-11-08T13:18:45+00:00,uravggstudent,"Teams making top 2 and not entering the finals:

1) DD - 2012 (lost against KKR in Q1 and then to CSK in Q2)

2) GL - 2016 (lost against RCB in Q1 and then to SRH in Q2)",5
2020-11-08T13:19:32+00:00,subendu7,"IPL 2018 SRH lose to CSK

IPL 2019 CSK lose to MI

IPL 2020 MI ???? to ???


And the circle is complete.",16
2020-11-08T13:20:37+00:00,The_The_Dude,"Toss prediction

  


Iyer we are going to bat first because of dew and we have no idea what to do about our batting, bowling and fielding.",7
2020-11-08T13:23:02+00:00,,[deleted],-2
2020-11-08T13:23:05+00:00,,☁️ 🌥 🌥 ☁️ ☁️,3
2020-11-08T13:23:49+00:00,,I don't mind Goswami playing honestly. I like him,3
2020-11-08T13:24:43+00:00,Vicodin_Abuser,"Should DC try getting Pant up at 3 and giving him the full license to play like he wants? Like even if he gets out slogging first ball, so be it. Would be better than watching him struggle for a 30 ball 30. Saw some of his best IPL knocks today. Almost all of them have come when he's entered the crease inside 3-4 overs.",2
2020-11-08T13:24:52+00:00,,Inb4 another Mumbai lad bullies Goswami,-3
2020-11-08T13:24:59+00:00,,Inb4 another Mumbai lad bullies Goswami,5
2020-11-08T13:25:03+00:00,Desimirch,Saha needs to return man. Goswami seems useless with the bat. We will basically be batting with one batsman less. Makes things easier for DC.,3
2020-11-08T13:25:41+00:00,Rubberducky1239,Roar Macha is our best anthem imo,10
2020-11-08T13:26:03+00:00,KelvinRkrab,"How we've played so far, we might get Warner for 0 only for Goswami to score a 100",6
2020-11-08T13:26:04+00:00,lonelyisIand,Delhi Capitals deserves to win for [this](https://twitter.com/ESPNcricinfo/status/1325420394724077569?s=20) alone,82
2020-11-08T13:26:16+00:00,crazyb14,Pant 100(52) incoming.,15
2020-11-08T13:27:14+00:00,,"Dhawan has horribly failed in bringing his experience for use into the young Delhi side, especially you shouldn't do puny shit like thigh-slapping and God forbid we shouldn't even talk about the Indian test vice-captain",-9
2020-11-08T13:27:24+00:00,fookin_legund,"Welp. We had a good season, guys. Meet ya next year.",6
2020-11-08T13:27:48+00:00,thelastsurvivor28,"Going to buy Hotstar for cricket, will the upcoming series between Aus and India be telecasted there too?",4
2020-11-08T13:28:36+00:00,,I'd say win toss- bat first put 170 + on the board for both teams.,2
2020-11-08T13:31:00+00:00,MISSIONCAP,Missing THAT Deccan Chargers anthem.,10
2020-11-08T13:31:20+00:00,,DC won the toss. We got a chance boys!,10
2020-11-08T13:31:24+00:00,exxentricity," 

>Delhi Capitals opt to bat",7
2020-11-08T13:31:25+00:00,2684335126835353,Chose to bat? What the actual fuck,3
2020-11-08T13:31:28+00:00,Slippin_Jimmy1216,DC bat first? No dew today?,16
2020-11-08T13:31:31+00:00,,[deleted],2
2020-11-08T13:31:45+00:00,,Our toss winning streak finally comes to an end,55
2020-11-08T13:31:45+00:00,9yearoldpatriot,did the toss happen?,3
2020-11-08T13:31:55+00:00,ShuddhGheeRoti,Interesting choice to bat first,2
2020-11-08T13:31:56+00:00,crazyb14,4d by Shreyas,6
2020-11-08T13:31:59+00:00,KelvinRkrab,Good decision to bat first.,8
2020-11-08T13:32:03+00:00,Treemann,Delhi have no problem winning (the toss),3
2020-11-08T13:32:11+00:00,sahibosaurus,"Good call, we cant chase for shit",12
2020-11-08T13:32:12+00:00,,"Owwwwwee this is interesting, DC are batting first",3
2020-11-08T13:32:44+00:00,Rubberducky1239,"Haha Iyer forgot lmao, Dubey in is a good move IMO",3
2020-11-08T13:32:50+00:00,ShuddhGheeRoti,Captain doesn't know the team he is fielding!,3
2020-11-08T13:32:53+00:00,uravggstudent,"DC have lost both their matches against SRH chasing. Maybe not a bad move to bat. Plus, Ponting is an Aussie. Runs on the board and then pressure.",1
2020-11-08T13:32:58+00:00,BoreHoRahaHaiYaar,Lmao how do you forget a guy like Hetmyer,7
2020-11-08T13:33:02+00:00,harsh1387,Lmao.. Shreyas forgetting the team changes..,3
2020-11-08T13:33:05+00:00,faxotee,So much for Phoren captains to not remember Indian players,8
2020-11-08T13:33:06+00:00,munkeyy,"Warner lost the toss after a loooong time, interesting call and DC captain looks confident!",5
2020-11-08T13:33:09+00:00,KelvinRkrab,Okay. 3 spinners. Yar amit mishra sir ki injury aaj tak khaa rhi he humaari team ko.,2
2020-11-08T13:33:12+00:00,Slippin_Jimmy1216,Ah careful there. You don't want to reveal your strategy Shreyas.,4
2020-11-08T13:33:17+00:00,anaksr1414,That talk from Iyer during toss itself was so negative man. He's saying we lost last two chasing with SRH and lot of similar stuff.,4
2020-11-08T13:33:19+00:00,TheFirstLane,Iyer is so honest during interviews.,3
2020-11-08T13:33:20+00:00,,Iyer is a no bullshit guy. Said they chose to bat because they lost their previous games vs SRH when they bowled first,109
2020-11-08T13:33:27+00:00,Naan6,Damn so both parties are satisfied,3
2020-11-08T13:33:29+00:00,ShuddhGheeRoti,Both captains happy with the toss,7
2020-11-08T13:33:33+00:00,mytwoice,So Saha is being rested as a precaution for the upcoming Australian tour and Rohit who was deemed injured to tour Australia declares fit and plays for MI?  I wouldn't be surprised if BCCI will be reporting to MI in a few years.,24
2020-11-08T13:33:55+00:00,,"I think it's advantage SRH, they've done really well after restricting the opponent and chasing it down",2
2020-11-08T13:34:05+00:00,Treemann,"On the one hand I really want DC to win the IPL; on the other hand, I want us to put indisputable difference between ourselves and RCB as the ultimate meme team.",2
2020-11-08T13:34:10+00:00,,SRH is actually vulnerable when chasing,8
2020-11-08T13:34:21+00:00,,Delhi is the best defending side this IPL. Feel for SRH they're on course to be knocked out now,2
2020-11-08T13:34:22+00:00,,No Saha :'(,3
2020-11-08T13:34:28+00:00,DoomMachine-77,Shreyas looks nervous as fuck. But let’s do this Delhi bros!,7
2020-11-08T13:34:35+00:00,anirudh1595,"Iyer: We want to bat first because SRH won twice against us when they batted first 

Also Iyer: We don't want to think about previous games; it doesn't matter what happened in the past.

Man, how confused is he? XD",21
2020-11-08T13:34:38+00:00,GlitchPro27,"I'm not unhappy necessarily with the batting first (idk what's better at this point), it's more that winning the toss hasn't been good for us.",5
2020-11-08T13:34:39+00:00,PlsDontBraidMyBeard,"^(Delhi have won the toss)

Oh No!

^(And have elected to bat first)

Anyway..",7
2020-11-08T13:34:41+00:00,Naan6,Dang it no Saha,9
2020-11-08T13:34:42+00:00,,Saha :(,6
2020-11-08T13:34:45+00:00,Nithinyns,Go Dc... go to dubai for finals.,5
2020-11-08T13:34:55+00:00,gr8astardd,SRH chasing is just gonna give me anxiety as soon as Warner’s wicket falls,16
2020-11-08T13:34:57+00:00,,So Iyer winning the toss means Delhi lose right?,2
2020-11-08T13:35:08+00:00,fieztel,Fuck no Saha fml :(,15
2020-11-08T13:35:08+00:00,anaksr1414,So no WAHA show today:-(,30
2020-11-08T13:35:22+00:00,pussydestroyer100,"Look in my opinion, SRH are gonna win this time. They've had a very tough road to the playoffs and their arc is very similar that of Pakistan in CT17 and those kinda teams are incredibly hard to beat. 

Do well SRH.",1
2020-11-08T13:35:26+00:00,International_Boat82,"From iyer's speech , delhi looks PREPARED 

without saha , we'll probably lose if they make anything over 100",12
2020-11-08T13:35:36+00:00,MotaBhai_Official,"DC won the toss and are batting first (SRH wanted to bowl anyway)

Same team for SRH

Dubey in for Sams and Hetymer in for Shaw",3
2020-11-08T13:35:36+00:00,sahibosaurus,Even when Davey loses the toss he wins it lol,13
2020-11-08T13:35:44+00:00,TheFirstLane,Stoinis opens i think.,3
2020-11-08T13:35:59+00:00,fieztel,Why do SRH always chase in the knock out games and give us mini heart attacks,22
2020-11-08T13:36:02+00:00,Sicknit,I think dc have decided to come in and just go for it and aim for 200 plus,3
2020-11-08T13:36:11+00:00,,"So Saha tore his hamstring, so even if we win today, he wouldn't be playing the next match either",7
2020-11-08T13:36:15+00:00,faxotee,Hetmeyer's century of rage incoming today,2
2020-11-08T13:36:25+00:00,Naan6,I feel like we gonna crumble tonight,6
2020-11-08T13:36:28+00:00,balajih67,"Feel srh will lose today. Warner will be the key scalp again. Dc look strong.

But lowkey as a srh fan for this season, hope we can pull thru",9
2020-11-08T13:36:29+00:00,,[deleted],0
2020-11-08T13:36:52+00:00,adityakb95,From my cellar I have pulled out the finest bottle of whiskey infused with lassi flavours. Will open it after DC win.,2
2020-11-08T13:37:01+00:00,Assraj,Lezzz go DC join us,3
2020-11-08T13:37:02+00:00,hornyh00ligan,I can't believe people are upset about Saha. How the fuck did he turn from that shit knock he played halfway through the tournament to this absolute match winner that everyone is missing rn,10
2020-11-08T13:37:15+00:00,Vicodin_Abuser,Should Stoinis open or should Rahane?,2
2020-11-08T13:37:22+00:00,,[deleted],13
2020-11-08T13:37:27+00:00,udayEm,Did Warner remind Iyer of Hetmeyer at the toss!?,8
2020-11-08T13:37:47+00:00,ShuddhGheeRoti,"DC favoured to win - SRH pulling off a chase against Nokia, Rabada, Axar, Ashwin; not really seeing that happening.",15
2020-11-08T13:37:51+00:00,munkeyy,"* Great call to drop Shaw
* Lots of batting power with heymeyer in, if there is a hige total on baord SRH might find it difficult
* Rabada and Nortje can put pressure
* Expect delhi to start aggressive batting",5
2020-11-08T13:37:54+00:00,necro-botanist,Fully expect stoinis to get maybe even 3 overs today,2
2020-11-08T13:37:59+00:00,Rubberducky1239,"I am gonna be so happy if Stoin opens, Hetmyer has to come at 3 tho",2
2020-11-08T13:38:03+00:00,gr8astardd,"Nah man, these injuries are actually fucking frustrating. Marsh, Bhuvi, Shankar, Saha, Williamson some games... We’re basically playing with our B team at this point",22
2020-11-08T13:38:08+00:00,thepokemonchef,Still no left hander in the middle order and Delhi brings an extra leggie. Looks like they're trying to repeat the middle order choke from spin that RCB tried in the previous game.,5
2020-11-08T13:38:12+00:00,mytwoice,IPL owners tweeting constantly about the team is cringe.,4
2020-11-08T13:38:16+00:00,DilliKaLadka,"If we score anything over 160, game on.",5
2020-11-08T13:38:24+00:00,Krs1218,"It’s a great season no matter what, Shankar/Marsh/Bhuvi/Saha all would be starters and we got this far. Just hope the team plays with freedom and attacks.",6
2020-11-08T13:38:27+00:00,uravggstudent,"Rashid Khan against DC this year

8 overs, 20 runs and 6 wickets.",15
2020-11-08T13:38:36+00:00,GlitchPro27,"Good news of batting first is that if our batting lineup collapses in epic fashion, the game will end sooner and it won't prolong our pain.

They're doing it for the fans guys.",8
2020-11-08T13:38:38+00:00,rmU6Rz0ztS,Slightly unrelated to the match but shouldn't Purple and Orange cap be decided after the end of league phase? It is slightly unfair to Bumrah that Rabada and DC are getting one extra game than MI.,7
2020-11-08T13:38:44+00:00,International_Boat82,Stoinis gonna fuck us up after we beat zampa last game,90
2020-11-08T13:38:53+00:00,MotaBhai_Official,lol it would really funny if after all the talk Hetmyer opens,7
2020-11-08T13:39:03+00:00,JustStrolling_,So is DC not expecting any dew?,8
2020-11-08T13:39:11+00:00,Slippin_Jimmy1216,Why do the practice jerseys look better than the original match jerseys? Lol.,24
2020-11-08T13:39:21+00:00,sahibosaurus,Poor Lamichane didn't get a look in all season,9
2020-11-08T13:39:25+00:00,Naan6,"DC looks so strong, I think we are gonna take the plane home tonight",2
2020-11-08T13:39:28+00:00,WaveParticle1729,"I have bet on almost all games since this Reddit Prediction thing started and won none so far. I really want a new team to lift the trophy so have bet on SRH today.

Ponting can thank me later.",6
2020-11-08T13:39:53+00:00,,"As a Delhi fan all I am hoping is we play like Delhi Captials and not Delhi Daredevils 

Insert Micheal Scott meme:I'm ready to get hurt again",14
2020-11-08T13:40:42+00:00,Krs1218,"Right toss by DC, they have a lot less pressure batting first and they have more experience with their bowling attack. Going to be a fun game.",4
2020-11-08T13:41:04+00:00,artha_shastra,"yep ...swanny is definitely either drunk or hungover ...

its going to be a usual swanny torture on dugout but only worse..",3
2020-11-08T13:41:11+00:00,,This is Delhi's game to lose now. Take care of MI in final Capitals,2
2020-11-08T13:41:13+00:00,fieztel,Tremendous pressure on Goswami to perform today,10
2020-11-08T13:41:16+00:00,,Worst part about batting first is I have to see Batting choke early in the game,5
2020-11-08T13:41:38+00:00,,"Send garg to open today cowards, he's an opener/3rd anyway",12
