Comment,Upvotes
Ishant looks like Ray Romano during his run up lmao,5
Creepy ass Amir Khan Dummy is gonna give kids nightmares,1
Wasn't that above waist?,0
"~~Ishant Sharma~~ 

Instant Karma",3
I swear I'll fuck some shit up if Kanos doesn't get to bat,5
What is this about changing gears? They've scored 49 off the last 4 overs. The game is going well. Keep calm and enjoy.,8
Rabada always gets Warner. Poor captaincy to save him for the end.,6
fuck these shitty songs no matter how big ipl gets,1
Tank it boys,4
Axar bowled really well in the 2 games so far. Give him the ball already.,1
Reverse switching Warner is the best Warner.,2
"Who are the rich kids gilding the bot everyday, I want to talk to you guys",4
The fact that these two have hit form just before we face them two games from now fills me with dread.,0
Must be extremely intimidating to bowl to these two first up. Even a centimetre away from perfect makes you look daft. Everyone has an opinion on who the best batsmen are but you really can’t get much better than having these two open for you,3
Thick boi can't run to save his life.,1
Pitch looked super hard to get started on so these two want to bat out the 20,0
"Seems like a 160 pitch tbh, and srh going at 8.5 an over with no wickets lost",1
Not sure about the value of a slow supporting knock from Bairstow. Williamson has been brought into the team for that role. Bairstow is supposed to be aggressive!,1
Shaw why you no slide?,0
Mishra ji personifying dad bod,0
Prithvio shaw looks like a short rohit sharma ..,0
Warner back to a decent strike rate,0
Score a boundary and run like maniacs every over.,0
SRH rising today,1
Is Ashwin still injured or what,2
Kanos gets into the team right as the openers hit form and doesn't get a chance to bat :(,1
IPL Amit Mishra is as good a spinner as any in the world.,2
Damn only 30 runs have come in boundaries,1
Why is the Mars Curiosity Rover in Abu Dhabi?,0
DRS? More like PRS am I right,-2
From rr of just 6+ to 8+ now. They are really accelerating. Delhi needs 2 wickets back to back.,1
Mishra looks like a chacha,0
sharmaji has lost weight,1
"When Warner swaps his gloves every second over, it isnt due to sweat. He wears down the padding from all the fist bumps",0
Fair Play-1,2
Gone,1
Everyone seems confident but Warner is like WTF dudes.,2
Oh Warner. You look so guilty.,2
Lmao Swann reckons Warner won't show guilt because he's Australian,2
Touched on gloves,1
Mishraji has the archetypal village cricketer body,2
Mishra gave the finger really hard lol,0
Okay pant appeals like a troglodyte,2
Lmao pant cheering even before wicket is given,1
Thank you Warner,3
SRH are one bowler short today,1
Did captain ask for review or the keeper?,0
Warner to bairstow- thik hai bhai ab mai chalta hu,1
Is it a wig or hair transplant?,1
"I think he is gone, oh my. We r fu ked",4
Defs off the glove,3
Warner’s sheepish smile is all the DRS we require,4
Rock and roll it,1
Out,4
Why is Rishabh so silent today,3
He's short and slow. Life dealt Prithvi a bad hand here.,2
Shit that hit glove,1
gone...,1
If Marcus Stoinis had played that reverse sweep and the ball had come off his bicep it would have gone for six,4
Crowd cheer sounds like some zombies being run over from a b list Hollywood movie.,4
Good on the ump not to give it just based in the appeal,7
goneeeee,1
Mishraji ko marne chala tha... Bhag,4
That small robo camera is taller than Prithvi Shaw,6
"Mishra giveth, Mishra taketh",4
"That is nothing, not out.",8
"Great review from Pant

Knew it straight away",5
That was minutest of touches,2
"Warner gone, whoever jinxed it by saying kane should get a chance to bat. Fuck you",6
Shukr hai,0
FUCK YEAH,3
"Finally, a breakthrough.
Thanks Mishra Ji",1
SRH frontrunners for fair play wooden spoon too.,2
Good comeback from SRH,1
WTF. That is nothing,6
isn't that disturbance too mild to be considered?,3
"Very small spike on ultra edge though

Was it very faint or just calibration error?",2
Barely even a spike,6
IPL umpiring being consistently shit as expected.,1
[deleted],5
Australian players and not walking away. Tell me a better combo,-3
There wasn't much of a spike,6
Fuck that is a stiff dismissal,4
We've got.,-1
Serial downvoter back for his cameo,6
There is a deviation as well.,4
That wasn’t a spike,2
Ponting basically captaining from outside the field.,7
[deleted],-4
Its clearly deflected from glove,8
"What d fuck, that is just a tiny tiny spike.",3
tbh that was barely a spike. usually they dont count those. weird.,9
"Uhh, obviously the glove's spike won't be as sharp.",4
Really strict decision. There was barely a spike.,9
Wait what,3
"Can a vice captain tell the umpire to refer for DRS? 

Pant made the T, and the umpire took the DRS, or did Iyer run in and make the T?",2
Unfortunate. Well played.,3
CLEAR DEVIATION,-1
Umpiring has been balls up this season - as usual.,-1
"thats is an itch.. not a spike

but its out though",2
Idk about that one,4
"**9.3** Mishra to Warner, OUT, **big appeal for a catch at the wicket, not given, and they go upstairs right away**. And it has come off the glove. Warner looks for another reverse sweep but this time the ball is not as full as the one that he pulled off two balls ago. Also it doesn't turn and kisses the glove on the way through to Pant **77-1**

DA Warner c &dagger;Pant b Mishra 45 (33b 3x4 2x6) SR: 136.36",0
Is that enough of a spike to overturn the decision?,3
Tough call,3
Anyone else see that it came up with us losing the review hahaha,0
Wow didn’t think that was enough to be considered,7
I'm not sure that spike is anywhere near big enough to overturn a decision??,7
Is that end of SRH?,0
"Small spike and clear deflection from the glove

You can complain about how small the spike was but it was definitely out",3
SRH FANS TRIGGERED.,-1
Ball does deviate off the gloves. Gloves don't make that much of a noise,8
There was no spike sure but the ball clearly deviated.,4
Huge wicket.,0
"Good decision, ultra edge doesn't trump human vision and common sense lol",2
"3rd umpire clearly would have seen it deviate. The slight spike was just confirmation, don't think the size of the spike really mattered much at that point",-1
There was a noise as well great call,-1
[deleted],1
Guys you can see in replay he gloved it. Doesn't matter what the snicko says it is out for me.,2
"I remember a similar spike the other game, and the 3rd ump was like 'flat line' wtf.",2
It's clearly gloved. Deviates enough in the slow mo.,-1
"Also for everyone saying not out, it clearly deviated off the glove",0
"Yea smart call, when taking in all the information.",-1
TV was showing review lost .... geez,1
you can actually see the ball move a bit after hitting the glove,1
should have just given the strike to bairstow,-1
That UpGrad advertisement is ballsy LMAO.,3
[deleted],4
Chacha Mishra coming in clutch,1
I think it did touch the glove but also there wasn't enough information to overturn the decision.,4
"Is it Kane time? I'm hard

Edit - yo wtf",2
Why not use Hotspot or a combination of Hotspot/Ultraedge for cases like this?,0
"The fucking heatbeat noice, the fake audience dj is more annoying than vuvuzelas.",0
"One test player gone, another test player walks in.",-3
Noooooo I want to see Kanos,1
Still no Kanos,3
Mishraji probably went to the same hair clinic as Dada.,0
I think Williamson should have come before pandey,2
Kanos ):,4
Whoever came here to downvote is only jealous of the biceps of Marcus Stoinis,7
"Did you see pointing gesturing for off spin as pandey was walking out?
Not saying this is a bad thing, but coaches are def leaders of teams now days. Captaincy has become diluted",1
No big spike but clearly looked like it kissed the gloves,4
[deleted],-1
Guys go and download Takatak,-2
Mishraji's and sharmaji's ruling,-1
I have a feeling Kanos won't bat today.,-1
Why has Axar not bowled yet? What is this captaincy?,-1
"""How much of a spike is a spike""

Me: Pulls out Discrete Fourier Transform",13
"...I don't understand how they can justify overturning a decision with that. That is NOT conclusive evidence of glove, that was literally the smallest little wobble of static and it didn't even have a specific peak, it could have been any kind of static interference...

The role of the third umpire is to collect sufficient evidence to OVERTURN a decision - if there isn't bang obvious evidence, how can they do that?

EDIT:

1) ""There was an obvious deviation"" it can't have been that obvious or the umpire would've given it. Moreover, if that was purely the product of the glove, why would there be such a tiny murmur on ultraedge?

2) A ""murmur"" is not sufficient evidence - ultraedge detects SOUND, not ""impact on the glove"". It could be the shuffling of a foot, the abrasion of glove on glove...",1
Dot Ball Pandey will bring DC back into the game.,2
Lol no kanos.,4
Why did pandey come above Williamson,1
Pandey.... I'm slightly confused,1
Whom are we saving Kane for?,3
[deleted],-4
All the weight is on Barstool now,0
"Yeah, even in that slow mo right there you can clearly see the deflection",4
"God, Manish gonna soak up 30 balls just to settle in",6
[deleted],2
Now this is gonna get boring as hell as long as Pandey’s on,2
Young Johnny Bairstow.,2
Can't get over MIshra ji's hair and how fake it looks.,2
"There seemed to be a clear deflection in the replay, but somehow not a big spike on UltraEdge",1
no offense but KL Rahul and Shreyas Iyer are not captaincy material.,-6
That a cut from the blades of the Nazgul.,-1
Does jersey no. even matter in cricket?,0
[What's your decision](https://i.imgur.com/LGqksRd.jpg),-5
Me thinks they should've sent Abhishek by giving him license to hit from ball 1,-2
Mishra is such a great seasonal campaigner. Would have loved him back at SRH.,1
No one wants to watch 100 SR Pandey when Kane is there,4
"Clear deflection, no??",5
"The ball clearly touched the gloves, stop complaining",9
Warner was arguing with ump tell me one thing If that was given out would warner had taken review?,4
Why no Axar yet?,3
Lol downvoting army at it yet again,6
That spike on ultra edge was actually the noise of Marcus Stoinis flexing at third man,24
Mishra looking ripped fair play big lad,-2
[deleted],2
"There was clearly a deflection in the ball as it passed the glove, why are people surprised with the decision?",6
Pandey about to shepherd the total to 130,5
"**Most wickets in IPL**

170 - Lasith Malinga

158 - Amit Mishra

154 - Piyush Chawla

150 - Harbhajan Singh

147 - Dwayne Bravo

133 - Bhuvneshwar Kumar

127 - R Ashwin

123 - Sunil Narine",7
"For folks saying there was barely a spike, VAR/DRS is like EA FIFA game: everything happens to make game close instead of being fair.",1
The ability of Pandey to play it to the fielders baffles me,13
"Whenever Axar Patel comes on to Bowl, I am reminded of that Emran Hashmi movie - Aksar

😂",5
"from why is Axar in playing eleven to why is he not bowling, Axar became DC's *premier spin all-rounder*",4
Pandey the test batsman,2
Too many wides ffs,0
"DC didn't want to expose Axar to Warner. So, Warner out, Axar in.",7
When harsha pronounces her name Lisa seems like a pure Maharashtrian,6
Pandey to play till lunch.,5
Pandey as an anchor doesn't give me enough confidence,9
Very poor fielding dhawan,4
I hate the constant referral of anything statistical in sports as moneyball,3
JONNY B,4
Why are batsman struggling so much against this left arm dart bowling?,3
they need a min 10+ rr from here to have a shot at this game.,4
This is going to be an important innings for Bairstow. He looks out of touch,2
Krrrrrackkkkking shot,2
Teams should be awarded extra DRS when playing against MI.,3
How axar has avoided dinda academy till now is one is one of the great mysteries of life,7
Why is prithvi wearing 2 hats?,1
"Bairstow, for the love of god. Never give the strike back to Pandey.",6
bring back Stoinis.,1
"Honestly, despite being IPL 2020 champions, Delhi field poorly.",7
I don't care if Manish Pandey scores 10 runs or 20. He needs to finish at a strike rate of 130+. He has been stat padding  for 2 seasons now,3
"Mishra wanted Elon's hair guy, but ended up with Trump's.   
jk jk, I commend a person for attempting to improve themselves in any way.",6
God I've liked the crowd noise in other games but its proper grating today,6
Haha! Pant catches it and Warner asking YJB not to run.,2
"The ball didn't deviate off Warner's glove, the gravitational pull of Marcus Stoinis's arms just forced it to start changing direction",11
"i see ipl sponsered by dream11

i see bcci head sponsoring myeleven circle

*I CONFUSED*",7
Lol that dive,1
">If there is a sound of leather on willow, which is usually a short sharp sound in synchrony with the ball passing the bat, then the ball has touched the bat. Other sounds such as the ball hitting the batsman's pads, or the bat hitting the pitch biscuit , and so on, tend to have a fatter shape on the sound waveform.",4
SRH fans are as annoying as MI and CSK fans.,2
Who are India's best fielder under 25?,3
Manish Pandey had a sr of 170+ in the Syed Mushtaq Ali trophy. So he is capable of finding the boundary.,1
Cool! http://reddit-stream.com/ Actually shows our active match thread.,1
Should’ve dropped it fuck,2
Oh shit,1
Happy cause Kane or sad cause wicket? 🤔,9
Pandey :(,1
Mishra beaut,2
I'm actually very glad as an SRH fan that Pandey is out,5
"SRH fans, is that one not out as well?",5
Pandey needs to be aggressive from ball one here,2
"*Fuck, he he we are in danger*",3
Kanos Time,3
YEESSSSSSSS I WANT KANOSSSSSSS,8
KANE IS HERE BABYY,4
pathetic from pandeyji.,1
Rashid doesn't look that threatening anymore because of the bowlers around him,7
Goodbye Tuk Tuk Pandey,4
It's Kanos time boys,3
Pandey got out cuz u fans wanted to watch Kane bat. Good guy Pandey.,6
Why Pandey why?,1
Into the tail bois,3
"Pandeyji doing the right thing imo ,need to get some runs now",2
Aaand there's Rabada's million dollar smile.,3
"**11.2** Mishra to Pandey, OUT,  **92-2**

MK Pandey c Rabada b Mishra 3 (5b 0x4 0x6) SR: 60.00",2
Mishra Ji en route to highest  wicket taker,1
I’m still jizzing over ashwin’s first over of IPL. Free my man he did nothing wrong,4
Kanosss,2
Noooooo!!!! Kane will fuck us.,2
Our batting lineup ends at 4 today instead of 3. Your loss today DC.,4
"Commentators: Should Pandey or Kane come in at #3?
Pandey: “Kane”",3
Choo choo. All aboard the Kane train.,7
DC fan here but KANE TRAIN HYPEEE 😍,5
Kanos facing his first delivery against a leggie makes me nervous. He prods forward to feel the ball and usually gets caught behind.,1
GOAT Mishra,1
"Critics- ""mishi bhai still got it""

Wtf do you mean by that, he is still younger than Rashid and Afridi",7
TBH pandey is a slow starter. He can't slog from f9rst ball. Atleast they should have sent Rashid to hit like naraine.,4
Mishraji showing chahal how it's done,3
Thank you Pandey-ji,3
"I remember when SRH picked Manish for 11CR in 2018 auction and our management were discussing whether to use RTM for him. 

Well, they were right.",2
TIME 4 KANOS,2
lol Pandey,1
"The one time he shows intent, he gets out. 

 Goddamn, we’re gonna see TukTuk 2.0 in the coming matches..",3
[deleted],3
I started this season as a DC fan excited about the batting and feeling ok about the bowling. Now I’m amazed at how good the bowling has been lol.,2
"Pandey scored a 50 at pretty much the best strike rate in the team last game but got flack from the moment he walked out today?

He played well last season too when batting at 3",1
Kanos time,2
get ready for some big dick shots!! Williamson is here,2
fake crowd noises are getting worse and worse,3
Jesse lingard of SRH.,4
2 wickets down and we still have competent batsmen batting. Is this SRH?,10
Wait they had Williamson and they sent Pandey. God help SRH!,2
This year we are gonna be at the bottom of the table,2
SRH imploding again. Delhi have an awesome batting unit too. 180-190 is bare minimum and with the way this IPL has been progressing even that might be too less,5
Kane!,4
😍,3
give us what we want... give us kanos,6
"i hope our boy, kanos, has a good game!",5
Rabada took catch of Murali Vijay last game and today Manish Pandey. Poor feilding.,11
[deleted],3
Have we ever seen KG drop a catch in the IPL?,1
"Everyone liked that.

SRH fans are more happy than DC fans that Pandey got out",6
Kanos arrives,2
Kane anna sounds like ganna,4
I don't have any complaints about Manish Pandey. He needs to either accelerate or go home. He went home and did not stat pad,3
Scenes if Kane gets out cheap now.,3
Mishra's hair growth is directly correlated to his wickets in IPL,3
Kane Train! ALL ABOOOOOOOOOARD,5
"Currently the 8th watched stream on twitch, not sure if sus that it seems to randomly gain 3k viewers but I won't complain, its 1080p60 so its nice nice to look at",1
So much reliance on foreign batsmen can bite SRH in the ass later on when pitches become more favourable for spinners,6
Is there anyone who hates Kanos?,1
Mishraji is one of the GOATs in IPL ... bit underraated,15
"Now that KW comes out to bat, half this sub have their lotions and tissues out.",14
Rotate strike Bairstow,1
Harsha he is not Kane Anna. He is Kane Mama for us.,12
Tewatia-esque comeback from Mishra,2
Kanooooos!,3
that long haired dude in the dc camp looks like Joy Lobo from 3 idiots,2
Kanos ran like a drunkard there. xD,11
"Kane anna.. 

Bhogle understands the audience’s pulse",47
In b4 Kanos snaps!,4
That's some sexy dancing by the girl in the middle!,10
So much respect for Mishra Ji. Throwing himself all over the ground even after crossing 50 years of age,7
Dream11 chutiya fans,9
Kane anna!,4
Indian men are the worst dancers,4
Hopefully Kanos plays a fantastic innings.,3
One of them is having a seizure. Guess who?,6
Kanos Mama ❤️,4
Those fans can scare new fans of the game.,10
These dream 11 fans are most likely tiktok thots by the way they are behaving,5
Why dream 11 fans are so cringe you can't seem to find such people in real life do they tell them to do this.,20
Tharki Swann. Got excited after seeing that dancing hottie,10
I might shit on Pant a lot for his chatter behind the stumps but he does make me nostalgic by reminding me about my early cricket days in the village.,5
"This thread makes all cricket fans seems like characters from Idiocracy. ""Technology is the only correct thing! Fuck our eyes and whatnot, let's only trust what technology tells us!""",-3
Kanos is the KEANU REAVES of Cricket...,10
[deleted],-9
"YJB abandoning the Gray Nichs hurts my soul, should never be picked for England in tests again",6
~~Kane~~ Keanu Williamson,7
"Imagine if Kanos turned around to Pant and said ""Chup bkl Tera baap hai hum"" in a thick bihari accent",48
kane train choo choo,5
K A N O S  hype 😍 what a shot for one,9
"Is Dream11 a drug company? If not, please tell that to the marketing team",4
fair play to Pandey for having a go. The usual complaint against him is that he doesn't get a move on.,11
">working this overcooked dart down the ground to long-on

From Cricbuzz. No wonder people find Cricket confusing",4
[removed],7
Please send Abhishek Sharma up the order. Such an elegant batsman,5
The amount of positive vibes in the air is insane. Kanos is love.,22
Is Deepak Hooda playing IPL this year?,1
Iyer saving Rabada's 3 overs for Priyam Garg or something?,11
"Kane, enough of your Keanu Reeves mode. Please access Johnny Sins mode and fk some of these bowlers.

&#x200B;

&#x200B;

Thanks",9
Badrinath reckons Dhoni is still a finisher.,7
"""When Kane Williamson bats, even God stops by to watch."" - God.",13
"Why are the pitches here so weird. One is too small, one is too big.",7
yikes priyam garg is next. kanos and weasley better finish the job here.,5
Shaw is a bad fielder,5
Pant you fucking monkey,6
"Final 4 predictions?
DC, KXIP, RCB, aaaaaand.... CSK 😎
Jk probably royals",3
Prithvi Shaw - great fielder.,2
*Shaw going kamble way.*,7
Shit fielder,2
I dont care how much they make or how fast. I just wanna see kanos bat.,3
One more wicket and it's the tail boys.,3
Pant alone is enough to create panic among the Batsmen.,48
I repeat: Shaw is a shit field,13
Pants screaming scares batsmen too lmao,11
pant is so fucking annoying close to the stumps.,4
Rabada - Nortje 5 overs left. Don't see them reaching 160,1
Well done Axar- Rishabh,2
Is that dummy supposed to be Amir Khan in the Ceat ad?,3
"I'm so disappointed, started okay, went well and back to square one now. Bad team structure, blow it up and get gun finishers next year 
Virat singh garg can handle the top order in the future",2
Bairstow is going to be dangerous if he stays till the death overs.,8
Having Pant shrieking in to your ears must be absolutely terrible. I foresee some batsman depositing a swift hook to him in a tense situation,2
Shaw has to.improve so much on his fitness,4
[deleted],-2
[deleted],1
"Wow I thought that was Mishra fielding, turned out it was Earthboy. The oldest 20 yrs old.",2
The only department where I've seen DC really struggle from these 3 games have been fielding.,0
"Ball : *exists*

Pant: arre jaldi jaldi (fast fast)",5
[deleted],4
They are without Nabi and pitch looks good for spinners,3
Iyer is a good-shit fielder,3
Even in the best case scenario we're going to fall short by 25-30 runs.,4
"I'd be really annoyed, angry and probably field poorly if pant was shouting like that. The ball doesn't even reach the fielder and he starts shouting.",4
no boundary in 15 balls.,1
"Bruh DC is actually overpowered wtf. In the pace department they have Rabada, Nortje and Ishant. And for the spinners it is even better, Axar, Ash and Mishra, all of whom are IPL legends. If DC doesn't win this year, I don't think they ever will",19
What a shot,5
Soooo Good,5
Total class shot,4
oh kane what a beauty,6
"Oh Kanos. Do me, daddy",4
Insane placement,3
That's class.,2
Not many people know this but DC went to buy Jadeja on Black Friday and ended up with Axar,4
What's that awkward inside out!?,1
"Pant, fake crowd, commentators, kw fanbois here - all giving me a headache.",0
Sublime,4
Swanny with that threat against Bishnoi,2
"For a young team, our ground fielding isn't the best.",4
Oh man that's a 3000 IQ shot,8
"Snecky shot kane , keep going like that.",6
I wonder if Pant will chirp so much if Kohli is batting. 💭,9
C L A S S written all over that shot,7
"Amazing that the largest Oil Rig currently in United Arab Emirates territory is actually on a cricket field, sending down medium pace for the Delhi Capitals in an overly tight shirt",6
Where's Virat Singh? There was so much hype around him,4
Score prediction - 145 - 150. Delhi will chase that in 18 overs and i will cry myself to sleep today as well.,3
KAANOOS,6
"Hetmyer ke sar pe kisine paan thooka hai kya ?

T: Has any1 spitten paan on Hetmyer's head ?",4
That mishraji stare,5
Willlllliammm-sannn!!!,4
Wtf was that shot,3
My heart was in my mouth waiting to jump off as the ball went over the fielder,7
"I like these threads, they are chill. Games with MI, RCB or CSK have comments every second.",7
Mishra ji looks betrayed,11
"Such placement,much wow",4
Kane you beauty,4
What a Shotttt,3
Without Warner the doubles have dried up,3
Kane coming into the side is already a W for us.,4
wtf those wrists!,3
Wow that was hit with precision,0
Kano that's an absurd shot,1
Kane is genuinely my favourite batsman to watch,1
Of course my internet shits itself as soon as I get to watch kaneo,3
"Where did  Virat Singh go? There was so much hype around him after the Auction


 Laxman said he would solve all their Middle odder Problems",7
"Just the right amount of energy in the right place

Kanos mama ❤️",7
[removed],1
My man Johnny doing nothing but just vibin' there lmao,9
What a snoozefest,-4
Can we call Amit Mishra an 'IPL Legend'?,13
That death stare when batsmen hit Mishraji for a boundary LMAOOOO!,11
"I feel if Mishraji ever gave me that stare, I would instantly vapourize.",4
"Wait, what? Mishra has hair now? God I am feeling old.",3
big respecc to mishraji for adjusting his length after getting tonked by bairstow in first over,8
SHOT KANEY,1
"Bairstow needs to try and accelarate, but knowing these are the last batters that might be tough",2
"Is Axar kinda like Washington?

Tall bouncy and hits tight lines which makes him difficult to hit. Might even tonk some with the bat",1
My boy kilogram rabada is back,7
Wasting your strike bowler only for the end overs is not that impressive a strategy to be fair. You can be more aggressive and use him to bowl to Williamson as he came in to bat for example.,5
"kane might need more time to ramp things up, it's all on bairstow now.",2
"What a smart mom, one kid enrolled in ExtraMarks and other in WhitehatJr.",9
Already Rabada time fuck,10
SRH’s openers are the only SRH’s best death over batsmen as well.,16
Has Abhishek Sharma played any good innings after that 46(19) for Delhi ?,2
Rabada's going to knock YJB's stumps isn't he,3
Kane came back like the Rohirrim to take us to the promised land.,3
this commentary is... something else,4
Kagaz aur Rubber,8
Damnnn...13.6 average??,3
Kanos is the best non subcontinent player of spin right now.,9
ooof d*ddy rabada,3
170 would be good if they can get to it,3
What the fuck is a Nokia?,4
