Comment,Upvotes
Faf's been amazing so far this season,2
[deleted],-14
why tf is Mavi looking at the sky when bowling??,3
Have they now put on 200 runs without getting dismissed?,7
How magnificent has Faf been goodness... Same vibes as THAT Mike Hussey season.,11
Who's Baz talking to on the walkie talkie??,3
Can someone explain the Dhoni and fart memes?,1
Was Narine not bowling in the previous KKR games or what? Why is dugout commentary making a big deal about him being a mystery spinner in this match?,2
Msd is not a good player.....He's a legend player - Hotstar chat,1
"Useless Jadhav - 7.5 cr

Fabulous Faf - 1.5 cr",11
Imagine CSK going to the finals without losing any wickets from now on ^I ^just ^want ^to ^jinx,9
Bit of nothing bowling performance so far!,2
Faf>Finch,4
2 easy runs. They can keep running by hitting in the gaps.,2
"Fuck, du Plessis has been flawless this IPL.",5
Has Karn Sharma always been a good bowler?,0
Faf making wide boi run 2s,2
Why are they playing csk chants for a kkr home game??? This irks me so much,5
"Why is the field placement so disappointing, ik it's powerplay but still",0
Watson has picked up his cardio game.,7
Another SEXY ASS Boundary for Faf,5
Just pack your team with South Africans in IPL. They are killer with no pressure.,8
Cred App HANDSOMELY rewarding everyday !!!! Ughhhhh,0
"Fuck sake I'm beginning to hate these threads for CSK matches

They're just full of people either complaining about Dhoni, or complaining about people complaining about Dhoni, the vast majority of which are just the same 3 'jokes' repeated over and over

Get a fucking grip guys, this is a place for glorious shitposts, not angry flame wars",18
Looks like another 10 wicket win loading. Sigh.,6
Can't wait for another MI vs CSK final and 2021 opening match 🤗,7
Nipple pokies XI is on a roll.,3
Looks like Srini anna gave Cummins more money than srk could /s,-8
Horrible length from both bowlers so far,0
"Narine doesnt bowl next

I sleep",1
Dinesh Karthik looks like a dude who owns an Altroz,11
"Pitch is really slowing down, there's no bounce.",0
"Wasn't there somewhere a successful appeal from fielding side when batsman returned the ball to the fielders ?

Faf just reminded me of that",1
If faf keeping playing like this he might even be the player of this ipl.,3
Fakhar Zaman and Faf du Plessis. Any1 else with that seperate hands on handle technique,1
 Bowl full this over! Thanks!!,1
Ole ole ole ole ole ... Ah man nostalgia trip,0
Bowls a Heavy Ball™,1
Watto just give the strike to faf. He'll go for the boundaries.,1
"Lol KXIP bought CSK into form , now they'll make playoffs",8
"Naaah, Narine should have bowled this one.",1
SEXY Four.,1
Running not necessary. Supreme touch !!,1
That’s a weird boundary from Watto lmao,0
Mavi's action reminds me a bit of Abdul Razzaq,1
Watson has reached double figures. Game over for KKR,9
"Both of these batsmen love pace and have struggled vs Narine, wtf is DK doing",5
"the foreign players really be putting the Indian players' fitness to shame

Shane Watson's nipples could cut through diamond",4
"KKR missed a trick by not opening Narine against Watson imo

Not that I am complaining",3
Four and single. Gavaskar is happy somewhere.,5
[deleted],10
I bet SRK fired Karthik after the debacle of the last match and he came back shaved and all pretending to be a different guy.,10
Longest unbroken partnership?,3
Kkr wtf. You're letting wide watto take a quick single.,3
Faf noooooooo,6
Faf.. NOOOOOOOOOOOOOOOOO,3
Big wicket that.,3
Mavi is 1 trick pony,-1
"Good Mavi, very good 👌👌👌",2
We have a game now,4
"CSK opening pair can tear this inexperienced bowling attack upfront  
I thought narine would start specially against watson",0
This is just plane garbage strategy. Pace up front to a south African and an Australian on a sticky wicket.,1
Intent ™©,2
Hittable ball but gets a wicket lol,5
"**3.4** Shivam Mavi to du Plessis, OUT,  **30-1**

F du Plessis c &dagger;Karthik b Shivam Mavi 17 (10b 3x4 0x6) SR: 170.00",2
Fuck.,4
Not faf...,1
RIP Francois,-1
No NOT FAF,7
You fuckers jinxed Faf,7
Hehe he we are gonna lose.,1
How did watto get so good since the last match. He looked completely different in the first few matches,4
Now who asking to bring Narine?,4
Is this first time Fafda got a low score this season?,4
Was about to say that these two can do no weong. Fucking jinxed it,5
Thx everyone for jinxing faf into oblivion,11
Can never feel safe with Watson in there.,6
rayudu time,2
Send Scurran you cowards,1
New phonepe ad with amir is hilarious.,-1
Curran?,2
Fuck.,1
One more and they are into tail!!,8
Curran above Jadhav?,4
Mistake from Duplessis chasing a wide one.,2
Who’s next? 3D?,4
Whose that takatak guy,1
Into the tail,2
Faf's wicket is the most important wicket. CSK are as reliant on him as King XI on KL.,6
"Whose is bigger, Dhoni or Watson?",2
I am liking this Mavi lad... such a subtle outseam there.,9
Put on your 3d glasses bois,9
Game on now would be exciting,1
Want to see Jadhav masterclass,11
Looks like short & wide is the way to go for pacers if they want to pick up wicket today.,1
Oy vey,1
Watto pls don't go for the Big shots now,2
Did CSK run out of money to buy undershirts (banyans)?,5
Rayudu's strike rate is lesser than I expected,0
IPLs very own child - Ambati,7
Why does everyone here sound like the same person?,7
From outta nowhere that wicket. So many identical dismissals today,5
That obese uncle from the swiggy ad on hotstar looks like he needs to uninstall swiggy from his phone if he wants to live atleast for another 5 years.,17
Still not convinced by Mavi.,0
As long as Kedar-Dhoni-Jadeja stay in the pavillion it's CSK's game.,15
"We get watto next

We win easy",4
It's easy win for kkr now.,-3
Where did they get so many children to chant for KKR,1
Thirst™,1
Faf was our rock,4
The key to KKR winning will be to make Kedar Jadhav bat as many balls as possible,5
Don't run watto out mate!,1
I like the extra over to the strike bowler!,5
Random Fact- Akshay Kumar was once DD's Brand Ambassador,4
Bringing Cummins again is aggressive!,7
"A good move

Cummins in for 3rd",5
Curran versus Karn,1
Rayudu as usual in giving calls,1
They are going after last recognised pair with their best bowler!!,12
that should've been 2.,5
Village level fielding..,3
[deleted],-1
Lol why did they just take a single,1
I could swear after seeing DK today that he was among the crowd of some Mughal era painting,0
Plz send Curran and Jaddu against Narine and Varun. Just plzzz,0
Narine elevated himself from being a mystery bowler to a mystery altogether!,17
There's been a lot of very village fielding today,3
oh... Rayudu... some free runs for you,1
A close match on the cards,3
"Haven’t seen any sign of dew, so spinners will kill.",6
no Mitchell Starc in IPL?,6
Whatever happened to DK's beard!,6
Sunil Narine's value is going to tank by the next auction,10
Tf Karn opens in Ranji??,2
"Off topic,amateur cricketers of this sub,how to get better at wicket keeping?",1
3D shot!,4
Cumdog redemption arc when? 🙁,4
How the fuck is Cummins so good looking ?,13
Trash tier captaincy. Should have three slips and a gully.,1
"Chahar at 11. Hell yeah, we bat deep. Remember he came in at 4 in one match last season.",11
"Fake crowd is so wholesome

Going ape shit over miss timed singles",13
this CSK team is the ultimate BATDEEP^TM in IPL,10
Petition for tuk tuk dhoni to come at 4 and dot every single ball,9
With the humidity and sweat a reasonable haircut looks like a dead plant on Cummins' head.,6
Rayudu turning down runs smh,5
IPL+ICL legend : Rayudu.,5
Another 2 there.,2
Holy shit that was just 1.,6
This is actually a good powerplay for csk. Usually they do fuck all.,3
Impeccable,1
Good Test for CSK middle order today,0
"He couldn't get wins by changing up the team so DK decided to change up his beard.

Desperate times call for desperate measures",4
jeez Rayudu.... enti ra??!?!?,3
"Commentator: “Two games they have won, their top order has performed”

Me: that’s some analysis dude!",7
"Other teams convert singles into doubles.

CSK converts doubles into singles.",11
McCullums pen skills are sharp.,7
Good job seeing off Cummins. Now kill the spinners Watto,3
Was Cummins staring at DK for not having 2 slips?,5
[removed],3
Drop Cummins.,-5
"Can someone tell how Cummins is 2 million + $$, while Rabada is at 560k, and Bumrah is at 800+k??",5
"so far CSK playing the maintaining rr game   
good too see the engine has warmed up for the old guards",2
Chennai average a healthy 44 in the powerplay this season. The problem starts after it,9
Scott Styris is killing CSK for the missed singles and doubles.,3
Russel may not be his best with the bat but his bowling allows Cummins to bowl most of his overs with the new ball. He's been excellent at the death.,1
What’s the Nohit/Brohit line for Shane Watson?,4
[deleted],0
Kkr fans how much do you miss GG?,-4
Does Mavi bowl another length?,2
Inb4 a jadhav half century and him securing this spot in the team for another 5 years,7
So y'all telling me if i slam my middle finger in the door i'll be as good at cricket and as good looking as Pat Cummins?,7
"Without context, that commentary on Cummins’ middle finger and balls will raise some eyebrows",1
5 overs in both teams 41/1,2
There is low turn out of people on this thread today,5
DK cosplaying as protagonist from V for Vendetta?,0
Just give swanny a free Altroz ffs,2
He could have fuckin saved that',1
Did I just hear a Mavi chant lol,1
Hope they give Swann that Altroz for free.,1
"Cummins hasn't bowled any bad at all, still nothing to show for despite bowling three overs straight. This game is really harsh on bowlers",5
Can Rana run anymore slowly,6
Wtf he could have stopped it with some effort,9
My favorite part of the dugout commentary is Swanny simping over the Altroz every chance he gets,5
"Mavi is one of worst bowlers I have seen so far, bowls one length, so easy to line up.",1
Give swaney the car already. Man promotes it better than anyone else lmao,11
Better fielder would have chased that down,8
ARghhhh!!! Yeaaahhh Daddyyy! Give it to me Daddy!! SIX. Go Daddy Watson.,3
This is so frustrating!! Both bowlers are attacking the same line. Fuck me!,3
Inb4 narine takes a stunner at long on,1
bowling Cummins' 3rd over was a bad idea.,4
Lol Mavi bowling tripe.,3
Uh-oh,3
Swanny plugging CEAT and Altroz in Dugout is hilarious. Deliberately over the top,13
That was great timing too,3
"Mccullum : Dear diary,help me find a batting line-up.",32
What the actual fuck was DK thinking?,1
FFS kick Banger out of the Dugout. Man doesn't know how to commentate.,3
That was just lazy,2
Game over for kkr unless there's a tewatia,4
WatDaddy,1
Never bowl short to Watto... Never.,8
The WatFather,8
Getting punished for bowling that line.,5
Watson apne bhai ka badla lega aaj Mavi se,4
Slapped by Watson.,6
"BC akhand chutiya bowler hai yeh toh

T: this is an unbelievably shit bowler!",2
Mavi and Nagarkoti are not t20 bowlers,4
Games gone CSK going to chase it down comfortably for those sweet NRR gains,6
Where is Nagarpalika 😖🤮,4
Watto back?,6
Mavi learned bowling good length and haven't bowled anything else since,4
Imagine how accurate Mavi could be if he actually looked at where he's bowling.,10
I miss Brandon + Dwayne Smith opening for csk before ban,42
"pumped crowd noise is same for a single and a six. annoying. when you are working and listening to the commentary in the background, it sucks.",6
[deleted],7
KKR should let Morgan captain the side instead of Karthik if they wanna win the rest of the games. This one's already in the hands of CSK.,6
"Watson first 15 balls : SR of 101
Watson after facing 15 balls : SR 191",13
Someone get Watson out so that tuk tuk jadhav can come in and win it for KKR,9
"Fuck off KKR, you can't do shit by bowling 100% of your balls the same way!!",4
do you guys think that rayudu brings in a sense of assurity to this CSK lineup?,19
If daddy bishop asks me to download cred i shall do so,8
Rayudu looks like he is auditioning for test team,-4
I wonder if the commentators have any embarrassment as the advertisers' names roll off their tongues. My least favorite part of IPL by far,1
we never see square cut in IPL,0
Does Swann's wife know that he is cheating on her with the Altroz?,39
People shitting on Kedar haven't been following CSK at all. Kedar's role is very similar to what Badri used to do. His role is to stabilize the middle order if CSK lose too many wickets. If CSK needs to aggressively chase then he bats at around 6. His role in CSK is a floater.,13
Mavi bowling is more predictable than a girl leaving me after 3 dates.,15
"sooo, chased down before 18th over?",9
What's this about cummins' finger? what's wrnng with it?,8
Bring in my mememan Chakrabarty you,5
"Jadhav is there only for you to appreciate Dhoni. If not, we would be bashing Dhoni more.",13
"Watson my boy....
Wtf you arnt supposed to stay this late on ground untill and unless its final...",9
How dumb is DK to bowl 3 overs for Cummins already in powerplay? Should have brought Narine after the wicket to control the runs,10
Who's the bowling coach for Kkr?,3
"No wonder Mavi looks up while bowling, he only wants to bowl one length.",13
So we’re all in agreement that Cummins’ sister slammed his finger because all the guys she brought home went for him instead right?,67
KXIP brought Watson back into form so early in the IPL and now every other team is gonna suffer,25
5 twos converted into 5 singles so far by Rayudu. Sunny is about to pound his meat.,7
"KKR  have now given Pat Cummins three overs in the Powerplay on three separate occasions this year.  This is the only time this season that those three overs have been wicket-less.   


via cricviz",3
Good segment this on dugout,2
[deleted],4
What are the stats for wickets falling after time out,2
"Best CSK opening partnership

Gusset and Vijay

Baz and Smith 

Watto and Faf",8
Watson should be careful of not spending runs from quota of knockout games for league stage matches :d,3
"Wink for us, sammy",1
Fantastic analysis from Scotty there. Can't wait to see if Dhoni can hit those short balls now.,4
This season has brought out the worst in KKR fans. Almost forgot  how obnoxious a part of that fanbase is due to them having been irrelevant for 6 years.,7
Guess they are saving Narine for MSD.,4
[deleted],3
Rayudu's timing is off,2
Varun Chakravarty over Kuldeep is just bad tactics.,1
Rayudu is the last person you would expect to have a neck tattoo,7
DK looks like he wants to act in Maari 3,7
Spin is key this match.,1
"Of all the Indian players who grew Knock-off Kohli beards a few years ago, is DK the first one to shave it off?",2
graeme’s smoked an extra one before coming to work today,4
If CSK win this match they would move from 8th to 3rd in matter of 3 days.... Incredible,7
Wtf happened to Kuldeep?,5
"No idea why KKR bowled Cummins for 3 straight overs in the powerplay.

He would be lethal against our middle and lower order",7
Spinners will probably win this for KKR (I hope),6
"Jesus, even the spinner is attacking the same line. Wtf!! 🤷",8
DK worst captain this season surely yeah?,-2
"1D guy is good enough to milk any amount of mystery spin, especially under minimal scoreboard pressure. 

Bleak here no. Sigh!",1
Kolkata Drop Riders,0
did he just drop Watto?,2
hurry up and get out so I can watch Sam 'makes things happen' Curran,3
Did he drop that fucking catch?,2
It’s like they practice bowling length in the nets lol.,3
Fuck catching that shot lol,6
Wait why didnt he go a step or two in front?,5
Holy shit that almost carried lmfao,6
"I'm not watching, and I may be dumb, but I was under the illusion Narine batted at the top, and specifically as an opener, so he could effectively act as a pinch hitter and nothing more. Today, they send him down to #4, ahead of Morgan. Why?",10
Watson still falling for that ploy lol,4
Watson is like that mine which is end of life and people feel the gold is over but they keep on extending it and finding something enough to keep it afloat every year and even a surprise bonus sometimes.,10
Whys everyone bowling trash short balls on this wicket?,2
Did the fielder not even attempt a catch,8
"Seriously, what kind of a plan is to bowl short to watson?",3
God it feels good to have a real number 3,7
How the fuck did that travel that far :o,6
Do y'all watch Dugout or the other commentary?!,3
The only thing that DK had going for him was that magnificent beard and he shaved it off.,4
Should have dived and gone for that,5
"If I bowl, I will at least get hit down the ground bowling full.",3
I screamed at that sad drop,2
Bring your leggie. Bowl a few yorkers. Do something different. Dafuq is this bakchodi bowling short and on the pads?,2
They really playing GoT theme there?,10
Nagarkoti going to be mauled this over?,4
What a poor attempt at playing GOT music.,6
Unexpected GOT?,5
Game of thrones tune playing in the stadium lol,3
"Smart play by csk especially Rayudu
Single and doubles whereever possible and a boundary to add to end the over",4
WTF game of thrones LMAO!!,10
Wtf? Why is the got theme playing?,6
Test match length to test batsmen. Woah ji woah,6
Playing game of thrones in the stadium?,12
I want a Fleming-Dhoni authored book on their secrets to Franchise T20 cricet,15
"Alright Kamlesh, take a wicket now. I would personally ensure you are selected for T20 WC",5
"Tripati’s feet were bolted to the ground, otherwise he should have taken that.",9
Narine still ghayab. I guess he is a batsman now,3
We need a Rayadu Redemption Thread.,6
Do you count that as a dropped catch with that one where Watto hit it to the square leg??,3
Hey this dude balls full! He will be out of the attack soon.,11
"Bad judgement. Committed way too early.

Looked very catchable that.",9
Rayuduuu,6
CSK are playing so well with all retired players imagine if we actually get a good team in the auction for once like MI,17
Rayudu been using the same shot to hit boundaries since 2018 lmao.,7
[deleted],-3
"Doesn’t Shane Watson look like Jamie Lannister from GoT? Especially the Jamie from the first season. 

It’s funny now that I think about it. It is the same arc. He was considered to be that smug asshole when he used to play for Australia but he is now this wholesome figure for Indian fans in the IPL at the fag end of his career.",7
CSK putting loads of trash talk to the bin since the last match,12
I am sorry to say but this match is done,10
Wear your fucking mask Mr.Khan. These entitles assholes,-7
Damn it feels good to be a gangster - Rayudu,11
where's the best batsmen and part time bowler Narine.,13
"Interesting titbit: When IPL was played in South Africa, Fleming asked Hayden how he wanted to train, so Hayden said that he wanted to surf. And the CSK management gave Hayden the permission to skip training session to surf. Hayden ended up scoring the most runs in that IPL with 582 runs. Since then CSK has given players freedom in whatever way they want to practice (Not completely but for players they deem good enough). 

Some Indian player was training every day and Fleming had to tell him to stop training so much and to relax.",32
"Also this tournament is fucked in the head when after 20 games you have RCB sitting 3rd with 6 points, followed by 4 teams vying for mediocrity, then KXIP, whom nobody really cares about.",-11
No Narine yet?,3
[removed],12
[deleted],7
If I don't get to watch Gayle  hammer some pie chucker all over Sharjah this season I'm gonna be severely pissed,16
"Bah, Rayudu what you dooooo?",1
Rayudu: Please bring me my 3D glasses. Who is the correct point of contact for that here?,4
Oh no full ball almost got a wicket!,2
Rana looks like a gunda,2
Nothing going right for kkr :(,7
Giving up some runs but Nagarkoti still bowled the best over KKR have had,4
DJ really warmed up.,7
Oh yeah nice short ball again,5
There are like 0 2s between rayudu and watson,3
Watson loves short balls.,1
How does Rayudu manage to play like that when he plays one month per year.,8
Haan nehra ji...dikkte rhengi...smjh gyaa...bss ab...sun chuka hu me yarr,-1
"Couple of overs with no boundary, probably a wicket, and things might take a turn..
CSK hasnt been allowed to run away with the game yet.


Is that hoping for too much?",6
DK would have WC semi final flashbacks if that catch is taken,2
"So I gotta ask, is this now the 2019 CSK with bad games with the bat here and there or the 2018 one which most bowlers fear?",1
"Do these fuckers not know Watson is Australian and will feast on short bowling. Also, he is famous for reviewing plumb LBWs.",9
[deleted],-5
"Brett Lee looks a bit off in dugout. All black today too, wonder if it is for Deano",4
"A comment on cricbuzz   


 **anish**: ""Sunil Narine could be more destructive in death overs with big outfield and his variations with the pitch slowing down later in the match. I think this is great move from DK.""   


Interesting perspective",14
Go Daddy Watto!,2
Give it to russell,2
For such a big man Watto does really play that sweep shot well,3
I don't think I've ever seen Watson hit scoop shots before this year. I guess Faf has been teaching him how to.,6
Is Narine playing as a specialist No 4 batsman?,2
Wtf is that field placement?,3
CSK should cruise to victory.,1
Sometimes I feel DK is brain dead. Where is Narine?,7
"Watto coming back to form, nature is healing",5
"KKR need to invest more on Nagarkoti than Mavi. Nagarkoti is truly special. Mavi is good, and can be very good on his day, but he is definitely not special. He's always been a level below Nagarkoti right from the 2018 U19 WC.",0
Un-Watto like.,3
Swanny going over everyone's head with that English banter,1
Narine Ko ball dega ya nahi bhsDK ?,3
"Narine has better figures against csk. Are you gonna bowl him?

DK: I don't think I will",22
Watson playing scoop. Yeah I've seen it all.,5
"Fk kxip for bringing watson to form, it was not supposed to be done until playoffs",7
Who bowls at the death for KKR now that Cummins has bowled 3 overs already . Narine?,6
Bowl Narine you cowards,3
Am I the only one who dislikes the helmet style that DK uses?,2
How has Banton done on drinks duty so far? Learnt a lot?,2
It’s almost too late for Narine now,2
"RR plays like a team without management, KKR plays like a braindead team.",5
Last time I remember DK being good was when he played for MI,2
Wtf is wrong with the Star Sports audio guy? Putting a CSK chanting song in now.,8
Somebody should make a separate thread to talk about Ashish Nehra's commentary.,4
How to rage quit a match as a viewer without breaking the tv?,11
People asking how Rayudu plays this well when he's only around for a month and I'm wondering how he's able to play this well with his eye and well known-problems of depth perception!,4
"Sunil Narine bats shit

*DK: yeah let me make him an opener*

Sunil Narine dismissed Watson 60% of the times

*DK: yeah let me not bowl him till Watto is there*",6
I thought McCullum would do wonders for KKR as coach as I was a huge fan of his tactics and captaincy. But KKR are reminding me of the old Delhi management. Pure knuckle headed decisions.,6
DK talking to the bowler in Tamil is nice to hear,8
"Unpopular opinion but KKR should play only one of Mavi and Nagarkoti. They are both still raw, and KKR would be better off with an experienced Indian pacer alongside either of them",2
[deleted],0
Watson lookin for that squareleg boundary for a long time now,5
why the fuck is every KKR bowler bowling short balls!! I just hate DK's captaincy,2
"FUN FACT:

DreRus has the Best Bowl. Avg., Best ER, Best SR and 2nd most wickets for KKR this season so far.",3
RIP takeitdeepsavenrr: 2020-2020,8
Ball caught his hand there lol,2
I think finally Narine about to bowl,6
"Sometimes I myself forget that Narine's a spinner, to be honest.",2
easy win for csk it seems,4
Why would you hold off Narine until Watson gets settled,6
"I am feeling that this KKR team may not crack top 4. DC, MI, CSK and 4th one up for grabs.",3
That little tap of foot before watson hits six is like watching scarlet johansson in bikini in your pool while sipping vodka martini cocktail shaken no stirred,13
Watson doesn't play any other league in the world ( except for PSL I think) and yet so good when he's in form,5
Hold on Narine hasn’t bowled a single over wtf lol,7
Ah the Chakravarthy.. familiar surname in India now...,7
No Narine AGAIN!,3
DK has been a shit captain this season. With batting line ups and now with bowling changes.,8
Narine has the best record against CSK...,7
Lol Narine last 4 overs I think,4
DK is treating narine as death bowler. Confirm,5
DK trying to finish the game before bringing Narine into the attack,4
"If this is how Chennai play at their worst then I will take them any day. 
- RCB FAN",6
"I remember when Natine was at his unhittable prime, Raina was the batsmen to have hit him for most sixes.  Who do you all remember tonking Narine back in the day.",5
MY GOD HOW MANY POUNDS HAS HE PUT ON WTF,6
"""Guys we need a CSK chant.""  

""OK, how many syllables in CSK?""    

""Three.""  

""How many in Rajasthan?""    

""Three.""      

""Alright, *use the exact same beat and just replace the syllables.""*  

""Don't you think that Tamil Nadu and Rajasthan have unique culture and...""  

""Did I stutter?""  

""But...""  

""Exact. Same. Beat.""",12
Dave Hussey has got thicc,7
Kamlesh is so lean. Perfect for a speedster.,3
David vs mike huseey,4
Narine has probably turned into a #4 batsman completely,5
