Comment,Upvotes
On field umpires are reminding me of myself in first 3 months of starting my job. We did the same work - whatever was got right it was done by others and rest of time was a delicate balance of doing nothing and getting things wrong.,5
I love how very little nervous energy you can feel in DC team,8
This is exciting.,1
Samad hype!!,1
Rabada is SO cute omg,6
"Underpar innings by Bairstow, but well bowled by Rabada as well. Hyped to see what Samad can do though. Can really bring some much needed representation for Kashmiris",3
"too much pressure on samad, man.",2
Good knock from Jonny (if this was an ODI lmao).,2
Send in Rashid you pussies,3
Download cred baby...it's catchy no,3
Apparently samad has a 100+ SR in ranji trophy,3
Bairstow overshot his target by 3 runs,1
And people were bitching over saving rabada's overs,1
"But harsh sending in an 18 year old debutant with two overs left to whack, should've sent in Abhishek or Rashid",1
Bangar giving a Geograhy lesson,0
Shoulda put Rash in,1
Im gonna make an early prediction: SRH is gonna end up at the bottom this year.,4
"Phonepe ad doesn't make sense, they are showing that they are paying bail amount through Phone pe and in disclaimer they have mentioned that phonepe app cannot be used to pay anything at a police station. Thenwhy the fuck are you showing this ad, make something else.",15
Who is Samad?Is he supposed to be good? Genuinly Asking,8
Statpadder Bairstow,5
Samad hit some hard,8
Let's see how is samad. Lot of hype.,2
Go Kanos get the 50 you rightfully deserve!,4
Both our death over batsmen Warner and Bairstow got out..,8
The DC songs sucks no offence,2
"Hey kid, it's your debut match. You got 12 balls, so go crazy


SRH management probably",11
Looks like Lara is also a fan of Kanos. Not surprising..,5
"Samad take it cool, like dear Kanos.",9
Kannum Kannum Nortje,8
Let's see if the J&K lad can blast some,3
poor samad. first over gonna be the fastest bowler in the IPL.,6
You may think Bairstow played a bit slow but some of the balls were too fast and other balls were too slow not enough of them were just right and someone ate all his porridge,19
"Rabada is bowling good, I think in best form of all fast bowlers",4
Samad only cost 5.5 in fantasy league picked him for that only,4
This is a bowlers pitch. 160+ is looking here easily and I don't think this will be easy for dc. Definitely a competitive match.,2
[deleted],3
Intent™,4
Cmon Samad 👏👏👏,2
I haven’t seen an RNS in a while. Probably since Ben Rohrer retired,2
Rashid is going to wreak havoc on this pitch,2
Axar patel looks like young Ravi shastri,4
INTENT. Yay!,6
For once please SRH give is one promising youngster.,5
Boy got that intent,7
Snort-hay bowling now!,2
Oh fuck,4
Intent,2
Kane should play as many of the remaining balls as possible,3
Can we have dual flairs mod?,5
We shouldn't actually shit on Bairstow. He did play a slow innings but if it gives him confidence to score like his original self in future matches so sure why not?,7
Nice to see Kanos bat after so long.,1
2 years back 150 would have been more than enough for SRH to defend... I want those days back... When bhuvi bowled yorkers on will,10
Jonny Bairstow probably goes and scores 150 tonight if his arms were the size of Marcus Stoinis's,4
"Very cool to see a player from J&K. Have there been others for India, even if not the IPL?",12
whats a good score here this ipl?,2
I N T E N T,3
Watch the ball. Watch the ball.,5
He got the intent,3
Oh boy atleast get to 170...,5
"Oh shit RCB's next match is against RR







Lord Tewatia please spare us",9
Wtf is a defensive yorker?,0
Oh luck finally,7
This is great rotation of strike from SRH which is a text book example of how to bat in an....ODI,1
Anything will do currently,2
It's pronounced like Nokia? wow,6
Not another blind hit youngster please just one youngster for SRH has to click.,5
[deleted],-2
Harsha is tingling seeing Samad bat,11
How many times Samad would have played a 140+ ball in his life?,9
"150 up guys

Moral Victory for us",14
He is not even looking at the ball,3
Samad showed more intent in that single than Pandeyjis entire career at SRH,13
It went exactly where he wanted it to go. Cant find any fault in that. Good shot,9
Every match we have one scorer that could only manage 100 strike rate.,5
Holy shit!,7
Shot boy,9
Oh boyyy. Daddy samad,4
WOAH. SMACKKED,4
Samad>>>>>>>>>>>>Saha,5
Fuck that's HUUUGE man,9
Fuckin Glorious!,3
"Not only does Rabada take wickets regularly, but you almost never see him getting hit all over.",5
Abdul Samad = Yusuf Pathan,6
The fuck.,5
lmao did you realise they didn't show the shit stat of *total sixes distance* after that match,9
mboi coming in w the I n t e n t,2
oi oi Abdul,6
what happned to sid kaul?,2
Oh my good god !! Who is this guy ?,6
That's enroute Kashmir,5
HOLY FUCK! SAMAD LETS GO,10
HOLY SHIT FINALLY A GOOD MIDDLE ORDER I'M SWIMMING IN JIZZ,28
"That ball gone, bring another one. Huuuuge hit",6
This is why he's so good clean hitting against 145 kmph,5
Holy fuck,8
Sent to Kashmir,10
HOLY COW,3
That was yuge,3
Samad you beauty,3
OI THATS FKN SEXY,4
Holy fuck wow that was something,5
Oh boy he is goood,9
Yes finally!!!! That was gorgeous.,8
Okay we’ve seen enough. Retain this lad...,9
Absolute Monster,6
Nokia looks like south african sebastian vettel ngl,6
Yeeaaahhhh,5
Where was this guy hiding?!,11
Chad Samad,7
He's a wee lad with a big stick,6
that fuckin flew up there damn,2
Only 18 years old,4
A lower order SRH batsman hitting a six? What world is this?,8
Statement made.,2
Delhi better show some fucking intent while chasing.,5
Why was he out in the first 2 games,5
"That was huge, indian t20 middle order future is secured if bewda plays it well",3
"Wait, so you're telling me we hid this guy and played saha last game??",7
"Samad looks decent, hope Abhishek Sharma and him can solve our middle order crisis.",4
This guy looks good. I am so happy that youngsters are doing well this season. Bodes well for the future of Indian cricket,4
Young samad from Kashmir!!,7
"Nice shot , looks like SRH found themselves a hitter",3
points were made.,3
Why didn't this guy play from the first match? They needed a finisher,3
WE GOT OUR POWER HITTER!!!,4
You application for dinda academy will be considered norje.,2
who's cutting onions??,2
Weak middle order who?,3
Rabada is straight up fire,4
Ouch,2
Hit on the 4th ab,2
Ouch,2
SRH -where the heck did u hide this guy until now?,6
That's it. Don't even think of dropping Samad. He has intent and he can hit sixes.,5
"Take care kane, give strike to other guy
 He seems to hit out of the park as well.",2
Pitch soo flat even a 18 year old no name player Can hit a 145 km ball a mile out the park,-4
"Don't injure Him, KG! Or we'll break up.",6
ouch,3
"https://www.reddit.com/r/Cricket/comments/j1armi/match_thread_10th_match_royal_challengers/g6yu5cq?utm_medium=android_app&utm_source=share&context=3 

Should've bought a lottery ticket ffs",1
All hype was true around Abdul it seems,4
Stop swinging blindly when you've the power.,3
Close your eyes and Swing,2
Come on now Samad be smart here get Kanos on strike,5
Kane mama 😢😭,5
This is Why Samad came in. I think SRH has finally got the 11.,9
Future Yusuf Pathan. Now don’t @ me.,10
This is already a hard total.,3
Play for the slower one.,3
Swing Samad,4
Kanos should keep the strike,2
That would have been a wide,2
Commentators not taking chances by pronouncing Nokia's first name. His entire name is a mispronunciation trap.,10
Srh just feels so weak idk why,5
"I'm loving Kane's batting, he's just placing the balls and has a high strike rate also love how he stays in the crease when he's at the runners end.",9
Lol Pant,2
Rishabh batting behind the wickets as well,9
Thanks Pant,6
170 170 170 cmon,4
Maar Samad maarrrr,2
Nice,2
:'(,6
Why is Rabada fuckin good at death,13
This ground is surprisingly big.,3
Have Delhi bowled at Sharjah...?? Would test their death bowling,4
He deserved that fifty 😭😭,15
feel sorry for kane but I love rabada fuck,8
NOOOOOOOOOO,2
Kanos gets a 100 from me,8
That would be six at Sharjah,3
"Rabada, so good.",3
Rabada is so good. Why is he not in SRH T.T,7
Come on Pant,1
That'd have been Six in Sarjah.,11
The intent. That's all we asked.. thank you.,6
Moral of the innings: Kane is going to carry SRH this season,4
Rabada should be banned,3
GG. Kane did his bit.,4
"PLAYED KANOS, NOT BAD",4
Kane's helicopter fell short - shame.,1
Hats off to Kanos,2
Fuck! How good is Rabada,3
"A top batsman in the middle order and suddenly you don’t collapse after your openers, and get a decent score.
Who would have thought",1
Atleast they reached 160 didn't expect that but Iyer bowled Stoinis at death,2
Shit,1
"Aah shit, good effort kane. Would have been dolmed without you. Take rest, we need you in the field. We need  to win this game.",3
Well played Kane mama. Don't even fucking think of dropping him again.,3
Rabada is the true OP fast bowler at the death.,3
Well played kanos,1
Rabada is simply killing this inning.,3
Nothing is working. Here we are looking at 160 and thing it's a good batting performance,3
[deleted],-5
Kanos ): but Rabada (:,0
Does anybody else think Shreyas Iyer is gonna be the next Indian captain? After Kohli era?,5
Rabada purple cap!,5
Oh no! Well played. It was a fine innings.,2
DC got Rabada for 4.2 crores...,8
"Imagine if they'd sent Kanos at 3 instead of the bottler, the score would be reading 170+ by now",6
Nice having you Kanos. Im a happy SRH fan today.,5
"Don't know why but I find Darren Ganga's voice very comforting. Same with Ian Bishop. Maybe its their CPL / WI connection, I don't know..",6
Williamson needs a new team this one cannot make room for him.,5
"Williamson is the only guy who looked anywhere near settled here , need change at the top",7
on that note what the absolute fuck is pant doing tonight,5
"Kohli be like,  ""oh betichod, death overs mein dot bhi hoti hai""",13
Lol kw played a Rashid Khan shot there. Show him how it's done rash!,5
Rabada just keeps delivering match after match after match,12
Excellent over this from KG!,5
"41 (26), good innings from Kanos.",11
Bhuvi and Khaleel aren't in greatest of form ... so all is not lost tbh.,6
"**19.4** Rabada to Williamson, OUT, full, 143ks, cross-seam, no room, Williamson looks to whip it to leg, but the slowness of the pitch means  he can send it only as far as the boundary rider at midwicket **160-4**

KS Williamson c Patel b Rabada 41 (26b 5x4 0x6) SR: 157.69",3
Rabada targeting kidneys now,8
"Poor Abhishek, always get 1 or 2 balls to play.",3
"Kane Anna, luv you raja! Great innings",4
Yeah Rabada is not going to cunted by unknown players.,19
"Feel bad for Samad

Rabada just too good",5
I'm not sold on Samad yet. He is not proper watching ball. Then again he is going up against likes of Rabada in his debut.,9
Williamson trying the helicopter shot :),5
"If Kane wasn't playing, our score would be 140/7 in 20 overs",30
And Rabada takes the top spot once again as the highest wicket taker so far with 7 scalps ahead of Shami,8
"Death, taxes and Rabada getting wickets at the death...",13
This commentary,2
163 is actually a good score here. Can totally defend,5
Rabada's 2 wicket per match steak continues,11
Rabada is god,8
Feel bad for poor Abhishek. Always comes at fag end.,8
smart catch ™,3
gave 5 runs in last over and 4 in this . Too fuckin good,8
"Lmao, Harsha is such a blatant Sunrisers fan",75
Lol the drama,4
What a fucking tragedy of an over.,16
"Oof that's poor

Missed by a big amount there, should've been a comfortable 2",14
Rabada is so fucking good at the death,9
Short run against Delhi. Feel like I have seen this before.,14
"Decent total, just need Rashid + Bhuvi to be OP again and we are good boiz",12
Well batted boys!,5
Always good to have Harsha for SRH games.,12
We are going to lose by 1 run aren't we,11
Solid score on this pitch,7
Rabada is insane. And he's not even in his prime yet.,9
Good call by the umpire on that short run. He was alert.,8
"Priyam Garg, Abhishek Sharma, Abdul Samad..why is SRH's Indian batting contingent straight from the U19s",7
"HISTORY REPEATS ITSELF, DC CONCEDING A SHORT RUN WILL THIS COST SRH IN THE FORM OF A SUPER OVER

IN THE NEXT EPISODE OF THE IPL......",10
lmao last over,5
"Those saying Kanos played a Helicopter shot, it's the uppish whip that he plays almost once every match. Not everything is ™ to India.",15
"Fantastic death bowling.....Earn your runs fuckers....No half volleys, full tosses",14
"Expecting Delhi toh cruise control the chase, and then go bonkers and lose by 10 runs",14
"Rabada too good man, looking better than Cummins, Jofra and Bumrah right now !!!",13
"Bc shourt run , you have all the time to run two. 

Warner and Jhonny need to make him run hundred time b/w wickets to teach him running. Trying to pull sneaky one when 10's cameras around.",7
Umpire signalling first bounce on the last ball of the over lol,7
Umpires making up for their mistakes,2
Great final over by Rabada. SRH was looking good for 180 at one time.,9
[Did not call it](https://www.reddit.com/r/Cricket/comments/j1xyyh/match_thread_11th_match_delhi_capitals_v/g72jokp/),5
Honestly it’s a HUGE ask to expect these youngsters to face arguably the best death bowler today. I really wish they get more game time in future games.,14
short run trauma,4
Did SRH forget Rashid Khan's six smashing capabilities!?,6
Can yall just open with the Hulk so I can go to bed soon pls Delhi?,4
not great but not terrible either.,4
Last over will give an orgasm to shitty SRH management,7
Rabada is a cheat code.Last we had a decent finisher we won the league (cutting) before and after that we always struggled to finish.,9
Rabada is so good at the death overs,3
Rabada is just so good man,2
calling it now. we are losing by one run,3
Delhi Capitals and one run short is still a better love story than twilight. Hopefully no petitions for this one. Lol.,0
So what's the call? Is 162 enough?,4
Kane hasn't played a single dot ball in this innings. That's a perfect middle order T20 batsman for you.,63
Tbh I think we have enough on the board. Just need our bowlers to get up to form again.,10
How long are the breaks in IPL? Not sure if I can keep myself awake for the second half of this game,2
"Any format, any day, any scenario: Rabada is a pretty safe bet",12
Will the famed srh bowling attack defend this total successfully?,6
"163 is a pretty good score. Might defend it. With Kane back in the field. And I'm calling it, Prithiv will run himself or someone out.",7
"DC fell at 158 for punjab's bowling yall, we got a real real chance here",14
"Exactly what we needed. Bairstow, Warner and Kane all scoring runs, some pinch hitting, now just need to bowl well and we are good.",12
Can SRH defend this? Brian Lara thinks they can!!,10
Shaun Pollock on cricbuzz predicted exactly 162 lol,12
"This Samad dude can really hit them, I think he can do a lot of damage against teams which do not have a death bowler as good as Rabada is.",11
"This is how poor captaincy can cost you a match. Examples

 - Axar did not bowl full quota despite being brilliant in the last two games.
 - Stoinis given needless over which should have gone to Rabada even if you wanted to bowl Stoinis.
 - Rabada, Nortje are strike bowlers who should be used when the batsman is new at the crease instead of following the template of saving them at the death. Then even folks like Samad come swinging and get one or two away.

Good captaincy would have restricted the score to less than 150.",6
"Classic SRH finish. Some people were saying we were whining when we're hitting at 5-6 rpo, you guys have something to add?",6
Kagiso with the 'that was a stupid ass question' body language,13
"3 required of last ball for DC and stoinis swings, edges it for a 4 & DC win.",4
"Yjb looked out of touch, but I have to assume the lack of depth is why he was so willing to play cautiously.... the dude destroys in ODIs at 110",6
This surface is literally made for Bhuvi. If he struggles today then I don’t know what else to say.,4
"Rabada low key wanted to be a boxer, now he's using the ball to hit people in the ribs.",3
Joint purple cap holder and economy just over run a ball as a death bowler. It’s just so fucking outstanding,8
Need to give credit where it's due. Delhi bowled wonderfully. SRH bowlers need to take a page or two from them and do their best today.,6
"Target: 160
SRH(2017) Could have defended it anyday.
SRH(2020) I have no fucking idea.",11
rabada is such fantastic bowler man. deserves every penny they're paying him.,7
We know the drill. Drag the game into 16th over and then Lord Chaos™ reigns supreme. Don't do anything fancy.,7
"Any other team, I would say it's easily chaseable. I mean CSK did it in the first match on the same ground.

But this is Delhi. We are pretty much memeteam while chasing.",6
[deleted],0
[removed],9
"RCB fans, if you could have Rabada, which player from your team would you be willing to give up? And don't say Dube. Who would you be willing to give up to make it interesting for Delhi?",4
i love this man,4
That was really bad death overs batting,7
"NGL, Rabada seems like a super fun guy.",7
"If no batsman crosses 50 and DC wins, Rabada should be MoM",10
I can already see Samad getting a 50(21) against RCB,15
Rabada's face looks too small for his head.,3
That's the fucking reason why Kane should be in the playing 11 smfh. Also make him open with Warner and let Panday and Johnny bat at 3 and 4.,8
[deleted],6
SRH is the only team which scores less/equal runs in first and last 10 overs.,6
Expecting khaleel to get tonked by Shaw,4
purple cap hype,3
Over rate has been absolutely shit this IPL. Even with 2 timeouts it's 20 minutes over what it should take.,11
rabada best bowler in all formats rn,5
160 abu dhabi > 250 Sharjah,5
Is rabada the best bowler in IPL 2020 till now?,12
[removed],2
"Our bowling isn't at its best yet.. I don't feel confident with this total. Let's see, if our bowlers could step up.",7
Rabada is our most valuable player. He's so consistent Delhi should pay him more than any other player.,10
"If Bhuvi bowls well, SRH will defend anything, if not, then easy cruise by DC.",7
"I feel DC have the slight advantage here, with the SRH bowlers not really putting any kind of pressure in the last couple of matches, and with the DC batting order being really strong. Unless Bhuvi pulls through, I don't really know if SRH have a chance here.",4
"Clearly Kane needed more time, he had to go all out and take risks because it was the last few balls but he would have scored more runs if he came in earlier",7
Another short run against Delhi.. who's up for another super over!?,3
Wtf was that Andrex ad lmao,1
">Rabada says the pitch is two-paced. The square boundaries are quite big too. So you need to bowl into the wicket

>Rabada says it is a decent total, and that Sunrisers batted well for it

*ESPNcricinfo*",11
[deleted],-6
Was I the only one who was expecting a promotion for Rashid Khan to go and tonk the ball in the last over?,2
"Hey guys, fucking braindead maniac here. Why don't Delhi replace the pom hack Bairstow with Wriddhiman Saha????",2
[removed],0
Who the fuck calls baby over a mini over,10
[deleted],1
Why was Bairstow ever played above Kane. Kane is the Fab Four for Christ’s sake,4
I think Williamson should play at 3. I don't think he should accommodate his preferred position because an inferior batsman can't play lower down the order.,9
[deleted],2
"Big boundaries and slow pitches is textbook Big Bash League. Promotes safe, albeit sort of boring, cricket.",6
Imagine if Kanos is transferred to CSK mid season *shudders*,6
This fkn indigo paints zebra is the most annoying advert after that douchey whitehat jr kid.,2
[deleted],1
"Boobie, do your thing please. I beg of you.",9
Shaw looks like a yuva neta from the Mahrashtra Navnirman Sena.,11
P E N E T R A T E,2
"Jfc, Bairstow has one 'bad' game and everyone's questioning his place in the side as if he wasn't SRH's best last year",9
Dhawan is thicc,1
We need the Purple Cap form Bhuvi today.,4
What is up with Ian Bishop and his excessive usage of the word *Penetration*?,7
"Can someone give me stats for Bhuvi this year?

I hear ""Out of form"" but I still see him being quite a good bowler (despite being wicketless)",6
Lets go delhi boys,1
"Fun fact: despite sharing the same surname, Luke Shaw and Prithvi Shaw are not related.",14
"SRH fans, do you think we'll have kanos after the mega auction? Warner and Rashid take up the foreign retainment. KW will obviously go for a shit ton of money. Would be nice to him at CSK as perfect replacement for Dhoni after he retires completely.",9
"Shri Kapil Dev:

Chaar chawanni ghode pe,

MC chintu teri ma...

T: I place on the horse 4 pennies

Chintu's mom sits on penis!",5
Ravi Shastri’s son Prithvi looks as fit as his father,10
I miss rapid wicket taking Bhuvi. He just lost his wicket taking ability after injury.,11
What is Iyer doing...,6
Drinking benadryl with the bois.,4
*Goti muh mein thi*,6
Samad looks like the protagonist from a periodical drama.,8
SRH needs some luck there.,6
Damn we gon lose.,1
First wicket for Boobie. I'm happy,21
There's my Bhuviii,25
"Gone

First wicket for Bhuvi this IPL

Hopefully the first of many",5
Literally Sehwag,5
"Damn bhuvi looking back in form, this is a dream today",11
"Vintage Bhuvi, fuck what a ball!",13
Ponting and Kaif really seem to enjoy each others company,7
LOL. Kris Srikanth is a comedian.,3
I try so hard to not swear in front of my parents but I fail everytime,9
Poor from Shaw. You are supposed to be in contention for the test opening spot.,8
Ravi Shastri Jr. didn’t do much today,6
I knew Prithvi would shit the bed,0
For all you Bhuvi haters out there,7
booby,2
Shaw should be dropped for Rahane. Super unreliable and always drop a catch each match.,2
Why do Cameramen keep showing us these random women without an intro ?,8
Zoom into ponting's face a little more,4
That swing man how much I missed it.,8
"Prithvi shaw ki WhatsApp chatein bhi leak kro ..

Benadryl hai kya??",4
We are going to bring Bhuvi and Khaleel back to form aren't we,4
Bhuvi 😍,9
Bhuvi has magic,3
DC’s chances today depends totally on the stable and dependable batting of Rishabh Pant.,7
fucking doraemon,8
No rahane again! Wtf,1
Bhuvi becomes a beast when the pitch has even a little bit of assistance for the bowlers,11
"**0.5** Kumar to Shaw, OUT, don't need slip for this. SRH have their early wicket. Short of a length, lovely outswinger seam, ball lands on it and kicks away, taking the outside edge as Shaw looks to punch it. Bairstow takes the catch **2-1**

PP Shaw c &dagger;Bairstow b Kumar 2 (5b 0x4 0x6) SR: 40.00",5
[removed],6
"I went to pee and awicket down. Who,? How it happened?",5
Bruh what the fuck is that disgusting donkey licking ad,10
"Who tf would be chanting SHREYAS, SHREYAS.",7
Gotta love YJB’s cheeky grin whenever he snags one. Looks like a kid that’s just spent £1.50 on 10p sweets at the corner shop,10
"*28 September Prithivi Shaw in interview* : This year I will play more grounded shot and won't make silly mistake.






*30 September*- hahahahaha 😂😭😂😭😂😭😭😂😂",8
Sanjay explaining Bret about seam bowling in the dugout.,12
Time to get Rahane in for Delhi. Shaw is terrible against any kind if movement.,0
"Okay, now it looks like the Sunrisers are having fun

Phew! This game has been a relief in general",5
"Breaking news: the White House has been hacked, the hacker is threatening to release nuclear codes to Russia. Not much is known about the hacker but sources claim he goes by the name ""Chintu"".",30
Bangar is 😴😴😴,7
"Better throw and Iyer's in huge trouble there

Great first over from Bhuvi",6
PP Shaw,2
And Shaw continuing the hit/miss form,2
That ad what in the hell was that about?,3
Shaw was supposed to be best if sachin and sehwag but unfortunately he took worst qualities.,5
[deleted],0
Dhawan needs to play a big one for DC to have a chance.,1
"interesting fact about prithvi shaw: he and rickshaw are not related, one is an automobile and other is a sportsperson (human)",18
"Heard a joke "" call me friends cause I am the most overrated shaw"" great pun.",5
Too close,1
Is P Shaw becoming an overrated player gradually?,-3
orgasming over Bhuvi and then I watch khaleel Ahmed. Mood kharab,1
Should have gone for it.,1
"Khaleel looked disappointed with that effort, anna calm down. Not everyone is jhonty",5
Leave the ball,1
"X has a bad game

Everyone: x is overrated, what a hack, who selected this loser",11
TNPL fielding that 😞,4
Khaleel is guaranteed x Factor the question is for what team,15
Shaw remembering he replaced Chand at Delhi,8
"Been in a shit mood since yesterday's match, bhuvi coming back to form is the only way I can recover",9
Rule 1 : Never trust Delhi if you're supporting them,6
For his own benefit someone should tell Shaw to get behind the line of the ball a little more. Cant stay beside the line of the ball and attack against international class bowlers.,3
Khaleel still doing his excessive celebration these days?,2
Some early signs of DC shitting the bed,7
Shaw is very mature for his age. I mean just in his appearance. Not a comment on his batting.,5
Tbh I wouldn't mind a Pandey swap for rahane,3
Don’t dismiss Dhawan if you want RRR to keep climbing...,4
Last rank team beating first rank team will be great for IPL,3
Khaleel Ahmed or Don Khaleelioni,6
