Comment,Upvotes
"Pretty sure KKR have zero chance of winning today. But hey, it's not winning that matters, it's the participation that counts.",6
"If we lose today, I call dibs on posting the sadness thread.",24
Please open with Gill and Tripathi today.,14
Jadhav and Dhoni partnership a key for KKRs victory.,56
"In b4 Kedhar Jadhav himself starts a ""Personal Apology"" thread on r/cricket for playing this match",4
"If Kedhar does not do something useful this match, he will only have himself to blame.",1
"*Announcement* : Guys few of us have written and E-mailed to Star Sports team for tonning down on Dhoni Ass kissing in their 90 Min Pre-show. Apparantly they have replied and said "" It's upto to producers & VT team, but we will look into it"". Please Watch today's Pre-Show and let us know if there is any shift from their usual "" Thala Dhoni"" "" Lion will Roar"" shenanigans. 👍",6
Curious to see if KKR would persist with Narine opening again,2
"Ideally, this would have been the match, our bowlers continued their upward trajectory. But I think Gill and Russell will have other ideas.",1
[deleted],1
Welcome to the Thala sux circlejerk thread!,8
"RCB boys, I bought a new book from the stationary today. Let the season of mind bending calculations begin. 🤗 Btw who should win and by what margin today?",2
How many of you remember KKR Vs CSK @ Eden Gardens in 2012. Where CSK needed 5 of 1 and Bravo smacked a full toss for a six at deep mid-wicket,13
I want a complete one-sided match so that SRH can be pushed up. That’s how we came to 6th from 7th and that’s the only way,2
My prediction batting first team will win the game,5
Watson and Faf will determine this game for CSK. I don't think the domestic Indian batsmen will be able to handle the KKR fast bowling.,1
I feel like the CSK middle order will come good today. Mighty Thala gonna troll our collective asses for doubting their chances.,1
"30 Min in and this is 3rd video of series "" Will Thala dhoni Roar again?"". Man at 39 Sachin had less expectations.",3
Pls give me some Banton to watch tonight KKR,4
Thala sucking off Thala like Indian media channels suck off mudiji,0
Pat Cummins' form decides the outcome.,5
I just wanna see dk and murali Vijay looking at each other with serious looks😂,12
"Dinesh Karthik as batsman: 30 (23), 0 (3), 1 (3), 6 (8) 

As captain: Trying every possible combination with the team's batting order. Sending himself before Morgan.

Can't be dropped because he is the captain. 

Press F.",6
Will DK and Vijay fist bump after the match...that's what I wanna know,9
"Hi folks, I generally don't do this, but here's a bit -- What's your opinion on Sunny's story on [ this r/cricket thread](https://www.reddit.com/r/Cricket/comments/j6or8p/heres_a_bit_from_sunny_days_where_gavaskar) today?",1
"Me: This should be a thriller match. Tense, CSK winning, winning six by Dhoni. Aww!

Also me: Dhoni suxx. I dont want to see another Jadhav-Dhoni duet. Spare me!",3
"DK and MSD, both have underperformed in this IPL. It's hard to choose one for the dream 11 team.",1
This match will be unique because both captains are being asked to consider Gambhiring themselves,2
[deleted],-1
"No matter who wins, rcb will come 4th cuz of their shit nrr",2
RCB should get Suresh Raina next year.,2
"I can't see CSK defeating KKR, sorry",2
"Taking 26 wickets, Imran Tahir was the highest wicket taker last IPL season. 

He was the third highest wicket taker (15) in the recent CPL which clearly shows he isn't out of form.

What's keeping him out of the playing-XI?",6
I'm sure Andre Russell will want to know Piyush Chawla's exact diet and fitness regimen that he has adopted over the last year.,3
Boys are we ready to meme dk into performing??,23
[removed],-6
Imagine being Brian Lara and have to praise Dhoni for 21 straight days. Tells you how after retirement cricketers life is not easy in carribian😂😭,5
Make. Tripathi. Open. Instead. Of. Narine. Also. Promote. Morgan. Up. The. Order.,1
Ffs CSK chase again,1
Love DK's new look. Hope that changes the fortune too.,5
"I've not started watching yet, but I can presume that the amount of times dhoni is mentioned in non-csk matches, today there'll be dhoni in each sentence",3
"Holy fuck DK without a beard, looks so different.",5
"CSK chasing.

Easy win for KKR.",6
Bruh DK,2
"Without a full beard, DK is an imposter.",1
Will we ever bat first or nah?,1
Fucking hell CSK are always losing the toss this year,2
">Narine opens

Bruh",2
Rajma Chawla dropped,5
Nice to see the Curran brothers playing for CSK today,5
"OK. KKR is doing one thing right at least today. Winning the toss and batting.

Let's see if we who comes out to open the batting.",1
Kohli winning some tosses and Dhoni losing thrice in a row. <Insert 2020>,5
[deleted],5
CSK are gonna struggle to chase on this used pitch unfortunately,1
"> Same XI for KKR. Chennai Super Kings have made one change: **Karn Sharma in for Piyush Chawla**

KEK",1
Aerodynamic DK,1
for a moment DK looked like that anchor Jatin Sapru lmao,3
"I feel csk will struggle a bit today. 

1. They are batting 4th on the same pitch used for both yesterday and today.
2. Havent seen much dew in abu dhabi. 
3. The ground dimensions are bigger so more running is needed and boundaries harder to come by. 
4. Batting second if opener gets out early i dont think middle order can sustain.",2
KKR chose to win!,1
Jadhav still in the 11. What does he contribute to the team?,4
"Karn Sharma for chawla .

What a change lol.

Why the fuck they can't try Kishore.",0
Hope Karn bowls better than Chawla,1
"DK is such a likeable guy, no wonder even after being cheated by his wife he still got to marry one of the cutest athletes in india ❤️🥰",13
Can we not do better than DK as a captain :(,-1
What does Narine have to do to get dropped? Just wanna watch Banton :'(,2
People were saying Patt Cummins is getting paid 1 crore for each match he plays. Karn Sharma is getting paid 5 crores for one match each year.,72
Karn Sharma selected- This little maneuver is gonna cost us 51 runs,13
"I just realised....

**Bois today is dk's day, murli vijay is in the opposite dugout**",15
CSK is chasing.. sigh😒,4
"If Narine opens, in supporting csk",2
We made a change after winning ? Wtf,3
[KKR last opted to bat first in 2015](https://twitter.com/deeputalks/status/1313834867558236161?s=21),14
"If narine is going to do well against any team it's csk, no real express pace bowler that can bounce him out. If he fails here he needs to either move down the order or get dropped. 

Do kkr have an indian opener that can replace him?",5
I'd be stoked if KKR pulls it off!,9
Whatsup with Chennai players and nipple pokies!,3
Guess Dhoni used up all the toss luck to the early part of his career.,14
I am getting heavy rps 2016 vibes  from this csk.,14
[deleted],-23
"I think they'll go with Narine on the top, one last time today and it will work somehow which obviously would be a disaster for KKR in the games to come.",4
My tamil friend called me a chamatu  (spelling? ) today. Was he taking the piss?,4
Surprise that CSK made a change but KKR didn't,3
 All the best Knights 💜,2
Could have used kuldeep to boost his confidence,0
"Morgan is a fucking madlad he should come in at 4 no questions asked, guy smashed Rabada like he was some gully bowler",2
You know you have screwed up badly when Dhoni replaces you with another player in the team.,5
I don't know why but I keep forgetting that KKR won multiple IPL championships,21
KKR has actually a brilliant xi like MI and DC. They don't have many gaps. The just need to be more consistent. The captaincy is a bit surprising.,6
Been raining all day feels like I'm in Manchester again,1
supporting kkr today!,3
Our management is braindead as fuck. They are gonna open with Narine once again and we are gonna be 5/1 by the end of 2 overs once again.,5
Chonker replaces Chonker,3
Really expecting a Karn Sharma masterclass/disasterclass today. Nothing in between.,2
Chawla dropped against his old team. Maybe Russell feasted on him in training all those years.,3
Come on. Let's see another Faf and Watto show.,5
No Banton. Boorrriiinngg,3
"> Trivia - The last time before today KKR opted to bat first after winning toss was in May 2015 - 69 matches ago.

From Cricbuzz. What the fuck?",99
All I want to see is CSK and MI lose.,10
"Anyone think that KKR will open with Tripathi and Narine and bat Gill at 7?

At this stage it honestly wouldn’t surprise me.",3
Kuldeep went from the most exciting new talent in India to a non-regular in ipl. Meanwhile Chahal is going from strength to strength even when he had to bowl at Chinnaswamy most of his career. Shows how important mental toughness is at the top level.,15
"Unless Kuldeep has forgotten how to roll his arm over, he should get a game, at least in games not in Sharjah",1
Why would KKR buy Banton with established pros like Alex Hales and Evin Lewis available at base price,0
Keep calm and  ~~trust MSD~~  pray to god!!,8
"|Rabada- 4.2 Crore|
|Karn Sharma- 5 Crore|
Makes you think",6
I am here just to see them lose...,2
"On paper KKR are stronger than CSK. However with Karthik being not a good captain and Dhoni being a better captain ,CSK have a better chance of winning the match. If CSK wins , they enter the top 4",4
"BC Imran Tahir might get injured bringing drinks, play him asap.",6
LMFAO picking the WK for your Dream11 team is the most boring choice today. Thala or DK?,4
"Almost at the half stage of the tournament, any news about letting crowds in? They said they were planning to allow crowds in the latter half of the tournament",1
"Did you all see the new jurassic world poster? Laura Dern, Jeff Goldblum and Sam Neill are all back. Don't really care for Crisp Rat that much personally but he's hilarious in Guardians.",0
[deleted],-1
"Karn Sharma gives CSK's bowling attack additional weight. That's good, isn't it?",2
"Imran Tahir only runs & carries the drinks, because it reminds him of his wicket celebration",5
"I noticed something over the past few days, especially after KKR's loss versus Delhi. 

McCullum is being credited for everything good and DK is being shit on for everything bad. 

I feel for DK tbh, I've been impressed with the way he's handled the bowlers, although I agree that some decisions have been braindead. But does DK have full power? I doubt it. I think a lot of these fuckups are to do with Baz and David Hussey ""as well"", but DK seems like the convenient target. You look at Baz/Hussey interviews and you get the feel that they have huge say on stuff like batting order. 

I mean, after all Baz opened with Narine in the CPL, so there's a good chance that he might be advocating for the same in the IPL. 

I think there's serious tension and conflict within the setup and it's kinda reflecting on the field.",62
[deleted],7
Amazing how under the radar has Faf been despite having such a stellar season so far.,1
Lmao was Dhoni bowling?,2
[deleted],-1
Wtf that doesn’t look like dk,1
Chawla spoke so much about this contest Vs his former team [here](https://youtu.be/NXxbui-kqzA)  only to be replaced eh???,3
Looking at these teams you see how OP MI and DC are with their bowlers.,6
"So Nehra not even trying hide anything.

Dhoni's CSK and King Khan KKR

Will he say in another match Ambani's Mumbai Indians?",5
Dhoni should’ve played M Vijay for the psychological advantage smh,27
Will Chennai ever bat first this year?,7
TRIPATHI!!!! LESSGOOOO,6
"Yeahhhhhhh, RAHUL TRIPATHI",6
And its TRIPATHI. Yay!!!,5
finally some sense in the KKR management,7
Thank you!!!!!,3
Finally a change of openers by KKR,4
Happy Birthday DJ Bravo. Turning 37 today,8
">Trivia - The last time before today KKR opted to bat first after winning toss was in May 2015 - 69 matches ago.

That's some stat. But understandable bringing Eden Gardens into consideration.",9
"""This is the 33rd toss KKR have won since they last chose to bat first back in May 2015"" source: cricinfo",7
Tripathi finally,3
Tripathi opening gives me hope that Morgan will come at 4,2
"Tripathi, my man, please don't let r/cricket down!",5
Csk is being chasing in all the matches in ipl 2020 until now...,3
"Rejoice my Brethren, our wish has been granted.",4
"Dint Expect Piyush to get dropped outta nowhere. CSK changing team for no reason is shocking. 

Bad for me as Chawla was my constant in Fantasy, as he's cheap and gave decent points.",2
Specialist fielder Jadhav is underrated,2
"Why isn't Vijay playing tonight?
Would have been fun ಠ_ಠ",1
Do csk basically bat till 11 ..,2
Karn Sharma must be the least well-known cricketer to play all three formats internationally for a top nation.,11
"Damn, a sensible decision by our management? What is this world coming to?",7
So who is up for a test match?,6
Now if only Eoin could come up ahead of Karthik.,9
"RCB boys, I bought a new book from the stationary today. Let the season of mind bending calculations begin. 🤗 Btw who should win and by what margin today?",1
"Change in opening order, yay!",1
great shot,1
"Deepak Chahar, Rahul Tripathi and Dhoni. Nice tribute to RPS",6
"Csk doesn't have an out an out pace bowler...Narine gamble could have paid off. 
They made him open against quicker guys man.",2
"Know your limits Master Chahar, no one could have swung it that much",6
Finally KKR giving the narine experiment a rest,4
I hate our bowling so much,1
Already a better start than Narine,6
Thank goodness they opened with Tripathi. I thought they would open with him after they played 12 or 13 matches /s.,2
"Told my grandma to skip her sleeping meds today. Snooze-fest, this match. She'll sleep by 9 easy peazy.",-1
Tripathi looks a million dollars,1
"Woah Tripathi is a Maharashtrian boy, gotta support KKR today then!",11
Good seam position tho,1
should narine have opened today? since csk doesnt have any express pace bowlers,8
Jesus the KKR camp looks dead,1
Jadhav and Dhoni partnership a key for KKRs victory,3
Karn Sharma makes 5.2 crores this season,2
"Bring russell at 3 , there is noone in csk bowling who can intimidate him.",2
"Kedar jadhav is just OP. 

He doesn't need to do anything to get in the 11.",5
"Brett Lee's bias for KKR is obvious. 

After all, he's BingaLee.",128
Finally Narine is not opening,5
"Good fielding,but looks in",1
Dhoni to Tripathi:- shankar Ham tmko pala hu!!,3
He clearly reached?,1
Glad Tripathi is opening,2
Bruh Karn Sharma looks like a mob-boss.,6
Dude that's so clearly not out. Why tf you gotta waste time like this?,10
Out,1
"Go subhuman Gill, Go!",2
Bro wtf. The umpire was not even looking at the stumps.,2
"These umpires are making easy money. No work, all pay",7
Lol why he referred to 3rd umpire we never will know,2
Karn Sharma looks like a BJP leader with 3 riots already under his belt.,118
OMG the wicket is **B R O K E N**,4
Remember when Faf got Parthiv runout in a final? Similar runout.,5
How Tahir hasn’t played a single game is beyond me.,1
umpires waste time for bs like this and then have to give soft signals for catches that happen 70 metres away,20
Sam Quran,5
What intent we seeing today?,1
That cringy “the game” ad from State Farm for Willow viewers. Gets me every time,1
That was a sexy shot,2
[removed],2
4 saved :/,2
"Sam Curran is our main attacking bowler, don't know to laugh or cry looking at CSK bowling attack.",15
Great shot by Gill but big oof,2
There is no shot more beautiful than a straight drive for 4,5
CSK attack is one bowling lineup Narine could've possibly succeeded against. Interesting choices KKR have made.,8
What's the par score here? 170?,3
"Sometimes I wonder how it must feel like to be

Mark Waugh

K Pandya

Tom Curran


...


You are better than so many people but not best at the dinner table at home.",90
Nothing comes close to **Warnakulasuriya Patabendige Ushantha Joseph Chaminda Vaas**,23
Bro that was a beautiful ball.,2
My mom keeps talking about how focused Sam looks when he bowls and that I need to have the same focus and dedication in life.. thanks for the pro tip mom,28
"Who has been the most impressive this IPL?

Devdutt, Gill or Shaw?",1
"Russell leading the huddle lol

DK simp",7
"Never seen Fleming this animated, he is been lit in last 2 matches.",10
"Rahul tripathi plays 13% slog sweep against Pace?

Wtf",10
Someone tell these guys the Sheffield Shield doesnt start till Saturday,10
There's something similar about DK and Tripathi batting style.,3
"Anathdapadmanadhan appears

Commentators: ah yes , content",62
Risky run,3
[deleted],9
Never hit the stumps directly when it really matters.,4
Hope Rahul Chipathi knows these are the powerplay overs.,11
Id love to go on a date with Sam Curran. Such a cutie.,11
Glad they are not opening with Suresh Narine today.,6
"Good to see kkr learning after losses


Removing a non utility naik after first

Making batting line up stronger after second

I feel more confident now",12
Can these commentators stop about big name bullshit,7
lmao games so boring already that the comms have to talk about the umpires name,11
Curran has been surprisingly good this IPL,17
Is Shubman the only Gill which can breathe out of water?,17
Harsha Bhogale :  **shriporwarmara attapattu jaisurya natwar shriramkrishna shivavenkata﻿ rajashekhara srinivasna trichipalli yekeparampir perambdur chinnaswami muttuswami venugopal iyer**,64
Karn Sharma better fielder than Chawla,5
"https://youtu.be/saTxhIaatis

Harsha Bogle today",3
Direct hit would have been out,5
ANANTHAPADMANAPAN,2
"*hits to Jadeja* 

*takes a quick single*

:-?",14
What's up with those risky singles,4
Just don't get runout man,3
If he was playing Australia Jadeja would have hit both of those. Dude never misses against us,84
Is Tripathi on a suicide mission wtf,1
Holy fuck jadeja throws like a gun,6
The crowd was really excited about that single lol,10
"Why would you bowl short when the ball is swinging, or when you have no deep midwicket?",3
karn sharma is in for piyush chawla simply on the basis of not being as much of a chunky monkey,5
"First Piyush Chawla now Karn Sharma.

The real reason for their inclusion is finishing up the leftover buffet.",3
Ok now it looks like KKR is playing cricket. GG,5
Pakistan is proud,2
Love chennai match threads,10
"I feel we r up for another gill special today

That straight drive n this pull",7
Beautiful by Gill,5
Shardhul with that great effort,3
You know the guy is a true Sr Developer when he looks dead from inside,15
[deleted],12
Can't believe Thakur is our specialist death bowler fml,17
[deleted],1
Why are they risking their wickets for singles? Wtf,4
That's a four,4
Bruh Gill would be an elite ODI player,7
4 bitch,2
LORD Thakur🔥,3
"Tripathi

Start swinging ur lathi (bat)",4
"KKR actually looks dangerously strong on paper. Abundance of in form Indian batsmen. Morgan + Russell, probably the best complimentary pair. Cummins + 2 talented Indian uncapped fast bowlers. Narine, Kuldeep and Varun. Surprisingly they haven't performed upto their mark. I think they're not far from MI or DC strength.",23
Do reserve playes get paid the same amount as they were taken in the auction?,8
4 but good effort,3
[deleted],10
Six,1
Ugh stop looking at that and just declare a boundary,5
WTF!! All 11 players in CSK can bat,9
It's a boundary!,3
How did that take so long lmao!?!,1
Shardul Thakur was the number 10 for India after Sachin. He got so much flame for that.,5
Why are they not playing Lachlan Ferguson?,3
Thakur's gonna bowl 180 kph against Tripathi lol,1
"Hotstar is having some issues, ahh man",1
i don’t know how bad I’ll hurt dk if he comes to bat before morgan today,2
Why were they weren't playing tripathi ffs?,5
that’s just sloppy bowling from chahar,3
"**Rahul Tripathi's IPL batting record for Powerplay overs (1-6)**

- 414 Runs

- 272 Balls

- 34.5 Avg

- 152.2 SR",11
They couldn't zoom in on his pinky and the ball so we could see lol,3
Kkr finally getting a good first few overs. I wonder why.,11
Chahar can just bowl outside off and keep a good line. But why do that when you can needlessly try to vary and bowl medium pace bouncers?,2
"Deepak you stupid fuck. The ball is not only swinging, but you also don't have deep fine. You have just been smashed over deep midwicket for bowling short as well. So WHYYYYYY would you bowl short?   


Gosh some cricketers really lack some thinking do they",6
Irfan Pathan Seeing 129 Kph Chahar getting carted makes his blood boils. Even though Pathan lost his potent swing he was equal to chahar in pace wise 😭😂😭,2
Chahar boi hasn't been upto the mark after contacting Covid-19,5
R A H U L.    C H A P A T I. exe,3
How many ads did Dhoni act during lock down.,5
"Chahar already bowling 3 pies to Tripathi in 2 overs

Fantasy league ka chakkar babu vaiya",7
I can imagine csk fans emotionally asking for a poll on twitter about the boundary if kkr win by 1 run,2
Thakur providing all.the shard,5
Does KKR have a replacement for DK ? Someone who can hit better ?,2
[deleted],6
I deeply thank DK for finally using his brain and removing Narine from the opening.,7
"Lmao Watson on field is exactly like my father going to bed every night.

*S L O W*",11
So /r/Cricket is right... Narine is a shit opener.,14
mAkEs ThInGs HaPpEn,6
GoDaddy!!!,4
Let's go KKR!!!,3
Why tf is everyone bowling on leg to tripathi with fine leg up,13
Imagine benching Tripathi so that your no. 8 can open 🤡,31
"***field set for bowling wide of off***

Chahar : K imma bowl short

***insert gif of OHHHHHHH in rap battle***",8
Stop bowling down the leg,2
Excited for Tripathi,1
Fucking bowl on the off-side csk,2
tripat-hit is too cringe to be on that megatron,9
"Ayoooooo....
I see 200+ score already.. which CSK will struggle so badly to chase 😭",8
Is there a particular reason why Karthik is selected as a Captain for KKR over Eoin Morgan?,1
Most singles in a powerplay?? Can someone give some facts,1
Memories of Royal Ultra Megatron Galvatron Super Giants' Chapati smashing bowlers around in 2017.,3
[removed],8
Tuk tuk Gill,1
Tripathi may never play for India but he has enough skills to be a IPL giant,3
Shite bowling Sam,1
I wanna brush Sam's hair and feed him grapes and tell him about my day while some Iron and Wine plays in the background,14
Is DK still the captain? I'm glad Tripathi is opening,1
Tripat-hit is a dogshit pun,8
Yeah.. Narine definitely not going to open the batting anytime soon after this.,7
"\*sanitation worker sweeping*

Tripathi: ""Yeh main karta hu, aap jaa ke Dream11 pe team banao""

If you know, you know ;)",2
Tripathi looks like dk,4
"Ofc today, they fix their lineup",6
[deleted],44
Just wanna see some Russell/Morgan/Dhoni show today,1
[deleted],1
Does anyone face a problem with smart tv routinely logging out of Google account ?,1
Tripathi to Management- You could not live with your own failure. Where did that bring you? Back to me,5
[removed],9
I can only see CSK getting hammered so bad,7
Can't wait for Lord Thakur  vs Russell and Morgan,8
See what happens when you actually play an opener?? Who could’ve seen that coming,47
"I'm calling it mi,dc,kkr in top 3(not in that order) rcb's nrr is just too shit",6
Every four Tripathi hits is a fuck you to DK and the team management.,30
Tripathi have already justified his promotion.,11
"That's the face of a man who is relishing being back where he belongs. Happy for Tripathi, great start.",5
I don't think CSK ever had a decent bowling line up ever!,0
"Slowly RR is creeping up, need wicket.",1
is this boundary short like sharjah?,1
So happy to watch Tripathi open,6
Pretty surprised to see that Tripathi is 29. I thought he was 25 or 26.,2
Morgan will bat 9,6
Sammy runs in with a face of a kid who larps as the evil power ranger.,1
A'ight. Sam's stay in the CSK side is coming to an end lads. Sad but that's how the management works. Expect Tahir or Ngidi/Josh in next match.,2
Why has this Tripathi guy not just got out for 7 off 5 like Narine?,4
Since 2015 this is the first time KKR won the toss and elected to bat first!,1
Tripathi getting ready for Mirzapur 2,3
"Happy we got a solid opener

Sad narine not gonna open against Rcb in Sharjah",5
Thakur Boi into the attack. One wicket this over,5
HEY RIKNU!!!,1
Dugout guys need to keep talking out Tripathi...,1
"Why doesnt KKR have more muslim players?
Very few muslim players dont do justice to Kolkatas demographics",-9
Tripathi looks in great form. surely he would've been hitting some in nets too. took too long for master tactician coach sir mcculum to notice that.,4
LORD IS HERE!!,4
Tripathi's 2017 season for Pune is super underrated. 391 runs at a strike rate of 146 for an opener is fantastic. Was really crucial in their run to the final.,9
"Contrary to the prevailing belief here, I’d say KKR should have gone with Narine to open today, because it is against CSK and their powerplay bowling is very ordinary.",-1
Shurdul Takkar,6
My Boi Shardul is gonna bowl better than Deepak,10
“Shurdul tukkur”,3
Rahul really was a popular baby name in the early 90s,4
Our bowling attack sucks man.,3
"Do not jinx Tripathi. I repeat, DO NOT JINX TRIPATHI.",5
Calm.and risk free innings so far,1
"Rahul Tripathi's Cricbuzz profile- 

“The **Maharashtra-born** right-handed batsman burst into the scene from nowhere after putting up a stupendous show for Rising Pune Supergiant in the 10th edition of the Indian Premier League (IPL). The **Ranchi-born** batsman...”

Exactly how many times was Tripathi born?",7
Was that Dhoni calling it a wide?,4
"Ffs why does every team make necessary corrections against us... should've played Narine but no, we get inform Tripathi.",5
