Timestamp,Comment,Upvotes
2024-04-08T12:51:40+00:00,"Will Thala bat today?

Will Chennai cum in unison upon seeing him bat?",4
2024-04-08T12:51:40+00:00,"KKR has an extremely shitty record against CSK which gets overshadowed by their ungodly record against MI. CSK, despite losing having 2 points less having played a game more are no doubt favorites at their home ground. Their loss to DC was bad but losing to a spirited SRH team can be excused. KKR mauled DC and beat RCB comprehensively but they're the two worst teams of this season. Their other win was against SRH and that was a good game overall which showed both side's strengths and weaknesses. Only if they win today should KKR be considered as one of the top dogs for the play-offs, and only then should CSK fans think their team is in trouble. If not, then CSK will continue on to be favorites for the play-offs as always and KKR will try to prevent a slide that haunts them at the middle of every season.",6
2024-04-08T12:53:37+00:00,Choker super Kings vs Keh ke Haar?,-4
2024-04-08T12:56:21+00:00,"Aj Kiska loha galega? 

T- Whose metal will melt today?",3
2024-04-08T12:58:56+00:00,Gaikwad vs Starc 💀,2
2024-04-08T13:05:04+00:00,My boy Deshpande bowling to Narine/Russell/Rinku today is already giving me nightmares 💀,5
2024-04-08T13:05:59+00:00,Whistle Podu,1
2024-04-08T13:06:09+00:00,we gonna loose but at least let it be a non humiliating loss,1
2024-04-08T13:06:27+00:00,Mukesh Starc vs Mitchell Starc,5
2024-04-08T13:07:38+00:00,nariane is gonna go ham today on csk,2
2024-04-08T13:07:46+00:00,"Since Harshit Rana is probably not playing, are KKR going to play that Indian left arm quick they have?

Edit: sorry Sakib Hussain is right armed",3
2024-04-08T13:10:24+00:00,Just bat with intent. That's all I ask. Don't go into a shell and become submissive.,7
2024-04-08T13:10:59+00:00,Either we’re in for a Narine 0(3) or 64(21) and nothing in between.,11
2024-04-08T13:12:22+00:00,narine and varun has to do a spin masterclass for us to have a chance,7
2024-04-08T13:12:47+00:00,Please don’t waste the Powerplay. That’s all I’m hoping for,16
2024-04-08T13:13:42+00:00,Powerplay decides the match....,13
2024-04-08T13:13:50+00:00,Looks like the battle for the last 4 would be more intense than the top 4.,9
2024-04-08T13:13:56+00:00,"CSK batsmen protec but they no attac (_Not you, Dube_, you rock)",93
2024-04-08T13:20:29+00:00,Please get bat to ball during pp. That's all I ask as a csk fan. That will be a win if we can just get past powerplay unscathed with a decent score.,3
2024-04-08T13:22:03+00:00,"Deshpande, Mukesh and Chahar against Narine, Salt and Russell. I have a feeling Chepauk will experience what we jokingly refer to pin drop silence.",8
2024-04-08T13:22:47+00:00,Gg knows the broadcaster game now. He will definitely give a hug to Thala today.,9
2024-04-08T13:23:26+00:00,Hoping for the same performance that we had last year in Chepauk,3
2024-04-08T13:24:16+00:00,watching this for narine,7
2024-04-08T13:27:16+00:00,"KKR look stronger on paper but CSK really need a proper template for bowling and not keep rotating them without any reason. It's probably Ruturaj's decision to do that but Dhoni needs to take control here and ask him to change that. If not , then they are just looking at another loss today , and maybe even more . Spin from overs 6-14 , that's what CSK need irrespective of the venue, it will win them more games , coz Spin with Dhoni behind the wickets and Jadeja/Theekshana bowling is a different game altogether. No other team has that kind of dominance , KKR come a close second with Narine and Chakravarty/Suyash , but not as good as CSK.",5
2024-04-08T13:27:53+00:00,"Pretty simple equation vs CSK. Get Ruturaj, Rachin, and Dube out - you've now crippled their entire batting innings",2
2024-04-08T13:28:51+00:00,Unbeaten team vs Team that lost to DC,9
2024-04-08T13:29:35+00:00,csk will win this one,4
2024-04-08T13:30:36+00:00,Mitchell needs to score runs at a better intent and rutu shouldn't drop intent,6
2024-04-08T13:31:29+00:00,"This will be a spinfest, ugh.


Jaddu to look like a world beater again on a tailor made pitch for spin.


But conversely, KKR benefit from a dry turner too.


Either way, spin will determine the outcome of the game.


I hate Chepauk games as a former pace bowler myself. 


But hey ho, c'mon KKR!!! Supporting KKR for this one for obvious reasons.",5
2024-04-08T13:32:09+00:00,Toss lost already 🥲,1
2024-04-08T13:32:24+00:00,Ruturaj needs some public speaking training,6
2024-04-08T13:32:27+00:00,Ahhh. Winning the toss!,3
2024-04-08T13:32:38+00:00,LORD SHARDUL IS HERE,5
2024-04-08T13:32:41+00:00,it smells like A Rizvi masterclass today,3
2024-04-08T13:32:49+00:00,Our Lord has returned.....,4
2024-04-08T13:32:50+00:00,LORD SHARDUL,4
2024-04-08T13:32:58+00:00,Lord Shardul hath arrived,3
2024-04-08T13:33:00+00:00,THE LORD IS HERE,6
2024-04-08T13:33:12+00:00,Shreyas who Tf picks tales mann!,1
2024-04-08T13:33:13+00:00,Totally not panicking rn,6
2024-04-08T13:33:19+00:00,Comeback of lord thakur 🛐🛐,6
2024-04-08T13:33:21+00:00,"Weird toss, Rutu checking the coin lol",3
2024-04-08T13:33:23+00:00,This bowling lineup can either all out the other team in 15 overs or concede 220+,4
2024-04-08T13:33:30+00:00,Lol no Deepak and Pathirana. 250 loading.,4
2024-04-08T13:33:33+00:00,"Shardul plays today, so Dhoni bats at 9",8
2024-04-08T13:33:35+00:00,"That guy who gave the coin to be tossed was so happy just to be there. 

Man I want such happiness in my life too.",25
2024-04-08T13:33:37+00:00,Finally rutu won the toss,3
2024-04-08T13:33:39+00:00,"LESSGOO no Deepak and Pathirana 

Game on for Sunil Narine & Big Dick Dre",11
2024-04-08T13:33:44+00:00,Look at the amount of sweat on the captains already ... dew is gonna destroy the 2nd innings!!,9
2024-04-08T13:34:13+00:00,Supporting csk first time let's gooo,2
2024-04-08T13:34:16+00:00,Gaikwad has lost his wickets to left arm pace quite a lot of time,6
2024-04-08T13:34:22+00:00,Harshit is FINEEE,7
2024-04-08T13:34:29+00:00,game will be over if CSK struggle to get Narine out in the first 3 overs,8
2024-04-08T13:34:33+00:00,Thakur and Mukesh against Russel and rinku is something I'm not sure I want to witness,22
2024-04-08T13:34:47+00:00,Star Sports trying to brand this game as a Gambhir vs Dhoni rivalry. These are the people from both the sides who are gonna have the minimum impact,90
2024-04-08T13:35:01+00:00,Lord to serve all 😭,6
2024-04-08T13:35:03+00:00,Rutu after losing 4 tosses in a row has trust issues now lol checked the coin himself,22
2024-04-08T13:35:26+00:00,Finally lord shardul is back,5
2024-04-08T13:35:29+00:00,![img](emote|t5_2qhe0|21498)![img](emote|t5_2qhe0|21498)![img](emote|t5_2qhe0|21498),4
2024-04-08T13:35:41+00:00,Huge game. HUGE. Are Fiz and Pathirana back from visa land or wherever?,2
2024-04-08T13:35:44+00:00,Fuck all these players are glass figurines.. every match atleast 2-3 players have niggles,11
2024-04-08T13:36:04+00:00,Lord please done come in clutch for today 🙏,2
2024-04-08T13:36:13+00:00,"190 is par

Our batting should make at least 15-20 above par 

Can’t trust Starc..",2
2024-04-08T13:36:15+00:00,I have a feeling that CSK are underdogs today considering how well KKR have been playing,5
2024-04-08T13:36:19+00:00,Probably Today is the day when kkr's opening will fail,2
2024-04-08T13:36:25+00:00,Let’s go Narine….love watching him bat![img](emote|t5_2qhe0|28120),1
2024-04-08T13:36:49+00:00,Narine isn't scoring today. Things cant get that crazy.,3
2024-04-08T13:36:53+00:00,Our pace factory is broken yet again,7
2024-04-08T13:36:58+00:00,1-4 at toss for Rutu,2
2024-04-08T13:37:01+00:00,">Shreyas Iyer says. ""The approach and attitude has impressed me. The way we have adapted and played fearless cricket...pure bliss.

Lol ""pure bliss"" is such a weird way to end that sentence, I love this guy",4
2024-04-08T13:37:04+00:00,Lord will be MOM,2
2024-04-08T13:37:08+00:00,Good to see lord back in finally. Too bad it's due to forced changes. A gem of indian cricket to be made to sit out even in a team like csk.,4
2024-04-08T13:37:25+00:00,Fizz and mini malinga back for csk?,3
2024-04-08T13:37:50+00:00,"When players like Jaiswal, Salt, Warner, try to play fast they get out but Narine does not. Why ?",2
2024-04-08T13:37:54+00:00,CSK on they're way to lose ....,0
2024-04-08T13:38:16+00:00,Whose nudes does Theekshana have,2
2024-04-08T13:38:22+00:00,"As a KKR fan, we are taking an L today. Fizz has been great.",2
2024-04-08T13:38:23+00:00,277 in danger tonight,1
2024-04-08T13:39:20+00:00,Badree was out there looking like a Mylapore uncle lmao,5
2024-04-08T13:39:28+00:00,No pathirana? Csk fans have their excuse ready if they lose today,4
2024-04-08T13:39:48+00:00,I want to stay humble but man the kind of fanfare CSK's struggles seems to ensure is disheartening. Long shot against this kkr but hope CSK win today to put all the anti CSK crusade to rest.,6
2024-04-08T13:40:01+00:00,"am here early early. 


i wish we were chasing but if we make 230+ we'll definitely win this",3
2024-04-08T13:40:13+00:00,Rizz and Fizz bacc,7
2024-04-08T13:40:29+00:00,"It's time

GG vs MSD",2
2024-04-08T13:40:32+00:00,CSK is not the same after DC game![img](emote|t5_2qhe0|28120)![img](emote|t5_2qhe0|28120),6
2024-04-08T13:40:34+00:00,Honestly Rutu looks under pressure since captaincy responsibility..,3
2024-04-08T13:40:37+00:00,"Russell at MA Chidambaram 

8 Innings 

205 Runs (Highest after Eden)

41 AVG (2nd highest after MACA)

149 SR 

Highest score - 88* (Highest among all grounds)",7
2024-04-08T13:40:43+00:00,"Thala Dharisanam ❌

Lord Dharisanam ☑️",6
2024-04-08T13:40:43+00:00,I knew it they're using Shardul as a Chahar contingency plan,5
2024-04-08T13:40:47+00:00,How much KKR need to score 190 - 200 should be enough ?,5
2024-04-08T13:40:49+00:00,Dew will surely affect the second innings,5
2024-04-08T13:40:53+00:00,Thoughts and Prayers with Tushar and Shardul,5
2024-04-08T13:41:16+00:00,Bruh chahar also injured,2
2024-04-08T13:41:21+00:00,"So if CSK wins today: CSK wins even against KKR. TFAR!

If CSK loses: this CSK loses even to KKR. TFAR!

Am I doing it correct?",4
2024-04-08T13:41:23+00:00,What does podu in whistle podu mean ??????,3
2024-04-08T13:41:32+00:00,How does Theekshana get selected every time.,3
2024-04-08T13:41:41+00:00,If mitchell doesnt even work today..Drop him and promote rizvi up the order,3
2024-04-08T13:41:45+00:00,"CSK fast bowling today is Shardul, Deshpande and Fizz. Surprisingly Deshpande has been their best bowler over the last 3 games.",8
2024-04-08T13:41:58+00:00,"With the batting power of kkr, i just can't see the possibility where they score any less than 190",6
2024-04-08T13:42:02+00:00,Thakur and Deshpande against that batting god forbid what we about to witness ..,6
2024-04-08T13:42:10+00:00,Pathirana should take proper rest & should not play till he's fit. Will be important in later half.,9
2024-04-08T13:42:12+00:00,Kept Theekshana dropped Moeen Ali .Thank you I guess,6
2024-04-08T13:42:16+00:00,Shardul will take a 2-3 wickets or will leak 40-50 runs nothing in between,6
2024-04-08T13:42:58+00:00,"Rinku 

Russell 

Ramandeep 

U don’t deserve to be in Top 4 if u can’t score 200+ with these finishers on this track

Gonna go harsh on this team if they disappoint",10
2024-04-08T13:43:02+00:00,"damn all these Lord Shardul deniers,

Blasphemous the lot of you",7
2024-04-08T13:43:16+00:00,"If you watch cricket and have watched Thala , He never had happy ending ...

He had chance last year but refused to give up ....",7
2024-04-08T13:43:20+00:00,Chasing is gonna be easy here. Tough task ahead. I have too much PTSD of losing to csk on last ball boundaries,4
2024-04-08T13:43:48+00:00,how am I seeing comments about how both teams will lose lmao,9
2024-04-08T13:44:42+00:00,"Looking forward to see Vaibhav. Genuinely love him. Tall , pacy , can swing both ways and has a good bouncer",2
2024-04-08T13:44:42+00:00,Narine to break his highest run score again,3
2024-04-08T13:44:55+00:00,A lot of goalscorers in the Kolkata team,2
2024-04-08T13:45:11+00:00,Shreyas is pretty underrated captain ![img](emote|t5_2qhe0|30516),1
2024-04-08T13:45:16+00:00,I'm anxious 277 may break against college level bowling of CSK..,4
2024-04-08T13:45:58+00:00,This Match should have been on the 730 slot yesterday rather than lsg/gt,5
2024-04-08T13:46:01+00:00,"Deshpandey 

Fizz 

Shardul 

Theekshana 

Jadeja 

Daryl 

Rachin

Bowling lineup",2
2024-04-08T13:46:15+00:00,Deepak has failed his own career by not improving his fitness. Could have been a regular in the Indian side with his ability to swing the ball and bat at 8.,5
2024-04-08T13:46:29+00:00,Moeen would've been better than Theek,4
2024-04-08T13:46:35+00:00,"Highest Strike Rate for a Batting Pair in IPL 2024 (70+ balls)  
  
Sunil Narine - Phil Salt: 217  
Heinrich Klaasen - Aiden Markram: 197  
Rohit Sharma - Ishan Kishan: 193",5
2024-04-08T13:47:02+00:00,"Should be a good match. I feel KKR has edge, they've 60% chances of winning today.",2
2024-04-08T13:47:20+00:00,Almost forgot that KKR even has Gurbaz in the team. This team is stacked,2
2024-04-08T13:47:23+00:00,Shreyas just sleeps said same team😭,1
2024-04-08T13:47:28+00:00,"The guy who scared my ass was Deepak Chahar bcs of his swing vs our top order 

Confident but not overconfident after he’s not included",1
2024-04-08T13:47:38+00:00,dropped moeen but theekshana is still here 🤷🏻‍♀️,3
2024-04-08T13:47:47+00:00,Another day Santhner not getting game 😐😐😐,6
2024-04-08T13:47:53+00:00,"Fizz, Moeen, Russel and Narine all play for Comilla Victorians. It'll be interesting to see how they counter each other.",7
2024-04-08T13:48:01+00:00,"Daryl your kids are watching, expecting a good one from you",3
2024-04-08T13:48:03+00:00,Is Harshit Rana injured?,1
2024-04-08T13:48:07+00:00,I'm sorry Chika is shit in Hindi comms guy can't speak ...,3
2024-04-08T13:48:11+00:00,Only Lord Shardul can save CSK now,2
2024-04-08T13:48:15+00:00,Og lord and new lord playing together for the first time. We’re in danger,34
2024-04-08T13:48:32+00:00,"  
**Kolkata Knight Riders Subs:** Suyash Sharma, Anukul Roy, Manish Pandey, Rahmanullah Gurbaz, Sakib Hussain  
**Chennai Super Kings Subs:** Shivam Dube, Moeen Ali, Shaik Rasheed, Mitchell Santne, Nishant Sindhu",4
2024-04-08T13:48:46+00:00,Csk has no express pace bowler who can Bowl good bouncers against Narine it's not looking good for CSK,7
2024-04-08T13:50:00+00:00,"Waiting for Deshpande to become prime McGrath against us and have a below 5 economy and Deepak Chahar to become Anderson under clouds and destroy our top order.


I am trying to jinx hard",6
2024-04-08T13:51:22+00:00,"I don’t see KKR losing this game, KKR is easily the best team in the IPL",7
2024-04-08T13:51:29+00:00,One of rare times when CSK is underdog....,7
2024-04-08T13:51:37+00:00,I'm scared,2
2024-04-08T13:51:48+00:00,Pls God (![img](emote|t5_2qhe0|30516)) cook something 🛐,4
2024-04-08T13:52:13+00:00,I'm expecting Rachin to score a 50 which means he will get out on 5,6
2024-04-08T13:52:26+00:00,"Unpopular opinion 

Narine hasn’t been as abysmal as he is against bouncers this year",2
2024-04-08T13:52:41+00:00,Salt is a bit iffy with the gloves but he has been a great pick up by kkr especially at his price as he's intent is always excellent ,2
2024-04-08T13:52:48+00:00,Inb4 Narina makes fool Outta cement foot Dube....,1
2024-04-08T13:53:08+00:00,CSK deserves to lose for not picking Santner over Theekshana,5
2024-04-08T13:53:14+00:00,Hope kkr have rare choke today !!,0
2024-04-08T13:53:15+00:00,Why I'm smelling 333,2
2024-04-08T13:53:24+00:00,I want another masterclass from Ruturaj Rahul Kohli Gaikwad![img](emote|t5_2qhe0|28120),7
2024-04-08T13:53:36+00:00,I hope that no Csk bowler has 2 braincells to actually bowl a yorker to Narine firsthand,3
2024-04-08T13:53:37+00:00,"Lord in powerplay 

We will either witness greatness or new record for Narine",9
2024-04-08T13:53:55+00:00,"CSK Bowling Powerplay (1-6 Overs) :-

vs RCB(H)  - 42/3 (7.0 rpo, 8x4, 0x6)

vs GT (H) - 43/2 (7.1 rpo, 4x4, 2x6)

vs DC (A) - 62/0 (10.3 rpo, 8x4, 2x6)

vs SRH (A) - 78/1 (13 rpo, 9x4, 5x6) 



how much do we concede tonight?",2
2024-04-08T13:54:00+00:00,Astromical 2.52 NRR 🗿,6
2024-04-08T13:54:14+00:00,No powerplay bowler for csk today !! Depend on lord despande !!,1
2024-04-08T13:54:23+00:00,who were they? asking for >!myself!<,2
2024-04-08T13:54:24+00:00,"Wait, is Chahar injured or is he dropped?",1
2024-04-08T13:54:37+00:00,I think it is either huge win or horrible lose for CSK nothing in between today,2
2024-04-08T13:55:47+00:00,Hope starc don't pay of all his 25cr tonight,2
2024-04-08T13:55:55+00:00,Idk how we scoring mad amount of runs consistently after having Shreyas Iyer at no.4/5,0
2024-04-08T13:56:01+00:00,I hope Varun gets Thala again,3
2024-04-08T13:56:02+00:00,"kkrbluds have 7 proper batterss bruh

  
edit : csk too",2
2024-04-08T13:56:07+00:00,Sakib plays. Lets gooooooo,1
2024-04-08T13:56:26+00:00,The KKR bowling looks weakest than CSK on paper. But this is Varu’s home ground so interesting match,2
2024-04-08T13:56:31+00:00,"Reminder that KKR has the worst win percentage against CSK. Yes, even worse than MI.",5
2024-04-08T13:56:32+00:00,CSK has shit bowling attack. Expecting KKR to score 80+ runs in the PP.,0
2024-04-08T13:56:40+00:00,Istg I’ll kill Rutu personally tonight if Jaddu bats 5 or 6 this match,3
2024-04-08T13:56:43+00:00,Moeen would have better on this pitch than Mitchell,2
2024-04-08T13:57:08+00:00,"wait, Ramandeep is fast bowling all rounder?!?!?",1
2024-04-08T13:57:11+00:00,Wide masters shardulcand despande,1
2024-04-08T13:57:15+00:00,"I swear to GOD of Jadeja comes above Rizz , Ms...",1
2024-04-08T13:57:20+00:00,why didn't Harshit bowl last match?,1
2024-04-08T13:57:20+00:00,Why doesn't csk use Dubey as an all-rounder and Rizvi as an impact player?,1
2024-04-08T13:57:26+00:00,I am convinced that Santner will never get to play a game,6
2024-04-08T13:57:49+00:00,KKR wins this button ——>,1
2024-04-08T13:57:52+00:00,It would be bonkers if Narine could go big against CSK.,1
2024-04-08T13:57:53+00:00,"➰➰➰➰➰➰➰➰➰➰➰➰➰➰➰➰➰➰➰➰➰➰➰➰➰➰➰➰➰➰➰➰➰➰➰➰➰➰➰➰➰➰

The rope Mitchel has been given by CSK.",3
2024-04-08T13:58:00+00:00,"Guys news from the CSK camp.


Thala has been declared interim captain for this match against us. We are gonna lose hard now.",1
2024-04-08T13:58:09+00:00,I was hoping  Santner would good game time with change in captaincy. But unfortunately he is still in bench. This is so sad,1
2024-04-08T13:58:10+00:00,"Having Bumrah is a cheat code.

But if by some miracle, he goes to RCB, he'd become the worst bowler ever.",2
2024-04-08T13:58:12+00:00,Predict the orange cap holder for csk bowlers today !!,1
2024-04-08T13:58:13+00:00,I really don't know why CSK are so obsessed with Theekshana both Santner and Moeen Ali are far better options than him,2
2024-04-08T13:58:25+00:00,Am i the only one who actually likes Theekshana??My man bowled so mant difficult overs last year and has actually improved his fielding..Seems like everyone just would prefer santner,3
2024-04-08T13:58:33+00:00,"Santner needs to go to a team where he'll be a sure starter, which judging by other franchises' squads, is none.",5
2024-04-08T13:58:34+00:00,Shardul will score 50 tonight but let's see whether it will come in bowling or batting,8
2024-04-08T13:58:41+00:00,"Thakur either 

>52/0

Or

>48/3 

Nothing in between...",7
2024-04-08T13:58:47+00:00,"Did Santner kill Dhoni's dog or something? What does he need to do to get a game?


Santner over Theekshana any day for me.


At least Lord gets a game , finally",7
2024-04-08T13:59:00+00:00,![img](emote|t5_2qhe0|21498),1
2024-04-08T13:59:15+00:00,"Jaddu is there, don’t worry csk fans…  /s",1
2024-04-08T13:59:16+00:00,"CSK Winning: CSK only wins at home  
CSK Loosing: CSK not even winning at home now  
![img](emote|t5_2qhe0|21498)",2
2024-04-08T13:59:19+00:00,Like DRS we should have something like addition of 15-20 runs for the team batting first cause you have heavy due in later half,-1
2024-04-08T13:59:22+00:00,100/0 in 6 overs. We will be there.,2
2024-04-08T13:59:28+00:00,lord take revenge from kkr,2
2024-04-08T13:59:35+00:00,Cannot wait for my team to lose again and cry to sleep. Wake up early to study for my exam at 9 AM.,2
2024-04-08T13:59:38+00:00,"Deepak Chahar bowls

His body— l'm about to end this man's whole career",3
2024-04-08T13:59:40+00:00,"Tushar Deshpande vs Sunil Narine 

A battle of legends awaits us",2
2024-04-08T13:59:42+00:00,Csk should use Shardul as an opener![img](emote|t5_2qhe0|28120),2
2024-04-08T13:59:50+00:00,Only thing I wanna see is lord and lord jr bowl in tandem at the death,2
2024-04-08T13:59:55+00:00,"86/2 in PP

254 20/20",2
2024-04-08T14:00:04+00:00,"If thala walks in front of this massive Chepauk crowd, gauti gonna piss his pants",3
2024-04-08T14:00:13+00:00,aakash is unbearable my god,1
2024-04-08T14:00:14+00:00,"Rutu's dismissals this season

Yash Dayal, Spencer Johnson, Khaleel Ahmed, Shahbaz



starc vs rutu already got my bp high",2
2024-04-08T14:00:24+00:00,already 5 mins late bruh,1
2024-04-08T14:00:34+00:00,WTFFFFF,1
2024-04-08T14:00:41+00:00,Hahahaha wtf ..,1
2024-04-08T14:00:41+00:00,Fizz is the one bowler that scares me,3
2024-04-08T14:00:49+00:00,If RR gets the trophy this year then I’ll be equally happy,1
2024-04-08T14:00:53+00:00,Hahahahahaha gone,3
2024-04-08T14:00:53+00:00,Ayo wtf ...,4
2024-04-08T14:00:56+00:00,Lmao,2
2024-04-08T14:00:57+00:00,Lmaoooo.,2
2024-04-08T14:00:57+00:00,Gonee,2
2024-04-08T14:00:59+00:00,Whoa,2
2024-04-08T14:00:59+00:00,demn bad start,2
2024-04-08T14:00:59+00:00,lfgooooooooooooo tdpppppppppppppppp,3
2024-04-08T14:01:01+00:00,YEAH HHHHHHHHHHHHHH,2
2024-04-08T14:01:01+00:00,Lord Deshpande strikes wtf,3
2024-04-08T14:01:01+00:00,Salt goes for a golden duck,3
2024-04-08T14:01:02+00:00,"![img](emote|t5_2qhe0|28120)![img](emote|t5_2qhe0|21496)![img](emote|t5_2qhe0|21944)![img](emote|t5_2qhe0|8767)

Did our homework 🌝",4
2024-04-08T14:01:02+00:00,wtf.,3
2024-04-08T14:01:04+00:00,It should be illegal to have two Lords in a team,6
2024-04-08T14:01:05+00:00,Deshpande for the WT20,5
2024-04-08T14:01:06+00:00,Special golden duck. Lol.,3
2024-04-08T14:01:08+00:00,Wtf,1
2024-04-08T14:01:08+00:00,Lord luck effect,5
2024-04-08T14:01:08+00:00,New Lord,2
2024-04-08T14:01:08+00:00,Oh My Deshpande,3
2024-04-08T14:01:09+00:00,Lord Deshpande strikes wtf,6
2024-04-08T14:01:11+00:00,Lmao,2
2024-04-08T14:01:12+00:00,"Damn We gave a wicket to Deshpande , we're so fucked",7
2024-04-08T14:01:12+00:00,Nah,2
2024-04-08T14:01:13+00:00,jadejaaaaaaaaaaaaaaaaaaaaa!!!!!!,4
2024-04-08T14:01:14+00:00,In n Out lmao,2
2024-04-08T14:01:17+00:00,Shite gets wicket,2
2024-04-08T14:01:18+00:00,Deshpande is the best!!,3
2024-04-08T14:01:19+00:00,He's not gonna drop that,2
2024-04-08T14:01:19+00:00,why do i feel a collapse is coming,2
2024-04-08T14:01:20+00:00,Lmao csk goated stay salty haters,3
2024-04-08T14:01:21+00:00,"Yea ok cool, get Narine",3
2024-04-08T14:01:21+00:00,What...no trial ball?,13
2024-04-08T14:01:24+00:00,Fuck.,2
2024-04-08T14:01:25+00:00,LORD JUNIOR YOU HAVE ROCKED MY WORLD. FIRST BALL WICKET OF THE BEST OPENER FOR ENGLAND,3
2024-04-08T14:01:26+00:00,CSK will mine their own Salt,3
2024-04-08T14:01:27+00:00,New Lord,1
2024-04-08T14:01:28+00:00,NOOOOOOOOOOOOOOOOOOO,2
2024-04-08T14:01:29+00:00,Glenn McGrath had posters of Tushar Deshpande in his room while growing up.,3
2024-04-08T14:01:31+00:00,"Looks like Tushar is *not* in form. Good for you, CSK!",3
2024-04-08T14:01:34+00:00,Mukesh Starc vs Mitchell Starc,4
2024-04-08T14:01:35+00:00,"7 seconds on the crease, Thala for a reason.",8
2024-04-08T14:01:36+00:00,Yeah I think this is going to be one of those days we see the old KKR,7
2024-04-08T14:01:38+00:00,CSK gonna turn Tushar into Bumrah now????!! That too against us...... :( WTH,6
2024-04-08T14:01:39+00:00,"It's okay lads, such a nice dream we had...  2023 in the making",4
2024-04-08T14:01:41+00:00,Definitely intentional. Planned it all 🌝,1
2024-04-08T14:01:41+00:00,Raghuvanshi show today. You heard it here,1
2024-04-08T14:01:46+00:00,Nooooooo![img](emote|t5_2qhe0|29262),2
2024-04-08T14:01:46+00:00,Blud thought he’ll get dropped every time on the  1st ball,7
2024-04-08T14:01:47+00:00,Definitely intentional. Planned it all 🌝,5
2024-04-08T14:01:55+00:00,Hmmmmmmmmmmmmmmm,1
2024-04-08T14:01:57+00:00,Most stupid shot,2
2024-04-08T14:02:00+00:00,"Lord and savior


But its not Shardul.",2
2024-04-08T14:02:00+00:00,Trial ball,2
2024-04-08T14:02:01+00:00,Yeah that nrr needs to go down![gif](emote|free_emotes_pack|trollface),3
2024-04-08T14:02:01+00:00,Damn CSKbros jinxing game is too strong. They literally got jinx jinx in their team after all.,3
2024-04-08T14:02:02+00:00,Why always the CSK matches,1
2024-04-08T14:02:02+00:00,Its so over rn 😔,1
2024-04-08T14:02:03+00:00,"""Safe as houses"" instantly reminded me of Rohan Gavaskar",1
2024-04-08T14:02:03+00:00,HMMMMMMMMMM,1
2024-04-08T14:02:03+00:00,Jasprit Desh Pande strikes again,3
2024-04-08T14:02:03+00:00,I still don't understand how this mini Lord gets his wickets :/,2
2024-04-08T14:02:09+00:00,Deshpande. I owe you an apology. I wasn't familiar with your game. New PowerPlay bowler unlocked. Time to bring in Hangargekar for middle overs.,1
2024-04-08T14:02:10+00:00,Lol,1
2024-04-08T14:02:10+00:00,If deshpande doing this we are winning this.,1
2024-04-08T14:02:12+00:00,Reality check day for KKR?,1
2024-04-08T14:02:12+00:00,hmmmmmmmmm,1
2024-04-08T14:02:12+00:00,Yeah csk is gonna win this,1
2024-04-08T14:02:13+00:00,Dhoni is the interim captain for this match. No other explanation,1
