Timestamp,Comment,Upvotes
2024-04-08T15:29:22+00:00,"Gaikwad is either out first over to Starc or he carries his bat, no middle ground",6
2024-04-08T15:29:24+00:00,Odds on shreyas iyer 50?,1
2024-04-08T15:29:24+00:00,What are you doing my Bangbro?,7
2024-04-08T15:29:28+00:00,What's the slowest ball a fast bowler has bowled? Curious if someone notes that?,1
2024-04-08T15:29:30+00:00,Excellent recovery,5
2024-04-08T15:29:33+00:00,That's how you bowl to Russell,5
2024-04-08T15:29:35+00:00,We're gonna see csk chasing this off in 15 overs,3
2024-04-08T15:29:35+00:00,"Another day another ""russel muscle"" PLEASE find something new commentators",5
2024-04-08T15:29:38+00:00,Bruh Russel that ball is coming to you change your stance mate,2
2024-04-08T15:29:41+00:00,Oh shit . That brings in Russel . That’s not good,1
2024-04-08T15:29:41+00:00,"Okay now is everyone gonna be up Shreyas' ass like you were up Kohli's and KLs?


It's clearly hard to bat out there yet all I see is ""hit out or get out""",2
2024-04-08T15:29:45+00:00,From now on in Gully cricket i will always blame my low scores on bad pitch,1
2024-04-08T15:29:45+00:00,"Shreyas should take one for the team, and let Dre Russ face the max no.of balls possible.",1
2024-04-08T15:29:47+00:00,Holy fuck. Fizz is the true goat to give a dot ball on a free hit to Dre Russ,7
2024-04-08T15:29:47+00:00,"only if KKR had at least 170 to defend, they could have at least given a fight...",1
2024-04-08T15:29:49+00:00,"What this stock investing gyaan by Harsha?

Gyaan : Knowledge",2
2024-04-08T15:29:50+00:00,Next over is going to be a massacre,1
2024-04-08T15:29:50+00:00,"Never thought I'd see Rinku play 9(14). 

If Kohli/Hardik/KL did it, fans would have started asking for their heads without waiting for the other team to bat.

Edit: I'm not criticising Rinku in any way",3
2024-04-08T15:29:52+00:00,Oops,1
2024-04-08T15:29:52+00:00,whats up with Batters struggling to score on free hits nowadays?? everyone seems to be struggling to hit in free hit deliveries.,2
2024-04-08T15:29:53+00:00,This year not seeing anyone able to utilize free hit. ,3
2024-04-08T15:29:55+00:00,Slow ball masterclass. This could very well be how few of the WT20 matches could turn out.,3
2024-04-08T15:29:59+00:00,DHONI FUCK YOU,-5
2024-04-08T15:29:59+00:00,Can anyone that plays cricket explain what’s actually happening here? Looks like low bounce and pitch being slow in general?,2
2024-04-08T15:30:00+00:00,Here before BCB pulls the jenga block out of CSK eleven and mukesh choudhary gets orange cap,2
2024-04-08T15:30:00+00:00,Thala 🫠,3
2024-04-08T15:30:04+00:00,That Dre Rus v Yorker compilation is wild,3
2024-04-08T15:30:04+00:00,Don't think Chennai's batsmen will find the goings easier here either. KKR has a pretty decent attack for this pitch. Unless of course Starc leaks runs.,2
2024-04-08T15:30:05+00:00,You know the pitch is terrible when someone like Russell is struggling to connect,7
2024-04-08T15:30:05+00:00,Harsha should retire from commentary and only host talk shows,10
2024-04-08T15:30:06+00:00,This is equally exciting as a 200 run game for me personally,12
2024-04-08T15:30:08+00:00,Well this is how you know Dhoni's getting old,18
2024-04-08T15:30:08+00:00,Oh no thala,10
2024-04-08T15:30:10+00:00,If there was Kohli instead of shreyas in KKR he would be getting blamed for putting pressure on Rinku and rusell instead of admitting that other can be shit on their own,4
2024-04-08T15:30:11+00:00,Dhoni missed a catch. Quick bring out the men in black glasses,1
2024-04-08T15:30:12+00:00,Thala wtf,13
2024-04-08T15:30:14+00:00,Am i tripping or did Harsha just call Dre russ Samuel badree?,10
2024-04-08T15:30:15+00:00,Oh no,3
2024-04-08T15:30:16+00:00,Man I lose so many brain cells whenever I listen the hindi commentators commenting,2
2024-04-08T15:30:16+00:00,Thala washed >!his hands!<,1
2024-04-08T15:30:18+00:00,This is where the IPL final will be played lol,1
2024-04-08T15:30:18+00:00,Thala not thalaing,2
2024-04-08T15:30:18+00:00,Dhoni dropped it again,2
2024-04-08T15:30:19+00:00,Ayo thalaaaa,1
2024-04-08T15:30:19+00:00,Tactical drop,3
2024-04-08T15:30:19+00:00,"Ay ay ay Dhoni dropping catches, CSK's doomed",2
2024-04-08T15:30:19+00:00,That's Dhoni's body saying it's time.,2
2024-04-08T15:30:20+00:00,Now the trolling will start,2
2024-04-08T15:30:20+00:00,One guy said thala will drop a catch today lmao,11
2024-04-08T15:30:20+00:00,Star sports ain't showing a single replay of this 💀💀,7
2024-04-08T15:30:20+00:00,no thalaaaaaaa ![img](emote|t5_2qhe0|29262),3
2024-04-08T15:30:21+00:00,Tactical Thala,6
2024-04-08T15:30:21+00:00,CLASSIC THALA,5
2024-04-08T15:30:21+00:00,Thala not a reason,10
2024-04-08T15:30:21+00:00,That was easy asf Thala.  Time to hang the boots.,-1
2024-04-08T15:30:21+00:00,"We played like this against dc last year, it was most brain-dead match for me. This has just beat that one",4
2024-04-08T15:30:22+00:00,Thala for a reason,4
2024-04-08T15:30:23+00:00,"Did Harsha just call Russel ""Samuel Badree""? Or are my ears bad?",7
2024-04-08T15:30:23+00:00,"Dhoni would've c- 

Nevermind",25
2024-04-08T15:30:23+00:00,Bruh just move toward offside a little,5
2024-04-08T15:30:23+00:00,Brilliant keeping from the 42 year old legend!!!!!!,7
2024-04-08T15:30:26+00:00,Dhoni : Mid Life Crisis 😂,5
2024-04-08T15:30:26+00:00,lol no full stretch animation now eh jio cinema,4
2024-04-08T15:30:27+00:00,Father time…,2
2024-04-08T15:30:27+00:00,Thala himself saved internet today,7
2024-04-08T15:30:28+00:00,Thala even diving is a rare sight,5
2024-04-08T15:30:28+00:00,Thala for not a reason,4
2024-04-08T15:30:28+00:00,"Thank you Thala, Love you",3
2024-04-08T15:30:28+00:00,Thala for a reason,4
2024-04-08T15:30:28+00:00,Yeah it's Thala's last season,11
2024-04-08T15:30:29+00:00,Okay the pitch is shit. At least this innings.,4
2024-04-08T15:30:30+00:00,still entire india will find a way to blow off dhoni for this dropcatch,19
2024-04-08T15:30:32+00:00,Dhoni fell off hard,6
2024-04-08T15:30:32+00:00,We saw nothing guys,24
2024-04-08T15:30:32+00:00,Criminal from Thala,10
2024-04-08T15:30:34+00:00,Thala for a reason.,3
2024-04-08T15:30:35+00:00,Tf is this keeper?!? Bench him!,9
2024-04-08T15:30:36+00:00,Now suck thala's dick.,5
2024-04-08T15:30:36+00:00,"Thala missed a catch, it was the ball's mistake.",14
2024-04-08T15:30:37+00:00,![img](emote|t5_2qhe0|29262)![img](emote|t5_2qhe0|29262)![img](emote|t5_2qhe0|29262)![img](emote|t5_2qhe0|29262)![img](emote|t5_2qhe0|29262)![img](emote|t5_2qhe0|29262)![img](emote|t5_2qhe0|29262),6
2024-04-08T15:30:37+00:00,Keeping at 42 🥵🥵,3
2024-04-08T15:30:38+00:00,Rare thala drop,6
2024-04-08T15:30:38+00:00,42 yrs old Thala drops an important catch 🥹,7
2024-04-08T15:30:39+00:00,"It's over, it's over guys

MS dropped a sitter for his standards

It's over",10
2024-04-08T15:30:39+00:00,Washed,6
2024-04-08T15:30:40+00:00,No matter how bad pitch is batting shit in death is a crime,6
2024-04-08T15:30:40+00:00,"I remember KKR failed to score 31 of 5 overs against MI in 2021 with DK and Russell present till the last over. 

Similar vibes today",6
2024-04-08T15:30:40+00:00,Thela for a reason,3
2024-04-08T15:30:41+00:00,Thala what a drop🤤,5
2024-04-08T15:30:45+00:00,"lucky Dhoni dropped that catch, I didn't want to be **SHELL SHOCKED** again",4
2024-04-08T15:30:45+00:00,Pitch has fooled MSD too with its slowness,3
2024-04-08T15:30:46+00:00,Thala a sadist won't let russell out of misery.,6
2024-04-08T15:30:47+00:00,Old man is really getting old,2
2024-04-08T15:30:47+00:00,Lmao,1
2024-04-08T15:30:47+00:00,"Well Thala is a human after all, an ageing one at that",5
2024-04-08T15:30:49+00:00,Commentators as usual sucking up as if dhoni has never dropped a catch before..,7
2024-04-08T15:30:50+00:00,Thala taking it too easy,2
2024-04-08T15:30:51+00:00,Stretch distance was about to have a field day.,4
2024-04-08T15:30:51+00:00,Why can't Russel even connect?,1
2024-04-08T15:30:51+00:00,Ek tha jo wicket ke picche se,2
2024-04-08T15:30:53+00:00,"Someone had commented I can see msd dropping a catch today.

Kudos to the guy",10
2024-04-08T15:30:53+00:00,Good thala dropped this and saved the us from commentary orgasm for next 10 days,1
2024-04-08T15:30:54+00:00,Drop this youngster why is he in the team ffs,4
2024-04-08T15:30:54+00:00,Thala can't catch even with keeping gloves too,1
2024-04-08T15:30:56+00:00,Tactical drop??? /s,3
2024-04-08T15:30:57+00:00,That ball was more spin,3
2024-04-08T15:30:57+00:00,Thala dropped the catch because the score is too low and he wants to come out and bat. What a legend,9
2024-04-08T15:30:58+00:00,Lol 🧓🏻,5
2024-04-08T15:30:58+00:00,what is going onnnn,1
2024-04-08T15:30:59+00:00,"sharp sophisticated different clumsy hurry pie unite quaint lush numerous

 *This post was mass deleted and anonymized with [Redact](https://redact.dev)*",6
2024-04-08T15:31:00+00:00,That was not catchable. Thala did good to get a hand on it,-5
2024-04-08T15:31:01+00:00,Commentators and channel missed the chance to show replays for a million times telling how great a catch that was,6
2024-04-08T15:31:02+00:00,russell fked up,1
2024-04-08T15:31:02+00:00,dayum first time ive seen him miss in ages,3
2024-04-08T15:31:03+00:00,No wingspan graphic today :((,2
2024-04-08T15:31:03+00:00,Don't think we'll be seeing a replay of that too often,7
2024-04-08T15:31:03+00:00,Thala: I will not dive 🗣️,1
2024-04-08T15:31:03+00:00,Wht the fck is he even doin????????,1
2024-04-08T15:31:05+00:00,Is this how you disable russell?????,1
2024-04-08T15:31:05+00:00,dhoni bruh,1
2024-04-08T15:31:05+00:00,Fizz's still got it.,5
2024-04-08T15:31:05+00:00,Pat Cummins could produce more silence,2
2024-04-08T15:31:06+00:00,Mustafizur literally bowls the same ball every time and Russell is still struggling lmao,7
2024-04-08T15:31:06+00:00,Thala-ctical drop?,6
2024-04-08T15:31:07+00:00,Even Thella is tired of his d-sucking,10
2024-04-08T15:31:07+00:00,Drop for a reason,3
2024-04-08T15:31:08+00:00,Bro whatever is this fast bowling off spin,2
2024-04-08T15:31:08+00:00,mfer dropped a dolly,9
2024-04-08T15:31:09+00:00,The ball is fizzing out,3
2024-04-08T15:31:09+00:00,This is some fantastic bowling by Fizz,2
2024-04-08T15:31:11+00:00,KKR is a flat track bully it seems like.,3
2024-04-08T15:31:12+00:00,Why tf is he not reviewing for wides,5
2024-04-08T15:31:13+00:00,Thala for a reason,3
2024-04-08T15:31:13+00:00,"Called it mfers. Thala can kiss my D 
https://www.reddit.com/r/Cricket/s/N3Nndy5Y72",-2
2024-04-08T15:31:14+00:00,Title of the Highlights should be - KKR batting struggles. /s,3
2024-04-08T15:31:14+00:00,Having Dhoni keeping in 2024 should be considered elder abuse,14
2024-04-08T15:31:16+00:00,Nehraji: BKC.....,3
2024-04-08T15:31:20+00:00,Dropped on purpose so Russell can eat more dot balls. TFAR,3
2024-04-08T15:31:21+00:00,Wtf are those gloves,3
2024-04-08T15:31:21+00:00,Wides,2
2024-04-08T15:31:21+00:00,"Slower balls sucks ASS when it's against you

Atrocious to watch",8
2024-04-08T15:31:22+00:00,You don't drop Russell ,1
2024-04-08T15:31:23+00:00,Who tf made that pitch,4
2024-04-08T15:31:23+00:00,Lmao Fizz is toying with Russell here,6
2024-04-08T15:31:24+00:00,"116, 119, 136, 116, 117, 116

guess which one was hit for a boundary",6
2024-04-08T15:31:25+00:00,Russel plz so something,0
2024-04-08T15:31:26+00:00,Every KKR batsman is struggling on this pitch,2
2024-04-08T15:31:26+00:00,Thala memes will bombard r/cricketshitpost,2
2024-04-08T15:31:27+00:00,that's a tough catch to take bruh,1
2024-04-08T15:31:29+00:00,Thala saved 4 to be honest. Well done.👏,1
2024-04-08T15:31:29+00:00,Shift  ipl final from Chennai. People will be bored if finals happen here,3
2024-04-08T15:31:29+00:00,great stop,1
2024-04-08T15:31:31+00:00,That is dhoni but that is 42 years old dhoni who somehow is still selected,0
2024-04-08T15:31:31+00:00,Russell clueless against Fizz bowling this line and pace,4
2024-04-08T15:31:32+00:00,"""SOUND effects couldn't have produced more silence"" can we PLEASE get better commentators",2
2024-04-08T15:31:32+00:00,i need graphics now how many metres he failed to cover.,1
2024-04-08T15:31:33+00:00,"Strategic drop, Russell choking",3
2024-04-08T15:31:34+00:00,Moments like this make me realize my king is actually getting old and its makes me really sad 🥲,1
2024-04-08T15:31:36+00:00,"That wasn't a drop, it was a tactic...you will see",3
2024-04-08T15:31:36+00:00,"ek catch nhi pakad skte tumhari \*\*\*\*

- Nehra",6
2024-04-08T15:31:38+00:00,Why was the catch dropped when Russell was on 5(7). Five off SEVEN.,3
2024-04-08T15:31:39+00:00,NOOOO I wanted to see the strech meter 😔,2
2024-04-08T15:31:39+00:00,Bruh full on negative bowling,1
2024-04-08T15:31:40+00:00,Fizz is cooking today damn.. what a buy,6
2024-04-08T15:31:40+00:00,Not them zooming on his gloves 💀💀💀,3
2024-04-08T15:31:40+00:00,"""He shows his mortality after all..."" On comms. 💀",5
2024-04-08T15:31:40+00:00,Bro that’s not a wide,1
2024-04-08T15:31:41+00:00,Thala wore black gloves and I wore my wife's black panties. Is that a coincidence? Absolutely not!,4
2024-04-08T15:31:41+00:00,"Lol
Bhogle saying, ""dont trust the stock market, but look at PnL & results"" when drawing out a comparison between the Fizz and Starc.",3
2024-04-08T15:31:42+00:00,Death bowling masterclass from Mustafizur. Could've been 4 run over with Russell facing the entire over,5
2024-04-08T15:31:43+00:00,Tactical drop,2
2024-04-08T15:31:45+00:00,what a miserable batting performance,3
2024-04-08T15:31:45+00:00,Look at Thala's attempt! 10/10 for that attempt 💦,8
2024-04-08T15:31:46+00:00,">Tactical drop???

If dropping russell is tactical, they deserve to lose",5
2024-04-08T15:31:46+00:00,It's a proper 110kmph over from Fizz. Perfect for this pitch,7
2024-04-08T15:31:47+00:00,Bruh pitch that bad or shit batting? Cuz im scared for our batters now,3
2024-04-08T15:31:48+00:00,This game will end kkr dominance....other team will figure out how to counter their lineup,-1
2024-04-08T15:31:49+00:00,Ahh I see Mustafizur hasn't left bowling those off cutters since 2016,3
2024-04-08T15:31:51+00:00,"Russell has got the one shot, the wild slog sweep, and with all his experience can't adjust to the wide slanting line.",3
2024-04-08T15:31:55+00:00,"CSK have four spinners today

Theekshana, Jadeja, Ravindra & Fizz",4
2024-04-08T15:31:56+00:00,Great op to send Dhoni as opener,2
2024-04-08T15:31:58+00:00,Someone has to tell that commentator that slow pitches doesn't behave erratic but altering your pace and length can create timing issues..,5
2024-04-08T15:31:59+00:00,"The ball just bounced off the glove, guess he wasn't expecting the slower pace",3
2024-04-08T15:31:59+00:00,That glove looks like something JACK THE RIPPER would have.,3
2024-04-08T15:32:00+00:00,CSK bowlers learnt from DC bowlers.. nice line outside off.,2
2024-04-08T15:32:01+00:00,Fizz should go for a toe crushing yorker,5
2024-04-08T15:32:01+00:00,Exceptional from fizz,8
2024-04-08T15:32:02+00:00,This Umpire missed like 3 wides this over 🤡,-13
2024-04-08T15:32:03+00:00,Was that a tactical drop? are they not prepared for Prime Starc the batsman?,15
2024-04-08T15:32:07+00:00,"News headlines tomorrow

""THALA STUNNING DIVE TO ATTEMPT IMPOSSIBLE CATCH HOW 42 YEAR OLD STULL DOING IT""",52
2024-04-08T15:32:08+00:00,If Thala caught that we would have had non stop replays till the end of time,28
2024-04-08T15:32:08+00:00,Was he chucking?,5
2024-04-08T15:32:12+00:00,Criticise ms just like other keepers you idiot commentators...,28
2024-04-08T15:32:13+00:00,"Holy shit the level of glazing from the commentators after someone has dropped a catch, I have never seen such levels. Thala for a reason",31
2024-04-08T15:32:14+00:00,Wait Shreyas is still playing?! I forgot,35
2024-04-08T15:32:17+00:00,Strategic drop by msd as strike rate of Russell is less than 100. TFAR,10
2024-04-08T15:32:20+00:00,This is what quality bowling looks like. ,5
2024-04-08T15:32:32+00:00,Rarest Thala L,3
2024-04-08T15:32:33+00:00,Lmao Thalasexuals down voting any and all comments calling their god out for that dolly drop.,7
2024-04-08T15:32:33+00:00,Absolutely embarrassing and disgraceful pitch,4
2024-04-08T15:32:34+00:00,Mustafizur is a fast spinner,9
2024-04-08T15:32:36+00:00,Why were we scared of rusell? We should be scared about our batting now.,8
2024-04-08T15:32:37+00:00,It's raining slow balls,1
2024-04-08T15:32:39+00:00,Fizz is medium pace Murali,8
2024-04-08T15:32:40+00:00,Fizz is chucking with the slower one,1
2024-04-08T15:32:41+00:00,"Pardon my French but 'Mustafizur ne Russell ko uski aukaat dikhadi'

Tr: Mustafizur bowled well",12
2024-04-08T15:32:42+00:00,"What BS, he slightly moved to off, that should not have been a wide.",3
2024-04-08T15:32:43+00:00,Shreyas last batted on 16.1 ...,2
2024-04-08T15:32:44+00:00,"Thala dropped a catch.

Thalasexuals creamed their pants.",6
2024-04-08T15:32:44+00:00,Excellent over until now by Fizz tbf,6
2024-04-08T15:32:47+00:00,Thalatards would've creamed themselves if that was caught,6
2024-04-08T15:32:49+00:00,"DRS for wides...

What happened to the game I love",2
2024-04-08T15:32:49+00:00,"KKR scored at 4.8 RPO in the middle overs. We prayed for such times, CSK fam",4
2024-04-08T15:32:49+00:00,"That catch drop just shows how many Indians just hate the guy who has done so much for Indian cricket. He is not even playing for India anymore and still gets hated. What are these ""Thala can kiss my D"" comments?",10
2024-04-08T15:32:52+00:00,150 looking hard. And CSK gonna chase this without a sweat. Typical KKR CSK matcg,7
2024-04-08T15:32:52+00:00,CSK dished out this pitch so Fizz doesn't feel homesick.,36
2024-04-08T15:32:53+00:00,Fizz has frustrated Russell. He will take out his frustrations in next over on Lord Deshpande or Lord Thakur.,49
2024-04-08T15:32:55+00:00,How did Russ manage to run two,13
2024-04-08T15:32:56+00:00,Fuck the pitch ain't even the usual spinny this some ekana level shit.,9
2024-04-08T15:33:00+00:00,Sluggiest pitch of this IPL.,9
2024-04-08T15:33:03+00:00,"I mean it's Chennai playing afterall, how can umpire be honest. /S",-2
2024-04-08T15:33:05+00:00,"Now I understand why Fizz is dangerous in such surfaces


His release is exactly like a spinner, lol",29
2024-04-08T15:33:08+00:00,Dear sub-mates.. You are witnessing some masterclass bowling here from Mustafizur... 🙌,7
2024-04-08T15:33:09+00:00,Iyer idli 100 SR 🚨🚨🚨🚨,11
2024-04-08T15:33:10+00:00,Iyer bhai maintaining 100 SR,8
2024-04-08T15:33:11+00:00,[deleted],1
2024-04-08T15:33:12+00:00,Is the pitch really that bad or it is just shit batting,3
2024-04-08T15:33:16+00:00,150-160 would be nice score,2
2024-04-08T15:33:16+00:00,damn that throw from the boundary line was on point,4
2024-04-08T15:33:20+00:00,Iyer at a strike rate of 100. It's curtains for CSK now.,4
2024-04-08T15:33:20+00:00,"When Shreyas Iyer is given out by the umpire, the bowling team reviews",15
2024-04-08T15:33:22+00:00,Chutiya Shreyas this ain’t Test match.,6
2024-04-08T15:33:23+00:00,sucks to be Shreyas today,3
2024-04-08T15:33:23+00:00,Bruh that speed at which Russell zoomed past Pathirana 🔥,5
2024-04-08T15:33:26+00:00,Shreyas finally got to 100 strike rate.,4
2024-04-08T15:33:30+00:00,Both Iyers are the weakest links in this batting line-up,2
2024-04-08T15:33:30+00:00,Is this your vintage infamous spinchoke-enabling Chepauk wicket?,1
2024-04-08T15:33:31+00:00,19th over will decide the match. Imo Russ will go big here.,4
2024-04-08T15:33:31+00:00,What a dead ass slow pitch,0
2024-04-08T15:33:32+00:00,Quality bowling from Fizz. Could never see Lord or Deshpande ever bowl like this,4
2024-04-08T15:33:34+00:00,Seems like we're gonna get the first low scoring thriller of the season,3
2024-04-08T15:33:38+00:00,Is this the pitch or the batters or the bowlers,2
2024-04-08T15:33:38+00:00,"sakshi is really jealous of raina , even she cant suck him off that much",-1
2024-04-08T15:33:42+00:00,Strategic drop to prevent Manish Pandey's 50(12),7
2024-04-08T15:33:43+00:00,Bro's been at it for 30 years still can't get it right.,1
2024-04-08T15:33:45+00:00,Completely forgot Iyer was in the middle,2
2024-04-08T15:33:45+00:00,Iyer bhai straight to jail today,1
2024-04-08T15:33:49+00:00,Dhoni keeping been always average against pace,1
2024-04-08T15:33:50+00:00,So did BCCI ask the Chennai curator to prepare this pitch? Or did CSK ask him? Asking on behalf of the Eden curator,0
2024-04-08T15:33:50+00:00,Csk 49 all out,1
2024-04-08T15:33:51+00:00,This brother Dhoni keeps on dropping Fizz's chances man 😭 poor guys can't even statpad in peace,3
2024-04-08T15:33:51+00:00,Varun and Narine's 8 overs will be handy on this pitch. And aren't they using Suyash anymore?,4
2024-04-08T15:33:52+00:00,Haha baba Sehgal 😂😂😂,3
2024-04-08T15:33:52+00:00,Thank God we couldn't buy Alzzari in the auction and got Fizz instead,10
2024-04-08T15:33:52+00:00,Russell gonna bowl some brilliant slow balls or some high class dollies today,6
2024-04-08T15:33:52+00:00,"Wow shreyas controlled hit

great control man u still have 32 overs to go",13
2024-04-08T15:33:53+00:00,People think Fizz is chucking? Doesn't he have a natural weird bend in his arm that allows him to bowl those deliveries?,1
2024-04-08T15:33:57+00:00,Mustafizur really is a fast spinner. Bros turning the ball at 110 kmph,9
2024-04-08T15:33:57+00:00,Holy sbit Fizz is the best buy for us this season,9
2024-04-08T15:34:00+00:00,Tactical drop by Thala #talklikecskfan,3
2024-04-08T15:34:01+00:00,Wth is that pitch no one can time ball... I don't mind slow low scoring games but atleast the pitch should be good ... This is some crap pitch,1
2024-04-08T15:34:01+00:00,Shreyas is trying to hit but just isn't able to pull it off. We might see a scoop from him.,3
2024-04-08T15:34:03+00:00,I think if we somehow scrape to 150 we can make a match of it. Unless dew comes in which case nothing is safe,5
2024-04-08T15:34:04+00:00,So is the pitch minefield?,3
2024-04-08T15:34:04+00:00,Please 150 at least bruh. Not judging the pitch like I did yesterday. But at least 150,4
2024-04-08T15:34:04+00:00,Deshpande!?!? Don’t we have anyone else! Should be Thakur atleast,4
2024-04-08T15:34:07+00:00,Starc do something we need a magical fifer here.,3
2024-04-08T15:34:07+00:00,"Russell rinku struggling 

Chad iyer always playing with 100 st no matter the pitch",16
2024-04-08T15:34:09+00:00,Don't know if the bounce on this pitch is lower than we expect or it seems like that because of bowling slow balls non-stop.,3
2024-04-08T15:34:10+00:00,The tdp we know is back?,2
2024-04-08T15:34:12+00:00,Fizz be like am I still at Mirpur for Visa purposes....,9
2024-04-08T15:34:13+00:00,Shreyas’ innings is actually solid,7
2024-04-08T15:34:13+00:00,Who would have thought that KKR best batsmen will be narine,7
2024-04-08T15:34:14+00:00,"Thala drops a catch

Over ends and ad plays ""Thala nahi chhodte aise catches""

T: thala doesn't drop catches like that",9
2024-04-08T15:34:17+00:00,Decent over from fizz,8
2024-04-08T15:34:19+00:00,Oh thala what is happening to you,3
2024-04-08T15:34:20+00:00,Yuzi Bhai started umpiring,1
2024-04-08T15:34:20+00:00,"32 frm this over plzzzz, yeah I’m spoiled by flat pitches",6
2024-04-08T15:34:22+00:00,DROPPED = 7 letters. The msg is clear.,13
2024-04-08T15:34:22+00:00,Thala's not catching anything,5
2024-04-08T15:34:25+00:00,Prediction : today Dhoni will be higher up than usual since its a low score,6
2024-04-08T15:34:28+00:00,Not Deshpande against Russell😭,3
2024-04-08T15:34:29+00:00,"Against rcb, Chennai had a batting pitch. Today against kkr, they got scared and prepared the slowest pitch possible. Lol",0
2024-04-08T15:34:30+00:00,Watch them blame it all the dew when they lose in yhe 15th over and not their absolute tripe shit taking batting,0
2024-04-08T15:34:31+00:00,Now watch deshpande bowl every ball at 140kph,5
2024-04-08T15:34:32+00:00,This is the over Russell was waiting for.,3
2024-04-08T15:34:32+00:00,Wide immediately after ad is so frustrating.,7
2024-04-08T15:34:33+00:00,Thala is out of it. Must be past his bed time,8
2024-04-08T15:34:35+00:00,You know the pitch is terrible when even thala can't get hold of the ball ![img](emote|t5_2qhe0|8767),1
2024-04-08T15:34:35+00:00,MS is sloppy today,3
2024-04-08T15:34:36+00:00,"Lmao, Hindi commentators want KKR to score 25 runs per over on this pitch to save the match.",2
2024-04-08T15:34:37+00:00,"With 2 knock outs in Chennai, CSK will have a good chance if they qualify. Fizz is a beast here, what a pick",4
2024-04-08T15:34:37+00:00,"Shreyas with a 100 strike rate is still higher than Rinku, Andre and Venkatesh!",2
2024-04-08T15:34:38+00:00,See a 30 runs over now,1
2024-04-08T15:34:39+00:00,what kind of gloves thala using today?,1
2024-04-08T15:34:40+00:00,"Nehra ji - length ball

Bravo - wide yorker.",1
2024-04-08T15:34:41+00:00,The only reason csk and perth schocheds succeed is due to the advantage of home ground.,1
2024-04-08T15:34:41+00:00,Tushar is about to get fucked,1
2024-04-08T15:34:42+00:00,17 more to get to be 20 under par.,1
2024-04-08T15:34:43+00:00,Yorkers please,3
2024-04-08T15:34:44+00:00,Lord shardul trying his best to make a game out of this,2
2024-04-08T15:34:45+00:00,Tushar gonna turn into McGrath or harshal in death there is no in between,4
2024-04-08T15:34:45+00:00,This ball feels like the turning point of the match .,2
2024-04-08T15:34:45+00:00,did that off cutter fucking leg cut,3
2024-04-08T15:34:45+00:00,So Reddit reactionaries have started shitting on Russell too?,3
2024-04-08T15:34:45+00:00,Tushagrath should start spamming back of the hand slower balls and off cutters.,2
2024-04-08T15:34:46+00:00,Iyer auditioning for CWC2027,1
2024-04-08T15:34:48+00:00,"Shreyas's score 29 2-9= -7  


AntiThala for a reason",7
2024-04-08T15:34:48+00:00,Oh no oh no oh no oh no,1
2024-04-08T15:34:49+00:00,"T: (IPL ad)

10 RUPAYE KA MAKKHAN",2
