Timestamp,Comment,Upvotes
2024-04-08T16:14:36+00:00,"I hope such pitches bite CSK in the ass, like the pitch in Ahmedabad bit ICT in the ass. Such pitches shouldn't be rewarded.",-12
2024-04-08T16:14:38+00:00,Rachin is cooking!,5
2024-04-08T16:14:43+00:00,Starc has been such a liability,2
2024-04-08T16:14:48+00:00,KKR making the same mistake that RCB made vs them in Chinnaswamy. Pace on is not the correct option,5
2024-04-08T16:14:50+00:00,Starc is still an RCBian by heart,8
2024-04-08T16:14:51+00:00,Pitch changed smh,6
2024-04-08T16:14:51+00:00,A boy from NZ owns a man from Australia.,14
2024-04-08T16:14:53+00:00,All that good work is gone,3
2024-04-08T16:14:55+00:00,25 crores let's go!,0
2024-04-08T16:14:57+00:00,i thought itd be a catch my heart skipped a beat smh,1
2024-04-08T16:14:58+00:00,Thank God for Rachin!,1
2024-04-08T16:15:00+00:00,Anyone find Harsha's commentary boring nowadays? Dude's way past his prime,1
2024-04-08T16:15:03+00:00,"Man Harsha is good 

But so annoying when is biased like hell and down on his knees sucking",1
2024-04-08T16:15:06+00:00,"LSG calling their captain a “defense minister” for defending 160 isn’t self-deprecating.   

Using big words just for the sake of using them..",2
2024-04-08T16:15:06+00:00,KKR following RCB's strategy and bowling fast on a slow pitch,1
2024-04-08T16:15:06+00:00,"le moot dia tere 24cr pe

T - Jus pissed at 240 million $",3
2024-04-08T16:15:07+00:00,WHAT PITCH NOW BOI!!,6
2024-04-08T16:15:15+00:00,Spin choke will start next over,0
2024-04-08T16:15:17+00:00,"I can't understand whether the pitch is slow or decent? Over the yrs, i have heard that this pitch is slow and then i have been seeing high scores here, heck even my shitty team rcb somehow scored 180, and now kkr couldn't score 150?",1
2024-04-08T16:15:20+00:00,Ofc Starc will go full pace on this pitch lmao,5
2024-04-08T16:15:20+00:00,The commentator bias is painful. Now I understand how other countries feel when India plays.,3
2024-04-08T16:15:21+00:00,"In Chepauk = Rachin

outside Chepauk = Ravindra",12
2024-04-08T16:15:27+00:00,Chepauk bully,1
2024-04-08T16:15:29+00:00,IPL Starc is Dinda academy product,2
2024-04-08T16:15:39+00:00,SRH flairs fuming seeing this pitch.,7
2024-04-08T16:15:40+00:00,Starc getting hit here only to arouse overconfidence in Indian players so that he can easily rawdog us during WC. Legendary game!,8
2024-04-08T16:15:40+00:00,I have a feeling all the other team owners pooled in money to pay Starc so that he can help their batsmen find form and score big runs.,9
2024-04-08T16:15:45+00:00,"Starc gonna get bashed in the IPL only to lead Australia to another WC    

You already know that’s the script",15
2024-04-08T16:15:47+00:00,"Starc after finally bowling one decent over: ""That's all I've got, sorry.""

KKR management: ""Go bowl mate. You can afford a few surgeries.""",11
2024-04-08T16:15:54+00:00,Another year another Aussie pacer from KKR getting cunted,3
2024-04-08T16:15:58+00:00,4D chess move by CSK to counter an Aus bro with an NZ bro. Tasman Sea cuts Tasman Sea bro!,3
2024-04-08T16:15:58+00:00,"Get Russel and Narine, try to get early wickets, don’t let them settle",2
2024-04-08T16:15:59+00:00,Ru'tuktuk'raj gaikwad ladies and gentlemen,1
2024-04-08T16:16:01+00:00,Starc should learn from Cummins how to bowl slow and into the pitch,10
2024-04-08T16:16:09+00:00,Bisla was underrated,6
2024-04-08T16:16:09+00:00,"never give an attacking player the captaincy

I remember Kusal Mendis in the WC he was on god mode and then he went into politician mode",6
2024-04-08T16:16:16+00:00,How the mighty have fallen,3
2024-04-08T16:16:16+00:00,I've got a feeling that anukul roy might...,6
2024-04-08T16:16:18+00:00,For all the kids in comments. It gets easier to bat with new ball the pitch hasn't changed.,10
2024-04-08T16:16:21+00:00,Tustark,3
2024-04-08T16:16:22+00:00,Rana injured?,1
2024-04-08T16:16:33+00:00,Starc is a typical RCB bowler. Doesn't know what the nature of the pitch is. Run in and bowl fast. Get smashed. Get paid.,3
2024-04-08T16:16:34+00:00,Common Gaikwad get that 2023 quickfire form,2
2024-04-08T16:16:38+00:00,Last year we were batting second and everything played out in reverse. It's what you get with this pitch,1
2024-04-08T16:16:39+00:00,Gaikwad on 9/11. Literal batting terrorist confirmed,3
2024-04-08T16:16:42+00:00,"This is power play, and first few overs they will get swing, so bowling slower ones now is the dumbest thing any fast bolwer will do, here analysts making jokes on starc lmafo.",7
2024-04-08T16:16:47+00:00,Nathan coulter nile was better thn starc,8
2024-04-08T16:16:48+00:00,Tuk tuk gaikwad,2
2024-04-08T16:16:51+00:00,"Rutu now denying 2s haha 
So tentative it shows",5
2024-04-08T16:16:56+00:00,Starc is looking innocuous in this slow pitch. Blud needs some variations like Fizz.,1
2024-04-08T16:16:57+00:00,"all captains are anchoring.

and kohli. he's probably captain inside his head",12
2024-04-08T16:16:59+00:00,"Tf r u doin rutu, who told you to play like cunt",0
2024-04-08T16:17:02+00:00,Lmao Harsha having an orgasm when Rachin scores a boundary,7
2024-04-08T16:17:02+00:00,Oceania coming thru,2
2024-04-08T16:17:03+00:00,Lmao,3
2024-04-08T16:17:04+00:00,IPL team strategy - buy best fast bowlers and make them ball slower balls,8
2024-04-08T16:17:06+00:00,Haryanvi commentry: Mai baar baar Bisla sahab ne touch karya karu 💀,6
2024-04-08T16:17:07+00:00,"Time for finch to bring up November 19, again to make them both shut up about Starc",6
2024-04-08T16:17:09+00:00,This is pure cheating. Bcci should investigate csk for changing pitch in innings break,8
2024-04-08T16:17:11+00:00,"I don't know what it is about KKR but it just doesn't seem like Shreyas' team. Like all the other teams seem like the captain's teams (except Ruturaj, but he's new), but Shreyas seems like just another player in the team.",12
2024-04-08T16:17:13+00:00,Ruturaj going strong for a 23(20),6
2024-04-08T16:17:13+00:00,Always love you starc,7
2024-04-08T16:17:14+00:00,Un-Starc-like,5
2024-04-08T16:17:16+00:00,"What a star, what a Starc!",4
2024-04-08T16:17:16+00:00,my boy starc is finished,3
2024-04-08T16:17:22+00:00,"I am ded sure maxi, green and starc will regain their form in the last 3-4 matches and then wreck havoc at the wc",13
2024-04-08T16:17:22+00:00,"Star being expensive, both in auction and on the field",8
2024-04-08T16:17:25+00:00,Yes good bowl 3 feet outside leg now.,5
2024-04-08T16:17:26+00:00,It's over for you lot,4
2024-04-08T16:17:28+00:00,Idk but he seemed so much more loose while batting with conway or faf,1
2024-04-08T16:17:30+00:00,WHAT PUBIC HAIR BALL WAS THAT?,4
2024-04-08T16:17:32+00:00,RCB Starc showed up today.,0
2024-04-08T16:17:33+00:00,Starc should hand over ₹10Cr of his salary to me for making me watch his shite bowling,4
2024-04-08T16:17:34+00:00,"Rutu can take time and gain his form back this match 

Best opportunity",2
2024-04-08T16:17:34+00:00,We know RCB will pay 30 crore for Starc next year,7
2024-04-08T16:17:34+00:00,"Genuinely reckon CSK might be in trouble if they can't kill this game by powerplay, once the field spreads out it's gonna be a nightmare to score boundaries with how hard it seems to get power on your shots on this surface",2
2024-04-08T16:17:34+00:00,Starc you absolute donkey,3
2024-04-08T16:17:34+00:00,Starc serving Rachin some pies,2
2024-04-08T16:17:38+00:00,This means Starc is the PoTM in the WC.,7
2024-04-08T16:17:39+00:00,Ruturaj Gaikwad when Rutupeasant Straightkwad walks in:,5
2024-04-08T16:17:40+00:00,Pack his bags. Get his tickets. Back to KANGAROO LAND for you buddy.,5
2024-04-08T16:17:42+00:00,"Rachin outside of Chepauk: I sleep. 

Rachin in Chepauk: Real shit.",7
2024-04-08T16:17:44+00:00,"> Utkarsh: This has been a pattern from CSK..lose a few games and create such horrible pitches.
> 

Can't get 200+ = Horrible pitch lmao. These flat track merchants delulu.",9
2024-04-08T16:17:48+00:00,"Yeah, the pitch is definitely not slow 🦥",4
2024-04-08T16:17:49+00:00,WOW PITCH CHANGED NOW AHHHHHHHHH,1
2024-04-08T16:17:51+00:00,Gaikwad SR watch - 🟡,1
2024-04-08T16:17:57+00:00,Rachin playing the most Ravindra shot,1
2024-04-08T16:17:58+00:00,"Starc sprays, Shreyas prays.",3
2024-04-08T16:17:59+00:00,Tf is starc smokin',2
2024-04-08T16:17:59+00:00,It looks like its freaking hot and humid out there.. looking at the sweat on Starc and Russell,2
2024-04-08T16:18:00+00:00,Starc is programmed to help the yellow team in any way possible.,9
2024-04-08T16:18:02+00:00,Most overhyped PLAYER (starc),1
2024-04-08T16:18:04+00:00,"At this point, KKR should take the L and just play Chetan Sakariya over Starc in the upcoming matches...",5
2024-04-08T16:18:05+00:00,What did KKR see in Starc to pay 24crs for him? At least Cummins has proved his worth so far.,2
2024-04-08T16:18:06+00:00,Is starc the worst 10cr+ buy ever?beating out Manish Pandey.,2
2024-04-08T16:18:08+00:00,Is CSK home track bully?,5
2024-04-08T16:18:08+00:00,Here I thought starc will silence a team wearing yellow jersey...,2
2024-04-08T16:18:12+00:00,26-0 > 26-1,5
2024-04-08T16:18:14+00:00,strac just waiting for world cup,4
2024-04-08T16:18:15+00:00,tushar > starc common knowledge,3
2024-04-08T16:18:17+00:00,Spinners where sheru,2
2024-04-08T16:18:18+00:00,Why are bus conductors so miserly when it comes to giving change? What do they do with all those ₹10 notes? Assholes of the highest order.,1
2024-04-08T16:18:23+00:00,"24 cr paani mei gaye chhappak!!! 

T : 24 cr wasted.",8
2024-04-08T16:18:25+00:00,I know rachin is a PIO but damn why do we celebrate and have orgasms for individuals who probably won't ever move back here? Harsha just loves him to death,2
2024-04-08T16:18:33+00:00,did they changed the stadium. after the innings?,3
2024-04-08T16:18:35+00:00,"Gambhir and kkr atleast deserve some belt treatment for going after Starc for that preposterous amount of money 
Mother toads",1
2024-04-08T16:18:35+00:00,Put salary cap on foreign players. Can't watch this night time robbery even though its not my money!,8
2024-04-08T16:18:36+00:00,starc seems like he's serious now atleast,1
2024-04-08T16:18:37+00:00,The best thing CSK can have is Gaikwad anchoring till the end,6
2024-04-08T16:18:38+00:00,"I remember the Time when Starc used to practice Spin bowling to make his deliveries more diversified.  

What happened?  Doesn't want to give away too much secrets?",4
2024-04-08T16:18:47+00:00,I dont think anyone knows anything about any pitch . Its all bs,3
2024-04-08T16:18:50+00:00,"Starc is unfit after bowling 10 deliveries , why did we get him instead of Cummins ffs",2
2024-04-08T16:18:53+00:00,"Kkr: abey chuna laga diya


T: con man",2
2024-04-08T16:18:59+00:00,"should bring spin now, pace is not helping kkr",1
2024-04-08T16:19:00+00:00,Oh fuck,3
2024-04-08T16:19:00+00:00,Reminder that KKR were in a similar position after the first 5 overs. It isn't over and doesn't necessarily mean the pitch changed either,3
2024-04-08T16:19:01+00:00,"For all the people calling fraud aussies and English players. It's your team who ignore the talents from NZ, SA, or even from the associate nations. So shut up",4
2024-04-08T16:19:02+00:00,"Starc should lob the ball at Rachin, have Rachin drop the ball and initiate PTSD from the Test series",4
2024-04-08T16:19:06+00:00,Strac is laughing with his 25 cr bag on all of your critisism,7
2024-04-08T16:19:09+00:00,"If Starc can’t even bowl well on this pitch, this is going to be a brutal season for him ",4
2024-04-08T16:19:09+00:00,To everyone saying that rcb starc showed up today prolly haven't seen ipl in 2015,8
2024-04-08T16:19:10+00:00,"Starc is the worst IPL buy since Tymal Mills, perhaps forever...",7
2024-04-08T16:19:13+00:00,Don't give me hope dude,2
2024-04-08T16:19:18+00:00,"KKR need to change their captain. Won't happen this year, but hopefully next.",4
2024-04-08T16:19:18+00:00,Ruturaj Gayakwad when Ruturaj Dancerwad walks in 🚶‍♂️ 🚶‍♀️,11
2024-04-08T16:19:22+00:00,👍,4
2024-04-08T16:19:25+00:00,Yeah get off mate,3
2024-04-08T16:19:26+00:00,"There was no need of that, Rachin",6
2024-04-08T16:19:27+00:00,Why Rachu?,1
2024-04-08T16:19:29+00:00,One more wicket in this over and Game on!,1
2024-04-08T16:19:30+00:00,That's how you bowl Starc.,4
2024-04-08T16:19:30+00:00,"First blodd, lets go, get 2 back to back.",3
2024-04-08T16:19:34+00:00,Ayoooooooo hope back,2
2024-04-08T16:19:35+00:00,Come on Bois comee on,1
2024-04-08T16:19:40+00:00,Gaikwad forced the wicket. Why so tuktuk man,-1
2024-04-08T16:19:40+00:00,rachin looks like Dube. it's so uncanny,7
2024-04-08T16:19:40+00:00,"What a vaib, what a Vaibhav!",6
2024-04-08T16:19:41+00:00,vaibhav to aakash chopra - 👍,2
2024-04-08T16:19:41+00:00,👍🏻,2
2024-04-08T16:19:41+00:00,Now starts the runs drought,2
2024-04-08T16:19:41+00:00,Fuck sake Rachin. The field is spread and that’s the only place you could think of hitting it?,11
2024-04-08T16:19:45+00:00,"we used ""belt treatment"" word to libreally in this thread",3
2024-04-08T16:19:48+00:00,Wat a shot perfectly placed ,2
2024-04-08T16:19:49+00:00,Game over.,1
2024-04-08T16:19:49+00:00,What do you guys think? Will IPL ever goback to no impact player rule? Honestly I don't think so.,2
2024-04-08T16:19:51+00:00,Spin choke them before dube comes in,2
2024-04-08T16:19:52+00:00,Viabhav has outbowled Starc two games in a row.,2
2024-04-08T16:19:54+00:00,"**3.2** **he has picked out long-on!** Wonder if Rachin forgot the field had been pushed back. This was short of length and outside off, he swung through the line but instinctively let out a groan as he saw the fielder near the ropes.

Rachin Ravindra c Varun b Arora 15 (8b 3x4 0x6) SR: 187.5",2
2024-04-08T16:19:55+00:00,"Mitchell promoted?? 

Rahane is injured ig",2
2024-04-08T16:19:55+00:00,Collapse,2
2024-04-08T16:19:57+00:00,Wow CSK vs SRH gonna be a proper revenge then 🥲,3
2024-04-08T16:19:58+00:00,Arora >>>>>> STARC,3
2024-04-08T16:20:02+00:00,Force of habit,1
2024-04-08T16:20:03+00:00,rachin seems like a good humble lad,2
2024-04-08T16:20:06+00:00,[deleted],-7
2024-04-08T16:20:06+00:00,Sending in Mitchell to gain some form,5
2024-04-08T16:20:06+00:00,"For all experts here, kkr were 56/1 in powerplay.",13
2024-04-08T16:20:07+00:00,"130k cutter into the pitch, straight to the fielder.",2
2024-04-08T16:20:09+00:00,Is Rahane injured? Mitchell is coming in,3
2024-04-08T16:20:12+00:00,"ravindra man you were looking good, needs to work a bit on decision making for shots",2
2024-04-08T16:20:12+00:00,"Tried to be a hero, got fucked",2
2024-04-08T16:20:13+00:00,Consistency is key.. Rachin is quick but Conway is more reliable.,6
2024-04-08T16:20:13+00:00,Cannot comprehend how different this version of Rachin is as opposed to the one I’ve seen in 50 over and red ball cricket,4
2024-04-08T16:20:17+00:00,"Varun took a catch.

Us KKR fans take it as a win.",2
2024-04-08T16:20:22+00:00,unnecessary,1
2024-04-08T16:20:23+00:00,game is already over,1
2024-04-08T16:20:26+00:00,Yeah fuck these slow wicket merchants,0
2024-04-08T16:20:28+00:00,Hattrick of mid on/long on dismissals for Rachin,3
2024-04-08T16:20:30+00:00,The Mitchell-off has begun,1
2024-04-08T16:20:31+00:00,👍🏻 is the new 😘🫴🏻,1
2024-04-08T16:20:31+00:00,one shot player,3
2024-04-08T16:20:38+00:00,"Does KKR have another pacer to replace Starc? (Serious question, not trolling)",1
2024-04-08T16:20:39+00:00,Looks like BCCI wants to show that the pitches aren't only Batsman friendly. There's some serious fixing going on here.,-2
2024-04-08T16:20:39+00:00,rachin got out so that dubey comes soon /s,1
2024-04-08T16:20:41+00:00,Rachin seems to have only one shot,3
2024-04-08T16:20:41+00:00,imagine paying 5k to watch match as a kkr fan,0
2024-04-08T16:20:41+00:00,Someone gonna drop that harsha copypasta now 😭,2
2024-04-08T16:20:43+00:00,"learn from Vaibhav , mr starc",2
2024-04-08T16:20:47+00:00,"Still better than rutu’s tf he’s there for , Are openers supposed to take game deep ?",3
2024-04-08T16:20:48+00:00,Rachin might be quicker and aggressive than Conway but Conway was consistent and gave good platform to build from.,11
2024-04-08T16:20:48+00:00,"With Starc clutching his abs and all, I guess he would want to rest in the next game with some 'niggle'. Might not be the worst thing for KKR to go with Harshit and Vaibhav...  
In that case, they can use the 4th impact player slot with a foreigner, if required.",6
2024-04-08T16:20:51+00:00,this match will bring down all the NRR that Kolkata collected against Delhi,4
2024-04-08T16:20:55+00:00,"Starc BC is pitch pe bhi pit raha hai 😂😂

T: Starc Justifying his “expensive” tag by being an expensive bowler 😂😂😂",5
2024-04-08T16:20:57+00:00,">Wonder if Rachin forgot the field had been pushed back.

Savage cricinfo!",11
2024-04-08T16:20:57+00:00,Bro they specifically placed a fielder for that shot..,6
2024-04-08T16:21:01+00:00,What will it take to stop this crappy iPhone ad??,9
2024-04-08T16:21:06+00:00,This is the ideal game for Mitchell,7
2024-04-08T16:21:09+00:00,This thread is so reactive it's frustrating,11
2024-04-08T16:21:13+00:00,No rahane??,6
2024-04-08T16:21:17+00:00,"Rrr is 6.66, just 1 more big over and tuk tuk ffs",3
2024-04-08T16:21:27+00:00,Narine hit 2 sixes on this pitch. Greatest opener in ipl!,3
2024-04-08T16:21:27+00:00,Bizzare tactics to not send Rahane in the powerplay. What's he supposed to do later?,3
2024-04-08T16:21:27+00:00,Declare Koyal as our national bird already,5
2024-04-08T16:21:32+00:00,"Rachin is just a little too rash. If he can develop some patience, he is gonna age well",12
2024-04-08T16:21:34+00:00,hopefully we get rid of impact rule. it sucks,5
2024-04-08T16:21:35+00:00,KKR look sharp in the field. Another wicket here and game on.,5
2024-04-08T16:21:35+00:00,This Apple ad is annoying asf,15
2024-04-08T16:21:35+00:00,Something tells me tonight's when we finally see Mitchell gain some form,7
2024-04-08T16:21:37+00:00,"what is the witchcraft, mitchell at 3",12
2024-04-08T16:21:40+00:00,now the real tuk tuk procession begins,13
2024-04-08T16:21:55+00:00,This is the kind of score that Mitchell should be perfect at chasing,12
2024-04-08T16:21:56+00:00,Please koach dm Rachin some slurs again we need his form,11
2024-04-08T16:22:13+00:00,Gaikwad SR watch - 🟡,2
2024-04-08T16:22:14+00:00,Gaikwad shouldn’t open if he’s just going to knock it around tbh. Maybe come in at 3 but I suspect his SR would be even worse,3
2024-04-08T16:22:15+00:00,Might Guy Vaibhav,1
2024-04-08T16:22:15+00:00,"KKR: Paisa Barbaad Behenxo

Trans: Money wasted",3
2024-04-08T16:22:17+00:00,Need to get close to 50 in the powerplay and switch to tuk tuk once the ball gets soft.,3
2024-04-08T16:22:26+00:00,"Just read on cricbuzz

This has been a pattern of csk... Lose a few game and create such horrible pitch.

Now my memory is shit, so is this true or reactionary from them",4
2024-04-08T16:22:28+00:00,Don’t injure urself 24 cr,2
2024-04-08T16:22:29+00:00,Fielding has been exceptional!!,1
2024-04-08T16:22:31+00:00,Good fielding,1
2024-04-08T16:22:32+00:00,Shivam Dube when Macheteam Dube walks in:,3
2024-04-08T16:22:34+00:00,No way we're fielding decently today,1
2024-04-08T16:22:34+00:00,"If Rutu gets out for 25-35 runs after tuktuk, we're so screwed.",3
2024-04-08T16:22:36+00:00,"So there far no chemistry b/w. Rachin and Gaik 


Faf and Rutu ,Conway and Rutu had it even in running ",7
2024-04-08T16:22:45+00:00,These 2 are perfect for such a chase tbh.,7
2024-04-08T16:22:46+00:00,"This is the perfect setup for Mitchell to shine. If he doesn't do well today, might as well just move on from him",7
2024-04-08T16:22:47+00:00,I wish the guy who came up with the Apple ad wishes to reach home early to pee but get stuck in 4 hours traffic jam in Banglore.,12
2024-04-08T16:22:50+00:00,How many games does Starc need to play to get his entire auction money? Mans prepping up to leave.,11
2024-04-08T16:23:03+00:00,Perfect time for narine baby,3
2024-04-08T16:23:04+00:00,Rcb > kkr,-14
2024-04-08T16:23:22+00:00,"KKR 500IQ play of taking one for the team, getting Starc injured before the WC to help India /s",4
2024-04-08T16:23:23+00:00,Respect increase for Cummins more even after getting 20 crore he choose to perform for SRH .,10
2024-04-08T16:23:31+00:00,CSK have two PP overs to get ahead. I don't think it's going to be a straightforward chase from thereon,8
2024-04-08T16:23:34+00:00,Lmao why do we have football like injury crisis?? Wtf is the physio doing?,10
2024-04-08T16:23:40+00:00,"Doesn't matter who the opponent is, Starc will go at 10 runs an over",7
2024-04-08T16:23:44+00:00,What is salt celebrating for   ?,3
2024-04-08T16:23:53+00:00,"Starc is struggling with something, Narine injured. What is this csk voodoo",12
2024-04-08T16:23:58+00:00,this is the day gaikwad/mitchel gonna shine,3
2024-04-08T16:24:00+00:00,Mitchell playing Shreyas Iyer’s role of Tuk-Tuk 🛺🛺 batting.,3
2024-04-08T16:24:01+00:00,how tf Vaibhav Arora is able to swing the ball and not Starc ?,3
2024-04-08T16:24:07+00:00,Class!,2
2024-04-08T16:24:11+00:00,Cummins and Head are the only Aussies performing,3
2024-04-08T16:24:15+00:00,Anukul before narine and VC? Brave!,3
2024-04-08T16:24:20+00:00,Clean af,6
2024-04-08T16:24:20+00:00,That's more like it from Gaikwad,4
2024-04-08T16:24:23+00:00,Damn. Great shot,4
2024-04-08T16:24:27+00:00,"All hot guys put your arms up and say

~~Om Shanti om~~ Jio Dhan Dhana Dhan",5
2024-04-08T16:24:28+00:00,"C'mon , bowl Narine you Cowards !!!",5
2024-04-08T16:24:30+00:00,"Vaibhav Arora giving 3 runs 
Starc giving 15 runs 
Can you imagine that.

How come he is a great bowler?

If you want to find an all condition great bowler look at mi there is a guy called bumrah",3
2024-04-08T16:24:30+00:00,Is Narine injured?,3
2024-04-08T16:24:31+00:00,"Imo KKR have had only one mega expensive buy that panned out and it's GG , none of our  big buys since then have delivered the performance you'd expect from them .",5
2024-04-08T16:24:33+00:00,What a cover drive!,4
2024-04-08T16:24:38+00:00,I wanted Roy. Jason Roy. Not Anukul Roy,3
2024-04-08T16:24:40+00:00,Wow beautiful,5
2024-04-08T16:24:40+00:00,Classic,4
2024-04-08T16:24:40+00:00,Brilliant cover drive ,7
2024-04-08T16:24:47+00:00,Up to 50 can be tolerated in the PP,1
2024-04-08T16:24:49+00:00,"Iyer played this multiple times, coundnt time it even once.",5
2024-04-08T16:24:49+00:00,If chuker is injured than this game is already over for kkr,10
2024-04-08T16:24:51+00:00,Wanna see how shivam dube does vs narine on this pitch,3
2024-04-08T16:24:58+00:00,"How many Mitchells do you need?

The sport of cricket: Yes",6
2024-04-08T16:25:05+00:00,Gaikwad looking dangerous with that 113 SR against pace this season,2
2024-04-08T16:25:06+00:00,A good stategy might be to bowl out Starc and then send him in to rest. He’s not looking good.,1
2024-04-08T16:25:10+00:00,"What a drive, what a driver!",1
2024-04-08T16:25:10+00:00,Why people are so rude on starc it’s not his forte and it was gg’s stupidity to over the top for him and ofc nehra fooled gg that day.,3
2024-04-08T16:25:10+00:00,"CSK could send Dhoni early with this total , that way he can't botch it up if it gets tight later",1
2024-04-08T16:25:10+00:00,Wasn't this guy a specialised fielder a few seasons back.,3
2024-04-08T16:25:11+00:00,"How did we choke so hard man ?

How ?",1
2024-04-08T16:25:14+00:00,Anukul over Suyush is one decision of Gambhir. I am completely against it,1
2024-04-08T16:25:19+00:00,What shoes Russell is wearing?,1
2024-04-08T16:25:20+00:00,That was a run-out ball from Anukul....,1
2024-04-08T16:25:22+00:00,"KKR picked up Anukul in impact sub only because of his batting ahead of Suyash, and he couldn't bat either. Might as well brought in Suyash",5
2024-04-08T16:25:32+00:00,"So this is KKR's demise, I guess or has Mr. Shah planned something else for this game?",3
2024-04-08T16:25:32+00:00,I have noticed that some people just hate to accept the fact that some bowlers actually bowl good line and length no matter how the pitch is 😂😂,4
2024-04-08T16:25:41+00:00,Phil Saltzwan,2
2024-04-08T16:25:50+00:00,Meme review,1
2024-04-08T16:25:51+00:00,bruh that hit bat.,1
2024-04-08T16:25:52+00:00,Wtf????,1
2024-04-08T16:25:54+00:00,"I forgot, who does Jaiswal have beef with (run out), Gaikwad or Paddikal?",1
2024-04-08T16:25:54+00:00,No no don't review that!,3
2024-04-08T16:25:55+00:00,Review wasted,3
2024-04-08T16:25:55+00:00,Bat first,4
2024-04-08T16:26:00+00:00,Thalas captaincy obv,4
2024-04-08T16:26:05+00:00,KKR bought Rizwan?,1
2024-04-08T16:26:06+00:00,Bat involved clearly,5
2024-04-08T16:26:07+00:00,"Come on, it was clearly off the bat.",2
2024-04-08T16:26:13+00:00,KKR bought Rizwan?,5
2024-04-08T16:26:20+00:00,LMAO,2
2024-04-08T16:26:22+00:00,"This is the most fuckall review I have ever seen, Iyer is making a mockery of himself this ipl",12
2024-04-08T16:26:25+00:00,lol why is Anukul ignoring Salt?? Bro is literally shouting on top of his lungs,3
2024-04-08T16:26:28+00:00,"No way , bowler plz get ur eyes checked up",8
2024-04-08T16:26:36+00:00,HOW THE FUCK DO YOU MANAGE TO WASTE A REVIEW LIKE THAT,7
2024-04-08T16:26:38+00:00,Didn't rock and roll absolute savage,4
2024-04-08T16:26:42+00:00,no ultra edge?? ![img](emote|t5_2qhe0|8774),6
2024-04-08T16:26:42+00:00,bangbros type of review...,2
2024-04-08T16:26:46+00:00,"Anukul Roy has such an interesting career. Sit on the bench most of the season, once in a while go field like a madman or bowl an economical spell, then back to the bench. Rinse and repeat every few seasons for another team",4
2024-04-08T16:26:48+00:00,bangbros type of review...,9
2024-04-08T16:26:48+00:00,That didn't even look out even if it didn't hit the bat,4
2024-04-08T16:26:52+00:00,Desperate review,5
2024-04-08T16:26:53+00:00,I could hear the sound of bat from here.,7
2024-04-08T16:26:57+00:00,Quickest review record,6
