Timestamp,Comment,Upvotes
2024-04-08T14:50:38+00:00,Man i missed the good old test match vibe. Love this.,9
2024-04-08T14:50:40+00:00,Hello world,0
2024-04-08T14:50:40+00:00,Csk fan bois downvoting me![img](emote|t5_2qhe0|28120),-17
2024-04-08T14:50:40+00:00,Rachin actually has pretty good control,3
2024-04-08T14:50:41+00:00,Why is Ravindra a bigger star than Shreyas ?,1
2024-04-08T14:50:41+00:00,So Harsha thinks Rinku's presentation to selectors is more important than this match for KKR smh,5
2024-04-08T14:50:43+00:00,CSK don’t even care to bring pace to Shreyas Iyer wtf,3
2024-04-08T14:50:49+00:00,"Harsha is so stupid. Yes, riinku might have more to offer than being a late order basher, but that’s his **role** in this squad. Doesn’t matter what else he’s capable of.",2
2024-04-08T14:50:49+00:00,"Waiting for a spin choke from Narine, Varun, Anukul.",3
2024-04-08T14:50:53+00:00,Rinku averages 37 at a SR of 113 vs spin in T20 cricket and Harsha is going on a 5 min rant about why he wasn't sent up the order.,6
2024-04-08T14:50:55+00:00,"I don't want to call Shreyas spin basher anymore, I can't remember the last time he has bashed anyone",4
2024-04-08T14:50:58+00:00,Iyer Idli slowing down,1
2024-04-08T14:51:01+00:00,Stop with the horn shit... already the roads are full of it..,2
2024-04-08T14:51:02+00:00,[deleted],4
2024-04-08T14:51:02+00:00,Shreyas gonna hold one end and Ramandeep gonna hit so keep an ounce of patience ffs! Would rather have a 160 instead of 120/10,3
2024-04-08T14:51:03+00:00,Man shreyas has become so weak mentally and physically,3
2024-04-08T14:51:04+00:00,Lord Rinku looking down at the mere mortals,3
2024-04-08T14:51:04+00:00,"CSK this year seems like get hit everywhere outside Chepauk and bash everyone here. As long as we can win 5-7 games here and win 2 or 3 away, we will qualify.",4
2024-04-08T14:51:08+00:00,20 runs in 5 overs. Choke is on,6
2024-04-08T14:51:08+00:00,Harsha goes real dark sometimes 😩😫,1
2024-04-08T14:51:09+00:00,"Lol what's with all the Iyer hate, he is 5(7), ramandeep is also 4(6), no one is hating on him tho",2
2024-04-08T14:51:11+00:00,Been a while since Iyer has done well in T20s,7
2024-04-08T14:51:12+00:00,So confused with KKR plans are they looking to attack or rebuild?,4
2024-04-08T14:51:16+00:00,"rachin's face looks, he is down in confidence.",0
2024-04-08T14:51:17+00:00,How come every team blows hot and cold except RR?,1
2024-04-08T14:51:18+00:00,Does Rachin look like [Tatya Bichoo](https://i.ytimg.com/vi/UFCk81xaEKQ/mqdefault.jpg) to anyone,2
2024-04-08T14:51:19+00:00,"I guess Ramandeep has got the message from Shreyash to calm the f\*\*k down and anchor till 13-14th to avoid a collapse. Not entertaining, but practical.",5
2024-04-08T14:51:23+00:00,8 overs of the RAVINDRAS! ⚔️💛,1
2024-04-08T14:51:25+00:00,Real test for kkr batting today...,4
2024-04-08T14:51:29+00:00,Boring,1
2024-04-08T14:51:29+00:00,shreyas was supposed to be spin basher,3
2024-04-08T14:51:30+00:00,"Hero cam is too much, i can literally see thala scratching his balls",4
2024-04-08T14:51:30+00:00,"Guys help me think of a Ravindra Jadeja and Rachin Ravindra joke. I know there's a joke somewhere here, just can't seem to catch it. ",2
2024-04-08T14:51:31+00:00,No spin on the pitch. CSK using spin choke to lure KKR into picking Suyash as an Impact Sub. CSK smash him? Thala playing chess.,5
2024-04-08T14:51:31+00:00,"Imo just bowl defensive balls and keep Iyer and Ramandeep on the crease, Russel and Rinku will be way worse than what’s happening rn lol",0
2024-04-08T14:51:31+00:00,Easy win? Or wanting to see dhoni bat? Pick ur choice 🤣,5
2024-04-08T14:51:32+00:00,Still faster than LSG and KL,2
2024-04-08T14:51:33+00:00,![img](emote|t5_2qhe0|29262) Rachin,3
2024-04-08T14:51:37+00:00,Just rotate strike get the odd 4 or 6 take it till 14 - 15 over then go all out,3
2024-04-08T14:51:38+00:00,Shreyas iyer should not be abused. Man used all his luck and intent im world cup,5
2024-04-08T14:51:41+00:00,"His form may have been slightly erratic recently, but Jaddu will get such help on the pitches in WI too, will be unplayable for sure",5
2024-04-08T14:51:44+00:00,How good of a bowler is Rachin? Is he batter first  who does bowl when needed or do both properly?,3
2024-04-08T14:51:47+00:00,Wow they're really not letting up with the Spin Choke,3
2024-04-08T14:51:47+00:00,"I'll apologise to KL today, at least he didn't block balls trying to hit everything nonsensically 


Hand me an apology form pls",4
2024-04-08T14:51:48+00:00,Spin choke is back at Chepauk. 🥹🥹🥹,8
2024-04-08T14:51:52+00:00,Weren't kkr 50 something in 5 overs? What a turnaround.,6
2024-04-08T14:51:52+00:00,fk. I thoght it will be high scoring match not some one sided shit show.,1
2024-04-08T14:51:54+00:00,5 overs since the last boundary by KKR.!,5
2024-04-08T14:51:56+00:00,Chennai has so much Horns,1
2024-04-08T14:51:59+00:00,Manforce...💦💦💦,3
2024-04-08T14:52:09+00:00,Dew is here![img](emote|t5_2qhe0|29262),5
2024-04-08T14:52:09+00:00,Rachin looks like the try-hard topper who decimates school academics but later gets bullied and ragged in college and becomes the cool idgaf with mid-performance guy.,3
2024-04-08T14:52:11+00:00,"KKR bats well: The pitch is a road

KKR struggling: CSK are masters of spin choke",17
2024-04-08T14:52:11+00:00,[deleted],2
2024-04-08T14:52:17+00:00,Is Chepauk a low scoring pitch?,-1
2024-04-08T14:52:17+00:00,What is Ramandeep doing wasting his time on cricket. He could be a model instead,3
2024-04-08T14:52:18+00:00,Jadeja's figures looks so good here,4
2024-04-08T14:52:28+00:00,Fucking hell iyer….. enough dots,1
2024-04-08T14:52:34+00:00,Finally Varun chakarvarty will lick his lips looking at the pitch,3
2024-04-08T14:52:37+00:00,"Ah a spin choke at Chepauk, a tale as old as time 😂",2
2024-04-08T14:52:37+00:00,"Iyer needs to understand tuktuking to 150 won't be enough 

Atleast take singles man",3
2024-04-08T14:52:39+00:00,Aah iyer snoozefest,0
2024-04-08T14:52:40+00:00,Is it that hard to smash spin basher ?,2
2024-04-08T14:52:40+00:00,Either score or give someone else a go shreyas,4
2024-04-08T14:52:43+00:00,I started watching at 54-1 at 5.1 overs,7
2024-04-08T14:52:44+00:00, chennai homeground 🏟️ is meh. Eden and chinnaswamy gives the best vibes.,-8
2024-04-08T14:52:46+00:00,How's dew at Chennai?,2
2024-04-08T14:52:47+00:00,"Narine,Russell,Rinku or inshaallah for kkr...",7
2024-04-08T14:52:52+00:00,Skipper anchorage continues,7
2024-04-08T14:52:59+00:00,"Its always fascinating to see the spin choke in action, with ipl being so batter friendly its wonderful to see bowlers doing their thing",12
2024-04-08T14:53:02+00:00,33 balls without a boundary 😭,7
2024-04-08T14:53:03+00:00,6-56 to 10.4-72,4
2024-04-08T14:53:04+00:00,Shreyas is behaving like Koach in his 90s,13
2024-04-08T14:53:05+00:00,Thanks for not making us bowl against Rinku.,3
2024-04-08T14:53:05+00:00,Will Shreyas Iyer get benched from the next game? 🤨🤔,0
2024-04-08T14:53:07+00:00,Get this Shreyas out and Kingku in.,1
2024-04-08T14:53:13+00:00,Can't believe this is the guy who hit 24 sixes in an ICC tournament,8
2024-04-08T14:53:15+00:00,So nice to see pitches with sub-200 scores after all the highways. Props to the curator,8
2024-04-08T14:53:17+00:00,Yeah we losing this one,1
2024-04-08T14:53:17+00:00,where's my spin basher Iyer,3
2024-04-08T14:53:18+00:00,I don’t think Shreyas is the Kohli successor guys,3
2024-04-08T14:53:18+00:00,I agree with the guy saying rachin looks like tatya bichu....,3
2024-04-08T14:53:19+00:00,"If GG has dreams about Rcb, does he have nightmares about Csk? Im sure his insecure lil ass hates Dhoni to this day lol.",6
2024-04-08T14:53:22+00:00,6 overs without a boundary is wild,4
2024-04-08T14:53:26+00:00,KKR thinks they're playing on Lucknow pitch,2
2024-04-08T14:53:28+00:00,"trust me bro, pitch was slow, interview coming.",2
2024-04-08T14:53:33+00:00,"CSK are such chepauk merchants. Finals are there this year too, they’re winning",0
2024-04-08T14:53:35+00:00,Faf: Hey I’ve seen this before. It’s a classic.,5
2024-04-08T14:53:37+00:00,"varun chakravarthy, home ground, spinning track,""mystery spinner"", get ready dube, we need you",11
2024-04-08T14:53:39+00:00,Finally. Time for these two to ramp it up.,2
2024-04-08T14:53:40+00:00,Gambhir should take his belt out today,5
2024-04-08T14:53:40+00:00,Hahahahha.. where are the guys who keep downvoting me whenever I say KKR is shit and is too dependent on Russell and Narine. Bowlers are nothing special either. KKR will finish in the bottom half of the table when MI peaks at the end,-6
2024-04-08T14:53:42+00:00,"In the second innings the pitch will become easy to bat on, and CSK will chase this in 15 overs",5
2024-04-08T14:53:44+00:00,Jio cinema broadcast is sucking ass tonight.,2
2024-04-08T14:53:48+00:00,This is the CSK we know,3
2024-04-08T14:53:48+00:00,Bruh someone just said terrible pitch 🤦‍♂️,4
2024-04-08T14:53:52+00:00,"Jaddu-Kuldeep-Bishnoi spin trio will be lethal in WI, with Bumrah-Arshdeep/Chahar-Hardik pace trio to support, which enables batting depth too",2
2024-04-08T14:53:53+00:00,The so called fearless KKR lineup terrified to hit boundaries. That's the power of CSK,0
2024-04-08T14:53:53+00:00,Boundary lmaooo classic test shreyas Iyer,3
2024-04-08T14:53:55+00:00,Iyer committing felony after felony,3
2024-04-08T14:53:57+00:00,KKR batting in shambles or the wicket slow? Just joining in.,1
2024-04-08T14:53:58+00:00,160 par score ?,3
2024-04-08T14:53:59+00:00,This 4 ruined iyers test innings,5
2024-04-08T14:54:02+00:00,boundary drought brought me back to the world cup final,4
2024-04-08T14:54:03+00:00,The ball is stopping a lot for rachin and turning a lot of jaddu. Rachin would be very economical against Russel today,1
2024-04-08T14:54:06+00:00,I'll guarantee this is the pitch and we are going to have the same struggles if not worse chasing whatever they put up,1
2024-04-08T14:54:07+00:00,"later in the season  , home teams will just put a mountain on the pitch so that the ball doesnt even reach the batter , i hate these slow af pitches",-2
2024-04-08T14:54:07+00:00,"Four after 34 Balls (3+4 = 7)  
Total Runs in Over = 7

Message is clear",4
2024-04-08T14:54:10+00:00,"Looking at this ,maybe Koach and his anchor approach is not dead in t20s",3
2024-04-08T14:54:12+00:00,97 balls without a boundary,5
2024-04-08T14:54:12+00:00,Oh Shreyas can hit a boundary too ?,3
2024-04-08T14:54:16+00:00,Jaddu can't ever be counted out. Between his fielding bowling and batting in that order he will p much always have something going his way,4
2024-04-08T14:54:16+00:00,Iyer is going to end up in the KL and Kohli route.,-1
2024-04-08T14:54:16+00:00,"just discovered about the multi cam feature, and kinda disappointed with it not being a POV cam. It just lets me stare at Thala's ass, but otherwise pretty boring.",1
2024-04-08T14:54:25+00:00,KKR has quality spinners so they could easily defend if they score around 165+,5
2024-04-08T14:54:28+00:00,KKR went from looking like the best team to RCB against CSK.,7
2024-04-08T14:54:31+00:00,Batriarchal IPL has spoilt Indian fans. Low scoring games like yesterday are hella fun. Kinda crazy how we're calling 160 a low score but that's what it has come to.,43
2024-04-08T14:54:33+00:00,It was 50 in 5 overs and only 27 in last 6.,5
2024-04-08T14:54:37+00:00,CSK batters will find a way to choke and give us a heart attack,4
2024-04-08T14:54:39+00:00,"KKR scored 77 in 11 overs at RR of 7

Message is clear",26
2024-04-08T14:54:47+00:00,Okay finally a boundary. Not an easy pitch but gotta show intent,8
2024-04-08T14:54:51+00:00,"Indian RHBs and their struggles against left arm bowlers 
Classic",3
2024-04-08T14:55:00+00:00,7 rpo ain’t gonna cut it,1
2024-04-08T14:55:01+00:00,"77 in 11

77/11 = ?",7
2024-04-08T14:55:01+00:00,y'all,1
2024-04-08T14:55:09+00:00,at least try to hit….. quit wasting balls,1
2024-04-08T14:55:23+00:00,I would've asked thala to tie me up and choke,1
2024-04-08T14:55:24+00:00,Ramandeep thinks it’s day 3 of a test,0
2024-04-08T14:55:25+00:00,What a downgrade for the advertisement industry . All these spaces for promotion yet they chose these dumb ideas.,0
2024-04-08T14:55:27+00:00,Kukur are really struggling.,-1
2024-04-08T14:55:27+00:00,"Everything is leading to 6th for CSK this year, they should win all games at home and they can get into playoffs. With semis and finals being here it's a perfect send off to Thala. 

Ofc unless one sexy tall lad from Aus wants to silence some fans again.",5
2024-04-08T14:55:27+00:00,Even Starc would hit better.,0
2024-04-08T14:55:31+00:00,Ramandeep and iyer will take 5 overs to settle in and then get out,10
2024-04-08T14:55:50+00:00,"now every team will just create a test pitch and win home games bruh stop this shit , i died watching yesterday lsg gt match",3
2024-04-08T14:55:51+00:00,Why not send Rinku and Russel to maximize gains? What is this strategy to hold most explosive batsmen to okay least balls?,2
2024-04-08T14:55:53+00:00,Where is Rana? Much better player of spin,1
2024-04-08T14:55:54+00:00,Get this fake R singh out I want to see the OG R singh masterclass,3
2024-04-08T14:55:54+00:00,Csk gonna get butchered by Narina and Varun here...,1
2024-04-08T14:55:56+00:00,"Problem is it's going to get easier for batting in second innings. If it remains sticky, our spinners will love it",3
2024-04-08T14:55:57+00:00,"Thanks CSK, this loss was important 🫂",1
2024-04-08T14:55:59+00:00,"a cringe insta page is already editing on that ""Spirit of Cricket"" moment, thanking Thala for bringing that culture in CSK.",2
2024-04-08T14:56:01+00:00,Scotty rubbing in some sandpaper,7
2024-04-08T14:56:08+00:00,"I think KKRs gonna have to use Anukul as their impact player, to get that extra batter",2
2024-04-08T14:56:08+00:00,bowl more of rachin,2
2024-04-08T14:56:08+00:00,Bro with those sandpaper jokes 😂,6
2024-04-08T14:56:10+00:00,Brain dead move by kkr for not bringing out rinku,2
2024-04-08T14:56:12+00:00,I guess they’re still adapting to the conditions,1
2024-04-08T14:56:12+00:00,"Need atleast run a ball, even if you're trying to prevent a collapse",2
2024-04-08T14:56:15+00:00,Thee two aren’t even trying…..,2
2024-04-08T14:56:16+00:00,With these idiots eating all the balls even Rinku and Russell can't do anything in the end...,3
2024-04-08T14:56:16+00:00,Why is everyone panicking? The main batters for KKR are yet to come out,2
2024-04-08T14:56:17+00:00,Fuck this is painful to watch...,2
2024-04-08T14:56:22+00:00,Theekshana shoes 👀,1
2024-04-08T14:56:23+00:00,Kkr waiting for a pacer little do they know lord is running spinner only.,3
2024-04-08T14:56:26+00:00,Scotty just killing Aussies lol,4
2024-04-08T14:56:26+00:00,Wtf is Shreyas doing? Where's the intent?,2
2024-04-08T14:56:28+00:00,Now I want a close low scoring match,1
2024-04-08T14:56:30+00:00,"Punjab already moved into their 6th spot, time to have kids.",5
2024-04-08T14:56:34+00:00,Ramandeep on 7...you know what that means,1
2024-04-08T14:56:36+00:00,Iyer is assets for opposition,1
2024-04-08T14:56:37+00:00,Scotty what are you doing,2
2024-04-08T14:56:40+00:00,kolkata peeps please try out the mud pie from balaram mullick. its so so good! ,3
2024-04-08T14:56:42+00:00,Should have continued with Rachin,4
2024-04-08T14:56:46+00:00,"Daily announcement on How much I love insider comms especially when everyone else seems to be complaining about other commentators.


These guys elevate match watching experience",4
2024-04-08T14:56:47+00:00,Not bringing in Rinku and Russell is pathetic,3
2024-04-08T14:56:49+00:00,All of Theeksana's boundaries are Sixes,2
2024-04-08T14:56:53+00:00,Less go DEEP.,1
2024-04-08T14:56:55+00:00,"fk test in t20s, either get allout under 100 or score at atleast 10 crr.",1
2024-04-08T14:56:56+00:00,[deleted],3
2024-04-08T14:56:58+00:00,Can everyone calm down? Maybe we are back to the old Chepauk where it's difficult to score? Just need to wait and watch.,7
2024-04-08T14:56:59+00:00,Raman got that dawg in him,2
2024-04-08T14:57:03+00:00,Try to hit and get out,1
2024-04-08T14:57:05+00:00,"Shreyas is definitely gonna play for us in the world cup, KL and koach too, the middle order is absolutely doomed",4
2024-04-08T14:57:09+00:00,Rinku should have come in before Singh. Poor decision,3
2024-04-08T14:57:12+00:00,INTENT and GONE,4
2024-04-08T14:57:13+00:00,r/deathrattleporn,7
2024-04-08T14:57:14+00:00,Let's go rammendeep,3
2024-04-08T14:57:14+00:00,Enough settling it you knuckleheads having a fucking hit,3
2024-04-08T14:57:18+00:00,"If CSK don't qualify for the playoffs, I would want them to finish at the 7th position. You know the reason.",7
2024-04-08T14:57:19+00:00,Ramandeep you moron,5
2024-04-08T14:57:19+00:00,"Six and then bowled 

6W is the common script in jay shahs writing",10
2024-04-08T14:57:20+00:00,Finally the Goat will arrive,7
2024-04-08T14:57:22+00:00,Gambhir asked them to maintain 7 run rate till 11th over to give tribute to dhoni's 2011 world cup heroics,37
2024-04-08T14:57:24+00:00,Jinxed it.,1
2024-04-08T14:57:25+00:00,Yes sir,2
2024-04-08T14:57:25+00:00,Ramandeep got too confident after that 6.,5
2024-04-08T14:57:26+00:00,Note to Koach: THIS is an actual slow sticky pitch. Not the batting beauty you played tuk tuk on,13
2024-04-08T14:57:26+00:00,beauutyyyyy,4
2024-04-08T14:57:27+00:00,Theekshana is in god mode!!!,4
2024-04-08T14:57:29+00:00,Hope Thala doesn't embarrass himself against Varun today,2
2024-04-08T14:57:30+00:00,Nah Santer still >>,2
2024-04-08T14:57:31+00:00,Perfect time for Kingku,1
2024-04-08T14:57:31+00:00,No no no! What have you done Theekshana,3
2024-04-08T14:57:32+00:00,Theeksshana where areow shooting action man?,3
2024-04-08T14:57:32+00:00,Rinku and Russell again tasked to do the impossible today,5
2024-04-08T14:57:33+00:00,EXPOSED,3
2024-04-08T14:57:33+00:00,Scared of Thakur/Deshpande vs Russel / Rinku,8
2024-04-08T14:57:34+00:00,Good. Let’s get someone in who will at least try and hit.,5
2024-04-08T14:57:35+00:00,"Was too restless 
Here and there 
No stable base",5
2024-04-08T14:57:35+00:00,WHY DID YOU TAKE HIS WICKET,5
2024-04-08T14:57:38+00:00,"if kkr find a more consistent batter compared to venkatesh, they have a really good batting order",1
2024-04-08T14:57:39+00:00,Holy hell nice ball from Theeks. Finally gets a wicket at chepauk after 6 or so games lmao,6
2024-04-08T14:57:39+00:00,spin choked,2
2024-04-08T14:57:40+00:00,Real batting starts now...,2
2024-04-08T14:57:40+00:00,Iyer Bhai is a spin basher!? 😂😂😂😂,1
2024-04-08T14:57:41+00:00,First big test for us today,3
2024-04-08T14:57:43+00:00,Does this really 47 comments in 2 hrs?,3
2024-04-08T14:57:43+00:00,Dhoni caught bails lol,8
2024-04-08T14:57:45+00:00,"Lol, someone playing below a run a ball for 7 or 8 balls suddenly means they're playing Tests? Go watch T10 if you can't bear a single dot ball",29
2024-04-08T14:57:46+00:00,Muthaiya theekshana,6
2024-04-08T14:57:47+00:00,Have there been cheaper dismissals in a single innings this year?,3
2024-04-08T14:57:50+00:00,"**11.5** **Theekshana with a terrific response!** Good length ball around off and skidding to middle with the batter backing away to cut.

Ramandeep Singh b Theekshana 13 (12b 0x4 1x6) SR: 108.33",2
2024-04-08T14:57:50+00:00,Raja Rinku 50 loading,5
2024-04-08T14:57:51+00:00,GG wearing a G shock ?,2
2024-04-08T14:57:55+00:00,"Okay, Thala.
Please do some magic to send Russell back to pavilion cheaply.",5
2024-04-08T14:57:57+00:00,Wearing two different colours shoes is fashion now and I used to be embarrassed about it when one time I did the same mistake,6
2024-04-08T14:57:59+00:00,Home track bullying is not easy as it looks. We saw what happened in the WC finals.,11
2024-04-08T14:58:00+00:00,This is a rank turner.,2
2024-04-08T14:58:00+00:00,Now the real thrashing starts lol,3
2024-04-08T14:58:01+00:00,Now this is OG KKR...,2
2024-04-08T14:58:02+00:00,"Ramandeep couldn’t control his adrenaline…
Smh",3
2024-04-08T14:58:02+00:00,That's it. KKR lost the match.,1
2024-04-08T14:58:04+00:00,why tf everyone giveaway their wicket after a six this season?,5
2024-04-08T14:58:05+00:00,That’s 12 balls Rinku could have played to get set smh,1
2024-04-08T14:58:05+00:00,"Praying to get a employer who treat me like csk management treats Santner, no work,good pay,job security, I need all that 🙏",6
2024-04-08T14:58:06+00:00,Bruh we shouldn't be taking wickets now,2
2024-04-08T14:58:07+00:00,Sometimes Shreyas plays like he's a master of the game and other times he works hard to make those innings look like proper flukes. ,2
2024-04-08T14:58:08+00:00,Shreyas needs to play  captain's innings today,2
2024-04-08T14:58:08+00:00,Russel is definitely struggling today,1
2024-04-08T14:58:08+00:00,get to some respectable score at least kkr,1
2024-04-08T14:58:09+00:00,i wanted that from jadeja,2
2024-04-08T14:58:09+00:00,Time for the bros of destruction to fuck csk in the ass,0
2024-04-08T14:58:09+00:00,"why is people in every dream 11 ad shitting on rr?

wtf pz. your team is garbage",5
2024-04-08T14:58:09+00:00,Haha......spinchoke baby....tho I'm quacking in fear as Russel and Rinku will arrive,3
2024-04-08T14:58:10+00:00,If Rinku bails out kkr today he is absolutely locked for the t20wc spot,8
2024-04-08T14:58:10+00:00,Nice,1
2024-04-08T14:58:12+00:00,Iyerlapse?,2
2024-04-08T14:58:13+00:00,Good. Gtfo ramandeep.,1
2024-04-08T14:58:14+00:00,Now its Kingku time.,1
2024-04-08T14:58:14+00:00,Kkr cooked thoroughly by spin,1
2024-04-08T14:58:17+00:00,not ready for rinku and russell,3
2024-04-08T14:58:19+00:00,"Actually, KKR's actual batting starts now.",3
2024-04-08T14:58:19+00:00,These 2 clowns made Theekshana look like peak Shane Warne,5
2024-04-08T14:58:21+00:00,DIDN’T 👏 HAVE 👏 A 👏 CLUE 👏,2
2024-04-08T14:58:21+00:00,"Great 
Now it's iyer turn to help kkr",2
2024-04-08T14:58:24+00:00,Give the points to CSK now...,1
2024-04-08T14:58:24+00:00,Young Muralitharan eshque,2
2024-04-08T14:58:24+00:00,Pretty sure india would have won the WC 23 final on this wicket,7
2024-04-08T14:58:25+00:00,Oh no he's here,5
2024-04-08T14:58:26+00:00,"Ab wo ayega.

T- now he will come.",5
2024-04-08T14:58:26+00:00,Gauti with his butt clenched,7
2024-04-08T14:58:28+00:00,Let's go![img](emote|t5_2qhe0|30516)![img](emote|t5_2qhe0|30516)![img](emote|t5_2qhe0|30516),6
2024-04-08T14:58:31+00:00,![img](emote|t5_2qhe0|29261),1
2024-04-08T14:58:31+00:00,Keep Bowling Spin,2
2024-04-08T14:58:32+00:00,"My man had orgasm from the last shot, Got humbled in no time.",5
2024-04-08T14:58:37+00:00,"Rinku is slow against spin, he's not going to be doing anything until the death",1
2024-04-08T14:58:38+00:00,Is there a contract in KKR of making the match impossible for Rinku to come to bat?,7
2024-04-08T14:58:39+00:00,bUt ThEeKsHaNa Is ShIt,6
2024-04-08T14:58:42+00:00,Imma cum now,1
2024-04-08T14:58:42+00:00,Iyer bhai vs Babita ji today,5
2024-04-08T14:58:46+00:00,People calling CSK home track bully bruh theydotn win 5 titles just by home bullying...,7
2024-04-08T14:58:46+00:00,Should’ve kept these two in,2
2024-04-08T14:58:47+00:00,"if csk qualify, its joever",4
2024-04-08T14:58:48+00:00,Seems like he didn't want  play & play at the same time.,4
2024-04-08T14:58:50+00:00,I am cry,5
2024-04-08T14:58:53+00:00,"The funny thing is, pitch favoring spinners is wet dream of dube",7
2024-04-08T14:58:56+00:00,"Csk exposed kkr batting completely.its Narine,Rinku,Russel or nothing....",4
2024-04-08T14:58:56+00:00,Can't wait to see what OG Spin Trio of KKR does on this track,2
2024-04-08T14:58:58+00:00,Theeks gonna watch replay for nxt 24 hr its rare lord theeks getting wkts in ipl that too bowled out ,4
2024-04-08T14:59:00+00:00,What a defence. Rinku you beauty,7
2024-04-08T14:59:01+00:00,kolkata should just suck ass for a couple matches so that gambhir convinces himself to come back ,3
2024-04-08T14:59:01+00:00,OK.. Rinkj is here :((((,1
2024-04-08T14:59:02+00:00,Russell won't succeed on this slow pitch,1
2024-04-08T14:59:05+00:00,LORD RINKU ARRIVES ![img](emote|t5_2qhe0|30516),3
2024-04-08T14:59:05+00:00,CSK are the only team that truly make use of home advantage. No other team has as big a gap between home and away performances,5
2024-04-08T14:59:05+00:00,"My saviour is here, the Messiah.",7
2024-04-08T14:59:08+00:00,"Last time these both played together against us, they ended us.",2
2024-04-08T14:59:11+00:00,All set for Hero cam,3
2024-04-08T14:59:11+00:00,This is the classic kkr i know,3
2024-04-08T14:59:11+00:00,Get ready for kinku-verse,5
2024-04-08T14:59:13+00:00,🤴 and 🐐 is here,1
2024-04-08T14:59:14+00:00,Iyer....this is the first time I have hopes on u for handling the situations....doo some Kohlisque sfuff (watch CSK bowl the most obvious short ball eva),1
2024-04-08T14:59:18+00:00,RCB is such a good ad team,3
2024-04-08T14:59:19+00:00,Rinku entered and jio immediately sorts out it's shit. truly KINGKU,3
2024-04-08T14:59:24+00:00,"Spin test of rinku tonight. If he pass, all set for t20wc",7
2024-04-08T14:59:29+00:00,![img](emote|t5_2qhe0|30516),4
2024-04-08T14:59:30+00:00,Dickheads in the chat having attention span of an Instagram reel.......,0
2024-04-08T14:59:31+00:00,The Lisan Al Gaib of KKR,4
2024-04-08T14:59:32+00:00,"This is literally the 2021 script again, Rinku = Karthik, Russell is Russell and Starc is gonna pay homage to his captain",1
2024-04-08T14:59:34+00:00,adgasm,1
2024-04-08T14:59:37+00:00,Keep bowling spin lol,1
2024-04-08T14:59:37+00:00,As a csk fan I am scared. As a Indian I am pumped.,5
2024-04-08T14:59:37+00:00,bro is 50% jaw,5
2024-04-08T14:59:37+00:00,"Don’t worry kkr fans, our two lords will face kingku and russel soon 🙃",4
2024-04-08T14:59:38+00:00,Moeen should've been in for Mitchell just for the ultimate spin choke.,7
2024-04-08T14:59:40+00:00,"""Drier than a lake in summer"" 

""track peels off like makeup on a sweaty day""

good to know the poet is feeling it on comms",7
