Timestamp,Comment,Upvotes
2024-05-01T15:48:25+00:00,Sandeep and Nattu getting ready to tag the selectors on twitter,3
2024-05-01T15:48:25+00:00,should have been harshal,3
2024-05-01T15:48:25+00:00,7*,1
2024-05-01T15:48:26+00:00,hope arshdeep gets smashed out of the wc 11 in the next 5 balls,2
2024-05-01T15:48:26+00:00,Arshdeep gonna take a unadkat level beating,4
2024-05-01T15:48:27+00:00,Now watch Arshdeep make up for Chahar's over,3
2024-05-01T15:48:28+00:00,"Indian bros this is your pacer for the worldcup, you guys are screwed",8
2024-05-01T15:48:29+00:00,That is some outstanding bowling from a bowler that would be among India's primary bowlers a month later.,4
2024-05-01T15:48:29+00:00,Thus it begins…,1
2024-05-01T15:48:29+00:00,Both full tosses to Dhoni here. Need to get the Yorker right or just spam slow balls,3
2024-05-01T15:48:30+00:00,"LSG and Tilak really broke Arsh’s confidence last season, he used to be clinically lethal.",3
2024-05-01T15:48:30+00:00,Our death bowler for the wt20 getting owned by a 42 year old lmao,9
2024-05-01T15:48:30+00:00,7(6) thala 4 a reason,2
2024-05-01T15:48:33+00:00,wc clown,3
2024-05-01T15:48:35+00:00,Punjab plz win tonight,6
2024-05-01T15:48:35+00:00,Thanks for that nice low full toss.,1
2024-05-01T15:48:35+00:00,"Dear MS


Take more risks, it's okay if you get out. Don't take a single after a boundary. Don't rotate strike against spinners. Accelerate, if you have wickets in hand.

Dont play for your 100. You clearly always do, and it costs the team.

It's not all your fault, you have been the best player for CSK this season. But don't take the responsibiltiy of CSK on your shoulders. Because if you do, it just doesn't work. Especially in T20s, one guy can't win you games. You need to trust that the middle and lower order will do well. 3 quick fire 30s > 1 medium pace 100.

I don't think CSK will start winning games, if you take more risk and potentially get out. There are other big issues with the team and management. But atleast people will stop blaming you. Let the rest of the batters get a chance to do their job, if they fail, it's on them.

/s",3
2024-05-01T15:48:35+00:00,Bowling arshdeep is big dick move as well,3
2024-05-01T15:48:35+00:00,"crowd got what they wanted, result irrelevant now",3
2024-05-01T15:48:36+00:00,"This man still got it. While that’s an awful bowling, but he still managed to play well",5
2024-05-01T15:48:36+00:00,Every bowler loses at least 30 IQ points and becomes kinda regarded once MSD comes to bat. Clearly it's the aura of MSD and also the gulf in quality between IPL bowlers and world class bowlers.,5
2024-05-01T15:48:36+00:00,Why do bowlers forget about variations whilst bowling to thala?,5
2024-05-01T15:48:36+00:00,Fuck u agarkar,3
2024-05-01T15:48:37+00:00,Its still dhoni guys he’ll find a way,1
2024-05-01T15:48:37+00:00,This guy is trying too hard to nail those yorkers,2
2024-05-01T15:48:37+00:00,Thala distracting players with his hair...,5
2024-05-01T15:48:37+00:00,"Arshadeep is disappointed that Thala couldn’t smash last over, so he’s covering for him. Now he’s gonna concede His quota of boundaries plus last overs",5
2024-05-01T15:48:38+00:00,"even harshall could've been a better option than arshdeep cmon man, he was basically a running spinner",7
2024-05-01T15:48:38+00:00,Sam curran had 1 over left . Cowardly captaincy,4
2024-05-01T15:48:39+00:00,"Wow. Arshdeep’s 20th over economy is 20 😳
He is our death bowler with Bumrah for WT20???!!",6
2024-05-01T15:48:39+00:00,"The only criticism I have with PBKS is Arshdeep

KL always played Arshdeep based on his strengths, those are proper Yorkers

But after KL and Kumble, they made him a data analytics bowler

They are making him bowl according to the dimensions of the ground rather than backing his strengths 🥲",11
2024-05-01T15:48:40+00:00,Ohh yeah 💦,1
2024-05-01T15:48:41+00:00,"Ah yes, time for the regular ""full tosses and slot filth to Dhoni"" in the last over.",7
2024-05-01T15:48:42+00:00,This clown is our death bowler in WC 🤡🤡,8
2024-05-01T15:48:44+00:00,"you can change your squad no questions asked till 25th may iirc, or something like that. maybe 20th",6
2024-05-01T15:48:45+00:00,Arshdeep can immortalize Thala with another legend in this over,3
2024-05-01T15:48:47+00:00,Peak cinema,2
2024-05-01T15:48:47+00:00,Fkers always give slots balls to Thali wtf man,4
2024-05-01T15:48:48+00:00,Man it’s braindead to bowl Thala a yorker or lower full toss,1
2024-05-01T15:48:50+00:00,20 runs short,2
2024-05-01T15:48:51+00:00,This guy is our wC death bowler. Dude has some kind of world record to get screwed specially in 19th over. What bowling we are gonna have!,4
2024-05-01T15:48:51+00:00,Brar and chahar you guys did well regardless of what the results will be,3
2024-05-01T15:48:52+00:00,"Arshdeep is just afeaid pf Thala.
Fairs",2
2024-05-01T15:48:52+00:00,Seriously? He could’ve stopped that,3
2024-05-01T15:48:53+00:00,Thala shoukd use these vibrations from soumd to help bowl come on to bat easily,2
2024-05-01T15:48:53+00:00,"After Pandya, Brohit and Surya performance yesterday. Meet the death bowler Arshdeep today.",8
2024-05-01T15:48:54+00:00,century for thala in 43 balls,6
2024-05-01T15:48:54+00:00,ICT T20 WC squad players are performing s#it since it got announced,3
2024-05-01T15:48:55+00:00,"If he wants to bowl wide line, then he should change the angle and come around the wicket.",1
2024-05-01T15:48:57+00:00,hindi language was invented so that Aakash Chopra can do commentary in that....,7
2024-05-01T15:48:58+00:00,It is 44 in 3 for Arsh man. I don’t fancy our chances in world cup.,3
2024-05-01T15:48:59+00:00,"Full toss

Commentator: nOt A BaD deLiVeRy",2
2024-05-01T15:48:59+00:00,Curran could have easily dove for that lol,1
2024-05-01T15:48:59+00:00,If Arshdeep can't handle MS with due respect to MS he may as well just drop out of WC by himself,9
2024-05-01T15:49:04+00:00,Is india fucked or is india fucked?,6
2024-05-01T15:49:07+00:00,"With this much dew, csk is fucked. They also wasted a impact player.",8
2024-05-01T15:49:08+00:00,DEW is here bois. Punjab needs to bat sensibly here,6
2024-05-01T15:49:11+00:00,Arshdeep is another case of IPL star or IPL criteria,3
2024-05-01T15:49:11+00:00,"For money he’s scoring at 200+ SR in the death for CSK 

For country he didn’t even made himself available for selection 

That’s MSD For u 👏🏻

>!s/!<",4
2024-05-01T15:49:11+00:00,This is how our death bowling will look like in the WC,3
2024-05-01T15:49:12+00:00,Dew is crazy,3
2024-05-01T15:49:13+00:00,Arshdeep please bring back the no ball special you debuted vs NZ in early 2023,1
2024-05-01T15:49:13+00:00,Why waste so much time between each ball,1
2024-05-01T15:49:13+00:00,"That first ball should have been a No Ball   
FFS Umpiring",3
2024-05-01T15:49:13+00:00,Sorry thala but rooting her Arshdeep here. World cup sar pe hai,3
2024-05-01T15:49:14+00:00,"If it was a Friday night I’d call my friends and do a drinking game, shots every time thala is mentioned or shown on screen. Would be a fun night. 

We’d overdose though",2
2024-05-01T15:49:14+00:00,Wasn’t a wide,1
2024-05-01T15:49:15+00:00,If punjab would have chosen Sam as captain earlier they might have been in contention of playoffs,7
2024-05-01T15:49:17+00:00,Fuck,1
2024-05-01T15:49:17+00:00,I would’ve gone with Harshal on this pitch for last over because he bowls slow,2
2024-05-01T15:49:19+00:00,Arshdeep please bring back the no ball special you debuted vs NZ in early 2023,-1
2024-05-01T15:49:20+00:00,Arshdeep gonna concede 50+ runs cuz he's selected in the WC squad.,2
2024-05-01T15:49:23+00:00,Who is better between Siraj and Arshdeep?,1
2024-05-01T15:49:24+00:00,Noooo,1
2024-05-01T15:49:25+00:00,Arshdeep and Siraj ☠️ Bumrah needs to single handedly save our pace lineup,10
2024-05-01T15:49:25+00:00,"ARSHDEEP IS THE WORST SELECTION. OMG, THIS GUY BOWLS TRASH ",7
2024-05-01T15:49:27+00:00,"With siraj and arshdeep, India will never defend any score in wc",13
2024-05-01T15:49:29+00:00,How can I perform well? Don't you know I got selected for WT20 yesterday.,2
2024-05-01T15:49:31+00:00,Arshdeep and Siraj will fuck hardwork done by Bumrah in every match in t20 wc.,4
2024-05-01T15:49:31+00:00,Yep Dhoni is there to cash in on trash 20th over pace bowlers,2
2024-05-01T15:49:31+00:00,Arshdeep the new victim of WC curse.,2
2024-05-01T15:49:32+00:00,Thala is not thala. He is thaliban.,1
2024-05-01T15:49:34+00:00,Why doesn't anyone bowl bouncers to thala??,2
2024-05-01T15:49:35+00:00,Why the fulltosses against Thala every single time,6
2024-05-01T15:49:36+00:00,Can’t miss those!!!!,3
2024-05-01T15:49:36+00:00,7(7)* let's goo,3
2024-05-01T15:49:36+00:00,3 full tosses in a row,2
2024-05-01T15:49:37+00:00,I will become a celibate the day Arshdeep bowls 6 fucking legal deliveries in death overs.,2
2024-05-01T15:49:38+00:00,When I'm in a d***riding contest and my opponent is an Indian commentator - 😟,9
2024-05-01T15:49:38+00:00,Thala tax,3
2024-05-01T15:49:38+00:00,I dont know why but first time i want India to get knock off in group stage,6
2024-05-01T15:49:39+00:00,chepauk crowd blowing ‘em whistles thinking its thala’s D💀,7
2024-05-01T15:49:40+00:00,Wonder how Sakshi feels with all these thots saying Dhoni Dhoni,4
2024-05-01T15:49:40+00:00,Masterclass calculated 7(7),3
2024-05-01T15:49:41+00:00,It’s funny how dhoni looks younger with long hair,2
2024-05-01T15:49:41+00:00,arshdeep accommodates like 4 overs of bumrah in his one over,4
2024-05-01T15:49:41+00:00,"100 sr for thala 

Am I reading right 
Am I going blint",2
2024-05-01T15:49:42+00:00,Fan poll strikes again,5
2024-05-01T15:49:42+00:00,"The most op ball of this season, Full toss strikes again.",10
2024-05-01T15:49:43+00:00,7(7) TFAR,7
2024-05-01T15:49:45+00:00,Where did Arshdeep loose all his pinpoint yorkers,7
2024-05-01T15:49:47+00:00,Rumor has it that CSK changes the batting order so much because all batters wanna have a first class ticket to watch Dhoni bat in the 19th.,7
2024-05-01T15:49:47+00:00,Thala 7(7),2
2024-05-01T15:49:50+00:00,"great start by arshdeep two full tosses, our wc dream looks like a dream",3
2024-05-01T15:49:50+00:00,"Thala isn't average 

So Ne Average Score For Thala this Season",1
2024-05-01T15:49:51+00:00,"Filth ball hat-trick. Ffs, you can't hit yorkers anymore.  Revert to regular line length.",1
2024-05-01T15:49:52+00:00,What is this bowling ![img](emote|t5_2qhe0|8774),0
2024-05-01T15:49:53+00:00,Arshdeep bowling fast fulltosses for thala,1
2024-05-01T15:49:54+00:00,Bruh that stare from thala to the ump. I would've pissed my pants,3
2024-05-01T15:49:54+00:00,Wait wtf he's wearing a keeping helmet,3
2024-05-01T15:49:54+00:00,buddy here throwing lollies at thala at death over,2
2024-05-01T15:49:55+00:00,Ban IPL poll,3
2024-05-01T15:49:55+00:00,That might just be the greatest bowl ever bowled. Thala couldn't touch that.,3
2024-05-01T15:49:56+00:00,Thala’s stare couldn’t challenge the non-wide ball,7
2024-05-01T15:49:56+00:00,Ok so script is full toss. Got it.,2
2024-05-01T15:49:57+00:00,7(7),5
2024-05-01T15:50:00+00:00,Bowl at stumps you cunt,4
2024-05-01T15:50:02+00:00,"That was an absolute dolly. 

Apart from bowling at 14rpo, what are Arshdeep's skills on a pitch without swing?",4
2024-05-01T15:50:02+00:00,Harshal is specialist batsman today?,3
2024-05-01T15:50:04+00:00,Umpire needs a change of pants after Thala stared at him,4
2024-05-01T15:50:04+00:00,Bro is asking to get hit with all those full tosses,2
2024-05-01T15:50:05+00:00,Full toss is the new yorker,1
2024-05-01T15:50:06+00:00,Dhoni looks pissed at Arshdeep. Stick to the script.,3
2024-05-01T15:50:06+00:00,Silence is deafening,3
2024-05-01T15:50:07+00:00,Pathetic by Dhoni so far today,-1
2024-05-01T15:50:07+00:00,"Bruhh he can't handle this ipl pressure, how tf he gonna bowl at world cup",7
2024-05-01T15:50:07+00:00,"7(7)   

TFAR",2
2024-05-01T15:50:08+00:00,Absolute filth,5
2024-05-01T15:50:08+00:00,What's bro bowling,7
2024-05-01T15:50:10+00:00,WC players continuing to be shit,5
2024-05-01T15:50:11+00:00,Longest over in history loading…,7
2024-05-01T15:50:11+00:00,New rule is that you can’t pitch the ball in the last over .,6
2024-05-01T15:50:12+00:00,Bowl yorker. Either its a rattle or a helicopterr,5
2024-05-01T15:50:13+00:00,wtf is he bowling,8
2024-05-01T15:50:14+00:00,"Aus,Eng will eat 100 siraj,arsh in WC",4
2024-05-01T15:50:14+00:00,"Man, how the hell is he selected for the WC squad. Happy that Thala is bashing him, but this is very mediocre bowling.",8
2024-05-01T15:50:15+00:00,7*(7),3
2024-05-01T15:50:15+00:00,18 Runs Extra,2
2024-05-01T15:50:16+00:00,"Arshdeep is worse than Siraj, holy shit",7
2024-05-01T15:50:18+00:00,Missed a fulltoss. #TFAR,6
2024-05-01T15:50:19+00:00,This should be a no ball as well,2
2024-05-01T15:50:20+00:00,nah wtf is this bowling paaji??,10
2024-05-01T15:50:20+00:00,Wtf has happened to Arsedeep,4
2024-05-01T15:50:21+00:00,Bro you can't hit yorkers let go ![img](emote|t5_2qhe0|8774),3
2024-05-01T15:50:21+00:00,wtf is that bowling bruh,8
2024-05-01T15:50:22+00:00,I feel like Arshdeep might clean up Dhoni here. Yorker at the stumps..after being cunted for 20,4
2024-05-01T15:50:23+00:00,Wtf is he bowling.,9
2024-05-01T15:50:23+00:00,"Yeah, Thala is just a last-over specialist.",2
2024-05-01T15:50:24+00:00,Arshdeep taking the pitch out of equation by throwing trash,5
2024-05-01T15:50:24+00:00,Are they not allowed to ball short balls to Dhoni ?,6
2024-05-01T15:50:25+00:00,no reviews lol,3
2024-05-01T15:50:25+00:00,"I can already see Bumrah creating pressure and Arshadeep and Siraj releasing it this WC.

We’re fucked",13
2024-05-01T15:50:25+00:00,4 in 4!! This man doesn't want the ball to hit the pitch,3
2024-05-01T15:50:26+00:00,"Whats going on with these fans, they weren't able to cheer up when their team was not scoring now suddenly thala comes lungis started shouting",1
2024-05-01T15:50:28+00:00,"Question to ppl who are good with cricket statistics — since Dhoni hasn't been dismissed even once this ipl, his average should be infinite, right? Even mathematically speaking you're dividing by 0. Then why do they write average as 0.00 on sites like cricinfo",4
2024-05-01T15:50:29+00:00,Get to 170 somehow please,5
2024-05-01T15:50:29+00:00,Full toss city,3
2024-05-01T15:50:29+00:00,Can we all agree umpires have been absolute terrible this match?,-1
2024-05-01T15:50:30+00:00,Fucking hell is arshdeep scared shitless,2
2024-05-01T15:50:31+00:00,"Can boom bowl three Yorkers to siraj, ashdeep and dick...

Get rinku, nattu in",2
2024-05-01T15:50:32+00:00,Arshdeep you asscunt,1
2024-05-01T15:50:33+00:00,Bro is flirting with a potential no ball call,2
2024-05-01T15:50:33+00:00,"So going by trend of selected players not performing, rr losing to srh tomorrow. 
Rr has 4 selected players nd srh has none",3
2024-05-01T15:50:33+00:00,Bruv....bowl bouncer or slower ones... Wtf is that,2
2024-05-01T15:50:33+00:00,Arsh is shit scared,1
2024-05-01T15:50:34+00:00,oh fuck offfffff,1
2024-05-01T15:50:35+00:00,Please replace Arsh with Nattu. Far better leftie pacer.,3
2024-05-01T15:50:35+00:00,We ain't making playoffs in the world cup,8
2024-05-01T15:50:36+00:00,Dafuq is he doing??,6
2024-05-01T15:50:36+00:00,"capable fine school fact grandiose existence tan resolute employ nutty

 *This post was mass deleted and anonymized with [Redact](https://redact.dev)*",9
2024-05-01T15:50:37+00:00,Fuuuuck you Agarkar,5
2024-05-01T15:50:39+00:00,Trash bowling,5
2024-05-01T15:50:40+00:00,Bowlers are afraid of Thala,3
2024-05-01T15:50:40+00:00,"Thank you for the 18 extras , CSK really needed that",3
2024-05-01T15:50:40+00:00,Classic Thala innings — 2 off 5,2
2024-05-01T15:50:41+00:00,"Arshdeep boi. Stop bowling wide beamers. 
Fck our WC bowling",3
2024-05-01T15:50:41+00:00,What the F is this bowling?!,3
2024-05-01T15:50:42+00:00,This is gonna be our death bowler in the wc?,5
2024-05-01T15:50:43+00:00,PBKS doesn’t have review lefts either to take a DRS for that,1
2024-05-01T15:50:45+00:00,"arshdeep has lost the plot, whatever happened to line and length lol. atleast wide yorkers.",1
2024-05-01T15:50:45+00:00,Arshadeep has fixed his income.,1
2024-05-01T15:50:45+00:00,Just for god sake bring santner today,1
2024-05-01T15:50:46+00:00,Arshdeep itni kyu fat rhi?,2
2024-05-01T15:50:46+00:00,Arshdeep directly bowling to the Keeper,2
2024-05-01T15:50:47+00:00,"OMG, this arshdeep will be our death bowler 😶",3
2024-05-01T15:50:47+00:00,Longest T20 in history of ODIs,5
2024-05-01T15:50:47+00:00,"Seriously, Arshdeep is one of the worst bowlers in IPL. Don’t know what selectors see in him",2
2024-05-01T15:50:48+00:00,At this rate mf's gonna bowl a no ball,1
2024-05-01T15:50:48+00:00,Why TF is arshdeep in our T20 squad,3
2024-05-01T15:50:48+00:00,7 for 7 TFAR,2
2024-05-01T15:50:48+00:00,Wtf is Arshdeep doing man... Only full tosses?,5
2024-05-01T15:50:49+00:00,"Scenes if Thala takes us over the line today

Vintage Vintage Vintage!",0
2024-05-01T15:50:49+00:00,LOL deliver it to the pitch aside then,1
2024-05-01T15:50:49+00:00,Has anyone tried bouncers to dhoni in death this ipl,4
2024-05-01T15:50:50+00:00,Is Arshdeep really scared of Thala?,1
2024-05-01T15:50:50+00:00,"Tuned in just now

How has Arshdeep managed to go 1/45 in a 155 game ?",4
2024-05-01T15:50:51+00:00,18 extras is going to be the differentiator,1
2024-05-01T15:50:52+00:00,Our lead WC pacer is scared of a 43 year old strawberry farmer. The cup is truly ours this year.,1
2024-05-01T15:50:52+00:00,Wasn’t the first wide a no ball,1
2024-05-01T15:50:53+00:00,Aye that's not wide thala was outside off,2
2024-05-01T15:50:55+00:00,"Veere kille te ball pa

T: bro, bowl on stumps",4
2024-05-01T15:50:56+00:00,Yeah we're fucked in the world cup,5
2024-05-01T15:50:56+00:00,We aren’t going to have a good time in June are we,5
2024-05-01T15:50:57+00:00,pissing his pant singh,0
2024-05-01T15:50:57+00:00,Bruhh we are so fucked for the WC ,2
2024-05-01T15:50:58+00:00,Arsh is bowling like he's in his fuckinn prime... Bowl at stumps.... Idiot,3
2024-05-01T15:50:58+00:00,Why does Arshdeep always bowl wide yorkers in the last over when he is far better at bowling them right at the stumps.  Every time he tries the wide yorker he goes for loads of runs.,2
2024-05-01T15:50:59+00:00,Just throw it straight to the keeper ffs,1
2024-05-01T15:51:00+00:00,7(7) thala for a reason ,2
2024-05-01T15:51:01+00:00,Very marginal wide calls to be fair,3
2024-05-01T15:51:03+00:00,"it should be a no ball, its pitching outside the pitch lol",1
2024-05-01T15:51:04+00:00,"Stop bowling full toss lmao, it's asking to be hit",4
2024-05-01T15:51:05+00:00,I didn’t know Jitesh was good looking,2
2024-05-01T15:51:06+00:00,I don't understand one thing like how the ballers automatically start to ball bad balls to dhoni. Lol has happened so many times....,3
2024-05-01T15:51:07+00:00,"Fixing used to be discrete 

3 continuous full toss from a national team player",3
2024-05-01T15:51:07+00:00,Dhoni scores runs without being able to hit that ball as well.,3
2024-05-01T15:51:07+00:00,Lmaooo he denied the single,6
2024-05-01T15:51:07+00:00,Shouldn't it be a no ball of the ball is outside the pitch on the grass?,3
2024-05-01T15:51:09+00:00,Thala doesn't run,2
2024-05-01T15:51:10+00:00,WTF is he bowling ? Tell him there is a pitch where the ball can be pitched. No pressure !,3
2024-05-01T15:51:10+00:00,Thala is 7(7) stop the counttt,4
2024-05-01T15:51:11+00:00,Arshdeep letting Dhoni play more balls,1
2024-05-01T15:51:11+00:00,bruh arshdeep either shines or shits under pressure,3
2024-05-01T15:51:12+00:00,Dhoni 7(7) and the run rate was 7.97.  So close,2
2024-05-01T15:51:12+00:00,Wicket incoming of dhoni by arshdeep ,1
2024-05-01T15:51:13+00:00,"Man, what is this bowler. He is Gill of bowling, most of the time shit, one time clutch.",0
2024-05-01T15:51:14+00:00,Nt csk today guys,2
2024-05-01T15:51:14+00:00,Arshdeep thinkin he playing baseball,3
2024-05-01T15:51:14+00:00,No run?? mmm,13
2024-05-01T15:51:17+00:00,ffs pitch the ball inside the crease,3
2024-05-01T15:51:18+00:00,Are we sure Bumrah is Indian?,12
2024-05-01T15:51:19+00:00,Why is arshdeep bowling like a Pakistani left arm bowler.,5
2024-05-01T15:51:21+00:00,Seriously? Not running?,8
2024-05-01T15:51:21+00:00,Lol wtf Thala,7
2024-05-01T15:51:23+00:00,This dumb motherfucker and his wides,1
2024-05-01T15:51:23+00:00,bro is yet to bounce the ball this over lmao,7
2024-05-01T15:51:23+00:00,Thala for a Reason,5
2024-05-01T15:51:23+00:00,There's some weird no ball rule if it pitches outside the pitch or something?,3
2024-05-01T15:51:23+00:00,lol,2
2024-05-01T15:51:24+00:00,They wasted Mitchell at 8,9
2024-05-01T15:51:25+00:00,I just saw his stats. 45 runs on this wicket? India is royally fucked. We are beyond fucked.,4
2024-05-01T15:51:25+00:00,nahh this is funny af,5
2024-05-01T15:51:26+00:00,Wtf happened there 😭😭,6
2024-05-01T15:51:26+00:00,Arshdeep will be bowling soon in the WC. 😍,4
2024-05-01T15:51:26+00:00,Pathetic from Dhoni but no one cares,5
2024-05-01T15:51:26+00:00,No run?💀,6
2024-05-01T15:51:27+00:00,5 in 5. Decent ball but I'm still counting it as a full toss,2
2024-05-01T15:51:27+00:00,Lmao😭😭😭😭😭😭,4
2024-05-01T15:51:27+00:00,That is stupid from Dhenier.,10
2024-05-01T15:51:27+00:00,What are you doing dhoni,4
2024-05-01T15:51:28+00:00,"Wides in the final overs should be worth 2 or 3 runs, bowlers are abusing it",7
2024-05-01T15:51:28+00:00,Good luck defending 10 runs in last over with this guy,9
2024-05-01T15:51:28+00:00,MS you are 7(7) why wouldn't you run?,11
2024-05-01T15:51:28+00:00,Turned down the single?,9
2024-05-01T15:51:29+00:00,7(7) TFAR,8
2024-05-01T15:51:30+00:00,Mitchell can’t bat,2
2024-05-01T15:51:30+00:00,Mitchell Disrespected,33
2024-05-01T15:51:30+00:00,No single lolll,1
2024-05-01T15:51:30+00:00,Wtf so cocky,7
2024-05-01T15:51:31+00:00,"Holy shit Dhoni 7(7) 

I'm bussing 🥵🥵🥵",4
2024-05-01T15:51:31+00:00,Dheined the single lmaooo,7
2024-05-01T15:51:31+00:00,wtf Dhoni,8
2024-05-01T15:51:32+00:00,What the actual fuck,2
2024-05-01T15:51:32+00:00,"Imagine Maxwell is batting and Arshdeep is bowling these full toses. And it's the WC semis/finals.

We are so as* f*cked.",11
2024-05-01T15:51:32+00:00,wtf 😭,1
2024-05-01T15:51:32+00:00,Why Daryl Mitchel is even playing today?,6
2024-05-01T15:51:32+00:00,Arshdeeps Instagram if he gets Thala out lol,2
2024-05-01T15:51:33+00:00,Ummm what?,1
2024-05-01T15:51:33+00:00,Didn’t run? THALA IS COOKING GUYS! 🔥,2
2024-05-01T15:51:33+00:00,"Lol, Thala, there is a batsman on the other end.",7
2024-05-01T15:51:33+00:00,"Mera L kare squad me select hone ke baad perform


T: fuck performances, I’m in the squad already",1
2024-05-01T15:51:33+00:00,Lmao,4
2024-05-01T15:51:33+00:00,7(8),1
2024-05-01T15:51:33+00:00,"one season. pfft. 

dhoni has made a career by going not out to increase his avg.",3
2024-05-01T15:51:34+00:00,Will Arshdeep be a good choice fir wc?,3
2024-05-01T15:51:34+00:00,Lmaooooooo,3
2024-05-01T15:51:35+00:00,"Mitchell literally ran 2 runs there, but Thala won't",9
2024-05-01T15:51:35+00:00,Not even a single ? Wtf 🤡,4
2024-05-01T15:51:36+00:00,Aint no way bro denied strike when he couldve ran two,7
2024-05-01T15:51:36+00:00,"swim seed aback compare rustic coordinated person crown placid desert

 *This post was mass deleted and anonymized with [Redact](https://redact.dev)*",4
2024-05-01T15:51:36+00:00,Wow the confidence,6
2024-05-01T15:51:37+00:00,"Castle dhoni 
You fucker",1
2024-05-01T15:51:37+00:00,"Wait WHAT? 

WTF?",5
2024-05-01T15:51:37+00:00,Wow lol thala really backing himself to finish this off?,6
2024-05-01T15:51:38+00:00,Is he fucking dumb?,6
2024-05-01T15:51:38+00:00,he didnt run??? MS WTF ,11
2024-05-01T15:51:38+00:00,He literally ran two,17
2024-05-01T15:51:38+00:00,Hahaha.,7
2024-05-01T15:51:38+00:00,Mitchell is probably like wtf lol,26
2024-05-01T15:51:38+00:00,Can ya bounce it mate??,6
2024-05-01T15:51:40+00:00,"Arshdeep, he's a retired old man. Why scared so shitless?",6
2024-05-01T15:51:41+00:00,Mitchell getting disrespected,7
2024-05-01T15:51:41+00:00,The disrespect lmao,9
2024-05-01T15:51:41+00:00,Bro a retired player is denying single,3
2024-05-01T15:51:42+00:00,Shit cricket from Dhoni but no one’s gonna talk about it,5
2024-05-01T15:51:43+00:00,so Mitchell ends the match 1(1)\*,1
2024-05-01T15:51:43+00:00,"I genuinely hate these wide Yorker deliveries , it's so infuriating to watch . Trash ball.",5
2024-05-01T15:51:43+00:00,Thala forgot non striker's also a batter,8
2024-05-01T15:51:43+00:00,Mitchel shown the levels,3
2024-05-01T15:51:43+00:00,Scripted lol,2
2024-05-01T15:51:44+00:00,We should get a run for that I reckon,5
2024-05-01T15:51:44+00:00,hahahahaha,3
2024-05-01T15:51:44+00:00,Is Arshdeep trying full tosses in hopes of a catch out. Good effort but change it up bro,4
2024-05-01T15:51:44+00:00,What,2
2024-05-01T15:51:44+00:00,Mitchell given the tailender treatment by a retired strawberry farmer. Gotta see it to believe it.,21
2024-05-01T15:51:45+00:00,"Arshdeep is a Punjabi

Punjabis aren't scared of anyone, someone remind him that",1
2024-05-01T15:51:46+00:00,Pakistan will humilate india in WC though result will have no impact,5
2024-05-01T15:51:47+00:00,Bro what is this cringe,11
2024-05-01T15:51:47+00:00,It would be funny as hell if he gets out on this ball ,11
2024-05-01T15:51:48+00:00,No run batting first? Stfu,3
2024-05-01T15:51:48+00:00,Are you kidding me?,10
2024-05-01T15:51:49+00:00,Yo thala wtf,7
2024-05-01T15:51:49+00:00,Big dick move from thala,4
2024-05-01T15:51:50+00:00,You can do better than this Arsh,2
2024-05-01T15:51:51+00:00,Lmaoooooo 🤣🤣,5
2024-05-01T15:51:51+00:00,"CSK ❌

MS Dhoni fan club✅",11
2024-05-01T15:51:51+00:00,They’ve come with some plan of not getting into Dhoni’s arc. It’s only about how much is he able to successfully execute it.,5
