Timestamp,Comment,Upvotes
2024-05-01T13:12:14+00:00,![img](emote|t5_2qhe0|8781),1
2024-05-01T13:14:36+00:00,Win the toss please,4
2024-05-01T13:17:38+00:00,"""Dhoni  told 'You can't control the toss but you have to win it so practice it' since then we were practicing coin tosses in the dug-out.""  


\~ Ruturaj Gaikwad",9
2024-05-01T13:22:21+00:00,Pathirana still allowed to bowl?,-10
2024-05-01T13:23:29+00:00,We are on a losing streak against PBKS.,6
2024-05-01T13:23:36+00:00,Ruturaj Anti Finch Captain,3
2024-05-01T13:24:19+00:00,Toss play important role in this match,6
2024-05-01T13:25:45+00:00,Pitch report - Expressway given.,3
2024-05-01T13:25:46+00:00,Fizz Pathirana both have chance to hold Purple cap Tonight,4
2024-05-01T13:25:47+00:00,livi and da 1 fit?,5
2024-05-01T13:26:12+00:00,"So which out of form player are we bringing back to form today?

Does Rabada fancy some wickets?",4
2024-05-01T13:27:32+00:00,Waiting for AshSha Duo to bat.,5
2024-05-01T13:28:11+00:00,Ipl do not play attention to actions no more narine has recently started chucking again.also how tf pathirana action is legal?,-4
2024-05-01T13:28:57+00:00,[deleted],2
2024-05-01T13:29:21+00:00,I tried tossing a coin 10 times. I won 7 times. I'm now expecting a call from CSK and fast.,6
2024-05-01T13:29:43+00:00,"David Warner in the run chase of more than 180 in the IPL since 2009.

1123 in 28 innings at an average of 38.72 and a strike rate of 151.1",3
2024-05-01T13:29:59+00:00,DaOne returning with a vengeance.,1
2024-05-01T13:30:06+00:00,Rutu better win the toss today.,6
2024-05-01T13:30:53+00:00,Its hard its sticky......,3
2024-05-01T13:30:54+00:00,Still no Dhawan?,3
2024-05-01T13:31:08+00:00,Goddamn it rutu.,25
2024-05-01T13:31:09+00:00,Rutu lmao,4
2024-05-01T13:31:22+00:00,This match will be exciting. We could still be possibly in the race if we win but we play CSK back to back so might end up giving 4 points too,6
2024-05-01T13:31:24+00:00,Rutu lost the toss again 💀,10
2024-05-01T13:31:24+00:00,He Mfing lost again what's the possibility,6
2024-05-01T13:31:25+00:00,He lost again lmao,5
2024-05-01T13:31:29+00:00,Da 1 ain't even wanna play no more,1
2024-05-01T13:31:33+00:00,Fuck you. Fuck you toss. Fuck you.,12
2024-05-01T13:31:38+00:00,This is starting to get funny,6
2024-05-01T13:31:45+00:00,Match Referee placing the toss on the ground 😭😭,7
2024-05-01T13:31:56+00:00,How does he keep losing it😭,5
2024-05-01T13:32:01+00:00,Come on Punjab![img](emote|t5_2qhe0|28120),2
2024-05-01T13:32:02+00:00,When I'm in toss losing competition and my opponent is Ruturaj and Virat Kohli,38
2024-05-01T13:32:14+00:00,Yea it’s officially confirmed now. Curran is new captain and Shikhar is a tactical niggle injury 🤣,8
2024-05-01T13:32:17+00:00,Getting Ravi on toss is always a blessing.,2
2024-05-01T13:32:21+00:00,I am supporting Punjab today.,3
2024-05-01T13:32:23+00:00,Goddamn! What does this man needs to do to win toss?,3
2024-05-01T13:32:26+00:00,Sam curran has the alien ahhh head,2
2024-05-01T13:32:28+00:00,Nvm win the match now,3
2024-05-01T13:32:35+00:00,Btw sam has won the 6th consecutive toss,4
2024-05-01T13:32:41+00:00,"Raza has left the team, so he won't play spoilsport today.",4
2024-05-01T13:32:41+00:00,"Thanks Rutu , just won a 100$ toss bet against you.",23
2024-05-01T13:32:48+00:00,Lmao rutu 💀,6
2024-05-01T13:32:57+00:00,I’m going to lose the toss-Rutu![img](emote|t5_2qhe0|8783),6
2024-05-01T13:33:05+00:00,and I thought Koach has worse toss luck,2
2024-05-01T13:33:05+00:00,The toss stats were staright up wrong lol,3
2024-05-01T13:33:09+00:00,Hehehe red soil pitch,4
2024-05-01T13:33:15+00:00,No Pathi and Pande damn,2
2024-05-01T13:33:16+00:00," What does Whistle Podu mean?

I mean I get what’s a whistle but what’s Podu?",2
2024-05-01T13:33:18+00:00,Still no news of Dhawan. Now I just feel they’re gonna keep with this combination even if he comes back.,2
2024-05-01T13:33:21+00:00,"In a bit of surprise for me, Punjab are 4-0 up against CSK in their last 4 games, and 2 of them were quite the mauling. CSK has also won the IPL in the two times where they were mauled.",5
2024-05-01T13:33:27+00:00,I always root for the team playing against CSK at Chepauk.. they really need the extra support at that venue,3
2024-05-01T13:33:29+00:00,No Pathirana and Tushar wtf 💀,11
2024-05-01T13:33:33+00:00,"""Winning toss is overrated""

- Rutu",15
2024-05-01T13:33:36+00:00,Must win back to back against CSK to stay in the chase. We play again on Sunday 😂😂😂,5
2024-05-01T13:33:40+00:00,"No pathirana, we are so fucked.",4
2024-05-01T13:33:53+00:00,Gleeson woah,3
2024-05-01T13:33:55+00:00,"gg Punjab 

No Pathirana and Deshpande",5
2024-05-01T13:34:02+00:00,Gleeson makes debut. Pathirana injured.,2
2024-05-01T13:34:04+00:00,Ayo no pathirana 😭,5
2024-05-01T13:34:08+00:00,No pathirana and Tushar McGrath 😭,10
2024-05-01T13:34:17+00:00,"Man we are sooo done for

No Pathirana",4
2024-05-01T13:34:17+00:00,"Rahane keeps his place, what even... Another early wicket gone",8
2024-05-01T13:34:18+00:00,Lol CSK is done without Pathirana,5
2024-05-01T13:34:20+00:00,Richard Gleeson makes his IPL debut,3
2024-05-01T13:34:23+00:00,Shastri ji is looking a little weird,5
2024-05-01T13:34:28+00:00,No pathirana? Richard gleeson carry us mams,3
2024-05-01T13:34:29+00:00,9 toss lost of 10.,14
2024-05-01T13:34:35+00:00,No Pathirana and GOATPande. We are fucked. GG PBKS.,12
2024-05-01T13:34:40+00:00,Reminds me of the time Faf (I think?) was losing so many tosses in Int'l cricket he even made a mascot or ground-boy make the call in his stead,6
2024-05-01T13:34:43+00:00,pathiranaless csk is rcb,5
2024-05-01T13:34:47+00:00,Chahar leading the pack be like![img](emote|t5_2qhe0|8781),13
2024-05-01T13:34:48+00:00,No pathirana and rahane's still in the squad 💀,7
2024-05-01T13:35:01+00:00,My boy Rutu cannot win a toss to save his life.,10
2024-05-01T13:35:09+00:00,Pathirana-less CSK bowling is a serious advantage for PBKS,11
2024-05-01T13:35:10+00:00,"Ritu is not even in WC squad, why tf script writers wants him to bat that much",6
2024-05-01T13:35:11+00:00,If pbks wins i will change my gender,6
2024-05-01T13:35:35+00:00,so how slim are csk's chances to qualify,2
2024-05-01T13:35:35+00:00,Without pathirana? If fizz fails today csk is done for,8
2024-05-01T13:35:43+00:00,cong to pbks for winning this match.,4
2024-05-01T13:35:46+00:00,"Whatever Pathirana Throws Is Not Good For Body

Said It over & Over again

Time to Change his Action",-3
2024-05-01T13:35:50+00:00,Mfs can score 300 and still lose vs this PBKS super team,6
2024-05-01T13:35:52+00:00,Koach vs Rutu at the toss would cause the universe to collapse on itself,71
2024-05-01T13:35:53+00:00,Rutu saving his toss luck for playoffs? Need to make it first man,14
2024-05-01T13:35:54+00:00,No Liam 🥹,1
2024-05-01T13:36:00+00:00,PBKS in familiar zone of requiring to win 5 out of 5. Like everytime they're well on their way to end up somewhere between 5th and 7th position.,2
2024-05-01T13:36:16+00:00,Zinta who? Da 1 is our professional cheerleader,5
2024-05-01T13:36:18+00:00,Fckk no Pathirana and Deshpande. We're so fcking screwed.,28
2024-05-01T13:36:26+00:00,CSK has 70% chance of winning this match.,3
2024-05-01T13:36:33+00:00,Sam in Chennai is so wholesome even in the opp team. Can never forget his contribution.,8
2024-05-01T13:36:39+00:00,No rachin still,2
2024-05-01T13:36:49+00:00,CSK just needs to play till last over and they will win,4
2024-05-01T13:37:10+00:00,"When will we win the toss ffs? Also, I pray on my life that we don't bring in Mukesh Starc as impact player. 😭",7
2024-05-01T13:37:22+00:00,">I always root for the team playing against CSK at Chepauk.. they really need the extra support at that venue

""**2023-** PBKS won by 4 wickets

**2022-** PBKS won by 54 runs

**2022-** PBKS won by 11 runs

**2021-** CSK won by 6 wickets

**2021-** PBKS won by 6 wickets""

# CSK vs PBKS Head-To-Head Record At MA Chidambaram Stadium

**Matches Played:** 7  
**Chennai Super Kings Won:** 4  
**Punjab Kings Won:** 3

# CSK vs PBKS Head-To-Head Record In IPL

**Matches Played:** 28  
**Chennai Super Kings Won:** 15  
**Punjab Kings Won:** 13",5
2024-05-01T13:37:30+00:00,We're cooked 🙃,6
2024-05-01T13:37:31+00:00,"At least Pathirana got a niggle when we still have Mustafizur in the squad. If he got the niggle after Fizz left, we would've been a foreign pacer down.",6
2024-05-01T13:37:31+00:00,"No Pathirana. 

Congrats PBKS",7
2024-05-01T13:37:39+00:00,Getting a 36 Year old Gleeson is the most CSK Thing ever! Love it 😂,31
2024-05-01T13:37:47+00:00,WHY IS PATHIRANA AND DESHPANDE NOT PLAYING,8
2024-05-01T13:38:01+00:00,We’re not defending shit without pathirana,12
2024-05-01T13:38:08+00:00,"cmon punjab, don't do an SRH today",3
2024-05-01T13:38:23+00:00,Csk can still win without pathirana if it is  a rank turner,3
2024-05-01T13:38:36+00:00,"So we don't have Pathirana and Deshpande? Real test for old boi Deepak here, he's the only person who can get the PP breakthrough now",6
2024-05-01T13:38:56+00:00,We need to get hazlewood as the overseas replacement,4
2024-05-01T13:39:14+00:00,csk are cooked today,4
2024-05-01T13:39:23+00:00,pathirana not playing? why?,4
2024-05-01T13:39:32+00:00,any bengali here wanna do blackmagic on my behalf to get punjab to win?,-1
2024-05-01T13:39:48+00:00,"No Pathirana and deshpande

Lets go!!!",2
2024-05-01T13:39:57+00:00,If there is some spin in the pitch then CSK might bring in Prashant Solanki as an impact player,3
2024-05-01T13:40:15+00:00,Is jaiswal better than rutu for t20 wc squad? I dont think so,-8
2024-05-01T13:40:21+00:00,In today's episode we decided to get exposed what our bowling would like without Lord deshpande and Pathirana,35
2024-05-01T13:40:24+00:00,Well guys i looked up gleeson stats and he is quite the average. CSK are fucked without pathirana and deshpande if dew comes in. Rutu must use spin today at least. Another disappointing powerplay expected.,8
2024-05-01T13:41:20+00:00,"If the pitch aint a Day 5 doctored spin pitch, CSK gonna get cooked alive.",1
2024-05-01T13:41:24+00:00,**Pathirana bowling action is so legal that it keeps on  injuring him**,5
2024-05-01T13:41:28+00:00,Richard Gleeson is so average that I'm surprised they even found him lmao.,15
2024-05-01T13:42:06+00:00,Csk cooked,6
2024-05-01T13:42:16+00:00,"PBKS is bowling first and still going with 6 prominent bowling options, why?

Imo they should drop Chahar and Rossouw for good and include Livi and an Indian batsman from the next game.",2
2024-05-01T13:42:49+00:00,Lmao at Ruturaj's toss luck.,7
2024-05-01T13:42:55+00:00,"I bet my dog, Punjab winning this comfortably without Pathirana and Deshpande",6
2024-05-01T13:42:58+00:00,I'm sensing a humiliation tonight,3
2024-05-01T13:43:03+00:00,It's gonna be a thrilling chase or lose by a big margin. As usual for Punjab.,1
2024-05-01T13:43:17+00:00,"Chidambaram is fortress for a csk, if csk crosses 190 runs they almost win it",6
2024-05-01T13:43:30+00:00,Even the pitch can't save csk today,3
2024-05-01T13:43:41+00:00,In pbks we trust,-4
2024-05-01T13:43:44+00:00,Gleeson has an average of 24.3 in t20s which is surprisingly average because he plays in England,2
2024-05-01T13:43:59+00:00,"Knowing PBKS, they'll either chase this down with a few overs to spare, or suddenly be 89/6 again",16
2024-05-01T13:44:03+00:00,"Man our CSK fans have been saying Rutu hasn't been picked because of politics, PR. Thing is he was never in contention in the first place when it comes to this format.

Jaiswal gives you agressive batting, strikes at 163 in T20is while Rutu is more of a guy that plays long innings.",15
2024-05-01T13:44:12+00:00,"Mukesh Choudhary,Prashant Solanki or Simarjeet Singh come in as impact sub in the 2nd innings...Kinda hoping it is Solanki havent seem him a lot and can actually turn out to be a good Indian spinner for us",5
2024-05-01T13:44:15+00:00,Why is Pathirana not playing today,0
2024-05-01T13:44:38+00:00,How many tosses did he lose?,3
2024-05-01T13:44:53+00:00,"Death, taxes and Ruturaj losing the toss.",9
2024-05-01T13:45:10+00:00,Choosing to chase at Chennai is the wrong decision.,-3
2024-05-01T13:45:14+00:00,We can see brar bowling the 6th over,3
2024-05-01T13:45:15+00:00,Average age of CSKs playing 11 is 33 and the youngest player is the captain.,9
2024-05-01T13:45:30+00:00,"Tushar McGrath and Lasith Pathirana missing today. Hope they post a score worthy of defending by this lineup. With Baristow one innings per IPL already over, I doubt Punjab will be able to do anything in chase",6
2024-05-01T13:46:16+00:00,Why is cutie patootie pathi not playing 🥺👉👈,0
2024-05-01T13:46:21+00:00,All my homies wanna see Punjab winning this.,3
2024-05-01T13:46:56+00:00,"We are fucked today. No Pathirana or Despande means our bowling is too dependant on Muztafizur. And he is rather rendered ineffective by the dew.

It was so important we won the toss today.",14
2024-05-01T13:47:20+00:00,"Today we have the battle of the Lords.. Lord Shardul, Lord Chahar, Lord Mustafizur and our new Lord Gleeson",14
2024-05-01T13:47:36+00:00,Is Pathirana rested or injured?,1
2024-05-01T13:47:36+00:00,Let's go ..no pathirana,-6
2024-05-01T13:47:57+00:00,172 loading,2
2024-05-01T13:47:59+00:00,sick of dhoni propaganda,6
2024-05-01T13:48:06+00:00,Come on Punjab,2
2024-05-01T13:48:24+00:00,[deleted],7
2024-05-01T13:48:36+00:00,Today I am seeing the importance of Lord Despande,11
2024-05-01T13:48:55+00:00,Mukesh is CSK's best bowler. He was among the top 5 bowlers in a recent IPL. Sad that they never play him,0
2024-05-01T13:49:23+00:00,"To whomsoever it may concern,

Pathirana's action is legal. Your team batters just don't know how to face him.

Regards",45
2024-05-01T13:49:44+00:00,"considering thala will still hang by as a mentor or a coach at CSK after retirement, do you think this cocksucking business by the broadcasters is ever gonna end?",7
2024-05-01T13:49:53+00:00,Ashutosh Shashank Bairstow Rossouw Prabhsimran are gonna have a field day...240 needed atleast,10
2024-05-01T13:50:27+00:00,Rutu boi the fuck is with toss luck you even lost of Maharashtra day ...,11
2024-05-01T13:51:32+00:00,Thala on Infinity Average Mission,2
2024-05-01T13:51:40+00:00,No Parthirana Gg CSK...,3
2024-05-01T13:52:04+00:00,"Most tosses lost in a season by a CSK captain  
  
MS Dhoni -  12 (IPL 2012)  
MS Dhoni - 11 (IPL 2008)  
MS Dhoni - 10 (IPL 2013 & IPL 2021)  
Ruturaj Gaikwad - 9 (IPL 2024)\*",48
2024-05-01T13:52:12+00:00,this is literally khabib vs mcgregor on alcohol,2
2024-05-01T13:52:13+00:00,"Lord Thakur is back, o h g o d .... but you know what? I was meme-ing Deshpande before last game and he had a solid game so maybe, just maybe Shardul can overcome his piebowlingitis and help CSK to win",3
2024-05-01T13:52:23+00:00,Each year I think CSK will improve its bowling line and then each year they produce more Lords,7
2024-05-01T13:52:35+00:00,Bairstow is the key for Punjab here as he showed how he coped with Narine and Chakravarthy in the last match,3
2024-05-01T13:52:36+00:00,No McGrath. No party.,3
2024-05-01T13:53:03+00:00,[deleted],3
2024-05-01T13:53:21+00:00,"Damn, even with the Chennai Choke, Santner cant start ahead of Gleeson, poor guy",8
2024-05-01T13:53:22+00:00,I reckon the Poonjab win today,3
2024-05-01T13:53:28+00:00,Instead of going for toss they should directly ask the other captain what they want to do.,4
2024-05-01T13:53:30+00:00,Rutu with that Koach coin toss luck ,3
2024-05-01T13:53:41+00:00,"Unreal stuff from Ruturaj.

He has even surpassed Harman when it comes to bottling coin toss.",6
2024-05-01T13:53:53+00:00,Imagine telling someone after 2022 that CSK fans would be grieving because Deshpande got dropped,12
2024-05-01T13:54:07+00:00,Csk showing kindness to pbks by not playing lord Deshpande,7
2024-05-01T13:54:23+00:00,2  L makes a W,1
2024-05-01T13:54:25+00:00,"Ideal wc squad:




Rinku replaces rohit


Kl replaces dube",0
2024-05-01T13:54:42+00:00,"CSK which makes every match boring vs Punjab which makes every match interesting.
Let's see what happens today.",7
2024-05-01T13:54:43+00:00,bro got that rohit sharma wc final toss luck 😭😭,6
2024-05-01T13:54:45+00:00,"“_… but looking at my toss winning percentage, most of my team members were prepared to bat knowing | would loss the toss …_”

Blud gave up",30
2024-05-01T13:54:48+00:00,Scenes if this is a 167 plays 156 kind of game,1
2024-05-01T13:54:55+00:00,What exactly happened to dhawan ? Injured or just being kept out of playing 11 ?,1
2024-05-01T13:55:19+00:00,"Lion vs lion, kings vs kings letsgo",5
2024-05-01T13:55:26+00:00,Why is Pathirana not playing?,1
2024-05-01T13:55:53+00:00,Where’s Rizvi,1
2024-05-01T13:55:57+00:00,Why Shashank Jersey Looks Less Red Than Others?,3
2024-05-01T13:56:08+00:00,Would love to see rachin playing! :(,4
2024-05-01T13:56:11+00:00,we are ready to bottle T20 final after bottling rigged wc at home,11
2024-05-01T13:56:43+00:00,This mf is cooked in terms of toss.,10
2024-05-01T13:56:50+00:00,CSK need Moeen to pull a Narine and get a 100,5
2024-05-01T13:57:15+00:00,"Think Rachin is quite a match winner. Rahane as a T20 opener in 2024 is just bizarre 

Gaikwad’s impressive run has shielded CSKs rickety top order",5
2024-05-01T13:57:24+00:00,Pathirana out and still no chance for Santner,6
2024-05-01T13:57:28+00:00,Knowing PBKS literally own CSK .....,3
2024-05-01T13:57:29+00:00,CSK should send a superfan for Toss,5
2024-05-01T13:57:41+00:00,Who will be CSK’s impact player?,2
2024-05-01T13:57:42+00:00,"I see it every time but I laugh when the Bot says ""Please upvote for visibility, you cowards!""",10
2024-05-01T13:58:04+00:00,"Didn't think there would be someone with worse luck than Kohli at the toss, but rutu beats him by a mile",4
2024-05-01T13:58:12+00:00,Open with Moeen or don't play him!,8
2024-05-01T13:58:25+00:00,No Pathirana and Deshpande with Fizz having to bowl with heavy dew? This is already gg,16
2024-05-01T13:58:39+00:00,Rutu is the opposite of Two-face. Dude can't win tosses,13
2024-05-01T13:59:16+00:00,I have a feeling Rahane is gonna click today,6
2024-05-01T13:59:20+00:00,Bowling lineup so shit that fans have to cry for Deshpande,3
2024-05-01T13:59:25+00:00,"It's literally Kings vs Super Kings


So the Super Kings should win right? Right?",1
2024-05-01T13:59:29+00:00,"Man, they should prolly just start asking the opp cap directly about what he wants to do first.

Saves time for all of us lol",6
2024-05-01T13:59:46+00:00,You read it first here. No thala batting today and rahane gonna fuck.,3
2024-05-01T13:59:47+00:00,glessen will concede the most runs today,1
2024-05-01T13:59:54+00:00,"Daone, csk basher is not playing",2
2024-05-01T13:59:58+00:00,Are they gonna do something with Ali or is he once again not gonna bat or ball,3
2024-05-01T14:00:00+00:00,CSK is gonna explode in the powerplay today.,2
2024-05-01T14:00:10+00:00,Preparing my brain for another Rahane disasterclass and then 3 hour long rant as to how we will not win this year due to so many dead weights we carry.,7
2024-05-01T14:00:12+00:00,CSK will easily win this since they are super King. PBKS can only win if they add hyper to their name like PBHKS. /s,7
2024-05-01T14:00:34+00:00,"CSK have humbled SRH and KKR, the two 250+ bashers of this IPL

Time for 3rd? 

Let's see",5
2024-05-01T14:00:35+00:00,GaikGod to take away that orange cap from Koach,5
2024-05-01T14:00:36+00:00,Damn what a ball first up,4
2024-05-01T14:00:37+00:00,"Koach's successor in the eyes of BCCI: Gill, the prince. 


Actual guy: Ruthu 

Loss toss, classy shots, carrying the team as a captain.",50
2024-05-01T14:00:48+00:00," can't wait to watch rohit ""bottler"" sharma and yashasvi ""short ball"" jaiswal to open in the world cup",2
2024-05-01T14:00:55+00:00,Wasn't previous pbks vs csk match also in chennai?,3
2024-05-01T14:01:02+00:00,Punjab has to use Brar smarter today. Csk have 3 lefties in the middle order so if they use their usual tactics they just won’t use him.,4
2024-05-01T14:01:08+00:00,"Rabada if take wickets: rabada ne kiya kabada

Rabada if concedes run: rabada ka kiya kabada

Aakash and his commentary 🙏",14
2024-05-01T14:01:19+00:00,Why can't anyone ask how long Dhawan is out for,3
2024-05-01T14:01:21+00:00,Ahh the iconic duo of rahane and rutu opening,3
2024-05-01T14:01:28+00:00,Why don't we just open with Ali?,5
2024-05-01T14:01:29+00:00,"We spared CSK the horror by not playing RAZA. That 3 off 1 still haunts you guys 

It’s a separate matter he is on international duty 🤣",7
2024-05-01T14:01:30+00:00,this is bullying,2
2024-05-01T14:01:37+00:00,Send Moeen at 3 today pleaseeeeeee,5
2024-05-01T14:01:53+00:00,20th century Chepauk pitch is here,1
2024-05-01T14:02:19+00:00,We want a 99 from Gaikwad,11
2024-05-01T14:02:24+00:00,Come on Rabada![img](emote|t5_2qhe0|28120),0
2024-05-01T14:02:25+00:00,Damn those horns and whistles. CSK matches always have those,17
2024-05-01T14:02:47+00:00,Is Rabada in SA squad?,2
2024-05-01T14:02:51+00:00,Gleeson looks like Starc. Let's hope he doesn't bowl like him,8
2024-05-01T14:03:13+00:00,"Rabada has also been really avg this season. 

Sa bowling suddenly also looks pretty bad. 


Nortje,rabada, coetzee",4
2024-05-01T14:03:17+00:00,They should ban these whistles instead of water bottles.,13
2024-05-01T14:03:32+00:00,We’re the only team not maximizing the powerplay..,15
2024-05-01T14:03:33+00:00,"Rahane blud no one cares about your wicket. Swing and swing hard, swing for your life for all I care.",48
2024-05-01T14:03:40+00:00,[deleted],4
2024-05-01T14:03:53+00:00,Can JioCinema kill off the crowd noise? I won’t complain,5
2024-05-01T14:03:56+00:00,"Im so sad for Gaikwad, dude should've been in the wc squad",2
2024-05-01T14:04:01+00:00,Im sure we have scouted atleast one youngster who can take singles...Just what Rahane does nowadays,4
2024-05-01T14:04:17+00:00,Imagine paying 10000rs only to go and get tinnitus,7
2024-05-01T14:04:19+00:00,Is it me or that whistling is kinda annoying lol,1
2024-05-01T14:04:20+00:00,"Csk batting has been carried by gaikawad and dube, they will be exposed soon if not today",1
2024-05-01T14:04:21+00:00,"Maybe Punjab changed their name because they realised their team defenitely doesn not have 11 kings. 

So now it just a mystery how many kings are there. Maybe just 2.",12
2024-05-01T14:04:24+00:00,Never thought there’ll come a day where I’m terribly disappointed to not see Tushar in the playing XI,31
2024-05-01T14:04:27+00:00,"Holy cow, I cant listen to those whistles. Mad.",4
2024-05-01T14:04:31+00:00,Rahane opens and gave his wicket so that opposition thinks they are ahead in game.,6
2024-05-01T14:04:36+00:00,"So this is the last match for Mustafizur. Depending on how bad Pathirana and Deshpande's injuries are, there's a chance CSK play their next game without 3 of their most important fast bowlers.",4
2024-05-01T14:04:50+00:00,We are so bad in the powerplay...,5
2024-05-01T14:04:54+00:00,The amount of trust CSK has on Rahane after 2-3 failures in opening is commendable,11
2024-05-01T14:05:06+00:00,"You've got two left armers in Arshdeep and Sam Curran. 

Come on PBKS, Gaikwad should not survive the pp.",4
2024-05-01T14:05:28+00:00,[deleted],13
2024-05-01T14:05:35+00:00,is this the record for the most toss lost in ipl in a season?,7
2024-05-01T14:05:40+00:00,Is Rahane back in to his shell..? He was phenomenal last season!,7
2024-05-01T14:05:48+00:00,Today I'm here to drink the tears of CSK fans (copium) (Plz Sam 😭🙏🙏),7
2024-05-01T14:05:50+00:00,Worst crowd ever![img](emote|t5_2qhe0|8766),0
2024-05-01T14:05:50+00:00,Who tf buying tyres cuz of an ad 😭,7
2024-05-01T14:05:54+00:00,"Come on why Rahane, make Mo open",7
2024-05-01T14:06:00+00:00,[deleted],9
2024-05-01T14:06:03+00:00,Rahane suddenly lost all intent this season,14
2024-05-01T14:06:10+00:00,Rachin instead of Fizz would've better no?,0
2024-05-01T14:06:14+00:00,Ruturaj takes too long to accelerate that's why i prefer jaiswal over him,4
2024-05-01T14:06:24+00:00,"Hayden was right last match, Jinx needs to play with the freedom he had last year. 

He is already playing for CSK, there's little chance that another team will want to pick him in the next auction. He just need to trust his skills and timing. It was glorious to watch last season.",31
2024-05-01T14:06:52+00:00,[removed],6
2024-05-01T14:06:53+00:00,Arshdeep bullying Rutu![img](emote|t5_2qhe0|28120),-13
2024-05-01T14:06:54+00:00,All tuk tuk in orange cap smh,1
2024-05-01T14:07:11+00:00,aint no way Gaikwad lost the toss again what are the fuckin odds,13
2024-05-01T14:07:12+00:00,Jokes aside. Whats the predicted/winning score on this pitch,6
2024-05-01T14:07:29+00:00,gaikgod,5
2024-05-01T14:07:30+00:00,"Alternate universe lineup: 

Vahane 

Tuturaj 

Kitchell 

Lube 

Goeen 

Badeja 

Toni 

Jhardul 

Peepak 

Fleeson 

Dustifizur",11
2024-05-01T14:07:48+00:00,That shot sounded so good.,2
2024-05-01T14:07:58+00:00,[deleted],2
2024-05-01T14:07:58+00:00,C'mon Rahane do something.,2
2024-05-01T14:07:59+00:00,Rutu gonna show selectors big d energy dor rest of tournament now.,8
2024-05-01T14:07:59+00:00,CSK losing is good for LSG right?,1
2024-05-01T14:08:02+00:00,"Whenever Styris days ""Rupaaaaay on the go 4"", I'm glad the mute button exists",8
2024-05-01T14:08:10+00:00,"Is Livi injured? I know he’s not been great with the bat, but he’s still a better option than Roussouw, surely…",1
2024-05-01T14:08:31+00:00,The ball that went for 4 was so bad,1
2024-05-01T14:08:34+00:00,Bhatura supremacy![gif](emote|free_emotes_pack|heart_eyes),2
2024-05-01T14:08:39+00:00,I’ve got a feeling Daz is gonna go gun blazing today.,4
