Timestamp,Comment,Upvotes
2024-05-01T16:54:06+00:00,Lmao last-benchers vs first-benchers behaviour,2
2024-05-01T16:54:09+00:00,"Jaddu is the biggest liability. Can't bat, can't bowl, can't field also now.",7
2024-05-01T16:54:12+00:00,"Dhoni's cock exists:

Star sports: ""is for me?"" 🥹👉👈",24
2024-05-01T16:54:13+00:00,"Etihad CSK
Qatar Airways RCB",5
2024-05-01T16:54:19+00:00,They are giving hints to us that we don't keep any hopes of doing good at wc,12
2024-05-01T16:54:22+00:00,CSK will fckup their OK NRR with these low scoring games,7
2024-05-01T16:54:30+00:00,PLS BOWL DUBE,2
2024-05-01T16:54:31+00:00,Arshdeep is so fucking bad man. (Just finishing the first innings now.),6
2024-05-01T16:54:32+00:00,"Ipl should be named toss cup like 2021 WC . Win toss ,chase in dew,win the match .Really Unfair.",-4
2024-05-01T16:54:35+00:00,"Whistle gale mai atak gayi 

T. Whistle got stuck in the neck.",6
2024-05-01T16:54:37+00:00,PBKS playing for the 6th spot is the most Dangerous team in the World,3
2024-05-01T16:54:39+00:00,Funny how the camera pans in to Rutu when CSK gets hammered and Thala gets shown on camera when CSK wins,10
2024-05-01T16:54:40+00:00,Whistle Fudu,8
2024-05-01T16:54:43+00:00,"But daddy thala scored a six and a four, that's enough for CSK fans. Whistle todu!",6
2024-05-01T16:54:51+00:00,"Windies is okay but if the pitches in US turn out to be highways ( I still remember us losing that 245 game in Florida ), we are fucked big time with this bowling unit as well as the batting unit of ours",5
2024-05-01T16:54:51+00:00,rossouw taking run on alternate pitch,9
2024-05-01T16:54:52+00:00,Commentary hurts my ears with all the yapping going on,6
2024-05-01T16:54:54+00:00,CSK's middle order is dube and insallah,10
2024-05-01T16:55:04+00:00,Teams are allowed to make changes to their squads until May 25 I hope Jaddu Gets Replaced by Rinku,3
2024-05-01T16:55:16+00:00,I am Happy I don't have to see Deepak chahar once again,1
2024-05-01T16:55:20+00:00,"If you see Rutu too many times on screen, you know CSK are staring at defeat.",24
2024-05-01T16:55:25+00:00,"Pbks when playing for qualifications:ahh boring

Pbks when playing for the 6th spot: real shit 😡😡🤬",14
2024-05-01T16:55:29+00:00,come on someone take a hattrick make the game interesting,2
2024-05-01T16:55:30+00:00,"Great, so we brought Jonny Bairstow back into form.",4
2024-05-01T16:55:30+00:00,PBKS plays best when when it stops mattering. Clutch team,1
2024-05-01T16:55:33+00:00,Fun fact: Barstow has the 3rd highest yo yo test score,2
2024-05-01T16:55:38+00:00,This is turning out to be some seriously good knock from Johny boy,2
2024-05-01T16:55:43+00:00,Kingku died for Jadeja just saying,3
2024-05-01T16:55:44+00:00,Can we sneak in a red ball for jaddu,2
2024-05-01T16:55:45+00:00,Bairstow suddenly activated his srh mode in KKR game,3
2024-05-01T16:55:47+00:00,This Guy same with LSG.,1
2024-05-01T16:55:47+00:00,Did the broadcast finally mute all those whistles?,5
2024-05-01T16:55:51+00:00,[deleted],-2
2024-05-01T16:55:52+00:00,This “spin choke” is as real as India’s chance at winning the world cup.,5
2024-05-01T16:55:55+00:00,Bairsrow hitting boundaries against Jadeja for fun means the pitch is great for batting,2
2024-05-01T16:56:00+00:00,"CSK didn't even tried to go run a ball when pitch was miss behaving, how can you defend after that",2
2024-05-01T16:56:01+00:00,CSK and RCB just can't defend anymore,2
2024-05-01T16:56:05+00:00,RCB fans can we borrow one of your calculators?,4
2024-05-01T16:56:07+00:00,"Guys, let's be real. 

It's going to be rather unlikely that Dube, Axar get to play in the XI. Maybe even Pant might start, so add Samson to being left out too. 

Eventually we're going to play the most 'familiar' XI from our 15. Nothing's really going to change even within the parameters. So yeah.",6
2024-05-01T16:56:09+00:00,Love my ginger boi's YES YES YES,5
2024-05-01T16:56:09+00:00,I can’t believe I’m saying this but BRING BACK THE PACERS!,3
2024-05-01T16:56:16+00:00,Ipl giving form to all washed international players,8
2024-05-01T16:56:18+00:00,This is a fucking water park,5
2024-05-01T16:56:19+00:00,"Who is this brain-dead commentator comparing spin between a dry and wet tennis ball to a dry and wet cricket ball 


Holy shit they are losing braincells by the minute",1
2024-05-01T16:56:20+00:00,"Pbks can still go for 16 points right ?

Why are people thinking they are out of the race ?",5
2024-05-01T16:56:21+00:00,Can someone tell me why Livingston is not playing?,1
2024-05-01T16:56:22+00:00,"Farewell season for Rahane, Deepak Chahar and Dhawan. End of an era.",2
2024-05-01T16:56:25+00:00,"usually when your team is in control, you start talking about finishing the game with an improved NRR, except when you're a pbks fan🥲",5
2024-05-01T16:56:25+00:00,"Silence in comm box and Chepauk, inner peace",6
2024-05-01T16:56:25+00:00,[deleted],3
2024-05-01T16:56:27+00:00,Guy can throw guy can't catch guy can't bat,3
2024-05-01T16:56:29+00:00,From that angle how did umpire know that ball didn’t get away from the body before fielder touching the boundary line?,1
2024-05-01T16:56:31+00:00,"Cummins silencing Chepauk? Please, CSK have silenced chepauk so many times this season.",2
2024-05-01T16:56:33+00:00,"Drop chahar at his hometown after this game, why even carry that extra baggage all over the country",1
2024-05-01T16:56:33+00:00,Bairstow's back foot cut shot against spinners firing rockets has been impressive.,2
2024-05-01T16:56:33+00:00,Much respect for Haydos for getting a PhD. in Yappology after retirement,3
2024-05-01T16:56:34+00:00,"My predictions for the last match are coming true lol

https://www.reddit.com/r/Cricket/s/bO8m3p8wp1",1
2024-05-01T16:56:34+00:00,Bairstow looks like Ricky Gervai’s ginger brother,2
2024-05-01T16:56:37+00:00,This ritviz guy is cooked,4
2024-05-01T16:56:38+00:00,What's this grow ad girl name?,1
2024-05-01T16:56:41+00:00,Why don't we use anti dew anymore?,3
2024-05-01T16:56:41+00:00,"This is why I was against PBKS dropping Bairstow in 2-3 games. 

That opening with Curran experiment was peak PBKS decision.",9
2024-05-01T16:56:42+00:00,PBKS did a good job picking to bowl first knowing dew will help them a lot.,5
2024-05-01T16:56:44+00:00,"Some csk fans were like "" easily 2 wins bro""",11
2024-05-01T16:56:46+00:00,"To make up for daunting silence of Chepauk, the commentators have switched on their yapping mode. Instant mute lol",3
2024-05-01T16:56:48+00:00,"Why doesn't Bairstow's bat have a manufacturer's label, did he chop down the tree and carve his bat by himself?",7
2024-05-01T16:56:49+00:00,When Kiwis don't contribute then Chennai loses,5
2024-05-01T16:56:52+00:00,good to see that CSK back to their losing form😃,4
2024-05-01T16:56:55+00:00,Bro threw it equidistant from both stumps and said you people decide LMAO,10
2024-05-01T16:57:08+00:00,"Chennai need to draw either player forward to get a wicket, both are too comfortable playing off the back foot.",1
2024-05-01T16:57:09+00:00,YJB coming into form on this pitch (based on the first innings spin choke by Brar and Chahar) was not in my bingo list tbh,3
2024-05-01T16:57:09+00:00,This is what pat Cummins and aussies in general felt like silencing the completely partisan jingoistic home crowd.,7
2024-05-01T16:57:13+00:00,Unless Punjab decide to do a Punjab we are cooked,2
2024-05-01T16:57:15+00:00,"This WC is going to be another group stage exit isn't it?

Please atleast beat Pakistan, that's all I ask.",7
2024-05-01T16:57:17+00:00,"Day 5 of Rutu being responsible for the defeat

Shame we are not able to see Day 6 of Dhoni being responsible for the win.",11
2024-05-01T16:57:20+00:00,Dube is here,3
2024-05-01T16:57:24+00:00,"Dube bowling?????
Not complaining tho",1
2024-05-01T16:57:24+00:00,DUBEEEEE,1
2024-05-01T16:57:25+00:00,Dube ji with the ball,2
2024-05-01T16:57:26+00:00,Is Morgsy no longer with Outsiders? Anyone with the sauce?,1
2024-05-01T16:57:27+00:00,DUBE,3
2024-05-01T16:57:30+00:00,Can pbks qualify without calculator?,1
2024-05-01T16:57:31+00:00,Yesss.....Lord Dube to the rescue,6
2024-05-01T16:57:33+00:00,"Dube bowling, get ready for his 7-fer",7
2024-05-01T16:57:35+00:00,Dube! now that's a brave decision,5
2024-05-01T16:57:37+00:00,"Ok lads, Dube is here.",1
2024-05-01T16:57:38+00:00,If csk wins I'll die,1
2024-05-01T16:57:39+00:00,almost going at 10rpo 🤞🏼💗,2
2024-05-01T16:57:39+00:00,All these shitty dances these players are doing for IPL,1
2024-05-01T16:57:40+00:00,"BCCI after selecting to Dube to CSK: ""Well he gotta have a bowl"".",4
2024-05-01T16:57:42+00:00,20 runs?,2
2024-05-01T16:57:48+00:00,Dubey gonna smash,2
2024-05-01T16:57:49+00:00,Thanks Chahar for letting Dube bowl,1
2024-05-01T16:57:50+00:00,DUBE IS  BOWLING I REPEAT DUBE IS BOWLING,3
2024-05-01T16:57:51+00:00,Dube bowling must be instructions from bcci due to his selection in World cup.,3
2024-05-01T16:57:54+00:00,"Dube really matching hardik, people used to be this excited when he finally bowled after ages",2
2024-05-01T16:57:56+00:00,Fucking finally. Have been asking since the first gameeeee. DUBEEEEEEE,6
2024-05-01T16:57:56+00:00,LORD DUBE BOWLING,7
2024-05-01T16:57:59+00:00,"dube hattrick, believe it",5
2024-05-01T16:58:00+00:00,CSK is reverse of SRH in first batting in this IPL,4
2024-05-01T16:58:00+00:00,50.3% runs scored in 45% balls,2
2024-05-01T16:58:01+00:00,Can he capitalise on “Dube! Dube! Dube!”?,4
2024-05-01T16:58:03+00:00,No,2
2024-05-01T16:58:07+00:00,Should have bowled Mitchell before Dube,2
2024-05-01T16:58:10+00:00,JINXED 😫,3
2024-05-01T16:58:13+00:00,"Bairstow scared Salt will take his place. Chasing masterclass incoming.

Edit: LOL, you can thank me CSK fans.",4
2024-05-01T16:58:13+00:00,This Rizvi chap seems to be about giving a lot of effort for not much result.,7
2024-05-01T16:58:14+00:00,"4 wickets, make them 7 Dube",6
2024-05-01T16:58:15+00:00,Btw Punjab has won all last 4 games vs CSK…there’s that. Its not easy points,7
2024-05-01T16:58:16+00:00,DOOOOBEEEEEEEEEE,8
2024-05-01T16:58:20+00:00,Lord,6
2024-05-01T16:58:22+00:00,"Lmao, Dube with wicket",9
2024-05-01T16:58:22+00:00,Dube eating Hardik's place in WT20,5
2024-05-01T16:58:23+00:00,LOLOLOLOL,3
2024-05-01T16:58:23+00:00,Dube redeeming confidence in ICT bowling unit singlehandedly.,5
2024-05-01T16:58:23+00:00,DUBE!!!!!,6
2024-05-01T16:58:24+00:00,I love that my Kiwis are consistently opping CSK. Saving their form for the WC,1
2024-05-01T16:58:25+00:00,"**9.2** **Edged and Dube has a wicket second ball of the season.**

Jonny Bairstow c †Dhoni b Dube 46 (30b 7x4 1x6) SR: 153.33",3
2024-05-01T16:58:25+00:00,"Bumrah and Kuldeep are our only wicket takers

Pandya and Jadeja are finishers",4
2024-05-01T16:58:26+00:00,Takes wicket lol,3
2024-05-01T16:58:26+00:00,"Good that Pandu had a good spell yesterday

Otherwise Dube just bowling a ball was enough for him to be considered below Dube

Edit: AAAAND he gets the Big Man on the 2nd ball Loool!",4
2024-05-01T16:58:26+00:00,"Fucking hell 


Dube finds a way to peform somehow.",5
2024-05-01T16:58:26+00:00,That was soft,2
2024-05-01T16:58:26+00:00,Arey yaar,2
2024-05-01T16:58:27+00:00,Pbks doesn't matter how good you play i won't forget how shitty your jersey is,2
2024-05-01T16:58:28+00:00,PANDYA'S POSITION IS OVER,8
2024-05-01T16:58:29+00:00,LORD FUCKING DUBE AHAHAHSHSHSHSHA,3
2024-05-01T16:58:30+00:00,Ok what just happened?,3
2024-05-01T16:58:30+00:00,"have never seen dube bowl, let's see how this goes(can he give 1-2 overs consistently)?",3
2024-05-01T16:58:30+00:00,DUBEEEEE,2
2024-05-01T16:58:30+00:00,LmOoooooo,2
2024-05-01T16:58:30+00:00,Hardik pandya has competition,3
2024-05-01T16:58:30+00:00,NO FUCKING WAY LMAO,10
2024-05-01T16:58:33+00:00,Dube 🥵,2
2024-05-01T16:58:33+00:00,"Jeez, 2024 Dube is what 2024 Jaddu aspires to be.",7
2024-05-01T16:58:33+00:00,"That's it, how's pandu over Dube now?",3
2024-05-01T16:58:33+00:00,YJB made up for the test series thou,1
2024-05-01T16:58:35+00:00,Dubeeeee you Running Yuviiii,5
2024-05-01T16:58:35+00:00,Stupid sexy Shivam,1
2024-05-01T16:58:36+00:00,Dube...,1
2024-05-01T16:58:36+00:00,Dubey: “In your face commentator”,3
2024-05-01T16:58:37+00:00,hahahahaha,3
2024-05-01T16:58:37+00:00,Johny lmao what,4
2024-05-01T16:58:38+00:00,Never underestimate Dube..,1
2024-05-01T16:58:38+00:00,[deleted],8
2024-05-01T16:58:40+00:00,Lord dubeeee,3
2024-05-01T16:58:41+00:00,NO WAY ALL ROUNDER DUBE!!!!,6
2024-05-01T16:58:42+00:00,"If Dube can keep bowling

It's lights out for Pandya's career",5
2024-05-01T16:58:42+00:00,Lord dube good news for WC atleast 🤩🤩,7
2024-05-01T16:58:43+00:00,Bye bye Hardik.,7
2024-05-01T16:58:44+00:00,Wait what just happened?,2
2024-05-01T16:58:45+00:00,"Important spell. Game is lost, but title isn't.

Will he be LORD or SIR Dube?",7
2024-05-01T16:58:45+00:00,BRUHHHH DUBEEEEEEE. DUBEEEE FOR FIRST PLAYING XI,5
2024-05-01T16:58:46+00:00,WE HAD THIS MONSTER SUBBED OUT????,8
2024-05-01T16:58:46+00:00,"Say what you will about PBKS, but they care about the World Cup more.",2
2024-05-01T16:58:47+00:00,Star sports about to put this in best catch of the season nominees list,5
2024-05-01T16:58:47+00:00,really jonny. tf man,2
2024-05-01T16:58:47+00:00,Grown ups blowing whistles lol,4
2024-05-01T16:58:47+00:00,Wtf was Bairstow doing lol,7
2024-05-01T16:58:47+00:00,NO NO NO,1
2024-05-01T16:58:48+00:00,Bruh 💀💀💀,4
2024-05-01T16:58:49+00:00,Shashank in now,5
2024-05-01T16:58:51+00:00,Fair play can’t blame Johnny there. Decent knock. We bat to the 8/9th man so should get there,7
2024-05-01T16:58:55+00:00,"See CSK, you should give Dube the ball every now and then",1
2024-05-01T16:58:57+00:00,HAHAHAHH THEY ARE PLAYING DOOBEY. HAHAHAHAAHHA,6
2024-05-01T16:58:57+00:00,Imagine if he dropped jt,5
2024-05-01T16:58:57+00:00,Bairstow with that sly smile after planning to cunt Dube in the semis.,12
2024-05-01T16:58:59+00:00,What an innocuous ball to get a wicket off,10
2024-05-01T16:59:00+00:00,"These whistles are annoying af.   
Whistle Lodu",11
2024-05-01T16:59:00+00:00,HP - *sweats profusely*,11
2024-05-01T16:59:00+00:00,Pandya in shambles,14
2024-05-01T16:59:01+00:00,Still an impossible ask to win this but this is a good start,1
2024-05-01T16:59:01+00:00,Catching practise?,2
2024-05-01T16:59:04+00:00,Dube working his magic..... If not with the bat then with the ball.,4
2024-05-01T16:59:05+00:00,This is why DUBE got selected,2
2024-05-01T16:59:05+00:00,"Change my mind

Csk matches have the worst coverage",0
2024-05-01T16:59:05+00:00,"Well, well, ain't concrete anymore",3
2024-05-01T16:59:06+00:00,"Dube ke bube 🤗

T: Dube is hot",6
2024-05-01T16:59:07+00:00,YJB forgot he is playing cricket and thought he is playing fetch with MSD,4
2024-05-01T16:59:08+00:00,Good innings from YJB,1
2024-05-01T16:59:08+00:00,Brain fade shot,3
2024-05-01T16:59:09+00:00,That was soft lol,4
2024-05-01T16:59:10+00:00,"Spinners are so underrated in T20s.

Literally every prominent power hitter plays pace better than spin but still the pacers are always bowled in the death overs.",1
2024-05-01T16:59:11+00:00,"Dube was batting well before selection, but not bowling. Post selection, got duck out....",4
2024-05-01T16:59:12+00:00,"Damn....

What a pleasant surprise",6
2024-05-01T16:59:13+00:00,nah DJ playing Doobey song 😭,7
2024-05-01T16:59:13+00:00,Shashank singh please,2
2024-05-01T16:59:14+00:00,Such bad shot to ordinary slower ball,2
2024-05-01T16:59:15+00:00,Johnny giving ICT fans false hope Dube is another Lord,6
2024-05-01T16:59:16+00:00,RIP Hardik,3
2024-05-01T16:59:18+00:00,Catching practice,2
2024-05-01T16:59:19+00:00,"Mfs. If they had bowled Dube constantly we would be for sure seeing him in the playing 11 WC.

Just dumb by Rutu to not let him bowl.",9
2024-05-01T16:59:20+00:00,Is dube our new lord ,6
2024-05-01T16:59:21+00:00,"Pandya who?

DUBE is the fast bowling allrounder we want.",12
2024-05-01T16:59:25+00:00,"No spin choke, so dube choke on card for csk today?",2
2024-05-01T16:59:26+00:00,"Dube now coming for pandya spot 


He has a wicket ",5
2024-05-01T16:59:31+00:00,10 games they didn’t bowl this guy and immediately he gets a set batter out…CSK are a true enigma,6
2024-05-01T16:59:31+00:00,"Dube with ball in hand 
Fine I'll do it myself",6
2024-05-01T16:59:32+00:00,Fuck yeah we're suddenly winning the world cup /s,3
2024-05-01T16:59:32+00:00,"If he bowls well, BCCI and Rohit will have enough ammo now to say “Fuck off Pandya!”",6
2024-05-01T16:59:33+00:00,CSK fans just had a collective orgasm at the stadium,8
2024-05-01T16:59:34+00:00,Shashank please,3
2024-05-01T16:59:39+00:00,That was actually a good ball lmao cramped Bairstow for room,6
2024-05-01T16:59:43+00:00,":(

Now we collapse, lose and mean CSK fans will bully us in reels ;_;

Part II",5
2024-05-01T16:59:44+00:00,Was more of a Bairstow wicket than Dube,3
2024-05-01T16:59:45+00:00,Thank you Chahar for getting injured,3
2024-05-01T16:59:46+00:00,I was memeing this guy back when he was at RCB. He’s a completely different player now,8
2024-05-01T16:59:47+00:00,"Fuck they have shanshank, ashutosh ,jitesh to come with rossouw.",6
2024-05-01T16:59:48+00:00,HAHAHAHAHA,2
2024-05-01T16:59:51+00:00,"Johnny Bairstow 

C: Dhoni    B: Bhagta hua off spinner(Dube)/s.",3
2024-05-01T16:59:52+00:00,Hardik + dube our third pacer,6
2024-05-01T16:59:53+00:00,Wouldn't be surprised if they throw a jump meter on that replay to show how MSD jumped a mighty 8 inches,4
2024-05-01T16:59:54+00:00,Pat somehow feels at home in that Arun creamier league,2
2024-05-01T16:59:55+00:00,"Bye bye Hardik, it was a good ride while it lasted",4
2024-05-01T16:59:56+00:00,S h a s h a n k  A r r i v e s,2
2024-05-01T16:59:58+00:00,Tbh we can play both chahal nd kuldeep for spin with two pacers nd play hardik nd dubey since both can bowl nd hardik is any day better batter than jadega/axar,2
2024-05-01T16:59:59+00:00,Time for our own Thala,3
2024-05-01T17:00:02+00:00,Shashank abhisekh pls finish this before 16th over,6
2024-05-01T17:00:02+00:00,Dube compensating for the duck,6
2024-05-01T17:00:03+00:00,Lord Duba gone now time 4 Thala magic and orbital strike the rest,6
2024-05-01T17:00:06+00:00,I think CSK missed a trick here by batting like ass,14
2024-05-01T17:00:06+00:00,Shashaaaankkk 🥵🥵🥵😩😩😩🔥🗣️🗣️🗣️,11
2024-05-01T17:00:12+00:00,Indian selectors rn saying we selected Dube in the fast bowling criteria,8
2024-05-01T17:00:12+00:00,"Some commentator somewhere: “wow, what an unbelievable catch by the master”!",2
2024-05-01T17:00:16+00:00,"Shashank is here

Its over for CSK",5
2024-05-01T17:00:16+00:00,Dube haters in shambles.,6
2024-05-01T17:00:20+00:00,knew it already from how he holding his bat from side on camera,2
2024-05-01T17:00:22+00:00,Cameraman is a lusty mf,8
2024-05-01T17:00:23+00:00,Shashank promoted again Yayyy,6
2024-05-01T17:00:26+00:00,dhoni should ask for some finishing tips from the goat shashank,9
2024-05-01T17:00:27+00:00,PBKS is old SRH without Tuk tuk batsmen.,9
2024-05-01T17:00:34+00:00,What is dube pace ?? Can anyone tell?,2
2024-05-01T17:00:37+00:00,Dube will out bowl Bumrah in the T20I WC.,7
2024-05-01T17:00:37+00:00,Shashank the real goat has come out now csk just give up and save us some time,1
2024-05-01T17:00:38+00:00,Probably not the best thought to guide  a 120kmph ball huh bairstow..,4
2024-05-01T17:00:40+00:00,It was not a ball to get out Jhonny b..,8
2024-05-01T17:00:44+00:00,Six 🥳,1
2024-05-01T17:00:44+00:00,Dube takes a single wicket i think i am ready for pandya to retire.,2
2024-05-01T17:00:47+00:00,"Yes cunt that batsman rilee 

^(only in IPL tho)",4
2024-05-01T17:00:51+00:00,That's clean,0
2024-05-01T17:00:52+00:00,"No way, dube chants ",5
2024-05-01T17:00:57+00:00,Bye bye hardik Indian cricket has dube now,5
2024-05-01T17:00:58+00:00,"Take that, HarHar!",2
2024-05-01T17:00:59+00:00,Dube bowling for the first time in IPL since Evin Lewis happened,5
2024-05-01T17:00:59+00:00,"I really wish people grab Dube and work on his bowling

Not a 4 over bowler but somebody dependable for at least 2 overs

If he does so, it's so over for Hardik",14
2024-05-01T17:01:00+00:00,Dube got that 70s hairstyle . He just needs a headband.,6
2024-05-01T17:01:00+00:00,Johny is Thalason confirmed,2
2024-05-01T17:01:01+00:00,i would be careful of getting jubilant about dube bowling. still remember that nz t20 game where rahul handed dube the ball and dude got smacked for 34 runs to allow nz to surge back into the game.,5
2024-05-01T17:01:01+00:00,Nope Hardik u safe,3
2024-05-01T17:01:03+00:00,"'the wristwork from Rilee'

Hmmm. IYKYK.",10
2024-05-01T17:01:05+00:00,Hahaha getting what these kind of deliveries deserve,2
2024-05-01T17:01:06+00:00,Good test for Shashank on this wicket,9
2024-05-01T17:01:11+00:00,South Africa are gonna regret dropping Rossouw,0
2024-05-01T17:01:11+00:00,It’s joever,2
2024-05-01T17:01:13+00:00,"Conspiracy of bairstow to get out to dube


And then smash him in west indies ",9
2024-05-01T17:01:15+00:00,Yeah thats how you cunt part timers,1
2024-05-01T17:01:19+00:00,Rossouw with that six bringing down my heart rate to norm😌✨️,6
2024-05-01T17:01:21+00:00,"clumsy snails ghost toy capable weather ask entertain advise rainstorm

 *This post was mass deleted and anonymized with [Redact](https://redact.dev)*",3
2024-05-01T17:01:22+00:00,You can injure the man but not the idea....Lord Deshpande perhaps,7
2024-05-01T17:01:23+00:00,Out of all the teams Russow chose CSK to bash.,8
2024-05-01T17:01:23+00:00,[removed],1
2024-05-01T17:01:28+00:00,Oh yes. My second favorite Rilee,6
2024-05-01T17:01:28+00:00,"Russouw coming back to form at a slow pace.

Increased his score every game so far",1
2024-05-01T17:01:29+00:00,"First boundary Dube has conceded since 2022. Vaaww what a bowler Dube.


Hardik Pandya who???



/s",14
2024-05-01T17:01:32+00:00,[deleted],6
2024-05-01T17:01:33+00:00,That one red polo shirt 🫡🫡,6
2024-05-01T17:01:42+00:00,Shashank my boy... please win this game cleanly as you did last game..  Take the long due revenge from these csk cunts....,2
2024-05-01T17:01:47+00:00,If they keep this momentum for 2 more overs it becomes a run a ball chase,2
2024-05-01T17:01:48+00:00,Dube out batting and out bowling jaddu,3
2024-05-01T17:01:49+00:00,Dube is gonna be this World Cup’s Joginder Sharma and iftikhar can be misbah,10
2024-05-01T17:01:59+00:00,Why is Brett Lee called Binga?,1
2024-05-01T17:02:00+00:00,Man Binga was a fucking beast,6
2024-05-01T17:02:00+00:00,"pot existence languid glorious plough theory attraction roof crown degree

 *This post was mass deleted and anonymized with [Redact](https://redact.dev)*",6
2024-05-01T17:02:02+00:00,Why do I have a feeling PBKS might face a last over disappointment?,2
2024-05-01T17:02:05+00:00,why did dhoni refuse the single with mitchell? anyone?,4
2024-05-01T17:02:07+00:00,Csk 20 runs behind now,4
2024-05-01T17:02:11+00:00,What happens if a spectator licks the ball before throwing it back to the field?,3
2024-05-01T17:02:11+00:00,Bruh what happened in the runup,2
2024-05-01T17:02:12+00:00,"Dube the new 4d player - 

- can bat
- can bowl
- can field
- is handsome af",22
2024-05-01T17:02:13+00:00,"If batsmen aren't in generous mood in WC, we are so fucked with this shit bowling attack.",6
2024-05-01T17:02:23+00:00,[deleted],19
2024-05-01T17:02:24+00:00,Nah dube way too slow,6
2024-05-01T17:02:25+00:00,"damn, I forgot Brett Lee played for us",8
2024-05-01T17:02:26+00:00,Need another wicket quickly,6
2024-05-01T17:02:28+00:00,Dube is bowling at pace of Lord,8
2024-05-01T17:02:33+00:00,No fraud russouw today,7
2024-05-01T17:02:40+00:00,Dube always looks like he’s doing something he’s not supposed to do,12
2024-05-01T17:02:45+00:00,"Effing whistles, just kill me already",2
2024-05-01T17:02:46+00:00,Crowd licking the ball because Dhoni touched it.,11
2024-05-01T17:02:47+00:00,At least clap when the opponent hits,13
2024-05-01T17:02:48+00:00,Bairstow convincing Indian selectors that Dube is a good bowler lol,25
2024-05-01T17:02:49+00:00,Yesterday hardik got out on duck nd today dubey for 1ig but hardik bowled really well nd now dubey,7
2024-05-01T17:02:51+00:00,Ngl i prefer these 160-200 games over 300+ disco light pro max circuses,22
2024-05-01T17:02:51+00:00,"Sorry Hardik, I was a bit reactionary",29
2024-05-01T17:02:54+00:00,What a shit ground,6
2024-05-01T17:02:55+00:00,"Hindi comms: ""Chennai crowd are so clever that they hide the ball when it comes to them so the wet ball gets replaced""


Isn't that just cheating?",29
2024-05-01T17:02:56+00:00,lmao dube took a wicket,7
2024-05-01T17:02:59+00:00,Alright perhaps Dube is not replacing Hardik,12
2024-05-01T17:02:59+00:00,"Ok pandya 


You are safe 


Keep practicing bowling and bring us world cup",2
2024-05-01T17:03:01+00:00,ok nvm dube isn't a good bowler lmao,12
2024-05-01T17:03:01+00:00,"From all the ipl grounds blud chose Chepauk to come back in form
 
Chad rossouw",16
2024-05-01T17:03:08+00:00,the bbl fraud finally woke up,9
2024-05-01T17:03:09+00:00,Riley russow banging like Riley Reid,7
2024-05-01T17:03:11+00:00,Hardik apology form where?,4
2024-05-01T17:03:12+00:00,Dube will improve. Good future prospect to get rid of pandya's dependency.,3
2024-05-01T17:03:12+00:00,No Pathirana no party??,6
2024-05-01T17:03:14+00:00,Might as well bowl mitchell,3
2024-05-01T17:03:19+00:00,Nah hardik is still way better,2
2024-05-01T17:03:21+00:00,"Dube still in contention, he's given away fewer runs than current Hardik still",8
2024-05-01T17:03:21+00:00,"People who were saying ""dube haters in shambles"" are in shambles",16
2024-05-01T17:03:23+00:00,Is cheeka doing the tamil commentary today? Is he in shambles or is he doing some copium?,5
2024-05-01T17:03:24+00:00,Did the commentators mention that Dhoni had taken the catch of the season.,5
2024-05-01T17:03:26+00:00,Bring in Fizz to knock out Rossouw,2
