Timestamp,Comment,Upvotes
2024-05-01T15:06:14+00:00,Shit! Rabada still got 2 overs,2
2024-05-01T15:06:15+00:00,"How many advertisements has thala done this season ?
That electric bike, Winzo, Jupiter scooter",2
2024-05-01T15:06:16+00:00,Gaikwad isn't Hardik. He WILL step up and take it to a respectable score if not a defendable one.,2
2024-05-01T15:06:17+00:00,Punjab is doing everything they can to make final matches entertaining by disrupting the points table,7
2024-05-01T15:06:23+00:00,43 Balls Since Last 6/4,1
2024-05-01T15:06:26+00:00,Replay of 2023 final,1
2024-05-01T15:06:27+00:00,Bruh wtf is csk doing,3
2024-05-01T15:06:28+00:00,Is gaikwad playing for the orange cap /?,3
2024-05-01T15:06:33+00:00,"puzzled quarrelsome entertain tie violet axiomatic lip crawl zonked rotten

 *This post was mass deleted and anonymized with [Redact](https://redact.dev)*",3
2024-05-01T15:06:35+00:00,"12(16) when you have Mitchell & Moeen & Thala 

Braindead Corpse 🤡🧠🤯",10
2024-05-01T15:06:38+00:00,Harshal hasn't bowled a over yet 💀,7
2024-05-01T15:06:38+00:00,"This is one of the most painful first innings I’ve watched. The worst one was well, you know…",4
2024-05-01T15:06:41+00:00,What harshal patel is doing,2
2024-05-01T15:06:43+00:00,see us taking this to 19th and loosing at last ball,1
2024-05-01T15:06:43+00:00,Theekshana In pp would have been nice,1
2024-05-01T15:06:43+00:00,"Csk are clueless man.
Why did they even sign Mitchell?
To play as a Finisher?",7
2024-05-01T15:06:47+00:00,Why not go for Rahul Char's last over now.,0
2024-05-01T15:06:53+00:00,What are these stupids shots from rizwi,5
2024-05-01T15:06:55+00:00,3 boring matches in a row. Even script writers not performing after wc selection,4
2024-05-01T15:06:57+00:00,"gaikwad still thinks he’s playing t20’s in 2022. a big believer that someone from top 3 must bat till the 15th over. i disagree with that mindset, the impact sub has made it a waste to play defensively",8
2024-05-01T15:06:57+00:00,Csk to Punjab: you dare use my spells against me potter?,4
2024-05-01T15:06:58+00:00,"8.5 CR for this guy 😂

Atleast Starc comes with brand value.",5
2024-05-01T15:07:06+00:00,Plan stupid selection and batting order. The fuck they are smoking?,3
2024-05-01T15:07:07+00:00,They just wanna go home earlier to watch ucl,3
2024-05-01T15:07:17+00:00,Rizvi riding his luck like my ex rode my best friend,3
2024-05-01T15:07:17+00:00,Very kind of [renowned singer Harpreet Brar](https://youtu.be/zDTCvGH4t_4?t=3s) to excuse himself from his musical talents and show us a spin masterclass,2
2024-05-01T15:07:21+00:00,"Not every hitter from up is Rinku Singh or Suresh Raina 
Kidding I know he is a kid just joking",3
2024-05-01T15:07:22+00:00,I am scared for Prabhsimran on this pitch. He is the most reckless player i've ever seen,4
2024-05-01T15:07:25+00:00,Rizz gonna time every ball from now,3
2024-05-01T15:07:31+00:00,He’s mistiming everything,2
2024-05-01T15:07:32+00:00,Utilization of Moeen has been weird this season with bat and ball both,1
2024-05-01T15:07:33+00:00,"what's with rizvi mahn? why would you waste an impact sub for below run a ball innings

this is mind boggling decision from the think tank",4
2024-05-01T15:07:35+00:00,CSK were begging for Rizvi to replace Rahane. Now apparently Rizvi is a bum.,6
2024-05-01T15:07:37+00:00,"I hope the World Cup incumbents realise that the BCCI can still change the squad till the 25th. Don't expect any drastic ones, but Axar will probably end up in reserves and Rinku comes in. Jadeja ain't getting dropped.",7
2024-05-01T15:07:47+00:00,"Just tuned in. So after being selected for WC, you lose form?",6
2024-05-01T15:07:50+00:00,"Get to 160, may be we can cook then..",2
2024-05-01T15:07:53+00:00,Doesn't CSK ground staff know how to build roads?,3
2024-05-01T15:07:54+00:00,Even Covid had better timing than Rizvi,3
2024-05-01T15:07:57+00:00,Rizvi is just trying to score runs on paper so that he dosent sound like hes a bad player 😭,1
2024-05-01T15:07:58+00:00,just farm their strike I dont wanna see thala do another thala,3
2024-05-01T15:08:01+00:00,[deleted],2
2024-05-01T15:08:03+00:00,The only thing Rizvi can time is his wicket,2
2024-05-01T15:08:12+00:00,Questionable team management and selection today...this is horrible,2
2024-05-01T15:08:12+00:00,Why didn’t they just use Mitchell or Ali before bringing in a batting sub,3
2024-05-01T15:08:15+00:00,I was surprised to learn we last won against PBKS in 2021,1
2024-05-01T15:08:16+00:00,What did they save Mitchell and Moeen for? 🙃,3
2024-05-01T15:08:18+00:00,Where is Harshal man ? He will be lethal on this pitch,1
2024-05-01T15:08:21+00:00,Rizvi has 0 power. Muscle up bro.,3
2024-05-01T15:08:24+00:00,This tuk tuk is boring af. Me want boom boom now NOW NOW NOW,0
2024-05-01T15:08:27+00:00,"42 ball without boundary , biggest this season",3
2024-05-01T15:08:28+00:00,For this phase bowlers are cooking. I would say let them cook. All those big scores made people numb for original cricket. People need some detoxing.,2
2024-05-01T15:08:29+00:00,"Not to sound cocky but spin basher is someone like Iyer, someone who actually plays all kind os spin well.

Dube is just slow ball basher(since ball doesn't spin at all). Still excited to see him in WC though",7
2024-05-01T15:08:31+00:00,Fk match my boy wants the orange cap,3
2024-05-01T15:08:32+00:00,Daryl Mitchel looks like Andrew Tate's father,4
2024-05-01T15:08:38+00:00,Just tuned in - are boys bowling really well?,2
2024-05-01T15:08:43+00:00,sorry but is the pitch slow? or pk bowling? just tuned in,2
2024-05-01T15:08:44+00:00,A good contest between bat and ball. Mindless slogs are being punished with lbws instead of being edged for SIX. Another good match.,4
2024-05-01T15:08:46+00:00,"Even CSK want PBKS to progress

Wholesome IPL",5
2024-05-01T15:08:47+00:00,Shit Richard Gleeson is playing today? How good is he?,4
2024-05-01T15:08:49+00:00,"Looks like CSK and SRH will be fighting for the fourth spot, with CSK bottling this and SRH loosing vs RR",4
2024-05-01T15:08:53+00:00,Can somebody share me Dube stats while chasing from ipl 2022,1
2024-05-01T15:08:55+00:00,Is it an actually decent pitch or batter are just shit today or both?,6
2024-05-01T15:08:57+00:00,"uppity sort flowery modern fall saw encouraging innocent yam familiar

 *This post was mass deleted and anonymized with [Redact](https://redact.dev)*",5
2024-05-01T15:08:59+00:00,2-3 slow / low scoring games and can already see disappointment from people in and out of the sub as well,9
2024-05-01T15:09:02+00:00,"all these overpaid auction buys for unknown Indian players have not worked out : 

Rizvi  8.40 crore

Kumar Kushagra - 7.20 crore

Shubham Dubey - 5.80 crore

while a lot of the 20/50 lakh players have performed well",4
2024-05-01T15:09:04+00:00,CSK not qualifying when the Knockout and finals is in chennai is a crime.,4
2024-05-01T15:09:05+00:00,Gaikawad playing for orange cap?,2
2024-05-01T15:09:09+00:00,"Looking to hit big sides, when you can't even time it to fielder",2
2024-05-01T15:09:11+00:00,"Relax, guys. If PBKS can deliver such a fine spin choke on this pitch, just imagine what CSK can do.


Yeah, I'm drinking Copium Fizz, why are you asking?",3
2024-05-01T15:09:14+00:00,Remove this eliminator system. Have 2 semi finals and a final. No wonder we choke in the actual knockouts,-1
2024-05-01T15:09:16+00:00,Bruh what is csk doing,2
2024-05-01T15:09:17+00:00,"mo is wasted as an os player.

jaddu is used randomly at 4.

impact sub usage has been below par.",8
2024-05-01T15:09:19+00:00,Cricket saviours must have ejaculated by now ffs,3
2024-05-01T15:09:25+00:00,"Conspiracy Theory: They used Impact sub so early to protect Thala from playing more than 2 overs. 

Tbh wtf was this decision from CSK",-1
2024-05-01T15:09:26+00:00,"**Stats Alert** copied

42* balls at the time of the Timeout) is the longest gap between boundaries in an innings this season. The previous longest was 38 balls by Gujarat Titans against Delhi Capitals

+ 4 balls commenting now",5
2024-05-01T15:09:27+00:00,10-15 more runs and we can declare,3
2024-05-01T15:09:29+00:00,Wtf does this guy do,1
2024-05-01T15:09:31+00:00,These 2 aiming to stay not out till day 2,8
2024-05-01T15:09:31+00:00,Harshal should have bowled this over.,1
2024-05-01T15:09:36+00:00,Worst impact sub of this season?,7
2024-05-01T15:09:38+00:00,"If they get 155+, it’ll be a close game",2
2024-05-01T15:09:38+00:00,We are bottling this up... I get pitch is difficult but 45 balls since a boundary is too much.. it's too defensive... Why get rizvi as impact when you have Mitchel sitting in dugout.. who can rotate strike if that's the requirement..,3
2024-05-01T15:09:39+00:00,8 Overs Without A Boundary,4
2024-05-01T15:09:42+00:00,"CSK have become MI in terms of winning in alternate years. Win one year, shit the bed the next year, comeback to another trophy followed by another mediocre season. CSK will win their 6th trophy in 2025.",8
2024-05-01T15:09:42+00:00,Its the 14th over start blasting lol,2
2024-05-01T15:09:43+00:00,Rutu from tuk tuk academy,1
2024-05-01T15:09:44+00:00,Where is purple?,1
2024-05-01T15:09:44+00:00,So Dhawan was actually dropped ig. Damn,2
2024-05-01T15:09:45+00:00,18 balls too much bro u have already impacted now hit or leave,2
2024-05-01T15:09:46+00:00,"rizvi move made no sense.. could've played Moeen, thala and mitchell and brought in a spinner as impact sub..",9
2024-05-01T15:09:53+00:00,"Ritu is not even in WC squad, why his performance dropped",6
2024-05-01T15:09:56+00:00,"liquid smile butter impolite overconfident dog detail bewildered far-flung squeal

 *This post was mass deleted and anonymized with [Redact](https://redact.dev)*",1
2024-05-01T15:09:57+00:00,"Ngl, this pitch curator needs a fucking raise. Reduce Sujan Mukherjee's paycut if needed to allow that rause.",5
2024-05-01T15:09:58+00:00,8 overs since the last boundary 💀💀,3
2024-05-01T15:10:00+00:00,7 wickets left and we going at 6rpo💀,6
2024-05-01T15:10:02+00:00,With dew anything less than 180-190 will be chased with ease,1
2024-05-01T15:10:02+00:00,"After getting rejected in T20 wc, the boys are auditioning for the Champions Trophy.",2
2024-05-01T15:10:07+00:00,"Balls since last boundary: 48

Reminds me of KL, Kohli partnership.... (you know which one.)",2
2024-05-01T15:10:07+00:00,My gfs last name is rizvi she could probs play better than this,2
2024-05-01T15:10:08+00:00,no boundry after pp,1
2024-05-01T15:10:08+00:00,48 balls no boundaries. Wth is it going on,3
2024-05-01T15:10:10+00:00,I'm all for a good contest between bat and ball - but sitting through this innings is painful. I'll doze off before the innings end.,0
2024-05-01T15:10:13+00:00,What happened to this rizvj dude he was way too much hyped bg csk fans when they played gt after that I haven't really heard much about him,1
2024-05-01T15:10:15+00:00,Rizvi bro is closing the eyes and swinging the bat,2
2024-05-01T15:10:15+00:00,48 balls no boundaries. Wth is it going on?,1
2024-05-01T15:10:18+00:00,Just loving this low score matches 👌,1
2024-05-01T15:10:18+00:00,"Seems like an unplayable pitch. Fantastic to watch a pitch made for bowlers to win over. Rizvi is struggling, Gaikwad struggling to get going, needs some proper power hitting here. 

Moeen ali, Mitchell, Dhoni na inside waiting. Hit out or get out already.",2
2024-05-01T15:10:20+00:00,I prayed for times like this,1
2024-05-01T15:10:21+00:00,"Bro wtf are we back in 2012 chepauk? 

Please say yes and that 140-150 is a defendable score",1
2024-05-01T15:10:22+00:00,"Most number of balls without a boundary this season

46* & Counting",1
2024-05-01T15:10:23+00:00,Rizvi playing as an impact sub for PBKS,0
2024-05-01T15:10:23+00:00,Jeez this game is reminding me of the wc final,1
2024-05-01T15:10:24+00:00,btw moeen ali and mitchell are still left. you would think these two are the last batters left,1
2024-05-01T15:10:24+00:00,Surely the first 6 will be soon.,0
2024-05-01T15:10:26+00:00,[deleted],4
2024-05-01T15:10:27+00:00,i still remember how fans sang songs about rizvi after he hit a six off rashid xDD,2
2024-05-01T15:10:28+00:00,"SR watch:

Ruturaj:106

Rizvi: 79",2
2024-05-01T15:10:28+00:00,"I see a lot of people questioning Jay Shah, let me remind you who he is: He is truly enigmatic visionary storyteller... someone who crafts intellectually stimulating and immersive narratives...marked by groundbreaking innovations and meticulous attention to detail...all wrapped within an atmospheric and twisty storytelling style.",1
2024-05-01T15:10:28+00:00,What are the most number of balls without a boundary in IPL?,1
2024-05-01T15:10:29+00:00,"I'm worried about Arshdeep & Purple, they'll leak runs from this stage & ruin all the hard work.",2
2024-05-01T15:10:29+00:00,career ending innings from rizvi,1
2024-05-01T15:10:33+00:00,There are no spin bashers. Most batsmen are just flat track bullies lol. That's why they suck in tests,6
2024-05-01T15:10:38+00:00,Bro,1
2024-05-01T15:10:39+00:00,🖕,1
2024-05-01T15:10:39+00:00,Our bowlers better bring their A-game,2
2024-05-01T15:10:41+00:00,"The way CSK have played in the middle overs (no boundaries yet), I'm remembering a particular match involving Australia and India.",2
2024-05-01T15:10:42+00:00,purple comes,1
2024-05-01T15:10:42+00:00,"Jayshah masterclass again

This is detoxification of the audience before the world cup so that people don't overreact on the 130 strike rate players",7
2024-05-01T15:10:50+00:00,Everything is going according to the plan for csk regarding this shit tip except one the toss /s,1
2024-05-01T15:10:50+00:00,Ruturaj has that kl Qaeda dna,1
2024-05-01T15:10:51+00:00,dhawan would've suited great for this pitch,2
2024-05-01T15:10:53+00:00,Purple here to balance things out,1
2024-05-01T15:10:53+00:00,Arrival of patel is always memorable,4
2024-05-01T15:10:54+00:00,"Give us PURPLE FUCKING PATEL


Edit: HELL FUCKING YES THATS THE GARBAGE DELIVERY IVE BEEN WAITING FOR",3
2024-05-01T15:10:55+00:00,Economy infinity,6
2024-05-01T15:10:55+00:00,Harshal with the Steve Harmison,4
2024-05-01T15:10:57+00:00,"What the fuck is this Harshal. What is this. 

Gully fucking cricket.",6
2024-05-01T15:10:59+00:00,"The one day they had to bring Mitchell in early, they fuck it up. That's amazing CSK",4
2024-05-01T15:11:00+00:00,good one,1
2024-05-01T15:11:02+00:00,thankyou purple patel,1
2024-05-01T15:11:03+00:00,lol purple patel,2
2024-05-01T15:11:04+00:00,Purple 5wide 🥰,2
2024-05-01T15:11:04+00:00,Purple Patel Breaks the 8 Over Draught of Boundary by Bowling a Wide + Four,2
2024-05-01T15:11:04+00:00,Wowww.,1
2024-05-01T15:11:05+00:00,Thanks Harshal. Every single run helps,3
2024-05-01T15:11:05+00:00,PURPLE PATEL YOU BEAUTY 😍🥰,2
2024-05-01T15:11:06+00:00,"Thanks Harshal.

Bowl 3-4 more like these. Pls.",3
2024-05-01T15:11:06+00:00,Purple 💜,3
2024-05-01T15:11:06+00:00,Classic purple,2
2024-05-01T15:11:07+00:00,lololol,1
2024-05-01T15:11:08+00:00,![img](emote|t5_2qhe0|8774)![img](emote|t5_2qhe0|8774),1
2024-05-01T15:11:08+00:00,Harshal Patel scores the first boundary after 8 overs,3
2024-05-01T15:11:09+00:00,Lord harshal moment,2
2024-05-01T15:11:09+00:00,You fucking spray gun,4
2024-05-01T15:11:09+00:00,MC Harshal![img](emote|t5_2qhe0|29262)![img](emote|t5_2qhe0|8774),2
2024-05-01T15:11:09+00:00,Fakk finally!!,1
2024-05-01T15:11:09+00:00,Harshal Patel doing his job,4
2024-05-01T15:11:10+00:00,what even was that,6
2024-05-01T15:11:10+00:00,"Reminds me of that 137 game by us vs CSK

Rutu playing Iyer's role, rest shitting the bed. Though CSK do have wickets as well rn

CSK chased that total with definitive ease",1
2024-05-01T15:11:11+00:00,Great ball man,1
2024-05-01T15:11:11+00:00,Purple saw csk struggling so he giveth,2
2024-05-01T15:11:11+00:00,And the lord has cometh,2
2024-05-01T15:11:11+00:00,Thanks Agent Patel,3
2024-05-01T15:11:12+00:00,Just the man I wanted to see,2
2024-05-01T15:11:12+00:00,"First boundary in 48 balls and it comes how!!!

Purple Patel mannn! Insane consistency!",5
2024-05-01T15:11:12+00:00,"Harshal ""I always wanted to play under Dhoni"" Patel",4
2024-05-01T15:11:12+00:00,Thanks purple,4
2024-05-01T15:11:13+00:00,Tf harshal,3
2024-05-01T15:11:14+00:00,obviously purple would do this malarkey,8
2024-05-01T15:11:14+00:00,Thank you Purple,4
2024-05-01T15:11:15+00:00,Fck Harshal fcker with donkey.,2
2024-05-01T15:11:15+00:00,Harshal showing them who's boss,2
2024-05-01T15:11:15+00:00,Rizvi more like Norizzvi,2
2024-05-01T15:11:15+00:00,Yes Harshal !!,2
2024-05-01T15:11:16+00:00,Patel........ whyyyyyyy,4
2024-05-01T15:11:16+00:00,Thank you purple patel,4
2024-05-01T15:11:17+00:00,Here comes csk saviour,9
2024-05-01T15:11:18+00:00,You just had to fuck it up didnt you,9
2024-05-01T15:11:19+00:00,"party workable steep bored mysterious spoon simplistic fanatical close boat

 *This post was mass deleted and anonymized with [Redact](https://redact.dev)*",8
2024-05-01T15:11:20+00:00,"I mean unless 140 is a good score, I dont understand the strategy here?",3
2024-05-01T15:11:21+00:00,"Missed the wide line 

On the leg side 💀",6
2024-05-01T15:11:22+00:00,vintage Harshal 🔥,7
2024-05-01T15:11:23+00:00,"Wide yorker, just to the wrong sided batsman",5
2024-05-01T15:11:24+00:00,Goddamn the whistles are so annoying,2
2024-05-01T15:11:24+00:00,"HARSHAL PATEL, YPU BEAUTIFUL HUMAN BEING.",7
2024-05-01T15:11:24+00:00,Purple Patel my goat,5
2024-05-01T15:11:24+00:00,Starc is that you?,4
2024-05-01T15:11:25+00:00,Purple what the fuck was that,5
2024-05-01T15:11:25+00:00,Purple Patel is today’s orange Patel. That ball would have been wide even for left handed,3
2024-05-01T15:11:26+00:00,finally,3
2024-05-01T15:11:26+00:00,Harshall brought the runs,3
2024-05-01T15:11:26+00:00,Purple Patel for a Reason,3
2024-05-01T15:11:27+00:00,"CSK batters couldn't do it in 8 overs what Harshal did in just 1 ball.

Score a fucking boundary!",8
2024-05-01T15:11:27+00:00,lmfao the first boundary for CSK after 8 overs is by Harshall Patel,10
2024-05-01T15:11:28+00:00,need a few more of em given our batters ain't doing sh!t,5
2024-05-01T15:11:29+00:00,Tehelka bowling,3
2024-05-01T15:11:29+00:00,Purple does this almost every match.. he has real problem with grip of ball,3
2024-05-01T15:11:30+00:00,"Rizvi and Kotian would be a good pair
.
.
.
In test matches
.
.
In 1970s",9
2024-05-01T15:11:30+00:00,Harshal you fkin 🤡,5
2024-05-01T15:11:30+00:00,What a great way to get a boundary 💜 for a reason,4
2024-05-01T15:11:31+00:00,CSK agent Harshal Activated 🤣,8
2024-05-01T15:11:32+00:00,Boundary gifted,4
2024-05-01T15:11:34+00:00,Patel: This is how you score a boundary,7
2024-05-01T15:11:35+00:00,"WC selection or not

Purple Patel arrives the same",8
2024-05-01T15:11:36+00:00,Wtf harshal released a significant amount of pressure,10
2024-05-01T15:11:36+00:00,"8 overs no boundaries?

Harshal: Hold my Lassi",20
2024-05-01T15:11:37+00:00,Of Course It's Harshal Time™™™™✓✓,3
2024-05-01T15:11:39+00:00,This was precisely the game where Mitchel should have batted early,5
2024-05-01T15:11:41+00:00,"Fear not, Purple Patel is here 😎",3
2024-05-01T15:11:44+00:00,"See, even the cricket god is feeling bad",3
2024-05-01T15:11:44+00:00,Purple giveth to get into csk next yr,3
2024-05-01T15:11:45+00:00,"Everyone: PBKS is in full control

PBKS: Brings Harshal Clown Patel",10
2024-05-01T15:11:47+00:00,Purple be like: 50 balls since the last boundary? Say no more,12
2024-05-01T15:11:51+00:00,"True lovers of cricket rejoice your wish is fulfilled,you are watching traditional cricket on traditional pitch not slogging.",7
2024-05-01T15:11:52+00:00,"What is wrong with harshal 


Perhaps saw biggest regret on any captain face after that dreadful delivery on Curran face ",3
2024-05-01T15:11:52+00:00,Who owns the purple cap right now? It’s that kid,7
2024-05-01T15:11:56+00:00,And Harshal Patel announces his arrival,2
2024-05-01T15:11:59+00:00,Secret agent of CSK is on,1
2024-05-01T15:12:00+00:00,KKR brought PBKS to peak form,2
2024-05-01T15:12:00+00:00,Jaddu should've been batting now,0
2024-05-01T15:12:01+00:00,48 balls without a boundary and my man Harshal just runs in and throws that pie,9
2024-05-01T15:12:01+00:00,4 more over of spin from here,1
2024-05-01T15:12:01+00:00,Ok I think csk should start hitting now,1
2024-05-01T15:12:03+00:00,Lord is here,1
2024-05-01T15:12:04+00:00,Ffs Curran,1
2024-05-01T15:12:05+00:00,Damn pathirana..,1
2024-05-01T15:12:06+00:00,Good guy Harshal ensuring CSK can get a par score,1
2024-05-01T15:12:06+00:00,Hit the wicket mf you have 3 more batters coming,4
2024-05-01T15:12:07+00:00,bro felt sad and gave the first boundary after 8 overs. GOAT PURPLE,8
2024-05-01T15:12:07+00:00,"Man, someone get this Harshal fraud out of that list.",5
2024-05-01T15:12:09+00:00,Lmao Harshal scored CSK's first boundary after PP,11
2024-05-01T15:12:10+00:00,Thik tuktuk has gone too far,2
2024-05-01T15:12:13+00:00,not having to defend Purple’s dogshit bowling is one of the better parts of this season for RCB fans,13
2024-05-01T15:12:18+00:00,man wtf are we doing 😭,7
2024-05-01T15:12:20+00:00,Its only 3 wickets down in 14 overs. Why are they batting like its 6 wickets down?!,2
2024-05-01T15:12:24+00:00,Now Koach 40 ball 50 looks good,8
2024-05-01T15:12:26+00:00,Will teams go for Purple Patel in a bid?,3
2024-05-01T15:12:28+00:00,"Ravi.... There hasn't been boundaries since last 8 over.... 
Le harshal :- not on my watch",10
2024-05-01T15:12:30+00:00,guys pathirana is sitting in yellow jersey. will he play?,5
2024-05-01T15:12:32+00:00,"we fieldng our weakest bowling attack, paired with weakest batting performance xDDDD",4
2024-05-01T15:12:33+00:00,This mf Patel,10
2024-05-01T15:12:38+00:00,Out of context but a drunk man on the road was upset and shouting Virat Kohli betrayed Mumbai Indians to join CSK.,15
2024-05-01T15:12:40+00:00,wtf is rizwi doing,8
2024-05-01T15:12:48+00:00,What is up with the horrendous timing Jesus Christ,3
2024-05-01T15:12:49+00:00,Why they haven't sent Mitchell? I mean why hell not?,6
2024-05-01T15:12:52+00:00,"Ravi - *And at number 5 on purple cap board is Natarajan.....can't take him out*

Selectors - *Watch us*",5
2024-05-01T15:12:54+00:00,"Send Thala in, cowards.",6
2024-05-01T15:12:54+00:00,"Look I get the pitch is difficult to bat but there’s still SO much batting to come in Mitchell, Ali, Thala and even Chahar/Thakur can smash it… just go for it ffs",2
2024-05-01T15:12:56+00:00,This has potential to be the worst innings in ipl history. What kind of fucking impact are you making??,3
2024-05-01T15:12:58+00:00,I get it you lost 3 wickets early. But that was 7 overs ago. You still have 7 wickets. You have only 6 overs left. And you still haven’t crossed 100. Disgraceful batting.,10
2024-05-01T15:13:00+00:00,lmao someone tell Harshal he is not in T20 wc squad,5
2024-05-01T15:13:02+00:00,Just smash atleast a few boundaries,2
2024-05-01T15:13:03+00:00,we deserve to lose mahn with such decisions.,1
2024-05-01T15:13:05+00:00,Rizvi is so bad,2
2024-05-01T15:13:06+00:00,Inb4 Dew Dharmendra makes this Tuk Tuk match a non Tuk Tuk match.,2
2024-05-01T15:13:07+00:00,This pitch is made for spinners and purple patel. Home pitch for Chennai or Punjab?,1
2024-05-01T15:13:07+00:00,Nice impact player from PBKS,3
2024-05-01T15:13:07+00:00,not even a mishit is going to the boundary 😭,1
2024-05-01T15:13:07+00:00,Praying this a slow pitch than just our batters shitting the bed,2
2024-05-01T15:13:08+00:00,"Punjab had SRH at 90/5. Only to get their ass handed to them by Nitish of all the batting power SRH is known for. 

This is to say, CSK should send in their own nobody (MSD) next.",4
2024-05-01T15:13:10+00:00,Man I hope Rabada gets released and KKR buys him next year. Him and Iyer's brohood was wholesome to watch.,1
2024-05-01T15:13:12+00:00,If you wanted to play this test cricket why would you even subbed rizvi in easily you could have batted till stumps,6
2024-05-01T15:13:13+00:00,"Punjab being punjab, they will fail to chase this 130 today after chasing 261 last match.",3
2024-05-01T15:13:15+00:00,"I see Chennai have found their own Pan Parag in Rizvi

He'll come good in his 5th season",5
2024-05-01T15:13:17+00:00,Are we practicing for impact player in WTC,1
2024-05-01T15:13:20+00:00,Rizvi is trying to get out and failing. Maybe hit wickets or smth,2
2024-05-01T15:13:20+00:00,Bluds going for that Koach- KL final partnership,4
2024-05-01T15:13:22+00:00,Inb4 Ruturaj *slams* Rizvi for lack of spark.,2
2024-05-01T15:13:23+00:00,"Why is he death bowling now, u stupid purple Patel",3
2024-05-01T15:13:23+00:00,"If rutu gone under 100 sr it would be pretty funny as how csk sub was complaining about him not selected , they basically jinxed him",4
2024-05-01T15:13:23+00:00,Wtf is Rutu doing?,2
2024-05-01T15:13:24+00:00,"What the fuck have they smoked , I want the same thing",1
2024-05-01T15:13:25+00:00,Bowl a cutter Harshal bhai![img](emote|t5_2qhe0|28120),2
2024-05-01T15:13:28+00:00,How costly will those 5 runs be on this pitch that’s helping both spinners and pacers?,3
2024-05-01T15:13:28+00:00,Watch thala come in and bash 4 sixes in a row after this snoozefest,5
2024-05-01T15:13:30+00:00,This is cricket heritage,1
2024-05-01T15:13:30+00:00,Harshal is spoilsport mf ruined a good record,4
2024-05-01T15:13:31+00:00,"Rizvi bro, hit or get out FFS. Your innings is very painful to watch.",3
2024-05-01T15:13:31+00:00,Good bowling meets horrible batting,7
2024-05-01T15:13:33+00:00,"Rizvi is too raw. Just trying to hit six every ball, instead he can look to pick gaps for 2's and 4's.",5
2024-05-01T15:13:35+00:00,"While the pitch is gripping so much, why is Harshal bowling full length?",4
2024-05-01T15:13:36+00:00,Send Dhoni fuck these tuk tukers,-1
2024-05-01T15:13:37+00:00,CSK on track to score a huge total of 120,10
2024-05-01T15:13:39+00:00,Just smash the ball 3 batters are still there,5
